commentator_id,created_utc,anonymized_body,ups,downs,score,controversiality,gilded,distinguished
871f9d1b-2587-43b5-87e6-cf41faf31682,1522455228,I did a search on the app store and found three text-to-speech programs. Two cost money and one was free.  Are there free ones out there (I have a macbook and iPhone) that I should start with?  Thank you.,,,1,0,0,
b73591d8-60c2-48e7-82f1-3403ae8fb8f3,1520302365,"This is pretty cool.

Any idea how he does that?",,,1,0,0,
bd938754-7e97-4f4f-a7c2-5285808657fc,1522031794,"You should also consider contacting your local rehabilitation group that does cane training, to show you how it is used. ",,,4,0,0,
ffb3fe92-2bdb-462c-afed-c5aef99b5d8d,1521172146,"I do a lot of gaming videos and a handful of videos of me playing the piano, singing, or going to concerts. Here's my channel:

https://www.youtube.com/channel/UCoZujToINVP7xax9BTc7s2g/videos?disable_polymer=1
",,,2,0,0,
8fd01324-2dfd-45de-9783-79bca3340315,1519889515,"If I go to the FEMDOM HYPNOSIS page, I notice there's an edit box, (a box you can type in,) that doesn't have the propper HTML to allow a screen reader user to know what it is. All I hear when pressing e to get to the box is edit. Instead of something like, first name edit. A great site to help you would be https://webaim.org/techniques/forms/",,,1,0,0,
0ce20fc4-3fd6-43af-97c7-4874225ec47e,1522357863,"In order to ensure a safe environment for all members of our community, we've chosen to disallow posts of a dating advertisement nature. We are unable to screen posters, and we discourage giving out your personal information over Reddit.",,,1,0,0,moderator
90ac4778-eda9-451e-9c5c-010eeec4552b,1522190283," It may take a few weeks to get medical documentation of your dad‘s disability, so that you can apply for the free talking book program available through The national Library service for the blind and physically handicapped;however, in the short term, if you have 20 bucks to spare, get your dad a subscription to audible. The $20 a month plan gets you to Audible credits, which equals two books a month, and since I am a science-fiction and fantasy fan I can vouch for the fact that they have literally thousands of titles. He can tell Alexa to read his audiobook, and it will play him the book from audible. He can even say Alexa, next chapter, previous chapter, etc., to navigate through the book. Also, get him an iPhone. It is costly, but it’sthe single most life-changing electronic device that the blind can access. When you aren’t there to help him, he can use free apps  like Be My Eyes, which utilizes the iPhone camera, and A network of 300,000+ volunteers around the world, who will help him with any task that requires vision. For example, if he wants to figure out whether there’s diet Coke or diet Pepsi in the fridge, needs to tell which bottle is shampoo, and which is conditioner, needs to get a shirt to match his pants,he can Open the app, ask his question, and the volunteers will direct him how to use his phone to show them his surroundings, so they can help. Social networking apps like Vorail, will let him virtually mingle with other blind peers, and find out how they cope. This can be extremely helpful to newly blinded individuals, because they learned that blindness is not a death sentence, that we are active, and social like everyone else. If you have any other specific questions, keep my user name handy, and don’t hesitate to PM me. I’m always happy to help, and fully understand that this new challenge in his life, may be overwhelming to the both of you at times.    ",,,1,0,0,
d42770b1-9f84-462c-9536-090461a2ff56,1522178331,I'm a conservative my self. I do believe that the ADA didn't really do much. Wile it did give access to buildings it didn't do anything for blind people in a cultural sense. And those of you who are conservative know who controls the culture. I'm also against protected classes. I don't want to go to college I want to get my own place and work at a job.,,,1,0,0,
bd938754-7e97-4f4f-a7c2-5285808657fc,1522385697,"Very cool article. That has been an issue my coworkers and I have discussed a few times. While the remote assistance is great, we've found that some people become too reliant on it and start to lose basic skills. Instead of learning a good organization system for their canned soups (or whatever groceries), they get used to just FaceTiming their family members and have them look through the camera. That's all fine and good in an optimal situation, but that doesn't always work. What happens if you need to locate something at 3 AM? Call your family and wake them up?

The other issue is about privacy, which has become a big deal in light of what some organizations have been doing. Some people don't like using those systems to access their banking or taxes, but that may be the only choice they have. ",,,4,0,0,
1a8aa46a-0519-4ead-b75a-9a3e5392ba8b,1522186240,"Thanks for the service! I'm in San Francisco and have been a really vocal supporter of Instacart along with giving you guys constant accessibility feedback. Had a pretty long thread going just a few years ago with some of your support personnel about it. Ultimately, the info pages for individual items could use some help as the information there is usually garbled when VoiceOver tries reading it back or is missing/consistent. Always seems like the touch areas for related items keeps trying to overtake attention from the item description and info, and the controls for adding the item to the cart is too small and sometimes hard to find with the rest of the interface fighting for attention. 

The chat and messaging interface works for the most part, but with the nature of having to listen to my screen reader in order to interact with the chat, a common occurrence is to have the shopper make a change, get the wrong thing, and by the time I've heard it and written a message, they are already in checkout and I get stuck working with support for the items I didn't want. This happens even with substitutions set. The best thing to do is to bring in an end-user and observe how we use the app first-hand. Writing out feedback is one thing, but if you have no one on your staff familiar with accessible technology, you won't be able to adequately test for accessibility and leave those bugs for us to find and struggle with in production. 

I would ask for more consistency with product labeling, as sometimes identical items show up in the browsing lists but worded in different ways making the shopping confusing.  Fixing the item descriptions would go a long way to solve this. O additional major problem is the way you handle the delivery scheduling time controls. It is Always a struggle to pick the correct date and time for delivery as it is a custom control. Changing that to a standard iOS control would be ideal rather than you trying to handle it programmatically with a custom control. Tapping on the time sometimes brings up the date, and vice-versa. Choosing a time that seems to be available results in the confirmation button remaining dim, making me go back to the scheduling pop-ups only to find that nothing I chose was actually set. It's been broken for years and you guys have done nothing to address that, so I hope that core bit of functionality will hit a bit of priority soon. ",,,4,0,0,
e69a955e-8406-4320-9ae3-f24b847ec433,1520048506,"Thank you for your reply.

I anticipate that any website I would develop would be best used on a smart phone. There are ways of activating the GPS and vibration from the Web browser now, so I see that as a way of communicating to the user when looking at a screen is not possible or practical.

Do you think you would find the data above useful while on the go? ",,,1,0,0,
bd938754-7e97-4f4f-a7c2-5285808657fc,1520908479,"All three are important, and there isn't a single solution. 

Individuals can be trained, but they can also just be busy or not paying attention. I've had people run into my clients because they were busy on their phone. 

Infrastructure can be improved to make traveling easier, but when a place is filled to max capacity, it doesn't matter if a person can't find the adapted sections. For example, the subway in Toronto has tactile markers that a cane user can use to follow to get to stairs, escalators, etc. But if people are standing on them and not moving, then that becomes much more difficult to use.

For technology, some locations are starting to use iBeacons now to help navigate. However, they are imprecise at best, and downright confusing at worst. I know of a location where two iBeacon signals overlap, and the phone thinks that someone is moving back and forth between then, when you are standing still. Worse yet, because the signals are overlapping, the message plays for a few seconds before jumping to the next one, and then it happens again. Also, EM interference (from Bluetooth devices, magnetic fields, and lots of other things) can throw it off as well. ",,,2,0,0,
dd47c174-7a35-40c9-85e7-2a78c2ba4e38,1521863843,Thank you! That is another thing I have never heard of! I think they could be used on other things too! ,,,1,0,0,
bd938754-7e97-4f4f-a7c2-5285808657fc,1520565825,"Oh, definitely. Isolation is not the best way to go, especially for that age range. ",,,3,0,0,
8fd01324-2dfd-45de-9783-79bca3340315,1519890014,"I'm honestly not that into Audio erotica but blind/VI people are like sighted people in that we like different things depending on the person you ask. For example, I love the sound of a womans heartbeat but others may not be into that. I like bigger women but others may not be into that. It's a personal preference. as for keywords I'd assume it was the same for a sighted person as it would be for a blind/VI person.

As for your recordings, I checked out the Enthralling Rhythms one and honestly was a little distracted by the popping Ps' and hissing in the background. I'd Personally not pay $35 for a recording like that.",,,1,0,0,
c576cee8-2618-45d4-84a8-770ca5a35b0d,1520599644,"I agree with everyone that you shouldn't give up on your dreams and that you should definitely continue to pursue a career that your passionate about. That being said, I think it's really smart that you're planning ahead for a career that could provide you with longevity and adapt to you as much as you will have to adapt to it given the eventual loss of both senses. 

The careers that you mentioned seem like great options because they'd allow you the flexibility to work with clients/ students and/ or focus on research while still getting to learn about things you're interested in! 

 As you're starting to choose your career one thing that might be helpful is to do some job shadowing for each of the feild you're interested in. That way you can experience what it would be like to have that job. and really see if its something you're interested in and and get a feel for which areas of the career you might need accommodations in and start to plan for that.  Another thing that might be helpful is reaching out to professors whose careers are similar to the ones you want, to talk about their experience in the field. You could also do some research on graduate programs as that can provide you withsome insight on what to expect from a career. Also consider talking to your campus disability centre and career center they might be good resources for talking about how you can make these careers work for you. 

It won't always be easy and sometimes you'll have to get creative but keep pursuing what you're passionate about! Good luck!    

 
 ",,,1,0,0,
7552a8b6-9ca5-4a1d-ae6b-78f23e86325c,1520536149,it would be cool to see this technology advance to a point where the blind for drive actual cars.,,,3,0,0,
3c0a5c2d-4532-404e-81c7-9fbd7a356ef0,1521918680,"That's fair. It's not really about conservatism as aphilosphy, just the current crowd.",,,3,0,0,
a81c4aaf-8201-4cb9-96d9-7a6c2036fb60,1522182611,"My father says until every car is electric/noiseless, they should have noisemakers of some kind because even if the electric car makes an audible sound, it will be completely masked by the sound of other non-electric vehicles. He has a small story, once while crossing a crossing without lights, there was a very quiet (hybrid?) vehicle just behind a large 4-wheel-drive, and he could not hear the sound of the hybrid car over the sound of the larger one; he nearly got hit because he couldn't hear it.

OP of that post said that the blind population can rely on buttons and lights to cross streets after previously highlighting how some crossings/intersections don't have buttons and lights. How are blind people supposed to cross those with silent cars streaming through?",,,2,0,0,
b73591d8-60c2-48e7-82f1-3403ae8fb8f3,1519934361,"CC is for deaph, DA is for the blind. Descriptive audio.

As for what I enjoy, I use Voice Over to read stories on stories.xnxx.com or literotica.

If there were a genre of audio porn, I don’t know it’s common name. May I propose CumCast or OTunes?",,,1,0,0,
7c5a55c7-8311-435a-8c62-a6f8e9e1967e,1521045265,What's the difference between rehabilitation vs habilitation O&amp;M?,,,1,0,0,
ec486146-6505-49ff-bd13-f77136c0f41d,1520829405,Like Quagmire (family guy) after he found online porn ?,,,3,0,0,
c86a8b54-17cb-4bb4-a458-8b888321de72,1522127487,So it turns out BrailleBlaster cannot convert the MathType add-in in Word directly to Braille...when I convert it to .txt the equations are lost. I need to find a way to convert .docx with MathML (converted from Math Type in a word document) to .xml to .brf... Any suggestions?,,,1,0,0,
8fd01324-2dfd-45de-9783-79bca3340315,1521344893,"I can't help with chairs sorry, but I'm curious, why don't beanbags last that long? My nan had beanbags for the kids in our playroom and they lasted for a year or more.",,,1,0,0,
b6417e3f-7a27-4243-861b-7e4dfd152f37,1521804634,"I am sighted and my wife is blind. She currently sees less than 2ft in one eye and just light dark in other, slowly loosing all sight. We have been married almost 7 years. I knew what I was getting into being the only sighted one. Luckily I don’t mind doing all the driving. Her blind friend from high school is also married to a sighted person so it is not that rare. ",,,5,0,0,
50ddf696-3529-4e1c-93d1-64222ea3b95e,1522154077,Im not blind but i can only assume this would make things a lot more dangerous,,,2,0,0,
70563e3b-9834-4622-a4f4-7d0fd3d0c0f0,1522355276,It's hard to imagine an optometrist that would tell you to wait and see. Sounds like he/she suggested that you see an opthamologist. They should be able to refer you. ,,,2,0,0,
7eb31e22-b3aa-4478-952e-7c959054f409,1520544803,The difficulty that may be faced by persons using screen readers is not that they will be unable to read it but depending upon the screen reader and settings they may not know that the background colour has changed.  If the background is intended to provide context information (for example halloween colours of orange and black) it will still be readable but the context is lost.,,,2,0,0,
dd47c174-7a35-40c9-85e7-2a78c2ba4e38,1521863493,Thank you so much for all the great info and links! Its just been so hard. I never realized how much was available. Awesome. I am going to look into the adjusting for vision loss course for me! Maybe it will help me help him.,,,1,0,0,
09b4f009-5982-4d90-bcef-118e4af5ba9f,1520485481,"Wait, like, riding the metro? Sorry, that mental image is just hilarious.

Like, how do they think you picked the train, or got into the metro station, but got lost on the line or something?

Did you just like, completely cease to know how to walk while sitting?

Some people are so silly.",,,3,0,0,
09b4f009-5982-4d90-bcef-118e4af5ba9f,1520486610,"I'm not sure which was your post, but I appreciate trying to make a single streamlined version of your site a lot.

I've just seen a couple posts, along with stuff of this sub, that play into the helpless, bumbling blind person trope, and seeing a post that implied that blind people are kitchen accidents waiting to happen kind of set me off.

I was 18 when I lost my vision, I'm 23 now, and I get the struggle of not understanding blind folks, but its just so damn irritating to be assumed to need constant help to do basic life stuff, without people even asking if we *do* struggle with it.",,,3,0,0,
71b56506-70aa-4557-b446-a04309ddca9d,1522388421,"Personally I find it more comfortable to use a stall with a toilet. I'll stand, but usually just prefer to use the toilet because I hate finding a urinal with my cane. They're usually soaked in piss and I don't want to get my cane in there. Of course, sometimes the stalls aren't much better.

It's totally up to the person, though. Whatever's comfortable for them.",,,2,0,0,
7c5a55c7-8311-435a-8c62-a6f8e9e1967e,1521114994,"… wow. That's … a pretty amazing example of ""unclear on concept"".

Did they have to have it explained, or was pointing it out and letting them think about it for more than 5 seconds enough?",,,1,0,0,
5a28ae88-1e35-40b1-b7f0-31ad324a3945,1521807785,[Get started on Android with TalkBack](https://support.google.com/accessibility/android/answer/6283677),,,2,0,0,
7dfa93f1-b4ca-4f21-9908-d574d170abee,1521033638,"You might also be interested in [you describe](https://youdescribe.org). Not quite what you're doing, but an effort with similar goals.",,,2,0,0,
09b4f009-5982-4d90-bcef-118e4af5ba9f,1520540165,"Color blind people or those with low contrast vision may have a hard time reading text, however, so that's the main issue.",,,2,0,0,
4d87e885-ee27-4ef1-944a-e0d8a0d8d295,1521999700,"You can purchase one through the shop on the link, though you'll probably need to call. They have a price list PDF on the page and Iowa canes are $23.10. 

https://blind.iowa.gov/living/store

For anyone wondering what an iowa cane is, it appears to simply be a version of a fiberglass long cane with a metal glide tip and a green handle. ",,,6,0,0,
8fd01324-2dfd-45de-9783-79bca3340315,1520976582,"I use the Barclays app here in the UK. It's completely accessible. I am able to make payments, view my statements, and move money from one account to another. I can call or message if I have a problem. The messaging feature could do with a bit of work, at the moment it doesn't tell you who is typing and I believe there's a problem with the apostrafy key, where, even if you press the apostrafy key, it isn't entered into the text box but apart from that, everything works fine.",,,1,0,0,
2114348b-4a72-4b34-b2a8-ee85552ef05b,1521120423,"These cards could be a really nice vehicle for not only informing the uninformed, but also for building true awareness and advocacy as part of a larger program. I'd suggest that in addition to the core info that you want to provide on the card itself, you could also include a URL to a site that includes even more info, examples, videos, and whatever else. The whole thing could be framed in a really positive, friendly way -- like hey, we know you mean well and want to help, so here's the best way to do it. The goal would be that anyone who receives a card not just get a few pieces of helpful info, but they also get plugged into a broader information ecosystem that helps to build awareness, advocacy, and maybe even some real empathy and compassion. The site could also host the card template for others to download (and maybe even host multilingual versions and such).

I'd be glad to help with any of this, especially the web part, if you're interested.",,,2,0,0,
b6f6eade-7ddf-4a7a-977c-7c7b58400bc2,1520441931,"Ted Henter the creator of JAWS. Also Louis Braille. I would say the governor of New York it would have been cool if he used Braille, cane, and a screen reader to show people how a blind person does his job.",,,1,0,0,
59dfbb4b-1e4a-4fa3-90c5-dfdd15cb66ea,1521495565,"The idea that this kind of design can be used by beginning uses is super helpful. Thank you very much. I was wondering if you still remember those moments when you were getting used to the inconvenience while you're a beginning user? And how do you learn those things? I feel like this kind of tool is like the training wheels attached on bikes when kids learn how to bike. 

However, they are quite different than training wheels. It might still be helpful while you're at a new environment. ",,,1,0,0,
a12909ba-1dd0-4c82-ac86-ddc03ee907ff,1521134937,Glasses do not help with ONH. I had glasses prescribed for astigmatism and I rarely wear those because they get in the way of me using magnification tools such as I’m in ocular and magnifier to read with. The 20/400 in my right eye the only IOUs is in just to pinpoint of My eye. It means that what you see at 400 feet I have to be 20 feet away from. Everyone situation is different though because the peripheral vision and other factors. I cannot drive and there is no way to correct vision. Magnification helps tremendously. Some people can drive with 20/400 vision depending on their peripheral vision. Hang in there Mom. Things will be OK.,,,2,0,0,
3c0a5c2d-4532-404e-81c7-9fbd7a356ef0,1521739305,"PhD student and programmer. Teacher, writer, and accessibility specialist or backend programmer are possibilities. HR seems like a good fit if you were good with some tech that could automate some annoying stuff.",,,5,0,0,
ec486146-6505-49ff-bd13-f77136c0f41d,1520816382,"I’ve used it around the shops, office, side walk stuff and...that’s about it. ",,,1,0,0,
04633183-2341-4cbb-9d0f-f40ef3e9a8be,1520559385,"Why give up on those careeerss? There are blind professors out there. 

Blind people can do anything they set their mind on. I am a totally blind student journalist. MOst blind people probably don’t think they can do what I do. I am very mobile, for many of the harder jobs your mobility has to be good, and you can learn to do it well. I travel around campus, ask and talk to everyone. I’ve also have been wondering around the campus everywhere, cafeteria all around the inside. I worked the student lounge. I’ve done many many things in my life. In high school, traveled around the entire school quad cornering people for interviews. I’ve been capturing random events on campus, going to the booths taking down information and pictures. Impossible, no. Do you sometimes more time, yes. But it’s doable. I’ve been from everything to leading groups to going to many events and because I was so out there I became the rep on flyers for this blind organization. I would take stabbs which most there, probably not believing in themselves so much, and more sheltered shied away from. I was the ASB president in elementary school. I’ve traveled around three counties, traveled internationally and mastered a random city in another country quite well. I know my county and the county next to me better than some sighted people. I’ve been everywhere, ate at a lot of the restaurants. ETC.... 

There is even a blind doctor out there.",,,4,0,0,
04633183-2341-4cbb-9d0f-f40ef3e9a8be,1521271408,"I think the first step is to understand and encourage. To Empathize. To tell her slowly continuous, that it’s okay, someone is there to believe in her, someone that will be there not as a nurturer or care taker, but as a friend. As someone support but believe in her. Remind her how capable she was or could be. Blind people could do much of anything. I did journalism work for a bit, and was basically able to complete it, even the independent travel. Blind do and has done much so, respect her and be her greatest allie. What did she do before she went blind? Tell her there is probably a good chance she can continue probably, or find something just as rewarding and productive. Just because she lost her sight means nothing. She can be just like she was. No one needs to believe she’s blind.",,,2,0,0,
2352c9dd-617c-4513-b9da-ef312b2109bf,1521891254,"So this past week was a conference called the CSUN accessible technology conference. There were 5+ booths there selling new models of canes. It's great for you to practice your engineering on this kind of project (and who knows, it could be the best idea ever) but just understand there is 20+ or even 100+ years of people practicing and researching and testing this topic already. Personally (I'm sighted) and yesterday I pointed my friend towards the hotel front desk and he drifted left over the next 40 feet (just like I do when I swim without goggles). Maybe some sort of way to compass/walk in a really straight for those big big open rooms?",,,1,0,0,
86789a6e-1475-465e-a4b6-218fa72fefdc,1520427288,"hey, unfortunately i have already reached out to someone, but thank you for your offer (if something comes up and it doesnt work,  i'll let you know ). It's still interresting to know more though, if you have any experiences with medical staff, it can be anything from the dentist to an ambulance ride, what would you say you liked the best about their approach and what would you have liked they did better?",,,1,0,0,
f9f54438-f5c9-44db-bfb1-2937dd5d89a7,1520612801,Doesn't make sense to me.  Why not train a visually impaired individual to make the best use of his or her remaining vision and then teach them skills to compensate for their impairment?,,,2,0,0,
4a701736-cf95-44ba-8c42-4d419c98ed6c,1520360796,"There aren't a lot to choose from aside from the occasional musician or comic-book hero. 

",,,2,0,0,
265ce014-6826-45e6-af94-7cfc8638f379,1521141083,I’m actually dad! But mom is just as interested so I will pass this information on to her. Thanks for getting back to me. ,,,2,0,0,
7552a8b6-9ca5-4a1d-ae6b-78f23e86325c,1520365358,"Aldous Huxley had very poor vision. Stevie Wonder and Ray Charles are amazing blues men. Hellen Keller but thats kind of a given.

and then there is always [wikipedia's list of blind people](https://en.wikipedia.org/wiki/List_of_blind_people)",,,3,0,0,
