commentator_id,created_utc,anonymized_body,ups,downs,score,controversiality,gilded,distinguished
04633183-2341-4cbb-9d0f-f40ef3e9a8be,1522331569,"Hahaha! That’s a good excuse for producing braille. Hahaha! That’s really interesting.

You’d be best if you learn first. Screen reading is pretty good and possible with long text.

Longer books can be more expensive, but if you do it through some sort of school, it’s free, at least it’s here.


It’s definitely possible.",,,1,0,0,
7dfa93f1-b4ca-4f21-9908-d574d170abee,1521562951,"It does exist. Nobody reads it. Largely because of the ""I'm on mobile"" reason you just gave for not knowing about it. 

A rule requiring people to do basic research seems pretty subjective.  I guess we mods could start removing surveys that ask obvious questions.  But that would quickly become the mods removing surveys we just don't find interesting. As a totally blind person, what's obvious to me may not be obvious to you.  And I have no idea what information is available to sighted people or where it is, because of course, I don't need it myself.  ",,,2,0,0,
fc6c45f2-5039-4b8e-8b4b-e54971e75d19,1520010003,Thanks for the recommendation. I'm not sure if I can customize the plug-in I use for that function. But I'll try to explore it. ,,,1,0,0,
7dfa93f1-b4ca-4f21-9908-d574d170abee,1520967531,"Yup! I do my banking myself using my online banking app, either on the phone, or on the web. It's accessible either way.  I also set up automatic payment of most bills, so I don't have to worry so much about reading my mail. And my bank emails me when I have a credit card payment due, so I don't forget about that either.",,,2,0,0,
3c0a5c2d-4532-404e-81c7-9fbd7a356ef0,1521825164,"If anything, blind/blind is the exception. I'm low vision and my partner is 20/20.",,,3,0,0,
c4f82a04-745f-4b72-b4ac-42a7c56532cb,1521156911,"You should share them. I'll accept they might not necessarily fit with the inspiration tag directly, but they still showcase things blind people like to do, as well as things blind people can do. We see plenty of questions from sighted and blind people about what blind people are interested in/do. That sort of content might also be inspirational for those people too, especially if they or someone they know is recently coming to terms with blindness.",,,2,0,0,
2ee13587-e842-41be-b10d-ca38155a8b45,1521826354,Did you come up with that all by yourself?,,,1,0,0,
28bd916f-f773-4af6-b115-ec219e094f89,1520484285,"Don’t forget the knights irl. Uber drivers keep trying to buckle my seatbelt for me, people want to guide my instead of trusting me and my guide dog, people asking me if I’m lost while I’m sitting on the metro... it’s a long list",,,11,0,0,
7dfa93f1-b4ca-4f21-9908-d574d170abee,1522239358,"I recorded all my lectures in university, with the best of intentions. Later in the week, I'd listen to them a second time, while transcribing them! It would be a good way to study, and to organize my recordings!  How many times do you think that ever happened?  Hint: if your guess is larger than ""zero"", you're wrong.

The problem with taking notes during the class itself is that keyboards are loud, and if you use speech, you need to have headphones on one ear, and that distracts you from actively listening to the lecture, or participating in the class.  Some universities offer paid note takers to help with this, but mine only offered them to students with physical challenges, not blind students.  

Transcription services are available today, but though I haven't used them much, I don't think they cut it.  What we need is something where we can search the auto generated text transcript, and then play the lecture audio starting from the word or phrase we found.  That way, a blind student while in the class, would only need to note down a list of unique sounding keywords. After class, the student could search for those keywords that seemed important, and make more complete notes from the recording. That would be much less work than having to listen to the entire lecture a second time, so it would be more reasonable to expect that students would actually do it. Also, if portions of the transcript were accurate enough, we could just copy those directly into our class notes.  ",,,2,0,0,
6605dbbd-ad6d-4d2a-a5cc-e69baf28869d,1520980106,That is very unfortunate and very irresponsible on their part. Would you mind sharing the name of the bank or give me their site? I will contact them. ,,,1,0,0,
1697f909-b894-419e-b416-b1462b0b5f50,1521763463,I use salesforce as well at work but I haven’t used it with a screen reader yet. I am interested to hear how accessible it is as well as it is an essential tool for my job.,,,2,0,0,
8fd01324-2dfd-45de-9783-79bca3340315,1521344678,"I took a look at the site and don't know what it's for. I hear turn on comment mode to collabirate with this prototype. I press enter on the on text, the comment section comes up and that's all I found. I'd highly recommend testing your website with NVDA. You can find out more here www.nvaccesss.org or if you have a mac, there's a screen reader built into it called Voiceover. If you can, coding the site by yourself would be a lot better than using a tool to do it for you. What is your site for? Is it for those of us who are blind, ( people who can see only light and shadows or nothing at all,) or visually impaired, (people who can see but not as well as someone who has full use of there vision?)",,,6,0,0,
d4e93e0c-b236-4ada-ad37-99d6d20d5c3f,1521266522,"Is it required to be an U.S. resident to participate? Currently, i live in Mexico but i'd like to help, since i mostly use Microsoft stuff.

Thanks in advance for the answer.",,,3,0,0,
04633183-2341-4cbb-9d0f-f40ef3e9a8be,1520339747,"Hey! I am totally blind here, feel free to message for contact. Definitely willing to commit to help. I do a lot of teaching in my daily life anyway. I have a fair warning though. I may or may not be the right candidate for you though. It depends what you are you looking for. I tend to be a go-getter, highly vocal, very assertive with it, really independent, usually have no trouble, probably if I need to use an ambulance I’d help you make me confortable, or be really understanding of operations so... I am not the average blindie. I get around 3 counties, have learnt to travel them. So, if I am too bright for you, too sighted like, too independent or vocal count me out, I take no offense. If I still qualify, count me in.",,,2,0,0,
5c0f4492-2a49-4bf8-abee-71f2f7e1b59e,1522319743,"I've not seen a Dr for anything relating to my eyes in 3-5 years (really can't remember), haha.. 

Maybe I will. But it'll have to wait til summer, cos organisating such things isn't my strong suit..",,,1,0,0,
815701da-4ebc-490a-a804-d701f864417c,1520593377,"That's great advice, thanks! You're totally right - you've really got to work hard and take the initiative, and not be afraid to ask for the help or alternatives you need!",,,1,0,0,
8cb9a862-14c2-40d4-b9b2-9b00f0330bf2,1522329199,"I use websites more than apps so will look at the website! I've never heard of this service before, so will give it a look.",,,1,0,0,
04633183-2341-4cbb-9d0f-f40ef3e9a8be,1522239412,"Well this is a very interesting project, but I’d say that gps is GPS and can only be as accurate as it is. Nothing you can do. GPS is always said to be a few hundred feet off, which isn’t bad. That’s what I want down to the door sign. I can get to my destination about a few hundred or even a hundred feet away, but it still remains if I do not know the area the question, is where is the shop? This is a general problem with GPS. I tell people well I can’t see door signs. I generally just get help.",,,2,0,0,
09b4f009-5982-4d90-bcef-118e4af5ba9f,1522510619,"I'm sure that plenty of us would be willing to critique things that are just plain not how blindness works.

Also, if you've watched Daredevil, the netflix series, their Matt Murdock is pretty great in the blindness portrayal.",,,1,0,0,
04633183-2341-4cbb-9d0f-f40ef3e9a8be,1520616434,"No problem. I do extremely well, usually in school, unless I am really not good at the subject or something. I know to ask for help when necessary. I think over using the office is a bad idea. When you go in know what you need, they like that, a lot! Don’t go in and say I need help, some help. I don’t know what I need, though. They don’t know either! Hahahaha! They’ll try to help you, but it may not ultimately be the right kind of help. Use the right offices. For example, don’t ask the disability office, hey what should I major in? 

Also, make friends even with staff. You would amazed what that means? Say hi, be friendly. Even if you’re not as social as I am, I feel like most isn’t. On most personality typing test I test high on extroversion. Fine, you aren’t. You could try to be friendly, nice and considerate though. Make good connection. Follow direction, act trust worthy. Stuff I would also advice a sighted student right? Be friendly, with your disability office. When you need to speak up, do so, but be assertive rather than aggressive. Be nice and reasonable when talking to people. Have a voice but don’t insult, demean, or have an attitude. Speak your needs and not wants. Use a ignorant moment to educate and not be flipant. Too many blind people have an attitude when things don’t go the way it’s supposed to or how they want it. I would advice being patient and kind. Just explain it gently. Such as “you may have this notion of things. The situation is such, and this or that method, won’t work because”

I also spend time in the disability office because I go in there semi-often, and just talk to them. Make connection, forge good friendships. I know the entire office. I could virtually walk in there and everyone knows me, and usually very glad to see me. I mean people have their bad/busy day right? So I am accounting for that.

I find that feedback really helps. Try to enumerate for them kindly this is working and this is not working. This is why? If they do something that doesn’t work, I’ve seen some people that just gets mad, turns and be rude, ETC.... Not helpful nor is it kind, and it won’t win you any support.

Learn that you are capable, and you don’t need to be needy. It’s okay to get lost! Be careful, yes. But you don’t need to fear every minute you may get hurt if you get up and try a little or a lot. Adapt and be innovative. For example, I am a student journalist. I work events fine I just need to quickly learn the area or wonder around the area and work it. Then I find a way to get out. I’ve also worked the cafeteria and student lounges. I passed out nearly 200 papers if not that or more. Be ready to make a little of a fool of yourself and don’t be ashamed about it. I have covered the same table twice, just to hear, “yes, you’ve already talked to us, given us the paper.” If I hear it too much maybe moot point, but if I hear once, appologize or explain and move on.

I’ve also worked club fair and shouted for our club and waved a flyer, it was my idea actually. No one thought to do it that way! I also shouted at people, or called out to them when they passed. “Hey, excuse me, are you interested? We are the school newspaper. It’s an interesting program.” Will you make a fool of yourself sometimes, but learn it’s okay. You don’t go the way I do, but my point is try be adaptable, think of your own way. In fact don’t do it my way. 

Be ready to improve and take suggestions. Maybe the disability office think you should do it b way and you’ve always done c way. Try to be considerate, think if you can do it their way, within reason of course, if they don’t want to provide even basic services then no. If it’s reasonable services then maybe the indivudal needs to grow a little. Be flexible, work with the office. Take responsibility for your education. At university they do much less then grade school/secondary school. Be ready for this.",,,2,0,0,
3c0a5c2d-4532-404e-81c7-9fbd7a356ef0,1522425404,I think the problem is needing to hang on to something while having a place for the dog to sit or stand without getting in anyone's way.,,,8,0,0,
7c5a55c7-8311-435a-8c62-a6f8e9e1967e,1521055124,"I don't think such people even have a thought process about ""how did this blindie manage to get here in the first place"". I've been in lots of situations where it would've been pretty impossible for me to be there without knowing what I was doing, and still got this.

Hell, I've gotten the ""walk up and grab my arm with no warning"" treatment at a _psychologist's_ office. And to add to it, the psych then treated my rebuke of the employee who grabbed me as an indication that there was something wrong with me.

One would think people there would know not to randomly assault patients, who might well have PTSD or a history of assault or any number of other issues. But … nope.",,,2,0,0,
04633183-2341-4cbb-9d0f-f40ef3e9a8be,1520558543,"Wwow! Sounds very unfortunate. Is there a good reason she’s kept at home for virus season? It sounds very nonsensical really. What does she have with the noise? I find to be a poor excuse. If your sighted student doesn’t like noise they still have to go to the crowded area right? I think people are babying her too much. I see no reason for her isolation when she is in school. She is choosing such isolation. Maybe try to get her in to a language club or group or a robotic activity?

I think she is making excuses whilst at school, maybe learnt from her doctors or guardians and it shouldn’t be encouraged. I work well in crowds. A blind person can do that well.",,,7,0,0,
8fd01324-2dfd-45de-9783-79bca3340315,1521701315,"This kind of thing has been done already, a lot. What would make your gloves different to the tech that's already out there? A lot of blind people use cains that they hold in their hands, so gloves might not be the best thing to wear. Here's an article about gloves for the blind. http://www.dailymail.co.uk/sciencetech/article-2951187/Soon-HANDS-Vibrating-glove-uses-ultrasound-help-blind-navigate-surroundings.html How much would these gloves cost? TThere's a product here in the UK that you hold and it does what you've described but it uses sound waves I think. Here's a product that does this http://www.sightandsound.co.uk/buzzclip.html",,,1,0,0,
a65875ce-2678-428a-bda4-757d6fe55fd9,1521367530,I use it everyday and they just end up like a puddle on the floor. ,,,1,0,0,
a65875ce-2678-428a-bda4-757d6fe55fd9,1521367667,They’re nifty. Unfortunately don’t think they’ll work for me.i have nystagmus so I have to turn my head severely. (That’s just one of my conditions),,,1,0,0,
2654932e-4441-4313-bb5c-716a3d40ae06,1522045634,"Wow, I am really surprised how this community helped me. Really cool! 
Thank you, man, for your comment and really nice explanations about a situation. So yeah we will focus primarily on inside usage.
Have a great day!",,,2,0,0,
6401b69d-c057-4894-af7f-2b255ce44f5c,1522315681,"Hey this is kind of unrelated to OP's post, but in your opinion, what are the benefits of Zoomtext vs MAGic? Also, I'm a low vision JAWS user, so with the updates to JAWS to work better with zoomtext, whats the difference between Zoomtext fusion and Zoomtext reader?",,,1,0,0,
b73591d8-60c2-48e7-82f1-3403ae8fb8f3,1520262235,"Even something as complex as Pokemon could be made easily playable if you ask me.

At least from a game play mechanics point of view. Some things would be hard to make accessable, such as puzzles, but the basic story, exploration, and battles should be easy to translate over.",,,2,0,0,
7dfa93f1-b4ca-4f21-9908-d574d170abee,1522325521,"Well, I'm not in university anymore. So it's a bit late for me. :-) But when I was, I recorded on a smartphone, that I would leave at the front of the class, so it would pick up the lecture clearly.  So the challenge with this approach is going to be: I could be ten rows back. Yes, I do have a laptop. But how can it trigger/sync up with my smartphone, recording at the front of the class, whenever I note down an important keyword? There might be clever...bluetooth? tricks to make this happen. Or maybe just relying on the clocks on my laptop and phone being exactly in sync? This requires some thought. I didn't record on my laptop, because the sound of typing, the sounds of other students, etc, would sometimes make the recording hard to listen to.  Most profs I had would let me put my recorder on a desk or table at the front near them.  ",,,2,0,0,
a485e89f-4dd5-47c1-9452-965aac534e5b,1521923950,"True, true. I remember there was a blind woman who won master chef a while back.

I used to say, given the choice I'd choose blindness over hearing loss, because I love music too much. So, At least I'm not deaf?

True, I guess it is just about adapting. Light perception sounds really interesting. I'm really curious about that, can you see slight differences if there is a colored light vs white? 

Thanks for your comment, it's nice to know that even with vision loss/problems you can still pursue your goals.
",,,1,0,0,
09b4f009-5982-4d90-bcef-118e4af5ba9f,1522281041,"Had one idling silently next to me, genuinely thought their car just shut off on them until they took off.

Even if it just played, like, the wheels on the bus, that'd be better than silence until you hear gravel crunch under its tires.",,,1,0,0,
bd938754-7e97-4f4f-a7c2-5285808657fc,1521173641,"There is a kit that some deafblind clients use, although I usually work with a deafblind client with an intervenor (or shouting louder).

Here is an example of a kit from Australia, with a printable document and a few examples on the website. Not sure how accessible it is.

http://auslanemergency.com.au/index.php/deaf-deafblind/natural-hazard-emergencies/general-emergency/

Here is an article (from 1997, I didn't see anything more recent) by Dona Sauerburger regarding deafblind clients and soliciting aid with cards. There have examples of cards from the Helen Keller National Centre and another experimental card for the time period.

http://www.sauerburger.org/dona/REviewcorner.html

",,,2,0,0,
8fd01324-2dfd-45de-9783-79bca3340315,1521124738,"Applevis is for apple related things like the IPhone mac and apple watch. the site is www.applevis.com and a good page to get started on would be https://applevis.com/new-to-ios

There's audiogames.net for games bassed on audio. The site is www.audiogames.net most of these games are for windows.

If you're interested in using windows and a screen reader, I'd highly recommend NVDA. You can find out more here: www.nvaccess.org and if you want to know what a screen reader is, go to this wikipedia article https://en.wikipedia.org/wiki/Screen_reader

That's all I can think of for now, I hope these posts helped you and if you have anymore questions, I'll do my best to answer them.",,,3,0,0,
e3844190-2d07-4e5d-8d2b-5fed0e848851,1522021646,"I see, so these services are more of a stop gap while awareness catches up and more designers make their content and infrastructure accessible.",,,1,0,0,
3b2a72c9-b4d9-4190-95c7-093cbd8ff885,1521780973,"I have an elderly, completely blind parent I live with, here's what I can suggest.

Victor Reader Stream by Humanware.  It allows access to internet radio (there are even channels for the blind).  It has podcast capability, great for listening to news shows.  It has a service that lets you read newspapers and magazines with a digital voice.  Most importantly, it allows access to NLS BARD -- free audio books for the blind.  Best of all, it does it all over WiFi -- for free.  You just need to get an NLS BARD account, they will help you get that verification of blind status and set you up if you ask.

Amazon Echo is great for playing games and music, if you add a Fire TV, it can serve up Netflix content.  Netflix has a growing library of content with descriptive audio for the blind.  In the future, a growing list of Android TV devices will have Google Assistant  which will quickly overshadow Alexa, hopefully.

Last but not least, an iPhone is essential.  It's ability to be navigated without eyesight is remarkable, although it needs to improve.  For example, it can be difficult to get Siri to read through your text messages.  It is surprisingly easy to read your email and you can do things like banking.  This is very important because having any control over your own life is very important to your well-being.  Just a simple thing like maintaining your contact list and being able to call people just by saying their name is very empowering.

My mother's biggest concerns are being able to feed herself and being able to match her own clothing.  There are iPhone apps that assist by having a person look through your camera and describe what you're looking at, even to the extent of reading labels for you.  I haven't explored them because my mother is not very adept with anything technological since she lost her eyesight before computerized life came along Circa 1990.

It is very important to introduce these things slowly and at a manageable pace, because feeling overwhelmed is something that comes easily when you're blind.  Frustration is an ever-present obstacle to mastering these devices.  By far the most engrossing thing is being able to read books cover to cover whenever you want on demand for free, it helps build an informed and thriving internal life.  As far as I can tell, that is the one thing that seems to help the most, especially since there is an element of escapism that is actually quite fun.  Here's hoping he gets to read all the great sci-fi books of the 20th century and beyond.",,,4,0,0,
8e867bed-ce3a-4d67-b332-413c19f2f655,1521158697,I cannot thank you all enough for your replies.  You have all been so kind and helpful. Thank you.,,,2,0,0,
7716495d-928e-4a54-9274-1028888036f6,1521766020,"It might help if we knew more about what he was interested in. There are all kinds of things that make TV guides and even TV's accessible to the blind, but whether any of them will work in his particular situation you've not given us enough to guess at. Comcast has an accessible cable box, for example, and if memory serves that includes reading the guide to him, but without knowing how technologically inclined it is it would be unwise to by default recommend it.",,,3,0,0,
bd938754-7e97-4f4f-a7c2-5285808657fc,1519865746,"Usually, when people talk about near sightedness or far sightedness, they are referring to refractive errors, which can be corrected by lenses. 

If you mean legal blindness, the definition is 20/200 or worse in the better eye *after correction*. That is important because my glasses are -15, which is stronger than some of my clients, but my visual acuity after correction is 20/25 (which wouldn't be legal blindness). Not sure if that matters for your paper, but refractive errors are generally not considered visual impairments (unless you are referring to extreme cases). Almost 50% of the world's population has some myopia. ",,,2,0,0,
bd04efed-5661-4f8c-8e4b-059a46adfeb5,1522290270,"I really appreciate these responses - 
My initial aim for this question was just to get maybe some interesting feedback to help me approach my assignment, and understand the current market of study/notation tools available to blind students.

Hearing from you, I genuinely would love to develop a product that helps address these needs.

The needs that you're describing sound very similar to needs that I use software to meet in terms of note taking 
Typical lectures will be conveyed in series of slides, which I print out to my OneNote, and label, organize, and hierachize the slides so that I can find what I need more easily.

In my degree, a lecture might have 70 slides, and a slide might have a plethora of equations, points of information and diagrams- 
Retyping slide contents would be hell, so I tend to add brief annotations, and meaningful titles to the slides.

Am I right in thinking that your needs are analogous in the sense that you'd like to be able to link audio recordings, to section titles, and maybe just briefly take down some key-points within sections?

I have a few more questions, because at the moment, if you're interested in contributing, I'd love to start by understanding your needs.

What do you typically use to make your recordings?
Is it your smart-phone, or does that not cut the mustard and do you prefer speciality gear?

Wherabouts do you study? (Just out of curiousity)

The concept you're proposing is really great, by the way.
I would love to actually make it happen.",,,1,0,0,
9f7fbd78-9ef2-422e-8e15-bfce552d43e4,1522479399,"Hey, i like your username",,,3,0,0,
8fd01324-2dfd-45de-9783-79bca3340315,1521526477,A talking treadmill or exersize equipment would be awesome. Or an app that connects via bluetooth to the treadmill and is fully accessible would be great.,,,2,0,0,
09b4f009-5982-4d90-bcef-118e4af5ba9f,1521617124,"Every person I know who has paid for the service has really enjoyed it. The advantage is that you constantly have access to somebody who’s actually had a background check and training, as opposed to be my eyes.

I personally wouldn’t pay for it, but if I had the disposable income for it,  I probably would.",,,5,0,0,
c63fba77-0d98-48b5-8b57-918d146313d2,1521116009,That's really fucking irresponsible. Unfortunately some people just don't put themselves in other people's shoes! ,,,2,0,0,
