commentator_id,created_utc,anonymized_body,ups,downs,score,controversiality,gilded,distinguished
6e2571d7-7e7c-4458-8ac7-e3eb28d7ef90,1522199383,"Just by the way, another way to get around the ""button not clickable"" problem is to double tap and hold, then let go as soon as VoiceOver makes the sound. This forces VO to pass the tap through to the button and will usually activate it, even when it's dimmed.",,,2,0,0,
7c5a55c7-8311-435a-8c62-a6f8e9e1967e,1521046977,"In my experience, it's not a lot like weightlifting. More like tennis, drums, or fencing. 

The grip should be comfy to wrap around, but you're not pulling it up by the grip like a deadlift weight — the leverage is totally against you for that. You're swinging it.

FWIW, personally I use constant contact most of the time (except super smooth floors like metro stations, where I switch to two tap) with a rolling tip. If anything, I'm pressing the cane tip _down_ so I can get more acoustic / tactile detail, like the lines between paving stones in sidewalks or the painted stripes on pedestrian crossings — palm facing down.

For that, you really want the cane to be as light as possible while still being rigid and comfy to hold. It doesn't feel at all like the muscles I use when lifting weights or doing a pullup.",,,1,0,0,
8fd01324-2dfd-45de-9783-79bca3340315,1519973806,"It's a great app. I've not gone out with it yet but I have downloaded it and like what it does. If someone could go on a little walk with it and write here what they think, I think that would be great.",,,3,0,0,
8e867bed-ce3a-4d67-b332-413c19f2f655,1521125444,"Thank you for the replies.

We are in england.  She is 42.

We do all try to help her breathe through but at the moment she is refusing so much outside help. Doesnt see the point of pills or counselling because in her words nothing will change what has happened.

I think she is in shock if that makes sense. 

She wont leave her bedroom except to go to the bathroom. She is so scared and i don't know what to say that isnt trite or patronising or just plain unhelpful.

I realise it is a stupid 'how long is a piece of string' question and i hope it isnt offensive but how long does it take a person to begin to adjust to having lost their sight and is there anything at all those who love them can do or say to help them cope? ",,,5,0,0,
7eb31e22-b3aa-4478-952e-7c959054f409,1520688798,"I don't have any expertise but here are my thoughts as someone who is also working on reading speed.  I would say use hard copy and braille display.  Braille displays or other electronic devices displaying braille are the future.  I can't answer the 8 dot question.  I use iOS OSX so I am able to choose 6 or 8 dot and contracted or uncontracted.  I would check to see if your screen reading software has options for different output.  
I am not sure of any technique that promotes faster reading other than read as much as possible.  I will be interested to hear if others have techniques for faster reading.  ",,,1,0,0,
6f9055db-1542-423a-b959-beb87d35403e,1521204234,"I just recently started my YouTube channel. I’m a (visually impaired) designer/artist: 

Introduction:
https://youtu.be/IBaz4XtlvbY

Drawing a water lily (based on a reference picture taken by another visually impaired photographer):
https://youtu.be/XqdrKxVBTzs

New likes and subs are very welcome! ��",,,1,0,0,
835be7db-4c29-499d-bf31-820fa9804cf7,1521814687,"I'm sighted, and I'm dating a blind woman.  She's been in lots of relationships before, and all of them were with sighted people.

",,,9,0,0,
7dfa93f1-b4ca-4f21-9908-d574d170abee,1521563946,"I actually thought we had one?  But our sticky posts are a confusing list of unhelpful things and closed threads, apparently.  That's something to work on.  ",,,2,0,0,
7552a8b6-9ca5-4a1d-ae6b-78f23e86325c,1521924573,"there are other people on here who can give better insight into how to deal with your problems. all i can say is that there are other people out there that have figured out how to live a full life without vision. hopefully they can figure out how to fix your vision but if they don't here is a list of people that might comfort you.

https://en.wikipedia.org/wiki/List_of_blind_people
",,,3,0,0,
333266a3-7fca-4d94-9d8f-4f23caaa0218,1521922256,"Seconding the need for dark humour. 

The winner of MasterChef US season 3 was blind (Christine Ha) so you can totally still cook. ",,,4,0,0,
0ce20fc4-3fd6-43af-97c7-4874225ec47e,1522013443,"Not sure I have any good advice, but I do want to say that I'm really proud of you for taking this step.

Good luck with your training, kick some ass. ",,,2,0,0,
5d297ced-9c71-4f17-9a24-4c59ba8b549c,1521923752,Did your medical insurance say they wouldn't cover it or something?,,,3,0,0,
bb272efd-aa70-42b8-aa48-f712e3ad6e7f,1522535255,"The organization I'm working with is called training gate international. Its a nonprofit organization that deals with advocacy towards for people with disabilities.
The clients will come to the instructor. However, we still need to think about the place that we need to book and the size of the place and so on.",,,1,0,0,
70563e3b-9834-4622-a4f4-7d0fd3d0c0f0,1521942791,My SO is blind (lost vision a few years ago). I’m sighted. ,,,1,0,0,
a65875ce-2678-428a-bda4-757d6fe55fd9,1521764317,"Sorry to hear this it must be horrible watching a decline. 

My blind relative uses a tablet.  It reads the screen to her. ",,,3,0,0,
bd938754-7e97-4f4f-a7c2-5285808657fc,1521085350,"Good lord, I hate it when that shit comes up. My clients occassionally worry because they are afraid they would hurt someone. I ask them to stand up, and I walk up from behind them, tapping against their leg as if someone had run into them. Invariably, they understand that it does *less* damage for a cane to tap into someone then a *person* running into them.

On a related note, me and my coworkers are actually having a discussion regarding whether we should issue a cane to a specific client. This client has a complicated history with violence at school, to the point that starting next September, he is being transferred to special school (not one for the blind, but for those with violence and self control issues... What is called Section 23 for the Toronto District School Board). He's already had instances where he caused grievous injury to kids half his age. ",,,3,0,0,
09b4f009-5982-4d90-bcef-118e4af5ba9f,1520527493,"Exactly. I'm an open book, I'll talk about just about any part of my blindness experience, but I cannot stand when sighted people try to tell me what being blind is like, or how blind people deal with X Y or Z.

If they'd done a precursory google search, or asked in here to get a better understanding before reinventing the wheel, I'd have pretty much no issue with it.",,,2,0,0,
09b4f009-5982-4d90-bcef-118e4af5ba9f,1520528411,"Genuinely, I don't mind answering questions, only when people skip the information-getting stage and instead just presume incompetence.

I'd rather answer the same question 500 times than be told what I deal with, in regards to things people are designing solutions for.

It'd be like if blind people made giant saucer goggles for sighted people who need glasses because they've heard that sighted people have vision in their peripherals not just straight ahead, then not baskingsighted people if they wanted new glasses, what issue the current ones have, things like that.",,,2,0,0,
8fd01324-2dfd-45de-9783-79bca3340315,1522249761,"Good luck and if your device/app comes out and it's a resonable cost, i'll be more than willing to try it.",,,2,0,0,
3fb9d2d8-9124-421f-8d32-d9bd30300623,1522258976,"My husband and I met through a mutual friend at a weekend music event. We actually didn’t interact much there, but he (who is the visually impaired one of us) contacted me on Facebook maybe a week later and did a little flirting (asking casual questions, like resources for finding things to do and a little bit about me), then asked me to go kyaking. His dad drove us actually so things were done in a different timeline from most dating relationships (meet the parents isn’t usually step 1). But I had a great time and we’ve been together ever since. I highly recommend an activity for a first date. It’s a great way to quickly bond over a shared experience and it shows a lot about a person. Also-we met after college.",,,3,0,0,
5a28ae88-1e35-40b1-b7f0-31ad324a3945,1520978536,"Barclays in the UK are very good at accessibility for VI people.

All users can log-on using a hand-held device called a PIN-Sentry, a small device with a keyboard, single line alphanumeric display and a slot for you chip+PIN bank card. For VI users they have a special version of this that is bigger, tactile and talks.
https://www.barclays.co.uk/ways-to-bank/online-banking/pinsentry-audio-accessible-card-reader/

Barclays can also supply personalised debit cards in a choice of colours with a big arrow pointing the end with the chip and an indent on the opposite end from the chip. In addition they can provide large print cheque books or templates to help you find where to write on standard size cheques.

They used to also offer a gauge for identifying bank notes but that is obsolete now that UK bank notes have tactile identification.

More information about what they do here:
https://www.barclays.co.uk/accessibility/sight/",,,2,0,0,
8cb9a862-14c2-40d4-b9b2-9b00f0330bf2,1521775797,I haven't used it as a screen reader user but when I could see years ago I used it with my remaining vision. I honestly have no idea. I wish I knew. I heard they did a Microsoft and suddenly started taking accessibility seriously but I have not seen it first hand.,,,2,0,0,
8fd01324-2dfd-45de-9783-79bca3340315,1520336285,I'm honestly not sure if that would work. I think some kind of beta testing would be great for the kind of feedback you would like. I don't think I'd focus on it as I have a lot of things in my pockets so might find it hard to feel the phone vibrate.,,,2,0,0,
7716495d-928e-4a54-9274-1028888036f6,1521616494,"You know, I think I took a survey on whether or not I'd use that, courtesy the [CNIB](http://www.cnib.ca). I also think I gave it a pass, given it doesn't do anything existing apps/services don't already do for less than what they're charging, and they don't mention if you or they are paying for access to the AT&amp;T mifi service. Not that that particular detail would impact me (I'm well outside AT&amp;T's coverage area), but were I a potential customer I'd be asking questions, and that'd be my first one.",,,5,0,0,
2654932e-4441-4313-bb5c-716a3d40ae06,1521891811,"Okay I see. Thank you, man, for pointing that out. As I said we currently don't have any particular idea of how the cain would look or work. We don't even know if there will be any electronic parts. But this compass idea seems really cool and it could work. We will take that into consideration. Thank you, sir!",,,1,0,0,
7aefdf5b-3adc-461f-b3e4-87cbe8f39f68,1520527225,My ignorance shows lol. That is what I mean! Thank you very much ,,,1,0,0,
bb930309-11dc-4dc3-8869-1ddf6467f5af,1520350660,To be perfectly honest Mac users are good too. Anyone who has more experience with me is beneficial. ,,,1,0,0,
b6f6eade-7ddf-4a7a-977c-7c7b58400bc2,1520441188,Okay thank you I want to learn C. I also found Quorum  an accessible programing language but I don't know if it is good.,,,1,0,0,
158519de-f322-4d1a-9f7e-15f13b7d68af,1521138845,"THis is no way immediate help but I read an excellent book about someone who transitioned from sight to blind due to a traumatic event. It's called Beyond the Bear: How I Learned To Live And Love Again After Being Blinded By A Bear



https://www.amazon.com/Beyond-Bear-Learned-Again-Blinded/dp/0762784555



https://www.huffingtonpost.com/dan-bigley/blinded-by-a-bear-how-my-_b_3202338.html


I found this book to be so inspiring and honest. I still think about it when I'm having a tough day and think ""man, if Dan can come through like that I shouldn't be complaining too much."" It's a those books that inspired me to write a letter to the publisher to pass on. I had never done that but I wanted to thank him for sharing his story.


I am sighted btw.",,,2,0,0,
8fd01324-2dfd-45de-9783-79bca3340315,1520976856,"security annoys me sometimes when I come across it but apart from that, yeah, they're doing very well.",,,2,0,0,
7c5a55c7-8311-435a-8c62-a6f8e9e1967e,1521151566,"blind.help seems like a fine name, except that I think people might not realize it's a real URL. ;)

I don't think it's worth being overly reticent with stuff like ""VI"" etc. Blind isn't a dirty word.

Functionally speaking, when we're talking about how to help a stranger of unknown visual ability on the spot, I think we should give advice/instructions on the assumption that they are 100% blind. That won't result in a _bad_ interaction for anyone, in terms of what help is offered / useful / interpretable, and avoids the intrusiveness of people asking exactly how well you can see etc.

If you want to override that in a particular situation, and disclose that you can see X or know where the Y is, that's your call - but the default scenario should be assuming nothing about someone's sight or knowledge of the local area.",,,1,0,0,
7dfa93f1-b4ca-4f21-9908-d574d170abee,1521770746,"Hopefully not. The only things conservative governments mean for the blind are unemployment, homelessness, poverty, and eventually death. There has never been any positive outcome for the blind from any conservative government in history. ",,,23,0,0,
bd938754-7e97-4f4f-a7c2-5285808657fc,1520824892,"There could be a market, but you also have to consider what other products are already on the market. Also what products have been produced but failed. 

Right now, I see two major issues that come up fairly often that neither technology or training has solved well. 

The first is crowded locations, such as a crowded subway station during rush hour, or a concert hall. Too many people, not enough people paying attention, and not enough room to use the cane well. Any kind of distance sensing technology (laser, sonar) doesn't help because there is just so much stuff in the way.

The second one is multiple conditions at once. Vision loss is significantly more common in elderly people, but so are many other health conditions. Deafblindness, or balance issues. One common issue that keeps cropping up is someone who uses a walker (due to bad balance) and a white cane. So someone needs two hands to hold the walker... which leaves no available hand to hold a white cane. Dementia is also an issue, where clients forget things. There are some devices that help (for example, this is quite helpful  https://seniorcareshop.com/products/personal-reminder-board ), but that doesn't help when someone can't see the board. And if you have something that CONSTANTLY reminds someone, that just becomes annoying. So you need a product that a person can use without learning new skills, but not overwhelm them with information they can't process at the same time. 

",,,1,0,0,
bd938754-7e97-4f4f-a7c2-5285808657fc,1521690568,"Most devices that use sonar sensors have been either glasses, or the device it attached to the cane. Although there is one that can clip onto clothing, too.

While gloves should be an good placement point (you can point your hand at things to check distance and it can be more intuitive), your hands may not be free. If it was glasses mounted, it is easier to look at the object. ",,,1,0,0,
663d99ce-064d-46a4-9c2d-6841daf11d88,1520585761,"Thanks a lot for your input. I would never have thought about the screen-readers problems. I know accessibility was not perfect yet, but I didn't think it was still so bad. I will definitely note it. 

The robotic seeing eye dogs was obviously my first idea, and the most ""common one"" in the field. Some projects already exist for this, but there is obviously a lot of room for improvement. On this topic, I was also wondering the following: do you think it would be considered useful to have a guiding robots that would be able to ""explain"" to their user why they are stopping, where they are currently, what is happening around, etc. I would believe it might increase the users comfort and understanding of the surrounding environment, and maybe even his/her acceptance of the robot, but I am not sure if this is needed information or if the user can already infer it by him/herself using his/her other senses. ",,,1,0,0,
04633183-2341-4cbb-9d0f-f40ef3e9a8be,1521901235,"Not a problem, not a problem at all! Yeah, i think it’s a common one, which is why I for now just ask for help hahaha!",,,1,0,0,
04633183-2341-4cbb-9d0f-f40ef3e9a8be,1521896787,"Hhaha! Join the blind club, relax, and get use to it.

Blind people can do just about anything? I don’t see why not for culinary school, there are some great blind cooks out there. If someone can be a blind journalist out there cook isn’t off the table. I served as a blind journalist and had a great deal of mobility!. I can cook if I tried and put some of effort in to it. I have no desire, however. Hahahaha! Get use to being blind, cracking those blind jokes and get over yourself a bit

I don’t necessarily think it’s darkness just seeing nothing. A lot of us have light perception. So, it’s not quite blackness and I have phantom lights some times so that may help you. I guess as a blind person you get use to seeing nothing and stop worrying about darkness or light.",,,1,1,0,
3c0a5c2d-4532-404e-81c7-9fbd7a356ef0,1522338425,"The reality is that not everyone has equivalent skill when handling a service animal...or any animal. I'm not experienced in this area, but chances are the dog should be retrained if it's younger or retired if it's older. This should probably have happened much earlier and now may be too late. It's too bad, though, because when service dogs behave badly in public, it hurts public confidence in guide dog programs and in blind people in general.

If the blind individual doesn't see it as a problem, not much is going to happen. Try to have a conversation about it in a nonconfrotational way. THere's not much else you can do.",,,8,0,0,
f9f54438-f5c9-44db-bfb1-2937dd5d89a7,1521570699,"This.  And TBH, I'm more selective about what I read.  I can read just about anything with enough light and magnification, but it is taxing on my eyes.",,,3,0,0,
9f7fbd78-9ef2-422e-8e15-bfce552d43e4,1522423266,"Just to play the devils advocate- perhaps the other passengers had their own invisible disabilities? Granted, the shouldve acknowledged the dude to at least say ""hey sorry but the seats are full,"" but still, we don't know what those passengers mightve been dealing with",,,5,0,0,
59dfbb4b-1e4a-4fa3-90c5-dfdd15cb66ea,1521495756,"Could you be more specific about how cane is helpful to you? In what kind of scenario is useful and in what kind of scenario is not? 
Have you ever thought about some other features that a cane can provide? 
For example, what if a cane that can lead you? Or a cane that can talk to you? or a cane that can replace the phone? or a cane that can work as a recorder?  ",,,1,0,0,
3c0a5c2d-4532-404e-81c7-9fbd7a356ef0,1521236227,"For what it's worth, I feel you. If it was anything else, I would just sympathize. But people already think we can't do stuff, you know?

Anyway, no hate here, just love. You'll probably swing back the other way before too long. You're clearly a smart person who has done cool stuff in the past.",,,4,0,0,
3fb9d2d8-9124-421f-8d32-d9bd30300623,1520431489,"Oh boy! Well, definitely check out the subreddit r/learnprogramming it is a veritable wealth of information and resources. It also depends what language you want to learn and they have many topics on that!",,,2,0,0,
90ac4778-eda9-451e-9c5c-010eeec4552b,1522191733,"I am a totally blind guy, who has been married to my sighted wife, since September 1999. We have two sighted kids. I can name at least a half dozen couples, off the top of my head, who are in similar circumstances to my own. I also know plenty of folks who are blind, and are married to blind people as well. I even know  a blind dude who is  married to a lady in a wheelchair.Ultimately, disability has no bearing on relationship, if a couple is a good match, it doesn’t matter. Every couple has strengths and weaknesses, even if both members of the couple are entirely able-bodied.",,,2,0,0,
e3844190-2d07-4e5d-8d2b-5fed0e848851,1521933116,"I feel like a lot of sighted designers are focused on helping people with severe visual impairments navigate, but from what I've researched, visually impaired users are more interested in better interfaces with existing resources and technologies. How do you think this relates to technologies like Aira?",,,1,0,0,
70563e3b-9834-4622-a4f4-7d0fd3d0c0f0,1519863916,"My husband is blind and travels all the time by himself -- two to three weeks/month. He knows his way around our airport and requests ""transfer assistance"" to change gates as needed. He just goes to the front desk at the airport and asks for someone to walk with him to the gate, room, etc. Ditto the other comments below. He pre- boards and just asks the flight attendant to lead him to his seat ... If they are behind him for some reason they want to put their hands on him, which make him crazy ha ha. He doesn't like to wait to get off last, so he just gets up and follows the flow off the plane.

Get the app SeeingAI ... it's new and free from Microsoft. It can read hotel rooms, describe scenes, handwriting, boarding passes etc.

His travel doesn't usually take him abroad but we took a river cruise for the first time (we are still figuring out best/accessible vacations) in Europe last year.  It was fun and the people were great. No, he wasn't expected to stay in his room. We requested a room kind of close to the main desk so he wouldn't have far to go if I wasn't with him. 
There were lectures, music, cocktail hours etc. We enjoyed sitting on the top of the boat too. I'm not sure if this is the type of ship you are taking. Definitely go! We met people from all over the world. 

The only issue we had were the lack of ... or narrow sidewalks and uneven cobblestones in a few towns but overall Europe is much more pedestrian friendly. Some employees wanted to assist him getting on and off the boat, but he doesn't like people grabbing him.  Hope this helps :)",,,1,0,0,
fc51f99d-f5be-4b62-9a27-1296b348d0c7,1520816622,"Ok,pretty standard. Sometimes when I'm going over a lot a rough terrain my hand cramps up, but in your case I'm sure it's just you getting used to it. I wish you the best of luck!",,,1,0,0,
09b4f009-5982-4d90-bcef-118e4af5ba9f,1520472777,"The majority of blind people have had vision or still have some vision, and even those born totally blind typically know that certain colors represent certain things.

I like the idea of doing it as prose, but I'm a reader/writer. Others might prefer a shorter description.",,,3,0,0,
04633183-2341-4cbb-9d0f-f40ef3e9a8be,1521507415,"I say you just need to stay on top of it. Anyone can be disorganized or organized. My aunt was sighted fully, and she had a riddiculously disorganized room. I am blind and I organize better than that, maybe excessively organized. If you have something, put it away. I tend to use a organization where I put a purpose to a shelf or a drawer. This one is for headphones. these two shelves in the cabinet is devoted to computer accessory and wiring. This one to software. That drawer is for accessibility tools. That other drawer is for microphones and studio equipment. ETC... I think you get the idea. Be consistent with it. Be disciplined about it. I say these are generally good ideas for sighted people as well.",,,2,0,0,
c8219722-a5f8-44fc-8b96-adf073a8cff5,1521945344,"Hi there!
I am a Teacher for the Visually Impaired (in California) but might be able to help with some first steps if you need! I provide services to students just like yourself and it would be very important to get started with stuff asap...at least before you graduate. Feel free to message me anytime. I know it must be scary but there are definitely some things that can be done to make the whole process and school a little easier. 

Edit: You can ABSOLUTELY go to culinary school still. You just might need additional support but totally doable!",,,3,0,0,
