commentator_id,created_utc,anonymized_body,ups,downs,score,controversiality,gilded,distinguished
04633183-2341-4cbb-9d0f-f40ef3e9a8be,1521509187,"I am definitely willing but there is a technicality you may like to consider, which may disqualify me. I am a very independent blind person, seen as kind of out there and brave as a blind person.. I travel extremely well, for the exception with seeing door signs I don’t usually have any much difficulty. I travel extensively and I mean very extensively. So, I am a willing participant, though you’re also dealing with a very competent person, which may not be able to produce much of an answer when asked what difficulty I have with travel. And, I am honestly not trying to brag or be vain here. I want to help you, but may not be able to. I think I grasp the usual challenges with others but honestly have few and far in between here.",,,2,0,0,
09b4f009-5982-4d90-bcef-118e4af5ba9f,1519871025,"I like to be able to be in discord and on roll 20 so I don't really want to have to tab over to a document, plus if I do play in person, I'd rather not bring my macbook, but instead just my phone.

My current method is just a note with spell pages of the wiki open on safari, but that's... really annoying.

I'd like something I could make, save, then hit, like, a plus or minus button to affect inventory or HP or things like that. Something with plenty of headers, roll20's has exactly none, with spell names that are clickable and can tell you what they do, so I know if they're relevant, etc.",,,1,0,0,
bd938754-7e97-4f4f-a7c2-5285808657fc,1520828210,That's pretty good. Build up those muscles. Just make sure you don't end up with one super-beefy arm because of that ;),,,1,0,0,
3b2a72c9-b4d9-4190-95c7-093cbd8ff885,1521781473,"I'm afraid that the process of acceptance can take a year to 2 years or more.  It depends on the person, and climbing out of that trauma and depression can be a very complex and difficult time.  Fortunately the human spirit is resilient and adaptive, and almost anyone in that situation will eventually start asking for help and show interest in empowering themself.  Even if it is natural, feeling sorry for yourself gets old and tiresome after a while.  The important thing to understand, is as a human, he needs time to grieve for his loss.  Such a process cannot have a deadline.",,,5,0,0,
6605dbbd-ad6d-4d2a-a5cc-e69baf28869d,1521003788,"So, who is tasked with adding all of these descriptions to videos? It seems like it could be tedious.",,,1,0,0,
f4c5b580-0643-44bd-9e58-fb45e03974a9,1519891769,You may subscribe to the feed of your inbox as an alternative.,,,2,0,0,
1a8aa46a-0519-4ead-b75a-9a3e5392ba8b,1521617400,"I've had it for a few months now, and though a little pricey, but has been a good safety net for myself. I've only been blind for 4 years and find having direct access to a live agent who can describe my surroundings, navigate me, pull stuff up on the internet for you while walking around. I'm mostly looking forward to Chloe, the onboard AI named after the 24 Character which will read signs and otherwise do live OCR on the fly. The agents have done really well with descriptions, helping me find my Lyft in a crowded area, helped me shop by myself at Safeway, things I'd use Be My Eyes for when out and about and not near wifi. It's worth a shot especially if the DOR can pay for it, but also depends on your lifestyle and level of independence.  Just another lifeline and tool in our growing accessibility toolset. ",,,6,0,0,
d4e93e0c-b236-4ada-ad37-99d6d20d5c3f,1521617203,"It's okay, i understand. Well, I'll make my suggestions by the normal channels, then.

Thanks for your time and for your answer.",,,1,0,0,
2114348b-4a72-4b34-b2a8-ee85552ef05b,1521122011,"Awesome! I did a little searching and there are a few web pages out there that offer various tips for helping people with low vision and blindness navigate, but there doesn't appear to be a single standalone web resource for this -- so it's good to know that if we built one, we wouldn't be stepping on anyone's toes.

I'm thinking the site could have a broader name that allows for a wider variety of content at some point down the road, even though we'd be starting off with a focus on content related to navigating physical spaces.

Any thoughts on a name? Short and sweet is always best, but I know there's also a lot of sensitivity around terminology. It's tempting to focus on the word ""blind"" out of simplicity but would that be off-putting to people who have visual impairments other than blindness? Would ""VI"" need to be part of the domain name for true inclusion, or is this overthinking things?

The domain name ""blind.help"" is available (didn't know that the .help TLD existed until now!). Any thoughts on a good name?",,,2,0,0,
7eb31e22-b3aa-4478-952e-7c959054f409,1520548392,Make popcorn,,,3,0,0,
4d87e885-ee27-4ef1-944a-e0d8a0d8d295,1522445934,"If you have a Kindle, you can increase the print size and they don't have glare, so you may be able to read a bit more successfully. 

With such a rapid development, you definitely need to speak with your doctor before learning how to use a long cane. 

If you're not comfortable driving, then definitely use an alternative form of transportation. 

Even if it is temporary, but reoccurring and or degenerative, you should speak to an orientation and mobilty specialist. There's a few on this forum that have a lot of good advice. They may be able to direct you to some resources in your area. An O&amp;M will evaluate your need for a long cane and fit and train you with a cane if needed. 

Most low vision resources aren't going to be able to help you or find funding for services unless you have an actual VI diagnosis, so there's no use stressing yourself out trying to get such services yet. Maybe compile a few local resources onto a Google doc just in case if it makes you feel better. 

Talk to your doctor and start there. You're going through something scary and new and I wish you the best of luck. Come back and update us if you'd like xo
",,,3,0,0,
7552a8b6-9ca5-4a1d-ae6b-78f23e86325c,1522447089,"I was reading a similar story in another disability sub where a young woman was forced to give up her seat to an old lady because she didn't seem to have a disability. But the young woman had cerebral palsy and probably needed that seat much more than the old lady did. Still, the driver insisted that the young woman stand. It must have been horrible for her.",,,5,0,0,
dd47c174-7a35-40c9-85e7-2a78c2ba4e38,1521786405,"Thank you so so much! I had never even heard of most of the stuff you mentioned. Its like bit of light at the end of a tunnel. I am out of state now but as soon as I get home I going to work on setting those up. I just want him to find any bit of joy in his life. Just thank you so much, that was exactly the type of advice I was hoping for. Forever grateful.",,,5,0,0,
7dfa93f1-b4ca-4f21-9908-d574d170abee,1522152788,And the surveys would still get posted here because we'd have like 20 times the subscribers.  ,,,1,0,0,
bd6c4d05-7da6-49b1-a0cf-6e3eb5a668ef,1521125674,I don't post my site data here to prevent doxing.  I actually run a few personal sites and also manage a couple of sites for my company as well as manage interface design for some other projects.,,,2,0,0,
61d31e72-e112-435c-a714-5c721e9f05d6,1521735779,"I agree. I don't see it as a necesity, and I wouldn't advise subscribing if you're barely scraping by. However if you can afford it your life will be enriched somewhat and you will have more independence and peace of mind. It really is a unique service that I don't think you can compare to anything else. The Be My Eyes people aren't really trained the same way and since their volunteers there's sort of an implied limot with how ""frivolous"" you can be that isn't there with Aira. It's more empowering. ",,,1,0,0,
04633183-2341-4cbb-9d0f-f40ef3e9a8be,1521671771,Bbecause some around is discontented with these survey things.,,,1,0,0,
70563e3b-9834-4622-a4f4-7d0fd3d0c0f0,1522354657,"I was thinking about Christine Ha too.  Here is an article about her. http://www.afb.org/info/catching-up-with-christine-ha/5
",,,2,0,0,
70563e3b-9834-4622-a4f4-7d0fd3d0c0f0,1521150793,"My SO (50 and otherwise healthy) lost their vision suddenly three years ago. My heart aches for you both. 

He has returned to work after going through mobility and accessibilty training in the US. None of it has been easy. He travels all over the country and even played golf for a while. The UK has lots of adaptive sports groups if that is her thing. 

A well-regarded psychiatrist described it to us as an “ambiguous loss”. He told me (as I listened one day through tears) to tell him that I knew what he was going through was hard and that I would be there for him and we would get the best people to help us through. It is a loss and she needs space to mourn that loss.  

I had to trick him (shhhhh ;) into going to the Dept of Vision bc the thought of identifying as blind was too hard for him. 

She may just not be ready.  My recommendation (to add to others here) is to acknowledge her pain, ask her how you can help, 

Watch a movie or TV show with her (Netflix and Amazon) have video description on all original content.  Most movies now have video description. 

Get audible or maybe your library has audio books for her (in US the dept of vision impaired has them for free)

My husband just had Aira glasses approved as an accommodation for work. He would be glad to talk to her. He is no Polly Anna but has been right where she is now. 

Maybe Invite close friends over for a quick lunch) no pity parties. People who treat her like her life has ended or talk loud to her need to be kept at a distance. 

She probably also needs to feel needed. We had to work through our own misconceptions about being vision impaired. Are you on Twitter? 

Depending on her previous job and activities there is lots she can do ... when she is ready. It *is* a body blow. No app will make her feel like she has her vision back but check out SeeingAI (free from Microsoft). 

Sending support from across the Atlantic! ",,,3,0,0,
b73591d8-60c2-48e7-82f1-3403ae8fb8f3,1520215687,I never heard of safety pins with beads. I appreciate you sharing.,,,1,0,0,
3c0a5c2d-4532-404e-81c7-9fbd7a356ef0,1521091405,"I honestly think this is a violation of her civil rights. She needs that cane to be independent, and she needs to learn to use it. This is incredibly misguided.",,,6,0,0,
8fd01324-2dfd-45de-9783-79bca3340315,1519973622,Thanks for the help. I ended up deleting my patreon account. I found the website to hard to work with and couldn't be bothered to keep it.,,,1,0,0,
8fd01324-2dfd-45de-9783-79bca3340315,1522223375,I don't think this survice is availible in the UK but here's a link to an applevis page about your app. You could try writing on there for more accessibility feedback. Thanks for doing this. https://www.applevis.com/apps/ios/food-and-drink/instacart,,,1,0,0,
7dfa93f1-b4ca-4f21-9908-d574d170abee,1520521006,"Start with C#. The Microsoft Visual Studio 2017 IDE is the most accessible programming environment you're going to get, assuming you're on windows.  And you can get extensions to it that will work with github, the most common collaboration tool for programmers, without ever having to touch the command line or leave the IDE. Also, make sure you download and install [CodeTalk](https://github.com/Microsoft/CodeTalk).  It's the largest productivity boost I've had in years.  And the syntax of C# works well for screen readers; lots of punctuation and braces, and Microsoft Visual Studio will auto-format your code for you, so no need to worry about indenting or anything like that.  If you can access bookshare, they have several books that will teach you c#.  ",,,2,0,0,
7eb31e22-b3aa-4478-952e-7c959054f409,1522419278,"In my case no one technique has ever worked well.  Like another poster I have up and down experience with recording lectures.  It's all about whether you get back and listen to them. again.  I am starting a new degree in the fall and I have been playing with a PlexTalk pocket to do the recording.  So far I am seeing a few advantages over my iPhone.  First, the battery life of the PlexTalk is better.  I can record in Daisy format and add in headings while recording.  I can speed up or slow down speech.  I can also put PDF or Word docs on the device to read.  I think this will be one device I will use in the fall.  Organizing notes has been something I have been thinking about.  In the case of the PlexTalk everything can be saved to an SD Card.  In theory I could have multiple SD cards and separate them by lectures, courses, etc.  However, in reality I think I would lose the various cards.  

If I had my ideal recorder it would be something like the PlexTalk with a few additional features.  It would sync with a cloud service when possible.  It would have a web interface with the cloud storage that would allow me to play the uploaded files from any device.  Perhaps even allow me to do some editing from the cloud service.  rather than another piece of software I would love something cloud based that I could use from any accessible computer.   ",,,1,0,0,
3c0a5c2d-4532-404e-81c7-9fbd7a356ef0,1521918825,"I don't see the need for OSHA and factory safety! I worked in a 19th-century factory for 20 years and never once had my hand ripped off. Also, seat belts seem like a waste of time. I drove for 15 years and never once died in a bloody accident by being thrown clear of my vehicle.

That's your argument.",,,6,0,0,
65134dbb-cb2c-48e9-ae49-d82fe8da5a8c,1521822817,I am sighted and I've been in a relationship with a blind person for almost 30 years. In that time I've met many other couples. Both blind-blind and blind-sighted couples are common. There is some variation in frequency based on locale; blind-blind couples seem more common in urban areas but not overwhelmingly so.,,,5,0,0,
0ce20fc4-3fd6-43af-97c7-4874225ec47e,1520540639,"Her videos aren't really for my demographic, but I agree, it's awesome that there are all these youtubers out there sharing their normal lives and diverse interests as blind people. ",,,2,0,0,
7c5a55c7-8311-435a-8c62-a6f8e9e1967e,1521055218,"Ditto. And when I was about to walk into a wall with my cane (perfectly fine, would've gone around without issue if they hadn't interfered). 

And when getting off a train with a significant step / gap I needed to coordinate. And when crossing a street. And when choosing to _not_ cross a street they thought I should. And… 

It's pretty much every single time I go out, unless I'm with someone else. I still startle every time.

Not to mention the people who grab your cane, or _move_ it from where you put it down. (Makes me _really_ tempted to ask how they would like it if I grabbed _them_ by the eyeballs… I get that they don't have any idea and are ""just trying to help"", so I'm not allowed to actually get angry with them. But still.)",,,2,0,0,
2e3d8457-4d6e-491e-bfce-7f6f0702ed68,1522239303,"That's really interesting! [I remember learning Microsoft developed something with a similar intent, only through stereo-headsets](https://www.theguardian.com/artanddesign/architecture-design-blog/2014/nov/07/microsoft-headset-blind-3d-gps-guide-dogs), it used stereo audio to create a '3D soundscape' that would give cues in the direction of items of interest, which is cool but I think it still a little too unfriendly to use daily.

I'm think my aim is to develop something that's a little less 'in your face'; that can do custom directions but also consistently relay a range of local information without 'shouting' it through your ears every five seconds...

Many thanks

",,,1,0,0,
7eb31e22-b3aa-4478-952e-7c959054f409,1521121769,"I will add to what others have said.  Screen reader compatibility is important.  I will mention a few specific things from my experiences with online courses and materials.

1.  Sticking to PDF is good.  However, make sure that if needed. the pdf has been OCR'd.  If you can't highlight an individual word in a PDF it is a good sign that OCR is needed.
2.  Convert those pesky PowerPoint type presentations to PDF as well.  Most presentation software is compliant with screen readers but it is easier to deal with PDF.  Review the document after you export it.  Are notes still included?  Does it flow?
3.  When you are making notes in Word, Pages, etc. Plan to convert to PDF later.  Try never to use tables for text.  Tables can be navigable but they can also turn into a mess for a screen reader.  The simple solutions is do not use tables.
4.  Avoid adding text boxes.  Again, they are not always bad but can get screwed up for a screen reader and may not be read at the appropriate time in the document.
5.  If you add pictures make sure you provide descriptions that provide enough information.  A bad description would be  - This is a graph.  A good description - This is a graph showing the  consistent decline of the Canadian population in the last ten years from 32 million to 31 million.
6.  Don't use bold or italics.  Screen readers can pick this up but I don't have the verbosity level set that high.
6.  Put heading in documents to divide sections.  When I say heading I mean from Styles in Pages or Word.  Usually called Heading1.  These are not the same as bold or italics.  They can allow a screen reader user to more quickly navigate through a document.

People can add a lot more I am sure.  Don't shy away from text based.  It can often be easier than narrating.  It can allow for braille displays or daisy readers can generally read text if desired. Simple text based documents with headings are great and very flexible.  More flexible than audio files.

Someone else mentioned making sure the platform is accessible.  That seems to be a common problem.  Another is the layout of course material files.  Make sure files are named in a descriptive way.  If there is a logical flow to folders or documents then number them.
",,,1,0,0,
7eb31e22-b3aa-4478-952e-7c959054f409,1521249141,It is quite a new product.  It is likely going to be tough to find one used.  You might want to try posting a classified on blind bargains website.  Might get lucky and find someone who has it but does not use it.,,,2,0,0,
bd938754-7e97-4f4f-a7c2-5285808657fc,1519865392,"There are already a number of colour readers and text-to-speech apps currently on the market. You can always make a new one, but for it to be successful, there would be some tough competition.

",,,1,0,0,
bd938754-7e97-4f4f-a7c2-5285808657fc,1520217911,"Where you live, do you have any deaf-blind intervention services? They may be able to help with that.
",,,1,0,0,
04633183-2341-4cbb-9d0f-f40ef3e9a8be,1520559872,"I agree, as someone who mastered a international city in 3 weeks time of being there I see no issues. I also work events and crowds at a totally blind journalist. My cane serves me lots but quite well. My sister did a similar project. It may help with beginning user, maybe more timid children, get them to begin as a training cane before they graduate to a normal cane. That could also teach bad habbits and reliance as well, though.",,,2,0,0,
7716495d-928e-4a54-9274-1028888036f6,1522223062,"Unfortunately, it's a them problem, not a you problem. Disability in general and for whatever reason blindness in particular make people get all weird and shit. They either assume they'll have to take care of you, or that if they spend more than 5 minutes in the same room as you they'll catch the blinds. Education helps, but only if the potentially educated is willing to listen. Otherwise, patience is about all you can do.",,,4,0,0,
0363f15c-0bba-4eef-b38d-8b47cf1db7d2,1520687776,here you go: [Talking Waterproof Watch for the Visually Impaired or Blind](http://areyouhappyat.work/finally-talking-waterproof-watch-visually-impaired-blind/) - someone had posted the link some time ago on this very same sub. ,,,4,0,0,
7eb31e22-b3aa-4478-952e-7c959054f409,1520690068,"Here is another person who inspires me.  Congrats to Mac and Jack and. his sighted guide at the paralympics.
http://www.cbc.ca/sports/paralympics/alpine-skiing/dynamic-duo-marcoux-leitch-golden-start-paralympics-1.4570912",,,1,0,0,
7eb31e22-b3aa-4478-952e-7c959054f409,1520600294,"I really like the idea of listing those who are blind and inspire us.  Another for me is blind rock climber and photographer Justin Salas.  I admit I am not inspired to go climbing.  However, I am inspired by people who continue to challenge stereotypes. http://www.justinsalas.com",,,1,0,0,
b99ec240-8263-4841-b1be-487bc2ba6ae2,1521037797,Make sure your platform works well with screen readers. ,,,5,0,0,
4a701736-cf95-44ba-8c42-4d419c98ed6c,1520360661,"Ahh voting. You know, aside from figuring out how to get to a polling place, I've never had an issue voting. Granted, I lived in a small enough town that one of the poll workers knew me by name and knew my disability, but what made that person stand out was that she didn't assume what accommodations I needed. Someone jokingly asked me once if my service dog was going to vote. It was a nice time.

The first time I voted, I did a paper ballot where you had to connect a line between two arrows to indicate your choice. I've done electronic voting since, and usually, it's bright and the print is large enough for me at least.  
",,,1,0,0,
fc6c45f2-5039-4b8e-8b4b-e54971e75d19,1520010288,I've never found an ASMR recording that actually worked. ,,,1,0,0,
6f2db2c8-8683-4638-9994-4f11ee8ae081,1520374670,"If you mean Pokemon on ds, that's quite playable as u/nighthawk321 will tell you. But yeah I'm helping him with walkthroughs and describing puzzles is... kinda hard, but only because i'm describing it step by step so it takes long. Nighthawk's completed a bunch of Pokemon games already. ",,,2,0,0,
2e6a9770-440e-41f7-a773-3a44dbde2590,1521503867,"It help a ton with a minimalistic design mindset. Owning just a few little stuff, has less stuff in mind, which makes organization much simpler. If I have something out of place, is because im selling it or throwing it away.

Blind people can’t do their best with a busy home/workspace.",,,2,0,0,
ffb3fe92-2bdb-462c-afed-c5aef99b5d8d,1521765077,Paralympic hopeful living and training at the Colorado Olympic Training Center.,,,4,0,0,
bd938754-7e97-4f4f-a7c2-5285808657fc,1521756733,"Rather than repressing all the emotions, take time to process your feelings. You may have to hold them in until the end of the day, but giving time to think and process your emotions help you a lot in the long run.

When under blindfold training, you may have a freakout. Might be early in the training, may be later. It's hard to tell. Not everyone has it, but a lot of people do. When that happens, you can ask the instructor to give you a few moments to calm yourself down. Take slow, deep breathes until you are back under control. You think more clearly afterwards, and can analyze what may have caused it.

Take some time to get to know the instructor. Building up trust helps, since they would be watching out for you. 

If you are learning how to eat under blindfold, you may want to start with someone simple. The first time my classmates and I had a meal under blindfold, my partner dumped a LOT of Parmesan cheese into my lap (for my spaghetti). I stuck to the garlic bread after that. 

Also, ask questions. If you aren't sure, it is better to ask and find out. I've had clients who made assumptions, that were not true. 

Good luck on the training! Hope you find it helpful!",,,6,0,0,
dd47c174-7a35-40c9-85e7-2a78c2ba4e38,1521765048,Thank you. It has been hard. He's just a shell of the man he was. I hide it as much as I can but I do get frustrated because its like he's just given up on life and is waiting to die. I can't be mad about it because I can't imagine how hard it is. I am really just grasping at straws now. Anything that might bring the smallest bit of joy or not even joy. Just something that interests him. Just something.,,,2,0,0,
bd938754-7e97-4f4f-a7c2-5285808657fc,1521514790,"I have used Aftershokz, but only the wired version. They have Bluetooth versions. They are decent enough for getting information, but not so good for music.

A landmark is a unique object that helps to identify where someone is. For example, a fire hydrant at a specific location could be a landmark. ",,,1,0,0,
31aed1d8-e257-4f14-a938-6ab06149fe17,1521182394,I recomend checking out the blind life on youtube. Always great videos. ,,,2,0,0,
7eb31e22-b3aa-4478-952e-7c959054f409,1520525227,"I will also add another from Canada.  David Lepofsky is a lawyer and disability advocate.  Here is a video of him talking about accessibility at Ryerson University.

https://www.youtube.com/watch?v=uqUZ6gK9N9k",,,1,0,0,
7dfa93f1-b4ca-4f21-9908-d574d170abee,1520041963,Sure is! US only according to the Microsoft press release I saw. And not in the Canadian app store; I just checked.  ,,,1,0,0,
