commentator_id,created_utc,anonymized_body,ups,downs,score,controversiality,gilded,distinguished
6c71594a-d15e-43ab-a858-ab28d9b2f786,1466820011,"Yeah, I was pretty happy to come across it. I don't know if I agree with everything but that hoes with anything ",1,,1,0,0,
48aa8e29-c585-4b0b-8c48-7f063b9c4b8b,1465416146,Huh.  I am not familiar with that law.  I'm sorry.,1,,1,0,0,
bc83942e-59b3-4c09-8671-15b514d00400,1464788269,"If you're in the US, call 2-1-1 or go to 211.org to communicate with an agency that can find financial support, food assistance, etc.  Let them know you're disabled but waiting on SSI, that you need financial help.  They will likely ask a few demographic questions and look up the info for you.  

Have a serious talk with your boyfriend about your financial situation.  If need be, sit down with a credit counselor (you can locate free agencies at 2-1-1).  

I can't advise in terms of being a sex worker except to weigh the pros and cons.  On the good side, it's good money under the table; on the bad side, there are certain risks, both to health and to reputation.  You know your own values and if that's something you can live with or not.  You also know what is or is not legal in your area, so keep that in mind too.

For now your job is to keep calling back until you get an answer.  If you feel able to, try to get a job that can accommodate your illness.  You know what you can or cannot handle.  

It's a lousy situation you're in.  I wish you the best of luck.",5,,5,0,0,
8b5b2d99-9c31-4822-99fa-9949e3120e32,1464878948,You are entitled to your opinion but I think this is another thing people overreact to. Have you even see the movie?,7,,7,0,0,
11701371-6c4f-401e-9763-7a0168485ed8,1465482956,"Interesting that you've chosen crutches. A lot of the research students who pop up focus on wheelchair improvements but there are plenty of long term crutch users out there. 

I am now exclusively a wheelchair user but used to use crutches full time (with EDS, pre-paraplegia obviously) so am filling it out from that time period. Great that you've asked about damage awareness, I think many people are unaware of the risks of long term crutch use. 

What I would suggest is that you add a q about the type of crutches used. Most people long term will use elbow crutches but there will be a few forearm or underarm crutch users and this will affect their answers.",3,,3,0,0,
6ef2492b-4a72-4170-a246-0d3f3c11855a,1465572054,"I used to be a perfectionist, very type A and constantly doing things. Now I have slowed down, I don't need everything to be perfect, and I prioritize my time and only spend it on things that are really important to me.",3,,3,0,0,
aae7c254-aa01-4ce4-83ba-64398c3b7be8,1467248307,"I'm not a little person, but I do know each prefer their own 'label' - since the proper medical terminology is ""dwarfism"" many are fine with being called ""a person(/student) with dwarfism"".

Secondly, how old is this student? If he/she is any older than like 6, just treat her like a normal student (if he/she has no other impairments). Your other staff has the right idea. If she is young and you would kneel down to speak to her peers (because most 5 year olds are shorter than adults), then yeah, do that. If she is older but you will be engaging in a longer conversation with her, perhaps kneel down so that you will be at eye level, or sit at a table with her.

Or, you know, just talk to the student (and her parents) and see what she wants.

Ask over on r/dwarfism . It looks like a bit of a stagnant sub, but I'm sure you will get some replies. ",1,,1,0,0,
65eb3d01-3c5f-4f46-bbd9-7f98ef92e763,1466084900,From what I've been told you cannot do an SSI application online but I do think that you can do one over the phone. I would go into your local field office or call the SSA national number (800 772 1213) and they can give you more specific answers to your questions or they may be able to set you up with a phone or in-person appointment.,1,,1,0,0,
a7638aea-8ad1-454c-bd87-0b61ea001384,1465154941,"&gt; All my duties for that day were done

That isn't an valid excuse for leaving, unfortunately. We all still have to put in the time. That behavior and attitude points to grounds for dismissal. Just giving the real world point of view.",1,,1,0,0,
8718c82e-9fd6-481e-b052-74004cc4caee,1466571396,I'm meaning if they are receiving ISM now and they move to FLA A then that's $600 is going to increase. Also if moving from a non supplement state to one that does then the locality most definitely means there will be a change. It won't change the FBR but an oss is still more money,1,,1,0,0,
de4d48a3-4b6f-45f5-8943-9b854fc442fc,1465631680,"I also plan on working for the government. 

Im studying nonprofits, and park administration. I have an associate's degree. I was planning on transferring to a get my BA, when I finally got an appeal hearing. I wasn't going to sit on my hands, because I was afraid of being denied. 

The hearing went very well, and they said there was no competitive work I could expect to do with my limitations. If I am approved can I continue going to school. I am receiving scholarships from DHS Department of Rehabilitation. 

Just asking, you seem very well versed in this.",1,,1,0,0,
ea4fc196-d231-4d6d-a859-41863eb7d823,1465513929,"Thanks for the correction!  I looked it up, interesting information!",1,,1,0,0,
006537ac-d699-4c1d-8cb7-10347d07182a,1466472351,"I think people have constructed that out of a charitable drive to portray people with intellectual disabilities and themselves by proxy in a positive light (think Goodwill commercials). I don't think showing the so-called ""behaviors"" that occur, or depression etc. would help create a sense of appeal. 
  
It may have earlier roots, but those I'm not aware of. Michel Foucault did write a rather influential book called ""Madness &amp; Civilization"" about the history of the asylum, which for a while as I recall became a dumping ground for many people society did not desire.",3,,3,0,0,
65eb3d01-3c5f-4f46-bbd9-7f98ef92e763,1465988975,"I would look for things like a customer service rep, telemarketer, or a receptionist. None of these are going to be real high paying or all that exciting but once you get some experience doing these types of jobs you'll open yourself up to a lot of other job opportunities. ",1,,1,0,0,
3d8520ea-41aa-4206-9242-a26c8870e4f7,1465346562,"I work with students who are aggressive, have throwing and food stealing behaviors...whatever. I swear by a clip on carabiner clip hooked onto a belt loop. Do not wear a landyard. I've seen people get neck injuries from them being yanked. ",1,,1,0,0,
a82bb553-721a-45e3-a70b-3284a1cb9e02,1466488751,"I'm not sure why you'd want one. It's largely for those on SSI and Medicaid to avoid the $2,000 asset limit. Your posts seem to indicate you aren't on welfare. ",1,,1,0,0,
d917959e-70e5-4339-881e-a4394671c340,1465047187,"I work for Vocational Rehabilitation and yes the ultimate reason for going there is to help you find work.  But sometimes that's how you have to get your foot in the door to access other services.  I'm sure you wouldn't mind working part time but still keeping your benefits.  Perhaps some type of home based employment.  Anyway if you go to VR saying you do want to work that's how you can start the process.  

My VR office in NC has a link to targeted housing options in our area.  So what happens is you get put on a list for subsidized housing and once a unit becomes available that fits your needs you get dibs.  

Also we have a section of VR called Independent Living which helps folks maintain their independence by modifying living spaces to make them more accessible.  Some folks also have a joint case with IL and VR to help provide more wrap around services.  ",2,,2,0,0,
d50d74ec-55db-41d5-906d-598b488b19c8,1467247807,"https://m.youtube.com/watch?v=xLRM0tQmmC8

That should do it ��",3,,3,0,0,
8f064780-0d55-4248-9b31-1018421953ae,1465972595,"There's nothing lighter or more nimble than a Panthera X. 4kg of carbon fiber goodness, the wheels (with rubber!) are 500g each. Absolutely love mine.",2,,2,0,0,
66c6933e-b2b2-453e-b4ec-cbb970926492,1465258415,Yes that sounds simple and it gets the point across without being to hostile. Thanks for the input.,3,,3,0,0,
13f144ec-c421-45fc-b384-949218baebf3,1465570513,"I'm confused. what are you going for SSDI for? hearing loss?

seems that you are working and going to school. 2 things that will make it harder to get SSDI. Your age is not supposed to matter but it does. 

From my experience with SSDI the fact that you are deaf does not matter. that does not keep you from a job. ",9,,9,0,0,
65eb3d01-3c5f-4f46-bbd9-7f98ef92e763,1464894435,"Really no one here can give you a ""yes"" or ""no"" answer to your question because there are so many factors to whether a not a person is going to be granted disability. 

The two biggest factors when it comes to disability decision (outside of the medical evidence) comes down to a person's age and what their past work (in the last 15 years) is. You're mom being 62 is a good start as a person's chances of approval go up significantly after the age of 50. What kind of work does she do? If she has been doing more labor-type jobs (anything being on her feet most of the day) she has a better chance of approval than if she has done sedentary/desk work.

You say that she has only been out of work for a month. Has she been getting treatment for the vertigo? Has any of it helped. Part of a disability determination is also that the condition has to last (or be expected to last) for at least 12 months. So if the vertigo is a relatively new thing they may give her an ""E3"" denial which is basically saying ""you're bad now but its not expected to keep you out of work for 12 months"". I know you mentioned the other conditions but if she had been able to work despite them (DM is controlled with meds, TN only causing issues a few times per year) then those will likely not be enough for an allowance. 

If you're mom is considering applying for disability then she needs to start the process sooner rather than later. It can take 3-24 months to get approved benefits (if she is approved). As far as the short-term financial needs she needs to look towards  state assistance (some states have LTD programs). Call the united way (2-1-1) to ask about any local programs as well. Even if she applies for SSDI today and is approved tomorrow there is a 5 month wait before benefits start. ",7,,7,0,0,
1837e361-dfc4-4968-8780-6d62d0eaf23d,1467243083,"Was asked something like this at the doctor's office today.  I said reading, gaming, and internet.  If I were in your situation, I might try to get in some walking every day or two.  ",1,,1,0,0,
25de61f5-906d-4406-b4c3-e611383b0079,1466571145,"It is probably too late to claim you are roommates and unethical.  You may be out of luck.  I had a fraud SSI case once where a couple got divorced to qualify for SSI and even had a separate trailer for the husband.  They got caught because he brought her to all her appointments--a fact that ended up in many of her medical records.  She lived with sever disabilities and his income wasn't much, but they lost big.  This was about 10 years ago, but I imagine the system hasn't changed.",1,,1,0,0,
7a2918a8-38e5-43af-a785-466b78ee93f2,1465171532,"Concepts such as good and bad pain days, checking in with your friends about their energy levels more frequently. Just generally being more aware of how much physical exertion any activity at all will require.",4,,4,0,0,
027a1edc-29da-4b66-aaf2-22f18a400f4e,1466713331,"I know what you mean. Still the only thing that's going to save your ass is ~~training~~ *you, and therefore,* the training you've got. The last thing you want, in that situation, is to find out on the spot what you can or can't do to protect yourself. You want to learn all that beforehand. I know a young woman with one leg and no mobility or sensation in either hand whatsoever. She broke her arm on Tuesday and on Saturday she hobbled into a rifle range and shot perfect tens for two hours, cast and everything. Now that's the sort of thing that ought to be physically impossible, but people can be surprising. Someone tries to pick her off as an easy target, they're gonna be surprised. You might surprise them too -- might surprise yourself even. In any case, if you're really concerned for your safety then *there is no substitute for training,* no matter how dumb it might feel or how pointless. Is it going to be harder for you than for other people? Sure. You're used to that by now, right? So get in there. Get some reps and learn hands-on, and ask the professionals if there's something else you can be doing for safety. There's reading and there's learning. We're talking about something that *must* be learned, or it's pointless.

edit: 'pointless' is putting it too strongly. You really want to know these things deep down, is what I mean. ",1,,1,0,0,
65eb3d01-3c5f-4f46-bbd9-7f98ef92e763,1466767895,"i believe your income is going to be excluded from the asset limit unless that income then converts to savings (if that makes sense). So if you have $1900 in your savings account and get your check (putting you at 2620) but you then spend 710 on your expenses for the month (leaving your savings at 1910) you will still be under the limit. But, using that same month, if you only spend 500 on your expenses that will leave you over the asset limit at the end of the month (2120).

Social security is endlessly complicated; SSI is even more complicated due to the resource restrictions.  [here](https://secure.ssa.gov/poms.nsf/lnx/0501110210) is a link to a general chart of excluded resources (from which you can get to other POMS sections dealing with each specific thing). 

If you are worried at all about going over resources I highly suggest that you contact someone at SSA to discuss your situation or a local benefits planner who can discuss the specifics of your situation in a way that the anonymity of reddit does not provide. ",3,,3,0,0,
37f84417-f829-4671-99d3-7ee8393787ad,1466065756,"I really want to second this and emphasise the importance of providing reassurance and empathy when expressing your frustration. In my experience, some of the most crushing and heartbreaking moments of my life are when I feel unbearable guilt for my disability affecting my relationship. If you can make sure that you are sensitive about this then I think it will help your communication about these issues both now and in the long-term. ",2,,2,0,0,
0a6db910-af33-491c-9fb5-7e0362c01de5,1465702804,"733 is better than nothing. Aren't neurologist brain doctors? I'll make a post tomorrow to ask specifically which doctor i should see. 

I use to have migraines as a kid because I needed glasses. I have newish glasses, but I still use my old ones and save my new ones for a rainy day. Should I be using my newer ones?",1,,1,0,0,
e377350e-ab18-48e4-a205-ff0b778257de,1466920217,"Go straight to your nearest Vocational Rehabilitation center and get some help.  They will tell you everything you need to know how it will affect you, and May help pay your way through school.",1,,1,0,0,
ebd9abbb-6073-4fb1-a281-5b2e3bf9282b,1466646765,"They don't really care if you could reinjure yourself only that you can currently perform it. The second rule is can you be retrained to perform a different job. Age and education are the most important factor in that one, at 50+ they're probably not going to expect you to find a lower impact job, at 32 they're probably going to find you fit to take a low impact job for an office or call-center job, even if it pays substantially less. ",2,,2,0,0,
d43ea476-9a65-4aa9-8133-c4b9e5b6ea8e,1464933123,"Benefit advisor here, My experience with them is that they are mainly interested in earing money from the federal government by pushing folks into the work force and getting them off SSDI/SSI. My belief is that they'll push folks into any job, just to meet milestones set by the feds. Once you meet the goal, they get paid. But they don't care what happens to you in the long run. If you've lost your benefits because of work, it can take months to get them back. I would be careful because finding and keeping a job is a very difficult process. The work incentive rules can be very helpful for folk to increase income but its you who will suffer if it doesn't work out. If you want to explore the idea of joining the work force, contact your local Center for Independent Living. they offer all the support and guidance you may need, for free.  Check out my past comments for more information.",12,,12,0,0,
bc83942e-59b3-4c09-8671-15b514d00400,1465051872,"A simple ""I'm disabled,"" not a curt one, can quiet them down without necessarily knocking them down a peg.  It's an honest answer but doesn't necessarily encourage further questioning.  There is the possibility people will ask you if you need help, which is up to you.  

Personal anecdote: as I've struggled walking (fibro, asthma, decreased stamina because of other health issues) I've only ever gotten weird looks.  No one has asked if I'm OK.  So I agree with you that even though it's unwanted, it is a caring gesture we probably need more of.

I also agree that it might be worth looking into mental health care while you're in this limbo.  Losing your capabilities without a definitive answer as to why (AND knowing what one of the possible answers could mean for you) is stressful as hell, and it might help to be able to talk about it somewhere safe.",1,,1,0,0,
ad42a842-27f0-4778-966d-f4e0aa02557b,1467302953,"I know someone who reacted to her disabilities in a similar way, mostly because she has such an independent personality and her disabilities forced her to be dependent on others, which makes her feel very vulnerable and sorry for herself.  ",1,,1,0,0,
4b7c971e-08f1-45bf-9f3d-328e7f15e005,1465542741,"No. They are just trying to tell you that if you think you can work again in any capacity they have ways to help and support you if you try.

You got accepted so the benefits are yours unless you are committing fraud in some way, your condition radically changes, or you start earning enough money to support yourself working in some manner.

Source: I have spent half of the last 15 years on Social Security Disability and just had my own ""review"" last summer. It took about an hour of my time and then two months of waiting just to tell me what I already knew. My condition has not changed and I am still forcibly retired due to permanent disability.

Take a deep breath and relax. This happens every X number of years.",2,,2,0,0,
0af0e878-460f-487e-8121-b47823c4dd94,1465570757,"The worst experiences I have had in the entire terrible experience of getting disability have been the people that work for the government body overseeing disability support; they seem to treat every case that walks through their door like a liar looking for a hand out and are immediately biased against you. Like you I was younger and was initially denied, and I think my age played a factor as well. 

Going forward, you have several doctors  on your side and, while I don't know the structure of American Disability Appeals (Canadian) I was able to get the paperwork of my denial back and used it in my own appeal. If you are able to find legal aid that will help too. Again, I don't know the American system so I would research as much as you can. 

Keep strong, the bureaucrats in the system are the worst part of it and don't give up. ",3,,3,0,0,
a82bb553-721a-45e3-a70b-3284a1cb9e02,1465878180,SSDI and SSI have the exact same disability requirements. Their differences are financial. ,4,,4,0,0,
65eb3d01-3c5f-4f46-bbd9-7f98ef92e763,1465492454,most lawyers will not take on your claim while she is getting benefits. they have no way of making money. just go through the CDR motions and see what the decision is. IF she is ceased make sure you file for an appeal right away (benefits can be continued during the appeal) and then consult an attorney.,2,,2,0,0,
e9129e83-1f21-49e6-98f1-cdeef4b5a4fa,1465472332,I know a big part of the problem is I can't get my doctors to take me seriously (except my psychiatrist). They all act like nothing is wrong with me and I'm complaining for no reason. I went to the ER a few months ago admitting that the pain was so bad I wanted to kill myself. The doctor who came in to see me told me I just need to deal with the pain and discharged me. I told them I was suicidal and they literally did nothing. Every other doctor I have seen has had the same attitude.,1,,1,0,0,
dde92d08-c75e-4367-bce1-014b871cd631,1466400629,"I've looked at east coast, and though affordable, I feel like is too far away from any family in case something happens to me. I may reconsider as a last resort for sure. ",1,,1,0,0,
a82bb553-721a-45e3-a70b-3284a1cb9e02,1465713852,"Neurologists treat conditions of the nervous system, including brain, spinal cord, and peripheral issues as well. Always wear your most recent prescription glasses. Hold the old ones just in case they break so you can get to the eye doctor. 

If I didn't already I'd recommend seeing an ophthalmologist soon. This is different from an optometrist in many ways. They can see and even diagnose certain ailments. 

I agree $733 is better than nothing, but you could earn more working 30 hours a week at minimum wage. If the doctors can get some treatments in place, you'd be far better off if you can work.",1,,1,0,0,
89daaaf1-69a7-4eec-ab02-ed716a6f90d2,1467319588,"The school is probably majorly regretting that decision now. There is always a risk of people just bringing pets in to take advantage of the ADA rules, but that is bound to happen. I've seen plenty of uplifting stories about other schools allowing service dogs, so there may be more stories like this one which don't get enough attention because they may be considered ""negative""",2,,2,0,0,
48aa8e29-c585-4b0b-8c48-7f063b9c4b8b,1466005700,"Agreed.  Consider spending it on paying your rent ahead, and things like that.",4,,4,0,0,
65eb3d01-3c5f-4f46-bbd9-7f98ef92e763,1466702182,"I am trying to be helpful, but unless I know what they said to you (ie the reasoning that they are giving you) then I cannot really give you good advice. If you cannot look past how you felt they treated (whether true or not) you to listen to what they are saying then I am not surprised you are getting nowhere with the agency. Not everybody is always going to treat you in the way that you want to be treated but that doesn't automatically negate any good that they are doing for you. 

I used to do community supported employment which was really similar to VR and I know a lot of VR workers. Based on your responses here is what my best guess is: you have a particular type of job in mind that you want to do and what they are offering you is nowhere near that? Or they want you to do training or education that you feel is unhelpful or beneath you? Their job is to help you find and maintain employment. That help can come from job evaluations, educational development, and helping get interviews. Their resources are limited and they do the best they can with what they have. Their available jobs are mostly going to be unskilled positions and jobs that nobody would be excited to have. But, guess what, its a job and its a start towards building your resume to what you really want to do. ",5,,5,0,0,
04b1921e-3a83-4199-8d0d-e5597bda1210,1466566908,"Maybe it came from my daughter.  Just kidding. 

My 25 year old daughter with cognitive disabilities s very affectionate and loving,  though in many ways she has the understanding and skills of a 3 year old. 

The other day she was with me while we were buying a bottle of wine, and she says hi to the clerk,  and then says to him ""I love you"".   He was cool about it and I told her not to say that, that she did not know him well enough. 

But that kind of thing happens about once a week with her, and in between she gives lots and lots of hugs to every friend, acquaintance and occasional stranger.   It can be a bit weird, but its never caused a problem.    Almost always it seems to make someone's day. ",1,,1,0,0,
094949ea-cd02-4f57-af3d-f1d7d50c5072,1466120445,"A lot of antibiotic therapy from my doctor, as we found that only certain antibiotics (Doxycycline and Augmentin) would get rid of my symptoms by 98%. However, as soon as I went off them I would get symptoms again. Elmiron doesn't work. Uribel doesn't even work as well as Azo (which only decreases pain by 20%). I have taken so many things recommended by people in my IC group (marshmallow root, desert aloe, baking soda, apple cider vinegar). I even got desperate and tried homeopathy though I don't believe in it. I have removed all acidic foods from my diet and only drank Fiji water for months. All of this controlled/not at the same time with help from my GP, since he's the only one who seems to believe me. I had a VCUG done, pelvic and trans-vaginal ultrasound. I have no endo and everything looks good. I have not had a cysto/hydro because my urologists refuse to do it for some reason.. they keep pushing silver nitrate/DMSO instillations. I refuse to have them because they can permanently damage the bladder and I do believe one day will be a cure. It's frustrating because no one knows what causes it, and right now all we have are treatments that don't really seem to work for 95% of people with this ""disease"".

Right now I'm taking a strong probiotic, and some Eastern Medicine that tastes like dirt that I got from my SO's parents who are pharmacists in Korea. I'm sure I have missed a lot, but honestly this past year has felt like 5 years.",1,,1,0,0,
