commentator_id,created_utc,anonymized_body,ups,downs,score,controversiality,gilded,distinguished
65eb3d01-3c5f-4f46-bbd9-7f98ef92e763,1466556199,"I am not agreeing that it is fair but the government has some good reasoning. One of the biggest fraud problems with medicaid/SSI is with people mis-representing their living situations  in order to improperly receive benefits. People will say that they are divorced when they really aren't, they will say that they are separated and not living with their spouse when they really are, etc. 

The theory is that living together as a couple implies a higher level of ongoing support that is not found with non-partners. If I live with a roommate and don't have a way to pay rent *most likely* that roommate is going to kick me out for not paying my share. However, if I have a partner and I have no income they are not likely to kick me out due to our relationship status. Roommates implies that everyone pays their fair share whereas partners implies support. Drastic example: one partner is disabled with no income but lives with their partner who makes $150K per year. Should that individual be allowed to draw on benefits that are only supposed to be for those with less than a few thousand dollars in assets? Clearly, as a partnership household, that disabled individual could be supported. 

Personally, while I think there is some level of unfairness, it is something that the government needs to do. All of these programs are  under intense scrutiny by the political right and their funding levels are dangerously low. Sure, you could just say that your boyfriend is just a roommate and likely keep your services. I will never advocate for lying to the government about things like this (if caught you'll be in for a whole world of hurt) but it is something that a lot of people do. ",1,,1,0,0,
65eb3d01-3c5f-4f46-bbd9-7f98ef92e763,1465115379,"I feel like there is some missing information here. WHY were you actually fired? It sounds like your main issues were with your coworkers and not your boss. 

Based on the story above it sounds like you were fired for leaving mid-shift which, depending on your work rules, is frown upon regardless of your medical conditions. ",4,,4,0,0,
81df23f5-c32e-4249-bcde-61b38bf83909,1465218830,"Medicaid does not cover a nurse unless there are nursing needs. None of what OP is describing requires a degree. They do cover paid caregivers who assist with mobility, ADL's, housekeeping. There has to be a needs assessment via DHSH showing that the person requires a paid Caregiver. Just being on Medicaid isn't enough.",1,,1,0,0,
e3e53770-bef0-4fb5-91eb-bbaf31befafa,1466552381,"Well, you know how you can save for retirement in a 401k, and a Roth IRA?  This has the same tax treatment as a Roth IRA (actually better considering most states will give you a tax break on contributions).

I look at it as extra 'tax advantaged' space (for those disabled before the age of 26) to save money for the future.  When you sell stocks and spend money from this account, the gains are not taxed.  Money in this account also has extra legal protections.

It does have some restrictions on what you can spend the money on, but they are fairly generous.  If you'd like to know more I encourage you to read the wiki link in the OP.",1,,1,0,0,
ea4fc196-d231-4d6d-a859-41863eb7d823,1466398150,Great!  Good to know they are protecting students' confidentiality!,2,,2,0,0,
48aa8e29-c585-4b0b-8c48-7f063b9c4b8b,1466008600,"Thank you for the program link.  

I don't feel right doing that.",1,,1,0,0,
c29f2422-a9ca-48db-b496-6cd30e55176a,1465702793,"Call center, receptionist, data entry, social media...
",1,,1,0,0,
400f3472-f749-43d1-901f-177f881a10a3,1466005461,"If you actually follow that and report everything, you're doing a great disservice to your personal progress.  Of course you could put it into one of those ""monitor me and my money while I save towards this specific goal"" accounts but that's pretty much a waste of time.  You can't even have savings bonds without being forced to cash them in.  It ""counts"" but it doesn't count.",1,,1,0,0,
98025a74-8b98-4666-917c-20b9fce19ad9,1465973832,"Hello, /u/d30a9d8e-c464-4fca-97e8-e6841616d205. 

Your comment has been removed because:

You violated the following rule of /r/disability.

&gt; Rule 4 - [Message the mods](http://www.reddit.com/message/compose?to=/r/disability) before posting a survey. Any unapproved survey will be removed. Surveys are also required to be in a self-post which must include information about the survey, the surveyor, the data being collected, and how the data will used. 



---

If you have any questions or concerns, please [message the moderators](http://www.reddit.com/message/compose?to=%2Fr%2Fdisability&amp;amp;subject=About my removed submission&amp;amp;message=I'm writing to you about the following submission: https://www.reddit.com/r/disability/comments/4n98yd/deaf_herewanting_captions_on_airplanes/d47i5c4 %0D%0DMy issue is...). *Direct replies to official mod comments will be removed.*",1,,1,0,0,moderator
48aa8e29-c585-4b0b-8c48-7f063b9c4b8b,1467061909,"I am not a doctor.  I did, however, have my L5/S1 vertebrae fused in May 2015.  In May 2016 I was given one final x-ray and told that I'm done healing.  

&gt;The doctors are saying I have a year window of healing and then whatever isnt healed is most likely not going to...

This seems correct to me.  Why not wait until you hit the one-year mark, and then apply for SSDI is chronic pain is something that you still struggle with.  I feel like if you apply now, you'd just be told, ""But you're not done healing yet.  Wait.""",2,,2,0,0,
e73372c3-53cb-4a43-ba62-88cb6eae4910,1464919201,"Check your Disability Benefit rules about Permitted Work, there may be a cap on the hours or weekly wage that may or may not affect that benefit.

In UK I have unlimited permitted work with Disability Living Allowance as long as said disability does not contradict the work you're doing.  I'm also on Employment Support Allowance, that's a lot more strict as that allows up to 4 - 6 hours a week and earning up to £20 per week, again provided work dosent contradict any physical or mental illness stated on any written form, doctors notes or anything else.

Voluntary work may be unlimited provided that don't contradict any physical and mental illness or disability.

I wouldn't know anywhere else in the worlds welfare rules about permitted work, though may have a variation on this.",2,,2,0,0,
65eb3d01-3c5f-4f46-bbd9-7f98ef92e763,1466615756,"While the POMS you cited does cover the instances surrounding the loan I would still use extreme caution. What you don't want is that it will mess with your SSI payments while they are doing all the paperwork and figuring out the logistics of the loan. That kind of stuff can take months for the paperwork.

If you insist on loaning someone money at least make it an oral agreement and cash transaction so at least it won't really ""be on the record"" especially if its a low (lets say &lt;$200) amount. The only foreseeable problem would be if they ""default"" on the loan and you take them to small claims court. At that point, in theory, it could get back to SSA. 

I know you say that you don't care if you see it again, but, honestly, with such a small amount of income you receive you should not be lending money to anyone.   ",3,,3,0,0,
c5765dd7-d95b-4bf1-9398-201e631ea9c9,1467296653,"Can you be honest and just say that your depression makes doing anything quite difficult? 

I just had a depression attack (mine comes and goes quite sharply now that I'm on meds)  and it was crazy how I just couldn't do *anything*. I couldn't even watch TV because I couldn't be entertained. I just laid in bed, hoping I'd fall asleep. 

Anywho, depression is quite debilitating in itself. I think it's fine to just say you're depressed, and finding it difficult to do anything other than lay in bed. ",3,,3,0,0,
5fd5dee1-e998-4e91-aee9-a4d85bf387dd,1466818752,"I think it's pretty cute and definitely a positive thing, even considering it came from Tumblr. I consider myself cpunk actually, haha! It's just a fun way for me to feel good about using a cane at 21 years old.",7,,7,0,0,
4d03e75b-1c17-46c1-8ca6-048c974f3270,1466111349,"I agree with you, I find most disabled communities drowning in self pity and waiting for the next article/term to get offended by.

What I will say is kinda ironic, since I'm writing this in a disability community subreddit, but I think that, ultimately, we don't need a community, everyone of us is fighting a different fight, we have different reasons to do what we do.

IMHO, when you have a disability, you gotta know your limits first, acknowledge your weaknesses and work on improving on them, you don't need to do something that you physically/mentally can't do, but it doesn't mean that you can't do something else, even excel at it.

I must admit that I don't have experience with depression, but I've been physically disabled since birth, and that's how I look at it.

",8,,8,0,0,
f98011f2-b5f0-4de6-bb28-b0e64a652ad9,1465944390,"I removed a line that basically said 'if you'd rather be homeless than work a desk job, you've clearly never experienced the shit show that is homelessness' once I realized, from his other posts, that he actually appears to be experiencing homelessness now. I felt shitty about it since I've been homeless before as a kid and it sucks.

Nevertheless, it makes the whole don't-want-to-work-that-job-ra-ra-homelessness mentality doubly baffling to me.",1,,1,0,0,
4bf3a028-2408-429b-98da-35b2148745ee,1465945120,"Too late to die young/Harriet Johnson

A leg to stand on/Oliver Sacks

Loud in the house of myself/Stacey Pershall

Born on a blue day/Daniel Tamett

The short bus/Jonathan moody

A great place for a seizure/Terry Tracy",1,,1,0,0,
e9129e83-1f21-49e6-98f1-cdeef4b5a4fa,1465911973,"Everyone I have talked to says it takes years. I wish I had applied sooner but I keep thinking my health might improve and was in denial about actually being disabled. It doesn't help that most of my doctors kept telling me that being in constant pain is really a problem and there's nothing really wrong with me.

I'll see if my primary care doctor is willing to help, unfortunately all of the specialist I have seen have not been supportive at all so I know they won't help me. ",1,,1,0,0,
02d0222c-f8d7-4c37-b234-38d0b8c36503,1466836901,"How about: ""Call be by my name, because I'm an individual who, as all Humans, wishes not to be reduced to a single aspect of my circumstance""?",6,,6,0,0,
a17492ed-91bc-400e-8830-698a1b0f04c2,1465259237,"""That's the rudest thing I've ever heard, I'm surprised your family lets you be seen in public with such appalling manners.""

I'm confused as to why speaking up for your client would get you fired, but I don't know your employer. If I had been there (as myself, the busybody old lady whose husband is quadriplegic) and I heard her say that to you, I'd have gone ballistic, possibly belted her.

 At the very least I would have pointed out that he was doing no harm to anyone, unlike her, and that he and you had every right to enjoy your meal in peace like any other paying customers. That much I think you could probably get away with as well.

The hard thing in these situations is always the shock and disbelief that makes it so hard to compose a response. You're doing the right thing by working on it in advance. If you never need it again, so much the better.

",8,,8,0,0,
48aa8e29-c585-4b0b-8c48-7f063b9c4b8b,1467058984,"I've been through this.  I can't tell you, even if I did know your diagnoses, what the odds are of you getting approved.

I know that it took me five attempts and almost three years to get my SSDI.",1,,1,0,0,
65eb3d01-3c5f-4f46-bbd9-7f98ef92e763,1466766801,that was my thought too but I've seen stranger things. It could be a DLI claim on their own SSN or a CDB claim based on a parents SSN? ,1,,1,0,0,
81a2f3db-9008-4a29-9b00-2aa59e658413,1467293392,"do it! even if you don't have their approval. it will take time for them to come around but once they see you're independent and successful, they won't doubt your ability level.    
    that being said, accept as much help as you can. living independently with a mobility impairment can get frustrating. ",2,,2,0,0,
a506c97a-9ebd-4c8c-9cfe-a61788847d15,1466825605,"Word. Tumblr is cancer, and your disability doesn't have to be the core of your entire personality and self concept for you to want help for it and acceptance with it.",3,,3,0,0,
48aa8e29-c585-4b0b-8c48-7f063b9c4b8b,1465854231,Same.  I could have written that myself.  ,1,,1,0,0,
10165881-04e8-4639-a82a-36be64a041db,1466615161,"I agree with points a,b, and c! haha it's a dire circumstance of someone dear to me so nothing regular by any means. And if I never saw it again it's ok, like I said it's monthly I use, this'll come from savings which has been whatever small amounts are left at the end of the month. 

I found this - https://secure.ssa.gov/poms.nsf/lnx/0501120220",1,,1,0,0,
d72a06f6-f38c-4394-a6f1-71cad849ec7f,1466704725,I think? I was in a pretty long psych hold but the insurance quit paying and I basically robbed my parents of money so I got out really fast I didn't really have time to set up anything but they gave me some medication but it only lasted a month and I don't think it was really helpful but from what everyone seems to be telling me going to see a psychiatrist or a doctor is probably the first step,1,,1,0,0,
804282ab-83ad-4cb6-84b9-cce1f563499b,1465479728,"I wonder how many people who consider themselves disabled and are a part of this sub use crutches instead of other means of transportation. Of course, if you mean people who only use crutches in a limited capacity (e.g., to get to and from their wheelchair) then you may have more luck. ",1,,1,0,0,
a41c71b6-b73c-41b9-a571-ef4c4656422a,1464817184,"I really do appreciate the advice and thoughtful post. I am doing all i can to get things documented. My most current worry is taking care of all my health insurance stuff due to turning 26 and being off my parents insurance as of a week into the new year. Sure some state insurance would help however sorting through it is a lot of effort when i barely have an hour or two of true ""free"" time to myself a day. My meds with insurance covering most of the cost are over 100 a month. I have no way of paying that when im making less than  $1100 monthly as gross income. Hell the psychiatry appointments and therapy take a good chunk out too.  And to top it all off i dont have the energy for this process much less work and what little life i have otherwise. Not being able to complete the application is more proof of my dissability than completing it.",2,,2,0,0,
9beb3a68-ca77-4c4a-b070-f9134a450038,1465875524,"Hard to say for sure. Honestly, it will depend a lot on your age and past work. You certainly have issues that impact your ability to work just remember if you apply the rules look at if there are any jobs in the national economy that you can reasonably do. 

Just be sure if you do apply to document how much you are able to do/not do as clearly as possible. ",3,,3,0,0,
4b427d9c-8e3c-40b7-911c-1296ac9a42cb,1465952301,This is why we will never have a community. Always ripping each other apart.,1,,1,0,0,
400f3472-f749-43d1-901f-177f881a10a3,1466008397,"[This is one such program.](https://www.theindependencecenter.org/wp-content/uploads/2015/09/The_IC_Fast_Facts_-_ABLE_Act.pdf)

Visit your local center for independent living to see what other options are available.  Others involve bigger goals, like saving for a down payment to make you eligible for a grant to buy a house.

They aren't going to show up with ""cash in the mattress detectors"" or query your bank account.  Financial privacy laws prevent that from happening.  If you have to show a bank statement; just print out the short form at an ATM that doesn't show transaction history.",1,,1,0,0,
aae7c254-aa01-4ce4-83ba-64398c3b7be8,1465342210,"First off, doing nothing is okay. As horrible as it might sound, you getting fired or disciplined or even just banned from taking him (or other clients) out is going to have a much deeper impact on your client than some rude old woman. Plus, in my experience, people like that woman are very closed minded and not easily educated. 

As others have said, if her words didn't seem to disrupt you client, you getting mad at the woman might have, then his outing would have been

But, I also understand the need to say SOMETHING to people like that, or wanting to completely burst. Perhaps something like ""We are not disrupting anyone, so can we please get back to our meal."" Or, ""We are paying customers, we are allowed to be here.""",2,,2,0,0,
46699cef-90bf-4cda-9936-790c1575cda4,1465285959,"I'm with you. I am a para and I have read the book. I actually really liked the fact that the guy still chose to die at the end. He had made a rational decision based on his situation and how he felt about being a quad for the rest of his life. The fact that there wasn't a warm and fuzzy Hollywood ending that he was now going to be quite fine now someone actally liked him despite his disability was really good and showed that his decision had been correct for him.


Being paralysed sucks a lot. I can't even begin to imagine how a quad would cope, shit I have days when I wonder if it is all worth the hassle and I am fairly independent. The one bright point of a spinal injury is that it mostly doesn't get any worse, and I don't have to try to guess at what point I need to make the hard decision of suicide before I am incapable.


My dad had a particularly nasty version of MND - with rapid onset aphasia, a version that destroys your ability to communicate faster than it destroys the body. Having watched that I cannot  do anything but wish you all the best, I hope your trip is still a long way away, but I completely understand that choice. Internet hugs from a stranger x",3,,3,0,0,
aae7c254-aa01-4ce4-83ba-64398c3b7be8,1466044264,"It really depends on the person - their needs and wants. I LOVE my TiLite ZRA and everyone that I have talked to that has nothing but praise for TiLite. What I like about mine is the weight - it is so light. I've had mine for 3 years and I have yet to have an issue with it.

My tip would be to try to find somewhere where you can try out as many of your options as possible.",2,,2,0,0,
75fca0a7-cdab-4337-940c-04201c9f663c,1465041193,Totally agree! I'm working on adding some in my area. ,1,,1,0,0,
65eb3d01-3c5f-4f46-bbd9-7f98ef92e763,1466166809,"I think that the availability question will naturally come up in the interview especially since it is a part-time job. If I were you, I would shy away from telling them that it is your medical condition affecting your availability. I think that this might scare them off from hiring you; I say just leave it as vague as possible and focus more on the strength of your schedule flexibility. Most part-time employees are students or parents of young children. I think you'll look better if you say that, while you can only work 20 hours per week, you can work any schedule/shift that they need. That will be more important to most employers than why you are working part-time. 

Only bring up your medical condition *after* you've been hired. And even then I would only bring it up if it is going to affect your work in any way or you need some sort of accommodation. Especially at the beginning you want to keep this information to yourself until you know that you can trust your boss/coworkers and you've had a chance to prove yourself as a good employee. ",5,,5,0,0,
be8e6b44-ea50-4734-bf04-1a81cc30f559,1467055148,"Your submission was automatically removed because you linked to reddit without using the ""no-participation"" np. domain. Reddit links should be of the form ""np.reddit.com"" or ""np.redd.it""

*I am a bot, and this action was performed automatically. Please [contact the moderators of this subreddit](/message/compose/?to=/r/disability) if you have any questions or concerns.*",1,,1,0,0,moderator
e377350e-ab18-48e4-a205-ff0b778257de,1467060414,"I got on first time I applied.  Didn't have to reapply many times with the hope someone would make a mistake and finally put me on.  If your truely handicapped, go into the hearing with all the newest data you can get.  Since you said hearing instead of appointment that suggests to me you have gone through initial, and reconsideration, now your going to a hearing with the judge right?  ",1,,1,0,0,
8678158d-3ddc-4920-ac29-98f574855a46,1465261857,"&gt; A person with a spouse or significant can lose benefits because the state decides they are living off the other person.

Which is dumb, considering that double income is almost required to be out of poverty nowadays.

MI does have a ""Home Help"" program that pays my family some money (not much - less than max SSI per month) for helping me with ADLs. There's also respite options, which pays out-of-home family to ""watch"" me instead of my parents. (Normally respite is PCA, though we have ""family or friends"" options.) 

I really should have remembered these things the first time I posted...

/u/ccc69fa8-be77-471f-8843-5a8be946b84d, try to find things like I just mentioned, if you can. Maybe call Medicaid to see if they can get you in touch with a social worker or the like. Voc Rehab might know where you can get help, too, even if your goal isn't to work (that is, they might have phone numbers to other agencies). There's a non-profit around here that helps you with navigating the system, in the spirit of maintaining a disabled person's independence; perhaps your area has the same? Without knowing *where* in MA you are, it's hard for me to Google that info for you.",2,,2,0,0,
a17492ed-91bc-400e-8830-698a1b0f04c2,1465265926,"OP, you should Google ILRU, and look for your local Center For Independent Living. They will help you navigate the system in your state. ",2,,2,0,0,
46699cef-90bf-4cda-9936-790c1575cda4,1465710348,"If someone pushes me either without asking or after I say no, I just stop one wheel, spin on the spot and try to run them over whilst swearing loudly at them :) 


Amuses me and gets the message across fairly easily.",3,,3,0,0,
e4bbe09b-8408-468c-9b41-46aa15fb2a18,1465617663,"You do not need SSI to get Medicaid, however if you are eligible for SSI, you are almost certainly eligible for Medicaid. Medicaid eligibility may vary depending on your state (I think - this is not my area of expertise). 

As far as hearing aids and cochlear implants go - well for Medicaid it would depend on your state. It appears that (per Google) Medicaid coverage of hearing aids depends on state, but more often then not they do not cover them. That's pretty shitty. Although, it appears that Federal law mandates that all states offer cochlear implants through Medicaid to people 21 and under and some states' Medicaid plans also cover it for adults.",3,,3,0,0,
74d8fb3a-baf6-4ad4-8366-67677edc5c7c,1465197173,"Those who are disabled are at a high risk of experiencing stigmatized situations. Also, spontaneity is not a luxury afforded to most who are disabled as planning for the purpose of access, medication, medical aides etc... is required. ",5,,5,0,0,
125268e4-c8cb-456a-8260-daca8f031df2,1464978099,"I sounds like you have a really good chance at getting it to me. I'm sorry that you are going through so much, I can understand why your disabilities are terrifying. My grandmother had a lot of breathing problems and she would panic a lot if we were not close by to make sure her oxygen tank and back ups were on hand and ready for her. I just wanted you to know that the fear of that kind of stuff is actually normal and I'd be the exact same way if I were in your shoes. I wish you the best and I have my fingers crossed for you that you get it.",3,,3,0,0,
65eb3d01-3c5f-4f46-bbd9-7f98ef92e763,1467120805,"Oh now your question makes a lot more sense. I may have read too much into your question and made assumptions about what you were asking. Most question on this sub revolve around SSI/SSDI eligibility. 

As long as you have a doctor willing to certify your condition as a disability (for work/ADA purposes) then you can consider yourself ""disabled"" for employment purposes. This will open you up for ADA accommodations, schedule A hiring with the government, etc.

From a practical standpoint, there are pros and cons to self-identifying as a person with a disability when you are looking for a job. From my experience, unless they specifically state that they are looking to hire people with a disability I wouldn't bring it up. In my experience it is more likely to hurt your application. While they can't discriminate in hiring it can, subconsciously, put off some employers. Accommodations can be time consuming and costly and they may fear that you'll need FMLA often which puts the work burden on the rest of the employees. ",1,,1,0,0,
98025a74-8b98-4666-917c-20b9fce19ad9,1466918664,"Hello, /u/78e98e42-0fee-4132-99d8-5a53b392a97d. 

Your submission has been removed because:

You violated the [site rules](https://www.reddit.com/help/contentpolicy) on

&gt;[Unwelcome Content](https://www.reddit.com/help/contentpolicy#section_unwelcome_content) 



---

If you have any questions or concerns, please [message the moderators](http://www.reddit.com/message/compose?to=%2Fr%2Fdisability&amp;amp;subject=About my removed submission&amp;amp;message=I'm writing to you about the following submission: https://www.reddit.com/r/disability/comments/4psqhm/possibility_of_a_new_physically_disabled_inmate/ %0D%0DMy issue is...). *Direct replies to official mod comments will be removed.*",1,,1,0,0,moderator
