commentator_id,created_utc,anonymized_body,ups,downs,score,controversiality,gilded,distinguished
a17492ed-91bc-400e-8830-698a1b0f04c2,1459318599,"OK, I'm back. First, you're in a transitional period right now, those are the hardest because you have to figure everything out new. Also, he's still physically traumatized and more fragile than he may be later. My husband has been a wheelchair user his whole life, but his disability is progressive, and he's had other traumatic health problems as well, and each new stage was most difficult at first, then it eases up as you get things working.

If your husband has a power chair, that's great, and your next goal is finding a wheelchair accessible minivan or some other method of transport that allows him to stay in it. You saw today how inadequate a manual chair is for his needs. Depending where you live, buses or cab companies may be accessible, but having your own vehicle helps a lot. At this point it doesn't need to be driveable by him, which is a little cheaperc

The hospital's lack of access is appalling, and your rant is spot on. As they say in the movies, keep that anger, channel it, use it to push for change. As for bathrooms, I've seen the inside of more men's rooms than I've cared to. Just go in boldly, but pointedly *not* looking at anyone standing at the urinals. Head straight for the big stall and get in there together. It's clear you're there for a good reason, so no apologies.

If he's driving a power chair, you'll be able to carry things, and so will he, in a pack or on his lap. People will tend to move out of his way, but not yours, so tuck yourself in behind when it's tight. The phrase to remember for when they don't is ""Watch your back!"" It's much more effective than ""Excuse me"" though you can use both together if you're feeling polite.

Having spent so much time in the hospital, I'm sure you've observed nurses vary greatly. Learn all you can from the good ones. I won't talk about the others. You shouldn't have to be responsible for all the care, but being able to do things will give you more privacy and independence as a couple. 

And yes, you're going to have to rearrange the world, or at least the part of it you occupy, to fit a wheelchair. (I assume you're already working on your home, for when he gets out of the nursing home. ) Just go ahead and do it, and don't put it back. If a waiter sees you, and has to physically undo it after, he's just learned what to do for the next guy. If a building has deliberately and unnecessarily blocked access, it ain't blocked anymore!

Sometimes I do this with a cheerful smile, sometimes with an angry glower, occasionally I go ballistic if it's really egregious. And sometimes I cry, but not lately because we're in a ""used to this"" stage right now, thank goodness.  Your husband has a lot of healing and adjusting to do in the months ahead, but so do you, and you need to allow yourself that. And you'll find the ""new normal"" establishing itself in you, not all at once but in little ways. 

My warmest wishes to you both.

",3,,3,0,0,
48aa8e29-c585-4b0b-8c48-7f063b9c4b8b,1457403369,"&gt; Does that mean that most people are being denied at that three or four month stage and then are talking about the appeal when they mention 18 months? Or does that mean that the response within 3 to 4 months isn't a determination, but just a continuation of some sort?

It means that most people are denied the first time.

My fifth application was accepted.  It took 2 years and 10 months from my first application until my first direct deposit from Social Security.  ",4,,4,0,0,
ffe5fb49-093e-4fee-87a7-c4eaf9fc4521,1456841394,That's the greatest thing I've read on this subreddit. Thank you! :),2,,2,0,0,
acdf3077-ddbc-4b3c-8341-9e42f10eab89,1457044108,"Yeah it's a little bit of a barrier. You can use the code 'waiig'.
",2,,2,0,0,
744b2045-b709-4eef-a559-922cd44a81aa,1459449593,"Hey I've never seen it before and I've been in a chair 10 years now, so thanks for posting! I'll admit my attention span didn't last long, what was the price?",5,,5,0,0,
8b37761e-f9b2-47c5-921a-b599746571cd,1457762905,"Being obese and having arthritis in a weight bearing joint, you can apply and get SSI",1,,1,0,0,
1f7b75e8-9ad2-4847-b1db-98a614f98445,1458059141,"The things that make one character or another amazing are all a matter of perspective.  Some people may see a strong female character, some may see a strong disabled character, and still others may see a strong geek character.

I'm also not suggesting that anyone campaign to get their ""feels taken care of"".  What I *am* asking for, is **equal representation**.  Consider what people of color thought when a character like Black Panther was unveiled in 1966.  It was groundbreaking.  A superhero to whom they could relate, whose skin color may have caused him some strife in his life, but he rose above the looks &amp; discrimination to become a seriously valued member of the Avengers.  I'm simply asking that the same view be taken with PWD, as there are young kids out there who may struggle with being different from their peers.",2,,2,0,0,
57cfc43e-fa4e-4899-a119-12b12350f295,1459302899,I would contact local agencies and determine how quickly they can respond with a resource for you. Can they do same day?  Next day?  Do they charge 2 hour minimum or four hour. Get several agencies and pick your top two. Revet them maybe every six months. I'd also have a caregivers list of things you need done and how to do them. Ask others in your position how they handle it. Do you have a neighbor or church member that you could ask in a pinch?,4,,4,0,0,
d8b88107-cbe2-4ce7-9088-9ba3e2523946,1457329181,"I'd like to add ""Wow, you should be grateful to your SO for being willing to be with you.""

Umm... thanks?",1,,1,0,0,
65eb3d01-3c5f-4f46-bbd9-7f98ef92e763,1458239258,"The amount of time spent waiting for an ALJ hearing and decision is highly dependent on where you live and how well staffed that area is with ALJs and ODAR (the SSA branch that does the hearings) offices are. 

I know right know the national average for a hearing decision is something like 500 days. SSA is actively working towards decreasing that number but its hard to recruit ALJs (and it takes a while to train them and get them up and running) and there are just so many people applying for disability (you can thank the Baby Boomers and slow economy for hat). 

I just re-read your post, is she currently on SSI? If she is on SSI then she is already on disability. Was she allowed for SSI but denied for SSDI (due to non-insured status)?  

While the national wait time average is 500 days I would listen to her attorney (assuming its a local one) as to how long it will be. They will have a much better feel for the timeframe. Keep in mind to that after the hearing it can still be months before a decision is actually made. ",2,,2,0,0,
35325534-800c-4b23-936e-e52bf2409ec9,1459021401,"Thanks a lot! 

Your point about being the person to person stuff being more interesting than the technical parts rings true. I want to shine a light on her character through the way she deals with interactions with strangers, unwanted negative (staring people, pointing tourists and children) and ""positive"" attention (people getting up on a bus or telling others that they should get up, strangers saying how brave she must be). I hope I'm not treating it too lightly though, especially when she makes fun of herself with friends (which obv. is something people do, but I don't want to overdo it or seem disrespectful).


I caught myself putting her hair in a bun when I drew some sketches, without thinking how difficult that might be now (I actually looked up youtube tutorials on it). Technicalities should definitely not be the focus but I plan on at least showing one or two. I think showing someone becoming quite proficient at something that should be harder than before is a worthwhile comment to include, that some physical obstacles can be overcome.",2,,2,0,0,
b119a33d-25b5-4fc1-be1b-e89ea726b927,1458971664,Thank you! Checking out their website now!,5,,5,0,0,
0010d6d9-d8d6-4c9a-a22e-c7c851a28128,1459038491,"Ohh, I did like that a lot. I'm gonna have to look this woman up and read more of her stuff.",1,,1,0,0,
e038a184-d3ea-496f-9f65-20567dafebfe,1457829462,"Weekly. It is now the same as JSA, the benefit for people out of work who do not have a disability, there's been a lot of coverage on how difficult that is to live on. Their reasoning is that the lack of money will 'encourage' people to get work quicker, but really when did that ever work? All I can see it doing is forcing people to take a job they can't do long term and quitting or being fired.

I'm not affected by the ESA cut but I can't imagine how stressful it must be to have 30 a week go from your income. Jobhunting is hard enough without that hanging over you. Depending on what changes they make I could be affected by the PIP cut, which is a scary thought -  like many people it pays for my personal care support.",2,,2,0,0,
ba01e4df-67b4-4802-9aa6-e9086b5f9d81,1458310206,"I've had people tell me that they hope I'll get better etc etc, but I've never heard it as a response to an accessibility complaint before. Of course I won't have access problems if my genetic condition is magically cured, but since that's unlikely....",2,,2,0,0,
37f84417-f829-4671-99d3-7ee8393787ad,1457947007,I seriously can't take any more. If I wasn't already sat down all the time I'd be on my knees after everything they've done. ,2,,2,0,0,
adc7026b-de20-4824-b2db-6e5ccee61c2a,1458325373,I've looked there but it seems many of those no longer exist =(,1,,1,0,0,
d32487ba-117f-4f7b-bbf6-325535a0f7e5,1457809323,"It's not a harsh statement. I have eight or nine conditions listed, all of them together make it pretty hard to produce consistent work that will keep me hired. I even have transcripts in my file showing I can't even do college well anymore. So don't tell me I'M the one being harsh.",1,,1,0,0,
60f5dae3-2b10-4ebf-aece-e4c597cfc1a7,1459203534,"Thanks, I know how to turn off the prompt though. I'm actually in the position of wanting to take the upgrade. I'm just reluctant to because I don't know if this piece of software I rely on will still work.",1,,1,0,0,
c9691d3e-23af-43e5-8704-67ac14abc496,1458091925,"Yeah I have some experience.  I receive my aid because I'm legally blind and I'm starting my freshman year as a Mechanical Engineering and Physics double major.  I personally have nothing but good things to say, if I need something my caseworker will move mountains to get it for me.  I feel very fortunate to have such a supportive team that is focusing on my success.  *However* I am just one person, and if you do a quick search of this sub you will find other people who have nothing but bad things to say, and their negativity is not unwarranted.  I have a great agency, but others don't.  The quality of the services varies drastically from place to place.  

&amp;nbsp;

My local agency has provided or is providing equipment/ technology (laptop, accessibility software, white canes, etc.), orientation and mobility training, and other school related expenses.  Currently I'm scheduling a meeting to get details finalized but it looks like I will be receiving some significant tuition assistance, room and board, and textbooks.  I am obviously not in your position though, I don't know all of the qualifications for service, and I don't know what benefits you will have access to in your area for your condition.  The best thing you can do is make contact and work with them on getting certified for services.  From there a caseworker can help you. ",1,,1,0,0,
24456d2a-8836-45bc-ac90-a916cdacfe7e,1457632329,"I just learnt this at uni this week, I'm disabled (rheumatoid arthritis) but also very morbidly obese....  Disability does indeed happen at the point where the person meets with society. ",1,,1,0,0,
4cb9a6e7-994c-4f8c-af41-3daae3f52af4,1458761065,"As another commenter said, ""work credits"" are an important issue.

I would find a way to earn money. Do that for as long as you can. If mental health symptoms are still acute in 10 years, then SSDI is more likely.

Benefits are not a golden ticket. Especially if a person just gets worse while isolated from social interaction. I am middle aged, and I can deal with this way of life because of maturity and discipline. Even so, its still ""work"" to maintain mental and economic stability.

SSI/SSDI may not be a solution for you. ",1,,1,0,0,
027a1edc-29da-4b66-aaf2-22f18a400f4e,1458715955,"mandatory ""the cake is a lie"" post",3,,3,0,0,
64132c87-9e38-4ab3-8fbf-627a0f79e115,1457474689,"Look, you need to learn to admit when you've made a mistake. I read your replies to OP. Not only did ypu criticize points that she made perfectly clear in her first post(living situation, arrangement with the cats), but you never once admitted that you obviously didn't read her post, and redoubled your criticisms as a way of deflecting attention from your errors. This is frustrating behavior at the best of times, but downright inexcusable in the context of someone asking for help. ",1,,1,0,0,
e55b19c5-ed7f-4d56-ad4c-8b18faf9a1a2,1457480419,"Thank you. My primary doctor has been pushing me to do this for years, so he will probably respond within 24 hours. My hospitalizations are what I'm worried about. It's a different (attending) doctor every time and they bill separately from the hospital, so I don't know if each one will be contacted. If so, I would have to dig just to find each name in order to start following up. Any idea how deep they go on that? Hopefully the hospital records including doctors' notes provide everything needed? ",1,,1,0,0,
e038a184-d3ea-496f-9f65-20567dafebfe,1458822329,"I came to say the same thing as /u/663a8a52-f40c-440a-a353-d57ae02b87f8. You have to stop comparing yourself to others. When you are chronically ill you measure life with a different yardstick, and that's fine. It is difficult to watch people do things that you expected you'd have done by now, but you need to focus on the progress you *have* made. It might not be the typical 'got married, got a house, had a kid' progress but it will be there. My progress was learning how to deal with my life in a different way, accepting my situation was a little different, learning more empathy for others, learning to talk to people and listen better. Less tangible but still great things to do with my life. Just from your post, you are working, part time is fantastic when you are struggling with just making it through the day. You realise what your problem is and are reaching out for help to fix it. That's awesome too. And that's from a few short paragraphs.

It really sounds like before a girlfriend, you need friends. One woman will not fix your loneliness, and if you head into a relationship with the issues you've outlined here, you're likely to smother her. You have to be happy with yourself before you try to be happy with someone else, because when you're dependant on another person for your happiness there will be problems down the road.

So, friends. Are there any times that you can leave the house? Does your illness fluctuate, is it pain and/or proximity to a bathroom that you need? Is there anything your doc can give you the odd day so that you can go out (for example I have stronger painkillers for every now and again)? Just wondering if there are some accommodations that could be made for you to give you the chance to physically get out more.

If not, that's also fine. I spent several years inside 99% of the time and made my best friends that way. We talk every day. The internet is an incredible thing. What are your interests? Is there anything you've ever wanted to know more about? Find a subreddit or other site about it and jump in. Post on /r/Needafriend. Talk to people, send PM's, eventually you'll find someone who clicks with you. Don't be disheartened when you get knockbacks, you're never going to get on with everyone and it can take a bit of patience.

I'm into video games (Dragon Age, LOTRO, Binding of Isaac, Elder Scrolls, Tomb Raider, Left4Dead), my pet rabbits who are little shits, wheelchair sport, fantasy novels, hiking and camping, sleep, and a good whisky. If I sound like a vaguely interesting person, shoot me a PM. (I won't be offended if you don't haha.) And there you go, you're already started. 

I also agree with other commenters to see about getting disability payments. In most places there is an advisor of some sort who will go through your situation and tell you what you are and are not eligible for. Find out who they are and contact them, you may be eligible for something you don't know about.",2,,2,0,0,
8a8e7c89-9b5b-46bb-abeb-0df4eaafcd28,1458285743,"I am completely deaf bilateral cochlear user. I've attended cons all across the east coast and have had nothing but positive experiences actually. The accessibility is surprisingly good for deaf people, although I have not attempted to request CART or an interpreter. However, they do notify panels that I am deaf so they can put on captions if available. ",3,,3,0,0,
eaae6e69-2f9f-43d1-9773-a3611987c5a5,1459223868,I'd be willing to answer some questions! I'm in a wheelchair because of psoriatic arthritis and my boyfriend is able-bodied and we have an amazing relationship.,1,,1,0,0,
83effdd9-4fda-43d5-a4ba-ff6d30b4042d,1457024424,This is my first Reddit post so I don't know how to fix that :( any feedback? I'm checking my preferences and I can't tell what's wrong. Apologies!,1,,1,0,0,
027a1edc-29da-4b66-aaf2-22f18a400f4e,1459005089,Yeeeeeaaah..... gonna wait for the video of that one. Goes in and gets a drink afterwards? Photographs of your boo-boo? This really sounds like a cash grab.,3,,3,0,0,
ed398870-6ed9-48cb-aed5-161524630da6,1459341086,Good luck with your surgery! Also your username is kind of amazing.,1,,1,0,0,
37f84417-f829-4671-99d3-7ee8393787ad,1457191199,"I'm sorry to hear about your experienced. I'm glad you are positive and moving forward with your life, it made me feel optimistic that maybe I can feel like this too someday. Thanks for your kind words :)",1,,1,0,0,
c1bb97d5-16c3-4e5c-9eea-79977ddc44a2,1456989577,im intrigued how often do the test come along?,2,,2,0,0,
b914fe0a-cce5-4d9d-b40a-f52fe22ee7f4,1458325700,"Make sure you feel the silk first before buying. Or make sure its the slippery kind. Not all silk is slippery, but a lot is.

You also might try going to a fabric store and looking for slippery fabric there.",1,,1,0,0,
65eb3d01-3c5f-4f46-bbd9-7f98ef92e763,1458749711,"Gosh you are right. Sorry OP, apparently I answered the question before having my morning coffee. ",3,,3,0,0,
0e229423-5704-43cf-af30-4511e9b25a0a,1458934784,"It will be struck down very soon. Abortion, constitutionally protected and backed up by over 40 years of case law. It's a good thing the government, and the right-wing don't make Healthcare decisions for women anymore.",4,,4,0,0,
c29f2422-a9ca-48db-b496-6cd30e55176a,1458965340,"It's impossible to say whether six weeks is good or bad without reviewing your medical evidence. Generally, once an applicant attends a CE and the analysts gets the report back, the analyst is good to make a decision. ",1,,1,0,0,
77da6e06-5445-48e8-bc8b-22909861660c,1457856094,I've never heard this take on the situation. Can you elaborate?,2,,2,0,0,
37f84417-f829-4671-99d3-7ee8393787ad,1458158432,It's a bit strange that the wheelchair area isn't sectioned off - for safety reasons. Did you ask them what safety provisions there will be? I guess it depends on the type of music it is and how energetic the crowd gets but it might be good to have a couple of friends to go with just to make sure you don't get punched in the face by various body parts of the other concert-goers...,2,,2,0,0,
97c43ab3-4f02-4947-b96f-aa58bff15209,1457102673,Thanks. I do post online so others can avoid making the same mistakes. I do plan to do advocacy.,1,,1,0,0,
e7fc28ee-ef9d-40fb-87f8-734211974663,1458050882,https://www.youtube.com/watch?v=PgwNgA5m0BY,2,,2,0,0,
f62c3724-5450-4e50-a702-61814936e27e,1459351480,"Without knowing which state you're in, try looking into the TBI Waiver program for your state. 

You should be able to get info on eligibility requirements and all that fun stuff. ",2,,2,0,0,
027a1edc-29da-4b66-aaf2-22f18a400f4e,1458094786,"Know what's really annoying with an above-knee prosthesis? PANTS. Seriously, screw pants. I have to wrestle them on over a shoe and around an immobile ankle -- which is annoying, and I guess probably damages the pants (especialy over time) -- or I can take the prosthesis off entirely, put the pants on it, then put it back on -- which takes A THOUSAND HOURS. 

Is there a way to lifehack my pants so that they're easier to put on in the morning? Maybe some kind of durable, low-friction SUPERSOCK? Idunno. ",3,,3,0,0,
0106696f-235e-4c4c-9a60-2e30ae5a34a4,1458382765,I think it is really understandable that people raising children with disabilities want to share their stories and experiences. I would suggest maybe some basic research first and then go and meet some people who have Downs Syndrome. You would be able to do better research by meeting and spending time with people. I'd also politely suggest that making statements such as you have about do all people with DS die before puberty illustrates that you haven't done basic research. This could cause offense and make people think you aren't serious about your aims and wanting to be respectful. I imagine this doesn't encourage people to want to help you. I do wish you well with your research.,4,,4,0,0,
c5df237d-cd8a-4299-b5d1-4a6926441bab,1457026688,"Exactly. If some people want to attach their disability to their identity, fine more power to them. But for many their disability is just that, a disability. They feel it as it impairs them from doing the things they want to do, from being a part of the rest of the world the way they see other people interact with it. If a cure can be found and given to those who want/need it, then it should be sought after. Nobody has the right to deny somebody the chance to live disability free.",5,,5,0,0,
5ddd8b26-45e2-4498-827a-278f668292a1,1459365366,"You both sound like incredibly strong people! One day at a time and those days will fly by! 

Also I completely understand the frustration with learning how to push a wheelchair and maneuver in a place that should make that sort of thing easier! 

Well wishes to you both! ",1,,1,0,0,
a8577bb7-a031-462e-9e0a-9b7a6ae28d43,1458340171,"This is the best tl;dr I could make, [original](http://www.theguardian.com/politics/2016/mar/18/iain-duncan-smith-resigns-from-cabinet-over-disability-cuts) reduced by 78%. (I'm a bot)
*****
&gt; Iain Duncan Smith has dramatically quit the cabinet, branding cuts to benefits for the disabled in George Osborne&amp;#039;s budget &amp;quot;Indefensible&amp;quot;.

&gt; In an implicit attack on George Osborne - and the biggest resignation since Cameron became prime minister - Duncan Smith said the disability cuts were defensible in narrow terms of deficit reduction but not &amp;quot;In the way they were placed in a budget that benefits higher earning taxpayers&amp;quot;.

&gt; The apparent climbdown came as Conservative rebels turned their fire on Osborne over what they see as the toxic politics of the budget, which juxtaposed the PIP cuts with tax giveaways for businesses and higher earners.


*****
[**Extended Summary**](http://np.reddit.com/r/autotldr/comments/4b0k8s/iain_duncan_smith_resigns_from_cabinet_over/) | [FAQ](http://np.reddit.com/r/autotldr/comments/31b9fm/faq_autotldr_bot/ ""Version 1.6, ~45624 tl;drs so far."") | [Theory](http://np.reddit.com/r/autotldr/comments/31bfht/theory_autotldr_concept/) | [Feedback](http://np.reddit.com/message/compose?to=%23autotldr ""PMs and comment replies are read by the bot admin, constructive feedback is welcome."") | *Top* *keywords*: **cuts**^#1 **budget**^#2 **benefits**^#3 **Osborne**^#4 **way**^#5

",1,,1,0,0,
1b6d1d2d-56b7-4f3e-9c59-3b4b06713228,1456792070,"Just a thought, but if you're designing for the 8-18 year old range you might want to make sure that the starting blocks are easy to get down from as well as climb up. Especially with younger swimmers there's going to be some that get up there and decide they can't jump, last thing you want is a situation where they feel like they can't turn around.

Not sure what concrete suggestions I can make other than possibly making the block extra wide and if practical putting hand rails on both sides.",2,,2,0,0,
b3cde213-8597-4fa2-9e84-9345b4ddaa96,1459395542,was working part time of 10h now only working 2h thay are hounding me to use there program,1,,1,0,0,
d88c71e1-47db-472b-86dd-b7de3e5168c2,1456858513,"Get your own doc to write a quite statement about how your current disability/ability to work relates to your condition on the date of your award letter (when you first were approved).

Submit this statement to your worker even if they didn't ask for it. You may avoid going to their doc at all. ",1,,1,0,0,
8da59540-6467-49f8-ac31-36fecf87a22c,1458777298,"I can't just constantly apply, can I? I don't exactly have much information. Could I get what little medical records I have by just calling the doctor, even though it's been years?",2,,2,0,0,
465eb4ef-bef3-46a2-bdc8-fae2f78cfb0e,1457707377,*Meet The Devotees,3,,3,0,0,
e331d1f6-573c-45e2-8990-cd3aa0f194a0,1458664819,"I hope he did take that video to the police, for the hot coffee if nothing else.

I also like how she's now driving away without any of the coffee that she used that parking spot to get.",4,,4,0,0,
