commentator_id,created_utc,anonymized_body,ups,downs,score,controversiality,gilded,distinguished
8a6f8b4c-9342-4e08-9310-54cb44e70044,1453846664,"Nobody ever said that no one thinks your disability is a bad thing.  Of course people who believe that exist.

&gt; •People have dedicated their life to making sure I don't exist. Curing my disabilities and preventing them are basically saying I shouldn't exist the way I actually do exist.

That's just hyperbolic BS.  Yes, there are those who believe that you are not worthy of life due to your disability.  But those people are the minority.  There's lots of people who think Jews shouldn't live.  Or blacks.  Or anyone different than them.  You're making it sound like it's the status quo.  It's not.  But I also know you think that there is nothing wrong with having your disability and that people shouldn't try to prevent it.  That is where you are wrong.  You're entitled to that belief, and that's fine for you.  But you can't make villains out of people who would prefer that their children or loved ones not have to deal with a condition that others may not have to.  That's ridiculous.  I'm paralyzed.  I'm perfectly happy with my life but I sure as shit wouldn't wish for my children to be paralyzed just because I'm fine with it.  Nor would I wish for them to be autistic.  Or bi-polar.  Or a huge number of different things.  But if they are, that doesn't make them unworthy of life.  But you know damn well that your disability takes monitoring, self-awareness, and more work than those without it.  If I could spare my child that, I certainly would, and you have no right looking down on others who feel the same.  That makes you no better than the largely exaggerated people who you claim hate your existence because of your disability.",2,,2,0,0,
74ef6f7b-a0d3-4235-82e3-d5663eb5da2a,1452317179,You know who else had severe depression? Abraham Lincoln...,4,,4,0,0,
9467eb37-981d-4ca7-8d4b-0d1f920f1dca,1453746045,"I'm deaf but otherwise totally physically able-bodied. I really can't stand the new theme either. It's not even done well either, to add insult to injury. 

Your comment was made 13 hr. ago, have they personally replied yet?",3,,3,0,0,
15186324-4c93-4518-b6cb-1b752acc9706,1452325926,What would an accessible oven look like for you?,1,,1,0,0,
74302fac-00a0-4d78-9947-2c9c72343e06,1453835925,"Mine is probably a little different from other people's but I'll throw it out here anyways. (Also I'm not sure whether it's an engineering problem).

I am lying down in bed 99% of the day. I'm also on my laptop 99% of the day.

I have two ways that I lay - on my back propped up on pillows with the computer on my lap, or on my side, with the computer on it's side. Occasionally I'm sitting up with it on my lap. 

Either way overheats the computer and fries the power cord. I try to keep a book under it, but that only goes so far. 

Any way to use my computer in bed without frying it?

Edit: It's a mid 2010 MBP. Yes, they run hot anyways. 

Edit 2: [I drew you guys a picture of the 3 ways I am in bed with the computer.](http://imgur.com/1cwd2C6) No. 1 and No 3 are most of the time. No. 2 never lasts more than 3 or 4 minutes at a stretch. No. 3 is the killer on the computer as everything's totally sideways it's usually resting on the magsafe power cord. ",4,,4,0,0,
74302fac-00a0-4d78-9947-2c9c72343e06,1453470231,"Thanks so much. I already let this morning's person know and he was great and is still coming in. We'll see about the people this weekend...

",2,,2,0,0,
0ddb56dc-e1a9-4313-a035-963ae97406e0,1453690028,"Well, after I responded she blocked me. So I think that's about it for this relationship. If you're interested in my response, I edited my post to include it.",3,,3,0,0,
010487db-5446-487f-a67c-6e7b1e7360d5,1452590830,"I was so disappointed with Jessica Jones. She meets a stroke survivor and within ten minutes he is begging for her to kill him. There are only two type of disabled people in most peoples' minds, inspiration porn object and pitiful figure begging for death.",4,,4,0,0,
d43ea476-9a65-4aa9-8133-c4b9e5b6ea8e,1454213819,"Benefit Advisor here. Getting benefits can be frustrating but you can get free help to prove your case. Seek out your states nearest Independent Living Center. Search web: www.ncil.org. ILC's employ mostly people who have disabilities, folks like yourself, who have struggled thru the process and won their case. And are now helping others. I can assure you that they will understand what your going thru and will help get financial assistance. ILCs  assist folks understand, apply for and maximize benefits and social supports. As a Benefit Advisor, I help fill out SSA, SNAP(food stamps) and Medicaid applications. I advise folks on gathering medical documents, understanding bureaucratic language and how to answer questions SSA asks about your limitation. ILCs  help anyone in need of an experienced mentor and its all free for the asking. I'm sure you can find this help in your state. You might also look thru my passed comments, I've left information for others in his situation. PM me if you need more help. ",2,,2,0,0,
589f63c3-bad5-4542-ac39-e0e5a5dc6591,1454271746,"I don't know if this will help, but...

I recommend remembering that most children who get seriously ill or have major problems like yours typically get better. There's lots of stuff out there written by other parents who have been through similar situations - likely also forums and other support groups online.  I know this sounds overly simplistic, but this kind of thinking and research helped me conquer my terror about flying.

If I could, I would share with you the (complete) tale of friends whose baby was born 6 months ago with a defective heart. Part of it was barely working. Worse, he kept developing infections and having feeding problems, and he was touch-and-go for a while. His parents, like you, had moved into the hospital to be with him.  I'm happy to say that when he was 3 months they were able to give him a new heart and they're all now living at home.  There are still a lot of hurdles, but his prognosis is excellent.

Lastly, I leave you with this little pearl: A friend of mine got pregnant while she was going through medical school. She was at that point where you spend 2-3 months in a variety of departments to try out specialties.  She was 6 months pregnant when she was working in the neonatal unit.  Everyone asked, ""How can you handle that when you're about to have your first baby?""

She said, ""There are some real tragedies but in the vast majority of cases I've seen, things work out in the end.  It's a big comfort knowing that health care is at the point where we can save the lives of kids that 20 years ago would have been doomed.""  (And that story is almost 20 years old, so...)",3,,3,0,0,
11335b30-3469-486e-9384-e1ad4ec0ea40,1453969428,"I think the problem that some of us may have is that a small percentage of people feel the need to go out of their way to tell us about their newfound inspiration. I do agree with you that most people don't have any malicious intent behind it.

However, I would rather have people keep thoughts like that to themselves. I get enough comments centered around my disability as it is. It's not so much about getting upset, but more that it just gets tiresome.",1,,1,0,0,
74ef6f7b-a0d3-4235-82e3-d5663eb5da2a,1453318819,"Disability is a social construct. Some people are inherently impaired, but that doesn't translate into disability unless society doesn't accommodate.

Mental disabilities like depression, anxiety, OCD, and bipolarity are absolutely disabilities and so is blindness! Not all disabilities are visible.",3,,3,0,0,
c381a2a1-8eb4-4f49-bd7b-ae1d8f7011de,1453468997,"&gt; One other attorney however said something about a 'closed period' of disability

I received backpay for a closed period when I wasn't then currently considered disabled. I had spent a couple of years in cancer treatments and couldn't work, but wasn't on disability during that period. Crap, I can't recall the specifics on that, but I did get $10k in backpay about 1.5yrs after I finished treatments. And then a few years later, after exhausting my attempts to get back to work, I applied for disability proper and was approved, and received backpay for the time intervening.
",1,,1,0,0,
c29f2422-a9ca-48db-b496-6cd30e55176a,1453706369,"For disability, you have to be disabled - meaning unable to do any kind of work - for 12 months. Losing a middle and ringer on your left hand more than likely will not keep you from doing any kind of work for 12 months, especially if you are not left hand dominant. There are many jobs that only require one hand. Of course you can apply, but generally no, you will not qualify for full disability benefits. ",4,,4,0,0,
6be7e826-bf78-44c3-9011-d80b6993cca7,1452241482,Good cause. What can be done to help?,1,,1,0,0,
48720b87-66d6-4b16-883d-e3c7f0bbe6c1,1453609467,Good look sorry I have been out of the CWIC thing for a year now and going off my old numbers.,1,,1,0,0,
589f63c3-bad5-4542-ac39-e0e5a5dc6591,1453142851,"Where is she, what country?   

All of this is US based.

In the US there is no way to increase the amount you get from SSI or SSDI. SSI payments are fixed -- all recipients get the same amount.   SSDI payments are based on work history, including how long someone worked and salary.

There are other programs that can help, though.  The majority of them are state-run or administered.  The first thing she can do is apply for ""subsidized housing"" -- apartments built and run by Federal (HUD) standards but administered by state or local governments or even private entities.  Google for subsidized housing in (state or city name) and you will find many resources.  Rent at these places is determined by income; at her income level she would likely pay 10% for rent.

There are other programs that can help, too.  A call or visit to her local Department of Human Services can help.",1,,1,0,0,
e0f89f86-5ed8-4246-b628-b6ef3a63d573,1454274275,"I agree with you absolutely. It is a sin that employers are not willing to accommodate jobs with basic supports (such as stools for cashiers, set schedules in retail, paid sick days, telecommuting). So many more people could and would work if this was the case.

I am terrified for the day when I am too unable to do my job, because I know how hard it is for able-bodied, energetic workers to get hired, let alone those equally willing to work, but physically in pain and requiring modifications.",2,,2,0,0,
a24c9519-3557-4466-875a-5915ddd0bdfd,1453074041,"Awesome reply! Thanks heaps. Yeah I am working with a physio at the moment and the chair is made for me so I have all the right measurements.

I am going for a permanent fixed frame so I want to get all the setup right so when it is locked in I don't regret it. I dont mess around with the tippiness or such once I have it set so see no need and have broken a few mechanisms in the past.

Do you find that pushing of just the rims messes up your push? I don't wear gloves and so slip on just the rims.

Also do you have the back lock into place? The first thing I have done is remove the locking mechanism of the back so it folds down easily. Why would you need it locked into place?",2,,2,0,0,
6508d5b7-fc32-4902-8c8a-1a64015d7bfe,1453946313,I use an AFO leg brace and a huge problem I have is the lack of shoes available that are wide enough to fit over the brace and give me enough support to walk. The is only one company I know that makes shoes for braces and there's only about 4 styles to choose from. ,1,,1,0,0,
fee77648-82f7-486b-8fbb-2bb004c4ce06,1451916009,"That last bit was just so perfect- it's parenting in a nutshell!

Thank you for ~~sharing~~ venting. It made my day. 😊",5,,5,0,0,
d1199376-fc94-4adf-976c-86f6dd0c42e8,1453840947,"I think what frustrates people, though, is that it's not clear what ""don't let X define you"" means.  Maybe I'm just dumb, but I can't come up with a coherent definition, and I feel like even then in common use it would vary from person to person.

What does it mean for your disability to ""define you?""

Is it acceptable to explicitly seek out friends that have your same condition?  If I go to a United Cerebral Palsy event am I letting my disability define me?

Is it acceptable to complain when something is difficult?  Does the answer depend on whether the task is difficult for other people or not?

Is it acceptable to gravitate toward activities I'm good at and avoid activities I'm bad at?

I'm not trying to be an ass here.  I honestly don't know how most people would answer these questions.
",1,,1,0,0,
9398fa3d-5a11-40ed-b671-0d40ecb444a4,1453984751,"That seems to be the general consensus. I appreciate you guys giving me an honest answer. Anywhere else, I'm sure I would've gotten a response about how I'm trying to scam the system. That's really not the case. I'm not a bad person, I'm just trying to survive. Not always easy.",2,,2,0,0,
c9691d3e-23af-43e5-8704-67ac14abc496,1453859869,"I honestly don't have any first hand experience with them, for the past 3 and a half years I've been using a Lenovo laptop that has pretty good sideways ventilation and when I am doing a lot I am usually on my desktop...  But I'm also getting a new Macbook Pro delivered next week and your comment made me remember how hot those get (I used to have one like 5ish years ago).  I remembered coming across these laptop heat sinks a few months ago and saw they have pretty good reviews, I think they are kind of popular with the gaming crowd because it keeps their hardware from frying and/ or thermal throttling under load.  I would check reviews to make sure it is what you want, but I have heard good things about them.  I'll probably end up picking one up myself since this new laptop is going to have to last me a while and also hot laptops aren't very comfortable.",1,,1,0,0,
c65ed6eb-04fb-4f80-81f3-45555d690c4e,1452259168,"I think so too, but it really depends on the person's preference normally. I just don't believe it should be an insult to use identity-first language though.",1,,1,0,0,
1f7b75e8-9ad2-4847-b1db-98a614f98445,1454025594,"As a wheelchairian, this just made my day.",2,,2,0,0,
1ba6e6bc-e510-4ff6-9449-a15a0c6ea2d6,1453472307,"I agree, I think that will be my route.  It's better to be upfront in life I think.  Thanks for your reply",2,,2,0,0,
1ba6e6bc-e510-4ff6-9449-a15a0c6ea2d6,1453514476,Have you tried a medical appeal?  I know such a thing exists but not too much more than that.,1,,1,0,0,
74ef6f7b-a0d3-4235-82e3-d5663eb5da2a,1453746142,I made a post about the rainbow flairs days ago. No replies whatsoever. The mods either don't know or don't care that we're unhappy.,4,,4,0,0,
74ef6f7b-a0d3-4235-82e3-d5663eb5da2a,1452781083,"Exactly. I *know* that claiming that Roman and Greek societies were tolerant of those with the disease is completely revisionist. Epilepsy was seen as a sign of either demonic possession or it was romanticized as divine. Either way, ableist as all hell.

Good question. I think the real question we must ask to see if disability is being politicized for non-disability issues is to ask, ""is this primarily for the benefit of disabled people and for the rights of disabled people?""",1,,1,0,0,
906a1327-1da9-49f9-b530-46b08b987186,1453672247,With youtube you can place timestamp links for different subject headings in the description and provide captions for those that prefer them.,1,,1,0,0,
753f67ef-8f84-4687-b5d0-6003c0267e7e,1452779577,Pretty neat. Is this local or international?,2,,2,0,0,
8678158d-3ddc-4920-ac29-98f574855a46,1453693324,"Eh, FWIW I pissed off about 50 people this week on FB, and wasn't that repentant, so I'm probably not the best person to ""ask"" xD ",2,,2,0,0,
a91a6f6a-627e-4625-b018-772584b531b2,1451867322,I still maintain /r/funny is grossly misnamed...this does nothing to change that. I couldn't find it on there but I shudder to think what the comments were...,3,,3,0,0,
4cb9a6e7-994c-4f8c-af41-3daae3f52af4,1453747118,"I write my own story, but I also value feedback and consider it objectively when my brain is cooperating.

I am well suited to solitude, and I learn how to enrich it, mix healthy behaviors into it, and maintain communication. I understand that well adapted, socially able folks may not know what extended periods of solitude produce in regards to mental activity and behaviors.

The only unhealthy effect is that my ability to communicate verbally has degraded. I practice speaking with mindful attention. I do not speak as I write, and I think most folks would not think I was very intelligent when a mess of word-salad erupts from my mouth.

I have never had verbal proficiency, and thus online forums are my ""social world"". It is not pathetic for someone like me to ""have no friends"" in the same way a scorpion should not be criticized for stinging prey.",2,,2,0,0,
37f84417-f829-4671-99d3-7ee8393787ad,1453914398,"Agreed. I have a special sling that slides under the body really easily and allows two people to lift an immobile person without putting too much strain on their backs. At first some airport employees didn't like it, they wanted to lift by hand because that's all they knew (not possible for me because of my spine). After I convinced them to just try it they were so excited and said they were going to ask their manager if they could buy one because it was so much easier to lift someone with it (both for their comfort and the comfort of the person but also it felt much safer to them). They loved it and were shocked that they didn't know such things were available. These sorts of issues are totally workable if people are willing to invest some time and money.",2,,2,0,0,
9398fa3d-5a11-40ed-b671-0d40ecb444a4,1454123640,"For what it's worth, you aren't doing anything wrong in my opinion. You deserve to be able to buy yourself something nice every once in a while. It's a shame the government doesn't see it that way. Just because someone is disabled doesn't mean they should be forced to live in poverty.",2,,2,0,0,
4e8456a5-0102-4115-83f3-79578de1c610,1453316870,"If you want good it will be expensive, Abena and ATNs are always great. If you get a prescription insurance pays",2,,2,0,0,
08adef3d-aaf9-4f3b-a116-3eb98a12d439,1453318400,"Adult diapers are cheaper if you buy them in bulk and without a middle man. Amazon is pretty good for that actually.

Stay away from pull up style diapers unless your wetting is light, they just don't hold very much. The kinds that tape up on the sides are much better, especially the plastic backed kind. They are also better because you can change in a stall without having to take your pants off.

I recommend starting out by trying some of the cheaper, lesser absorbancy kind such as [this](http://www.amazon.com/dp/B007AZ5MTW) or [this](http://www.amazon.com/dp/B0000532I1/) and if they aren't absorbant enough, try out [Tranquility ATN Briefs](http://www.amazon.com/dp/B000CSG5TU/) as they are also quite cheap and also much more absorbant.

If Tranquility ATN Briefs aren't absorbant enough for you then you should go to one of the more expensive premium brand adult diapers like Abena or Molicare. They are quite a bit thicker than most diapers, but to be completely honest, as long as you don't wear skinny jeans and throw a pair of boxer briefs over the diaper, no one will ever notice that you are wearing it.",3,,3,0,0,
589f63c3-bad5-4542-ac39-e0e5a5dc6591,1451745084,"Wait a minute. There's **NO WAY** your ""check and the checks of your friends"" say that the Medicare Part B premiums went up -- they wouldn't change until the JANUARY payment, which hasn't even come out yet.",1,,1,0,0,
c29f2422-a9ca-48db-b496-6cd30e55176a,1453705888,"I'm guessing, again, that you are younger. SSA believes that anyone of younger age (18-49) can work, at least sedentary (desk) work. For someone younger to be approved, he/she must not be able to sustain competitive work, meaning he/she must not be able to do a desk job, or he/she must meet one of SSA's disability listings. It is difficulty to do either of these things, which is why so many younger people are denied. 

Analysts are supposed to take all conditions into account, meaning they are supposed to look at how all your conditions *together* effect your ability to work. You do have many conditions that are difficulty for analysts because they are umbrella conditions. Fibromyalgia, for example, is a general condition used for chronic pain. Most reports of fibromyalgia are subjective, meaning they are the patient's reports of pain. It is difficult for the doctor to assess these types of conditions.

Where in the process are you? Have you been denied once? If so, I recommend filing for a reconsideration and hiring an attorney. A reconsideration means that another examiner will look at your claim to make sure no mistakes were made. An attorney can have your doctors submit paperwork with their opinions about your disability- a ""medical source statement"". These can be very helpful to your claim. An attorney can be helpful if your reconsideration claim is denied, because then you can proceed to the ALJ (administrative law judge). This is where many decisions are overturned. 

I hope this helps. Please feel free to message me with any other questions!!",2,,2,0,0,
978f8c5d-51e7-4c62-ba47-e1b47a9e537a,1451833575,"I struggled with this same problem for many years. I don't think it's ever a good idea to try to hide your disability, but how much (or even if) you want to tell her depends on your comfort level. What works for me is waiting until it comes up and then laying it out as plainly and briefly as I can. I've found that if you don't go into every detail at first, other people are less likely to see you as self-pitying or get overwhelmed and reject you. If you just say something like ""I have ____ and that gives me trouble with _____""  when it comes up, then later on they're pretty accepting of  ""I also have trouble with ____ and _____"" when that comes up. Hope your date goes (or went) well!",2,,2,0,0,
589f63c3-bad5-4542-ac39-e0e5a5dc6591,1453336256,"To add to what /u/93260279-3ee3-4f73-81e8-05f2f6209e68 said:  If you have transportation issues to get to the appointments, tell the SSA as soon as possible.

At the time that the SSA had me see their own doctors for evaluation, my car was broken.  The SSA paid for a taxi to take me to and from the appointments.",2,,2,0,0,
a7efd846-efba-4057-a0c4-8f33a484d54b,1454086479,"That's good to know, thank you. From what I gather, our situation should be alright though, unless my tax return goes to our new joint account - we also get state cash benefits, and the money from that will be put on the new joint account, and they are aware of the fact that we get state benefits, so that shouldn't go over what's reported. So I'll just have my tax return from last year go to my own account. I am on state disability, so we shouldn't get more income than that. Really, we only need a joint account in the case of an emergency, or for spending money, or whatever, so I don't see it going over what's reported.

Very helpful information, thank you - I'll be opening my own separate account as well as a new bank account, so we'll each have a separate account and joint account. Until recently I was using a prepaid card for everything (Bluebird from AmEx) and it's really inconvenient to stand in the customer service line at Wal-Mart to reload it.

Edit: To clarify, what we get from state benefits is not nearly enough to exceed the limit, and to be honest, we've only had that much money on hand like once in our lifetimes, so I don't think a joint account will be an issue, especially if it's reported, and separate from the account the SSI funds are deposited into.",1,,1,0,0,
4cb9a6e7-994c-4f8c-af41-3daae3f52af4,1454006402,"Good question. It's a matter of commitment. I could monetize my creative output, but I have never been motivated to do such a thing. Basic tasks are work for me. I have an idea for some video art, and I am somewhat excited about it, but the project is likely to wear me out. Its not an idea which is easily commodified either.

I am an experimentalist, and few would consider my creative output to have value as a commodity. I make cool stuff, but it's not packaged for sale.

We all have different reasons, but common barriers seem to be the amount of energy it takes to run a side business and still maintain basic living obligations.",2,,2,0,0,
3dd1c5c3-fc55-4974-92db-ee15ccf08d3e,1452276136,"When I got my disability the judge expressed dismay that both doctors hired by ssa never did look at my medical and mental history at all nor did any test. 

Just days later I passed out while shopping at the dollar store People said I was overcome by all the dollar specials.",2,,2,0,0,
