commentator_id,created_utc,anonymized_body,ups,downs,score,controversiality,gilded,distinguished
b82056e1-38b6-4aaf-b241-1d54fe75a2f8,1453742573,"As an at least temporary solution, RES allows you to turn off subredit themes for individual subreddits.",4,,4,0,0,
c29f2422-a9ca-48db-b496-6cd30e55176a,1453496610,Disability applications are evaluated as a whole; all of your impairments and issues are taken into account in terms of how they ALL impact your ability to work. ,1,,1,0,0,
74ef6f7b-a0d3-4235-82e3-d5663eb5da2a,1454218373,"I actually think that you are on to something. I think capitalism is the huge driving factor behind a lot of ableism. We're all lazy because we don't meet capitalist standards. Our lives must be miserable because we don't meet capitalist standards.

The stigma against poor people is largely because the rich elite don't want us to focus on the rich are doing. So, they blame the poor and the immigrants and the disabled and people of colour and LGBTQ and all of these other groups. :/",5,,5,0,0,
589f63c3-bad5-4542-ac39-e0e5a5dc6591,1453401382,"Personally, I think this is just going to make things worse.  

Between all the fake badges you can print out on the Internet and people not understanding that real service animals don't need to be registered anywhere, I expect a rise in people with service dogs getting crap from businesses who don't understand how things work.

This law does not cover ESAs.",4,,4,0,0,
589f63c3-bad5-4542-ac39-e0e5a5dc6591,1451852060,"Yes. Unless they can prove that changing the door would cause an ""unreasonable"" problem with the company, asking for a way to use that door is a reasonable accommodation.",3,,3,0,0,
79c8af08-d8f4-4dde-8db0-48575776e117,1452297864,Thank you! for posting this link.  =D,3,,3,0,0,
4603dfc1-a6c6-441d-8f71-719f862c601d,1453397720,"That's awful! I hope you've been able to find another doctor. Chronic pain is difficult enough to deal with, you don't need idiot doctors talking down to you. I had one of those when I first got violently ill with my chronic illness 12 years ago. Told me I was depressed, and needed to just go ""hang out with my friends."" Douchebag.

Have you missed the window for applying? A lot of times you can resubmit those things if they were incomplete. The combination of your back pain and subsequent mental health difficulties could give you a new crack at it. Whatever doctor you go to, make sure to document the ways your disabilities interfere with both your physical and mental abilities to work. Besides sitting, standing, etc, the ability to work relies on concentration, mental stamina, and other cognitive and emotional coping capabilities. A lot of times, it's not a single condition, but the combination of conditions and how they impact one's abilities that make the case.",1,,1,0,0,
3dd1c5c3-fc55-4974-92db-ee15ccf08d3e,1453828376,"sometimes people will stare at me. Usually its teens but one time it was an older fella in a restaurant who should have known better. 

So I whipped up a really goofy look and started pretending to be grabbing and eating invisible butterflies. Next thing the guy was craning his neck left and right to avoid looking my direction.

Sometimes I would pretend to get into an argument with an invisible person. Another time I started raising my left hand up and down and suddenly I jumped up, screamed stop that slapped my hand and sat down on it. The guy jumped in startlement almost hit his head on the top of the bus. It works every time.

I figure people are going to judge me no matter what so I might as well give them a reason and have fun doing it.",2,,2,0,0,
965382d1-f951-498b-9819-deaeaf1559ec,1453738194,"&gt;I'm guessing, again, that you are younger.

That's correct...24

&gt;Where in the process are you?

I'm over 3 years in, and waiting on a hearing with an ALJ.

I have an attorney, I've been establishing medical care here (moved to another state 1.5yrs ago) and trying to get additional documentation and treatment...

My new doctors are thinking I have an unusual autoimmune condition tying everything together.  But the (very busy) specialist who will be figuring that out has no appointments open for five months, so I might not find out until after the hearing...Would an ALJ take something like, ""we aren't sure what's happening, but it's bad"" into account?  

",1,,1,0,0,
956599a1-1382-4bc9-ae2a-30f8e2410e26,1452220984,"I have CP in my legs too. Don't even have a girlfriend yet but I go back and forth on wanting kids for some of the very reasons you are describing. 

If I may ask, how exactly/balance do you carry him?

Before you had kids how did you bring up these difficulties with your SO? Does she have any disabilities too? 

Just fishing for information if I have my own children one day. ",1,,1,0,0,
2e083f9a-cf07-4840-ae89-a3cca72ba834,1452961516,"Biodiversity can be a good thing, but not insofar as it affects people's ability to function. As an example, I would really love to be able to walk and enjoy normal spinal function. It's incredibly inconvenient for me and although my parents never said or showed any signs of it, I'm sure they were burdened by this as well. Knowing what I know of intellectual disabilities - which is, admittedly, quite outside of my wheelhouse - I can only imagine the challenges faced by sufferers of Downs and those around them. However, I do know that it's something that nobody would want dropped on them by surprise. If somebody is planning on bringing a child into the world, they've got every right to know the totality of the situation they're getting themselves into. ",2,,2,0,0,
f8be31ab-cc60-4b53-bb4c-a48d2fa3112d,1452187934,Help get proper disabled changing facilities for older children and adults,1,,1,0,0,
e038a184-d3ea-496f-9f65-20567dafebfe,1452364168,"You specifically asked about the exploitation of 'at-risk' youths, in a disability subreddit, with an article about autism. No, no exploitation is right, but that is not how your question comes across. You did not post and ask if the army was exploitative, you asked about it for this subset of youths, insinuating that it was because they are 'at risk' and needed more protection than the average soldier.

Having known and dated people with high-functioning autism, I have seen how much they are babied once their diagnosis is known. Would you have posted if the article hadn't mentioned their autism, and it was just a specialised unit of 'normal' soldiers? Probably not. So why are you more concerned about this particular avenue of exploitation in the Army, if you see it that way, than of it overall? You can only comment on how someone treats an at risk group if you have a frame of reference on how they treat others in the same situation - in this case soldiers in standard units.",2,,2,0,0,
4cb9a6e7-994c-4f8c-af41-3daae3f52af4,1454095907,"I have a condition which may be curable by nanites which can repair all the molecules in my body. Technology like that is experimental, so my treatment plan is palliative. The SSA is a partner in helping me be as comfortable as possible and my doctor is also a partner. 

My living space is a hospice. It may be 30 years before Mother Nature flicks the kill-switch, but until a full nervous system transplant is possible, I am categorically disabled. Therefore,  I was approved in 4 months, and re-approved 6 months ago.

Looks like I am retired at 45. 

I tell people to find another way. Seek other services, help, charity. SSDI is for people like me who are damaged beyond current modes of repair. 

Your spouse needs help, and that is fine, but SSDI should be last on the list.

",1,,1,0,0,
027a1edc-29da-4b66-aaf2-22f18a400f4e,1453912693,"What the industry needs are:

1. New planes with better materials and more inclusive designs so that you can take your chair all the way to your sead. **(this will not happen in our lifetime probably, because there are trillions of dollars' worth of development still to be done before any of that is possible)**

2. I'm not sure about GB, but speaking for the Americans, *we simply need better people working on wheelchair logistics.* All the precautions and all the technology in the world mean nothing when your whole trip is directly handled by the lowest common denominator. **This part CAN be fixed, but it won't be easy for anyone, least of all the barely-out-of-bankruptcy airlines.**

3. We really ought to look at making a chair they *can't* break, and getting it to the people who need it. I've flown in two manual chairs and they injured both of 'em -- not beyond use, but bent some pieces and that sort of thing. And the reason was, the people loading/unloading had never seen handled a chair like mine.... It's asking a lot for these individuals to *literally never* damage any one of a million different chair designs. I think BA, USA, United, et. al. should put their heads together and come up with a single standardized (modular, so it can support as many people as possible) travel chair, and make it available start-to-finish for your whole journey. *Or something like that.* The fewest people possible should be putting their hands on your real chair. 

idunno, that last one isn't fully thought out but I'm on the go. ",2,,2,0,0,
65eb3d01-3c5f-4f46-bbd9-7f98ef92e763,1452627428,"I think that if it is going to be cheaper for you to buy a house than pay rent go ahead and purchase the home. You have good credit but being on such low [albeit fixed] income may mean you won't be approved for much. 

The one thing thought to consider is that houses can be huge money-suckers. With such a low income it won't take more than 1 or 2 things to break for you to be in trouble. What happens when you need a new furnace, main line replacement, roof repair, etc? Will you have $3-5 saved up for these emergencies? If you drain the emergency fund how will you build it back up? $1445 may seem like a lot but once you pay your mortgage (including taxes, homeowners, interest, etc) and utility bills you won't be left with much left over. 

My honest advice is to rent for a few years so you can be accustomed to living on your SSDI check. You need to apply for section 8/HUD housing so that your rent will be cheaper. HUD apartments won't allow dogs but if you can get Section 8 you may be able to find a landlord who will allow your dog. ",7,,7,0,0,
7a5c9f4f-946b-41d7-a71e-9bffe94f52be,1453929139,"Wow. That sounds very complex, and thank you for that long write-up.  What are some ways to improve upon that?  It seems like calling the airline ahead of time so they're prepared would help",1,,1,0,0,
753f67ef-8f84-4687-b5d0-6003c0267e7e,1452723779,"Revisionist history to serve a leftist political slant. People with disabilities are not a blunt weapon to be wielded against everyone else in some Marxist crusade. Fuck me. If you let the social model go *too* far, you'll start to hear about ""internalized ableism"" from anyone who doesn't toe the party line.",1,,1,0,0,
4e474cdd-3f71-4e94-8b7e-cfdfad11be3b,1452307182,"Ah, the exploitation of at-risk youth by the military-industrial complex.  That does not worry you at all? ",3,,3,0,0,
e142b923-e128-406f-84c6-d2466b0eb1c0,1452779709,"This is the Israeli version of a global project


http://www.gobabygo.org.il/#!english/c1m9u

",2,,2,0,0,
965382d1-f951-498b-9819-deaeaf1559ec,1453528572,"&gt;This is very standard in exams and orthopedic assessment. 

Yes it is.

I do not have standard medical issues.  It told them *nothing* about my body...I don't have arthritis, or a joint deformity.  I have a collagen defect.  My range of motion is *better* than most.  

The only thing they could've learned is a few things that *don't* cause me pain, and a couple of things I *am* able to do.

They saw none of my pain, none of my problems.",1,,1,0,0,
965382d1-f951-498b-9819-deaeaf1559ec,1453682126,"*Nobody* is sure whether or not they qualify for benefits, unfortunately...even the severely disabled.  

All you can do is try!  That likely wouldn't qualify you for full, permanent disability benefits...

...but you're out of school and can't work...


",4,,4,0,0,
44d9987e-5eb2-45ad-9150-ba774748dcee,1453973654,Tbh I was surprised they didn't already exist.,3,,3,0,0,
e038a184-d3ea-496f-9f65-20567dafebfe,1453061950,"&gt;I am trialing some high pressure tyres now and enjoy the speed but curbs are a bit tricky now. Are they worth the speed with the rough ride?

I'm not sure what tyres are in your pic above, are they solid or pneumatic? I personally do not like solid tyres. They are more durable and obviously don't need pumped up but they're so much heavier and bumpier to me they're not worth it. Remember if you don't like the pressure in a pneumatic tyre you can tinker with it a bit, there's a range printed on the side of the tyre so you can experiment with the PSI until you find what suits you. A lower PSI will give a smoother ride. The width and texture of your tyres will also affect the ride, I have slim tyres for nice weather/mostly indoors, slightly chunkier ones for harsher weather, and want to get a good knobbly pair for hiking etc - think mountain bike tyres. I love going fast so I built up my core and learned to move with the chair wherever possible, over bumps, round corners and so on. If you can manage it, a strong core makes a world of difference in an active chair.

&gt; What setup for the rims do people use? I have my rims in as tight as I can to the wheels and push off both rim and tyre. Am I unusual here?

My rims are about an inch off the wheel, I like to be able to wrap my whole hand round the rim and only brush the edge of the tyre. Some people will do what you do, some have no rims at all. It's just personal preference. I don't like having my hands on the wheels directly as they get so dirty and run through gloves much quicker too. I also had an interesting experience with an older chair where I pushed on the tyres themselves, pushed a little too hard and broke both thumbs catching them in the brakes. If you have scissor style brakes or the self control to not drink and roll this won't be an issue.

&gt; Do people put the chair in the front or back seat of their car? I transfer it into the backseat, I just got into the habit having passengers I guess. Is this a waste?

I don't drive so I can't give you a personal answer here. However the other wheelies I know put it in the back seat, or those with leg function put it in the boot. I've never seen anyone put it in the front seat but I know there are people who do. Again, personal preference.

&gt; What sort of camber are people running on their wheels? I used to have a bit but have lowered it over the years. Do people have much? I really like a lot but getting through doors etc is a pain.

I love a lot of camber especially on hills, but have the same issue with doors. I'd have to check the angle for you but mine is not huge. If (in a dream world) I could have separate outdoor and indoor chairs I'd have one with high camber and the other without.

&gt; How do people handle the shoulder pain? I dont get much but when I do its crippling, is the lightest chair possible what people normally aim for?

I'm not the best person to answer this as I have shoulder pain without the chair. You should not be having crippling pain however unless you've pushed it too hard that day, normally after a day of hiking my shoulders are screaming bloody murder. Were you measured by a specialist for your current chair? I wonder if the pain is more from the setup of the chair (too high, axle too far back, wrong seat angle etc) causing you to push at a funny angle rather than the weight. When I went from an off-the-peg chair to an active user the weight difference was only 5kg, which isn't a lot. The difference is more in the setup of the chair which makes it much easier to push.

I would *strongly* recommend that you go to a wheelchair department or specialist shop and try some out for yourself. They will be able to look at how you currently push and ask what you want from a new chair. It makes a huge, huge difference to have someone who knows what they're doing say 'you're reaching too far back/your plate is too low/your frame isn't right' etc.",2,,2,0,0,
93ed1e88-35dd-4aab-8679-22f44ee6975f,1452538961,You can do the process yourself but it increases your chance of denial due to a paperwork mistake. A disability attorney will work for a portion of your first SSDI check which will be backdated and several thousand dollars. The attorney will take 20-30% of that first check. Hire an attorney it will cost you nothing out of pocket and increase your likelihood of sucess on the first try. ,1,,1,0,0,
74ef6f7b-a0d3-4235-82e3-d5663eb5da2a,1453408196,The mods have been silent about this. I doubt it is going away soon. :(,1,,1,0,0,
f663867d-9aea-48ca-8ce2-a2e05ae4cb08,1453946785,"People are motivated to view disabled individuals as ""inspirational"" because it reaffirms to those people that **the world is a just and fair place**. People believe in karma for similar reasons. 

How do we square the idea of a just world with the reality of disability? One way is to convince yourself that the disabled person deserves what came to them. When that's not possible, the alternative is to hail them as inspirational and amazing. 

Disabled + inspirational = 0

By their tortured justice calculus, everything balances out. The world can still be a fair place. And the people can go back to their lives without really grappling with the inherent screwed-up-ness of the world. 

I'm sure there are people who truly find disabled others inspirational. But the underlying motivation for that feeling is disturbing, chilling. ",7,,7,0,0,
6be7e826-bf78-44c3-9011-d80b6993cca7,1452173241,"I'm amazed there isn't really anything that springs to mind for me. 

Steering ball, I guess. If have learned/started to oearn to drive before I did if I'd factored one of those in ",2,,2,0,0,
fbad7255-6578-45e7-9f58-b8e5c36bdf83,1453870139,"1 Carrying food/drink... It's either super compartmentalized or sloppy by the time I get anyway

2 cooking (standard oven)",1,,1,0,0,
e6f83a20-f8da-4dfd-814b-bb559e7fe25f,1452738470,"I think it depends on you ... If you disclose it in the application, you are opening yourself up to discrimination and bias and might not get called in to positions you are qualified for. But maybe you don't want to work for places like that? Sad but true.",4,,4,0,0,
965382d1-f951-498b-9819-deaeaf1559ec,1452998996,"Godspeed.

There's no way you can speed it up...I'm going on three years now.  The biggest thing you can do is continue seeing doctors, have them document how much this affects your life, and have them support you in your case as much as possible.

And you shouldn't have to physically meet with your lawyer to get things rolling!  Can you talk on the phone, or email?  Tell them you're struggling, it's their job to help!  They only get paid if you win.  ",4,,4,0,0,
0ddb56dc-e1a9-4313-a035-963ae97406e0,1453769239,"Well, quadriplegia is far more severe than my circumstances. She's referring me to me having to use a cane to walk as ""awful."" I think that's insulting because a) she's telling me authoritatively on something she has zero experience about and b) she's doing it in a pitying way.",1,,1,0,0,
5149106d-3d63-4b05-a5e3-68aeee282507,1454138054,"California has SNAP, it's called CalFresh.",1,,1,0,0,
77d5758f-58a3-4f8e-a4d7-7d0bc6ab75e2,1453699661,"I was studying in Australia when I had my stroke/disability. During my time as an inpatient I realized quite a few interesting things.

Many of the disabled people around me that were adults (not young adults, had been working for years, maybe have a family and/or house) and not elderly yet were mostly sharing the notion that, ""We're not disabled damnit, we are just DIFFERENT!""

Via rehab. staff (I was the youngest around and easy to talk with I guess), I've discussed with them about the hate of the ""disabled"" label from the disabled community themselves. Also, at the time there were plans for the state to provide public transport benefits (free disabled only taxis in certain suburbs) and additional assistance for public transport such as trams/trains and it was fervently rejected by the disabled community, citing that that'll enforce the stigma of ""disabled"".

To which I facepalmed.

(2007-2008 for reference). Not sure if benefits came through after.",2,,2,0,0,
027a1edc-29da-4b66-aaf2-22f18a400f4e,1453699828,"That almost feels like a shame-blocking, rather than an angry-blocking. Like ""oh, shit, I am so embarrassed I want to never encounter this ever again.""",1,,1,0,0,
5a47262f-625e-4c6e-8488-db24cfd2cc22,1451871425,"Talk to the school, they may be able to assign someone to help you take notes and tests.",2,,2,0,0,
d1199376-fc94-4adf-976c-86f6dd0c42e8,1453843862,"All that is fine.  But I don't think one universal standard exists.  If someone is wheelchair-bound, for example, the disability is probably a much more significant part of their life than if the exact same person were ambulatory.  So if I say ""don't let your disability define you"", to the wheelchair-bound person, it can rather easily come off as gloating or insensitive, yes?

I'm just not sure that there's ever a situation where saying ""don't let your disability define you"" acutally adds something to the conversation.",1,,1,0,0,
e038a184-d3ea-496f-9f65-20567dafebfe,1452365104,"Bear in mind that what you hear is only the very worst of it, the shocking stories that are considered news worthy. Mr Cameron and his bullshit 'we're in it together' *has* had an impact on disability welfare in the UK but cases like this make the news because they are still shocking. 

I am a wheelchair user and so everyone can instantly see I am disabled. I do have negative interactions with people, but they are far outnumbered by the positive ones, or by people being well-meaning if not immediately helpful. Most people in the UK are very helpful and more impressed by my wheelchair skills than put off, so the culture thing I think is in reality mostly confined to the odd arsehole and inside people's heads. 

I have a social worker who can be an advocate for me, and a disability officer who helps me fill out forms and deals with the bullshit of the DWP. These are free and available to anyone who needs them, although they are not widely advertised. We also have a free service called CAB which will help with the same thing. ESA (the replacement to Attendance Allowance) is all done over speech or textphone and can be stop-started. I have never had to hire a lawyer to file for disability, in that respect the US system seems bizarre to me. 
",1,,1,0,0,
8e9fbb3b-47d7-4aba-a16f-a8113cfe734b,1453348932,Post this in TIL.  This NEED TO BE DISCUSSED!! ,3,,3,0,0,
65134dbb-cb2c-48e9-ae49-d82fe8da5a8c,1453758467,"I have removed the rainbow flair in response to the widespread complaints. 

The rainbow flair was specified as a gradient. The stylesheet has been that way for 7 months or so but I suspect that the background gradient was being ignored until recently by most browsers. I only noticed it last week with Firefox but was travelling and didn't have time to look in to why it had suddenly appeared.

No apparent harm or ill will to anyone was intended by either the inclusion of this flair or by the removal of the rainbow flair. Many people reported it as distracting and out of place.",1,,1,0,0,moderator
c9691d3e-23af-43e5-8704-67ac14abc496,1453856329,"I was recently approved for a guide dog at one of the major schools in the US so I've done quite a bit of research on service dogs in general in the past year.  I admittedly know next to nothing about hearing ear dogs but I did some searching and found [Dogs for the Deaf](http://www.dogsforthedeaf.org/).  They are a little different from guide dog schools (at least the ones I looked into).  You will have a $50 application fee and a $500 deposit.  The deposit will be returned after 1 year of working with your dog.  Guide dog schools are generally completely free.  The other difference is that they will send a trainer to you for what looks like 5-7 days to train you to work with your dog.  Most guide schools have a one month program that is residential and will only train in the home in special circumstances.

&amp;nbsp;

I mention all of this to give you an idea of how this compares to another professional service dog training organization. 

&amp;nbsp;

I have heard about a lot of people handler training their service dogs.  I don't know much about the intricacies of managing with a hearing impairment, so I don't know how easy it would be to owner train a hearing ear dog on your own.  I know that training a guide dog is something that really only professionals can do, but the website I linked to seemed to indicate that their dogs only indicate on 7 sounds so it may be simpler to train them.  Either way, if you have never trained a dog before I would definitely seek a professional opinion from a dog trainer, preferably one that has trained service dogs before, and someone who is familiar with hearing ear dogs.

&amp;nbsp;

If it were me, I'd probably go with a professional organization that does this full time.  It's kind of a safety thing, and the $50 fee would be very worth it to me for the assurance that the dog was trained properly by professionals and knowing that I received the instruction necessary to handle it.  Plus you do get the $500 back if you are able to part with that for a year.

&amp;nbsp;

Anyway, I hope this helps, best of luck to you!",1,,1,0,0,
d21aec2a-243b-4540-8085-cfcddc583026,1452096569,That website says they are in Florida? I don't see any mention of a Michigan office...,2,,2,0,0,
