commentator_id,created_utc,anonymized_body,ups,downs,score,controversiality,gilded,distinguished
589f63c3-bad5-4542-ac39-e0e5a5dc6591,1465853352,"It is 2016.  Why this paperwork still has to be on actual paper instead of email or a secure webform is beyond me.

Even email would be a far simpler and more reliable option for many, and at low cost.  

I got my re-eval paperwork 2 months after they sent it because my mailbox is nowhere near my door and in bad weather I cannot leave the house.  I sent it back but I am still waiting for a letter saying, you took too long. No more SSDI for you.",1,,1,0,0,
400f3472-f749-43d1-901f-177f881a10a3,1465870716,"Well, no.  According to what you've said, you are still able to do work you have done in the past; even if it's just 20hrs/week.  So winning a case for SSDI is unlikely.  You may however be able to get SSI.  I think, anyway.  I only know so much, but hang round, we have a few SS employees that participate.",3,,3,0,0,
c994b5c6-8bbc-4f0c-8a88-385ea8922f08,1465752032,"&gt;  They keep basically threatening to lower or take away my benefits pretty much every time I go in there

That's awful, I'm really sorry to hear that. Those kinds of reps are the ones who give us all a bad name. ",1,,1,0,0,
f92e790d-a40e-445b-9e46-0772f4631a90,1466928541,"the thing with school is they might try to say ""if you can do school, why can't you work?""!  many other forums i've read have said that, but i dont know anyone who has...",1,,1,0,0,
bd26d6ba-eedc-452a-8f08-1ad9915e77f6,1466561680,"Usually you do not need to report a change in your living expenses, as your SSI award amount changes based on your INCOME, not your expenses. Your living situation expenses ARE taken into account for the initial award, but not thereafter, UNLESS (as in your case) when you are living with your parents and are moving out.

In your case, Social Security had counted your parents resources as part of your income when making your initial assessment. Now that you will no longer have those resources, you can expect your award amount to go up as much as 1/3 of what you currently get.

HOWEVER, you MUST report these changes to SSA to have your award amount adjusted. More information can be found here https://www.ssa.gov/ssi/text-report-ussi.htm",1,,1,0,0,
5ea9ae0d-1806-4105-831f-58318f40c7b2,1466991247,Encouraging people to be dishonest with SSA isn't going to end well.,1,,1,0,0,
9beb3a68-ca77-4c4a-b070-f9134a450038,1464749374,narcolepsy is a bit more tricky which can be in a good way for program sake anyway. I know that it must suck awful bad for you. If you have the records to support that it prevents you from being able to complete a full work week and that fatigue limits your mental ability despite treatment then it would be looked at similar to the way severe migraines or seizures would be looked at. Keep a dairy of events and struggles and do everything you can to get it medically helped. That way if worse does come to worse you case will already be well on the way to being built. Sorry for you struggle I can't imagine how bad that must suck. ,2,,2,0,0,
e377350e-ab18-48e4-a205-ff0b778257de,1465320786,"In my state it is hectic, the case loads are huge and the retention rate of examiners is in the pits.  They just approved the hiring of 90 new people there. ",1,,1,0,0,
a82bb553-721a-45e3-a70b-3284a1cb9e02,1467137258,"I also just consider myself disabled. I'm often just barely existing as opposed to living. 

I also feel bad for my kids. My older two (34 and 35) had young mom, biking, roller skating, all kinds of activities. 

My younger two (21 and 16) have old/sick mom. With them it's been a lot of games - card games, board games, etc. A lot less time at the playground. 

You give what you have. You're lucky you can still work. I miss that a lot. ",2,,2,0,0,
65eb3d01-3c5f-4f46-bbd9-7f98ef92e763,1465477293,"I would think that most airline movies already have the capability to turn on closed captioning (as with most DVDs, Netflix, Hulu, etc) but perhaps its a matter or them being asked? I know that I've flown internationally and those movies had CC to account for the language differences. 

OP, its not clear from your post, but have you been told when flying that there is no CC available? or is this just a theoretical question?",1,,1,0,0,
48aa8e29-c585-4b0b-8c48-7f063b9c4b8b,1465352057,"Is it constant hunger, or an inability to feel satiated?",2,,2,0,0,
010487db-5446-487f-a67c-6e7b1e7360d5,1465290270,Don't raise your voice or swear and sweetly say 'this is a free country and 'client's name' and I have every right to be here. Can you please keep your hateful opinions to yourself and leave me and 'client's name' to enjoy our meal in peace'. No one deserves to treated that way. ,2,,2,0,0,
ca2d5ddf-11bc-4597-abb5-d3f7ae707019,1466465109,No way would I let any outside organization have access to my son's IEP.   Problem is there are issues that schools refuse to address and a primary reason why parents seek outside services.   I made the mistake once of giving out his IEP to Easter Seals and I will never let it happen again.  After getting the IEP the therapist wouldn't listen to the issues we were having functioning in the home she just read the IEP and started therapy based on the IEP.    It was a disaster and a terrible waste of time.  He already had a speech therapist at school working on those goals I needed a speech therapist to work on real life goals which does not always coincide with what IDEA requires the school district to achieve. ,1,,1,0,0,
fbad7255-6578-45e7-9f58-b8e5c36bdf83,1465486485,"Yes. I have written 1, plan on writing more. I've looking to write for awhile, but didn't know where to start. They provide a great platform for aspiring writers",2,,2,0,0,
6004554a-52c7-4dea-97db-b00db3589ec6,1465696722,"Thank you for this response (and also to /u/49e8a211-4347-4a5c-be27-53238c676451 for some more specific examples). I'll keep these responses in mind for future. I guess the thing I struggle with is keeping on the right side of the line between intruding and making a big deal of something (and potentially embarrassing the person), and actually being able to help someone and let that be that. So - just politely offer, and take the person their word whatever their response is :)",3,,3,0,0,
65eb3d01-3c5f-4f46-bbd9-7f98ef92e763,1467073197,"You could apply now but /u/21c4c4d9-adbe-4e80-88eb-7932aaf45ade is correct in that you'll probably be what is called and ""E3"" or ""duration denial.""  While you are only 5 months out it sounds like you've made some good progress with your healing. You're right that you may never be at 100% but it sounds like you can still do sedentary work (which is what your current job is yes?). 

The other issue that will come up is that you did return to work and that work ended for reasons *other* than your back. If your job wasn't being eliminated you would still be working and that is something SSA will consider. 

You can apply for SSDI just to see what happens, but I think you have too much going against you. I think you'd be better off focusing your efforts on finding a new job. Plus, an SSDI application will take months to years to complete (depending how far you appeal) and in that time you're going to continue to get better making your chances smaller and smaller. ",1,,1,0,0,
65eb3d01-3c5f-4f46-bbd9-7f98ef92e763,1466687070,"I think that the point that /u/93877da5-ef30-477b-8c23-aafb4a265b63 is making is that the accounts are *intended*  for those people who are on government assisted programs that are means tested like SSI and welfare cash assistance.  If you aren't on any of those programs then you have no real need for the account.

By all means you are free to sign up for the account if a doctor will certify your disability. But I think that these accounts are going to have a lot of detractors in the political sphere because of people like yourself who don't really need them. ",2,,2,0,0,
ebaf9b6e-f2de-4aea-bd4e-116f2e508666,1464914519,"I'm really sorry that happened to you. �� 
That must've been very difficult for you.

I wish I knew how to help... I'm sure the other resources and ideas posted here will be good. But I would definitely buy your cookies!",1,,1,0,0,
f65afc7a-f928-4f13-b0d0-e540d9fe452c,1465283650,"/u/da912455-5c13-440f-a2dd-056ea50cd0b0 lays it out very well. I would also take a look at his specialties. If he deals with a lot of addicts, he is used to patients bullshitting him. No offense to addicts, is just part of the disease. I've had very good doctors that come off as dicks if you bs them because they want to help and honesty is one of the first steps of recovery. But, I have had plenty that once they think it is a substance issue, they will never believe other wise. In their mind, you are marked. I've had doctors tell me that 2 years sober and still having issues tell me that wasn't long enough. Or I had 1 beer in 5 months on the new meds and they insist that 1 beer is why the meds weren't working. So, give it a shot, but don't be disappointed if your doctor still doesn't take you seriously. That's when you find a new doc, preferably associated with a new medical group. Also, many pharmacies erik provide 3 day emergency refills if it is rare and not a highly abused medicine. There are also walk in emergency clinics. They usually run $100 to $200 but can give you emergency scripts if you have no other options. Best of luck to you. Also, research all your meds before taking them. I've had bad doctors put me in the ER because they didn't know their meds. I had a feeling in my gut, but asked twice and he promised it was a safe med change.",3,,3,0,0,
da0b8b33-b644-4000-9af4-39aa8c3a79b2,1466819696,"I filed for SSDI in October but only called to make an appointment to apply for SSI today because depression. My lawyer filed the SSDI paperwork but you have to apply by yourself for SSI and that has been too daunting for me. 

Would it have been good for you to have applied for both at once? Maybe, but it's not too late. I'd recommend you call and make an appointment to file just to cover your bases. You may also be required to have applied if you're seeking state benefits (which I just learned). Hang in there and good luck.",1,,1,0,0,
39a082c3-f496-46ef-a5d1-8a700adfc447,1466783598,"&gt; A trained and experienced shooter is formidable at any size.

Except in close range you would most likely be disarmed and because they would have better leverage the weapon then used against you or someone else later on.  

I do want you to be safe but once you bring a gun out escalation happens and simple taking of your wallet now ends your life.",1,,1,0,0,
400f3472-f749-43d1-901f-177f881a10a3,1464899328,"Of course we don't all think that way.  But no, they need to see the hard dark shit, and get the perception that yeah, it *really* fucking suck for all of us - so that they will create a better world for us to live in.

They don't need all three of you hanging outside the theater shouting

&gt;DON'T BELIEVE THE MOVIE, WE'RE ALL ACTUALLY VERY HAPPY WITH THE WAY THINGS ARE!!!  NO NEED TO CHANGE ANYTHING!!!  LOSING YOUR LEGS ISN'T ACTUALLY THAT DEPRESSING!!!  DISABLED PEOPLE DON'T NEED MENTAL HEALTH REFORM!!!  ALL OF US CAN LEARN TO COPE ON OUR OWN!!!",5,,5,0,0,
b4bdeef2-0ad7-4d53-b1ea-ae5b84ed1ba9,1467242253,"Thanks for the tips, I'll keep this in mind.",1,,1,0,0,
ea4fc196-d231-4d6d-a859-41863eb7d823,1466346373,"I'll add that it's rare for a camp to receive information on a child's IEP or any educational documents unless the parent gives them to the camp.  Even then, the camp is required to keep this information confidential, and only share with those on a need-to-know basis.  As a paraeducator, I never had access to students' IEPs, although the teacher often shared helpful information with me.",1,,1,0,0,
a82bb553-721a-45e3-a70b-3284a1cb9e02,1465536606,"I have several chronic illnesses but the worst has me on 02 24/7. This has dramatically changed my life. 

I must schedule trips outside the home so I don't run out of 02. I used to do stuff with my kids - roller skating, bike riding - that I can no longer do. 

It has made me sad and depressed.",2,,2,0,0,
ca2d5ddf-11bc-4597-abb5-d3f7ae707019,1466452600,"Never heard the unconditional love thing but I do think intentional or not when most people think of ID they automatically think about kids and adults with Down's Syndrome.   

To answer your question more directly it is probably because in reality many of these kids never lost their naivety.   Basically they don't recognize stranger danger that someone with a higher level of development would recognize which tends to make them exceedingly friendly (most of the time remember toddler developmental phase is also rife with tantrums).   

Case in point my child at the age of 6 crawled into a person's lap we had never met before and gave them a book.  All he wanted was to be held and read to.  Thankfully I was nearby and the person was kind about the situation but I was horrified. 

I don't know if you have 1 or 2 year old but imagine their social awareness being in a more developed teenager's body or even a young adult.   It is honestly very scary because it makes them easy victims and targets for abuse and bullying.   

Now I have met one kid in my son's self contained classroom who is very strong and has a tendency towards violent tantrums but it isn't intentional meaning he doesn't intend to strike out to hurt.   The best way I can describe it is again imagine a 1 or 2 year old throwing a physical tantrum in a teenager's body and that was pretty much the situation.   I actually had to wrestle the kid once because I was bringing medicine to my son at school and he decided to try and snatch the bottle right out of my hands  It took me and a classroom aide to physically wrestle the medicine away from him.   

I have also met a severely autistic teen at my son's school who was an arm flapper.  Once again no intention to hurt anyone but he was large and if they went on field trips the principle had to go with them because he was the only one strong enough to keep him from accidentally hurting someone with his stimming.  This kid was easily 6 feet and 200 plus pounds.  

Fortunately my son has very few behavioral issues and the schools tend to separate those with just ID and those with ID and behavioral problems so I am sure there are worse stories out there these are just the one I have personally experienced.  ",3,,3,0,0,
9beb3a68-ca77-4c4a-b070-f9134a450038,1465876028,"Appel the decision and then call, call, call. You want to talk to your analyst and explain the situation that way they can make sure your address is correct and they will know they can just give you a call to address anything that comes up. It might even be worthwhile to get a PO Box for a few months if the mail is that big of an issue. I'm so sorry you have had so much trouble. Just know there are people on the other end who do care and want to do everything they can reach a correct decision. ",1,,1,0,0,
4fe7a48e-cb15-4c62-b052-a5a3df8774fc,1465478822,You're primary care doctor and any specialist should provide the documentation you need for SSDI to review. They should be willing to work with you. ,1,,1,0,0,
c7748fe6-9f3b-424c-b567-8983be404a66,1465225502,"Man that sounds nice.  My son is on a vent and requires 24 hour supervision so we get about 60 hours a week primary nursing care, and 60 hours a month respite care.  Nurses keep his room and laundry up for the most part which frees us to do the rest of the house work and take care of the other kids, both of which have their own disabilities which require tending too :S  

I just looked to make sure, and yeah, we don't have that here.  Seems like we might have extended nursing care availability here than in Oregon but do not have the in home caregiving that I can find. ",1,,1,0,0,
f1c7ef23-d083-40e9-b16c-fc10b0ca48b3,1465543279,"Thanks, that's really reassuring. They keep basically threatening to lower or take away my benefits pretty much every time I go in there, so it makes me really paranoid.",1,,1,0,0,
c514fc3d-841e-4027-abaf-0400131297a2,1465110320,"Honestly, i applied online on the ssi website for disabilty and received my disability in under three months. My guess what be its because i have been hopitalized three times. Once for suicide attempt  (diagnosed bipolar) and twice for suicidal thoughts. (Ptsd the first time and schizoaffective disorder the second time.) I also have other health issues.i used to work helping people apply for disabilty so i think that may have given me a +1 ( i eventually got fired from that job twice because of my health issues)",2,,2,0,0,
ca2d5ddf-11bc-4597-abb5-d3f7ae707019,1465271528,"I honestly don't know how well you know this client but I would take a long hard look at their reaction before saying anything because if they don't notice then try to keep up appearances so the fun isn't ruined for them.  There are plenty of more subtle ways to make a point under the radar of your client. 

My son is nonverbal and has an IQ below 60 but his receptive language is quite good.    I have seen him get ashamed before over things I did not think he would even understand fully.   If he had picked up on the insult, I would have dealt with her swiftly and directly then spent the next 10 minutes smoothing over his upset followed with a little pick me up gift/activity to put the nastiness behind him.   If he doesn't pick up on the insult then I would have let it mostly slide by slapping a false smile on my face and chirpily wishing her a happy day in bigot land.   (I know for a fact my son doesn't understand the term bigot so that would be my safest response).  

As much as I would probably want to launch across the table and strangle her I would weight my response against my son's perception of the situation because at the end of the day he is my ultimate responsibility, not putting some stranger in her place.    

Unfortunately I find more often then not I can't take any action without drawing my son's attention to what is actually happening so generally my hands are tied because the bigger the deal I make out of it the more likely he is to get upset.   ",2,,2,0,0,
753f67ef-8f84-4687-b5d0-6003c0267e7e,1466450239,"The answer is: it makes $$$ at fundraisers. People say ""awwww"" and then reach into their purses/wallets.",5,,5,0,0,
a82bb553-721a-45e3-a70b-3284a1cb9e02,1465878988,"I've read both Temple Grandins and John Robinsons books. 

For a parent seeking insight/help I'd recommend Grandin. Otherwise I'd recommend Robinsons. It's just more interesting and diverse. He talks about jobs he had including prepping guitars for Kiss. ",3,,3,0,0,
8b5b2d99-9c31-4822-99fa-9949e3120e32,1465240980,I respectfully disagree. ,3,,3,0,0,
de0692e7-886b-4e9e-bf7f-a3aa1af845dd,1466363287,"Interesting. Our co-op requires paras to familiarize themselves with students' IEP's etc., and I know of a local camp who requests this information during the application process if I remember correctly. Perhaps it depends on your state, co-op, or school Corp? 

Edit: As I'm thinking about your response, I truly wonder if it has to do with what program you work in. Paras hired though the school Corp who work with mild students most likely do not have access to students' documents, but paras hired through my co-op or paras hired by the school Corp to specifically work in the life skills program are the ones with access to that info. I was told by admin to keep an IEP/IHP binder on hand in the classroom for paras to access freely. Our kids have much higher needs in general, whether it be academically, behaviorally, or medically. I assume it has to do with liability in our case. Anyway, OP should definitely ask if she has access to those documents. The worst she can be told is ""no.""",1,,1,0,0,
66c6933e-b2b2-453e-b4ec-cbb970926492,1465259616,"Yeah the shock and disbelief really froze me up. The problem was, the manner I would have stood up for my client probably wouldn't have been appropriate. A mix of physical and mental aggression really over came me so I just had to ignore it. It was really quite sad. But that's why I wanted to ask. I was lost for words and if it happens again I would like to have something planned. Thanks for replying. I appreciate it.",3,,3,0,0,
e4bbe09b-8408-468c-9b41-46aa15fb2a18,1465590968,"This is not true - see my reply to /u/56231b1e-544d-44fe-83af-78b1e527608f

Also you wouldn't get it for 'just' being in a wheelchair...but if that wheelchair was Rx to you by a Doctor and you *needed* that wheelchair to move around, yes. You would certainly be allowed.

Also, we do not look at college like a job. You cannot be denied for being in college full-time, but you would if you were working full-time. We can consider that you are attending college in our assessment of your mental residual functional capacity, but it can not be used as a decisional factor, so to speak. 

Just trying to clear up a few common misconceptions , otherwise you're on the money.",5,,5,0,0,
010487db-5446-487f-a67c-6e7b1e7360d5,1465289675,"Media criticism is a perfectly valid focus of our energies. We live in a society that actively shuns us and time and time again tells us we are better off dead. Society would rather we just curled up and died so we would stop demanding true equality. Why make that pool, library or park accessible when disabled people could solve everything by killing themselves? How many times have I heard 'they got paralysed, oh god, wouldn't they be better off dead'. My own father even expressed that feeling once. Non-disabled people don't want us criticizing the ableist society we live in but they needn't worry because disabled people are busy telling each other don't make a fuss, keep smiling and most importantly shut up.",4,,4,0,0,
125268e4-c8cb-456a-8260-daca8f031df2,1467194240,I found a website that has helped me called ssdfacts. It has a forum of a lot of information and a lot of advice for your hearing. I'm not sure if I'm allowed to mention that and I apologize in advance if I broke a sub rule. I went to my hearing last week for SSDI. You can still appeal after your ALJ hearing denial. Best of luck to you.,1,,1,0,0,
204f3ca9-aecf-492f-bc5f-00649c217d4e,1466752557,"I had a few incidents when I lived in NYC and I would go from 0 to crazy screaming banshee if anyone bothered me.  Worked like a charm.  
I also think I prevented a lot of incidents by meeting people's eyes and saying hi.  I would always look confident and alert and not openly display money or valuables.  I never wore jewelry other than my medical ID bracelet.  
These things have served me well in my international travels too.  I've been to lots of places that are considered not so safe and even wandered around on my own and never had a problem I couldn't banshee my way out of.  Could be I'm just lucky, but I'm sticking to what has worked for me so far.",2,,2,0,0,
1b6d1d2d-56b7-4f3e-9c59-3b4b06713228,1465172756,"I'd say the answer is a pretty solid yes.

The only arguments I've seen against that is that, of course, disability as a subculture is divided by the many sub-cultures within it, usually defined by the disability a person has, but sometimes also by core beliefs (such as whether 'person first' language matters or the concept of differently-abled vs disabled).

The same however can be said for any subculture. All subcultures can be broken down into component parts. Taking comic book fan subculture as an example, Marvel or DC^1 ? Within Marvel comic fans X-Men or Iron Man or Thor or etc? Within X-Men fans modern X-Men or classic X-Men? And so on and on and on.

With that said, I think your sociology professor/teacher is barking up the wrong tree. Subcultures aren't defined by how their norms and values are different to dominant cultures, but in what criteria that subculture has implicitly agreed on to define themselves by. Most subcultures don't vary from dominant culture in norms and values in any significant way, or even have an implicitly agreed upon set of norms or values that they share and simply define themselves by a shared interest or trait. It'd be just as blurry a thing to ask for for comic fan subculture as it is for disabled subculture.

That said, you don't get marks for being right, you get marks for giving the marker what they want. So ask yourself, what norms and values do the majority of people within disabled subculture hold?

An example I can think of for each:


Norms (how people with disabilities expect/want others to act):

1. Language. Most disabled people have stronger opinions than dominant culture about terminology for and about disabled people.

Values (what people with disabilities want from the world):

1. Accessibility. Obviously accessibility means very different things to different disabled people (ramps, elevators, public transport, audio guides, etc), but it's something that's usually considered important. Even for people who don't have personal accessibility concerns it's often viewed as a positive sign of society acknowledging the existence and rights of the disabled.


Anyway, that's my two cents. Hopefully you'll be able to think of more norms and values that you think apply and other people will chime in with their thoughts as well.

----------------------

^1. ^Or ^comics ^that ^don't ^suck.",6,,6,0,0,
