commentator_id,created_utc,anonymized_body,ups,downs,score,controversiality,gilded,distinguished
4240fb0f-827b-494d-be8d-ab33922141f2,1451894376,"I have EDS too! I just (finally) got diagnosed last week. And I'm totally getting my damn accessible hang tag. I know I look totally healthy and fine and I don't plan to use it *all* the time (probably not even *most* of the time) but the last thing I need is to go to the store on a bad day, park too far away, and be able to make it in, but not back out.",2,,2,0,0,
2e3d0f14-8180-45e0-8001-5948eaaacc28,1452229738,"I agree, but we should also consider using People First language - putting the person before the disability.  For example, choosing to refer to my ""friend with autism..."" (or ""my friend, who happens to have autism..."") is preferred over ""my autistic friend"".  I will check out the article.",1,,1,0,0,
1897cbcb-4360-46c7-b7be-5ac4f23e15eb,1452221346,"Honestly the BDSM pages seem the most open-minded as I recently discovered but that's fitting with those willing to explore kink. Otherwise though, the internet can be a bad place for this. ",2,,2,0,0,
b6b71309-1d59-4f1f-8735-b2ddd841894e,1454082104,"It's not that people with disabilities aren't a large or important group; we are roughly 20% of the US population. The difficulty is that we are a highly variable population and voting trends amongst people with disabilities aren't homogenous. While many of us tend to be supportive of government programs such as ssdi, snap, tanf, etc., which trends democrat, a lot of other issues are more sticky and our votes trend along with whatever other racial, religious or regional groups we belong to. 

For example, an anti-abortion voter with a disability is still more likely to vote for an anti-abortion candidate over a pro-choice candidate regardless of whether the pro-choice candidate's platform is better overall on disability issues. 
",4,,4,0,0,
b146d141-e209-4b54-bd30-2f70f6c4b0f1,1454050709,Define real change?  As in unambiguous and universally covered access to a range of early intervention and continuing education options based on IEP driven goals and outcomes along with bilateral (employees &amp; employers) employment-centric training and activity once people age out of the school systems?,2,,2,0,0,
009336e6-0f0e-4925-9b6a-9a8e21d2fa3e,1451745962,"I agree with the sentiment most of the comments have expressed and have first hand experiences that are similar as well. One thing I would like to point out that hasn't been mentioned but is essential is as a state agency/service all VR programs are *required* to follow the reasonable accommodations sections of the ADA and its amendments. In Michigan I have been constantly told over and over again that they would close my case because they could not accommodate my disability. Stating that only employers are required to accommodate disabilities, even being told schools don't have to follow this law. This is false. This wasn't some low or mid level bureaucrat either, it was the site director of the VR agency. Even the ""Client Assistant Program"" told me this was true.. 

I had to do endless research into what the proper paper work and procedures were and file multiple OCR complaints before they even got the tiniest indication that I might be right. Even to this day I get attitude about this concept and may have to file retaliation complaints. Apparently based on the settlements I've found online Michigan is particularly bad about following federal laws in regards to accommodating the disabled for state services.",1,,1,0,0,
37f84417-f829-4671-99d3-7ee8393787ad,1453930139,"You're welcome :)

To be honest, calling ahead has never helped in my case -  unfortunately. There seems to be some kind of loss of communication between the people you call and the people who are at the airport. I really don't know why. This is definitely something that could be improved though. 

For me, the biggest help would be for people at the airport to be able to communicate well with me and appreciate that I have a good understanding of my chair and my body. Sometimes it can be hard because the people working these jobs are hired for their physical strength but they may not be able to speak the language well (this bit is purely my personal experience in the UK, may be different elsewhere) or communicate well or they think that all disabled passengers and all chairs/mobility equipment are the same. I've been in situations where I've repeatedly said things and given tips and been ignored, only to result in damage to my chair or even unsafe/damaging handling of my own body - not out of malice, purely out of a communication barrier and a lack of understanding that one size does not fit all. Also, airline staff often don't know the regulations in place surrounding disabled passengers and on top of this each airport has its own set of unique policies. So in the end, even though you try really hard as a disabled person to organize and communicate about the situation and be proactive, the system is such a chaotic mess that all of that just gets lost. 

Maybe a consultation between airlines, airports and wide range of disabled people might help to identify weak points in the process? That's probably what I would suggest.",1,,1,0,0,
009336e6-0f0e-4925-9b6a-9a8e21d2fa3e,1453958632,"As a comic book fan (the movies don't always work exactly like the comics). Xavier's powers and his disability have always worked strangely.. When he goes to the ""Savage Land"" (An island with dinosaurs and crap where mutants lose their powers) he is able to walk again because his second body was physically fine but his mind did not process this due to the Shadow King injuring him on the astral plane, meaning when his powers are gone the block is also gone. I assume they were referencing these events (albeit poorly) in the movie.

Speaking of comic book characters that I felt were good representations of the disabled, Oracle was the wheelchair bound Barbra Gordon (previously Batgirl) turned hacker/catch all resource for the Justice League and Batman. She had this role pretty much my entire life, until in the last five years DC Comics decided to magically heal her from spinal injuries and make her Batgirl again with no real explanation. Granted, the story in which she became paralyzed treated women terribly.. However they did *not* erase that story from canon, instead they basically just erased all of her two decades worth of stories where she was a major player in the DC Universe who also happened to be disabled.",1,,1,0,0,
aa01476d-a2bf-4268-95ed-48912bbffed9,1453700424,Fantastic response! Well put! I'm sorry your friend decided to shut down instead of opening up and learning something. Your self confidence is inspiring. Did you put your response in a video? I'd love to see it if you could link it. ,2,,2,0,0,
589f63c3-bad5-4542-ac39-e0e5a5dc6591,1452554227,"There really should be a disabilities version of The Bechdel Test.

I propose:

1) The movie must have at least one character in a major or supporting role.  No throw-away characters like Uncle Biff who ""is stuck in a wheelchair"" type stuff.

2) Nobody calls attention to the disabled character(s) because of their disability.  If the disabled character needs assistance, it's provided as if it's something absolutely normal, just like in ""real life.""  Nobody refers to them by any other means than you would any other person.

3) Nobody treats the disabled character(s) like inspiration or excuses for something, or uses their disability as a plot device.  [""We wouldn't have found the stolen jewels if they weren't hidden in his wheelchair!  Who would have thought to search a wheelchair?!"" &lt;--- shoot me, please]",3,,3,0,0,
65eb3d01-3c5f-4f46-bbd9-7f98ef92e763,1452196776,"Medicare is a whole separate program however I believe that it is 24 months from the date that your disability was established. So for you that would mean November 2016. Fun fact, there are two conditions in which there is no 24 month waiting period: chronic kidney disease requiring dialysis and ALS (lou gehrig's disease). 

If you are on disability benefits you should qualify for your state's Medicaid program (assuming you meet the other financial requirements) which can help you get to the Medicare date. ",1,,1,0,0,
c29f2422-a9ca-48db-b496-6cd30e55176a,1452728561,"When you apply for disability, the disability examiner should look at all of your allegations- you can apply for endometriosis, CFS, and anxiety/depression. The disability examiner will look at your impairments as a whole, and if you are capable of doing any sort of work, not just your current and past work. The most important thing is to be honest about how your impairment effects your daily life and ability to work. You lose nothing by applying. ",2,,2,0,0,
4b7c971e-08f1-45bf-9f3d-328e7f15e005,1453598417,"https://www.ssa.gov/pubs/EN-05-10095.pdf

Page six titled ""Social Security work incentives at a glance."" Right from ssa.gov which is the Social Security website.",1,,1,0,0,
7de7fa32-cb62-4fcf-a16a-68b2e353d311,1453005838,"Contact social services to find out about medicaid to help with insurance issues. They may tell you that you have to hear about disability first, but it's a start. ",2,,2,0,0,
4603dfc1-a6c6-441d-8f71-719f862c601d,1453131152,"Oh, boy! This is the first time I'm seeing it, and it's like lasers that draw my eyes right to them. Definitely makes browsing much harder on my eyes. I'm not a fan of it. Why is the username the most important thing to draw our attention to? ",8,,8,0,0,
ea4fc196-d231-4d6d-a859-41863eb7d823,1453956582,"In my experience (deaf), they create a goal for you first.  It could be to get a full-time job, to get a college education that will lead to permanent employment, etc.  Then they will set you up with whatever you need (within reason) to achieve that goal.  This could include scholarships for college, a job coach, accessibility devices, vocational training, etc.  After you have achieved your goal, they will continue to work with you for 6-12 months, then close your case.",1,,1,0,0,
d5090459-b682-4c7e-b441-f4bc002794e7,1452251830,"When I go out I use a wheelchair, and my 4 year old thinks it's her very important job to push.  It's so frustrating because I can't get any speed up, and she's not great at pushing, so it just makes my life harder.  Plus we have to stop for every little old lady who wants to tell her what a good job she's doing and tell me what an angelic child I have.  Just sit on my lap, child!  Although I've been super lucky that she's very cautious and never wanders off, I'm constantly worried she'll run away into oncoming traffic.  

I like your last sentence, my four year old is more of a whiner though, so I guess we'll do that together instead!",1,,1,0,0,
906a1327-1da9-49f9-b530-46b08b987186,1453636840,Best option would probably to be getting in a sign language interpreter and filming meetings.,1,,1,0,0,
6508d5b7-fc32-4902-8c8a-1a64015d7bfe,1453576731,"You cannot be ""legally blind without glasses"". The definition of legally blind is a prescription of 20/200 or worse with *best corrective care* so if your vision is better than 20/200 with glasses contacts or surgery you are not legally blind. ",1,,1,0,0,
fd4f56d3-7479-496c-a3c2-54e15fa6e327,1454250384,"&gt; I dread the day when I will be told that I'm 'no longer considered disabled enough' 

Happened to me in May.  The determination was made in another state, mind you, because ""we can't handle all of the claims"". My reapplication just got denied last month for the same reason, and it also had some factually inaccurate information about how much I was getting paid and for what reasons I was applying.  So now I have to hire a lawyer to appeal so I can have a better chance at success, albeit at the cost of 25% of whatever backpay I get. I'm just lucky my family has helped with my meds and other non-food ""must haves"". If it weren't for EBT, I'd starve. If it weren't for HUD, I'd be homeless. 

Louisiana doesn't give a shit about the disabled. My neighbor has one leg (and it's paralyzed), chronic headaches and is confined to a wheelchair, all from being hit by some well-connected prick (while neighbor was walking).  He was awarded court fees and medical bills, nothing else.  Had to appeal *twice* to get disability. Sickening. ",3,,3,0,0,
4cb9a6e7-994c-4f8c-af41-3daae3f52af4,1453334218,"It is a good thing IMO. I simply showed up at the appointment and answered questions. Apparently it helps to have a ""good doctor"", but all I did was be myself. Seems like people know immediately that I have brain disorders; I am a bit more stable now, but 6 years ago I remember how I behaved.",1,,1,0,0,
1ee91c92-fba0-4636-8187-ddd622c99583,1451817325,"The public would love to walk streets full of beautiful people, thats why they hid them  ( the disabled ) for so long. Its only been 20 years since that was changed here in Australia. But i face the publics distain everyday with my clients, they still want them to be out of sight. That attitude  wont change. I believe its like racism, it can be very suttle or it can be very overt. Either way,  i am not backwards in fighting for my clients. The public are note very bright, how often do they quiz themself about there own biases, how often do they try to modify  there outdated views. I would have to say they dont. A good example is music,  i listen to new music all the time but friends of the same age seem to be stuck listening to music of there youth .  So i can only assume that social attitudes  are the same, stuck in there youth and are not modernised. At least our goverment is looking forward with policies and laws but thats not the public. The fight for social justice continues.",2,,2,0,0,
4e474cdd-3f71-4e94-8b7e-cfdfad11be3b,1452329694,"&gt; no more exploited

Exploitation is still immoral, whatever the means and whatever the outcome.  I see your point of view but respectfully disagree.  ",2,,2,0,0,
65eb3d01-3c5f-4f46-bbd9-7f98ef92e763,1453381565,"Thank you for adding that! While providing transportation is not legally something that SSA is required to do most States have some form of transportation assistance. Mileage reimbursement (if you have to pay a friend to take you), taxis, and bus passes are the most common. 

Sometimes these transportation requests require pre-approval through an examiners supervisor so make sure to let the DDS know as soon as possible that you have transportation needs. Often times these funds are very limited so please don't be that a-hole who wants to get a taxi because you just don't want to take the bus. ",2,,2,0,0,
589f63c3-bad5-4542-ac39-e0e5a5dc6591,1451716561,"On the one hand, I really hate the ""So-and-So did this, so you can, too!"" bullshit.  I'm not So-and-So, and their challenges are not every other person's challenges.

That said -- I love to cook but had to stop using the stove because it's a normal box stove and I kept burning myself on the edges of pans and such.  


Until I can live somewhere with an accessible kitchen, I've learned to make almost everything in the microwave.  Sometimes there's a lot of trial and error to get things right, and some things are completely impossible (ex. sunny-side eggs or proper potstickers), but for the most part I've adapted all sorts of recipes.",3,,3,0,0,
589f63c3-bad5-4542-ac39-e0e5a5dc6591,1452216983,"In the past few years I've had a couple of ""doctors"" try to tell me that I'm really just lazy and on welfare, instead of disabled and on SSDI.  (And they made this determination without even doing an exam!  Such superpowers!)

My biggest fear is that the SSA will find their notes and use it to remove my SSDI qualification.",5,,5,0,0,
4cb9a6e7-994c-4f8c-af41-3daae3f52af4,1453836815,"Right with you. Enjoyed your perspective.

I like what you say about the NFL. I like watching games, but after 40 years of exposure, I never thought I could be anything but a coach or support staffer. As a   ""dwarf"" I know my physical limitations. As a person with a brain disorder, I am usually in a psychotic state. 

I can define myself as human male, but my height and brain/nervous system are generally dysfunctional in regards to most professional sports. 

My brain is still an asset, and my BFA in Fine Arts (with strong liberal arts credits) means I should excell in the creative economy, but even then, my ability to socialize is quite impaired. 

I agree, not many folks can just pick a random vocation and be the best at it. ",1,,1,0,0,
4cb9a6e7-994c-4f8c-af41-3daae3f52af4,1452126923,"Yes, I think applying for, and receiving disability benefits means that the applicant is agreeing to be investigated by the Federal Government. ",2,,2,0,0,
e331d1f6-573c-45e2-8990-cd3aa0f194a0,1453741592,I will also add that it is painful for me to read. And it seems to be quite unnecessary in a disability sub.,6,,6,0,0,
a91a6f6a-627e-4625-b018-772584b531b2,1451943771,I couldn't even find it...just as well I suppose.,1,,1,0,0,
65eb3d01-3c5f-4f46-bbd9-7f98ef92e763,1454026672,You need to call SSA and tell them that you are working. Your income may make you ineligible for disability or your income may require your check to be lowered.  The sooner you call and report your work the better it will be in the long run for you. ,2,,2,0,0,
302b4a88-f024-47ee-85fa-b9d8ba50b008,1451857499,"What did you say about your disability? This hasn't been my experience, sorry to hear this.",3,,3,0,0,
6be7e826-bf78-44c3-9011-d80b6993cca7,1451923075,"All makes perfect sense to me. I have CP and no use of my left hand. I'm dad to a 17 month old boy, and I managed to dress him myself (t shirt, top, trousers, socks) for the first time this morning. Much joy. 

I can change him now but only since 6 weeks ago when we started experimenting with potty training and swapped nappies for pull ups. Now he's older he's more able to assist in doing things like dressing and changing, which helps. 

Frustrating doesn't cover it. I have bad days physically and bad days mentally; I was in plaster for about three months Jan-Apr last year (long story) and went about 6 months in all not being able to pick him up at all. 

But he still loves me. And his most basic need is to be loved. I can do that no problem, CP or not. 

Good luck with it all :-)",3,,3,0,0,
65eb3d01-3c5f-4f46-bbd9-7f98ef92e763,1453381819,"You can always try to request the records again but honestly that kind of information is not something you really need moving forward. In previous times keeping documentation was recommended as paper files quite often got lost, the papers got ripped/fell out, etc. Now everything  is done electronically. If you have a previous paper file and you get a CDR your previous file is scanned in electronically and then it is destroyed. 

If you decide to push the issue its not going to risk your SSDI at all but honestly you're going to really irritate the field office with continued requests. ",1,,1,0,0,
4603dfc1-a6c6-441d-8f71-719f862c601d,1453133490,"FYI, u/accounthaver25 &amp; u/southtexasdeathride if you are using the regular internet site to browse, there's a little checkbox in the sidebar on the right where it says, *Show this subreddit's theme*. If you uncheck it, the rainbows will disappear!",8,,8,0,0,
15186324-4c93-4518-b6cb-1b752acc9706,1452326134,If you want I can fix that problem...just let me go get my baseball bat (sarcasm),1,,1,0,0,
7a5c9f4f-946b-41d7-a71e-9bffe94f52be,1453993543,"&gt;the system is such a chaotic mess that all of that just gets lost.
You said it right there.  

Oh man, I work for a wheelchair assisted transportation company and we deal with all kinds of systems that people are in and it is very chaotic at times.


&gt;Maybe a consultation between airlines, airports and wide range of disabled people might help to identify weak points in the process?

That is logical but will be a difficult undertaking.  Especially since airplanes are probably not designed for carrying wheelchairs.  Perhaps discussing the wheelchair loading procedure with the industrial engineers that designed the boarding process would be beneficial.",1,,1,0,0,
27809ccd-4f22-4c7d-b2ad-a6fb15cb6f3d,1454234621,"Dude, I'm in a wheelchair and I get it too. Had a couple standing behind me at a supermarket checkout discussing if they bought a wheelchair would the government give them free money. They shut up fast when I pointed out that my chair cost me £3.5k.",5,,5,0,0,
2289cbba-017a-4b67-a1a8-ff9d0856f41f,1451905785,"Wow I can't believe this, why do people think it's any of their bloody business to ask about reasons for parking etc.

So much prejudice around invisible disabilities and illnesses.",4,,4,0,0,
dd19c642-f242-477f-a6f8-b376d9b6fde3,1452189250,"May i ask you: Does medicare start 24 months from the onset of illness date, or 24 months after approval for ssd. My doi is November 2014. I was approved around June of 2015. Will I be eligible for Medicare this november, or June 2017?",1,,1,0,0,
c381a2a1-8eb4-4f49-bd7b-ae1d8f7011de,1453901794,"Unless the money is inserted into an account they know about, I don't see how they could know. Also, unless you're dipping into 4 digits, I doubt they're going to care.",2,,2,0,0,
753f67ef-8f84-4687-b5d0-6003c0267e7e,1452782638,"Spitballing: I bet you could make a ""hatchback"" shoe where you put the back end of it down, and slide your foot into it from behind, then raise it back up. Maybe that's a stupid idea. I'm no cobbler.",1,,1,0,0,
589f63c3-bad5-4542-ac39-e0e5a5dc6591,1452377831,"Well, now you know.

And knowing is half the battle!  

:)
",1,,1,0,0,
74ef6f7b-a0d3-4235-82e3-d5663eb5da2a,1452905056,"There is a legitimate concern that we are eliminating a part of human biodiversity. People with Down syndrome are a marginalized group of people and Down syndrome is a perfectly valid way of being. There *should* be people with Down syndrome in the future!

Maybe not everyone can, but a lot of parents who can raise children with Down syndrome abort because they have been, as Stella Young describes, sold the lie that disability is a bad thing. It is the parents' choice, but societal attitudes are leading to the loss of an entire group of people.

And don't describe fellow human beings as burdens. Please.",1,,1,0,0,
c381a2a1-8eb4-4f49-bd7b-ae1d8f7011de,1452745071,"Which brand specifically? 

It's a shame how poor the selection is for brace-friendly shoes.",1,,1,0,0,
589f63c3-bad5-4542-ac39-e0e5a5dc6591,1453942059,"I doubt the SSA would know or care.  Remember that with SSI they're also concerned about assets, so don't go buying any cars or boats with your gift certs. :-)

But, seriously, I would advise against selling them for cash. That's again probably something nobody would ever notice or care about, but it's just iffy enough that I would worry about it.",1,,1,0,0,
c262aba1-a72e-458a-a126-084d8a6e4791,1451940554,Very true. We're the minority that they feel they aren't required to put up with...,3,,3,0,0,
eeb1b94b-ce41-4235-876e-51a71f7da9c3,1454065419,"There's not enough of us to matter. That's a cold, unfortunate truth.

I remember reading something from a book on disability a long time ago, about politics. ""Politicians tend to ignore disability issues because they are a statistically insignificant voting block."" That's stuck with me ever since.",3,,3,0,0,
a32f58d1-cfdb-4c77-bfd7-d6bffef5e1c2,1453373147,thank you what is that definition do they have a blue badge in the usa ,1,,1,0,0,
7a5c9f4f-946b-41d7-a71e-9bffe94f52be,1454014848,"At JFK airport, it seems like they pass all the terminal process on to the airline: 

&gt;Call your airline or travel agent and ask them about access to the terminal, boarding the aircraft and any other special needs you may have.

from http://www.panynj.gov/airports/jfk-accessibility-services.html

I guess each individual airline needs to be contacted regarding wheelchairs on planes.",1,,1,0,0,
4b2b53ca-5d94-4f73-a3a1-6d9fb39d6aee,1451673717,"You've received good advice, but another option is takeaway from his fave places, too. Chains like Ruby Tuesday (at least the one near me) even have a drive-thru and you can call ahead and pick up your meal. It was really helpful when my mom was in a nursing home and I wanted to bring her a steak or something.",1,,1,0,0,
c29f2422-a9ca-48db-b496-6cd30e55176a,1453432039,"The doctor asked you to move in various positions to gauge your range of motion, how far you can move your cervical spine, lumbar spine, shoulders, hips, etc. This is very standard in exams and orthopedic assessment. The consultative exams (CE) are one-offs, the CE provider does not know you well, but usually receives some medical records. The CE provider has to get as much information as possible in a short amount of time, so asking you to move into various positions and measuring how much and how far you can bend is very good objective evidence. 

If you want, call your examiner and tell him/her that you rested before the exam so you could drive there, and you were in a lot of pain after the exam. She/he can take that into consideration. 

The reason you had to drive three hours is because there is a shortage of providers in almost all states. They provider has to agree to give the exam for a specific, and usually much lower, fee than they usually charge. If you live in a rural area, they scheduled you for the soonest exam as close as possible. ",1,,1,0,0,
74ef6f7b-a0d3-4235-82e3-d5663eb5da2a,1453010509,"If you are actually behind this, OP, thank you. :)",1,,1,0,0,
a32f58d1-cfdb-4c77-bfd7-d6bffef5e1c2,1453372351,Hi SUCKSLUMPS yes your correct it does create a false image i think its time to change it any suggestions welcome .thanks,1,,1,0,0,
