commentator_id,created_utc,anonymized_body,ups,downs,score,controversiality,gilded,distinguished
400f3472-f749-43d1-901f-177f881a10a3,1465864426,"Expect your participation to be required for success.  There's a misconception that you show up and they just stick you in some menial envelope licking job.  That's *not* how it works.  They provide help to overcome your barriers to employment in your desired field; be it assistive tech, certification classes, trial work to test your limits and gain resume filler, etc.  It will only go as far as you're willing and able to go; but if you do not show initiative and desire for progress, I would not expect much investment in yourself from them.

What you should expect in the beginning, is a few simple assessment tests.  These wont make you look good or bad; they are designed to discover your natural inclinations and skill sets.  Knowing where you can improve to make yourself a good candidate for work is very valuable.  It also will help point out why types of jobs you would naturally be good at (even *within* your desired field).  Just be open minded about it all and remember you control the pace.",2,,2,0,0,
ad42a842-27f0-4778-966d-f4e0aa02557b,1467301631,"Here's a direct quote from a person with disabilities - hoping it helps you in your wonderful endeavor:
""I do my best when traveling to arrive at a hotel/motel before the evening rush or dark. If the hotel/motel is not accessible it gives me time to find another place. When renting a car with hand controls I always make reservations with two rent a car companies. The odds of the car being present is 50% I call from terminal and go to the company that actually has the car... High beds are the rage in hotels. I never make a reservation at a good hotel without asking about this... My favorite access fails typically involve a swimming pool at ski resorts. Many resorts have heated out door pools. A ton of fun to swim in hot pool after being in cold all day. I have been to resorts that had wheelchair lift to get into the pool. Great. Little problem is to access pool requires going up a bunch of steps. Ignorance abounds.""",1,,1,0,0,
81e3ece9-1d90-4712-8c67-633947fa89fc,1465515660,"I'll give it a go,when i was moving into a place in 08 i went to the local office &amp; they told me that my place didnt exist....something about if they cant find it in whatever list of roads they use,even if i get mail there it doesnt exist.i didnt know whether to do a facepalm or pass out from frustration lol",1,,1,0,0,
b4bdeef2-0ad7-4d53-b1ea-ae5b84ed1ba9,1467242222,"I got a letter a week ago telling me I had a hearing. It's been almost a full year since there was any status on my case, so I didn't take any action. I was living in my car with my dog and my son. No, it shouldn't have gotten this far with out mr hiring a new attorney but at the same time I had more pressing priorities.",1,,1,0,0,
de0692e7-886b-4e9e-bf7f-a3aa1af845dd,1466394426,"Yes, that makes sense. All of my paras sign confidentiality agreements. The local camp I referenced requests IEP's directly from parents/guardians, so the school does not provide those. In the application, the camp states that the IEP remains confidential and is shared with staff on a need-to-know basis to provide the best care possible. Obviously those staff members sign confidentiality agreements as well.",2,,2,0,0,
dd5ba938-8e66-497b-aa3a-5b82d384ce26,1466873490,"I went through 4 years of undergrad, 2 years of grad school, and 4 years of medical school without it affecting my SSI",3,,3,0,0,
52125029-ef34-4266-b616-59e0978be810,1465669892,"I honestly just have always had family or friends bring me around. When I bring up the desire to learn, my family seems to get nervous about the possibility. I've brought it up with the social worker and she told me that my local school for people with disabilities is not accepting new applicants at the moment due to a lot of staff turnover.

Regarding companies saying no, I just feel people see me and make a lot of assumptions. I represent risk for a potential employer. That coupled with the fact that I have literally zero work experience makes me easy to pass on regardless of how intelligent I might be. Regardless, hearing about you getting a job has given me a bit of hope.
 ",2,,2,0,0,
48aa8e29-c585-4b0b-8c48-7f063b9c4b8b,1465963392,"It's my understanding that a person on SSI may not have more than $2,000 in the bank if single, or $3,000 if married.  

https://www.ssa.gov/ssi/text-resources-ussi.htm",2,,2,0,0,
11701371-6c4f-401e-9763-7a0168485ed8,1465353156,"One as a result of the other. People with PW never feel full, which causes the constant hunger. The medical term is hyperhagia. 

It's currently not known exactly what causes it but it's thought to be linked to hormones, particularly those produced in the hypothalamus. There are several endocrine system issues that exist with PW outside the hypothalamus including skeletal growth and fertility issues. ",1,,1,0,0,
65eb3d01-3c5f-4f46-bbd9-7f98ef92e763,1467138797,"The SSI system can be unfair in situations like yours but it is always important to remember that SSI is a *needs based* program unlike SSDI which is a program that an individual paid into with their FICA taxes.  If you are working then the theory is that you are less ""needy"" than if you were not working.  To have that kind of decrease in your check you were probably earning maybe just under $1000/mo? It may not seem like it, but to SSA that is significant amount of earnings. Most people think of work as a full-time thing but to SSA you only need to earn $1130/mo to be completely ineligible for the program. 

Are you sure that you aren't already receiving some type of SSDI? You said that your monthly benefit amount is $810 but the current SSI max is around $730. Even though you haven't worked if one/both of your parents is deceased, disabled, or retired you can get SSDI based on their SSN rather than your own. 

It sounds like and your mom are in a tough financial spot. You  mention that your mom has never worked; is there any reason for this (other than caring for you)? I think that the best solution to your guys' problems would be for her to find a way to bring in an income. ",3,,3,0,0,
d43ea476-9a65-4aa9-8133-c4b9e5b6ea8e,1465703231,"Benefit advisor here.
The first question SSA will ask is, has your condition lasted or is it expected to last at least a year. Sounds like you meet that requirement. Question two is, what is your disability and when did it start to limit your ability to find and hold a job. SSA is only interested in your medical history from the last two years. So you already have most of that information. One last step before you contact SSA, is to sign up with your state's Office of Vocational Rehabilitation Services. This free program helps folks with disabling conditions find ways to work despite their limits. The reason you need to sign up for this program is they will examine your skills and test your ability to find and keep a job. Because of your age and lack of work history this information will be essential to prove you have a disability. The test results will be your best proof that your disability is real! If you feel you need help to accomplish the above; seek out your states Independent Living Centers web: www.ncil.org Most states fund ILCs to assist folks understand, apply for and maximize benefits and social supports. The service is free. PS, If you want to try to get SSI based on your mental health problems, you would have to seek treatment ASAP and obtain a diagnosis and treatment plan, before prove your condition is so bad that you can't do any kind of work. Hope this helps, PM me if you want more details. 












  
  
  
  


 


 
 
 






 



 
  
  













 




 ",3,,3,0,0,
1f7b75e8-9ad2-4847-b1db-98a614f98445,1465326467,I'm sorry to hear that your father expressed that sentiment.,1,,1,0,0,
4b427d9c-8e3c-40b7-911c-1296ac9a42cb,1465991935,"I've changed, if you don't believe that, fine.",1,,1,0,0,
0a6db910-af33-491c-9fb5-7e0362c01de5,1465702647,Desk job? Like what? Any suggestions are welcomed.,1,,1,0,0,
4cb9a6e7-994c-4f8c-af41-3daae3f52af4,1465241138,"I feel solidarity with folks who are overtly disabled. There is a norm about bodies and minds -right or wrong. The norm is distinct in regards to factors like optimal physical capabilities for certain tasks or jobs. Mental capabilities are the most important factors though in our current time period.

I am physically capable of work, but mentally, I am already fired. 

Even common interactions are difficult, so that means sustained group interaction is almost beyond me. 

I am out of the ""game"" -sometimes as much as a person without physical mobility. Dwarfism is a factor in my life, and adds to the exile.

I have never felt like a ""normal person"" in regards to physical or mental abilities. I take responsibility, and improve or work on stuff, but that does not change my status.",1,,1,0,0,
da0b8b33-b644-4000-9af4-39aa8c3a79b2,1465454566,I am not an examiner but I've read on here plenty of times that if you're working while waiting SSI/SSDI will pretty much assume you're capable to keep working. ,5,,5,0,0,
0e18b23b-da4b-4ad0-8215-6e162a54c7ba,1466721580,"I carry a firearm and two knives on my wheelchair. I've been shooting since I was about 7 years old and I've been very successful at hunting so I feel fully qualified and prepared to carry and use a firearm with my disability. As far as knives, one is a hidden folding knife and the other is a sheath knife, both of which I use regularly to open/pry/shape things.

As others have already said, it's best to just give them what they want. However, if someone wants to hurt me they will need to earn it.",3,,3,0,0,
e9129e83-1f21-49e6-98f1-cdeef4b5a4fa,1466714930,What kind of doctor would I have to go to for something like that? My current doctors are not very helpful with anything.,1,,1,0,0,
204f3ca9-aecf-492f-bc5f-00649c217d4e,1466173406,"Hi fellow zebra!  I agree that it is sometimes difficult to find motivated people with our condition.  I think so many people are beaten down from years of misdiagnosis and poor treatment which makes it hard to try or even think of something better.    
I went to a controversial speaker at the national EDS conference and he had a good point about people either being survivors or victims.  From what I have seen, this is pretty true.  (Although people can change. It's not a life sentence.) And the survivors tend to have better health and better quality of life.    

I like to think of myself as a survivor type most of the time.  I have to fight really hard to do a lot of what I do, but at least I'm still living (and working, and traveling and having some fun.)  There's no cure for EDS, but I've gotten a lot better from when I was bed bound seven years ago.  Meds, exercise, and doing stuff helped me get there.    
  

You'll find your peeps, don't worry.  :0) ",2,,2,0,0,
d50d74ec-55db-41d5-906d-598b488b19c8,1467320791,"I know this was deleted buuuut I wanted to mention that for this student you'll need a CDI (a certified deaf interpreter). Even if the student doesn't use ASL, a CDI has the experience and resources available to figure out what is being communicated. This is true with home signs and signs in different languages. You'd be surprised by how much we all have in common ��

That being said, a CDI needs a hearing ASL interpreter to team with to voice for the hearing individuals. Working once a week with a CDI can help students a faculty learn signs the student is familiar with and bridge the communication gap. (For example, the CDI establishes that when the student opens their mouth and points it means ""I'm hungry"". So from now on when a teacher or peer sees that gesture they know what it means and can act accordingly)

Best of luck!",1,,1,0,0,
d43ea476-9a65-4aa9-8133-c4b9e5b6ea8e,1464752328,"Benefit advisor here,You can try contacting your nearest Independent Living Center. Search web: www.ncil.org.http://www.ilru.org/projects/cil-net/cil-center-and-association-directory. They will help you understand how to obtain the benefits and support programs you need to find a safe affordable place to live. The help is free, and if they follow the same rules that we do, can go to your home and fill out the forms.",2,,2,0,0,
8b972f96-7f9c-4d57-b0ab-14c841e70eee,1464847936,"How about you read off a list of similar movies in which the disabled character offs themselves simply because they're disabled? Or hold mock funerals for the dead disabled characters and have the ""preacher"" explain from the pulpit that maybe they would still be with us today if they had adequate attendant care, functional wheelchairs, treatment for their depression instead of others telling them ""if I were like you I'd kill myself"", a society that didn't desert them, etc.…",3,,3,0,0,
14249c93-8037-4997-a924-19b81473b73b,1466184955,"I brought up my need for accommodations/environmental controls at my last job AFTER they made me the offer and before I accepted. 

I think RambleRamble makes some great points. Odds are the issue of availability and scheduling will come up, and if not you certainly can bring it up. But I would advise not bringing up the medical/disability schedule needs until after an offer is made.",2,,2,0,0,
e377350e-ab18-48e4-a205-ff0b778257de,1465203165,"One of my medical problems is that I have an essential tremor.  We have our own groups in many large towns.  We have our own pages on Facebook.  There is an International Essential Tremor Association that is the spearhead for setting up medical seminars for us.  On our Facebook page we all have the same problem so we can laugh at our situations that we are in, because we have all been there.  We pass on knowledge about new meds, New devices for our problems, and research studies.  We have our own jokes that someone who doesn't have a tremor just won't Truely understand.  

",2,,2,0,0,
30c5b634-d237-4b27-a37f-e32a3fd44a4f,1464916104,I wouldn't if they are doing it over the phone.,2,,2,0,0,
02d0222c-f8d7-4c37-b234-38d0b8c36503,1466065732,"Other half of /u/0d8c6e4f-b833-4050-9823-b988e3ec0980 (thank you, my love :)

As usual, communication is key, but communicating about communication can be tricky to begin with. I agree with /u/543a3951-e13f-4df2-a73f-c75e98b0f009 that the likely best path is to grant your girl the same kind of honesty you're sharing with us: allow her to see your vulnerability by admitting you can't solve this yourself, &amp; strength of character in inviting critique. I've been on the receiving end of this kind of ""how can I talk to you about X"" approach, &amp; it is beautiful. It says ""I care more about our relationship than I do about my anxiety &amp; fear of looking bad"". I've also been on the approaching end, &amp; while scary at first, it gets easier as you better learn how to speak each other's language.

&amp;nbsp;

&gt; I'm afraid that I'll cause her more stress by making her think that her disability is affecting both of us

This is a really valid concern, &amp; kudos for exercising the maturity &amp; empathy required to see it. I am a C5/6 Complete Quad, &amp; my disability has a profound effect on our relationship. I'm acutely aware of this every hour of every day. Every single compromise we make, every assistance I require, every plan we set is moderated by my disability. As such (assuming relevant similarities in our situations) there are 2 sides to the issue:

1. You are not telling her anything she doesn't already intimately understand. I promise you that if she is half as self-aware as you seem to be, she knows that her disability affects you, even the times you haven't seen it yourself. She may be scared that by bringing it up, naming the issue, she may catalyse conflict or cause you to resent her needs. She may be hoping to endure until circumstance improves, thereby sidestepping potential negativity. I've been there - it's a fairly natural tactic &amp; it *can* be useful if the issue is trivial: ""I don't like these dining room chairs, but I'll soon forget they even exist"". With an issue like disability, it can rot away confidence &amp; harmony. She may be ecstatic you speak first, as it's implicit ""permission"" for her to speak openly too.

2. Mindful of the toll it probably already takes on her mental &amp; emotional state, it is prudent to have a solution-focussed mindset going in. If the message is distilled to be ""your disability drains me/us"", it's understandable that she may come to see the topic as even more taboo (n.b: that's not to say this kind of conversation can't be had, there is certainly a place for venting, but in your context, /u/b9619313-71b7-49cc-a4f3-494d7c08a749, you need to establish robust communication channels first). Show her that the reason you need to talk about it is that you want to add tools to your toolkit or action some positive strategy.

&amp;nbsp;

Perhaps a personal example paints a better picture:

Within the context of my disability, I'm usually extremely active. I (as an ongoing or intermittent activity) drive, travel, work full time, start too many side projects, go to concerts, festivals, plays, movies, language classes, date nights/weekends, go on road trips, eat out (more than I should), &amp; otherwise socialise with family &amp; friends. This is who I am, &amp; what our relationship formed with. In the past year, however, a few health complications have rendered me pretty useless in contrast to normal life. The timing is terrible (between us: moving interstate, job promotion, job resignation, job seeking in new state, major surgery for father, niece with very rare syndrome undergoing record-breaking surgery, hospitalisation for anaphylaxis, tight financial situation, transition to new health providers (NDIS), etc), &amp; through no fault of either of us the load on my girl has increased dramatically. We have had many conversations about our circumstance &amp; the challenges in that scope. Our best discussions have usually included some key similarities:

* The issue has been identified explicitly &amp; clearly. Sometimes this takes time, especially when a root cause is easily lost in the noise of exhaustion, anxiety, ego, etc. Sometimes it takes a day or two of introspection to differentiate signal from noise. By being so specific we are able to keep our conversation focussed on the solution (e.g: ""I feel that [subject], while certainly something we should discuss, is out of scope for now"").

* Before trying to solve, we discuss the issue &amp; dissect it in detail. The point is to not just identify the root, but to also understand each other's motivation &amp; justification for their view. This includes lots of ""the reason I do that is..."", ""to me that comes across as..."", ""an analogous situation in context you're more familiar with might be..."", etc.

* We *explicitly* verbalise our gained perspective, our apologies, &amp; our praise, so that we both feel heard &amp; understood, &amp; can validate our solutions. This involves phrases like: ""I can see how by doing [*specific* action] I make you feel..."", ""I'm truly sorry that I unfairly chastised you, &amp; I now see how hypocritical I was for..."", ""I notice how much effort you put into [action], &amp; I'm extremely thankful to you for...""

* We take action, &amp; praise each other for it. ""I feel like [issue] is so much easier now, &amp; I'm incredibly grateful for your hard work in..."", etc.

I know this seems very general advice rather than disability specific, but hopefully it helps you in approaching the current conversation as well as future ones. With this shared attitude towards communication we have been able to discuss some challenges our current situation presents. I'm so proud of our relationship, &amp; it's a testament to my beautiful girl's dedication to our bond that we can have an overwhelmingly positive conversation about subjects that could so easily create conflict &amp; resentment. We have only recently had more exceptionally honest &amp; uncensored conversation with minefields like:

* ""I was overwhelmed caring for you without proper supports"" - after an emergency room visit &amp; admission to a hospital with poor understanding of SCI support. An extremely positive talk, with a solution reached with the preemptive inclusion of family support should the situation arise again.

* ""I know it seems like a selfish complaint when I'm not the one with poor health &amp; there's no fault on your behalf for being unable, but I struggle with not having the 'real you' around. I miss going on dates, having an active boyfriend"" - a time where I was bedridden without even a few hours here &amp; there out of bed. A difficult talk, as I felt guilty already. By discussing so honestly I came away feeling an enormous weight off my shoulders, as I was able to see how she compartmentalised her disappointment in our situation from her feelings about me/us. She allowed me to similarly disassociate one from the other.

* ""I crave the full return of our *very* active sex life, but I understand that your recovery takes precedence. Your long-term health is my priority, but I need you to know that my desire for you has not diminished *one iota*"" - when our usually voracious intimacy has been limited by my recovery. So important for my mental health in knowing her disappointment &amp; cravings mirror my own.

* ""I absolutely appreciate that your life includes some non-standard accessories, but some of the medical equipment in use makes our bedroom feel a bit clinical. If there are no alternatives I will never complain, as your mobility is the importance, not my aesthetic preferences. If there are alternatives however, perhaps we could explore the options?"" - when my clunky old hoist takes up a large footprint in our new apartment. Such a difficult thing to bring up, &amp; I know she felt guilty for doing so. The outcome was me concurring, &amp; a flush-mounted ceiling hoist explored. 

While disability is a very visible use case, the tools you use to communicate in this way will strengthen your whole relationship - from &amp; for both of you, &amp; regarding subjects from choosing dinner to establishing child discipline ideals. A good couple will feel free to say ""I love when you do X""; a great couple: ""I feel invalidated when you do Y"".

&amp;nbsp;

Your language is so wonderfully appropriate &amp; mature: ""I'm frustrated by/because of X"". The fact that you're asking important questions should give you confidence that you're capable of a great relationship. Well done, &amp; best of luck!

&amp;nbsp;

^^^I'm ^^^SO ^^^sorry, ^^^I ^^^got ^^^a ^^^*little* ^^^carried ^^^away... ^^^I ^^^can't ^^^help ^^^myself ^^^when ^^^it ^^^comes ^^^to ^^^topics ^^^close ^^^to ^^^my ^^^heart!",4,,4,0,0,
e9129e83-1f21-49e6-98f1-cdeef4b5a4fa,1465471880,"Thanks. My therapist and psychiatrist are beyond furious at the lack of help I am able to get because they know how much the pain has ruined my life. 

I knew this was going to happen. The problem with my pain is that is comes and goes so it'sreally hard to document. When I was doing PT my therapist had me practice lifting since I had to do that in my previous job. I can lift a 5 or 10 lb box but if I do a few hours later my nerve pain gets so bad I can't put any weight on my foot. My pain is so bad at night that I barely sleep but my doctors don't see that so they act like nothing is wrong with me. 

I'm going to keep trying since I have had so many failed work attempts that I know even if I could get hired I couldn't keep a job. I just have no idea how to document all the limitations I have.",1,,1,0,0,
e4bbe09b-8408-468c-9b41-46aa15fb2a18,1465590162,"From my experience, if you want a SSA field office to do something for you, you need to go there in person to do it. They have to help you if you go there, as you take a number and wait to be seen. It's much easier for one of them to ignore a voicemail. Bring a smattering of bills and other items which have your current address on it.",1,,1,0,0,
f337e1bc-9233-49f6-a7ae-1139021b13b0,1465606712,"&gt; cochlear implant,

But medicaid &amp; medicare don't cover cochlear implants or hearing aids, right? So odds are someone on SSI or SSDI is unlikely to get that done unless they are fairly well off or have someone like a family member willing to pay out of pocket.",2,,2,0,0,
ac4b06a3-70b2-46db-bb79-648b787d8042,1466872384,"I have nothing helpful to say, but as I read the thread title my brain mushed it together with your username, and I thought you were going to ninja school.  Which would be super awesome!",2,,2,0,0,
