commentator_id,created_utc,anonymized_body,ups,downs,score,controversiality,gilded,distinguished
a35734cc-8787-4ae7-9a0d-b36309682876,1458749806,"Is the ""over resources"" only for SSI? My husband applied for SSDI and I'm pretty sure he was never asked about household income.",1,,1,0,0,
6ef2492b-4a72-4170-a246-0d3f3c11855a,1456956278,"I don't think words like ""disabled"" or ""impaired"" are really ableist. It describes what many people live with, a loss of natural human activity because of illness or injury.

(I'm not sure if natural is the right word, and normal isn't either, but I guess the baseline healthy human being? idk)

A few words I would probably see as an issue are wheelchair bound, crippled and retarded. ",1,,1,0,0,
c5df237d-cd8a-4299-b5d1-4a6926441bab,1458093058,"The piece was pretty good. It focused more on how society needs to adapt to a broader spectrum of people with Autism, rather than shun the idea that Autism is still something that many people are forced to deal with, whether it's because it's something they suffer from, or someone close to them dose.

I got to ask though, as someone who doesn't suffer from a mental disability, but a physical one and wishes every day that it weren't so. If you could, would you choose to live your life without Autism?",2,,2,0,0,
b353aeb5-7cea-49b3-8473-b4346795c053,1457166174,"Definitely unlawful. Pop down to any solicitor and show them this. Then ask them to write a simple claim for damages (plus expenses). This will both net you a few hundred quid and trigger an internal case review (which happen in most public bodies when they are sued) to fix the problem. It's a truly simple one; buy a couple evac chairs, give the staff a morning's training on how to use them., ",2,,2,0,0,
58101f45-4da5-4552-b809-7f4166f6530a,1456894353,"A lot of good stuff here, and the link looks like an excellent source! A couple of thoughts:

I'm a big fan of identity-first language myself for social model reasons, but the fact remains that there *are* a lot of folks who prefer person-first, and as recently as a couple years ago it was practically mandatory in US activist circles (by actual disabled people, not just parents/caregivers/allies). Lots of Autistic and Deaf people have expressed strong identity-first preference, and I'd say that for those communities, respecting that stated preference is stylistically correct. But identity-first vs person-first is a subject of open debate in many circles, and although I don't use it myself, I'd hesitate before totally writing off person-first as ableist. OP should look into more activists and blogs like DidIStutter to determine if there's a strong community preference one way or another.

/u/b2d7108b-4f73-46e0-8319-ceb0e9d80ce8 has given you a good introductory breakdown to differentiating between impairment and disability. To further clarify: disabled people are those whose impairments are disabled by society. You can be impaired without being disabled, like people who need glasses, because society fully accommodates that impairment and all of society is open and accessible with minimal discrimination against people who wear glasses.

It's worth noting that some people consider ""impairment"" itself to be a negative value judgment, and that their functioning is simply non-normative, rather than pathological. Speech disability could fall into this category, and many neuroatypical people feel this way, as well as some Deaf people who identify as linguistic minorities. Either way, because ableist social constructions consider these non-normative forms of function to be negative, these people are still *disabled*: disability is not a negative value judgment, but rather a product of societal oppression.

Hope that's helpful, and good luck!",8,,8,0,0,
8b3cf793-9eb4-4600-80e0-a509a3b86afa,1458386830,"&gt; I think it is really understandable that people raising children with disabilities want to share their stories and experiences. 

I understand that, I just found it a bit absurd that there's so many blogs about the same types of experiences, to the point where it's almost impossible to find things that deviate from that.

&gt;I would suggest maybe some basic research first and then go and meet some people who have Downs Syndrome. You would be able to do better research by meeting and spending time with people. 

How would you suggest I do this? (Not trying to be snarky, legitimately asking.) I live in a small town, I don't know anybody with Downs, I don't think I have any friends-of-friends with Downs. I spend 95% of my time around the same 500 people, that's why my first instinct is to go to the internet to help me research different viewpoints. And even if I saw someone who had Downs, wouldn't it be super incredibly rude of me to walk up to them and say, ""Hello, would you mind telling me all about your condition?"" Or to pretend like I just want to chat as a pretense to use them for my own purposes? That's just really not something I'm comfortable doing. 

&gt;I'd also politely suggest that making statements such as you have about do all people with DS die before puberty illustrates that you haven't done basic research. This could cause offense and make people think you aren't serious about your aims and wanting to be respectful. I imagine this doesn't encourage people to want to help you.

I'm sorry. That came from a place of frustration and was an uncool thing to say. 

I have done some basic research, but there's a difference between reading a list of symptoms and hearing about how something has actually affected somebody's life/way of thinking. And when all the resources are about children with Downs, it makes me start thinking of people with Downs as being children, which...I mean, I know that's super effed up and it makes me cringe to admit it. That's why I'm trying to find things from the adult perspective.",9,,9,0,0,
02d0222c-f8d7-4c37-b234-38d0b8c36503,1457157302,"I know it's a bit late now, but pointing out their [access policy here](https://www.cambridgeshire.gov.uk/directory_record/ely_library) may have caused some red faces!",5,,5,0,0,
98aef27f-db47-417b-961d-254d3ac16ac3,1459349839,"I hear this almost daily and I'm currently bedbound.  

Sure,  it *could* be worse,  but that doesn't take away from the fact that some days are exceptionally difficult.  I almost never complain,  my counsellor is working with me to change that,  but if I mention the smallest thing people just say that it could be worse.  

And don't get me started on the people that go on about how *strong* I must be for dealing with a disability.  Gah",6,,6,0,0,
c29f2422-a9ca-48db-b496-6cd30e55176a,1457754654,"How old are you? If you are below 50, they might not have needed your work history to make a determination. Also, if the information you submitted originally was all correct, the examiner can use that information.",1,,1,0,0,
6714ab4f-4ee4-4c52-90dd-e30a8194a6e3,1458145504,"Zippers might also work.  I remember having pants as a kid that had zippers around the knees that converted them from pants to shorts.  They were kinda dorky, but you could put a hem on them that would cover the zipper (or some other aesthetic choice).  ",1,,1,0,0,
a35734cc-8787-4ae7-9a0d-b36309682876,1458750747,"I thought so, but wanted to be sure. Thanks!",1,,1,0,0,
1d20c626-b143-4276-a1ee-058213893434,1457593620,"You're a really good writer man. TBH I haven't played video games in years so I can't really comment on the content, but always nice to see someone from the disabled community out there with a voice. Keep it up!",2,,2,0,0,
fbad7255-6578-45e7-9f58-b8e5c36bdf83,1459375415,I know I'm inspired...to tell people off more! lol,3,,3,0,0,
422cd58b-8b0b-4c5e-9a26-f36257f3a27f,1458098382,This is not available for download. Or that is what the link said.,1,,1,0,0,
6714ab4f-4ee4-4c52-90dd-e30a8194a6e3,1458396474,"I'm glad I'm not the only one who has random people come up to me and suggest that I should get Lasik.  Sorry, some of use don't have the required parts.",1,,1,0,0,
37f84417-f829-4671-99d3-7ee8393787ad,1457258564,"I might recommend that you go and ask to see what the evacuation procedure actually is, if you can (e.g. evac chairs?). That way your friend can feel safe utilizing the space. ",1,,1,0,0,
74302fac-00a0-4d78-9947-2c9c72343e06,1459266624,Thank you - this is incredibly helpful!,1,,1,0,0,
0d854a7c-99fb-4841-b901-a61ccc8ed3d9,1459362623,"I love long-winded, so don't apologize! Right now I need INFORMATION. It's hard to find a lot about amputees or other disabilities online because I guess the fetishists ruin communities pretty quickly. So this thread has been a huge blessing!

Right now I'm trying to avoid complaining or when I do, I try to complain ""with"" him rather than at him, focusing on the external issues like lack of access rather than ""if you weren't hurt we wouldn't have to do this"" or whatever. But it's still a great reminder to watch my words so that he feels confident that I don't resent him. (Which, I don't! Anger at the person who hurt him is pretty intense, though....)

Sounds like the main thing is just experience. Thank you for the encouragement!",3,,3,0,0,
fbad7255-6578-45e7-9f58-b8e5c36bdf83,1459375803,"this reminds me of growing up...my dad would always get mad at me for not using my ""weak hand"" more. I've CP, and he'd essentially scold me for not using it more...He had a stroke about 6-7 years ago, and has had trouble with some hand motions ever since. I remember him looking at me one day, and genuinely apologizing for his previous ignorance. I felt vindicated, but also sad that he now really understood one of my limitations.",4,,4,0,0,
8a9452cf-3bd5-4401-a506-c62158a4f38f,1458261406,"I had to move back home due to not being able to be independent anymore,  my dad built me a ramp because there was a possibility I would be in a chair.  

Ended up able to walk with a came and it helps me greatly,  but just how he without a second thought built it just in case really gets to me. ",6,,6,0,0,
d3791c51-88a1-4341-a651-c0733b508874,1458968868,"Don't give your money u/rwal1. Disabled people need people to be a voice for us. If you want to support, lobby your politicians. Start locally, then email your state reps, etc. Disabled people would not be in positions of unemployment if  we were just given equal opportunity and rights like everyone else. The laws that exist right now are not enough. We need more protection from discrimination and hate crimes. GIVE PEOPLE A HAND UP, NOT A HAND OUT. I, along with many others would love a job that made use of my skills and talents. ",1,,1,0,0,
0d854a7c-99fb-4841-b901-a61ccc8ed3d9,1459362016,"Thanks so much for your comment. I can't wait to get through this phase of things. The nursing home is absolutely godawful, and he's in a different city (was med-flighted) so I'm staying with family and his parents commute back and forth to see him. Once he can move to rehab and I can move back into our house (and start working again) I know we will both feel more normal. And then it's just a matter of time to get him home!

His parents are buying a new car and giving us their old one. It's a crossover SUV type thing. Once he can bear weight on his leg I think (I'm hoping) he should be able to transfer to the car and sit normally. Whether or not I can get his power chair into the vehicle is another question! I think there is a lift of some sort we can install on the car, maybe? 

Thank you for all the tips on interacting with the world in a chair (whether as pusher or pushee). I will definitely use them! I will try to shore up my confidence to make sure he gets the access and comfort he needs when we are out!",1,,1,0,0,
329ce6eb-1352-4dc8-bcc7-a51ad03bde98,1458838687,"Snapit makes good quality cupholders for powerchairs. They also make a cellphone/cup holder hybrid which is pretty nice. 

http://mobility.snapitproducts.com/mobility",2,,2,0,0,
48aa8e29-c585-4b0b-8c48-7f063b9c4b8b,1457990865,"I believe there is a cap, but I don't know what it is.  It likely varies by state.",2,,2,0,0,
f79209b2-f6ae-4aba-ba5c-763d6d56c633,1458958471,"&gt; disability rights do not have to be mutually exclusive.

Exactly. I have Spina Bifida/NF1 and Scoliosis. My mother could have gotten an abortion. I grateful she didn't because I've had a great life, but she, as  any woman, should be able to make that choice. Especially in cases where the quality of life for the child would almost non existent.",5,,5,0,0,
9467eb37-981d-4ca7-8d4b-0d1f920f1dca,1458019369,"Because being deaf, whether willingly or unwillingly (spoiler: it's the latter), is part of my identity and it's shaped me for who I am. As a kid and even now, I never had anyone to look up to, fictional or not, that was like me. Kid me would have felt like utter shit if one of the only available role models out there, wanted to ""be fixed"". It would have felt like invalidating who I am and told me I pretty much don't matter. I understand the intent and that they aren't obliged to cater to disabled people, but keep in mind they've also done this over race and other things that were not disability related 

(Finally getting a better cochlear implant soon enough. Best time to plant a tree 20 years ago, next better time ya da da.... But I'll always be very deaf, and it's important to highlight that our disabilities almost never leave us completely)",2,,2,0,0,
64132c87-9e38-4ab3-8fbf-627a0f79e115,1457459537,x-posting is a good idea. It would be great if there was someone in her area who could help her advocate for herself or who is familiar with services in the Myrtle Beach area.,2,,2,0,0,
acdf3077-ddbc-4b3c-8341-9e42f10eab89,1457044308,Yeah it's definitely an issue. We sometimes feel like we are pushing a heavy rock uphill. People don't seem to appreciate the importance of accessibility and the relative ease in which change can be made. Our solution is to keep the discussion going and make incremental change.,2,,2,0,0,
65eb3d01-3c5f-4f46-bbd9-7f98ef92e763,1458780716,"Yes you can apply as many times and as often as you want. 

SSA will typically request records for the 12 months preceding your alleged onset date (the day you last worked or your SSI application date). If the doctor records are older than that I would recommend obtaining them yourself and submitting them when you apply. ",3,,3,0,0,
82905be6-8ec4-46d7-b1d9-93b9f7796b4b,1459360879,"I will add that it's very difficult to get approved for disability if you are young (under 50) and only diagnosed with depression and anxiety.  In my experience, you will need very compelling medical evidence to get approved.  At the very least, this typically means continuing to have very severe symptoms while regularly seeing a specialist and complying with all treatment.

Seeking out a job that can accommodate you may be a better option.",3,,3,0,0,
884c42d5-75d4-4ee4-9f5c-c756aea8f985,1457564821,"From a Disability Studies perspective, Disability =/= Impairment

Like... Nobody is disabled by them self. You may have an impairment, but that impairment isn't a disability unless the structures of society that surround you MAKE IT a disability.",3,,3,0,0,
a2d6a112-40ad-490e-8dae-3e89e4fe82bd,1458356567,"Hi triple amputee here, everyone has given great advice!  But if his arm is limited severely I would suggest a one-armed cutting board.  They are so amazing ",1,,1,0,0,
bf8d18ac-3065-49f8-8c1d-90a48ef56eaf,1456839795,"Unfortunately the height and angle of the platform are set by FINA. The special Olympics use their starting block dimensions, but the blocks can be modified to help people get on them. I don't know the height off the top of my head, but I know the decline of the platform has to be something between 6-10 degrees. We're probably gonna go with 6 now that you've pointed that out. 

We hadn't given any thought to the backstroke handle. Would a recessed handle under the actual handle (think of a ladder) work to help you get out of the water enough to reach the handle you have to use?",2,,2,0,0,
a91a6f6a-627e-4625-b018-772584b531b2,1457992029,Comics are wish fulfillment! Why WOULDN'T they have that kind of stuff? This is idiotic. Are we going to bitch about not being able to fly and shoot lasers out of our eyes as well?,2,,2,0,0,
d1c79e5c-f6f6-4dcd-b447-ebaa3cafc31f,1457571599,"&gt; Fun fact: People who complain about political correctness are almost always doing it to silence opinions they don't like. Hypocritical much?

When did I try to silence anyone? And how am I hypocritical? Strawman much?",6,,6,0,0,
3860ac0c-307b-4913-aa0c-68a0c4c39cdd,1458101508,"My dealings with my local office have been a nightmare hell ride. I went though the program called Vesid now called ACCES-VR in NY. I started it back when I was 19 lost and confused to try to find my way into a career. The first place they tried to send me at to take my tests was for severely mentally handicapped. I told my advisor that she sent me to a place that wasn't right for my needs so she sends me to another and doesn't apologize for the mistake. I take my tests and get the results back. The advisor proceeds to tell me (full quote here) ""I'm not college material"" I'm devastated hearing that and never felt so worthless in my entire life. I asked them what I should do then they wanted to send me to vocational schooling and programs for the mentally handicapped. I almost believed all the Horseshit they are selling me till a Saint of a woman called my house randomly asking if I would liked to tour her college. I told her no vesid just told me I'm not capable of going to college. She BEGS me to come down and speak with her because she ironically used to work for them and knew the game they were playing. She told me to appeal the shitty results they gave me to get them to FINALLY fund my college experience. It took a few semesters before they agreed to do so. Fast forward to me graduating with my associates and bachelors finally i call for job placement assistance. That began another degrading hell that lead me to never want anything to do with them ever again. 

TLDR: your results may vary by location. I would ask people in your area how the services are. ",1,,1,0,0,
4ca9567f-f60e-493d-9915-7d3bdacfd1c1,1458030893,Yes and some people don't and use comics as a form of escapism. Why is your preference more important than theirs? ,1,,1,0,0,
c381a2a1-8eb4-4f49-bd7b-ae1d8f7011de,1456888494,"&gt;  used the example of his grandfather, disabled by polio, to imply that disabled people should simply work harder in order to be able to live fulfilling lives.

That's such crap. For people with post-polio syndrome working harder is what destroys you. Thanks to the nerve damage/decay issues you must ration your physical exertion if you want to go the long haul.

&gt; not get an automatic cost of living adjustment.

Aren't those cost-of-living adjustments generally super tiny anyway? I'm not sure it's a big deal. My monthly disability benefits have gone up $50 over the past 10 years.",2,,2,0,0,
d9684cc1-e5f7-482e-94bd-c6495dffc69d,1459214623,"Well, for SSA it might not matter, but for my pension to pay anything at all I need a doctor to agree.  I haven't thought of voc rehab. Thanks for the tip.",1,,1,0,0,
4b2b53ca-5d94-4f73-a3a1-6d9fb39d6aee,1458400750,"Conventions are generally very good about access these days and generally have policies posted on their websites. You might look for groups like this who may have more specific insights to share:

https://www.facebook.com/groups/FansForAccessibleCons/",1,,1,0,0,
37f84417-f829-4671-99d3-7ee8393787ad,1457949509,"You're right. I just feel so angry and frustrated and I don't know how to make a difference. I've written to MPs, I've talked to journalists but it doesn't seem enough. I thought about starting a blog. I know it will just be one voice in a sea of millions but it's the only other thing I can think of to fight back somehow. I'm hoping there will be protests organized by DPAC and the like but we'll see I guess. I'd love to see more of us out there.",2,,2,0,0,
c29f2422-a9ca-48db-b496-6cd30e55176a,1459014812,"Allsup depends on the rep. We have a VERY responsive Allsup rep in the state I work. I knew her by name. Binder/Binder, ARC, Chamberlin/Edmunds, etc, they're virtually useless, as you say. There are even attorney reps who are not allowed to call the analysts and have to go through the higher ups due to their aggressiveness. 

Definitely, DEFINITELY agree with your second statement.",2,,2,0,0,
4a701736-cf95-44ba-8c42-4d419c98ed6c,1458268061,"Wow, what a dick thing to say. That's like telling me to just get glasses or laser surgery. Doesn't quite work that way, bub!",5,,5,0,0,
c7748fe6-9f3b-424c-b567-8983be404a66,1457960760,"Volunteer.  The hardest thing for our family after my son's stroke was finding people to do work to get the house ready.  Wheelchair ramp, furnace had to be replace (air quality), flooring in his room, adding storage for his supplies and such.  People volunteering and donating money and time was what made the biggest impact for us. ",7,,7,0,0,
85d78199-6a32-4e80-aa98-2b4135b65903,1456837669,"I've had nearly 40 odd broken bones in my life. My life for better or worse, especially my earlier years were filled with medical trauma, and the cultural effect of disability. While medically things improved, I was shocked at the lingering mental effects all that had even into my early adulthood. All I can say is I found an amazing therapist, and began EMDR, both of which reduced my anxiety and stress by nearly half pretty quickly. Slowly but surely, week to week life is getting better, and I'm slowly finding my footing. Self-Care, Self-Love, and a willingness to seek out help are important. Take care of yourself. :) ",8,,8,0,0,
1a461619-fe12-49a8-8fb3-184f7eb42480,1459347762,"One of the sites I found has a ton of information on different types of therapy, so when he's born and they know what they're up against, they've already got a selection. Thank you!",1,,1,0,0,
1988c84f-012f-4c3e-a144-2f87958a7a72,1458908518,"I've got a Brica on my scooter myself

Mine is the 2 slot ""snack pod"" style: http://www.walmart.ca/en/ip/brica-snack-pod/6000111966714

Very handy. 

I'll have to look at those hooks though",1,,1,0,0,
c381a2a1-8eb4-4f49-bd7b-ae1d8f7011de,1459010337,"They hogtied him, then shortly after he decided to go inside for a drink? This is bullshit.",2,,2,0,0,
6d5f9ba9-8639-43c2-9e0e-8857799d5348,1456825004,"I use this dressing stick and it be great to be able to fold it and put it in a bag for travel. Right now it sticks outside the bag and extremely annoying!

http://smile.amazon.com/gp/aw/d/B007X07QUC/ref=sr_ph_1_a_it?qid=1456824894&amp;sr=sr-1&amp;keywords=dressing+stick",2,,2,0,0,
0d7c179f-ea7e-4628-917e-324938a53872,1458951651,"&gt;4)For the women it may effect... Is the state prepared to increase it's commitment to disability services? Are they going to allocate more money? Time and again we've seen the first cuts in budgets being disability services, and this should re-emphasize that this isn't about disability rights, or fetus rights, or even about be pro-life. This is about being pro-BIRTH and chipping away at a woman's right to choose.

As a resident of Indiana, I can assure you none of this will happen. It's so sad. I hate that I have lost control of my body. This is another piece of awful legislation brought to you by our awful governor Mike Pence, who this time last year was passing the states religious freedom act, costing the state millions. What's even worse is all the people here who support him. 
",5,,5,0,0,
02d0222c-f8d7-4c37-b234-38d0b8c36503,1457156032,"I'm not sure about law there, but this would absolutely not fly with the ""Access to Premises Standards"" here in Australia.

By their reasoning: your friend should be denied access to any building with steps as the only entrance, given that their is no safe accessible escape route. Even a single step (assuming you were to help them mount/pull up the step... we all do it when we have to).

Edit: no, actually by their reason your friend should be denied access to ANY multi-level building with an elevator.

Here at least, the Human Rights Commission would eat that up &amp; spit them out a lovely fine at least.",6,,6,0,0,
d82191fd-365b-4465-9da3-ff5dcd609a03,1456970468,"Dude, I can't believe my taxes go to voc rehab. It is the biggest shithole excuse for a program...  

I mean, do they help anyone find a job that pays living wages? Voc rehab was my first experience of the realization that Republicans are not always wrong.  

It doesn't matter if their budget is huge or non existent; either way they are totally ineffectual",1,,1,0,0,
027a1edc-29da-4b66-aaf2-22f18a400f4e,1458717182,"I can't promise that I'd react well, but yeah, that IS the law -- no placard, no park, disability or not. 

That said I will *never* be the guy who comes up and confronts a random passer-by over it, films their reaction, and throws it all over the internet.",3,,3,0,0,
