commentator_id,created_utc,anonymized_body,ups,downs,score,controversiality,gilded,distinguished
027a1edc-29da-4b66-aaf2-22f18a400f4e,1456890068,"fair enough. Yeah stick to that then -- I'm over here trying to reinvent the wheel, lol. I guess the thing to focus on is scariness-factor -- I mean, I was out swimming with injured combat vets and *we* were scared of standard blocks. For no good reason, other than 'they look hard' I guess. Maybe colors could help -- who's afraid of a pink block?

And then obviously whatever you can do for safety. ",1,,1,0,0,
e55b19c5-ed7f-4d56-ad4c-8b18faf9a1a2,1458973116,"If the examiner really meant it when she said ""about a week"" I should hear any day now. I'm cautiously optimistic. I've been told by caseworkers that having more than one condition is usually grounds for approval, and I have three. I was also told that seizures alone usually warrant approval.

I'm going to call Monday, since ""everyone"" said to call weekly and follow up.",1,,1,0,0,
6c71594a-d15e-43ab-a858-ab28d9b2f786,1457880146,Thank you so much for your comment! I thought that being so independent might put me at a disadvantage. Does insurance cover this sort of thing?,1,,1,0,0,
eb2d8c7d-39c8-477d-b850-2073565e7ba1,1457317446,"Where did I ask for pity? I didn't, I don't want it, and you are just assuming. So, because other's can't go somewhere that I want to be able to go (which I can't anyway), that makes me selfish? Because I other's can't, then I shouldn't want to? That's silly. 

Assume what you want of my ""attitude"" or what I say, if that makes you happy. I didn't come here looking for ""pity"" and people that know me well, know I wouldn't want that anyway.

You are assuming and barking up the wrong tree and being more of an ass than anything.
",2,,2,0,0,
cc0ed6f8-8b02-4974-85e2-da65df2c5d7b,1458845109,"So unfortunately I think cup holders may not be the best solution to this because wheelchair wheels are just too small to avoid those bumps. But as an alternative, have you considered using a reusable insulated cup like a thermos that has a sliding cover to the cup opening? Or perhaps one with a straw?",2,,2,0,0,
c5df237d-cd8a-4299-b5d1-4a6926441bab,1458102392,"But it's the communication issue that is most present, and is the biggest hurdle most individuals on the Autism spectrum have when it comes to living active lives. Take that away, and on the surface there is little difference between someone on the Autism spectrum and everyone else. And honestly, I don't understand what kind of point you're trying to make. /u/1d1a90de-fecc-40c5-89bc-491a7d2e1782 was talking about how the author seemed to be implying that because their level of Autism wasn't debilitating and keeping them from living a productive life, that it meant that Autism shouldn't be seen as a disability that can make someone a sad shell of who they could be. When in fact that's a real problem with Autism. Your counterargument was that there was more than Autism that makes someone so. That's just an argument of false equivalence. ",3,,3,0,0,
027a1edc-29da-4b66-aaf2-22f18a400f4e,1458971629,"Sounds like you've got a pretty good handle on things. Being an amputee (in a small town anyway) feels a little like you might imagine a celebrity feels -- people steal glances, people remember that one time they saw you at the store, people hold doors open and get awkward, the whole works -- except it's all about something terrible that happened to you. So if you're already in a downward spiral, it's that much harder to climb out -- *every single human encounter is a reminder*, and it's all anybody wants to talk about. 

The little every-day challenges never really bothered me. They're challenges, sure, but winnable. You can never really overcome 'everybody treats me weird.' Overcoming that is just learning how to not be bothered by it -- which takes some figuring out I guess. From my experience that's the worthwhile struggle you want to write about -- re-learning how to make herself coffee is a boring story, all technique, little room for character. The person-to-person stuff? That's a good story -- and you don't need a disability to figure it out either. We've all got some experience with being an outsider.",3,,3,0,0,
8da59540-6467-49f8-ac31-36fecf87a22c,1458736996,"&gt; Get insured. See if you qualify for Obamacare subsidies or even your state's Medicaid.

I unfortunately don't. For either, if I recall. I remember filling out the Obamacare thing and since I couldn't afford any of them, I needed to go through the state. Calling them they basically just... gave me a permission slip to be too poor. A while back I had to suffer through some kind of ear infection because I couldn't get anyone to take me to a clinic.

Can you go into more detail about some of that? I know SSI, and I can take a guess at SSA, but what's PCP? SSDI? I thought I wasn't able to apply at the moment, because none of my information is recent enough (at least, that's what someone else told me).

&gt;The disability process can take several years.

That's where the ""cry"" step comes in. I feel like I'm never going to be at a place where my life's stress is being handled. I'm never going to live on my own and be able to be open about queer stuff without being judged. Or even just in a place where I'm not constantly hounded about being a burden. God, I just hear stuff like this and wonder if it's even worth it.",1,,1,0,0,
1f7b75e8-9ad2-4847-b1db-98a614f98445,1458016267,This is one of the points I've been trying to make.  Thank you.,3,,3,0,0,
48aa8e29-c585-4b0b-8c48-7f063b9c4b8b,1458926578,"I am not an amputee.  Your language doesn't sound inappropriate to me, though!  

Best of luck with your endeavor.  ",3,,3,0,0,
f430651d-ae26-4fbb-9fc8-4e516a96493e,1459423233,"I know this device isn't new but I only came across it today, so I thought it was worth a write up.",7,,7,0,0,
57cfc43e-fa4e-4899-a119-12b12350f295,1457659340,"Yes, Acorns would count toward your Medicaid and SSI asset limits. ",1,,1,0,0,
6be7e826-bf78-44c3-9011-d80b6993cca7,1458716722,So...you would be cool being treated like that if you forgot t yours? I'm confused ,2,,2,0,0,
884c42d5-75d4-4ee4-9f5c-c756aea8f985,1457820407,"Monoagamy puts people viewed as ""disabled"" at a major disadvantage unfortunately.",3,,3,0,0,
7e36148b-2b74-4bba-b469-eb50434fa64b,1458933612,"Adorable &amp; well written. Like a little fantasy trip for my self image :) 
Thank you for sharing this creative little piece :)",1,,1,0,0,
65eb3d01-3c5f-4f46-bbd9-7f98ef92e763,1458247386,No worries. All of the different acronyms and state/federal programs get confusing. ,1,,1,0,0,
9467eb37-981d-4ca7-8d4b-0d1f920f1dca,1457583154,"Ok, so why did it have to come at the expense of the disabled? ",2,,2,0,0,
d945ce7d-2689-40f9-a4d6-de96aec70c23,1457245777,"Have her call Medicare. Someone already mentioned the extra help program for prescriptions but they also have a program with a much higher income bracket that helps with the premium or deductible. I could be on Medicaid but I'm not because I don't need it as I get Medicare as well as private insurance through my parents but I am on a Medicare low income program so they don't take the $100ish a month from my check to pay the premium and all my meds are $7 or less (even massively expensive ones). Basically there's different programs and options depending on income limits but call Medicate. They're far more with it and nicer than state DHS (though the app probably has to go through DHS which is such a pain. Heck that's part of why I'm not on Medicaid too. So many dang issues with DHS). Medicare's hotline was who helped me out in the first place. So try there. Again, the limits for their programs are much higher than with Medicaid.",2,,2,0,0,
52c0d54e-5e5e-48a0-b297-e0f887edee6c,1457976830,"not sure actually. my wife and I want to physically go to a place and volunteer and donate money if it can help. Been donating to red cross, but just not sure about the impact on individuals.",1,,1,0,0,
87485551-a728-4008-9e24-658dacd896dd,1458233365,"I used to hate the word cripple but once I began to wear it as an identity through school, it really took the power away.  I totally understand those who disagree -- it's a pretty big debate in the disability community here in the Bay area.  ",2,,2,0,0,
93ed1e88-35dd-4aab-8679-22f44ee6975f,1456874144,I've heard EMDR can be really helpful but it's also very expensive and generally not covered by insurance.,2,,2,0,0,
400f3472-f749-43d1-901f-177f881a10a3,1459286332,"You will basically have only a few options.  I don't doubt that an agency could send someone tomorrow if they had to.  But if you wanted to interview and hire them yourself, that would likely take a bit longer.",2,,2,0,0,
d1c79e5c-f6f6-4dcd-b447-ebaa3cafc31f,1457561920,"&gt; (Disability isn't in the individual, it's in society)

Huh? No, it's definitely in the individual. I was born without most of my limbs, I am disabled. Society didn't make me this way, some fucked up genetic issues did.

",9,,9,0,0,
c7748fe6-9f3b-424c-b567-8983be404a66,1458234905,"Like your username, both my sons are aspies :)

One of them is a quad due to a stroke.  I am stunned by how many people question the access decisions I've made for the house based on ""but what about when he gets better"". 

1. He might not ever get ""better"".  This might be it. 

2. I'll adjust access as needed because that what needs to be done to make his life better.  

Geez.  ",11,,11,0,0,
6c71594a-d15e-43ab-a858-ab28d9b2f786,1459388459,"I just wanted to pop in here and thank anyone who has contacted me or commented that they are interested. I will have my topic approved Monday, it's so great to know people are willing to talk!",1,,1,0,0,
c381a2a1-8eb4-4f49-bd7b-ae1d8f7011de,1458715449,"Cute. 

^^But ^^the ^^thumbnail ^^promised ^^cake!",1,,1,0,0,
d9684cc1-e5f7-482e-94bd-c6495dffc69d,1459361654,Thanks for the info.  Food for thought for sure.,1,,1,0,0,
c29f2422-a9ca-48db-b496-6cd30e55176a,1457755152,"Exactly as RambleRamble says. Also, it depends on the allegations and conditions. Some people, as the person with stage IV cancer, are expedited or very easy allowances. These can be allowed very quickly. Other cases with more complicated impairments or combinations of impairments take longer. 
Right now, in my office, we are scheduling consultative examinations three months from now. If someone needs an examination, obviously, the case will take quite a bit longer.
Again, as RambleRamble said, stay on top of your phone calls and paperwork.",2,,2,0,0,
6c71594a-d15e-43ab-a858-ab28d9b2f786,1457980598,"I appreciate this comment because I can tell you've actually read my post. I admit that I wish my post had been a bit more well written, but I didn't say a lot of things because I didn't want to call people out point blank. There have been many things occurring surrounding this post outside of my website that you couldn't see, and I hope that the point of my website as a whole is not lost. It is not my intention to play the victim, I'm sorry if it came across that way  ",2,,2,0,0,
010487db-5446-487f-a67c-6e7b1e7360d5,1459329661,"It's tough but sometimes realising things could have been worse does help me. Also I think able-bodied people often say the most inappropriate things not out of malice but because they often just don't know what to say or desperately want the uncomfortable moment to go away. Able-bodied people are surprisingly fragile, weird human beings.",8,,8,0,0,
68bd88b2-df37-46b4-ba0d-7326630915d9,1459220432,"Go ahead and add me when you want.  I'll be back in a bit, I gotta go teach one class right now but I'll be back in an hour
",1,,1,0,0,
c29f2422-a9ca-48db-b496-6cd30e55176a,1457754723,"That is somewhat of a harsh statement. Analysts do care about the determinations they make. However, there are certain rules and regulations they have to follow set by social security and congress. ",1,,1,0,0,
8a6f8b4c-9342-4e08-9310-54cb44e70044,1458676665,That's good to know. Helps ease my fears a little knowing that if I need to I should be able to get back on Medicare pretty quickly so I'm not paying hundreds of dollars a month for medical expenses. Thanks for the info!,1,,1,0,0,
fbad7255-6578-45e7-9f58-b8e5c36bdf83,1459376129,"I was born with my disability, but if I could offer a piece of advice...be patient, I'm mid-20's and I'm always finding new methods to do things. Hopefully, he'll ""level-out"" soon, but ""normal"" doesn't really exist. adaption's the name of the game.

I wish you and your family the best of luck, might not get used to it, but it'll get easier. ",1,,1,0,0,
027a1edc-29da-4b66-aaf2-22f18a400f4e,1456808199,"Ooh! I did this yesterday. Here's what I saw.

- A lot of mobility-impaired people were afraid to try the blocks, even though they could totally handle it. The height is scary. Consider a lower starting block? Or a more welcoming one -- perhaps you climb up from the side, and there are grips on the back to help steady you on the way up?

- Some folks in my group had trouble balancing on a slanted surface (also that freaked me out a little before I tried). You probably want a flat top -- and a big one at that, so little stumbles don't take you over the edge.

- CONTROL THE SPLASH WATER! The blocks we used had slots built in to let the water run off (we were at the UNLV pool -- you can probably google up some pics). A perfectly flat surface will collect splashes, drips, etc. Have a plan to handle that.

- Make sure the backstroke start is accounted for. It's.... *reasonably* hard to propel myself out of the water for a good handhold, and other people probably have it worse. Especially if you use that idea of clamping into the gutter area, make sure the swimmers have some sort of grip option on backstroke.",2,,2,0,0,
a91a6f6a-627e-4625-b018-772584b531b2,1458000773,"Fine, from now I'm considering my lack of super powers as a disability. ",6,,6,0,0,
8b37761e-f9b2-47c5-921a-b599746571cd,1457763484,"She needs a different Medicare part D provider, that is for sure.",1,,1,0,0,
5987117e-e88c-40f6-8f1c-5fd6202d85d8,1458174099,"&gt; So, screw other people if they have different opinions than you?

No... I just think your opinions are stupid and I'm calling them out.

&gt; For goodness's sake...

So am I right or am I wrong?

&gt; And I feel like you make it way easier on yourself by demonizing people like me as people who get too easily offended, when really, you don't want your thinking challenged.  If you did you wouldn't so rudely blow off my own 2 cents.

I love having my thinking challenged but there's no thinking going on here. People are getting their feelings hurt over stupid shit that I didn't even know was an issue until 3 days ago. My mind is blown by how insignificant of an issue this is compared anything and everything else.
Yes, it is easy 'demonizing' (as you say?) people like you because I can't relate to anything you have to say on a logical level. Looking at the big picture I hate all disabled people who live miserable lives and want the world to change for them, even going so far as to complain about the representation of disabled people in FICTIONAL writings. The fact is we are a very small minority and the world shouldn't have to cater to us beyond what's necessary. I've grown up with one really important analogy in mind that you should all take a long hard think about.

&gt; While waiting at the hospital you look down and notice you need a new pair of shoes and you're a bit upset about ruining your favorite shoes. Out of the corner of your eye you see that the man next to you has no feet.

I hope I don't need to explain the moral of the story here. Sure being def sucks but there are many worse things out there to live with. Am I downplaying your suffering? You bet your ass I am and if you need disabled heroes in a comic book to make up for your shitty existence then keep fighting the good fight but come on... I really doubt it'll change anything for anyone. 
Also, it doesn't sound like you appreciate Devil's advocate or disabled humor at all, but hey! that's just my 2 cents, take or leave it.",2,,2,0,0,
d43ea476-9a65-4aa9-8133-c4b9e5b6ea8e,1458968789,"Look for the nearest Center for Independent Living, www.ncil.org. One of the four core services is pushing for the changes mandated in the ADA. They have staff member's who will help you file an ADA complaint with your city. They can also help find housing in less inaccessible location. http://www.ilru.org/projects/cil-net/cil-center-and-association-directory ",5,,5,0,0,
28c057bc-4512-426e-a2d9-f2ec12a7045c,1456937752,"Yes. I recall a comment made to someone asking him if he wanted to be called ""autistic"" or ""someone with autism"". He said ""I want to be called by my name"".",5,,5,0,0,
6c71594a-d15e-43ab-a858-ab28d9b2f786,1458277375,"In college I've heard stories about people (I don't know if able-bodied or otherwise but I assume) taking people's devices like wheelchairs for example and doing terrible things with it like putting it on the roof, makes me so mad.",4,,4,0,0,
3d8520ea-41aa-4206-9242-a26c8870e4f7,1458938584,"I had a similar question and someone provided this link. It does also cover other types of disabilities.

It's not just Down's, it's any fetal abnormality. 

Prohibits a person from performing an abortion if the person knows that the pregnant woman is seeking the abortion solely because of: (1) the race, color, national origin, ancestry, or sex of the fetus; or (2) a diagnosis or potential diagnosis of the fetus having Down syndrome or any other disability.

https://iga.in.gov/legislative/2016/bills/house/1337#digest-heading

",4,,4,0,0,
bb666a74-cb16-4d0b-a24c-cd03dac459b4,1458201664,"The  problem with velcro... well, velcro is great, only if you have limited mobility, you have shoes with velcro, orthostetics with velcro, a hanbag with velcro and so on and though it really makes life easier when 2-3 of these things get accidentally completely entangled, I find myself seriously fustrated (and cursing ;))",1,,1,0,0,
d1c79e5c-f6f6-4dcd-b447-ebaa3cafc31f,1458010486,"While I've never used it to describe someone who's mentally challenged I have and will continue to use it to describe people who are willfully ignorant, stupid ideas and concepts, etc...

For instance; this article is retarded.",2,,2,1,0,
82db3290-4dbe-49c0-9b24-bf901f2aaa76,1459043262,"Please help your sister find support outside your family if you can. As an adult woman, especially one who has been sexually active, she needs to see a gynecologist. I am not intellectually disabled, but I do have a few other disabilities that have made me dependent on my parents. It is not a good situation for anyone when that happens. Your parents should not get to make moral decisions for an adult but they feel like they get to because they are providing for her. They shouldn't have to take care of her if they don't want to either. There are social workers, group homes, and other services that can help her live in a different home from your parents. You should look up your local Center for Independent Living. http://www.ilru.org/projects/cil-net/cil-center-and-association-directory They help disabled people  be more independent and live in the community instead of with family or in a nursing home. Even if everyone decides she should stay with your parents for now, that can't happen forever and it's best to look at options now. Your sister sounds very capable. I don't know if she'll ever be able to handle parenthood but remember that she can learn things she doesn't know now, even if it takes her longer than other people. ",9,,9,0,0,
7128deaa-bc73-4fd8-942b-5e0c75b6f126,1459373419,"You should keep in mind that you're putting him through a lot and need to have patience with him. Your disabilities aren't just your burden to bear, but his too.   ",1,,1,0,0,
c5df237d-cd8a-4299-b5d1-4a6926441bab,1458100718,"&gt;If you improve a diabetic's foot, you aren't curing their diabetes.

lol wut? Yeah, I guess you wouldn't be because diabetes isn't in the god damn foot. Now, if you could find a way to improve the bodies ability to produce glucose then that would ***ACTUALLY*** be a valid comparison. But that would negate your argument. Because again, with the loss of the primary symptom of a disease/disorder it results in a cure (or at least treatment) of the disease/disorder",4,,4,0,0,
d42770b1-9f84-462c-9536-090461a2ff56,1456946756,"I am disabled. I have deficits and impairments. This language is not offensive. It is appropriately descriptive.

I have real battles in my life that stem from my disability. I don't have the energy to care whether someone calls me a disabled person or a person with a disability. 
",5,,5,0,0,
37f84417-f829-4671-99d3-7ee8393787ad,1458337126,This is most likely a cynical move on his part to undermine Cameron and Osborne whilst re-branding himself in the run up to Brexit but for now it's good to see this asswipe go. ,5,,5,0,0,
bb666a74-cb16-4d0b-a24c-cd03dac459b4,1458202034,"Yes, that was my idea too, these detachable zipper pants. Another idea (but you would need a tailor for that) to replace the inner seam of the pants with a zipper.",1,,1,0,0,
965382d1-f951-498b-9819-deaeaf1559ec,1457976406,"""The disabled community"" is not one big group, as nice as that would be.

Find something you want to help with.  Donate to that cause.  

Some conditions get all the money - cancer, heart disease, etc.

Others get none of it.

Donate where the money is needed, there are *so* many worthy causes.",3,,3,0,0,
8678158d-3ddc-4920-ac29-98f574855a46,1458210946,"I know the struggle and am likely going to be fighting for it again soon, myself :( 

Honestly, I don't use it much outside the house, and I used it some at an office job - mine is *extremely* slow to go up/down, and it limits the speed far too much, IMO. But when I do use it? Yeah, ""godsend"" sums it up very well!",1,,1,0,0,
e55b19c5-ed7f-4d56-ad4c-8b18faf9a1a2,1457404488,"My condition has been confirmed by several tests, all during inpatient hospital stays. All of the physical proof is solid. There is ten years of medical documentation. 

The people I alluded to before were approved quite quickly with things like bad backs. That's why I started wondering if I'm only reading the worst case stories here.",2,,2,0,0,
4b7c971e-08f1-45bf-9f3d-328e7f15e005,1457252105,Do this. I just switched to an Advantage plan from Coventry and it is amazing compared to just plain Medicare. It is saving me $200 a month from using my old work provided insurance.,2,,2,0,0,
6bd9e28b-183c-4865-bb04-8f719ba594b1,1456932011,"This is ridiculous.  Write your paper, this PC crap is stupid.  

For the record I am disabled.  I am not ""handi-abled"" or ""differently mobile"", or ""handi-capable"".  

So stupid.",7,,7,0,0,
eaae6e69-2f9f-43d1-9773-a3611987c5a5,1459317474,"I know exactly what you're going through right now. It's so tough. And yes, the world is not at ALL made for people in wheelchairs. You get used to it. It sucks, but you just kinda have to. 

I have an autoimmune joint disorder that got really bad all of the sudden in my last year of college. Went from an active, normal, job-holding college student to not even able to get out of bed in a matter of months. I started using a chair, but not until after around 4 months of just being bedridden because it hurt too much to walk. I couldn't stand up without screaming. So because of that start, I see my wheelchair as an instrument of freedom. I can't go places and walk around, so being able to get places anyway, even if I'm squeezed into a corner or people keep bumping into me, at least I'm there! 

I have just gotten used to being able to tell places that will be good for me to go and those that aren't possible. Cute little record stores on the second story of a downtown shop? Adorable, but I'm never going to be able to go into one of those again. Malls are usually pretty good places to go, things tend to be accessible. I have a mental list of restaurants that are spacey enough that I don't feel weird wheeling myself into. 

It's definitely a huge transition, and there will be places that are near impossible to navigate but you just have to anyway. There will be kids and rude people who just stare. That's really hard to get used to. I normally just smile and wave now. It makes them feel weird, but I like that, haha.

My partner is able-bodied and has to push me around places a lot, and I know it's hard on him. But he's absolutely my rock. I know it's tough, but it's so good that he has you to rely on! It's okay to complain, you both will want to at times. Just try not to make him feel like it's his fault, which I know you wouldn't mean to, but things like that I can easily accidentally take personally. 

Communication is key! Also some places have Yelp pages that mention their accessibility, so that's good to have when you are thinking about going somewhere new! 

Okay I'm sorry that got so long winded! If you ever need somebody to talk to or vent to, PM me! I have too much free time ",1,,1,0,0,
f67eb86f-da61-4a5f-8dee-43adf0042e74,1456849781,"Canada doesn't have food stamps or SSI afaik, and I have a strong feeling that people on SSI are not permitted to get Canadian citizenship. Best of luck.  ",1,,1,0,0,
