commentator_id,created_utc,anonymized_body,ups,downs,score,controversiality,gilded,distinguished
c262aba1-a72e-458a-a126-084d8a6e4791,1451858156,"Meh, I was just talking about how my friends and I get funny looks for using handicap parking spaces because we're so young even though we have a permit (we use one friend's car because we're broke students and all disabled). When questioned, I clarified that my visually impaired friend has issues with stairs and sometimes parking lot lines with the wrong contrast and stuff but that this friend can still drive. I said that driving and stairs are different skills and that my friend is actually a great driver. Then I got downvotes and doubt because people don't really get how visual impairment works. I guess people are just confused!

Edit: usually reactions are fine -- I just get questions about my disease and answer them and people find it interesting. This time just annoyed me.",11,,11,0,0,
4960b4d7-f1b1-45ed-8153-f76f2802f1c0,1454283665,"The wait for my LTD was six months but I had short term also. I got a lot less but it was something. I got approved for SSDI quickly but there was a five month wait for my first check. I had to pay the full cost of my insurance after my 90 days paid time ran out. It is $700.00 per month. I have advanced Cancer which is why I got approved for SSDI so quickly. There is a 24 month wait for Medicare so I will be eligible for it in July of 2017. My state did not expand Medicaid but you should check to see if your state did. If you don't have income during the waiting period it would be helpful. Also, state programs like TANF and SNAP will provide limited cash and food stamp assistance if you don't have any assets or income. It is a hard road and I wish you the best getting through it. I am finally past it for now but I worry about the LTD carrier saying I am ready to work again. I understand that it is not uncommon to have issues with it. ",3,,3,0,0,
589f63c3-bad5-4542-ac39-e0e5a5dc6591,1452818390,"You don't say where you are.

In the US, applying for SSDI isn't about what you have  as much as ""does this make it impossible to work?""  You likely would have to show that you have tried working and had difficulties and/or lost jobs because of sudden fainting.

In addition, to qualify for SSDI you would have to have worked for a certain period of time making a certain amount of money - the formula changes depending on your age and how long you were working.

SSI may be possible but, again, you would have to be able to show that you cannot work due to your situation.",3,,3,0,0,
400f3472-f749-43d1-901f-177f881a10a3,1454210928,"Happy to help; if you need anymore help navigating services in your state for a particular purpose, give a shout and I'll see what I can dig up.",1,,1,0,0,
6ef2492b-4a72-4170-a246-0d3f3c11855a,1453480560,"Thank you for your reply. It turns out that the appointment date they set is the same day as a specialist appointment I have been waiting 8 months to get. My lawyer told me she would try to get the date changed, but I am worried they are going to push the determination up before I can even see the specialist. I cannot work or even drive a car and have nearly become homeless twice since getting sick. My first application was denied because they said ""you can still move your limbs"". I am so worried because my finances are becoming dire during the wait.",1,,1,0,0,
4b7c971e-08f1-45bf-9f3d-328e7f15e005,1453603539,I think I might be doing that then. Thank you for the suggestion.,1,,1,0,0,
dceb64d2-5c4b-4083-acea-083cb49463b7,1452961043,Sorry it's not exactly what you were asking but I found this video really helpful: [Tips for Choosing the Right Wheelchair](https://youtu.be/XDhfcAV-fsE) (It's long but there is a lot of really good information and I really like the way she presents it.) This video talks about some techniques to help negate arm pain though most long tern pushers already do this: [Top tips for wheelchair users](https://youtu.be/kiYWU8gwDBc). Hope it helps at least a little!,1,,1,0,0,
74ef6f7b-a0d3-4235-82e3-d5663eb5da2a,1454272277,"Do you consider yourself a disabled person? Whether as a relatively impaired person or a person who faces a lot of disabling discrimination or just as a person who's ability is outside the norm?

The label is yours to claim because of your conditions. But do you want to?",1,,1,0,0,
956599a1-1382-4bc9-ae2a-30f8e2410e26,1452564513,"Not really. TV isn't much better. 8 characters on network TV for 2015 were PWD, some not visible so therefore easy to sweep under the rug if need be. Page 25. http://www.glaad.org/whereweareontv15

Between inspiration porn (therefore making us heroic or angelic *because* of our disability or tragedy making a character gain a disability, we seem to be stuck in two modes. Outside of *The Sessions* which was more about therapy, I can't think of any sex scene with a visible physical disability. Although it did mock the disbelief of a male hotel clerk hen he was told what was going on in that room. This video goes into it more: https://www.youtube.com/watch?v=7PwvGfs6Pok ",1,,1,0,0,
8a6f8b4c-9342-4e08-9310-54cb44e70044,1453835120,"""Don't let your disability define you"" is no different than any other ""Don't let 'x'"" define you.  It's advice that applies to everyone whether they have a disability or not.  I don't want me disability, color of skin, gender, occupation, taste in music, etc. define me.  They all make up who I am and no particular one defines me.  And that's how it is for most people.  By no means does someone saying ""Don't let your disability define you"" indicate that they are saying your disability is a bad thing.  You can go ahead and keep on pretending it does though.",2,,2,0,0,
8a6f8b4c-9342-4e08-9310-54cb44e70044,1453842783,"It's vague yet simplistic at the same time.  It's not hard to tell people who let themselves, or choose to, be defined by their disability.  You'll find many of them in this sub.  Everything you've listed is acceptable.  People seek out like-minded and similar individuals.  People gravitate towards things they're good at or comfortable with.  I personally have issues with some of them, but that's just me.  

Being defined by your disability means letting it consume your life.  Not having a personality that isn't linked directly to your disability.  Again, the same can be said for other people.  Are you a person who enjoys doing cross fit?  Or does your enjoyment of cross fit encapsulate your life, who you are, who you exclusively surround yourself with?  Are you a musician?  Do you have a personality outside of being a musician?  A person can be a lawyer who enjoys cross fit and plays in a band on the weekends.  No single thing defines that person.  It's no different with a person's disability.",1,,1,0,0,
4b2b53ca-5d94-4f73-a3a1-6d9fb39d6aee,1454255683,"I have a disability and declined even temporary disability payments because I can work just fine, but it's not fair to generalize about people with disabilities because of those of us who can do so.

Why? Because people want to work! The vast majority of those I know with a disability would MUCH RATHER work than receive a rather paltry benefit which basically leaves people on the poverty line anyway, if they were able to do that. The issues are sometimes the nature of the disability, sometimes discrimination, and sometimes employers unwilling to make reasonable accommodations like letting a worker have a flexible schedule when undergoing treatment. AND the fact that they lose access to things like subsidized carers that they would be unable to afford anyway if they're earning more.

Honestly, I think the crude comments and judgment come from people who hate working and see disability as some kind of vacation instead of well, disability, which involves some obstacles they can't relate to and a much greater financial struggle than that faced by people who are lucky enough to be in employment. ",3,,3,0,0,
0ab84db1-5c55-47c9-941b-301c6aad95a9,1452272601,"That's the case with many disabilities, however many autistic people prefer identity-first language, specifically *autistic person* over *person with autism*.

Many of us don't see ourselves as ""with autism"" or as autism being some separate thing from us as a person. We are autistic, you don't say ""your friend who happens to be female"" or ""your friend who happens to be *insert identifying term here*. Autism isn't cancer or a broken leg. You can't remove it and be left with the same person, it's one's most basic brain wiring. To many of us, it's viewed not as something you *have*, but something you *are*.

I don't have problem with people using person-first language, as it's so common with other disabilities, and I know the intent was not bad. For some though, it's a serious issue where they feel as though an inseparable part of themselves is being labeled as wrong, separate, or diseased. 

Autism is a brain wiring difference that affects how our brain processes information, and in so affects everything, but like all aspects of an individual, it is not the only thing affecting anything. It is one part of who we are, but it is inseparable from us. We are who we are in some part *because* our brain is wired the way it is and processes how it does, and we would not be ""us"" if we were not ""autistic"". ",5,,5,0,0,
a7efd846-efba-4057-a0c4-8f33a484d54b,1454246461,"Ok - but the refund isn't counted as savings until it sits in the account for a set amount of time, right? Because there's no way we'll keep over $3000 in the bank for more than a week or two. We need every penny we get. I've been trying to get enough money to fix our car since May. ",1,,1,0,0,
9fa38aa5-f7f8-4e3b-a444-00d64eaa6422,1452655925,Not Europe. I'm not OP. I just take like $50 out when I drive up to New Hampshire to the mountains. I thought that was illegal when I saw this post so I got worried haha,1,,1,0,0,
1ee91c92-fba0-4636-8187-ddd622c99583,1451814378,"Maybe, but when you talk about fetal screening and abortions, its up to the  individual. Imagine the uproar if you tried to take choice away from the individual. You can not force a women to give birth if they dont want to. The state should not have control over wombs.",2,,2,0,0,
4751fa06-39f5-4e81-bafb-b4ba711d35dd,1452056588,"If you feel you're in a moment where it's very obvious, you can just say ""I have a back issue that affects my [breathing/walking/etc.]."" Say it with a smile. No need to elaborate more if you don't feel like it, until the next date. :)",2,,2,0,0,
d4c07107-131c-4f5e-bb39-ce40d48d9503,1451607069,"All hospitals have wheel-on scales. They're usually just on a ward somewhere. Ask at the physio department, someone will point you in the right direction (you don't need to be a patient)",1,,1,0,0,
74ef6f7b-a0d3-4235-82e3-d5663eb5da2a,1453134105,Thanks. :),4,,4,0,0,
589f63c3-bad5-4542-ac39-e0e5a5dc6591,1451716069,"This is incorrect.   Medicare Part B payments will only go up for a small number of people.  That includes:

People who are just getting Medicare for the first time in 2016.

People who have a higher income (not an issue for people on SSDI).

People who have their Part B premium paid for by Medicaid, in which case *it doesn't come out of the SSDI payment* since it's not being paid for by the SSDI recipient at all.

**In short, for most people, Medicare is not cutting into your SSDI payment.**

[Here's the link to the SSA's page on Medicare in 2016](https://www.medicare.gov/your-medicare-costs/costs-at-a-glance/costs-at-glance.html).",6,,6,0,0,
e6f83a20-f8da-4dfd-814b-bb559e7fe25f,1452703614,"My husband has CP -- hi there! US mobility/disability support is primarily provided by the state. Which state are you in?

Some are better about providing support than others. We are in California, which is better set up to assist children or people with cognitive disabilities, but we have been able to get some support from the Regional Center. Direct support from government agencies has been  problematic because they require you don't have a lot of assets saved to use them. We pay for a lot out of pocket or using his private insurance through his job. :) 

We don't really use any support groups... But I know there are a lot of local, in person ones in our city. We found out about them through our local wheelchair/ability device store.

Good luck!",2,,2,0,0,
37f84417-f829-4671-99d3-7ee8393787ad,1452001362,"Hey - I'm not 100% sure what the system is like in the US and how much it varies by school but there are definitely ways to get around writing issues. There are options like notetakers, laptops for examinations or using a scribe for examinations, speech to text software for essay writing etc. It's definitely not out of the realms of possibility! I'm pretty disabled (use motorized wheelchair, very limited upper body strength etc) and I got a degree in biochemistry which involved a significant amount of lab work. Things may require planning and foresight but if it's what you want then it's not completely impossible to achieve!",2,,2,0,0,
65eb3d01-3c5f-4f46-bbd9-7f98ef92e763,1454065228,"Are you on SSI, SSDI or both? Generally there is nothing you can do to increase your benefits as they aren't really linked to your costs.  

If you're not going to be able to afford the new place I suggest looking into HUD housing; they can't charge you more than 30% of your income for rent. ",4,,4,0,0,
85d78199-6a32-4e80-aa98-2b4135b65903,1453778939,Thanks for changing it and responding!,2,,2,0,0,
0ddb56dc-e1a9-4313-a035-963ae97406e0,1453702155,"No, it was in the comment section of the video she originally commented on, which is about a cyberbully targeting my disability in particular and a cyberstalker being genuinely delusional, both happening at the same time. It's been quite a week. And knowing this, she still chose this moment to say this. If she felt it needed to be said, you'd think she would at least have the consideration to wait until my circumstances calmed down. [Here's the link if you're still interested](https://youtu.be/OFjjBxH9xyg)",1,,1,0,0,
1ee91c92-fba0-4636-8187-ddd622c99583,1451809079,"This is great, i have clients that will benifit from this,  i just dont have a 3d printer, a small hurdle. I was looking for another DIY, an eye guided mouse, i seen one on reddit to make but didnt keep the link. Do you have  one by any chance ?.",1,,1,0,0,
755ccf1f-a130-4ea8-a10b-988239258f0c,1451832277,"I haven't gone under any sort of mental health treatment since turning 18. Prior to that, I believe I may have tried one anti-depressant many years back and seen a counselor once to see if it'd help. It didn't. There is official documentation of my conditions but I'm sure they'll need re-evaluated. Thank you for the info. I'm trying to find another job right now. I don't want to be on disability for life. I just want it to give me the boost I need to be able to study and work up a career in the field I can do efficiently.",1,,1,0,0,
4cb9a6e7-994c-4f8c-af41-3daae3f52af4,1454267663,"I worked for 20 years. I paid into an insurance fund. I applied to receive a dividend, and the SSA granted my request. 

EBT is a nice luxury, and I paid enough taxes to justify reception of it. 

Yes I save up money and buy toys, but I have no dependents, debt, car, mortgage, or social life which eats up income. 

Invisible disabilities? Yes, but ""crippling"" in how my brain blows a fuse quite easily, and when enough fuses blow, the machine itself is broken. 

I practice personal responsibility, and I am politically conservative, but I also know what my jurisdiction is. I let people stew in their own garbage while I attend to my obligations. If they don't respect me, then they don't understand wisdom itself. ",2,,2,0,0,
74ef6f7b-a0d3-4235-82e3-d5663eb5da2a,1453686431,"Fuck that person!

It sounds they are given their opinion on living an impaired/disabled life without having actually lived it. I mean, it is awful when privileged people tell struggling people to ignore their struggles or to just ""get over it."" Pity is also awful because it is dehumanizing and ignores people's resolve.",6,,6,0,0,
c9691d3e-23af-43e5-8704-67ac14abc496,1453948243,"I can only speak from the stories I've heard from others in the visually impaired community in my area.  At least in my area Voc Rehab is heavily focused on getting people to school and helping them succeed in school so that they can seek professional careers.  Because of this, a lot of the benefits I'm receiving are centered around equipment and funding for college.

&amp;nbsp;

Depending on your area/ the division of the DSS you are dealing with they may have a different focus.  For those who choose not to further their education in the visually impaired community in my area, it seems like many are directed to a local non-profit that offers assembly line and warehouse work to those who are legally blind.  This of course can't support the entire population so I don't know how they handle job placement when jobs aren't available.  There may be similar resources available to you.  If you are looking for work, Voc Rehab is a great place to get connections and explore your options.  It wouldn't hurt to check there.",1,,1,0,0,
f8ccf5ac-d246-4a42-a843-18331147ebf6,1452198881,"Yes, and I'm starting to think it may not be legal in the US, based on everything I'm finding being from the UK. Drat",1,,1,0,0,
c9bced98-206e-41c8-905f-8d813d1c8004,1454225248,"It makes me very sad too, and I am glad to see I am not the only one that feels this way. Exactly on point you are! I do not know what the solution is but  was growing up, I remember things not being as hostile. People cared more. This whole idea of the “Welfare Queen” with an Escalade and designer handbags is what gets stuck in peoples heads. 


I am disabled for mental health reasons and reading this kind of stuff and hearing people say it, tends to make my panic/anxiety and depression issues worse! I have enough trouble going out of the house to get food as it is, I would like to not have to feel like I am being judged by the people in line or the cashiers when I slide the EBT card. It complicates my well being in other ways too…I constantly feel like I am some kind of worthless piece of crap and I just wish that feeling would stop. I wish I could stop caring what ignorant masses on the internet think but when you see so many people saying so many hurtful things, you start to become affected. I used to put people (politely) in their place but no more of that. Not anymore.. too draining. I even hate commenting on this post though I am glad to see someone else feels the same about this topic. 

It is also funny that hardly anyone commenting the hateful small minded things says that they were once a welfare recipient themselves.. It comes from those who do not have any direct knowledge or experience with it. ",7,,7,0,0,
62cde741-2969-4c1a-a857-8db06df43f77,1453146117,She resides in NY and a lot of the rent reduced apartments are generally in high crime  areas. I think she is not eligible for senior citizen benefits yet. Not a veteran and no little children.,1,,1,0,0,
589f63c3-bad5-4542-ac39-e0e5a5dc6591,1452046464,"I'm going to assume you're in the US, although you don't state otherwise.

First, I suggest talking your state's vocational rehab office. In my state it's called ""Rehabilitation Services."" Their goal is to help disabled people find and keep jobs by determining what they *are* able to do and what skills can be developed and/or enhanced.  If needed, they can help you get ADA accommodations so you're able to perform the job.

As for ""filing for disability"" - without a strong work history you're unlikely to qualify for SSDI, which is funded by taxes that come out of your paychecks.  You have to have worked so many hours over a certain period of time to qualify for SSDI.

You may qualify for SSI.  SSI is intended for disabled people with limited financial means.  It limits the amount of assets you can have (outside of one car and a house, you cannot have more than $2000).  SSI payments are relatively low (IIRC it was $780 in 2015) and most people on it can qualify for their states Medicaid and SNAP programs.   

You can apply online at ssa.gov [here](https://www.ssa.gov/onlineservices/#&amp;a0=0).  Note that the application is very long and it's easier if you gather all the relevant data before you start - doctor's names and contact info, dates of any testing done, etc.  The initial application process (from filing until you get a decision) usually takes at least a year, and only about 1/4 of applicants are accepted with their first application.",2,,2,0,0,
1ad63d2e-18fb-4b01-90f7-5b4f1370fcaa,1453690249,"Well it sounds like she's right about you choosing to strongly identify with your disability. It's unfortunate that she sees it as holding you back. Maybe she's concerned that you're fixated on it to an unhealthy extent? There's clearly no right or wrong amount of disabled identity, it's up to us to find what's healthiest. But if I had to reach out to a friend that I was concerned about, I'd want my message to sound like hers. 

So if she's wrong, why be pissed? You can appreciate the sentiment behind the message but still reject the content. She obviously cares about you and she clearly wasn't trying to say something hurtful, so why not treat it as a teaching moment? Let her know that you're happy with the 'badge.' Let her know that your disability has contributed positively to your character and you can't just deny it. ",6,,6,0,0,
4cb9a6e7-994c-4f8c-af41-3daae3f52af4,1454004245,"""Inspirational"" = vitality. So I am a source of vitality? Red alert, energy vampire in the vicinity. ",1,,1,0,0,
400f3472-f749-43d1-901f-177f881a10a3,1454141324,"Medicare and Medicaid both have prescription drug coverage.  If you're on SSDI/SSI you are covered.

That said, if you don't actually need pain meds, don't start taking them.  You will literally enslave your body to them.  Also, pain meds for chronic pain are not meant to fully alleviate your pain; if they do, you're likely taking too much.  The purpose is to bring the pain down to a level where it is manageable.",1,,1,0,0,
be8e6b44-ea50-4734-bf04-1a81cc30f559,1453467366,"Your comment was automatically removed because you linked to reddit without using the ""no-participation"" np. domain. Reddit links should be of the form ""np.reddit.com"" or ""np.redd.it""

*I am a bot, and this action was performed automatically. Please [contact the moderators of this subreddit](/message/compose/?to=/r/disability) if you have any questions or concerns.*",2,,2,0,0,moderator
aa01476d-a2bf-4268-95ed-48912bbffed9,1453686295,"I'd be pissed too! I'll admit, this is one of the fundamental fears I have about my disease is that others won't recognize it as legitimate because its an ""invisible"" illness and therefore dismissing your emotional pain. I'd tell them that your disease, as it is happening to you, has changed you and your experience as it would if it happened to them. Yeah, other things happen to you than the disease but its something you have to deal with everyday in order to function so of course its going to become a huge part of who you are. 



If I were in your shoes, I'd attempt to talk to your friend because everyone makes mistakes in judgment and maybe what he needs is to learn more about what it means to live with a disability. However, if he is still trying to diminish your experiences and emotions then I would reconsider the friendship. Someone who does that isn't a friend and you'd be better off without them around. ",2,,2,0,0,
93ed1e88-35dd-4aab-8679-22f44ee6975f,1453594937,"They want 1140 or whatever it is gross income before deductions. There is something called [""subsidy and special conditions""](https://www.ssa.gov/disabilityresearch/wi/subsidies.htm) that can count against that 1140 and allow you to make more. ",2,,2,0,0,
be8e6b44-ea50-4734-bf04-1a81cc30f559,1452752825,"Your comment was automatically removed because you linked to reddit without using the ""no-participation"" np. domain. Reddit links should be of the form ""np.reddit.com"" or ""np.redd.it""

*I am a bot, and this action was performed automatically. Please [contact the moderators of this subreddit](/message/compose/?to=/r/disability) if you have any questions or concerns.*",1,,1,0,0,moderator
6be7e826-bf78-44c3-9011-d80b6993cca7,1451642221,I read the article. It doesn't state anywhere ,1,,1,0,0,
4cb9a6e7-994c-4f8c-af41-3daae3f52af4,1453324594,"Physically speaking, I have mobility, dexterity, and a strong back. 

Mentally speaking, my ability to do tedious labor is reduced. Sure, I clean my living space and do maintenance tasks. I prepare my meals and wash my laundry by hand. But it's just me and my thoughts, at my own pace, without social friction.

Human beings are kryptonite for me, and the modern workplace is too fast and furious. On top of that is social friction in how communication is exhausting; I don't talk much because of how tiring it is. 30 minutes with my case manager and Pdoc is ""work"". 

200mg Sertraline is my ""wheelchair"". Acquired coping skills are my ""walker"".

Not an objective definition; perhaps helpful.",3,,3,0,0,
589f63c3-bad5-4542-ac39-e0e5a5dc6591,1451743221,"&gt;many people are paying for it out of pocket.

Really?  Who?

People on SSDI get Medicare *as part of being on SSDI*.  If someone is already on SSDI their part B premium is unlikely to be changing.

Typically, the only people who pay for Medicare out of pocket are older people delaying retirement, not the disabled.",1,,1,0,0,
