commentator_id,created_utc,anonymized_body,ups,downs,score,controversiality,gilded,distinguished
d4096601-8670-4eb3-a258-afdde0e21208,1456896052,"Ah, makes sense! Thanks, that highlights a lot of important aspects of daily routine with a mobility aid",1,,1,0,0,
884c42d5-75d4-4ee4-9f5c-c756aea8f985,1457726269,"&gt; Can the exact caloric need at a given moment be determined? Possibly. But it's going to take a lot more invasive procedures than just plugging in data to a website.

I think we agree then.

.... This is probably the first time a conversation like this was actually civil on Reddit, lol",1,,1,0,0,
8da59540-6467-49f8-ac31-36fecf87a22c,1458777537,"Wait, so does the fact that my employer ended up putting me to like eight hours a week screw me even more?",1,,1,0,0,
838355bf-38f9-4cc4-87c4-8161ef2abf19,1458261705,"I wouldn't have thought to do that, thanks for telling me. :3",1,,1,0,0,
97c43ab3-4f02-4947-b96f-aa58bff15209,1457095050,"I had an evaluation in 9th grade. They only did evaluations every 3 years. I could have removed the para at 18, but I doubt they would have listened to me. Even at 18, you're still under your parents in high school. I did call the DOE at 16 and they said they needed my info (name student ID, etc.) before they can give me info. When I told them the situation they said ""Would you like us to call your school""? WHAT??? Of course this is another step to get the school against me. they were no help at all.

I'm turning 20 in a few days and I do plan to sue the DOE. I don't know if I can sue the DOE. Maybe I can file a complaint. I'm sure they would investigate. Being a high school senior is already hard enough. Why add a babysitter, especially if the student expressed multiple times to the school that she didn't want it. A few of my classmates had paras when they clearly no longer needed them.",1,,1,0,0,
82905be6-8ec4-46d7-b1d9-93b9f7796b4b,1459179060,"The backlog on decided cases depends on the office.  We try to get them out pretty quick though, I would guess the turnaround varies from a few weeks to a month or two in most offices.

The wait time has no impact on whether your decision is favourable or unfavorable.

",1,,1,0,0,
85600c05-c911-4d38-a9b1-250ab1a10c90,1459310944,Downsyndromepregnancy.org the woman that runs it will do DS matchmaking - helping them find someone in their area with a child with DS to provide a community of support. This can be really helpful if the baby has an associated health issue. The site has a lot of info that moms wish they had had. ,3,,3,0,0,
ed398870-6ed9-48cb-aed5-161524630da6,1459378168,"I can definitely relate to that. My dad just never excepted that one of my arms wasn't right. When I was younger he would always try to get me to use it, or just pretend there was nothing wrong with it. When I got older he always acted like if I did exercises with it, it would be all better so it was my fault it wasn't normal. He just won't except that the nerve ruptured and no amount of exercises if going to fix that.",3,,3,0,0,
2aa805ec-949c-4a5b-9bb7-064663458203,1459310749,"I've been to therapy plenty in my life, I've got very intense social anxiety and agoraphobia so I have a whole other plethora of issues to work through there, lol :P I have tried to tell him but he insists it's not what he means to do. I believe him--my dad really is a great guy, he's just...not always perfect. He still tends to keep on doing it.

I'm not sure whether to say I'm sorry or congratulations on getting a diagnosis--I know it must be a huge relief to understand what's going on. How has your mom been handling it so far?",1,,1,0,0,
c30f1c54-490d-448e-aa2c-7754b7f967da,1457962756,"Would you like to support a local, national, or international group?  ",1,,1,0,0,
6e113e51-3bd4-4030-a1f5-a96f319d1176,1457987626,"If you want to volunteer, just start googling. ""Volunteer with disabled adults/children""; ""Disability advocacy""; etc.

ARC is a national program you can find in most places. 

Another one is http://findaclub.usparalympics.org/search-by-location.aspx which is more sports and rec, but it can also lead you to your local programs, which can give you more information about the services they offer and volunteers they need. Special Olympics has a similar page and you can find your chapter. ",1,,1,0,0,
d917959e-70e5-4339-881e-a4394671c340,1456832415,Thank you for that article.  I didn't know most of the information in it.  ,2,,2,0,0,
400f3472-f749-43d1-901f-177f881a10a3,1457890183,"Ohhhh yeah, since when did medicare have deductibles?",1,,1,0,0,
6c71594a-d15e-43ab-a858-ab28d9b2f786,1458059207,"Thank you so much for this! I'm completely lost with how to get started, is an application the first part? I've done some research but more into if it was actual suitable for me.",1,,1,0,0,
1cc994f1-2ae5-47ce-b4bc-75632be4d1e5,1456932326,I think for me it is the added weight.   I've used a cane for so many years that it's movement is just a natural part of my stride now.  A quad tip affects that movement and takes more space is the best way I can explain it.   ,2,,2,0,0,
1de6d51a-ae10-4b98-8650-a96598336eb3,1458754543,"I take issue with several statements, but I'll only comment on your assertion that ""having a lawyer does not increase your changes (sic) of approval AT ALL during those first 2 levels; typically actually they get in the way. Lawyers have a fiscal incentive to drag your case out as it increases their back pay.""

This is an individual who by his own admission ""is a general mess of a human being.""  

An attorney will make sure the Claimant includes information from any and all medical sources.  Many clients forget, or think particular sources aren't applicable without prodding from someone explaining the importance.  An attorney can recommend free and low cost clinics for clients with financial constraints.  An attorney at any stage of the process can contact the treating physician and request medical source statement forms or narrative opinion letters tailored to the Claimant's situation.

Following an initial denial, an attorney can request a copy of the Disability Determination Explanation and see if perhaps SSA mischaracterized Claimants PRW or wrongly discounted a medical opinion.  An approval at the reconsideration level, thereby avoiding the 20mn backlog is an incredible benefit to the client.

If by ""get in the way,"" you mean ""advocate for the interests of the client.""  DDS examiners call clients all the time and ask probing questions that the Claimant may not understand.  Claimant's often unknowingly mischaracterize their work history or daily activities to their detriment.  They'll regret not having had help with a work history report when it bites them in front of a VE at an administrative hearing.  

Finally, you insinuate that lawyers would act in an unethical manner in order to increase their fee.  As you may know, fees are capped in SSD/SSI claims at $6,000.  An average fee in most cases is ~$3000-$3300.  No attorney is getting rich off one disability claim.  To breach ethical standards for an extra thousand dollars would be ludicrous.  Dealing with a complaint to the State Bar b/c an attorney wilfully ""dragged out"" a claim wouldn't be fun.  I may be more wary of non-attorney advocate firms who are not held to the same strict ethical standards as licensed attorneys.  Furthermore, if a claim is resolved quickly, that client is going to be exceptionally pleased with the services and likely to refer friends and family members for months and years to come.  All infinitely more valuable than the little bit of money (and dozen hours of extra work) that would come along a claim going to hearing.

So, you should probably stop ""always telling people not to get a lawyer"" lest their trust in your misguided opinion prejudice their claim.

My advice to OP would be to open a phonebook, look for a small, local firm that specializes in Social Security Disability Claims.  Go in for a free consultation and decide his best course of action from there.",3,,3,0,0,
6be7e826-bf78-44c3-9011-d80b6993cca7,1458717568,Again I'm confused. Maybe angry coffee woman has a placard at home but forgot it?,1,,1,0,0,
d1c79e5c-f6f6-4dcd-b447-ebaa3cafc31f,1457995248,With the shit state this sub is in it wouldn't surprise me :/,1,,1,1,0,
f589729b-a56d-4072-aaef-829b216fc600,1458182731,"I'm a quadriplegic in a house we designed, so I know that the circumstances are different. However, the project that I worked on for a few years, called Challenging Reality, focused on the struggles and technologies to help myself and other quadriplegics in daily tasks. I do most of the cooking in our family, and I am happy and proud to be able to. It didn't come without figuring out a few things of what works for me and not being afraid to try a different technique or tool to make a task easier. Often it was something that did not work at first, but after a few more tries worked better than what I used to use, or how I used to do something.

Below I linked to the cooking section. Maybe some of the things that have worked well for me would work well for him. Hope it helps and I hope you enjoy the photography, which was the secondary purpose of the project.

http://challenging-reality.blogspot.ca/search/label/cooking",7,,7,0,0,
be8e6b44-ea50-4734-bf04-1a81cc30f559,1457191046,"Your comment was automatically removed because you linked to reddit without using the ""no-participation"" np. domain. Reddit links should be of the form ""np.reddit.com"" or ""np.redd.it""

*I am a bot, and this action was performed automatically. Please [contact the moderators of this subreddit](/message/compose/?to=/r/disability) if you have any questions or concerns.*",1,,1,0,0,moderator
984cea99-4198-440f-9c30-49c30735ada0,1458409679,"I'm glad I could be of help! He knows what the phone is and he knows where it is. So I tell him 'phone get it' and he brings it to me. With remotes again he knows what a remote is, and as I would be in the same room as the remote I can just point to it and say 'remote get it' and he will fetch it. ",1,,1,0,0,
ca2d5ddf-11bc-4597-abb5-d3f7ae707019,1457154899,"I'm sorry you had a terrible experience.   We have had some terrible experiences but overall my son loves school.   He asks to go back to school every single day during the holidays.    Honestly I think he loves school so much because it really is the only place he has a chance to be around other children he can interact with.    

He isn't mainstreamed due to severe cognitive, visual, medical and physical disabilities.  The worst experience I have had is the schools not pushing him harder which while maddening isn't exactly traumatic.   It is very easy to write kids like him off.   It takes lots of dedication and skill to push children with these levels of disability to achieve IEP goals and obtain life skills, unfortunately not all school staff are fit for the job.

I have had tons of problems with school nurses.   One nurse over dosed him on a drug that crosses the blood brain barrier, we were very fortunate he didn't suffer permanent neurological damage.   Another nurse bless her heart asked me in all seriousness if she could stand my son up at the toilet to empty his colostomy bag.  My son is in a wheelchair and has a tendency to lose his balance standing unless he is in a rigid standing frame.   I honestly don't know what she was thinking when she asked this question.   For a 2 year period he had chronic pain (since been surgically alleviated) and we had problems with the staff constantly sending him home even though I told them repeatedly all they needed to do was call me to come give his pain meds and he would be okay.   I have also had issues with staff not understanding autonomic dysfunction.  They kept sending him home with a ""fever"" when he was really overheated and just needed to be in an air conditioned room.  It got to the point where I would pick him up and tell them I was taking him straight to the ped.  After he got a clean bill of health after having a ""fever"" just a few hours earlier they finally stopped sending home needlessly.  ",1,,1,0,0,
e55b19c5-ed7f-4d56-ad4c-8b18faf9a1a2,1458932865,"Thank you for the information. I make much less than that in a year, but our household income is decent. Regardless, yes, those premiums are a lot less than I pay now with my pre-existing conditions. And my insurance declines to cover so much. That is the biggest reason that my doctor is excited at the prospect of me being on Medicare. He will finally be able to start some tests and treatments that he's been wanting to start for years.

Now I just have to keep hoping that I get it. My examiner said more than a week ago that they should have a response for me in about a week. Overall, that would mean a six-week process. I'm still trying to figure out whether such a short wait time is good news, bad news, or doesn't mean anything either way.",1,,1,0,0,
f589729b-a56d-4072-aaef-829b216fc600,1458226184,"I must admit, I had to look up what a hob was. It is not a term I'd never heard, as a Canadian. :-)

No, I don't regret it, but I know a lot of friends who really like their countertop cooktop/range. Because of space limitations, we really didn't feel like it would be efficient to have the cooktop separate from the oven, as most adapted homes do. As was stated in this post, and you've seen in my website post, I use a lot of electric appliances and have been quite successful in that. Anything that I need the cooktop on our oven for, I am quite able to reach to the side and do what I need to. I know this is not the case for everyone.

Regarding handles on utensils, I no longer use them. I try to buy good quality utensils that have a nice thick handle which works with my everyday wheelchair gloves. That post says mountains about my functionality.",2,,2,0,0,
e55b19c5-ed7f-4d56-ad4c-8b18faf9a1a2,1457501949,"Thank you. That sounds in line with other things I've read. 

I wonder what happens, though in these cases that take years. If they determine in 2018 that you were disabled in 2015... I'm sure there's a cap, which doesn't seem fair. The applicant didn't make it take that long. ",1,,1,0,0,
8a6f8b4c-9342-4e08-9310-54cb44e70044,1458673133,"Yeah, I kinda figured that was the case. I've just gotten nothing but uncertain answers everywhere I ask so I thought I'd see if any of the fine folk here knew better.

It is what it is I guess. I like having that safety net from Medicare in case something comes up and I find myself jobless or unable to work. I can always apply again, but we all know how ridiculously slow the government works.",2,,2,0,0,
78ed102b-1919-4681-8506-d29c8fc4d882,1457392283,"What is the matter with you? This person came to vent frustrations with a new situation, get some insight, get some advice and feedback and all you  have done is humiliate, abuse, mistreat and belittle this person. 

You are a very abusive person and are nistreating a person just asking for advice. I do not see anything you are accusing this person of doing, self-defeatism, pity fishing, or whatever the words you are using in your abusive manner.

This person has every right to be upset and frustrated with their situation as it's new, not something grown up into. It's a new experience that MANY people have a hard time adjusting to. if you can't help someone with some nice, useful advice then you have no right to bully anyone. You might want to sit yourself down and reread how ugly you have been towards this person.

I commend them for being able to come up and speak out about their frustration to a community you would think was trusting and awesome enough to understand and give some advice. Nothing you have given has been any of this and your attitude towards this person is disturbing.

This person asking for help, Ravenskye, did not come here asking for you to treat her as being selfish for speaking about what they have done in the past often. The ""Glorifying"" what she used to do isn't her being selfish, it's you being selfish and controlling on what someone else can speak about because either you haven't ever or can't ever do what they have. Why does this person have to feel horrible for having a different life than many in disability for a lifetime? 

If anyone is selfish, it's you. You are a bully demeaning and a bad example of a human. Mistreating this person because you feel bad about yourself and your situation,, is wrong on many levels.",2,,2,0,0,
4b2b53ca-5d94-4f73-a3a1-6d9fb39d6aee,1459350836,"I was in a physio unit in a hospital (inpatient) for a month and despite being FOR people in wheelchairs, it's a pain. Doors can be heavy or impossible to open because of angles, there was a lip over the entrance to the bathroom that was hard to roll over, etc.

I spilled my iced tea in my lap, killing my iPhone, because I was juggling my Subway sandwich bag and the drink. 

It takes a lot of getting used to. 

Maybe he'll be able to eventually use a prosthetic leg? Even if not, people adapt to using wheelchairs after some practice. Definitely have a bag to carry things that you can hook onto the wheelchair or go over his arm -- maybe a courier bag over the shoulder would allow him to tuck his paralyzed arm in the strap and keep it in place so he can use the other, and he can keep his wallet and phone and things in it. Or you can use a velcro ""bracelet"" to keep his arm on the handle. There are also cup holders that clip on. 

I didn't complain either! I actually improved and am a ""walking paraplegic,"" (still numb but mobile) but I didn't know I would improve.  Rehab will help once his pelvis heals, too, and he'll get stronger. ",5,,5,0,0,
82905be6-8ec4-46d7-b1d9-93b9f7796b4b,1457632408,"Certain very severe impairments, including stage IV cancer, are expedited under the TERI case policy.",2,,2,0,0,
8678158d-3ddc-4920-ac29-98f574855a46,1458191641,"I was going through your site (awesome, btw), and saw your [kettle post](http://challenging-reality.blogspot.com/2013/06/kettle-and-coffee-maker.html). You might find that a kettle tipper is easier for you, if you use it a lot like I do. I have [this one](http://www.amazon.com/dp/B00KLEA30W/) built for taller kettles but there seems to be a few different models out there.

Of course now I realize you wrote that in 2013 and feel kinda silly...",1,,1,0,0,
02088aab-9670-48af-9885-e234ee3b48fb,1458233535,"I'm not so sure about cutting things, but I'm need to look into an induction burner! ",1,,1,0,0,
2205b097-f200-4596-a06a-be7089c66fbc,1459015248,"&gt; From my understanding, certain disabilities carry more weight than others. I
&gt; am beginning to see an onset of certain symptoms and am curious if any one 
&gt; has any experience in this matter.


You are probably thinking of a ""[medical listing"" vs. ""RFC](http://www.eastbaydisability.com/are-you-disabled.html)"".


A medical listing will automatically qualify you as disabled, otherwise you must prove that the ailments, which can be many, combined with treatment (e.g. medication side-effects) make you disabled.


&gt; What exactly is the process when it comes to SSI and not SSDI? 


SSI is a ""needs-based"" program, where SSDI is for employees who are no longer able to work.  To apply for SSI, you need to fill out the paper form (SSA's online application is only for SSDI).


&gt; Without medical records, is it better to apply now or wait until a diagnosis is 
&gt; made? When the diagnosis is made, it doesn't rule out the fact that I am 
&gt; un-able to work but I do have a work history with part time jobs that are 
&gt; isn't over the SGA limit. 

There's no downside to applying now, however, without proof it will be difficult to prove the onset date.  

&gt; Would a CE examination

Many believe, perhaps erroneously, that CE exams are meant to prove you're not disabled.  Best to have your own records.

&gt; I do have a work history with part time jobs that are isn't over the SGA limit. 

Lack of work doesn't prove you are disabled.  You can incorporate this into your argument, but it's weak evidence.


&gt; Am curious to know what I will be expecting. 

From the sound of it, most likely you'll be declined on the initial application.  Just appeal it, and keep building your case.  Getting on SSI isn't easy (there are also [income](http://www.eastbaydisability.com/ssi-income-eligibility.html) / [resource](http://www.eastbaydisability.com/ssi-resource-assets-requirements.html) limitations).


",2,,2,0,0,
65eb3d01-3c5f-4f46-bbd9-7f98ef92e763,1458663266,"My best understanding is that, no, you will no longer be eligible for Medicare. the two things that make someone eligible for Medicare are age (65) or disability (after 24 months). Since you are no longer considered disabled (by SSA standards) you will not be eligible for the program. 

Since you used to be on disability and were ceased for work activity you do have a period of time (60 months) where you can apply for an Expedited Reinstatement (EXR) of your benefits as long as the reason you quit working was related to the reason you were allowed disability benefits to begin with. All an EXR does is make the process quicker and you can get an immediate restart of your disability payments while they process the paperwork. I *believe* that your Medicare will start right back up again and you don't have to wait the full 24 months again. ",3,,3,0,0,
884c42d5-75d4-4ee4-9f5c-c756aea8f985,1457622936,"&gt; HAES says to eat healthier and be more mindful of what you eat. HAES says to exercise regularly, because exercise is the key to improving your overall health.

&gt;HAES is NOT anti-weight loss. It is anti-dieting

Isn't eating healthier and dieting the same thing?",6,,6,0,0,
753f67ef-8f84-4687-b5d0-6003c0267e7e,1459263460,I don't know how you guys here feel about things like webinars but I saw this one and thought I'd share. Please feel free to cross-post to any subs you feel are relevant.,1,,1,0,0,
4cb9a6e7-994c-4f8c-af41-3daae3f52af4,1458238875,Ironically I have been unaffected by its use towards me. I accept that I am a late bloomer. Still mentally retarded but also an innovative genius in certain ways. More socially retardation than cognitive sogginess.,1,,1,0,0,
400f3472-f749-43d1-901f-177f881a10a3,1459273118,"You hire one.

Insurance sometimes covers it.

If it doesn't and you can't afford it, you can get assistance for that.",3,,3,0,0,
1f7b75e8-9ad2-4847-b1db-98a614f98445,1457807919,"Post this in /r/DisabledSex, if you haven't already.",5,,5,0,0,
68bd88b2-df37-46b4-ba0d-7326630915d9,1459219780,"If it's a set list of questions, Reddit works fine but if it's more of a dialogue.  You can go ahead and add me on Skype.  MyAtomicGard3n",1,,1,0,0,
d4096601-8670-4eb3-a258-afdde0e21208,1456888979,"Haha! I keep encountering this in my research, may I ask why you are still using a cane even though a walker might be better for your situation?",1,,1,0,0,
f589729b-a56d-4072-aaef-829b216fc600,1458226370,"It's interesting, that tipper looks really neat. I could see how it could be very useful and effective. For Christmas of 2014 I received a new kettle. It is a gooseneck with a smaller handle and it did take me a while to figure out how to hold it effectively and safely. Once I did, it has been so good for not spilling as much as I used do with the old kettle. It's not that I ever burnt myself, just an even pouring made for a few splashes on the countertop. This gooseneck cattle is much better for accurate pouring, especially with my Aeropress.

As I said in a few posts on my site, I do my best to avoid any adaptations as I would prefer to be free of them, whenever possible. I appreciate that they can enable someone to do something that they otherwise could not do, but I do like to use my hands' remaining dexterity to its fullest.",1,,1,0,0,
c381a2a1-8eb4-4f49-bd7b-ae1d8f7011de,1457098777,"&gt; I hope you enjoy your new ""bodyguard"".

Ah, I see. Yah, that does sound like a bummer. ",1,,1,0,0,
cc0ed6f8-8b02-4974-85e2-da65df2c5d7b,1458850913,"Yep those shocks will help you with some bigger bumps and a lot just cruising down the sidewalk but the technology just isn't there for the cup holders at least that I've seen. 

Now the tech may be out there, but it's probably a more cost effective approach to find a bottle type solution to keeping your coffee contained. 

I assume you're talking about tea in a thermos or a disposable cup with a small opening for you to drink out of? ",1,,1,0,0,
6c71594a-d15e-43ab-a858-ab28d9b2f786,1457935511,"I didn't know this subreddit existed, you rule.",2,,2,0,0,
4cb9a6e7-994c-4f8c-af41-3daae3f52af4,1458671979,"Your friends are doing what they are doing, but why does job, marriage, and college qualify as ""progress""? Yes, those situations are usually termed as progress, but in your case, illness is severe enough that progress is defined in another way.

You have a decent place to live. You may or may not get along with family, and you have income. Personally, I think that is awesome. 

Income and a place to live. Supercool!

Work on alleviating your illness. Maybe doctors have offered you something which you ignored or don't want to do?

You can work on your perceptions, emotions, and thoughts by using exercises from cognitive behavioral therapy.

Yes you are frustrated, but that does not mean you have to remain that way.",2,,2,0,0,
