,body,score_hidden,archived,name,author,author_flair_text,downs,created_utc,subreddit_id,link_id,parent_id,score,retrieved_on,controversiality,gilded,id,subreddit,ups,distinguished,author_flair_css_class,anonymized_body,anonymized_masks
175,"do you get medicaid?  If so they will be able to fund the chair for your if you qualify, but the chairs you get to pick from are limited but also doesn't mean they are cheap chairs, just that only a handful the government will pay for otherwise you will have to do it out of pocket.
permobil makes some great chairs though if you want to take a look at their models. http://www.permobil.com/en/Corporate/",,,,druminfected,Muscular Dystrophy SMA3,,1470808394,t5_2qhe8,t3_4x0dft,t3_4x0dft,3,1473320252,0,0,d6bhbw7,disability,3,,,"do you get medicaid?  If so they will be able to fund the chair for your if you qualify, but the chairs you get to pick from are limited but also doesn't mean they are cheap chairs, just that only a handful the government will pay for otherwise you will have to do it out of pocket.
permobil makes some great chairs though if you want to take a look at their models. <URL>","[{'start': 367, 'end': 372, 'entity_type': 'URL', 'text': '<URL>', 'operator': 'replace'}]"
176,"Except for a very few conditions (like ALS and Downs Syndrome) just having a particular diagnosis is not going to be disabling.  What SSA looks at is how all your physical/mental medical conditions combined impact your ability to work.

So you can have 10 psych diagnoses but if your condition is not severe enough to prevent all work activity then your claim will be denied. Conversely, you can have only 1 diagnosis but it is so severe that it prevents work activity then you will be an allowance.
",,,,RambleRamble,SSI/SSDI Examiner,,1470139311,t5_2qhe8,t3_4vptnq,t3_4vptnq,12,1473152617,0,0,d60wcf5,disability,12,,,"Except for a very few conditions (like ALS and <PERSON>) just having a particular diagnosis is not going to be disabling.  What SSA looks at is how all your physical/mental medical conditions combined impact your ability to work.

So you can have 10 psych diagnoses but if your condition is not severe enough to prevent all work activity then your claim will be denied. Conversely, you can have only 1 diagnosis but it is so severe that it prevents work activity then you will be an allowance.
","[{'start': 47, 'end': 55, 'entity_type': 'PERSON', 'text': '<PERSON>', 'operator': 'replace'}]"
177,I have to wear a brace and wear special shoes. I also get prescribed pain medicine but they have bad side effects so I don't like to take them. But other than that I can still walk and drive a car normally. I can't play any sports or run because that causes me extreme pain. I also have a major limp but nothing I can't handle. You should deal with anything that you think might hurt you long term because arthritis is not fun lol ,,,,Dealingwiththecrazy,,,1471569041,t5_2qhe8,t3_4yb27o,t1_d6nd2r6,1,1473483525,0,0,d6ng4t8,disability,1,,,,
178,"If you're same-sex, /r/LGBT maybe be a good forum. ",,,,[deleted],,,1471405695,t5_2qhe8,t3_4y0yba,t1_d6knwrm,1,1473446570,0,0,d6koyy4,disability,1,,,,
179,Have you looked into your state's vocational rehabilitation? They often have engineers to evaluate your workspace and needs and then purchase you tech to help you do your job. ,,,,princessimpy,,,1470745716,t5_2qhe8,t3_4wtbhf,t3_4wtbhf,3,1473304871,0,0,d6aa42i,disability,3,,,,
180,"&gt; Even if you have to go the lawyer route, they often get paid from the six months of back pay you get from social security. While expensive, it'

Do they get paid off of container? Maybe it's silly I've never looked into it more seriously..

Do you also know whether getting ""approved"" for disability lasts forever/would forever prohibit me from going back to work? I guess I'm still clinging to the possibility of some half-remission, and even if it were to only last 6 months (seems to be the trend, actually), I would want to be able to go back to work, maybe ideally have some sort of ADA protection while working (would have to WFH, etc.), and in the event of a huge relapse I wouldn't have to re-start the whole process. Especially because if I relapse I won't have the health/energy for any sort of, um, process.",,,,whoiamidonotknow,,,1471016413,t5_2qhe8,t3_4x622i,t1_d6dwnd5,2,1473365550,0,0,d6engcq,disability,2,,,,
181,"&gt; My mom said that there was a chance, that the man didn't stop previously since he had a prior bad experience with police and wanted to get home first (where you ""feel safe"") before talking to this particular cop. 

Sorry, only police are allowed to take precautionary measures for their safety.

For everyone else, it's ""comply immediately or be murdered"".",,,,NeonDisease,,,1471891479,t5_2qhe8,t3_4z13bi,t1_d6s2dsm,4,1473543215,0,0,d6s6wv5,disability,4,,,,
182,"I see your account exists solely to promote your stand up comedy. Have you ever heard the concept ""don't punch down"" when it comes to comedy? This is punching down. If that is you pictured, you clearly aren't so physically disabled as the person you're making fun of. It is really inappropriate to come here to make fun of the physically disabled.",,,,FlailStorm,,,1472671603,t5_2qhe8,t3_50h62u,t3_50h62u,3,1473702766,0,0,d74ek2g,disability,3,,,,
183,"The important thing to point out here is everybody is talking about two completely different programs, with different rules. 

SSDI - beneficiaries have paid in thru FICA to qualify financially. There is no asset limit, their spouse can make six figures, they can inherit a million dollars. Not one penny of it affects their monthly check. Only their own, personal earned income can do that. 

SSI - this is a disability welfare program. Beneficiaries are limited to $2,000 in assets and their earnings *as well as* those of a spouse will affect their monthly check. 

So OP - if you are on SSDI (you typically get your check any day BUT the first) then gifts have no bearing on your benefit. ",,,,Frugalista1,,,1471652877,t5_2qhe8,t3_4ykear,t3_4ykear,7,1473499838,0,0,d6osq64,disability,7,,,,
184,"huh, never thought I'd stumble across this family again. I worked for them as a PCA (before I became disabled) back in 2008. ",,,,bicycle_dreams,CRPS/PTSD/MDD/MPS,,1471035977,t5_2qhe8,t3_4um3ak,t3_4um3ak,1,1473371471,0,0,d6f37tx,disability,1,,,,
185,"I think it's pretty common. My friend got a bunch of that when he started a podcast, with one creep going to the extreme of finding his workplace and harassing him there. I've been warned of this myself, now that I'm thinking about it- when I expressed an interest in making some YouTube content. 

I hope you'll keep posting on YouTube. There's a huge difference between what you're doing (bravely sharing your experience in a public forum) and what those shitheads are doing (anonymously harassing someone for a thing they can't change). It's very clearly not a level playing field- so don't bother engaging with them!

Hugs to you as well!   :-)",,,,YESmynameisYes,ABI,,1472525132,t5_2qhe8,t3_507fhv,t1_d71r4ou,3,1473673240,0,0,d724ecx,disability,3,,,"I think it's pretty common. My friend got a bunch of that when he started a podcast, with one creep going to the extreme of finding his workplace and harassing him there. I've been warned of this myself, now that I'm thinking about it- when I expressed an interest in making some <PERSON> content. 

I hope you'll keep posting on <PERSON>. There's a huge difference between what you're doing (bravely sharing your experience in a public forum) and what those shitheads are doing (anonymously harassing someone for a thing they can't change). It's very clearly not a level playing field- so don't bother engaging with them!

Hugs to you as well!   :-)","[{'start': 330, 'end': 338, 'entity_type': 'PERSON', 'text': '<PERSON>', 'operator': 'replace'}, {'start': 280, 'end': 288, 'entity_type': 'PERSON', 'text': '<PERSON>', 'operator': 'replace'}]"
186,If I do get denied by the judge what happens? From what I seen it then goes to a federal judge? Would a lawyer still be willing to help me if I were denied by the first judge?,,,,throwingaway19483918,,,1471987525,t5_2qhe8,t3_4z37fl,t1_d6t72m7,1,1473564703,0,0,d6tt9mn,disability,1,,,,
187,The general answer is that it depends on what type of benefits they get. Do they get SSDI or SSI? If they're all collecting SSDI then your income won't matter. If however any of them collect SSI then the benefits may change and you'll want to call social security to be sure.,,,,asknanners12,PTSD/MDD/GAD/BPD/MISC.,,1470899081,t5_2qhe8,t3_4x51rl,t3_4x51rl,1,1473341961,0,0,d6cyc39,disability,1,,,,
188,"My high school counselor told me to drip out, get my GED, and go to college a year early because my many absences and hospitalizations would mean the school would challenge my credits every grading period. They cared more about the tax money for having my butt in a chair there than my perfect honors class grades and outstanding achievement test scores.",,,,SeizeThesePanties,"epilepsy, severe allergies, depression",,1471284443,t5_2qhe8,t3_4xptre,t3_4xptre,4,1473418988,0,0,d6il7kq,disability,4,,,,
189,"I'd like to clarify that initial and reconsideration examiners, as well as the ALJ, are not solely looking at the Bluebook and Grid when they make a disability determination.

Sure, those are the hard, brightline rules that allow for easy determinations of whether someone is definitely disabled, but if a person doesn't qualify for those, the examiner/ALJ makes a finding of the person's residual functional capacity (RFC).

The decisionmaker then determines whether there are adequate jobs in the national economy that a person with the determined RFC can perform.  If there are jobs, they are not disabled.  If the person cannot perform work with their RFC, then they are disabled even if they don't meet a listing or grid out.",,,,DrMuffinPHD,SSA ODAR Attorney Advisor,,1471617715,t5_2qhe8,t3_4xyocj,t1_d6nqq4g,2,1473491349,0,0,d6o398t,disability,2,,,,
190,What paperwork though? They sent no forms and didn't tell me to bring anything (bank statements or anything) so I have no idea what they'll want. We did it for the first time last year (over the phone) and they didn't want anything then either so I'm not all that familiar with these things.,,,,frackentay,,,1470514234,t5_2qhe8,t3_4wemcu,t1_d66mg80,1,1473258783,0,0,d670cn1,disability,1,,,,
191,"Phrasing: I'm going to ""run, jump, leap, etc."" is just the English language. I can't tell you how many odd faces I've seen after an odd turn of phrase. Make a joke of it... break the tension.",,,,Skid_rower,,,1471759952,t5_2qhe8,t3_4y0yba,t3_4y0yba,1,1473518561,0,0,d6qbtnc,disability,1,,,,
192,"Be sure you can test drive the model you chose beforehand. Get one that accommodates your size well, and has a long battery life. 

God luck!",,,,Frugalista1,,,1470814304,t5_2qhe8,t3_4x0dft,t3_4x0dft,1,1473321147,0,0,d6bjlmu,disability,1,,,,
193,"I have MS and my medicine alone is almost 100k a year.  I need a wheelchair, but the portion I have to pay is still ridiculously expensive. My tecfidera costs $266 a day.",,,,HighOnAmbien,,,1472042615,t5_2qhe8,t3_4z4erm,t3_4z4erm,1,1473574822,0,0,d6ukl6g,disability,1,,,,
194,"&gt; 
&gt; 

Speech to text software. ",,,,mixedmaterials,Cerebral Palsy,,1470760546,t5_2qhe8,t3_4wtbhf,t1_d6aac3d,1,1473308543,0,0,d6ak4a1,disability,1,,,,
195,"Haha, the deciphering trouble you describe is a minor daily annoyance in my daily life, and yes, that's my problem with masks in movies. Luckily my SO enjoys watching movies with subtitles on. I'm always startled when I meet people who are actively against subtitles in movies. Usually they think they're too visually distracting. I can understand that, but I also know that literally every Chinese movie is subtitled with Chinese characters, and no one has a problem with that.

I definitely rely heavily on context in lip reading, facial expressions, body language, and tone of voice, so I think this is probably a reason for my dislike for extended phone conversations. I did meet a patient the other day who said that since he lost his sense of taste, he had no problem eating lots of healthy foods!

Haha, I did enjoy that pic. Thanks!",,,,dsugoi,,,1472652039,t5_2qhe8,t3_5076j3,t1_d724qe2,2,1473696890,0,0,d73zb8j,disability,2,,,,
196,A Dremel and hand tools for woodcarving.,,,,dtdt2020,,,1472172156,t5_2qhe8,t3_4zllyg,t3_4zllyg,2,1473604037,0,0,d6wvhoy,disability,2,,,,
197,I just followed up on this post.  /u/thepirateboy hasn't posted in two months and I'm really concerned about him.  I did some sleuthing and I believe I found his gofundme from last year where some people donated for him to get housing prior to his class at the blind school.  If you'd like I can PM you the link.,,,,weedpussy,,,1470026679,t5_2qhe8,t3_4juqll,t1_d3asm2l,1,1473129921,0,0,d5z7yav,disability,1,,,I just followed up on this post.  <USER> hasn't posted in two months and I'm really concerned about him.  I did some sleuthing and I believe I found his gofundme from last year where some people donated for him to get housing prior to his class at the blind school.  If you'd like I can PM you the link.,"[{'start': 34, 'end': 40, 'entity_type': 'USER', 'text': '<USER>', 'operator': 'replace'}]"
198,"The only time I tell the decision is if the case has gone back to the field office and I know my decision is final, is that what you do as well?",,,,spicyshazam,,,1470577103,t5_2qhe8,t3_4w1eu2,t1_d63b8fl,2,1473269562,0,0,d67rel7,disability,2,,,,
199,"I'm hoping others will chime in with more direct knowledge. I taught for a little and had students with undiagnosed disabilities and we had some vague tactics that seemed to help, but they came more out of trial and error than any real knowledge of disabilities and how to work with them. 

* If there are students who are having trouble because they can't keep track of where their homework/textbooks/pencils are, and you've tried and failed to get them to be able to do it on their own, try keeping a little cabinet in the classroom for them to store their stuff just for that class. 

* Sometimes students have trouble sitting all day. Try incorporating some movement into each class. Even if it's just a time to stand up and do a few jumping jacks or stretch. 

* Having a few fidget toys on hand can be great, especially for those who have trouble focusing. 

* Give students as much routine as possible without making things boring.

* Make instructions very clear and simple. Make a clear time to write down homework.

Disabilities can be widely varying and the accommodations needed are just as varied. You might identify a few disabilities that you think students might have and look up supports specific for those disabilities.

You might also try crossposting in r/occupationaltherapy. 

Hope that's helpful!",,,,kwxt,,,1472046038,t5_2qhe8,t3_4zcb5m,t3_4zcb5m,6,1473575553,0,0,d6umjz1,disability,6,,,,
200,"For sure. I see my doctor this Wednesday actually.

I've tried to work many times before and always end up quitting unnoticed, I actually think all the jobs I've had. I've left without warning by just not showing up.

I really want to improve and be able to work. Part of me thinks I can try and touch it out and work, but at the same time I just know I'll end up being exhausted.

I try not to bring it up or talk about it, but that's definitely how every job has went for me. I want to try and make this job not the same way. The longest I've ever worked I think was 3 weeks.

I'd say I've improved. But like you say, therapy and what not would be good. I agree too.

Thanks for the insight!",,,,MNdakota,,,1471245888,t5_2qhe8,t3_4xsbe0,t1_d6i1l7g,3,1473411845,0,0,d6i1xw1,disability,3,,,,
201,I tried to play my guitar. It's hard to play while you're on your back. I was surprised. I need a ukelele.,,,,IQBoosterShot,T4 paraplegic,,1471180116,t5_2qhe8,t3_4xl327,t1_d6gq2gr,1,1473397811,0,0,d6h087i,disability,1,,,,
202,Wish I could say I was surprised.,,,,The_Croaker,Muscular Dystrophy,,1471423338,t5_2qhe8,t3_4y2rub,t3_4y2rub,4,1473449268,0,0,d6kwas2,disability,4,,,,
203,"Where I am, this mostly applies for seniors. ",,,,sunkindonut149,,,1472659142,t5_2qhe8,t3_50cgki,t3_50cgki,1,1473698848,0,0,d744iq0,disability,1,,,,
204,"A ramp might be a good investment. In the long term she may lose the ability to walk entirely. It's also possible she could have a heart attack, stroke, or other health event. ",,,,dtdt2020,,,1471616424,t5_2qhe8,t3_4ydr24,t3_4ydr24,1,1473491034,0,0,d6o2ba5,disability,1,,,,
205,"I don't think they consider Asperger's a separate syndrome anymore.  [It's part of developmental disorders, namely, autism spectrum disorder.] (https://www.autismspeaks.org/dsm-5/faq)

",,,,ozarkhome,,,1470139302,t5_2qhe8,t3_4vptnq,t3_4vptnq,2,1473152616,0,0,d60wcaa,disability,2,,,"I don't think they consider <PERSON>'s a separate syndrome anymore.  [It's part of developmental disorders, namely, autism spectrum disorder.] (<URL>)

","[{'start': 144, 'end': 149, 'entity_type': 'URL', 'text': '<URL>', 'operator': 'replace'}, {'start': 28, 'end': 36, 'entity_type': 'PERSON', 'text': '<PERSON>', 'operator': 'replace'}]"
206,"Reading, drawing, painting, jig saw puzzles, games, sitting in front of the PC for way too long doing ""research"", knitting, crocheting, needlework, wood burning, making bird houses, whittling, sewing, leather making, jewelry making, probably more.

 Is there something around the house he needs to do, but just hasn't taken the time to address it?  Like a craft project kind of thing he can do at a table?  I have pictures that need to be matted and framed, photos that need to be organized, stuff that needs to be sorted, stuff like that.",,,,Eight43,,,1472168882,t5_2qhe8,t3_4zllyg,t3_4zllyg,5,1473603287,0,0,d6wtczu,disability,5,,,,
207,You need to contact the people above the floor manager. Simple as that. Tell them that your client is talking to an attorney but that you think he'd calm down if he was told it was a one-time mistake and was given a sincere apology.,,,,UHaveNoPowerOverMe,Narcolepsy,,1470628948,t5_2qhe8,t3_4we739,t3_4we739,3,1473282014,0,0,d68mk6o,disability,3,,,,
208,Fine print use more than 23gb of data in a month you get throttled during peak network activity,,,,Kyddeath,Nerve Damage/Crip,,1470206845,t5_2qhe8,t3_4vwqvm,t3_4vwqvm,2,1473169693,0,0,d626js7,disability,2,,,,
209,Is there an accommodation that would help you? Maybe a talk-to-text to make up for your slow typing speed?,,,,UHaveNoPowerOverMe,Narcolepsy,,1470711101,t5_2qhe8,t3_4wtbhf,t3_4wtbhf,5,1473299708,0,0,d69wb71,disability,5,,,,
210,You talk about the pain killers but what is your dr giving you to address the prostatitis that is the root of the problem?,,,,Frugalista1,,,1470723760,t5_2qhe8,t3_4wqae5,t3_4wqae5,1,1473302182,0,0,d6a2xtc,disability,1,,,,
211,"I just requested that one of my exams be moved since it was on the same day as a doctors appointment (which i could not re-arrange) as well as another exam, but they refused to change the day of the exam. Well you see, i organised this through the disability office, but it was the actual faculty which denied it, and they practically bullied me into not going further with it (which im pretty sure is not legal). So i gave alot of documentation on my doctors appointment, as well as copies of emails  and all the disability proof, but they still said no to the appeal, which makes me think they did not look at it properly, or the documentation.",,,,Blurryblanket,,,1471566540,t5_2qhe8,t3_4yfo57,t1_d6ne0pi,2,1473482948,0,0,d6nef6e,disability,2,,,,
212,I don't see why not. I don't think it's disrespectful if you're genuinely feeling a lack of energy and stamina.,,,,karen93111,,,1471229910,t5_2qhe8,t3_4vejrh,t3_4vejrh,1,1473409193,0,0,d6hunut,disability,1,,,,
213,"If she's on disability, and it's too low for a place to live, is she getting SNAP? That gets you another $194.00.

Why are you paying medical bills? Is she on SSI or SSDI? Why doesn't she have medical?

There is NO Section 8 in most places, but it's different if you are disabled. 

A completely disabled person can't live in her car, or a trailer! How will she use the dump sites, unhook the trailer, etc. I've lived this as an elderly person. She will roast, and freeze. She can't afford solar panels. Who will change her propane tanks? A site with electricity and water costs as much as a motel. Just, hell no. If she's in a van, how will she get to the bathroom? Will she poop in the van? Where will she shower? This is not an idea for a disabled person.

She needs to find a place to travel to, and then go to the housing authority, a public hospital emergency room, or a shelter, and ask for help. 

Or, BEST, does she have enough for a Studio 6 type motel? These get you a roof, tiny kitchen. water, electric, TV, cable, even toilet paper and clean towels, for one price. Then she gets her food card and medical, and she's set. I've done it, and it's perfectly fine. She needs her check to be just a few dollars more than the motel; for the laundry. and an occasional trip to dollar tree. She can get an emergency food card in just days, but you have to request EMERGENCY CARD.

Some of these plans are a non-starter for a person with a jacked-up back, people. Sorry.

",,,,lyn816153,,,1471507079,t5_2qhe8,t3_4xm6e2,t3_4xm6e2,1,1473468638,0,0,d6mciiq,disability,1,,,"If she's on disability, and it's too low for a place to live, is she getting SNAP? That gets you another $194.00.

Why are you paying medical bills? Is she on SSI or SSDI? Why doesn't she have medical?

There is NO Section 8 in most places, but it's different if you are disabled. 

A completely disabled person can't live in her car, or a trailer! How will she use the dump sites, unhook the trailer, etc. I've lived this as an elderly person. She will roast, and freeze. She can't afford solar panels. Who will change her propane tanks? A site with electricity and water costs as much as a motel. Just, hell no. If she's in a van, how will she get to the bathroom? Will she poop in the van? Where will she shower? This is not an idea for a disabled person.

She needs to find a place to travel to, and then go to the housing authority, a public hospital emergency room, or a shelter, and ask for help. 

Or, BEST, does she have enough for a <LOCATION> type motel? These get you a roof, tiny kitchen. water, electric, TV, cable, even toilet paper and clean towels, for one price. Then she gets her food card and medical, and she's set. I've done it, and it's perfectly fine. She needs her check to be just a few dollars more than the motel; for the laundry. and an occasional trip to dollar tree. She can get an emergency food card in just days, but you have to request EMERGENCY CARD.

Some of these plans are a non-starter for a person with a jacked-up back, people. Sorry.

","[{'start': 943, 'end': 953, 'entity_type': 'LOCATION', 'text': '<LOCATION>', 'operator': 'replace'}]"
214,"Personally, I feel we're just not ready yet. The disability movement is fractured, disillusioned, apathetic. Society is focused on other issues, on other forms of inequality, financial or otherwise. A lot of things are going to need to line up before perceptions change.",,,,TinyLittleStormCloud,,,1470227671,t5_2qhe8,t3_4vxur5,t3_4vxur5,2,1473172462,0,0,d62dkvt,disability,2,,,,
215,I'm just happy I get the best parking spots,,,,pinkcultleader,,,1470681509,t5_2qhe8,t3_4wqq9v,t3_4wqq9v,3,1473292066,0,0,d69c6gv,disability,3,,,,
216,"I'm sorry, but that's absurd. There's no way of judging intent. It's a fundamental attribution error. https://en.m.wikipedia.org/wiki/Fundamental_attribution_error

Even if there was it would be meaningless. ""Sorry I shot up the theatre, but my intentions were good! I was trying to commit ethnic cleansing and save the planet!"" 

Nope.",,,,Savesomeposts,,,1472428814,t5_2qhe8,t3_5006bc,t1_d708yzu,3,1473654238,1,0,d70kjcv,disability,3,,,"I'm sorry, but that's absurd. There's no way of judging intent. It's a fundamental attribution error. <URL>

Even if there was it would be meaningless. ""Sorry I shot up the theatre, but my intentions were good! I was trying to commit ethnic cleansing and save the planet!"" 

Nope.","[{'start': 102, 'end': 107, 'entity_type': 'URL', 'text': '<URL>', 'operator': 'replace'}]"
217,"Thank you, and I appreciate the insight!!",,,,_Legs_,,,1471382254,t5_2qhe8,t3_4y0yba,t1_d6k6zqc,2,1473440746,0,0,d6k997p,disability,2,,,,
218,"Not recently, also any diagnoses are from at least 2 years ago. I haven't been able to seek treatment after I turned 19 due to the insurance I had at the time being only for children and adolescents(they were able to pay for things like my inpatient stays completely). The help I was getting at the time wasn't helping me despite dealing with multiple therapists, two different psychologists, and one psychiatrist. One therapist even complained about her other clients to me since she seemed to like me for some reason. Medications just worsened my condition and there wasn't much of any actual behavioral therapy. 

Only recently have I become aware of things like Medicaid and sliding scale clinics which i'm currently looking into. I'm aware my current situation is helpless but hopefully it can at least be used as an example.",,,,[deleted],,,1472346998,t5_2qhe8,t3_4zr8op,t1_d6yx4m7,1,1473639565,0,0,d6zgb6i,disability,1,,,,
219,"Disability Services should absolutely be able to help you. I have accommodations for this exact thing. My only other advice is to check their website or call to find out what paperwork they use to verify diagnosis. It can a while to get everything set up so you should get that paperwork to your doctor as soon as possible. In the future, get your accommodations set up before the semester starts.",,,,isaac_the_robot,"anxiety disorder, delayed sleep phase, depression, crohn's",,1472062124,t5_2qhe8,t3_4z42nb,t3_4z42nb,1,1473579879,0,0,d6uybpe,disability,1,,,,
