,body,score_hidden,archived,name,author,author_flair_text,downs,created_utc,subreddit_id,link_id,parent_id,score,retrieved_on,controversiality,gilded,id,subreddit,ups,distinguished,author_flair_css_class,anonymized_body,anonymized_masks
497,"Well everything was up to date until 2010.  After 2010, there was a six year gap.  I was under my parents insurance until 2013.  I couldn't get the help I wanted them because my parents were abusive and controlling.  They wouldn't let me see a therapist unless I admitted that I'm the crazy one and they were the normal ones in the family.  

So I had to wait until I aged out.  The problem was that I was going to school from 2014-2015, and my husband's job wasn't paying enough to get insurance or obamacare.

I got lucky this time around and got my own insurance because I got pregnant so I'm under Medicaid for a year.",,,,[deleted],,,1472542723,t5_2qhe8,t3_509w6t,t1_d72c9fn,1,1473675849,0,0,d72cezw,disability,1,,,,
498,"I'm 21, and have spastic hemiplegia. Over the course of my life (since being diagnosed at 2) I have tried a LOT. Bracing, casting, Botox, and of course a ton of occupational and physical therapy. My doctors were unwilling to perform a bilateral gastroc lengthening until they were sure I would not grow in height any more (this reduces the risk of overextension leading to crouching) so I couldn't get it until I was 19, but now I walk completely unassisted--I'm still in therapy, and get Botox and cortisone injections several times a year, but I am so happy with the results. Obviously it depends on the severity of the case and the individual's response to surgery, but for me it worked amazingly well.

As for important things for a parent to know: when it comes to public education (if that's what you decide to do for your son), know your rights. Don't let school administrators short-change your son on accommodations he is entitled to. Read his IEP carefully and address anything that seems fishy with the school team.  My IEP team once tried to put a provision that if I got all As, my accommodations would be revoked because I would be ""demonstrating adequate coping skills."" Literally. 

Let me know if you ever need someone to talk to. While CP impacts the lives of the people who have it most, it is incredibly hard for their caretakers as well. Don't burn yourself out. Care for yourself so you can care for your son. 

EDIT: misread the age of your son, so sorry. Took out the part about early intervention.",,,,literarylion,,,1472257232,t5_2qhe8,t3_4zqoel,t3_4zqoel,3,1473622761,0,0,d6y8rg3,disability,3,,,"I'm 21, and have spastic hemiplegia. Over the course of my life (since being diagnosed at 2) I have tried a LOT. Bracing, casting, <PERSON>, and of course a ton of occupational and physical therapy. My doctors were unwilling to perform a bilateral gastroc lengthening until they were sure I would not grow in height any more (this reduces the risk of overextension leading to crouching) so I couldn't get it until I was 19, but now I walk completely unassisted--I'm still in therapy, and get <PERSON> and cortisone injections several times a year, but I am so happy with the results. Obviously it depends on the severity of the case and the individual's response to surgery, but for me it worked amazingly well.

As for important things for a parent to know: when it comes to public education (if that's what you decide to do for your son), know your rights. Don't let school administrators short-change your son on accommodations he is entitled to. Read his IEP carefully and address anything that seems fishy with the school team.  My IEP team once tried to put a provision that if I got all As, my accommodations would be revoked because I would be ""demonstrating adequate coping skills."" Literally. 

Let me know if you ever need someone to talk to. While CP impacts the lives of the people who have it most, it is incredibly hard for their caretakers as well. Don't burn yourself out. Care for yourself so you can care for your son. 

EDIT: misread the age of your son, so sorry. Took out the part about early intervention.","[{'start': 492, 'end': 500, 'entity_type': 'PERSON', 'text': '<PERSON>', 'operator': 'replace'}, {'start': 131, 'end': 139, 'entity_type': 'PERSON', 'text': '<PERSON>', 'operator': 'replace'}]"
499,"I felt like I should get some insight from someone who has experienced this situation. It's the little details that I wanna get caught up on to make him more comfortable. Like, for example, I posted this to r/relationships first and someone informed me that I should say 'using' a wheelchair instead of 'in a wheelchair'",,,,_Legs_,,,1471382149,t5_2qhe8,t3_4y0yba,t1_d6k8ghz,2,1473440718,0,0,d6k96dj,disability,2,,,,
500,"Im paralyzed waist down and live on my own in Cambridge MA. For me, its all about routine and staying active. I get help cleaning once a week, but I would do that anyway just because I'm messy. I live close to my pharmacy and my Dr's office so I can just roll on down when I need to. Plus I have a car with hand controls so I get around town easy.  I cook for myself and can do transfers onto my bed, couch , and shower chair when needed. I've been here about nine years and been paralysed about a year longer than that. I wouldn't trade the freedom for anything. Yes, I have tough days where everything seem to go wrong.
Fall out of my chair, having super bad neuropathy pain, the list goes on. But there are far more good days than bad.",,,,SmallManBigMouth,,,1470539557,t5_2qhe8,t3_4wgo2h,t3_4wgo2h,2,1473264378,0,0,d67eg00,disability,2,,,"Im paralyzed waist down and live on my own in <LOCATION>. For me, its all about routine and staying active. I get help cleaning once a week, but I would do that anyway just because I'm messy. I live close to my pharmacy and my <PERSON>'s office so I can just roll on down when I need to. Plus I have a car with hand controls so I get around town easy.  I cook for myself and can do transfers onto my bed, couch , and shower chair when needed. I've been here about nine years and been paralysed about a year longer than that. I wouldn't trade the freedom for anything. Yes, I have tough days where everything seem to go wrong.
Fall out of my chair, having super bad neuropathy pain, the list goes on. But there are far more good days than bad.","[{'start': 227, 'end': 235, 'entity_type': 'PERSON', 'text': '<PERSON>', 'operator': 'replace'}, {'start': 46, 'end': 56, 'entity_type': 'LOCATION', 'text': '<LOCATION>', 'operator': 'replace'}]"
501,"The last thing I want to do is be *literally* paraded around for being disabled. I understand some people feel differently, but I don't want people to think of me as the disabled guy, I want them to recognize me by my interests and my personality. And if you want to know why these parades don't have any traction is because non disabled people find it uncomfortable to draw attention to people's disabilities in most cases. I still get uncomfortable when talking with someone about a mental disability they have, not because I'm afraid of them or I don't want to know about their experiences, but because I cannot imagine myself what that would be like.",,,,99baking,,,1471767768,t5_2qhe8,t3_4yt97v,t3_4yt97v,5,1473519497,0,0,d6qefse,disability,5,,,,
502,"I got SSDI at 21.  If they've been working full time since 18 then they can probably get it.  Really depends on how much they're getting paid.  But yes, they should go to VocRehab first.",,,,atrociousness,"Type 1 Neurofibromatosis, Hydrocephalus, Severe Chronic Pain",,1471348468,t5_2qhe8,t3_4xyocj,t1_d6jkdmr,2,1473431626,0,0,d6jkjjx,disability,2,,,,
503,"Even if the judge says you medically qualify for SSI, once it goes back to the field office they will relook at your finances and, if you are over resources, you're claim will be a technical denial. 

If you are over that $2K limit you need to spend that money before you go in front of the judge. Don't just give it to a family member, SSA will look at your bank statements and if money just ""disappears"" like that it will raise questions about you hiding assets. Spend it on yourself (paying your rent in advance, pay down any loans, etc) and get under that limit. ",,,,RambleRamble,SSI/SSDI Examiner,,1472123377,t5_2qhe8,t3_4z37fl,t1_d6tt18n,1,1473592286,0,0,d6vx2of,disability,1,,,,
504,Then bring the paperwork just in case,,,,stinkyfrenchguy,,,1470488916,t5_2qhe8,t3_4wemcu,t3_4wemcu,1,1473253251,0,0,d66mg80,disability,1,,,,
505,"Well that was a nice, unfunny start to my day. ",,,,FaceofMoe,,,1472653807,t5_2qhe8,t3_50h62u,t3_50h62u,9,1473697342,0,0,d740i4e,disability,9,,,,
506,"Actually I am Irish thankfully, but you are our neighbours and Brexit affects Ireland so I keep up to date. Corbyn is cool, didn't like his tepid support for Remain though. The other guy is fine, probably an easier sell to Tory supporters. But Labour needs to stop being New Labour and become Old Labour again. There has to be a genuine humane alternative to the Tories. It looks like there is less room for Tory-lite candidates under Corbyn which is great. The fact that certain Tories have a visceral dislike for Corbyn is a sign he is doing something right. He is the best chance to roll back the worst cuts. 

The system in Ireland isn't great, you can get an education without being beggared but they don't know how to support disabled people at work. But there is no great stigma about disabled people getting welfare, if you honestly can't get a job, not your fault. ",,,,The_Croaker,Muscular Dystrophy,,1472635687,t5_2qhe8,t3_50g3sy,t1_d73s1ba,2,1473694218,0,0,d73scut,disability,2,,,"Actually I am Irish thankfully, but you are our neighbours and <PERSON> affects <LOCATION> so I keep up to date. <PERSON> is cool, didn't like his tepid support for Remain though. The other guy is fine, probably an easier sell to Tory supporters. But Labour needs to stop being New Labour and become Old Labour again. There has to be a genuine humane alternative to the Tories. It looks like there is less room for Tory-lite candidates under <PERSON> which is great. The fact that certain Tories have a visceral dislike for Corbyn is a sign he is doing something right. He is the best chance to roll back the worst cuts. 

The system in <LOCATION> isn't great, you can get an education without being beggared but they don't know how to support disabled people at work. But there is no great stigma about disabled people getting welfare, if you honestly can't get a job, not your fault. ","[{'start': 637, 'end': 647, 'entity_type': 'LOCATION', 'text': '<LOCATION>', 'operator': 'replace'}, {'start': 442, 'end': 450, 'entity_type': 'PERSON', 'text': '<PERSON>', 'operator': 'replace'}, {'start': 113, 'end': 121, 'entity_type': 'PERSON', 'text': '<PERSON>', 'operator': 'replace'}, {'start': 80, 'end': 90, 'entity_type': 'LOCATION', 'text': '<LOCATION>', 'operator': 'replace'}, {'start': 63, 'end': 71, 'entity_type': 'PERSON', 'text': '<PERSON>', 'operator': 'replace'}]"
507,People can call themselves whatever they wish. I think when it comes to outsiders using the term it's different. The n word can't even be compared bc that's a whole sociological thing. ,,,,Frugalista1,,,1472171401,t5_2qhe8,t3_4xv4w0,t1_d6wrgzj,1,1473603866,0,0,d6wuzud,disability,1,,,,
508,"that's cool, you have nothing to lose by starting one so I encourage you to do it! It might be difficult to get it up and running, but something is better than nothing. Create a couple initial threads about your experiences or proposing questions. Get clear about resources, the purpose of the forum in your sidebar. You can post about it once in the chronic pain sub Reddit and also maybe on some other websites. But if it's really rare it's going to be a slow increase of people",,,,staticthought,,,1471905990,t5_2qhe8,t3_4yzhdn,t3_4yzhdn,1,1473547204,0,0,d6shsx8,disability,1,,,"that's cool, you have nothing to lose by starting one so I encourage you to do it! It might be difficult to get it up and running, but something is better than nothing. Create a couple initial threads about your experiences or proposing questions. Get clear about resources, the purpose of the forum in your sidebar. You can post about it once in the chronic pain sub <PERSON> and also maybe on some other websites. But if it's really rare it's going to be a slow increase of people","[{'start': 368, 'end': 376, 'entity_type': 'PERSON', 'text': '<PERSON>', 'operator': 'replace'}]"
509,Is she on ssdi or ssi? Ssdi or disability she should not lose benefits but SSI she would.,,,,Kyddeath,Nerve Damage/Crip,,1472046145,t5_2qhe8,t3_4zcjau,t3_4zcjau,1,1473575580,0,0,d6ummfa,disability,1,,,,
510,Definitely look into this!! https://www.autismspeaks.org/news/news-item/10-things-know-about-able-act,,,,AverageHeteroSapien,,,1471685009,t5_2qhe8,t3_4ykear,t3_4ykear,1,1473504766,0,0,d6p7p5n,disability,1,,,Definitely look into this!! <URL>,"[{'start': 28, 'end': 33, 'entity_type': 'URL', 'text': '<URL>', 'operator': 'replace'}]"
511,"I like youtube.

Really helped me through times when I couldn't get out much.",,,,unUSEFUL_idiot,,,1471129350,t5_2qhe8,t3_4xl327,t3_4xl327,2,1473389869,0,0,d6gewp5,disability,2,,,,
512,"I've luckily always had the option of help, but I like being independent so I don't usually ask.  I get by ok on my own with similar restrictions as you have by:  
- Using a picker-upper.  Between that and my monkey toes, I almost never have to bend down.  
- sending out for laundry, grocery shopping, ect.  Have a cleaning crew come in every once in a while. A bit more money, but worth it to me.  
- making sure things I need frequently are housed at around chest height.  That way no bending or reaching.    
- taking more trips so that each load is lighter.  Also for something like a bag of potatoes (as a reason example of a heavy thing), I would split up the bag into many smaller bags so it would be easier for me to move things around.
- basically I just adapt anything that didn't work for me.  I'm an OT, so I'm trained in it now, but I was adapting things long before I went to school.    
  
The thing that is hardest for me is cleaning up when I let things get to messy (aka my room lol).  I usually call in reinforcements when it comes to major cleaning time. ",,,,allonzy,,,1470505704,t5_2qhe8,t3_4wgo2h,t3_4wgo2h,2,1473256748,0,0,d66vbg5,disability,2,,,,
513,"So when you say check up for SS, do you mean as a disability review? If so, do you have any reason to think your mom wouldn't continue to meet the definition of medically disabled? ",,,,FaceofMoe,,,1470266576,t5_2qhe8,t3_4vzr0l,t3_4vzr0l,2,1473207109,0,0,d636s8y,disability,2,,,,
514,"Wheelchair or not, I wouldn't buy a fitbit right now. I think they're still being sued and the independent research I've seen says they over and under estimate the values they record by a lot. I did a lot of research on it a while back and I think any of the ones made by Garmin had the most consistently positive reviews. ",,,,zebra-stampede,,,1471362190,t5_2qhe8,t3_4xzm19,t3_4xzm19,3,1473434796,0,0,d6jt2xi,disability,3,,,,
515,Hello again!  You've gotten some good advice.  Have fun on your date!,,,,LittleBlueEyes,"On SSDI/SSI. Schizophrenia, PTSD, major depression, anxiety NOS.",,1471395086,t5_2qhe8,t3_4y0yba,t3_4y0yba,1,1473444045,0,0,d6ki66z,disability,1,,,,
516,"To me, this shouldn't be up for debate at all. Legal in half the states or something now. So, those of us in the south suffer until..??? ",,,,summerofsin,In pain and fed up.,,1472296912,t5_2qhe8,t3_4z9v5u,t3_4z9v5u,1,1473629113,0,0,d6yoszu,disability,1,,,,
517,"Thanks. Crazy informative! (I may print, but I swear I won't sell copies without cutting you in)

I don't know if it's because my wife is sometimes somber and I have a pension for bad moods, but I've been dreading the self-awareness/consciousness of adolescence. He's a super happy, funny kid right now. His teacher was just telling us that he had the whole room laughing today with some joke he told, and this is a kid with significant dysarthria (sp?) and who is non-ambulatory-- it's been a huge relief to us that he's doing well and is well-liked in school...so, yeah, dreading when/if that changes.  ",,,,_jbd_,,,1472276089,t5_2qhe8,t3_4zqoel,t1_d6y87lw,1,1473626817,0,0,d6yisx7,disability,1,,,"Thanks. Crazy informative! (I may print, but I swear I won't sell copies without cutting you in)

I don't know if it's because my wife is sometimes somber and I have a pension for bad moods, but I've been dreading the self-awareness/consciousness of adolescence. He's a super happy, funny kid right now. His teacher was just telling us that he had the whole room laughing today with some joke he told, and this is a kid with significant dysarthria (sp?) and who is non-ambulatory-- it's been a huge relief to us that he's doing well and is well-liked in <URL>, yeah, dreading when/if that changes.  ","[{'start': 554, 'end': 559, 'entity_type': 'URL', 'text': '<URL>', 'operator': 'replace'}]"
518,"It's cheaper through AT&amp;T Access.
I have a very fast connection and I pay $10, $10.33 with fees. My modem is included. It is only available for people on food stamps, in certain states. 
It says 10 mbps but I get 15.
https://www.att.com/shop/internet/access/index.html?source=ECmj0000000000mbU&amp;wtExtndSource=access#/",,,,a_little_motel,,,1470233049,t5_2qhe8,t3_4vwqvm,t3_4vwqvm,1,1473173711,0,0,d62gpoy,disability,1,,,"It's cheaper through AT&amp;T Access.
I have a very fast connection and I pay $10, $10.33 with fees. My modem is included. It is only available for people on food stamps, in certain states. 
It says 10 mbps but I get 15.
<URL>","[{'start': 221, 'end': 226, 'entity_type': 'URL', 'text': '<URL>', 'operator': 'replace'}]"
519,"I'm sorry for your situation, it absolutely sucks. I'm on SSDI, I have a lung disease that keeps me from doing most things I enjoyed/took for granted in the past. My husband is my caretaker, in addition to working 7 nights a week. 

I too was the main breadwinner. I was also a paralegal for many years. My plans for law school were scuttled when my oldest had a TBI. So I can empathize somewhat. 

A little bit about SSDI/SSI. They are completely different from a financial perspective. Exactly the same as far as disability requirements to obtain them. If you can collect SSDI, that's a better benefit in many ways. You can have unlimited assets, if you were to marry you wouldn't lose your benefits and his income wouldn't count against you. The downside is you have to wait 5 months for your first payment, 24 months for Medicare to start. 

If you hire a lawyer he will receive 25% of your backpay up to $6,000. 

Edited to add: between the gabapentin and the prednisone be sure your sugars get checked. Both can raise them and you'd get symptoms which could be confusing with everything you've got going on.",,,,Frugalista1,,,1472504556,t5_2qhe8,t3_505vt9,t3_505vt9,4,1473668475,0,0,d71q48w,disability,4,,,"I'm sorry for your situation, it absolutely sucks. I'm on SSDI, I have a lung disease that keeps me from doing most things I enjoyed/took for granted in the past. My husband is my caretaker, in addition to working 7 nights a week. 

I too was the main breadwinner. I was also a paralegal for many years. My plans for law school were scuttled when my oldest had a <LOCATION>. So I can empathize somewhat. 

A little bit about SSDI/SSI. They are completely different from a financial perspective. Exactly the same as far as disability requirements to obtain them. If you can collect SSDI, that's a better benefit in many ways. You can have unlimited assets, if you were to marry you wouldn't lose your benefits and his income wouldn't count against you. The downside is you have to wait 5 months for your first payment, 24 months for Medicare to start. 

If you hire a lawyer he will receive 25% of your backpay up to $6,000. 

Edited to add: between the gabapentin and the prednisone be sure your sugars get checked. Both can raise them and you'd get symptoms which could be confusing with everything you've got going on.","[{'start': 363, 'end': 373, 'entity_type': 'LOCATION', 'text': '<LOCATION>', 'operator': 'replace'}]"
520,"The funds have been redirected, transportation has been scrapped, and no one has raised a fuss about it. ",,,,[deleted],,,1471928390,t5_2qhe8,t3_4z4rne,t3_4z4rne,3,1473552074,0,0,d6svmxa,disability,3,,,,
521,"yes those things won't count towards your asset limit. While everything you own has value they still aren't going to be considered assets. Assets are things like extra cars (since you only need 1), life insurance plans (that have a cash value), gold coins, etc. 

If you receive the back pay and use it to update your wardrobe, buy some new appliances, pay rent ahead, etc. that would be an appropriate (and smart) use of your back pay. 

Please remember that I am just a stranger on the internet, if you receive the back pay and you have ANY question as to whether what you are doing is ok you need to check with SSA directly. Sometimes a specific answer cannot be given without seeing the specifics of your file. 
",,,,RambleRamble,SSI/SSDI Examiner,,1472399342,t5_2qhe8,t3_4z37fl,t1_d6yv0a1,1,1473647288,0,0,d701gbs,disability,1,,,,
522,"People tend to just bend over and give me a hug. You'd normally ask someone you don't know if they're up for a hug rather than charging right in yeah? I go with 'Hey I'm Raargh, you up for a hug?' as some people just don't like hugs anyway. You could always work it into a chat before the date, mention you love hugs and see what he says.

As long as you're not acting like a condescending prick, don't worry about the little things. Yes, the little things are nice to do, but no-one worth going out with is going to flip if you accidentally use a term they don't like or act in a way they find insulting. They'll let you know, or you can ask. 

If they do flip at the first sign of error, take it as a normal crazy person sign. Having a disability isn't an excuse to be a dick. Good luck on your date!",,,,Raargh,Wheelie,,1471379343,t5_2qhe8,t3_4y0yba,t3_4y0yba,8,1473439919,0,0,d6k6zqc,disability,8,,,,
523,"Jesus fucking Christ, dude.  Don't give up yet.  I'll gild this thread every month if I have to until you come back with a success story.  The way you're being treated right now is no way to reward someone who is obviously intelligent and caring, especially in regards to your comment about helping other disabled people in your situation.  If I had the capability to give you a job, I would, since you obviously want to work and not ask for handouts, but I am just an average man trying his best.  At least I care about you and whether you live or not, even if it seems like no one else does.

If you come back, create a post in /r/legaladvice.  They're being really helpful to me right now and I have a feeling that after reading your story, they'll point you in the right direction.  Who knows, maybe you can even get a fat settlement so you won't ever have to worry about working for a living.",,,,weedpussy,,,1470028742,t5_2qhe8,t3_4juqll,t1_d3ie55w,1,1473130360,0,0,d5z8ykc,disability,1,,,,
524,"Obviously not for everyone, but I tie flies for fly fishing. A basic starter kit doesn't cost that much, and there are zillions of high quality tutorials on the utoob.",,,,riverscrossed,,,1472323715,t5_2qhe8,t3_4zllyg,t3_4zllyg,1,1473634404,0,0,d6z2l23,disability,1,,,,
525,"SSDI is a pathetic joke of a scam. If you are working, you most certainly will never be approved, regardless of how little.

My dad has been in a court battle for over 5 YEARS of trying to get SSDI at 50 years old. He has RSD(most painful disease next to chronic migraines), clinical depression, fused lower lumbar, and 40% remaining mobility with arthritis in both feet.

We have had to go all the way to sueing SSDI in federal court, winning the federal case to be remanded back to another admistrative law judge, who just recently ruled against us again even after that.

The system is a corrupt piece of shit that has zero thought or input on anything but making sure you die starving in the street. If my dad wasn't lucky enough to have paid his house off before becoming disabled and had two kids who can support him with good jobs, he would be either dead or a hobo on the street begging for food.

They don't give two shits about how disabled you are, nor do they care if you get hit by a truck. They care about saying NO to as many applicants as possible.

It's a fucking disgrace.",,,,suchacrisis,,,1471304469,t5_2qhe8,t3_4xsbe0,t3_4xsbe0,3,1473424280,0,0,d6j03p4,disability,3,,,,
