,body,score_hidden,archived,name,author,author_flair_text,downs,created_utc,subreddit_id,link_id,parent_id,score,retrieved_on,controversiality,gilded,id,subreddit,ups,distinguished,author_flair_css_class,anonymized_body,anonymized_masks
184,"It sounds like you definitely need some help but maybe aren't understanding or are frustrated by some of processes you have to go through to get the help. I'll just go ahead and say, to start, I completely understand, it can be very frustrating for all parties.

The first bit of advice i would suggest is taking a big metaphorical deep breath. The agencies you mentioned, and all agencies/facilities in general, can't (and shouldn't) just take your word as truth. You are going to have to provide some kind of verification for your claims, whether it's your dd-214 or the doctors ""note"" saying you have a disability. The VA can't just take in any joe schmo off the street that says ""but I swear, I was there"" and the state can't just hand out disability/ssi to anyone who says ""I'm disabled"". With all of that said, i sympathize with you for having to ""prove"" to people what you already know. It can feel like the whole system is out to get you sometimes but the only alternative would be universal health care and that's a whole other ball of wax.

**If I were you, and i think the easiest route, would be to track down a dd-214. Start with the recruiter office where you signed up or even where you went to MEPS. They keep the paper records you signed during in-processing. They wouldn't have a 214 on you but they would have your enlistment papers. If you've found someone to request your 214, that means you talked to someone who found you right? Just have them fax it to you right then and there. There's no notary involved or anything, it's just a piece of paper.**",,,,wheeliebarnun,,,1480366223,t5_2qhe8,t3_5fc9x8,t3_5fc9x8,2,1481831288,0,0,daji43k,disability,,,,"It sounds like you definitely need some help but maybe aren't understanding or are frustrated by some of processes you have to go through to get the help. I'll just go ahead and say, to start, I completely understand, it can be very frustrating for all parties.

The first bit of advice i would suggest is taking a big metaphorical deep breath. The agencies you mentioned, and all agencies/facilities in general, can't (and shouldn't) just take your word as truth. You are going to have to provide some kind of verification for your claims, whether it's your dd-214 or the doctors ""note"" saying you have a disability. The <LOCATION> can't just take in any joe schmo off the street that says ""but I swear, I was there"" and the state can't just hand out disability/ssi to anyone who says ""I'm disabled"". With all of that said, i sympathize with you for having to ""prove"" to people what you already know. It can feel like the whole system is out to get you sometimes but the only alternative would be universal health care and that's a whole other ball of wax.

**If I were you, and i think the easiest route, would be to track down a dd-214. Start with the recruiter office where you signed up or even where you went to MEPS. They keep the paper records you signed during in-processing. They wouldn't have a 214 on you but they would have your enlistment papers. If you've found someone to request your 214, that means you talked to someone who found you right? Just have them fax it to you right then and there. There's no notary involved or anything, it's just a piece of paper.**","[{'start': 622, 'end': 632, 'entity_type': 'LOCATION', 'text': '<LOCATION>', 'operator': 'replace'}]"
185,"Wow, I'll never smuggle coke in my false leg again! :')",,,,wanderlou,,,1478011335,t5_2qhe8,t3_5ajeqy,t3_5ajeqy,1,1481113894,0,0,d9gubwj,disability,,,,,
186,"Yes, I am certainly worrying heavily (forefront of my mind, most of the time). I turned in the paperwork which was mailed to me well before the deadline, and filled it out to a sloppy yet redundant degree: I wrote the names, and contact info. for all my healthcare providers on a separate sheet of paper. 

In the ""remarks"" section I went on a rant of sorts (no bad words) but I drove the point home that if I was magically going to heal with time, it would've happened already. My hearing was 3 years after my visit to the Psych Ward where I started the application process. But that wasn't sufficient to leave it at that. I wrote about 10 pages of notes and I could see it as being interpreted as ""trying to hard to prove I am nuts"". I wrote  one -draft biographical information....I apologize for the original rant on the ""remarks"" page as I was overcome with stressed emotion, I talked about my life spending 23 hours indoors a day, afraid of my own neighbors, and much more. I stated ""ignore anythingbirrelevsnt, I don't mean to waste time""...I did expand upon the yes/no questions. In short, I'm painting a picture of what my life is composed of and that I've decompensated as I started to get an extremely painful degenerate disc disease. All the medical records pertaining to that is included. 

A neighbor of a certain comedian I love (the really morbid one) said with regard to not completing his CDR paperwork that it was evidence that he is too disabled to complete the CDR...It's ironically sound logic...and my big journal entry I submitted maybe makes me look very competent. I can write, ergo, I could be a journalist or author or earn ad money as a Blogger. Maybe...or maybe writing is really my best skill for someone who is a total mess, and I am not oblivious of my diagnosis (you've seen severe schizophrenics who won't acknowledge something is wrong with them-like my mother) and I discuss that life for me is a waking nightmare and I get comfort in the certainty that one day I'll be dead and no longer suffering. A cynic could say that just because I loathe myself and my life, thisdoes not mean I'm the least bit incapable of work. You don't seem like a cynic. But I really wonder if I dug myself a hole for making an Op-Ed about this expidited Disability Review that a Judge unrealistically and with a psychic level of certainty, there was an expectation that I'd improve, and rapi6dly, given my history. I go into my history. A point of contention that almost cost me tbe Hearing was that I was mentally illas a direct result of substance abuse. In truth, drugs like narcotic painkillers gave me a brief peace of mind. I didn't mention it but I did take psychedelic/hallucinogenic drugs which certainly brought out the latent hardcore break with reality that I never came back from completely. The Judge asked ""So was it tbe chicken or the egg?"" (Giving me a chance to say something to hurt my case. I simply brougt up my mother's condition. I spent 10 years living with the illness before I inherited it. Reality bending Drugs didn't help, but I wouldn't be well had I never picked up a joint. Drugs just shined a light on something in the dark. Keep that in mind if younget someone who never came back from a DMT Trip. They were predisposed to H.P.P.D. due to the fact that they're already mentally ill. It isn't just glaringly obvious yet. The treatment is antipsychotics and benzos. The cure is suicide. I keep a unused needle, still in the package, well-hidden. I have a connection for that poison. I got a free sample. I flushed it. I'm not interested in nodding off for 5 minutes. I want the flatline as an option at all times. Yes, I am aware that posession charges will end my Benefits. End my benefits and I'm gonna get a bundle. 

See how I write a lot? I must be able to hold down a job. Employee of the month!
",,,,channel35,,,1479434169,t5_2qhe8,t3_5cam3s,t1_da4xdos,1,1481562868,0,0,da539pd,disability,,,,"Yes, I am certainly worrying heavily (forefront of my mind, most of the time). I turned in the paperwork which was mailed to me well before the deadline, and filled it out to a sloppy yet redundant degree: I wrote the names, and contact info. for all my healthcare providers on a separate sheet of paper. 

In the ""remarks"" section I went on a rant of sorts (no bad words) but I drove the point home that if I was magically going to heal with time, it would've happened already. My hearing was 3 years after my visit to the Psych Ward where I started the application process. But that wasn't sufficient to leave it at that. I wrote about 10 pages of notes and I could see it as being interpreted as ""trying to hard to prove I am nuts"". I wrote  one -draft biographical information....I apologize for the original rant on the ""remarks"" page as I was overcome with stressed emotion, I talked about my life spending 23 hours indoors a day, afraid of my own neighbors, and much more. I stated ""ignore anythingbirrelevsnt, I don't mean to waste time""...I did expand upon the yes/no questions. In short, I'm painting a picture of what my life is composed of and that I've decompensated as I started to get an extremely painful degenerate disc disease. All the medical records pertaining to that is included. 

A neighbor of a certain comedian I love (the really morbid one) said with regard to not completing his CDR paperwork that it was evidence that he is too disabled to complete the <URL>'s ironically sound <URL>d my big journal entry I submitted maybe makes me look very competent. I can write, ergo, I could be a journalist or author or earn ad money as a Blogger. Maybe...or maybe writing is really my best skill for someone who is a total mess, and I am not oblivious of my diagnosis (you've seen severe schizophrenics who won't acknowledge something is wrong with them-like my mother) and I discuss that life for me is a waking nightmare and I get comfort in the certainty that one day I'll be dead and no longer suffering. A cynic could say that just because I loathe myself and my life, thisdoes not mean I'm the least bit incapable of work. You don't seem like a cynic. But I really wonder if I dug myself a hole for making an <PERSON> about this expidited Disability Review that a Judge unrealistically and with a psychic level of certainty, there was an expectation that I'd improve, and rapi6dly, given my history. I go into my history. A point of contention that almost cost me tbe Hearing was that I was mentally illas a direct result of substance abuse. In truth, drugs like narcotic painkillers gave me a brief peace of mind. I didn't mention it but I did take psychedelic/hallucinogenic drugs which certainly brought out the latent hardcore break with reality that I never came back from completely. The Judge asked ""So was it tbe chicken or the egg?"" (Giving me a chance to say something to hurt my case. I simply brougt up my mother's condition. I spent 10 years living with the illness before I inherited it. Reality bending Drugs didn't help, but I wouldn't be well had I never picked up a joint. Drugs just shined a light on something in the dark. Keep that in mind if younget someone who never came back from a DMT Trip. They were predisposed to H.P.P.D. due to the fact that they're already mentally ill. It isn't just glaringly obvious yet. The treatment is antipsychotics and benzos. The cure is suicide. I keep a unused needle, still in the package, well-hidden. I have a connection for that poison. I got a free sample. I flushed it. I'm not interested in nodding off for 5 minutes. I want the flatline as an option at all times. Yes, I am aware that posession charges will end my Benefits. End my benefits and I'm gonna get a bundle. 

See how I write a lot? I must be able to hold down a job. Employee of the month!
","[{'start': 2235, 'end': 2243, 'entity_type': 'PERSON', 'text': '<PERSON>', 'operator': 'replace'}, {'start': 1507, 'end': 1512, 'entity_type': 'URL', 'text': '<URL>', 'operator': 'replace'}, {'start': 1482, 'end': 1487, 'entity_type': 'URL', 'text': '<URL>', 'operator': 'replace'}]"
187,"Great article!  Thank you for sharing this!!

Hmmmm, Comcast is supposed to be evil....but, they have functioning assistive technology.

Am I up for selling my soul &amp; applying to work for an EvilConglomo?  They have functional assistive tech, so they can't be totally evil.  

I shall miss my soul....",,,,UserNme_AlreadyTaken,,,1478066705,t5_2qhe8,t3_5akymx,t3_5akymx,1,1481143004,0,0,d9i186o,disability,,,,,
188,"UK disabled person here (following US news extremely closely, feeling very worried/upset for what this means for minorities in general). 

Just wanted to offer sympathy and solidarity. Hang on over there.",,,,TinyLittleStormCloud,,,1479122415,t5_2qhe8,t3_5cv0n7,t3_5cv0n7,5,1481467477,0,0,d9zocmp,disability,,,,"<LOCATION> disabled person here (following <LOCATION> news extremely closely, feeling very worried/upset for what this means for minorities in general). 

Just wanted to offer sympathy and solidarity. Hang on over there.","[{'start': 43, 'end': 53, 'entity_type': 'LOCATION', 'text': '<LOCATION>', 'operator': 'replace'}, {'start': 0, 'end': 10, 'entity_type': 'LOCATION', 'text': '<LOCATION>', 'operator': 'replace'}]"
189,"With proper rationale, disability examiners (not just judges) can also set diaries they deem appropriate, based on the circumstances of the case. Or they can just set the standard 3 year diary, because then they don't have to rationalize anything. Like anything else in life, depends on the person.",,,,tsarcasm,Disability Examiner,,1479337270,t5_2qhe8,t3_5cam3s,t1_d9zankh,1,1481533671,0,0,da3fe1u,disability,,,,,
190,"Of note, smart phones have many built-in accessibility options. They can be set to react to waving your hand over them, voice commands, etc. so that you can mount them on something and not have to hold them, and there is an option for one-handed use.

Some of the same hands-free stuff used for mounting a smartphone to a dash in a car would probably work well for a wheelchair, depending upon the setup.",,,,BeastOGevaudan,,,1478181800,t5_2qhe8,t3_5aky0p,t3_5aky0p,1,1481177797,0,0,d9jy5s4,disability,,,,,
191,"&gt; (we will almost certainly have a week or two of unpaid furlough)

Do you really think this will happen? I figured that we'd have the bare bones funding and a hiring freeze, but I would at least hope that we'd avoid a shutdown or unpaid furlough. 

",,,,RambleRamble,SSI/SSDI Examiner,,1479238884,t5_2qhe8,t3_5d0lup,t1_da1bqxu,1,1481502577,0,0,da1oery,disability,,,,,
192,"i just went through my re-eval and it went smooth ...it isn't any different than when you first went through it except that now you have tons of medical records and doctors to provide proof of issues and treatments you have been going through....THAT helps SO much ...most of the time i would imagine the medical records provide more than enough info but as they tell ya in the papers they sent ya ..IF THEY NEED TO they will ask ya to go to see one of their own doctors in the area ...which isn't a biggie ...i know how ya feel right now 1 stop worrying, it's unneeded stress 2 it will move fast and be done before ya know it. so don't worry so much about it just live life and be happy ",,,,Superh3rozero,,,1480268728,t5_2qhe8,t3_5f3xdt,t3_5f3xdt,3,1481790848,0,0,dahryt4,disability,,,,"i just went through my re-eval and it went smooth <URL> isn't any different than when you first went through it except that now you have tons of medical records and doctors to provide proof of issues and treatments you have been going <URL>AT helps SO much <URL>st of the time i would imagine the medical records provide more than enough info but as they tell ya in the papers they sent ya ..IF THEY NEED TO they will ask ya to go to see one of their own doctors in the area ...which isn't a biggie ...i know how ya feel right now 1 stop worrying, it's unneeded stress 2 it will move fast and be done before ya know it. so don't worry so much about it just live life and be happy ","[{'start': 257, 'end': 262, 'entity_type': 'URL', 'text': '<URL>', 'operator': 'replace'}, {'start': 235, 'end': 240, 'entity_type': 'URL', 'text': '<URL>', 'operator': 'replace'}, {'start': 50, 'end': 55, 'entity_type': 'URL', 'text': '<URL>', 'operator': 'replace'}]"
193,"Really, I live in RI, I saw nothing about this on my state website. Is it federal?",,,,slam7211,,,1478811765,t5_2qhe8,t3_5c19t7,t1_d9uk71v,1,1481377604,0,0,d9uvo2f,disability,,,,"Really, I live in <LOCATION>, I saw nothing about this on my state website. Is it federal?","[{'start': 18, 'end': 28, 'entity_type': 'LOCATION', 'text': '<LOCATION>', 'operator': 'replace'}]"
194,"I think you meant to post a link, not a self post. ",,,,woofiegrrl,D/HH,,1478192775,t5_2qhe8,t3_5axr08,t3_5axr08,1,1481182282,0,0,d9k796g,disability,,,,,
195,"I think it depends on the disability office. I send out questionnaires on every CDR. If, when you provided your sources for the past year, you reported hospitalizations, maybe they decided not to send out the Qs, and were able to continue you without them. Consider yourself lucky!",,,,spicyshazam,"Disability Examiner, Hearing Officer (DHO)",,1478835344,t5_2qhe8,t3_5cbsg1,t3_5cbsg1,5,1481386738,0,0,d9vdbtu,disability,,,,,
196,"The SSDI program itself is safe. Social Security is insanely popular so I think it will be exempt from MAJOR changes. People tend to be afraid of changing programs that they know they may need. Will there be reductions in benefits or more stringent eligibility rules? Maybe. 

There is always the bias too when you look at attitudes/perceptions between SSDI and SSI. Those on SSDI have paid into the system and so ""earned"" the benefits. Things that are earned tend to be safer than those that are given (SSI)",,,,RambleRamble,SSI/SSDI Examiner,,1478763886,t5_2qhe8,t3_5c19t7,t1_d9u0phi,6,1481362710,0,0,d9u2jma,disability,,,,,
197,"&gt;  But Social Anxiety alone, by itself, is a bad way to try to get Disability.

Ugh that is frustrating.  It should be based on severity.  This is absolutely causing me to be unemployed.",,,,anxietythrowawayhelp,,,1479266798,t5_2qhe8,t3_5czaml,t1_da1aa6e,2,1481513307,0,0,da29wnr,disability,,,,,
198,More like you are disabled and it's hard for you to understand. ,,,,rammingparu3,,,1479599972,t5_2qhe8,t3_545sy5,t1_d86ezzt,1,1481606435,0,0,da7k1vr,disability,,,,,
199,"This app sounds great. I find it challenging when you go to a restaurant that in paper is accessible but you get there and quickly realize the bare minimum has been done for accessibility. I like the idea of a ""rating system"" because it gives more specificity. For example, there have been restaurants that advertise as accessible, yes they'll have a ramp etc but then I can't even maneuver my wheelchair in the place. Can really ruin an evening and make me uncomfortable. 

Good luck to your friend and their app! ",,,,tedcruziszodiac,,,1479966209,t5_2qhe8,t3_5eldnq,t3_5eldnq,4,1481714393,0,0,dadhxzv,disability,,,,,
200,"Yes, I did.  I cried for two days.  

Internet hugs!!",,,,UserNme_AlreadyTaken,,,1478067956,t5_2qhe8,t3_59xp8f,t3_59xp8f,1,1481143240,0,0,d9i1pdk,disability,,,,,
201,"Thanks for the reply. On their [website](http://smalaw.net/our-approach/) they say no fees unless you win, however I recall there being mention in the paperwork of fees only for medical records and other small things on a loss. But when I last called they said ballparking it on the low end would be around 150 usd and not providing me with the high end. I will ask tomorrow.",,,,Moxil,,,1479182532,t5_2qhe8,t3_5d01o6,t1_da0t8z0,2,1481487599,0,0,da0u2dy,disability,,,,"Thanks for the reply. On their [website](<URL>) they say no fees unless you win, however I recall there being mention in the paperwork of fees only for medical records and other small things on a loss. But when I last called they said ballparking it on the low end would be around 150 usd and not providing me with the high end. I will ask tomorrow.","[{'start': 41, 'end': 46, 'entity_type': 'URL', 'text': '<URL>', 'operator': 'replace'}]"
202,"thanks! wasn't sure if approved credit counted as an asset or whatever
",,,,soliddrake83,,,1480151308,t5_2qhe8,t3_5eyfwo,t1_dag3qai,2,1481761483,0,0,dag4ko1,disability,,,,,
203,"Can yous apply for food stamps in the mean time? &amp;Yes I got approved a little less than a year ago,  thank god. I cried when I read the words ""Fully Favorable"".. &amp;Haha! :D Let me know if you have anymore questions. I try to respond to everyone asking about SSI since every single night waiting for mine I was online reading forums and asking questions. Gotta give back now~",,,,maipoxx,,,1478504853,t5_2qhe8,t3_5b2txz,t1_d9panie,1,1481275205,0,0,d9pb65m,disability,,,,,
204,"Extended hospitalization it's not the only thing that qualifies as decomp, but it's basically guaranteed to qualify as decomp.  What other things qualify as decomp are up to the discretion of the ALJ.

Regarding qualification, the initial and reconsideration decisions are made by doctors.  It's only at the hearing level that you get a decision made by a judge.  At that stage we're technically making a legal determination, not a medical determination, which is why you need a law degree rather than a medical degree.

I'm sorry that the process has you so discouraged.  We're doing our best to be fair, and nothing makes me happier than approving someone who clearly needs the help.  ",,,,DrMuffinPHD,SSA ODAR Attorney,,1479170840,t5_2qhe8,t3_5b2txz,t1_da0j134,1,1481483616,0,0,da0ltoc,disability,,,,,
205,I've seen in records where some care providers won't write a letter recommending disability or support the decision because they believe working would be better for the individual than being on disability and not working.,,,,spicyshazam,"Disability Examiner, Hearing Officer (DHO)",,1478408672,t5_2qhe8,t3_5b2txz,t1_d9mpvjn,1,1481248740,0,0,d9ntu82,disability,,,,,
206,"Try to make the best out of it! I know how hard it is. i think all the time how much Id be making if I could work. I found out the job I had(but couldnt keep) raised their minimum to $12 an hour. Makes me cry. 

The income based housing &amp; food stamps are the only solution for me to live outside my parents house, but I still couldnt afford a car or anything besides absolute basics. ",,,,maipoxx,,,1479231454,t5_2qhe8,t3_5d0lup,t1_da0zssp,2,1481499564,0,0,da1i7ab,disability,,,,,
207,I think you are confusing book knowledge with real world knowledge.  Good effort though,,,,Jerome_Hightower,,,1478471418,t5_2qhe8,t3_595l57,t1_d9eitpt,1,1481265055,0,0,d9oqjya,disability,,,,,
208,"I want to clarify that life will never feel like it used to.  You will never be the person you were before because your life has changed.  it took me a few years to understand that.  I kept waiting to get better and kept waiting to change back.  Finally, I realized that I would be permanently changed.  But once I accepted that, I accepted my new ""normal.""  That's what you have to do.  Find a new normal, accept you are changed, and be sad for what could have been sometimes.  Be mad about it sometimes, but then move on.  Make things yours.  My sister began wrapping my canes in duct tape to make them more individual for me.  She just gave me a cane as a present and I was excited because it was pretty cool.  For the first time int he past three years when I cooked Thanksgiving dinner, I didn't collapse immediately after and that was super exciting.  Find joy in the little improvements.",,,,kitzunenotsuki,,,1480432176,t5_2qhe8,t3_5bykee,t3_5bykee,2,1481850149,0,0,dakk7hd,disability,,,,,
209,"I'm one of the higher functioning clients in my group home.  I constantly struggle with not feeling 'disabled enough' to be here, that other people deserve it more.  I frequently seek reassurance that it is okay from staff.  The feelings have never gone away.

The answer is always the same, you deserve it.",,,,Maddisonic,,,1477981127,t5_2qhe8,t3_5acvi2,t3_5acvi2,5,1481105874,0,0,d9giitq,disability,,,,,
210,"In reviewing evidence, I never consider the date it was submitted as either a positive or negative credibility factor.

Submit it if you think it'll help you ",,,,DrMuffinPHD,SSA ODAR Attorney,,1479068370,t5_2qhe8,t3_5cr6ko,t3_5cr6ko,3,1481452240,0,0,d9ytuqs,disability,,,,,
211,"Exactly. Like I said my job pays good money if I had the mental ability to keep that job then I would much rather do that than get a small stipend from SSI every month and be basically living off of the government. I would much rather work and make something of my life but I need them to see that that's not possible right now and it may never be depending on if these issues ever get better or not. And it feels extremely prejudiced whenever someone says you're not old enough to be disabled. That should be something that's honestly illegal, is for someone to say you're not old enough for this. Because that's the very definition of being prejudiced.",,,,darknaio,Major Depression/Anxiety,,1478341489,t5_2qhe8,t3_5b2txz,t1_d9mpvjn,1,1481228155,0,0,d9mpyj9,disability,,,,,
212,"If you like games Steam in home streaming has worked almost flawlessly for me, an games don't kill the laptop battery that way (been playing Diablo 2/3 for example, no problem.",,,,rndwombat,Major stroke,,1479509205,t5_2qhe8,t3_5dneev,t1_da6a88p,2,1481584106,0,0,da6agy3,disability,,,,,
213,"Agreed, I mean - I'd rather not pretend or gloss over the fact that I am disabled. I mean, you can pretend all you want - but I still got crutches, and I'm still going to spasm. 

But yeah, the language is often framed as joking. It makes me wonder about reclamation, and how things like queer and faggot originally started off as jokes in those communities as well.",,,,cripple2493,autistic crutch dancer,,1478335657,t5_2qhe8,t3_5b7yu8,t1_d9mlfl8,2,1481227414,0,0,d9moire,disability,,,,,
