,body,score_hidden,archived,name,author,author_flair_text,downs,created_utc,subreddit_id,link_id,parent_id,score,retrieved_on,controversiality,gilded,id,subreddit,ups,distinguished,author_flair_css_class,anonymized_body,anonymized_masks
368,"Yeah.  We were already expecting a tough budget year ahead.  I would anticipate that wait times will rise, as we are unable to hire new employees or replace employees who leave.",,,,DrMuffinPHD,SSA ODAR Attorney,,1478797489,t5_2qhe8,t3_5c19t7,t1_d9to08z,6,1481371185,0,0,d9ujb9i,disability,,,,,
369,Is that a thing I can get on as an emplyed person? I make a lot of money.,,,,slam7211,,,1478743925,t5_2qhe8,t3_5c19t7,t1_d9t5r6c,1,1481356947,0,0,d9tr9bq,disability,,,,,
370,Take a look at SAS shoes. They make some that might work for you. ,,,,knightricer210,,,1478950340,t5_2qhe8,t3_5chkbf,t3_5chkbf,1,1481419532,0,0,d9x2lwc,disability,,,,,
371,"Not on any meds yet, my mother and I are both very artistic and she was on meds for a few years and they completely destroyed her joy in creating art so I told them a few months ago I'd like to avoid medication unless absolutely necessary. I am searching for other work but after my evaluation today the therapist wants me to do intensive outpatient care for 3 weeks, 3 times a week",,,,calistong,,,1478561346,t5_2qhe8,t3_5bozsv,t1_d9q7h3m,1,1481292546,0,0,d9qaed7,disability,,,,,
372,"I get ambushed a lot by security guards acting as if they simply think my dog is cute. They come up, perhaps after staring at me awhile, and ask innocent questions like how old she is, how much does she weigh? Commenting how cute she is. . . Then they suddenly get rude and inform me I must leave because dogs can't be there. Its weird and has basically trained me to nearly shout ""she's a service dog!"" When they walk towards me or even hide if they haven't noticed me yet. ",,,,Elephant_on_skis,,,1478787330,t5_2qhe8,t3_5bw366,t1_d9u4jwx,2,1481367232,0,0,d9ubfy7,disability,,,,,
373,Why hasn't he applied for Social Security Disability? Contact the United Way for help filing and help keeping the house.,,,,nobodytrickedme,,,1479774456,t5_2qhe8,t3_5e75sz,t3_5e75sz,7,1481654670,0,0,daaakth,disability,,,,Why hasn't he applied for Social Security Disability? Contact <LOCATION> for help filing and help keeping the house.,"[{'start': 62, 'end': 72, 'entity_type': 'LOCATION', 'text': '<LOCATION>', 'operator': 'replace'}]"
374,Paul Ryan (a one time beneficiary) would like to see SS privatized. Likely that wouldn't include SSI and hopefully they grandfather those of us already on SS benefits. ,,,,Frugalista1,,,1479151938,t5_2qhe8,t3_5cv0n7,t3_5cv0n7,3,1481476446,0,0,da06z35,disability,,,,<PERSON> (a one time beneficiary) would like to see SS privatized. Likely that wouldn't include SSI and hopefully they grandfather those of us already on SS benefits. ,"[{'start': 0, 'end': 8, 'entity_type': 'PERSON', 'text': '<PERSON>', 'operator': 'replace'}]"
375,"I saw a few, and I suppose you're right. ",,,,saltysmilodon,BPD/Anxiety/Autism,,1480302964,t5_2qhe8,t3_5f3xdt,t1_dahaopw,2,1481808318,0,0,daihtn7,disability,,,,,
376,"See your doctor and get documentation about what shoes you to wear. If you are in the US, according to title I of the ADA, they cannot force you to wear a part of a uniform that will negatively impact your disability.

Edit: my apologies, I just saw that you can't see a doctor. You may be able to do it without a doctor's note if you request it as a reasonable accommodation. Perhaps find plain, all black (or whatever color dress shoe they now require) sneakers. Bring in pictures of a couple shoe options and talk to your boss. ",,,,wtfgiraffe18,,,1478962789,t5_2qhe8,t3_5chkbf,t3_5chkbf,1,1481421857,0,0,d9x76ly,disability,,,,"See your doctor and get documentation about what shoes you to wear. If you are in the <LOCATION>, according to title I of the ADA, they cannot force you to wear a part of a uniform that will negatively impact your disability.

Edit: my apologies, I just saw that you can't see a doctor. You may be able to do it without a doctor's note if you request it as a reasonable accommodation. Perhaps find plain, all black (or whatever color dress shoe they now require) sneakers. Bring in pictures of a couple shoe options and talk to your boss. ","[{'start': 86, 'end': 96, 'entity_type': 'LOCATION', 'text': '<LOCATION>', 'operator': 'replace'}]"
377,"The ""you're so young, you can't be sick"" argument makes me just about turn inside out from anger. Age has nothing to do with health problems. There are 65 year olds that are healthier than some 20 year olds. Yeah, there's the whole ""discrimination against the disabled is illegal blah blah"" but that doesn't change a whole lot, unfortunately. They know you'll have to take legal action and sometimes it's more trouble than it's worth. I'm sorry you're dealing with all that. :/ ",,,,mdiamond328,,,1478006670,t5_2qhe8,t3_5acvi2,t1_d9gobqw,3,1481110959,0,0,d9gr4dt,disability,,,,,
378,"It's not that the government wants to keep you in poverty.  Well, not the SSA at least.  It's that we have very limited funds and resources.  Our budget is likely to be bare bones in the coming year (we will almost certainly have a week or two of unpaid furlough), and we've already put a hiring freeze in place, meaning we can't even replace employees who leave.  

The disability trust fund is in danger of completely running out in 2022 (it was also in danger of insolvency this past year, but was extended by the bipartisan budget act).

In order to solve the problem, we need stronger social safety nets.  However, this would require agreement by Congress and the president.  It would also require either shifting resource allocation in the budget or increasing taxes.  As you're no doubt aware, Trump was just elected president and we have a Republican Congress and House.  Increasing social safety nets like SSA disability is at the bottom of their priority list.  


",,,,DrMuffinPHD,SSA ODAR Attorney,,1479223410,t5_2qhe8,t3_5d0lup,t1_da0zssp,4,1481496396,0,0,da1bqxu,disability,,,,,
379,"It just means you may need a review of your medications. As long as you aren't on multiple schedule 1 or 2 drugs from different doctors, you will be fine.

With my mother's MS, a doctor finally flagged her and found all kinds of issues with drug combinations. Flagging you should result in better care and may help you in the long run. Seeking a new GP may make your hearing panel think you are shopping for a doctor who will say what you want. Stay put and get a medication review.

&gt; pol·y·phar·ma·cy
ˌpälēˈfärməsē/
noun
the simultaneous use of multiple drugs to treat a single ailment or condition.
the simultaneous use of multiple drugs by a single patient, for one or more conditions.",,,,dwrichards,ADA Coordinator,,1480191484,t5_2qhe8,t3_5f0qys,t3_5f0qys,5,1481771339,0,0,dago5ih,disability,,,,,
380,"Never would've thought of that, but it sounds like an answer. Thank you!",,,,outofpatience,,,1480077667,t5_2qhe8,t3_5eqomg,t1_daeit1j,1,1481741223,0,0,daeztsu,disability,,,,,
381,Thanks! It's because it's rare that I decided to do it. Let me know if you have any suggestions for games or anything.,,,,darkscanner2000,,,1480533904,t5_2qhe8,t3_5fl7cs,t1_dal7vhk,1,1481884515,0,0,damg1wo,disability,,,,,
382,"It's all just unfortunate. I'm in Wichita Kansas atm. I'll look around, but I'm unsure where to start. ",,,,ProtoSori,,,1480363109,t5_2qhe8,t3_5fc9x8,t1_dajf51r,1,1481829990,0,0,dajfgzx,disability,,,,"It's all just unfortunate. I'm in <LOCATION> <LOCATION> atm. I'll look around, but I'm unsure where to start. ","[{'start': 45, 'end': 55, 'entity_type': 'LOCATION', 'text': '<LOCATION>', 'operator': 'replace'}, {'start': 34, 'end': 44, 'entity_type': 'LOCATION', 'text': '<LOCATION>', 'operator': 'replace'}]"
383,No they don't say that every time. This level of fear in a population and among minorities is unprecedented. At least for people of the youngest generation.,,,,TinyLittleStormCloud,,,1478718749,t5_2qhe8,t3_5c19t7,t1_d9t4zqg,9,1481346778,0,0,d9t7uf0,disability,,,,,
384,"My function form was a hot mess. I was in the middle of a psychotic break and suicidal for months. The only thing that came out of it was that it was determined that I should not manage my own money.

I know I am only speaking from personal experience, but you want to be as honest as possible.",,,,kristyintheD,"SSDI, Bipolar 1, Schitzoaffective Disorder, Anxiety",,1478714805,t5_2qhe8,t3_5c10tp,t3_5c10tp,2,1481345080,0,0,d9t4l30,disability,,,,,
385,"I'm staying with my mom, but she's not happy about it. My family is making the situation a lot worse.

I appealed all the way to the Appeals Council and they denied me. My lawyer and I agreed that we didn't want to take it further. So I'd have to start all over again, with a new application, and I'm so exhausted and depressed I'm not sure I can manage it. 

I have to get going anyway. Thanks for your kindness and understanding.
",,,,a_realnobody,,,1479172806,t5_2qhe8,t3_5cv0n7,t1_da0m1mh,1,1481484284,0,0,da0n7a9,disability,,,,,
386,"Wow! Thank you so much for this reply. I will share this with my supervisor as well. I really appreciate you taking the time, and wish you all the best with your future advocacy efforts. 

Your response and others have certainly helped me frame my thinking. I wanted to be sure I wasn't misunderstanding the issue or entering into a battle of egos, but it seems clear that euphemisms are out of place when it comes to legal protections. 

I think a good way to move forward would be to find people with disabilities who are willing to speak to the class about how they have benefitted from disability protections and services. Thanks for the inspiration! ",,,,Pesomillionaire,,,1478051400,t5_2qhe8,t3_59eyp0,t1_d9ginuc,1,1481138215,0,0,d9hrrh4,disability,,,,,
387,"Try CBT. I have social anxiety. Maybe just go out there and talk to random people.  See this as a life and death situation.  

Mine was super bad.  ",,,,bmiggidy,,,1479191362,t5_2qhe8,t3_5czaml,t3_5czaml,2,1481489954,0,0,da0yvn5,disability,,,,,
388,"I have EDS and POTS, which in short means I dislocate very easily and am in a perpetual state of injury, and I faint all the time. I am able to walk, but only short distances as my heart rate shoots through the roof just standing up.  I have certainly pushed myself too far trying to do everything and being stubborn about using my assistive devices. 

For work, I am a PhD student ad technology researcher. Luckily since I work in medical and assistive tech, most people are pretty understanding. In addition to my EDS and POTS I also have severe allergies and asthma. So, I have an air filter in the office to clean the dust which I am severely allergic to.  Fortunately my office mates all like it since it cleans their air too, haha. I also am now using a wheelchair most days, so my work area was expanded somewhat to accommodate the wheelchair. I also have a reserved parking pace up front. While yes, there is disability parking and I do have a pass, there are minimal disability spots. Because of this, I have a reserved spot for the event that the disability spot is being taken by a visitor. 

As far as who would want to hire you over an able-bodied person, well, that really depends.  Being able to do more things =/= more qualified. In my job, I mainly do research. And while I suffer fatigue and brain fog at times, I am still able to do my job and perform better than many of my able-bodied colleagues. I have brains and grit and that is what gets me through and makes me good at my job. Who cares if I can't life the boxes of paper for the printer? There are a million other people in the building who can do that, it isn't necessary for me to, nor would it make be a better researcher. 
",,,,forgotmypasswoops,,,1478154218,t5_2qhe8,t3_5aaw75,t3_5aaw75,2,1481172356,0,0,d9jnaks,disability,,,,,
389,"We also appreciate any feedback on usability of the site, thanks!",,,,geobug,,,1478261982,t5_2qhe8,t3_5b19ny,t3_5b19ny,1,1481202981,0,0,d9ldacl,disability,,,,,
390,"She's on SSI. According to her bank statement, she did not receive any payments on 11/8. The $3,473 is after the $1,033 was ""recovered"" on 11/8, and we don't know why that amount is due. The Social Security office told us that she would not be receiving those $291 payments ever again.",,,,soju_warrior,,,1480321549,t5_2qhe8,t3_5e0w4i,t1_dab4pj0,1,1481815541,0,0,dairzta,disability,,,,,
391,"I hope the gerbil gets better soon,  maybe take it to the vet? ",,,,sh0nuff,,,1478622670,t5_2qhe8,t3_5bth44,t3_5bth44,1,1481309517,0,0,d9r8ifr,disability,,,,,
392,Was going to post the same thing but you beat me to it. Have an upvote instead! ,,,,Frustrated_Deaf,,,1478299320,t5_2qhe8,t3_5b5u3h,t1_d9m45ek,2,1481217759,0,0,d9m69dp,disability,,,,,
393,Thank god I don't have a disability that requires medical care. ,,,,ItsBabySheep,Totally deaf since birth.,,1478760009,t5_2qhe8,t3_5c19t7,t3_5c19t7,4,1481361916,0,0,d9u0ydq,disability,,,,,
394,"I'm 40 with a masters degree and I can put clothes on (but only to leave the house). Never mind that I frequently think of killing myself, have never managed to maintain steady employment, have fits of rage, and panic attacks. SSA doesn't care. ",,,,a_realnobody,,,1479167105,t5_2qhe8,t3_5b2txz,t1_d9nq4aw,1,1481482309,0,0,da0j4iv,disability,,,,,
395,I had this kind of scenario and was terrified. Everything turned out just fine. I even brought someone with me to the hearing and surprisingly I didn't feel that it was necessary for them to come in and talk since the hearing officer was so thorough. I think she sat with me for over or about an hour. Very nice lady. But any records are good. They probably often do see instances like this where doctors are very brief with their records and don't emphasize. Especially when one is without a therapist. That's why they have that hearing. To hear it from you. Try to relax you'll probably be ok. :) ,,,,Poltergeisha,,,1479120200,t5_2qhe8,t3_5cr6ko,t3_5cr6ko,2,1481467188,0,0,d9znqtg,disability,,,,,
396,"Hi, /r/service_dogs may be a great place to cross post! There's no one place in particular to apply for a service dog-- it depends on several factors (e.g. Location, price, owner trained or professionally trained). ",,,,RealistAlien,,,1479666988,t5_2qhe8,t3_5dz6si,t3_5dz6si,2,1481621562,0,0,da8f0wx,disability,,,,,
397,It could take awhile but you can make it go as fast as possible by completing paperwork and answering calls the best you can. Good luck!,,,,bonaynay,,,1478492875,t5_2qhe8,t3_5bguy0,t1_d9p5a20,1,1481272472,0,0,d9p5n91,disability,,,,,
398,"When claims are processed, two things happen - 

1. Payment is released, and
2. An award letter is created and mailed out. 

These two things happen independently of one another, and if you have direct deposit, it's not at all uncommon to get the payment before you get the letter spelling it all out.  ",,,,unwillingSSAexpert,,,1479181931,t5_2qhe8,t3_5chhgn,t3_5chhgn,1,1481487405,0,0,da0to0f,disability,,,,,
399,Aww thankyou for the kind words! I can see it being a long process here too x,,,,KellyCobate,,,1478559540,t5_2qhe8,t3_5bpasq,t1_d9q8rpi,2,1481291863,0,0,d9q918p,disability,,,,,
400,"I wish I could do that, but none of the people I know believe its as bad as it is, so I doubt they'd be willing to write a letter or anything like that. They already had the person I live with fill out some paperwork that from what they told me was similar to what they had me fill out, stuff about my condition, what I do daily, what difficulties I have, etc, but from her point of view. It even specifically said not to show it to me on the cover of the envelope. 

And yeah I know about how unhelpful therapists and such can me. Mine is *extremely* negative about me applying. Plus I found out after getting a response from SSI that she isn't even a full psychiatrist which I didn't even know this whole time. So since I've just this week had my psychiatric evaluation by the doctor the SSI had do it, I plan on finding a new Full psychiatrist who can help me throughout this process. I am also on several different medications, I think about 6 if I recall correctly. 1 for severe adult ADHD, the rest are for depression and anxiety and sleep-related issues caused by those problems.",,,,darknaio,Major Depression/Anxiety,,1478339167,t5_2qhe8,t3_5b2txz,t1_d9mov01,1,1481227879,0,0,d9mpdy9,disability,,,,,
401,"this is a fantastic idea. I work for an organization that is considered small, and we support over 200 people with disabilities. I would recommend this to everyone. you may also consider rating based also on service. I've had great and horrible experiences with clients. we have in the past been told that we can't be served at a hairdresser because someone can't transfer into their chairs, or staff don't speak to our clients directly, they ask us instead. ",,,,Mandy_Nano,,,1480459701,t5_2qhe8,t3_5eldnq,t3_5eldnq,1,1481861669,0,0,dal77xx,disability,,,,,
402,"I think that I'll give it a shot. Sitting is the bane of my existence- haha. 

Yeah,it's dicey buying aids for easier living; I have a fancy back brace and TENS unit that make my pain worse that I shelled out for. One of the best things I bought was a lightweight janitorial dustpan with a 3 ft (appx) handle so I don't have to bend over.  I also found that I can use lightweight, scaled-down gardening equipment  (rake, shovel ) made for kids. 

Thanks for the post; it's very informative. 

",,,,mudanjel,,,1480100050,t5_2qhe8,t3_5eujd6,t1_dafbpkx,1,1481747594,0,0,dafchcj,disability,,,,,
403,"Having both a psychiatrist and therapist is the best. Finding good ones though is the problem. If they talk down to you or tell you that you shouldnt be applying, walk out. You dont need to hear that. I still get so upset sometimes over the way I was treated by some of these 'professionals'. 

I think people are just judgemental especially when it comes to people getting 'free money'. They need to understand that none of us want to be on disability. We all want to be normal and have normal lives. ",,,,maipoxx,,,1478341144,t5_2qhe8,t3_5b2txz,t1_d9mpny3,1,1481228114,0,0,d9mpvjn,disability,,,,,
404,I don't trust the way the freewheel looks I prefer the RGK frontwheel or tns smartwheel or lomo 360,,,,mdcd0331,,,1479067764,t5_2qhe8,t3_5cgbp3,t3_5cgbp3,1,1481451996,0,0,d9yte5g,disability,,,,I don't trust the way the freewheel looks I prefer the RGK frontwheel or tns smartwheel or <LOCATION> 360,"[{'start': 91, 'end': 101, 'entity_type': 'LOCATION', 'text': '<LOCATION>', 'operator': 'replace'}]"
405,But the people we're referring to might not necessarily be disabled and so will likely not lose money. Not sure where you're going with this...,,,,TinyLittleStormCloud,,,1478794566,t5_2qhe8,t3_5c19t7,t1_d9u8k2x,1,1481369917,0,0,d9ugttz,disability,,,,,
406,"I rode my bike so much as a youngster that I was able to learn to ride without my hands.  It would be a challenge to learn with only 1 arm.  But it can be done.

Also I would look into a bike with the brakes on the pedals instead of the handlebars.

Good luck!",,,,yoon1735,,,1479242802,t5_2qhe8,t3_5czw4t,t3_5czw4t,1,1481504202,0,0,da1rpgb,disability,,,,,
407,"her name is brooklyn chase and she is a porn star, http://www.pornhub.com/pornstar/brooklyn-chase
i only know because of science!",,,,Rae_Hurlock,,,1480072065,t5_2qhe8,t3_5b7v3i,t3_5b7v3i,2,1481740385,0,0,daey4bk,disability,,,,"her name is brooklyn chase and she is a porn star, <URL>
i only know because of science!","[{'start': 51, 'end': 56, 'entity_type': 'URL', 'text': '<URL>', 'operator': 'replace'}]"
408,"Good luck &amp; let me know if you have any other questions, Ill try to answer as best I can. ",,,,maipoxx,,,1478500353,t5_2qhe8,t3_5bguy0,t1_d9p5bf4,2,1481274380,0,0,d9p9i8d,disability,,,,,
409,"I work in a similar program here in Chile, and from my experience I can tell you that those programs are made for putting you in contact with job opportunities, but it's up to you to fully commit and go for it (if it's what are you looking for). Good luck and keep your eyes open for other opportunities outside the program! ",,,,efecandia,,,1478142354,t5_2qhe8,t3_5arzkc,t3_5arzkc,1,1481168218,0,0,d9jf0hj,disability,,,,"I work in a similar program here in <LOCATION>, and from my experience I can tell you that those programs are made for putting you in contact with job opportunities, but it's up to you to fully commit and go for it (if it's what are you looking for). Good luck and keep your eyes open for other opportunities outside the program! ","[{'start': 36, 'end': 46, 'entity_type': 'LOCATION', 'text': '<LOCATION>', 'operator': 'replace'}]"
410,"How would you like to this information presented to you? If the review had a category on door width, would a simple rating (maybe like ""4.3 out of 5 stars"") work? Or would you like the review to include *actual* measurements (like ""2.3 meters wide"")?",,,,LDShivang,,,1480012974,t5_2qhe8,t3_5eldnq,t1_dadcwpj,1,1481725096,0,0,dae3ktk,disability,,,,,
411,"No worries, I think it's an important topic for discussion!",,,,TinyLittleStormCloud,,,1480237717,t5_2qhe8,t3_5exlt4,t1_dagpcw7,2,1481784362,0,0,daheush,disability,,,,,
412,"If it's one of those self reporting things, where they ask race and veteran status, you can just say that you decline to answer. I decline to answer everything.",,,,lbsmith5,EDS,,1478133575,t5_2qhe8,t3_5ar0ko,t1_d9ip1c8,2,1481164702,0,0,d9j7urn,disability,,,,,
413,I hope you get out of the hospital soon!,,,,CooperArt,"Leg, Brain (neuro, psych), Pain, Lungs",,1478195599,t5_2qhe8,t3_5axcoo,t1_d9k5762,3,1481183492,0,0,d9k9q4x,disability,,,,,
414,"United way will help with filing?  OK, thanks I will check it out.",,,,anxietythrowawayhelp,,,1479183206,t5_2qhe8,t3_5czaml,t1_da0p8j4,1,1481487815,0,0,da0uihj,disability,,,,,
415,"What does it mean ""accept Obamacare""? Medicare? ",,,,megoprune,,,1479181882,t5_2qhe8,t3_5czaml,t1_da0rz1z,2,1481487389,0,0,da0tmsu,disability,,,,,
416,"You know what's great? I probably have had it since 2012, but I've been incidentally taking medication that treats tremors since then until a few months ago: Inderal once before, and Topamax, both for migraine.

I distinctly recall having one at graduation, and deciding that since it seemed to go away on its own, there was no need to be concerned.

Well, now I'm a mechanic and fry cook, so there's a bit of a need. At least now I'm back from dangerous to just oddly clumsy at work.",,,,CooperArt,"Leg, Brain (neuro, psych), Pain, Lungs",,1478355858,t5_2qhe8,t3_5axcoo,t1_d9mnlt7,1,1481230637,0,0,d9muz3m,disability,,,,,
417,There is an anonymous fraud line that you can report people who should not be getting disability - http://oig.ssa.gov/report-fraud-waste-or-abuse/fraud-waste-and-abuse,,,,disability_examiner,Name says it all,,1479529859,t5_2qhe8,t3_5cam3s,t1_da55inc,1,1481589962,0,0,da6mhdq,disability,,,,There is an anonymous fraud line that you can report people who should not be getting disability - <URL>,"[{'start': 99, 'end': 104, 'entity_type': 'URL', 'text': '<URL>', 'operator': 'replace'}]"
418,"Is this an attorney from a national disability advocate like Myler Disability, Iannella &amp; Mummallo, ALLSUP, etc? If so, they don't get paid *anything* unless you are approved, so you wouldn't be out anything.

My understanding (I don't work on the medical determination side of things) is that during the initial claim, the disability determination folks have a very stringent set of rules they have to follow, with no wiggle room - but that judges have more leeway. 

In that case, the worst case scenario is that you go through with the hearing and are denied. If you have the hour or two to spare, **GO**. If you don't go, you are definitely not getting paid, but if you *do* go, there is at least a possibility. 

",,,,unwillingSSAexpert,,,1479181305,t5_2qhe8,t3_5d01o6,t3_5d01o6,6,1481487204,0,0,da0t8z0,disability,,,,,
419,"That is a great point, and I think having social gatherings for multiple disabilities will really show the range of disabilities out there, (and it may even make that community more inclusive!)",,,,JuneBugg94,,,1478144520,t5_2qhe8,t3_5arzis,t1_d9j3zmw,1,1481169112,0,0,d9jgrsx,disability,,,,,
