,body,score_hidden,archived,name,author,author_flair_text,downs,created_utc,subreddit_id,link_id,parent_id,score,retrieved_on,controversiality,gilded,id,subreddit,ups,distinguished,author_flair_css_class,anonymized_body,anonymized_masks
0,"My friend in Indiana has one for her PF, so hope that gives you some hope. ",,,,summerofsin,In pain and fed up.,,1472296644,t5_2qhe8,t3_4zlu8m,t3_4zlu8m,1,1473629085,0,0,d6yoqcv,disability,1,,,"My friend in <LOCATION> has one for her PF, so hope that gives you some hope. ","[{'start': 13, 'end': 23, 'entity_type': 'LOCATION', 'text': '<LOCATION>', 'operator': 'replace'}]"
1,Was not putting it down just informing ,,,,Kyddeath,Nerve Damage/Crip,,1470373198,t5_2qhe8,t3_4vwqvm,t1_d62qmw6,1,1473231908,0,0,d64zevc,disability,1,,,,
2,"Being a diabetic with cerebral palsy, rolling around in a $5000 chair (man, I'd love one of those push assist things) with a $6000 insulin pump, I sometimes feel like a pimp. ",,,,Briannkin,Cerebral Palsy,,1471934780,t5_2qhe8,t3_4z4erm,t3_4z4erm,4,1473552951,0,0,d6sy4ic,disability,4,,,,
3,"It's a bit of a complicated situation. I go to school out of town, where I was diagnosed. He hasn't seen me at my worst, or even my average. I'm beyond thankful that he doesn't give me treatment options (he specifically tells me to go back to the doctor who diagnosed me) simply because I don't trust his judgment for mental health. It's honestly such a stressful mess and I hope it resolves itself when I appeal. ",,,,screaming-succotash,,,1472171546,t5_2qhe8,t3_4zippe,t1_d6wqq2j,1,1473603899,0,0,d6wv38z,disability,1,,,,
4,"Thanks for posting, and for the kind offer of help via PM.  

I'm a little more scatterbrained since my operations and hospital stay, and I have trouble concentrating along with some memory issues.  I hope I don't have to go it alone at the hearing.  I'm just so sore and tired and sick all the time, and I live with my elderly mother.  In addition to my own issues, I have to try to keep her out of trouble as well - she doesn't make good decisions these days, and she's unsteady, among other things.  I wish things were a little more calm.

I got my CD in the mail Friday.  I guess I'll start looking it over tonight.  Hopefully I can concentrate enough for the task at-hand.

I'm happy that you got approved.  Given the politics in this state, I don't have a lot hope and trust that anyone in the gov't is at all interested in my health or continued survival.  Here's hoping.",,,,SoVerySick314159,,,1470030106,t5_2qhe8,t3_4uhbu5,t1_d5z5fjg,1,1473130621,0,0,d5z9kko,disability,1,,,,
5,"What about text-based counseling? I feel like that is an emerging field. Have you looked at it? Good luck.  Also, consider writing articles and essays—I would love to read an essay about your experience with your voice, especially if you got your masters recently, if you wrote it. ",,,,acey,,,1471611362,t5_2qhe8,t3_4yhnfg,t3_4yhnfg,1,1473489985,0,0,d6nz6at,disability,1,,,,
6,There are some theater groups that exclusively cast actors with disabilities.  I hope to see this expand to film and television opportunities.  I'm getting pretty sick of seeing able-bodied actors in disabled drag being commended for their performances and I feel like the tide is turning just a little bit.,,,,Nocoolnamesleft10,,,1470164821,t5_2qhe8,t3_4vshl6,t3_4vshl6,2,1473159204,0,0,d61ei6h,disability,2,,,,
7,"I'm in the same boat, I think I might have to take the plunge and move to CO though.",,,,bcxx143,Cerebral Palsy,,1472497571,t5_2qhe8,t3_4z9v5u,t1_d71et3z,1,1473666573,0,0,d71kjh2,disability,1,,,,
8,Thank you for the feed back. They did go up to the SS office today and found out that my income wont be a problem for them.,,,,Sleepykat666,,,1470952993,t5_2qhe8,t3_4x51rl,t1_d6cyc39,1,1473354645,0,0,d6duh1b,disability,1,,,,
9,"Thanks, I was just worried if I get accepted and spent it on stuff like that if I would get in trouble, now I see it's mostly for things that are ""luxury"" items, not essentials.


One more question (thanks again for the replies) do you know how long the average wait time is after seeing the ALJ? They didn't tell me how long to wait, just told me I'd receive a letter in the mail with my decision.",,,,throwingaway19483918,,,1472495865,t5_2qhe8,t3_4z37fl,t1_d701gbs,1,1473666134,0,0,d71j78u,disability,1,,,,
10,"Still, the SSA is looking for a strong case file; they need to justify the approval according to criteria. Anecdotal evidence may or may not be relevant when actual documentation of work and treatment history are factored into the question ""...can the applicant do the work they once did""?

10 years of work credits may result in a meager monthly check; my 20 years of retail and food service did not result in a large monthly check or some kind of golden ticket akin to winning the lottery. ; )

Work as long as you can at high-wage gigs before you just can't do it anymore and require the aid of SSA programs.",,,,psychforge,schizophrenia spectrum disorder,,1472685882,t5_2qhe8,t3_50cq92,t1_d74ozrt,1,1473706906,0,0,d74p9zf,disability,1,,,"Still, the SSA is looking for a strong case file; they need to justify the approval according to criteria. Anecdotal evidence may or may not be relevant when actual documentation of work and treatment history are factored into the question ""<URL>n the applicant do the work they once did""?

10 years of work credits may result in a meager monthly check; my 20 years of retail and food service did not result in a large monthly check or some kind of golden ticket akin to winning the lottery. ; )

Work as long as you can at high-wage gigs before you just can't do it anymore and require the aid of SSA programs.","[{'start': 241, 'end': 246, 'entity_type': 'URL', 'text': '<URL>', 'operator': 'replace'}]"
11,Positional or tension migraines? Have you tried a triptan medication?,,,,zebra-stampede,,,1471764654,t5_2qhe8,t3_4ytnw9,t3_4ytnw9,3,1473519145,0,0,d6qdhi6,disability,3,,,,
12,"There's a Disability Pride march in Toronto now :D It's in it's 5th or 6th year. Still really small, but I love it.",,,,themooninthesky,,,1471827076,t5_2qhe8,t3_4yt97v,t1_d6r3rrh,2,1473530817,0,0,d6r9eab,disability,2,,,"There's a Disability Pride march in <LOCATION> now :D It's in it's 5th or 6th year. Still really small, but I love it.","[{'start': 36, 'end': 46, 'entity_type': 'LOCATION', 'text': '<LOCATION>', 'operator': 'replace'}]"
13,"Yes, you can apply for both at once, they used to do so automatically. 

Keep in mind if you have over $2,000 in countable assets or a spouse who's earning good money, you won't qualify. 

There is no waiting period for SSI as there is for SSDI. ",,,,Frugalista1,,,1470723203,t5_2qhe8,t3_4wtras,t3_4wtras,1,1473302105,0,0,d6a2qa3,disability,1,,,,
14,"I understand where this writer is coming from but they really seem to be taking a shit over these people who posed in these photoshoots. I would bet money that it was not their decision in the first place, and even if it was I can never be mad at someone for doing something with good intentions. Lay off a little, they probably didn't know what they did was wrong and from what I can tell they probably aren't bad people.",,,,99baking,,,1472449415,t5_2qhe8,t3_5006bc,t3_5006bc,3,1473658258,0,0,d70w3pk,disability,3,,,,
15,"Ugh. Skin breakdown. I worked in direct care for 13 years prior to becoming disabled myself, and skin care in mostly immobile patients was always such an uphill battle. I had one client that was essentially comatose and had to be repositioned every 2 hours during the day and every 4 hours at night, and it was not at all difficult to tell if the previous shift's aides hadn't done it, and it would piss me off to no end (same with not changing soiled briefs or clothing in a timely manner). People who don't understand the importance of basic cares like that or simply don't care don't belong in direct care, at all. Anyway, enough ranting from me. Thanks for responding!",,,,jlmitch12,dystonia and autoimmune disease,,1472531944,t5_2qhe8,t3_5076j3,t1_d7278do,2,1473674514,0,0,d728cqc,disability,2,,,,
16,"You're best option will be to call the title place to ask them what is legal and what isn't. As another poster said, a rubber stamp may be considered legal. 

When I did my house closing, there was a good deal of paperwork but I don't think that it was an exorbitant about of signatures (my closing took maybe 30 minutes top and a lot of that is explaining the paperwork).  If the rubber stamp isn't an option, I wonder if they would allow you to break up the signing into two different sessions still in the same day. Maybe have one session before lunch, everybody goes to lunch, and then come back and finish the paperwork?",,,,RambleRamble,SSI/SSDI Examiner,,1470408516,t5_2qhe8,t3_4wa3ag,t3_4wa3ag,3,1473237469,0,0,d65elw6,disability,3,,,,
17,"&gt; I am largely going to rule out any programs that require ""official"" proof given all the horror stories I've heard. . . otherwise be subjected to all sorts of 'tests' and judgments from people who don't understand the nature of 'chronic' and 'invisible' illnesses.

I understand the frustration with the different programs, but, in your situation, I don't think you can afford to rule out any options. SSDI/SSI and Medicaid is more difficult when you have a rarer condition but it is not impossible. And there is no ""judgment"" with these programs - when they send you to doctor's appointments and order different tests it is because they are required to in order to determine eligibility. Its cynical to think that SSA doesn't ""understand"" these illnesses; we do understand them but we also have regulations and rules to follow. We are not able to just say ""well, they say they have this condition and these symptoms so it must be true"". Objective evidence is required as part of the program, in part due to remove some of the subjectiveness of the decision and keep determinations consistent across disability examiners.   

From where I'm sitting (and not just from an SSA perspective but also as a former social worker) your best bet will be a combination of disability and Medicaid. You say that you don't need home health, which may be true, but sometimes these programs will give you access to services that can help you with some of your non-medical needs.  When I was a mental health case manager I would often help out my clients with routine errands/chores when they needed it.

As for non-government options, could you consider getting a roommate? You could even consider giving them a small break on the rent (say you pick up $50/mo of their portion) in return for them helping you out when you need it. I can understand not wanting to give your key to a creepy male neighbor but I have to think that you are not the only female in your apartment complex. ",,,,RambleRamble,SSI/SSDI Examiner,,1470926417,t5_2qhe8,t3_4x622i,t3_4x622i,4,1473346395,0,0,d6d9kca,disability,4,,,,
18,"I appreciate your advice however you would probably feel differently about the outcome if it happened to you. Nothing I could ever say would adequately represent this disease. Can't taste, can't smell....do you like Thanksgiving ? I don't look forward to it anymore. I have bouts of nerve pain, brain fog, neurological headaches, depression, and on and on.  I have not had a good night sleep in over two years as I have lost almost all sensations. Do the sheets in your bed feel good at night after a long day ? I don't feel sheets, hot, cold, etc.  My IQ has dropped from 130 - 109, failed neurological test, etc. Chronic Lyme disease is a BIG money disease. A relapse is thousands of dollars. That morning I was so upset, scared, confused, and apparently not well represented. All that advocate had to do would have been to remind me about treatment money.  I actually told the judge thinking for me was like thinking through mud and the current state of my thyroid was not helping things. People are tired of the system screwing them over in one way or another.  We need a complete redo. Making someone with any type of debilitating illness wait as long as I waited is pathetic. If I was approved than I am approved based on medical information. Changing that would seem like some kind of twisted payback / punishment for standing up for myself.  Whether I am disabled or not was already ruled upon.  It should be off the table for now !!  As far as medicare goes, I don't qualify. I don't know of any medical insurance that pays for long-term Lyme disease and the physicians that treat it at this time. Many treatment methods are deemed experimental.",,,,ecfboop52,,,1470173278,t5_2qhe8,t3_4ve034,t1_d5yt6q6,1,1473161688,0,0,d61lb29,disability,1,,,"I appreciate your advice however you would probably feel differently about the outcome if it happened to you. Nothing I could ever say would adequately represent this disease. Can't taste, can't <URL> you like Thanksgiving ? I don't look forward to it anymore. I have bouts of nerve pain, brain fog, neurological headaches, depression, and on and on.  I have not had a good night sleep in over two years as I have lost almost all sensations. Do the sheets in your bed feel good at night after a long day ? I don't feel sheets, hot, cold, etc.  My IQ has dropped from 130 - 109, failed neurological test, etc. Chronic Lyme disease is a BIG money disease. A relapse is thousands of dollars. That morning I was so upset, scared, confused, and apparently not well represented. All that advocate had to do would have been to remind me about treatment money.  I actually told the judge thinking for me was like thinking through mud and the current state of my thyroid was not helping things. People are tired of the system screwing them over in one way or another.  We need a complete redo. Making someone with any type of debilitating illness wait as long as I waited is pathetic. If I was approved than I am approved based on medical information. Changing that would seem like some kind of twisted payback / punishment for standing up for myself.  Whether I am disabled or not was already ruled upon.  It should be off the table for now !!  As far as medicare goes, I don't qualify. I don't know of any medical insurance that pays for long-term Lyme disease and the physicians that treat it at this time. Many treatment methods are deemed experimental.","[{'start': 195, 'end': 200, 'entity_type': 'URL', 'text': '<URL>', 'operator': 'replace'}]"
19,"I'm a T-10 Paraplegic. You are over-thinking if you are concerned about how to great him. Hug, kiss on the face, handshake... its just meeting someone. As far as boundaries physically... I would not be offended if you bent down. Just do not push my chair unless I ask, it implies I cannot do it myself. Otherwise just be yourself and let your date be themselves. Wish you the best!",,,,[deleted],,,1471403921,t5_2qhe8,t3_4y0yba,t3_4y0yba,4,1473446186,0,0,d6knwrm,disability,4,,,,
20,"I believe a rubber stamp would be legal...basically if you agree that it constitutes your signature, it is legal.  That is why people who don't know how to write can sign with an X (or whatever) and have it be legal.  If you say it's your signature, it's your signature.  But you might want to tell the closing office beforehand that you plan to do this.
Not really any other options that I can think of at the moment.  My wife signed where she could and I took over for when she couldn't...I see your point on exclusion but we're a team, so not a big deal to help each other when needed.",,,,GubbyWMP,,,1470403998,t5_2qhe8,t3_4wa3ag,t3_4wa3ag,5,1473236391,0,0,d65bha9,disability,5,,,"I believe a rubber stamp would be <URL>sically if you agree that it constitutes your signature, it is legal.  That is why people who don't know how to write can sign with an X (or whatever) and have it be legal.  If you say it's your signature, it's your signature.  But you might want to tell the closing office beforehand that you plan to do this.
Not really any other options that I can think of at the moment.  My wife signed where she could and I took over for when she couldn't...I see your point on exclusion but we're a team, so not a big deal to help each other when needed.","[{'start': 34, 'end': 39, 'entity_type': 'URL', 'text': '<URL>', 'operator': 'replace'}]"
21,"Uh, no. That's not how this works. That's not how any of this works. They can't discriminate against you for being blind. They don't reserve the right to do that.",,,,UHaveNoPowerOverMe,Narcolepsy,,1470666116,t5_2qhe8,t3_4w7qd4,t1_d68oojv,1,1473287636,0,0,d690qnt,disability,1,,,,
22,"I am so sorry you have to live like that, but I completely understand how you're feeling.",,,,bcxx143,Cerebral Palsy,,1472046150,t5_2qhe8,t3_4z9v5u,t1_d6ukitg,1,1473575582,0,0,d6ummjj,disability,1,,,,
23,"Thank you so much for the comment, advice, and commiseration! It's nice to meet a kindred law spirt, and I am sorry to hear of your own health troubles! I've definitely been researching in prep for my appointment tomorrow (got all my questions written and ready), but it's great to hear about the SSDI not being affected by preexisting assets or marriage status! That's something I haven't seen specified anywhere, so that's a great comfort. 

My sister is actually an RN/case manager for a health insurance co, specifically Medicare and Medicaid cases. So I have a little information that tells me not to expect more than about $750/mo in SSDI, which is what scares me as that doesn't even cover my rent. And I'd hate to use that savings I have left up just to get by... But I guess I'm getting far ahead of myself until I even get approved and find out what I'd get. Maybe I've accumulated more work than I expected.

I'm just a big planner, in case you can't tell. It's really hard adjusting to not bejng able to rely on pretty much anything. But thank you again! Your comment has really been a great comfort. ",,,,tinymoroke,,,1472508341,t5_2qhe8,t3_505vt9,t1_d71q48w,1,1473669391,0,0,d71swy0,disability,1,,,,
24,"Well, everyone is different! Maybe he feels like once in the wheelchair, he can't get out? Or it's hard to get back in if he gets out? What you said about him liking roughhousing makes me think it's something like that.

No, I think every kid has that weird habit that parents try to talk them out of :P If it's just a few things, and the ""big picture"" isn't full of shame, then I think it's fine. A lot of more milder kids are encouraged to hide their disability and conform at all costs... And a lot of the severe kids are encouraged to have no independence at all. Both are detrimental - as long as you avoid both I think you're largely golden :)

(Which reminds me, another great thing my parents did is encourage my independence and autonomy. For my severity I should've had aides in school [I was mainstreamed] and whatnot, but didn't because my mom wanted me to do things by myself. For me, it was the best choice possible, and I love that they did that. Maybe the only thing they could've done was explain my condition to the class; even though I had balked at doing that, maybe they should've done it anyway.)",,,,kikellea,,,1472246231,t5_2qhe8,t3_4zqoel,t1_d6y12di,1,1473619886,0,0,d6y1n7p,disability,1,,,,
25,SSDI thru parents (DAC) is also terminated at marriage unless the spouse is also on DAC. ,,,,Frugalista1,,,1472090505,t5_2qhe8,t3_4zcjau,t1_d6v0f7g,2,1473587419,0,0,d6vje1v,disability,2,,,,
26,"How old is he, and what is is allowance date?",,,,spicyshazam,,,1470533560,t5_2qhe8,t3_4wemcu,t3_4wemcu,1,1473263092,0,0,d67b80x,disability,1,,,,
27,I was manic and psychotic when I got mine.  I ended up being escorted out of the building because I was tired of their snotty attitudes.  I was approved though because I was in such horrible shape that it was obvious.,,,,[deleted],,,1471167051,t5_2qhe8,t3_4wuy5x,t1_d6cx8ro,1,1473396416,0,0,d6gwj66,disability,1,,,,
28,"I forgot to mention the hearing scores are all bone.
I have sensorineural hearing loss in both ears.  I can't get cochlears because it's that bad.  My eight central nerve is damaged not my ear drums.  I have other nerve damage too that causes numbness but I don't see how it'll affect my life in huge ways other than having to make more trips caring stuff up the stairs and needing support to go up thin stairs or else I'll lose my balance (I lean against the wall to go up the stairs in my apartment, my apartment was paid for by a family member out of guilt because her husband kicked my husband, three week old son, and I out.  But it was only temporary, we still have to find a way to cover the remaining lease).",,,,[deleted],,,1472581953,t5_2qhe8,t3_509w6t,t1_d72o34m,1,1473682897,0,0,d72xc6h,disability,1,,,,
29,"You sound like a great person for all you've done, it's really great to read about another person being so thoughtful. I bought a van to live in at the beginning of my mental breakdown when I knew I'd be losing my apartment. The sub r/vandwellers has some great advice about living in a vehicle and the site www.cheaprvliving.com is full of advice and sample budgets for vehicle dwellers at $500 and $1000 per month. 

Vehicle dwelling is attractive because you have a sense of independence and a type of stability. BLM land is a great option but OP will need to track in her own water and track out her own waste as well as figure out ways to stay warm and cool. She might find some luck rotating parking in Walmart parking lots- I believe r/vandwellers has a link to the Walmarts that welcome vehicle dwelling. 

In my experience it was hard to live in a van and I have a nice little conversion with a real bed and a bit of floor space to move around in. If I had to do it again though I think I would have liked a trailer. It would have been so much nicer to stand up and if you live in a vehicle that breaks down you are without shelter when it's in the shop. Could you possibly buy OP a small used trailer? Depending on where she parks she might be able to bike or take public transport to get around. 

For long term I think your friend should apply for section 8 housing. The waiting lists can be long but they won't take more than 30% of her income for rent. As your friend is female she may have more options than living in a vehicle. Maybe try some women's shelters and churches to see if they have housing options. 

Hopefully I've provided some advice, you may also want to post on r/assistance. 

Thanks again for being a stellar friend. ",,,,asknanners12,PTSD/MDD/GAD/BPD/MISC.,,1471391234,t5_2qhe8,t3_4xm6e2,t3_4xm6e2,2,1473443067,0,0,d6kfkar,disability,2,,,"You sound like a great person for all you've done, it's really great to read about another person being so thoughtful. I bought a van to live in at the beginning of my mental breakdown when I knew I'd be losing my apartment. The sub r/vandwellers has some great advice about living in a vehicle and the site <URL> is full of advice and sample budgets for vehicle dwellers at $500 and $1000 per month. 

Vehicle dwelling is attractive because you have a sense of independence and a type of stability. BLM land is a great option but OP will need to track in her own water and track out her own waste as well as figure out ways to stay warm and cool. She might find some luck rotating parking in Walmart parking lots- I believe r/vandwellers has a link to the Walmarts that welcome vehicle dwelling. 

In my experience it was hard to live in a van and I have a nice little conversion with a real bed and a bit of floor space to move around in. If I had to do it again though I think I would have liked a trailer. It would have been so much nicer to stand up and if you live in a vehicle that breaks down you are without shelter when it's in the shop. Could you possibly buy OP a small used trailer? Depending on where she parks she might be able to bike or take public transport to get around. 

For long term I think your friend should apply for section 8 housing. The waiting lists can be long but they won't take more than 30% of her income for rent. As your friend is female she may have more options than living in a vehicle. Maybe try some women's shelters and churches to see if they have housing options. 

Hopefully I've provided some advice, you may also want to post on r/assistance. 

Thanks again for being a stellar friend. ","[{'start': 308, 'end': 313, 'entity_type': 'URL', 'text': '<URL>', 'operator': 'replace'}]"
30,"Slightly different but when people at my work ask what else I do for work since I am only there a couple days a week and I tell them I don't do anything and collect disability I am often met with something like ""Wow, lucky you only having to work 2 days a week"" or ""I wish I only had to work 2 days a week..."", my response is always ""I'll trade ya any day of the week."" or ""I would gladly work if it meant not having to live with what I go through"" or something to that effect.

I have chronic pain issues and congenital birth defects but  that generally aren't that noticeable unless I am not wearing a shirt. I try not to be snarky unless they are. But if people are genuinely rude then I don't tell them anything as it's none of their business.    
Don't waste your energy.

*Sorry for any typos or grammar errors... I've only slept one night since saturday morning.  ",,,,elastic-craptastic,,,1472196696,t5_2qhe8,t3_4sq0t2,t3_4sq0t2,1,1473608750,0,0,d6x8kwp,disability,1,,,,
31,Disabled people who are eligible for State Disability Benefits can apply for it. But you have to fulfill some requirements before applying. Sometimes you can be denied by SSA due to your non-severe condition. After receiving denial letter you can go for appeal within 60 days. Once you approved for State Disability benefits you will receive back -pay too from when your disability began.,,,,USAdisability,,,1470135386,t5_2qhe8,t3_4nfz6o,t3_4nfz6o,1,1473152081,0,0,d60uuqs,disability,1,,,,
