,body,score_hidden,archived,name,author,author_flair_text,downs,created_utc,subreddit_id,link_id,parent_id,score,retrieved_on,controversiality,gilded,id,subreddit,ups,distinguished,author_flair_css_class,anonymized_body,anonymized_masks
352,"Agree with /u/frugalista1.

It sounds like you don't have any concrete diagnoses. There is no diagnosis that includes sensitivity to sugar and fluorescent lights. Realistically speaking, you need to go to a psychiatrist, you need to be on medication and/or therapy for at least a few years, and you need to exhibit a clear diagnosis that Social Security can attach to an impairment.

What do you do during the day if you are not working? Describe your activity from when you wake up to when you go to sleep.

Have you tried other prescriptions? What is the longest that you have been on an antidepressant or antipsychotic medication?",,,,dds2011,,,1472392015,t5_2qhe8,t3_4zxipw,t3_4zxipw,2,1473645820,0,0,d6zxh17,disability,2,,,"Agree with <USER>.

It sounds like you don't have any concrete diagnoses. There is no diagnosis that includes sensitivity to sugar and fluorescent lights. Realistically speaking, you need to go to a psychiatrist, you need to be on medication and/or therapy for at least a few years, and you need to exhibit a clear diagnosis that Social Security can attach to an impairment.

What do you do during the day if you are not working? Describe your activity from when you wake up to when you go to sleep.

Have you tried other prescriptions? What is the longest that you have been on an antidepressant or antipsychotic medication?","[{'start': 11, 'end': 17, 'entity_type': 'USER', 'text': '<USER>', 'operator': 'replace'}]"
353,"I couldn't disagree more.  

Yes, the movement is fractured, disillusioned and apathetic.  So is just about every movement ever, regardless of their success.  

The advantage the disability movement has is that it has no class distinctions.  Both the billionaires and impoverished alike can end up with a disability.  Personally, I think if we all just spent a little more time bitching about the social bullshit we face, more of the right people will start listening.

Actually, last year I launched a complaint with my country's Human Rights Commission over an unpleasant incident involving airlines, airports and accessibility.  A major company is now changing its policies because I filled out a form online.",,,,euphemistic,,,1470229996,t5_2qhe8,t3_4vxur5,t1_d62dkvt,6,1473172948,0,0,d62esx1,disability,6,,,,
354,"Once you're on SSI you will be subject to the asset limits so saving to buy a house will be challenging. If you are allowed and get a chunk of back pay you will have a grace period (off hand I don't know it, a few months usually) in which to spend the money before they reimpose the asset limit. ",,,,RambleRamble,SSI/SSDI Examiner,,1472259799,t5_2qhe8,t3_4z37fl,t1_d6xebzu,1,1473623378,0,0,d6yab3j,disability,1,,,,
355,"Have you considered playing games like Dungeons and Dragons with a group over Skype or Discord? I'm legally blind and it's one of the greatest ways for me to get to know people and still feel connected to a group of people with similar interests despite my inability to drive anywhere. It's fun, engaging, pretty cheap if your friends can get you the PDF files for books, and the time really does fly by when you're slaying dragons or exploring dungeons. Good luck with your recovery, and I hope you feel better soon!",,,,blind_devotion08,Retinitis Pigmentosa / Legally Blind,,1471140167,t5_2qhe8,t3_4xl327,t3_4xl327,9,1473392146,0,0,d6glapp,disability,9,,,,
356,"I said 90% are denied *at the appeals stage*. I never said originally. Denying 90% of appeals is not acceptable, nor is it even close to actually looking at and correcting your mistakes. 

&gt;I absolutely think that there are changes that need to be made within SSA. People like your father fall into these traps where they aren't quite old enough, or just not quite bad enough to be allowed.

He is over 50, thus the requirement it has to be any job no longer applies like it did initially, so this doesn't matter. The second part highlights the problem. For someone who is in constant pain as if he is on fire with the most painful disease on the planet, stacked with other physical ailments like arthritis, on top of 10 different medications that don't even allow him to drive to not be ""bad enough"" says all there is to say about how the cards are stacked against you. If that isn't considered disabled and unable to work, then we don't have to search very far on what the problems are.

What would I change? First, both the rules and the mentality needs to change. The entire system is built around telling you No. It leaves no benefit of the doubt to the applicant, nor does it even give a shred of impartiality. My lawyer is the only Ohio Certified Specialist in Social Security Disability Law in my state and gives training to others, and at the ALJ stage, he told me they could literally deny every single case that comes to their desk and have a legal reason to do so. What part of this is trying to actually distinguish who is disabled?

In our last hearing, the judge actually proclaimed, ""I've never heard of full body RSD, are you sure you have that?"" After looking directly at the medical record that states it. Does that sound like someone trying to help someone disabled? The mentality currently is, ""What loophole in the law can I find to tell this person No"". That needs to change. While the judge gets to ride her horses on her acres of land(overheard this convo she had with the guard), my dad sits in shambles with his house falling apart and no A/C for 4 years running. When you have someone who is even close to borderline ""disabled"" according to guidelines, they need to be given benefit of the doubt. You are playing with a person's life here, not deciding on what's for lunch.

I would change the role of medications in determination. My dad is like a zombie on his meds. The amount of things he isn't allowed to do is a list just as long as his actual disabilities, including driving. This needs to be a factor. 

I would also change the sheer ridiculousness of the entire process. My dad can't even remember to pay his bills. If he hadn't of had kids, how was ever supposed to go through this process? People wonder why there are so many homeless? This is part of it. We have waited 5 years and counting. How does someone with no kids live 5 years with no income? Unless you are 100% mentally there, there is no way a single person can keep up with this process.

When reading both the ALJs decisions and the Attorney General at the federal cases, your honesty is used against you and your words twisted. I could go on and on and on about what a joke this is.

For now, I'll just say what I tell everyone else. You better pray you never become disabled before 62, and pray you can work full-time the entire time or you are going to go through a hell you have never experienced.

",,,,suchacrisis,,,1471350067,t5_2qhe8,t3_4w9c7p,t1_d6jjxyi,1,1473431880,0,0,d6jl8k6,disability,1,,,,
357,"Ok, first the SNAP. How much you get is based mostly on your housing expenses. If you have no rent, utilities, trailer payment, etc, you may only get $21.00. If she has real rent (not on a car) she'll probably get the full amount, ~200.00. I think this is why her QMB (Medicare help) is screwy! If she doesn't end up with the full amount, her check amount is definitely already enough to get by! Also, some states are better than others.

I simply don't see how a DISABLED person is going to use the bathroom several times a day in your van scenario. I've lived in a damn nice travel trailer all over the country, and the details of doing it are not that easy. 

Answer this: How will she stay warm? How will she stay cool? Van dwelling is hard. What happens when she has to poop, for gods sake?

So:

*The monthly motels can be had for around $800 or less. Or a mobile home park, bills paid. 

*SNAP, *$194.00. (She CAN get this if she's paying RENT)

*Medical, free, except for under $3.00 for most drugs.

*Toilet paper, but not needed at the motel. ~$8.00

*$3.00 each for each drug.

So she needs a check of $808.00 + drug deductables. And a few bucks for Dollar Tree, please.

If her check is less than this, SECTION 8, *somewhere*, or contact the USDA for help with a reduced price apartment in a rural area.. Not stuck in a van with your tummy hurting and no bathroom. 

Source: Lived this. with a broken back. ;...(






",,,,lyn816153,,,1471651849,t5_2qhe8,t3_4xm6e2,t1_d6omhmt,1,1473499619,0,0,d6os25n,disability,1,,,"Ok, first the SNAP. How much you get is based mostly on your housing expenses. If you have no rent, utilities, trailer payment, etc, you may only get $21.00. If she has real rent (not on a car) she'll probably get the full amount, ~200.00. I think this is why her QMB (Medicare help) is screwy! If she doesn't end up with the full amount, her check amount is definitely already enough to get by! Also, some states are better than others.

I simply don't see how a DISABLED person is going to use the bathroom several times a day in your van scenario. I've lived in a damn nice travel trailer all over the country, and the details of doing it are not that easy. 

Answer this: How will she stay warm? How will she stay cool? Van dwelling is hard. What happens when she has to poop, for gods sake?

So:

*The monthly motels can be had for around $800 or less. Or a mobile home park, bills paid. 

*SNAP, *$194.00. (She CAN get this if she's paying RENT)

*Medical, free, except for under $3.00 for most drugs.

*Toilet paper, but not needed at the motel. <LOCATION>*$3.00 each for each drug.

So she needs a check of $808.00 + drug deductables. And a few bucks for Dollar Tree, please.

If her check is less than this, SECTION 8, *somewhere*, or contact the USDA for help with a reduced price apartment in a rural area.. Not stuck in a van with your tummy hurting and no bathroom. 

Source: Lived this. with a broken back. ;...(






","[{'start': 1053, 'end': 1063, 'entity_type': 'LOCATION', 'text': '<LOCATION>', 'operator': 'replace'}]"
358,"You make a decent point but there are a lot of people who don't want to take mind altering medications when the issue is that her illness stems from abuse, not birth. ",,,,Majahight,,,1470612006,t5_2qhe8,t3_4wjw3s,t1_d685kg9,2,1473278110,0,0,d68ctbl,disability,2,,,,
359,"Work history: had my first job at 19, I am 29 now. So I dont have 10 years of work history but not 10+. The jobs I had only lasted 3 months or less. Not because I didn't want to work but because my anxiety is so random/sudden that its made me afraid to leave the house. 

I am constantly worried/afraid and as a result have been isolating myself from people in general since age 15. None of this is documwnted but if they were to ask my family about my behavior and ask them if they believe I am depressed all of my family would say I am depressed.

I have only had 8-10 jobs max in my lifetime that lasted maybe 3 months each. One of them lasted 5 months maybe.

Im fine with them investigating me. 
Because I legitimately suffer from this issues.
I have also had depression. Since I was a child.
Its possible maybe this is something I have always had. 

",,,,tosh123no,,,1472685465,t5_2qhe8,t3_50cq92,t1_d74o162,2,1473706798,0,0,d74ozrt,disability,2,,,"Work history: had my first job at 19, I am 29 now. So I dont have 10 years of work history but not 10+. The jobs I had only lasted 3 months or less. Not because I didn't want to work but because my anxiety is so random/sudden that its made me afraid to leave the house. 

I am constantly worried/afraid and as a result have been isolating myself from people in general since age 15. None of this is documwnted but if they were to ask my family about my behavior and ask them if they believe I am depressed all of my family would say I am depressed.

I have only had 8-10 jobs <PERSON> in my lifetime that lasted maybe 3 months each. One of them lasted 5 months maybe.

Im fine with them investigating me. 
Because I legitimately suffer from this issues.
I have also had depression. Since I was a child.
Its possible maybe this is something I have always had. 

","[{'start': 576, 'end': 584, 'entity_type': 'PERSON', 'text': '<PERSON>', 'operator': 'replace'}]"
360,"In all legal aspects, a reasonable accommodation can only be denied if it causes an undue financial burden on the school, or if the accommodation is of a personal nature (like demanding the school provide you a personal care attendant so you could toilet at the school). My guess is they considered this less of an accommodation related to your disability, and more of a scheduling conflict between you and the instructor (which they leave to the instructor's discretion). 

If you have any documentation that shows the appointment was crucial to the management/treatment/etc. of your disability, that will go miles. If they don't budge on it (though you can file at any time if you want), you can file a complaint with the Office of Civil Rights of the DOE here: http://www2.ed.gov/about/offices/list/ocr/complaintintro.html",,,,[deleted],,,1471570569,t5_2qhe8,t3_4yfo57,t1_d6ngi1y,2,1473483874,0,0,d6nh61q,disability,2,,,"In all legal aspects, a reasonable accommodation can only be denied if it causes an undue financial burden on the school, or if the accommodation is of a personal nature (like demanding the school provide you a personal care attendant so you could toilet at the school). My guess is they considered this less of an accommodation related to your disability, and more of a scheduling conflict between you and the instructor (which they leave to the instructor's discretion). 

If you have any documentation that shows the appointment was crucial to the management/treatment/etc. of your disability, that will go miles. If they don't budge on it (though you can file at any time if you want), you can file a complaint with the Office of Civil Rights of the DOE here: <URL>","[{'start': 764, 'end': 769, 'entity_type': 'URL', 'text': '<URL>', 'operator': 'replace'}]"
361,"Correct, but as you said, during peak network activity, so if the network is not congested at the time, you shouldn't notice a difference.",,,,olrs15,,,1470245884,t5_2qhe8,t3_4vwqvm,t1_d626js7,2,1473177859,0,0,d62qmw6,disability,2,,,,
362,"Yeah I have RA, nerve damage, failed back surgery syndrome, treatment resistant depression, anxiety, migraines and PTSD w/ panic attacks. All of those things together make it really hard for me to do basic things and interact with people. It's hard because I feel like my doctors don't take any of my health problems seriously because I look ""fine"".",,,,Melting_Phoenix,"RA, neuropathy, broken spine, depression, PTSD, etc.",,1470503036,t5_2qhe8,t3_4w7qd4,t3_4w7qd4,2,1473256112,0,0,d66topf,disability,2,,,"Yeah I have <PERSON>, nerve damage, failed back surgery syndrome, treatment resistant depression, anxiety, migraines and PTSD w/ panic attacks. All of those things together make it really hard for me to do basic things and interact with people. It's hard because I feel like my doctors don't take any of my health problems seriously because I look ""fine"".","[{'start': 12, 'end': 20, 'entity_type': 'PERSON', 'text': '<PERSON>', 'operator': 'replace'}]"
363,i dont care when people bend over for a hug but when people kneel down i get pretty mad.,,,,NRetallick,C6/7 Quad,,1471378618,t5_2qhe8,t3_4y0yba,t3_4y0yba,5,1473439710,0,0,d6k6epb,disability,5,,,,
364,I am. But unfortunately they can. It's a subjective decision that every individual school reserves the right to make. ,,,,BandedeMacaques,,,1470633366,t5_2qhe8,t3_4w7qd4,t1_d68mh3k,1,1473282873,0,0,d68oojv,disability,1,,,,
365,"I wish you were right. But sadly this is exactly how all of it works. Medicine isn't a handicap accessible field. At all. It's not technically discrimination if they believe that the accommodations I would need fundamentally alter the academic standards of the curriculum. And I cannot evaluate patients without an aide to describe to me the things I can't see for myself. This is highly unorthodox and the school has not yet decided how they feel about it. There are a few vets out in the real world that practice this way, but nobody has ever graduated from a veterinary program already requiring those kinds of accommodations. Some human med schools have done it. But most human med schools still will not graduate a visually impaired student. Graduating me would be a huge risk for my school to take, and not all clients would be comfortable with a veterinarian who can't see very well so employment once I graduate may be difficult to come by. 
That's the reality. Nobody likes it. Nobody relishes the idea of kicking me out. But it's truth. ",,,,BandedeMacaques,,,1470686360,t5_2qhe8,t3_4w7qd4,t1_d690qnt,1,1473293520,0,0,d69fyoi,disability,1,,,,
366,Of course this only pertains to how SSA considers the money in terms of continued eligibility for benefits. The IRS has different rules about income and what is taxable. ,,,,CrazyLogicGirl,,,1471647181,t5_2qhe8,t3_4ykear,t1_d6olkmy,1,1473498599,0,0,d6ooxie,disability,1,,,,
367,"For me, definitely office jobs are the way to go. Do you have any research labs or even universities nearby? See if there are openings for administrative assistants. If you don't get anything because of no experience, I agree that a good staffing agency is a great place to start because you get experience and yet aren't tied down if it doesn't work out. 

",,,,lbsmith5,invisible - lots of it,,1472180920,t5_2qhe8,t3_4zfug0,t3_4zfug0,1,1473606114,0,0,d6x1c8f,disability,1,,,,
368,"I kinda live alone. I live in a suite and I have roommates upstairs. I don't know if this is a living arrangement that would work for you. My roommates is a guy I went to high school with and his wife, so we are friends but not that close. I'm fairly independent and my roommates have left for like weeks and one time over a month. 

One thing that I make sure I have is easy prepared meals. I have jars of soup (made by my mom) that if I'm just really tired, I can pop in the microwave and have a easy meal. 

There are several local ""odd job"" facebook groups that I'm a part of where I can post something like ""hey, my roommates are out of town and I need someone to shovel my driveway/mow the lawn"" and someone in the area will come and do it. I've seen some pretty mundane tasks posted.

I rotate my cleaning areas for the days - I have only 4 small rooms and will only do one room a day. I might take a full day or two to do laundry. ",,,,Briannkin,Cerebral Palsy,,1470532829,t5_2qhe8,t3_4wgo2h,t3_4wgo2h,2,1473262932,0,0,d67atoi,disability,2,,,,
369,"I may sound like I am being an asshole but I know a couple people who have had payees who were not mentally challenged and that was because of other mental issues and past mistakes. Drug addiction, bi-polar etcetera. 

If you are being assigned a payee it is because they believe you might relapse or not able to handle things. Saying you are thinking of a permanent solution sounds like those things. 

I would recommend trying to calm down as best you can even calling someone or talking to someone here if you feel up to it. Instead of thinking of this as an attack think maybe it can be helpful. Give yourself some time to deal with this. Talk to your doctor, get a therapist if you feel it would help. Work towards healing and getting yourself to where you need to be. 

I went through this. I tried latching onto anything to make me feel like I was whole again but I had to work for it. You will too and you will look back on this and realize how much better you have become because of this. ",,,,Kyddeath,Nerve Damage/Crip,,1470445771,t5_2qhe8,t3_4wbg5h,t3_4wbg5h,4,1473246928,0,0,d665m8u,disability,4,,,,
370,"College, but university students here typically don't reach the age of majority until their sophomore year.",,,,Miltonaut,,,1472187731,t5_2qhe8,t3_4zcb5m,t1_d6vg6b5,1,1473607509,0,0,d6x54gk,disability,1,,,,
371,I looked it up and you may be right; I spoke hastily based upon personal experience assuming it held true for other people.,,,,like300,,,1471915605,t5_2qhe8,t3_4z37fl,t1_d6so17m,2,1473549427,0,0,d6so503,disability,2,,,,
372,"Stress is a trigger for me in regards to red alert psychosis and physical symptoms. Stress used to wreck my GI tract, but I think my longtime ""quasi-Crohns"" is in remission because of how I learned to cope with stress, as well as diet and exercise.

Many years of mindfulness practice, supported by a once habitual, formal meditation practice, has helped me accept the things I cannot change, and deal with what I am obligated to change.

Also helps to be nearing 50 and simply not giving a fk about certain former stressors.

Think about how your brain and nervous system are essentially one ""thing"" which extends into all parts of your body; so, I learned to ""think"" with my whole body instead of centering thoughts and emotions in my skull.

Mindfulness is more than ""being here or present"", it is an action which connects a person to their vitality; if I am centered in my power, I tend to avoid stress, and/or cope better with difficult people/situations.

Habitual centering through mindful awareness is the engine of empowerment.",,,,psychforge,schizophrenia spectrum disorder,,1472507890,t5_2qhe8,t3_505vt9,t3_505vt9,2,1473669283,0,0,d71slcx,disability,2,,,,
373,".......

there is a **big** goddamn valley between ethnic cleansing and doing a photo-shoot under a banner of solidarity.",,,,sielingfan,nub noob LAK,,1472444030,t5_2qhe8,t3_5006bc,t1_d70kjcv,4,1473657447,0,0,d70tphd,disability,4,,,,
374,"Damn, those are some rude coworkers! Also I feel you on platform lifts, they're so unreliable (in my experience) but also very slow and noisy. I've never met a platform lift I've liked. Not to mention that I've never felt safe in one.",,,,TinyLittleStormCloud,,,1471537537,t5_2qhe8,t3_4y0398,t1_d6juirc,1,1473475015,0,0,d6mroas,disability,1,,,,
375,"I want people to understand that you can't just offer some professions online. It is illegal.

When people keep suggesting that, it makes them look stupid. There is a reason that you can't currently go to the doctor or counselor online. State boards do not allow one-to-one counseling to be done in that way.

The Dear Abbys and spiritual columns/radio/sites are required to state that they are for entertainment purposes only or are not medical/counseling advice because giving serious counseling advice online is illegal and unethical.

It is also against state board rules for anyone who is or has been licensed to offer ""for entertainment purposes"" counseling. In other words, you can't do something to lose your license and then decide to keep offering the same services that you offered before claiming that it is now not for medical purposes.",,,,BlankNothingNoDoer,,,1471671858,t5_2qhe8,t3_4yhnfg,t1_d6p304v,1,1473503338,0,0,d6p3dj0,disability,1,,,,
376,"Oh that would work well! Thanks, I had a hard time. finding something that wasn't for toddlers",,,,Mahtiggah,,,1470856091,t5_2qhe8,t3_4x0dx6,t1_d6bfkv5,1,1473330444,0,0,d6c6zh9,disability,1,,,,
377,"I really don't know what's worse. The attitude towards disability and disabled people being treated like second class citizens in this context OR the fact that the Brazilians who are already living in a crumbling economy that is failing them will now have to spend even more money bailing themselves out of this mess. 

I have mixed feelings about the Paralympics in general and the way it has almost been twisted to be used against disabled people. Setting that aside as well as my general sympathy for the Brazilian people who are going to bear the costs, I feel absolutely awful for the paralympians who have trained so hard to overcome their limitations*, whatever those may be. Many of them will be from countries where disabled people are not really seen or heard from in public. 

*The physical, the emotional and the societal.",,,,TinyLittleStormCloud,,,1471681696,t5_2qhe8,t3_4y2rub,t3_4y2rub,2,1473504445,0,0,d6p6s43,disability,2,,,,
378,"He's an interesting character all right.  He seems to have a superiority complex and his response to criticism is to say ""You're all idiots."" rather than ""Is that how it sounded?  My mistake, that wasn't the tone I intended.""",,,,MacintoshEddie,,,1470927408,t5_2qhe8,t3_4x4d99,t1_d6csjre,5,1473346702,0,0,d6daadf,disability,5,,,,
379,Can you carpool with someone else in your training?,,,,mixedmaterials,Cerebral Palsy,,1470541022,t5_2qhe8,t3_4wgyby,t3_4wgyby,2,1473264666,0,0,d67f6re,disability,2,,,,
380,"Not what you're asking and they likely don't care but it's considered better form to say one ""*uses* a wheelchair"" instead of ""*is in* a wheelchair.""",,,,ughfuckthisugh,,,1471374940,t5_2qhe8,t3_4y0yba,t3_4y0yba,1,1473438622,1,0,d6k3gi2,disability,1,,,,
