,body,score_hidden,archived,name,author,author_flair_text,downs,created_utc,subreddit_id,link_id,parent_id,score,retrieved_on,controversiality,gilded,id,subreddit,ups,distinguished,author_flair_css_class,anonymized_body,anonymized_masks
293,"I think it's a totally valid concept to explore in a fictional world - it's a spin on a classic ""get what I want now - damned be the consequences"" idea. 

Maybe add something like this sort of magic (or whatever drug) is controversial among people with disabilities (as it would be in our world) as some believe it isn't worth the toll, some are completely fine with living with their disability, but others, who do apply this sort of treatment say it is worth it because they can do things easier for a time. ",,,,Briannkin,Cerebral Palsy,,1473393923,t5_2qhe8,t3_51qaen,t3_51qaen,2,1475477866,0,0,d7f8f6v,disability,2,,,,
294,"If you can fold up your wheelchair or dissemble it somewhat, it should be fine. I have a rigid frame now with quick release axles, but even back when I had a crap quickie folding frame, I was able to stick it in some pretty tight back seats of tiny cars. ",,,,Briannkin,Cerebral Palsy,,1472796308,t5_2qhe8,t3_50ogfi,t3_50ogfi,1,1475258815,0,0,d76gfzk,disability,1,,,,
295,"I do not know.  I would suggest carefully reading their site and matierials they provide, maybe contacting a representative or asking the doctors office.  If cost is prohibitive, you can get non-custom inserts at drug stores and discount stores, particularly if your feet are not an odd size (too large or too small).  The mass-produced ones cost much less.  ",,,,SWaspMale,,,1474500600,t5_2qhe8,t3_53ry9v,t1_d7wi4rn,1,1475924683,0,0,d7wr4kp,disability,1,,,,
296,"Hmm, was it Cymbalta by any chance? Not all SNRI's are the same, but yeah it's your choice.    

I have epilepsy as well as depression so I know all about seizures, and I can sympathise. Was your seizure related to your drug? If so then it should back off after the effects have worn off. I don't know enough about ECT I'm afraid, but I mean asking is the only way you're going to know. ",,,,AceBakerThing,Too many to list here...,,1473797071,t5_2qhe8,t3_52ko9g,t1_d7l80d4,1,1475638499,0,0,d7lgewz,disability,1,,,"Hmm, was it <LOCATION> by any chance? Not all SNRI's are the same, but yeah it's your choice.    

I have epilepsy as well as depression so I know all about seizures, and I can sympathise. Was your seizure related to your drug? If so then it should back off after the effects have worn off. I don't know enough about ECT I'm afraid, but I mean asking is the only way you're going to know. ","[{'start': 12, 'end': 22, 'entity_type': 'LOCATION', 'text': '<LOCATION>', 'operator': 'replace'}]"
297,"I'm sorry, this is not helpful in the slightest (maybe its not even funny) but my first thought when I read the title was ""Hallelujah! She can [pass](https://en.wikipedia.org/wiki/Passing_(sociology%29)!""

I hope you manage to get a second space.",,,,Loreki,CP right side. Mild.,,1473489400,t5_2qhe8,t3_51ydus,t3_51ydus,2,1475514621,0,0,d7gp17f,disability,2,,,"I'm sorry, this is not helpful in the slightest (maybe its not even funny) but my first thought when I read the title was ""Hallelujah! She can [pass](<URL>(sociology%29)!""

I hope you manage to get a second space.","[{'start': 150, 'end': 155, 'entity_type': 'URL', 'text': '<URL>', 'operator': 'replace'}]"
298,"When we ordered ours we had to have custom measurements taken.   Now we do have stairs that have a 90 degree turn.   The parts are large and heavy and need to be bolted securely.   There was one chair lift that had a recall but can't remember the brand and model off the top of my head.   Some Medicaid Wiavers pay for home modifications but not straight Medicaid.   If you share the stairs with anybody else the chair lift can be problematic if the stair case is narrow.    I have almost fallen several times trying to squeeze past ours.   We have to leave it on the landing midway or it is a safety hazard. 

ETA:   TBH if I had to do living arrangement decisions over again.   I would have looked for a one level house or apartment.   Transfering in and out is hard on the back as a caregiver.  Medical lines tend to snag.  If adaptive mobility equipment is required you either carry it up on your lap or you have to have 2 one for upstairs and one for downstairs.  ",,,,mekat,,,1474746949,t5_2qhe8,t3_541vma,t3_541vma,3,1476017230,0,0,d80hcez,disability,3,,,,
299,"I couldn't agree more with blind_devotion. 

I married a widower, his first wife was sick and died at 22. I was healthy when we met, 22+ years ago. Neither one of us thought about being disabled. 

A couple years later my husband had gained so much weight he couldn't walk through the food store. He could barely work. I had to pick up the slack. 

After a health scare he dropped the weight. All of it. A year later I started slowing down, it took a while to get diagnosed. 

Today my husband does everything - cook, clean, work, etc. Plus he is my caretaker, doing things no husband should ever have to do. Yet he does it all with love. 

You'll know when you've found the right person, if that's your path in life. There will be compromise. It's worth it though.",,,,Frugalista1,,,1473267887,t5_2qhe8,t3_51lw2o,t3_51lw2o,3,1475419415,0,0,d7d0bmx,disability,3,,,,
300,"Payments CAN be backdated to the application date, it's not a rule. 

OP is not in a position to file right now. He needs to try other jobs, he needs a diagnosis or set of diagnoses that would impair his ability to work at SGA level. 

Has anyone considered these might be migraines? There are treatments that work. ",,,,Frugalista1,,,1473027872,t5_2qhe8,t3_513e7i,t1_d791x2q,1,1475335959,0,0,d79lclt,disability,1,,,,
301,"Hello. I was born with club foot in both of my feet, a pretty severe case. Treatment when I was young has mostly fixed my issues, but working labor intensive jobs the last 10 years really did some damage. I went to a podiatrist first, and was given multiple steroid shots, as well as some ""custom"" inserts. They were really just generic inserts with some arbitrary padding glued on. They kinda worked, but they slid around a lot and I would always be partially walking on the edge of the insert because they were too small. I got fed up trying to deal with them after about 8 months and went to my orthopedic specialist. He was much more expensive, and not very polite.  He did comment on the inserts saying they were bad idea, I needed real custom ones. He sent me to a place that makes prosthetic limbs and splints. Now I have inserts that wrap around my foot on both sides, and go up past the ankles. They had to goof with insurance claim, because these inserts are typically for diabetes patients,  which I am not. It went through after about 12 months of submitting  and re submitting. I finally got the bill, 1600 roughly,  insurance paid about 650.",,,,TheJuice87,,,1474752960,t5_2qhe8,t3_53ry9v,t1_d7wi4rn,1,1476019792,0,0,d80l1kv,disability,1,,,,
302,"I like /u/blind_devotion08's advice. As an aside, you might also try working up to the big trips. Like, that's a daunting proposition, sure -- it's reasonable for her to feel unprepared for such a thing, especially if she hasn't really done any preparation, right? Try some shorter trips first, maybe in the car, maybe on a bus, whatever. See if she's interested in smaller adventures first, and then build from those. Maybe she'll even run into some of these unique obstacles she's got, and learn whether or not they're as prohibitive as she currently thinks. Of course you'll have to be prepared for either answer -- don't approach it like ""We're doing these little things so that we can do this big thing,"" you have to honestly approach with the attitude that you're 'finding out whether or not it's an option.' Sorta. 

Am I making sense? Basically the gist here is, 'finding ways around' poor accessibility isn't just an innate talent all disabled people have. We learn the skill. Give her a chance to learn too, and she might (emphasis on MIGHT) feel more comfortable with big undertakings.",,,,sielingfan,nub noob LAK,,1473288427,t5_2qhe8,t3_51nbx3,t3_51nbx3,1,1475430717,0,0,d7dg22m,disability,1,,,"I like <USER>'s advice. As an aside, you might also try working up to the big trips. Like, that's a daunting proposition, sure -- it's reasonable for her to feel unprepared for such a thing, especially if she hasn't really done any preparation, right? Try some shorter trips first, maybe in the car, maybe on a bus, whatever. See if she's interested in smaller adventures first, and then build from those. Maybe she'll even run into some of these unique obstacles she's got, and learn whether or not they're as prohibitive as she currently thinks. Of course you'll have to be prepared for either answer -- don't approach it like ""We're doing these little things so that we can do this big thing,"" you have to honestly approach with the attitude that you're 'finding out whether or not it's an option.' Sorta. 

Am I making sense? Basically the gist here is, 'finding ways around' poor accessibility isn't just an innate talent all disabled people have. We learn the skill. Give her a chance to learn too, and she might (emphasis on MIGHT) feel more comfortable with big undertakings.","[{'start': 7, 'end': 13, 'entity_type': 'USER', 'text': '<USER>', 'operator': 'replace'}]"
303,"Too fvcking bad, record it. Then file a federal complai t aginst theteacher with theADA.",,,,Koolorado,,,1473828496,t5_2qhe8,t3_52lj4i,t3_52lj4i,4,1475653078,0,0,d7m1ese,disability,4,,,,
304,"This might seem like a dumb question, but what does your sister want? State run locations only operate based on need. If they could serve less people and therefore spend a little less money that is what they'll advocate for. If you sister is unhappy and indicates that she wants to move and they know your willing to take her in you probably won't need to fight for her at all. However, if she is happy where she is than you have an up hill battle. The state of disability related services is more about self-advocacy and person-centeredness rather that family centered. ",,,,TheCMZ,,,1474891486,t5_2qhe8,t3_53z161,t3_53z161,1,1476069055,0,0,d82iq8c,disability,1,,,,
305,"I'm no expert in CP, but I have enough neuroscientific knowledge to give a bit of background. CP is a developmental brain disorder mainly affecting the motor cortex. From this you can already conclude that hemiplegia is more common, since this will occur when one hemisphere of the brain is affected, but the other isn't. 

There is however no theoretical reason for only the arms to be affected, but also no theoretical reason for only the legs to be affected. From my understanding of the disorder, often all limbs are affected to some extent. Pure paraplegia is not common in CP (*only* legs affected), same as pure paralysis of the arms is probably not common. This is because the damage or problematic brain development encountered in CP, will rarely follow the mapping of muscles of the brain. Areas that map to very different parts of the body can be found next to each other. There is no reason to assume that the 'damage' in CP (which can be from various sources) is specific to either the arm or leg area's. 

Someone who is better verses in CP, can probably be more clear about this. What I can be a bit more clear about, is the naming conventions. The reason we have names for certain types of paralysis is that they are common. I tried to explain above that pure paralysis of the arms is not very common, so that is why there is no name for. 

Paraplegia happens to almost all people that get substantial damage to their spinal cord anywhere in the T1-L2 region. Quadraplegia happens to people that get substantial damage in the C5-C7 region. Pentaplegion (a phrase I don't commonly hear), happens to people with damage in the C2-C4 region and in brain disorders, most famously ALS. Hemiplegia is characteristic of onesided brain damage, such as trauma and strokes. If you have twosided brain damage, you often have quad or triplegia (also something I don't hear often). 

It is possible to have only your arms affected, but for that you would need very twosided damage to your brain to very specific regions, leaving intact the regions next to it. The other way would be to have two sided damage in the spinal cord (or just outside it) that would only affect the nerves innervating the arms. Due to the nature of brain and nerve damage, this is just extremely rare. 

The only cases that I know of that have specific paralysis of an arm, are when the nerve going to the arm is cut off outside the spinal cord. This can happen in car accidents when the seatbelt pushes so hard into you that the nerve gets squashed. ",,,,Shoarma,,,1474064675,t5_2qhe8,t3_533vna,t3_533vna,2,1475750816,0,0,d7pvfti,disability,2,,,"I'm no expert in CP, but I have enough neuroscientific knowledge to give a bit of background. CP is a developmental brain disorder mainly affecting the motor cortex. From this you can already conclude that hemiplegia is more common, since this will occur when one hemisphere of the brain is affected, but the other isn't. 

There is however no theoretical reason for only the arms to be affected, but also no theoretical reason for only the legs to be affected. From my understanding of the disorder, often all limbs are affected to some extent. Pure paraplegia is not common in CP (*only* legs affected), same as pure paralysis of the arms is probably not common. This is because the damage or problematic brain development encountered in CP, will rarely follow the mapping of muscles of the brain. Areas that map to very different parts of the body can be found next to each other. There is no reason to assume that the 'damage' in CP (which can be from various sources) is specific to either the arm or leg area's. 

Someone who is better verses in CP, can probably be more clear about this. What I can be a bit more clear about, is the naming conventions. The reason we have names for certain types of paralysis is that they are common. I tried to explain above that pure paralysis of the arms is not very common, so that is why there is no name for. 

Paraplegia happens to almost all people that get substantial damage to their spinal cord anywhere in the <US_DRIVER_LICENSE>-<US_DRIVER_LICENSE> region. Quadraplegia happens to people that get substantial damage in the <US_DRIVER_LICENSE>-<US_DRIVER_LICENSE> region. Pentaplegion (a phrase I don't commonly hear), happens to people with damage in the <US_DRIVER_LICENSE>-<US_DRIVER_LICENSE> region and in brain disorders, most famously ALS. <PERSON> is characteristic of onesided brain damage, such as trauma and strokes. If you have twosided brain damage, you often have quad or triplegia (also something I don't hear often). 

It is possible to have only your arms affected, but for that you would need very twosided damage to your brain to very specific regions, leaving intact the regions next to it. The other way would be to have two sided damage in the spinal cord (or just outside it) that would only affect the nerves innervating the arms. Due to the nature of brain and nerve damage, this is just extremely rare. 

The only cases that I know of that have specific paralysis of an arm, are when the nerve going to the arm is cut off outside the spinal cord. This can happen in car accidents when the seatbelt pushes so hard into you that the nerve gets squashed. ","[{'start': 1798, 'end': 1806, 'entity_type': 'PERSON', 'text': '<PERSON>', 'operator': 'replace'}, {'start': 1728, 'end': 1747, 'entity_type': 'US_DRIVER_LICENSE', 'text': '<US_DRIVER_LICENSE>', 'operator': 'replace'}, {'start': 1708, 'end': 1727, 'entity_type': 'US_DRIVER_LICENSE', 'text': '<US_DRIVER_LICENSE>', 'operator': 'replace'}, {'start': 1596, 'end': 1615, 'entity_type': 'US_DRIVER_LICENSE', 'text': '<US_DRIVER_LICENSE>', 'operator': 'replace'}, {'start': 1576, 'end': 1595, 'entity_type': 'US_DRIVER_LICENSE', 'text': '<US_DRIVER_LICENSE>', 'operator': 'replace'}, {'start': 1482, 'end': 1501, 'entity_type': 'US_DRIVER_LICENSE', 'text': '<US_DRIVER_LICENSE>', 'operator': 'replace'}, {'start': 1462, 'end': 1481, 'entity_type': 'US_DRIVER_LICENSE', 'text': '<US_DRIVER_LICENSE>', 'operator': 'replace'}]"
306,Either. I'm trying to gather information from a wide breadth of parents.  ,,,,rephleks,,,1475195538,t5_2qhe8,t3_54tb9i,t1_d87cpgu,1,1476198782,0,0,d87o3tb,disability,1,,,,
307,"The point of using hearing impaired instead of deaf is because some people are not totally deaf, they just can't hear in certain ranges of sounds. Same goes for sight impaired. There are people with poor eye sight that are legally blind but not totally blind.",,,,meskarune,in the application process,,1474222438,t5_2qhe8,t3_53asuy,t1_d7ro8a0,3,1475808258,0,0,d7s1fb6,disability,3,,,,
308,"I'm not sure what I have can be trained.

 I have **severe** avolition, and bipolar cycles unresponsive to any medication (hence why I was upgraded to schizo-affective unspec.) The idea of me actually holding down a real job seems like a pipe dream. That and I'm living on only $600 a month (supplemental) and if I make any more than that or have any 2000+ in the bank my disability gets ripped away. I'm just lucky to have a friend who's not making me pay rent, the 600 barely covers food and meds. ",,,,AmantisAsoko,,,1473889267,t5_2qhe8,t3_52r0hu,t1_d7mz01k,1,1475676599,0,0,d7mzqzf,disability,1,,,,
309,"I don't mean to judge -- just trying to possibly motivate. The way I see it, you're either being smart to hang back and invest in your future happiness, or you're being smart to go out there and live for the moment just for a second. You're not wrong for going either direction. There are smart ways to go to a concert, and smart ways to stay home. Never be afraid to be smart, and never feel bad about being smart. 

And if you absolutely *cannot* do this fun thing, try and find another fun thing you can manage. Cabin fever can be worse than pain. *At some point* -- maybe not, you know, the mosh pit, I can see your point there -- but *at some point*, somewhere down the line, ""I *could* get hurt"" needs to be followed up with ""but fuck it, I'm awesome.""",,,,sielingfan,nub noob LAK,,1472874512,t5_2qhe8,t3_50v474,t1_d77ejt8,2,1475289578,0,0,d77n7vl,disability,2,,,,
310,"I would encourage you to include it.  I can't guarantee it'll be considered a severe impairment, or even a medically determinable impairment (given that you don't know what the underlying condition is), but it won't hurt to include it.",,,,DrMuffinPHD,SSA ODAR Attorney Advisor,,1474740856,t5_2qhe8,t3_54alwi,t3_54alwi,2,1476014693,0,0,d80dh4q,disability,2,,,,
311,"You may have to adjust how you report your living situation to the SSA. My suggestion would be to apply for EBT food assistance, get your parents to write you a note saying you're supposed to pay back rent once you have the means and are responsible for your own food and food prep. 

Then if/when you get approved for SSI you tell the SSA you owe x amount for y number of months back rent, and will be paying x amount of monthly rent going forward and get your parents to confirm it in writing. Ask around your local area to see what the minimum rent is to get the full SSI benefits, here it's $350. Use that minimum (or more) as the x monthly rent above, give that to your parents every month, and take care of your own food and expenses with the remainder and the EBT food assistance.",,,,xyzyxyzyx,,,1475076430,t5_2qhe8,t3_54tpxh,t1_d84xy7l,1,1476146336,0,0,d85l1un,disability,1,,,,
312,"What do you mean when you say that you're ""temporarily disabled""? Are you receiving short-term disability payments from an employer or insurance policy? Are you doctors telling you that this condition is temporary? ",,,,Thirdrawn,,,1474585109,t5_2qhe8,t3_54183s,t3_54183s,1,1475959738,0,0,d7y4jkr,disability,1,,,,
313,"I just had my SSI trial and am waiting for the results. It is my experience so far that the judge wants to see that your condition is so bad that you need to be seeing a specialist regularly and if you're not, you need to show you have a very good reason why that is.

Start seeing your doctors regularly and make sure you are following all of their treatments. Without a history of treatment that proves the nonfunctional state you're at is the best you can be, you probably won't get very far.

EDIT: I have extensive medical records going back 16 years but the judge was concerned about the missed appointments in 2015 while I was living in my car. As if my bipolar had magically cured itself, I guess. That should give you some idea of how important medical records are.",,,,SugarHooves,,,1473040290,t5_2qhe8,t3_513e7i,t3_513e7i,2,1475340815,0,0,d79s5el,disability,2,,,,
314,"I typically just say Hot Mess. Or multiply (pronounced ee at the end, not ) disabled. ",,,,Frugalista1,,,1474179685,t5_2qhe8,t3_53asuy,t3_53asuy,9,1475794228,0,0,d7ri2ru,disability,9,,,,
315,"that is a very excellent point, I think my word choice was poor. I wouldn't argue that SA can't be classified as a mental illness, it is still evaluated as one by SSA, but we just won't pay someone benefits for it. As I said above, a DAA material denial is very rare and requires a great deal of documentation in the file.  I would say that I do a DAA denial only maybe 1-2 times per year (adjudicating between 600-800 cases/year) and I won't do it unless it's clear that the person's only disabling condition is substance abuse. 

Not paying someone benefits for DAA is written into social security legislation. While substance abuse very much needs to be treated as a mental illness by society, there is still a line between having the illness and being disabled by it.   

The rules also don't apply once that person's use has caused permanent damage. So an alcoholic whose use ends up causing irreversible liver damage can be allowed because, even if they did stop drinking, the damage is done and permanent. ",,,,RambleRamble,SSI/SSDI Examiner,,1473479306,t5_2qhe8,t3_51yosl,t1_d7gf802,4,1475511443,0,0,d7gkux5,disability,4,,,,
316,there is NO such thing as a right to be rude!,,,,Rae_Hurlock,,,1474553514,t5_2qhe8,t3_53xio4,t1_d7x4iyc,1,1475942153,0,0,d7xg8nq,disability,1,,,,
317,"He likes computers, but doesn't know much about how they work. He'd probably really enjoy it if they were willing to train him. Would they allow telecommuting? 

I know he CAN work. We were both raised with a VERY strong work ethic. When we were in high school we worked together in a local industry and he's the only person I've EVER worked with who I'd trust to put in the same level of effort as I do. 

If you could find those links or be able to point me in the right direction, I'd appreciate it. ",,,,MisterRection,,,1473539864,t5_2qhe8,t3_51plpm,t1_d7fnepv,2,1475532453,0,0,d7hcqsf,disability,2,,,,
318,I just got my modem from pcsforpeople today!  This is a fantastic deal that will dramatically improve my daily life.  Thank you so much for this post.  Now I can stop paying $50 a month for 5GB of data on my ipad.,,,,Maddisonic,,,1474783268,t5_2qhe8,t3_4vwqvm,t3_4vwqvm,1,1476031287,0,0,d811kgi,disability,1,,,,
