,body,score_hidden,archived,name,author,author_flair_text,downs,created_utc,subreddit_id,link_id,parent_id,score,retrieved_on,controversiality,gilded,id,subreddit,ups,distinguished,author_flair_css_class,anonymized_body,anonymized_masks
136,"I can fit two whole wheelchairs (one foldy, one basketball) into my 2-door coupe. A Fusion should be totally fine. ",,,,sielingfan,nub noob LAK,,1472769227,t5_2qhe8,t3_50ogfi,t1_d75px0t,1,1475247223,0,0,d760mwv,disability,1,,,,
137,"It doesn't benefit us in any way. Able-bodied people see this inspiring nonsense but they don't equally fund the Paralympics, they believe disabled people have no right to exist and believe that we are better off dead. I do not exist to give warm and fuzzy feelings to able-bodied people. You might be happy with status quo but I am not.",,,,The_Croaker,Muscular Dystrophy,,1473264261,t5_2qhe8,t3_51l46x,t1_d7cvstt,4,1475417402,0,0,d7cxji3,disability,4,,,,
138,"Very reminiscent of Marx's concept of alienation from the *Philosophical and Economic Manuscripts*. Relationships between people transformed into relationships between things, humanity being made instruments of capital instead of the reverse, etc.",,,,ughfuckthisugh,,,1472781754,t5_2qhe8,t3_50p77x,t3_50p77x,2,1475253172,0,0,d768tbx,disability,2,,,"Very reminiscent of <PERSON>'s concept of alienation from the *Philosophical and Economic Manuscripts*. Relationships between people transformed into relationships between things, humanity being made instruments of capital instead of the reverse, etc.","[{'start': 20, 'end': 28, 'entity_type': 'PERSON', 'text': '<PERSON>', 'operator': 'replace'}]"
139,"I think we would need to see the language of your policy to advise.  What state are you in?  You may be able to complain or threaten to complain to the insurance commissioner, but I think you win more bees with honey.  Try to get letters from all your treating physicians.  ",,,,OperaO,,,1472925922,t5_2qhe8,t3_50v1ub,t3_50v1ub,2,1475303269,0,0,d787o48,disability,2,,,,
140,While the event itself was a tragedy this article and it's conclusions are simply... drivel!,,,,dominoconsultant,,,1472693648,t5_2qhe8,t3_50g6zm,t3_50g6zm,1,1475218648,0,0,d74u99e,disability,1,,,,
141,I have a disability (Hemiplegia) I am not disabled though. I have no idea what the difference is but it's important to me. ,,,,reaper_2,Left Hemiplegia,,1474188225,t5_2qhe8,t3_53asuy,t3_53asuy,5,1475796062,0,0,d7rkqtc,disability,5,,,I have a disability (<PERSON>) I am not disabled though. I have no idea what the difference is but it's important to me. ,"[{'start': 21, 'end': 29, 'entity_type': 'PERSON', 'text': '<PERSON>', 'operator': 'replace'}]"
142,Nah not that fancy of a chair unfortunately.,,,,MadiasHell,Lame,,1472759809,t5_2qhe8,t3_50ogfi,t1_d75s9yc,1,1475242361,0,0,d75txuo,disability,1,,,,
143,"I usually use disabled. However if I get really mad at abled people being ableist/jerks I will call myself crippled while calling them out.
I use depression instead of bipolar disorder because of how scary it is to people without mental illnesses. 
I hate gimpy, people have called me that jokenly (?) when I was on crutches. My pain isn't a joke.
I have a seizure disorder but I call it epilepsy (I think it's technically correct), because seizure disorder would confuse people, but I still have to explain I don't get grand mals, just some partial seizures and mostly petite mals.
I try not to mention that I have language disabilities or anxiety.
I really hate r*tard, idiot and the ilk, because I still haven't unpacked that trauma of being ""special Ed"" in elementary school.",,,,Azel_Lupie,MCTD/SLE/GAD/SD/BD/APD,,1474315304,t5_2qhe8,t3_53asuy,t3_53asuy,1,1475845432,0,0,d7tlgcw,disability,1,,,"I usually use disabled. However if I get really mad at abled people being ableist/jerks I will call myself crippled while calling them out.
I use depression instead of bipolar disorder because of how scary it is to people without mental illnesses. 
I hate gimpy, people have called me that jokenly (?) when I was on crutches. My pain isn't a joke.
I have a seizure disorder but I call it epilepsy (I think it's technically correct), because seizure disorder would confuse people, but I still have to explain I don't get grand mals, just some partial seizures and mostly petite mals.
I try not to mention that I have language disabilities or anxiety.
I really hate r*tard, idiot and the ilk, because I still haven't unpacked that trauma of being ""special <PERSON>"" in elementary school.","[{'start': 754, 'end': 762, 'entity_type': 'PERSON', 'text': '<PERSON>', 'operator': 'replace'}]"
144,"Thank you for the advice! I'll call some airlines tomorrow to see. And I will respect her decision if it is a final one, I just want to make sure its her talking and not her anxiety. Also I don't mean to sound like I'm pressuring her to go so that I can. I plan on going no matter what, I just want her to go with me. If she ends up not going I probably will just take as many pictures/videos as possible and keep a journal so that I can tell her about everything when I get home.",,,,dudeeveryoneishot,,,1473282849,t5_2qhe8,t3_51nbx3,t1_d7dbmi4,3,1475427781,0,0,d7dc17i,disability,3,,,,
145,"Well it is a disabled spot, and I am disabled. I'd hardly be trying to use it if I didn't have the paperwork. But going in to the dmv to legally register as a disabled person took enough hits off my pride, feeling like I don't have the right to use it in my own home is just cruel.",,,,jenOHside,"gastroparesis, RA, Lupus, POTS",,1473635336,t5_2qhe8,t3_51ydus,t1_d7g0dvr,2,1475569806,0,0,d7iu0ht,disability,2,,,"Well it is a disabled spot, and I am disabled. I'd hardly be trying to use it if I didn't have the paperwork. But going in to the <LOCATION> to legally register as a disabled person took enough hits off my pride, feeling like I don't have the right to use it in my own home is just cruel.","[{'start': 130, 'end': 140, 'entity_type': 'LOCATION', 'text': '<LOCATION>', 'operator': 'replace'}]"
146,"Not sure if this helps, but as a paraplegic, the worst part of it is having to pee with a catheter. It's a fucking hassle and I hate it. The not bieng able to walk part, I can live with.

Also, having sensitivity on my dick and being able to get it up without Viagra would be great.",,,,JimmyJamesincorp,,,1473346890,t5_2qhe8,t3_51qaen,t3_51qaen,2,1475452186,0,0,d7e924j,disability,2,,,,
147,"File a medical necessity appeal, you can google template forms. *Write it yourself.* Your doctor will likely have to sign off on it and fax it in from the office (at least, that was the process with a medication I appealed) and you'll have much more time to write the letter than the physician will. When you do, make sure to word it firmly and strongly, but not aggressively or rude. If it has to come from your physician, write it from their point of view. Outline the current standards of treatment, all the treatments the patient has tried and failed off of, requiring the chair you're requesting, and describe how each feature is medically necessary and will either improve your function or prevent future disability and pain. Include your medical records, relevant assessments, a list of clinical references and published peer-reviewed literature. Highlight summary statements from the research papers abstract or conclusion. Good luck!",,,,zebra-stampede,,,1474322551,t5_2qhe8,t3_53jzpq,t3_53jzpq,3,1475849384,0,0,d7tr4xv,disability,3,,,,
148,"You're mother would have to be *on* SSDI for you to qualify based on her earnings record. 

SSI is a needs based program that has the same medical qualification rules as SSDI but, since it is ""needs based"" there are strict limits as to how much extra money you can have. You cannot have more than $2K in cash or other assets (excluding primary house and car and some other possessions) otherwise you will be disqualified. ",,,,RambleRamble,SSI/SSDI Examiner,,1473780664,t5_2qhe8,t3_52gv12,t1_d7l09vq,1,1475628587,0,0,d7l2yl6,disability,1,,,,
149,"Yeah, her abortion stance had a pro-eugenics perspective and her view on disability was mostly preventative, rather than social model-type awesomeness. Still impressive for the front page, though.",,,,Alwayswrite64,,,1474795914,t5_2qhe8,t3_54e7az,t1_d814xn7,3,1476033891,0,0,d81595q,disability,3,,,,
150,"I'd certainly be asking them to show me what's so different about a seat on a plane vs one in my living room. 

Since I'm under no obligation to remain in the US if I collect SSDI getting to another country shouldn't be a deal breaker. ",,,,Frugalista1,,,1474266991,t5_2qhe8,t3_5379w2,t1_d7sqci2,2,1475827777,0,0,d7suo1k,disability,2,,,"I'd certainly be asking them to show me what's so different about a seat on a plane vs one in my living room. 

Since I'm under no obligation to remain in the <LOCATION> if I collect SSDI getting to another country shouldn't be a deal breaker. ","[{'start': 159, 'end': 169, 'entity_type': 'LOCATION', 'text': '<LOCATION>', 'operator': 'replace'}]"
151,"These are really unattractive. I'd rather just carry my shit in a bag and wear something that looks better.

Tips:

1. Design so that the pockets aren't obvious on the outside of the pants. Using a pocket of fabric vs. fabric sewn to the pant.

2. Find a better template for the pant itself. These are like 1980s-style sweatpants. They don't look good on anyone. For guys, look at something more like an athletic pant. For women- either loose yoga pants or athletic pants.

3. No elastic at the bottom. It's hard to tell, but just in case.",,,,endergrrl,,,1474738062,t5_2qhe8,t3_549i2e,t3_549i2e,1,1476013471,0,0,d80bmz9,disability,1,,,,
152,I throughly enjoy D&amp;D/Pathfinder/other RPG systems. I do better with shorter games (I have a few friends who prefer marathon sessions) and those that are either online with friends or close to home so that I'm not driving for an hour or two after exhausting myself. ,,,,IceMutt,H-EDS,,1473814872,t5_2qhe8,t3_52jl81,t3_52jl81,1,1475647470,0,0,d7lt7ua,disability,1,,,,
153,"I've been doing trial work for almost a year now to get my resume filled up again.  I get paid a stipend of $10/day, and I keep ALL of my benefits; *ALL* of them.

They can help you get a GED; it's just a matter of how bad you want it, or the money, as it were.",,,,atrociousness,"Type 1 Neurofibromatosis, Hydrocephalus, Severe Chronic Pain",,1473891111,t5_2qhe8,t3_52r0hu,t1_d7n0xg3,1,1475677605,0,0,d7n14db,disability,1,,,,
154,"Unfortunately, people do this because often their X-really-disabling-condition ISN'T enough, when it really should be.

I had a neighbor who had a horrific stroke. She was in the hospital for literally months. When she got out she couldn't talk, couldn't walk, feed, or bathe herself. She needed round-the-clock care.

It was months later before they applied for SSD, so well after the whole ""you must be disabled for X amount of time"" thing. SSD still freaking denied her the first time around. Because she might get better!",,,,BeastOGevaudan,,,1475098445,t5_2qhe8,t3_54alwi,t1_d80akvl,2,1476159404,0,0,d8635gw,disability,2,,,,
155,I believe it's bc they find that a person presenting with a mental disability may either be just suffering from the side effects of their continued use (which does not qualify you for benefits) or that it may mask both the true level of mental instability as well as benefits gained from treatment. ,,,,Frugalista1,,,1473447977,t5_2qhe8,t3_51yosl,t3_51yosl,3,1475496804,0,0,d7g0m40,disability,3,,,,
156,"If I imply that her parents are narcissists, I don't think she will ever speak to me again. She has very low self esteem and she thinks that her mom has all the rights to control her like this. ",,,,cakez_,,,1473429587,t5_2qhe8,t3_51trer,t1_d7fk7fb,1,1475487159,0,0,d7fmhtg,disability,1,,,,
157,"I. Like the idea of it, though don't know how to suggest going about getting it done, sorry.",,,,Silly_Christians,You based all your holidays off of pagan holidays!,,1473562770,t5_2qhe8,t3_51qaen,t3_51qaen,1,1475542614,0,0,d7hqtcu,disability,1,,,"<PERSON> Like the idea of it, though don't know how to suggest going about getting it done, sorry.","[{'start': 0, 'end': 8, 'entity_type': 'PERSON', 'text': '<PERSON>', 'operator': 'replace'}]"
158,"Well, if my claim is doubtful despite the fact that multiple specialists have diagnosed my condition as ""severe"", as supported by numerous x-rays and MRIs, then I suppose I probably am screwed.  Given the way the world operates these days, I won't be the least surprised.  

Thanks again for taking the time to comment.",,,,SavannahWinslow,,,1474481433,t5_2qhe8,t3_53fh0g,t1_d7w2djl,2,1475914481,0,0,d7wbxoy,disability,2,,,,
159,I was always way more into Laura Bridgman too! Lived not too far from where she did.  ,,,,HereticalHawk,,,1474870989,t5_2qhe8,t3_54e7az,t1_d81si93,1,1476064622,0,0,d82ceov,disability,1,,,I was always way more into <PERSON> too! Lived not too far from where she did.  ,"[{'start': 27, 'end': 35, 'entity_type': 'PERSON', 'text': '<PERSON>', 'operator': 'replace'}]"
160,"Exactly. I'm a Marxist myself (Idk about the author), so I was really glad to see this. It's a large part of why disability is so often seen as an innate flaw, rather than the complex combination of ability and social interaction that it is.",,,,Alwayswrite64,,,1472783346,t5_2qhe8,t3_50p77x,t1_d768tbx,1,1475253925,0,0,d769u8k,disability,1,,,,
161,"I think that you are causing yourself to panic for no reason and sometimes irrational thoughts can be our worst enemy.  So, how many hours were you working a week?  I used to work with people who had disabilities and I worked with the disabilities office and DHS etc.  Each state can be different, as well as it has been a few years so laws may have changed.  From what I remember, you do have to let the disability run out... but as long as you have been keeping in touch with them and they know what is going on, your case will have been updated and the information should be logged in your file and trust me.... if you owed them, you would have known about it already.  Congrats on pulling life together and holding down a job!  That may not sound like much for some people, but when you struggle with mental health issues it is a big mile marker!  Keep up the good work! I think you are worrying for nothing and when you start having those anxious thoughts, stop thinking about it... focus on what is good in your life and find something to occupy your thoughts that are healthy. :-)  Good Luck!",,,,ImUnapologetic,,,1473729399,t5_2qhe8,t3_52hpe7,t3_52hpe7,3,1475609678,0,0,d7kdr3s,disability,3,,,,
162,I don't know how that works in the UK. I'm in the USA with private insurance so I would just find a psychologist who does testing and expect to pay a percentage of what they charge. I don't know what services are available there either but my local library offers free tutoring to illiterate adults. It may also be worth looking into the lack of motivation. If she doesn't show emotion or desire over anything it could be depression or something like that.,,,,isaac_the_robot,"anxiety disorder, delayed sleep phase, depression, crohn's",,1475174207,t5_2qhe8,t3_54yet0,t1_d877shc,1,1476187731,0,0,d878p72,disability,1,,,I don't know how that works in the <LOCATION>. I'm in the <LOCATION> with private insurance so I would just find a psychologist who does testing and expect to pay a percentage of what they charge. I don't know what services are available there either but my local library offers free tutoring to illiterate adults. It may also be worth looking into the lack of motivation. If she doesn't show emotion or desire over anything it could be depression or something like that.,"[{'start': 58, 'end': 68, 'entity_type': 'LOCATION', 'text': '<LOCATION>', 'operator': 'replace'}, {'start': 35, 'end': 45, 'entity_type': 'LOCATION', 'text': '<LOCATION>', 'operator': 'replace'}]"
163,"And yet in my case they both knew I want to go to college, and later work. SSI for me is a starting point, a way to help me live until I can get a job and get off.  

I haven't had any problems due to what I am going to do, but then again I am also legally blind which is black and white. There is no getting better besides a cure. ",,,,charliemyheart,"blind, TBI",,1474705399,t5_2qhe8,t3_53g7b1,t1_d7yk401,2,1476004390,0,0,d7zxkox,disability,2,,,,
164,"You can (and should) appeal to your landlord for a second spot. 

I'm sorry you have such a shit neighbor. I totally understand your and your neighbor's situations - I use a wheelchair somedays, but somedays I can walk short distances and either way it just pisses me off when I can't get a spot - but truly should be ""first come, first serve"", so you both should be asking for two disabled parking spots.  ",,,,Briannkin,Cerebral Palsy,,1473577302,t5_2qhe8,t3_51ydus,t3_51ydus,3,1475547696,0,0,d7hy1so,disability,3,,,,
165,Tell the disabilities office that the teacher said that you couldn't record and ask them to handle it before your next class. ,,,,UHaveNoPowerOverMe,Narcolepsy,,1473786820,t5_2qhe8,t3_52lj4i,t3_52lj4i,3,1475632377,0,0,d7l7z19,disability,3,,,,
166,"If you don't mind me asking what type of evidence did you have for your case? I have depression, anxiety, and get panic attacks from PTSD however I have no medical records of my PTSD because just the thought of even talking to a doctor about my PTSD triggers flashbacks. ",,,,Melting_Phoenix,"RA, neuropathy, broken spine, depression, PTSD, etc.",,1473774697,t5_2qhe8,t3_52gv12,t1_d7kn3o1,1,1475625251,0,0,d7kylvc,disability,1,,,,
167,"People who are legitimately disabled can do whatever they want with their money. That is different than giving someone money because they are an addict. Some addicts are mentally ill, but not all of them. Some people are just addicts. 

I understand that my credibility is limited in this sub because people see me as part of ""the system"". But a DAA denial is still rare. I would say in 100, maybe 1 or 2 will fall into this category. And you and I both ""live in it"" in different ways. You have your experience (and maybe a few other friends/family) and that is what you extrapolate to ALL social security. You claim to know how the system works but then discount the advice of someone who spends 40+ hours a week administering the system. I'm the first to say that there are flaws in the system; my correcting misconceptions on the internet doesn't make me a shill. ",,,,RambleRamble,SSI/SSDI Examiner,,1473460062,t5_2qhe8,t3_51yosl,t1_d7g3ze3,2,1475503025,0,0,d7g9i9g,disability,2,,,,
168,"Great, we've actually talked about doing a video on pedal lengtheners or pedal extensions as we call them. Arm controlled steering wheel I guess can be done as simply as a steering device in which you attach your arm and as complicated as electronic steering. We don't do the latter but we certainly do the first. I'll add it to our todo list. 

Door opening presets aren't really products that we sell but our inhouse adaptation workshop do them ever so often. In short we should be be able to do a video on this. 

The door holder I haven't even heard of, but maybe it's a product worth developing. 
Thanks for your input! ",,,,Makkan77,,,1474014956,t5_2qhe8,t3_52vfyr,t1_d7o6xd3,1,1475729617,0,0,d7ozwmn,disability,1,,,,
169,Very experienced D&amp;D player here.  Anyone who can't find a group in person can play on Roll20.com!,,,,quigonjen,,,1473803410,t5_2qhe8,t3_52jl81,t3_52jl81,2,1475642105,0,0,d7llfw9,disability,2,,,Very experienced D&amp;D player here.  Anyone who can't find a group in person can play on <URL>!,"[{'start': 91, 'end': 96, 'entity_type': 'URL', 'text': '<URL>', 'operator': 'replace'}]"
170,"You've go a lot in there, so I'll try to kind of go through point by point

You are not going to be eligible for SSDI because of your lack of work history; unless you have a parent that is deceased, retired, or disabled. You're SSI eligibility will depend on your assets. You cannot apply for SSI online; you'll need to contact your local FO to set up an appointment (in phone or in person)

Form what information you've given, honestly, you probably won't medically qualify. As the other poster said, it is more about functional limitations than diagnosis. BUT you still have to have a medically determinable impairment (MDI) that could *reasonably* cause your reported limitations. 

Your main complaints seem to be back/neck and feet. I'll just tell you know that your allergies and blood pressure will not come into play. Each are controlled with medications and they aren't going to cause significant work related limitations. 

The problem with your musculoskeletal complaints is that you really don't have that diagnosis (MDI); muscle spams are a symptom of a problem not a condition in themselves. The fact that you've had normal X-rays and MRIs (along with your foot complaints) leads me to believe that this is more of a physiological condition. Either related to deconditioning (you are obese but at your age your body can overcome that a bit), posture, or your activity level. Did all of this get worse after you started mowing? If you already had poor posture/conditioning and you threw yourself into physical work it is going to make the situation worse 

Your information sounds familiar; I""m thinking that you have PM'd me before. I do think that you need to seek out additional medical treatment. Stop going to that chiropractor - he is just going to keep trying to sell you things and you need a physical therapist (they are NOT the same). Also, chiropractors are not considered ""acceptable medical sources"" per SSA guidelines; so even if he did diagnose you SSA can't use it. Only certain MDs can give medical diagnoses and opinions; this does exclude PT providers but their information can still be used.

 I would also encourage you to see a psychiatrist or a therapist. The human body is amazing and infuriating at the same time; there is a very strong connection between our mental health and our physical well-being. Untreated depression and anxiety can cause chronic pain, or a least exacerbate minor issues. Your description of the neck muscle spasms and chronic headaches (without physical explanation) makes me think that you are under a great deal of stress or anxiety? You are seeking for explanation with all these specialists (which is fine, you do need to rule out something serious) but a lot of times the explanations are much simpler. Take care of your mental health, work on your body mechanics, and work on conditioning and I suspect a lot of this would get better.  ",,,,RambleRamble,SSI/SSDI Examiner,,1472995228,t5_2qhe8,t3_513e7i,t3_513e7i,3,1475323254,0,0,d792h0g,disability,3,,,,
171,"Thank you! I was worried about the possible money and legal red tape involved in getting a specialized space, I think a reserved space for me is a god compromise. ",,,,jenOHside,"gastroparesis, RA, Lupus, POTS",,1473635446,t5_2qhe8,t3_51ydus,t1_d7gxpye,3,1475569858,0,0,d7iu3cc,disability,3,,,,
172,Meant to reply to this. I got permission for one class. Still waiting on the other. The disability office said they would sort it out with the professor when I told them what happened. ,,,,justademonindisguise,ADHD &amp; Schizophrenic,,1473996245,t5_2qhe8,t3_52momh,t1_d7njik5,1,1475724349,0,0,d7osdzd,disability,1,,,,
173,"I am so sorry to hear that :( I just am told that sub has been very helpful and supportive for people with parents that stymie them, and thought it may be a good resource. I wish I had a better suggestion that could help! :-/ Maybe encouraging her to reach in forums like this would help her, even just to lurk. I know they've helped me a lot with many things! Maybe she'll have some luck connecting to more people and feeling stronger in herself. ",,,,tinymoroke,,,1473437966,t5_2qhe8,t3_51trer,t1_d7fmhtg,1,1475491405,0,0,d7fsr3i,disability,1,,,,
174,"I say that I'm disabled, all these new terms really bother me and distract from the reality of the situation. Person-first language is also awkward.",,,,mailboy79,,,1474243824,t5_2qhe8,t3_53asuy,t3_53asuy,2,1475819106,0,0,d7shh2j,disability,2,,,,
175,"This is a libertarian website, just so everyone knows. No wonder it's paradoxically overwritten and poorly thought out. ",,,,FaceofMoe,,,1475116565,t5_2qhe8,t3_545sy5,t3_545sy5,1,1476167702,0,0,d86ezzt,disability,1,,,,
