,body,score_hidden,archived,name,author,author_flair_text,downs,created_utc,subreddit_id,link_id,parent_id,score,retrieved_on,controversiality,gilded,id,subreddit,ups,distinguished,author_flair_css_class,anonymized_body,anonymized_masks
562,"Yes a review afterbonlyb1 and a half years.

My feelings and fears reflect yours. Same concerns. No, I did not get 3 full years before my first CDR. The Award Letter typed by the Judge states something to the effect of ""Expectation of improvement with time"" : In my unique case, they saw me as a Druggie Alcoholic first, Mentally Ill second, and believe that many of my cognitive impairments and mental illnesses are the direct or indirect result of getting drunk, stoned, etc. way too much. In cases where there is Substance Abuse, only refer to ALCOHOL. Not Coke or Weed or whatever you really consumed for a buzz. 

Alcohol IS LEGAL. Everything else is ILLEGAL=Bad for your Case if you admit to any non-prescribed drug use. I noticed my attorney referring SOLELY to my alcohol abuse(In reality I never liked Alcohol, and I was smoking weed after the last day of my last job. This hurt the amount of Retroactive Backpay I received.

   Yes, in many cases, like what you'll see in a long term residential drug rehab, the guys who have a couple months under their belts are looking and feeling and thinking better than the people who have only been there for one week. Their brain chemistry is all messed up at first.  However, I filed my claim in Spring of 2012 while in a Psych Ward with assistance of a Social Worker, and my Hearing was in 2015. That 3 years apart. A 3 year wait. If I was gonna improve from the Post Acute Withdrawls or brain fog, (Cognitive Impairment from drugs) it would've happened already within that three-year time frame. I left important details out of my original post. And it is a grammatical mess. Sorry. This will be sloppy too.

My ""Win"" was really like a compromise, meaning my benefits could have a short lifespan(maybe this was the only way I couldve won?)-some 12 Step AA /NA Halfway House Member/ Owner Cult Member/Fanatical Book Club Member AND Psychologist was there via Speakerphone and he commended me on my continued Sobriety and stated I had the deck stacked against me in my lifelong situations, but BECAUSE I WAS STILL SOBER-A TERM OF RECEIVING BENEFITS, He equated this with improvement in ALL AREAS of my Life-or so it seemed. The whole Bio-Psycho-Social Spectrum. I need to address this I will pull out the Award Letter from the Judge later. He, the Government Psychologist, is a Devout member of 12 Step (I AM NOT A MEMBER) and the weight of my case hinged on this Psychologist's testimony-Based on the Judge's notes in the Award Letter, that it was clear that I was so bad off mentally that I even had real trouble speaking or answering questions verbally...

. A Wellbutrin Overdose (ACCIDENTAL) coupled with an Energy Drink overdose (UNINTENTIONAL) had me feeling very ill. I was trying to ensure that I was awake and alert for the Hearing and didn't oversleep. I didn't sleep at all.. I was sick for a couple more days after that. I hate Bupropion for its so called 'Side' Effects, yet it is the Best Antidepressant I've responded to in 19 years(Excluding Ritalin &amp; Adderall because they are not indicated for Treating Depression.) SSRIs do nothing, at best, or they make me feel sick. Zoloft evem triggered a Full BAD LSD flashback the final time I tried a dose. I will never touch any other Antidepressant, ever again.

Yes, in most typical Mental Health cases, reviews are conducted 3 years later, after the Hearing date. I'm not in that boat. 

I even skated on VERY THIN ICE by doing some light, easy, ""fake"" office File Clerk work FOR PAY for a year or so right until the Hearing(I was basically coerced into working by my Landlord and it nearly blew up in my face at the Hearing). My Attorney and I explained that the job was only a few hours per week and I got to come in and leave the Accounting Office (Of a Drug Rehab-see a theme?) whenever I felt like it and didn't have to work at all if I was having a ""bad day"". The whole, real, reason that I was given the job was partly Clinical in nature-to get me to stop isolating in my apartment,and interact with people, and also contribute something to  ""give back"" to the Rehab that I had been a Resident in for 4 months before getting a real apartment with a real legally binding Lease.

 If I said ""No"" to the job, I may have lost my place and became homeless. The place I'm talking about is dirty: Incompetent, Corrupt, another 12 Step Based Recruitment Center with a tight clan at the Top Administration Level. It is a Glorified Homeless Shelter: No real Treatment is offered or provided. Counseling is a matter of Counselors filling out the necessary paperwork to keep the whole Operation up and running without losing (even more) funding or Grants. It is a SHADY 501(C)3 Rehab that clients get Stockholm Syndrome for if the are treated well. I once had this delusional thinking. I'm going on a Tangent but Rehab and 12 Step ARE THE SAME THING. THEY AREN'T SUPPOSED TO BE...But in the 1980's AA became the Monolithic sole source of ""Recovery"" from Addiction/Alcohol Abuse. If you are in AA or NA, and don't like this, know that I am not attacking the individual members. It is the Group, The Club, The 501(c)3 AAWS and NAWS that I have major issues with.

I stated to the judge who kept attacking me from all angles, that as long as I was out of my room and physically in the Accounting Office, they'd pay me Minimum Wage for my time present there. Which is  the truth. 

However, I did definitely do stuff that would be considered ""work"" by organizing tons of Accounting papers and putting them where they belonged in file cabinets. Do NOT do what I did.DO NOT WORK AT ALL UNDER ANY CIRCUMSTANCES WHEN AWAITING A DISABILITY HEARING. Not even light work. 

 I should have refused to work that job, which the CFO of the Rehab and my Landlord collaborated on to get me some busywork for the sake of doing something productive. And so it was less file work for the real, salaried employees. Work for work's sake. Why did my Landlord care what I was doing with my free time? Because at this nutty 12 Step Housing Complex, it is Subsidized Housing and considered a modified Section 8 deal. Not true Section 8. No Voucher to move elsewhere. But very similar. The Landlord wanted/needed to show to the County Housing Agency that I was doing something ""good"" and ""productive"" with my time. So my funding was justified. I wasn't just ""sleeping all day."" In truth, at least half of the Tenants do NOTHING all day, except go to Mandatory Group Meetings once per day.

The Landlord is all too familiar with Disability Cases, so my assumption is that she never thougnt I had a chance of winning my Case to begin with, based on my age, her potentially bigoted views, and her misunderstsnding of my work history and complete lack of comprehension of what is wrong with me. 

My problem is that on the outside, I can appear calm, focused, maybe even happy or ""normal"" , and functional as if nothing is wrong with me. My Landlord was being Pragmatic and making one of the Queen Bee's Drones leave the Hive to show evidence of some ""Rehabilitation"" and that I was trying to be a good productive member of Society, to an extent, which they could prove with Pay Stubs. Grrr...

What the Queen Bee failed to notice was that I was, at the the time, volunteering out in the Summer Florida Heat at a Wildlife Sanctuary, Aviary and Exotic  Animal exhibit at a Science Museum. I did that all on my own. No one asked me or told me to get an unpaid volunteer job. Yet I did, so I could be less Self-Incarcerated. 

More to come...someone is going to figure out the identity of this facility. I will not mention it by Name. Let its Staff Members and Board Of Trustees give me the grief. If you are an outsider or a Stepper, do not criticize me for not following the herd. Thank you. 

Be Well, Guys.",,,,channel35,,,1478877321,t5_2qhe8,t3_5cam3s,t1_d9vb53u,1,1481397005,0,0,d9vwblf,disability,,,,"Yes a review afterbonlyb1 and a half years.

My feelings and fears reflect yours. Same concerns. No, I did not get 3 full years before my first CDR. The Award Letter typed by the Judge states something to the effect of ""Expectation of improvement with time"" : In my unique case, they saw me as <PERSON>, Mentally Ill second, and believe that many of my cognitive impairments and mental illnesses are the direct or indirect result of getting drunk, stoned, etc. way too much. In cases where there is Substance Abuse, only refer to ALCOHOL. Not Coke or Weed or whatever you really consumed for a buzz. 

Alcohol IS LEGAL. Everything else is ILLEGAL=Bad for your Case if you admit to any non-prescribed drug use. I noticed my attorney referring SOLELY to my alcohol abuse(In reality I never liked Alcohol, and I was smoking weed after the last day of my last job. This hurt the amount of Retroactive Backpay I received.

   Yes, in many cases, like what you'll see in a long term residential drug rehab, the guys who have a couple months under their belts are looking and feeling and thinking better than the people who have only been there for one week. Their brain chemistry is all messed up at first.  However, I filed my claim in Spring of 2012 while in a Psych Ward with assistance of a Social Worker, and my Hearing was in 2015. That 3 years apart. A 3 year wait. If I was gonna improve from the Post Acute Withdrawls or brain fog, (Cognitive Impairment from drugs) it would've happened already within that three-year time frame. I left important details out of my original post. And it is a grammatical mess. Sorry. This will be sloppy too.

My ""Win"" was really like a compromise, meaning my benefits could have a short lifespan(maybe this was the only way I couldve won?)-some 12 Step AA /NA Halfway House Member/ Owner Cult Member/Fanatical Book Club Member AND Psychologist was there via Speakerphone and he commended me on my continued Sobriety and stated I had the deck stacked against me in my lifelong situations, but BECAUSE I WAS STILL SOBER-A TERM OF RECEIVING BENEFITS, He equated this with improvement in ALL AREAS of my Life-or so it seemed. The whole Bio-Psycho-Social Spectrum. I need to address this I will pull out the Award Letter from the Judge later. He, the Government Psychologist, is a Devout member of 12 Step (I AM NOT A MEMBER) and the weight of my case hinged on this Psychologist's testimony-Based on the Judge's notes in the Award Letter, that it was clear that I was so bad off mentally that I even had real trouble speaking or answering questions verbally...

. A Wellbutrin Overdose (ACCIDENTAL) coupled with an Energy Drink overdose (UNINTENTIONAL) had me feeling very ill. I was trying to ensure that I was awake and alert for the Hearing and didn't oversleep. I didn't sleep at all.. I was sick for a couple more days after that. I hate Bupropion for its so called 'Side' Effects, yet it is the Best Antidepressant I've responded to in 19 years(Excluding Ritalin &amp; Adderall because they are not indicated for Treating Depression.) SSRIs do nothing, at best, or they make me feel sick. <PERSON> evem triggered a Full BAD LSD flashback the final time I tried a dose. I will never touch any other Antidepressant, ever again.

Yes, in most typical Mental Health cases, reviews are conducted 3 years later, after the Hearing date. I'm not in that boat. 

I even skated on VERY THIN ICE by doing some light, easy, ""fake"" office File Clerk work FOR PAY for a year or so right until the Hearing(I was basically coerced into working by my <PERSON> and it nearly blew up in my face at the Hearing). My Attorney and I explained that the job was only a few hours per week and I got to come in and leave the Accounting Office (Of a Drug Rehab-see a theme?) whenever I felt like it and didn't have to work at all if I was having a ""bad day"". The whole, real, reason that I was given the job was partly Clinical in nature-to get me to stop isolating in my apartment,and interact with people, and also contribute something to  ""give back"" to the <LOCATION> that I had been a Resident in for 4 months before getting a real apartment with a real legally binding Lease.

 If I said ""No"" to the job, I may have lost my place and became homeless. The place I'm talking about is dirty: Incompetent, Corrupt, another 12 Step Based Recruitment Center with a tight clan at the Top Administration Level. It is a Glorified Homeless Shelter: No real Treatment is offered or provided. Counseling is a matter of Counselors filling out the necessary paperwork to keep the whole Operation up and running without losing (even more) funding or Grants. It is a SHADY 501(C)3 Rehab that clients get Stockholm Syndrome for if the are treated well. I once had this delusional thinking. I'm going on a Tangent but <LOCATION> and 12 Step ARE THE SAME THING. THEY AREN'T SUPPOSED TO BE...But in the 1980's AA became the Monolithic sole source of ""Recovery"" from Addiction/Alcohol Abuse. If you are in AA or NA, and don't like this, know that I am not attacking the individual members. It is the Group, The Club, The 501(c)3 AAWS and NAWS that I have major issues with.

I stated to the judge who kept attacking me from all angles, that as long as I was out of my room and physically in the Accounting Office, they'd pay me Minimum Wage for my time present there. Which is  the truth. 

However, I did definitely do stuff that would be considered ""work"" by organizing tons of Accounting papers and putting them where they belonged in file cabinets. Do NOT do what I <URL> NOT WORK AT ALL UNDER ANY CIRCUMSTANCES WHEN AWAITING A DISABILITY HEARING. Not even light work. 

 I should have refused to work that job, which the CFO of the <LOCATION> and my <PERSON> collaborated on to get me some busywork for the sake of doing something productive. And so it was less file work for the real, salaried employees. Work for work's sake. Why did my <PERSON> care what I was doing with my free time? Because at this nutty 12 Step Housing Complex, it is Subsidized Housing and considered a modified Section 8 deal. Not true Section 8. No Voucher to move elsewhere. But very similar. The <PERSON> wanted/needed to show to the County Housing Agency that I was doing something ""good"" and ""productive"" with my time. So my funding was justified. I wasn't just ""sleeping all day."" In truth, at least half of the Tenants do NOTHING all day, except go to Mandatory Group Meetings once per day.

The <PERSON> is all too familiar with Disability Cases, so my assumption is that she never thougnt I had a chance of winning my Case to begin with, based on my age, her potentially bigoted views, and her misunderstsnding of my work history and complete lack of comprehension of what is wrong with me. 

My problem is that on the outside, I can appear calm, focused, maybe even happy or ""normal"" , and functional as if nothing is wrong with me. My <PERSON> was being Pragmatic and making one of the Queen Bee's Drones leave the Hive to show evidence of some ""Rehabilitation"" and that I was trying to be a good productive member of Society, to an extent, which they could prove with Pay Stubs. Grrr...

What the Queen Bee failed to notice was that I was, at the the time, volunteering out in the Summer <LOCATION> Heat at <LOCATION>, Aviary and Exotic  Animal exhibit at a Science Museum. I did that all on my own. No one asked me or told me to get an unpaid volunteer job. Yet I did, so I could be less Self-Incarcerated. 

More to <URL>meone is going to figure out the identity of this facility. I will not mention it by Name. Let its Staff Members and Board Of Trustees give me the grief. If you are an outsider or a Stepper, do not criticize me for not following the herd. Thank you. 

Be Well, Guys.","[{'start': 7508, 'end': 7513, 'entity_type': 'URL', 'text': '<URL>', 'operator': 'replace'}, {'start': 7297, 'end': 7307, 'entity_type': 'LOCATION', 'text': '<LOCATION>', 'operator': 'replace'}, {'start': 7278, 'end': 7288, 'entity_type': 'LOCATION', 'text': '<LOCATION>', 'operator': 'replace'}, {'start': 6924, 'end': 6932, 'entity_type': 'PERSON', 'text': '<PERSON>', 'operator': 'replace'}, {'start': 6481, 'end': 6489, 'entity_type': 'PERSON', 'text': '<PERSON>', 'operator': 'replace'}, {'start': 6177, 'end': 6185, 'entity_type': 'PERSON', 'text': '<PERSON>', 'operator': 'replace'}, {'start': 5941, 'end': 5949, 'entity_type': 'PERSON', 'text': '<PERSON>', 'operator': 'replace'}, {'start': 5752, 'end': 5760, 'entity_type': 'PERSON', 'text': '<PERSON>', 'operator': 'replace'}, {'start': 5734, 'end': 5744, 'entity_type': 'LOCATION', 'text': '<LOCATION>', 'operator': 'replace'}, {'start': 5567, 'end': 5572, 'entity_type': 'URL', 'text': '<URL>', 'operator': 'replace'}, {'start': 4818, 'end': 4828, 'entity_type': 'LOCATION', 'text': '<LOCATION>', 'operator': 'replace'}, {'start': 4073, 'end': 4083, 'entity_type': 'LOCATION', 'text': '<LOCATION>', 'operator': 'replace'}, {'start': 3573, 'end': 3581, 'entity_type': 'PERSON', 'text': '<PERSON>', 'operator': 'replace'}, {'start': 3128, 'end': 3136, 'entity_type': 'PERSON', 'text': '<PERSON>', 'operator': 'replace'}, {'start': 294, 'end': 302, 'entity_type': 'PERSON', 'text': '<PERSON>', 'operator': 'replace'}]"
563,"The ALJ should have all your records already, unless you've been treated somewhere and didn't tell the government, in which case, call the ALJ office and tell them. It would be a waste of your time and money to submit stuff they already have. If it is old stuff outside the relevant time frame, they won't even look at it.

Getting statements from your doctors is a good idea, but make sure they back up their statements with the reasons why they come to those conclusions.

Otherwise just be as honest and detailed as possible, and know that everything will be looked at as a whole - multiple pieces of stand-alone evidence plus testimony creates the whole picture.",,,,spicyshazam,"Disability Examiner, Hearing Officer (DHO)",,1478210574,t5_2qhe8,t3_5ayktc,t3_5ayktc,1,1481189787,0,0,d9kmfca,disability,,,,,
564,Adjusting to a new normal is hard. Cognitive behavioral therapy and self compassion can go a long way in getting you to a place where you can accept the changes and move through life. ,,,,mixedmaterials,Cerebral Palsy,,1478704452,t5_2qhe8,t3_5bykee,t3_5bykee,2,1481340627,0,0,d9sw66l,disability,,,,,
565,"You could spend this time learning about different philosophies so that you can find your life's meaning. I personally am Buddhist by choice and Nihilistic by nature so I just try to find beauty and joy where I can, but I don't believe that my life has a purpose. Take care of yourself, if you have energy left after that offer what you can to others even if that is only a kind word over the internet.",,,,asknanners12,PTSD/MDD/GAD/BPD/MISC.,,1480205123,t5_2qhe8,t3_5eyf24,t3_5eyf24,3,1481775981,0,0,dagxmge,disability,,,,,
566,"You cannot apply now since you are under 18. Your father or mother would need to apply for you and they would have to meet all financial qualifications for the program. You have said your dad makes too much money so you won't qualify for the program. 

Your best bet is to just wait until you are 18 to apply.",,,,RambleRamble,SSI/SSDI Examiner,,1478521070,t5_2qhe8,t3_5bguy0,t1_d9p5bf4,1,1481277608,0,0,d9pg0mg,disability,,,,,
567,"Maybe you can try voice commands when your father is able to speak (I don't know). Install the app ""Google Voice Access"" on a Chromecast device who is plugged in your TV ( Costs: 35$/39€). I hope i helped you.",,,,picard47,,,1480083350,t5_2qhe8,t3_5eru39,t3_5eru39,1,1481742360,0,0,daf23az,disability,,,,"Maybe you can try voice commands when your father is able to speak (I don't know). Install the app ""Google Voice Access"" on a <LOCATION> device who is plugged in your TV ( Costs: 35$/39€). I hope i helped you.","[{'start': 126, 'end': 136, 'entity_type': 'LOCATION', 'text': '<LOCATION>', 'operator': 'replace'}]"
568,"Send a nicely worded letter to the lot manager stating legally applying the ADA Act on him. 

ADA Act: The ADA is a civil rights law that prohibits discrimination against individuals with disabilities in all areas of public life, including jobs, schools, transportation, and all public and private places that are open to the general public. https://adata.org/learn-about-ada",,,,randyco,,,1480535287,t5_2qhe8,t3_5fr526,t3_5fr526,5,1481885140,0,0,damhajs,disability,,,,"Send a nicely worded letter to the lot manager stating legally applying the ADA Act on him. 

ADA Act: The ADA is a civil rights law that prohibits discrimination against individuals with disabilities in all areas of public life, including jobs, schools, transportation, and all public and private places that are open to the general public. <URL>","[{'start': 342, 'end': 347, 'entity_type': 'URL', 'text': '<URL>', 'operator': 'replace'}]"
569,You should google around to see if you have any disability advocacy groups in your area or affiliated with your local hospital or your surgeon may even know some. They likely have info. Otherwise you likely have some community legal aid resources nearby who might also be able to assist you or point you in the right direction. ,,,,zebra-stampede,,,1478559302,t5_2qhe8,t3_5bpasq,t1_d9q8iak,1,1481291769,0,0,d9q8ulv,disability,,,,,
570,I really liked how you described it.,,,,THCx,,,1480148892,t5_2qhe8,t3_5eyf24,t1_dag2sxx,3,1481761123,0,0,dag3um0,disability,,,,,
571,"I consider myself disabled. I have Postural Orthostatic Tachycardia Syndrome and Ehlers-Danlos Syndrome, both severe. I faint all the time and walking even short distances is not only painful, but makes me tachychardic. However, because I look able bodied, it has been incredibly difficult for me to get accommodation, which is why I feel it is important for me to own my disabled status and make it clear that this is not an inconvenience, this is a disability that requires accommodation. That being said, I always decline to answer if they ask that question prior to hire. As much as they say they don't discriminate, I always worry about unconscious bias. ",,,,forgotmypasswoops,,,1478141821,t5_2qhe8,t3_5ar0ko,t3_5ar0ko,1,1481167983,0,0,d9jekb5,disability,,,,"I consider myself disabled. I have Postural Orthostatic Tachycardia Syndrome and <PERSON>, both severe. I faint all the time and walking even short distances is not only painful, but makes me tachychardic. However, because I look able bodied, it has been incredibly difficult for me to get accommodation, which is why I feel it is important for me to own my disabled status and make it clear that this is not an inconvenience, this is a disability that requires accommodation. That being said, I always decline to answer if they ask that question prior to hire. As much as they say they don't discriminate, I always worry about unconscious bias. ","[{'start': 81, 'end': 89, 'entity_type': 'PERSON', 'text': '<PERSON>', 'operator': 'replace'}]"
572,Hellow new kid on the block.  Welcome!,,,,Maddisonic,,,1479365430,t5_2qhe8,t3_5d7gms,t3_5d7gms,1,1481542355,0,0,da3x53y,disability,,,,,
573,"Hah! Ya man, just wanted to give credit where its due ;) I figured this community would appreciate seeing this just in case they dont see your original post for some reason. Thanks for finding and posting it!",,,,SmallManBigMouth,,,1479369205,t5_2qhe8,t3_5dekin,t1_da3xxpz,6,1481543018,0,0,da3yipw,disability,,,,,
574,"It's impossible for me to estimate your chances of approval without seeing your medical record.  However, in my experience, a person with a diagnosis of BPD in addition to MDD and Anxiety has a greater chance of getting approved.  Once again, it all depends on the record though.",,,,DrMuffinPHD,SSA ODAR Attorney,,1479223937,t5_2qhe8,t3_5b2txz,t1_da0rxfy,2,1481496582,0,0,da1c4rq,disability,,,,,
575,"I think it depends on the disability office. I send out questionnaires on every CDR. If, when you provided your sources for the past year, you reported hospitalizations, maybe they decided not to send out the Qs, and were able to continue you without them. Consider yourself lucky!",,,,spicyshazam,"Disability Examiner, Hearing Officer (DHO)",,1478835317,t5_2qhe8,t3_5cbsg1,t3_5cbsg1,3,1481386727,0,0,d9vdb6b,disability,,,,,
