,body,score_hidden,archived,name,author,author_flair_text,downs,created_utc,subreddit_id,link_id,parent_id,score,retrieved_on,controversiality,gilded,id,subreddit,ups,distinguished,author_flair_css_class,anonymized_body,anonymized_masks
440,"Your [submission](https://www.reddit.com/r/disability/comments/53ze8a/medical_disability_campaign_help/) in /r/disability was automatically removed because you linked to a fundraising website.
By consensus the /r/disability community has decided to disallow individual fundraising appeals. See /r/Assistance, /r/Care or 
[other subreddits](http://www.reddit.com/r/Assistance/comments/1hexgp/other_subreddits_that_can_help_you/)  that can help. 

*I am a bot, and this action was performed automatically. Please [contact the moderators of this subreddit](/message/compose/?to=/r/disability) if you have any questions or concerns.*",,,,AutoModerator,,,1474556882,t5_2qhe8,t3_53ze8a,t3_53ze8a,1,1475943927,0,0,d7xird2,disability,1,moderator,,"Your [submission](<URL>) in /r/disability was automatically removed because you linked to a fundraising website.
By consensus the /r/disability community has decided to disallow individual fundraising appeals. See /r/Assistance, /r/Care or 
[other subreddits](<URL>)  that can help. 

*I am a bot, and this action was performed automatically. Please [contact the moderators of this subreddit](/message/compose/?to=/r/disability) if you have any questions or concerns.*","[{'start': 260, 'end': 265, 'entity_type': 'URL', 'text': '<URL>', 'operator': 'replace'}, {'start': 18, 'end': 23, 'entity_type': 'URL', 'text': '<URL>', 'operator': 'replace'}]"
441,"Hello, /u/deandrewjones. 

Your submission has been removed because:

You violated the following rule of /r/disability.

&gt; Rule 4 - [Message the mods](http://www.reddit.com/message/compose?to=/r/disability) before posting a survey. Any unapproved survey will be removed. Surveys are also required to be in a self-post which must include information about the survey, the surveyor, the data being collected, and how the data will used. 



---

If you have any questions or concerns, please [message the moderators](http://www.reddit.com/message/compose?to=%2Fr%2Fdisability&amp;amp;subject=About my removed submission&amp;amp;message=I'm writing to you about the following submission: https://www.reddit.com/r/disability/comments/548liu/hey_guys_i_really_need_you_help/ %0D%0DMy issue is...). *Direct replies to official mod comments will be removed.*",,,,bytester,C5 SCI,,1474723227,t5_2qhe8,t3_548liu,t3_548liu,1,1476007814,0,0,d802wly,disability,1,moderator,,"Hello, <USER>. 

Your submission has been removed because:

You violated the following rule of /r/disability.

&gt; Rule 4 - [Message the mods](<URL>) before posting a survey. Any unapproved survey will be removed. Surveys are also required to be in a self-post which must include information about the survey, the surveyor, the data being collected, and how the data will used. 



---

If you have any questions or concerns, please [message the moderators](<URL> my removed submission&amp;amp;message=I'm writing to you about the following submission: <URL> %0D%0DMy issue is...). *Direct replies to official mod comments will be removed.*","[{'start': 554, 'end': 559, 'entity_type': 'URL', 'text': '<URL>', 'operator': 'replace'}, {'start': 459, 'end': 464, 'entity_type': 'URL', 'text': '<URL>', 'operator': 'replace'}, {'start': 144, 'end': 149, 'entity_type': 'URL', 'text': '<URL>', 'operator': 'replace'}, {'start': 7, 'end': 13, 'entity_type': 'USER', 'text': '<USER>', 'operator': 'replace'}]"
442,"Those are completely normal questions for a disability hearing. The reason is that the law does not allow someone to collect benefits if substance abuse is the reason they are unable to work.

It is a bit more complicated than ivybelle mentioned. You can be found disabled even if you have issues with substance abuse/dependency. There is only a problem if substance abuse is material to the disability finding, i.e., you are not and would not be disabled when sober. 

Social Security provides [this guidance](https://www.ssa.gov/OP_Home/rulings/di/01/SSR2013-02-di-01.html) on evaluating materiality, which basically says:

1. If there are diagnosed substance abuse issues, determine if the individual is disabled when considering all issues - including the substance abuse.

2. If the individual is not disabled, no further evaluation needed.

3. If the individual is found disabled, determine if there are periods of sobriety that allow evaluation of the individual's functioning in the absence of substance abuse.

4. If they are not disabled during the periods of sobriety, then substance abuse is material and the individual is denied. 

5. If the person remains disabled even during periods of sobriety, they are awarded benefits. 

The policy is also setup so that if it's not clear whether substance abuse is material, Social Security is supposed to resolve that issue in the applicant's favor and award benefits. This would be the case when, for example, there are no periods of sobriety or the only periods of sobriety occur during intensive rehabilitation programs. 

That is at least how the policy is supposed to work.  ",,,,Zhenshanre,,,1473449290,t5_2qhe8,t3_51yosl,t3_51yosl,6,1475497501,0,0,d7g1mv8,disability,6,,,"Those are completely normal questions for a disability hearing. The reason is that the law does not allow someone to collect benefits if substance abuse is the reason they are unable to work.

It is a bit more complicated than ivybelle mentioned. You can be found disabled even if you have issues with substance abuse/dependency. There is only a problem if substance abuse is material to the disability finding, i.e., you are not and would not be disabled when sober. 

Social Security provides [this guidance](<URL>) on evaluating materiality, which basically says:

1. If there are diagnosed substance abuse issues, determine if the individual is disabled when considering all issues - including the substance abuse.

2. If the individual is not disabled, no further evaluation needed.

3. If the individual is found disabled, determine if there are periods of sobriety that allow evaluation of the individual's functioning in the absence of substance abuse.

4. If they are not disabled during the periods of sobriety, then substance abuse is material and the individual is denied. 

5. If the person remains disabled even during periods of sobriety, they are awarded benefits. 

The policy is also setup so that if it's not clear whether substance abuse is material, Social Security is supposed to resolve that issue in the applicant's favor and award benefits. This would be the case when, for example, there are no periods of sobriety or the only periods of sobriety occur during intensive rehabilitation programs. 

That is at least how the policy is supposed to work.  ","[{'start': 511, 'end': 516, 'entity_type': 'URL', 'text': '<URL>', 'operator': 'replace'}]"
443,"I'm east coast and my daughter gets paid on the first every month, but if it falls on a weekend it always comes the Friday before. I looked it up one time on the social security website, have you checked there? ",,,,1qmom,,,1475200423,t5_2qhe8,t3_553pri,t3_553pri,1,1476201203,0,0,d87rf8b,disability,1,,,,
444,This may work for bottle feeding - designed to be hands free: [http://www.thebeebo.com/pages/how-it-works](http://www.thebeebo.com/pages/how-it-works),,,,owlandfinch,,,1474256605,t5_2qhe8,t3_531jns,t3_531jns,1,1475824687,0,0,d7spyun,disability,1,,,This may work for bottle feeding - designed to be hands free: [<URL>(<URL>),"[{'start': 69, 'end': 74, 'entity_type': 'URL', 'text': '<URL>', 'operator': 'replace'}, {'start': 63, 'end': 68, 'entity_type': 'URL', 'text': '<URL>', 'operator': 'replace'}]"
445,"There's no such thing as temporary disability from SS. Are you getting Medicaid or Medicare? 

Everyone who collects benefits is reviewed occasionally to be sure they haven't been cured. ",,,,Frugalista1,,,1474618514,t5_2qhe8,t3_54183s,t3_54183s,2,1475972195,0,0,d7ymadi,disability,2,,,,
446,"you said you used an ""advocate"".         
If you're not already using a disability lawyer that specializes in SSDI, why aren't you?  The one I used worked on contengency (no up front payment) and took a percentage of my back payment I got from SSDI when it was approved.      
even with a lawyer, I was denied once, but won on appeal.      
I had to write out a list of *every* symptom I had, not diagnosis, but symptom which interfered with daily life.      
",,,,whatRwegonnado,,,1474559403,t5_2qhe8,t3_53tbsj,t3_53tbsj,1,1475945358,0,0,d7xkqu0,disability,1,,,,
447,"You can try and find another doctor for testing and treatment.  You can not get back pay on disability. It hires from the day you filed not from when you had it. 
Good luck. Look for someone who specializes in autism.  You can have a full life.",,,,shanni365,Autoimmune magnet,,1472722421,t5_2qhe8,t3_50lu5q,t3_50lu5q,2,1475226652,0,0,d756qrl,disability,2,,,,
448,"According to this Wikipedia article, Diplegia typically involves the legs but some people can get it in their arms. So it is possible but very rare.

https://en.wikipedia.org/wiki/Diplegia",,,,Letshavefunn4,Bill,,1474063857,t5_2qhe8,t3_533vna,t3_533vna,4,1475750443,0,0,d7puwi7,disability,4,,,"According to this Wikipedia article, <LOCATION> typically involves the legs but some people can get it in their arms. So it is possible but very rare.

<URL>","[{'start': 152, 'end': 157, 'entity_type': 'URL', 'text': '<URL>', 'operator': 'replace'}, {'start': 37, 'end': 47, 'entity_type': 'LOCATION', 'text': '<LOCATION>', 'operator': 'replace'}]"
449,Oh! Well unless they count the financial aid I get from my school (which all goes to my school) I don't get any money right now. My boyfriend has been supporting me since I had to leave my last job (a part time job). I definitely don't have or make 2 thousand dollars outside of my student aid. My last job I only made around 6 thousand a year :l,,,,SecretCitizen40,,,1473781970,t5_2qhe8,t3_52gv12,t1_d7l2yl6,1,1475629417,0,0,d7l40hl,disability,1,,,,
450,"I did like the show overall. Self-aware humor is good and it ended better than I expected. 

However, I'm worried it'll turn into a show bouncing between the mom and middle son. I don't like the mom as a person (I get the ""fighting,"" but she's a helicopter mom to *one child of three*), and if it focuses on the middle child it'll feel like a wasted opportunity. Treating it like an ensemble cast would be ideal but there's not a lot of characters to do so...

So basically, I have hope for it but am not holding my breath.",,,,kikellea,,,1474607595,t5_2qhe8,t3_53yxkt,t3_53yxkt,4,1475969597,0,0,d7yikt6,disability,4,,,,
451,"""Trash-can"" sends unhealthy messages; maybe construct a ""play environment"" with proper ventilation? Like a collapsible crib for an older child?

",,,,psychforge,schizophrenia spectrum disorder,,1474315136,t5_2qhe8,t3_53ez3t,t3_53ez3t,2,1475845342,0,0,d7tlbkw,disability,2,,,,
452,"So they asked about substances because disability is awesome at denying people with an active substance abuse problem. I have no idea why they don't understand that you can be disabled AND have a dependency issue, or that a dependency issue is a form of mental illness and can lead to disability. Regardless, if you are actively using cocaine or heroin or something, that will get you denied. Being an alcoholic will too. It's beyond stupid. They probably asked about smoking or whatever because it makes it less suspicious when they are digging for the real dirt lol. 

It's just another way for social security to deny people benefits in the end. Don't worry about it unless you told them you have an addiction issue.",,,,ivybelle,,,1473445058,t5_2qhe8,t3_51yosl,t3_51yosl,1,1475495187,0,0,d7fybvm,disability,1,,,,
453,"Has your condition deteriorated? I'm sorry I'm not trying to be invasive. 

Here's the deal. If you now have psychological AND physical records, I would refile. Especially if the practitioners in both of those areas support disability on both of those grounds. Re file based on both and submit every shred of evidence you have to support it. 

It sucks. I'm sorry. ",,,,ivybelle,,,1474470819,t5_2qhe8,t3_53tbsj,t3_53tbsj,1,1475908644,0,0,d7w35ug,disability,1,,,,
454,"I will start the online app tomorrow, thanks. I was wondering if you knew the documents I needed to complete it.

I'll also call my provider tomorrow and ask where the nearest mental health facility is and see if it's walk-able.

With my feet the pain happens when I stand, walk, run, and push a lawn mower. When I'm lying down it doesn't hurt. The pain is mainly in my heels, with pain sometimes on the bottom of my arch. I wear insuls from the chiropractor for plantar fascilitis, but I'm not sure I even have that. My ankles are starting to hurt more since I've had to power through my heel pain more regularly. Is there a heel/foot doctor i can go to? I think podiatrist are the name, but I also vaguely recall them being only cosmetics of the foot. 

It's not a problem asking me more questions, I love them. You're giving me a world of advice and hopefully I get approved. I do not have any other job possibilities than mowing lawns. Even though it sounds physically demanding, it's the only job i can do. I only have to do it 2-4 times a week and only an hour or two per job. I tried getting a retail job but by the 4th hour or so my feet and head hurt too much and I feel like laying down somewhere. I can't do anything that requires more than an hour or two of work because my headache gradually and consistently gets worse with every moment I'm not lying down.",,,,TankTitan,,,1473051949,t5_2qhe8,t3_513e7i,t1_d79gp6k,1,1475345196,0,0,d79y9y5,disability,1,,,,
455,"All new/additional information you have will help. As to getting approved, it's a total crap shoot. I got approved immediately, but on the basis of a medical problem that didn't stop me from working (I do have several far worse conditions that essentially keep me at home) bc it met a listing and they stop looking once they can approve. 

Meanwhile I have friends with significantly life altering conditions who are going to a judge eventually. 

Unfortunately mental issues fall into that category a lot - there's not a ct scan or X-ray to look at. ",,,,Frugalista1,,,1473926930,t5_2qhe8,t3_52njp2,t3_52njp2,1,1475692168,0,0,d7nkg2n,disability,1,,,,
456,"Everyone who is eligible for SSDI has an ""insured period"". After you've worked enough you become insured, called the date first insured. A person stays insured for as long as they are working. However, once you stop working, the clock starts ticking on that insured status. Eventually it will lapse. Generally speaking, you will remain insured for 5 years after you stop working (unless you received special insured status prior to age 31, then it's less). 

Once that insured status lapses, you can still file for SSDI but they now have to find you disabled PRIOR to when your insured status lapses (called the Date Last Insured or DLI). SSDI works like any other type of insurance. Once you stop paying the premiums you become ineligible for coverage. 

So in your case your DLI was 12/31/2009 and the medical records at that time didn't establish a finding of disability because your medical records were lacking. In these cases they don't look at anything beyond your DLI. So anything over the last 6ish years wasn't considered. Normally in disability claims if there isn't enough evidence we can order exams/tests but since you're not insured they just denied your claim for insufficient evidence. ",,,,RambleRamble,SSI/SSDI Examiner,,1473812783,t5_2qhe8,t3_51uh7s,t3_51uh7s,2,1475646525,0,0,d7lrtmh,disability,2,,,,
457,"Find a local lawyer who handle SS cases. They all have websites and emails now. Send them off an email, see if they can communicate that way, at least initially. 

Your lack of medical care is going to count against you. A vocational therapy program might help. ",,,,Frugalista1,,,1475157004,t5_2qhe8,t3_54myus,t3_54myus,1,1476178860,0,0,d86vhel,disability,1,,,,
458,"I really am sorry to hear about the issues with your employee's paychecks. My job in the marketing department is to try to get our name out there, answer questions, find out who is informed about independent living and help with any issues that I can. We have many field representatives and customer service associates that help with numerous states that are available all day long to assist you with any questions. I know that it can be frustrating to have to wait for a paycheck, as most employees know for any job, it all depends on your start date, the pay schedule, time sheet timeliness, proper documentation, as well as Agency/Insurance collaboration in order to have the funds and legally disperse them to the correct individual. If one piece of the puzzle fails it can take longer than usual and for that I apologize. If you would like to discuss any further issues or if you have any questions please feel free to call our customer service associates, they really are here to do anything they can to assist you. I hope your experience with us improves and I thank you for bringing this issue to our attention. ",,,,GTIndependence,,,1473274382,t5_2qhe8,t3_50cgki,t1_d73fxzu,1,1475422971,0,0,d7d5aj5,disability,1,,,,
459,"I couldn't imagine living without a vehicle. I haven't been able to drive for about 10 years now and it's horrible. 

There are lots of great used cars out there. We haven't bought a new car in 22 years. I saved thousands upon thousands of dollars. 

Research the best body style car for your needs, then start looking at prices. When you're ready to look at cars, don't buy on the first viewing. Come back with a mechanic or really good car guy (or girl!) and have them look it over, test drive it, etc. 

It's not a guarantee but it certainly puts the odds in your favor. 

As for your parents, tell them you need independence. You're buying a used car, or they can buy you a new one. ",,,,Frugalista1,,,1475156685,t5_2qhe8,t3_54zdav,t3_54zdav,3,1476178726,0,0,d86va2f,disability,3,,,,
460,I'm waiting for my schools disability office to have enough to loan me one so I can see if like it and then if I have the money I'll buy one myself. ,,,,justademonindisguise,ADHD &amp; Schizophrenic,,1473998089,t5_2qhe8,t3_52momh,t1_d7ot6rb,1,1475725107,0,0,d7oth0l,disability,1,,,,
461,"True. I understand why, but I just rarely watch shows that only get half-hour pilots (most shows I watch are full hours-long, or they get an hour long pilot, but I'm not that familiar with ABC family).

And, yeah, honestly, Micah Fowler might be the best actor on the show. Or at least his character is the most-well-written thus far. ",,,,Briannkin,Cerebral Palsy,,1474598146,t5_2qhe8,t3_53yxkt,t1_d7xufmh,2,1475965937,0,0,d7yd9tk,disability,2,,,"True. I understand why, but I just rarely watch shows that only get half-hour pilots (most shows I watch are full hours-long, or they get an hour long pilot, but I'm not that familiar with ABC family).

And, yeah, honestly, <PERSON> might be the best actor on the show. Or at least his character is the most-well-written thus far. ","[{'start': 224, 'end': 232, 'entity_type': 'PERSON', 'text': '<PERSON>', 'operator': 'replace'}]"
462,"Since I have an invisible condition, I usually end up saying I'm ""sick"" or ""ill"". 

EDIT: In a work context I use variations of the word ""disability."" I put ""RETIRED/DISABLED"" on my LinkedIn profile. On forms that ask for current job I write ""disabled."" If someone asks me to work, I say, ""I'm sorry, I have a disability that prevents me from doing that."" ",,,,workerdaemon,photophobia &amp; fibromyalgia,,1474182247,t5_2qhe8,t3_53asuy,t3_53asuy,4,1475794853,0,0,d7rizq6,disability,4,,,,
463,"Your comment was automatically removed because you linked to reddit without using the ""no-participation"" np. domain. Reddit links should be of the form ""np.reddit.com"" or ""np.redd.it""

*I am a bot, and this action was performed automatically. Please [contact the moderators of this subreddit](/message/compose/?to=/r/disability) if you have any questions or concerns.*",,,,AutoModerator,,,1472924524,t5_2qhe8,t3_50v474,t1_d786til,1,1475302706,0,0,d786tio,disability,1,moderator,,"Your comment was automatically removed because you linked to reddit without using the ""no-participation"" np. domain. Reddit links should be of the form ""<URL>"" or ""<URL>""

*I am a bot, and this action was performed automatically. Please [contact the moderators of this subreddit](/message/compose/?to=/r/disability) if you have any questions or concerns.*","[{'start': 164, 'end': 169, 'entity_type': 'URL', 'text': '<URL>', 'operator': 'replace'}, {'start': 153, 'end': 158, 'entity_type': 'URL', 'text': '<URL>', 'operator': 'replace'}]"
464,"I'm not exactly sure what type of ramp you are referring to but I think I know of a few solutions that could help with in your situation. 

One is a hoist that does all the heavy lifting. All you have to do is attach the wheelchair and guide it in the direction you want it. There are many types and manufacturers of hoists, we have one version that will allow you to pick up a powered wheelchair from the side of a vehicle and stow it in the trunk. 

Another solution could be a platform lift for the wheelchair only. Basically you just move the wheelchair onto the platform. Strap it down and then at the press of a button it loads the wheelchair into the trunk. 

I'll add both these solutions to our todo list of videos. If you want I can link you to the products I'm referring to. 
",,,,Makkan77,,,1473936489,t5_2qhe8,t3_52vfyr,t1_d7nms9g,1,1475694071,0,0,d7nn0dn,disability,1,,,,
465,"I'm going to admit that I didn't read the article, but it comes as no surprise that one and six eligible voters is disabled. Having a disability is more common than having naturally blonde hair. Yet, people with disabilities are under-represented, and systematically neglected. :/ it's one of those titles that just makes me go, well no s***.",,,,blind_devotion08,Retinitis Pigmentosa / Legally Blind,,1473714316,t5_2qhe8,t3_52f0xw,t3_52f0xw,5,1475601546,0,0,d7k31fi,disability,5,,,,
466," I have bipolar and am on disability, so yes, you are a candidate. I won my case by getting a lawyer. Denied the first time, approved on appeal. Get a lawyer who specializes in disability cases. They won't get paid until you win your case. ",,,,kkristen1,,,1473744000,t5_2qhe8,t3_52gv12,t3_52gv12,1,1475616737,0,0,d7kn3o1,disability,1,,,,
467,"I'm in Canada but I worked at a children's hospital that offered help in transitioning (a guide, resources, and a consultant). Maybe your local hospital/your daughter's specialist could give you some info on what's available in your area? ",,,,Fatpandasneezes,,,1473993608,t5_2qhe8,t3_52z9lu,t3_52z9lu,2,1475723129,0,0,d7oqn7k,disability,2,,,"I'm in <LOCATION> but I worked at a children's hospital that offered help in transitioning (a guide, resources, and a consultant). Maybe your local hospital/your daughter's specialist could give you some info on what's available in your area? ","[{'start': 7, 'end': 17, 'entity_type': 'LOCATION', 'text': '<LOCATION>', 'operator': 'replace'}]"
468,Reviews can take months. I got a short form 6/15 and filled it out and sent it back. I figured I would get a long form. The long form came in November. I completed that and sent it back. While I was on vacation the SSA called and left me a message that I needed to go see one of their doctors. They had never received my doctors records. I was able to get everything straightened out in a couple of days and when they got my doctor's records they found my disability to be continuing but if I was out of the country for a couple of weeks my benefits would have been suspended because I would have missed my appointment with SSA's doctor. Long story short- reviews take a lot of time to be processed.,,,,fluffy_bunny22,,,1474299401,t5_2qhe8,t3_5379w2,t3_5379w2,2,1475836834,0,0,d7t8j2m,disability,2,,,,
469,Thanks for responding.  I appreciate it.,,,,SavannahWinslow,,,1474351010,t5_2qhe8,t3_53fh0g,t1_d7u9esf,1,1475862601,0,0,d7u9jpa,disability,1,,,,
470,"It sounds like your behavior may be perceived as curt. People aren't saints: we get the right to be mildly rude on occasion. Given the circumstances it seems a reasonable salve, although if you had an abundance of energy and patience you could have handled it more gently.

Have you told your roommates/tenants/friends how important it is to you to have that particular parking space? You should ask (/ politely tell) them to let their guests know that a certain spot is reserved for their roommate.",,,,like300,,,1474522530,t5_2qhe8,t3_53xio4,t3_53xio4,3,1475933828,0,0,d7x4iyc,disability,3,,,,
471,"You said you're planning to appeal; that is really the best thing you can do. Most of the time an initial cessation is reversed by at the next level of appeal (hearings officer). 

As for what is going to make your case stronger: medical treatment. Part of the definition of disability is that a person's condition has to be disabling despite treatment. I don't necessarily doubt your claims that you are still disabled, but right now you have no evidence to back up that claim. For anyone on disability it is always smart to continue seeking regular treatment, even if you don't feel it is working. Just as when a person is granted disability, having a trail of medical records is important when you have a medical review. ",,,,RambleRamble,SSI/SSDI Examiner,,1472751767,t5_2qhe8,t3_50h0fh,t3_50h0fh,2,1475238047,0,0,d75nphh,disability,2,,,,
