,body,score_hidden,archived,name,author,author_flair_text,downs,created_utc,subreddit_id,link_id,parent_id,score,retrieved_on,controversiality,gilded,id,subreddit,ups,distinguished,author_flair_css_class,anonymized_body,anonymized_masks
0,"I'm not entirely sure what you are describing, but I've never had trouble and I've used some pretty rickety lifts.  Is there something you can hold on to (assuming you have use of hands) to feel more secure?  Can you have an AB person try it out first if it's not regularly used?",,,,allonzy,EDS-Quadish,,1479843570,t5_2qhe8,t3_5ecj9z,t3_5ecj9z,2,1481676627,0,0,dabdvb1,disability,,,,,
1,"Yep.

Being disabled means that due to a medical condition you have significant difficulty, or are unable, to do something that the majority of the population can do.",,,,Surly_Canary,"Stops, drops and rolls.",,1478209781,t5_2qhe8,t3_5az05y,t3_5az05y,6,1481189476,0,0,d9klteg,disability,,,,,
2,"I was awarded my disability benefits at 18 despite being disabled prior. I'm 22 now and still disabled. I share the feelings in which you see everyone else that seem to be going places and doing things and yeah, it makes me feel like a loser too. ",,,,saltysmilodon,BPD/Anxiety/Autism,,1480229173,t5_2qhe8,t3_5brf2b,t3_5brf2b,1,1481782866,0,0,dahbt8a,disability,,,,,
3,"Personally not blind, but low vision. For low vision,  availability of hand menus (if menus on the wall are the norm), is a big one for myself.  ",,,,Cherveny2,,,1480016050,t5_2qhe8,t3_5eldnq,t1_dae378e,2,1481726181,0,0,dae5p4m,disability,,,,,
4,"Make your voice known via your local representative by calling, writing a letter, etc. It's really important because otherwise your concern falls on deaf ears. :)",,,,captainstardriver,,,1480299691,t5_2qhe8,t3_5f5j8a,t3_5f5j8a,3,1481806865,0,0,daifh31,disability,,,,,
5,"tbh, it took me a good moment to notice the prosthetics. always great to see disa-visibility  ��",,,,scoobysnaxxx,,,1480299529,t5_2qhe8,t3_5f6ri2,t3_5f6ri2,2,1481806809,0,0,daifcz8,disability,,,,,
6,"I never got anything in school, it is kind of shocking right?",,,,cripple2493,autistic crutch dancer,,1478200933,t5_2qhe8,t3_5awc1a,t1_d9k8k2e,1,1481185804,0,0,d9kee2e,disability,,,,,
7,Thats very unfortunate. I'm glad you have found out about it on your own though. There is oral history records at UC Berkeley. I'll try to find a link,,,,g0bananas,,,1478208607,t5_2qhe8,t3_5awc1a,t1_d9kgziv,1,1481189014,0,0,d9kkw0q,disability,,,,,
8,"Seriously, yes, there is such a need for this! 

It's awesome that you have someone making adaptive equipment that is specifically fitted to your body. ",,,,megerrolouise,,,1478829582,t5_2qhe8,t3_5buqpi,t1_d9rh2vb,1,1481384675,0,0,d9v9a5u,disability,,,,,
9,You summoned the flames of black?,,,,Blackflames64,,,1479367524,t5_2qhe8,t3_5dekin,t1_da3xw7t,3,1481542737,0,0,da3xxpz,disability,,,,,
10,"Housing codes! I can't stress this enough. 

Businesses are somewhat decent, and I don't think any new laws should be placed, just enforced better. For wheelchair access anyway.

Honestly though, the biggest problem I have in a wheelchair is being able to get into a bathroom. Doors should be 36"" minimum. Builders use 28"" to create wall space. I don't care about the pictures when I need pee or poop. It makes visiting people very difficult. ",,,,Handicapreader,L1 - complete - SCI,,1478147022,t5_2qhe8,t3_5arzis,t3_5arzis,4,1481170109,0,0,d9jist3,disability,,,,,
11,"Terms and guardianship explanations (copied and pasted)

Guardianships are only appropriate for intellectually disabled individuals who also meet the definition of an “incapacitated person.” An incapacitate person is defined as an individual with a clinically diagnosed condition that effects his or her ability to receive and evaluate information, or to make or communicate decisions, which renders him or her incapable of making essential decisions relating to health, safety, or self-care, even with technological assistance. The inability to make these essential life decisions is really the threshold determiner for a guardianship.


A guardian is an individual who is appointed by the court to make decisions for an intellectually disabled or incapacitated person who is determined by the court to be incapable of making those decisions on their own. The focus of the new guardianship laws is to have limited, tailored guardianships which will allow disabled or incapacitated individuals to retain their right to make decisions in areas where they are capable of making them.
",,,,journeytrue,,,1479591459,t5_2qhe8,t3_5duhal,t3_5duhal,1,1481603804,0,0,da7ely6,disability,,,,,
12,"I found this that might help -- http://sedgwickcounty.org/healthdept/services_providers.asp#uninsured 
There are clinics listed there. 

But on the state level check this page out:

http://www.dcf.ks.gov/services/Pages/default.aspx?f=Disabilities

Look specifically at the Disability-related categories. The Disability Determination Services office may be able to help refer you down the correct path. However, also check out the Centers for independent living. They usually can help provide direction, if not direct advocacy for you.

Last but not least, you might try out the department of vocational rehabilitation who assist with getting people back into the workforce. I know you have tried the employment/business thing already but these folks can also assist with helping you get training/etc. And they could help you move towards SSDI/SSI in the right direction. The link is on the bottom of the page I sent above.

Let me know if you have any questions!
Dan
",,,,captainstardriver,,,1480365234,t5_2qhe8,t3_5fc9x8,t1_dajfgzx,1,1481830874,0,0,dajh99y,disability,,,,"I found this that might help -- <URL> 
There are clinics listed there. 

But on the state level check this page out:

<URL>

Look specifically at the Disability-related categories. The Disability Determination Services office may be able to help refer you down the correct path. However, also check out the Centers for independent living. They usually can help provide direction, if not direct advocacy for you.

Last but not least, you might try out the department of vocational rehabilitation who assist with getting people back into the workforce. I know you have tried the employment/business thing already but these folks can also assist with helping you get training/etc. And they could help you move towards SSDI/SSI in the right direction. The link is on the bottom of the page I sent above.

Let me know if you have any questions!
<PERSON>","[{'start': 840, 'end': 848, 'entity_type': 'PERSON', 'text': '<PERSON>', 'operator': 'replace'}, {'start': 118, 'end': 123, 'entity_type': 'URL', 'text': '<URL>', 'operator': 'replace'}, {'start': 32, 'end': 37, 'entity_type': 'URL', 'text': '<URL>', 'operator': 'replace'}]"
13,"With your amount of proof/hospitalizations, it seems like a no brainer. Glad it was an easy process for you.",,,,maipoxx,,,1478832755,t5_2qhe8,t3_5cbsg1,t3_5cbsg1,2,1481385790,0,0,d9vbimg,disability,,,,,
14,"Please don't. Love still exists in this country. Please reach out to one of these resources. I'm sorry for formatting, I'm on mobile. 
 National Suicide Prevention Lifeline: 1-800-273-8255 (TALK) Veterans press 1 to reach specialised 

Online Chat: http://www.suicidepreventionlifeline.org/gethelp/lifelinechat.aspx

Crisis Text Line: Text ""START"" to 741-741

",,,,Ludaq,,,1478674352,t5_2qhe8,t3_5bz7gw,t3_5bz7gw,16,1481332013,0,0,d9sfpex,disability,,,,"Please don't. Love still exists in this country. Please reach out to one of these resources. I'm sorry for formatting, I'm on mobile. 
 National Suicide Prevention Lifeline: <PHONE_NUMBER> (TALK) Veterans press 1 to reach specialised 

Online Chat: <URL>

Crisis Text Line: Text ""START"" to 741-741

","[{'start': 249, 'end': 254, 'entity_type': 'URL', 'text': '<URL>', 'operator': 'replace'}, {'start': 174, 'end': 188, 'entity_type': 'PHONE_NUMBER', 'text': '<PHONE_NUMBER>', 'operator': 'replace'}]"
15,"Thank you both! As I posted in another reply, do I need to file an appeal once the November statement is released showing nothing over $2,000 for the month or will they automatically see this since I'm technically still accepted in the program? ",,,,TheDiscoHippie,,,1479023769,t5_2qhe8,t3_5ci027,t1_d9y2i3y,1,1481441301,0,0,d9y8jrg,disability,,,,,
16,"Oh, to answer your specific question, the judge's award letter stated a review is advised in one year. That isn't verbatim-word-for-word(I don't have access to the letter right now) but it essentially stated that there was an expectation of improvement in my symptoms and a review is recommended in one year. Due to Government Paperwork being slow to go out-or some unrelated reason-I I received this approximately 1.5 years after the date of the hearing.

I've heard that I ""look good"" too from Social Workers and at least one psychiatrist. Maybe we just don't know how to take a compliment. I tend to look good until I start talking. Then I am told to get in touch with ""The Mobile Crisis Unit."" I looked so good that my former Psychiatrist disappeared on me and his co-worker, a Licensed Clinical Social Worker, SCREAMED AT ME on the phone (making a false accusation about something he claimed I said-an alleged Insult or alleged threat. Record your calls. I played it back many times and it seemed like this Therapist was pretending I said something hostile when I'm just asking why the discrepency between what I was told a month earlier and during that call.) He didn't want to admit that I had essentially been abandoned by my Psychiatrist over 2 months earlier than he stated during my last appointment. And I was learning about it by calling to confirm my final appointment.",,,,channel35,,,1478886237,t5_2qhe8,t3_5cam3s,t1_d9vb53u,1,1481400908,0,0,d9w36u6,disability,,,,"Oh, to answer your specific question, the judge's award letter stated a review is advised in one year. That isn't verbatim-word-for-word(I don't have access to the letter right now) but it essentially stated that there was an expectation of improvement in my symptoms and a review is recommended in one year. Due to Government Paperwork being slow to go out-or some unrelated reason-I I received this approximately 1.5 years after the date of the hearing.

I've heard that I ""look good"" too from Social Workers and at least one psychiatrist. Maybe we just don't know how to take a compliment. I tend to look good until I start talking. Then I am told to get in touch with ""The Mobile Crisis Unit."" I looked so good that my former Psychiatrist disappeared on me and his co-worker, a Licensed Clinical Social Worker, SCREAMED AT ME on the phone (making a false accusation about something he claimed I said-an alleged Insult or alleged threat. Record your calls. I played it back many times and it seemed like this <PERSON> was pretending I said something hostile when I'm just asking why the discrepency between what I was told a month earlier and during that call.) He didn't want to admit that I had essentially been abandoned by my Psychiatrist over 2 months earlier than he stated during my last appointment. And I was learning about it by calling to confirm my final appointment.","[{'start': 1012, 'end': 1020, 'entity_type': 'PERSON', 'text': '<PERSON>', 'operator': 'replace'}]"
17,"I have social anxiety, but like you said people are everywhere and everything in this world so I feel it all the time.  How did she get a doctor to write a recommendation?",,,,anxietythrowawayhelp,,,1480106562,t5_2qhe8,t3_5czaml,t1_da6w8bw,1,1481749744,0,0,dafgv4d,disability,,,,,
18,"Hello, /u/piperitapatti26. 

Your submission has been removed because:

Not english



---

If you have any questions or concerns, please [message the moderators](http://www.reddit.com/message/compose?to=%2Fr%2Fdisability&amp;amp;subject=About my removed submission&amp;amp;message=I'm writing to you about the following submission: https://www.reddit.com/r/disability/comments/5dfdh7/linvalidita_non_deve_essere_confusa_con_lhandicap/ %0D%0DMy issue is...). *Direct replies to official mod comments will be removed.*",,,,Handicapreader,L1 - complete - SCI,,1479524882,t5_2qhe8,t3_5dfdh7,t3_5dfdh7,1,1481588716,0,0,da6jwzg,disability,,moderator,,"Hello, <USER>. 

Your submission has been removed because:

Not english



---

If you have any questions or concerns, please [message the moderators](<URL> my removed submission&amp;amp;message=I'm writing to you about the following submission: <URL> %0D%0DMy issue is...). *Direct replies to official mod comments will be removed.*","[{'start': 246, 'end': 251, 'entity_type': 'URL', 'text': '<URL>', 'operator': 'replace'}, {'start': 151, 'end': 156, 'entity_type': 'URL', 'text': '<URL>', 'operator': 'replace'}, {'start': 7, 'end': 13, 'entity_type': 'USER', 'text': '<USER>', 'operator': 'replace'}]"
19,Sweet - I did not know about Dis- studies :),,,,cripple2493,autistic crutch dancer,,1478335685,t5_2qhe8,t3_5awc1a,t1_d9l6zyr,1,1481227417,0,0,d9moj1f,disability,,,,,
20,"It seems like you might have more impact as a supportive family member rather than legal guardian. (In my opinion) in cases like this guardianship is usually more important for interactions with services and professionals, if your sister is dismissive and difficult around taking your advice I doubt legal guardianship will change that other than potentially making the relationship more strained.

",,,,ThomasEdmund84,,,1479614582,t5_2qhe8,t3_5duhal,t3_5duhal,1,1481610730,0,0,da7sv8f,disability,,,,,
21,Thank you so much. Sorry for the delay here too. This has helped me so much! Wish me luck.,,,,Overallsolid,,,1478112753,t5_2qhe8,t3_55f9ht,t1_d8zz73s,1,1481155856,0,0,d9iqt9m,disability,,,,,
22,"Cool, Not sure if you know about it, but Sportaid is always a good place to purchase equipment for chairs and such.

http://www.sportaid.com/

",,,,Aedonr,,,1479919907,t5_2qhe8,t3_5eeazd,t1_dackq39,1,1481698422,0,0,dacllft,disability,,,,"Cool, Not sure if you know about it, but <PERSON> is always a good place to purchase equipment for chairs and such.

<URL>

","[{'start': 117, 'end': 122, 'entity_type': 'URL', 'text': '<URL>', 'operator': 'replace'}, {'start': 41, 'end': 49, 'entity_type': 'PERSON', 'text': '<PERSON>', 'operator': 'replace'}]"
23,"It is a lot harder to get on disability than stay on. At CDR, the analyst has to prove you have not only improved, but improved SIGNIFICANTLY, and it has to be related to your ability to work. Believe me, we'd rather continue you, it's a LOT easier. A lot of what you said was difficult for me to follow, but if you have specific questions, just ask, there are a couple of analysts here who can answer general questions.",,,,spicyshazam,"Disability Examiner, Hearing Officer (DHO)",,1478817063,t5_2qhe8,t3_5cam3s,t3_5cam3s,9,1481379875,0,0,d9v021t,disability,,,,,
24,"&gt; I'd recommend adding 'automatic doors' &amp; 'elevators' to the available/searchable accessibility information.

Great ideas. I've noted those categories and will be sure to include them. I'll also look into those rewards you mentioned in Google Guides. Thanks for your input!",,,,LDShivang,,,1480013755,t5_2qhe8,t3_5eldnq,t1_dadcln7,1,1481725403,0,0,dae44ou,disability,,,,,
25,"AMEN! 
Just lost a friend because she thought it was funny that her friend was teasing people with a limp and calling them lame... meanwhile i'm limping all over the place due to my CP. When I called her out on it, suddenly all her friends and family came to her aid and belittled my opinion of this clown. :( ",,,,mixedmaterials,Cerebral Palsy,,1480143086,t5_2qhe8,t3_5exlt4,t3_5exlt4,3,1481760097,0,0,dag1rlq,disability,,,,,
26,"What PR fallout? From the people that were apparently ok with sexism, misogyny, racism and ableism? ",,,,TinyLittleStormCloud,,,1478715189,t5_2qhe8,t3_5c19t7,t1_d9t3ih4,15,1481345238,0,0,d9t4wfx,disability,,,,,
27,"Oh okay, I see. I dont understand how us looking better matters at all. My one psychiatrist told me I can do my hair and nails so he doesnt see how I have any problems. Funny thing is I had 5"" roots and I never paint my nails of even file them. He was just an a**hole cause Im a young female. 

Its so hard to find good psychiatrists. Most only want to get you in and out. They get hundreds of dollars for 5 minutes of nothing. Ive had bad luck with therapists too until I found my recent one.

I wish you the best, Im trying to read all your posts but my memory's horrid and I have a hard time comprehending things  ",,,,maipoxx,,,1478903133,t5_2qhe8,t3_5cam3s,t1_d9w36u6,2,1481407971,0,0,d9wg5o6,disability,,,,,
28,"I got on SSDI when I was 26 and am now 30. I was lucky to have a partner that supports me. We have had a child in that time.  I'm lucky that I ""pass"" for normal.  The problem is that people never see me when I'm doing badly.  We look like an average family but my child goes to daycare 3 times a week to keep my stress down.  

I never thought my life would be like this. I have an engineering degree and have actually worked for a natural gas company designing pipelines. I am working through therapy to come to a better place in accepting my situation but it has been extremely hard because people just don't understand.  They think it must be nice to stay at home and not have to work.",,,,kristyintheD,"SSDI, Bipolar 1, Schitzoaffective Disorder, Anxiety",,1478828460,t5_2qhe8,t3_5brf2b,t3_5brf2b,2,1481384284,0,0,d9v8gre,disability,,,,,
29,"My mistake, yet again-I am confusing you with another member who is responding to me. Thanks for the information all the same.",,,,channel35,,,1478884957,t5_2qhe8,t3_5cam3s,t1_d9vzz7y,1,1481400370,0,0,d9w26ff,disability,,,,,
30,"I can assure you some people learn to live with it and be happy again despite their disability but you probably already know that.  
I've written a few posts like yours over the years. I was never satisfied with the answers. I think these are questions you can only answer yourself.   

&amp;nbsp;

Some people have found meaning and happiness despite severe limitations, so there is no reason you can't.  
If you wrote this post I assume you're at a low point but keep in mind there will be better times and try to keep your chin up. We're all rooting for you.",,,,MLApprentice,,,1480329928,t5_2qhe8,t3_5eyf24,t3_5eyf24,3,1481817509,0,0,daiulqu,disability,,,,,
31,Thanks for posting. Very interesting.,,,,alwayspro,,,1478530070,t5_2qhe8,t3_5auzzp,t3_5auzzp,1,1481279960,0,0,d9pks9m,disability,,,,,
32,"I'm in a similar situation.  I can walk with a quad cane and get around my apartment or go to my doctor visits with no problems but if I need to go shopping or anywhere where there will be a lot of standing/walking involved, I need to use a wheelchair.

I voted by mail-in ballot but since my mail goes out with my sister's family's mail (I live with her and they have a PO box because mail is not delivered to their street) I'm not always confident that any mail I send out will be mailed on time.  I also have no car and public transport is abysmal in my area, unless you already live on one of the few routes.  There is a service for disabled riders but it's not very reliable so I don't use it.  Finally, taxis are out of the question because I live on a fixed income and just can't afford that expense.

I live my life online - paying bills, banking, shopping - so being able to vote online is one more thing that would help me participate in the democratic process.",,,,laffinalltheway,,,1478958561,t5_2qhe8,t3_5ci3g1,t1_d9x0dpf,2,1481420851,0,0,d9x592u,disability,,,,,
33,"If you don't mind sharing, what is your diagnosis?",,,,11cupsofcoldbrew,Left hemiplegic,,1479688338,t5_2qhe8,t3_5dcfr4,t1_da3q0lx,1,1481629409,0,0,da8v2zb,disability,,,,,
34,Can they legally ask that in the US?,,,,keyvin,"SSDI, Classical EDS, Schizoaffective DO",,1478786774,t5_2qhe8,t3_5ar0ko,t3_5ar0ko,1,1481367059,0,0,d9ub3ko,disability,,,,Can they legally ask that in the <LOCATION>?,"[{'start': 33, 'end': 43, 'entity_type': 'LOCATION', 'text': '<LOCATION>', 'operator': 'replace'}]"
35,"I am also pretty sure you will have to send them a letter once a year, with either a copy of your tax return OR a signed letter stating that you did not work that tax year.  If I remember correctly.  Failure to do so, would likely result in threats of and the eventual dismissal from the program.",,,,[deleted],,,1478299488,t5_2qhe8,t3_5b5u3h,t1_d9m45ek,1,1481217819,0,0,d9m6dmi,disability,,,,,
36,"I get bad migraine and have an added chronic illness and get ssi. My health started going before I turned 22 so I am an adult child with a disability. Once my parents start collecting social security retirement I get a percentage of it too without it changing my parents payments. My dad will start collecting next September and I can't wait to not have to deal with ssi!

A few tips to remember when applying: because migraines aren't a listed condition for SSA don't me surprised if you have to go to the hearing stage.",,,,Wishin2BaKitten,,,1479969608,t5_2qhe8,t3_5elr52,t3_5elr52,3,1481715215,0,0,dadjlfs,disability,,,,,
37,"I work for someone who prices these things and we usually go through Spin Life. Not sure that just anyone can buy from them, but you can try. ",,,,contextISeverything,Invisible Illnesses,,1479873671,t5_2qhe8,t3_5eeazd,t3_5eeazd,2,1481687705,0,0,dabzzxf,disability,,,,,
38,"Ok, thank you. While I no longer do outpatient therapy with a licensed, trained Therapist(now that I have Medicare, I am supposed to go find my own. I haven't, which certainly will not benefit me. And it isn't for lack of wanting to-I need Therapy precisely to help cope with my living conditions-but I am somewhat Agorophobic and can't tolerate driving or using public transit very well, barring something VERY important... I do, however, see an assigned Staff-Member that I do short 1 on 1 sessions with, even if it is only telling him what important appoinments I have scheduled. He isn't trained for counseling. But I hope that counts for somthing,  and I REALLY hope he has been keeping accurate records of what I've been self-reporting about how I'm doing...",,,,channel35,,,1479051895,t5_2qhe8,t3_5cam3s,t1_d9xqelb,1,1481446130,0,0,d9yi1xc,disability,,,,"Ok, thank you. While I no longer do outpatient therapy with a licensed, trained Therapist(now that I have Medicare, I am supposed to go find my own. I haven't, which certainly will not benefit me. And it isn't for lack of wanting to-I need Therapy precisely to help cope with my living conditions-but I am somewhat <PERSON> and can't tolerate driving or using public transit very well, barring something VERY important... I do, however, see an assigned Staff-Member that I do short 1 on 1 sessions with, even if it is only telling him what important appoinments I have scheduled. He isn't trained for counseling. But I hope that counts for somthing,  and I REALLY hope he has been keeping accurate records of what I've been self-reporting about how I'm doing...","[{'start': 315, 'end': 323, 'entity_type': 'PERSON', 'text': '<PERSON>', 'operator': 'replace'}]"
39,"There are agencies &amp; non-profits that offer sliding fee scales, as well.

Basically, the OP needs people trained to help, &amp; for them to help the OP navigate through this difficult time.",,,,UserNme_AlreadyTaken,,,1479190763,t5_2qhe8,t3_5czaml,t1_da0y73e,2,1481489829,0,0,da0ym9c,disability,,,,,
40,"Yes, but SSA pays very little attention to their opinions. Psychiatrists are God. What's worse, I have to go to a community mental health center, and it's their policy not to write letters for people seeking disability.",,,,a_realnobody,,,1479167382,t5_2qhe8,t3_5cv0n7,t1_da0j7ja,1,1481482409,0,0,da0jbxx,disability,,,,,
41,"I had two mall security guards target me because of my service dog recently. I entered the mall like I always do and stopped by a pet store. Then the guards approached me, the female guard addressed me while the male guard stood beside her. She kept pressuring me, asking if my dog was a real service animal, what was ""wrong"" with me that required a service dog, and what my dog was trained to help me with. I have horrible SA so I tried to explain my situation and kept stuttering, she then told me my dog wasn't allowed in the mall and that I should just leave him in the car! She even told me I had to carry my dog out, that his paws can't touch the floor. I was exasperated and started to panic, I can't lift my dog and just broke down. I should probably get cards for next time, for now I'm avoiding the mall and hoping I never have to face that security guard duo again. I felt really intimidated by the male guard and how he didn't speak as well. Everyone I talk to says I should have complained to her supervisor or stood up for my rights more but I can't even imagine getting into a heated argument. 

Besides being told my fibromyalgia is fake or isn't an actual disability by ignorant people, that was my most heated one.",,,,spiralsplitz,,,1478769755,t5_2qhe8,t3_5bw366,t3_5bw366,2,1481363736,0,0,d9u4jwx,disability,,,,,
42,"I coordinate community- based supports for people with physical and developmental disabilities and frail elders. Some categories that might not be as obvious for inclusion could be:
* dementia- friendly businesses
* places that have made accommodations for people with sensory issues 
* restaurants with picture menus

Also, there a significant number of people with disabilities who utilize Medicare and Medicaid for medical services, pharmacy items, dentistry, archeology, counseling and psychiatric services, and medical equipment and supplies. If you are already cataloging businesses, there would be some value added by noting the ones that accept Medical Assistance. Providers are always difficult to locate for people who depend on public health coverage.",,,,lortnocratrat,,,1479968659,t5_2qhe8,t3_5eldnq,t3_5eldnq,2,1481715011,0,0,dadj671,disability,,,,,
