,body,score_hidden,archived,name,author,author_flair_text,downs,created_utc,subreddit_id,link_id,parent_id,score,retrieved_on,controversiality,gilded,id,subreddit,ups,distinguished,author_flair_css_class,anonymized_body,anonymized_masks
0,"Thanks for responding. I believe I understand what you mean about suicidal ideation being a sense of comfort. I sort of have a similar feeling, though mine is a bit more concrete. Both my neurological and autoimmune conditions are progressive, and due to the hazy, uncertain air that surrounds comorbid conditions, they really can't give me any sort of prognosis. I could remain at my current level for the next 40 years, or I could deteriorate and be paralyzed within the next 5. There's no way to know. I've discussed this with my best friend of 20 years, who like me has spent her adult life working in direct care, including hospice, and we've made an agreement that once I deteriorate severely she will have power of attorney, I'll be fully DNR, and once my mother is no longer living (that's a key element; I don't care how bad things get, as long as it's my choice, my mother is not going to bury one of her children) my friend will help me seek out a legal assisted suicide situation. If it's not legal in the US by then, then we will find it elsewhere. I have no interest in living as a human pretzel if there's pain involved (and with autoimmune connective tissue disease, there almost certainly will be). Paralysis and permanent contortions I think I could learn to live with, but not with the amount of chronic pain that's likely to be involved. And I find it very comforting to know I have my exit strategy planned, should my conditions become that excessively severe. This way I can enjoy what I have now, and don't have to worry about what the future might hold for me.",,,,jlmitch12,dystonia and autoimmune disease,,1473909712,t5_2qhe8,t3_52kctm,t1_d7lad7c,1,1475686784,0,0,d7ndd2m,disability,1,,,"Thanks for responding. I believe I understand what you mean about suicidal ideation being a sense of comfort. I sort of have a similar feeling, though mine is a bit more concrete. Both my neurological and autoimmune conditions are progressive, and due to the hazy, uncertain air that surrounds comorbid conditions, they really can't give me any sort of prognosis. I could remain at my current level for the next 40 years, or I could deteriorate and be paralyzed within the next 5. There's no way to know. I've discussed this with my best friend of 20 years, who like me has spent her adult life working in direct care, including hospice, and we've made an agreement that once I deteriorate severely she will have power of attorney, I'll be fully DNR, and once my mother is no longer living (that's a key element; I don't care how bad things get, as long as it's my choice, my mother is not going to bury one of her children) my friend will help me seek out a legal assisted suicide situation. If it's not legal in the <LOCATION> by then, then we will find it elsewhere. I have no interest in living as a human pretzel if there's pain involved (and with autoimmune connective tissue disease, there almost certainly will be). Paralysis and permanent contortions I think I could learn to live with, but not with the amount of chronic pain that's likely to be involved. And I find it very comforting to know I have my exit strategy planned, should my conditions become that excessively severe. This way I can enjoy what I have now, and don't have to worry about what the future might hold for me.","[{'start': 1018, 'end': 1028, 'entity_type': 'LOCATION', 'text': '<LOCATION>', 'operator': 'replace'}]"
1,"Call CPS with an anonymous report.  If they think it's abuse, they'll take the report.  I know it doesn't sound good to me.",,,,SweetHermitress,A whole lotta stuff,,1474246124,t5_2qhe8,t3_53ez3t,t3_53ez3t,3,1475820082,0,0,d7siylr,disability,3,,,,
2,"Thanks for responding. I believe I understand what you mean about suicidal ideation being a sense of comfort. I sort of have a similar feeling, though mine is a bit more concrete. Both my neurological and autoimmune conditions are progressive, and due to the hazy, uncertain air that surrounds comorbid conditions, they really can't give me any sort of prognosis. I could remain at my current level for the next 40 years, or I could deteriorate and be paralyzed within the next 5. There's no way to know. I've discussed this with my best friend of 20 years, who like me has spent her adult life working in direct care, including hospice, and we've made an agreement that once I deteriorate severely she will have power of attorney, I'll be fully DNR, and once my mother is no longer living (that's a key element; I don't care how bad things get, as long as it's my choice, my mother is not going to bury one of her children) my friend will help me seek out a legal assisted suicide situation. If it's not legal in the US by then, then we will find it elsewhere. I have no interest in living as a human pretzel if there's pain involved (and with autoimmune connective tissue disease, there almost certainly will be). Paralysis and permanent contortions I think I could learn to live with, but not with the amount of chronic pain that's likely to be involved. And I find it very comforting to know I have my exit strategy planned, should my conditions become that excessively severe. This way I can enjoy what I have now, and don't have to worry about what the future might hold for me.",,,,jlmitch12,dystonia and autoimmune disease,,1473909703,t5_2qhe8,t3_52kctm,t1_d7lad7c,1,1475686780,0,0,d7ndcvo,disability,1,,,"Thanks for responding. I believe I understand what you mean about suicidal ideation being a sense of comfort. I sort of have a similar feeling, though mine is a bit more concrete. Both my neurological and autoimmune conditions are progressive, and due to the hazy, uncertain air that surrounds comorbid conditions, they really can't give me any sort of prognosis. I could remain at my current level for the next 40 years, or I could deteriorate and be paralyzed within the next 5. There's no way to know. I've discussed this with my best friend of 20 years, who like me has spent her adult life working in direct care, including hospice, and we've made an agreement that once I deteriorate severely she will have power of attorney, I'll be fully DNR, and once my mother is no longer living (that's a key element; I don't care how bad things get, as long as it's my choice, my mother is not going to bury one of her children) my friend will help me seek out a legal assisted suicide situation. If it's not legal in the <LOCATION> by then, then we will find it elsewhere. I have no interest in living as a human pretzel if there's pain involved (and with autoimmune connective tissue disease, there almost certainly will be). Paralysis and permanent contortions I think I could learn to live with, but not with the amount of chronic pain that's likely to be involved. And I find it very comforting to know I have my exit strategy planned, should my conditions become that excessively severe. This way I can enjoy what I have now, and don't have to worry about what the future might hold for me.","[{'start': 1018, 'end': 1028, 'entity_type': 'LOCATION', 'text': '<LOCATION>', 'operator': 'replace'}]"
3,Sounds like her parents have control issues and your friend's disability is just an excuse. ,,,,UHaveNoPowerOverMe,Narcolepsy,,1473385741,t5_2qhe8,t3_51trer,t3_51trer,3,1475474018,0,0,d7f2u2f,disability,3,,,,
4,"Forgive me for not knowing who Tony Robbins is, but I understand your point. What I'm trying to say is that it's fine to aknowledge achievements, but just surviving and not being a miserable shitwad isn't deserving of the title of ""inspirational,"" and I've been called such for that reason. ",,,,blind_devotion08,Retinitis Pigmentosa / Legally Blind,,1473276863,t5_2qhe8,t3_51l46x,t1_d7d6q6g,5,1475424345,0,0,d7d78gb,disability,5,,,"Forgive me for not knowing who <PERSON> is, but I understand your point. What I'm trying to say is that it's fine to aknowledge achievements, but just surviving and not being a miserable shitwad isn't deserving of the title of ""inspirational,"" and I've been called such for that reason. ","[{'start': 31, 'end': 39, 'entity_type': 'PERSON', 'text': '<PERSON>', 'operator': 'replace'}]"
5,Great! What time works for you? It's 2:34 pm central time currently. ,,,,DDS8395,,,1474140864,t5_2qhe8,t3_532k9w,t1_d7qv6pm,1,1475776428,0,0,d7qvhw9,disability,1,,,,
6,"The thing is that mainstream economic models don't take externalities into account. Work done by people who are privileged (able to draw maps, similar to the people who draw maps) is more privileged because the map is not the territory - economics isn't the economy. 

That's why stuff like pollution credits were created in order to bring externalities into the formal economy. Many people do contribute to the economy in an informal manner. One example is domestic work. 

Disabled people contribute as much as anyone else - but often, it's in less quantifiable ways that do not fit into existing economic models. ",,,,sunkindonut149,,,1472845293,t5_2qhe8,t3_50p77x,t1_d76cisy,1,1475277442,0,0,d77646e,disability,1,,,,
7,"Thank you so much for this information. You seem very well informed. Where did you learn all of this, if you don't mind me asking. 

",,,,GTIndependence,,,1473275497,t5_2qhe8,t3_50cgki,t1_d736he8,1,1475423585,0,0,d7d660w,disability,1,,,,
8,"Try going here: https://dese.mo.gov/adult-learning-rehabilitation-services/vocational-rehabilitation

If you need retraining, they should pay for it; if you need proper attire, they should pay for that as well.  They will pay for adaptive tech too.

&gt; our government isn't known for having its shit together.

""Due to restricted funding, Missouri Vocational Rehabilitation is unable to provide services to all individuals with disabilities at this time.  A statewide Order of Selection has been implemented, and individuals will be served on the basis of the severity of their disability.""

You can say *that* again.",,,,atrociousness,"Type 1 Neurofibromatosis, Hydrocephalus, Severe Chronic Pain",,1473888275,t5_2qhe8,t3_52r0hu,t1_d7mynhe,3,1475676063,0,0,d7mz01k,disability,3,,,"Try going here: <URL>

If you need retraining, they should pay for it; if you need proper attire, they should pay for that as well.  They will pay for adaptive tech too.

&gt; our government isn't known for having its shit together.

""Due to restricted funding, Missouri Vocational Rehabilitation is unable to provide services to all individuals with disabilities at this time.  A statewide Order of Selection has been implemented, and individuals will be served on the basis of the severity of their disability.""

You can say *that* again.","[{'start': 16, 'end': 21, 'entity_type': 'URL', 'text': '<URL>', 'operator': 'replace'}]"
9,That subreddit is fantastic! Thanks for sharing!,,,,Jorrie-kun,,,1475029540,t5_2qhe8,t3_54t194,t1_d84pre7,2,1476130505,0,0,d84zrc4,disability,2,,,,
10,"I think I get what you're trying to say but since drug addiction is a mental illness, it is impossible to be an addict and not be mentally ill. https://www.drugabuse.gov/publications/research-reports/comorbidity-addiction-other-mental-illnesses/drug-addiction-mental-illness",,,,isaac_the_robot,"anxiety disorder, delayed sleep phase, depression, crohn's",,1473469211,t5_2qhe8,t3_51yosl,t1_d7g9i9g,2,1475507206,0,0,d7gf802,disability,2,,,"I think I get what you're trying to say but since drug addiction is a mental illness, it is impossible to be an addict and not be mentally ill. <URL>","[{'start': 144, 'end': 149, 'entity_type': 'URL', 'text': '<URL>', 'operator': 'replace'}]"
11,"I have Arthrogryposis in my upper extremities.

I generally say that I have a disability or some physical limitations, but I'm not disabled.  I'm not a fan of the term crippled, since it's mostly used in a derogatory context.",,,,Forester263,,,1474921913,t5_2qhe8,t3_53asuy,t3_53asuy,1,1476084285,0,0,d834thb,disability,1,,,,
12,"I didn't say it was doubtful I simply pointed out that your claim has some red flags, so to speak. As I said, you (your atty) could present a strong case provided that the red flags are ameliorated by good facts. There are many relevant unknowns which you have not provided. 

Again, you need to speak with an atty who can sit down and talk through your case. I'm not sure why you seem reluctant to do this. As I have said earlier, you will probably not pay any legal fees unless benefits are awarded and your fee will only be deducted from your past-due benefits with no effect on future payments. You have very little risk by talking to an atty and you stand to gain so much.",,,,Thirdrawn,,,1474482274,t5_2qhe8,t3_53fh0g,t1_d7wbxoy,2,1475914969,0,0,d7wcmdz,disability,2,,,,
13,"Being caught in tornado alley tied into the bible belt, I get it! But hey, we can say merry christmas now so all is good, right? ",,,,Frugalista1,,,1474312006,t5_2qhe8,t3_53fdhw,t1_d7tcb4o,1,1475843649,0,0,d7titag,disability,1,,,,
14,"That link actually confirms my concerns about mental illness and substance abuse and why people are continually denied when those are comorbid. Step six of that process essentially asks an examiner to determine if someone's disability would not be as severe and potentially make then able to work if they were not actively abusing substances. I feel confident that most people doing these determinations at social security are not licensed clinicians and have no real way of knowing that. Nor is there any real way of knowing that, even for a licensed clinician. The default assumption then becomes, ""the depression this person is experiencing would be a lot better if they weren't drinking so, we are going to deny their disability."" The concept is, as you so warmly put it, people on disability shouldn't be using their benefits to buy drugs. 

I agree that disability benefits should not be used to support addiction. That is not ideal. There should be some recognition however that cooccurring disorders, particularly in mental health, are hugely prevalent, and those people are likely to need more help, not less. Denying them access to the healthcare benefits that social security provides just ensures that they continue on the death spiral. 

I was lucky in that I did not have a substance issue to contend with so my appeal went smoothly (I was of course initially denied because I was in my early 30's and it was a mental illness claim). It's not okay that the denial rates for legitimately mentally ill people is so high. In my case, I hadn't had a job last longer than six months in my entire life. I was in my early 30's, had a college degree but it took like 8 years to get it because I had to drop so many semesters. I had to file bankruptcy at one point due to a $30k 2 month shopping spree. My case was pretty obvious. I had 4 years of biweekly psychiatry visit notes along with a very specific evaluation from my psychiatrist. I had also qualified for disability from my state. I was still initially denied by social security, had to get a lawyer, wait two years for an appeal hearing all to get my SSI benefit of $430 or whatever a month since I live with my parents. The Medicaid is what I really needed, so that was the important part. Honestly though, that is a bit of a joke since it only covers 20 mental health visits (psychiatry and therapy included in that) so I have multiple ongoing battles with my local mental health agency for therapy and such. So, it's kind of a mess.

Arguing that somehow this system works, to people who actually have to live in it, doesn't fly. I'm sure you want to defend it. That's great. Good for you. 

I appreciate social security. I am grateful it is there. Trying to say it is not punitive about certain things or is somehow an efficient system is just an outright lie. ",,,,ivybelle,,,1473452319,t5_2qhe8,t3_51yosl,t1_d7g0td7,1,1475499135,0,0,d7g3ze3,disability,1,,,,
15,"Thanks for writing this! I've worried for most of my life about having to rely on someone to help me with mundane tasks. Hearing about your efforts makes me want to really give this a shot, as it doesn't seem hopeless anymore. :D",,,,Jorrie-kun,,,1475035027,t5_2qhe8,t3_54t194,t1_d852q67,2,1476133013,0,0,d852zad,disability,2,,,,
16,"I understand where you are coming from, but the fact that it doesn't just hurt for a minute with chronic pain should be more than enough reason to stop most people, because who wants to endure a week of pain at a ten just to see a concert? Chances are I won't remember the concert, I will remember the week I spent in agony, but that's just me personally. Also for me, it isn't just pain, not even nearly, I'm a pretty big fall risk and I've already been nearly trampled (pushed down AND jumped all over) in one of these crowds at a concert like this one I want to see, so I could get really hurt. I've BEEN really hurt before at a concert like this before I was disabled, so chancing it while I am disabled isn't smart. 

With some things, sure, but you have to know where to draw the line too. Because what I have to lose is the rest of the mobility I DO have, and at that point, I am basically fucked, I can barely take care of myself on my worst days now. 

And at this point I have had no treatment of any kind for this, I am still waiting, and it is still getting worse while I do, so maybe that is a thought pattern to have after treatment in fact, it really is something I want to do after treatment is push myself as much as I can, but they have done nothing yet, only some things have been mentioned that they could try which sound good. I'm waiting without any pain treatment until the 22nd in hopes that they will be able to do something that can help and after that I can push myself to do normal things, but right now the reason I shelter myself is because I can't have it getting any worse, or I'm screwed. That's a lot to lose in my eyes.",,,,MadiasHell,Lame,,1472858308,t5_2qhe8,t3_50v474,t1_d77dv8t,1,1475283491,0,0,d77ejt8,disability,1,,,,
17,"You talk about SSRI's and tricylic but what about SNRI's? I can't take SSRI's because of epilepsy meds but I've found a SNRI that works for me, currently.

If nothing works and you're getting really desperate, I guess you could try ECT.  ",,,,AceBakerThing,Too many to list here...,,1473782661,t5_2qhe8,t3_52ko9g,t3_52ko9g,2,1475629825,0,0,d7l4kio,disability,2,,,,
18,My advocate is a paralegal who handles SSD cases exclusively.,,,,SweetHermitress,A whole lotta stuff,,1474666925,t5_2qhe8,t3_53tbsj,t1_d7xkqu0,1,1475992218,0,0,d7zfeij,disability,1,,,,
19,"Was it for long periods of time? Or was it just playing? Was there trash in it? 

Make sure you know the whole story before you upend their lives",,,,cmst239,para power,,1474250232,t5_2qhe8,t3_53ez3t,t3_53ez3t,3,1475821878,0,0,d7slpvx,disability,3,,,,
20,"disabled/crippled is my go-to. I have reclaimed the word 'cripple' for myself after dealing with a lot of self-hate/bullying growing up (been wheelchair bound since grade 2) but it makes a lot of able-bodied people uncomfortable when I use it... lol

able-bodied people are funny",,,,moonk-,,,1474681806,t5_2qhe8,t3_53asuy,t3_53asuy,1,1475998209,0,0,d7zo2ug,disability,1,,,,
21,"No medication inherently means a person has a disability, and even further, no disease is classified by the government as ""disabled."" The ADA outlines categories of life activities, and if you have, or even in some cases are perceived as having, an impairment that leads to your inability to perform one or more life sustaining activity, you can seek reasonable accommodations through your employer and your government under the ADA. 

For example, some people with rheumatoid arthritis have their condition well under control and might be going out climbing mountains on the weekends and capable of performing all sustaining life activities. However, one person might be unable to even dress themselves. The second person would qualify for disability status under the ADA. The impact of the disease on the individual can very so much that the decision was to look at a persons capability or incapability of performing certain ubiquitous life functions. This is why the government is not in the business of classifying any particular disease or condition as disabled. Also could you imagine the outcry! If the government suddenly declared that everyone taking a high blood pressure medication was disabled... some people would be unaffected, some would be infuriated as they are otherwise healthy, and others would attempt to flood or ""game"" the system. This is why we look at it on the individual basis. 

So, to specifically answer your question, no diagnosis is universally considered disabled. Your friend may well have qualified for accommodations based on her ability or inability to perform life sustaining functions you never personally witnessed, or she could be perfectly fine and her medication enabled that. No way to tell. ",,,,zebra-stampede,,,1472941134,t5_2qhe8,t3_50w0yh,t3_50w0yh,1,1475309168,0,0,d78gv23,disability,1,,,,
22,"I understand your logic but it is how people treat the Deaf and Hard of Hearing people. When they learn that we are ""hearing impaired"", they has this tendency to condescend us or feel sorry for us. They also think since we can't hear, we can't do anything else like drive, eat, breathe, play, sleep, whatever you name it, hence the word ""broken"" associated with ""hearing impaired"".

We just can't hear to a certain degree but everything else is in working order for us and we can do pretty much everything a normal, capable person can. It's just the general negative attitude and reception we get when they label us ""hearing impaired"". 

I have a deaf friend who can't see in one of his eyes and he labels himself, ""deaf and half blind"" so to each their own. 

&gt; It doesn't mean the person is less than other people. 

Wish a lot of people share the same thinking you have, but unfortunately that isn't the case, at least with my experience as well as my peers. ",,,,Frustrated_Deaf,,,1474238439,t5_2qhe8,t3_53asuy,t1_d7s3qmx,1,1475816690,0,0,d7sdtjh,disability,1,,,,
23,"What zebra said.  Also, don't admit that you expect to pay for anything, appeal everything and act like it is all properly owed to you.  Most insurance companies will do a meet you in the middle type game with appeals, so aim high and you'll stand a better chance of getting what you want.",,,,the_turtle_hermit,Spouse--LGMD,,1474381285,t5_2qhe8,t3_53jzpq,t3_53jzpq,1,1475871194,0,0,d7ulijz,disability,1,,,,
24,"&gt;Is it worth submitting any information on my GI problems or would that just be ignored?

Submit everything, always. You want to appear as unhealthy as possible.

Edit: Not saying you aren't, obviously. When I say you want to ""appear"" as unhealthy as possible, what I mean is... when SSD asks about your ""typical"" day and what not, you don't tell them about your good days, you know?

As to not being able to drive, does your city public transportation? If so, they may have a special system for disabled persons who cannot drive and who may not be able to use the regular bus. For me, I was able to use this system because I use a rolling walker and there were no sidewalks between me and the bus stops closest to my house. In your case, your doctor may certify that you can't use public transportation due to your back pain (exhaustion/inability to walk long distances to bus stops, busses can be awfully herky-jerky and pain inducing!) and your anxiety (the anxiety of a press of people, the anxiety of bus schedules, etc.). Cost will vary. In my city the one-way trips to wherever I wanted to go, while not always convenient (they often got me to doctor's appointments over an hour early) were cheap at $1.95. They'd also recently partnered with Yellow Cab to where for short rides of under 3 miles we could call a cab up to 21x a month.",,,,BeastOGevaudan,,,1475097817,t5_2qhe8,t3_54alwi,t3_54alwi,1,1476159077,0,0,d862otk,disability,1,,,,
25,"I agree about the focus.  I'm hoping to see more of Dylan (the youngest), whose personality I *love*, and I hope to see more of the dynamic between dad &amp; the kids.",,,,TheOneTrueCripple,"Spina Bifida, Hydrocephalus, Type II Chiari Malformation",,1474659729,t5_2qhe8,t3_53yxkt,t1_d7yikt6,1,1475988698,0,0,d7za7qj,disability,1,,,"I agree about the focus.  I'm hoping to see more of <PERSON> (the youngest), whose personality I *love*, and I hope to see more of the dynamic between dad &amp; the kids.","[{'start': 52, 'end': 60, 'entity_type': 'PERSON', 'text': '<PERSON>', 'operator': 'replace'}]"
26,"I know, I was really upset by it too. And then I saw another article about another disabled woman in a similar position today. I can't handle the feels. I appreciate that you commented though, it helps to vent anger and hurt with other people who get it I guess. ",,,,TinyLittleStormCloud,,,1472755930,t5_2qhe8,t3_50g3sy,t1_d75ow2u,1,1475240254,0,0,d75qx7c,disability,1,,,,
27,I own a powerchair. I don't go out in rain or extreme heat/sun. So that's a no. ,,,,Frugalista1,,,1475187640,t5_2qhe8,t3_5545pu,t3_5545pu,3,1476194941,0,0,d87iv7m,disability,3,,,,
28,"Then they would be labeled ""Hard of Hearing (HoH)"" and still not hearing impaired. 

People do have a choice to label themselves however they wish, but the majority of this community, the Deaf and Hard of Hearing community, hates the label, ""hearing impaired"". 

Hearing impaired may be ideal for people who has been hearing their whole life, but lost their hearing due to old age, some kind of condition, or a sudden trauma, then they would prefer the term ""hearing impaired"".  ",,,,Frustrated_Deaf,,,1474223762,t5_2qhe8,t3_53asuy,t1_d7s1fb6,3,1475809008,0,0,d7s2ibe,disability,3,,,,
