commentator_id,created_utc,anonymized_body,ups,downs,score,controversiality,gilded,distinguished
7e68e93f-4294-4c4f-80ee-c7fb2f4e0a9a,1491234041,"The destroyed medical records thing is bad news. 

I did go to the SSA office here and the person I talked to was lovely and encouraging. 

I do have the ability to track down my educational records and since my guidance counselor came to the hospital to participate in some of the meetings while I was there, I suspect there would be some mention of my hospitalization in there. Obviously that is not as compelling as the records themselves if I cannot get them. 

I think it shouldn't be all that difficult to prove continuation of disability. I mean, when I was 26 I went on a manic binge for a few months that resulted in a 2 and 1/2 month $30k spending spree and a subsequent bankruptcy filing (that finally drops off next year and is probably the reason I have a payee). My college transcripts manage to show good grades in the classes I completed, but they are full of dropped classes and withdrawn semesters. It's not like it looks like a straight arrow even keel type situation even on paper. 

The medical record thing could be tricky though so thanks for the heads up. Perhaps the only saving grace in this whole situation may be the guidance counselors I had that I spent a ton of time with when I was in school that were genuinely concerned and probably documented that concern in some detail in my records. It's spring break here this week so I won't know until I see them. I am aware that guidance counselors are also not likely to be looked at with the same level of seriousness as medical providers, but it is some kind of documentation and I suspect my diagnosis etc is in there somewhere. 

I do appreciate your comments and time. ",,,2,0,0,
7e68e93f-4294-4c4f-80ee-c7fb2f4e0a9a,1493297693,"I hear what you are saying, and I am well aware of what it looks like to the public. 

I am even aware of *some of that employment information myself because I did have a small period where treatment seemed like it might provide some benefit but it ultimately did not for me. 

I will tell you that I have a college degree and am fairly intelligent and persistent and it was difficult for me to determine what the actual information is regarding employment and social security. 

What I gave you was the feeling that most people I know have about the situation. The information is not easily accessible and there is a TON of misinformation out there. People will tell you, ""if you get a job of any kind, SSA will think you can support yourself working and end any benefits."" Since, as I stated, SS benefits are a literal lifeline to many people, people are not willing to risk it. People are not going to come into the office or call and ask those questions either because they don't want their case flagged or something because they asked questions about employment. There is a lot of mistrust and fear largely due to the lack of transparency and information. 

If people understood the seeming lottery system for why some people are approved in three months and why others have to fight for 3+ years, perhaps this would be less terrifying. If the appeal hearing backlog wasn't 3 years. I mean, just things like that. It seems very arbitrary to people so that creates a large element of fear. 

To you, someone on the inside, you see all of the rules and policies. To someone who has to deal with your office, we see the way it impacts our life. It feels random. It feels random when someone I know with a disability that has been documented medically for maybe just over a year (and is definitely a disability) gets approved immediately, while my disability which was documented with notes from a specialist in almost 20 visits a year in at least a three year span, got denied and scheduled 3 years out for an appeal.

It scares people when they don't understand a system. The information may exist but it's confusing and complicated. The fear prevents people from coming in to ask about it. 

This is a huge issue for people granted disability.
It is how people get ""stuck."" ",,,1,0,0,
7e68e93f-4294-4c4f-80ee-c7fb2f4e0a9a,1491190713,"Lmao. No. My highest income in a year was a little over $6000. That was maybe when I was 26. It was also possibly less than $6000. I don't really remember. It was when I made $15 an hour full time for a couple of months. And had a job at minimum wage earlier in the year for a month or so 8 hours a week or something. Like that was my most profitable year ever. Sad. 

Thanks again for the input. ",,,1,0,0,
7e68e93f-4294-4c4f-80ee-c7fb2f4e0a9a,1491226248,"Well, no lawyer wants to touch this. Big shock. ""That is going to be a lot of work."" 

So, I guess I am going to sit at SSA this morning and ask how stupid this is. Always sort of terrifying for fear of messing something I already have in place up. Ugh. Truly terrifying honestly. I am just really hoping and putting my faith in the idea that these are just people like everyone else that come to work and do their jobs and not some faceless government agents determined to cull the herd. 

I know these people have to be just people. It's just a scary place.
",,,2,0,0,
7e68e93f-4294-4c4f-80ee-c7fb2f4e0a9a,1492277872,"I am guessing they mean the Chinese government the way that you worded that. China is still a fairly restrictive state in a lot of ways and quasi communist so the appearance of equality of people is very important. In order to give someone special privileges in a line, I have to assume that a business (in this case Disney), would require some kind of authorization from the Chinese government to allow that. Especially given that the disability in question is an ""invisible"" one (I.e., not requiring a wheelchair). 

The problem you may run into with this is that China has particularly uncomfortable views on mental illness. Psychiatric hospitals are still used as places of punishment for political dissidents. Having a psychiatric diagnosis makes you somewhat suspect due to that and just a long standing harsh stigma in general in that society. 

Personally, I am not sure I would be comfortable alerting the government officially that I was coming into the country with a diagnosed mental illness. While they will obviously see the prescriptions upon entry, that is when you are already there. Assuming you are a US citizen and have applied for the VISAs required etc, asking for something like this could cause them to pull the VISAs theoretically. 

Mental illness is not exactly loved or accepted all over the world. Do your own research on this, but I have looked into the current situation in china surrounding mental illness and while it isn't overtly hostile, it is also not welcoming or understanding. 

As an example of this, I have a friend from China who is willing to treat his depression by taking a pill, but will tell no one, and absolutely refuses to see a therapist. He has lived here for 20 years and he still is dead set against therapy. Taking a pill is kind of okay because then it is ""just a medical issue."" Turning it into anything more than that is terrifying to him. It was his reaction to all of that that caused me to look into the current climate in China. 

Like I said, explore further. The US state department might have some solid information or advice on this subject actually and could be a good resource. It may or may not be an issue. I would find out before you announce anything officially to the Chinese government though. 

Edit: So [this article ](http://www.economist.com/news/china/21715701-sufferers-are-routinely-treated-danger-society-china-wakes-up-its-mental-health) from The Economist back in January of this year describes the current situation for people suffering with mental illness in China. It talks about how the government is still rounding people they know to be mentally ill up before important events because they are seen as potentially dangerous. It describes people being subjected to involuntary ECT treatment for postpartum depression in unpleasant and downright terrifying sounding facilities. As I said, I would speak to the State Department here before you talk to China. ",,,1,0,0,
7e68e93f-4294-4c4f-80ee-c7fb2f4e0a9a,1491249672,"Yeah. I talked to the school district I went to for 3 semesters. The whole area is on spring break but the admin building said that those records are housed at the high school and that they should include not only my transcript but any other information that was in my file. So crossed fingers that the guidance counselor who was so involved back then also took good notes. There is another school I attended for one semester and was also heavily involved with the guidance counselor at, but it is a private high school and they are also in spring break and don't have a central administration obviously to talk to per se. They are part of the Catholic system here but I'm assuming they deal with their own records so I will call them next Monday when school is back in session.

So really, the only records that are iffy are the outpatient therapy/psychiatry/partial program ones from the one clinic. I put a call into them but I don't have the best hope there since that clinic has moved  (once) in the intervening two decades. They may have warehouses them. I will find out soon enough. 

I was even able to get a transcript from the university I attended for half a semester when I was 18 and withdrew from. I am fairly certain that is not possible with the 4 or 5 graduate programs I started in my late 20's since I dropped all of those before a ""W"" was even entered so no transcript exists.

Other than that, I'm assuming SSA has access to my employment history and I have all of my transcripts from the community college and later, the university I eventually graduated from after 8 years. I will be able to get the high school ones and if I remember correctly those are ridiculous. I think my sophomore year it shows me being absent more than 70+ days out of 180 or something. And that I didn't return to finish junior or senior year. 

I sort of fully expect this to be denied on round one, but I might have a chance with an appeal I guess. We'll see. The lady at the SSA office was very kind today and set an appointment for me and my mom near the end of the month. ",,,1,0,0,
7e68e93f-4294-4c4f-80ee-c7fb2f4e0a9a,1491235784,"So I found out my inpatient hospitalization records exist. I don't know about the outpatient treatment records. The diagnosis was made during the hospital stay but the continuation of care, therapy, and subsequent partial program a couple years later was at that outpatient clinic. I guess it's just a waiting game. 

At least the hospitalization record exists. This seems like a better than 0% thing so I will pursue it. I'm not overly hopeful but any chance at having a future that is not horrible is worth looking into. The security it would provide me and the sense of peace it would give my mom is sort of worth the leg work.

I guess I'll find out eventually. The worst thing that happens is things stay how they are I suppose. ",,,2,0,0,
7e68e93f-4294-4c4f-80ee-c7fb2f4e0a9a,1493302694,"I really appreciate you replying to this. I do appreciate that you contribute here. 

I don't actually think that people who work for the SSA sit around and try to figure out how to deny people. I think a lot of other people think that though. 

It does seem difficult to access the full picture about some of these services or programs or that conflicting information exists on different government websites. It is sometimes a challenge to sort all of it out.

Regardless of validity, it is stressful to have to go to SSA. It feels like grabbing the dragon's tail. I always find out that the person I end up meeting is very nice and helpful, but it never feels like it is going to be beforehand. 

I think it is amazing that you come here to try to demystify things for people. 

Thank you. ",,,2,0,0,
589f63c3-bad5-4542-ac39-e0e5a5dc6591,1492476981,"Which could have been for a mess of reasons outside of ""she's fat.""",,,1,0,0,
589f63c3-bad5-4542-ac39-e0e5a5dc6591,1492400835,"The problem with this picture is not ""fat people in mobility devices."" 

The problem is ""Selfish people blocking the view of a child.""

It could be a thin but tall person that makes it so the child can't see over their head. It could be another child in a bulkier wheelchair that blocks the view.  Using weight as the ""They're just lazy and abusing the system"" is still a problem. You don't know if the women are disabled. It's none of your business. 

""Fat is not a disability"" is just a way to express bigotry while marginalizing some disabled people -- who happen to be fat.",,,3,0,0,
589f63c3-bad5-4542-ac39-e0e5a5dc6591,1492382108,"There are plenty of fat people out there that are actually disabled. Don't go assuming anyone is or isn't disabled.  It's no better than judging someone who ""looks healthy"" who is disabled.",,,7,0,0,
589f63c3-bad5-4542-ac39-e0e5a5dc6591,1492457352,"I agree 100% that her demanding to get off was 100% wrong.

But bringing up her weight is wrong, too, because the issue isn't her weight. It's her rude and inappropriate behavior.",,,5,0,0,
589f63c3-bad5-4542-ac39-e0e5a5dc6591,1492384351,"She was completely wrong to demand the cart from you.

You have no way of knowing whether she was actually disabled.  ""My feet hurt"" could be from severe arthritis, physical damage, or some other issue that makes her disabled.

Nobody should judge whether another person is disabled just by how they look. ""They're fat, so they're not disabled"" is just as wrong as ""They can walk fine, so they're not disabled.""",,,7,0,0,
5196f89a-623d-4a77-b49e-d2a7822b9402,1491454163,"She's likely your representative payee, thus she is to manage the funds. ",,,1,0,0,
5196f89a-623d-4a77-b49e-d2a7822b9402,1491453670,Check out the Job Accommodation Network (JAN),,,2,0,0,
5196f89a-623d-4a77-b49e-d2a7822b9402,1491453457,http://www.disabilitysecrets.com/resources/social-security-disability/ssdi/keeping-benefits-continuing-reviews.htm,,,1,0,0,
5196f89a-623d-4a77-b49e-d2a7822b9402,1491453854,How old are you? Are you regularly seeing appropriate specialists for all conditions that limit you in any way? And establishing decrease in functionality with each?,,,1,0,0,
5196f89a-623d-4a77-b49e-d2a7822b9402,1491453302,"In the US only 6 states/territories offer statutory Short Term Disability: California, NJ, NY, RI, HI and PR. 

Social Security Disability Insurance (SSDI) doesn't cover short term disability. There's a 5 full calendar month unpaid waiting period and conditions must be expected to be fully disabling for at least 12 mo. ",,,1,0,0,
5196f89a-623d-4a77-b49e-d2a7822b9402,1491453964,Hopefully he has a good SS attorney who SOLELY does as law. ,,,1,0,0,
aae7c254-aa01-4ce4-83ba-64398c3b7be8,1491361045,"I live in a small town, but often travel to larger cities.

In terms of transit and generally getting around, bigger cities are so much easier. I actually had to stop taking the bus in my town (and broke down, got driving lessons and bought a car) simply because the buses would just drive past me if I was the only one at the stop (and when they did stop, it was like lowering the ramp was some huge favor). I've never had any issues with public transit in big cities.
 
Large crowds can be annoying in big centers, but often the general infrastructure is better. ",,,3,0,0,
aae7c254-aa01-4ce4-83ba-64398c3b7be8,1491981490,"You are not the only person this happens to. Just this past weekend I went to a church dinner where afterward they had a nurf-gun battle in the basement. My friends offered to help me down the stairs and get me into a spot where I could be a sniper, but I was already feeling rather tired, so I made the choice to leave.

Disclosing your disability may help a lot, but at the same time, I have certainly drifted away from people due to their choices in activities. I had this one friend who turned really out-doorsie once she met her (now) husband. I was actually in her wedding and forced to treck to the middle of nowhere for her wedding and it nearly killed me. Even now, her idea of a fun hang out is hiking (even in the middle of winter) and it sucks but I have to decline.

I guess I deal with it by knowing when to move on, get involved with people who take things at my speed.


Also, just a FYI - most college buildings have to have some sort of elevator. ",,,2,0,0,
aae7c254-aa01-4ce4-83ba-64398c3b7be8,1492014059,YOU mentioned that you were freeing out about an event happening on a second floor of a college. I merely stated that most colleges HAVE to have some sort of elevator.,,,1,0,0,
aae7c254-aa01-4ce4-83ba-64398c3b7be8,1493154269,"All that is nice, but completely irrelevant. You have NOTHING to worry about. I have mentally disabled great-uncles, both with the fictionality of 13 year olds. They both live in group homes now that they are in their 70s, but they are still in control of their personal finances (and were totally independent as adults).

A person has to have like the mental capabilities equal to that of a small child before courts will even consider appointing a guardian for an adult. ",,,3,0,0,
aae7c254-aa01-4ce4-83ba-64398c3b7be8,1492977874,"No. If you are over the age of 18, there is nothing your mother can legally do to control your life. It is actually a bit of a legal process for parents/guardians to remain in control of an adult child's situation (IE controlling finances and whatnot) and the adult child has to be proven by a doctor and sometimes other professionals to need a court appointed guardian. You can read more about the process [here](http://www.friendshipcircle.org/blog/2012/10/16/when-your-child-turns-18-a-guide-to-special-needs-guardianship/) so I don't think any court would give your mother the time of day considering your disability is only physical. 


My mother was very much the same way - she did not want me to move out at all (the guilt trips when I was in the process of finding a place and figuring out how I could be independent were part of the reason why I left). Eventually when I figured out everything and left, she got a lot better once she realized I could live on my own. I say igore her. You are no different than any other almost-college graduate.",,,10,0,0,
a973010f-4923-4faa-8cc4-1a3fb49ebc15,1492450166,"&gt; ""now how you deal with this whole identity business is up to you.""

I decided that when it comes to autism, I will identify myself as a ""person with autism"" and when it comes to disability in general I will identity as a ""person with a disability"". Personally, I prefer this combination because there is consistency between the two and I do not consider ""person with autism"" derogatory (at least when it is referred to myself).",,,3,0,0,
a973010f-4923-4faa-8cc4-1a3fb49ebc15,1492450254,"I decided that when it comes to autism, I will identify myself as a ""person with autism"" and when it comes to disability in general I will identity as a ""person with a disability"". Personally, I prefer this combination because there is consistency between the two and I do not consider ""person with autism"" derogatory (at least when it is referred to myself).",,,1,0,0,
a973010f-4923-4faa-8cc4-1a3fb49ebc15,1492444048,"Thank you. I agree. I should be free to identify with my autism how I please. I shouldn't let a person (even if they have good intents) convince me or impose their views on what they view is the correct way for me to identify myself as because ultimately, only I can know what I am comfortable with.

Think about it. A person telling me that I should identify as an ""autistic person"" as opposed to a ""person with autism"" is like a person telling a gender-nonconforming person named Allice that they should identify as ""genderless"" instead of ""genderqueer"". Do you see the analogy?",,,2,0,0,
a973010f-4923-4faa-8cc4-1a3fb49ebc15,1492450239,"I decided that when it comes to autism, I will identify myself as a ""person with autism"" and when it comes to disability in general I will identity as a ""person with a disability"". Personally, I prefer this combination because there is consistency between the two and I do not consider ""person with autism"" derogatory (at least when it is referred to myself).

",,,2,0,0,
d42770b1-9f84-462c-9536-090461a2ff56,1493349146,"after I had my shoulder amputated I couldn't walk at all..

but that's because I also had my legs amputated",,,1,0,0,
38e3e564-5493-4e55-a871-9a30954871e8,1491312828,"Nice! I used to swim as well, but then I found basketball :). Hope your shoulder recovers soon!",,,3,0,0,
38e3e564-5493-4e55-a871-9a30954871e8,1491462051,He thinks it's okay to kill babies with spina bifida. Why? I have spina bifida and I'm living a perfectly fine and normal life. What the hell?,,,4,0,0,
ba7a07b3-5a1e-4d3f-ac84-9d7853ab4af1,1491840856,"Interesting, that sounds like you had one of those non-genetic causes, like a uterine accident etc. there's a really wide variety of weird accidents that can happen during fetal development and we're still learning about what contributes to them.",,,3,0,0,
ba7a07b3-5a1e-4d3f-ac84-9d7853ab4af1,1491839526,"I used to work in a pediatric orthopedic research clinic and processed clinical images. There were several cases I saw with syndactyly, synbrachodactyly who also had PFFD. genetics has moved on considerably since you were small, I wonder if there's more known now about it. I was born with a really rare spinal cord lesion and I look back at the research every so often just to see if any more is understood about my condition. 

Here's an interesting article I found about hand genetic anomalies related to other conditions, FYI: http://195.186.81.45/isdsch/PDF%20Files/GeneticsHand%20AnomaliesSchwabe.pdf",,,2,0,0,
ba7a07b3-5a1e-4d3f-ac84-9d7853ab4af1,1491840581,"There's a difference between hereditary and genetic. Genetic anomalies can exist and be spontaneous and not yet hereditary, and two genetic limb deficiencies can have a common cause and weren't hereditary (though any changes in genotype are heritable from the affected individual). I don't know about your case obviously :) 

",,,4,0,0,
ba7a07b3-5a1e-4d3f-ac84-9d7853ab4af1,1491838593,Are you related to the person who posted a pic of his hand missing a pinky on r/mildlyinteresting today? ,,,2,0,0,
7466dc5a-306a-45dc-a6fe-e08e37c38515,1493201474,"First, I want to recognize that the concept of speaking directly about how to advance integration for the next generation is important.  I wonder if the approach ought to be more subtle - picture books that include kids with and without disabilities playing side by side.  The new Sesame Street character, for example, seems great -- I loved seeing the clip and recognizing characteristics of kids I know along with a message on friendship.  Kids should see inclusive images and that also opens the door for families to talk.",,,3,0,0,
7466dc5a-306a-45dc-a6fe-e08e37c38515,1493207805,"Bring your local office the rental agreement plus a copy and ask them to sign or stamp the copy received and the date.  You should be due a full check from the time you supplied this -- likely your next check, although it can take time to process.  One point - you might have to show $250 is reasonable market value to rent a room in your neighborhood, so that you aren't receiving a subsidy.  FYI, food stamps can also be reduced if you live with family -- must show you purchase and prepare food separately.  ",,,3,0,0,
7466dc5a-306a-45dc-a6fe-e08e37c38515,1493595127,"Yes, if you both contribute you should be good.  Remember that if you get food stamps you have to purchase and prepare food separately to be considered 2 household of 1 versus a household of 2.  And yes, marriage would impact SSI benefits.  Dominic Evans writes some great stuff on the marriage penalty for people with disabilities ",,,2,0,0,
7466dc5a-306a-45dc-a6fe-e08e37c38515,1493583458,And call your state vocational rehabilitation agency.  I'll bet they have benefits counselors who can help,,,3,0,0,
7466dc5a-306a-45dc-a6fe-e08e37c38515,1493201729,"That form means the SSA is trying to locate you -- and yes, it should have gone to the Post Office.  Likely they had some mail sent to you that was returned.  Call them and send a letter to make sure they can reach you -- last thing you need is a suspension of benefits because they think they have the wrong address.  Good luck!",,,1,0,0,
7466dc5a-306a-45dc-a6fe-e08e37c38515,1492997965,"There is a marriage penalty for SSI.  I know a bunch of people who haven't gotten married because they can't afford the cut in benefits.  Here's a good article on the issue:  

http://www.dominickevans.com/2015/06/some-people-with-disabilities-are-prevented-from-getting-married-and-heres-why/",,,2,0,0,
