commentator_id,created_utc,anonymized_body,ups,downs,score,controversiality,gilded,distinguished
6ef2492b-4a72-4170-a246-0d3f3c11855a,1511213621,"1. I agree that it's a two way street and people on both sides should try to find ways to communicate better.

2. I agree it is a problem when someone totally avoids a person due to them being socially awkward and it would be great if we could change society to be a bit more tolerant and understanding and also give people more information about autism spectrum disorders and how to be effectively communicate.

3. The studies had absolutely nothing to do with anyone's lack of empathy. It doesn't appear the study participants who rated people even know the people they were rating were on the spectrum. 

Having a lack of empathy would be a person being told that someone is autistic and told that person will be socially awkward and then told ways to accommodate said person and then willfully and completely ignoring this information. Making claims that the other person is the problem and saying they are not obligated to change. While that does happen and its fucked up, that wasn't what the studies were about.",,,5,0,0,
e038a184-d3ea-496f-9f65-20567dafebfe,1511240005,"Yep. It happens with everything in life to be honest. People empathise better when they personally understand what you are going through, normally by having experienced it. Kind of a no-brainer.",,,1,0,0,
cebb40e2-bf23-4271-9488-392ed59daecf,1511195726,What does neurotypical even mean? Not autistic? So all the people with severe neurological problems are just typical then. ,,,6,0,0,
8a04b6f0-e845-4da9-8f53-83a4c83565d4,1511198375,"...The word “neurotypical” was initially invented by Autistic people to mean non-Autistic. 

It is now broadened to mean any people with no cognitive disabilities or mental illnesses.

The article used the outdated version of neurotypical, so I was matching their name. 

In addition, the now “true” term of non-autistic is “allistic”. Given that the vast majority of people here won’t know that that means, it also made more sense to go for a slightly inaccurate, if easier to understand, word.

I don’t need this aggression today, dude.",,,5,0,0,
c4c6a003-cc26-4573-8be1-5282e9e1ee65,1511498081,What's with the classy scare quotes around neurotypical? ,,,1,0,0,
9a8bc462-37ef-4901-bf80-0211f51f4604,1511213200,"If you look at what central neurodiversity advocates actually say, they absolutely *do not* say that neuroatypical people do not have problems or need help. Go to the original sources rather than what *others* **say** it means. First impressions are not always accurate. 

Here's at least one person at the center of the neurodiversity movement: http://neurocosmopolitanism.com/neurodiversity-some-basic-terms-definitions/  ",,,3,0,0,
9467eb37-981d-4ca7-8d4b-0d1f920f1dca,1511239816,"Ohhh, the irony. 

That moment when disabled people downplay or invalidate what you have to go through. They are not the ultimate authority, and I support your side, just like I support differing perspectives from others who are also autistic. But neurotypicals talking down to you with their uneducated opinions like it's fact, makes my blood boil. 

Bunch of unempathic people in here, eh? Maybe they should just have their disability checks on hold until they take sensitivity training. :-) No, not really, but yeah.",,,4,0,0,
6ef2492b-4a72-4170-a246-0d3f3c11855a,1511207499,"The study in no way says that the a ""neurotypical"" person is less likely to empathize with an autistic person. 

This is the study: https://www.nature.com/articles/srep40700

""neurotypical individuals likewise have difficulty interpreting the mental states of those with ASD. Thus, difficulties with social interaction for individuals with ASD may be a bidirectional problem, not just an individual one.""

The study says that ""neurotypical"" people will avoid interactions with autistic people due to poor first impressions or previous bad social interactions. Basically if a person meets another person and they think that person is awkward/weird/creepy/rude what have you, then most typical people will just avoid them.

In all 3 studies, people were asked to rate those with autism and those without on how likely they were to hang out with the person or how awkward the other person seemed. Obviously the results were that they thought the autistic people were more awkward and they were less likely to pursue social interactions with them.

Someone who is autistic does not communicate with body language and facial expressions in a way that others expect, and in return ""neuro-typical"" people respond by wanting to avoiding them. This has nothing to do with how empathetic anyone in either group is.

Basically the blog article is way over stepping and making up things that weren't in the original study.",,,5,0,0,
c4c6a003-cc26-4573-8be1-5282e9e1ee65,1511499775,"Of course, most other folks with different disabilities aren't inaccurately stereotyped as being unable to empathize with others themselves.  This is important to discuss particularly in terms of autism because we grow up being told that we're fundamentally broken and this neurotypical with an education will teach you how to properly empathize.  Even if their own empathy is minimal and they treat you like shit because they're unable to imagine what having sensory differences is like.

This is particularly important when discussing autism because a lot of treatment, if improperly applied, sets up neurotypical social behaviors as the gold-standard for empathy.  The discussion tears down a false preconception, that a neurotypical is going to be inherently more empathetic than an autistic person, which is one of the justifications that gets used to ignore a therapist or caregiver who is being abusive to warp therapy into attempts to produce NT children rather than autistic children with a better quality of life.",,,2,0,0,
8a04b6f0-e845-4da9-8f53-83a4c83565d4,1511211574,"Hey, as a note: “people with autism” is not the preferred language, dude.

I also don’t know why you think I need to be told why non-autistic people don’t like autistic people. As an Autistic person, I am *very* familiar with the idea that I am less likeable due to my “body language and facial expressions that others don’t expect”.

However, the simple fact is that, as a rule of how we are raised, autistic people are taught to bend over backwards to learn all about how non-autistic people emote, behave, react, etc. I have gone through hundreds of hours of patronizing and infantalizing “therapy” teaching me “proper” social interaction, and despite all my hard work to constantly make other people comfortable, I’m still seen as creepy/awkward/unfriendly.

On the other hand, non-autistic people see us doing something like not making eye contact and instantly, from that tiny factor, assume we are less likeable and dismiss our words. Instantly.

I have been forced to constantly “empathize” and be kind to people, even people who are legitimately ableist, manipulative, and have no interest in doing the same. I have gone through 8 years of compliance-based training to teach me to say yes to everything non-Autistic people want from me, to make myself uncomfortable and to put myself through actual pain so that non-autistic people can get their beloved eye contact, but they can not for a single minute not make shitty and baseless assumptions about me based on a few minutes of lapsed eye contact.

I would call that a lack of empathy.

I would call that a lack of theory of mind.

If you can’t even fathom that other people might have different sensory experiences than you, and punish them for that, that’s a lack of empathy.
",,,3,0,0,
cebb40e2-bf23-4271-9488-392ed59daecf,1511203272,"Nothing against you whatsoever, I knew as a good reddit you were quoting the title.


I see that word everywhere now and it feels like, oh, OK, well then, neuro disorders no longer matter it seems. I'm all about supporting the autistic community and reducing stigma, but it's a big kick in the teeth to try to help one disability by denying the other exists. ",,,4,0,0,
7c974207-802b-4dd7-be3b-58b6149370a2,1511349218,My go to gloves are double layer military surplus fingerless gloves. Down side is I look slightly homeless. Upside I keep my hands nice and toasty while having the dexterity and fingertips to use my phone.,,,1,0,0,
7c974207-802b-4dd7-be3b-58b6149370a2,1511349845,"Im in the UK so we rarely have really cold winters and the gloves cover about half my fingers so they keep me pretty toasty, but yes if my core temps not warm my fingers will also get cold. This looks like the kind I have https://www.amazon.com/Rothco-GI-Wool-Fingerless-Glove/dp/B018MSVC3U The double layer is really important as the single layered fingerless gloves I have had don't cut the mustard warmth wise.

Just as a disclaimer Im transitioning to using a wheelchair, so maybe Ive got completely the wrong end of the stick and they are a terrible idea for wheelchair use.",,,1,0,0,
768b9949-62fd-44b9-8000-78af7bb1dd37,1511489196,I'm in Michigan and a manual user. I use Seal Skinz for when it is snowy and wet out and then switch out to another pair (I think the pair I have now are Isotoner or Northface) when it is just plain cold. ,,,1,0,0,
f7e954d9-28f9-4f2a-9ecc-2d2df6169938,1511295246,"I recently switched from gloves to waterproof (and heavily insulated) mittens. That made a world of difference for me. Sure, I lose a little dexterity, but this way my fingers can keep each other warm with the body heat. I'm particularly bad with cold weather and when my fingers are seperated, there was nothing I could do and do amount of layers I could glove on to keep my hands comfortable",,,2,0,0,
a4971c12-bd11-4807-a068-2967303bbab0,1511349319,But won’t your fingers/fingertips be completely cold?,,,1,0,0,
e038a184-d3ea-496f-9f65-20567dafebfe,1511516280,"If you're looking for a way to make your wheelrims warmer there are a couple options. You can buy rims like the [Natural Fit](https://images.duckduckgo.com/iu/?u=http%3A%2F%2Fwww.spokz.co.uk%2Fcms%2Fgalleries%2Fimages%2Fnaturalfitshowc_1457626409.jpg&amp;f=1) ones (various brands available along these lines) which replace your existing pushrim. You can also buy covers that just slip [right over your pushrim](https://images.duckduckgo.com/iu/?u=http%3A%2F%2Fwww.mobilityforyou.co.uk%2Fnews%2Fwp-content%2Fuploads%2F2017%2F01%2FPushrim-Covers-Pair-600x600.jpg&amp;f=1) and provide some insulation, they come in all sorts of colours.

If you're going for that second option and live in an area that gets ice, don't bother buying wheelchair-specific covers. They're expensive and in my experience the grit put down for snow and ice destroys the covers in no time. Instead look for some thick silicone or rubber tubing in a DIY store and cut a section out lengthwise so it fits snugly on your pushrim. Cheaper and so you'll be less reluctant to toss and replace. I'd advise against tape because the wet will make the glue loosen and the tape may unravel, and you don't want to risk tape getting caught in your wheels (either set) or around the axle and causing an accident.

I would still make sure you get a good pair of gloves though, grip on gloves is less important with a pushrim cover but normal things like zips on your coat, getting out your wallet, even just pulling gloves on and off will be much harder with cold hands even if you can push your chair.",,,1,0,0,
744b2045-b709-4eef-a559-922cd44a81aa,1511521322,"Man, this is really valuable info. Gloves in the winter have always been a crapshoot. I'm definitely going to be ordering 2 pairs like you suggested. I live im Boston and the winters for us wheelies are just....ugh. Too much. This at least makes one aspect easier and a huge difference over all. Thanks so much for taking the time. Take care.",,,2,0,0,
768b9949-62fd-44b9-8000-78af7bb1dd37,1511489256,I've been in a wheelchair since I was two and it is a struggle every year to find something that works.,,,2,0,0,
e038a184-d3ea-496f-9f65-20567dafebfe,1511484982,"I'm assuming you are a manual user. I use [these](https://www.arco.co.uk/products/14A4400?s=1) after a lot of trial and error. They are fully waterproof, fleece lined, velcro fastening at the wrist, available in several sizes. Have good dexterity for pushing, rubber coating means fantastic grip including in rain and snow.

Cons, they don't hold up well if you push directly on the wheel instead of on the handrim. When I go camping with my off-road wheels (think mountain bike tires) where I push directly on the tire, they show wear on the first day and are fucked by the end of the weekend. They're not conductive so you can't use your phone without removing them and I struggle with coins. Notes are fine. They're bright blue and don't come in any other colour.",,,2,0,0,
e038a184-d3ea-496f-9f65-20567dafebfe,1511484396,"&gt; maybe Ive got completely the wrong end of the stick and they are a terrible idea for wheelchair use.

I'm afraid that for me, as a full time wheelchair user, these would be less than useless. They are fingerless, not waterproof and have no grip to stop at speed or in the rain. When it gets to freezing (which is already is, in the daytime, in my part of the UK) you're going to touch a cold metal handrim with your exposed fingers or your wet glove and it's going to be miserable. Your dexterity is going to be through the floor which makes the fingerless bit useless anyway and although wool dries out quickly, in the rain a wet glove just makes your whole hand cold.

If you live right in the south of England where it doesn't get very cold you might be fine, or if you only have to get in and out of the car with little time spent out in the open. But if you spend any considerable amount of time outside, especially when it gets wet, these are no good. These are the kind of glove I'd use in the summer, except not even then as they don't have any kind of grip against a metal handrim.",,,2,0,0,
1837e361-dfc4-4968-8780-6d62d0eaf23d,1511301510,"Would it help to wrap wheels with electrical, or some other insulating tape?   ",,,2,0,0,
744b2045-b709-4eef-a559-922cd44a81aa,1511494448,"Are they like , insulated rubber gloves? Cuz that would make a lot of sense actually.",,,2,0,0,
e038a184-d3ea-496f-9f65-20567dafebfe,1511538774,"No worries, I live in Scotland and it started snowing today. Just...no. Very pretty to sit inside and look out at, a complete pain in the arse if you ever want to leave your house!",,,2,0,0,
9687fc8c-19cc-477e-8aa3-7c7fad2d1627,1511318311,"Get gloves designed for motorcycle riders. You can get a good set at your local Harley/Suzuki/Triumph dealer or go to J&amp;P Cycles website and grab a few pairs. Yes they will be expensive, but they will last and be worth it.",,,2,0,0,
a4971c12-bd11-4807-a068-2967303bbab0,1511302473,Maybe! That’s something I had not yet thought about.,,,1,0,0,
744b2045-b709-4eef-a559-922cd44a81aa,1511292457,Oh man. The eternal search. One year i had some pretty great insulated leather gloves that managed to keep me both warm and dry. Perhaps that is the best way to go. ,,,5,0,0,
e038a184-d3ea-496f-9f65-20567dafebfe,1511485846,"&gt;  Yes they will be expensive, but they will last 

This is what I thought too. Unfortunately I have found that they don't last and are just expensive. Motorbike gear is designed for a single, serious impact - you crash, skid, and replace your impacted gear. Wheelchair users need equipment that lasts with continual friction over a long period and motorbike gear just isn't designed for it. 

A lot of the protection is over the backs of your hands, your fingers and knuckles. We don't need that protection, it just impedes movement and is a pain in the ass. I've tried some very pricey motorbike gloves and although they are lovely and warm, they wear out just as fast as any random thick leather gloves which will be much cheaper. I don't find that pure leather on the palm (most bike gloves) is as good for grip as a glove with a rubber or textured plastic addition.",,,1,0,0,
e038a184-d3ea-496f-9f65-20567dafebfe,1511515378,"That's exactly what they are, just with a thicker rubber coating. I once asked a guy working a supermarket freezer where he got his gloves as they looked good. He pointed me towards Arco, where I trial-and-errored a bunch of different types. These ended up on top. They don't look great but the functionality is fantastic, I'd suggest two pairs so that one can air out because being fully waterproof they can smell a bit if you don't rotate them. 

I've gone through so damn many gloves over the years and these are definitely my favourite for winter. Second best is my old leather gloves, which were warm and dry with slightly better dexterity, but much more expensive and took ages to dry out. They also let water in at the seams when they got really wet, i.e. pushing through heavy rain or snow. ",,,2,0,0,
fee77648-82f7-486b-8fbb-2bb004c4ce06,1511359706,"No advice at the moment, but e-hugs are yours if you want ‘em!",,,2,0,0,
5ed0fe9d-0c1f-4df4-b0d9-91890592ea16,1511411077,"I have mental health issues + Migraines and I got approved 2 years ago for SSI (Will be 23 soon). I also feel so much older.. My memory is horrible, can barely get out of bed. In constant pain due to migraines. 

I also live with my parents and it's a toxic environment. I applied for public housing so I'm waiting on that. 

Please apply for public/income based housing as well. Then you'll only pay 30% of your income for rent. If you don't have any income I think you pay $25 a month. Just look up your county's housing authority. You can also apply at others as long as they're willing to accept people outside of their county. 

Please hold on until you get into housing. Then SSI. Also, If you get denied initially (this is normal) please get a disability lawyer and appeal. They take a small percentage of your backpay but they increase your chances of getting approved tremendously.

My parents understand my problems since they all struggle with similar issues (though not to my extreme extent). So I don't have them calling me a freeloader, because they know it's very real and debilitating. I do hear off remarks about how I don't work, because they're jealous I get 'free money'. But I wish I could work. I never wanted this. To be so young and be on disability. I wanted a life. A house. I can barely leave my parent's house without having a panic attack though. 

Just know that your problems are real. And they are what they are. You are applying for SSI because you need it. Try to find contentment with your life despite it not being what you want. Use all available resources (SSI, Public Housing, Food Stamps)",,,1,0,0,
b21893de-2770-4665-82dd-8d179285492e,1511392446,"Thank you!  That's a good idea.  My fatigue is cyclical so I try to do as much as I can when I'm feeling less horrible, but some days are a complete bust.  That always seems to be the days they come at me sideways with a list of demands.  But yeah.  Communication is something I need to improve on.",,,2,0,0,
8101ade4-e557-4093-825d-52bfe118052f,1511361881,"Make a list of all the things you can feasibly do during a typical day. Bring the list to your parents and let them know this is what you will commit to doing each day, even if it is just one or two things. Ask them if this is okay and if not what they are expecting of you. Let them know what is reasonable or not. If you are not feeling well, tell them very plainly ""I am not feeling well right now, but as soon as I wake up I will do it before ____."" Communication and consistency on your part is key.",,,5,0,0,
c536d392-79ba-4573-ba89-b3b2f0686119,1511569324,"Yeah, it's pretty gross. Republican voters are completely bat shit crazy. That being said, Ron Paul has a few good points. Regulations related to licensing are a bit of a problem. As I understand it, the AMA really has a stranglehold on the medical system. The supply of MDs is artificially limited, raising the cost of services due to scarcity and a lack of competition.


The only things that seem to help me with my condition is massage therapy, craniosacral therapy, and chiropractic. I'm on my parents plan, and have received mostly ineffective medical treatment. My Drs are only really good for prescribing me medications. Thus my insurance is pretty much also only good for that reason. This being the case, my insurance is probably not worth the price, and because it is so expensive as it is, my family cannot afford to pay for the only alternative treatments that help me.",,,3,0,0,
7e36f9bf-92c4-4771-aaa7-923dbff062f7,1511558350,Kind of where I'm sitting at this point...,,,4,0,0,
183944c8-d9a7-4618-8125-d74d52a0a5e6,1511591289,"oh yeah, there are definitely way more people who've had to go through appeals than get approved right away. It just makes me wonder about how SS is really reviewing these cases. I've seen many people who have a lot of my conditions get rejected over and over.",,,3,0,0,
d9ea11d7-be98-4c60-b1a1-cb97d8315562,1511482777,"Unfortunately part of the equation. Took me 3 years plus with 2 medical close calls. I needed the better Medicare to pay the 11K infusion treatment every three weeks. I had Medicaid only during this time with some interruptions as well. 

Universal health care is needed ASAP and PDQ. 

Scary stuff. 

",,,16,0,0,
349b775c-991e-4538-984e-5379f0ef0f0d,1511584649,"I also got it in a few months on my first try and I don’t have a listed condition either. But I know more people who have been through the appeals process than have been approved quickly.

In any case a glance at the approval rates at each step make it clear that most people don’t have an easy time if they’re even approved.",,,1,0,0,
4d0fb8e4-d3d6-42c2-863f-a48b7a95aa91,1511545382,That explains it. My husband and I have several diagnosis. ,,,3,0,0,
08a58d63-5887-4493-b670-6f4f60d1444b,1511634988,I don't agree with you about the chiropractic or massage therapy. I had a wonderful chiropractor at one point and felt soooo much better. Unfortunately he's 3 states away now. I don't see how anyone can say massage doesn't make you feel better. ,,,1,0,0,
00e67e02-8063-44a2-ab1d-e18608da0f14,1511493288,"I can believe it. It took me 6 years and two appeals. Thank god I had a decent support system. So many people don't have that option, and what are they supposed to do while they wait?",,,12,0,0,
f337e1bc-9233-49f6-a7ae-1139021b13b0,1511516409,"It depends on what the diagnosis is. Per SSA's rules if your condition is ""listed"" you're not supposed to be rejected even with the initial application. Its supposed to fast-track you to approval, almost automatically.

How that actually works in the real world is another story.",,,5,0,0,
b0b464ca-d97a-4add-9411-3f25a3109b52,1511559270,"That is terrifying. I can't watch it now, but I've saved it for later. That might strengthen my argument. Thank you. ",,,1,0,0,
f337e1bc-9233-49f6-a7ae-1139021b13b0,1511558142,"&gt; Every time I try to explain this to a person, they think I'm a crazy conspiracy theorist.

There is an easy way to explain this to a skeptic without coming off like Alex Jones.

All you have to do is pull up a youtube video from the republican primary debate of a couple presidential election cycles ago.

I will set the stage for what happens: The Republican presidential candidates are debating what to do about health insurance. They all claim that the country just needs more personal accountability, which is their way of saying ""pay for it yourself or get fucked. No hand outs.""

Ron Paul, being a former doctor is asked about what we should do with someone who is young, feels invincible so they don't have health insurance, they end up in a coma and someone has to pay the hospital bill. Patient has no job or income or assets left, because they're in this coma in a hospital.

Ron Paul wants to answer. The crowd, on live national television during a presidential debate, start screaming ""LET HIM DIE! USA! LET HIM DIE! USA!""

The disgusted Ron Paul is so mortified he can't hide his emotions and goes ""Nooo, that isn't how it should be!"" but nobody seems to listen. 

It ends up being the last time he runs for the presidency.

Watch it and weep:

https://www.youtube.com/watch?v=8T9fk7NpgIU

Half the country wants social undesirables to die. Its really that simple. They admit it.",,,9,0,0,
f337e1bc-9233-49f6-a7ae-1139021b13b0,1511516327,"&gt; and what are they supposed to do while they wait?

They are supposed to die, and that's the whole point. The system is designed to accomplish this result, and it does so with great efficiency. While in a totalitarian regime you might have people being gased or gunned down for being socially undesirable, in our country they just put them in designed-to-fail social welfare programs that encourage death by untreated medical problems and/or substance abuse.",,,17,0,0,
b0b464ca-d97a-4add-9411-3f25a3109b52,1511556375,"Every time I try to explain this to a person, they think I'm a crazy conspiracy theorist. I guess it seems too far-fetched to those who don't have to live it. ",,,7,0,0,
a27fcf4b-d60d-46d1-98dd-2be088fb56ba,1511593700,If someone is terminal their cases get expedited.  They get handling first before another case.  Terri cases as they as called are pushed through the system as fast as possible.  They do as much as they can to get those cases out fast .Terri cases and wounded warriors cases also have special process and handling given to them.,,,1,0,0,
