commentator_id,created_utc,anonymized_body,ups,downs,score,controversiality,gilded,distinguished
856673a5-83ad-41a9-b934-3e56b1d45e86,1489978151,I was going to get a 50cc scooter from a friend and the gas isnt that expensive for it and dont need ainsurance.,,,2,0,0,
664e4021-a6d0-4099-8324-0690edaeb69a,1490672112,"Really hard thinking of something for this one.  Chex Quest?  Old doom clone made as a Chex marketing thing.  Very kid friendly, no losing or anything. Old though.  https://m.youtube.com/watch?v=PSjD8855qo0",,,1,0,0,
b6b44d68-e51c-4719-87ba-ab22f8e2951a,1489845233,"&gt;So now my situation is this..the worst..and I mean WORST thing that could happen to me has finally happened..I have mild carpel tunnel..so now instead of standing and doing jobs like that, now i have problems with computers..i wake up at night with my hands numb and in pain..I also get pins and needles.

Do you still have insurance? If so, please, please look into surgery for carpal tunnel. I put it off until I was waking up with my hands like this almost every day. If I'd realized just how simple the surgery was - only a 15 minute surgery that doesn't even always require a full general anesthesia, I'd have done it so much sooner. Sleeping with wrist braces was such a pain in the butt, and didn't always help. I had my stitches out within a week, and was back to being able to do just about everything I normally could within 2 weeks, and better hand strength than pre-surgery within a month. I had one hand done and then about 2 months later I had the other hand done. In each case I only had 3 stitches in the palm of my hand, and that was with the ""open"" surgery due to the configuration of my hands not being suitable for the lapro surgery.",,,1,0,0,
204f3ca9-aecf-492f-bc5f-00649c217d4e,1488388628,"For me,  I agree with this within reason. It tends to make my life easier to ""kill with kindness.""  But it's not the same for everyone.  ",,,3,0,0,
4d0fb8e4-d3d6-42c2-863f-a48b7a95aa91,1488650777,"My disability is invisible so you wouldn't even know I have something wrong with me just by looking at me. My mom and I went to Paris and everyone there was friendly but it was until we walked into this one area where the Opera house is and we were shunned there. We were ignored and everyone stared at us with disgust and we were in a department store there and they wouldn't even give me service so they just ignored me. It was very strange like everyone magically becomes unfriendly when they get to that area and we walked into this cafe to eat and the workers there were not friendly either but still gave us service when my mom said I would have a meltdown if I didn't eat and another customer there said ""Ugh Anglious"" and started ranting in French and one of the workers there snickered. We never went to that area again. 


What made us stand out? We were not dressed all fancy like they were and we were dressed casual so they knew we were not one of them. Plus we were speaking English when I would talk or when she would talk so another giveaway we were tourists. ",,,3,0,0,
204f3ca9-aecf-492f-bc5f-00649c217d4e,1488388463,"100% agree.  This is what I do,  not what others should do.  :0)",,,3,0,0,
62e020e8-8019-4a69-b7b3-a39c66de44d2,1490893709,"Update: I just got back in control of my profile from 09-10, Would it be better to stay on the profile i am on, or go with this one i got back, it has about 3,000 points on it and shows i am not just starting out,",,,1,0,0,
a82bb553-721a-45e3-a70b-3284a1cb9e02,1488819871,"What disturbs me is there's doctors willing to amputate healthy body parts. These folks need mental health care, not surgery.",,,5,0,0,
aae7c254-aa01-4ce4-83ba-64398c3b7be8,1489004894,"It depends on the kid, the age and the general situation. If I know the kid (say like a cousin) and I'll see them again, I might explain that the connection between my brain and my body got broken.

If I have no idea who the kid is and will never see them again, I'll just insert an generic life lesson (I didn't wear a seatbelt, or eat my vegetables, etc). I'm not that fond of kids to begin with, however, I do see the importance of educating them in disabilities, but at the same time, they aren't likely to comprehend or remember anything other than ""playing in the road might end me up in a wheelchair, so I shouldn't do that"".",,,6,0,0,
d819ba83-d594-4b18-b82f-45f7250afe3c,1489703062,The thing is my doctor has always gone with the diagnosis of the previous doctor. I looked back at paperwork and I was 12 years old when I was first Diagnosed with Major Depressive Disorder &amp; PTSD. I haven't put anything on my life on here but I have very unique circumstances. Thanks for your feedback though. ,,,1,0,0,
b6b44d68-e51c-4719-87ba-ab22f8e2951a,1490836804,"&gt;New York’s subway is by far the least wheelchair-friendly public transit system of any major American city, with only 92 of the system’s 425 stations accessible. 

This is just utterly *shameful.* Especially when it is compounded by the outages.",,,6,0,0,
ca2d5ddf-11bc-4597-abb5-d3f7ae707019,1489289834,"I signed and shared with Facebook.  As long as Medicaid grant and per capita funding are on the legislative table, Medicaid waiver funds will be on the chopping block.   I personally will consider myself lucky if my son doesn't lose any state services this presidency.   I hope it works out for you I really do but frankly I don't see any good coming for anybody needing Medicaid funds.  ",,,2,0,0,
90ad7d8b-b3f1-4d89-be8a-415b4b63cdd3,1488722357,Nice! What is your disability? I have Centronuclear Myopathy. No Xbox...Just pPSN,,,2,0,0,
027a1edc-29da-4b66-aaf2-22f18a400f4e,1489756005,"I thought these were coming down, like, a *while* ago. There were threads all over /r/bestof about people working together and archiving the videos before they got deleted.",,,2,0,0,
dcb60d0d-0b04-4005-91c3-e4a2cd8554c6,1489462938,"Much appreciation for your reply. I have similar experiences to yours &amp; I am assuming that is why they've made that decision. I have my meeting at SS &amp; the payee coming up. I was first nervous to ask the person, so I couldn't get excited about my decision, then when they said ""yes,"" I was amped. Then stewing over stuff like ""what if I want to buy a lipstick?"" --the leash you mentioned. The ironic thing is, I had asked my future payee if they'd help me keep a budget in and when I got approved. My plan was to have them give me some oversight &amp; go to financial counseling through a local agency.  Now that this has all come to fruition &amp; the plan is different, I find it very overwhelming.

Considering the peril I put myself in..like not being able to have my basic needs met, what you said makes a lot of sense. Also, what you said about the whole thing about being labeled ""disabled"" hits home as well, so much that I found myself sulking. In fact, it is was what kept me from ever appealing in the past and then even completing a new application. I know logically that this all makes so much sense, but the emotional part of me is processing this on another level.  I am excited and very scared..very, very scared 

 ",,,3,0,0,
c4700850-875b-465c-b50e-e8b77c12c8f6,1488382466,"I got mine from eBay, since Amazon isn't very easily available where I live. I coincidentally later found one of the exact same kind in a hardware store, so that may be worth a look. 

I suggest getting one with adjustable height, as many of them seem to be unusually tall.",,,1,0,0,
2ae69041-931b-494e-b9d1-9d266647bf38,1489330952,"In Florida we do have a Medicaid Buy In Program, but we do have a share of cost program called Medically Needy Medicaid which is a joke and I would never believed except I was on it last year for two months.

First, this program does not cover any long term care expenses. The state of Florida determines what you can pay for your care and the numbers usually make no sense. For example, if you make $1,200 they will tell you can pay $1,000 which is your share of cost. If that month you have very few medical expenses and they add up to $350 then you pay the $350. If your medical expenses add up to $1,000 you still pay the $1,000. Now if your medical expenses are $1,000.01 the state of Florida will pay all $1,000.01 and you pay nothing. In essence the state of Florida is encouraging you to increase your medical expenses.",,,2,0,0,
be8e6b44-ea50-4734-bf04-1a81cc30f559,1489782073,"Your comment was automatically removed because you linked to reddit without using the ""no-participation"" np. domain. Reddit links should be of the form ""np.reddit.com"" or ""np.redd.it""

*I am a bot, and this action was performed automatically. Please [contact the moderators of this subreddit](/message/compose/?to=/r/disability) if you have any questions or concerns.*",,,1,0,0,moderator
804282ab-83ad-4cb6-84b9-cce1f563499b,1490383883,"It depends the reason for the remand. A remand could just mean that the judge applied the wrong standard and needs to reevaluate the claim. Remand just means that it goes back to the lower judge for another review. If it were overturned and NOT remanded, then it would appear that your brother was granted benefits. As of right now, he has not been granted anything except another chance.",,,4,0,0,
118755c0-5f50-4ddc-a009-d957db5f73c9,1489965406,"If you haven't gotten one yet, and you need to bring it with you every time you need to shower, you may want to consider a walker with a seat and basket. You could use the basket for your shower items, even get a snap on shower tote bag that you can affix to one of the arms to keep your shower items in.. make the chair work for you... One that has either all 4 wheels with brakes or 2 wheels and 2 flat bottoms so that you can also use it for balance while standing.

You may also be able to get a used one for low cost or free. Some areas have Medical Supplies available for those who need them, Google ""Free Medical Supplies (area).""

",,,1,0,0,
132ac09a-0c2a-411f-8919-c6b54f3d3858,1489924153,"They *may* give you a temporary one depending on your state, just look up the requirements in google. For instance here are the requirements in my state and technically, you'd fall under #8 with a doctor's signature on the paperwork (which I would have printed before you go in there):

Applicant:
(1) is blind.

(2) does not have full use of an arm or both arms.

(3) cannot walk 200 feet without stopping to rest.

(4) cannot walk without the use of, or assistance
from, a brace, cane, crutch, another person,
prosthetic device, wheelchair or other assistive
device.

(5) is restricted by lung disease to such an extent
that the person’s forced (respiratory) expiratory
volume for one second, when measured by
spirometry, is less than one liter or the arterial
oxygen tension is less than 60 MM/HG on room
air at rest.

(6) uses portable oxygen.

(7) has a cardiac condition to the extent that the
person’s functional limitations are classified in
severity as Class III or Class IV according to the
standards set by the American Heart
Association.

(8) is severely limited in his or her ability to walk due
to an arthritic, neurological or orthopedic condition.

(9) is a person in loco parentis of a person specified in
paragraph (1), (2), (3), (4), (5), (6), (7) or (8) above.

(10) is the parent, including adoptive parent or foster
parent, of a child or adult child provided that the
person has custody, care or control of the child or
adult child and the child or adult child satisfies
paragraph (1), (2), (3), (4), (5), (6), (7) or (8).

(11) is the spouse of a person specified in paragraph (1),
(2), (3), (4), (5), (6), (7) or (8)",,,3,0,0,
382adfe4-2fa4-48be-8246-58c45fa2a4c9,1490563511,"Thank you for the information and the links. Really answers most of my questions. So much information seems to be directed at SSI, and I get confused easily trying to figure out what applies to SSDI. 

I've looked before and didn't find anything - is there a way to report income online? At this point I don't think I'll make over $600 and that work isn't gonna be reliable, but I believe I'm still supposed to report it. 

(I earned about $1000 all of last year, and I've already done the taxes but going forward I'm trying to work for real and so I wanna do everything right and official)",,,2,0,0,
437bef1b-0a07-482d-8c15-2752bb261cfd,1488341893,"I lived in Santiago, Chile for a good part of last year.  It was one of the most accessible places I've ever lived - not as good as Portland, of course, but better than NYC and most other large cities in the US.  I strongly considered moving there permanently and might one day.  IDK about the immigration part but it's a nice place to live if your Spanish is decent",,,2,0,0,
6ef2492b-4a72-4170-a246-0d3f3c11855a,1489980127,"Basically this. OP needs to get their own insurance, and if they can't work then apply for SSI right away. It can take up to 4 years to be approved.",,,7,0,0,
382adfe4-2fa4-48be-8246-58c45fa2a4c9,1490507135,"Yeah, my questions are like you for instance. 

How much can I earn before it gets counted as one of the 9 months?
How do I go about reporting what I do earn (I'm thinking I can manage $400-600 a month, which will still be below but I'm assuming it's high enough they'd want it reported)? 

And that thing about the 3 SS agents is kind of my worry; can I rely on what they tell me, or is there a more reliable way to figure things out. 

I did find the SGA part of the website but thanks to your response I  followed some links on that page and I see where it talks about $840. I'll have to poke around that site more closely. 

Do I need to be in a program like TTW - does TTW give any benefits if you have some work you already know you want to try?

Basically though your comment about the agents giving you bad information kinda answers my question. My most reliable option will be searching the website :-)

Thank you!",,,1,0,0,
dcb60d0d-0b04-4005-91c3-e4a2cd8554c6,1490838943,"To everyone who gave me input &amp; emailed, thank you &amp; I am sorry if I got slack with my replies. Well, I got my SSDI today &amp; my family member agreed and I think it is going to be a good thing!",,,1,0,0,
8932fe87-5bd3-4b61-99c5-9e83095bf515,1488505304,"Look into services in your area, sometimes doctors can come to you.",,,1,0,0,
844d1ee7-6b73-4073-8741-cc6adb264fdf,1490160446,"The lucky thing about being asked questions by little ones is that they have a tendency to have their curiosity pacified pretty easily with a simple "".I was just born this way"".  But I'm also not an encyclopedia, so most times I'll just want to end an intrusive conversation as quickly as possible by saying as nicely as I can muster ""it's none of your business."" This might be a harsh approach for little ones though, I'll really only use that response for nosy adults. ",,,2,0,0,
ba7a07b3-5a1e-4d3f-ac84-9d7853ab4af1,1490284461,Usually friends do this to shame able bodied people who are clogging up the elevators so they can't ride with me.,,,4,0,0,
6be7e826-bf78-44c3-9011-d80b6993cca7,1488892003,"I do love how so many people on Reddit can be 100% certain that someone else doesn't have an invisible disability. The irony being the number of posts in these parts about how the world at large doesn't notice invisible disabilities and how this is an absolute fucking travesty and anybody caught not noticing said person's invisible disability should have their head shoved down the nearest (accessible) toilet and flushed. 

But anyway... ",,,1,0,0,
431fb2c7-cdf0-49a7-9616-62cdfab3f6a7,1490356373,"Sometimes botox is used to paralyze the muscles involved in a tic and when that happens, the person usually reports that the tic urges go away and do not transfer elsewhere.  However, this procedure is usually only used when the person has one single tic causing a lot of problems. Tourettes is by definition multiple tics (though not necessarily at the same time). So they might be more likely to feel the tic transfer elsewhere than people who only ever had one tic.",,,3,0,0,
3ccea275-e5f8-4eab-94f5-4709d1687781,1488735123,"By the same reasoning, the terms ""disable"" and ""disabled"" are slurs.

There is nothing wrong with the term ""cripple"" or ""crippled"" when used grammatically correct. That is, a crippled person should not be referred to as a ""cripple"" but as a crippled person.

What is the difference between ""cripple"" and ""disable"" (as verbs)?",,,1,0,0,
f7eae90a-9dd9-4ff3-81a6-86ca59684244,1489360680,"Raise hell, they will bow out - almost guaranteed. Just keep moving up the ladder till it works. Though, quick note, don't threaten them just be real and be 'concerned' and tell them this is important to you and ask to speak to supervisors, etc. etc.",,,1,0,0,
2ae69041-931b-494e-b9d1-9d266647bf38,1490121184,I am waiting for someone to have a nurse or aide provided and when they ask for you address the response is under the bridge between x street and y avenue.,,,1,0,0,
bfda64d5-5ea3-4b29-9c24-426e5499845a,1490914111,"Yeah kind of hard to prove but I'd definitely talk to an ADA lawyer and ask for advice to see if they have something they can do. 

If your father don't want to do anything, then I guess that's that. Pride can be a good thing but also a bad thing. My father is too proud, he refused to apply for social security disability because of his stroke (lost the use of his left half) and has been siphoning into my bank account to pay for his bills without me knowing. 

I fought with him about this, which was hard with me being deaf and him being hearing with some hearing loss and he refused to budge. I eventually gave up and moved to Ohio because of a lot of reasons, but my father was one of the reasons and I closed my bank account immediately. He was so pissed at me but he finally budged and applied for disability income. Since then he is happy he is getting a substantial income but hasn't thanked me for forcing him to realize he need financial assistance rather than relying on my $$. I have a family to support and I can't just have him siphoning $$ from me. 

Sorry for turning the table here to me, but back to your issue, I'm a little concerned that your father would let this slide. If he is not getting any income yet, the ADA lawyer would probably do it pro Bono and get something out of the situation like a severance package of maybe 1-3 years in pay or something. ",,,3,0,0,
3e2013ba-335a-42bb-bacc-4a6e31c5ed95,1489462586,"The doctor will ask you about your life history in a nutshell, your mental health history, ask about the severity and frequency of your symptoms, make observations about your general appearance, speech, eye contact, activity level, etc. The doctor will ask you many questions, have you perform tasks like copying a design, repeating things back, some math, and have you follow some instructions. Unless memory or IQ testing was requested, it should take 45 minutes to an hour or so.",,,3,0,0,
65eb3d01-3c5f-4f46-bbd9-7f98ef92e763,1490963837,"I'm a little surprised that after 2 days no one has answered your question. 

SSDI is based on work history. If you've been on SSI since you were 21 then you didn't have enough work credits to qualify for the program. So if you tried to apply now you would be instantly denied. 

*However*, since you were disabled between the ages of 18-22 you can qualify for SSDI based on a *parent's* work record. But to qualify for this your parent has to be either deceased, disabled (on benefits themselves), or retired. 

If your parent meets one of those 3 qualifications, you can contact SSA to see about adding what are called CDB benefits. You would be able to draw about 75% of what your parent gets, less if there are other dependents drawing on that SSN as well.

You can still receive SSI and the CDB SSDI benefits at the same time. But your SSI amount might go down a bit to offset some of the SSDI payments.  This ultimately will depend on how much you earn from each program. ",,,1,0,0,
92338401-4c21-40e9-9544-2873f6d9551b,1490490499,I'm starting to think either the people in my town are decent or Ive just never noticed anything ,,,1,0,0,
65eb3d01-3c5f-4f46-bbd9-7f98ef92e763,1490666654,"Was he already on disability and his case that happened last year (the denial) was actually a cessation of benefits? Someone can elect to continue to receive payments during that time while they appeal. 

If it's not that..well then I think your boyfriend has some sort of significant misunderstanding of the situation.",,,2,0,0,
2165338b-9864-4f67-9889-f37d62f75ae0,1489756818,"These videos were uploaded as a public service because the cost of uploading them was nothing. Having to budget money to pay for transcription means they can't offer a free service. Maybe you should read about the financial pressure the UC system is under. 

So no, not a shit title. No, not a shit issue. 

",,,1,0,0,
a82bb553-721a-45e3-a70b-3284a1cb9e02,1489648741,"My husband has to do virtually everything for our household. It complicates what was once a more equal relationship. 

However it sounds like she is taking all her problems out on you. That's unfair. She needs counseling, and you need some respite care before you burn out. Call 311 to find out what might be available. ",,,4,0,0,
a82bb553-721a-45e3-a70b-3284a1cb9e02,1489648399,"Have you considered replacing it with metal ones? That's what I have and they're like new some years later now. 

Also sounds like the angle of his ramp might be too steep.",,,1,0,0,
4a701736-cf95-44ba-8c42-4d419c98ed6c,1489339415,I've never heard that crappy analogy before. People are definitely not Skittles,,,1,0,0,
65eb3d01-3c5f-4f46-bbd9-7f98ef92e763,1488374141,"Most private disability insurers have provisions in the contract that say they don't have to pay you if you're receiving SSDI, or they only have to pay the difference. Short and Long Term plans tend to have slightly different rules. 

Does Cigna also offer long-term disability? This would be the point that they would transfer you to the LTD side of the house, since your condition is no longer considered ""short term"". If you do not have LTD insurance, then that is why they are cancelling your plan. STD is designed for people to only be paid for a shorter amount of time with the assumption they return to work. So you no longer ""medically"" qualify because its not a short-term condition. 

I've never worked in private disability insurance, so don't take my word as gospel. But I do have general knowledge since I encounter these companies a lot, and a lot of former disability examiners, when they leave the state, move to private industry. 

A lot of these companies will require you to pay back any money they gave you if you receive back SSDI payments for the same timeframe. Or at least the difference between the two. So if you received $1500 from Cigna, and your SSDI payment is $1000, then you owe Cigna $1000. 

If your onset date is when you stopped working in September though, you shouldn't owe them any money. SSDI payments don't kick in until the 5th month (which for you should be Feb or March depending on the day you stopped work), so you shouldn't be getting any back pay. 

There is someone in that office that is in charge of at least fielding phone calls and questions. Often times its hard for people to just pick up another person's case, because they don't have the knowledge of what is going on, and that kind of stuff doesn't make it into the case notes. When you get her voicemail I would try to press 0 or # to see if that takes you to the operator, otherwise call the main number and ask for her supervisor. ",,,2,0,0,
027a1edc-29da-4b66-aaf2-22f18a400f4e,1489380585,"&gt;Public schools are funded based on the number of students

That sounds like the crux of the problem. If I'm understanding correctly, in order for a voucher system to work, we need to either (a) issue them in such a way that all the costs are funded, or (b) ensure that public school funding doesn't necessarily disappear because of departing students. I'm not *crazy* about the idea that we have to lock kids into a public school to keep it funded anyway, so voucher or no voucher, that's probably a good thing to switch up real quick.

&gt;Add into this Medicaid cuts

Well that's the elephant in the room. Medicaid is.... well I probably don't have to tell you. I've got no stake in Medicaid right now so it's easy to detach myself and claim some moral high ground about ""WHAT ABOUT THE FUTURE THOUGH"" and I get it, that's not really.... well. Whatever. I'm pretty sure at some point we're gonna need to see some major reforms and not all of those will be increased spending, let's just put it that way.",,,1,0,0,
e8e9a173-ec1e-4835-9e3b-db832a168a37,1490727722,"Society, at least in the United States, has made significant strides in civil rights for people with disabilities, but like the civil rights movement against racism, there's still a lot to be done.  
The systems, as they exist, promote being stuck with a label and subsisting on a meager income as long as you let the label stick. If you do find work you can do, it's fantastic and wonderful, but you always feel more job insecure, because if you lose your job, you're limited in your career options.  
My disabilities, being mental, make it difficult to work period. But I'm gainfully employed at an ILC, and they're aware of my disabilities, so hopefully they'll continue to work with me as needs arise.",,,3,0,0,
66f6c848-d543-4e2f-83e9-267504f7be82,1490792223,"I'm so glad you're going to blog again! Please let me know when you do and I will be sure to check your blog out. I also felt pretty isolated as a young child with a disability. 
Best wishes to you and good luck with the blogging! So glad you enjoyed the post :)",,,1,0,0,
e331d1f6-573c-45e2-8990-cd3aa0f194a0,1489090893,"This is interesting, I didn't know they were trying this out! Thanks!",,,1,0,0,
