commentator_id,created_utc,anonymized_body,ups,downs,score,controversiality,gilded,distinguished
1a37967a-86e1-4963-8431-6d95bf91dfe4,1488684965,"YES ON THIS THREAD, let's DEFINITELY start the disabled traveling discussion!! I had the same concerns about Japan and Korea but GO GO GO it is NOT like that at ALL. In Japan, awareness of other people's needs with regard to anything is paramount, and this includes disability, so that there's a beautiful harmony between always being cognizant of something someone might need and never being overbearing about it. I haven't been to Korea but my partner taught there and can vouch for all the students and teachers being truly sweet to the one boy in the middle school who had a disability. I taught an adult ESL conversation group when I lived in Boston to a Japanese and Korean student who had just arrived in the US, and both never gave a single thought to my disability. They'd gladly help with anything I needed, carrying things etc., but it was never an issue, not even a little bit.

The appearance thing you're thinking about is actually an interesting paradox. Koreans will judge their OWN appearance, out of fear that other people are judging them, and that's where you see the early plastic surgery and whitening creams, but it's VITAL that they never JUDGE OTHERS based on appearance; there's just a culture-wide assumption that other people will so they're armored against that. Not sure if that was as coherent as I'd like it to be so let me know if I can clarify at all or if that makes sense.

I'm guessing it works similarly in Japan. One thing I can definitely say for myself is that a lot of my childhood issues with appearance did come surging to the surface in Japan but that had nothing to do with the way I was treated. There's just an attentiveness to composure the likes of which I'd never seen, so I realized that I have to be VERY comfortable with myself and the way I move the next time I go. This is completely internal though, and I seriously can't emphasize enough, nothing to do with how I was treated in Japan. Both cultures are founded on communal values of always looking out for other people, and you can definitely tell that.

edit: left out the word NOT when it really mattered, whoops!

edit2: meant to thank you for the hugs!!",,,1,0,0,
4d8f5eb0-bf81-48df-a2c4-4d63e10c6b94,1488603483,Damn good question and one I'm trying to figure for myself. I'm about to get laid off so SSDI DAC makes sense for me to go on. But I'd like to be able to go back onto SSI 1619b. Worst case your State probably has a Medicaid buy in program where you keep Medicaid through your State not Feds. ,,,1,0,0,
27514a64-e1f1-4f58-80df-c01be50da6f8,1488695236,"Haha. 

""Whoa, whoa, whoa...I didn't mean *that* much help.""",,,1,0,0,
30c5b634-d237-4b27-a37f-e32a3fd44a4f,1488866419,"Well, if that's the case I may be in trouble.",,,1,0,0,
ba7a07b3-5a1e-4d3f-ac84-9d7853ab4af1,1488785057,"[Terry Fox](https://en.m.wikipedia.org/wiki/Terry_Fox) was a young guy from near Vancouver who first thought of running a marathon across the country to raise money. He lost his leg to osteosarcoma as a college student and in 1980 ran across Canada starting in Newfoundland to raise money for cancer research I think.  Health issues led him to stop his run in Ontario and he died soon thereafter due to complications of cancer. If memory serves Terry was voted  the Greatest Canadian a few years ago. 

After Terry's Run, another local guy, [Steve Fonyo](https://en.m.wikipedia.org/wiki/Steve_Fonyo) tried to complete his mission and ended up completing the run across Canada  and later the U.K. He ran into legal troubles later in life and sadly is more infamous than famous. 

A few years later, wheelchair athlete [Rick Hansen](https://en.m.wikipedia.org/wiki/Rick_Hansen) (also from around Vancouver) set off to wheel around the world on his Man In Motion World Tour to raise awareness about spinal cord injury and disability. It was organized to coincide with the Expo 1986 world's fair in Vancouver. He succeeded and raised something like $26 Million (and has been a national celebrity ever since).

Re: my friend: she's a biomechanics grad student at a spinal cord injury research centre I used to work at. She was approached by sidestix about testing their product as an industry-partnered research project, which she did while she was finishing her PhD. ",,,2,0,0,
1a37967a-86e1-4963-8431-6d95bf91dfe4,1488794801,"Thank you!!! And your friend sounds like a TOTAL BADASS which speaks well of you! Also I've now had occasion to use your phrase ""magical emblem of disability"" twice, so I owe you for that as well.",,,2,0,0,
52b1237c-07b4-46c7-a6bd-1e8fdfc21d55,1488514460,Actually. I don't meet deaf people often. I guess the ones I do meet are just not bright.  So I realize it would be unfair to say anything bad about deaf people.  Some people will be idiots in every group.  ,,,1,0,0,
3e2013ba-335a-42bb-bacc-4a6e31c5ed95,1488641752,"You don't need all the places you've been in your lifetime, only for a year prior to your onset date, which is either the day you last worked, or your filing date. Stuff from 10 years ago, unless SSA determined your onset date is 10 years ago, isn't going to matter. If SSA needs a psychological evaluation to make the determination, yes, they will pay for it.",,,1,0,0,
386da598-bde1-4f59-9113-5bc7d741638f,1490015037,You're welcome.  I have 2 daughters of my own and they grew up with a Dad that had no fingers or toes.  Adversity is a part of life......keep on truckin'.  :),,,2,0,0,
a82bb553-721a-45e3-a70b-3284a1cb9e02,1488383811,You're there to take a class and get a good grade. Do what is asked of you and move on. ,,,2,0,0,
b6b44d68-e51c-4719-87ba-ab22f8e2951a,1490280649,Well. I'll say that definitely allays any fears I had of possibly having to modify my house for a ramp when I get older. Where there's a wheel there's a way.,,,2,0,0,
9f2c2830-1c2a-41c9-b8b7-dfa4b0df6b91,1490539078,"The local SS office is the best source for answers to questions. They handle your case directly and can give you specific answers based on your situation. However, the Ticket To Work program is handled by a separate group within the agency, so questions relating specifically to TTW should go through their help line.

[Ticket To Work](https://www.ssa.gov/work/)

/u/84d9d6a7-4f03-4523-8cd9-5743ff8bbeba is getting the Ticket To Work (TTW) program and the Trial Work Period (TWP) confused...and the TWP info provided isn't correct anyway. 


**Quick summary of the Trial Work Period:**

*Note that this only applies if you're getting SSDI, not SSI.

If you earn over the trial work amount in a month ($840 gross in 2017), you'll use a trial work month. If you do this in 9 separate months within a 5 year period, you've used your entire Trial Work Period. After that 9th and final TWP month, you begin a 3 year period called the Extended Period of Eligibility. During this period, if you earn over SGA in any month ($1170 gross in 2017), you're not due a check for that month.
After the 3 year Extended Period of Eligibility ends, if you earn over SGA, your benefits terminate and will not restart unless you file for an Expedited Reinstatement (EXR) or file a new claim. 

Here are some links for info on the policies mentioned above:

[Trial Work Period](https://www.ssa.gov/oact/cola/twp.html)

[Extended Period of Eligibility](https://secure.ssa.gov/poms.nsf/lnx/0413010210)

[Expedited Reinstatement](https://www.ssa.gov/disabilityresearch/wi/exr.htm)

[Working While Disabled](https://www.ssa.gov/pubs/EN-05-10095.pdf) - Here's the pamphlet that explains the work incentive programs in PDF format.
 ",,,6,0,0,
2ae69041-931b-494e-b9d1-9d266647bf38,1490033034,"It has been a little while, but I think that SSA requested everything from my doctors.",,,2,0,0,
960dc36f-6ce0-4255-a36d-0e50d92c7504,1488669076,"Oh god that thread. *hugs* I've been to Paris and I didn't feel like they were especially bothered by my limp, but I was younger and didn't pick up on it as much. I did, however, see a woman with severe scoliosis on the street berated by passers-by but she was Roma and that may have had more to do with the discrimination than her physical difference. 

Thank you for sharing your experiences in Asia. I've always wanted to visit Japan or Korea but the hyper-appearance focused cultures have always made me nervous that I would be at worst unsafe or at best unwelcome. Maybe we could have a pinned thread about traveling with a physical disability and maybe even some guides written by community members? ",,,2,0,0,
d45e850c-e657-40b2-a4ee-ab32905b76c2,1488547516,"Going from being a fully functioning adult to being totally dependent while being unable to read, write.or use a computer is very isolating, knowing the world exists but you cant interact with it.

Right now I'm looking forward to resuming therapy because that's the only human contact I get outside of immediate family or the occasional doctor.

Thankfully I am not as limited as I was two years ago, but my world is tiny in a way most people who are used to freedom and autonomy would have difficulty imagining. Not impossible though. I'd accept most people have not considered such a thing. I cant drive which is huge. Being able to work again would be great but the hurdles are near insurmountable.  As far as most are concerned I have no value as a person, I'm only a leech, a taker. In a world where value is defined by ""hard work"" (monotonous shit that will be automated away completely) I'm dead weight. I used to feel like I did something that mattered (not in the grand scheme of things) now I'm just a chore.

Much like the people that wont try to communicate with a deaf person because its cumbersome, people stop talking to you. I've become inconvenient, people that were once friends ignore me. I'm no longer the guy that can do favors, I'm pretty much the guy that needs favors.
I guess I don't have to worry about children though, I'll never have any. I expect to die alone and in extreme poverty.

I have to object to any pissing contests about how other people cant know how bad a certain disability is. or which one is worse etc(so I'm not trying to do that here). I know what its like to use an interpreter, its cumbersome as hell, and the communication barrier that presents is huge, but people can still imagine what all of this is like.

If you're looking for soul crushing, all too many people experience that unfortunately. Imagine what if feels like to feel your life ended before you even hit 40. you get into that ""would it be better to not know the way things were before my life changed forever"" I'm not going to tell anyone they cant imagine that though
IMO its not that no person can empathize, its that you are really saying its a collection of hundreds of things people don't realize and don't have to cope with. Maybe many people don't even care.

**TLDR:** Life can suck in a variety of ways, its not that we cant imagine it, it that we dont bother.",,,4,0,0,
d0d4be64-a550-443e-ac4b-255d418ab00c,1489785162,Your analogy would be wrong. See https://www.access-board.gov/guidelines-and-standards/recreation-facilities/outdoor-developed-areas,,,2,0,0,
027a1edc-29da-4b66-aaf2-22f18a400f4e,1488327187,"Well it's a couple of factors. The space is a big one. My desk gets as cluttered as anyone else's, or probably more so, and I like to have extra square inches available for things besides keyboards and mice. Second issue is wrist angle. When I had the keyboard up on top of my desk I was getting carpal-tunnel-ish problems in my wrist, and that's obviously no good when you need that wrist for getting around. That's..... I mean those are probably the big ones, but there are lots of great reasons why a keyboard tray is a good thing.

",,,3,0,0,
d8b83b2a-4d08-4d92-8787-c3c4250e4c12,1490748802,"Hi there, I have a physical disability but don't feel like I can answer your survey based on the type of questions you are asking and the scales.  If you want input on why the survey is difficult to answer, you can message me.",,,1,0,0,
027a1edc-29da-4b66-aaf2-22f18a400f4e,1489369276,"Lemme rephrase.

The problem in the Gorsuch case was that the law doesn't let waivers happen, and we all piled on about how wrong that was. Now DeVos (who is **noooooooot** my favorite, don't get me wrong) is saying yeah, let's offer waivers. And we're piling on again. So......... I mean you can see how this sounds disingenuous to me, right? *But I'm not remotely smart on this, I'm just looking at face value and I'm absolutely ignorant.* What's the thing that we *should* be doing?",,,1,0,0,
a2034da2-3329-4c1f-8817-d059dccdf56e,1490846777,"It's the same problem over here in the UK. It's just incredibly difficult to retrofit lifts and things into something running neatly packed underground. They do now add access when building new lines or stations, but you cannot feasibly rip out huge parts of underground rail to add disabled access. 

I can't use the Glasgow subway at all, most stations have stairs and only a few have escalators. If you use an electric wheelchair or can't use an escalator with your manual you're out of luck. The London Underground is a bit better and some stations are accessible but it's very hit or miss. 

It's the same in any old city. There are a huge number of buildings I can't get into here in Scotland because older cities (Glasgow especially) are full of buildings with steps up to the front door, and steps down to a below street entrance. They're too steep to fit ramps to that anyone could actually use, and the buildings are normally protected anyway. They were built in an age before wheelchair users were normal members of society and short of ripping down the whole city there isn't much we can do about that.",,,2,0,0,
4d8f5eb0-bf81-48df-a2c4-4d63e10c6b94,1490849540,"What's the issue? Lawyers are always involved. If a non lawyer coordinator had a question, they'd call the university attorney. And just because he's a lawyer doesn't mean he's acting in that capacity in his current job. Would you rather the ultimate decision be made by a lawyer who does this everyday or a lawyer who's responsibilities include everything that goes into running a university (meaning ADA issues are #38 between drunk frat boys and motor pool liability)?

Don't judge someone off their linkedin. ",,,3,0,0,
28bd916f-f773-4af6-b115-ec219e094f89,1488701326,"Oh, sometimes people are totally being rude and staring! I was just hoping that maybe that wasn't the case :( 

Do you plan on doing more traveling? Any more countries on the list?",,,1,0,0,
d0d4be64-a550-443e-ac4b-255d418ab00c,1489903550,"&gt; Another argument I didn't make.  

So you agree with my argument? If so, why can't a Deaf person make a complaint, but a person in a wheelchair can?

&gt; access for everyone

unless you are deaf, then your lack of access doesn't count.

Any luck with finding the 96% source yet? You have not produced it yet.",,,1,0,0,
d42770b1-9f84-462c-9536-090461a2ff56,1490760644,"Snow skiing, BOEC....They are great people and you will love it, even if you haven't tried it before.",,,1,0,0,
89a6f684-0353-429a-bbe7-6cd5783d3bd6,1489761525,"My doctor office is bad at paperwork.   They barely answer phone calls or letters that is not a patient.   I was able to get my medical history with in 2 days, using there online system.  Ssdi was waiting still after 3 months to get anything.   As soon as I sent in the info I was aproved very fast.  If you know your doctor will send in the paperwork, you do not need to.",,,2,0,0,
9e4cf7af-dafc-4c50-a362-d82ac134ee3a,1490731229,"Veterinary medicine is way more than just sitting at a table performing surgeries all day, unfortunately. I had to drop out of veterinary school BECAUSE of my illness. If you can't lift, be on your feet all day, etc for 10-14 hours a day, you're not going to get very far, sadly.",,,1,0,0,
74f99c3c-5b78-4b54-bd6b-281b52ec89da,1490133090,"Ok, that's Salem/Licking area and a bit far for me to ask them to take me for a day trip.  I'm sorry.",,,1,0,0,
c86503a0-a387-4e86-af6b-83dac0369a34,1489358294,"Yeah man. I would eat the fucking Skittles if the Skittles were HUMAN LIVES.

It's a horrendous analogy.",,,2,0,0,
f0f7355b-1367-46f6-83e6-e915bffeb197,1489271397,Fuck that. Medical privacy is so important ,,,2,0,0,
a9090660-b2d1-4f4a-b00d-32880c994553,1488401507,Medical records are usually only accepted by fax or mail due to privacy concerns...at least that is what I have run into.,,,1,0,0,
65eb3d01-3c5f-4f46-bbd9-7f98ef92e763,1489091280,they've actually been doing this prototype thing for...like 12 years now I think? I think that it is just 11 states that do it; I'm not sure why they haven't either adopted it nationally or gone back to everyone doing it the same. ,,,1,0,0,
2165338b-9864-4f67-9889-f37d62f75ae0,1489782392,"Especially compared to virtually nothing. California Minimum wage is $10.50, and there may be state laws affecting who the UC system uses. In a budget crunch. 

https://www.nytimes.com/2016/02/11/us/university-of-california-berkeley-deficit.html?_r=0",,,2,0,0,
d45e850c-e657-40b2-a4ee-ab32905b76c2,1489704655,"This is a very unhealthy relationship, you cant fix eveything. I'm not saying move on, but it sounds like it might end up that way.

IMO do what you know you need to in order to achieve a better balance. If she takes that out on you and is unwilling to respect that the demands she has are unreasonable you have your answer.",,,3,0,0,
d45e850c-e657-40b2-a4ee-ab32905b76c2,1489706078,Not quite the same but I have a hard time thinking anyone would want anything to do with me. ,,,3,0,0,
be8e6b44-ea50-4734-bf04-1a81cc30f559,1488591813,"Your comment was automatically removed because you linked to reddit without using the ""no-participation"" np. domain. Reddit links should be of the form ""np.reddit.com"" or ""np.redd.it""

*I am a bot, and this action was performed automatically. Please [contact the moderators of this subreddit](/message/compose/?to=/r/disability) if you have any questions or concerns.*",,,1,0,0,moderator
3ec3bd97-28a1-4611-8383-de2c8c466c74,1488600073,I think my CP caused a lot of issues with body dysmorphia for the same reason. Have you considering seeing a psychotherapist or someone for medication? Something like Celexa might help you! ,,,1,0,0,
844d1ee7-6b73-4073-8741-cc6adb264fdf,1490161343,This! A thousand times this! I'm all for kindness BUT when I get stared at and asked intrusive questions I'm gonna get a bit crabby. So excuse me for not wanting to always be a bucket of sunshine. ,,,1,0,0,
027a1edc-29da-4b66-aaf2-22f18a400f4e,1488434213,"Checked user history for some context. Don't waste time, everybody else.",,,6,0,0,
62e020e8-8019-4a69-b7b3-a39c66de44d2,1489726803,"I am on the Xbox leaderboards, only 120 now but just started today. I am on trueachievements and xboxamerica, my gamertag is LustrousTree32, feel free to send a friend request.",,,1,0,0,
620981f7-90f6-4e81-9611-1caa62e056af,1488639868,"Thank you gor your help.   I actually already called and set up an appt a few weeks ago but a week later left my job and never made it in.   Trying to apply for unemployment for now and they mentioned if I was trying to get disability I would automatically get denied for it.   I am 99% sure I will get denied anyways but need some income while looking for my next job so think it might be worth trying.   They did send me a packet that had a questionnaire asking for Dr visits, meds and stuff like that.   

I could give them my last Dr name which would show them trying to prescribe me every anti-depressant out there but beyond that I have no idea all of the places I have been to in my lifetime.     Would getting a psychological evaluation be covered by them?  I have no insurance and sonething like that would probably be pretty expensive.        Thanks again fir your help",,,1,0,0,
fa0ce569-525e-4cf2-acfd-88cb40aaab67,1488382504,"My wife broke her knee cap last year, we found a decent one at the local Walgreens. Easy to assemble, fit well in the shower. Thinks it was about $35.",,,1,0,0,
525c4e39-bf9f-48a5-9156-ed01e408d976,1490028723,"I second this. If OP cannot work, then it may behoove them to also apply to SSDI as soon as they can; rules for SSDI regarding work credits are different for people of different ages, I believe. (Am not a SSDI expert).",,,1,0,0,
bfb52841-2448-43c5-8d0d-bd8055e79cae,1489074275,"This was eye opening for me.  I'm not a chair user, and have never dealt with personal care attendants, so it offered an entirely new prospective. 

One thing that surprised me was how much I could relate to scribes and note takers that I've used in academic settings.  Obviously it is a very different situation, but I feel like there is a common thread of disrespect from those we hire to help us.",,,2,0,0,
9467eb37-981d-4ca7-8d4b-0d1f920f1dca,1489271706,"As far as I know, if the bill hadn't passed, even healthy people with family history of disabilities would have been at risk. Unfortunately there's a bill making the rounds in the US, that would allow for employers to demand genetic testing from employees. http://www.cnbc.com/2017/03/10/employers-could-demand-genetic-testing-under-congressional-bill.html",,,3,0,0,
720d37b9-0056-41a5-baf2-558fd5340266,1488930897,Talk to social workers at hospital or family service ,,,1,0,0,
c6eeabec-7022-4f87-8070-a7b61b100b7f,1489087468,"so your saying I am going to go directly to a hearing?
How is that an advanatge btw?",,,1,0,0,
52038af8-7495-4702-b503-9efb639aab85,1489774978,"Do you sincerely think they were trying to get the videos removed? They couldn't access the videos, so they complained to get access to them, and instead they were removed.

I understand that the cost of CCing 20,000 videos is huge, but I don't think they expected immediate results. It could have been done over a period of time, or even just start as making sure to CC all new videos. Since it's the law, they could have received some help from the State for making their videos compliant, so if they were taking their time doing it, it would not have been a huge expense.

They just tooked the easier road of ""fuck it, let's just remove the video"". I'm not going to blame the people of Gallaudet for it (you spelled it wrong, by the way). I'm pretty sure that if they were asked to pick between the videos being removed entirely or the videos not getting CC right away, they would have picked the latter and not the former. But UC was breaking the law, so the videos had to be removed regardless of what the employees would have preferred.

Hopefully they'll re-upload them slowly with CC. I'm sure many people would be willing to help with that effort, even as volunteers, if UC is willing to accept the help.",,,4,0,0,
6f99b329-7f13-4c7d-aac6-5e4014ee87b6,1490805682,Im just waiting for a wheelchair one,,,7,0,0,
9467eb37-981d-4ca7-8d4b-0d1f920f1dca,1489292790,"Out of curiosity, what situations have arose where you felt like it was appropriate to tell them you *loved* them without getting a green light first? 
",,,11,0,0,
027a1edc-29da-4b66-aaf2-22f18a400f4e,1490509365,"&gt;Without capitalism, discrimination would serve no purpose. Workers would welcome people of differing abilities to join them as they work to address the needs of society.

Show me one socialist country where that happened. ",,,4,0,0,
804282ab-83ad-4cb6-84b9-cce1f563499b,1488694283,I am literally crying.,,,3,0,0,
e331d1f6-573c-45e2-8990-cd3aa0f194a0,1489302534,"Only if you consider women to be disposable, capable of being dirtied beyond worth, and worthwhile solely based on their outer layer.

If that's how you feel, then, yeah, I guess it's similar and yeah, it probably is a personality problem.

",,,9,0,0,
d917959e-70e5-4339-881e-a4394671c340,1490698435,"Please visit your State Vocational Rehabilitation agency.  I work for VR in North Carolina.  We can do all types of aptitude testing and pair that with any work limitations you have to come up with a career cluster and then actual occupational codes for jobs you could do.  

",,,3,0,0,
386da598-bde1-4f59-9113-5bc7d741638f,1490010364,An inspiring story!  You've got a great attitude and a promising future.  Good Luck! ,,,2,0,0,
ac4b06a3-70b2-46db-bb79-648b787d8042,1489640029,"You're correct, it's an explosives test. ",,,2,0,0,
c6eeabec-7022-4f87-8070-a7b61b100b7f,1489165760,"I already put in the appeal so ...
in the next 12 months I can basically get everything in order right?
Yeah Im changing my psychiatrist. I have felt for a long time like she isnt right for me. 

Im gonna search for an attorney asap. 
You said I need to find an attorney by my deadline or can I take a little longer?
",,,1,0,0,
3e2013ba-335a-42bb-bacc-4a6e31c5ed95,1489493399,"Be as honest as possible, the nitty gritty of what we really want to know is what triggers your panic attacks and PTSD symptoms, how often you get them, what your coping methods are (medication, CBT/DBT tools, breathing), and what your typical day to day functioning is like. Give the doctor a good look into a day in the life of Panthemanny, and explain exactly what makes it hard for you to work or even actually look for, apply for, and interview for jobs, or reliably show up 40 hours a week.",,,3,0,0,
