commentator_id,created_utc,anonymized_body,ups,downs,score,controversiality,gilded,distinguished
f89bf182-b8b7-4d13-9f6d-bd4d9a525c41,1510631353,"That is so wonderful to hear she is getting relief. I've met a few others in pain mgmt where they start on one and end up on the other. I'm on 500-600 mg a night.  

Honestly, the first few rounds with CBD bath products was kind of intense but after three nights its leveled out. ",,,1,0,0,
9c09381f-1ac5-46a6-820c-004b5c74c11f,1510107800,"I suggest checking out Meetup.com and looking for things you're interested in, also the Chicago area subreddits.  
  
Edit here's one https://www.meetup.com/Chicago-Disability-Friends-and-Fun/ best of luck!",,,4,0,0,
8a04b6f0-e845-4da9-8f53-83a4c83565d4,1510634766,Seconded. We don’t need to keep dividing ourselves along some pretense that “high functioning” people are different than “low functioning” ones - that’s not even a line that makes sense.,,,8,0,0,
cd1dd61d-d948-4afc-a81e-e77de171cb3b,1509893725,"No problem, thanks for your support!",,,1,0,0,
2f0ff134-7985-4cea-8ed1-58372988155d,1509562923,"I'm happy to hear you were approved for so much assistance.

No, I didn't appeal the decision because I couldn't handle it anymore. The effect of the hearing was just too devastating. I can't get out to doctors to help build my case and the one house call service available here didn't believe me about why I couldn't go out to to doctors and lied about their services to deny me (the proof they were lying was on their website). I can't handle calling people to get help. I can't go to a hearing and they won't let me attend remotely. Even the doctors I saw before were worming their way out of writing me a letter to state that I was disabled, even lying that they would write me a letter and after three attempts to get them to actually write it, they still just wouldn't. One of them told me to my face that he thought I was lying. Another doctor lied about my capabilities. One doctor sent in *blank pages* when asked for my records.

The deck is too stacked for me to overcome. I'm simply too disabled to do what's required to get on disability.",,,1,0,0,
febc0c9d-75cc-4c7c-9c69-9bc3c618d465,1511368141,"Fiverr.com

If you have any skills you can offer (typing, translating, drawing etc)  , you can find people who will buy your services.",,,1,0,0,
f49e4d7e-c0b7-4de8-9ee3-f70d9d00dda6,1511297979,"Video Description:

&gt; Jerron “Blind Boy” Paxton is a musician bringing back the magic of a bygone era of American jazz. Drawing inspiration from the blues scene of the 1930s, Paxton has become a master of forgotten music, transporting his audiences to another time. By the time he was 18 years old, Paxton was declared legally blind, lending way to his moniker “Blind Boy.” Still, his love of music never waned. The multi-instrumentalist and musical virtuoso continues forward on his historical mission, rediscovering and spreading the genius of the original black music of America.",,,2,0,0,
85cbf5b1-6d05-40f0-9fe5-8ee05163ed6b,1511779501,"It is important to make sure your briefs are top-notch, as winning your case may depend on it. An effective brief consists of the following elements.",,,1,0,0,
37892f14-97ea-4dfd-a0af-1655668dd973,1511797301,"We love that you took the time to give us some feedback! We are super open to feedback at this stage of the website since it was just launched and we plan to constantly mould and shape it as we go! Right now we are just 2 people working on the project. The prerequisite for products, apps, resources and videos making to our website right now is reviews. We did read many quality reviews on “Look at me” but having this elaborate review from yourself will definitely have us reconsider this App. We also do appreciate your suggestion of having someone with Autism review that tab and we actually already planned to set this up in the later stages. We plan to have people with that specific need test out the products and apps and have them review them themselves. Also adding reviews/testimonials on products is a great idea this way we can see what the community thinks of this product. Anyways we appreciate your feedback and hope you stick around with us on our journey. AAL",,,3,0,0,
2b097b4d-4d33-4679-b3c9-69c07f9053d9,1510936916,"Sorry, I misunderstood. You're already there, but I found 
http://www.cvcog.org/cvcog/trans.html
By searching ""San Angelo TX elderly transportation.""",,,1,0,0,
e038a184-d3ea-496f-9f65-20567dafebfe,1511020807,"&gt;Maybe I just haven't built up enough upper-arm strength

This. Using a manual chair takes effort and full time users build considerable muscle using one. It's not just arm strength but also core muscles that help with chair use - as a part time user you're just not there yet. Work using your chair into your exercise routine and you should notice a difference quickly.

For carpet and other difficult surfaces you can learn to push in a rolling wheelie which is much easier but takes considerable strength and balance, so a longer term goal.

I would suggest you go back to your doctor or physio to talk about your chair. Using a chair without medical approval is not a good idea. Sometimes your doctors want you to stay mobile for whatever reason, or do not believe you have the balance or nervous capability to use a chair safely. If they are fine with you buying your own, you must get fitted properly to prevent postural issues and consequent long-term damage.",,,1,0,0,
f293f257-ad0e-412d-9fa8-e01affb462ae,1510344382,"Hi, that’s so much for the insight. To shed some further light on it all, I got denied first attempt. Not much of a surprise, disappointing nonetheless. I spend almost a month on gathering every shred of detail I could on the reconsideration appeal. Medical records since initial filing, new diagnoses, multiple medication changes, doctor and therapist letters that state I am unable to sustain meaningful gainful activity, statement from a therapist I had three years ago, letters of observations from 2 family members, 2 former coworkers, 1 close friend. Very detailed description of decline in conditions and every day functions and abilities. I wrote letters to my congress rep, senators, governor. I spoke to the senators office who called right away and said if/when reconsideration is denied, they could assist because at that point it’s federal level. My congress rep office was amazing. The constituent services manager met with me and we’ve been in contact. He called local SS office to ask whether or not I should fax mail or drop off evidence. The examiner knew my case and said to drop off. I did last week. I got a request for reconsideration summary in the mail today. I feel no changes are needed so it says to leave it alone. I met a lawyer for a consult yesterday and he read my appeal and said it was excellent especially the doctors letters. Is this summary any indication of a good sign? I know it’s moved out of my local office back into DDS for medical review already. Any thoughts yet or am I still trying to read tea leaves? Thank you",,,1,0,0,
c29f2422-a9ca-48db-b496-6cd30e55176a,1509665253,"You wouldn't get very far. You think social security is just set up willy-nilly? There are fail-safes on top of fail-safes. It sounds like this woman was on benefits and went up for a continuing disability review, where they found her medical condition had improved (as the OP said). That is what a continuing disability review DOES, and everyone on social security has to go through one.
OP's friend is welcome to re-apply, and may be re-allowed. I think she should, in fact. 
But ""suing"" social security is rarely...like almost never...successful due to all the laws, procedures, policies, fail safes, etc in place TO PROTECT THE CLAIMANT. That's why there are so many changes for reconsiderations, and ALJs, etc, to ensure that everything was done fairly.
",,,1,0,0,
0d785d8d-4e86-4fb8-b2ca-18f52973d7c6,1512085332,"It's 2-3 months for the decision and another 1-2 for the payments.

I had my hearing at the end of June and the letter with the decision came in early September. The SSDI money started in October with some of the SSI back pay showing up a few days before the 1st of October. The actual award letter showed up in October. The back pay for SSI then showed up sporadically throughout October and November. They took out Medicare for 4 months from the first SSDI payment. The back SSDI payments are coming ""soon"" according to my attorney. 

It's stressful to check like that. It's stressful to not know what the hell is going on. 

I know how you feel.",,,1,0,0,
65134dbb-cb2c-48e9-ae49-d82fe8da5a8c,1511929918,"Hello, /u/7a3b82e2-e08b-4198-9744-59e667a9f835. 

Your submission has been removed because:

You violated the following rule of /r/disability.

&gt; Rule 4 - [Message the mods](http://www.reddit.com/message/compose?to=/r/disability) before posting a survey. Any unapproved survey will be removed. Surveys are also required to be in a self-post which must include information about the survey, the surveyor, the data being collected, and how the data will used. 



---

If you have any questions or concerns, please [message the moderators](http://www.reddit.com/message/compose?to=%2Fr%2Fdisability&amp;amp;subject=About my removed submission&amp;amp;message=I'm writing to you about the following submission: https://www.reddit.com/r/disability/comments/7g8se1/wheelchair_survey_one_minute_super_short/ %0D%0DMy issue is...). *Direct replies to official mod comments will be removed.*",,,1,0,0,moderator
c381a2a1-8eb4-4f49-bd7b-ae1d8f7011de,1510762689,"&gt; (Several reviews of the trailer daintily mention the character’s “facial differences.” Um, no, the character should have facial disfigurements)

Same thing, anyway. It's been PC'd up for niceness's sake. Disfigurement has  negative connotation. I spent a bunch of time in facial difference support groups and everything must always be shiny happy. So annoying. 

The film looks like useless hackwork, sadly. The kid is super cute. They could have made the kid actually look shocking, actually challenged people, actually provided insight into how it is to be far funky in looks growing up  But no, eww ugly people.

&gt; . My own concern—as someone who has written a lot about bullying and ineffective good intentions—is that when you make Auggie cute, you demonize the kids who bully him. You make them Other. And we lose the ability to see that we’re all capable of being bullies — that we have to choose, consciously, every day, to be mensches

��",,,2,0,0,
0d785d8d-4e86-4fb8-b2ca-18f52973d7c6,1510668089,Even after being shot by one she doesn't have anything against guns. Wow. ,,,5,0,0,
8a04b6f0-e845-4da9-8f53-83a4c83565d4,1510848673,"This is amazing! Best accessibility I’ve seen anywhere, personally.",,,2,0,0,
a8577bb7-a031-462e-9e0a-9b7a6ae28d43,1511470722,"This is the best tl;dr I could make, [original](https://www.desmoinesregister.com/story/life/2017/11/21/thanksgiving-kindness-intellectually-disabled-mentally-challenged-mosaic/850009001/) reduced by 97%. (I'm a bot)
*****
&gt; Deb had been so distraught over her husband Randy&amp;#039;s death from a fast-moving cancer that she didn&amp;#039;t notice that Holly, the intellectually disabled woman who had moved in with the Robbinses a year earlier after years of abuse, was struggling, too.

&gt; Deb, 59, finds purpose with Holly, whom she cares for through Mosaic at Home, a program that places intellectually disabled adults with families instead of in group homes.

&gt; Last Thanksgiving, Deb and Randy eagerly set Holly a place at their table.


*****
[**Extended Summary**](http://np.reddit.com/r/autotldr/comments/7f2i45/holly_escaped_abuse/) | [FAQ](http://np.reddit.com/r/autotldr/comments/31b9fm/faq_autotldr_bot/ ""Version 1.65, ~252718 tl;drs so far."") | [Feedback](http://np.reddit.com/message/compose?to=%23autotldr ""PM's and comments are monitored, constructive feedback is welcome."") | *Top* *keywords*: **Deb**^#1 **Holly**^#2 **Randy**^#3 **year**^#4 **home**^#5",,,1,0,0,
cf96012f-6d90-4661-ab08-aabc4dda8b03,1510167122,"The $1170 number is not an average, but a monthly limit- you can't go over that amount in any given month that you claim to be disabled. But, there are several exceptions to that rule, including ""unsuccessful work attempts"" which likely apply in your case. (Take a look at the SSA's guidance [here] (https://secure.ssa.gov/poms.nsf/lnx/0411010145).) Whether your work attempts look good or bad on your application depends on the specific facts of your case, and which examiner/judge is looking at it.",,,3,0,0,
be8e6b44-ea50-4734-bf04-1a81cc30f559,1509626038,"Your [submission](https://www.reddit.com/r/disability/comments/7ab6me/theres_a_girl_with_very_rare_disabilities_living/) in /r/disability was automatically removed because you linked to a fundraising website.
By consensus the /r/disability community has decided to disallow individual fundraising appeals. See /r/Assistance, /r/Care or 
[other subreddits](http://www.reddit.com/r/Assistance/comments/1hexgp/other_subreddits_that_can_help_you/)  that can help. 

*I am a bot, and this action was performed automatically. Please [contact the moderators of this subreddit](/message/compose/?to=/r/disability) if you have any questions or concerns.*",,,1,0,0,moderator
725915ed-6264-43c3-9fea-b1bc9350a158,1510981447,"Arkansas seems determined to marginalize the needs of our most vulnerable citizens. 


Please help us bring the actions of our Arkansas Government in relation to people  severely disabled. 

Fighting 4000 cuts affecting Arkansas’s most vulnerable.",,,3,0,0,
6df91383-2180-4e5c-9df2-37ea3a8398f8,1509597081,"It's not up to you to decide whether he's disabled or not.  He might have issues that you completely cannot understand, especially if they're mental.  Just tell him he is not officially disabled until SSA declares him as such.  Let him apply, if that's what he's after.  Let him go through the process.  Let the professionals decide who's disabled and who isn't.",,,2,0,0,
c4c6a003-cc26-4573-8be1-5282e9e1ee65,1511994767,"I....should have known better than to try that.  

RIP tendons &amp; pinky MCP.  Also I can totally lift the finger, the range just is limited.  Not sure if that's hypermobility thing, or just a flaw with this video.",,,1,0,0,
f808b564-8a3e-4f9c-a4b0-62d45ef5ed96,1512025362,Acid reflux disease or gastroesophageal reflux disease (GERD) typically do not qualify for disability benefits in the VA rulebook. ,,,1,0,0,
0d81106b-5cce-4ea1-8e15-bcd9ecd4b010,1510361262,"Speaking as someone who worries a lot about CDRs, was she actively in treatment with solid notes from her doctor(s) after benefits started? I always hear that as long as you're in active treatment you'll pass a CDR . . . considering this sounds like such a slam dunk continuation I'm wondering if lack of medical records was the issue?",,,1,0,0,
ca40e141-28cc-4e48-bbde-06d980858989,1511302184,"I don't know what his disability is, but you reminded me of [this](http://www.popularmechanics.com/technology/robots/a24135/liftware-level-spoon/) spoon that always keeps itself level.  Maybe it could help?",,,2,0,0,
c308e9cc-cc71-4275-9620-4ac9f68a239e,1511503089,Do people ask you these questions too?,,,1,0,0,
077ff922-e976-4980-881f-bc6dbb84eb21,1510017066,"Are they listed in the DSM?

http://dsm.psychiatryonline.org/doi/book/10.1176/appi.books.9780890425596",,,1,0,0,
a82bb553-721a-45e3-a70b-3284a1cb9e02,1510300352,"No, he cannot get Medicare with ssi only. 

For those on ssdi, it is indeed a two year wait. ",,,3,0,0,
00f29e61-c452-41bf-b67b-bb63985c21b4,1509899145,"Thanks for posting this. This museum is number one on my ""Want To Visit"" list but I really wanted an independent view of how accessible it is. I can start planning a trip now. :-)",,,1,0,0,
7568407c-582b-4761-bf0a-4ebcdcf0facd,1510968838,"I saved this post thinking I'd come back and read the comments later, but shame there are none, friend.

I just wanted to know what rare nervous system disorder you speak of.  I have something rare that primarily affects my nervous system.  And I'm sure it's a long shot, but it'd give me something to research at least.",,,1,0,0,
a1f06c11-3d71-48e8-a320-eeccf197bf1b,1510713644,"I'm not a lawyer but I think that is the case. You should definitely contact social services though, they will have better information.",,,2,0,0,
65eb3d01-3c5f-4f46-bbd9-7f98ef92e763,1511788598,"what did you apply for? Physical, mental, both? 90% of the time you're going to be approved for what you applied for. 

The only way to know for sure, would be to contact social security and as them for your DIG (diagnosis) code and then try to find it [on this list](https://secure.ssa.gov/poms.nsf/lnx/0426510015). But these are typically general categories, so it still may not give you the exact reason that you were granted benefits. ",,,1,0,0,
5ddd8b26-45e2-4498-827a-278f668292a1,1509976094,"I lurked in your post history and noticed two years ago you inquired about losing the weight. I don’t know if you got the answers you wanted on those subs, but if it’s something you need help with I’m willing to try! I lost a significant amount of weight but gained most of it back when my dad died. I’m currently in the process of losing again. 

I’m also close to you in age, 24, but it’s helpful to have someone to discuss this with or even get you started. I think applying for disability might be useful for you, but in the long run trying to fix/turn your health around might be even better. ",,,2,0,0,
d42770b1-9f84-462c-9536-090461a2ff56,1511037777,20 or 30 years of propaganda coupled with a lack of empathy.,,,2,0,0,
6be7e826-bf78-44c3-9011-d80b6993cca7,1510783980,"•Lists like these

•People assuming all disabled people are the same, and that they automatically speak for every other disabled person just because they are disabled. ",,,5,0,0,
d42770b1-9f84-462c-9536-090461a2ff56,1511036401,"I'm mostly used to it by now. My stroke effected my sensation and movement on the left side of my body, it just ends up being the "" new normal"". It bothered me much more at first

When you have no option you get used to things more quickly than you would have thought possible.

In stressful times it bothers me more because I feel like I'd be better able to handle something, or that something would not have happened at all, like dropping something.This makes me much more acutely aware that the new normal isn't normal.

Dreams where I can move normally tend to upset me the most, fortunately those are infrequent.",,,1,0,0,
5196f89a-623d-4a77-b49e-d2a7822b9402,1510382535,Some resources : https://www.cdc.gov/ncbddd/developmentaldisabilities/links.html,,,1,0,0,
b9dac879-e6ba-480c-aaa2-46d8bbb47243,1510011659,"People take photos of you because of your condition?? I hope it's just a concern of yours, and not reality :( that's absolutely atrocious. Who the hell does that?",,,1,0,0,
48aa8e29-c585-4b0b-8c48-7f063b9c4b8b,1509644644,Call the 1800 number to ask them. You NEVER want to just keep money that's not yours when it shows up!,,,1,0,0,
be8e6b44-ea50-4734-bf04-1a81cc30f559,1510498832,"Your [submission](https://www.reddit.com/r/disability/comments/7cftaz/ihear_affordable_invisible_hearing_aids_under_300/) in /r/disability was automatically removed because you linked to a fundraising website.
By consensus the /r/disability community has decided to disallow individual fundraising appeals. See /r/Assistance, /r/Care or 
[other subreddits](http://www.reddit.com/r/Assistance/comments/1hexgp/other_subreddits_that_can_help_you/)  that can help. 

*I am a bot, and this action was performed automatically. Please [contact the moderators of this subreddit](/message/compose/?to=/r/disability) if you have any questions or concerns.*",,,1,0,0,moderator
425347e2-dd6b-4586-b98a-8c88ba8bf351,1510968928,Congenital Central Hypoventiltion Syndrome! ,,,1,0,0,
0d785d8d-4e86-4fb8-b2ca-18f52973d7c6,1510314210,"Once he gets the SSDI award letter he will get Medicare. There is a 2 year waiting period, but if he has been on SSI for 4 then he’s probably going to qualify. The award letter will state a date of onset and it is used as the date for Medicare. 

If you have both, then make sure to sign up for a Medicare Advantage plan. It’s usually no cost if you’re disabled, but find out first. It will take over the Part D and provide lots of other benefits. 

The paperwork is more debilitating than the condition!!! ",,,2,0,0,
9fecae27-7a35-49b5-96a0-18559b6c336d,1511457151,"Yes, on my campus. I mostly use Dragon, but as far as I know, any AT that the school uses to make exams/midterms accessible for students has to have tutorials available on campus for new users (or new to the new version users). This is at least true where I am.",,,1,0,0,
6df91383-2180-4e5c-9df2-37ea3a8398f8,1509596922,"That scene struck home for me too, having anxiety and depression issues.  I'm still capable of things and still willing.  People just need to understand I have more limitations than most.",,,1,0,0,
885cd5aa-8160-49d6-98e5-6ac03e01406b,1510593393,"Good stuff here; We've been working with my son (8) on this for a few years - his issues have quite a bit of overlap between Cerebral Palsy and Autism and we've struggled to unravel which issues are CP and which are autism.  They may not be unravelable, but it helps to try and understand some of the factors...",,,1,0,0,
a1f06c11-3d71-48e8-a320-eeccf197bf1b,1510702070,"Also, call me crazy but I don't see a professional autism mom on an anti-carb blog as authoritative.",,,5,0,0,
cd1dd61d-d948-4afc-a81e-e77de171cb3b,1509893751,"Thanks for your support, I appreciate it!",,,1,0,0,
f69b9271-cbbb-4f42-839c-7941401636f6,1509991110,"In my experience, a common habit of people struggling with anxiety is avoidance of treatment. I've been through it myself, and I've had several loved ones go through it, and the common thread is that we kept putting off getting treatment. 

I honestly can't explain why. I have no idea. I wanted help. I wanted to feel normal again. I wasn't against medication, or against therapy. I was just scared, and overwhelmed, and frustrated. But once I took the steps I needed to take to get help, I was SO angry with myself for waiting as long as I did. It's unnecessary to fight that daily battle. There is help out there, and once you get your anxiety under control, you'll be so thankful that you took the leap. You deserve to feel ""normal."" 

Edit: I said I wanted to feel normal again, but when I got treatment I realized I had never felt normal, even in childhood. High levels of anxiety had become my normal from an early age, and finally feeling that level out was such a huge relief. ",,,2,0,0,
077ff922-e976-4980-881f-bc6dbb84eb21,1510004595,"Depends on where you are. In the US, this process should start with your medical provider - those who diagnosed you and you told about this pain which should be treated. ",,,1,0,0,
cf96012f-6d90-4661-ab08-aabc4dda8b03,1510944363,"This is not true. Meeting a listing is only one way to qualify for disability. Another is simply to show you are unable to work full-time. 
  
Agreed that speaking to an attorney is a good idea.",,,3,0,0,
