commentator_id,created_utc,anonymized_body,ups,downs,score,controversiality,gilded,distinguished
501f1952-d7cf-4a4e-bce2-0b362d2aba21,1489654917,"&gt;I understand having issues, I have mental health and a few physical issues that leave me unable to work and function some days. Has she applied for disability if its so bad? That would help with money. 

We haven't discussed it in depth but as I understand it she's not ""technically"" disabled enough to qualify for disability, by the DPSS' metric.

&gt;I would love to meet someone that would put up with my issues and accept me. She's very lucky, I think she just doesnt realize it. Why would she yell at you? From the sound of it you do everything for her and her way, yet she yells at you? That's very unhealthy. 

I don't want to give off the wrong idea. She's a great person but she's got a lot of hardship in her past, especially with regards to her disability so it's a topic she's very sensitive on. Her parents basically gave no fucks and treated the list of things you just don't ever do/say with someone who has a disability as a to-do list, they just canned her up in an apartment for several years with no real human contact.

She tries hard to protect herself and I can't say I blame her.

&gt;Is she on medication? I think she should go to therapy, it would help her out with dealing with her issues. If moneys an issue for that would she qualify for Medicaid? 

Oh yes. Quite a lot of it. Mostly for pain management. She's been avoiding therapy because of the anxiety and she's already on Medicaid. Getting meaningful therapy when you're on Medicaid is incredibly difficult.

&gt;I would tell her how you feel. I would just say you feel under appreciated and wish she would try harder. She may not even realize how these things affect you. 

We've had that discussion several times and I do feel like she's trying, she has also acknowledged that this has been a lot harder on me than we thought it would be. There's just...not a lot of change day-to-day.

I understand I don't *have* to stay with her but leaving feels cruel. She has no job, no real money, very few friends, and some serious medical conditions. Leaving wouldn't quite be a death sentence but it would make for a very dark future for her. I'm basically it in terms of a support system.",,,1,0,0,
f589729b-a56d-4072-aaef-829b216fc600,1490029622,"I really appreciate your post and your story. I'm happy for you and everyone else who has benefited from what you said and have come to accept yourselves.

I feel as though I'm in the opposite situation, that is I'm getting worse and less accepting. For the record, I am a 36-year-old C6-C7 quadriplegic, almost 20 years post injury.

My condition is in no way to generative, but my pain levels continue to increase and there just isn't enough money or funding for the amount of physiotherapy, chiropractic or massage that would keep me at a point of reaching something closer to my full potential. Of course, mindnumbing and liver destroying painkillers are in great abundance. Oh how I hate using those because what if I really need them at some point for something much more serious, and I know that my mental capacity is never at its peak when I use them. That said, when the pain is gone, I certainly can get a lot of work done but it is best if it does not involve intense thinking.

Everybody tells me what an accomplished, skilled and talented photographer I am. I appreciate their kind and supportive words, especially those that come from people who know better than to say things that are false to me. When I need a good critique of an image, I go to those who will give me the honest answer.

What I see in the mirror is a guy who has a pretty decent intelligence level, talent and experience making fine images but a flaky body that either keeps me down because of pain, poor sleep (often because of the pain) and an unreliable G.I. tract. Some of that is caused by those blessed/damned painkillers when I do choose to use them.

I will quit ranting. I really didn't want my post to say that I am happy for those of you that have accepted you as you are. I feel that the older and wiser I get, the more I try to go out and be part of society, the more I see unfair barriers, both physical and attitudinal, that sap my motivation and make me feel as though I'm really not supposed to even try to live up to the potential that I know I have. I loved the accuracy but hated the bitterness of a post on here a few weeks ago, where one of the replies stated that as long as society refuses to create the infrastructure in which we can fully function, why do we owe them anything to even try? Like I said, I don't like that bitterness but some days it just feels like once I'm done dealing with the obstacles of being disabled I have so little energy left to contribute to society, contribute to my own sense of growth and accomplishment and be the best father, domestic engineer and cook for my family, those who mean the most to me.

I will reread your post again later and see if I can't gain some more personal insight for myself. If anyone that reads this can relate, and has found ways to mentally move beyond where I feel stuck, I would welcome your thoughts.",,,5,0,0,
027a1edc-29da-4b66-aaf2-22f18a400f4e,1490275206,"Me personally, no. 

edit: now, if I was allowed to wager other body parts, maybe. ",,,1,0,0,
f18a7e3d-2ae3-45ae-98e7-726cc8fdb59c,1489900283,"This really isn't the case and you shouldn't worry too much about it. I'd say about 90% of the flights I've been on the armrests facing the aisle can raise. I actually just mentioned this in a reply to you other post but just ask a flight attendant to help raise it, they typically know how to do it. The armrests are locked in place, but there is a button on the bottom of it somewhere near the seat back that you need to depress for it to unlock. I typically find it myself when I'm still in the aisle chair because I fly so much and it blows the aisle chair crew's minds because they never knew they could raise, ha ha.",,,1,0,0,
1cc6d3ff-c45b-45b1-b638-77834cc81d4d,1489078496,"Yes. I got in touch with my accommodations director in disability office because special parking requests can be made, so hopefully he can help. ",,,5,0,0,
6a9b5dba-0e83-4674-8765-e24201f4267b,1489520710,"The major issue is how so many people with disabilities are ignored in acting positions. So many are unemployed for any job, really. People don't think twice, but if they did, they could be finding some fantastic disabled/marginalized/other minority actors. The US has an association for deaf actors and actresses and yet almost all deaf roles in TV shows and movies have been hiring hearing people.",,,3,0,0,
948f5be7-0b73-435b-950f-7397edd9b15b,1488990155,"A rated g version of the truth.  I don't mind the kids honestly.  They're young, and curious.  Gives me a chance to educate them a bit on how to act around disabled folks. ",,,3,0,0,
d45e850c-e657-40b2-a4ee-ab32905b76c2,1490231647,"Any way she can stay with family? relatives that can help cover, maybe you can find some assistance for part time care?
How old is she?

any medicaid expansion where you are? I'm surprised she can be released in that condition to be honest!

I went through that over this last couple years (minus the communication part) and it was very rough even with 6 months between two good rehabs. I'm 38 and Ive been told my age gives me an advantage, I cant imagine this at 60+
Crazy idea maybe some crowdfunding like a gofundme?

This is not helpful at all but I'm raging for you. Your mom should have better care. a quick discharge is barbaric. =(",,,1,0,0,
8f2ab161-fabe-4886-8eaa-64e001505ef0,1489100394,"Thank you! He mentioned that they take a portion out for his Medicare or Medicaid from his benefits each month and they didn't this month. I don't know all the facts, so sorry if I'm not making sense. I only know what he's told me.",,,1,0,0,
92338401-4c21-40e9-9544-2873f6d9551b,1490825512,"""It's in what you like""

What'd you mean by the above? 

Hopefully ",,,1,0,0,
c29f2422-a9ca-48db-b496-6cd30e55176a,1489618163,"I don't know why you were denied a reconsideration request unless you applied for a recon too late, but you can reapply as many times as you'd like. I would recommend reapplying, and if you get sent to the same CE examiner, tell your analyst you do not want to go to the examiner because of what happened before. 

If you can't afford the co-payments, try to get off your family member's insurance so you can go to the free clinics? It does not seem the insurance is helping you much. 

Calling a hotline is helpful because it's someone you can talk to, someone who will listen and offer sympathy, advice, and an ear. Please do not give up. ",,,1,0,0,
459cc5da-b083-416f-8faf-70692e5a8be6,1490745931,"I had hoped that it was different than here, it's a shame practices like that are gotten away with.",,,1,0,0,
1fdf3be9-e13c-44f8-94ee-e5570d628981,1489291090,"I've been bitter and angry at times but not self-loathing. 

I'm Currently in a much better place after having taken a 40 hour MBSR (Mindfullness Based Stress Reduction) meditation course designed for people in chronic pain. 

I have had a daily meditation practice for 4 years and have come to understand that I'm still me;  meditation helped me to gain an acceptance of what my life has become and to take joy in comfort in what I can enjoy and to let go of that which I can't control. 

I get great comfort from breathing; feeling my breath go in and out and knowing that I'm alive and this is my life. I may now appear hopeless to many others, but for me being present in the now and not fighting to be how I would be if I was well has freed me to enjoy the existance I have. 

The MBSR course was designed by Jon Kabat Zinn when he was hired to develop a new means to treat the most miserable and intractable
chronic pain patients. The course uses secular and scientifically developed meditation techniques to treat sufferers who were unresponsive to all conventional treatments and were seen as untreatabke.

MBSR courses are offered world wide by trained and licenced medical providers. It changed my life. 

http://www.umassmed.edu/cfm/mindfulness-based-programs/mbsr-courses/",,,8,0,0,
9467eb37-981d-4ca7-8d4b-0d1f920f1dca,1488429134,Do you mean the elitism from the general disabled population towards the deaf community? Because like hell if I know. ,,,1,0,0,
9467eb37-981d-4ca7-8d4b-0d1f920f1dca,1488515380,"Well, if you're saying that they wrote like a six year old, there's actually a real reason for that. But yeah, there's always idiots in every group. Cross fitters, the local math club, and Canadians. Mostly I try not to judge. ",,,1,0,0,
d917959e-70e5-4339-881e-a4394671c340,1489326588,I work for VR in NC and we have benefits counselors who's sole job is to give you guidance about all of this.  What state do you live in?  ,,,1,0,0,
9e9ea3b1-5954-49fc-af1b-ba3a88931af5,1489683930,If you're not happy this isn't the relationship for you. I'm very sorry but she seems to be taking advantage of your giving nature. I would understand helping her if she was at least grateful for you but she sounds mentally abusive. You don't deserve that. This may be how she treated her family and why she's estranged now. You can break up with her if that's what you want. You could stop doing everything for her and tell her she has a preset time to find somewhere to go like 2 weeks to 1 month. Where she goes after that isn't your problem because you have her time to figure it out. She needs to work on herself before she can be in a relationship. ,,,4,0,0,
2165338b-9864-4f67-9889-f37d62f75ae0,1489783743,"Not analogous to the situation in any way, sorry. ",,,1,0,0,
307a586c-dfc4-4e06-8deb-d231debec646,1489702633,I don't know anything that you just asked. I will look into getting an attorney. Thanks!,,,3,0,0,
2165338b-9864-4f67-9889-f37d62f75ae0,1489787875,"Another argument I didn't make. You'd have to be an utter asshole (or a lawyer, not much difference) to file a legal complaint you know would result in removal of access for everyone AND have such far reaching consequences. Not just for open learning and education, but for the disability rights movement in general. ",,,1,0,0,
8e1397a9-6b9b-4ef1-844a-a64334ac4fd2,1489955714,"That's good to know. Many patients don't feel like they have the ""right"", or simply don't think to, take the actions that you took. I'll look into this more.",,,4,0,0,
ac60aab4-d67f-4ff4-85f9-465bc31c576a,1489967334,"My hope for the guidebook is to contain strategies for how to deal with disrespect from people who have unfortunately had to learn the hard way. I'm still thinking all this through and all the replies here are helpful. There may ultimately just not be many effective ways to respond to disrespect in the medical setting, it may be something we just have grit our teeth and bare. but some comments here suggest there may be more effective methods to get our voices heard.",,,1,0,0,
de6dcd15-0280-4763-85ac-07d6d6c73060,1488574263,"For concrete advice, I recommend talking to a disability lawyer. I got one and it hasn't cost me a dime. I'm trying to get SSDI with a brain injury, and it's a tough hill to climb because brain injury isn't well understood yet. Look up Legal Aid services around you, I'm sure you can find somebody qualified to give you concrete answers. Personally, I'd say there isn't much for you to worry about, just do your best with the paperwork and try to keep it organized. Paperwork is my cryptonite. My roommate is the only person who supports me.",,,2,0,0,
2ae69041-931b-494e-b9d1-9d266647bf38,1488599055,"What if do not qualify for SSI because I get SSDI? SSDI is nice, but it is not enough to cover my expenses. I would happily give it up if I could work and keep Medicaid.",,,1,0,0,
ca2d5ddf-11bc-4597-abb5-d3f7ae707019,1489368016,"Waivers don't cover the cost of private schools.   Also the data of existing waiver programs show poor results even for regular education children.   Add that in with public schools experiencing further funding shortages due to waiver expenditures; The ESE student population stuck in the schools will be further disadvantaged.   

My heart broke when Devos won the nomination.   Students like my son are on the losing side of this.   Privates schools won't take him and even if by some miracle they did he would lose IDEA protections and we would have to win the lottery to pay for the rest of tuition because educating ESE students is expensive and time consuming.   To you this might be politics but to me this is our reality.   

There is also a lot of uncertainty on whether this current administration intend to weaken IDEA, a civil rights education law.  More importantly if they enact funding changes to medicaid they will negate EPSDT law guaranteeing children access to many Medicaid medical services.   Disabled children will be disproportionately affected by such a loss.  They get many more services covered then adults on Medicaid due to this law such as medically necessary OTC medications, diapers, private duty nursing, eye care, dentistry, DME coverage, AAC devices and therapy.  ",,,3,0,0,
65eb3d01-3c5f-4f46-bbd9-7f98ef92e763,1488458373,"Have you received your ADLs and work history form yet? What I always tell people to do is include your records with that. You'll notice that they gave you a bar code to put on the top whether your mail/fax. That is how the information gets into your electronic file. 

If you just mail or fax it straight to the DDS, there is a good chance it won't make it into your file. You need to find out exactly where your case is (is it at the DDS or still with the Field office), and contact them to find out how you can get them the paperwork. 

You cannot submit an imaging CD. SSA computers don't have the software to read those. All you need is the xray report from the radiologist (which should be in your records already).

edit: if you do end up mailing or hand delivering records, make sure that you give them a COPY of your records, don't give them your only copy. ",,,1,0,0,
459cc5da-b083-416f-8faf-70692e5a8be6,1490761351,"You're welcome. 
You are definitely right on false hope. It's certainly something to be careful of.",,,1,0,0,
125e148b-a612-4466-826f-f66458e9c2a1,1489635233,"Both your therapist and your support worker should have given you information about your rights as a client. Included in there should be information regarding informed consent, and who to contact if you have a problem with the services you are receiving. These are important things for you to have and keep in mind. If they haven't given you that information they're in violation of a lot of specialties' professional/ethical standards.

Your participation in their services or with them as your providers shouldn't be mandatory. Your participation in volunteering also shouldn't be mandatory. If you have concerns about your capability to do volunteering work they're obligated to help you determine other options that might work for you. If you feel you want to give them the opportunity to correct their error, state this plainly. If they refuse, go above their heads. You might also be able to get back with the doctor who referred you to see if you can get them to support you in this.

You don't have to blindly follow suggestions of people if you feel it will hurt you. You have every right to advocate for yourself and tell them no. They may mean well, but their way of doing things isn't the only way and they need to individualize their services if they expect to be proficient in their work. ",,,4,0,0,
3e2013ba-335a-42bb-bacc-4a6e31c5ed95,1490273567,"What would be your reason for asking for the file? If you want it for your own personal reasons, then ask for a copy, but the disability office has the entire file from when you were allowed, and will get the updated records from the sources you listed on your 454. If they decide medical improvement has occurred, you get a hearing. You can request to receive your entire file on CD prior to the hearing, or get a half hour to review the file prior to your hearing.",,,1,0,0,
43715a5b-2776-4ea5-9572-58934ad4520d,1490391180,"Yeah It would definitely show up elsewhere eventually I was just curious as to if it would be an immediate switch or like...the person would have phantom limb ticcing or something lol

I have tourettes and for me its incredibly frustrating when I have the urge to tic and try to supress it or can't do it in a situation...I'm just imagining the urge to tic and not being able to do it because the limb isn't there being maddening until it switched to somewhere else if it stayed for a while",,,1,0,0,
da78dbd3-e2ec-494c-a9d7-b945b391594a,1489351647,"I'm a little late to the party – but this guy is a friend of mine-
https://aminl.com

That sounds like I am advertising , but really I am not. He has a great outlook on life – he has been disabled all of his life, and has been able to change his outlook on life not only to better himself, but to make a business out of it. I'm not sure if he does online coaching, but it may be worth reaching out and saying hi to him. I think he may have some interesting advice or input to how you are feeling. His blog is thoughtful, funny, and self deprecating at times. It's honest and super relatable.

And by the way, I've seen that there are people here that say that they have tons of self-confidence. And I believe them! But keep in mind for everyone, able-bodied or not, it is a day-to-day battle. Some days you feel great – some days you just feel like shit. It's OK to have bad days, good days will come too.",,,2,0,0,
2165338b-9864-4f67-9889-f37d62f75ae0,1489783823,My analogy would be that grass isn't wheel chair accessible so we need to pave over the entire park. ,,,2,0,0,
d0d4be64-a550-443e-ac4b-255d418ab00c,1489782700,Not having done proper [budget] planning is not a reason to obey the law. Would you say a similar excuse for if you got pulled over?,,,3,0,0,
875b0aa9-0637-4529-bfc8-1b52f49c2c4e,1490654892,Just mock them like when anyone says something stupid.,,,2,0,0,
46240103-7bc4-458c-86aa-dd4d38df45ba,1489610374,"Hey, I know this isn't hugely helpful but you're not wrong in the fact that this is a seriously unhealthy situation for you. If you need to hear it from an outside source, this is it: that sounds like it's only going to keep draining and destroying you until she's taken everything she can from you and YOU end up on the street or equally badly off. I get having a mentally ill partner but I feel like this is her taking advantage, not her asking for actual healthy support from her partner, if that makes sense?",,,5,0,0,
e9129e83-1f21-49e6-98f1-cdeef4b5a4fa,1488916255,"If I was physically capable of it I would become and escort. Not that I would want to, it would probably be psychologically damaging to me but that still sounds better than being homeless. ",,,1,0,0,
74f99c3c-5b78-4b54-bd6b-281b52ec89da,1489769399,Thanks for the info!  I'll check them out.,,,1,0,0,
3b74ac2f-4a5d-4dca-824e-f72ea4d5d70c,1488326525,"Woah that's really bad, I'm so happy he is ok. Though this project wouldn't allow me to design a hospital bed I'd like to know if such dangerous equipment is used when staying at home when sleeping on a normal bed?",,,2,0,0,
094f16df-fb35-4d85-aa2f-f4a2e086e76d,1488598045,"The one I saw was a quack. Don't worry too much about it. I had a pain level of 9 when I saw him and have lots of problems that at the time where thought to be failed back syndrome, only later to get a more specific diagnosis. I was still denied, in the midst of waiting a few years now for the trial :(",,,2,0,0,
9d1852eb-4755-46a2-80c1-74dc93bd3701,1488854446,"Good idea..I will definitely call in beforehand.  I definitely plan to check my wheelchair at the gate.  But, glad to know there's at least one thing airlines don't fuck us over with :P  

It's a short flight so not too worried about the bathroom issue.  

Thanks for the reply:)",,,1,0,0,
027a1edc-29da-4b66-aaf2-22f18a400f4e,1490243894,I can't believe you've done this.,,,3,0,0,
7128deaa-bc73-4fd8-942b-5e0c75b6f126,1488431305,"I was told it was the other way around. I don't know any deaf people, but considering there were special schools only for them when I was growing up, I can see why this perception exists. ",,,2,0,0,
aae7c254-aa01-4ce4-83ba-64398c3b7be8,1488355637,"I'm not, but my family knows a guy with CP who 'immigrated' to Japan. However, he had worked there on business for a number of years and I'm not sure if he is actually a joint-citizen or there on some long-term work visa. I never met the guy so I can't remember details.

You might want to consider something like a ""Teaching English to Non-English Speakers"" certificate. It is a fairly easy certificate to get and most post-secondary schools have some sort of program to get it. However, having something like that might help you live abroad as a skilled worker, making any disability less of an issue. ",,,1,0,0,
7e68e93f-4294-4c4f-80ee-c7fb2f4e0a9a,1489463603,"Yeah. The leash sucks. Like any leash, you get used to it. You got used to the limits your disability placed on you. You don't love them, but you get used to them. 

The labeling thing sucks. It's been a few years since I got my disability judgement and I am still struggling with dealing with it. When I first brought it up to the psychiatrist I had at the time, she did say, ""I think this is something you probably need but I hate doing this. I have seen so many people do this and then roll up and give in."" I didn't really know what she meant and I told her that wouldn't happen to me. I was still trying to go to college then and she was my pdoc there. I saw her there until she retired and I pretty much had to leave school at the same time really. 

I TOTALLY understand what she meant. She only really said it that one time. I don't think I would have heard it no matter what so even if someone had sufficiently rang the alarm bells, I don't know that it would have mattered. It's been 4 and 1/2 years since I left school and the only thing that has happened is that I have gotten worse. Nothing is better. I live with my parents. I can't even get myself out of the house really to volunteer. I am isolated from nearly all of my friends. I don't really DO anything. I have let my life slide so far that I don't even know where to start picking things up. It is nice to have health care because I have all kinds of crappy health issues now too- but I am now starting to wonder how many of those are caused by the psychiatric issues that I cannot get under control. Honestly. I was suffering and struggling before but I don't know if struggling wasn't better than letting go and just slowly sinking with a really crappy life preserver. Just my take on it. I'd go back to struggling but I am nowhere near as functional as I was when this whole thing started so... now it's like crack and I'm addicted and I don't know how to get off.
",,,3,0,0,
65eb3d01-3c5f-4f46-bbd9-7f98ef92e763,1489579681,"I think you need to treat it more as a conversation than an examination. They'll ask you a ton of questions, and if you're responding honestly it will be just fine. Honestly these exams *rarely* make or break a case, and the doctor you see does not have any say in the decision. ",,,1,0,0,
74f99c3c-5b78-4b54-bd6b-281b52ec89da,1490719279,"I'm not sure about any organizations in your area as I live in Missouri.  However, I have a good friend who is a Special Ed teacher in the IE.  If you need her info let me know.",,,1,0,0,
