commentator_id,created_utc,anonymized_body,ups,downs,score,controversiality,gilded,distinguished
cae28d09-3eca-40c9-93e5-ea34dff4462e,1493410735,Tell them after you get hired. Never disclose disabilities in the hiring process. ,,,2,0,0,
962bc8ef-23eb-429d-bec6-b55a57f46549,1491941980,"I am a paraplegic as well.  I say write your story.. Perhaps it will be a more interesting take on it as you struggle to put yourselves into someones shoes who has lost their ability to walk.  For a lot of newly disabled persons, its not just the lost ability to move and function, but it also has an impact on what their own self-worth and self-image becomes.  This takes the most hit with a lot of people.

I have been disabled my entire life so I am sort of a coach and a mentor to persons like this.  I like to say ""Your life is not over, its just different.  Learn to adapt, learn to live and you will be surprised at what you will be able to achieve, even from sitting in a chair.

Also, here is another graphic novel that deals with a person going through a similar process that you are talking about.  Its centered around a wheelchair basketball athlete and team.

https://en.wikipedia.org/wiki/Real_(manga)",,,4,0,0,
0cb23645-9306-4f62-8ece-9db0ef6e1853,1493312676,"Is there personal care assistant program offered by the state where he lives? This will allow him to live at home/in the community. Have him hire an attorney for the divorce. Since he is disabled and cannot work and has relied on his wife for income, it may be possible for him to get support from his wife after divorce. Really depends on state laws. If he doesn't live somewhere that has a personal care assistant program, might be worth looking at alternative places to move. I'm a quadriplegic and in my final waiting period for my divorce to become final.",,,1,0,0,
5cea98c3-cc6b-44a4-9e35-5087342ff614,1493154180,"I think this is a really exciting! I work in accessibility and special education, I am also a parent.  I think raising children to be inclusive is one of the most important things we can do.  I would be interested in a book that talks about inclusive friendships, tips and practices, and the equality in our differences. I wish you all the luck!",,,3,0,0,
510090f0-437a-46a7-af1c-f306fc3ee2c6,1493587874,"As an aside, you may also read up on in-kind support since you will be living with someone on SSI.

[This link](https://www.ssa.gov/ssi/text-living-ussi.htm) should be a good introduction.",,,1,0,0,
220056aa-2070-4815-81c5-a4d9b4b54760,1491269223,Will those doctor's appointments be like the ones in SSA Consultative exams? I had an awful encounter with one of those and I would *really* not want to experience something like that ever again...,,,1,0,0,
ca201d4e-48aa-41fc-b6c0-475e5ecab276,1493350661,You can always go to your property manager and request that he do something without missing the law.,,,1,0,0,
30c5b634-d237-4b27-a37f-e32a3fd44a4f,1491487996,"Sounds like what the NAZI's did to justify their war on disabled people as well.  He seems rather focused on disabled people as set for a life of unhappiness.  Technically, people with chronic depression are disabled too.  In Denmark they have very rare cases of assisted suicide based on quality of life, where the participant advocates their own death.  But those are rare and are contemplated by the person in question and doctors who know their cases personally.  He's talking about infant children though... 

EDIT: I hate NAZIS, my ancestors died there.  He can't philosophize on death for anyone.  It's not right.  How does he know the majority of disabled people?  ",,,4,0,0,
11701371-6c4f-401e-9763-7a0168485ed8,1492460087,"You've got it :)

When possible I ask someone's preference. If their disability is relevant to conversation I then use that preference. Most of the time it's not!

I have found that some people want to make their disability a large part of their identity, in the same way that some make their sexuality a large part of their identity. 
If they want to do that, that's up to them and I will not stop them. But it's not for me, because my illnesses are something I *have*, and only a very small part of the person I *am*. ",,,1,0,0,
cc60cffa-30e8-4060-8326-65236370a073,1491204785,"What about a tablet with a sim card? Most don't have an actual phone app, but that could be fixed by using something like Google Voice. Most android phones have support for voice controls too which could make input usability/screen size less of a concern. Galaxy Note phones are a good middle ground between phone and tablet size.",,,3,0,0,
d0d4be64-a550-443e-ac4b-255d418ab00c,1492705228,"You can ask for accommodations, the most likely ones you will get is alternative test time/locations. You could see if the instructor will let you take it at home so you don't need to go in that day. You may be able to ask for a note taker, for days that you just can't get there. All of this will need documentation by a doctor, saying what, and how much detail is dictated by you college's accommodations office, usually called DSS.",,,1,0,0,
dea45520-6d27-40cb-a50a-7b50820c9aad,1491749805,"My own plates and placard (kept in my husband's car or brought with when not using my own car) are registered to me and to my DL. I would have to agree with the officer and have a placard on hand, as that's the only way they have to verify who they are prescribed to.  
Interesting they are checking though! I outwardly look mobile (particularly if my Service Dog isn't noticed), so I'm surprised I haven't been stopped. ",,,1,0,0,
37d04fa2-c904-4295-b81b-241d50cabf88,1491337491,"https://m.imgur.com/a/soWEr 

Blue circle - normal field of visioon

Red circle - my field of vision.",,,2,0,0,
c08b5cd8-20a4-428a-8482-e7aa753b74bb,1491517423,"I got SSDI when I needed it, went back to work when I felt like I could a couple years later.  They told me that it is much easier for me to get disability again if needed .. basically no investigation since mine was basically for the rest of my employable years.

I don't think it is really a decision that you need to make that you can't take back.  Worth it to have it.",,,1,0,0,
d45e850c-e657-40b2-a4ee-ab32905b76c2,1492042016,Yep going through that now. Thanks to the ACA my state has the medicaid expansion which seems great so far. Using that until medicare kicks in.,,,2,0,0,
48720b87-66d6-4b16-883d-e3c7f0bbe6c1,1492256094,"Yes that is the case, if it's metered with a machine get a receipt, and if it's normal quarters, take a picture when you arrive",,,4,0,0,
dd5eb00e-666e-420c-8899-cc8a70053217,1492694109,"You should probably consider getting a power chair. The majority of colleges don't have anything in place for people with physical disabilities. They're very clueless.  They mostly just deal with test accommodations for ADHD. You should try to have a meeting with a Dean that has power to help you. 

Be careful you don't end up with nerve damage from overusing under arm crutches. ",,,2,0,0,
5905a3d8-ca1d-4986-a81a-308adf2c6eca,1492016369,not too sure but [flic](https://flic.io) might be able to use IFTTT to do this? nice little device...,,,1,0,0,
2e84cb19-e4a7-4da3-8ae8-bfff163a6152,1492198122,"Thanks, I tried emailing them but they haven't replied yet.",,,1,0,0,
2ae69041-931b-494e-b9d1-9d266647bf38,1491323168,"Yes, I agree it will not put SSDI and Medicare in danger, but I believe it will put Medicaid in danger.",,,1,0,0,
d04398fa-0678-4ad4-8875-9203924a867d,1491439142,"Pet sitting isn't really that complicated. I have a friend who does it and it's pretty easy to start. You help out a friend for a decent fee, they tell their friends etc etc

If you're right about boarding in your area then Pet sitting is an even better option because owners don't have to do anything (vaccines, paperwork etc) and their pets don't get stressed out by the chance in scenery.

I dreamed of being a vet once, but for a bunch of reasons couldn't do it. I love animals so that I didn't let that discourage me. I found different ways within my limits to support that love. Maybe instead of thinking about why something won't work, think of creative ways that might work and give it a shot. You really don't lose anything from trying.",,,1,0,0,
322615a8-192e-4fe4-a282-c8578c9b5ae5,1491355841,"I filed in June of 2014. My Hearing is tomorrow. :(
I was denied once and decided a lawyer was the way to go. Denied again and my lawyer immediately filed an appeal.  It just takes time. ",,,1,0,0,
48720b87-66d6-4b16-883d-e3c7f0bbe6c1,1493291784,"Look, you need to go talk to a CWIC, go to choosework.net and find a WIPA project. There's no reason why you need to worry about TWP, when the real number is SGA, and even then you have the EXR, and the EPMC. Also in your state if you are just worried about health care there might be a Medicaid Buy-In. So here's the thing... these are a lot of acronyms, do the right thing and have a trained individual tell you what they all mean.",,,1,0,0,
235aaa3c-f07b-4484-a363-704af13bc429,1492114586,Are they generally over sensitive or under sensitive?,,,1,0,0,
37f84417-f829-4671-99d3-7ee8393787ad,1492455369,That's totally fair and entirely up to you :),,,2,0,0,
178b05b1-a29a-421d-8ae9-ad56658b4499,1491939577,"You gotta learn a way to deal with the difficult shit that come with having a disability. Not only with the physical stuff, but also the social stuff. The earlier you learn to confront the difficult social stuff the better. It will get easier every time you do it. It will still suck, but at least you can do what you want and feel comfortable in your own skin in any kind of surrounding. 

You've clearly got an invisible disability and that can be extra challenging. I've got a pretty visible one, so I'm forced to deal with the fact that people will treat me differently. This made me find strategies of how to deal with situations that I don't appreciate. I know how to deal with people that are patronising or that are overly helpful, because I've done it tonnes of times. I doesn't bother me any more. I've dealt with situations where people want to accomodate and you have to walk this thin line where you don't want *them* to have less fun because of you, but at the same time you want to have fun yourself. 

Bottom line is that you will run into these problems for the rest of your life. The situations you describe seem like a pretty friendly environment where you can experiment with different ways of dealing with people. I'm sure that people will understand. ",,,1,0,0,
f5c9b1c9-736e-4c7e-9da7-186f01a5e387,1493318218,"He has healthcare through Medical, I believe, so he should be taken care of on that front. I don't know if he gets SSI, but I will check with him.",,,1,0,0,
77e4b8f8-8e17-4a7b-94b4-dfd990e6ed3c,1491185567,"Sadly this isn't always true. My congenital heart defects are life long. I've never been healthy. I have working lung. 
I can easily go a week or two without leaving the house. 
My body stops me more than I wish it did. 
I would rather have one less leg or arm then what I was born with. I'm always tired. I get short of breath all the time. My immune system has been compromised since I was born. It's a result of open heart surgery. 
I'm trapped in a body that is only getting weaker. 
I do do things differently because of my health issues.  But sometimes I can't even do that. That my body won't literally let me. ",,,1,0,0,
1346c3ed-8326-44f0-86f7-e43af81f013a,1491715710,Something that has happened to me a few times is medical professionals assuming my husband is my father.  The ridiculousness of it blows my mind.  We are close in age and even a different race from one another.  But it has happened on more than 1 occasion.  I just don't understand it other than the assumption would be that I wouldn't possibly be married.,,,6,0,0,
0c24733a-e76f-4687-b9ac-54a4be3c9aaa,1492001759,"What sort of cell phone? is it a smartphone?

I don't know about Apple (I'm sure it is similar) but on Android at least there are about a hojillion apps do this or similar things",,,1,0,0,
d7e61ae2-ab65-47a6-9837-317575faf28b,1492091931,"How unfortunate that those able bodied/able minded people were distraught from pretending to be disabled for a day.

Meanwhile, for us who are actually disabled every day...",,,8,0,0,
11701371-6c4f-401e-9763-7a0168485ed8,1492458243,"This is a problem I have had a lot with support workers and friends, particularly in bars. I've had a whooooole lot of people pat me on the head for heading out and getting drunk. For context I am a paraplegic with motor neurone disease and require full time care.

With friends, I sat them down and asked that any questions directed at them but meant for me...were redirected at me. I didn't say *how* this should be done so they all have their own ways, some tell the person to ask me, some repeat the question to me in a very obvious manner, some make a joke or sarcastic comment about my big mouth etc. If he can think about how he'd like questions redirected that'd be a good start. 

To meet people it's really a case of putting yourself out there, a lot. It really is hard, 21 is a difficult age anyway and disability does affect how people react to you. Encourage him to try some groups he's interested in, college is fantastic for that. Some will do beginners groups for newbies who meet half an hour beforehand with an established member of the group, for those who aren't sure about hopping right in - they might be good for your brother so get him to ask. 

When you attend a group or club, make yourself busy. Be on the phone, fuck about on reddit, just give out some body language that you're not interested. Your brother will then be the one who is making the conversation and the other person has to hold it with him. If you get to the stage of conversation in a group and he's not included, make a concerted effort to bring him into the conversation. 'Remember that time when...' and let him tell the story. Redirect everyone's attention to him. If possible subtly move a group towards a table, it's much easier to hold a conversation at eye level especially in noisy environments. 

Definitely get him to push himself wherever possible, as well as good exercise it absolutely gives off the impression he's more independent. Personally I like to do as much myself as possible, I have my own adapted glass that I take to bars for them to fill, take a crazy straw, have my smartphone and adapted stylus to take numbers, have a bag I can reach easily...anything that means I don't have to ask someone else for help is a big plus for me. 

To make it clear, anyone who flat out ignores someone making conversation is an ass and not worth his time. Just blank 'em. 

For support workers I do it a little differently. Now this may not be appropriate for you as his sister, and everyone has a different relationship with their support worker/carer/nurse/personal aide etc. but I prefer to keep my support worker and my friends separate. I find it helpful to see them as a tool, someone who helps me with daily living tasks much as my wheelchair does. I keep shorter shift rotations (unless requested) and give lots of personal space. At home they have a desk and good internet connection in their bedroom or are welcome to use the living room, and I shout or send a text when I need them.

When we are out they are welcome to sit in the group but are part of the group and not sitting beside me watching over me. They are also welcome to wander off once I'm sat down and settled as long as they're in close proximity if needed. One of my support workers is a student and often brings her work out, we'll sit and get drunk and she uses the time to study close by. 

Initially I found this really, really odd as I'd always been friends with support workers, but in the long run it's done a lot for my mental health to not be good friends with someone who I am employing, especially if they change jobs. I do have one good friend who helps out with toileting when we're out and my partner does as well, they're treated as friends not support workers. All that said though I know many people who have a much more personal relationship with their support worker and prefer that. It's an individual choice.

Once he has a core group of friends everything gets a lot easier, because they introduce him to more people and the new people take cues from existing friends. So many people just don't know how to act around disabilities, they are afraid to offend or frightened of the disability itself. If they have someone else to take a cue from it helps a lot. ",,,3,0,0,
c20db9a0-7426-492e-b7ae-8aca3a08c28a,1491343181,I played wheelchair basketball for 12 years until i had to go on Warfarin. Currently looking for a new sport to fill the void,,,2,0,0,
37f84417-f829-4671-99d3-7ee8393787ad,1492435158,"It's completely your choice how you prefer to be referred to.

To answer your question about why ""person with autism"" might be considered offensive whereas ""person with disability"" is not, I think it's to do with how many autistic people see autism as a part of who they are (i.e. that they are not disabled, they are simply neurodivergent). I think people don't like Autism Speaks because it focuses on a cure and that means that it views individuals as having a disability that needs to be fixed. When you say ""person with autism"" it's like it's making a point that they have a disability whereas saying ""autistic person"" is just a descriptor of their neurodivergence.

That would be my guess as to why some people consider it offensive but there are probably people on here who can explain it better!",,,7,0,0,
e093957d-d131-4810-9199-3e852d9d0ed7,1492095385,"I've learned that some people are really dense when it comes to disabilities, and you really need to spell out your limitations for them and suggest alternatives. It can be a lot of work and not always worth the effort, but if you like this group it might be worth emailing the leaders to see if you can brainstorm with them to come up with some activities or modifications to their plans that might be more inclusive. Who knows, there could be other people who are currently sidelined who would also love to participate if it was made feasible.
If the leaders won't listen to you, see if you can get a friend to help advocate for more inclusive opportunities - I've found my friends are willing to be a lot more blunt than I am and people who previously didn't want to make accomodations suddenly feel like an asshole real fast when someone *else* points out that their friend has been left out because of their choices.",,,1,0,0,
b241e5af-a6f6-4c7a-afd8-212c466457fa,1493473332,Just call customer assistance and sort out the registration no?,,,1,0,0,
46085692-bab0-4930-aad8-55e623729ab2,1492218921,"The schedule that SSDI goes by is that you can get a review by any of the following: &lt;1 yr, 1 yr, 3 yrs, 7 yrs, 7+ yrs.",,,2,0,0,
948f5be7-0b73-435b-950f-7397edd9b15b,1492340719," Good on you for sticking to your guns! 

 The rare times I shop at Wal-Mart with my roommate, I'll use a cart.  I get the glare that quickly turns into a shamed look away.  It's how I found out people look at you from the top down sometimes.

  I workout a lot and have a well developed upper body.  Glare folks see this first and I guess, assume I like the cart because of its amazing slowness.  Then they see I don't have a left leg and put on this weird shame face and start doing the non stare that everyone else does. ",,,10,0,0,
37f450b8-174d-41cd-9527-0af63eaefd9b,1491720675,Some people have thought I was my (over 10 years older) cousin's mother before. It's really weird how people act about anyone in a wheelchair and just assume that other family members don't help out/interact once in a while.,,,3,0,0,
9d459e82-2526-43b8-b2d9-c01fb8265a21,1492186520,"Awesome! Yeah specifically, how would you prefer questions to be phrased? I'll definitely check out those videos, but yeah, in a clinical setting, how do you prefer to be asked questions? Typically when people ask me how to go about this kind of conversation, and they ask ""how do I ask someone about their diagnosis"" I usually say ""well first, you don't...."" but given the nature of the clinical setting, what do you think is proper? 

To give further context, I'm speaking about patient experience of illness in terms of setting health goals. Basically, my idea is that doctors have their own understanding of a diagnosis and what their medical education tells them they should do about it, but a patient may have other ideas. But how can a doctor really understand his or her patient's experience and goals without asking personal questions? I haven't seen many videos dealing with this topic. ",,,2,0,0,
f98011f2-b5f0-4de6-bb28-b0e64a652ad9,1493317103,"Thanks for the reply. I edited my post but I am in the US so ADA does apply. Like you say, I'd like to go about this nicely before I try a ""the law says"" approach. ",,,1,0,0,
161b8f55-f877-4faf-86b4-8f373b5ca484,1493425113,"Been with a real jerk, I am a t-10 para.  Keep in mind, you will meet ass holes regardless. Keep your spirits up, its a crap shoot for most everyone. Keep trying like the rest. ",,,1,0,0,
f589729b-a56d-4072-aaef-829b216fc600,1492020093,"You are right, it is so seldom talked about in the media and that is the problem. Technology and research always seems to be focused around walking, and can you blame those developing it? All they hear is about mobility so that's what they think is the primary focus. What would be so much more helpful is if they would work on some type of technology that would allow us to activate or deactivate those sphincters. Anyway, I digress.

For me, the sensitivity and satisfaction of intimacy is definitely different, but still very enjoyable. For a number of people things work quite well the standard way and others need small to significant amounts of technology, often vibration related. For others it is impossible to climax. I'm speaking from a male perspective, both personal and from other quadriplegic men I have spoken with. Where I find my greatest struggle, and this could be anyone, is my desire does not match that of my wife's. I want more and my greatest psychological obstacle is that I'm afraid I'm not attractive enough, despite my efforts, selflessness, and willingness to ignore my current state of physical pain to do all I can for her.

Now, we're delving into a region I'm not interested in talking about. My physical abilities and limitations are just another topic. My relational concerns are off the table. :-) I'm mostly just joking, but would love to find a way to give and receive more intimacy than we currently do.

I hope this helps your work!",,,2,0,0,
a337ea4c-ed81-4ac5-b203-c56d2c0f56ed,1491936466,"We do have a handi transit system where I live but they are the worst. you have to book your ride 24 hours in advance and after that you cannot make any changes, even if the driver was given the wrong drop off location. they are never on time, early or late by as much as an hour and if you aren't waiting outside they just leave. did I mention the temperature here range from plus 40 to minus 50.   
one of my friends had an incident where the diver was being very aggressive in traffic and it was scaring her, she had to tell him at one point that he was going the wrong way and he yelled at her to shut up.   
this system is also used to transport ppl with developmental disabilities, who sometimes cannot physically speak for themselves. it horrifies me that drivers like that are put in a position to care for them. I was assisting someone like that and the driver had the wrong dropoff, he refused to change it even when I told him no one would be there to let us in. he left us in front of her house in the middle of winter with no way to get inside. ",,,3,0,0,
81ae43f6-b59e-4ef5-9fcc-345c79e7e7e3,1492634720,I went on a vacation with two other power chair users to New Orleans. We each brought our own personal assistant. All six of us were in college and roughly the same age. We took the Amtrak there and back. The whole vacation was about four days and took most of our spring break. It was probably the best vacation I've ever been on.,,,8,0,0,
dd5e440d-368b-49e2-97f6-5ca4fe352f25,1492462413,"I like ""the witch casting a spell"" theory  for my disability. It makes as much sense as anything else �� ",,,3,0,0,
f98011f2-b5f0-4de6-bb28-b0e64a652ad9,1493317152,"Oh man... that'd be awesome. Unfortunately, the way the building is designed, I don't think they could do that since there's a whole lot of concrete surrounding the doorways on the ground floor.",,,3,0,0,
4018ffa4-c99f-4bc1-80d3-9322d1dc0e7a,1491787111,"Kinda not great on the subways. The elevators are out more often than not and most stations aren't accessible at all. Your best bet would be calling an accessible cab, which thankfully, there are tons. ",,,3,0,0,
16e2f625-0321-454e-9aa7-bebd928a47f1,1493347925,"Apply as soon as you can, you are always able to add more information down the road.

I just want to say I can totally understand what you're going through, as someone who has a handful of mental &amp; physical disabilities and am still pretty much homeless (was recently in a shelter, staying with cousin 'til the end of the school year and then I'm out of luck again, unless SSi magically appears before then.)


Two suggestions I have for you are to see if there is a Homeless Coalition where you live, they will be invaluable. IF you decide to go to a shelter, try ones that are publicly funded in some way first (private shelters are hit or miss, mine was a MAJOR miss.)


Also, if you have a community mental health center, check it out. Ours specifically has programs for people who are homeless or at risk of being homeless and they can refer you out to social services and sometimes even get you housed.",,,1,0,0,
