commentator_id,created_utc,anonymized_body,ups,downs,score,controversiality,gilded,distinguished
bbf9ee16-b3a5-4c78-8949-723a5cdd2680,1493445644,Thanks! We managed to find most of the supplies we needed through a charity that lends out supplies. We'll have to play it by ear to see if she needs anything else.,,,1,0,0,
9a8bc462-37ef-4901-bf80-0211f51f4604,1492311767,"&gt;She was also wearing flip-flops, if her feet hurt her that bad you would think she would at least be wearing some type of shoe that supports her feet better than those things. 


She was out of line to demand that cart from you. Assuming that you were ""not disabled enough"" is a perennial problem in our society. People need to be taught about the various kinds of disabilities at an early age, so this kind of self-serving prejudice will not be as common, maybe?  Good supportive shoes are too hot for some people and good supportive sandals are expensive. I have ""hot-foot syndrome"" [my father has it too] and am still having trouble finding supportive shoes that don't make my feet feel like they are on fire. She may not have this syndrome though, and yes, she should wear better shoes that flip-flops. I see this some of this problem as the store's fault because disabled people are never their priority: profits are. If they buy another cart it'd cost them. I wonder if a complaint to the management would light a fire under them to get them to purchase another cart? ",,,13,0,0,
d7e61ae2-ab65-47a6-9837-317575faf28b,1493225911,If they already let you have the time off then I wouldn't worry about it.  I doubt they think you are flaky if you schedule time off weeks in advance.,,,3,0,0,
c2e6c79c-ea9a-441c-8379-d52a85acd9e3,1492108446,"Wow, this is very complicated now that I'm thinking about it. 

It would vary so widely between the different disabilities.  I think the reason people say ""just ask!"" is because everyone feels differently about it.  Personally, I would not want someone to call me disabled, but I know there are others out there that would not mind.  I think the very first question for most people would be some version of ""Are you comfortable sharing information with me about your disability?""  

After you've determined they are comfortable talking about it, I think any genuine concern or curiosity would be fine.  Using basic tact.. (Not ""What happened to you?"", rather ""I'd really like to know more about x disability, would you be comfortable talking to me about when and how you were diagnosed?"").   

",,,3,0,0,
da78dbd3-e2ec-494c-a9d7-b945b391594a,1491685802,Do you have a question ?,,,4,0,0,
28c057bc-4512-426e-a2d9-f2ec12a7045c,1492624644,"I don't think that is legal, unless you are outside the US.",,,3,0,0,
56514544-9f47-48fa-8a32-6e38e1f4c8f7,1491786081,"&gt;  A 3% increase in the SS tax 

I think you mean a 3 *point* increase. The current rate is 12.4%. A 3% increase makes that about 12.8%. A 3 *point* increase makes it 15.4%.

",,,3,0,0,
a9090660-b2d1-4f4a-b00d-32880c994553,1492015521,"My wife is a quad so adjacent info here:

Many wheelchair users get very tired of hearing ""You're such an inspiration"" or similar.  People mean it as a compliment, but wheelchair users often hear it MANY times a day and it ends up ringing kind of false, especially if the person is doing nothing more than just being outside the house rolling down the street.

In a similar vein, I am also told that I am such a great person because I chose to date/marry someone in a wheelchair.  I find it strange and it gets old.

Many people will feel awkward around a person in a wheelchair and will get super nervous or embarrassed and end up saying something like ""Just walk that way.....uh, um, uh...I mean you need to go over that way"" and turn beet red.  I would say 95% of the chair users I have met have no issue with someone using the word walk, they know what you mean.  A newly injured person might get angry at something like this, but even then it seems pretty rare.

A lot of my wife's good friends were initially supportive after her car accident, but drifted away over the next couple years.  Several reasons, but to me it seemed like:

*1) it is often more work to include someone in a wheelchair in your plans - and they didn't want to put in the work, wanted to be able to be more spontaneous.  

*2) didn't know how act/feel around my wife...they couldn't get past the chair/paralysis and see her as a normal person anymore.

*3) didn't like the attention that it brought them when they were out together - people do stare and sometime give disapproving looks, etc..


Good luck, I look forward to seeing the completed GN.",,,2,0,0,
f4d18fa8-4341-4c9e-9b7b-df64934a1b8c,1491801338,"Yeeeeeeesssssss.

And there is only 1 wheelchair accessible bus (ie: with a ramp) every hour, But there is a standard bus every 15 minutes! 

You can lift a pram over the bus threshold without a ramp, you *can't* lift a power wheelchair.

Like, I get you were here first, sometimes the bus will pull over, the doors will open and the driver will just frown ""sorry, the wheelchair spot is full"". That's totally fine!

But what's not ok is when I;m at the bus stop for 10 minutes, then a person and their pram will arrive, push in front of me, lift their pram over the threshold, then park in the wheelchair spot, before the driver even notices I'm at the stop and need the ramp.

I've had some lovely drivers turn around at this point and tell the pram-owner that they pushed in and will have to get off and wait in line, if they can't fit on, that's their problem, they can wait 15 minutes, The wheelchair users have to wait an hour!

But some drivers will not be as confrontational, which is valid, because some pram-owners get really aggressive when drivers ask them to wait their turn

I don't use a power chair anymore thank god, I mostly use crutches but some days I have a transit chair. If I can't be bothered waiting for a wheel-chair accessible bus, sometimes I'll just crawl onto the bus and my friends will lift my chair on for me. Bus drivers usualy yell ""You need to wait for a ramped bus, there will be one in 90 minutes!"" but i've waited a number of times for the scheduled ramped bus, only to find the depot made a last minute replacement, and sent a standard bus, and I've been waiting outside in the elements for nothing, and I'll need to call a taxi anyway.

And taxi's aren't cheap. bus fare; $5.60 flat rate. Accessible cab flagfall; $12, + $2 per km travelled (Regular cabs are $6 flagfall :/ ). If I need to go to my doctors, 20km away, that's a $50-$60 taxi ride. I'm on a fixed income ($200 per week), I can't afford to travel like that. I need the bus to be reliable.

Uber is like 50c/km, able bodied people can uber instead of taxi if they miss the bus, I don't have that luxury.",,,4,0,0,
99fe72e0-61c7-4bd6-a41f-fa27ac9aa5c5,1493402217,"I'm not sure a book about how to treat children with disabilities would be the best. I would prefer a book that helped children and their parents understand that the disability may affect a person's life a lot but that they're still a human being worthy of respect, understanding, and friendship. I think often, people have a hard time looking past the disability long enough to realize that there's a whole human being there. The child with the disability and their parents would be best equipped to have the conversations about the disability with people in their lives but this requires that people be open to learning about it. I think a book that helps take away the fear and stigma of a person with disabilities is what's most desperately needed. ",,,3,0,0,
7128deaa-bc73-4fd8-942b-5e0c75b6f126,1491304136,I suggest you put a blurb on your CV about this issue if you think it is stopping you from becoming gainfully employed. Are you absolutely sure it is a lack of DL though? Is your design portfolio strong? Did you intern at a decent place? Does the position ask for a Masters of Science? I think there is a flood of mechanical engineers right now and employers can be pickier. ,,,5,0,0,
d0d4be64-a550-443e-ac4b-255d418ab00c,1492705370,"A powerchair are thousands of dollars. You could get a cheapo Jazzy, but wouldn't trust them on a hilly campus personally",,,6,0,0,
e8e9a173-ec1e-4835-9e3b-db832a168a37,1491398279,"Get in touch with a [Center for Independent Living](http://www.virtualcil.net/cils/) in your area and contact them to get information on legal resources for disability rights. You're going to have to push back hard, but you'll need help in order to do it in ""the right way.""",,,1,0,0,
17a7a310-6cf9-4cea-b8e6-745931b1df66,1491954545,"Being born disabled and becoming disabled are very different experiences, and the latter can be extremely traumatic, depending on how it happened. I got sick and eventually became disabled through and unfortunate turn of events, so I never had the trauma, but I've definitely had to deal with mourning the loss of who I used to be and the dreams of what I wanted to be. Everyone is different, but relearning that you're still a capable person while being disabled can be difficult. There can be a lot of self hatred and depression in the beginning, but you eventually come out of that and begin to realize that you're still you, you've just got different parameters to work with. And sometimes there's shit you just can't do anymore, and you have to figure out how to accommodate that. Honestly, the most worst part of being disabled is not the disability, it's how society treats you and your disability. (I'm positive that there are disabled people who disagree, because everyone experiences being disabled differently, but I would say this is a pretty widely accepted school of thought)

Thanks again for asking. I'm sure there's always going to be someone who doesn't like how you've written her story, but if you're already actually wanting disabled peoples' perspectives, I'm sure you're gone do great!",,,7,0,0,
df06e91d-105d-47ea-90c9-8ea99e8a26e3,1493321215,"Thanks for the reply. It's a good point I should've included the location of his pain and stiffness.

He had his lower back fused and also pinned, going from his lower lumber up. He then fell and fractured somewhere in the middle, so now the pins go up about 1/2 to 2/3 of his back. 

It's more that sitting poorly, he gets lower back pain and numb legs.",,,1,0,0,
d45e850c-e657-40b2-a4ee-ab32905b76c2,1492042575,"&gt; lest they lose cash benefits and that all-important health care
I cant see myself in a full-time job any time soon and having no health insurance is not an option for me, so this hits the nail on the head.

They need to let someone that is disabled stay on medicare if they find work that is sga but offers no reasonable health insurance. Even then you'd need guidelines that define what reasonable is.",,,2,0,0,
79c8af08-d8f4-4dde-8db0-48575776e117,1491881554,"I used to feel that way ... wasted decades on it, in fact, time I now wish I had back.

Doesn't Quiddich need announcers?  Could you do that?

Also, I notice that you mentioned not disclosing your disability ... isn't it just one tiny part of who you are?  Or are there reasons why this information needs to be kept secret?

If nothing else, you posted here, which means you are open to change.  Good luck!",,,2,0,0,
9e9ea3b1-5954-49fc-af1b-ba3a88931af5,1492326838,Obviously the lady shouldn't have demanded the cart. She should've waited until a cart was returned. You don't know the lady wasn't disabled though just by the description of her being fat. Many disabilities aren't visible to anyone but the person suffering. The lady was in the wrong but could very well be disabled too.,,,17,0,0,
e0968244-376f-4565-8169-2f368ba85870,1493100420,"It can take at least a year or more to get benefits from SSI or SSDI and the way I've heard it is that almost all cases are initially denied as a rule. Just go ahead and know that the entire system of getting to this help is designed to thwart you and encourage people to give up. I know that sounds really...whats the word? paranoid? But it's something I've seen with my own eyes and it's an often repeated refrain from those who've had contact with this system. 
I'm currently on year 2 of fighting for assistance (I didn't stay after my case like I should have so some of this time is my fault) and have just obtained an attorney who is taking on my case since I've been denied (this is very very common in my state; Alabama). In the mean time you need to focus on insuring you'll have a place to stay while this whole process is underway. You mentioned Conway SC and a quick google search found some shelters around there that could potentially help you out, if that is even where you're still at. Make use of whatever resources are available to you locally and I'd also dig around online and see if there aren't charities or programs designed specifically to assist autists who are struggling in similar circumstances (i have a strong feeling such things exist).
If you want, message me and, my energy level willing, I'd be happy to do a bit of googling and digging to try to find some local resources for you.   
 http://www.shelterlistings.org/city/conway-sc.html",,,1,0,0,
510090f0-437a-46a7-af1c-f306fc3ee2c6,1493587008,"You are correct that SSDI does not work the same as SSI.

If you are receiving SSDI, there is no prorated reduction in your benefit payment based on your monthly income.

Social Security will cease your benefits if your monthly income exceeds the yearly substantial gainful activity level ($1,170 for 2017) after you have already completed a trial work period.

What's a [trial work period](https://www.ssa.gov/oact/cola/twp.html)? It is an opportunity to test your ability to work without any immediate effect on your SSDI benefits. 

While in the trial work period, there are no limits on your monthly income from work. Your trial work period ends once you have completed nine ""month[s] of services"" - any month in which your income exceeds $840 in 2017. 

So your benefits won't be jeopardized until you complete a trial work period (9 months where your earnings exceeded $810) and, even then, your income will not directly impact your SSDI benefits unless you make over the substantial gainful activity limit.

Even if all of that happens, there is an [extended period of eligibity](https://secure.ssa.gov/poms.nsf/lnx/0413010210#a) that makes it really easy to reinstate your benefits if your income drops below substantial gainful activity levels within 5 years of your benefits being ceased.
 ",,,3,0,0,
c86503a0-a387-4e86-af6b-83dac0369a34,1492390281,This is a sad comment. Please look into your fatphobia and how it relates to ableism.,,,4,0,0,
f91f8843-1a81-4fa5-b7a3-e03234fd5385,1492051897,Thank you for sharing!,,,3,0,0,
37f84417-f829-4671-99d3-7ee8393787ad,1491816061,"I second what everyone else has said here.

In addition, one thing that I've encountered a lot by medical professionals is a lack of respect towards my body and an assumption that they or their colleagues know it better than I do. I'm a wheelchair user with a progressive neuromuscular disease and I've had extensive spinal surgery. I've lived with my condition for over 26 years. Recently, I was at a neurology centre in a unit that supposedly specializes in my condition. I specified prior to the appointment that I would need a particular type of hoist (specialized for the type of surgery I've had) to transfer out of my chair and was told this was fine and no problem at all. When it came to transferring on the day, the nurse on duty refused to use the hoist I'd asked for (which was in a room across the hall) because she believed she knew better than me despite objections from both myself and my carer. What was the result? I was hoisted in a way that is inappropriate to my body and it is now 3 weeks later and I'm still in pain. She did not apologize but proceeded to tell me that she has lifted other patients like me and they've never had a problem. I can't describe how much that makes me rage. She caused me pain that I still haven't recovered from, refused to listen to my repeated instructions and continued to think her training and her experience was more important than my knowledge *of my own body*.

That's one example but similar sorts of situations happen often. I used to think I was just not clear enough or maybe I was too soft in the way I set boundaries but it has become apparent that it's just a lack of respect towards my body and myself as an individual. When you grow up with a physical disability, you become accustomed to viewing your body as some external thing. My therapist describes it as being a ""floating head"". It's like everyone has ownership and a say over your body when no able-bodied person would be treated that way. Frankly, over time, repeated events like the one I described above start to feel genuinely violating. It's upsetting not so much because of the pain, I can handle that, but because of the way it feels to have your body disrespected by the very same people who are supposed to be caring for it and healing it. I wish someone had taught me earlier as a child that I have the right to say no and the right to demand my body is treated with the respect it deserves.",,,3,0,0,
f4d18fa8-4341-4c9e-9b7b-df64934a1b8c,1492415599,"I'm super open about my condition so for me, something as simple and polite as ""Hey, I noticed that you do X a little differently, could you tell me more about that, I'm curious to learn more"" and that's all that's needed.

I've had people ask about my crutches, and my braces this way and it's always felt so polite and it's made me *want* to talk to them even if I was tired.

But I've also had people ask in a way that was rude/acusatory. phrasing questions like ""hey, yesterday I saw you on crutches but today you're out jogging, what gives?"" yes it's just a question fueled by curiosity, but the language unknowlingly taps into the disability binary, and it feels acusatory. Instead, try ""Oh hey, I saw you yesterday when you had crutches, does your condition waver? if it's not too personal, could you tell me more about how that works?"" because that just feels a little less like ""are you *really* disabled"" and more ""I'm so curious I just have to know!"" which is what I like to see.

The main thing to avoid is a language or tone that makes it seem like you think your entitled to the information. Sometimes things are too personal, or i'm in a rush, too tired, or having major sensory processing issues or brain fog and I just can't talk at that time, some people are polite and will say ""sorry to have interrupted your day, but i wish you the best, thanks for your time, bye"" but others will act all butthurt as if I am a bouncer, unfairly keeping them from information. ",,,1,0,0,
4284471f-0b33-4e27-ad5b-fa2a602af16a,1493262539,????? That's a shit psychologist wtf,,,3,0,0,
81ae43f6-b59e-4ef5-9fcc-345c79e7e7e3,1491503775,"Let me preface this by saying that I'm not defending Singer in any way. I think many of his utilitarian notions are based on completely generalized and misled notions regarding disabled quality of life. That said, this article is filled with faulty assumptions regarding Singer's own views, and I personally believe that if we're ever to win this argument, we shouldn't spend excess communal effort arguing points that aren't actually being made.

Singer never attempts to justify the rape of ""disabled people"". His arguments lie solely within the scope of this single bizarre incident. Singer simply poses the question of whether or not a person who will never be capable of understanding the psychological implications of sexual contact, forced or consensual, is risking anything by engaging in sexual activity (assuming of course that there's also no risk of pregnancy, STI transmission, or physical injury). The analogy that the article's author makes regarding molesting an infant is faulty because that infant will develop psychological disorders as it grows that it wouldn't otherwise have, thus there *is* a degree of risk. The entire principle of statutory rape is based on the widely-accepted fact that the people involved who don't understand the implications of the actions *at the time* might someday re-experience them when they manifest themselves as psychological illness. If there's no chance of this happening, and the individuals involved would experience physical gratification, is consent even a meaningful issue?

Singer suggests that it isn't. I'm not going to speculate.",,,10,0,0,
c994b5c6-8bbc-4f0c-8a88-385ea8922f08,1492245564,"&gt;  I have called the Medicare and Social Security many times. I have asked to make an appointment on the issue but they will not let me since I have been denied.

There's not much they can do - the folks at the local level aren't really involved in these determinations - but I'm very sorry to hear that they did not at least inform you of the appeal process. 

[This](https://secure.ssa.gov/poms.nsf/lnx/0603040001) is the policy regarding appeals, [this](https://www.ssa.gov/forms/ssa-1021.pdf) is the form you need to appeal. Send it to the address on the form, **not** your local office. ",,,2,0,0,
227d7e43-5553-4f3d-bcfe-4a7642de6436,1491402535,"Well, the doctor they sent her to straight up told her he didn't think she was disabled because she's white. So there's that. But the ""official"" reasoning was that her condition had improved to the point where they felt she could resume working. She has Rheumatoid Arthritis, which has her struggling to walk, use her arms, and even talk - her jaw joints had to be replaced years ago because they'd deteriorated so badly. She's been having her medication increased over the last 3 years, not decreased, and she can't walk as far as she used to, which already wasn't far. I've seen her getting worse. Doctors who aren't jackasses have seen her getting worse. It was bad enough 3 years ago that she qualified, but suddenly she's better because some asshole doctor who needs his licence revoked thinks a white girl can't be disabled.

Sorry, rant. Been getting more and more pissed about this as the day goes on. ",,,6,0,0,
28c057bc-4512-426e-a2d9-f2ec12a7045c,1492107479,"I don't think simulating my disability (autism) works well at all, because it's different for every autistic person.",,,2,0,0,
161b8f55-f877-4faf-86b4-8f373b5ca484,1493426360,"I force myself to be social when I don't want to. Shows, events, it doesn't matter. When you have a disability you want to turn inward, and I just had to force myself against that. People can be hesitant to interact with the disabled, and you can't hold it against them. Just suck it up and start introducing yourself to others. You'd be surprised the friends you make.",,,2,0,0,
7923b1a9-81b8-424d-b994-4ca522623f74,1491938528,"I say just do your thing because you're never going to please everyone.  The fact that you're trying to take steps to not offend anyone shows that you'll probably do just fine.  Tell the story you want to tell.  Sometimes art offends people.

I'm a paraplegic and really nothing offends me.  There are others on here that will grab a pitchfork at even the slightest hint of ableism.  You'll be walking around too many eggshells in your attempts to tell the story of a girl who can't walk.",,,7,0,0,
ef2acd10-fe78-4a2d-9abf-25d7992eb1a8,1493179579,"I'm working on helping artists with developmental disabilities earn a living. I would love to hear your feedback. Some question's I'm curious about include:

-Do you know any artists/organizations that would be interested in working with me?

-Would you purchase any of these products/services?

-Anything else?


Don't forget to check out our social media!


https://www.facebook.com/staysmilingart


https://twitter.com/staysmilingart


https://www.instagram.com/staysmilingart/",,,1,0,0,
d274c489-2bb7-4ea9-94eb-a288d814674f,1492231994,"Thank you.
What would be cause for concern?
What would be grounds for them dropping my SSI?",,,1,0,0,
b7e46e48-fb21-4ac1-a19f-89070f99a0b2,1492419052,"I've had several doctor appointments where I've come in with some concern unrelated to wheelchairs and the provider has interrupted me to get me to talk about why I use a wheelchair, to tell me what a shame it is that I use one at a young age, and ask about how they can help me ""get out"" of it (I can walk). It's ridiculous because being a wheelchair user is the difference between living independently and being a nonfunctional, exhausted, ball of pain for me, but everyone wants to let me know what a tragedy it is.

People touch me all the time without asking. The worst was a bus driver patting me on the head and shoulders and telling me what a good boy I am, which was especially gross because 1) I'm black and an adult and do not want to be called ""boy"" by a white person, and 2) as a DV survivor I don't want to be touched without warning by strangers. People will also grab stuff away from me without asking in an effort to ""help""--door handles I'm already opening, groceries out of my basket to put them on the belt. If I say ""no"" they usually don't listen. 

Dorky jokes about horsepower and licenses and speed limits. It wouldn't be as big of a deal if it wasn't /always/ older white men. Since I was a teenager, middle-aged white men have often scowled at me, treated me like a threat, stepped between me and their families, etc. When I use a wheelchair I become suddenly approachable. It's a weird feeling because I don't feel like being perceived as threatening should be part of my identity as a black person, but it's not a demographic I'm used to interacting with and it just feels like I'm getting made fun of. 

Sorry this is so much race stuff, but it's an area that I have noticed has changed a LOT since becoming visibly disabled. It's like I'm an entirely different race now or something. ",,,2,0,0,
