commentator_id,created_utc,anonymized_body,ups,downs,score,controversiality,gilded,distinguished
4f6e2d84-feeb-4997-b521-0e1acfd7a235,1505183313,It's a shame that in America the disabled has no chance of a decent life all because employers don't want to hire and accommodate and then there are people who encourage that behavior :(  ,,,2,0,0,
0e44bd1b-8d31-4dad-9937-a8d69bb5a0ef,1506655849,"Having an LLC would have made me 100% ineligible for SSDI/SSI, plain and simple. 

I'm not worried about PayPal closing my account, it's all aboveboard and it's a risk I'm willing to work with.

I use my PayPal balance purely for business expenses. I basically re-invest everything back into the business each month. The paypal balance/earnings will be reported to the irs at the end of the year. I just have to show SSA my schedule C to show my income after expenses. 

I think I'm just going to have to kill the business and burn the money somehow and relax for a year or two for my health to get fixed or until I go blind. Kind of giving up on this stuff. 

It's a profitable online business but if this messes up my Medicaid and coverage of my $4k/month medications I'll go blind anyway. I spoke with my 6th lawyer and none of them have a clue on what to do.",,,1,0,0,
f4d18fa8-4341-4c9e-9b7b-df64934a1b8c,1505220794,"Completed.

Just a few notes on the survey itself, you have no option for people who have no difficulty opening wine bottles to opt out of further questions. I answered ""I have no difficulty"" but the next question asked what makes it difficult and so on. Likewise if someone does not drink wine there is a no way for them to opt out of further questions.

And a note on the design of the wine opener itself. Unfortunately despite being a bottle a week kind of gal, I live in Australia where our wine is just a simple screw top and hundreds of devices already exist to open those likes [this one](https://i.imgur.com/b4PbeHu.jpg) or [like this](https://i.imgur.com/b4PbeHu.jpg). The second type are given out for free by a lot of OT departments I've been to.

So I don't really know what problems someone might encounter with wine bottles.

I've never had the dough to splurge on a bottle of imported, corked wine.

I've always just used a tea towel and a bench top to pop the cork on a bottle of bubbly. Boxed wine comes with a handy spout, I like the button kind, though I sometimes have to monkey-claw it because of PIP Instability, the ones you rotate are difficult because my wrists don't twist easily. So I end up having to lift the box to avoid spills.

",,,1,0,0,
facd3939-1686-42f3-b0bc-0b548c960a77,1506699083,"I am a multi-instrumentalist and singer. I have Charcot Marie Tooth disease. I have hand tremors, muscle weakness and I wear leg braces to walk. http://cathypowermusic.wordpress.com",,,1,0,0,
7a7d927d-b273-4d02-a9f1-26d97a67d62b,1506002455,"Yes, you have to report any change in living conditions including moving in with a larger family. If you are on SSI and you live with a larger family SSA may see you as needing to contribute less depending on the arrangement, to make the household run, and may adjust your benefits or take you off them altogether. Depends on the situation and their incomes, whether they consider the person you are living with now a holdout marriage - things like go into their decision. . ",,,1,0,0,
ca2d5ddf-11bc-4597-abb5-d3f7ae707019,1504224867,You don't need to wait for the doctor to refer your son.   Early intervention will take self-referrals and do a free evaluation.      ,,,1,0,0,
c4c6a003-cc26-4573-8be1-5282e9e1ee65,1505884983,"Agreed.  While I definitely tend to see my autism as a difference and appreciate the concept of neurodiversity,  I find it frustrating when people take it too far and try to ignore the fact that there *is* disability wrapped up in that difference.

  Lord knows I don't feel particularly abled when I am sitting in my room friendless wondering why I can't develop friendships, or when I can't even complete the volunteer service for food stamps because the clattering noises and contact with Bad Textures^tm are a constant assault on my senses that leaves me drained and feeling like I'm about to vomit.",,,4,0,0,
5a1e1030-9101-40f1-a7f2-1f0821fb4ac2,1506345541,"he not sure your gender of disability, but there is a grate facebook page for people with SCI called wheelmommies 
Hope that can help :)",,,1,0,0,
8d41c1b2-5e51-4759-98a0-ed1e207775d1,1505826202,"Do you have a lawyer? If so, let them handle it unless you're specifically asked questions by the judge. If they ask about your day to day life (they probably will), explain your worst day. It's usually a short hearing only in front of a judge and possibly a vocational expert. ",,,2,0,0,
fa1b58ca-645c-4a09-a0d4-58e77a792d29,1506708913,"Maybe it's just me but ""cute"" seems kind of infantilizing. Puppies are cute, babies are cute. I like ""hot"" or ""sexy"" better.",,,2,0,0,
9fbe2cbc-1375-4c1b-9b5f-ad8ede59617b,1505143076,"That would be a question I would as your care team, as what they feel is safe and appropriate vs getting info off the internet. What may work and be safe for someone else may not work for you. ",,,1,0,0,
1d540ad2-41ac-418b-81ce-d003c70d1792,1506122860,The injuries you're describing would not be an allowance at your age. You are better off focusing your efforts on building the business and finding supplemental income. ,,,1,0,0,
3a44f40a-7dc9-472b-9e90-473dd506b5c1,1505336185,"If you're receiving SSI or SSDI, you have Ticket To Work and can assign your ""ticket"" (you don't actually get a physical ticket...just a number) to any participating Employment Network and they can help you find a job. When they do find you a job...and you start earning money, they collect an incentive off your ticket. 
Free to you, and they only get paid if you get a job and keep a job. 
Win-Win. ",,,1,0,0,
84d12d64-378d-4a7d-b3e2-3ac51f8f3b23,1506501695,Is this different based on state? They decided my case in about five months so I didn't get any back pay. I got a letter saying I didn't qualify for Medicare. So I won't get it for two years? I suppose I'll have to go through the exchange since I can't go two more years without the surgery.,,,1,0,0,
f4d18fa8-4341-4c9e-9b7b-df64934a1b8c,1505904496,"What country will you be applying for? Every country will have a different process, but generally the best place to start is with your doctor, asking for a personal copy of your existing medical records and asking if they can fill out some assessment forms listing how your conditions effect your functioning and also writing a letter explaining how long they've been treating you, what treatments you've tried, which ones you're continuing with, how long your condition will effect you (unknown/lifelong, etc) and letting them know you plan to see if you can get vocational or financial support from welfare because you're struggling to work for a livable wage.

From there, it will depend on your country, generally contacting the welfare organisations to make a claim, then they will have a process that will usually involve handing over a lot of the ""medical evidence"" you collected while talking with your doctor.",,,1,0,0,
c159ab61-5593-438e-828c-057a259c865d,1506446789,More bullshit this has been problem long before  2004 when I had to start using one.,,,4,0,0,
48787f95-dd2a-4088-9d2c-4d7485c2c814,1506447718,"But they'd have to, like, do their jobs!",,,2,0,0,
be8e6b44-ea50-4734-bf04-1a81cc30f559,1505765206,"Your [submission](https://www.reddit.com/r/disability/comments/70xlx4/fibromyalgia_fashion_blogger_help_her_get_a/) in /r/disability was automatically removed because you linked to a fundraising website.
By consensus the /r/disability community has decided to disallow individual fundraising appeals. See /r/Assistance, /r/Care or 
[other subreddits](http://www.reddit.com/r/Assistance/comments/1hexgp/other_subreddits_that_can_help_you/)  that can help. 

*I am a bot, and this action was performed automatically. Please [contact the moderators of this subreddit](/message/compose/?to=/r/disability) if you have any questions or concerns.*",,,1,0,0,moderator
ad2c738b-ebad-4496-be48-00d9eeffcf1b,1504906703,"It sounds complicated but I think the judge made a good call.  Her parents clearly love her and want what is best for her and to protect her, but she wants freedom to make decisions for herself and not to be treated like a child.  She clearly does not like living in group homes and they have not taken this feeling as seriously as she needs them to.  Running away is also not a safe situation, so what the parents are doing is backfiring currently.  Most teens go through this sort of separation from parents between ages of 16-25, they make choices their parents think are foolish and unwise in an experimentation phase where they establish their adult identity. I hope she keeps herself safe and stays in touch and uses the supports around her during this time. I think the temporary freedom will lead to her reconciling with her parents as guardians eventually.  ",,,7,0,0,
28c057bc-4512-426e-a2d9-f2ec12a7045c,1506105184,"Clarification for anyone reading this: ""learning disabilities"" in the UK refers to what the US now calls ""intellectual disabilities"" (including Down syndrome). In the US, ""learning disabilities"" refers to academic disabilites such as dyslexia. I have a writing disability and would be considered to have a learning disability in the US, but because I have an average or higher IQ, I would not be considered to be someone who fits the UK's definition of having a ""learning disability"".",,,2,0,0,
30a39155-0df9-417a-b0a4-2b3a1157ddc4,1506432643,"Yep, he's draining the swamp. We're down stream and wheelchairs don't float. But, thankfully, the money the airlines will save by these removed regulations will allow their CEOs to buy another Tesla. ",,,5,0,0,
431fb2c7-cdf0-49a7-9616-62cdfab3f6a7,1505497615,"Your best bet would be someone in your area who can meet with you face-to-face.  Try looking for charities in your area that serve people with intellectual or developmental disabilities. It sounds like you want a business partnership, not a charity one, but they may be able to point you in the right direction.",,,6,0,0,
61864ea6-aaea-45f3-a428-985911146ed7,1504954238,"There is a Protection and Advocacy Service in your state. They all have different names, but if you type Protection and Advocacy Service and your state's name in google, you should find the number for yours. You can ask them for the name of a local attorney to contact or the PAS may be able to answer your question. In general, medical evidence is required before SSA can say you don't have a disability and once that evidence is available, it applies only in that month and going forward. Absent some medical evidence that you didn't have a disability in the past, they can;t declare that you weren't disabled. ",,,1,0,0,
a27fcf4b-d60d-46d1-98dd-2be088fb56ba,1504698119,"They can give you gas, it will calm you down and allow you to be able to get the xrays and procedures done.  Wouldn't hurt to talk to your doctor for an oral antianxiety med to take before hand.  Then ask for a bite block.  It allows you to keep your mouth open without making you open your mouth.  That's how I get my dental work done.  Right now I have four temporary crowns waiting for the real ones.  Talk to the dentist and tell them what you are feeling, trust me they have delt with patients with anxiety.  If you got an iPhone bring earplugs and listen to music loud you can tell the dentist if you plan on not hearing her/his.  If they need to ask a question to pull out one of the buds then ask my dentist and I have got the his down to a science.",,,2,0,0,
d3e1aefa-6f2e-42e4-be8a-0f2694fe53ae,1506705356,"It's so sad that in 2017 so many people don't understand disabilities. We don't choose to have physical, cognitive, and psychological difficulties or differences. It is wrong to deny people access to equal opportunities.",,,2,0,0,
5ed0fe9d-0c1f-4df4-b0d9-91890592ea16,1506016983,"I've never self harmed. The only time I've been suicidal was when I was in-patient years ago. 

He asked me if I was suicidal and I said no. Imo my problems aren't as bad as the people there (When I was in the mental hospital people were suicidal, self harming, screaming, like serious serious stuff).

He even thinks all I have is depression and anxiety(extreme anxiety though).. so I'm not understanding the need for it. ",,,1,0,0,
20487a8d-fe1c-486f-8970-8292ef27da01,1505849029,"We all have our battles. I am chronically ill with an incurable, rare genetic illness called Ehlers Danlos Syndrome. The blueprints in my DNA make malformed collagen proteins, so I suffer from hyper-flexibility, constant body-wide pain, joint instability, and frequent dislocations. Some of my organs seem to also be affected as eating a regular diet causes my GI system to randomly cramp and bleed. I practically live in MRI machines and hospital waiting rooms. I have more doctors in my life than friends. My extensive experience using America's healthcare system confirms that healthcare reform is imperative. 


One of our primary issues is that millions of Americans, insured and uninsured alike, cannot afford to go to the doctor when they are sick. Millions of citizens are forced to ration their medicines because our country's drugs are systematically overpriced. These problems are so difficult to contend with, sometimes I literally just want to die and be done with it. In the wealthiest society that has ever existed, sick people are being methodically priced out of being alive. That is morally  outrageous. America overflows with good people, so there has been bipartisan outcry:  WE CANNOT AFFORD HEALTHCARE. Yet the bill being rammed through the Senate does almost nothing to help affordability.


In fact, multiple proposals in the Graham-Cassidy bill are insolently the opposite of what is supported by American voters. Polls suggest that the American people are IN FAVOR of maintaining the Medicare expansions and subsidies granted by the ACA. We are IN FAVOR of protecting citizens with pre-existing conditions from exploitation. We are IN FAVOR of protecting elderly and disabled Americans from exorbitant premiums and endlessly growing deductibles. We are IN FAVOR of requiring all insurance plans to cover hospital visits and mental health care. We are IN FAVOR of banning caps to coverage. Voters are united in asking the powers that be to advocate for the best interests of the American people, yet the Graham-Cassidy bill obstinately sides with the insurance industry.


I've contacted and begged our Senators to VOTE NO to Repealing and Replacing the ACA, to VOTE NO to the Graham-Cassidy-Heller-Johnson legislation. 


Repairing the American healthcare system is an issue close to my heart. I know you're all busy, but I desperately need for you to contact your Senators and ask them to reject the half-baked Graham-Cassidy bill, especially if you live in a red state. https://www.senate.gov/senators/contact/


If you are comfortable with it, please  also let your representative know that it's time to begin the arduous process of transitioning our great nation to a single-payer healthcare system. The American people resoundingly agree that universal, single-payer healthcare is America's best way forward.


Thank you to everyone who is fighting for our right to be as healthy as we each can be. Let's push aside all the red and blue bickering and create legislation that is good for everybody. It won't happen quickly, but we can make it happen. This is our chance. I beg you, please help me.



",,,2,0,0,
f14ef1ea-286d-4c80-986f-3cd85766d6be,1506562205,"You can get a wheelchair attachment called a free wheel that is a detachable wheel for the front of wheelchairs and it basically turns your wheelchair into a jogging stroller. What the free wheel does is lift the front two ""caster wheels"" that often get caught on things, making it hard to push on uneven surfaces. ",,,1,0,0,
ca2d5ddf-11bc-4597-abb5-d3f7ae707019,1504224867,You don't need to wait for the doctor to refer your son.   Early intervention will take self-referrals and do a free evaluation.      ,,,1,0,0,
c381a2a1-8eb4-4f49-bd7b-ae1d8f7011de,1506485682,That stroller reminds me of a racing wheelchair I once saw.,,,3,0,0,
852f30d5-9bed-47ee-8cfb-19643fad633f,1504918469,"Hey u/marlon99rocks99 ,

How realistic does playing the Vive feel?",,,2,0,0,
34fd5bda-ce6f-4ab4-81aa-f12577a5c002,1504593477,"It's difficult to assist without specific questions, but some that I can think of...

Invest in a *good* wheelchair. One that is lightweight because you'll be taking that in and out of your car quite a bit. (unless you become a part time user, but even so, convenience is great)

Get a wheelchair meant for self pushing, so one without the arm rests, or you can choose one with low or foldable arm rests because I've found that they really limit your movement and causes a bit of bruising near my upper arm. 

I can't remember the name, but there are like.. hand guards for the wheels so that you don't jam your fingers into the side. People with TBI or experience numbness on one side or hands, or lack of feeling, etc., find this very useful. 

Umm.... a sturdy foot rest. One that won't lean to one end or the other when you rest your prosthetics on them. It depends on if you'll be using prosthetics while using the wheelchair, but that's an option to have. 

A wheelchair with handles on the back, I've found to be useful so you can put a backpack on it. 

A comfy, soft or sturdy cushion for you to sit on. Trust me... it's great. 

I can't think of anything else right now... I hope this helps and I'm sorry to hear about your accident. It's going to be a long, hard transition. 

I'd also suggest looking into ways to protect your back, neck, and arms as pushing oneself can be strenuous when you're not used to it. Do exercise in and out of your chair. Look up ways to stay as comfy as you can. ",,,2,0,0,
cbe12c83-1813-4db4-8c4e-b5cd70bc164a,1506016593,"I don't know about psychiatrist, but my therapist recently told me on our first visit the only time she's legally obligated to violate the patient doctor relationship or whatever is if I were to tell her in a serious manner that I had a plan to seriously hurt myself or other people.

May be different in various states?",,,2,0,0,
1e59d546-e273-450f-8db5-a0da1a9700e5,1505498889,I wonder if campus police would be sympathetic enough to the cause to help enforce the policy. Worth a try maybe,,,5,0,0,
28c057bc-4512-426e-a2d9-f2ec12a7045c,1506104900,"I can't blame her. I wouldn't want to be in touch with my parents if they thought I was incompetent and treated me like a child despite the fact that they had my whole childhood to do that. Jenny is an adult, and just because she has Down syndrome doesn't mean she should be forced to live in a group home or have her parents still be her guardians. Some people with Down syndrome may benefit from that arrangement. Jenny is not one of them, and I trust her judgment. Her parents are being ableist and assuming she is incompetent solely because she has Down syndrome.",,,1,0,0,
d0d4be64-a550-443e-ac4b-255d418ab00c,1505501942,"I am sorry to hear this. Here are some options:

- ask the **cool** kids to smoke elsewhere  
- ask the dean of the department to make a comment to leadership  
- the building should have a building manager, ask for a meeting for solutions  
- see if there is a student group that will help make noise  
- see if your school paper is willing to write an article about it  
- if you are at a public university, such policies must get approved by your state or city, so calling the appropriate rep and report a policy violation  
- call somebody, like the dean of students, per incident  
- instead of calling, send a daily e-mail summarizing every violation",,,5,0,0,
f9f54438-f5c9-44db-bfb1-2937dd5d89a7,1504319906,"I applied in April, but my onset date was the day in May where I was determined to be legally blind.  That is when they stated I met the requirements for approval. 

",,,2,0,0,
453571d9-6939-4321-bd88-bd2db21e29aa,1505175306,"Sure! A picture would be great! 
I have been trying random things and was interested in what others are doing. I have these gloves that I wrap around my hands and put a weight in the middle. That's mainly what I do for my workouts. ",,,1,0,0,
a82bb553-721a-45e3-a70b-3284a1cb9e02,1504590457,"I'm sorry for what you've been through.

You need to really clarify what you want. Ideas for dressing? Access issues at work? ",,,1,0,0,
b0329038-7eac-4cdf-a1f5-26a071f38d9f,1505799959,"If possible, you could perhaps fly with more stops (i.e. Break a 10hr flight down to 2x5hrs) and it may also make flights cheaper by going indirect? ",,,1,0,0,
c3cd2274-b966-4c57-8144-82aec57ad73e,1504676350,"Thanks for sharing this! I'm traveling to Japan in a few months, and I've subscribed to a sub called /r/JapanTravel .... you may want to cross-post this over there, too! ",,,3,0,0,
c381a2a1-8eb4-4f49-bd7b-ae1d8f7011de,1504863053,"I think the only requirement is you sign up to be a [guide](https://maps.google.com/localguides).

You could not only answer questions, but even illustrate with photos, and add reviews to places praising/damning accessibility. ",,,3,0,0,
25481d4c-7060-4004-98b0-4caab881eb26,1504606075,"Is call this man a piece of shit, but that would insult turds the world over.",,,11,0,0,
948a8310-ebe4-47de-bcf8-6f491ecaf656,1505844146,Look for a local Center for Independent Living (CIL) it's their job to help and connect you to resources to help you live independently as a person with a disability.,,,2,0,0,
3a64c99a-b77b-46ec-a566-bedfc2f9d149,1504649536,"That's what I was worried about. Yes, the account is in my name now and has well over $2,000.

I work best in a structured setting away from home, so I hadn't really considered working from home. It is an option now though because one of my roommates works from home, so I wouldn't be isolated at home so often. Thanks for the idea :)

My dad is 71 and he's on SSI, and my mom is 57 and on SSDI. Is there anywhere in particular I should start with the process for getting disabled adult child benefits? If my dad is not /required/ to help with the process, he won't.",,,1,0,0,
180daa16-d126-4e4e-a1da-71a83dce1d82,1506072240,Am an easy going young girl looking friends that will keep me company and also are and i will are for them too,,,1,0,0,
7175a24d-8af1-4a83-bd2f-7fa12378c3c4,1506797644,"I think that comes down to personal preference. I get what you're saying, but lots of adults still use ""cute"" to mean attractive. In fact, when I first met my boyfriend, I called him ""cute guy from work."" Lol ",,,2,0,0,
6c300b66-a770-4693-91a6-8a5c1a9fdf13,1505279781,Wow! I'm glad you were finally approved. What changed to finally get you approved? How were able to bet by financially? ,,,1,0,0,
461087f6-0edc-4586-ab04-ba1c367fca2a,1506614049,I immediately went to Instagram and used it.,,,5,0,0,
be8e6b44-ea50-4734-bf04-1a81cc30f559,1505171682,"Your submission was automatically removed because you linked to reddit without using the ""no-participation"" np. domain. Reddit links should be of the form ""np.reddit.com"" or ""np.redd.it""

*I am a bot, and this action was performed automatically. Please [contact the moderators of this subreddit](/message/compose/?to=/r/disability) if you have any questions or concerns.*",,,1,0,0,moderator
5ed0fe9d-0c1f-4df4-b0d9-91890592ea16,1506388396,"Section 8 is income based so yes any money you make is counted for that. SSI is seperate and has their own rules. Are you making above ""very low income""? Then instead of charging 30% they would charge 50%. So yes at that point it's like why even work. I'm not sure how to help you or answer more of your question. Sorry! Wish I could help you more :/ ",,,2,0,0,
92338401-4c21-40e9-9544-2873f6d9551b,1505528473,The government here straight up violated the ADA regarding my scholarship eligibility so nothing would work also Internet not get expelled ,,,1,0,0,
