commentator_id,created_utc,anonymized_body,ups,downs,score,controversiality,gilded,distinguished
65eb3d01-3c5f-4f46-bbd9-7f98ef92e763,1493301650,"&gt; The information is not easily accessible and there is a TON of misinformation out there.

Totally agree with you. I don't know how SSA can combat myths, because they are so ingrained in popular culture. It can be hard for SSA to give real simplistic information, because ultimately it can still be complicated. No two situations and beneficiaries are alike.

&gt; People are not going to come into the office or call and ask those questions either because they don't want their case flagged or something because they asked questions about employment.

Again, I'm not sure why people think this. The only ""flags"" that case really gets that will follow that person around is if the person is a physical threat (ie banned from the FO) or if there is fraud involved.

&gt; If people understood the seeming lottery system for why some people are approved in three months and why others have to fight for 3+ years, perhaps this would be less terrifying

The information about the programs is out there (the entire POMS is available online), but the hard part is that most people only see themselves through their own eyes, and there is this natural bias to be skeptical of the system.  Some people see themselves as 'disabled' but they don't meet the criteria for SSDI/SSI. Or maybe they do but their doctor's keep crappy notes (or don't turn them in at all) so the evidence isn't there to support them. Disability is ultimately a vocational program, and there are so many factors that go into it besides just medical. A person can be disabled (in the vernacular sense) but not qualify for SSDI

One of the reasons I like to post on this sub is to help give information and correct misinformation. Each case is different so you **cannot** compare two claimants side by side to determine why one person was allowed immediately while another wasn't. 

These stories always start out with ""someone I know.."" but the problem with that is that you don't know what was in that person's case file; hell, most people don't know exactly what was in their case file. Last year SSA processed 2.1 million disability applications, so you can't extrapolate a few anecdotes to the whole system.  

 A lot of the negative myths out there get perpetuated by anecdotal evidence, and then when faced with actual statistics, people still refuse to believe it. Take the ""everyone gets denied the first time"" myth. The reality is that about 30-33% of claims are allowed the first time (assuming it clears the first level of FO approval and makes it to the DDS). The reason that allowance rates increase the longer a case goes on is because the case file gets longer. Everyone says ""oh well they just deny you so you have to go in front of the ALJ"". One of the reasons more people get allowed at the ALJ (aside from judges being able to do whatever the hell they want, unlike the DDS) is that the case file is probably *double* what it was at the initial level. 

I can't tell you how many times I've posted actual facts on this sub, only to be told that I'm wrong, or that I'm lying. People insinuate that all I do all day is sit around and figure out how to screw people over. Its almost impossible to counter that kind of thinking. The unintended consequence of that is that these myths then permeate the discussions about the program as a whole, which will probably  negatively impact it in the future.  ",,,2,0,0,
65eb3d01-3c5f-4f46-bbd9-7f98ef92e763,1491238434,"The school and guidance counselor notes will help, even if they aren't medical. It goes towards the whole picture of your disorders. Plus, school records have different rules for retention so most of those shouldn't be destroyed. Finding them may be difficult (they are probably in offsite storage) but not impossible. I would just start working on finding them ASAP since it could take a while. 
",,,2,0,0,
65eb3d01-3c5f-4f46-bbd9-7f98ef92e763,1492219245,"What is your current medical insurance? Are you on Medicaid or Medicare? Both?

Is this an issue with just a certain medication (like one with no generic) or a combination of all your meds?",,,2,0,0,
65eb3d01-3c5f-4f46-bbd9-7f98ef92e763,1492688272,"The ADA does not actually dictate how far away the parking spaces need to be; they just need to be closest to the building entrance as possible. (at least to my knowledge, someone is free to correct me). The rules governing handicap spaces are specific only to the size of the space and the number of spaces required. 

Obviously the school can't do anything about it being hilly, other than parking are the buildings not accessible? I had a similar situation (knee surgery) when I was in college. Do you guys have any sort of campus security? When I had to go long distances across campus I was able to hitch rides from them. ",,,9,0,0,
65eb3d01-3c5f-4f46-bbd9-7f98ef92e763,1491229971,"I think the issue, as you pointed out, is that you had a big gap in treatment (about 6-7 years). This can be overcome, but it will be difficult. 

SSA does take into account that certain mental disorders will have large gaps in treatment (since that can be part of the disorder). But in order for your SSDI claim to go through, they not only have to prove that you were disabled prior to 22, but that the disability *continued* from age 22 to the current time period. 

If you can produce that evidence from when you were between 18-22 I still think you have a strong case. If it was of hospitalization-level severity and you were granted disability in your 30s, it is not that far of an inference to say you were disabled in between. 

I don't think you need a lawyer in this situation. There isn't going to be much a lawyer can do that you can't do yourself.  The hardest part is going to be getting those records. Do you (or your parents) already have copies? Medical records are typically only kept for about 7 years, and back then almost nothing was electronic. So there is a good chance that all those records have been destroyed. ",,,2,0,0,
65eb3d01-3c5f-4f46-bbd9-7f98ef92e763,1492218777,"This review is right on schedule. Everyone (legally) has to get their disability reviewed every 3-7 years (usually 3 until you get over 50). 

The only thing you need to focus on is filling out all the paperwork and returning it in the requested timeframes. If you're not cooperative with SSA/DDS they will cease your benefits. ",,,6,0,0,
65eb3d01-3c5f-4f46-bbd9-7f98ef92e763,1492804274,"This is all standard. About every 3 years you'll get a complete review of your case. They will get functional information from you and a years worth of your current medical records. 

From there they compare your current status/functioning to when you were allowed. If you've had significant medical improvement related to work, then they may find you no longer disabled. If there is no improvement, your benefits continue. 

Make sure you're watching the mail and answering the phone. They may call you with additional questions or need to send you to an exam. If you don't cooperate with them (even accidentally) they will cease your benefits. 

If you do get ceased, make sure to appeal within 10 days so you can elect to have benefit continuation while you appeal. A large number of cessations are overturned on appeal. ",,,3,0,0,
65eb3d01-3c5f-4f46-bbd9-7f98ef92e763,1492456828,"* Yes you need to list every place you've seen in the last 12 months. It looks incredibly shady if you leave of sources that are then discovered later (they normally are). 

* whether lack of treatment for your disability will be detrimental to your case depends exclusively on what your disability is. If it is something truly permanent for which treatment will have no effect (say an amputation) then it won't matter. But for most conditions lack of treatment (depending on the reason) will negatively affect your CDR. 

* Don't go into long explanations on the SSA-454 form. This form is just for the factual information so they can create the file and request medical records. They will send you an updated ADL form, that is where you can put all that information. 

* make sure to list your psychiatrist on the medical records form. SSA will gather medical records from **all** your doctors and then sort it out once everything is in. Again, *excluding* information is extremely suspect; hiding information suggests that there is something that you are actively trying to keep from SSA because you know it will hurt your case.

* As long as your physical condition hasn't changed they won't really consider the mental stuff, so you won't need to go to an exam. The first step of the CDR is to see if there has been medical improvement in your disabling conditions; all other conditions are put on the back burner. 

* Most people on disability don't really know why they were allowed. Sometimes they think its one condition but its actually a different condition; or a combination of impairments. Just list all your currently diagnosed medical conditions. SSA knows why you were granted disability; you don't need to tell them. 

* if you've been on for 20 years and are only given CDRs every 7 years, then you have nothing to worry about. The longer that someone is on disability, the smaller the chances of cessation. There is actually something written into the POMS (rules) that gives wide latitude to continue someone who has been on disability for more than 10 years and/or is over 50. You'd have to basically be cured of your conditions to be ceased now. ",,,3,0,0,
65eb3d01-3c5f-4f46-bbd9-7f98ef92e763,1491614979,"That would depend on the type of job. If you're condition is severe enough for you to qualify for disability you probably won't medically qualify to be in law enforcement.

 You don't actually have to disclose you were on disability (but they'll do a background check and probably find out). Any other job (that doesn't do a check) you don't have to tell them, but you'll have to explain a gap in your work history. ",,,3,0,0,
65eb3d01-3c5f-4f46-bbd9-7f98ef92e763,1491072731,"Your plan sounds sketchy at best. If you're on SSI any additional income (through work or ""support"") will affect your check amount.

Before you do anything, you really need to speak to SSA or talk to someone whose job it is to advise people on SSI rules (like a benefits planner). Don't just start this and figure it out later. 

There are ways to work without affecting your benefit eligibility. But the way you describe your plan it's real close to sounding like fraud through hiding income. This would be considered self-employment which has special rules to prevent people from doing just this. Artificially keeping your income low to continue to qualify for benefits. 

The ABLE accounts are separate from income rules. So you can put say, an inheritance in there, and that's fine. But you can't earn more income than allowed, regardless of where it goes. ",,,3,0,0,
65eb3d01-3c5f-4f46-bbd9-7f98ef92e763,1491261019,"If they can argue that driving to the sites is an integral part of the job, they can get away with requiring the license.  Do you know for sure how often you'd be required to leave the office to do site visits? Would these be with another person or just yourself? How far away would the sites be?

If you don't know the answers to those questions, then it's hard to say whether their request is reasonable or not. I would recommend calling and explaining, but if they need it enough to require it to apply, they probably won't budge. ",,,7,0,0,
65eb3d01-3c5f-4f46-bbd9-7f98ef92e763,1491232666,"CDR reviews are a mandatory part of being on disability. Every case gets reviewed anywhere from 1-7 years, with the longer you're on disability (or the older you are) getting them less frequently. 

The only thing you need to worry about is filling out the paperwork correctly, legible, and turning it in on time. If you are seeking regular care (sounds like you are) and your conditions haven't gotten any better; so you should have no problems with your CDR. 

Its also important to remember that a CDR does not work like a regular disability claim. When you were found disabled you were compared to the disability criteria. At the CDR level, they only look at whether you've had significant ""medical improvement related to work"" comparing how you are **now** to how you were **then**. ",,,2,0,0,
65eb3d01-3c5f-4f46-bbd9-7f98ef92e763,1491238230,"yes you can't draw on either one of their SSNs until they start drawing benefits themselves (or die).  Once that happens you can apply for the SSDI benefits which will be higher than your current amount. 

How much higher will depend on a lot of factors. Generally speaking a CDB beneficiary will receive 75% of the SSN holder's check. So if your dad's retirement is $1,000 you'd get $750. If the amount is high enough, it will significantly lower or eliminate your SSI. But you'd still be coming out ahead, and if you're not on SSI you wouldn't be subject to all the asset restrictions. ",,,2,0,0,
65eb3d01-3c5f-4f46-bbd9-7f98ef92e763,1493294748,"While I don't think your overall point is incorrect, I think it illustrates some of the inherent flaws with how people view the disability program (and frankly is a big reason why UHC would be great)

I don't think that it is correct to think about SSI/SSDI necessarily in terms of medical care. The two are really separate. Medicaid is separate from SSI, so even if OP did lose their SSI benefits that doesn't necessarily mean they lose Medicaid. Its likely that they qualify for their state's Medicaid program (either through a buy-in, working disabled, or  income).  The good thing about Medicare is that if a person loses SSDI, they can still get Medicare (EMCP) for 5 years after they lose their SSDI. 

So when someone says that they don't want to work because they may lose their medical care, I don't think that is entirely accurate. From an outside (general public) perspective what you see is someone who *can* work the extra hours choosing not to.  

&gt; the jobs that they are able to get are not high paying due to spotty work histories

Having a spotty work history, no work history, or having no marketable 'skills' does lead to lower paying jobs; at least in the beginning. But this is the case even for non-disabled individuals, and I don't think its fair to use ""well they won't make a lot of money"" as a reason for not working. 

There is also a misconception with regards to what happens once you start working again. After a person has completed the TWP months, they begin a 36 month [extended period of eligibility](https://secure.ssa.gov/poms.nsf/lnx/0413010210) where they will get a check should they fall below SGA. 

So they get that 3 year period where they can test out working above the SGA level.   If their goal is to get to full-time work they can gradually build up to that. If it doesn't work out, or their condition gets worse, then they will still get their check.

&gt; then have to back through the horrific SSA system to regain benefits after attempting full time gainful employment and many people just give up

This is why there is the [Expedited Reinstatement](https://secure.ssa.gov/poms.nsf/lnx/0413050001), so that a person who tried working, but couldn't stay employed due to their condition, gets a fast track back onto SSI/SSDI.  As long as its within 60 months of their cessation, they are able to get put back on benefits right away during the EXR determination, which is almost always approved (it just needs to be the same disability as they were originally allowed for). They do not have to go through the initial claims process all over again. 

You're right that healthcare is expensive. But as I mentioned above there are options for medical coverage that are separate from SSI/SSDI. If a person is working full time, they often then will also qualify for benefits through work. For a person on SSI, they can usually still qualify for their state's Medicaid system. For those that were on SSDI/Medicare they have the [extended Medicare coverage](https://www.ssa.gov/disabilityresearch/wi/extended.htm) program.  This allows for a person to keep their Medicare coverage for 8.5 years after they start working. The clock for this does start during the EPE; so realistically its 5 years after SSDI cessation. 

So really between the EXR protection and the EMC protections, a person who returns to work has a 5 year buffer; and that is after the initial 3 year EPE/trial run. 
",,,2,0,0,
65eb3d01-3c5f-4f46-bbd9-7f98ef92e763,1492219037,"You still have to worry about deadlines with the lawyer. Well, they do. Depending on whether you're using someone local or the ""big guys"" (binder/binder, allsup, etc) attorneys can forget (or ignore) those deadlines. And with attorneys SSA doesn't have to give them multiple chances to cooperate. Once they miss one they will do a failure to cooperate denial. 

Point being, I would make sure you're following up with your attorney on the paperwork. I would also follow up yourself with SSA/DDS to make sure the paperwork is returned. When you have an attorney SSA can't contact you directly, but they can talk to you if you call them. ",,,2,0,0,
65eb3d01-3c5f-4f46-bbd9-7f98ef92e763,1492257122,"If they are name brand you may want to look into any programs the companies have for low income patients. If you call them and say you can't afford the meds, they might send you a discount card. ",,,2,0,0,
65eb3d01-3c5f-4f46-bbd9-7f98ef92e763,1492257535,"That all sounds fine. Lawyers are good for situations like yours where you'd have trouble keeping track of things. I've just seen claimants who had no idea their lawyers weren't turning things in, or lawyers who weren't helping the claimant cooperate. ",,,1,0,0,
f1b22fe1-83fe-42ae-a5a0-7ad028498c24,1493048298,"Amen.  When I get down with hubby, it's awesome, but unfortunately I pay for it later with pain in whatever joints used.  Totally worth it though!

I hate how meds affect libido though.  THat's really hard to deal with.  I went from a ""sexual tyrannosaurus"" to a withered, pathetic asexual, starting clonapin and lyrica.  my poor husband.  I seriusly hav no desire, and it causes anorgasmia.  It's very frutrating now.  We used to have a great sex life, but now it'snnon existent.  I feel so guilty.",,,1,0,0,
f1b22fe1-83fe-42ae-a5a0-7ad028498c24,1493047702,"I'm interested in what you're saying.  I can't believe the DMD organization has ignored your attempts to discuss sexulity, because i9t's on the basic hierarhchy of needs.  What kinds of struggles are there for you guys regarding sexuality?  I knows very little about DMD and jusst learned about it yesterday, brieefly.  What kinds of ""unique"" experiences do you think sexual and romantic partnerss can have?  Tell me guys tell me.  I'm super interested.",,,3,0,0,
f1b22fe1-83fe-42ae-a5a0-7ad028498c24,1493048016,"This kind of situation is why I think prostitution should be legal and regulated.  Like strip clubs with bouncers, nd the girls get tested frequently.  There are so many people who think they cannot get laid, that I think prostitution, the age old occupation, should really be legal.  It's like, porn is legal, the only difference between porn and prostitution is a camera.  This part wouldn't fix a romantic relationship, but it would fix a lot of sexual frustration for so many, disabled or not.  plus the government could tax it.  Not that I'm pro prostotution, I'm really not, but just from a freedom aspect, that's how I feel about it.  People are paid to do many many things, so that's what I think about it.  Would you guys consider hiring a prostitute if it were legal and the girls were tested?  Or just in general with it being illegal? Or just no? rre you guys talking about romantic sexual partnerships?",,,3,0,0,
f1b22fe1-83fe-42ae-a5a0-7ad028498c24,1493005012,Then you've got to tell your family or support system to take you on trips to nearby big cities so can do these meetups and make friends.  frindship is so important.  I'm very sorry about your condition.  How old are you?  Have you cosidered moving to a bigger city?,,,1,0,0,
f1b22fe1-83fe-42ae-a5a0-7ad028498c24,1493047091,"oh okay, I'm srry I thought you were lonely and looking fo0r advice.  My bad.  Well that's a neat idea to start  a friendship/relationship thread thread.  compendium....  U just taught me a new word. :)",,,3,0,0,
f1b22fe1-83fe-42ae-a5a0-7ad028498c24,1493005652,"I would hang on to the money until you get your reward and backpay.  The pay off house with that, so you're not destitute.",,,1,0,0,
f1b22fe1-83fe-42ae-a5a0-7ad028498c24,1493048463,"One thing that bothers me is when my psychologist says that I'm lucky my husband stays with me through this, because ""a lot of men would leave"".  It makes me feel like I'm worthless.  Like, especially if I'm talking about relationship problems.  Its just kind of like, oh i should drop my standrds because i'm lucky he's even with me.  so fucked up.",,,5,0,0,
f1b22fe1-83fe-42ae-a5a0-7ad028498c24,1492996984,"There are challenges.  That's for sure.  My husband is able bodied and is working to provide for both of us.  I have psoriatic arthritis, sjogren's syndrome, fibromyalgia, hidradenitis suppurativa, and (as of now, ruled as non-epileptic) seizures.  
The one challenge for me is that I cannot always do the things around the house and for my husband that I want to do.  I don't work.  He works, and comes home and cooks dinner and does chores.
It's very difficult for him to take on more responsibility, as he has an already physicially demanding job.  He never complains and is always happy to step in and help.  He is a good man.  Another challenge is not being able to do ""normal couple"" date stuff like going on a walk or hike, or doing sports, outsdoorsy stuff.  We stay in a lot, and that can be very depressing for some.  Luckily we are both introverts nd like to stay in.
My challenge is accepting that I need the help.  Sometimes I get frustrated with how helpful he is, because I used to be very athletic and busy and do so much.  
Also the meds I'm on lower my sex drive and that is quite unfair for him.
We manage to get tyhrough it by having nice quality time together and interesting conversatiopns and watching tv.

As farf as friendship goes, I've lost contact with a lot of my friends since things have gotten so bad.  They are off being nomral healthy people, and young disabled peopled tend to be just kind of forgotten.  I don't have many friends anymore, but I'm open to making new ones.  I'm still okay with this, being an introvert.  Most of my contact with my friends is not in person.  This makes me sad.

One of the things that is important with any relationship, romantic or platonic, is that there is understanding, respect, and compassion.

having a disease changes things in a lot of ways, but the people who stick around for it are the real kind of people you need to get through it.  Meetup.com is a cool place to meet new people and make friends with common interests.  it's free.  Just though it'd throw that out there.

What has worked for me is having a good personality and being intelligent and people able to connect with people.  Sometimes they don't always connect back, and that's okay.  Being disbled shouldn't take your identity away.  Keeping yoru identity and your strength in your self of self is extremely important.  And not being ashamed of your disabilty.  That's what'sworked for me.  but trust me, I've cut ties with people who choose to not empathize, accomodtae, or be undrstanding of my situation,a nd I highlyh recommend doing so if yu cannot problem solve with those types.",,,5,0,0,
c5765dd7-d95b-4bf1-9398-201e631ea9c9,1492381238,"Someone who is close to being in a vegitative state. 

If someone has conscious understanding of themselves and the world, then I think we should do everything we can to maximize their quality of life. 

But when someone barely knows they exist, why are we putting them through that? Why are we putting ourselves through that?

My aunt was in a persistent vegitative state for 15 years. Why oh why did my grandmother think that was OK? Well, she's Catholic, that's probably why. My aunt didn't understand her own existence. What's worse is that her eyes would track anything that moved so it gave a false illusion that she could comprehend anything.

My MIL had a massive stroke and went into a coma. My FIL didn't want to pull the plug :( After 5 days I was prepared to sit down with him and tell him about my aunt and that it is no life to live. But fortunately she had already gone brain dead by that point, which in CA is legally dead. Can you imagine keeping a body alive after brain death? My FIL totally would have considered it.",,,4,0,0,
c5765dd7-d95b-4bf1-9398-201e631ea9c9,1492383218,"In your case (deafness), the employer is being dense.

In my case (everything triggers a migraine), I'm simply not competitive. I can't work more than 40 hours a week, I slow down after 6 hours in a day, and you never know when my body will decide to freak out and shut me down. There's too many alternative able bodied people to consider someone with a body like mine.",,,2,0,0,
c5765dd7-d95b-4bf1-9398-201e631ea9c9,1492385287,"That is so unfortunate. I really hope that Canada realizes deafness doesn't cause a ""drain on society.""",,,2,0,0,
