commentator_id,created_utc,anonymized_body,ups,downs,score,controversiality,gilded,distinguished
d3af0d3d-235e-4618-ab49-a052d54d06cf,1509657997,"Thank you for the response, and for correcting me! I apologize. But I didn't pick the project, the prompt was given to me. I am required to talk to people who are wheelchair users and show these results to my professor. I don't agree with this, and I think it's pretty unnecessary to require talking to someone in a wheelchair for most of this, as it's pretty apparent that using a wheelchair to do most things would be very difficult, and that most people who are wheelchair users have somebody else shovel show for them. 

If you would be able to just type out some reasons that it's difficult (obvious or not) it would really really help me out. 

Again, I apologize and thank you for responding. ",,,1,0,0,
204f3ca9-aecf-492f-bc5f-00649c217d4e,1509660131,"My bestie in grad school wanted to attach a plow  to the front of my chair and use it to clear her driveway.  Haha.   Honesty though,  I would rather pay a neighbor kid to do it.     ",,,1,0,0,
d3af0d3d-235e-4618-ab49-a052d54d06cf,1509639872,"Hey. Sorry but I can't find a single post on here about this topic. Unfortunately due to the project it has to be specifically about shoveling snow, not any other movement. ",,,2,0,0,
8845fd1c-b461-42d9-b492-b91e83ab171a,1509656926,"Honestly?  Doing anything from a wheelchair is HELL.

Try it.  Go rent one for a week and without cheating, spend all your waking hours in one.  No cheating.  Try doing all the things you normally do but do them from a wheelchair.  

Get back with us and let us know how it went.

:-)",,,3,0,0,
aae7c254-aa01-4ce4-83ba-64398c3b7be8,1509655404,"Northern Canadian here. I, and several of my friends, are in wheelchairs. None of us shovel our own driveways. It is just too hard. It's a whole lot easier to make the roommate do it (what I do) or pay the neighbour kid to do it (what my friend just told me she does). Another one of my friends lives in a condo so she doesn't have to deal with shovelling at all.

You may want to rethink your project because there is very few people in wheelchairs who shovel their own snow. 

Also, we are not ""bound"" to our wheelchairs. It is much more correct to say ""wheelchair user"".",,,3,0,0,
d3af0d3d-235e-4618-ab49-a052d54d06cf,1509660101,Thank you very much for your response!,,,1,0,0,
85d78199-6a32-4e80-aa98-2b4135b65903,1509652521,Bleu is being a bit grumpy. Why not talk to someone from your school or community who uses a wheelchair rather then internet strangers? ,,,2,0,0,
92338401-4c21-40e9-9544-2873f6d9551b,1510055056,"Well tell your teacher that you don't need a source for common sense. 

im
Not in a wheelchair but my guess which is common sense would be oh you can't see the ground if it's covered in snow if you're using a manual chair pushing the snow plow and yourself would get really complicated.


This invention may be useful to some
People but my guess is it may be easier to just ask for help ",,,1,0,0,
aae7c254-aa01-4ce4-83ba-64398c3b7be8,1509659848,"This might be brisk because I have my own schoolwork to worry about (sorry!) but I want to help. 

It's difficult because moving in a wheelchair requires your hands (one if you are in a power chair, both if you are in a manual one like myself) and, obviously, shovelling requires use of your hands. Getting through snow (especially the amount that warrants shovelling the driveway) is hard enough as it is (and darn well impossible after a few CMs). Snow is also heavy and lifting it high enough to clear the snowbank can be hard if you get a lot of snow. 

Winter is also cold. For me and my disability, my joints and muscles tighten in the cold making every task harder. pushing yourself in a wheelchair requires arm mobility and hand dexterity - neither of which you get a whole lot of in winter coats and gloves. I personally also have other health conditions (I get pneumonia quite easily) so being outside in the cold and snow and doing heavy labour is just a recipe for a week in the hospital hooked up to oxygen for me. 

As a person with a disability, I believe there is a solution to everything. Even if the solution is getting someone else to do it. ",,,3,0,0,
d3af0d3d-235e-4618-ab49-a052d54d06cf,1509658091,"See the other comment I responded to. 

But I understand it's easy to make educated guesses, but my professor is requiring me to have sources for all of this, including every reason why it's difficult to shovel while in a wheelchair. ",,,1,0,0,
9c09381f-1ac5-46a6-820c-004b5c74c11f,1509667297,"Update: They also have a provision to eliminate tax deductions for medical expenses which disproportionately effects this community:  
&gt;Sec. 1308. Repeal of medical expense deduction.  

&gt;Current law: Under current law, a taxpayer may claim an itemized deduction for out-of-pocket
medical expenses of the taxpayer, a spouse, or a dependent. This deduction is allowed only to
the extent the expenses exceed ten percent of the taxpayer’s adjusted gross income.  

&gt;Provision: Under the provision, the itemized deduction for medical expenses would be
repealed. The provision would be effective for tax years beginning after 2017.
JCT estimate: For information about JCT’s revenue estimate for this provision, see the note
immediately following the heading for Subtitle D of Title I in this document.  
  https://apps.npr.org/documents/document.html?id=4172075-Tax-Bill-Detailed-Summary",,,6,0,0,
92338401-4c21-40e9-9544-2873f6d9551b,1510054554,Not suprising. Can't even get an acsess button that works consistently on my college campus. Friend of mine found this out when her hands were full at night and she like couldn't get into her dorm for a minute there ,,,2,0,0,
8845fd1c-b461-42d9-b492-b91e83ab171a,1509764755,"They want all the non ""able bodied Aryans"" to die off, plain and simple.

Welcome to the Fourth Reich...

:-(",,,6,0,0,
c9f7ce63-a9a4-4ade-9b04-e67104746d6d,1509726430,"None of this should come as a surprise. Take a look at Trump's proposed budget. They are already trying to turn the old folks against those on SSDI by saying ""it's not really social security"". F*** the Republican party.",,,8,0,0,
027a1edc-29da-4b66-aaf2-22f18a400f4e,1509681352,Wonder if there's a way to fix those provisions but still pocket the estimated $1600 extra.,,,2,0,0,
f4d18fa8-4341-4c9e-9b7b-df64934a1b8c,1509713615,"There are an immeasurable number of types of invisible disabilities, because almost every disability has the power to be invisible depending on the situation. 

You have mobility issues that may not be obvious because you're not expecting to see someone walk or run in the setting.

Blindness can be an invisible disability, as not everyone with visual impairment uses a cane, wears glasses or has a seeing eye dog.

Deafness is an invisible disability.

It depends on how how you want to categorise things as to how you count it, you can try and group things into body systems. Neurological, Gastrointestinal, respiratory, sensory, muscular, skeletal... etc

If you want to count individual conditions you'll be there for years, just look at the GI system, almost every illness starts off invisible, many remain invisible, and many can cause functional limitations that lead to disability. Crohns, UC, duodenitis, BAM, gastroparesis, achalasia, short colon, SIBO, IBS etc can all cause debilitating symptoms that effect daily life, yet it's mostly invisible to the public eye.

Likewise with skeletal problems. Even something you think would be obvious like an amputation can be invisible. If someone has long pants or long sleeves on, you may not notice a missing limb, their disability is invisible.

Mental health also falls under invisible illness and disability, and there are hundreds of mental illnesses that cause disability.

Developmental disorders are separate to mental illness and also often invisible.

Neurological dysfunction is also again different from mental illness, but often invisible, and has many potential causes including things like stroke, brain injury, tumours, connective tissue disorders, vascular disorders etc.

Chronic pain can be a condition in itself (like Chronic pain syndrome) but more often than not it's a symptom of something else, like degenerative disk disease, or cervical Instability, or abdominal adhesions, or whatever.

So chronic pain can be it's own type, but an individual who experiences chronic pain may associate their disability with the underlying condition, not the symptom of pain.

Like myself, my condition is a connective tissue disorder, it's invisible because you can't see how loose and fragile my tissues are from the outside, I consider my disability to be my loose tissues. Sometimes people bump into me in the street, and because my tissues are weak, the bump dislocates my shoulder or back, it's very painful, and can cause nerve dysfunction and other symptoms that are disabling. But I still consider the connective tissue disorder itself to be the disability, not the symptoms.

Yet some people are the exact opposite, they have the same connective tissue disorder and yet they choose to see the symptoms as the disability. So it can be very personal as to how we count and label invisible disabilities. ",,,3,0,0,
adf46e8d-fcdc-45f9-af4d-0a70170b8dd4,1509676490,"It depends on how you want to categorize them. I have several invisible illnesses many cause chronic pain but they’re from different sources: genetic, viral, nerve, immune issues, unsealed injuries...",,,3,0,0,
47ee3b64-0c89-4080-be3c-d3684aedbef5,1510008675,"&gt;how many types are there? 

types? I don't know. as many as there are disabled people with invisible disabilities? or do you mean like mental, physical, whatever?

&gt;is chronic pain a type? thanks!

yes, absolutely. chronic pain can be disabling and potentially qualifies a person for disability.",,,1,0,0,
59fc8aa4-cfed-409f-800a-ab7b93aa65a2,1509684518,"can you explain how the sources cause the pain? im trying to start research and make sure i dont get anything wrong. 
or can you direct me to sites to learn more about these sources?",,,1,0,0,
7c974207-802b-4dd7-be3b-58b6149370a2,1509964616,"So for me I have multiple invisible disabilities. 

The main one's I have are Ehlers Danlos Syndrome, POTS, Dysautonomia, Asthma, Scoliosis, Dyslexia and Dyspraxia.  

Ehlers Danlos and Scolosis are the only one's which really cause me pain, however Ehlers Danlos affects the whole body so I experience joint pain in most joints, severe stomach pain and bad back pain - all of which can be pretty debilitating. 

The other conditions like Pots (which make's me feel exhausted all of the time as not enough oxygenated blood get's to my brain) debilitates me by never allowing me enough energy to do what I want, and when I do expel energy, It is super easy to exhaust myself to the point of illness. After which I wont be able to do anything for a few days because I am so exhausted. 

The invisible aspect is most frustrating for me as I look like a healthy mid twenties man, but really my body barely functions and my capacity is probably 20% what other people can do but there expectation from me is that I can do 100%. 

Even when I explain to people they look at me weirdly because I look pretty normal and mostly don't use mobility aids in public (this is changing as my health has gotten so bad). I also want to appear as normal as possible so I do a pretty good job of not letting on I am in pain and pushing myself when I am around others. This however only get's me the reputation of seeming to manage well and all that stuff about my health kicking up a bit of a fuss, which of course It isn't but it seems very hard for people to trust what I am saying.

The learning difficulties just add's another level of problems as I can communicate well verbally but struggle translating it onto paper. So talking to me you'd assume Im relativly clever and can manage paperwork and admin but when I comes down to it I really struggle with essays etc for hours and hours but they read like Iv'e rushed it and not put any effort in.

edit: Posting on Reddit is not only Cathartic but good for me practice writing cleanly and in a hopefully relatively grammatical manner.",,,1,0,0,
7c974207-802b-4dd7-be3b-58b6149370a2,1509703596,"You've said It yourself you are loved :) Please don't do anything drastic, your family will miss terribly and all that will happen is you will pass all of your pain to them to bear. Your at your lowest ebb, but I have good news for you - It's only uphill from hill! Honestly pick yourself up maybe take a few minutes to meditate and get a nice slow breath going and clear your mind a bit. If you need to cry for 2 hours then do it, get all that bunged up emotionality out then find that one thing you know will make you laugh and watch it / do it.

Your family love you -  you need to live for them!",,,1,0,0,
be8e6b44-ea50-4734-bf04-1a81cc30f559,1509685764,"Your comment was automatically removed because you linked to reddit without using the ""no-participation"" np. domain. Reddit links should be of the form ""np.reddit.com"" or ""np.redd.it""

*I am a bot, and this action was performed automatically. Please [contact the moderators of this subreddit](/message/compose/?to=/r/disability) if you have any questions or concerns.*",,,1,0,0,moderator
3383ab68-896a-4a2a-9735-94d968c6ba42,1509703865,"Hi, I hope you are feeling a bit better today. Sometimes I also think I will never find happiness in my life but I have found when I accept that, it's a bit easier.

For the sake of your wife and your kids please vent here as much as you want because I think it can be helpful. Please take care.",,,2,0,0,
9a8bc462-37ef-4901-bf80-0211f51f4604,1509685760,"&gt;I am still waiting on a determination from SSA

I've read what you said and hope you get what you need very soon. That SSA determination took 5 years for me, and I almost gave up. Our society is heartless out of perceived sense of how it would be unfair if other people didn't suffer as much as them [the working class]. It is called crab mentality --it has no sense of humanity or empathy-sadly some people benefit by fostering this. 

&gt;The metaphor refers to a common pattern of behavior seen in a [group of crabs](https://en.wikipedia.org/wiki/Crab_mentality) when they are trapped in a bucket: Their focus is on saving oneself rather than willing to cooperate to save the entire group. Individually, any given healthy crab could easily escape, but when grouped with others, any individual's escape will be hindered by others. They will grab at each other in a futile ""king of the hill"" fight for survival, which eventually ensures their collective demise",,,7,0,0,
9070693b-2d6a-49fd-8b8f-dc347ec2a2d3,1509728930,"This is a really tricky one! Is it an option to have a minivan's floor lowered? My brother's Odyssey has a lowered floor and it kneels, so the incline of the ramp is VERY slight. Two wheelchairs do fit in his van, but only one is in the front and the other is behind it. I'm not sure if it could be modified to fit two side by side. 

Side note, you might want to remove a space from your second line in your post, the formatting makes it hard to read because we have to scroll side to side.",,,2,0,0,
fef14778-5548-4115-ae5f-6f393dacdc46,1509740886,Have you considered a larger SUV like a Suburban?,,,2,0,0,
5196f89a-623d-4a77-b49e-d2a7822b9402,1509777114,"Have you talked to some of the companies that convert vans for wheelchair users? They can likely meet with you all to discuss options, concerns, etc. ",,,2,0,0,
2ea42b25-1f63-448a-9064-673baa8305f8,1509757970,Thanks.  My mom tried a kneeling van but she still can't get into the van by herself.,,,2,0,0,
2ea42b25-1f63-448a-9064-673baa8305f8,1509741291,Do you have an example of a suburban with a wheelchair lift?,,,1,0,0,
2ea42b25-1f63-448a-9064-673baa8305f8,1509816763,Yes but my parents issue of two wheelchair users and my mom not being able to get up the ramp is an unusually one.,,,1,0,0,
8d41c1b2-5e51-4759-98a0-ed1e207775d1,1509746165,"I was told by my social security lawyer that SSA wants the most recent records available (I was told yesterday they'll be looking into my records from June - September of this year to make a decision on my most recent claim as well as the records in my past claims). I'm sure they'll help. With lack of insurance, are you able to receive Medicaid? It wouldn't hurt to apply, even if they can just point you in the direction of receiving mental health care if you were to get denied Medicaid.

I think your best bet is calling a disability lawyer and explaining your situation as well as what evidence you have, they'll tell you if they're willing to take on your case/if they believe you have a case. Of course you can still apply on your own online/at your local social security office as well if you can't find a lawyer willing to help you https://www.ssa.gov/planners/disability/dapply.html",,,2,0,0,
8d41c1b2-5e51-4759-98a0-ed1e207775d1,1509746829,"I'm so sorry about your health insurance situation, that's horrible :( Try and find local mental health clinics run by your state. Most are very low cost and even free depending on your income (your husband's in this case). Where I go to therapy (a state funded mental health center) it's $33 to see a psychiatrist and $16 for a therapist without insurance for those who qualify. ",,,2,0,0,
05bfeb22-3942-49d1-ae09-083d5ce229ed,1509742714,"If you are in the US, find a lawyer to represent you NOW. They only getpaid if you win your case. My case took over two years before i was approved. ",,,2,0,0,
1837e361-dfc4-4968-8780-6d62d0eaf23d,1509743098,"I understand most people are denied, then you have to 'appeal' which may involve a lawyer and an appearance in court.  ",,,1,0,0,
8d41c1b2-5e51-4759-98a0-ed1e207775d1,1509743244,"Find a disability lawyer, they don't get paid unless you get approved. The initial application takes anywhere between 3-6 months if you're approved immediately. Most people aren't approved the first time then you have to appeal which takes around 2 years. If you're still denied after the appeal, you start this process over with your lawyer again. I'm going through all of this for the 3rd time right now for anxiety, panic disorder wirh Agoraphobia, borderline personality disorder, and bipolar NOS - I also see a therapist weekly and psychiatrist monthly. 6 years in, I just filed my 3rd application with my lawyer yesterday while my 2nd denial at the Appeals (not ALJ level) level is in Federal Appeals. I couldn't afford mental health care either, but if you go to your county's assistance office they'll be able to provide you with resources. 

ETA: Yes, Social Security will want evidence of your disability. Therapy notes, Psychiatric records, other doctor's your seeing records, etc. 

They most likely will also send you to one of their psychologist/psychiatrist to be evaluated as well. ",,,3,0,0,
93ed1e88-35dd-4aab-8679-22f44ee6975f,1509756145,Did you use a lawyer from the start- just looking to give OP some details.,,,1,0,0,
5196f89a-623d-4a77-b49e-d2a7822b9402,1509776981,"r/SugarHooves is correct. You need treatment history, current treatment , extensive medical records , notation of functional limitations, Rx history, etc. ",,,3,0,0,
8655ddfb-08a5-48ba-a269-7f3c3b73dd6a,1509746271,"I was on Medicaid for a couple months until my husband found new employment. Now my husband makes slightly over the Medicaid income limit, and health insurance at his company is insanely expensive. Even healthcare.gov wouldn't work for us- the only thing we qualified for was $600/mo+ insurance which is right around what his employer is offering us. :(

Thank you for your help!",,,1,0,0,
a82bb553-721a-45e3-a70b-3284a1cb9e02,1509758403,"Everybody here is recommending a lawyer - that's putting the cart before the horse. First you need to get solid medical evidence that you have been treated and that you have tried various treatment options to get your situation under control. They are going to look for current, ongoing medical treatment. 

You can file your initial claim yourself. 35% are approved. You can file online or fill out a paper one. An attorney will take 25% of your backpay up to $6,000. ",,,10,0,0,
ebd9abbb-6073-4fb1-a281-5b2e3bf9282b,1509762491,With no recent medical history they will likely require you to see a specialist they have contracted for such situations.,,,5,0,0,
48aa8e29-c585-4b0b-8c48-7f063b9c4b8b,1509830784,This is absolutely correct.  Untreated =/= disabled.,,,2,0,0,
05bfeb22-3942-49d1-ae09-083d5ce229ed,1509757244,"Started by myself and was denied, then found an attorney who helped me appeal",,,2,0,0,
b4bdeef2-0ad7-4d53-b1ea-ae5b84ed1ba9,1509765056,"You absolutely need medical history and on going treatment. Not just a therapist, but a doctor that works with you and your anxiety and can provide records which state that even with treatment, you experience debilitating panic attacks, etc. Without those things, you're not disabled, you're untreated, which isn't the same thing.

They do not budge on this. ",,,6,0,0,
5196f89a-623d-4a77-b49e-d2a7822b9402,1509777258,A prospective employer can legally ask if you have any conditions which would preclude you from doing the job or if you'd need any accommodations. Check out the AskHR subreddit.,,,3,0,0,
8655ddfb-08a5-48ba-a269-7f3c3b73dd6a,1509777790,"The employer did not say during the interview, ""This job requires that you be able to stand/walk for xyz amount of time. Are you able to do so?"" Instead he just flat-out said ""Do you have any diseases?""

It is illegal to ask a job candidate if they have a disease under the Americans with Disabilities Act of 1990. Employers cannot discount anyone from a job because of a physical or mental disability. In fact, the law requires that they accommodate disabilities unless they can prove it would cause significant difficulty or expense to do so. Employers also cannot ask you if you have had any past illnesses or operations.

My question was more-so geared towards if there's potential for legal recourse considering they weren't willing to accommodate me after I technically already had mentioned resignation but it wasn't actually official yet at that point.",,,1,0,0,
d332a2f3-d3ab-427c-9403-0e0a72bcede6,1509748893,"I would contact a lawyer , they could tell you if you have a case, it seems like it is, as far as I know, they are legally compelled to make a reasonable accommodation.

I think the key word here is reasonable.

The whole reason we have the Americans With Disabilities Act of 1990 is because of these kind of situations.

Discrimination happens all the time, but most people don't have the money to hire lawyers to go after these people.",,,2,0,0,
be22a0d4-d910-4bd0-9efd-ace24b997029,1509817442,"&gt;My question was more-so geared towards if there's potential for legal recourse 

The only person who can tell you this is a lawyer who knows all the specifics of your case. No one here can give you a for sure answer. Contact a lawyer. Or post on /r/legaladvice and be told the same thing. 
",,,1,0,0,
226ef4e7-f3a6-4213-a9de-df4f9c8447aa,1510200375,"You're right, it's easy to open another checking account.  I didn't know it was so crucial, but in your experience I see how it is.  My experience with bankruptcy was a personal bankruptcy, where I was the only owner and depositor of the account, and all of my money was work dollars.  If the lines are blurred between work dollars and disability dollars, then yes it would be easy to declare the entire account non-exempt.",,,1,0,0,
