commentator_id,created_utc,anonymized_body,ups,downs,score,controversiality,gilded,distinguished
d146a3eb-4f6c-45e9-85d4-dbb3d22fbaa6,1504909394,If you have any other questions just pm me I'd be happy to help.,,,1,0,0,
50896fb0-d51d-4f66-af38-c3db74f1a49f,1504699114,"Thanks a lot! Information training is really a good idea. You’re right that parking spots are a problem. We have good parking spots, but because they are nearest to the entrance, visitors simply love parking there. I have no idea what to do about it.",,,1,0,0,
a82bb553-721a-45e3-a70b-3284a1cb9e02,1504591213,Filing cabinets. My office put up a stink when I could no longer access the top or bottom drawer of a typical tall cabinet. ,,,2,0,0,
5905a3d8-ca1d-4986-a81a-308adf2c6eca,1504546477,"All the points that /u/b0133c69-14ae-485f-be63-e549a84e6b30 made are absolutely top of the list. I would just add, if possible, making the gap between the rows of desks slightly wider.

Have to say, good on you for asking these questions! I wish every office had such a forward-thinking manager :)",,,2,0,0,
948a8310-ebe4-47de-bcf8-6f491ecaf656,1506231969,"Look to your local Center for Independent Living,  they get questions like this every day and will know all about it.",,,1,0,0,
bd08c321-986f-4148-99a9-5219959792d8,1504540726,"I'm assuming your workplace is an office and not, say, a restaurant or a factory. As a wheelchair user who works in an office building myself, here are some observations...

Office chairs: They can be a big barrier. Most meeting rooms and offices are full of empty office chairs, and I'm constantly having to move them out of the way so I can have a place to sit at a table or desk. My advice on this would be: (1) Make sure there are no more chairs in a room than needed, and (2) Try to get people to push their chairs back in under meeting room tables/desks when they're done. These two things would help a lot.

Rugs: Don't use small rugs if you can help it. Those black entry mats for people to wipe their feet on are always getting caught under doors and can also get caught in wheelchair casters (not to mention being a tripping hazard for walkers). I don't know of any good alternatives... maybe make sure they're tacked/stuck down somehow?

Bathrooms: I'm sure you will follow your country's laws about accessible bathrooms. But one of the most annoying things is entering a large bathroom with many stalls, only to find that the one accessible stall is the only one occupied. Make sure to put the accessible stall(s) at the very end of the room (so people have to walk past lots of other stalls on the way to it), and put a placard on it with the access symbol. This will help discourage people from using this stall if they don't need it.

Doors: If you're going to put automatic opener buttons on doors, please make sure they are the kind that don't take 10 minutes to open and that don't make the door extremely hard to open manually. Also, make sure the open button is located along the path that a wheelchair user would actually travel. And if you have two sets of entry doors, it'd be nice to wire them up so that one button opens both sets at once.

This is a start. I may update this later...",,,6,0,0,
d146a3eb-4f6c-45e9-85d4-dbb3d22fbaa6,1504909272,"Most tend to be too high for wheelchair users, but power chair users are a different story.",,,1,0,0,
d146a3eb-4f6c-45e9-85d4-dbb3d22fbaa6,1504539942,"I actually custom fit chairs users and often do walk around to suggest the aids to daily living (ADL). 

One big one is carpets, they make wheeling really tasking compared to solids surfaces. Doors can be challenging for others as they don't open flush so look into swing away hinges or just removing them. In the bathroom, lower one sink and mirror or mount it on an angle downwards.

",,,1,0,0,
32052027-449e-41c9-a9bf-5dfc377ece58,1504550703,Make sure everyday use things are within reach :),,,1,0,0,
3381bfde-9ef1-45fa-a335-62d9be6203bf,1504550264,"Making walkways and movement areas nice and wide is a big one. Often places have one walk way that's big enough but the rest are super narrow. My mom was in a wheelchair temporarily and we struggled to get her around clothing racks and stuff at stores. 

I agree with the other poster about discouraging use of the accessible bathroom stall. Either make all of them accessible, or put up signs. I never use the accessible stall and it drives me up a wall when I see people use it because it's bigger and not because they need the space or the bars to maneuver. Also you might look at your parking lot and make sure the accessible spots are close to the accessible doors and not near rough patches of asphalt. My last work place had parking spots right next to a raised sidewalk with no ramp ����

You could also have an informational training or something regarding workplace etiquette surrounding mobility aids.",,,5,0,0,
50896fb0-d51d-4f66-af38-c3db74f1a49f,1504698716,"Thanks a lot! Actually, the only carpet we have is right here, in my office, where I don’t hold any meetings. You got me thinking whether I should remove it or not, I don’t want people to have a problem with coming to me. Hmm, I’ll have to think about this.",,,1,0,0,
50896fb0-d51d-4f66-af38-c3db74f1a49f,1504698231,"The abundance of chairs often bothers even me, so I will have to try to organize our rooms a bit differently. We already have two nice accessible bathrooms that are separate from the others. I think people without disabilities don’t ever use them, so I hope this shouldn’t be a problem. You are right about doors, I’ve never thought it could be such a problem to find a solution that would meet all my requirements. Last time an architect was trying to persuade me it doesn’t matter if the button is placed quite far away from doors and not along the path, because it “fits there so nicely”. 

Thank you so much for your thoughtful answer! I’ll definitely try to incorporate these ideas. ",,,3,0,0,
5eb4f6c4-fe33-4386-8f8c-72a7571b2877,1504792086,"Height adjustable desks? Or just desks with a higher surface than normal, so it is high enough to get your knees under it as a lot of desks seem to be slightly too low :) ",,,1,0,0,
948a8310-ebe4-47de-bcf8-6f491ecaf656,1506231825,Look to your local Center for Independent Living. They can help.,,,1,0,0,
356c0d6e-4130-4610-82c5-8b301f25d929,1504660329,"I'm in the USA. Washington State, specifically. I've been told (although it's been a while) that we're not one of the better states for it.",,,2,0,0,
b98b5c96-93d0-4d74-afe6-381284259604,1504596533,I guess step one would be to figure out what systems or programs are available where you are that might be able to help out. What country do you live in?,,,3,0,0,
e5006bf8-e29c-4027-bf22-56989878178b,1504773454,I'd also like to add speak to an OT. This is their game.,,,2,0,0,
8b8c02fb-6ca4-47eb-9547-dd8e9d31389b,1505309074,This might help as well! [Self Directed Care in Washington State](https://washingtoncommunitylivingconnections.org/consumer/pdf/Self-Directed_Care.pdf),,,1,0,0,
d45e850c-e657-40b2-a4ee-ab32905b76c2,1504576000,"I understand where you are coming from as I'm in a similar situation with my folks pushing 70. This question feels like its more about how to pay for people to provide the needed care or find assistance for that.

I don't usually talk about my future, as that usually is very morbid, so I'll enjoy whay I have when I have it because whats coming for me is inevitable.

Winning the lottery would fix our problems though :D",,,2,0,0,
8b8c02fb-6ca4-47eb-9547-dd8e9d31389b,1504799067,"Hey! Also early 30s here and started living independently about 4 years ago. I found that planning for care when living on my own was the single most important thing for me. 

[This is aimed at folks younger than us](http://www.ncwd-youth.info/sites/default/files/pas-toolkit-052610-print-final.pdf) but it helped me a lot in my transition. 

There are a fair number of resources for teenagers transitioning to college that talk about how to move towards living on your own. They're easily applicable to any age making a similar move away from living with family. Might be some helpful key words for you to google. ",,,2,0,0,
b98b5c96-93d0-4d74-afe6-381284259604,1504937529,"It might be worth getting in touch with one of the advocacy organisations listed here: [link]
(http://www.wsdot.gov/NR/rdonlyres/0C1029BF-1F39-4893-B14C-6E8A117D9362/0/DisabilityAdvocacyGroupsWA.pdf)

Not knowing your personal circumstances, I couldn't say which would be the best fit- but advocacy groups tend to be a good place to start if you're looking to find out what's available in your region :)",,,1,0,0,
29b74165-3f7c-46f4-aa2c-115550446f31,1506231828,"_Look to your local_

_Center for Independent_

_Living. They can help._


&amp;nbsp;


&amp;nbsp;&amp;nbsp;&amp;nbsp;&amp;nbsp;&amp;nbsp;&amp;nbsp;&amp;nbsp;&amp;nbsp;&amp;nbsp;&amp;nbsp;&amp;nbsp;&amp;nbsp;&amp;nbsp;&amp;nbsp;&amp;nbsp;&amp;nbsp;&amp;nbsp; ^- ^Nickia1


------------------------------
^^I'm ^^a ^^bot ^^made ^^by ^^/u/82901f14-402a-465b-9395-eb2f683345b2. ^^I ^^detect ^^haiku.",,,1,0,0,
356c0d6e-4130-4610-82c5-8b301f25d929,1504587680,"Well…yes and no.

At least right now, for me, the question *is* more about planning/organization/management than it is about paying. I'm fortunate enough to be in a position of fair financial independence, thanks to the fact that I'm finishing up my graduate studies without any student debt, and will be transitioning to the workforce after that. So on the one hand, it's a boon to not have to manage all of this through the constraints of government support programs.

But on the other, I get the sense that it's almost *harder* this way, since so many providers are set up to assume that's what clients are doing.",,,1,0,0,
7060282f-0160-44fe-9cd8-611fe2b7dc02,1504568756,Hey dude congrats on taking the first steps. Definitely go to you local Center for independence. Just type in SILC  of (your state) then follow to your area. I my self just moved from college to a new apartment. ,,,7,0,0,
356c0d6e-4130-4610-82c5-8b301f25d929,1505160530,"Wow, that's actually a super useful document with a ton of consolidated information. Thanks!",,,1,0,0,
0ddb56dc-e1a9-4313-a035-963ae97406e0,1504735404,That should be doable when I get my tablet pen replaced! Thanks for responding.,,,1,0,0,
8678158d-3ddc-4920-ac29-98f574855a46,1504734297,"Honestly no, but I use ""handicapped"" regularly, ""cripple"" sarcastically, and ""disabled"" formally. So I guess I'm outside your niche.",,,3,0,0,
0ddb56dc-e1a9-4313-a035-963ae97406e0,1504735545,"That's okay. It's a tiny niche, not much room in there ;) But thank you for responding!",,,1,0,0,
be8e6b44-ea50-4734-bf04-1a81cc30f559,1504977825,"Your comment was automatically removed because you linked to reddit without using the ""no-participation"" np. domain. Reddit links should be of the form ""np.reddit.com"" or ""np.redd.it""

*I am a bot, and this action was performed automatically. Please [contact the moderators of this subreddit](/message/compose/?to=/r/disability) if you have any questions or concerns.*",,,1,0,0,moderator
d8b83b2a-4d08-4d92-8787-c3c4250e4c12,1504740845,"I love the idea of creating a fun shirt for people with disabilities.  If someone saw me with a ""cripple"" shirt, I'd lose a ton of respect.  

Where I live, cripple and crips are the negative labels for any people who were institutionalized because of disabilities as kids and then those institutions closed in the mid-1990s.  People who lived in these institutions may have had Down Syndrome or have been nonverbal or used a wheelchair.  I get frustrated but for me, I'm stuck with the label PWD.

Keep at it!!",,,6,0,0,
961c387f-4c99-4aea-b62b-a160493a428d,1504736172,I wouldn't wear it. ,,,6,0,0,
7060282f-0160-44fe-9cd8-611fe2b7dc02,1504801845,"Yep! I been rolling on my 24"" wheels all my life! I was the OG crip :D ",,,1,0,0,
8678158d-3ddc-4920-ac29-98f574855a46,1504772974,"I love your attitude :) FWIW if you made a shirt that says ""not disabled, just handicapped"" I might seriously consider buying it, but I'm admittedly really wary about wearing shirts that spark conversation... That, and I suspect it would be even less popular :P",,,2,0,0,
24e858b2-9684-4c1f-be9c-bf6f23426101,1504977809,Have you heard of the Cripple Punk movement? [It's basically a movement for physically disabled folks that are tired of society's expectations of the disabled](http://www.urbandictionary.com/define.php?term=Cripple%20Punk&amp;amp=true),,,2,0,0,
7060282f-0160-44fe-9cd8-611fe2b7dc02,1504732471,I would love to wear that shirt but instead of cripple could you just put CRIP? I'm not a big fan of cripple the word I would rather use Crip it sounds better and make me sound gangster ��♿️,,,2,0,0,
7585984f-c186-4d5f-a5b1-d87115571677,1504726713,"I like the concept, but not the font/ambiance of it.",,,6,0,0,
0ddb56dc-e1a9-4313-a035-963ae97406e0,1504735473,"Glad you like it! Are you sure you'd want to wear ""Crip""? It's my understanding that that could get you shot dead! ;)",,,1,0,0,
6be7e826-bf78-44c3-9011-d80b6993cca7,1504888836,No. Cripple is an offensive term to me and probably everyone I know. ,,,1,0,0,
0ddb56dc-e1a9-4313-a035-963ae97406e0,1504730565,Thanks for responding! I'm glad you like the idea. The finished product will be better; I had to do this one by hand and take a photo because I'm waiting for a replacement pen for my artist tablet. Technology is amazing. ,,,1,0,0,
df264261-4169-405b-a42a-8fe78da11f12,1504732972,"Would rise to the level of ""mildly interesting"" with some decent artwork.",,,3,0,0,
431fb2c7-cdf0-49a7-9616-62cdfab3f6a7,1504798368,"The US government website O*Net is actually pretty darn useful all things considered.

You can take a free career personality test [here](https://www.mynextmove.org/explore/ip).

Once you get your results, you can see a list of jobs that fit that type, sorted by how much education you need to pursue them.  For each job, you can look at a detailed list of the job requirements, so you can see which ones require fast processing.

(By the way, if you're a social sort, consider working as a personal care aide or 1:1 support professional for developmentally disabled or elderly adults.  Very rewarding and you don't really have to go that fast.)",,,1,0,0,
40c9159f-c8e9-4f70-a60e-e105b03f5224,1504745548,"Hmm. I have a few suggestions based on your strengths and interests. First, you could look again to some bigger employers like Costco, though it sounds like Walmart was not a good fit... I have found they mostly do tend to have a bit better grasp of individual employee needs and don't typically appear as ""trigger happy"" to terminate people based on ""speed of production"" issues.

Second, you may want to consider how you approach your interview process. You could consider disclosing some of your weakness, while also highlighting your great strengths. It's a tough subject to breach, but disclosing can start a good foundation to the relationship if it's the right employer.",,,1,0,0,
4f6e2d84-feeb-4997-b521-0e1acfd7a235,1504744189,"Heya thank you for replying I appreciate it :) 

I do live in the U.S. I'm in Middle Tennessee and unfortunately the career center in my area doesn't seem equipped to deal with my tyoe of disability and sometimes I got the feeling they thought I was either just lazy or ""dumb"". Vocational rehab seems to be a better option but I also been told to not count on them too much due to inadequate funding ",,,1,0,0,
5f84140a-4f18-4f44-ba02-e4f717c89928,1506742306,Advertise your strengths on a local job board . They are tons of small businesses that would love someone organized and willing to take their time packing and pull items. Speed is not a huge issue with smaller businesses.,,,1,0,0,
65eb3d01-3c5f-4f46-bbd9-7f98ef92e763,1504794652,"Each state's Voc Rehab is a bit different (depending on staffing and funding) but they are still worth checking out. 

A lot of people dislike VR, but sometimes those feelings come from their expectations rather than problems with the system itself. Don't' get me wrong, the system isn't great, but VR does work for a lot of people. Some think VR is there to land them their dream job, or pay for expensive schooling. VR exists to help people gain skills and find them a job, even if its something they may not love. 

You are actually the perfect type of person for VR. You don't need a lot of expensive accommodations or assistance. You just need someone to help you find a good fitting job and getting your foot in the door somewhere. The companies that already work with VR show a willingness to take on people that might need a bit of extra help.


",,,2,0,0,
1cc994f1-2ae5-47ce-b4bc-75632be4d1e5,1504756574,Tell us a bit about yourself - would make it easier to see where common interests lie.  ,,,5,0,0,
5eaa9282-6c5f-4546-b8e6-7e992a5a717f,1504839833,I take credit for your future friendship x,,,2,0,0,
b6d6f1e3-e2f6-480e-abc1-76ea7fa1113d,1504848974,"You might have to explain a bit more about art swaps since I've never done them. But it sounds like fun, I'm trying to be a bit more social since I don't get out very much other than to go to therapy. ",,,1,0,0,
d4813c8e-eb4c-4160-9f37-ef67f465e1e8,1504792002,"Hey, I'm 33/F, and I've been pretty lonely lately. What's up? ",,,2,0,0,
5eaa9282-6c5f-4546-b8e6-7e992a5a717f,1504839681,"I have tried pen pals, couldn't find anyone that fit. Yet!",,,1,0,0,
bc83942e-59b3-4c09-8671-15b514d00400,1504808355,"Also 33/F, and I just had to tell you I love your username.  I used to love that show, man.",,,2,0,0,
5eaa9282-6c5f-4546-b8e6-7e992a5a717f,1504769136,I've watched it through with an ex. It is pretty good.,,,4,0,0,
5eb4f6c4-fe33-4386-8f8c-72a7571b2877,1504790697,"Sorry OP not trying to thread jack but hey dis_ABLED, I'm in Brisbane and became a bilateral bka last year - I go to a local support group but I'm the youngest there by about 30 years, what state are you in?",,,1,0,0,
bc83942e-59b3-4c09-8671-15b514d00400,1504812216,"Not much!  Sitting at home, watching some old episodes of Top Chef.  Hope you're doing well!",,,1,0,0,
bc83942e-59b3-4c09-8671-15b514d00400,1504813876,"Enh, sounds rough to me (I struggle with walks long distances, myself).  I have been lazy today, I admit.",,,1,0,0,
d45e850c-e657-40b2-a4ee-ab32905b76c2,1505010621,"&gt; I don't get out very much other than to go to therapy. 

I  found I looked forward to Therapy just for the chance to interact.
",,,1,0,0,
b8678d6a-f4dd-4cdf-b45f-740beeae0692,1504749151,How can we assist?,,,4,0,0,
853ef473-e920-4513-8dc4-00e00ce61f32,1504750695,"Do you have any hobbies or interests? Maybe making some internet friends might help (if you are housebound like some of us are)--join forums, start a blog, join social media, interact here on reddit with folks",,,4,0,0,
948f5be7-0b73-435b-950f-7397edd9b15b,1504801548,Yeah.  Seems like for us it'll most be really windy rain.  Hope it stays that way,,,1,0,0,
e5006bf8-e29c-4027-bf22-56989878178b,1504772684,Happy to be a friend. M 37 from australia. Tell me a bi about yourself,,,2,0,0,
948f5be7-0b73-435b-950f-7397edd9b15b,1504795657,I live in Florida.  Getting ready for irma.,,,1,0,0,
d4813c8e-eb4c-4160-9f37-ef67f465e1e8,1504813450,"Eh, I'm hanging in there. Just got back from a walk. ",,,1,0,0,
5eaa9282-6c5f-4546-b8e6-7e992a5a717f,1504840014,"Design nerd. DIY nerd. Regular nerd. Pink haired and pierced nerds. Rabbit nerd.
I guess you could say I'm a nerd?",,,1,0,0,
d4813c8e-eb4c-4160-9f37-ef67f465e1e8,1504809866,"Hey, what's up? Good to hear from u Reddit stranger. :) ",,,1,0,0,
c3cd2274-b966-4c57-8144-82aec57ad73e,1504767427,"Hi there! There's a whole crew of us here for you. I hope you're doing ok. 

Totally random topic, but I was on another sub just before, a really friendly place called /r/CasualConversation and someone ha brought up an old TV show I absolute adore called ""Avatar the Last Airbender"". It's a cartoon, but not just for kids. If you're feeling down, it's a really uplifting show. Highly recommended.",,,4,0,0,
bc83942e-59b3-4c09-8671-15b514d00400,1504808191,Fellow Harry Potter fan!  I'm a Hufflepuff wannabe Quidditch player!,,,1,0,0,
5eaa9282-6c5f-4546-b8e6-7e992a5a717f,1504793095,"So many kind hearts. I'm a bit of a nerd, getting married in January and am into art and design.",,,1,0,0,
bc83942e-59b3-4c09-8671-15b514d00400,1504808129,"Hello, OP!  I'm a bit older than you (I'm almost 34, F, and have multiple disabilities), but something that has helped me is going on /r/penpals and meeting people.  You can find all sorts of people, and it doesn't matter what disabilities you do/don't have, there's all sorts of people.  I hope that helps.",,,3,0,0,
948f5be7-0b73-435b-950f-7397edd9b15b,1504795718,"Nice.  Good luck with 40k.  I like painting the miniatures, but found the game to mostly be comprised of arguing about the rules lol ",,,2,0,0,
5eaa9282-6c5f-4546-b8e6-7e992a5a717f,1504841791,"I just re read and realised we may have something else in common, a bit more rainbowy.",,,1,0,0,
b6d6f1e3-e2f6-480e-abc1-76ea7fa1113d,1504840968,"Hi, I'm a little late to this post. I'm 30, F and also have a few more disabilities than I expected to have - I was in an accident and ended up with a a crushed leg (looking into a left bka right now) and a traumatic brain injury (memory loss, seizures, and all other 'fun' things). I too am really nerdy but I've embraced it, I've been working on my art skills lately which are mostly just drawing and watercolor painting. My wife however is a web and graphic designer, so a little bit may have rubbed off on me.",,,1,0,0,
c3cd2274-b966-4c57-8144-82aec57ad73e,1504845614,"PM me if you want a pen pal or a snack swap pal! I'd be happy to share post cards or letters, or packages. ",,,2,0,0,
c3cd2274-b966-4c57-8144-82aec57ad73e,1504794913,"I'm curious what you're looking for in this thread? Are you looking for someone to talk to online, someone to meetup with in person? etc... ",,,2,0,0,
bc83942e-59b3-4c09-8671-15b514d00400,1504808230,My husband plays 40k!  It's loads of fun to a lot of our local friends.,,,2,0,0,
765c1124-82bd-47e9-b32c-cb5e0dae6e43,1504826179,"I am in central too. Not really worried about it outside of what damage the fallen tree limbs will do. If your close to Gainesville let me know, we could meet up and nerd out.",,,1,0,0,
5eaa9282-6c5f-4546-b8e6-7e992a5a717f,1504841502,"Even though my disabilities are in my head and heart, I feel like we have things in common - art/design.
Would you be interested in doing motivational/friendly art swaps?",,,1,0,0,
948f5be7-0b73-435b-950f-7397edd9b15b,1504787282,"I'm down for meeting new friends.  Fair warning, I'm a 37 year old dad.  I'm also a nerd ass nerd and I'm full of lovely dad jokes if that's your thing.

  I understand what it's like to be very disabled.  I'm a double amputee (no legs) and I live with moderate adhd.  We might be quite different in age, and maybe interests, but I'm willing to bet we share common ground in facing challenges.

  I'm always up for meeting new friends.  I like knowing folks with different perspectives and backgrounds too.  If you ever want an understanding ear, feel free to message me.",,,2,0,0,
5eaa9282-6c5f-4546-b8e6-7e992a5a717f,1504788316,"I am certainly in denial about my nerdyness. My fiance and I are playing Magic on the loungeroom floor now. He is going to teach me 40k after semester break.
I get on better with people older or younger than me anyway.",,,2,0,0,
2a16f365-5a5e-4b23-bcca-d826c28b6664,1504747038,You ok,,,4,0,0,
31fb8cfc-fcc7-4fbd-8b39-7fff81423919,1504748203,What assistance can this internet stranger provide?,,,2,0,0,
e038a184-d3ea-496f-9f65-20567dafebfe,1504801585,"Great tip about the mop thanks, I'm sure we have that brand here. You have reminded me I had one similar years ago but I never found a replacement. 

I tried the little boards! I bought one first because I thought it was cute. But I found them too small for school shirts, trousers etc. I think my hand control is too poor for anything other than a full size, I just burn myself despite my best efforts.

Unfortunately my house is just too small for a commode style chair, that's really what I want but there's nowhere to put it that isn't in front of a cupboard or door. I have a small house and messy people stay in it! Thanks so much for your suggestions though, I'll definitely look for the Velida mop. ",,,2,0,0,
8aaaf1ae-a2d6-4d0e-a269-863c6a9eac85,1504815330,"I'm not permanently in a wheelchair but when I was for a while after surgery, I just bought a boat chair and set it in the shower and climbed in and out, making sure that I was dry before getting back into the wheelchair ",,,1,0,0,
5eb4f6c4-fe33-4386-8f8c-72a7571b2877,1504793607,"Cleaning - I have a Velida mop, the handle length can be adjusted. You twist it one way so it is loosened and then twist it the other way to keep it at the length you want. 

As far as ironing boards go you can get small ones with little short legs that are designed for you to sit them on a table and use them - I know IKEA have them and possibly department stores like Walmart might? (no idea, I'm not in the US). Grab yourself one of those and put it on a coffee table so its at a comfortable height for you.

I have a separate bathroom wheelchair, one of the commode style ones but with normal size wheels so you can push yourself around in it. It just sits in the corner of my room out of the way when I'm not actively using it.",,,3,0,0,
