commentator_id,created_utc,anonymized_body,ups,downs,score,controversiality,gilded,distinguished
ca2d5ddf-11bc-4597-abb5-d3f7ae707019,1489379403,"I don't know anything about the Gorsuch case but I came from a state that offered waivers.   Most parents still had to send their kids to public schools because the waivers only covered a fraction of the cost.   Public schools are funded based on the number of students  so if public school enrollment drops so does their funding.   School overhead costs won't drop so there will be less funds per student.    

Add into this Medicaid cuts.   Many kids that have 504's or IEP's consume medical services while in school and the school in turn can bill Medicaid.   Schools that have a high number of ESE and 504 students will lose funding in both directions.   Our schools are already underfunded.   

My son attends a dedicated ESE public school dedicated to all students who cannot be mainstreamed into a regular education environment.  Every year my son's school has to have two major charity events just to make up for funding short falls charity golf tournament and a motorcycle fundraising event.   This administration very well may bankrupt schools like my son's unless they cut back on essentials like nurses or therapists or equipment.    Hey, I guess we don't have to worry about legal repercussions.  They will simply legally cover up the lack of services by weakening or removing important legal protections for children by chiseling away at IDEA and EPSDT.    ",,,2,0,0,
65eb3d01-3c5f-4f46-bbd9-7f98ef92e763,1488725770,"The doctors that contract with SSA are paid to give us some observations and exam findings. They don't make the disability determination, and so it's not their job to ""debunk"" your diagnosis. They can say whether exam findings are consistent (i.e. If you allege fibromyalgia and have 0/18 trigger on exam they will make a comment), but they don't diagnose/undiagnose. 

As with all providers, each CE doctor is different. Some are attentive, others aren't. They don't treat you like a normal patient because you aren't (a lot of people can't make that distinction). That being said, if you really do have issues with the doctor, you can call the DDS and ask to seek to their PRO (professional relations officer). They can't really do anything about your specific case but they do log all the complaints in a file. In certain cases they will contact the doctor to get their side of the story (after their report is submitted). Otherwise if a doctor gets enough complaints, the DDS will stop using them if possible. Some areas have a lack of doctors, so sometimes they are stuck with bad doctors. ",,,2,0,0,
6a622408-814c-4bb2-957f-c7d057acf099,1488647165,I drive with the Spacedrive 2 system (two joysticks). I use a power wheelchair and I think it actually helped. It definitely helped me with spacial awareness ,,,1,0,0,
2165338b-9864-4f67-9889-f37d62f75ae0,1488739421,"Yeah... It was weird being told I was so smart, and feeling so stupid consistently. Youngest kid in a talented and gifted program, as well as having 3 standard deviation variation in IQ sub scores. ""Math Sucks"" by Jimmy Buffet is my anthem. ",,,1,0,0,
2165338b-9864-4f67-9889-f37d62f75ae0,1489758826,"What part of ""it was only being done because it cost nothing"" is so hard to understand.",,,2,0,0,
d332a2f3-d3ab-427c-9403-0e0a72bcede6,1489600418,"We will see how this goes, I'm going back to school , hopefully this fall. I may end up not doing this too",,,1,0,0,
bc83942e-59b3-4c09-8671-15b514d00400,1490284108,"Oh man, I have been there.  I'm in the opposite spot where I am overweight and feel literally and metaphorically weighed down by it.  I'd love to be able to just walk normally like I used to - to be able to stroll leisurely through a store without getting tired or sore or winded.  My physical limitations are preventing me from being able to do things outside the house, so I just stay at home, which makes me depression worse.  It really is a vicious cycle.  I hate it.",,,3,0,0,
4cd701f7-cdd0-4ed4-8fad-067623073d3a,1490639639,Love that ending! :),,,3,0,0,
65eb3d01-3c5f-4f46-bbd9-7f98ef92e763,1489406114,"I sent you a PM, but you also may want to try cross-posting to /r/SocialSecurity

That sub is *mostly* SSA employees that do the Field Office side of things, but I know there are a few DDS examiners that lurk around there. ",,,1,0,0,
92338401-4c21-40e9-9544-2873f6d9551b,1490738816,"It was fun. DEFINITLy. But the lines were miserable. And once I had to wait 10-15 minutes in the heat my day was completly killed just because heat bothers me.
I think there were only two rides that I rode that had any kind of wait really since the rosy were staying at we got express passes with our hotel room. But the lines for all of the HP rides were insane I didn't ride anything but the hogwarts express there. We rode it once early in the morning before it was packed and then we rode it in the afternoon just to get back to the exit without me having to walk a few miles when I was already doing the weird side to side rocking I start to do wen j get too hot.(I look drunk when u get too hot apparently.) and it was. 20 minute wait which I almaot passed out from standing in the heat that long so...",,,1,0,0,
ef75167f-c775-4423-b9d9-98af1e19beca,1488549286,"Did you travel solo?
Central and Western Europe was mostly accessible from what we saw.  There were some places however, that would be damned near impossible to navigate in a wheelchair though.  A lot of the old towns have super narrow, hilly and bumpy streets.  Though my friend's blind we take note of how it could be difficult to people with other disabilities too.  Our hostel in Lisbon for example, would've been impossible to get to without taking a cab.  Kinda screws up your trip if you're on a budget.
Where to next? Like I said, if you come to Toronto we'd be interested in a meet up!",,,1,0,0,
962bc8ef-23eb-429d-bec6-b55a57f46549,1488991697,"""My legs dont work, Why are you wearing that funny shirt?",,,3,0,0,
5ed0fe9d-0c1f-4df4-b0d9-91890592ea16,1489011794,"Wow sorry you had to go through that!! 

Medicaid was what saved me though. I cannot work, am on SSI which is $500 a month. I saw my therapist twice month which would run me about $300 a month without insurance.  Psychiatrist was if I remember correctly(this was the first one I had, only took primary)$100 and that was with the deductible met. ",,,1,0,0,
92338401-4c21-40e9-9544-2873f6d9551b,1490801060,Oh well. I can just have pets if I want to. I already have 4.,,,1,0,0,
4d8f5eb0-bf81-48df-a2c4-4d63e10c6b94,1488583271,"It's automatic, I thought I was going to lose Medicaid when I got a job that cancelled out SSI. Nope, I got a letter that they'd keep me on Medicaid via 1619b. My county only cares that I've got SSI status, beyond that it's between me and SSA. ",,,1,0,0,
6ef2492b-4a72-4170-a246-0d3f3c11855a,1488583918,"Yes, it can be anyone, just make sure you have a person with you so you have a witness.

As far as I know, I don't think anything happened with the complaint, It was probably filed with all the rest. I was told that if a doctor gets enough complaints the government will stop sending patients to that doctor. I have no idea how many complaints are required though. :/",,,2,0,0,
e4ae2e55-aa8b-422a-8768-c69a02f5140b,1488342085,Thanks! I'll look into whether or not Louisiana has those.,,,1,0,0,
28bd916f-f773-4af6-b115-ec219e094f89,1488699537,"One person on the French post mentioned not being treated like a 'prince' and that line really stood out to me. People here in America try to go out of their way for me. An uber driver tried to buckle my seatbelt, a women grabbed my arm and tried to help me onto the bus, etc. I'm legally blind and use a cane and somehow that translates into being helpless. 

Anyway, in France that didn't happen. People were polite but there was no one falling over themselves to try to 'assist' me. Dressing a certain way in certain districts in Paris was definitely a thing, but I would assume that on vacation people would judge others' clothing less.  

My mom always said the only way to know if someone is still staring at you is if you are staring at them. Maybe you all got caught in a staring loop? ",,,3,0,0,
c4700850-875b-465c-b50e-e8b77c12c8f6,1488955117,"Kids will accept any simplified reason. ""My legs don't work well"", ""it hurts for me to walk"", ""I get dizzy from standing up"", whatever the reason is, they're most likely just going to say ""oh, okay!"" and move on.",,,9,0,0,
62e020e8-8019-4a69-b7b3-a39c66de44d2,1488724763,"I have Pfeiffer Syndrome.  I do not have a list together yet but I do have my gaming profile as a resume so to speak. PlayStation would be system of choice, but I find Xbox to be easier in terms of point system. I have PlayStation and 360 right now, what system do u play on Socialist Butterfly?",,,2,0,0,
cc965ec5-10e8-4e8b-97f5-24453009852d,1490023369,"I think for me, when I learned to accept the ignorance of others, I really developed a healthy perspective regarding my paraplegia. Every once in a while, the frustration breaks through, but I'm much more patient and forgiving than I used to be. 

So many of our barriers are social. I don't want to help lay thicker bricks, you know?

Keep writing! It's helped me mucho, and is now what I do professionally. ",,,2,0,0,
ef75167f-c775-4423-b9d9-98af1e19beca,1488821534,"Paris definitely differs from the rest of the country.  Though, it's definitely not my favourite place in the country, I still think it gets a bad rep.  We spent most of our time in Marseille and Lyon.  Two fantastic cities that I can highly recommend. I've sent him the link to this thread so we'll see if he answers.  For the time being though, he did a video talking about accessibility and mentality in Portugal in one of our videos.  A lot of the streets in Portugal were similar to Southern France so this may be helpful to you: https://www.youtube.com/watch?v=irqtABkVM1A&amp;list=PLClFsbZvL0EDc4DoEDuZ-k-8P5W281iGr&amp;index=3 

As for the grabbing thing, as long as they spoke French, yes he could communicate well enough but sometimes it just happened so quickly.  One time I remember it happening when we were trying to figure out the buses... If you ever go to Morocco, know that bus stations are madness.  One guy who spoke English decided to help us and basically handed us off to another guy who then disappeared.  We waiting around for him and while he was gone some body else grabbed my friend - either trying to help us or to get our bus money for himself.  We didn't move said that we were okay and luckily the first guy showed up shortly thereafter.  He also grabbed my friend by the arm and guided him to the bus.  I think because it was a rather stressful situation and it happened so quickly, he didn't really have time to question it or tell him to stop.  In the end he was helpful but rather aggressive and may have only been doing it for the expected tip - which we gave him. ",,,1,0,0,
3ccea275-e5f8-4eab-94f5-4709d1687781,1488662501,"Ask politely if you can help with the door.

I always appreciate it when people offer to help. Even before I was disabled I appreciated people holding doors for me. It is just a matter of being polite.

Yes, your boss is partially correct about some things. Never push someone's wheelchair without first offering. If someone falls, don't grab them but offer to help them get up.

But opening doors -  when two able people approach a door, one opens it for the other. When you see that someone is approaching a door with their hands full, pushing a baby stroller, or pushing a cart full of boxes, it is certainly appropriate to get up and open the door.

Those of us in wheelchairs, like able people, appreciate courtesy and helpfulness.",,,2,0,0,
664e4021-a6d0-4099-8324-0690edaeb69a,1489399150,My group home is my payee.  Honestly it is a relief to not have to deal with it.,,,4,0,0,
d0d4be64-a550-443e-ac4b-255d418ab00c,1490727587,That's not what I suggested really...,,,2,0,0,
c381a2a1-8eb4-4f49-bd7b-ae1d8f7011de,1490731137,That sounds like so much fun. I've never been to an amusement park like that before. :),,,1,0,0,
e331d1f6-573c-45e2-8990-cd3aa0f194a0,1489080001,"Right. That makes it sound like your administrative review has already been denied. Have you ever responded to any other letters sent by SSA? Or perhaps the review is triggered automatically in your state. There's no way for me to really be sure, but it sounds like you're heading into your final appeal before the ALJ.

Generally speaking, the process is 

1) Apply for Disability, 
2) G notice that you've been refused, 
3) File an appeal for Administrative Review, 
4) Denied after review, 
5) File an appeal for a hearing before the ALJ, 
6) Go to court and plead case before ALJ, 
7) Final decision made.

It's also important to note here that I am neither a disability lawyer, nor an SSA employee. I've just been through the process and have helped a number of other people with theirs. I can only tell you things based on my experience, and it's always wise to get advice from more than one person.

That being said, my advice would be to start calling lawyers immediately. Ideally, you'd like to find one sympathetic to you who is willing to meet with you immediately, and have their paralegal file the appropriate paperwork for you prior to that deadline. The reason it's important is because of that 200-word summary there -- you want to make sure the right words are included, and the lawyer will know what needs to be said.

You absolutely want a *local* attorney, not a national one. Local attorneys know the people in the SSA offices, and generally know the judge you'll be seeing quite well. It is always an advantage, but more so when you are on as tight of a timeline as you are, since knowing the staff can sometimes provide wiggle room.

If that is too much work/you can't get out (many lawyers will do this consult over the phone if needed)/some other reason it won't work today or tomorrow, then you need to fill out that form yourself and send it in. Make those 200-words your best as to why you can't work; you need to directly contradict their assertion that there isn't enough evidence that you can't work. If you need an idea on what to write, read every page on the [SSDRC website](http://www.ssdrc.com), and pay special attention to the pages related to filing appeals and about your state. That should give you a good idea of what you need to say there.

Make sure you get that submitted before the deadline. I cannot stress that enough. If you miss the deadline you're in for a world of frustration, since you'll have to start over from step 1.

After you get that submitted, immediately start looking for a lawyer. You're at the point where you need one badly. You absolutely cannot walk in front of that ALJ without one. The approval rate without one is something like 40%, but approval rates for those with representation jumps up to 65%+. And once that decision has been made, either way you're done.

~~~~

tl;dr: Ideally you need to try to find a reputable attorney who will meet with you early tomorrow morning, or who is willing to do it by phone this evening. They're going to want to hear all the details, and they'll want all the documentation you have and gave the SSA. Make sure they know the deadline you're on, and specifically ask them to call you once they've submitted that form.

If that doesn't work out, make sure you read up on that site, write your appeal, and get it submitted all before your deadline. As soon as you have submitted it, start the process of finding a lawyer.


**Edit:** In case it wasn't clear, you *absolutely* want to appear at that hearing. Make sure you check that box, and not the one that lets them decide based on evidence already submitted.

**Edit 2:** /u/ceb4f910-6872-4787-9983-f99ec0c6056b Here is the main SSDRC page for [California](http://www.ssdrc.com/state-california-ca-getting-started.html) since it was more difficult to find than I thought it was. However, it doesn't link out to all the other ones, so to find them all make sure you use Google and search the following term: `California site:www.ssdrc.com`",,,1,0,0,
cfee7a52-b6e9-4940-841c-14839582aec7,1490213609,In 'relationship to person' you missed a pretty major category: Partner/Spouse,,,3,0,0,
2165338b-9864-4f67-9889-f37d62f75ae0,1489781385,"Where on earth did I say captions are bad? Oh, that's right. No where.  You put that argument into my mouth to avoid saying ""Yes, this opinion and complaint will cast the ADA in a bad light to people that don't live with disabilities"". 

This is the kind of ""common sensibility outrage"" that opens the way for conservative reforms. 

Edit: see wellfare reform, environmental regulation rollback, right to work, etc. etc. etc.",,,3,0,0,
d0d4be64-a550-443e-ac4b-255d418ab00c,1489788333,"&gt;But unless you're a lawyer, being legally correct isn't the same as what is actually just. 

I am not a lawyer, I literally get paid to make interpretations like this. While I am  not going to prove my identity here, I will say at work if this was brought to me, I would say something like 

&gt; caption the video because it is the law. I am sorry you didn't budget or plan. I will allow you to post the video as is, with a transcript, but you must get a captioned version up in 2 weeks. Here is a vendor that can do captioning for ~$100 in 2-3 days. All videos after this must be captioned or will be taken down. If the video cannot be captioned, you must notify us as early as possible with a justification. My office reserves the right to take the video down if a captioned video is not in the place of the current one in two weeks.

You said
&gt; remove uncaptioned videos posted by their institutions or face the prospect of damages for offering knowledge freely on youtube

Good. It is not a novel concept that laws like the ADA apply to digital content. It isn't NAD's fault CU chose to ignore the law. You are seeming to be leaning towards educating the people should be more important than the two guys at GU. Laws like this are made to grant equal access, and  it is the responsibility of the groups that a law applies to in meeting it. It is simple as that. As mentioned money is not a justification, though there is [undue buren](https://www.ada.gov/reachingout/l2factors.html). You pointed out how UC has been struggling with budget, see factor 4:

&gt; (4) If applicable, the overall financial resources of any parent corporation or entity; the overall size of the parent corporation or entity with respect to the number of its employees; the number, type, and location of its facilities; and

So, UC Berkley would need to argue that captioning the videos, would force the entire UC system to shut down. I didn't look too hard, but UC's budget was $22.5 *billion* in 2011-12. It would cost the system $3.6 million to caption all 20,000 videos - assuming that the average video is an hour, and the cost to caption is $3/min. Like I said, they could go to a caption company and probably get a discount.",,,1,0,0,
7936027c-69ba-4b96-8383-59ab09c2f76f,1490999691,"Thanks for the reply, it looks like I'll have to wait until my dad retires to do anything  differently from what I'm already getting. My mom has never worked. It will probably be a while before my dad retires but I am curious. If when he does I'm still in this situation and I apply would it effect how much he gets? I will be updating want to take his money or anything. 

I do live in a place that is 30%of my income but I can't have kids live there, not sure why exactly that is. I assumed that was the case with all places that are based on income. If not I suppose I could try to move. ",,,1,0,0,
1b75a0d3-c493-4385-9082-e6758006221d,1489800149,"I hope this is used to introduce common sense to the ADA and get rid of the shyster lawyers that go around and shake small businesses down for being 1/4"" off in a measurement.",,,1,0,0,
d45e850c-e657-40b2-a4ee-ab32905b76c2,1488849657,SSD.hopefully I'll see continued improvement in the next couple year and make all of this a moot point(unlikely but I'm working on it). ty for the feedback.,,,1,0,0,
eddfe193-4720-41c6-8ab2-e435ae281ce1,1489713967,"Yes.  Get everything you can, from as far back as you can.  Documentation is key.",,,1,0,0,
73866e75-10f8-484a-9a53-5e546de1ac5d,1490585006,You should definitely report this to your supervisor. I've been in the field for 16 years (in New York) and slapping someone's hand is not at all acceptable. That would not be in a behavior plan or part of any intervention program/training. ,,,3,0,0,
9d1852eb-4755-46a2-80c1-74dc93bd3701,1488859864,"&gt; The outside arm does not raise/lower so I that may or may not prove to be a challenge in getting in/out of the seat from the transfer chair.

Also, I forgot to mention.  Thanks for this warning.  I totally did not know that.  I handle transfers from my wheelchair pretty well most of the time so I think I should be ok.  I hope the armrests aren't too long though.  My legs are both high above the knee so I guess I could just go over the armrest if I need to? lol",,,1,0,0,
3fd4c6cc-1556-46f4-bc91-f4169d6799f7,1488860029,"I cannot for the life of me find the ACTUAL website, there doesn't appear to be a link to it in that article, can someone link me plz!? Thx!",,,1,0,0,
664e4021-a6d0-4099-8324-0690edaeb69a,1488944131,I think they just pay you back to when you first applied?,,,1,0,0,
875b0aa9-0637-4529-bfc8-1b52f49c2c4e,1488945733,It's a disabiluty of mental illness. Mental illness is being unable to provide the expected necessity of life for the future due mental process.,,,2,0,0,
1a37967a-86e1-4963-8431-6d95bf91dfe4,1488343537,"Yeah, that's the thing, this is really SPECIFIC to French culture from what I've experienced, I haven't gotten any such weirdness or even a start of it from anyone from Eastern or Western Europe.

The previous response about assumptions that I'm a clumsy American who got herself into a reckless scrape seems very likely to me.

Raaaaaugh, sorry about those damn well-intended pity comments; we all feel you on that I'm sure!",,,1,0,0,
f91f8843-1a81-4fa5-b7a3-e03234fd5385,1489033354,Thank you for posting this. This was very well written. ,,,3,0,0,
c52c86f1-433d-4da2-ab72-7aeb5fd35cb1,1490245784,It's like /r/prequelmemes merged with /r/shittyreactiongifs. And I mean that with tremendous regard for /r/Shittyreactiongifs. ,,,2,0,0,
aae7c254-aa01-4ce4-83ba-64398c3b7be8,1490334583,The less slope the better. I go to an university that did the absolute maximum they could get away with and the ramps kill my arms. ,,,1,0,0,
1a37967a-86e1-4963-8431-6d95bf91dfe4,1488701671,"Oh, absolutely!! Indonesia is next, we're still figuring out where, and I'm still in Malaysia, my adopted home. After living all over the US, I can safely say I feel more relaxed (um, when not crossing a street) and at home here than anywhere in the world. I recommend the island of Penang to everyone everywhere.

And I'll also add re: THE FRENCH that I know you never really know what people are thinking if they don't tell you (and, hey, sometimes even then) so it could be curiosity that just looks/feels hostile and I LOVE curiosity. I meet curious children in Malaysia all the time whom I can't converse with using words so we smile, we wave; one little girl, her father explained, wanted to shake my hand (after we exchanged eye contact and smiles), so she put her hand against mine as is custom and then she took my hand and put it on her cheek! One of the cutest, sweetest things that's ever happened to me.

Edit: And now I REALLY have to go to France which I've always wanted to do, but I want to make sure I've got a VERY solid grasp on the language; at the moment I feel far more limited by that than by my tight hamstrings or the crutches I walk with. I will arrive with no romantic visions and, as someone on the France thread said, can't remember who, save myself a ""Paris syndrome,"" that sad and endlessly fascinating temporary mental condition I'd actually just learned about.",,,1,0,0,
65eb3d01-3c5f-4f46-bbd9-7f98ef92e763,1489154790,"If you want to get good feedback, I think you need to have a system that allows for anonymity. I'm not sure the level of care your employees give, but some might be reticent to give negative feedback if they worry it might impact their care.

When I managed a community based program (we provided 1:1 24/7 care along with some 1:1 hourly services) I always found that things worked best when our clients knew who to come to with a complaint (me). I made it a point to work at least 1 shift with each of our clients each month. That way we could talk about anything without any other staff there, and they had permission to ""speak freely"" about the program, their staff, and me. That trust would carry over and they felt comfortable coming to me other times of the month with concerns.  

Now my system may not work depending on your company structure, and the number of service users. But I think the point rings true that you need a system where they feel heard, and sometimes that comes best with interpersonal interaction. ",,,2,0,0,
5ab4acb4-e4a9-4b4c-9094-04cae42cf90f,1488463410,Sending in images is useless. SSA needs a doctor's interpretation of the image for it to be of any use. ,,,1,0,0,
235aaa3c-f07b-4484-a363-704af13bc429,1488731381,1-800-799-7233 is the domestic abuse hotline. If they can't help they probably know who can,,,1,0,0,
a82bb553-721a-45e3-a70b-3284a1cb9e02,1488383530,Walmart sells a nice sturdy one with adjustable legs for about $25.,,,1,0,0,
d332a2f3-d3ab-427c-9403-0e0a72bcede6,1489596734,"Oh! Well I wanted to do something, that helped other people, that wasn't retail",,,1,0,0,
