commentator_id,created_utc,anonymized_body,ups,downs,score,controversiality,gilded,distinguished
9897ee2f-4f1f-4162-9d99-bdeb94b70095,1505354641,Known as Untermensch....https://en.m.wikipedia.org/wiki/Untermensch,,,2,0,0,
be8e6b44-ea50-4734-bf04-1a81cc30f559,1505354647,"Your comment was automatically removed because you linked to reddit without using the ""no-participation"" np. domain. Reddit links should be of the form ""np.reddit.com"" or ""np.redd.it""

*I am a bot, and this action was performed automatically. Please [contact the moderators of this subreddit](/message/compose/?to=/r/disability) if you have any questions or concerns.*",,,1,0,0,moderator
64c278e2-2bd2-43e1-88ad-d329502c4cab,1505354645,"Non-Mobile link: https://en.wikipedia.org/wiki/Untermensch
***
^HelperBot ^v1.1 ^/r/HelperBot_ ^I ^am ^a ^bot. ^Please ^message ^/u/d6696ab4-9134-491b-9209-fc7260d3828c ^with ^any ^feedback ^and/or ^hate. ^Counter: ^111163",,,1,0,0,
614ee4a4-834b-40db-bf51-d373640e0ce9,1505335681,"Yep, I've been well aware of Aktion T4 for the longest time. Unfortunately, modern society has learned from the Nazis' hubris and have adapted more covert, hands-off method in engineering our demise by setting up resources that are intentionally designed to fail, such as departments of vocational rehab, so that we may end up unemployed, broke, and desperate to be used for our disability checks and bodies enough to the point where suicide seems like the best option. Sadly I don't believe we'll ever get the quality of life that we deserve.",,,13,0,0,
28c057bc-4512-426e-a2d9-f2ec12a7045c,1506104576,"This was chronicled in Neurotribes, which is a book about the history of the diagnosis known as autism, including both the anti-vaccine saga and the autism rights movement.",,,1,0,0,
123d9b2b-2f72-4751-8cff-38e28788d835,1505363877,"I had some jerk on facebook that tried to argue LGBT people were the first.

The irony is I'm LGBT and disabled...",,,8,0,0,
cf96012f-6d90-4661-ab08-aabc4dda8b03,1505501720,"The fact that you're planning ahead means you're in a better position than most. As others have noted, your assets have nothing to do with SSDI. Of course, you cannot receive SSDI while working full time, but having high earnings now is otherwise a good thing- (1) it will look good on your application if/when you need to apply (2) your SSDI benefits will be higher if you are approved and (3) you can save some money to keep you afloat during the application period.  
There are also things you can do now to help your future case, such as going regularly to your doctor(s), following their prescribed treatment, and reporting all symptoms. Finally, you mention you have accommodations at your current job- try to get documentation of these accommodations for future use with your disability application. This is because if you are only able to work with accommodations, you are still considered disabled by SSA.",,,2,0,0,
cf96012f-6d90-4661-ab08-aabc4dda8b03,1506042614,"In some cases you can avoid an early withdrawal penalty from your 401k and/or get your student loans discharged if you are permanently disabled, but I'm not sure exactly what criteria you need to meet.    
I'm not sure I understand your last question- your employer must already know about your condition if they are giving you accommodations. Other than that, it doesn't matter if/how you bring it up, at least with regard to future SSDI applications.",,,1,0,0,
9dc93938-216e-496f-8d62-3fa03bd6005a,1505371182,your house has nothing to do with it,,,1,0,0,
b8e21c43-0c24-42fa-a603-4d4c87eac087,1505910081,"Thank you so much for the response. I don't have a ton of money saved up but I do have a significant amount in my 401k. I'll have to check into but I know if you normally take it out before you are eligible they take a huge amount out in taxes.  I'm wondering if there is a disability clause?   Same for my student loans.  I don't want to have take these drastic steps but I also need to be smart about my future because my health isn't getting better (narcolepsy has no cure).  

How/when/if ever do I bring up disability at work (outside of accommodations)?  Should I never bring it up and simply document on my own the issues I'm facing?  I want to be very careful how I approach these things.  ",,,1,0,0,
65eb3d01-3c5f-4f46-bbd9-7f98ef92e763,1505401998,"The only thing that is going to matter for SSDI is what your earned income is, and whether it is over SGA or not. You cannot be actively *working* over SGA and apply for SSDI. However, you can apply if you remain *employed* but aren't working - so situations like FMLA, STD/LTD, sick leave, unpaid leave, etc. Any income from those sources doesn't count. 

As for that interim time, you need to figure out a system of support for 2 years. Even if you feel that you have a 'slam dunk' case, there are lots of things that play into a determination and no guarantee that you'll be approved right away. From initial application through an ALJ decision takes roughly 2 years, depending on what state you're in. (and of course there is no guarantee at the ALJ level, where the approval rate is still only about 60% vs initial level of 35%)

A person can work while they are applying for SSDI, as long as that work remains under the SGA amount. Its important to remember that the SGA amount is looked at based on **gross** income, not net. 

Some will tell you that working while applying for SSDI means your case is going to be a denial. That is not entirely true, a lot of it depends on what your conditions are, and what kind of work it is. If you're saying you can't work because of a bad back, but you still do part-time construction work - that doesn't look good. But for your conditions I'm guessing its more of a problem with sustained effort over 40 hours, not an inability to do the work itself.

 Plus, we know that a lot of people will work *despite* being disabled because they have bills to pay. it really is a case-by-case analysis regarding their work activity. What is most important is that you keep a roof over your head, its terrible advice to tell someone to not work in hopes that it bolsters their disability claim, because there is no outcome guarantee.   ",,,2,0,0,
48aa8e29-c585-4b0b-8c48-7f063b9c4b8b,1505358779,"Unfortunately, the way the Social Security Admin looks at it is to assume that if you're working, that  you're able to work.

It's a screwed up system.",,,3,0,0,
a82bb553-721a-45e3-a70b-3284a1cb9e02,1505371184,"On SSDI there is no asset limitation. You can have a house, a boat, 3 cars, your spouse can bring in 6 figures. The only things that affect your SSDI is your *earned* income. 

The SSA definition of disabled is that you cannot work due to the severity of your illness and/or injuries. 

Work as long as you possibly can. Save as much as you can. People lose their houses bc it can take so long to get approved. ",,,3,0,0,
64fab85b-d3af-4f6e-9463-9ee980690616,1505427501,"True, at this point. I suppose I should clarify that my experience predates 2008 (the economic crash). I don't think I've looked for a full time job since then.",,,2,0,0,
4f6e2d84-feeb-4997-b521-0e1acfd7a235,1505432450,I'm sorry you have to deal with that too you sound like a wonderful person especially with being a single father. Yeah I done some overcoming myself of my learning disability like I've managed to get an associate's degree took five years to get but hey I earned it fair and square but sadly like your situation people and employers see me as if I may as well be brain dead just because I'm a slow learner. I'll definitely take what you said and fuck em they want to see my shortcomings rather my strengths then they're the ones losing out. Do have some good news to share I did manage to land an interview at Kroger (A grocery store if you don't live in the eastern/southern U.S.) on Monday. As for as having a job that's probably the best I'm ever gonna do but at least it's an income.     ,,,1,0,0,
3e14d5e1-86e8-4e58-96be-d894f5b7cb02,1505445670,Ditto. I had a hard time since 1998 after college. I had to sacrifice with low pays. :(,,,2,0,0,
4f6e2d84-feeb-4997-b521-0e1acfd7a235,1505432450,I'm sorry you have to deal with that too you sound like a wonderful person especially with being a single father. Yeah I done some overcoming myself of my learning disability like I've managed to get an associate's degree took five years to get but hey I earned it fair and square but sadly like your situation people and employers see me as if I may as well be brain dead just because I'm a slow learner. I'll definitely take what you said and fuck em they want to see my shortcomings rather my strengths then they're the ones losing out. Do have some good news to share I did manage to land an interview at Kroger (A grocery store if you don't live in the eastern/southern U.S.) on Monday. As for as having a job that's probably the best I'm ever gonna do but at least it's an income.     ,,,2,0,0,
4f6e2d84-feeb-4997-b521-0e1acfd7a235,1505383121,I have done those things for like 2 years now and after hundreds of applications still jobless and voc rehab here in Tennessee is no help thanks to constant budget cuts and temp agencies are even worse at being discriminating :(,,,2,0,0,
85d78199-6a32-4e80-aa98-2b4135b65903,1505368712,"That isn't true. You can acknowledge the very real prejudices and barriers to employment the disabled face, while STILL believing in your abilities, and the power of persistence. You can't control who hires you. You can control whether you spend each day trying to better yourself, and preparing for the opportunities that WILL reveal themselves if you are persistent. ",,,6,0,0,
64fab85b-d3af-4f6e-9463-9ee980690616,1505427501,"True, at this point. I suppose I should clarify that my experience predates 2008 (the economic crash). I don't think I've looked for a full time job since then.",,,2,0,0,
64fab85b-d3af-4f6e-9463-9ee980690616,1505396655,"In my own experience, it's been fairly easy to get a part-time job, but a full-time job w/ benefits? Forgot it. Companies love that little tax break they get for hiring a disabled person, but they also like making sure they have enough space to push the person out at any time that's inconvenient. ",,,5,0,0,
948f5be7-0b73-435b-950f-7397edd9b15b,1505395544,"Burn your own path if at all possible.  You're right, ableism sucks.  It's also not going anywhere anytime soon.

  I'm a weight lifting, marathon rolling, single father who doesn't need help with a damn thing.  Know what people see?  Guy with no legs.  Know how they treat me?  As if I'm defenseless in the wild.  I could wrestle the worst offenders into submission, but they'll never even notice that ability.  I couldn't get a job either.  Know what I say to That?

  Fuck em.

 Society deems you a liability or too weak?  Prove them wrong, and chase what you want and believe in.  No one helping You?  Try anyway with everything you have.  Take what ability is left to you, and find the fire that burns within.  Let that fire consume you and forge you into a new person.  It will be hard, and there is a good possibility you fail, but try anyway, because that's where the life is.

  Hopefully, somewhere along the way, you'll see that you're living life the way you see fit, and you've stopped caring about what others see or react to.

  Remember the first step.  Fuck em. ",,,6,0,0,
6714ab4f-4ee4-4c52-90dd-e30a8194a6e3,1505422103,"At this point, it's difficult for an able-bodied person to get a full-time job with benefits.  I know a lot of people stuck in temp/part time positions after looking for work for 8 months to over a year.  ",,,3,0,0,
45268f4a-ca08-462f-84bf-41b6f12c550e,1505361676,"Right there with you. Maybe some day the mindset will change, but I doubt I'll see it in my lifetime. ",,,5,0,0,
3e14d5e1-86e8-4e58-96be-d894f5b7cb02,1505445670,Ditto. I had a hard time since 1998 after college. I had to sacrifice with low pays. :(,,,2,0,0,
6714ab4f-4ee4-4c52-90dd-e30a8194a6e3,1505422103,"At this point, it's difficult for an able-bodied person to get a full-time job with benefits.  I know a lot of people stuck in temp/part time positions after looking for work for 8 months to over a year.  ",,,4,0,0,
40c9159f-c8e9-4f70-a60e-e105b03f5224,1505435248,"What state are you in? Resources may vary but DVR is available, as well as various job centers which are typically state funded and assist in resume development, strategies, and job search.
Be",,,1,0,0,
a7194309-51f6-4e93-a49b-0dba21d7ee9a,1505526454,"Holy shitbox. Years? I'm using the DOR in San Diego County and it took me all of three minutes to get accepted after my papers were in order. I agree that you should try a different county. You should also definitely write your congressman about this. It's repugnant. 

I use Indeed.com to search for jobs. You seem like you've got it together intellectually so you can use Indeed's resume maker to create a comprehensive resume and then use it to apply for many jobs on Indeed with just a click. Depending on your disability you can probably rule out which jobs you just can't do on your own. For instance, I'm in a wheelchair so I can't stock tall shelves, move heavy objects, and stand ever. 

The great thing about VR/DOR is that they will help with costs related to work or school, help you narrow down what kind of career you'd be good at, and will provide direct support. They can also help you find employers who are looking to hire disabled people. CVS, for instance, is currently looking to fill their ""disabled employees"" quota so, while I don't WANT to work at CVS for very long if ever, I've applied. 

What your caseworker will tell you to do is to get a job that you CAN do and then work towards a job that you WANT to do. You can get ahead by getting a job on your own and having some recent work experience on your resume. 

Good luck!",,,1,0,0,
d75c38d3-a478-4eaf-b8d1-1051ee8f5a99,1505426898,Thanks for all that! And I love your username!!!,,,1,0,0,
d4c7a949-edc7-41bf-baff-054aa779d36a,1505426533,"writing to the legislature would probably be good in a long term since because vocational rehab is really a bipartisan issue, but i would be surprised if it helped you personally over the short term.

in terms of self advocating i suggest reading the section of the americans with disabilities act that pertains to jobs. actually knowing what my rights are has saved my butt before because you know what you're actually allowed to ask for and when an employer is either lying or confused about what they're supposed to do.

i've never really been able to sustain work so grain of salt but i would suggest not disclosing during the interview but asking lots of questions about what the work environment will be like and what will be expected of you so you can get an idea of if you can work there. then once hired ask to have a meeting with your supervisor or human resources (if there's one) where you can disclose and ask for what you think are reasonable accommodations. having this in writing never hurts because then they will have something objective they can reference and there's also a record of you having disclosed. you once you disclose you have more legal rights. 

they don't have give you the actual accommodations you ask for, but they are supposed to help you come up with an alternative that works for both of you. if they are willing to sit down and talk with you in good faith then you need to be willing to compromise since you are both coming from different perspectives. your application/contract should describe 'essential job functions' and you cannot ask for accommodation that prevents you from doing the essential functions (eg bus driver can't ask for an accommodation to bypass having a driver's license), but anything 'reasonable' that helps you do the essential functions is fair game to ask.

if you want you can disclose during the initial interview instead and it is illegal for them to refuse to hire you because of that, but nothing stops them from saying 'poor culture fit' and moving on. likewise it is illegal to penalize you for disclosing after being hired, but that doesn't mean some employers won't be mad and try to penalize you anyway.

that was kind of long and maybe you knew some of it, but yeah, read the ada, google search about disclosing, always be kind, polite, and respectful but don't be afraid to stand up for yourself or articulate your rights.",,,1,0,0,
d75c38d3-a478-4eaf-b8d1-1051ee8f5a99,1505527979,"Thanks! Unfortunately it goes by state here, so county switching isn't an option. And what I really wanted was to help someone help me to figure out what'd be a good fit with juggling multiple disabilities... I'm not too concerned about getting a job because I have a degree, a decent work history, and can BS transferrable skills but I've recently become unable to do my old career, so that's rough.

Maybe I'll just ask for OT/career counseling for Christmas. :/

That's really scary about sponsored jobs! I figured they were scams of sorts, but I thinking on a much less sinister level.",,,1,0,0,
d75c38d3-a478-4eaf-b8d1-1051ee8f5a99,1505426898,Thanks for all that! And I love your username!!!,,,1,0,0,
a7194309-51f6-4e93-a49b-0dba21d7ee9a,1505526554,"Oh and you should ignore ""sponsored"" jobs on Indeed. They are usually job placement mills. I made that mistake and ended up nearly giving my personal information to some random woman in a very noisy operating centre. ",,,2,0,0,
d4c7a949-edc7-41bf-baff-054aa779d36a,1505426533,"writing to the legislature would probably be good in a long term since because vocational rehab is really a bipartisan issue, but i would be surprised if it helped you personally over the short term.

in terms of self advocating i suggest reading the section of the americans with disabilities act that pertains to jobs. actually knowing what my rights are has saved my butt before because you know what you're actually allowed to ask for and when an employer is either lying or confused about what they're supposed to do.

i've never really been able to sustain work so grain of salt but i would suggest not disclosing during the interview but asking lots of questions about what the work environment will be like and what will be expected of you so you can get an idea of if you can work there. then once hired ask to have a meeting with your supervisor or human resources (if there's one) where you can disclose and ask for what you think are reasonable accommodations. having this in writing never hurts because then they will have something objective they can reference and there's also a record of you having disclosed. you once you disclose you have more legal rights. 

they don't have give you the actual accommodations you ask for, but they are supposed to help you come up with an alternative that works for both of you. if they are willing to sit down and talk with you in good faith then you need to be willing to compromise since you are both coming from different perspectives. your application/contract should describe 'essential job functions' and you cannot ask for accommodation that prevents you from doing the essential functions (eg bus driver can't ask for an accommodation to bypass having a driver's license), but anything 'reasonable' that helps you do the essential functions is fair game to ask.

if you want you can disclose during the initial interview instead and it is illegal for them to refuse to hire you because of that, but nothing stops them from saying 'poor culture fit' and moving on. likewise it is illegal to penalize you for disclosing after being hired, but that doesn't mean some employers won't be mad and try to penalize you anyway.

that was kind of long and maybe you knew some of it, but yeah, read the ada, google search about disclosing, always be kind, polite, and respectful but don't be afraid to stand up for yourself or articulate your rights.",,,1,0,0,
a27fcf4b-d60d-46d1-98dd-2be088fb56ba,1505503160,I might suggest moving to a different county in your state that you live in.  In my state Voc Rehab is done county by county.  Yes a large county with a high population will have more funds but they will have more people looking for aid.  Try a county that is more rural with a smaller population.  You might get on much quicker that way.,,,1,0,0,
40c9159f-c8e9-4f70-a60e-e105b03f5224,1505435248,"What state are you in? Resources may vary but DVR is available, as well as various job centers which are typically state funded and assist in resume development, strategies, and job search.
Be",,,1,0,0,
cc994d18-3d7d-4967-9c44-df55c0b358df,1505439110,"&gt; Are you an adult and if so are you legally allowed to handle your obligations. I do not mean to be condescending...

Aye, I'm 33 but as I said I spent most of that time basically locked up.",,,1,0,0,
f258d4cc-f97e-44f3-a9b0-87a2ea6c1f75,1505429545,"Have you tried a sliding board? That'd probably do what you're looking for. It's literally just a board you use to bridge the gap and slide over to on. If so, I personally recommend a wood one with at least one hand hole, always been my go-to. ",,,2,0,0,
9b44b1a8-512a-4635-8249-ae1c0a056a42,1505438513,"I mean, a hoyer power lift or something similar seems to be the only solution. Thinking outside the box, a power engine lift came to mind, but they are just as expensive.

Your inability to walk is terrible and presents a crappy situation. I feel for you tremendously.

Are you an adult and if so are you legally allowed to handle your obligations. I do not mean to be condescending...

If so, call Medicaid and ask where you can get one. I assume if you can get a doctor to write you an RX for such a device, it would make it more of a justification.

You need to go to https://www.medicaid.gov and start reading. And reading and reading. I would, but I don't know your information, like what state your in, area, etc. Which is dependent as well. I also don't know your specific illnesses, so when if has criteria, you know if you meet them or not.

Do you have a doctor, and if so, call his or her office and see if they dealt with this before.",,,1,0,0,
9b44b1a8-512a-4635-8249-ae1c0a056a42,1505443034,"I wish I knew more... Out of ideas.

At least you have the net right now. Hope it ain't dial up.",,,1,0,0,
cc994d18-3d7d-4967-9c44-df55c0b358df,1505434192,"&gt; Are y o u transferring between two stable things? Like 2 beds? From a bed to a power scooter?

Yes. Powerchair is immovable so is bed/toilet.

&gt;who can walk

No. Rheumatoid arthritis screwed up my joints and I have lived all my live in near total isolation from goods and services with my insane mother.

&gt;You should Google a medical supply shop in your area and ask what would work for your issue.

Did. Fuckers don't accept my insurance. I suspect no one wants to deal with Medicaid, especially United Healthcare Community Plan.",,,2,0,0,
cc994d18-3d7d-4967-9c44-df55c0b358df,1505429653,"Because I'm a little person and my feet don't touch the ground, a sliding board would be pretty unstable for me as I could just slide off it.",,,2,0,0,
cc994d18-3d7d-4967-9c44-df55c0b358df,1505429653,"Because I'm a little person and my feet don't touch the ground, a sliding board would be pretty unstable for me as I could just slide off it.",,,2,0,0,
3a4e0882-a484-494b-8ae0-33100295e03f,1505529461,If in USA a part of every states Vocational Rehab services is their Independent Living Program.  They retrofit living situations for this purpose.  Don't be misled by their name; they will help people irrespective of ability or plans to be in workforce.  ,,,2,0,0,
720d37b9-0056-41a5-baf2-558fd5340266,1505511888,"There are organizations in every state that does assistance program6such as the Medicaid waiver,  also there are other independent living programs that can provide technology as well",,,1,0,0,
