commentator_id,created_utc,anonymized_body,ups,downs,score,controversiality,gilded,distinguished
0a681b08-b474-4994-8d91-be563da1b768,1510539811,"I'm far from an expert on the law; I just happen to know that it exists. And I'm certainly not going to say anything that could be construed as a defense of the policy. I'll start the googling for you, though. Here you go http://www.motherjones.com/politics/2017/08/many-people-with-disabilities-are-being-paid-way-below-the-minimum-wage-and-its-perfectly-legal/

",,,1,0,0,
261172ca-54be-4aee-bea2-804c359afedd,1510144634,"Speaking personally, I wouldn't claim that in your application materials. If it would be necessary to discuss, mention it during your interview. There isn't any data to indicate it increases or decreases your chances of getting hired for a job. 

I would recommend speaking to a vocational rehabilitation specialist if this a serious concern for you, especially if your injury has impacted any functional abilities (e.g., movement, sensation).",,,4,0,0,
4322c709-4e06-42c0-87ab-787176cd27f4,1510179946,"If you will be able to do the job (with or without a reasonable accommodation), I wouldn't mention it during the hiring process. If you do need an accommodation, you can let them know once you are hired. 

Sometimes you might need to ask them questions to determine whether you can do the job, so it might make sense to disclose your disability at the interview stage. 

I have heard anecdotally (mostly on LinkedIn disability groups) that disclosing a disability can reduce your chances of getting interviews and getting hired. It shouldn't, legally, but it's hard to prove the reason you are looked over in a hiring process, and employers know that. It is possible that some companies are looking to improve their diversity, so some may look at it as a plus, but I personally prefer not to risk it unless necessary. ",,,5,0,0,
d42770b1-9f84-462c-9536-090461a2ff56,1510198103,The most surprising thing is a youtube vid without super annoying music!,,,1,0,0,
60933438-bb12-4b31-a1f6-4cce0d57da5f,1510239416,"I actually don’t know, as I just look for royalty free music that I think suits best. I’m now on my phone, but I think I should be able to tell later from my computer. ",,,1,0,0,
ca40e141-28cc-4e48-bbde-06d980858989,1510275943,"&gt;(not so great)

Yet, it's far better than my best stick figure. :)",,,1,0,0,
ab18fe77-8cd5-45f0-aba9-6cf908d5bb0d,1510168366,Great video. I just subscribed to your channel. Looking forward to watching your other videos.,,,1,0,0,
acc40d5c-4fee-4404-b4bc-076105f6196d,1510160771,I seriously thought you were going to water color on a paper towel lol.,,,3,0,0,
60933438-bb12-4b31-a1f6-4cce0d57da5f,1510315675,I meant the resemblance is not the greatest! :D but thanks :)),,,1,0,0,
948f5be7-0b73-435b-950f-7397edd9b15b,1510159780,Always nice to see a fellow disabled artist.  You're very skilled!,,,3,0,0,
fccbbf6c-057a-48ef-8803-4235a808cd26,1510231953,"Although I agree that it shouldn't be shameful, the stigma in the U.S. is terrifying. For a lot of people, the use of food stamps should be ridiculed. And I whole-heartedly disagree with them.",,,2,0,0,
804282ab-83ad-4cb6-84b9-cce1f563499b,1510202632,I'm not sure why no one has recommended that you talk to a manager. You should talk to the store's manager! You've been shopping there for a while without issue. Tell the manager that and how you would like to be given due respect. ,,,10,0,0,
5d8fcb61-10fc-4404-ad1b-6faea8dcd780,1510229470,"
It went something like, ""Total is $X. Are you paying with food stamps?"" This was unnecessary because the card reader automatically differentiates between an EBT card and credit or debit. All she had to do was approve my transaction. 

I ignored her and focused on entering my pin. ""If it's food stamps, then the total is $Y."" By this point in time, their computer had approved and applied my payment method, so no need to say ""food stamps."" My head was spinning and I couldn't actually notice any difference in the total. She got a third ""food stamps"" in that exchange somewhere but now I cannot recall because of the adrenaline. 


I think she may be one of the mangers. It's an independently owned store in a village in a conservative region and I'm pretty sure that I would be laughed out of the store if I explained what happened. 

I was even afraid to call because the office is immediately behind her checkout lane and I figured that she would answer the phone. 

I also couldn't see her name tag. 

All of this makes me feel like I won't be taken seriously.",,,11,0,0,
47ee3b64-0c89-4080-be3c-d3684aedbef5,1510246420,"&gt;I wanted the world to swallow me whole. I felt like screaming my situation to the world to try and I don't know.... justify why I was on assistance. I felt utterly ashamed.

It's because people are shamed for struggling. You're shamed for not having a rich daddy to pay all your bills. You're hated for having to work harder than others. You're hated for not having a trust fund, for not exploiting the labor of others, for not sailing through life. You're taught to hate yourself, not just because you're poor, but because you're disabled.

Right wing politicians and their followers talk a big game about being compassionate, but they're full of shit. They constantly try to kill us. They constantly try to starve us, take our homes, and criminalize us. And they do treat us like criminals for taking less than what we really need and less than what we really deserve while they take far more. They stuff themselves and begrudge us a crumb.

Most of us have to deal with this. We are taught that we are bad for being disabled and, consequently, poor. They never come out and say we're bad, but it's a mountain of coded language and dog whistles covering up an ideology that is like a gun pointed at our faces. If you look at the history of the labor and disability movements in this country, you will see who has been opposed to them. You will see who preaches hate against us. You will see who wants to steal what little we have. These are the people trying to make you hate yourself.

It took me an entirely new way of looking at the world. I realized that our economic system is designed in spite of me and many millions -billions, worldwide- of others like me, and that these people rely on that system for their wealth. Liberals and conservatives both maintain this system.

[this is all that helped](https://libcom.org/library/the-conquest-of-bread-peter-kropotkin)

",,,10,0,0,
9bd9e05f-cc1a-4b6a-a684-b1ed0ac665f9,1510199990,"You march right back in there and buy a loaf of bread. 

Go put it in your car. 

Wait 10 seconds. 

Then you march right back in there and buy another loaf of bread. 

Wait 10 seconds.  

Then you march right back in there and buy something else. A single item. 

Wait 10 seconds. 

You do this for as many items as you want, one item at a time. You don't have to talk. You're the paying customer. She does. 

And everyone will get absolutely sick of it after a while. 

Enjoy. ",,,10,0,0,
01142598-a73e-4b38-b94a-dfafeaecd0a2,1510187337,He'll be on food stamps too when he gets replaced by self checkout ,,,11,0,0,
5d8fcb61-10fc-4404-ad1b-6faea8dcd780,1510203241,"Well, I think she may be one of the mangers. It's an independently owned store in a village in a conservative region and I'm pretty sure that I would be laughed out of the store if I explained what happened. 

I was even afraid to call because the office is immediately behind her checkout lane and I figured that she would answer the phone. 

I also couldn't see her name tag. 

All of this makes me feel like I won't be taken seriously. ",,,5,0,0,
6b901178-b02a-4da8-9f71-8a61883354f8,1510187570,"I’m sorry that happened to you. That cashier is a terrible person.
I honestly don’t think most people are going to judge you for using food stamps, so many people need them at one time or another. But she surely came off like a jerk to anyone who may have witnessed her rude behavior. I also use food stamps, and it makes the difference!",,,8,0,0,
e991960f-c46a-457e-b309-cbed5d629fbe,1510195561,"I'm sorry, that was just a crappy person. No reflection on you, just her. Best wishes for the future.",,,8,0,0,
9062c4b8-7af1-465e-a2ab-73fdb255cee4,1510233738,"I remember I went to a Bi-Lo once, because they had my son's formula in stock in the huge amount that WIC coupons require you buy in one purchase. Like ten cans for the month, or something. 

I put it all on the conveyor belt and the cashier rolled her eyes and said, ""Lemme guess, is this WIC?""

I sheepishly looked down and mumbled, yes, it was WIC.

She then loudly complained about what a hassle it is to run ""those WIC checks,"" then, when she struggled to ring the formula up, she called a manager over to her station on the loudspeaker, ""Got a WIC issue on checkout three"" .... I wanted the world to swallow me whole. I felt like screaming my situation to the world to try and I don't know.... justify why I was on assistance. I felt utterly ashamed.

Anyway, my then-husband was in the car, waiting with our baby, and I got out there sobbing, as I burst into tears having been treated so callously (in my opinion).

Now, we didn't end up together, no one's fault, but he marched me and the baby right back into the store and went to the service desk and quietly asked to speak to the store manager in his office about a sensitive issue. He elbowed me a little to encourage me to speak up.

I told the manager I was sorry I was using WIC and I apologize about inconveniencing anyone, however it is profitable for the store and all that jazz, so therefore I'm a paying customer like any other. I am TERRIBLE at confrontation, even over a decade later, but my ex helped me properly articulate and describe how the event made me feel, and we requested perhaps the cashiers be advised to treat the issue sensitively since there absolutely IS a negative stigma attached, as if the ten cans of formula at once isn't already a glaring ""Hey look I'm poor!"" signal to the rest of the checkout line.

Well, the manager sat down at his desk and sighed, and mentioned that wasn't the first time the cashier had been singled out for being judgmental, and that ""appropriate action would be taken"" and said he welcomed all people in his store and all that, and essentially bought us off with a $100 gift card.

Not that that was exactly what I wanted or however it turned out, but I will say I never saw that cashier in that Bi-Lo again :( so I then felt bad that maybe I contributed to getting her fired because she was ignorant to others' struggles. I just wanted to share that I still to this day feel shame, in my disabled state, about using ""assistance"" and avoid the stores near my house when I use what food stamps/SNAP I *do* receive. I'm deeply ashamed, and I don't know why, but I do know it's almost encouraged to be ashamed for receiving assistance, especially in the more conservative areas .",,,12,0,0,
0d7a3b82-e12e-478e-862a-85142d29f195,1510228738,"She just said ""Food Stamps"" without any context?   If that's the case you should report that.",,,8,0,0,
ae315024-dc0f-4476-b225-7e9a9d0ff39a,1510245508,"I am so sorry you feel ashamed. You have no right to feel that way! People deserve assistance when they need it, especially to basic human needs like food and shelter. Whether someone is on assistance for a disability, or they kind of ""put themselves"" in a position of needing assistance, like a drug addict, I am so happy that some of my taxable income goes to help them. Everyone deserves help! Also, keep in mind that most people like to help people. Of course there are people who don't believe in assistance programs but there are many, many people who do. Go to a mirror, look yourself in the eyes, and say ""I am deserving of all the help I receive."" Say this until you believe it because dammit, it's the truth. ",,,3,0,0,
f4d18fa8-4341-4c9e-9b7b-df64934a1b8c,1510219460,"Sounds like an awful lot of walking, energy, carrying, and faff for someone who experiences disability.

I don't know the nature of OPs limitations, but that above karmic justice, while it would be satisfying, it would be awesome total waste of my limited and precious energy and the few moments I get a break from symptoms. ",,,11,0,0,
f4d18fa8-4341-4c9e-9b7b-df64934a1b8c,1510220028,"I guess this isn't much help, but personally I don't see receiving food assistance as shameful, and while the cashiers intention might have been to shame you, If you can transition your thought process to recognise that making use of your available tools (food stamps) in order to fulfil basic needs (food, shelter) is not shameful, it's smart and nessesary.

Though not being American, I think that's easier for me, my country is slightly more socialist so I've never really had to fight a social pressure today pretend to be something I'm not. Most of my disability is invisible, and I spend a lot of time having to fight for the accessibility accommodations I need to achieve very simple goals, so I guess for me there's almost an urge to say ""yes, food stamps, because our society and economy is not designed to allow people like me to survive without them, got a problem with me not starving to death?"" ",,,10,0,0,
5ed0fe9d-0c1f-4df4-b0d9-91890592ea16,1510182282,"I'm so sorry. :/ That's not right of her. 

This is what I fear..  
When I move into public housing I plan on applying for food stamps. I feel like I'll be judged.. Especially since I don't 'look' poor. ",,,8,0,0,
e5748870-4d7a-4296-a5ec-17c225e4395c,1510280003,"In Illinois IF you can't walk 100 ft without difficulty get a placard.

Off topic: SIUC&gt;SIUE. GO SAUKIS!!!",,,3,0,0,
cc46e9b1-e39e-453c-afd8-b5a4a9dcb2de,1510257770,i would ask your doc for the handicapped placard,,,6,0,0,
c89d8b55-ee70-4e80-81b2-f2bfc4ccb3b9,1510323022,"I am in the same boat, and I totally understand where you're coming from. I'm in school as well, and I have chronic widespread pain and fatigue (currently diagnosed as fibromyalgia) but I can still walk, though with difficulty and pain. I typically use a cane or a rolling walker, depending on the day, but I have needed a wheelchair when I go to things like conventions and sometimes when I do my student teaching (because some of the schools I go to are enormous). 

I recently bought my own wheelchair odd Craigslist, and I struggle to feel okay with that decision. I don't use it much, partly out of fear of the social consequences and partly out of trying to ""tough it out."" But I found out recently that I have the opportunity to go to a teaching conference next year, and I know I won't be able to get around without it. 

My family makes a huge stink about it, because they don't understand what I'm going through at all, despite the fact that my mom also has chronic pain and has used a mobility scooter for years. They don't want me to use it because they feel like I don't need it and it's not appropriate if you're not paralyzed or something. (Which is bullshit; I read recently that something like 80% of *full-time* wheelchair users have at least some ability to walk/stand.) My boyfriend has been more supportive, but he worries that once I start using it, I'll stop trying to get places and walk around on my own. Again, it's kinda BS. From what I've read, most wheelchair users only use it as much as they need it, and most people choose to stay in a manual chair rather than electric so they can get that extra exercise. 

Bottom line: if you think this will help you get around with less pain and make it easier to experience your everyday life, do it! People will be shitty, and you'll have to educate folks that you'd rather ignore (or just give them the finger if you don't feel like it lol), but ultimately any decision about your health is up to you and you alone, regardless of shitty people who think they know better than you. As far as an accessible parking spot, I can't tell you how much that has saved my energy and pain this year. I wasn't able to get an official one through the state because my dr has some weird ideas about fibro, but my school allowed me to get a parking pass through the disability services office (and campus police) as long as I had a letter from my doctor. She did agree to that letter, and it has helped me immensely. 

Long story short: talk to your doctor and disability services, get a tag, and you do you when it comes to mobility aids--fuck everybody else. ",,,4,0,0,
00f29e61-c452-41bf-b67b-bb63985c21b4,1510259960,"I can walk, but I have peripheral neuropathy that makes standing and walking very painful. It got to the point where I became housebound. Then I got a wheelchair and life began again.

If walking is difficult, get a chair. It doesn't matter if you don't need it all the time. It's a tool, like a hammer or a drill, you use it when you need it. It'll allow you to save your energy for more important things than getting from A to B. You'll get to B and be able to do something really worthwhile for yourself, instead of sitting in a corner in agony wondering how you're going to get back to A again.

Not everyone in a chair is a para or tetraplegic, many of us can still walk (even if only short distances). The general public don't understand that, but then their opinion on the matter doesn't count for anything.

Plus, if you start using a chair, then you should get handicapped parking permits. Getting people to make allowances for ""hidden"" disabilities is a struggle; it's much easier with something visible. Yes, you'll probably face criticism from the ignorant public, and may have to prove to some idiots that you really do need the chair, but on the upside you're life is going to be so much better.

My only regret is that I waited so long before using a chair.",,,5,0,0,
ca40e141-28cc-4e48-bbde-06d980858989,1510287911,"Haha. My brother graduated from SIUC, so clearly I can never go there. :P",,,2,0,0,
7406ba91-3814-4ec3-9c04-50426c814aef,1510300552,"Or get a stair lift...
TBH I did it for a year and I’ll never do it again if I can avoid it, but definitely doable. ",,,3,0,0,
3c9c0356-fee1-4c74-94ba-b12e76a61656,1510260792,"A cheap wheelchair up the stairs too. Do the stairs on your bum, although this is dependant on upper body strength and stamina/ stair height etc.",,,2,0,0,
7406ba91-3814-4ec3-9c04-50426c814aef,1510523814,"I’ve always wondered if a pulley system lift/elevator thing existed.. I have awful luck and anything power tends to fail with me on it at some point. 
That’s another thing with the lift, is if you lose power the back up battery is only good for so long/so many trips. I did get stuck in the middle once ��",,,1,0,0,
3c9c0356-fee1-4c74-94ba-b12e76a61656,1510452627,Yea it's kind of a worst case fix. The stairs in my last house were too narrow to accommodate a stair lift. Or engineer some sort of pulley system kind of like a zip line - that's the dream !,,,2,0,0,
3c9c0356-fee1-4c74-94ba-b12e76a61656,1510452689,Oh and have a urinal bottle on the floor without a bathroom for sure!,,,2,0,0,
c23e6b4d-571f-4b68-b296-6f24de496c08,1510272697,"Socks slipped over the handles or wrapped around , depending on what type of crutches you are talking about .",,,2,0,0,
cc46e9b1-e39e-453c-afd8-b5a4a9dcb2de,1510257860,"i dont know but considering i have crutches in my near future its something to think about
",,,1,0,0,
3c9c0356-fee1-4c74-94ba-b12e76a61656,1510260619,When I'm desperate I put hand sanitizer over it,,,2,0,0,
f4d18fa8-4341-4c9e-9b7b-df64934a1b8c,1510313296,"I use forearm crutches and after one horrendous trip to the zoo on a humid 40°C (I'd pre booked a wheelchair from the zoo guest centre but they double booked) My hands got so sweaty, I kept loosing grip, slipping and hurting my shoulder and I fell a few times.

I stopped at a $2 Shop on the way home and bought a cheap 5 pack of anklet socks for a buck.

I cut a hole just below the hem (used some fray stop/super glue), I took the forearm rest off the crutch and threaded the sock over the crutch via the new hole, allowing the actual ankle hole of the sock to be pulled over the handles.

[Here's some pictures](https://imgur.com/a/4mep4) to help it make sense.

When they get dirty, I just launder the socks. 

Bonus, I can find socks to match my crutches and make them more colourful!",,,2,0,0,
41fdb8dd-8b05-4ede-9629-01153fa03b04,1510328248,"After having dated several devotees over the past ten years, I've made a decision to pursue a relationship with only devotees from now on. It's not about being loved because I've been in love and loved by non devotee women, I actually do fairly well with women. It's really about that special connection and dynamic that can't exist outside that kind of relationship. If you're a female devotee, send me a message. I'm willing to just talk about it if you want, too. ",,,3,0,0,
a3088134-795d-4d46-ba56-7735403413f5,1510310524,What is devotee?,,,3,0,0,
d42770b1-9f84-462c-9536-090461a2ff56,1510643330,"I don't understand it, but I do understand the desire to connect with someone, as being a shut in is a degree of isolation I never could have imagined before becoming disabled.

Wouldn't mind hearing about it from the other end though.

In a world where women think 80% of men are below average looking, that paints a pretty bleak picture for genuinely below average straight men.

Maybe its just sour grapes, but I've written it all off as a problem I don't have to worry about.

Maybe my Art3mis  is out there lol :D",,,1,0,0,
a3088134-795d-4d46-ba56-7735403413f5,1510333510,Tell me more. Never heard of them... ,,,1,0,0,
c4700850-875b-465c-b50e-e8b77c12c8f6,1510325776,Someone who is especially attracted to disabled people.,,,4,0,0,
ee4c2470-84e0-4af3-9537-2280f990b64b,1510859466,I want to be loved for me as a person and not because of my disability. Disability isn't a fetish it's a lifestyle that no one chooses. ,,,1,0,0,
567a0ff7-a84e-4836-bbbb-d00caa3d5a38,1510283869,Where did you meet devs online? I've looked but haven't found any sort of reasonable looking sites.,,,3,0,0,
961c387f-4c99-4aea-b62b-a160493a428d,1510304966,"paradevo, but it's not a dating site. It's a community for male wheelers and female and gay male devs.",,,2,0,0,
ee4c2470-84e0-4af3-9537-2280f990b64b,1510863673,"It seems like everything about what you described seems more favorable to when a man is disabled. I wonder how it would work if there was a disabled woman in need of a devotee. 

I'm a disabled woman and I think that while disable stigma and negativity exists everywhere, it can be different for women. Even with the same disability, men are viewed as strong while woman are seen as inspirational. 

Plus, I think it's more socially acceptable for disabled men to date then disabled women. I constantly get asked ""how will you have or take care of kids being disabled"" whereas my guy friends don't get these kinds of questions. 

I saw you said you're looking to date a devotee. Does that mean she has to be fully able bodied or would you consider dating a woman with disability (same type of disability or otherwise?) ",,,1,0,0,
c4700850-875b-465c-b50e-e8b77c12c8f6,1510358335,"I don't have any personal experience, I've just heard of them. It's usually described as a fetish. I can understand the appeal of dating a devotee, since they would like your disability, rather than seeing it as a drawback or a hassle. On the other hand, you might worry about if they would like you if you weren't disabled.",,,2,0,0,
961c387f-4c99-4aea-b62b-a160493a428d,1510304828,"As a quad with a devotee partner, I agree that it's magical. Having someone love you and your disability feels great.",,,2,0,0,
41fdb8dd-8b05-4ede-9629-01153fa03b04,1510863318,"This might be the biggest misconception about devotees. A devotee will NOT fall in love with someone because of their disability. Just like every gay man doesn't fall in love with a guy just because he's also gay. You still have to be appealing. It's not just a simple, physical fetish. But once a bond is there, the chemistry can be almost magic. ",,,1,0,0,
c23e6b4d-571f-4b68-b296-6f24de496c08,1510347222,"A quick Google search will turn up equipment expos in your area . I really like the Abilities Expo, you get to see different wheelchair cushions from various vendors . ",,,1,0,0,
cf345023-1504-4662-9658-c7ae58d18bdd,1510860061,I have no more ideas. You are now on your own. {Cue scary music.},,,1,0,0,
ee4c2470-84e0-4af3-9537-2280f990b64b,1510880581,I have a tilt function which I use but I wonder if it's enough..I'll check out the video thanks. ,,,1,0,0,
cf345023-1504-4662-9658-c7ae58d18bdd,1510325443,For years I sat on a [Stimulite](http://www.supracor.com/products/medical/cushions/) cushion that was absolutely sweat-free. They've since greatly expanded their model line; perhaps one will suit you?,,,1,0,0,
ee4c2470-84e0-4af3-9537-2280f990b64b,1510859351,What about ones that are less itchy? I get bumps that look like raised mosquito bites that itch. Any ideas? ,,,1,0,0,
cf345023-1504-4662-9658-c7ae58d18bdd,1510876419,"You have to do pressure relief periodically. For the first three decades of my adventure, I simply lifted myself straight up and off my cushion with both of my arms (wheelchair pushups) and then held myself up for 10-15 seconds. I did this every 20 minutes or so.

But if you wish to save your shoulders, you can simply lean over to one side for 30 seconds, then back to the other side for 30 seconds. If you have the ability, you can lean over and put your hand under your ischial bone to see if it is lifted off the cushion while you are doing this.

[Here is an excellent video describing various pressure relief techniques.](https://youtu.be/5zqxSCwtixc)",,,1,0,0,
