commentator_id,created_utc,anonymized_body,ups,downs,score,controversiality,gilded,distinguished
060474bf-b410-4553-bc32-04de13692491,1506082808,"You don't need to coach me in ""online speech."" Saying ""he isn't wrong"" seems like you were challenging/invalidating OP. It was a poor choice of words.

And being disabled isn't ""abnormal."" The whole point of the disability rights movement is to reject concepts like normality. Are you familiar at all with the Social Model of Disability?

Ableism will likely never go away, sure. But that doesn't mean we still can't try to dismantle it and try to teach people about disability culture ",,,5,0,0,
92338401-4c21-40e9-9544-2873f6d9551b,1506096979,"Yeah yeah. Safety is a better thing. Ignore any typos there's currently 2 parrots and a dog all begging for snuggles they're litterally using me as a tree right now. Correction I'm a moving throne for the birds right now.

Only broken one bone in 19 years and it was totally my fault. Like oops. Coordination probably a thing I should have and in theory do but I once walked into a wall.... Well more than once I usually ram right into my door or th chair in he hallway. 

",,,1,0,0,
060474bf-b410-4553-bc32-04de13692491,1506050206,How is he not wrong?,,,5,0,0,
92338401-4c21-40e9-9544-2873f6d9551b,1506100926,"Yes by definition disability is out of the norm. Lest we'd all cease to exist because if our ancestors were all in various ways disabled humans wouldn't have made it this far. But we still need variance in genetics or interbreeding would occur and then pose the exact same problem. There needs to be a mixture of both for humans to continue to exist. There's other factors in that of course like our enviorment developing countries have higher death rates ghan developed countries. They make up for this by having higher birth rates. There's also a lack of education that causes developing countries to have higher birth rates. 

But just because something is abnormal does not make it bad entirely. If we had that attitude we'd all think the world was flat. And I kinda wish it was sometimes because there are people I'd like to push off the nonexistent  cornered edge of the earth.(*cough* the person that told me I'd have to sell my animals to ever get married like okay then*cough*)

Beethoven was deaf and he's considered one of the greatest composers of all time. Steven Hawking is a famed scientist. So yeah abnormal does not equal bad.

l",,,1,0,0,
92338401-4c21-40e9-9544-2873f6d9551b,1506098762,Oh I've had that argument with someone before. Like the fyck? Was online though so wasn't to my face but *still*,,,1,0,0,
92338401-4c21-40e9-9544-2873f6d9551b,1506100207,"It's better than the medical model it sounds like. Also this sounds like sociology. Which is definitely interesting but I really don't need any more fluff classes for university. And yes psychology was what I picked as a communications class. Like I could've taken easier classes but I didn't want to at all. Honestly my easy class this semseter I hate. Like kill me now level of hate because the professor is condescending and it's kinda like ""oh hey thanks for the common sense.""  It's a class on how to study essentially I thought I'd need it but apparently not really. Because I'm doing the same shit I did in high school and my grades are better than they were in high school. Still oissed about the music quiz I somehow bombed. Like, ""shit shit shit shit shit I need a good GPA for a variety of reasons."" But it doesn't count for too much of my overall grade so it's fine I wish I could check my grade in that class without asking the professor I probably could buy not gonna lie I froze my computer doing math homework so.....",,,1,0,0,
31fb8cfc-fcc7-4fbd-8b39-7fff81423919,1506089479,I don't know if you're being sarcastic. No I haven't been reading stoic philosophy. After a certain point of frustration this is the only thing left to do,,,1,0,0,
92338401-4c21-40e9-9544-2873f6d9551b,1506094449,If I didn't have to carry a bunch of supplies for class I probably would get there early and just slowly try to do it but that's probably not wise ,,,1,0,0,
31fb8cfc-fcc7-4fbd-8b39-7fff81423919,1506095425,Being safe is better than broken bones...,,,2,0,0,
92338401-4c21-40e9-9544-2873f6d9551b,1506137202,"Kinda? Like I want to have a back up plan but at the same time on scared it'll come across as admitting""fine I can't do what I wanted what's another option?""

Which hot even sure I'm ever gonna move out of my parents house so that's that's a thing. Eh. It's fine. Not gonna spend any time freaking out. Well I didn't just spend 3 hours on algebra homework. Algebra sucks like I like solving simple equations but finding the functions of weird points using s tabled chart is kinda like ""the fuck just happened to the normal math? What the he'll is this?)",,,1,0,0,
31fb8cfc-fcc7-4fbd-8b39-7fff81423919,1506098816,Ahh the zookeeper guy. Now I remember you,,,1,0,0,
c4c6a003-cc26-4573-8be1-5282e9e1ee65,1506104624,"Average is a good one too!   And yeah, it's all about the fine-grained semantic differences which can make a bigger difference than people often give them credit for(though I'm into linguistics, so...y'know, caring about this stuff comes with the territory there lol).",,,2,0,0,
48588fe3-b6c3-42de-8051-56ec00498371,1506091015,"I'm honestly not being sarcastic - I can see why it would sound that way. I'm just saying that most people prefer to complain about injustices (no offense to OP) or try and rationalise things in a negative light. Which isn't practical at all, it gets you nowhere and makes you sad. 

Not many people have the strength to just accept reality at face-value, try to understand the other person's perspective (even if they are wrong) and move forward.",,,1,0,0,
92338401-4c21-40e9-9544-2873f6d9551b,1506138228,"Yeah hopefully. Pretty sure everyone is like ""okay your idea of the perfect house scares me.""

i have to take calculus eventually but I really don't want to",,,1,0,0,
060474bf-b410-4553-bc32-04de13692491,1506090475,"I'm getting a masters in Disability Studies; disability activism and culture is something I have been researching for a long time. 

The Social Model of Disability argues that we are (usually) more disabled by society than our bodies, that society only caters to bodies that look or operate a certain way. The Social Model of Disability puts the burden of accessibility on social structure rather than individual people.

You can get technical about what it means to be ""normal"" or ""abnormal,"" but those words have routinely been used to oppress and ""otherize"" disabled people. Continuing to distinguish disabled people as ""abnormal"" is pretty much the opposite of disabled activists' goals. We're a minority, sure, but we don't have to elevate non-disabled people by calling them ""normal."" That's where the oppression started. The relatively small number of disabled people in the world doesn't mean we still can't ask people to change their perspective. There are still over 50 million disabled people in the United States alone, and most people develop a disability at some point in old age.

Promoting disability activism and disability culture has actually significantly improved the lives of the disabled community. Since the United States' disability rights movements in the 1970's, we've seen numerous anti-discrimination bills be made into legislation to dismantle the oppression of disabled people.

Teaching about disability culture actually does the opposite of what you suggest. It promotes equality and seeks to correct people's feelings of condescension or pity.",,,1,0,0,
92338401-4c21-40e9-9544-2873f6d9551b,1506097311,"I'm not sure who he was trying to insult honestly. Because it's not like I stood up and announced it. That's not s thing that happens. I mean it did happen once in middle school that my classmate yelled ""infinity has a pacemaker.""
Like I was *pissed* 

But I'm 5' now and I was so tiny in middle school. Idk what I wake off now because I'm not checking since I've eaten cafeteria food for the past month.(I gotta lay off that pizza it's so unhealthy but damn my schools food is good.) 

I think the most indie give thing anyone has sai to me was ""you should probably look into that and make sure it's something you can do."" Like excuse me? Now I'm like 1000X more determined to do it. If I can't well there's a way probably. And even if there's not a BS in a STEM field can do a hell of a lot becauE it looks really good for a lot of careers. ",,,1,0,0,
31fb8cfc-fcc7-4fbd-8b39-7fff81423919,1506101242,It's neither good or bad. However from the last post of yours I saw your outlook seems to have improved you sound more pragmatic now and that is definitely a good thing,,,1,0,0,
92338401-4c21-40e9-9544-2873f6d9551b,1506101097,"[–]ToInfinityandBirds[S] 1 point 19 minutes ago
Not sure if that's suppose to be a good or a bad thing. So, thank-you?
Also I'm a girl. I'm pretty sure once I have a degree in plenty qualified to talk to people about exotic animals. There's 5 of them in my living room right now. Well 4. One is trying to eat my bedspread. And she was flying around and failing at the landing. She thought my mirror was another bird and so yeah. They can't see glass. So, mirrors are actually a big hazard to parrots. But tell that to bird toy companies they haven't gotten that memo. Then again everyone calls the little marsupials with long tails that are comsntslynroadkill in the USA possums. Like what? They're not possums. They're opossums and you need to cross an ocean to see possums they're different. I've gotta get out more. But my friends all have insane amounts if pets so all we do is go shopping for animal supplies. Because why not?",,,2,0,0,
31fb8cfc-fcc7-4fbd-8b39-7fff81423919,1506103994,I see....so my mistake was using normal as a substitute for average. I usually use words at face value. Because I don't believe in giving words too much power. For terms like typical and usual very often normal works as a synonym.,,,2,0,0,
31fb8cfc-fcc7-4fbd-8b39-7fff81423919,1506137491,You're only 19. All I'll say is chill. Don't freak out and I'm sure you'll eventually be moving out and living on your own. Algebra is always fun calculus is way more fun and can get way more wtf. But that's just my opinion,,,1,0,0,
92338401-4c21-40e9-9544-2873f6d9551b,1506100985,There's so many different majors and if I hadn't already decided what I was doing with my life feels like that'd be freaking me out,,,1,0,0,
1837e361-dfc4-4968-8780-6d62d0eaf23d,1506074476,Meh.  Would you want them all crowding you out of the elevator before class?  Maybe just keep it a secret.   ,,,8,0,0,
060474bf-b410-4553-bc32-04de13692491,1506050907,"Well, sure, but these people saying ""elevators are for the weak"" aren't thinking about it logistically; they aren't using ""weak"" in a clinical way. They're just being ableist.",,,8,0,0,
92338401-4c21-40e9-9544-2873f6d9551b,1506098671,"Not what I said. Maybe I do? Autocorrect is evil if I did. Oh I very well can. Just a matter of not killing the guy who invented math in the process. Like thanks a lot ancient so duties. Thanks a fucking lot. I have it in my notes from the summer class j took but I don't remember who invented math and I'm not checking. I know it has roots in Arabic speaking places. But not sure that's the only root. 


You're gonna laugh in my face and tell me ""you're joking, right?""
But I want to be an animal educator in a zoo. Ill take any position in a zoo but I want that specific one like the most. Wanted to be a zookeeper but really not sure you want *me* feeding a lion. Or more like Ivw been low key researching different zoos trying to find the animals I'd really enjoy working with. 
My dream zoo might be a little less desirable right now considering there was just a hurricane in the state and I'm terrafued of trying to evacuate with the number of animals if ideally have as pets. I want an iguana one day. Because I'm a sane human being that instead of screaming in terror at a book on reptiles with pictures of snakes went ""yes!"" When I it was left on my bed. My grandma has been going through her house and just sent it home with my parents like ""your kid never shuts up about animals give this to her.""

Haven't read it yet but my book on iguana care is no longer alone in my reptile book section. 
If anyone needs a book on cockatiels though I have so damn many of those. Like 2 copies of the same book has happened twice now. Like: ""I have 2 copies of a book about breeding oxkteila. I have one cockatiel.""",,,1,0,0,
92338401-4c21-40e9-9544-2873f6d9551b,1506126222,"Ok. Yeah. Are we counting my weird reaction to a perfect test grade as being pragmatic? Because I'd call that temporary insanity. 

Like looked at the grade and it's an online grade book so I can obsessively stalk my grades as much as I like. We won't be opening the music class tab for a while because I bombed that quiz. 


But anyway in psych I made a perfect grade 50/50 and my reaction was ""I did the extreme credit so that means I must've missed arphnd 3/50+ questions to get this grade. So I didn't earn this grade on my own. It's cheating.""
Like the fuck? I did the homework on my own(with the ad stance of my textbook because that's where the professor told us to get the answers to the homework.[which litterslly jjst boost test greases for ya. It's kinda like ""hold up we don't have to do homework for your class?] and I just spent like 10-15 minutes freaking out and my friend was kinda like its not gonna show up that extra credit is why I have the grade but that was my reaction.


The 87 I made on my college algebra test oh yeah I was like ""this has to be wrong there's no way I did this well."" Apparently I did. I can do math. Kinda I'm not exactly great with numbers. They're stupid invented concepts that drive me insane 


Anyway.....yeah less defeatist. Or maybe just a hell of a lot more determined because someone told me I was incapable of what I wanted to do. Like ""okay and now I have to prove you wrong I had plans.""

I did not have plans unless we're Clinton sitting on my couch with a pint of Ben and Jerry's and crime procedurally/sitcoms 

I seriously need to make friends in my area. Everyone's mkves. ",,,1,0,0,
31fb8cfc-fcc7-4fbd-8b39-7fff81423919,1506050463,If it's three floors and I was capable I would take the stairs. My muscle weakness is what causes me to use a wheelchair and hence an elevator even for one floor,,,3,0,0,
060474bf-b410-4553-bc32-04de13692491,1506096299,"It's a theory developed by disabled activists. It's a replacement for the Medical Model of Disability.

The Medical Model of Disability argues that disabilities are a deviance or corruption from the norm and that they must be treated and fixed. The Medical Model suggests that the burden of accessibility is on the individual because their bodies don't ""work right,"" and advocates for accessibility only when it is absolutely necessary. 

The Social Model of Disability argues that we are more disabled by society than our bodies. This is why, in disability culture, we're seeing a switch in terminology from ""people with disabilities"" to ""disabled people."" The Social Model suggests that we are ultimately disabled by society only catering to a narrow set of body types and functions. The Social Model puts the burden of accessibility on social structure, and advocates for broad accessibility and accommodations instead of pinpointing treatment for individual disabilities.

The Social Model isn't perfect, but it's a step in the right direction of unifying and empowering disabled people.",,,2,0,0,
31fb8cfc-fcc7-4fbd-8b39-7fff81423919,1506101037,Yep.. I never said disabled people are bad.,,,1,0,0,
6bd9e28b-183c-4865-bb04-8f719ba594b1,1506092758,"...or point out how 'weak' all those cardiac patients must be on the 5th floor of the local hospital, and how the government should just 'put them down' or something.",,,1,0,0,
92338401-4c21-40e9-9544-2873f6d9551b,1506094484,What's the social model of disability? I don't believe I'm familiar and sounds really interesting. ,,,2,0,0,
31fb8cfc-fcc7-4fbd-8b39-7fff81423919,1506129017,I meant pragmatic because you seem to be investing or at least thinking about a backup plan,,,1,0,0,
92338401-4c21-40e9-9544-2873f6d9551b,1506094408,Real question: whys this comment get down ores? The point the comment made is extremely valid and makes perfect sense.,,,1,0,0,
92338401-4c21-40e9-9544-2873f6d9551b,1506097675,"Stem field? 

Sciene Technology Engineering and Maths.

The name for my actual major is too damn long to type using an iPhone keyboard when you have one parrot trying to eat or phone and the other wanting to mess with your dog

But they're back in their cages and my calmest little parrot is chilling on a perch:

My actual major is organismal biology and ecology. I'm thinking minoring in either communications or education because I need one or the other for what I want to do with my life. Well at least it will increase my chances of getting hired and I 100% cannot live with my parents my entire life. Well I could but I'm pretty sure half of my family is terrafued of some of the animals I like. Like my sister went ""why is it never ""oh let's get a dog"" whys it always ""pooh look parrot"" or ""look lizard.""""

And BS is the abbreviation for Bachelor's of Science. 

I guess in theory I could get my masters and be a college professor or high school teacher of all else fails but umm no thank you. But I'll take the back up plan that doesn't involve ""hey teach little children music.""
Like no. Do not give me the repairs nobility for a bunch of little kids. I once lost one in Walmart. We found him he was fine. And yet I still have to babysit that kid. Like did his mother not get the hint that I am not qualified to be responsible for her children?  Apparently not. Because his little sister spent her entire summer hanging out with me. 4 year old had a very interesting visit to a vet's office and saw what I look like when low key trying not to look like I was losing it under pressure. I can actually function fairly well under pressure just ill probably be yelling instructions at whoever is around.

My little sister was kinda like ""okay then...""",,,2,0,0,
464a0b84-9cf6-468e-888a-994835cb3ab3,1506129952,"As someone going through the nightmare of that system, that is part of the problem. As my doctors have told me it isn't a prescription. It is more of a recommendation, they tell me that is as much as they can do.",,,5,0,0,
b5a11fcb-af7f-4d44-a7b8-2cb7a6c02a4a,1506178897,"Yeah but there are so many ways to consume and use cannabis, pills, lotions, sprays etc. And many options that don't include the psychoactive part. I've know cancer patients who needed to take care of their children, also who got denied disability so they had to try to find a job but couldn't because they used cbd oil. People drink alcohol and it has much worse effects but it's still legal and doesn't show up on drug tests, and even f it did no one would bat an eyr. If you don't do it on the job and don't come in high what's the problem? It's the same thing with narcotics but they give a pass on that. Although with heavy machinery I can that. Wouldn't you rather have people work then use government money, that's what I thought people wanted?",,,4,0,0,
b5a11fcb-af7f-4d44-a7b8-2cb7a6c02a4a,1506180895,"Never said you can't feel that way, but how can people find work . Opiates are much worse. CDB derivded from cannabis is not legal in all fifty states. The government had a pattent called Patent No. 6630507, which covers the use of cannabinoids for treating a wide range of diseases. Because cannabis is illegal anyone with procession even if they are dying with a medical card can be arrested and prosecuted, is that fair? 

This is from the cancer society ""More recently, scientists reported that THC and other cannabinoids such as CBD slow growth and/or cause death in certain types of cancer cells growing in lab dishes. Some animal studies also suggest certain cannabinoids may slow growth and reduce spread of some forms of cancer."" There are also many reports of people going into remission and beating cancer because of cannabis. Opioids should be illegal or even more controlled, number one cause of death in the US under the age of 50 is prescription drug overdoses. 

It's not just for seizures man. ",,,3,0,0,
fe21bfb6-29f5-4b7a-ab33-ba8d9cfc0252,1506275187,It's really ridiculous! It's funny cause my doctor is younger. When she asked me if I smoked weed and I said yes she got all rude with me and acted like I was dealing crack lol! I think soon enough they will start allowing smoke breaks at work for it �� can't wait for that day! ,,,2,0,0,
fe21bfb6-29f5-4b7a-ab33-ba8d9cfc0252,1506202473,I would totally do this OP! I know a couple ppl that do this and have never had a problem �� I also agree with LucidTopiary that it sucks you have to resort to trickery to find a job! I also agree that alcohol is way worse then weed will ever be! You don't hear of anyone getting stoned and getting behind the wheel of a car and killing anyone but you certainly hear of it all the time with alcohol! A drunk driver killed my sister! Plus I was a bartender for 8yrs and I seen firsthand what alcohol can do to a person and how it changes people! ,,,2,0,0,
b5a11fcb-af7f-4d44-a7b8-2cb7a6c02a4a,1506123602,Yeah but it's medical cannnabis and employers can just say no .,,,3,0,0,
7c974207-802b-4dd7-be3b-58b6149370a2,1506160662,"It's a real shame your being stigmatised for something that works for you. If there not understanding then I'd say take it into your own hands and go down the fake urine route to get the job you want. This device (https://www.thewhizzinator.com/) called the 'whizzinator' amusingly is basically a fake penis connected to apparatus with fake urine which is kept at body temperature and will fool the test. So even if it's an observed urine test then you can fool the observer!

Its a shame you have to resort to trickery however you are certainly on the moral high ground on this one!",,,2,0,0,
fe21bfb6-29f5-4b7a-ab33-ba8d9cfc0252,1506202129,I live in WA state and even tho its legal to buy here it's still federally illegal! Dumb!! And with my primary doctor I was receiving 12 5/325 norcos a month for my migraines and she told me that I wasn't allowed to smoke weed while getting those pain meds! What a joke! I told her she can keep her meds and I'll keep mine lol,,,2,0,0,
ace08e50-b41e-490a-8082-8faf6c2265cf,1506265686,"I think it depends on the job. If it's legal in your state, you may be able to talk with them and see if it fits into their drug policy. They may be able to make an exception if you have a prescription. Also not all jobs require drug tests.",,,3,0,0,
b5a11fcb-af7f-4d44-a7b8-2cb7a6c02a4a,1506179670,"But who's to say they don't do any legal drugs? You never know, there's a sterotype that some surgeons like to drink but no one bans alcohol consumption.And jobs that don't require precision and things like surgery it doesn't really matter. That's why I brought up heavy machinery. You don't require much to do janitorial work, secretary work etc. Cbd oil can still show up on drug tests. 

You don't want people to not work and be a burden on society? ",,,2,0,0,
f0762d86-1dde-4d4a-bee5-8892436dc371,1506115130,"I have a feeling the other poster is correct, still being federally illegal. I'm in the same position, so I'll be interested to hear if anyone has personal experience with this.  ",,,5,0,0,
37e14f4d-8e5f-4536-add8-9506603755e3,1506123103,Do prescriptions count for nothing? I take medications that make me fail urine tests. My understanding from that situation is that the testing company contacts you to verify your prescriptions. ,,,1,0,0,
f0762d86-1dde-4d4a-bee5-8892436dc371,1506136939,"Part of the problem, as much as no one wants to bring that into things, is the politics. Every doc I've seen to try to get help with disability recommends pharms and some even go so far as to recommend addiction therapy. I wish pharms worked for me (it would a hell of a lot cheaper with insurance) but I've been through so many, and now that I've found something that works it would be hard to say the least to go back to being a lab rat.    
If you don't mind me asking, is the medication you take mmj? if not, that might be why you get a pass with a prescription.  ",,,2,0,0,
d42770b1-9f84-462c-9536-090461a2ff56,1506110770,"Unfortunately, my understanding is that you're out of luck. Because marijuana remains illegal at the federal level, a judge is unlikely to side with you on this one. I believe some states with recreational markets may have passed laws (or are trying to) that prevent someone (in certain fields) from being fired if they have a medical card but, if so, that will depend heavily on where you are. It's possible to get an employer who won't care (they may be more interested in positive results for other substances) but that's a total crapshoot. ",,,7,0,0,
c14f29b9-a9d5-4c6e-93d0-5e3d1bb07340,1506118005,"Basically find a job that doesn't piss test, or get some fake pee",,,2,0,0,
f0762d86-1dde-4d4a-bee5-8892436dc371,1506274838,"Yeah my doctors don't respond to well to it here in ct, they really want me to try pharms again.  I think it's so odd workplaces here allow smoke breaks for cigarettes but try medicating (not just smoke breaks, piss tests) and you'll probably get fired/ not hired at all.   ",,,2,0,0,
