commentator_id,created_utc,anonymized_body,ups,downs,score,controversiality,gilded,distinguished
98258667-73a0-442d-b8f7-98d4b4ad2629,1554236090,"I have a couple of thoughts. The first is that you sound super depressed (I mean that with all the love in the world) and if you're not already that should be addressed. It's really hard to like doing things when you're depressed, I've been there. 

The second is do you enjoy reading at all? I ask because you're a rambler like me, and I thought maybe that means you like words and stories as much as I do. Or maybe you would. Would you be able to make a trip to the library? I know you say you're not comfortable volunteering, but this would be a little different. There wouldn't be any expectations of you, and they have comfortable seating usually. They're free, and if you're in a populated enough area they probably have a huge selection of things. Not just books but magazines, movies, graphic novels, music, audiobooks. Some will have regular events like free showings of old movies and art/culture exhibits. I love my library, and I think it might be a more engaging way to discover new interests? It's a lovely way to kill an afternoon regardless. 

Beyond that, I love going to parks on weekend mornings/early afternoons. They're usually pretty empty (great for my social anxiety) and I'll take a walk or sit under a tree with my dog. On that note, I get all my errands done when everyone else is at work to avoid the crowds. No one is at the store at 9:30 AM on a Monday. I'm a writer, so sometimes when I need to get out of the house I'll just go to a coffee shop with my laptop. I've gotten to know the owner and we're friendly. I really like tabletop and role playing games, sometimes I'll go down to my local game shop and talk with the people who work there about their games, sometimes they'll have demos and they'll sit down and play with me. I know my shop hosts D&amp;D groups and others, that's a great place to meet other people who won't make you feel weird for having social anxiety. There are also online groups you can join where you won't have to leave the house.

Other suggestions that don't involve leaving: for music, have you tried websites like musicroamer that help you find related music? I thought mathcore was dead before I decided to look up some of my favorite bands from high school. Started going to concerts again (which is a terrible idea medically speaking but way too much fun) which is great. I also spend a lot of time writing, but if that's not your thing that's cool. I'm a PC gamer, I'm embarrassed by how many hours I've logged on my origin account. Lately I've been thinking about getting into programming, mainly so I can getting into making my own mods. Programming is relatively easy to teach yourself online, and there are stupid amounts of applications. You can even earn some side money once you get good. I buy adult coloring books, which sounds weird but it's oddly soothing. I read voraciously, I've been working through some old classics that just got added to the free domain. I spend a lot of time on subreddits like this talking to people like me. 

Anyway, I hope you at least get some ideas from this. I think I may have rambled too lol. Good luck with everything, OP. ",,,2,0,0,
4d6b8256-0dc1-4034-b913-7a32c1a033ea,1555191491,It's like he wants to take disabled people's rights to privacy away. I have really bad depression. But sometimes I take pictures of myself &amp; i'm smiling. Doesn't mean I don't have depression. Even one guy from a old friend from church who I also see on the metro link. Figured out I  have depression because he's noticed my mood swings a few times &amp; he doesn't know me that well. But online I put on a front. Because I don't want to be seen as negative,,,2,0,0,
08342311-2fc3-4412-8d48-106431b14d80,1556489233,You need some of those badass gloves.,,,2,0,0,
c301d24f-49a6-4937-8df4-13d313b21405,1556306898,"This was one of my thoughts as well. I struggled with gaining accessibility at school and other places without any kind of diagnosis, and I know for a fact that they judge this harshly for SSDI. You mentioned that you’re young as well, and they tend to blanket deny anyone who is under 50 and not legally blind or missing limbs.

Hang in there, and definitely get a lawyer. I was also denied after appeal, and am waiting for my hearing date. It is a VERY long and difficult process, but hopefully worth it in the end. Hopefully you’re somewhere the courts are not so backlogged that you’re waiting two years from the date that you request a hearing. This is completely normal even if it’s messed up, and you likely still have a shot.

An attorney also might be able to help you find other doctors in your area that may be more willing and able to help. You’ll need a geneticist to diagnose EDS, and possibly a rheumatologist knowledgeable about Fibromyalgia (as in actually KNOWS up to date info on it as opposed to using it as a blanket diagnosis for autoimmune pain that doesn’t test positive for Lupus, RA, or other diagnoses that can actually be tested for.)",,,1,0,0,
41064adf-0627-45a0-8630-4c521b40ad65,1555359151,"Exactly. I think people don't realise for a lot of us with disability who can't get out much, social media is almost the entirety of our social experience.",,,9,0,0,
ffef4222-0a61-47e6-a34e-2faeb98903a5,1554494168,"I don’t use a wheelchair but I have a white cane (for visual impairment) and I can still see my phone but I’m scared to use my phone whilst holding my cane because there have been memes etc of visually impaired people using phones while holding their cane because people don’t see, to know about accessibility features on phones ����‍♀️",,,2,0,0,
b8678d6a-f4dd-4cdf-b45f-740beeae0692,1556308445,Tbh there is only one family member of mine that has done that and they were cut out by my entire family for other toxic behaviour,,,2,0,0,
63f81259-c556-4a75-8706-8906fcbc87d0,1556137259,"I won't be able to check the model of his phone until next week unfortunately, but I know it's a Nokia, probably from 2017 or early 2018 and in a lower price range. 

&amp;#x200B;

He does not browse the internet at all and makes no use of social media, so any app he might end up using only needs to work through standard SMS messages. Another hassle is that he only wants *that* text read aloud, and TalkBack with single-touch input + no selector unfortunately recites everything he taps, which causes him some embarrassment. Not to mention, he often triggers the shake-to-enable feature accidentally, but struggles to do so deliberately. 

&amp;#x200B;

Thank you for your time and I appreciate any suggestions you might have.",,,1,0,0,
d2ea8360-8e19-46ac-9517-d5bde7a950e3,1555882916,Maybe she could learn to use her feet or mouth?,,,1,0,0,
a27cce6c-c850-4b86-88d6-82fb1b0bf4bf,1554765430,"Well, this definitely doesn’t sound like someone with a fetish...",,,1,0,0,
95a44b1b-b8d5-4437-8ac7-ab4a7ae32f36,1556139984,"It seems like the plan is to restrict most parking placards. My guess is that this is inappropriate, but neither the response nor the original article details what exactly would be changed.",,,1,0,0,
81518809-3037-4c67-ab11-2a7900edbfb7,1556317220,"You said that if you earn over $880, the application will be denied. It's actually $1220.",,,1,0,0,
0d307b8e-76c3-4e0e-a91c-22f233b72f26,1555543520,"I use KFOs, and my holy grail shoes are definitely Timberland boots.
They last for forever - I've had my current pair for 2.5 years now (modified with shoe lifts)",,,1,0,0,
7e280863-e709-456b-a69d-6c57787c70b9,1556059543,"I'm curious how many people take offense to things being referred to as ""lame"", now that you mention it.",,,2,0,0,
7a8adfe0-b3bb-42b1-8e1d-493cd5ecfe68,1554941770,"If you need it, use it. If it can ease your pain enough to let you focus on bigger and better things, do so. You'll get no judgment from me!",,,1,0,0,
8813d837-a781-4ea0-887e-279895ad63de,1556064469,Seriously. I could get away with murder if I was in an airport wheelchair. Instant invisibility.,,,1,0,0,
c52d51b9-5c84-421d-93a7-69936ae578f9,1554339169,"You might also want to check out r/disabledgamers that subreddit is not as active as this sub, but there is regular content posted there specifically about video gaming and people with disabilities.

You should expect the same objections to or reservations about the generalized use of inconvenienced instead of disabled over there as you have heard here. Best wishes!",,,2,0,0,
2ff66ffd-1d31-4c58-9bea-82ea4a9ea0ed,1555896638,Thank you very much for this great info. :),,,1,0,0,
53214170-3871-43a4-8c94-38b49ab53931,1556156140,"Yeah, I'm short, I'd need stool to reach.",,,2,0,0,
f4d18fa8-4341-4c9e-9b7b-df64934a1b8c,1554428784,"I also need the handrails for safety, especially on a bad day. On a really good day I can sometimes flat-palm the wall of the stall to brace myself, and at family member's homes I do this weird thing where I put my hand directly on the toilet seat between my legs and lower myself down though this has sometimes caused elbow and shoulder injuries - But I am NOT putting my hand on the seat of a public toilet, even though my bum is going on the seat, something about putting my hand on the seat just feels too disgusting. And being alone in a public toilet is the last place I want to injure myself or fall, so handrails are important for me.

Anyway, I was on a holiday with my partner in a new state and I was using my crutches so I definitely needed handrails, the bathroom at this park was surprisingly well equipped, they had a male and female wheelchair accessible stall at the front as opposed to just 1 wheelchair accessible stall, and then the standard male and female bathrooms where through a heavy door off to the side. (Not so great for non-binary folk though :/ )

I was busting and unfortunately both wheelchair accessible stalls where occupied because that was also the baby-changing station/family bathroom. So I clenched and waited. While I was waiting a man on crutches walked up, and didn't even blink at the accessible stalls, he just walked right into the standard male bathrooms. 

So I sort of had this moment of ""is there something he knows that I don't, is there a stall in there I can use?"" and asked my partner to open the heavy door for me.

As soon as I got into the standard stall section there was this sign on one of the stall doors [""Ambulatory stall""](https://imgur.com/NMCLbAh) and low and behold, it was a standard width stall, with handrails!

We continued on our holiday, and over the next 3 days, every single major building or major park with a public toilet I went to, I checked in the standard stall section and EVERY SINGLE BATHROOM had an ambulatory stall *as well* as a wheelchair accessible stall.

I could not shut up about the bathrooms and my partner kept laughing that my first time travelling out of my home state (Victoria) to a new state (Tasmania) and the thing I loved most was the public toilets. They could still be better, having the *only* baby change station in the wheelchair accessible stall means that able-bodied parents take up a stall that people with wheelchairs need. And the baby changing station in that stall is set to an able-bodied persons height so parents who are also wheelchair users can't change their babies. Having both a wheelchair acsessible stall *and* an ambulatory stall is great though because it means someone in my situation doesn't need to take up the wheelchair accessible stall, But the signage could be better because there was no indication from the front of the building that there was an ambulatory stall inside the main bathroom.

It's common in Australia for the wheelchair acsessible stall to be seperate from the other stalls, so this isn't unique, It was the ambulatory stall that was new to me!

[Here's what the bathroom looked like](https://imgur.com/7oXM7i8) for anyone confused by my description.",,,2,0,0,
bdc697b0-0b41-4a64-bdf3-f4ba65371b11,1556418099,"I’m in Arizona. 

Several years ago the state of Arizona gave much of its Medicaid insurance deliver system to a for profit  called Cenpatico (owned by Centene, a publicly traded company; currently known as Arizona Complete Health.  Since then Cenpatico has a near monopoly on local public health services. They’re also the major funder if local health non-profits, many of which have closed due to having their funding slashed. 

Search “mueller Cenpatico” for more. 

I’ve written to local and state politicians. I’ve tried Cenpatico, AHCCCS, the local paper, a fundraiser, family members, etc. Aside from getting into a story I’m the local paper, I’ve gotten nowhere when it comes to gaining access to essential medical care. 

It doesn’t help that the state of AZ is broke as is the city where I live. I know there are plenty of others in situations similar to mine. None of them have had any ideas beyond what I’ve tried. I’ve asked during support groups. 

This is why I’m going for the student loan angle. There aren’t other angles to play.",,,3,0,0,
afad3370-687a-4621-8fd6-db0f91da78ae,1555813510,"Don’t waste your time fretting about what lesser minds think about you.

Just think of how sad those poor trolls are that they feel the need to bully people online. They will probably die at an early age from some self-induced stress-related injury. So for us disabled people, we know we are better than them since we’ve been through tragedy and it wasn’t our fault.

Trolls are plebs and not worth feeding.

Don’t feed the trolls!",,,6,0,0,
3cb7d812-b7a3-4c50-9dec-994b924d0ba2,1554864385,Thank you. That means a whole lot. &lt;3,,,2,0,0,
492c15b3-0640-4b78-a565-74eb92ac5f61,1554093735,"My dream is to get a mini fridge.  If nothing else than to keep drinks cool in the summer.  I can't afford it but like i literally have dreams about it so often that when i wake up im confused about if i actually do have one or not.  

I lived in a small (converted hotel room)  apartment when i was 21 and there was no kitchen.  I had a mini fridge there and had a microwave on top and a toaster oven as well.  They do take up space but it's convenient to have all of that right next to you.  I ate so many baked potatoes back then.  ",,,1,0,0,
ba452430-62ce-46dc-9207-a13ecd0ba570,1554782654,"If he could get up from the floor by the door where there were no grab bars, that's unlikely. Either way, it's a women's handicap stall, not the dressing room at Nordstrom, not a phone booth, not a vanity. There were 30 unoccupied stalls and a huge makeup area because this was a stadium. 

Being that this was the monster's ball tour, pre-2012, gay marriage wasn't legal yet, AND it was the South, it's just not a great idea in the first place. Had it been half of the girls I knew had tickets that he pushed past, the cops could have easily been called, and at the very least back then you'd get kicked out of the venue. I didn't want that to happen, so I just knocked at 10 and at 15 minutes. That's an absurdly long time to use the stall without actually sitting on the toilet, whereas I would have been in and out in 2 minutes.",,,4,0,0,
1a5fb2e5-420d-4e5c-bc3d-b4a606fa3e7c,1554699376,"I mean if the bonuses aren't worth your time, i don't know what is. It’s definitely the only way I can make $200-$1000 an hour",,,1,0,0,
5d8fcb61-10fc-4404-ad1b-6faea8dcd780,1555046710,"I think that’s kind of an unthoughtful thing to say to me because whether or not I was ill and struggling then (I was), and whether or not a social worker or doctor warned me (they didn’t—and I only knew about loss of SSI), I am indeed married now. It cannot be undone without a complete upheaval of my life and a divorce in two different countries. 

My husband wasn’t disposable. He’s my life partner, my number one emotional support, and my best friend. And we had been through so much together. 

We are from different countries. If we wanted to live together, one of the following had to happen:

1. me move to his country (that’s a no due to disability reasons, although we did try to make it happen.)

2. him get lucky with the immigration lottery

3. him get lucky with finding a job in the US and getting an H1B visa

4. us spending a lot of money we didn’t have on a doctoral program at an American university 

5. us getting married


Options 1-4 were ruled out over the years, so #5 it was, which was what we really wanted anyways. 

Cohabiting without marriage impacts Medicaid coverages anyways.

Edit: I will add that I didn’t have more clear diagnoses until recently despite being low*er* functioning and in need of strong supports since childhood. (I am getting worse, too.) 
 I was constantly and aggressively pushed into normalcy by my family with no respect for or acknowledgement of my limitations. I didn’t apply for SSI until 2017. Only recently have I realized that I cannot earn a Ph.D. (or probably even finish my bachelor’s) or have children.",,,1,0,0,
a94a26a2-2cd6-44e4-affd-6856acf2dc96,1556254859,"I mentioned this above. One of the nurses in the hospital demonstrated proper handling by stopping the person nicely, acknowledging their intention and educating them. Explain why you are uncomfortable or find their reaction offensive or rude. Coworkers can be difficult so you might try humor, To the “amazed you work at all” say something like “Thanks a lot, Do I look THAT bad today?! Is it my eyeshadow?” Following up with a Hey, I took it as a compliment but another disabled person probably wouldn’t. Explain why. For the religious crazies, same thing. I know you mean well, but I try not to focus on my disability and what makes me different. There are disabled people who might find it a tad offensive and prefer to be acknowledged for their other qualities..or Hey, I appreciate the thought but I’m uncomfortable with that. It makes me feel like all you see are the speed bumps that I have worked really hard to overcome and I’d rather not look back to see how much road kill I may or may not be responsible for while I was speeding along...",,,1,0,0,
39049bf8-b0e9-4c11-a45f-8cafb019a1bc,1555051088,gravel is the devil and cobblestones are his brother,,,2,0,0,
bdcda70d-faa6-4ecc-af9d-eebe3f3e3c0c,1555481094,"I was pretty impressed by how accessible a lot of downtown Honolulu was. There were a lot of hotel pools with lifts and ramps.

Also check out [AccesSurf](https://www.accessurf.org) if you head over there. They have adaptive surf and swim clinics and are super rad.",,,2,0,0,
4cd701f7-cdd0-4ed4-8fad-067623073d3a,1556604965,"I hear you. I have a mobility scooter and have RA, my ankles burn and sting when I walk on them over about 10 M. I get people ask me all the time  ""if you can walk why do you need the scooter? "" very frustrating",,,7,0,0,
caba63cd-ed7f-46d8-8e19-9740273400c5,1556440507,"Is this in the US?  If it is, a few tips:

1) Get a lawyer. Absolutely. It is incredibly difficult to get approved for disability and you’re already working against an incomplete file. Lawyers know exactly the key terms and phrases that the courts greenlight.

2) You don’t have to pay a lawyer up front, they take a percentage from the back pay you get from disability, and there are laws about how much they can take so they won’t be predatory

3). I had confirmations from 9 specialists &amp; 5 surgeries, and SSA’s own doctor said I’d be disabled. They *STILL* denied me

4) It took me 3 years to get I front of a judge, where she look one look at me and apologized for dragging me in, and threw out the old judgement, but at that point, I had my lawyer.  If I’d gotten him right away I might have saved myself 3 years of trouble. In the end I paid him the same amount I would have paid him from the start, but I lost 3 years.",,,2,0,0,
31af4d96-b9ae-4ea7-aeef-cc03d8cd88bc,1554362025,"I don't look like I need the accessible stall/toilet, but I do, and this makes it so much worse for people like me. It's a bit disheartening when people in chairs/with visible disabilities get annoyed with me for using the toilet I need, but I completely understand it considering how many people like this exist.

I also go to comic conventions a lot, and people use the accessible toilets to change out of their cosplay when it's explicitly said that they need to plan better to not inconvenience people who need the accessible toilet. Good on the organisers, not good on the people who don't listen.",,,32,0,0,
15498052-c77f-4b9b-b25c-abccca171dae,1554726762,"Is there any organisations that sort out work adaptations for people. You are classed as disabled as you have limited use of your wrists and hands. There are many adaptations you can use such as dictaphone apps for the computer, specialist mouse kettle tippers etc you need an occupational therapist to look at your home and work to help you figure out the stuff that will help you adapt. Things like electric can openers and specialist cooking equipment can help loads",,,2,0,0,
9211df50-d385-4c65-a6cb-07dd996688fb,1555419392,I thought it was only opening packages that was illegal?,,,9,0,0,
589f63c3-bad5-4542-ac39-e0e5a5dc6591,1555250971,"So, it's a form of bocce? Cool!",,,5,0,0,
dcb515ff-3dd2-4fe4-9b6e-f7576773b218,1555252106,"Boccia England cup is next month and there’re paralympians there, so for someone who’s literally 14 I’m terrified

Pretty sure if I score a point I’ll be doing well!",,,1,0,0,
5d8fcb61-10fc-4404-ad1b-6faea8dcd780,1555075006,"Maybe it covers different things in different areas—maybe some agencies are more liberal in its definition? I was evaluated and my GP specifically cited decreasing ability to perform ADLs. Therapist and psychiatrist said the same.

I hardly shower and use a shower chair for balance. I have orthostatic intolerance, so I have to spend a lot of time in bed. I’m mostly housebound. I have good (productive) days and bad, though. The good days wreck my body.

I’ll have to ask about ARHMS (adult rehabilitate mental health services) or ILS (independent living services). Maybe those were the programs that the social worker said I was disqualified for because I don’t live alone.",,,1,0,0,
256310ec-9a7e-417c-84eb-7474c7a78a10,1554658326,"Able-bodied is offensive as it's only used when talking in relation to disabled people. My wheelchair makes me able bodied, so it just confuses the narrative.

&amp;#x200B;

Is an elderly person able- bodied?",,,1,0,0,
ae4bfd87-1bb8-44bd-8a17-554c7029dca2,1556117040,"More like doing a lot of of coke and then trying to sleep. There isn't a way to boot strap your self out of a serious hypo or manic or episode. What you're saying equates to ""just try harder."" and that is incredibly stigmatizing and gives in to the stereotype that people with SPMI have a character flaw and aren't doing enough to take care of their mental health.",,,1,0,0,
9a87f7bd-f325-4ee4-b36f-aca4d3d08e75,1554475790,"I'm in the same boat as you. Got my CDR review this last Monday and I'm worried because 3 years ago they said they thought my conditions would improve (PTSD, Major Depressive disorder, Lumbar Spondylosis, Neuropathy, facet degeneration). I've got an advocate who is helping me but I'm still on edge cause I know they want to take my benefits. Good luck to us both ",,,1,0,0,
8f6dd056-fbb1-42fb-b055-9019c0f77971,1554310316,"That's it?  Where are you from, how old are you, male or female?  What IS your first language?  What else (if anything) do you like to do besides draw?   What kind of stuff do you draw?  Do you have any drawings online that I could see?  ETC.",,,1,0,0,
589f63c3-bad5-4542-ac39-e0e5a5dc6591,1555780874,Her local congressperson.  Seriously; this is the kind of thing they eat up.,,,9,0,0,
3c4f6702-fd95-4dec-a6c7-44d0cdacd6ac,1555865520,"You also forgot the part of ""everybody will wait for me to come back from smoke area"", ""I will intoxicate everybody with the smell of my cigarettes"", ""I will reply late\[er\] to emails, chat messages, phones, once I finish and come back from smoke area"".",,,22,0,0,
2bc19789-4a7c-479b-8762-fcc171d475af,1555004422,Hang in there. The ones I know of have almost died multiple times from just trying to manage the pain. They have PTSD from hospitals because of the carelessness of staff about not washing their hands and handling their ports.   Shit I would too. Knowing how completely preventable that stuff is yet having nurses roll their eyes when you ask them to wash their hands. They should know just as much as the patient how important that is so it's like rolling your eyes at someone that is asking you to not kill them by washing your hands.  Just ridiculous!,,,3,0,0,
98258667-73a0-442d-b8f7-98d4b4ad2629,1554673523,"I'm sorry, I laughed out loud when you said they hired a driving instructor. That's just so unhelpful and counter-intuitive, it sounds like a bad joke. Maybe they thought it might have some crossover with mobility training? Sheesh, I'm glad you're an adult now and you can make your own decisions. ",,,3,0,0,
7f6d17da-fe69-45f9-a39d-b5cdaf2f8d73,1555190362,Well its certainly shut down our discussion,,,4,0,0,
