commentator_id,created_utc,anonymized_body,ups,downs,score,controversiality,gilded,distinguished
c35b34da-6786-488e-983a-ccdbd835032c,1554596767,"Yikes, I'm sorry. I wish the system were better ",,,1,0,0,
f9f54438-f5c9-44db-bfb1-2937dd5d89a7,1554252244,"Teaching (well) is a very intense career and I could see how you might be leery of going that route.  However, you might consider determining if there are potential accommodations that might help you in the classroom.  Good written communication skills are a valuable commodity in the workplace, so there are a lot of options for you.  My undergraduate degree is in Professional and Technical Communication (switched to that after abandoning English secondary education).  Worked as a grant writer and project manager for a few years and then transitioned to public safety management.  I used my writing skills extensively in both.  

There are also a lot of legitimate work from home jobs.  You might contact the Department for Vocational Rehabilitation to see if they can point you in the right direction.  Good luck!",,,2,0,0,
bd26d6ba-eedc-452a-8f08-1ad9915e77f6,1555547863,"You'll see opportunities for small kindnesses. You can do those. But yeah, we can't change other people. Good luck.",,,1,0,0,
f6e8da8b-ea8b-437a-8eee-17e0aaab1339,1556066057,"https://www.bodypoint.com/ECommerce/category/lower-body/ankle-huggers
Did you used to have these thingies (see link)? If so, they are sold by Bodypoint. I’ve noticed Permobil stopped selling a lot of Bodypoint accessories that they used to offer.",,,1,0,0,
4c2e48bd-245a-48c7-890e-9457b68cdfc5,1555550155,Thank you so much! This is very helpful and sweet,,,1,0,0,
f12fe83b-e94f-47d6-9830-5e498e85f80e,1554602448,"You are probably better off not working and collecting SSI. 

The Social Security Agency makes so many great sounding promises to get disabled people to work. Then they start slashing benefits--because you're now not unfit to work--and you have to go through a bunch of hoops to get assistance started again.",,,12,0,0,
f92fcf62-0a19-44b3-92b0-313999efa810,1555810782,"That doesn't help me though. I have trouble eating, and when I do eat it's hard to get enough calories to make any ground. So just eating more, changing when I eat, and eating certain things, don't actually help me.",,,1,0,0,
f4707d69-87b9-42a1-84c6-a55813e4b0c4,1554256710,"Is there a r/ADAfail subreddit?  There should be.  

Architects design something very of even adequately-ADA-friendly for wheelchairs, and the owners/tenants just F it up.  Happens all the time!!!  (This big space designated for wheelchair-accessibility is a great place to put a big-huge plant/extra-restaurant table/or whatever.  Jerks.",,,25,0,0,
bd74173e-3a5a-4875-8bab-d86704e19f24,1555217839,It's also just a beautiful RV all around! Congratulations!,,,5,0,0,
a38e649b-cc97-4f7d-be4b-7469cbec73bf,1554101615,Thank you for this. I really appreciate it. That must have been a really awful ordeal. I will give them a call in the morning. ,,,3,0,0,
a4c52be1-4b38-494a-ac70-7ef5be27b652,1554188825,"Well 10,000 people each year die waiting for disability, so you'll have to draw your own conclusions.  ",,,13,0,0,
1d6593ac-0047-47f0-8c64-207ff1301d56,1554965306,"&gt; Ignored because we don't have time to look at that because we are required by law to ALREADY REQUEST IT so you are wasting our time and your own tax dollars by sending it. Thanks.

Is this true? I always thought I had to submit everything myself. Is SSA getting the same stuff from my doctors that I would send in? I expect a CDR next year and my condition is not expected to change. I haven't engaged in any activities like work, volunteering or going to school but I have gone to the doctor less because there isn't much they can do so I just keep my regular appointments and don't go to the ER anymore since I know what the problem is.",,,1,0,0,
d98dda1f-b71d-4126-b786-3d258615c99e,1554112206,"I’ve gone through many times with several canes.  Once they remarked how heavy one was, I asked how heavy it was allowed to be, and they dropped it.  Another time they remarked that the handle came to a point.  I asked how pointy it was allowed to be and they went and got a pointyness measuring tool, told me I was on the line, but let it through.  I went home and took a lighter and a file and made it slightly less pointy.  They WILL take it and run it through X-ray and give you a loner, and take even that away during the actual scan.  Hope that helps.  ",,,4,0,0,
3ee5b77e-c82e-4228-85bd-92a5a9ca5224,1554288057,"Holyshit ... I'm a C6 incomplete quad and I work out 4 or so times a week. I can't even imagine seeing that. Honestly I would probably try to sue them if they tried enforce it. I mean of all people, I would almost say we need to work out the most. I can't tell you how extremely freeing it was to realize that I had attained a level of strength that would allow me to put myself back in my wheelchair if and when I fell out. before that there was always a shadow of fear any time I went anywhere by myself. It was small and it never really stopped me from doing to much, but there was always the knowledge that if something bad happened I may just be screwed. Because I was simply too weak if worst happened I would just have to lay there.
They probably do this because they're afraid of getting sued if someone falls off a machine and gets injured. That's life tho, you have to take risks if you want rewards. We all know that's going in. I've fallen several times at my gym. it just made me want to be stronger even more.
",,,9,0,0,
5c713954-35a4-40cb-a82f-7fe18f7be112,1556455668,What kind of diapers do you wear?   I prefer plastic covered ones at night but do wear clothlike ones during the day and they are breathable.,,,2,0,0,
20e174ef-86b3-4740-81a3-e6ab73e3b1e0,1555422218,If you have your social media accounts set to public then what do you expect? Of course they are watching.,,,1,0,0,
98258667-73a0-442d-b8f7-98d4b4ad2629,1554738351,"Okay, this is the first time you've explained it in a way that I understand. I love that your charity doesn't force labels onto people who reject those terms. That's awesome! 

I would have really loved if you'd explained this to me clearly and respectfully above as you've done here. I'm still not sure how asking a direct follow-up question was rude. I will tell you now that I wasn't questioning your charity or your position, it was a simple request for more information. 

And I didn't downvote you either, so if that's why you got so upset you shouldn't be coming for me. ",,,3,0,0,
8aecce2e-ae51-453a-8247-126a5236a166,1554135677,http://hyundaitruongchinh.info/temporary-handicap-ramps/,,,2,0,0,
507d610a-733c-4f39-b6a2-57da91f78d39,1555429716,"I do not. I agree that it’s something I should look into, but we’re moving to a new city this summer so I had planned to put it off til then.",,,1,0,0,
8f4c1b65-ec5d-47ec-9944-6db8fa6ab846,1555860784,"I live in the US where all restrooms are supposed to be accessible with at least one toilet that can be used by people with disabilities.

Unfortunately, these are also where the baby changing station is. As someone that needs an accessible toilet and in the past has used no aids and has dealt with a bitchy mother. I would recommend getting a RADAR key and accessing the locked toilet for the disabled.

&gt;Explaining I need to use the toilet when I don't 'look disabled' isn't a conversation I want either. As far as I'm concerned those toilets aren't meant for me, they're for those with more severe disabilities or who use wheelchairs who've no choice.

With your own key the explaining isn't neccessary and if you sometimes require a larger stall even though you don't look disabled you still are disabled so just use what you need, when you need it.

I do the same with accessible parking. I am disabled, I have a placard and the right to use a reserved spot though I do not use one 100% of the time. If there is an equally close spot or one that is closer I use it and leave the others for someone that needs the extra space more.",,,2,0,0,
8417e9a2-9b85-4c0e-a324-80207ea2d35f,1556206759,"Well, after a week of research i finally got the video made and uploaded. Closed Captions/Subtitles are available for anyone who needs them. Just click on English (United Kingdom).

&amp;#x200B;

[https://youtu.be/wTu69A-mavM](https://youtu.be/wTu69A-mavM)",,,1,0,0,
3a94d29d-d7b7-4128-b51f-eb0f82308dbb,1556119929,Even worse when they prey and nothing happens and they tell you that you clearly don't want to be better that's why nothing happened (mum and other people have told me this),,,11,0,0,
1cb2090c-2e4e-42c2-a6fd-4c7b9a007164,1555782018,Look at those ways to lose loose weight then do the opposite,,,1,0,0,
f7bf1a28-b6ee-42cd-bb75-2fd2fb422cba,1554999217,"You're totally right. The context and lack of background is definitely the problem with this video. Odds are, it was posted on facebook or instagram by a parent or family member and then taken by someone else and put on reddit. From there, people repost it for karma. It's one thing when people do this with pictures of dogs; it's something else entirely when they do it with children and target child with disabilities because 'they're cute' or 'inspiring'. I'm going to look around and see if I can find back story in this.",,,2,0,0,
c35b34da-6786-488e-983a-ccdbd835032c,1554745194,"The SSA has permission to check your bank account and you have 9 months to spend down the backpay before it counts as a resource.

And no you can't transfer assets, thats illegal",,,6,0,0,
d1808b08-79c3-4136-9126-396d169fb0b1,1554667043,"For physical disabilities, I prefer ""physiotypical"", by analogy with ""neurotypical"". I have a significant physical disability and use a wheelchair, but at the same time can do things with my body that some of my friends without disabilities can't, so why are they ""able-bodied"" while I'm not? (""Abled"" has the same problem.) 

More generally, ""non-disabled"" or ""people without disabilities"" will always work, although the double negative is a bit odd.",,,9,0,0,
39e4c401-9ea7-423d-b03b-09a235d88195,1555350718,"Google Docs online has free speech-to-text. I don't know about the quality but she could give it a try.  [https://support.google.com/docs/answer/4492226?hl=en](https://support.google.com/docs/answer/4492226?hl=en) . There's also Dictation, built into OSX.  [https://www.howtogeek.com/178636/use-voice-dictation-to-speak-to-your-mac/](https://www.howtogeek.com/178636/use-voice-dictation-to-speak-to-your-mac/)   


There are also ways to run PC software on Macs, so maybe look into that and she can use Dragon for Windows.",,,1,0,0,
53214170-3871-43a4-8c94-38b49ab53931,1555872281,Correct me if I'm wrong but wouldn't the motocyles still have a handicap plate or possibly placard? So wouldn't towing it be illegal? I know people will get harrased for parking in handicap spots when they don't look disabled but I've never heard of someone with a plate or placard getting towed.,,,2,0,0,
c52d51b9-5c84-421d-93a7-69936ae578f9,1554489527,"Illinois also has a state supplemental payment program for people receiving SSI. You can apply for this cash program, Medicaid and food stamps in Illinois through the state’s Department of Human Services. [https://www.dhs.state.il.us/page.aspx?item=45317](https://www.dhs.state.il.us/page.aspx?item=45317) 

I was not able to find information about payment amounts directly from the IL DHS, but this Illinois based nonprofit legal aid resource says that the cash supplemental generally is no more than $70 (for people receiving SSI and living in the community as opposed to a skill nursing facility) and the payment amount depends on your living expenses. See [https://www.illinoislegalaid.org/legal-information/am-i-eligible-aabd](https://www.illinoislegalaid.org/legal-information/am-i-eligible-aabd) ",,,2,0,0,
78d75fca-1796-4b8f-a4b1-015c310681d3,1556047893,"It depends if the world building incorporates a factor that makes it unrealistic. If you cannot think if a way a wheelchair bound character would get around a certain obstacle in that world, then yes.",,,2,0,0,
0d785d8d-4e86-4fb8-b2ca-18f52973d7c6,1555622506,"I agree it is a simple question with a simple answer. The problem is that there are other questions to ask. Some times the answers that are right for me aren’t right for you. I think I can make slightly more than what you said, but I can’t find my paperwork. I got the paperwork with all that, and more, information from when I went in for help from the DVR. 

If you are already receiving payment and you have a determination then most of the actual bullshit is behind you. There are opportunities available if you choose to use them.",,,1,0,0,
b0b464ca-d97a-4add-9411-3f25a3109b52,1555361951,"The thing is, they don't care about that. The system has no heart. It's less money for them if you fall through the cracks. I got bumped off of all my assistance right before Trump bragged again how much he'd improved the economy, had cut out reliance on Medicaid and food, and used the fact that people were off assistance to say the economy was getting better while I just wanted some decent food.

Edit: Sorry, from my end it looked like my reddit glitched and replied ten times.",,,8,0,0,
5ed4253f-c963-4f86-beec-cfd622891678,1554844965,"Great list! However, I wish there were more movies a about women with disabilities.",,,1,0,0,
e7df228a-cafc-416e-8afc-9601c3b0eb2a,1555540393,Thanks for this information. I am relearning to walk currently after being wheelchair dependent for 2 yrs. The walking process is going well except that I've gotten several bruises from my AFO's rubbing. It's nice to know other options are available.,,,2,0,0,
ee4c2470-84e0-4af3-9537-2280f990b64b,1555370394,Message me and I'll tell you about the college I went to.,,,1,0,0,
98258667-73a0-442d-b8f7-98d4b4ad2629,1554336856,"I'm definitely not going shopping, so I'm looking at my current wardrobe for now. But it's something I want to be mindful of when I do go clothes shopping next.",,,2,0,0,
f1359b20-16da-4b88-9f2a-b08053ecb4b5,1554770651,"to move the mouse, command: say ""mousegrid""

I forget the keywords,
so helps to have this hot linked.
https://support.microsoft.com/en-us/help/12427/windows-speech-recognition-commands",,,1,0,0,
4b407f1b-9669-4a93-ba9a-74c2433b74d8,1554080724,i dont know which place my case worker is at. i was thinking about going to the ssi office here in grand rapids. i get my deposit tmrw so i can cover my hotel room for another week. i havent been able to go to my therapist in a while do to all this happening. i cant get my medication cuz of that. i think i have a social worker. ill call them tmrw. idk what well house is but i will look into it. thank you so much for taking the time to respond. im so sorry it took me so long to respond. ive been walking a lot and busy trying to find a place. i found apartments but the deposit is too much. ,,,1,0,0,
4c99923f-9858-43fc-81b5-0d50ba6669d6,1555986442,"Thanks for your reply!

That may be the case - we’re in texas so most state help isn’t available (thank you, deep south), but thats 100% worth looking in to.",,,1,0,0,
7db2d26d-648f-45b8-b9c9-8e1da6acb4ab,1555819122,"Pearl is a 10 years old tea cup Chihuahua, that weights a pound and a half right now, she has like three other videos there one playing with the Easter Bunny and another one doing her morning exercises so you can see her in action, basically,  she is missing her two front legs, she was born like that, and I was never able to find such a small wheelchair for her so a friend made one for her, but she never adjusted to it, so since she my baby, and I love her to pieces, I take her everywhere, either just carry her everywhere around the house in my hands and she has two strollers and a purse....so she goes pretty much every where, she is very happy and well adjusted, she is simply amazing.",,,1,0,0,
53214170-3871-43a4-8c94-38b49ab53931,1554095674,"I've gone though with a walking boot and crutches. The only issue was the boot not being easily removable so they had to do a pat down and some sort of weird scan thing with a wand. But in general you should be fine. A cane is a common mobility aid and unless it has a sword in it, they aren't going to take away a mobility aid. It might have to go through x ray. And security could take a couple moments longer but it should be fine. Also they should let you preboard with it.",,,3,0,0,
f671ab75-3ffa-4227-8d69-45af4f967e4b,1555995411,"Check with your local DME! An Invacare cs7 bed has a range of 7-30”.

Watch out for  furniture store models getting them fixed can be an issue. In the medical world they must hold parts for the “projected” life span of the product sold on the day of discontinuation. So for example invacare discontinued the cs7 bed tomorrow, they hold parts for 7 years. 

If a furniture store discontinues the bed, you could be stuck with a boat anchor.",,,1,0,0,
76ba91c8-08e5-4f2b-aff3-10a1a4042700,1554273967,"Well I hope you get better after your surgery it horrible the recuperating time, and about what to do well you can write your memories that's very useful and thérapeutique, or you can try to learn how to be a master puppet and if you don't had friends we can be friends and talk ",,,1,0,0,
1b33ac43-28ee-4e2f-99e7-a4a3f0fb54da,1555567768,"This video was pretty good. I was already familiar with a lot of these terms, but there were also some that I've never even heard of until just now.",,,2,0,0,
1b33ac43-28ee-4e2f-99e7-a4a3f0fb54da,1555568317,"Not telling them off because they're older then you are is probably ageist, so maybe you should just tell them off next time. You could also just ignore them, since you don't need a bunch of ableist jerks to be your friends.",,,1,0,0,
d75c38d3-a478-4eaf-b8d1-1051ee8f5a99,1555851090,"I have a friend who users one of [these](https://topshelf-fun.com/products/game-haul-board-game-bag) (I forget the brand,  but generally) to haul around board games for game night. They're meant for bigish boxes. Might do the trick?",,,1,0,0,
b519ab62-8af7-4faf-b5a1-6880b778c588,1555260147,Congratulations! That's a huge success!,,,4,0,0,
ef1bfd33-fe1d-4b5c-80a9-85935b106b2f,1554659895,I wouldn't worry about it.  People are always going to find something to be offended by.,,,2,1,0,
78d75fca-1796-4b8f-a4b1-015c310681d3,1556118673,"I find the notion of “clearly equating having disability with negativity” to be reading into it just a bit too much for me personally. “Clumsy” is far far too mild of a negative trait to even remotely find equating that to disability insulting. I wouldn’t even call it a negative trait. That’s coming from someone who slams their body into literally everything like a giant pingpong ball on the daily. 

What I don’t like is word claiming and especially those that are medical terms.  I have seen a lot of people get offended for people using words like it in a medical context. It shuts down discussion and is hands down way worse than possibly using a medical term as an extremely mild insult, in my opinion.",,,1,0,0,
a9090660-b2d1-4f4a-b00d-32880c994553,1555605791,"If in US, the disabled parking spots are mandated by the Americans with Disabilities Act (ADA).  A business can not choose to make an exemption.",,,5,0,0,
5d753975-8920-4dc3-a446-bb89fcba89fb,1555182291,https://www.medicaid.gov/medicaid/hcbs/authorities/1915-c/index.html,,,1,0,0,
dea76f9d-91eb-4300-b1f3-e34b0b093050,1555435031,"There are times when age should not protect you from consequences of being an asshole. I get tired of the well they are old and that's how things were in their day attitudes. (I'm a gen xer)  Even ""in their day"" some people were nice, non bigoted people. So it was possible to be more equal minded at any time. Sure being rude to various minorities might have been more socially acceptable back then -- they didn't get any blowback and maybe even got thumps on the back and giggles. That doesn't make them incapable of being polite. The \*only\* age related excuse I can see is dementia. Dementia can do horrible things to impulse control and filters due to damage to the frontal lobe.",,,5,0,0,
eb37d902-bb67-46f5-ba32-00e43c223003,1555089840,"Thank you so much! I really appreciate you taking the time to write this. I’ll reevaluate the way I handle things and what not, so thank you for the advice. :)",,,1,0,0,
44384607-409d-44e6-9f0c-38830b4fb9bc,1556215999,Thanks�� Red Dress Boutique! It’s an online store!,,,2,0,0,
a8183b3a-0e39-459d-8e72-6633f9428c1e,1554321614,"South Park cripple fight.... The movie.

Th...th...th... You're a great audience, thank you!",,,1,0,0,
589f63c3-bad5-4542-ac39-e0e5a5dc6591,1555190998,"You don't get SSDI/SSI solely because you have medical problems.  You get SSDI/SSI because you're unable to work.

They will look at your medical records and your claims that your illnesses are making you unable to work.

If you have not worked enough hours to generate the required work credits into Social Security, you cannot qualify for SSDI.  You will be considered for SSI, though.

If you are rejected you can file an appeal. A ""disabilities attorney"" will talk to you for free and, if they feel you have a case, take the case for no fee.  They are paid when you are accepted, by taking a percentage of the initial payment.",,,8,0,0,
98258667-73a0-442d-b8f7-98d4b4ad2629,1554236952,"Cool dude, well I gave you a lot of other stuff to think about than those few dealbreakers, and I wish you all the best. ",,,2,0,0,
3b50f526-eeed-4d8c-a614-3f8197f01c90,1555011931,"Honestly you may want to talk to him about divorcing legally so you can get the help you need. You could still be with him after though, just not legally married. I know that awful, but it sounds like a good option to get you the care you need. Me and my boyfriend pretty much decided not to marry for this reason.",,,9,0,0,
3ac62dba-f28f-4fa3-a9cd-f6cbd9d2325d,1554406985,"That must absolutely suck, I can only imagine how frustrating it must be to use a rollator at uni. So many people and not enough lifts! 

You're right. We're here, we're visible, and all these people in the comments don't get that they're a bad car accident or a fall away from needing to use a wheelchair. ",,,1,0,0,
a588b056-25d5-4de1-b6bb-1a255ed6451c,1556570269,"I grew up in 70s and thought back then that by the time I got older things would be cool because the “regressive morons”  will all be gone.
Oh boy was I wrong.",,,7,0,0,
daa2519f-7929-4d72-b26e-596dfcd9f517,1554326536,"Oh yeah definitely! like I apreciate jokes (especially the offensive ones) It's just when the same ones over and over again, i don't find it rude just starts to get irritating.",,,3,0,0,
9874a67c-c5ce-42f1-b588-b88fcd929b0d,1555803861,"Ugh, yeah, I know what you mean. This is such a great place to find other people who actually understand, instead of having to explain everything at best and be defensive/get rejected at worst. It also helps me better understand myself and what I'm going through.",,,1,0,0,
53214170-3871-43a4-8c94-38b49ab53931,1554412376,"Very cold or very hot is bad for a lot of different disabilities. Usually about 72ish degrees outside is best and will work for most people. Shade is important, the sun can cause issues. Un even ground/climbing is hard/impossible for a lot of people. Some people can't sleep on the ground without like an air mattress or something. Hydration is so so important. ",,,17,0,0,
41064adf-0627-45a0-8630-4c521b40ad65,1555369034,It is scary. We shouldn't have to hide or feel we can't try something for fear of losing our income,,,6,0,0,
802ecb01-2d00-40bc-a7e6-904436fe02ff,1556148161,Thanks for the insight.  Much appreciated,,,1,0,0,
cea341e0-5fdc-48f6-b983-777331412597,1556063466,"State supplement programs are an additional cash payment that some states administer for recipients of SSI (not SSDI) based on living arrangements. There are varying rates for living alone, living with others, and congregate care living.  If she receives any SSI, it is worth inquiring with your local health and human services office regarding eligibility.",,,1,0,0,
53214170-3871-43a4-8c94-38b49ab53931,1555551844,There website doesn't say. But they mention kids in special education. So I'm assuming they mean people with cognitive impairments/disabilities.,,,1,0,0,
c29f2422-a9ca-48db-b496-6cd30e55176a,1554521661,"If this is the local social security office and not the disability office, go in if you can. If you can't, call the main line and ask to speak to a supervisor or manager. ",,,1,0,0,
994e223a-e938-42de-b811-2f9628d68d0d,1554261318,"Hello, /u/4680f46c-77ef-4957-9685-7b946f70fa45. 

Your submission has been removed because:

You violated the following rule of /r/disability.

&gt; Rule 4 - [Message the mods](http://www.reddit.com/message/compose?to=/r/disability) before posting a survey. Any unapproved survey will be removed. Surveys are also required to be in a self-post which must include information about the survey, the surveyor, the data being collected, and how the data will used. 

Link is not to a survey, but survey results. :) 



---

If you have any questions or concerns, please [message the moderators](http://www.reddit.com/message/compose?to=%2Fr%2Fdisability&amp;amp;subject=About my removed submission&amp;amp;message=I'm writing to you about the following submission: https://old.reddit.com/r/disability/comments/b8r3da/-/ %0D%0DMy issue is...). *Direct replies to official mod comments will be removed.*",,,1,0,0,moderator
b6bb5674-9de5-4d04-9ce6-793a683a62a1,1555215520,"We may could and my husband said he’d like to put in a hydraulic lift in the future, since that would be a few thousand $$! I can walk a few steps, as long as I can hang on to something, so he’s putting an extra grab bar in!",,,5,0,0,
b6bb5674-9de5-4d04-9ce6-793a683a62a1,1555215550,Thank you!!,,,3,0,0,
