commentator_id,created_utc,anonymized_body,ups,downs,score,controversiality,gilded,distinguished
b6bb5674-9de5-4d04-9ce6-793a683a62a1,1555219235,That looks so handy!!!!! Luckily ours has a fairly big grab bar!,,,3,0,0,
5d8fcb61-10fc-4404-ad1b-6faea8dcd780,1555392240,"I think the good news is that maybe you won’t even have to go through with the hearing before getting their attention. 

Also, I’m pretty sure you don’t have to be present at the hearing.",,,1,0,0,
6283f0b6-74ad-4560-a5e2-931cc2b4647c,1554377242,"Good work. Wouldn’t just lowering the rail be easier? That’s what I did that’s all. 
That thing ain’t gunna be light when it’s got a shirt/jacket hanging off it. I’d just end up hitting myself in the face with it an dropping my clothes. That’s just me tho. Lol",,,3,0,0,
81f2b724-02c3-44fb-9620-8f3c9c200a50,1555165178,"Quick note that Netflix tracks a *lot* of data. So even adding this to ""your list"" counts as positive feedback for the show! �� 

(I'm gonna be watching the heck out of this, but for people on the fence, at least put it on your lists. ��)",,,4,0,0,
f6344ce4-c6b3-4041-8293-db0c9779ef35,1556023494,Oh YEAH they'll be all over it!,,,3,0,0,
a96e8743-3782-4765-b5fa-f48d3db01934,1556112277,Awesome!  Sounds simple enough. Thanks!,,,1,0,0,
f1359b20-16da-4b88-9f2a-b08053ecb4b5,1554472764,"Firewood. Dry seasoned hardwood burns much cleaner (less smoke).

The cheap firewood is often softwood that burns hotter/faster but also can produce much more smoke. Not good for those with breathing issues.

On camp chairs, in [my photo](https://i.imgur.com/f602Q0X.jpg), you can see my camp chair. Folding, but have armrest and a side panel so I have a place to put my morning coffee and a book.  Those chairs are sturdy enough I can use them for a little support as I get up.

There are combo sprays that are sunscreen and bug repellent. 

You can also find ""screen tents"" so chairs and table can be set up inside a bug free room.

Pack extra feminine products. A variety of styles. I've been camping with friends who were caught off guard and didn't bring enough. 

Remind campers ZERO FOOD in the tents with them. Diabetics may need emergency candy bar, too much insulin, but   bears can smell OPEN wrappers (so maybe bite size product that can be opened and consumed). 

Cots - already mentioned

Water - I have five gallon jugs with spigots. Handy to fill up (as heavy as you can carry) then on their side, so now I have a facet at the table. I put my plate washing jug under this to catch any extra water (it will be used later for washing dishes). 

Spiral notebook, pen attached with a string, big clip to hold pages down (keeps wind from flippling them around).

Cooking -- I do use the ""moutain house"" meals. Pouches are usually 2.5 portions. That and Knorr Rice. Catch is how to boil water, measure 2 cups and pour. Most picnic tables have slats so spilling scalding water can still burn knees (can not move fast enough).  Rice takes 1 cup of water. Pour cold into a pan, cover pan to reduce evaporation. The two cups goes cold into my tea kettle (whistle on it) and brought to a boil. Kettle easy to pour into the bag (set timer to remember to stir, close bag, another time for soak time).  I'm not trying to measure and pour boiling water, just pouring. The multi time events is a challenge after a long day hiking. I've messed up dinner more than once!   Hence notebook to jot down times (I've made notes on first page about my timing).

Canned soup. Easy for car transport, and there are days when sipping ginger ale and a can of chicken noodle soup is all I can eat. So I pack about a dozen soups (simple to heat up and consume).

Yogurt. I need it in the morning to help swallow a dozen pills. Apple sauce also works (daily I take about 30 pills, some with food, some without. My phone/watch are my reminders... brings me to the next thing:

Solar Chargers for USB Charging phone and Watch. I keep them charged, but off grid most vehicles can use plugs. Still my watch has a custom cable. I also get lost, I did a simple hike out to a stage coach when my son hiked up tallest point in Texas. Easy walk for me, but coming back I missed a turn. My Golden Retriever blocked me and kept telling me ""this way"" brush had covered the trail (we pushed through on the way out, didn't see the turn on the way back).  Good doggy.

Whistles. Ya, pretty silly but not a bad thing to keep on you.  If every learns three short - three long - three short it is pretty obvious a distress signal. Let folks know to remain in place (we teach kids to talk to a tree and not leave that tree). Even adults who know better have panicked when alone and night falls. So everyone in the group should be taught to stay with ONE tree and remain in place.  Nights get cold, so loose wind pants and wind jacket can be stuffed with pine needles/leaves so additional insulation. Oh I had a bear slobber me. No moon, pitch black night, and I was out there by myself. I kept thinking I was imaging things, but bear slobber stinks. Next day the back of my jacket was a mess (slobbered). Bear probably thinking what the hell are you doing out here.  Now I always carry extra flashlights.

&amp;#x200B;

&amp;#x200B;",,,2,0,0,
3e2013ba-335a-42bb-bacc-4a6e31c5ed95,1555426909,"They will contact you by mail with your decision and any paperwork that needs to be filled out. Occasionally they will call with a question, but most everything is done by mail.",,,3,0,0,
98258667-73a0-442d-b8f7-98d4b4ad2629,1554135643,"I always bring my cane when I travel. They run it through the x ray machine with your carry on luggage, but they'll give you a loner to go through the body scanner thing. You can also call the disability services for your airline and request a wheelchair, but unless you do this in advanced they aren't very helpful in my experience.

Maybe this is because I'm a young woman, but I've never had someone question the lethalness of my cane. This might also be because it's covered in purple flowers and sparkles lol. I've gotten a few rude comments - people telling me I don't need a cane or asking what's wrong with me, but that's hardly specific to airports. I usually have my dog with me when I travel so the security process is a little more involved, I always have a good time joking with the TSA workers as they swab my hands for explosives. Those people are overworked and underpaid as hell, they're usually very responsive and grateful if you're polite and you don't make their job more complicated than it has to be. Have your shit together, say good morning and thank you, and if your cane is hollow on the inside just don't try to stuff it with cocaine and you'll be fine. ",,,5,0,0,
16a3306c-1ce2-4d18-ae08-7aca7f61dc2f,1554908468,"Legally, places of employment are to provide reasonable accommodations for people with disabilities.

However, if the employee isn't able to perform the job anymore, despite becoming more disabled, the individual can be terminated because they lack the performance requirement. 

[https://www.dol.gov/odep/pubs/fact/ada.htm](https://www.dol.gov/odep/pubs/fact/ada.htm)",,,3,0,0,
ae87055d-910f-4489-8761-45579df81da8,1556121071,"People try to do this to my sister all the time.  She is very visibly disabled.  They always act offended when I yank her wheelchair away from them immediately. I tell them they are committing a battery against a disabled person and we will follow up with law enforcement unless they leave immediately. I love their stammered apologies.  Sometimes I enjoy the ensuing argument-they tell me they were just trying to be nice and I’m making a scene.  So I go up and physically push myself between their body and my sister.  It helps that, even though I’m female, I’m 6’1 and built like a linebacker.  God is not a reason to forcibly touch someone against their will.  

Don’t be afraid to make a scene.  Yell “why are you touching me?” Act scared of them, whatever it takes to embarrass them.  You deserve to be treated as the individual you are with body autonomy.",,,18,0,0,
c35b34da-6786-488e-983a-ccdbd835032c,1554312523,"If you get married and are on SSI, you may lose benefits if your spouse makes too much.

Also if you hold out as married sometimes you can lose SSI but I don't know how enforced that od",,,1,0,0,
ee6633a8-7b45-4a73-b587-d286f83f3488,1554911379,"Saw this on the news last night, it's such a shame :( while us folks are struggling to get the stuff we need and those clowns are playing medical white elephant!",,,5,0,0,
ae4bfd87-1bb8-44bd-8a17-554c7029dca2,1554666031,"Ah. That makes a lot more sense. The term we use, at least in my state, for those type of programs is ""Day Training and Habilitation sites and services"" or DT&amp;H. ",,,3,0,0,
f73a1aaa-8224-4328-8c6b-cb7b38ddf690,1556036453,I can’t stand her voice ... plus the neon glowing white skin is making my eyes hurt lol,,,1,0,0,
d0d4be64-a550-443e-ac4b-255d418ab00c,1554143300,"It looks as long as a boat. The knee protector is not a nee protector AFAIK, rather it keeps your legs back in the foot rests when you stand. Applying pressure on the shin is more safe than directly on the knee, to avoid hyperextension. If the person has tremmors or limited control of their legs, it would prevent them flying out.

As somebody who travels often, that looks like it is very long and heavy, so getting that on buses, and planes won't be fun.",,,2,0,0,
5d753975-8920-4dc3-a446-bb89fcba89fb,1555087931,"In most cases, spouse's income is considered as yours as well especially for Medicaid and SSI.",,,1,0,0,
d42770b1-9f84-462c-9536-090461a2ff56,1555436895,"You can call or go to the local office and ask to speak to your caseworkers supervisor. Get their name and info, call them daily and leave messages as you have been. Try to give them 3 days or so to get back with you if you can, or as long as you can manage. Or you can go down to their office, politely explain what has happened to you, and tell them you need to speak with someone *today* please. Then sit down and wait. Recheck in every half hour until they find someone.",,,2,0,0,
62a6be17-5f19-446f-b162-4dc7afd7f3a6,1555698631,"Ask in r/3dprinting instead! I also googled it, and yes it's possible and has been done before evidently.",,,2,0,0,
7f7c3ef5-aae9-4e52-b3ab-4930bf7edbc3,1555612975,"haven't recorded it yet, only live versions exist, but i should record it huh? i will soon for sure!",,,3,0,0,
868f2a53-dd2a-4a26-aa92-1d1af41753f9,1554319530,First congrats on taking that step to represent at PRIDE and bringing out the woman you want to feel like! I can only imagine the courage that takes. Are you looking to buy new clothes or use what you already have? This seems like it would be fun to play stylist for you. ,,,3,0,0,
3c52a609-1b49-4f67-827b-25adc92c34b0,1556128218,"I have to say I am shocked that others have experienced this.  

My planned reaction if this happens to me again is to charge a fee.  Sure you want to touch me and pray for me, that is $25.",,,8,0,0,
4a229b07-8a54-40b4-b270-64a6a025b166,1555961187,"Are you certain you submitted everything for the review? I forgot to include a rent receipt last time and the same thing happened to me. Either way, call your caseworker and ask. My benefits have not dropped.",,,3,0,0,
9445f226-1cf9-4fd0-8a0b-0a9c6467ab05,1556129644,That sounds awful.  Poor kid.,,,3,0,0,
dcfbc4b4-01f6-4b63-9d6c-2e4ebe061cd0,1554236003,"I have a few ideas i am not sure if your budget will support any of them but i will list them and let you look into it and decide 

1. Membership in a gym and lift weights 
2. Get into a martial arts school 
3. Get a ham radio license and a hand held radio and get on the air",,,2,0,0,
53214170-3871-43a4-8c94-38b49ab53931,1556651273,"Wait are they saying there is nothing wrong with you, or there's nothing wrong with being disabled so you shouldn't feel bad about putting it out there?",,,1,0,0,
eeadf9b0-88d6-45d7-ac83-72c1d9002475,1556401609,you don't get approved and not get paid. paper check to the address you gave or a ss debt card which also comes in mail. someone had your money.edit:direct deposit to your bank if you set it up,,,2,0,0,
6972e1a2-d3d2-4ca8-9655-c930fdbb60b6,1556303732,"I'm assuming you are referring to SSDI, the Social Security Disability Insurance program?  If so, the answer is: it depends.  It depends on the number of credits you have, how old you are, and a few other factors.

The type of disability you have does not affect the amount you receive in SSDI benefits; whether you have a disability of not and it affects you in certain ways is the determining factor.",,,4,0,0,
97e2f69f-97e0-497e-80d8-b59e188fef46,1554407875,"Most wheelchair users (I'm sure someone would cause y'know, we can be assholes too) aren't going to be upset with you because you need the rails. I do too, and I'm not always in a wheelchair. The only people who have ""called me out"" Have always been able people. I get why you feel guilty, but you really shouldn't feel guilty. ",,,9,0,0,
2086fcf3-6485-461e-aabf-04851774987a,1556048428,"Doctor Who actually has a few disabled actors in it over the years including a little person, a deaf person and I think an amputee (Sil).",,,2,0,0,
97e2f69f-97e0-497e-80d8-b59e188fef46,1554409849,"I realized this may sound rude, that wasn't my intention. Idk why but ""inconvenienced"" struck a nerve in me?? Perhaps because people like to downplay my struggle and that reminded me of it?? I'm not sure exactly, just wanted to let you know I wasn't trying to be an asshole. ",,,1,0,0,
acb89da6-e248-4645-8012-49e008ca727e,1554160335,"I read every word as well. I am sorry it is so hard, and doubly sorry that your family doesn't validate you. Without a strong support system it is all so much more difficult.",,,2,0,0,
3ac62dba-f28f-4fa3-a9cd-f6cbd9d2325d,1554411943,"Hooray, I hope you have much better success with a new floor! I also hope you can get your driving license soon, I loved it when I passed my test: so much less to worry about! All the best with your studies, and thank you ��",,,2,0,0,
e038a184-d3ea-496f-9f65-20567dafebfe,1556576105,"&gt; just let your hands get tougher. 

Unless you don't want rough, calloused hands; they're not always a good thing. Soft hands are very much appreciated in some areas of life. 

I use gloves and still developed minor callouses under them, that's enough for me. I don't want heavily calloused hands, aesthetics aside it reduces feeling in calloused areas which doesn't pair well with neuropathy. Gloves can help with grip if you don't have full mobility or sensation. 

Plus, with gloves, you can keep your hands clean. If I want to eat, I pull off my gloves. Without gloves I have to carry wipes/antibac or find a place to wash them. In the winter, gloves are an essential if you get regular cold, wet weather.",,,2,0,0,
77768fd0-e937-43a5-b4cf-f7b8ff166dde,1554850045,I didnt know there was one. Iam new to this.,,,1,0,0,
6412c546-5001-4eee-9480-408ca07bdede,1555455376,Up until July of last year I worked at the SSA and I can tell you we used social media to investigate fraud. If you’re truly disabled you would want us using all tools available to catch and prevent fraud. What do you think happens to your benefit when the well runs dry?,,,1,0,0,
39049bf8-b0e9-4c11-a45f-8cafb019a1bc,1554422107,"Obligatory not disabled: Was a care-giver and also have several friends with disabilities. 

Do you have a Wheelchair Repair store? My city has several with the typical stuff to fix motorized and manuals as well as all sorts of doo-dads like hooks, straps, ultra velcro and poles to hold computers or communication devices.",,,2,0,0,
75ee263f-8a99-4a53-bc7f-c64b7fc9e090,1556324740,"Not sure if it's classed as a mental condition, but it had a brain injury when I was 27 (I'm now 32) and it's left me with anterograde amnesia, traumatic epileptic seizures and migraines. Also have physical disabilities, but had those before the brain damage, always happy to chat to people xx",,,12,0,0,
c63ce74e-b83b-4b4b-9b15-e3b2bd026a39,1555204851,"No, I was in 2014.

I have PTSD, severe social anxiety, and a genetic connective tissue disorder. At the time only my psychiatric disabilities were diagnosed.

Yes. I had a psychotic break due to an extended PTSD trigger before my second semester and stopped attending classes. I also had to move out of the dorm due to panic attacks that would occur multiple times per day. I didn’t understand what was happening to me and it was not controlled in time for me to get through the following fall semester; I dropped out entirely during the first week of my sophomore year.

I didn’t have a social experience. I couldn’t make friends or talk to anyone due to my psychiatric issues. I spent all of my free time with my boyfriend, who attended a different school and came to pick me up frequently (he commuted from home and I was at school nearby.) I was friendly with my coworkers at work off-campus.

I did not get support until after my first year, and it wasn’t through the school. I was not comfortable using the college’s services for assistance as I had already had a rough experience there. Unfortunately I had to go through several professionals before I found ones that helped me.

I did not have accommodations and took a full schedule. I plan to return to school in the fall and it will be drastically different in order to accommodate my physical and psychiatric conditions - online classes, disability paperwork on file, etc.

I am currently in a much better place, living mostly independently with my now-fiancé and my service dog. I work full-time in a supervisory capacity and am more active socially. My disabilities are much better controlled, though they require complex treatment and management. I would not have reached this point had I remained at school.

I’m going to combine my answers for these last two. Adaptability is important. Willingness to get help, and also the ability to look for help - because your college will not reach out proactively. A sense of humor. A relaxed attitude. And just being mindful of what college you choose and why you want to go there. Don’t lose sight of your support system.",,,4,0,0,
35061ffd-5365-428e-8404-85ba5661a79a,1554602532,That’s where I’m at that hoop jumping or sucking it up and working ,,,3,0,0,
20f5e15c-5e8b-4cb5-9e57-53a43ca315e5,1555552261,"Never give up hope! I thought no one would want to date me because I'm albino with really bad vision problems. I've learned that the right people to keep around--friends or a significant other--don't care about the way I look or my vision. The right person will come along. Don't forget that you are worthy of your own love, too. :)",,,3,0,0,
8205511a-ed7e-494e-8453-dc9a6325fd74,1555817890,Happy Birthday (belated) to her! Can you tell us more about Pearl?,,,1,0,0,
e6cf6eec-504b-4fbd-97b5-1bdf9aedf0b8,1555818355,"That kind of behavior in today's political climate in unsurprising when bigots, racists, supremacists and even neo-nazism have become normal and openly practiced and openly supported by a segment of our political representatives. Last fall I went to get groceries and I have to use one of the motorized carts.  All my lumbar vertabrae are damaged and in 2017 I had a heart attack (blood clot) causing a portion of my heart muscle to die.  Consequently I can't walk but only about 20 feet without a cane and can't stand longer than a handful of minutes.  I had pulled the cart about 10 feet away from any walking areas and was looking over my list when some asshat walked by and made a few choice comments about me being disabled.  Such *ssholery!  I read posts here but seldom post so pardon me for busting in.  Your post just reminded me.  I already have issues about leaving my home and this kind of behavior doesn't help but ultimately I have to assuming I want to eat, etc.",,,3,0,0,
8f4c1b65-ec5d-47ec-9944-6db8fa6ab846,1554434929,"Everyone here (including you) has great ideas. Something that might be good for those with sensory needs is a hammock or maybe a camp style rocking chair. Also maybe some masks for people sensitive to smoke/fire.

Edited to add: a good amount of walking sticks/trekking poles would be a great addition.",,,11,0,0,
eaae6e69-2f9f-43d1-9773-a3611987c5a5,1554954800,"My illness used to be invisible, now it’s visible. People still doubt me and think I’m faking. They can literally see my joint damage and think I’m making it up.

People suck no matter what.",,,12,0,0,
708d4128-28d1-4e42-8345-619c519986ed,1554614947,Solid find/share! Very informative. Thanks ����,,,1,0,0,
4e8d6228-8279-4673-8a15-7d4461d4b302,1554704549,"As someone on the parenting side of this equation, ain't easy to figure out how  to push, when to push etc... I have an 8 year old with CP... so, what do I do?? What are the rules!!?? /s.. but in all seriousness, this subreddit is great for advice. So, what do you guys think? How hard do you push therapy, how hard on socializing, etc... 

I tend to push about as hard as a moderate coach with therapy and that feels fine (tbh, he's very self-motivated with therapy so it's not a big issue), but I'm at a total loss with the social stuff. He's recently made some friends, so this doesn't keep me up at night quite as much --  but sometimes we go to cub scouts or whatever and he's just not into it, doesn't want to participate, and my gut is to push him out there -- you don't want it to become a habit -- but shit, I don't know, it's just so hard for him to be heard and understood and he's absolutely brimming with funny, creative things to say. I know he's frustrated but I can't sit by and let him become a shut it in... there are days, where if I let him, he would sit on the couch all day and stim (he self-soothes by 'stimming', which for him is basically him rocking on the couch and making car like noises. Most of the time he's making up stories while he stims (kid's gonna be a writer, I'm sure of it) , and there's no harm in it, and it makes him feel good, but I can't let him do it for hours...)

&amp;#x200B;

Side note: I've noticed he's really not very accepting of other kids with disabilities. It's like he wants to separate himself from them, but his tactics -- ramming into people's chairs, shouting at them-- are not so cool. I'm sure it's a phase, but that doesn't mean I'm going to allow him to be a jerk. Does anyone here remember going through that when they were younger?",,,1,0,0,
63a246d9-6c85-4552-96d8-21ef3387ff76,1554273067,which disability? is it a private plan? short term? long term? social security?,,,2,0,0,
b18391f5-f332-4a01-abce-b2ceac6edd07,1554709819,"So do I! It's the best out of the options we have. ""Handicapable"" and ""differently abled"" send me into a murderous rage. ""Disabled"" is nice and succinct.",,,3,0,0,
71e0d585-5d85-439f-9d19-d5d6a7e3b9d4,1554111664,"One of my best doctors was at Hopkins, he really went the mile but when even my case was too much and nothing worked, he dropped me like a hot potato and it was a big struggle to get my records sent on to a world specialist at another University out of state. 

The doctor wasn't as good. It's still hit or miss and they REALLY hate when they don't have all the answers.",,,2,0,0,
befda811-78a4-4525-b461-9962b3c93a4e,1554799956,The changing tables are typically located in the handicap stall. I've always felt bad having to use it just to change a diaper.,,,3,0,0,
01027576-01da-4e25-8733-542186326803,1555409125,"I don’t have the energy to reply to this massive wrong interpretation of what i said properly.

So I’ll break it down like this “we wrote this exceptionless but, we don’t mean You!” = “we never expected You to read this advert”

= “well those guys don’t consider disabled people might read this, so I don’t have to consider disabled people either” 

= “hey disabled people mustn’t be out in society”

But guess what? We are, and it’s not a war on “healthy people” to ask to not have health shaming on a device most needed By disabled people, especially when it then acts like disabled = don’t care about being healthy. It wouldn’t have taken too much brain power to have “If you don’t need to take this lift, why not use the stairs instead?”. Much more inclusive as well as not creating a binary where taking the stairs = healthy and not taking the stairs = deliberately not caring about health.",,,1,0,0,
bcdd28b6-1817-4b86-a17b-8ff2fc494462,1555240562,"Love it! But y'all are going to have to coordinate your bathroom trips. One person being in the bathroom traps the other in part of the vehicle. Not a horrible problem, though.",,,3,0,0,
85cea924-c3c5-4543-b9fe-98c87b2bcdfd,1556185987,"I love this. Maybe we can all just respond like they want to pray for all the normal, daily struggles of our lives. Maybe we can act like they're looking at us as a human being struggling with the complexities of life, and they'll suddenly realize that they're not. Ohhhh... You meant pray for me because I'm in a wheelchair?... I thought you meant because my mom died. How should I know, I'm not constantly thinking about the fact that I'm disabled like you seem to be ��",,,2,0,0,
7552a8b6-9ca5-4a1d-ae6b-78f23e86325c,1554294776,my disability isn't even physical and this makes me kind of salty. you have to forgive them though. for they know not what they do. its better to just politely voice your concerns. i am sure the normies will fix things quickly once they realize how dumb they are being.,,,4,0,0,
c4b5bc36-a215-461f-907c-5d5e84ffcfda,1554209481,Do you not have an attorney working with you?,,,3,0,0,
