commentator_id,created_utc,anonymized_body,ups,downs,score,controversiality,gilded,distinguished
8f4c1b65-ec5d-47ec-9944-6db8fa6ab846,1554120089,"These are still available they are seamless and *AND*. 

https://www.target.com/p/women-s-cotton-blend-seamless-waistband-leggings-a-new-day-153-black-s-m/-/A-52376428?ref=tgt_adv_XS000000&amp;AFID=google_pla_df&amp;fndsrc=tgtao&amp;CPNG=PLA_Women%2BShopping_Local&amp;adgroup=SC_Women_Local&amp;LID=700000001170770pgs&amp;network=g&amp;device=t&amp;location=9016882&amp;gclsrc=aw.ds&amp;ds_rl=1241788&amp;ds_rl=1246978&amp;ds_rl=1246978&amp;gclid=EAIaIQobChMI5Iy2r-uu4QIVUxh9Ch0-Vg79EAQYASABEgKwFPD_BwE",,,3,0,0,
24b1ad55-114e-487b-ac10-b15240fbce12,1555244459,"Hello, I would recommend a partial as it would both be cheaper, and be easier to take on and off while still being rather customizable. 

But a good way to test a fursuit head without dumping a ton money into it would be to try out one of those cheap mascot heads. You can find them at Walmart, or for a full suit experience they have those animal onesies things too. Should totla out to around $45 or so for both. Both are rather ugly but the suit could also work as a frame too for the bodysuit of the OC. If a full suit is required.

The feetpaws if made like sippers should work, but the digigrade legs probably wouldn't due to your ankle.",,,3,0,0,
78d75fca-1796-4b8f-a4b1-015c310681d3,1556017835,"Not really. I refer to myself as a spaz (I am diagnosed with mild spastic diplegic CerebralPalsy) as more of a inside joke as I don’t outwardly present as such. If you watch older or more niche movies it’s not uncommon to hear “don’t be a spaz” or “you’re such a spaz”. That being said, I do find it extremely tedious that is actually medical terminology is considered offensive.",,,8,0,0,
ae315024-dc0f-4476-b225-7e9a9d0ff39a,1556020688,"Um, that's amazing.",,,4,0,0,
44384607-409d-44e6-9f0c-38830b4fb9bc,1556462097,Also thank you for the gold!! I’ve never gotten it before and honestly don’t know what it does haha,,,3,0,0,
99d7ad0c-3c08-4f9c-b085-afe45a577ef0,1555336150,I just feel like people are reading into things and finding offence in anything that could be interpreted as attacking disabled people. People are posting things here that have nothing to do with disability but then changing it around to be something that could be seen as negative against those who are disabled. ��‍♀️ It's upto you to be offended or not.,,,4,0,0,
1d70a1df-c1eb-4c8d-8e2a-4d6659617400,1555170946,I’ll assume you’re using a wheelchair.  How much dump do you have in the seat?,,,2,0,0,
7198a81e-0ec9-4edf-b25c-2ccad0ffbda8,1555343464,"This is a really bad idea. My spouse is disabled I'm not and I caregive for her. I talk and act like I can fly but I like being open about our situation and how crappy it is due to how bad it is in Canada / Ontario.

That being said this would only open for targeted harassment, etc. There is already a system in place to report fraud and such. Not only that many people also have mental illness, etc and say things that are not true and maybe others want to live the dream on the Internet that they are not disabled.

Either way this is crazy..",,,18,0,0,
85cea924-c3c5-4543-b9fe-98c87b2bcdfd,1556120191,"Oh jesus lmao. No pun intended. I feel that - my disease progressed within 5 years of leaving my family's religion. Now there's no convincing some of them it's not related unless I were to genuinely ""repent"" and still get worse. Although, they'd probably still just say my spirit wasn't truly in it, or my faith is being tested. Whatever helps them sleep at night, I guess.",,,9,0,0,
8c5ebf16-78ff-4ec4-b53e-28706ba54e4e,1554828620,"I’m really impressed with how much you’re doing. Your school load sounds unbelievably stressful but you’re getting after it! It’s no wonder you are too tired to cook or clean. There are other ways you’ll be able to surprise and support your husband. I bet other people in relationships might have some really good low energy ideas on that. Things like leaving little notes for him on the bathroom mirror etc. 

It just plain sucks to not be able to do the things you want to accomplish so badly. I think we are all  in your mind frame from time to time. You’re doing WAY better than you realize. That isn’t to minimize your distress but to give yourself the credit you deserve. 

Things will look up. In the meantime, try to be kind to yourself. We’re all here for you and cheering you on.",,,2,0,0,
7552a8b6-9ca5-4a1d-ae6b-78f23e86325c,1555180184,"lol no shit! and the hardest part about being black is all the racism.

-

i guess this sort of statement is shocking to normies but it seems really apparent to me.",,,9,0,0,
257425c8-99bb-4f65-b3af-e03ea48acdc5,1554142956,"My favorite leggings are from Amazon, brand is leggings Depot and they're mainly seamless. One size fits all, but they have plus size and extra plus. I wear plus and extra plus (depending how much restriction I can tolerate) and I love them. They're between $12-$15 a pair",,,4,0,0,
b9b7cf9a-2327-45c2-b177-1002a740ca9e,1555521499,"Will definitely check it out, thank you!",,,1,0,0,
98258667-73a0-442d-b8f7-98d4b4ad2629,1554831484,"Damn it, again, Arizona? Seriously, I love my state but I feel like every time an innocent person with a disability is raped or murdered it's us. 

Like, can we fucking not please?",,,14,0,0,
2c5477d3-ce38-4d02-a17e-ab74b580e039,1554584827,Thank you so much for your kindness ❤️�� I hope so. I really would like to. ,,,2,0,0,
9070693b-2d6a-49fd-8b8f-dc347ec2a2d3,1555609778,"""Access Inclusion Seekers"" is ridiculous. It's awkward and patronizing. It implies that the only people who want inclusion and access for PWD are they themselves. And as if only PWD benefit from being included in society. Quit nit-picking language and work for actual access and inclusion for all.",,,5,0,0,
c52d51b9-5c84-421d-93a7-69936ae578f9,1554148388,"The potential start date of benefits depends on the specific rules of your short term disability insurance. Generally, eligibility for both private snd publicly administered short term disability insurance starts after you stop working due to medical conditions. 

I recommend consulting the information provided to you if it is a private insurance program. If it is a state program, check with their rules and policies. If it is a state administered insurance program, and you would like help finding resources let us know which state you are in.",,,1,0,0,
b24a0d87-70f5-4c14-babc-967a9a12dba8,1555440989,"Again AMC theaters..  before they had added slots for Wheelchairs. They would come at us in wheelchair info we could no sit in the walk way even Thur there was 45 inch wide from out chair to seat across....  We had the Cops and Fire Marshall called on us.. there fuck up, being was a friend and his son was Oh/Ohi like us.....   This chain will never get it right...",,,2,0,0,
92f54726-682c-407f-af69-5d2fb6c9a23e,1555613689,"yeah, I mean even for the live version if possible!",,,1,0,0,
b66957ba-a7df-45a9-a161-24397ba200f5,1554919476,This is awesome. If only Hollywood were willing to cast disabled people based on talent and didn't shove them in the back of scenes (or ignore them).,,,3,0,0,
5d753975-8920-4dc3-a446-bb89fcba89fb,1555009409,I'm sorry but that's the reality. People with severe disabilities can't get married in this country without losing benefits. This is why we need Medicare for all.,,,5,0,0,
5987117e-e88c-40f6-8f1c-5fd6202d85d8,1556403146,The title is so stupid I don't even want to read it.... What the fuck else are you going to call us? Special Snowflakes?!,,,6,0,0,
97b1c3d6-eabe-44d5-a1ae-6cc080e6c7ea,1554409375,I thought this post was ridiculous too. Is someone working on a start up to help people with disabilities and accessibility this is the exact thing that I’m trying to solve for. People never have accessibility top of mind and even when there are solutions out there people who don’t need them take advantage of them at the most in opportune times.,,,5,0,0,
ef3052dc-bc30-405e-a87f-a3199a5f2583,1555014201,"I will be seeing a PT in a week to talk about it, so I will talk to them and see what they think.",,,1,0,0,
fc34a7a6-7c9a-4a1f-9b2e-d888d1ec7819,1556051899,"
Keep in mind that you don't have the same RIGHTS to a modified curriculum as you had in high school with an IEP or a 504 plan. Legally, I think they only have to give you access to the room and course materials in a way you can understand and participate.

Certainly, professors aren't in the game of arbitrarily screwing disabled students, and your school probably has a higher General mandate for accommodation then is legally required, however, in the end what you're able to work out it's a negotiation between you and your professors.

Ideas for alternatives to essays would be a PowerPoint presentation, an oral presentation, a YouTube video  Karma an exam, or a creative project. 

Even by a reasonable accommodation standard, though, the difficulty would have to be equivalent, and probably hard to throw together on the Fly. It also depends on the class. Alternatives make a lot more sense in a history or science class then in English composition class. In some cases, an extension might be the most reasonable choice.

In the future , I'm sure you've realized to ask for Alternatives ahead of time and to disclose your disability and needs to professors individually. It's not like they send out a mass memo to everybody who registers at the office as needing possible accommodation.

Your best bet now though is to open up to your professors and see what they suggest or are willing to work with.

Good luck to you. Back when I was in college, I wouldn't ask for the help I needed till I was in tears, and eventually led to me dropping out. I realize it's hard.",,,2,0,0,
a961ea9f-5f8c-4768-b0ee-a7673ba9dabd,1554502780,"Good god thank you for this. Murphy and Jess’s relationship is so profoundly broken in the way that addict/narcissist and enabler/codependents often really are. What, can’t a physically disabled person also be an abusive asshole? Are we supposed to pretend that all physically disabled people are emotionally perfect angels? 

I actually really appreciate this character being far from fake angelic; it humanizes her. It isn’t a super-disabled character, who races his wheelchair and volunteers at the Y with a group of perfectly racially diverse kids on the weekends. 

It shows the warts of a real, interesting, complex, fucked up character who happens to be blind. I’m good with that. 

The one point I’d prefer is to have a blind actor, I’ll grant anyone that. That said, if you look at the history of how various minorites become more integrated into mainstream media, this is at least a start. So, eh.
",,,4,0,0,
a4263da8-7a17-4eba-8f95-228062ee0919,1555456296,"Okay, since I’m 24 in a couple months, I probably don’t qualify for having more of my earnings exempt from SSI income counting rules.",,,1,0,0,
9dbafcd0-f5d6-43c8-9fca-fe1b6ac9458c,1555633384,"He posted this photo twice. Once here, and once In r/pics. I don’t see a problem with that. Calm down. He was not spamming or anything and just making a fun light hearted joke about his disability. When you live with something like this it’s good to stay light hearted and make jokes about the 125k worth of drugs he has to shoot into his spine to stay alive. Please don’t take your anger out on people just trying to have fun and make life a little easier through comedy.",,,13,0,0,
785f2ef4-0b9c-4c96-88de-9530c620018c,1555116994,"Yes! I would love to read your feedback. 

I would also love for you to recommend places for people with certain disabilities. Like anything for someone that has mobility issues and severe back problems. He cannot go on roller coasters or things that will affect his back.",,,3,0,0,
a38e649b-cc97-4f7d-be4b-7469cbec73bf,1556414596,"That’s okay, I don’t have a problem with using the term, especially if it’s something people feel more comfortable using. My issue is that I know able bodied people who have tried to police *my* language and prevent me from saying “disabled people” as if it were a dirty word",,,8,0,0,
9dbafcd0-f5d6-43c8-9fca-fe1b6ac9458c,1555637848,Spinraza (the little bottle he’s got) is a stupid expensive because it’s a life saving drug. That’s how it works. It has cost my sister in law 400k just to stay alive every year for the past 20 years (well the insurance) you could argue things like ingredients and the work that went behind creating the drug. But eh.,,,7,0,0,
35061ffd-5365-428e-8404-85ba5661a79a,1554602034,Yeah my situation is purely physical I’m not sure why They thought it was a mental disability and made me take a IQ test ,,,3,0,0,
492c15b3-0640-4b78-a565-74eb92ac5f61,1554093496,Also if you have the same delivery person and after a while if you trust them if you know they are coming you can leave the door unlocked and tell them to just come bring the food to you.  ,,,1,0,0,
a351957b-bbc7-433c-8643-1bcf088889e4,1554781746,"Does it count as a disability if I have severe germ-related OCD to the point that I'll have a complete and total mental breakdown if any part of my body touches the walls, door or toilet in the stall? I'm not even a big person, I'm 5'1"" and 105lbs, but they make those stalls so tiny, especially the ones with the doors that open IN instead of out, that you can't get in and close the door without rubbing your legs against the toilet and your body against the door. So I use the handicapped stall so I have room to go in without having to have my body touch anything, because I literally can't mentally deal with it if it does.",,,9,0,0,
a82bb553-721a-45e3-a70b-3284a1cb9e02,1556250842,"A cup holder is a must for me. My base has shields over the motor and batteries - I pimp them out with striping from the auto parts store. I put flames on my last chair. 

I get a cushion, makes it softer. I had terry cloth covers made for my prior chair. 

Just a few ideas.",,,2,0,0,
8678158d-3ddc-4920-ac29-98f574855a46,1554702540,"I like that. Most ""neurotypical"" people may very well have some milder symptoms of a disability, but that's because there's a wide range of what is ""normal."" The same thought process pretty neatly fits when using ""physiotypical;"" it's not that they're all fully fit and able to do all the things, it's that they don't meet most criteria to be considered disabled or significantly impaired.

There's the flaws of there can be exceptions, and that people don't like being called ""(stereo)typical,"" but you can't please everyone. A distinction has to be made, but our language isn't perfect and won't be for a while. It's very good to at least try to be respectful towards the majority, it's just that there's always going to be a vocal minority that is outraged over a(n imperfect) label. That's just life.",,,2,0,0,
8d495a6c-1810-44b5-80c9-3e9258a1dfe1,1555669991,Spinraza is life! So happy you have access to it. Your caption made me laugh so hard ��❤️,,,1,0,0,
b18391f5-f332-4a01-abce-b2ceac6edd07,1554722425,"That's not surprising. Usually the language between carers and disabled people is pretty different, but I didn't know any autistic people active in the community (or any who cared to think about these things) to ask.",,,1,0,0,
8f50efd3-07b4-4751-8985-f19f9db0bc76,1554120584,You just made my day!,,,3,0,0,
52c9cbf5-0cb0-4d84-b29f-68b3c98f55f2,1554643478,"The only thing I can really offer is that while it may never get easy, it does get better. Seriously, elementary, middle, and high school were some of the worst years of my life. Kids latch onto anything ‘different’ and run it into the ground. I struggled in school, and shit was not cool. But I survived, and oh my god it got better. I scraped into a crummy college, where people rarely gave a shit that I was different. I met an amazing guy and got married. I got a job that wasn’t fancy, but I loved it, and people treated me like, well, me, not some freak. I’m in my 40s now, and my disability has reached the point it prevents me from working regularly, which has been hard, but I have friends and family I have gained along the way, and that’s made things easier, as has meeting people in similar shoes. None of these friends are from my early years in school. I got an invite to my 25th HS Reunion and I told them they could fuck right off, and it felt AMAZING. ",,,4,0,0,
641ecd98-4fd6-4983-b408-b2906665fc78,1555160257,"Speachless is also one, the main character JJ is played by Micah Fowler and both the character and actor have cerebral palsy.",,,10,0,0,
7a8adfe0-b3bb-42b1-8e1d-493cd5ecfe68,1554646427,"In short, no, I don't find it offensive and haven't heard any case for it being so. able-bodied and neurotypical are what I tend to use to describe the typical states of being ( for physical and mental disabilities, respectively) but I can see how the former runs into problems.

But term discussions can definitelty get complicated, as you've seen. The issue is trying to find a single word to encapsulate a whole range of experiences, some of which are conflicting and none of which are exactly the same for everyone. It's a tough tightrope to walk.",,,6,0,0,
f1359b20-16da-4b88-9f2a-b08053ecb4b5,1554730025,"Have you used any Speech to Text programs?  Dragon Speak is one. I'm using Microsoft's Win10 tools (accessibility). Google has made huge improvements.

[https://www.windowscentral.com/how-set-speech-recognition-windows-10](https://www.windowscentral.com/how-set-speech-recognition-windows-10)

There are times (medication worn off) that I can not use a keyboard. Hard to control a mouse. For mouse work I use Steadymouse

Speech to Text, good microphone is key. I like my Yeti Blue. Irony is when it has a hard time, I know I am slurring my words so I have to work on my vocal sounds (yes, Speech Therapist help).  

I use Grammarly to help catch wrong word usage (often I mean one thing, say another word). 

Just another day for me. :)

&amp;#x200B;",,,2,0,0,
027a1edc-29da-4b66-aaf2-22f18a400f4e,1554299155,"Other person: What's it like being an amputee?

Me: It's not that big a deal. I mean I wake up in the morning, I put my pants on one leg",,,4,0,0,
d4c07107-131c-4f5e-bb39-ce40d48d9503,1554815540,"Also, people tend to camp out in the accessible stalls, doing god knows what for a very, very long time",,,9,0,0,
d0d4be64-a550-443e-ac4b-255d418ab00c,1555074123,"  What would a ""very accessible position"" mean to you?",,,1,0,0,
13772f42-289e-41c8-97ba-e0355f102238,1554818274,"Have you got MCTD? Me too! You sound so much more informed than I am, would love to talk to you about stuff if that's ok? Docs having trouble finding any meds to relieve my sx, so talking to another MCTD-er would be great. New to Reddit so not sure if you can ""friend"" people on this?
:)",,,1,0,0,
21cd9282-724a-494b-b6c1-9eb9da02eca8,1555167167,"Speechless is an excellent show. It might be my favorite one right now. It's a formulaic ABC sitcom that nonetheless has the best male relationships of any show on television. The triumvirate of JJ, Kenneth &amp; Jimmy have done some *excellent* acting, particularly this season with the arc of JJ going to college",,,3,0,0,
8f4c1b65-ec5d-47ec-9944-6db8fa6ab846,1556545640,"1,000 upvotes right here. Establish a history OP, is this a one time thing? Or many times? Write them down, write them down, write them down.",,,2,0,0,
f1359b20-16da-4b88-9f2a-b08053ecb4b5,1556634956,"I hear you!

I was telling a friend who commented ""why are the stall doors and wall so high off the ground"". I had to laugh as it is for EMT's to pull you out of a stall when you fall over and hit your head! Doh!   Last place anyone ever wants to be on a floor!

My classic was falling when I got out of my car. Thankfully a couple walking into the store stopped to assist. Firefighter and his wife was a RN. When I explained falling was normal for me, she said I should have a handicap placard.  Uh, I do have one but save the spaces for more mobility impaired (he had a great point about Police often assume you fell due to being drunk, if it  a handicap spot they realize it is  a medical issue).

Just need that extra bracing when standing up!",,,3,0,0,
46699cef-90bf-4cda-9936-790c1575cda4,1556114739,"I stayed in a couple of places in Scotland if you fancy somewhere remote.

This is a cottage on Skye. Downstairs is wheels friendly. Lovely spot. 
[Brescalen](http://www.brescalan.co.uk)

This is 20 mins drive south of Oban. They have wheels friendly apartments. 
[Melfort](https://www.mellowmelfort.com)

Both places you will need a car but both are well worth a visit.

Edinburgh was also nice but lots of hills and cobblestone. 

I've also been to Dublin a few times and it's not too bad.",,,3,0,0,
373bfa5b-30a6-4edb-b62c-ed46f02ae6c1,1554135521,"Yeah, it was weird as a kid. My mom wanted to say something, but she couldn't make it stop. My dad was probably the worst about it. He knew I was insecure and used it to get me to do things I physically couldn't yet. They're divorced so mom couldn't stop him at his house. ""Your husband won't like it if you can't mate the socks right."" ""Your husband won't want to help you cut up food or get to the bathroom."" This started when I was maybe eight. ",,,2,0,0,
1650e43c-4500-412d-a344-1062d8eb206c,1555084751,Fair enough. Thank you for your honesty ��,,,5,0,0,
ae4bfd87-1bb8-44bd-8a17-554c7029dca2,1555606480,"I feel so dirty for clicking a. Link from such a horrible tabloid but then I found this gem from someone apposing the change.

""Social attitudes to disability have already changed and almost no one stigmatises and diminishes what people with disability can and should achieve,' Dr Sammut said.",,,7,0,0,
2bc19789-4a7c-479b-8762-fcc171d475af,1555002424,"1. Chronic Vestibular Migraines. Dysautonomia. Asthma. Ataxia. And the usual stuff that goes with it like GAD, panic disorder, insomnia, depression, etc...       
2. My job consists of 15 people. I do get to work from home but they denied me FMLA. I don't think I could handle the probationary period of a new job in order to get benefits. Also I run the only contract that lets you work from home. If I lose it, no more job. So I can't exactly stick someone in my place to run it for a week while I do something and expect to still have a job when I return.",,,3,0,0,
256310ec-9a7e-417c-84eb-7474c7a78a10,1554669946,"You don't need to mention disabled people though, unless you're talking about a specific person...describing an impairment won't get you bad karma,  making a bad joke that will come off as douchey, probably will.",,,1,0,0,
3ac62dba-f28f-4fa3-a9cd-f6cbd9d2325d,1554398757,It's the comments that made me make the decision to report. ,,,7,0,0,
3570b881-4435-485f-ac4c-81894bcca6a0,1556127473,still doesnt seem fair to charge more if u require first floor due to mobility issues. versus someone not wanting to carry boxes a farther distance,,,2,0,0,
44384607-409d-44e6-9f0c-38830b4fb9bc,1556216141,Omg will do! I went there on Valentine’s Day and got an ice cream as big as my head it was grand,,,2,0,0,
dea76f9d-91eb-4300-b1f3-e34b0b093050,1556564290,"The point is that we should not \*have\* to do that! This is more of the whole attitude of we can't let people who ""don't deserve it"" have anything.   


They don't seem to get that many times we don't have disability aids in the picture -- that doesn't mean that they are not out of the frame.   


They don't see the help you had getting onto the beach -- only that you are there.  


They don't see that just because I can type a few paragraphs one day doesn't mean I can do the amount of typing required in a full time desk job. (they also don't see me wince or tear up)  


Just because I can smile doesn't mean everything is awesome and I don't hurt!  


This is an attitude that needs to be hunted out and destroyed. It is something pervasive in the US society.  Look what happens with disability placards if you have an invisible disability. Hell even people with \*visible\* disabilities get shit about placards sometimes if they are ""too young"" to need (a cane, crutches, rollator, etc) Gatekeeping exists from within the disability community as well and that needs to be shut down. But this is just evil.  


Besides, in facebook you can set your post to public (keep that just to basic memes or pretty stuff), friends, friends except x, or specific friends. However, there is no guarantee that even posts locked down to specific friends will stay that way.  FB has changed their privacy settings before and screwed up a bunch of my posts.  FB used to let you create friend lists and you could target your posts to specific lists. This was hugely helpful in cutting down broadcasting stupid game posts. I don't see that option anymore.  


  I tend to post mostly in closed groups anymore. I know in most of my groups mods go out of their way to vet new people. Some of my best support comes from FB and Reddit. I know other people who get a great deal of support from the twitter community (for example #spoonieclub) To lose that would isolate me further than my disabilities already do isolate me. I've also seen some conspiracy creeping in thinking that they will target people who are critical of Trump on social media.",,,6,0,0,
c52d51b9-5c84-421d-93a7-69936ae578f9,1554489915,"Illinois does have a state supplemental administered by their Department of Human Services (whose customer service number you posted in your comment). It is called the AADB (aid to the aged, blind or disabled) cash program. I linked to more info elsewhere in this thread.",,,2,0,0,
