,body,score_hidden,archived,name,author,author_flair_text,downs,created_utc,subreddit_id,link_id,parent_id,score,retrieved_on,controversiality,gilded,id,subreddit,ups,distinguished,author_flair_css_class,anonymized_body,anonymized_masks
560,"I will add to what others have said.  Screen reader compatibility is important.  I will mention a few specific things from my experiences with online courses and materials.

1.  Sticking to PDF is good.  However, make sure that if needed. the pdf has been OCR'd.  If you can't highlight an individual word in a PDF it is a good sign that OCR is needed.
2.  Convert those pesky PowerPoint type presentations to PDF as well.  Most presentation software is compliant with screen readers but it is easier to deal with PDF.  Review the document after you export it.  Are notes still included?  Does it flow?
3.  When you are making notes in Word, Pages, etc. Plan to convert to PDF later.  Try never to use tables for text.  Tables can be navigable but they can also turn into a mess for a screen reader.  The simple solutions is do not use tables.
4.  Avoid adding text boxes.  Again, they are not always bad but can get screwed up for a screen reader and may not be read at the appropriate time in the document.
5.  If you add pictures make sure you provide descriptions that provide enough information.  A bad description would be  - This is a graph.  A good description - This is a graph showing the  consistent decline of the Canadian population in the last ten years from 32 million to 31 million.
6.  Don't use bold or italics.  Screen readers can pick this up but I don't have the verbosity level set that high.
6.  Put heading in documents to divide sections.  When I say heading I mean from Styles in Pages or Word.  Usually called Heading1.  These are not the same as bold or italics.  They can allow a screen reader user to more quickly navigate through a document.

People can add a lot more I am sure.  Don't shy away from text based.  It can often be easier than narrating.  It can allow for braille displays or daisy readers can generally read text if desired. Simple text based documents with headings are great and very flexible.  More flexible than audio files.

Someone else mentioned making sure the platform is accessible.  That seems to be a common problem.  Another is the layout of course material files.  Make sure files are named in a descriptive way.  If there is a logical flow to folders or documents then number them.
",,,,Warthil,,,1521121769,t5_2qpec,t3_84dpfg,t3_84dpfg,1,1525188821,0,0,dvqmi4y,Blind,,,,,
561,It is quite a new product.  It is likely going to be tough to find one used.  You might want to try posting a classified on blind bargains website.  Might get lucky and find someone who has it but does not use it.,,,,Warthil,,,1521249141,t5_2qpec,t3_84w21j,t3_84w21j,2,1525251961,0,0,dvtrxj2,Blind,,,,,
562,"There are already a number of colour readers and text-to-speech apps currently on the market. You can always make a new one, but for it to be successful, there would be some tough competition.

",,,,KillerLag,"Sighted, O&amp;M Instructor",,1519865392,t5_2qpec,t3_80xl3t,t3_80xl3t,1,1524685369,0,0,duzp1yz,Blind,,,blue2,,
563,"Where you live, do you have any deaf-blind intervention services? They may be able to help with that.
",,,,KillerLag,"Sighted, O&amp;M Instructor",,1520217911,t5_2qpec,t3_81t4hz,t1_dv60ugd,1,1524822690,0,0,dv70nl0,Blind,,,blue2,,
564,"I agree, as someone who mastered a international city in 3 weeks time of being there I see no issues. I also work events and crowds at a totally blind journalist. My cane serves me lots but quite well. My sister did a similar project. It may help with beginning user, maybe more timid children, get them to begin as a training cane before they graduate to a normal cane. That could also teach bad habbits and reliance as well, though.",,,,estj136,blind conservative go-getter,,1520559872,t5_2qpec,t3_830lqb,t3_830lqb,2,1524968029,0,0,dveqi8r,Blind,,,blue1,,
565,"Unfortunately, it's a them problem, not a you problem. Disability in general and for whatever reason blindness in particular make people get all weird and shit. They either assume they'll have to take care of you, or that if they spend more than 5 minutes in the same room as you they'll catch the blinds. Education helps, but only if the potentially educated is willing to listen. Otherwise, patience is about all you can do.",,,,quanin,Glaucoma,,1522223062,t5_2qpec,t3_87p9fu,t3_87p9fu,4,1525672269,0,0,dweq1ur,Blind,,,blue1,,
566,here you go: [Talking Waterproof Watch for the Visually Impaired or Blind](http://areyouhappyat.work/finally-talking-waterproof-watch-visually-impaired-blind/) - someone had posted the link some time ago on this very same sub. ,,,,JackFly,,,1520687776,t5_2qpec,t3_83f2wf,t3_83f2wf,4,1525013319,0,0,dvhad79,Blind,,,,,
567,"Here is another person who inspires me.  Congrats to Mac and Jack and. his sighted guide at the paralympics.
http://www.cbc.ca/sports/paralympics/alpine-skiing/dynamic-duo-marcoux-leitch-golden-start-paralympics-1.4570912",,,,Warthil,,,1520690068,t5_2qpec,t3_82gyj5,t1_dvffmh0,1,1525014026,0,0,dvhbr3h,Blind,,,,"Here is another person who inspires me.  Congrats to <PERSON> and <PERSON> and. his sighted guide at the paralympics.
<URL>","[{'start': 118, 'end': 123, 'entity_type': 'URL', 'text': '<URL>', 'operator': 'replace'}, {'start': 66, 'end': 74, 'entity_type': 'PERSON', 'text': '<PERSON>', 'operator': 'replace'}, {'start': 53, 'end': 61, 'entity_type': 'PERSON', 'text': '<PERSON>', 'operator': 'replace'}]"
568,"I really like the idea of listing those who are blind and inspire us.  Another for me is blind rock climber and photographer Justin Salas.  I admit I am not inspired to go climbing.  However, I am inspired by people who continue to challenge stereotypes. http://www.justinsalas.com",,,,Warthil,,,1520600294,t5_2qpec,t3_82gyj5,t1_dvanugi,1,1524980528,0,0,dvffmh0,Blind,,,,"I really like the idea of listing those who are blind and inspire us.  Another for me is blind rock climber and photographer <PERSON>.  I admit I am not inspired to go climbing.  However, I am inspired by people who continue to challenge stereotypes. <URL>","[{'start': 251, 'end': 256, 'entity_type': 'URL', 'text': '<URL>', 'operator': 'replace'}, {'start': 125, 'end': 133, 'entity_type': 'PERSON', 'text': '<PERSON>', 'operator': 'replace'}]"
569,Make sure your platform works well with screen readers. ,,,,furtivepatach,,,1521037797,t5_2qpec,t3_84dpfg,t3_84dpfg,5,1525154093,0,0,dvopboj,Blind,,,,,
570,"Ahh voting. You know, aside from figuring out how to get to a polling place, I've never had an issue voting. Granted, I lived in a small enough town that one of the poll workers knew me by name and knew my disability, but what made that person stand out was that she didn't assume what accommodations I needed. Someone jokingly asked me once if my service dog was going to vote. It was a nice time.

The first time I voted, I did a paper ballot where you had to connect a line between two arrows to indicate your choice. I've done electronic voting since, and usually, it's bright and the print is large enough for me at least.  
",,,,blind_devotion08,Retinitis Pigmentosa / Legally Blind,,1520360661,t5_2qpec,t3_82bxsp,t3_82bxsp,1,1524881662,0,0,dva0s00,Blind,,,blue1,,
571,I've never found an ASMR recording that actually worked. ,,,,Mesmer7,,,1520010288,t5_2qpec,t3_80yso1,t1_duzgvla,1,1524741085,0,0,dv2uewm,Blind,,,,,
572,"If you mean Pokemon on ds, that's quite playable as u/nighthawk321 will tell you. But yeah I'm helping him with walkthroughs and describing puzzles is... kinda hard, but only because i'm describing it step by step so it takes long. Nighthawk's completed a bunch of Pokemon games already. ",,,,HailDaHailu,retinopathy of prematurity in one eye,,1520374670,t5_2qpec,t3_825akz,t1_dv7q0ug,2,1524890217,0,0,dvag6md,Blind,,,blue2,"If you mean Pokemon on ds, that's quite playable as u/<REDDIT_NAME> will tell you. But yeah I'm helping him with walkthroughs and describing puzzles is... kinda hard, but only because i'm describing it step by step so it takes long. Nighthawk's completed a bunch of Pokemon games already. ","[{'start': 54, 'end': 67, 'entity_type': 'REDDIT_NAME', 'text': '<REDDIT_NAME>', 'operator': 'replace'}]"
573,"It help a ton with a minimalistic design mindset. Owning just a few little stuff, has less stuff in mind, which makes organization much simpler. If I have something out of place, is because im selling it or throwing it away.

Blind people can’t do their best with a busy home/workspace.",,,,ScarReincarnated,,,1521503867,t5_2qpec,t3_85o3ik,t3_85o3ik,2,1525349679,0,0,dvyvnkm,Blind,,,,,
574,Paralympic hopeful living and training at the Colorado Olympic Training Center.,,,,Nighthawk321,Gunshot.,,1521765077,t5_2qpec,t3_86ctx0,t3_86ctx0,4,1525487932,0,0,dw4vmog,Blind,,,blue1,<LOCATION> hopeful living and training at the Colorado Olympic Training Center.,"[{'start': 0, 'end': 10, 'entity_type': 'LOCATION', 'text': '<LOCATION>', 'operator': 'replace'}]"
575,"Rather than repressing all the emotions, take time to process your feelings. You may have to hold them in until the end of the day, but giving time to think and process your emotions help you a lot in the long run.

When under blindfold training, you may have a freakout. Might be early in the training, may be later. It's hard to tell. Not everyone has it, but a lot of people do. When that happens, you can ask the instructor to give you a few moments to calm yourself down. Take slow, deep breathes until you are back under control. You think more clearly afterwards, and can analyze what may have caused it.

Take some time to get to know the instructor. Building up trust helps, since they would be watching out for you. 

If you are learning how to eat under blindfold, you may want to start with someone simple. The first time my classmates and I had a meal under blindfold, my partner dumped a LOT of Parmesan cheese into my lap (for my spaghetti). I stuck to the garlic bread after that. 

Also, ask questions. If you aren't sure, it is better to ask and find out. I've had clients who made assumptions, that were not true. 

Good luck on the training! Hope you find it helpful!",,,,KillerLag,"Sighted, O&amp;M Instructor",,1521756733,t5_2qpec,t3_86e3v4,t3_86e3v4,6,1525483600,0,0,dw4ncve,Blind,,,blue2,,
576,Thank you. It has been hard. He's just a shell of the man he was. I hide it as much as I can but I do get frustrated because its like he's just given up on life and is waiting to die. I can't be mad about it because I can't imagine how hard it is. I am really just grasping at straws now. Anything that might bring the smallest bit of joy or not even joy. Just something that interests him. Just something.,,,,majorthomasina,,,1521765048,t5_2qpec,t3_86ge3l,t1_dw4uv6t,2,1525487918,0,0,dw4vlmo,Blind,,,,,
577,"I have used Aftershokz, but only the wired version. They have Bluetooth versions. They are decent enough for getting information, but not so good for music.

A landmark is a unique object that helps to identify where someone is. For example, a fire hydrant at a specific location could be a landmark. ",,,,KillerLag,"Sighted, O&amp;M Instructor",,1521514790,t5_2qpec,t3_830lqb,t1_dvyn4xh,1,1525354961,0,0,dvz5tfz,Blind,,,blue2,,
578,I recomend checking out the blind life on youtube. Always great videos. ,,,,woolentripod,,,1521182394,t5_2qpec,t3_84pxhn,t3_84pxhn,2,1525223850,0,0,dvs9l77,Blind,,,,,
579,"I will also add another from Canada.  David Lepofsky is a lawyer and disability advocate.  Here is a video of him talking about accessibility at Ryerson University.

https://www.youtube.com/watch?v=uqUZ6gK9N9k",,,,Warthil,,,1520525227,t5_2qpec,t3_82gyj5,t1_dvanugi,1,1524948989,0,0,dvdpk5c,Blind,,,,"I will also add another from <LOCATION>.  <PERSON> is a lawyer and disability advocate.  Here is a video of him talking about accessibility at Ryerson University.

<URL>","[{'start': 164, 'end': 169, 'entity_type': 'URL', 'text': '<URL>', 'operator': 'replace'}, {'start': 42, 'end': 50, 'entity_type': 'PERSON', 'text': '<PERSON>', 'operator': 'replace'}, {'start': 29, 'end': 39, 'entity_type': 'LOCATION', 'text': '<LOCATION>', 'operator': 'replace'}]"
580,Sure is! US only according to the Microsoft press release I saw. And not in the Canadian app store; I just checked.  ,,,,fastfinge,born blind,,1520041963,t5_2qpec,t3_81b043,t1_dv3iby0,1,1524755711,0,0,dv3oz3t,Blind,,,blue1,Sure is! <LOCATION> only according to the Microsoft press release I saw. And not in the Canadian app store; I just checked.  ,"[{'start': 9, 'end': 19, 'entity_type': 'LOCATION', 'text': '<LOCATION>', 'operator': 'replace'}]"
581,"Yeah, ask if you need help.

I am 25, and totally blind, blind since birth totally blind since 8. Pretty decorated out there blind person. I do a lot, tend to be a go getter, very vocal and assert. If you know MBTI I am ESTJ, Te subtype. So yeah. 

Work on staff for the newspaper, get interviews by myself, find people go places on my own. I traveled around 3 counties completely alone, I know three of them pretty well, 2 of them fairly large counties, Orange county, Los Angeles county, and the city of san francisco. Served on my high school paper and had the same independence. Traveled over seas twice. Once really independently, the other semi but the semi-independent when I was 13. Another example, is tomorrow I go on business for the paper downtown and helping with advertising and securing lunch. Iam going to a restaurant to secure a deal. I want to either pr for a political thank tank, person, or party. We’ll see what happens or be a political correspondent. Being a journalist fully is a goal, or in religion. I am on a paper but it’s for a university. So, basically still work, it’s seen either at most school as slub or class, but honestly, all those meetings are are, work meetings. You just don’t get paid! You write on a paper, work your own events story, basically no difference than a real job. So... What else have I done. I’ve lead a few writing critique groups, online. I’ve ran a few forums. I’ve also been the flyer girl for a blind organization, because the staff liked me so much for being so independent and a go getter! I’ve always just jumped out there and done things. I also won the ASB presidency in fifth grade and there continues to be a contest at the school to beat my record. So. Heh! Blind people can do anything is the moral of the lesson!",,,,estj136,blind conservative go-getter,,1520341632,t5_2qpec,t3_7zucmo,t3_7zucmo,1,1524871296,0,0,dv9i3p3,Blind,,,blue1,"Yeah, ask if you need help.

I am 25, and totally blind, blind since birth totally blind since 8. Pretty decorated out there blind person. I do a lot, tend to be a go getter, very vocal and assert. If you know <PERSON> I am <PERSON>, Te subtype. So yeah. 

Work on staff for the newspaper, get interviews by myself, find people go places on my own. I traveled around 3 counties completely alone, I know three of them pretty well, 2 of them fairly large counties, <LOCATION>, <LOCATION> county, and the city of <LOCATION>. Served on my high school paper and had the same independence. Traveled over seas twice. Once really independently, the other semi but the semi-independent when I was 13. Another example, is tomorrow I go on business for the paper downtown and helping with advertising and securing lunch. Iam going to a restaurant to secure a deal. I want to either pr for a political thank tank, person, or party. We’ll see what happens or be a political correspondent. Being a journalist fully is a goal, or in religion. I am on a paper but it’s for a university. So, basically still work, it’s seen either at most school as slub or class, but honestly, all those meetings are are, work meetings. You just don’t get paid! You write on a paper, work your own events story, basically no difference than a real job. So... What else have I done. I’ve lead a few writing critique groups, online. I’ve ran a few forums. I’ve also been the flyer girl for a blind organization, because the staff liked me so much for being so independent and a go getter! I’ve always just jumped out there and done things. I also won the ASB presidency in fifth grade and there continues to be a contest at the school to beat my record. So. Heh! Blind people can do anything is the moral of the lesson!","[{'start': 510, 'end': 520, 'entity_type': 'LOCATION', 'text': '<LOCATION>', 'operator': 'replace'}, {'start': 475, 'end': 485, 'entity_type': 'LOCATION', 'text': '<LOCATION>', 'operator': 'replace'}, {'start': 463, 'end': 473, 'entity_type': 'LOCATION', 'text': '<LOCATION>', 'operator': 'replace'}, {'start': 224, 'end': 232, 'entity_type': 'PERSON', 'text': '<PERSON>', 'operator': 'replace'}, {'start': 210, 'end': 218, 'entity_type': 'PERSON', 'text': '<PERSON>', 'operator': 'replace'}]"
582,It really is a cooky situation! Things at school before this season's isolation were frankly out of control and the parent was coming up to school and allowing her not to go to lunchroom despite my disapproval. They say the isolation is necessary due to her reduced lung capacity from a rare syndrome and adrenal disorder; that getting the flu could cause her serious hospitalization. I will continue to request and look into more extracurricular activities for her when she's in school.,,,,96tears,,,1520562942,t5_2qpec,t3_832rs3,t1_dvep8tw,1,1524969500,0,0,dvetf71,Blind,,,,,
583,Hey being introverted I am quickly learning recently gets you in to less trouble!!!! Uggg! I’ve been a mess lately because of people who is picking me and this other guy apart. They hate what I have to say and is agressively attacking both of us. Hahahaha!,,,,estj136,blind conservative go-getter,,1520124460,t5_2qpec,t3_7z0cb5,t1_duvdfun,1,1524783870,0,0,dv57r8e,Blind,,,blue1,Hey being introverted I am quickly learning recently gets you in to less trouble!!!! <PERSON>! I’ve been a mess lately because of people who is picking me and this other guy apart. They hate what I have to say and is agressively attacking both of us. Hahahaha!,"[{'start': 85, 'end': 93, 'entity_type': 'PERSON', 'text': '<PERSON>', 'operator': 'replace'}]"
584,"You can use a cane to check where the urinals are, if they are the wall mounted kind that stick out. The ones that are sunken into the floor, that is trickier because you generally don't want your cane in there. You can also use environmental cues (running water, sound of other men peeing) to help orient where things are. An O&amp;M instructor can also teach you where the urinals and toilet stalls are.

In terms of toilet stalls, you can also use the cane to locate the toilet itself. Sitting down isn't particularly difficult, parents usually teach that part. ",,,,KillerLag,"Sighted, O&amp;M Instructor",,1522383921,t5_2qpec,t3_887r55,t3_887r55,3,1525743605,0,0,dwikgwx,Blind,,,blue2,,
585,"No problem at all. May be worth a post at some point to explain how to make a good one, but these are people with an interest and I wouldn't want to curtail that.",,,,jage9,,,1521510846,t5_2qpec,t3_85ojma,t3_85ojma,3,1525353129,0,0,dvz2ar6,Blind,,,,,
586,"It just sounds like we feel so sorry for our kid, let us baby her, and just give her an easy time. And she’s so precious let’s just baby her, and burry our head in the sand! She’s so delicate to us let’s isolate her.

I don’t care what side of politics you are on, the folloing bit is really not party specific but disability.

In the 2012 or 2016 I think it was 2012, rick santorum was talking about his child. He was born with a disability. I forgot the gender but that doesn’t matter right now either. Santorum was saying how one day rick santorum himself realized the baby was more than his disability, and was actually human. and that it was probably better to treat the baby like he was human. I think the point was made about abortion, but whatever, doesn’t matter. His political views isn’t my point here. It is people often do this. You have to realize it’s okay, you can’t be so afraid to break them, because if you are, you’ll break them, for sure! There is probably a better more medical solution. We don’t live in the old days where isolation was in fact the best solution.",,,,estj136,blind conservative go-getter,,1520566202,t5_2qpec,t3_832rs3,t1_dvew1y5,2,1524970987,0,0,dvewdv8,Blind,,,blue1,"It just sounds like we feel so sorry for our kid, let us baby her, and just give her an easy time. And she’s so precious let’s just baby her, and burry our head in the sand! She’s so delicate to us let’s isolate her.

I don’t care what side of politics you are on, the folloing bit is really not party specific but disability.

In the 2012 or 2016 I think it was 2012, <PERSON> was talking about his child. He was born with a disability. I forgot the gender but that doesn’t matter right now either. <PERSON> was saying how one day <PERSON> himself realized the baby was more than his disability, and was actually human. and that it was probably better to treat the baby like he was human. I think the point was made about abortion, but whatever, doesn’t matter. His political views isn’t my point here. It is people often do this. You have to realize it’s okay, you can’t be so afraid to break them, because if you are, you’ll break them, for sure! There is probably a better more medical solution. We don’t live in the old days where isolation was in fact the best solution.","[{'start': 532, 'end': 540, 'entity_type': 'PERSON', 'text': '<PERSON>', 'operator': 'replace'}, {'start': 500, 'end': 508, 'entity_type': 'PERSON', 'text': '<PERSON>', 'operator': 'replace'}, {'start': 369, 'end': 377, 'entity_type': 'PERSON', 'text': '<PERSON>', 'operator': 'replace'}]"
587,"Hmm... maybe Scientific Notebook from MacKichan?

And if this is something you’re going to be doing regularly, buying one Duxbury license will honestly save you tons of time and energy. I know it is expensive, but it is worth it. ",,,,jogajaja,Sighted- TVI,,1522474694,t5_2qpec,t3_8740c8,t3_8740c8,1,1525777998,0,0,dwkh8v7,Blind,,,blue2,,
588,We need to get to the point where VR/AR and link directly to the occipital lobe,,,,bailerj,,,1520504888,t5_2qpec,t3_825akz,t3_825akz,1,1524941445,0,0,dvdb5wy,Blind,,,,,
589,"The name is [Millennium BCP](https://ind.millenniumbcp.pt/en/particulares/Pages/Welcome.aspx); it's a Portuguese bank.  Don't bother contacting them, they aren't likely to do anything.",,,,Ramildo,,,1520984642,t5_2qpec,t3_846fdj,t1_dvnjtda,2,1525135010,0,0,dvnobk4,Blind,,,,"The name is [Millennium BCP](<URL>); it's a Portuguese bank.  Don't bother contacting them, they aren't likely to do anything.","[{'start': 29, 'end': 34, 'entity_type': 'URL', 'text': '<URL>', 'operator': 'replace'}]"
590,"Ah, that makes a lot of sense. To be less vague, I think that I can design a portable system that could effectively merge those categories of screen reader and navigator. Using multiple cameras it would be able to read any computer screen in front of you and guide you through the touch screen or keypad, and it would use those same cameras to orient the user once GPS routes you to within roughly 10 meters of the location. The system itself would be a PC with the processing power of a laptop and a touch interface. I know it all sounds rather fantastic, but I really think the hardware technology is there, the biggest issue is thoughtful implementation.

I'm trying to learn by using screen readers myself. I'm still very new to it, but I've noticed that even screen readers can't help when it comes to inaccessible web content, and I haven't tried yet, but I imagine certain things like spreadsheets are not fun to use. I think my project can add to this by turning the space in front of you into a virtual touch interface.  I know touch interfaces are tricky to get right, but the key is that users could parse content however they pleased using their hands and get audio feedback.

Am I understanding what makes web content inaccessible? I know things like not providing alt text are just designers being lazy and inconsiderate, but I'm trying to understand the fundamental issues that come from content relying too much on graphical intuition. Right now in content design, I feel like it is cool not to explain anything or provide a description. Everybody wants to use slick graphics without text because it is en vogue.",,,,Able_Me,Sighted Engineer,,1522076365,t5_2qpec,t3_86rmpf,t1_dway34j,1,1525607144,0,0,dwb6qt7,Blind,,,blue2,,
591,"That's awesome. I wish I could do that. A friend from Florida wanted me to meet him in and another friend in California last year but I had to decline cause I can't travel independently yet. 

That and my passport has expired. ",,,,BeardedJerry,,,1520364763,t5_2qpec,t3_80nvnb,t1_dv9h3v5,1,1524884465,0,0,dva5b5b,Blind,,,,"That's awesome. I wish I could do that. A friend from <LOCATION> wanted me to meet him in and another friend in <LOCATION> last year but I had to decline cause I can't travel independently yet. 

That and my passport has expired. ","[{'start': 112, 'end': 122, 'entity_type': 'LOCATION', 'text': '<LOCATION>', 'operator': 'replace'}, {'start': 54, 'end': 64, 'entity_type': 'LOCATION', 'text': '<LOCATION>', 'operator': 'replace'}]"
