,body,score_hidden,archived,name,author,author_flair_text,downs,created_utc,subreddit_id,link_id,parent_id,score,retrieved_on,controversiality,gilded,id,subreddit,ups,distinguished,author_flair_css_class,anonymized_body,anonymized_masks
0,I did a search on the app store and found three text-to-speech programs. Two cost money and one was free.  Are there free ones out there (I have a macbook and iPhone) that I should start with?  Thank you.,,,,dal301,,,1522455228,t5_2qpec,t3_88co0a,t1_dwjwy6l,1,1525770921,0,0,dwk2pvw,Blind,,,,,
1,"This is pretty cool.

Any idea how he does that?",,,,BARDLover,LCA,,1520302365,t5_2qpec,t3_827a4n,t3_827a4n,1,1524858396,0,0,dv8utp2,Blind,,,blue1,,
2,"You should also consider contacting your local rehabilitation group that does cane training, to show you how it is used. ",,,,KillerLag,"Sighted, O&amp;M Instructor",,1522031794,t5_2qpec,t3_86rmpf,t1_dw90if1,4,1525594239,0,0,dwafnh3,Blind,,,blue2,,
3,"I do a lot of gaming videos and a handful of videos of me playing the piano, singing, or going to concerts. Here's my channel:

https://www.youtube.com/channel/UCoZujToINVP7xax9BTc7s2g/videos?disable_polymer=1
",,,,Nighthawk321,Gunshot.,,1521172146,t5_2qpec,t3_84pxhn,t1_dvrobdn,2,1525219827,0,0,dvs2b3d,Blind,,,blue1,"I do a lot of gaming videos and a handful of videos of me playing the piano, singing, or going to concerts. Here's my channel:

<URL>
","[{'start': 128, 'end': 133, 'entity_type': 'URL', 'text': '<URL>', 'operator': 'replace'}]"
4,"If I go to the FEMDOM HYPNOSIS page, I notice there's an edit box, (a box you can type in,) that doesn't have the propper HTML to allow a screen reader user to know what it is. All I hear when pressing e to get to the box is edit. Instead of something like, first name edit. A great site to help you would be https://webaim.org/techniques/forms/",,,,bradley22,,,1519889515,t5_2qpec,t3_80yso1,t3_80yso1,1,1524695086,0,0,dv07xeu,Blind,,,,"If I go to the FEMDOM HYPNOSIS page, I notice there's an edit box, (a box you can type in,) that doesn't have the propper HTML to allow a screen reader user to know what it is. All I hear when pressing e to get to the box is edit. Instead of something like, first name edit. A great site to help you would be <URL>","[{'start': 309, 'end': 314, 'entity_type': 'URL', 'text': '<URL>', 'operator': 'replace'}]"
5,"In order to ensure a safe environment for all members of our community, we've chosen to disallow posts of a dating advertisement nature. We are unable to screen posters, and we discourage giving out your personal information over Reddit.",,,,-shacklebolt-,,,1522357863,t5_2qpec,t3_884gd0,t3_884gd0,1,1525730422,0,0,dwhw2tz,Blind,,moderator,,,
6," It may take a few weeks to get medical documentation of your dad‘s disability, so that you can apply for the free talking book program available through The national Library service for the blind and physically handicapped;however, in the short term, if you have 20 bucks to spare, get your dad a subscription to audible. The $20 a month plan gets you to Audible credits, which equals two books a month, and since I am a science-fiction and fantasy fan I can vouch for the fact that they have literally thousands of titles. He can tell Alexa to read his audiobook, and it will play him the book from audible. He can even say Alexa, next chapter, previous chapter, etc., to navigate through the book. Also, get him an iPhone. It is costly, but it’sthe single most life-changing electronic device that the blind can access. When you aren’t there to help him, he can use free apps  like Be My Eyes, which utilizes the iPhone camera, and A network of 300,000+ volunteers around the world, who will help him with any task that requires vision. For example, if he wants to figure out whether there’s diet Coke or diet Pepsi in the fridge, needs to tell which bottle is shampoo, and which is conditioner, needs to get a shirt to match his pants,he can Open the app, ask his question, and the volunteers will direct him how to use his phone to show them his surroundings, so they can help. Social networking apps like Vorail, will let him virtually mingle with other blind peers, and find out how they cope. This can be extremely helpful to newly blinded individuals, because they learned that blindness is not a death sentence, that we are active, and social like everyone else. If you have any other specific questions, keep my user name handy, and don’t hesitate to PM me. I’m always happy to help, and fully understand that this new challenge in his life, may be overwhelming to the both of you at times.    ",,,,GoneVision,blinded by the light… revved up like a deuce,,1522190283,t5_2qpec,t3_86ge3l,t3_86ge3l,1,1525659506,0,0,dwe0e2f,Blind,,,blue1," It may take a few weeks to get medical documentation of your dad‘s disability, so that you can apply for the free talking book program available through The national Library service for the blind and physically <LOCATION>, in the short term, if you have 20 bucks to spare, get your dad a subscription to audible. The $20 a month plan gets you to Audible credits, which equals two books a month, and since I am a science-fiction and fantasy fan I can vouch for the fact that they have literally thousands of titles. He can tell <PERSON> to read his audiobook, and it will play him the book from audible. He can even say <PERSON>, next chapter, previous chapter, etc., to navigate through the book. Also, get him an iPhone. It is costly, but it’sthe single most life-changing electronic device that the blind can access. When you aren’t there to help him, he can use free apps  like Be My Eyes, which utilizes the iPhone camera, and A network of 300,000+ volunteers around the world, who will help him with any task that requires vision. For example, if he wants to figure out whether there’s diet Coke or diet Pepsi in the fridge, needs to tell which bottle is shampoo, and which is conditioner, needs to get a shirt to match his pants,he can Open the app, ask his question, and the volunteers will direct him how to use his phone to show them his surroundings, so they can help. Social networking apps like Vorail, will let him virtually mingle with other blind peers, and find out how they cope. This can be extremely helpful to newly blinded individuals, because they learned that blindness is not a death sentence, that we are active, and social like everyone else. If you have any other specific questions, keep my user name handy, and don’t hesitate to PM me. I’m always happy to help, and fully understand that this new challenge in his life, may be overwhelming to the both of you at times.    ","[{'start': 620, 'end': 628, 'entity_type': 'PERSON', 'text': '<PERSON>', 'operator': 'replace'}, {'start': 528, 'end': 536, 'entity_type': 'PERSON', 'text': '<PERSON>', 'operator': 'replace'}, {'start': 212, 'end': 222, 'entity_type': 'LOCATION', 'text': '<LOCATION>', 'operator': 'replace'}]"
7,I'm a conservative my self. I do believe that the ADA didn't really do much. Wile it did give access to buildings it didn't do anything for blind people in a cultural sense. And those of you who are conservative know who controls the culture. I'm also against protected classes. I don't want to go to college I want to get my own place and work at a job.,,,,[deleted],,,1522178331,t5_2qpec,t3_86h5nd,t3_86h5nd,1,1525652853,0,0,dwdng1i,Blind,,,,,
8,"Very cool article. That has been an issue my coworkers and I have discussed a few times. While the remote assistance is great, we've found that some people become too reliant on it and start to lose basic skills. Instead of learning a good organization system for their canned soups (or whatever groceries), they get used to just FaceTiming their family members and have them look through the camera. That's all fine and good in an optimal situation, but that doesn't always work. What happens if you need to locate something at 3 AM? Call your family and wake them up?

The other issue is about privacy, which has become a big deal in light of what some organizations have been doing. Some people don't like using those systems to access their banking or taxes, but that may be the only choice they have. ",,,,KillerLag,"Sighted, O&amp;M Instructor",,1522385697,t5_2qpec,t3_886q16,t3_886q16,4,1525744303,0,0,dwilrf0,Blind,,,blue2,,
9,"Thanks for the service! I'm in San Francisco and have been a really vocal supporter of Instacart along with giving you guys constant accessibility feedback. Had a pretty long thread going just a few years ago with some of your support personnel about it. Ultimately, the info pages for individual items could use some help as the information there is usually garbled when VoiceOver tries reading it back or is missing/consistent. Always seems like the touch areas for related items keeps trying to overtake attention from the item description and info, and the controls for adding the item to the cart is too small and sometimes hard to find with the rest of the interface fighting for attention. 

The chat and messaging interface works for the most part, but with the nature of having to listen to my screen reader in order to interact with the chat, a common occurrence is to have the shopper make a change, get the wrong thing, and by the time I've heard it and written a message, they are already in checkout and I get stuck working with support for the items I didn't want. This happens even with substitutions set. The best thing to do is to bring in an end-user and observe how we use the app first-hand. Writing out feedback is one thing, but if you have no one on your staff familiar with accessible technology, you won't be able to adequately test for accessibility and leave those bugs for us to find and struggle with in production. 

I would ask for more consistency with product labeling, as sometimes identical items show up in the browsing lists but worded in different ways making the shopping confusing.  Fixing the item descriptions would go a long way to solve this. O additional major problem is the way you handle the delivery scheduling time controls. It is Always a struggle to pick the correct date and time for delivery as it is a custom control. Changing that to a standard iOS control would be ideal rather than you trying to handle it programmatically with a custom control. Tapping on the time sometimes brings up the date, and vice-versa. Choosing a time that seems to be available results in the confirmation button remaining dim, making me go back to the scheduling pop-ups only to find that nothing I chose was actually set. It's been broken for years and you guys have done nothing to address that, so I hope that core bit of functionality will hit a bit of priority soon. ",,,,Marconius,Blind from sudden RAO,,1522186240,t5_2qpec,t3_87l1d9,t3_87l1d9,4,1525657387,0,0,dwdwbkk,Blind,,,blue1,"Thanks for the service! I'm in <LOCATION> and have been a really vocal supporter of <LOCATION> along with giving you guys constant accessibility feedback. Had a pretty long thread going just a few years ago with some of your support personnel about it. Ultimately, the info pages for individual items could use some help as the information there is usually garbled when VoiceOver tries reading it back or is missing/consistent. Always seems like the touch areas for related items keeps trying to overtake attention from the item description and info, and the controls for adding the item to the cart is too small and sometimes hard to find with the rest of the interface fighting for attention. 

The chat and messaging interface works for the most part, but with the nature of having to listen to my screen reader in order to interact with the chat, a common occurrence is to have the shopper make a change, get the wrong thing, and by the time I've heard it and written a message, they are already in checkout and I get stuck working with support for the items I didn't want. This happens even with substitutions set. The best thing to do is to bring in an end-user and observe how we use the app first-hand. Writing out feedback is one thing, but if you have no one on your staff familiar with accessible technology, you won't be able to adequately test for accessibility and leave those bugs for us to find and struggle with in production. 

I would ask for more consistency with product labeling, as sometimes identical items show up in the browsing lists but worded in different ways making the shopping confusing.  Fixing the item descriptions would go a long way to solve this. O additional major problem is the way you handle the delivery scheduling time controls. It is Always a struggle to pick the correct date and time for delivery as it is a custom control. Changing that to a standard iOS control would be ideal rather than you trying to handle it programmatically with a custom control. Tapping on the time sometimes brings up the date, and vice-versa. Choosing a time that seems to be available results in the confirmation button remaining dim, making me go back to the scheduling pop-ups only to find that nothing I chose was actually set. It's been broken for years and you guys have done nothing to address that, so I hope that core bit of functionality will hit a bit of priority soon. ","[{'start': 84, 'end': 94, 'entity_type': 'LOCATION', 'text': '<LOCATION>', 'operator': 'replace'}, {'start': 31, 'end': 41, 'entity_type': 'LOCATION', 'text': '<LOCATION>', 'operator': 'replace'}]"
10,"Thank you for your reply.

I anticipate that any website I would develop would be best used on a smart phone. There are ways of activating the GPS and vibration from the Web browser now, so I see that as a way of communicating to the user when looking at a screen is not possible or practical.

Do you think you would find the data above useful while on the go? ",,,,MowgliB,,,1520048506,t5_2qpec,t3_80t609,t1_dv08hbm,1,1524758147,0,0,dv3u23z,Blind,,,,,
11,"All three are important, and there isn't a single solution. 

Individuals can be trained, but they can also just be busy or not paying attention. I've had people run into my clients because they were busy on their phone. 

Infrastructure can be improved to make traveling easier, but when a place is filled to max capacity, it doesn't matter if a person can't find the adapted sections. For example, the subway in Toronto has tactile markers that a cane user can use to follow to get to stairs, escalators, etc. But if people are standing on them and not moving, then that becomes much more difficult to use.

For technology, some locations are starting to use iBeacons now to help navigate. However, they are imprecise at best, and downright confusing at worst. I know of a location where two iBeacon signals overlap, and the phone thinks that someone is moving back and forth between then, when you are standing still. Worse yet, because the signals are overlapping, the message plays for a few seconds before jumping to the next one, and then it happens again. Also, EM interference (from Bluetooth devices, magnetic fields, and lots of other things) can throw it off as well. ",,,,KillerLag,"Sighted, O&amp;M Instructor",,1520908479,t5_2qpec,t3_83po30,t1_dvk6hp4,2,1525099946,0,0,dvlywgu,Blind,,,blue2,"All three are important, and there isn't a single solution. 

Individuals can be trained, but they can also just be busy or not paying attention. I've had people run into my clients because they were busy on their phone. 

Infrastructure can be improved to make traveling easier, but when a place is filled to max capacity, it doesn't matter if a person can't find the adapted sections. For example, the subway in <LOCATION> has tactile markers that a cane user can use to follow to get to stairs, escalators, etc. But if people are standing on them and not moving, then that becomes much more difficult to use.

For technology, some locations are starting to use iBeacons now to help navigate. However, they are imprecise at best, and downright confusing at worst. I know of a location where two iBeacon signals overlap, and the phone thinks that someone is moving back and forth between then, when you are standing still. Worse yet, because the signals are overlapping, the message plays for a few seconds before jumping to the next one, and then it happens again. Also, EM interference (from Bluetooth devices, magnetic fields, and lots of other things) can throw it off as well. ","[{'start': 414, 'end': 424, 'entity_type': 'LOCATION', 'text': '<LOCATION>', 'operator': 'replace'}]"
12,Thank you! That is another thing I have never heard of! I think they could be used on other things too! ,,,,majorthomasina,,,1521863843,t5_2qpec,t3_86ge3l,t1_dw5nlrp,1,1525535494,0,0,dw74ykf,Blind,,,,,
13,"Oh, definitely. Isolation is not the best way to go, especially for that age range. ",,,,KillerLag,"Sighted, O&amp;M Instructor",,1520565825,t5_2qpec,t3_832rs3,t1_dvevzxp,3,1524970819,0,0,dvew1y5,Blind,,,blue2,,
14,"I'm honestly not that into Audio erotica but blind/VI people are like sighted people in that we like different things depending on the person you ask. For example, I love the sound of a womans heartbeat but others may not be into that. I like bigger women but others may not be into that. It's a personal preference. as for keywords I'd assume it was the same for a sighted person as it would be for a blind/VI person.

As for your recordings, I checked out the Enthralling Rhythms one and honestly was a little distracted by the popping Ps' and hissing in the background. I'd Personally not pay $35 for a recording like that.",,,,bradley22,,,1519890014,t5_2qpec,t3_80yso1,t3_80yso1,1,1524695203,0,0,dv0862o,Blind,,,,"I'm honestly not that into <PERSON> erotica but blind/VI people are like sighted people in that we like different things depending on the person you ask. For example, I love the sound of a womans heartbeat but others may not be into that. I like bigger women but others may not be into that. It's a personal preference. as for keywords I'd assume it was the same for a sighted person as it would be for a blind/VI person.

As for your recordings, I checked out the Enthralling Rhythms one and honestly was a little distracted by the popping Ps' and hissing in the background. I'd Personally not pay $35 for a recording like that.","[{'start': 27, 'end': 35, 'entity_type': 'PERSON', 'text': '<PERSON>', 'operator': 'replace'}]"
15,"I agree with everyone that you shouldn't give up on your dreams and that you should definitely continue to pursue a career that your passionate about. That being said, I think it's really smart that you're planning ahead for a career that could provide you with longevity and adapt to you as much as you will have to adapt to it given the eventual loss of both senses. 

The careers that you mentioned seem like great options because they'd allow you the flexibility to work with clients/ students and/ or focus on research while still getting to learn about things you're interested in! 

 As you're starting to choose your career one thing that might be helpful is to do some job shadowing for each of the feild you're interested in. That way you can experience what it would be like to have that job. and really see if its something you're interested in and and get a feel for which areas of the career you might need accommodations in and start to plan for that.  Another thing that might be helpful is reaching out to professors whose careers are similar to the ones you want, to talk about their experience in the field. You could also do some research on graduate programs as that can provide you withsome insight on what to expect from a career. Also consider talking to your campus disability centre and career center they might be good resources for talking about how you can make these careers work for you. 

It won't always be easy and sometimes you'll have to get creative but keep pursuing what you're passionate about! Good luck!    

 
 ",,,,tacos4thesoul,,,1520599644,t5_2qpec,t3_832438,t3_832438,1,1524980331,0,0,dvff85x,Blind,,,,,
16,it would be cool to see this technology advance to a point where the blind for drive actual cars.,,,,LanceThunder,sighted accessibility enthusiast,,1520536149,t5_2qpec,t3_82zzdl,t3_82zzdl,3,1524955587,0,0,dve1yf7,Blind,,,blue1,,
17,"That's fair. It's not really about conservatism as aphilosphy, just the current crowd.",,,,Amonwilde,,,1521918680,t5_2qpec,t3_86h5nd,t1_dw6ilo5,3,1525552112,0,0,dw823ih,Blind,,,,,
18,"My father says until every car is electric/noiseless, they should have noisemakers of some kind because even if the electric car makes an audible sound, it will be completely masked by the sound of other non-electric vehicles. He has a small story, once while crossing a crossing without lights, there was a very quiet (hybrid?) vehicle just behind a large 4-wheel-drive, and he could not hear the sound of the hybrid car over the sound of the larger one; he nearly got hit because he couldn't hear it.

OP of that post said that the blind population can rely on buttons and lights to cross streets after previously highlighting how some crossings/intersections don't have buttons and lights. How are blind people supposed to cross those with silent cars streaming through?",,,,joininfluck,Parents,,1522182611,t5_2qpec,t3_87dyxa,t3_87dyxa,2,1525655329,0,0,dwdsc0t,Blind,,,blue2,,
19,"CC is for deaph, DA is for the blind. Descriptive audio.

As for what I enjoy, I use Voice Over to read stories on stories.xnxx.com or literotica.

If there were a genre of audio porn, I don’t know it’s common name. May I propose CumCast or OTunes?",,,,BARDLover,LCA,,1519934361,t5_2qpec,t3_80yso1,t3_80yso1,1,1524712418,0,0,dv16l2h,Blind,,,blue1,"CC is for deaph, DA is for the blind. Descriptive audio.

As for what I enjoy, I use Voice Over to read stories on <URL> or literotica.

If there were a genre of audio porn, I don’t know it’s common name. May I propose CumCast or OTunes?","[{'start': 115, 'end': 120, 'entity_type': 'URL', 'text': '<URL>', 'operator': 'replace'}]"
20,What's the difference between rehabilitation vs habilitation O&amp;M?,,,,saizai,lightblind,,1521045265,t5_2qpec,t3_7wlnir,t1_du1jfoe,1,1525157962,0,0,dvoxbvi,Blind,,,blue1,,
21,Like Quagmire (family guy) after he found online porn ?,,,,Type_ya_name_here,,,1520829405,t5_2qpec,t3_83r1y8,t1_dvk75fi,3,1525068965,0,0,dvk7z99,Blind,,,,Like <PERSON> (family guy) after he found online porn ?,"[{'start': 5, 'end': 13, 'entity_type': 'PERSON', 'text': '<PERSON>', 'operator': 'replace'}]"
22,So it turns out BrailleBlaster cannot convert the MathType add-in in Word directly to Braille...when I convert it to .txt the equations are lost. I need to find a way to convert .docx with MathML (converted from Math Type in a word document) to .xml to .brf... Any suggestions?,,,,IllustriousBeginning,,,1522127487,t5_2qpec,t3_8740c8,t3_8740c8,1,1525632764,0,0,dwcl4vm,Blind,,,,So it turns out <PERSON> cannot convert the MathType add-in in Word directly to Braille...when I convert it to .txt the equations are lost. I need to find a way to convert .docx with MathML (converted from Math Type in a word document) to .xml to .brf... Any suggestions?,"[{'start': 16, 'end': 24, 'entity_type': 'PERSON', 'text': '<PERSON>', 'operator': 'replace'}]"
23,"I can't help with chairs sorry, but I'm curious, why don't beanbags last that long? My nan had beanbags for the kids in our playroom and they lasted for a year or more.",,,,bradley22,,,1521344893,t5_2qpec,t3_853caz,t3_853caz,1,1525287336,0,0,dvvmpgh,Blind,,,,,
24,"I am sighted and my wife is blind. She currently sees less than 2ft in one eye and just light dark in other, slowly loosing all sight. We have been married almost 7 years. I knew what I was getting into being the only sighted one. Luckily I don’t mind doing all the driving. Her blind friend from high school is also married to a sighted person so it is not that rare. ",,,,zkbthealien,,,1521804634,t5_2qpec,t3_86jhkw,t3_86jhkw,5,1525507992,0,0,dw5ktzs,Blind,,,,,
25,Im not blind but i can only assume this would make things a lot more dangerous,,,,I_Do_Not_Use_Reddit,,,1522154077,t5_2qpec,t3_87dyxa,t3_87dyxa,2,1525639739,0,0,dwcy6hw,Blind,,,,,
26,It's hard to imagine an optometrist that would tell you to wait and see. Sounds like he/she suggested that you see an opthamologist. They should be able to refer you. ,,,,brass444,,,1522355276,t5_2qpec,t3_86razr,t1_dw87n47,2,1525728867,0,0,dwht82s,Blind,,,,,
27,The difficulty that may be faced by persons using screen readers is not that they will be unable to read it but depending upon the screen reader and settings they may not know that the background colour has changed.  If the background is intended to provide context information (for example halloween colours of orange and black) it will still be readable but the context is lost.,,,,Warthil,,,1520544803,t5_2qpec,t3_82y8ky,t3_82y8ky,2,1524960453,0,0,dvebl2d,Blind,,,,,
28,Thank you so much for all the great info and links! Its just been so hard. I never realized how much was available. Awesome. I am going to look into the adjusting for vision loss course for me! Maybe it will help me help him.,,,,majorthomasina,,,1521863493,t5_2qpec,t3_86ge3l,t1_dw5j6v5,1,1525535370,0,0,dw74pg6,Blind,,,,,
29,"Wait, like, riding the metro? Sorry, that mental image is just hilarious.

Like, how do they think you picked the train, or got into the metro station, but got lost on the line or something?

Did you just like, completely cease to know how to walk while sitting?

Some people are so silly.",,,,AllHarlowsEve,Low Partial since 2013 from brain farts,,1520485481,t5_2qpec,t3_82ug9d,t1_dvd0hrv,3,1524936449,0,0,dvd1dl7,Blind,,,blue1,,
