,body,score_hidden,archived,name,author,author_flair_text,downs,created_utc,subreddit_id,link_id,parent_id,score,retrieved_on,controversiality,gilded,id,subreddit,ups,distinguished,author_flair_css_class,anonymized_body,anonymized_masks
206,"BTW, this isn't the same as clinical depression. She's _grieving_, which is completely natural given the situation.

Counseling might help, but this situation is not what antidepressant medications are for. If she has preexisting depression, or her psychologist recommends otherwise, that's another matter - but I think that you pushing her to get meds for her grief is not a good idea, and implicitly devalues the legitimacy of her loss.

Good things you could help her get: counseling / therapy; rehabilitation / O&amp;M training; follow-up medical diagnosis / treatment; contact with friends / enjoyable activities; skills / tools to cope with being blind.",,,,saizai,lightblind,,1521158891,t5_2qpec,t3_84m7k1,t1_dvroryr,3,1525212836,0,0,dvrpmkt,Blind,,,blue1,,
207,"Not really. Apple has talked a lot about making programming on OS X accessible.  However, they have yet to make the changes required to allow blind people to lay out a user interface by ourselves. They also don't provide any tools to make debugging, syntax checking, or any of the other day to day programming tasks easy or efficient.  You can do it, but it's far from ideal, and I suspect a starting programmer will just be lost and confused.  ",,,,fastfinge,born blind,,1520967308,t5_2qpec,t3_82oegj,t1_dvkznco,1,1525124825,0,0,dvn68xr,Blind,,,blue1,,
208,"I know at least one blind guy who is using it regularly. Cool guy.
[Learn About 508 Compliance from a Blind Salesforce Developer](http://galvintech.com/learn-508-compliance-blind-salesforce-developer/)
",,,,jage9,,,1522125084,t5_2qpec,t3_869mwn,t3_869mwn,3,1525631940,0,0,dwcjkrp,Blind,,,,"I know at least one blind guy who is using it regularly. Cool guy.
[Learn About 508 Compliance from a Blind Salesforce Developer](<URL>)
","[{'start': 130, 'end': 135, 'entity_type': 'URL', 'text': '<URL>', 'operator': 'replace'}]"
209,So you can hear where you and the enemy are?,,,,BARDLover,LCA,,1520345564,t5_2qpec,t3_827a4n,t1_dv8z5hj,1,1524872922,0,0,dv9l1it,Blind,,,blue1,,
210,"Apple watch as well, bit more than $11 though ",,,,Silverottawa,AMD,,1521639314,t5_2qpec,t3_83f2wf,t3_83f2wf,1,1525426752,0,0,dw1pvnp,Blind,,,blue1,,
211,"Hahaha! That’s a good excuse for producing braille. Hahaha! That’s really interesting.

You’d be best if you learn first. Screen reading is pretty good and possible with long text.

Longer books can be more expensive, but if you do it through some sort of school, it’s free, at least it’s here.


It’s definitely possible.",,,,estj136,blind conservative go-getter,,1522331569,t5_2qpec,t3_85tuum,t1_dwgv5jl,1,1525714458,0,0,dwh2dyr,Blind,,,blue1,,
212,"It does exist. Nobody reads it. Largely because of the ""I'm on mobile"" reason you just gave for not knowing about it. 

A rule requiring people to do basic research seems pretty subjective.  I guess we mods could start removing surveys that ask obvious questions.  But that would quickly become the mods removing surveys we just don't find interesting. As a totally blind person, what's obvious to me may not be obvious to you.  And I have no idea what information is available to sighted people or where it is, because of course, I don't need it myself.  ",,,,fastfinge,born blind,,1521562951,t5_2qpec,t3_85ojma,t1_dvzpwmo,2,1525372285,0,0,dw00waa,Blind,,,blue1,,
213,Thanks for the recommendation. I'm not sure if I can customize the plug-in I use for that function. But I'll try to explore it. ,,,,Mesmer7,,,1520010003,t5_2qpec,t3_80yso1,t1_dv07xeu,1,1524740940,0,0,dv2u3xt,Blind,,,,,
214,"Yup! I do my banking myself using my online banking app, either on the phone, or on the web. It's accessible either way.  I also set up automatic payment of most bills, so I don't have to worry so much about reading my mail. And my bank emails me when I have a credit card payment due, so I don't forget about that either.",,,,fastfinge,born blind,,1520967531,t5_2qpec,t3_846fdj,t3_846fdj,2,1525124967,0,0,dvn6hus,Blind,,,blue1,,
215,"If anything, blind/blind is the exception. I'm low vision and my partner is 20/20.",,,,Amonwilde,,,1521825164,t5_2qpec,t3_86jhkw,t3_86jhkw,3,1525517315,0,0,dw64ays,Blind,,,,,
216,"You should share them. I'll accept they might not necessarily fit with the inspiration tag directly, but they still showcase things blind people like to do, as well as things blind people can do. We see plenty of questions from sighted and blind people about what blind people are interested in/do. That sort of content might also be inspirational for those people too, especially if they or someone they know is recently coming to terms with blindness.",,,,Terry_Pie,RP - Legally Blind,,1521156911,t5_2qpec,t3_84pxhn,t1_dvriij0,2,1525211738,0,0,dvrnrm1,Blind,,,blue1,,
217,Did you come up with that all by yourself?,,,,stop_being_ugly,,,1521826354,t5_2qpec,t3_86lut0,t3_86lut0,1,1525517963,0,0,dw65nm9,Blind,,,,,
218,"Don’t forget the knights irl. Uber drivers keep trying to buckle my seatbelt for me, people want to guide my instead of trusting me and my guide dog, people asking me if I’m lost while I’m sitting on the metro... it’s a long list",,,,awesomesaucesaywhat,,,1520484285,t5_2qpec,t3_82ug9d,t3_82ug9d,11,1524936001,0,0,dvd0hrv,Blind,,,,,
219,"I recorded all my lectures in university, with the best of intentions. Later in the week, I'd listen to them a second time, while transcribing them! It would be a good way to study, and to organize my recordings!  How many times do you think that ever happened?  Hint: if your guess is larger than ""zero"", you're wrong.

The problem with taking notes during the class itself is that keyboards are loud, and if you use speech, you need to have headphones on one ear, and that distracts you from actively listening to the lecture, or participating in the class.  Some universities offer paid note takers to help with this, but mine only offered them to students with physical challenges, not blind students.  

Transcription services are available today, but though I haven't used them much, I don't think they cut it.  What we need is something where we can search the auto generated text transcript, and then play the lecture audio starting from the word or phrase we found.  That way, a blind student while in the class, would only need to note down a list of unique sounding keywords. After class, the student could search for those keywords that seemed important, and make more complete notes from the recording. That would be much less work than having to listen to the entire lecture a second time, so it would be more reasonable to expect that students would actually do it. Also, if portions of the transcript were accurate enough, we could just copy those directly into our class notes.  ",,,,fastfinge,born blind,,1522239358,t5_2qpec,t3_87p24p,t3_87p24p,2,1525675932,0,0,dwexnxd,Blind,,,blue1,,
220,That is very unfortunate and very irresponsible on their part. Would you mind sharing the name of the bank or give me their site? I will contact them. ,,,,extrablankets,Web Accessibility Advocate,,1520980106,t5_2qpec,t3_846fdj,t1_dvnj3l1,1,1525132535,0,0,dvnjtda,Blind,,,blue2,,
221,I use salesforce as well at work but I haven’t used it with a screen reader yet. I am interested to hear how accessible it is as well as it is an essential tool for my job.,,,,KrolPolski,,,1521763463,t5_2qpec,t3_869mwn,t3_869mwn,2,1525487113,0,0,dw4u0ly,Blind,,,,,
222,"I took a look at the site and don't know what it's for. I hear turn on comment mode to collabirate with this prototype. I press enter on the on text, the comment section comes up and that's all I found. I'd highly recommend testing your website with NVDA. You can find out more here www.nvaccesss.org or if you have a mac, there's a screen reader built into it called Voiceover. If you can, coding the site by yourself would be a lot better than using a tool to do it for you. What is your site for? Is it for those of us who are blind, ( people who can see only light and shadows or nothing at all,) or visually impaired, (people who can see but not as well as someone who has full use of there vision?)",,,,bradley22,,,1521344678,t5_2qpec,t3_855yfh,t3_855yfh,6,1525287240,0,0,dvvmjpv,Blind,,,,"I took a look at the site and don't know what it's for. I hear turn on comment mode to collabirate with this prototype. I press enter on the on text, the comment section comes up and that's all I found. I'd highly recommend testing your website with NVDA. You can find out more here <URL> or if you have a mac, there's a screen reader built into it called Voiceover. If you can, coding the site by yourself would be a lot better than using a tool to do it for you. What is your site for? Is it for those of us who are blind, ( people who can see only light and shadows or nothing at all,) or visually impaired, (people who can see but not as well as someone who has full use of there vision?)","[{'start': 283, 'end': 288, 'entity_type': 'URL', 'text': '<URL>', 'operator': 'replace'}]"
223,"Is it required to be an U.S. resident to participate? Currently, i live in Mexico but i'd like to help, since i mostly use Microsoft stuff.

Thanks in advance for the answer.",,,,DiegoARL38,,,1521266522,t5_2qpec,t3_84vtg8,t3_84vtg8,3,1525258288,0,0,dvu4y9y,Blind,,,,"Is it required to be an <LOCATION> resident to participate? Currently, i live in <LOCATION> but i'd like to help, since i mostly use Microsoft stuff.

Thanks in advance for the answer.","[{'start': 81, 'end': 91, 'entity_type': 'LOCATION', 'text': '<LOCATION>', 'operator': 'replace'}, {'start': 24, 'end': 34, 'entity_type': 'LOCATION', 'text': '<LOCATION>', 'operator': 'replace'}]"
224,"Hey! I am totally blind here, feel free to message for contact. Definitely willing to commit to help. I do a lot of teaching in my daily life anyway. I have a fair warning though. I may or may not be the right candidate for you though. It depends what you are you looking for. I tend to be a go-getter, highly vocal, very assertive with it, really independent, usually have no trouble, probably if I need to use an ambulance I’d help you make me confortable, or be really understanding of operations so... I am not the average blindie. I get around 3 counties, have learnt to travel them. So, if I am too bright for you, too sighted like, too independent or vocal count me out, I take no offense. If I still qualify, count me in.",,,,estj136,blind conservative go-getter,,1520339747,t5_2qpec,t3_80ozbs,t3_80ozbs,2,1524870655,0,0,dv9gx5p,Blind,,,blue1,,
225,"I've not seen a Dr for anything relating to my eyes in 3-5 years (really can't remember), haha.. 

Maybe I will. But it'll have to wait til summer, cos organisating such things isn't my strong suit..",,,,haelaeif,,,1522319743,t5_2qpec,t3_85tuum,t1_dw01070,1,1525710024,0,0,dwgu2ij,Blind,,,,,
226,"That's great advice, thanks! You're totally right - you've really got to work hard and take the initiative, and not be afraid to ask for the help or alternatives you need!",,,,Snessrek,,,1520593377,t5_2qpec,t3_82lje7,t1_dvesams,1,1524978710,0,0,dvfbw43,Blind,,,,,
227,"I use websites more than apps so will look at the website! I've never heard of this service before, so will give it a look.",,,,rkingett,,,1522329199,t5_2qpec,t3_87l1d9,t3_87l1d9,1,1525713271,0,0,dwh06vw,Blind,,,,,
228,"Well this is a very interesting project, but I’d say that gps is GPS and can only be as accurate as it is. Nothing you can do. GPS is always said to be a few hundred feet off, which isn’t bad. That’s what I want down to the door sign. I can get to my destination about a few hundred or even a hundred feet away, but it still remains if I do not know the area the question, is where is the shop? This is a general problem with GPS. I tell people well I can’t see door signs. I generally just get help.",,,,estj136,blind conservative go-getter,,1522239412,t5_2qpec,t3_87j3x7,t3_87j3x7,2,1525675948,0,0,dwexp89,Blind,,,blue1,,
229,"I'm sure that plenty of us would be willing to critique things that are just plain not how blindness works.

Also, if you've watched Daredevil, the netflix series, their Matt Murdock is pretty great in the blindness portrayal.",,,,AllHarlowsEve,Low Partial since 2013 from brain farts,,1522510619,t5_2qpec,t3_88fkpg,t1_dwku8tx,1,1525788070,0,0,dwkzzhp,Blind,,,blue1,"I'm sure that plenty of us would be willing to critique things that are just plain not how blindness works.

Also, if you've watched <PERSON>, the netflix series, their <PERSON> is pretty great in the blindness portrayal.","[{'start': 169, 'end': 177, 'entity_type': 'PERSON', 'text': '<PERSON>', 'operator': 'replace'}, {'start': 133, 'end': 141, 'entity_type': 'PERSON', 'text': '<PERSON>', 'operator': 'replace'}]"
230,"No problem. I do extremely well, usually in school, unless I am really not good at the subject or something. I know to ask for help when necessary. I think over using the office is a bad idea. When you go in know what you need, they like that, a lot! Don’t go in and say I need help, some help. I don’t know what I need, though. They don’t know either! Hahahaha! They’ll try to help you, but it may not ultimately be the right kind of help. Use the right offices. For example, don’t ask the disability office, hey what should I major in? 

Also, make friends even with staff. You would amazed what that means? Say hi, be friendly. Even if you’re not as social as I am, I feel like most isn’t. On most personality typing test I test high on extroversion. Fine, you aren’t. You could try to be friendly, nice and considerate though. Make good connection. Follow direction, act trust worthy. Stuff I would also advice a sighted student right? Be friendly, with your disability office. When you need to speak up, do so, but be assertive rather than aggressive. Be nice and reasonable when talking to people. Have a voice but don’t insult, demean, or have an attitude. Speak your needs and not wants. Use a ignorant moment to educate and not be flipant. Too many blind people have an attitude when things don’t go the way it’s supposed to or how they want it. I would advice being patient and kind. Just explain it gently. Such as “you may have this notion of things. The situation is such, and this or that method, won’t work because”

I also spend time in the disability office because I go in there semi-often, and just talk to them. Make connection, forge good friendships. I know the entire office. I could virtually walk in there and everyone knows me, and usually very glad to see me. I mean people have their bad/busy day right? So I am accounting for that.

I find that feedback really helps. Try to enumerate for them kindly this is working and this is not working. This is why? If they do something that doesn’t work, I’ve seen some people that just gets mad, turns and be rude, ETC.... Not helpful nor is it kind, and it won’t win you any support.

Learn that you are capable, and you don’t need to be needy. It’s okay to get lost! Be careful, yes. But you don’t need to fear every minute you may get hurt if you get up and try a little or a lot. Adapt and be innovative. For example, I am a student journalist. I work events fine I just need to quickly learn the area or wonder around the area and work it. Then I find a way to get out. I’ve also worked the cafeteria and student lounges. I passed out nearly 200 papers if not that or more. Be ready to make a little of a fool of yourself and don’t be ashamed about it. I have covered the same table twice, just to hear, “yes, you’ve already talked to us, given us the paper.” If I hear it too much maybe moot point, but if I hear once, appologize or explain and move on.

I’ve also worked club fair and shouted for our club and waved a flyer, it was my idea actually. No one thought to do it that way! I also shouted at people, or called out to them when they passed. “Hey, excuse me, are you interested? We are the school newspaper. It’s an interesting program.” Will you make a fool of yourself sometimes, but learn it’s okay. You don’t go the way I do, but my point is try be adaptable, think of your own way. In fact don’t do it my way. 

Be ready to improve and take suggestions. Maybe the disability office think you should do it b way and you’ve always done c way. Try to be considerate, think if you can do it their way, within reason of course, if they don’t want to provide even basic services then no. If it’s reasonable services then maybe the indivudal needs to grow a little. Be flexible, work with the office. Take responsibility for your education. At university they do much less then grade school/secondary school. Be ready for this.",,,,estj136,blind conservative go-getter,,1520616434,t5_2qpec,t3_82lje7,t1_dvfbw43,2,1524987868,0,0,dvfusix,Blind,,,blue1,,
231,I think the problem is needing to hang on to something while having a place for the dog to sit or stand without getting in anyone's way.,,,,Amonwilde,,,1522425404,t5_2qpec,t3_8891r2,t1_dwizq4v,8,1525757123,0,0,dwja095,Blind,,,,,
232,"I don't think such people even have a thought process about ""how did this blindie manage to get here in the first place"". I've been in lots of situations where it would've been pretty impossible for me to be there without knowing what I was doing, and still got this.

Hell, I've gotten the ""walk up and grab my arm with no warning"" treatment at a _psychologist's_ office. And to add to it, the psych then treated my rebuke of the employee who grabbed me as an indication that there was something wrong with me.

One would think people there would know not to randomly assault patients, who might well have PTSD or a history of assault or any number of other issues. But … nope.",,,,saizai,lightblind,,1521055124,t5_2qpec,t3_82ug9d,t1_dvd1dl7,2,1525163342,0,0,dvp8kv4,Blind,,,blue1,,
233,"Wwow! Sounds very unfortunate. Is there a good reason she’s kept at home for virus season? It sounds very nonsensical really. What does she have with the noise? I find to be a poor excuse. If your sighted student doesn’t like noise they still have to go to the crowded area right? I think people are babying her too much. I see no reason for her isolation when she is in school. She is choosing such isolation. Maybe try to get her in to a language club or group or a robotic activity?

I think she is making excuses whilst at school, maybe learnt from her doctors or guardians and it shouldn’t be encouraged. I work well in crowds. A blind person can do that well.",,,,estj136,blind conservative go-getter,,1520558543,t5_2qpec,t3_832rs3,t3_832rs3,7,1524967387,0,0,dvep8tw,Blind,,,blue1,,
234,"This kind of thing has been done already, a lot. What would make your gloves different to the tech that's already out there? A lot of blind people use cains that they hold in their hands, so gloves might not be the best thing to wear. Here's an article about gloves for the blind. http://www.dailymail.co.uk/sciencetech/article-2951187/Soon-HANDS-Vibrating-glove-uses-ultrasound-help-blind-navigate-surroundings.html How much would these gloves cost? TThere's a product here in the UK that you hold and it does what you've described but it uses sound waves I think. Here's a product that does this http://www.sightandsound.co.uk/buzzclip.html",,,,bradley22,,,1521701315,t5_2qpec,t3_868hfx,t3_868hfx,1,1525458604,0,0,dw3dlr0,Blind,,,,"This kind of thing has been done already, a lot. What would make your gloves different to the tech that's already out there? A lot of blind people use cains that they hold in their hands, so gloves might not be the best thing to wear. Here's an article about gloves for the blind. <URL> How much would these gloves cost? TThere's a product here in the <LOCATION> that you hold and it does what you've described but it uses sound waves I think. Here's a product that does this <URL>","[{'start': 476, 'end': 481, 'entity_type': 'URL', 'text': '<URL>', 'operator': 'replace'}, {'start': 352, 'end': 362, 'entity_type': 'LOCATION', 'text': '<LOCATION>', 'operator': 'replace'}, {'start': 281, 'end': 286, 'entity_type': 'URL', 'text': '<URL>', 'operator': 'replace'}]"
235,I use it everyday and they just end up like a puddle on the floor. ,,,,CuteHalfling,,,1521367530,t5_2qpec,t3_853caz,t1_dvvmpgh,1,1525294181,0,0,dvvxgzx,Blind,,,,,
236,They’re nifty. Unfortunately don’t think they’ll work for me.i have nystagmus so I have to turn my head severely. (That’s just one of my conditions),,,,CuteHalfling,,,1521367667,t5_2qpec,t3_853caz,t1_dvvqyl9,1,1525294212,0,0,dvvxine,Blind,,,,,
237,"Wow, I am really surprised how this community helped me. Really cool! 
Thank you, man, for your comment and really nice explanations about a situation. So yeah we will focus primarily on inside usage.
Have a great day!",,,,Deklevad1234,,,1522045634,t5_2qpec,t3_86rmpf,t1_dwafu1x,2,1525598777,0,0,dwap75u,Blind,,,,,
238,"Hey this is kind of unrelated to OP's post, but in your opinion, what are the benefits of Zoomtext vs MAGic? Also, I'm a low vision JAWS user, so with the updates to JAWS to work better with zoomtext, whats the difference between Zoomtext fusion and Zoomtext reader?",,,,Badassmotherfuckerer,,,1522315681,t5_2qpec,t3_86769d,t1_dw2veqo,1,1525709083,0,0,dwgsa3g,Blind,,,,"Hey this is kind of unrelated to OP's post, but in your opinion, what are the benefits of <PERSON> vs MAGic? Also, I'm a low vision JAWS user, so with the updates to JAWS to work better with zoomtext, whats the difference between Zoomtext fusion and <PERSON> reader?","[{'start': 250, 'end': 258, 'entity_type': 'PERSON', 'text': '<PERSON>', 'operator': 'replace'}, {'start': 90, 'end': 98, 'entity_type': 'PERSON', 'text': '<PERSON>', 'operator': 'replace'}]"
239,"Even something as complex as Pokemon could be made easily playable if you ask me.

At least from a game play mechanics point of view. Some things would be hard to make accessable, such as puzzles, but the basic story, exploration, and battles should be easy to translate over.",,,,BARDLover,LCA,,1520262235,t5_2qpec,t3_825akz,t1_dv7pytt,2,1524835723,0,0,dv7q0ug,Blind,,,blue1,,
240,"Well, I'm not in university anymore. So it's a bit late for me. :-) But when I was, I recorded on a smartphone, that I would leave at the front of the class, so it would pick up the lecture clearly.  So the challenge with this approach is going to be: I could be ten rows back. Yes, I do have a laptop. But how can it trigger/sync up with my smartphone, recording at the front of the class, whenever I note down an important keyword? There might be clever...bluetooth? tricks to make this happen. Or maybe just relying on the clocks on my laptop and phone being exactly in sync? This requires some thought. I didn't record on my laptop, because the sound of typing, the sounds of other students, etc, would sometimes make the recording hard to listen to.  Most profs I had would let me put my recorder on a desk or table at the front near them.  ",,,,fastfinge,born blind,,1522325521,t5_2qpec,t3_87p24p,t1_dwgcyzl,2,1525711752,0,0,dwgxcp6,Blind,,,blue1,,
241,"True, true. I remember there was a blind woman who won master chef a while back.

I used to say, given the choice I'd choose blindness over hearing loss, because I love music too much. So, At least I'm not deaf?

True, I guess it is just about adapting. Light perception sounds really interesting. I'm really curious about that, can you see slight differences if there is a colored light vs white? 

Thanks for your comment, it's nice to know that even with vision loss/problems you can still pursue your goals.
",,,,lindsaymad2000,,,1521923950,t5_2qpec,t3_86razr,t1_dw7k19r,1,1525554394,0,0,dw86mmc,Blind,,,,,
242,"Had one idling silently next to me, genuinely thought their car just shut off on them until they took off.

Even if it just played, like, the wheels on the bus, that'd be better than silence until you hear gravel crunch under its tires.",,,,AllHarlowsEve,Low Partial since 2013 from brain farts,,1522281041,t5_2qpec,t3_87pa0h,t3_87pa0h,1,1525696756,0,0,dwg4l1g,Blind,,,blue1,,
