,body,score_hidden,archived,name,author,author_flair_text,downs,created_utc,subreddit_id,link_id,parent_id,score,retrieved_on,controversiality,gilded,id,subreddit,ups,distinguished,author_flair_css_class,anonymized_body,anonymized_masks
391,"Barclays in the UK are very good at accessibility for VI people.

All users can log-on using a hand-held device called a PIN-Sentry, a small device with a keyboard, single line alphanumeric display and a slot for you chip+PIN bank card. For VI users they have a special version of this that is bigger, tactile and talks.
https://www.barclays.co.uk/ways-to-bank/online-banking/pinsentry-audio-accessible-card-reader/

Barclays can also supply personalised debit cards in a choice of colours with a big arrow pointing the end with the chip and an indent on the opposite end from the chip. In addition they can provide large print cheque books or templates to help you find where to write on standard size cheques.

They used to also offer a gauge for identifying bank notes but that is obsolete now that UK bank notes have tactile identification.

More information about what they do here:
https://www.barclays.co.uk/accessibility/sight/",,,,vwlsmssng,friend / family / other,,1520978536,t5_2qpec,t3_846fdj,t1_dvng2lk,2,1525131629,0,0,dvni5ym,Blind,,,blue2,"Barclays in the <LOCATION> are very good at accessibility for VI people.

All users can log-on using a hand-held device called a PIN-Sentry, a small device with a keyboard, single line alphanumeric display and a slot for you chip+PIN bank card. For VI users they have a special version of this that is bigger, tactile and talks.
<URL>

Barclays can also supply personalised debit cards in a choice of colours with a big arrow pointing the end with the chip and an indent on the opposite end from the chip. In addition they can provide large print cheque books or templates to help you find where to write on standard size cheques.

They used to also offer a gauge for identifying bank notes but that is obsolete now that <LOCATION> bank notes have tactile identification.

More information about what they do here:
<URL>","[{'start': 815, 'end': 820, 'entity_type': 'URL', 'text': '<URL>', 'operator': 'replace'}, {'start': 721, 'end': 731, 'entity_type': 'LOCATION', 'text': '<LOCATION>', 'operator': 'replace'}, {'start': 329, 'end': 334, 'entity_type': 'URL', 'text': '<URL>', 'operator': 'replace'}, {'start': 16, 'end': 26, 'entity_type': 'LOCATION', 'text': '<LOCATION>', 'operator': 'replace'}]"
392,I haven't used it as a screen reader user but when I could see years ago I used it with my remaining vision. I honestly have no idea. I wish I knew. I heard they did a Microsoft and suddenly started taking accessibility seriously but I have not seen it first hand.,,,,rkingett,,,1521775797,t5_2qpec,t3_869mwn,t3_869mwn,2,1525492914,0,0,dw55w6v,Blind,,,,,
393,I'm honestly not sure if that would work. I think some kind of beta testing would be great for the kind of feedback you would like. I don't think I'd focus on it as I have a lot of things in my pockets so might find it hard to feel the phone vibrate.,,,,bradley22,,,1520336285,t5_2qpec,t3_80t609,t1_dv9c00o,2,1524869659,0,0,dv9f43q,Blind,,,,,
394,"You know, I think I took a survey on whether or not I'd use that, courtesy the [CNIB](http://www.cnib.ca). I also think I gave it a pass, given it doesn't do anything existing apps/services don't already do for less than what they're charging, and they don't mention if you or they are paying for access to the AT&amp;T mifi service. Not that that particular detail would impact me (I'm well outside AT&amp;T's coverage area), but were I a potential customer I'd be asking questions, and that'd be my first one.",,,,quanin,Glaucoma,,1521616494,t5_2qpec,t3_8602qj,t3_8602qj,5,1525421099,0,0,dw1e7vu,Blind,,,blue1,"You know, I think I took a survey on whether or not I'd use that, courtesy the [CNIB](<URL>). I also think I gave it a pass, given it doesn't do anything existing apps/services don't already do for less than what they're charging, and they don't mention if you or they are paying for access to the AT&amp;T mifi service. Not that that particular detail would impact me (I'm well outside AT&amp;T's coverage area), but were I a potential customer I'd be asking questions, and that'd be my first one.","[{'start': 86, 'end': 91, 'entity_type': 'URL', 'text': '<URL>', 'operator': 'replace'}]"
395,"Okay I see. Thank you, man, for pointing that out. As I said we currently don't have any particular idea of how the cain would look or work. We don't even know if there will be any electronic parts. But this compass idea seems really cool and it could work. We will take that into consideration. Thank you, sir!",,,,Deklevad1234,,,1521891811,t5_2qpec,t3_86rmpf,t1_dw7h8nr,1,1525541712,0,0,dw7hh88,Blind,,,,,
396,My ignorance shows lol. That is what I mean! Thank you very much ,,,,Itsmepeaches,,,1520527225,t5_2qpec,t3_82y8ky,t1_dvdoyeb,1,1524950225,0,0,dvdrr1a,Blind,,,,,
397,To be perfectly honest Mac users are good too. Anyone who has more experience with me is beneficial. ,,,,senior_thesis_,sighted / accessibility researcher,,1520350660,t5_2qpec,t3_82ckl9,t1_dv9flvo,1,1524875555,0,0,dv9pt5w,Blind,,,blue2,,
398,Okay thank you I want to learn C. I also found Quorum  an accessible programing language but I don't know if it is good.,,,,LUCKYNOLUCK,,,1520441188,t5_2qpec,t3_82oegj,t1_dvbjeiv,1,1524914194,0,0,dvbt7a8,Blind,,,,,
399,"THis is no way immediate help but I read an excellent book about someone who transitioned from sight to blind due to a traumatic event. It's called Beyond the Bear: How I Learned To Live And Love Again After Being Blinded By A Bear



https://www.amazon.com/Beyond-Bear-Learned-Again-Blinded/dp/0762784555



https://www.huffingtonpost.com/dan-bigley/blinded-by-a-bear-how-my-_b_3202338.html


I found this book to be so inspiring and honest. I still think about it when I'm having a tough day and think ""man, if Dan can come through like that I shouldn't be complaining too much."" It's a those books that inspired me to write a letter to the publisher to pass on. I had never done that but I wanted to thank him for sharing his story.


I am sighted btw.",,,,_WeAreTheLuckyOnes_,,,1521138845,t5_2qpec,t3_84m7k1,t3_84m7k1,2,1525199337,0,0,dvr4r3r,Blind,,,,"THis is no way immediate help but I read an excellent book about someone who transitioned from sight to blind due to a traumatic event. It's called Beyond the Bear: How I Learned To Live And Love Again After Being Blinded By A Bear



<URL>



<URL>


I found this book to be so inspiring and honest. I still think about it when I'm having a tough day and think ""man, if <PERSON> can come through like that I shouldn't be complaining too much."" It's a those books that inspired me to write a letter to the publisher to pass on. I had never done that but I wanted to thank him for sharing his story.


I am sighted btw.","[{'start': 371, 'end': 379, 'entity_type': 'PERSON', 'text': '<PERSON>', 'operator': 'replace'}, {'start': 244, 'end': 249, 'entity_type': 'URL', 'text': '<URL>', 'operator': 'replace'}, {'start': 235, 'end': 240, 'entity_type': 'URL', 'text': '<URL>', 'operator': 'replace'}]"
400,"security annoys me sometimes when I come across it but apart from that, yeah, they're doing very well.",,,,bradley22,,,1520976856,t5_2qpec,t3_846fdj,t1_dvng2lk,2,1525130601,0,0,dvng9mo,Blind,,,,,
401,"blind.help seems like a fine name, except that I think people might not realize it's a real URL. ;)

I don't think it's worth being overly reticent with stuff like ""VI"" etc. Blind isn't a dirty word.

Functionally speaking, when we're talking about how to help a stranger of unknown visual ability on the spot, I think we should give advice/instructions on the assumption that they are 100% blind. That won't result in a _bad_ interaction for anyone, in terms of what help is offered / useful / interpretable, and avoids the intrusiveness of people asking exactly how well you can see etc.

If you want to override that in a particular situation, and disclose that you can see X or know where the Y is, that's your call - but the default scenario should be assuming nothing about someone's sight or knowledge of the local area.",,,,saizai,lightblind,,1521151566,t5_2qpec,t3_84grci,t1_dvqmptr,1,1525208466,0,0,dvrilre,Blind,,,blue1,,
402,"Hopefully not. The only things conservative governments mean for the blind are unemployment, homelessness, poverty, and eventually death. There has never been any positive outcome for the blind from any conservative government in history. ",,,,fastfinge,born blind,,1521770746,t5_2qpec,t3_86h5nd,t3_86h5nd,23,1525490682,0,0,dw519wr,Blind,,,blue1,,
403,"There could be a market, but you also have to consider what other products are already on the market. Also what products have been produced but failed. 

Right now, I see two major issues that come up fairly often that neither technology or training has solved well. 

The first is crowded locations, such as a crowded subway station during rush hour, or a concert hall. Too many people, not enough people paying attention, and not enough room to use the cane well. Any kind of distance sensing technology (laser, sonar) doesn't help because there is just so much stuff in the way.

The second one is multiple conditions at once. Vision loss is significantly more common in elderly people, but so are many other health conditions. Deafblindness, or balance issues. One common issue that keeps cropping up is someone who uses a walker (due to bad balance) and a white cane. So someone needs two hands to hold the walker... which leaves no available hand to hold a white cane. Dementia is also an issue, where clients forget things. There are some devices that help (for example, this is quite helpful  https://seniorcareshop.com/products/personal-reminder-board ), but that doesn't help when someone can't see the board. And if you have something that CONSTANTLY reminds someone, that just becomes annoying. So you need a product that a person can use without learning new skills, but not overwhelm them with information they can't process at the same time. 

",,,,KillerLag,"Sighted, O&amp;M Instructor",,1520824892,t5_2qpec,t3_83po30,t1_dvk1dyq,1,1525067360,0,0,dvk4miv,Blind,,,blue2,"There could be a market, but you also have to consider what other products are already on the market. Also what products have been produced but failed. 

Right now, I see two major issues that come up fairly often that neither technology or training has solved well. 

The first is crowded locations, such as a crowded subway station during rush hour, or a concert hall. Too many people, not enough people paying attention, and not enough room to use the cane well. Any kind of distance sensing technology (laser, sonar) doesn't help because there is just so much stuff in the way.

The second one is multiple conditions at once. Vision loss is significantly more common in elderly people, but so are many other health conditions. <PERSON>, or balance issues. One common issue that keeps cropping up is someone who uses a walker (due to bad balance) and a white cane. So someone needs two hands to hold the walker... which leaves no available hand to hold a white cane. Dementia is also an issue, where clients forget things. There are some devices that help (for example, this is quite helpful  <URL> ), but that doesn't help when someone can't see the board. And if you have something that CONSTANTLY reminds someone, that just becomes annoying. So you need a product that a person can use without learning new skills, but not overwhelm them with information they can't process at the same time. 

","[{'start': 1096, 'end': 1101, 'entity_type': 'URL', 'text': '<URL>', 'operator': 'replace'}, {'start': 731, 'end': 739, 'entity_type': 'PERSON', 'text': '<PERSON>', 'operator': 'replace'}]"
404,"Most devices that use sonar sensors have been either glasses, or the device it attached to the cane. Although there is one that can clip onto clothing, too.

While gloves should be an good placement point (you can point your hand at things to check distance and it can be more intuitive), your hands may not be free. If it was glasses mounted, it is easier to look at the object. ",,,,KillerLag,"Sighted, O&amp;M Instructor",,1521690568,t5_2qpec,t3_868hfx,t3_868hfx,1,1525454946,0,0,dw374fi,Blind,,,blue2,,
405,"Thanks a lot for your input. I would never have thought about the screen-readers problems. I know accessibility was not perfect yet, but I didn't think it was still so bad. I will definitely note it. 

The robotic seeing eye dogs was obviously my first idea, and the most ""common one"" in the field. Some projects already exist for this, but there is obviously a lot of room for improvement. On this topic, I was also wondering the following: do you think it would be considered useful to have a guiding robots that would be able to ""explain"" to their user why they are stopping, where they are currently, what is happening around, etc. I would believe it might increase the users comfort and understanding of the surrounding environment, and maybe even his/her acceptance of the robot, but I am not sure if this is needed information or if the user can already infer it by him/herself using his/her other senses. ",,,,Korydween,,,1520585761,t5_2qpec,t3_82xemt,t1_dvdlunw,1,1524977190,0,0,dvf8tb0,Blind,,,,,
406,"Not a problem, not a problem at all! Yeah, i think it’s a common one, which is why I for now just ask for help hahaha!",,,,estj136,blind conservative go-getter,,1521901235,t5_2qpec,t3_86rmpf,t1_dw7lrvd,1,1525544505,0,0,dw7n0ck,Blind,,,blue1,,
407,"Hhaha! Join the blind club, relax, and get use to it.

Blind people can do just about anything? I don’t see why not for culinary school, there are some great blind cooks out there. If someone can be a blind journalist out there cook isn’t off the table. I served as a blind journalist and had a great deal of mobility!. I can cook if I tried and put some of effort in to it. I have no desire, however. Hahahaha! Get use to being blind, cracking those blind jokes and get over yourself a bit

I don’t necessarily think it’s darkness just seeing nothing. A lot of us have light perception. So, it’s not quite blackness and I have phantom lights some times so that may help you. I guess as a blind person you get use to seeing nothing and stop worrying about darkness or light.",,,,estj136,blind conservative go-getter,,1521896787,t5_2qpec,t3_86razr,t3_86razr,1,1525543005,1,0,dw7k19r,Blind,,,blue1,,
408,"The reality is that not everyone has equivalent skill when handling a service animal...or any animal. I'm not experienced in this area, but chances are the dog should be retrained if it's younger or retired if it's older. This should probably have happened much earlier and now may be too late. It's too bad, though, because when service dogs behave badly in public, it hurts public confidence in guide dog programs and in blind people in general.

If the blind individual doesn't see it as a problem, not much is going to happen. Try to have a conversation about it in a nonconfrotational way. THere's not much else you can do.",,,,Amonwilde,,,1522338425,t5_2qpec,t3_881tfi,t3_881tfi,8,1525718413,0,0,dwh9tss,Blind,,,,,
409,"This.  And TBH, I'm more selective about what I read.  I can read just about anything with enough light and magnification, but it is taxing on my eyes.",,,,B-dub31,,,1521570699,t5_2qpec,t3_85tuum,t1_dw09edg,3,1525377528,0,0,dw09nw1,Blind,,,,,
410,"Just to play the devils advocate- perhaps the other passengers had their own invisible disabilities? Granted, the shouldve acknowledged the dude to at least say ""hey sorry but the seats are full,"" but still, we don't know what those passengers mightve been dealing with",,,,blindjo,,,1522423266,t5_2qpec,t3_8891r2,t3_8891r2,5,1525756017,0,0,dwj7rhf,Blind,,,,,
411,"Could you be more specific about how cane is helpful to you? In what kind of scenario is useful and in what kind of scenario is not? 
Have you ever thought about some other features that a cane can provide? 
For example, what if a cane that can lead you? Or a cane that can talk to you? or a cane that can replace the phone? or a cane that can work as a recorder?  ",,,,HCIdGRAD,,,1521495756,t5_2qpec,t3_830lqb,t1_dveam98,1,1525345614,0,0,dvynqcq,Blind,,,,,
412,"For what it's worth, I feel you. If it was anything else, I would just sympathize. But people already think we can't do stuff, you know?

Anyway, no hate here, just love. You'll probably swing back the other way before too long. You're clearly a smart person who has done cool stuff in the past.",,,,Amonwilde,,,1521236227,t5_2qpec,t3_84v8hp,t1_dvtfc2r,4,1525246566,0,0,dvtgno8,Blind,,,,,
413,"Oh boy! Well, definitely check out the subreddit r/learnprogramming it is a veritable wealth of information and resources. It also depends what language you want to learn and they have many topics on that!",,,,igloolafayette,,,1520431489,t5_2qpec,t3_82oegj,t3_82oegj,2,1524909424,0,0,dvbjeiv,Blind,,,,,
414,"I am a totally blind guy, who has been married to my sighted wife, since September 1999. We have two sighted kids. I can name at least a half dozen couples, off the top of my head, who are in similar circumstances to my own. I also know plenty of folks who are blind, and are married to blind people as well. I even know  a blind dude who is  married to a lady in a wheelchair.Ultimately, disability has no bearing on relationship, if a couple is a good match, it doesn’t matter. Every couple has strengths and weaknesses, even if both members of the couple are entirely able-bodied.",,,,GoneVision,blinded by the light… revved up like a deuce,,1522191733,t5_2qpec,t3_86jhkw,t3_86jhkw,2,1525660229,0,0,dwe1sf2,Blind,,,blue1,,
415,"I feel like a lot of sighted designers are focused on helping people with severe visual impairments navigate, but from what I've researched, visually impaired users are more interested in better interfaces with existing resources and technologies. How do you think this relates to technologies like Aira?",,,,Able_Me,Sighted Engineer,,1521933116,t5_2qpec,t3_8602qj,t1_dw1elsz,1,1525558345,0,0,dw8eg2h,Blind,,,blue2,"I feel like a lot of sighted designers are focused on helping people with severe visual impairments navigate, but from what I've researched, visually impaired users are more interested in better interfaces with existing resources and technologies. How do you think this relates to technologies like <PERSON>?","[{'start': 299, 'end': 307, 'entity_type': 'PERSON', 'text': '<PERSON>', 'operator': 'replace'}]"
416,"My husband is blind and travels all the time by himself -- two to three weeks/month. He knows his way around our airport and requests ""transfer assistance"" to change gates as needed. He just goes to the front desk at the airport and asks for someone to walk with him to the gate, room, etc. Ditto the other comments below. He pre- boards and just asks the flight attendant to lead him to his seat ... If they are behind him for some reason they want to put their hands on him, which make him crazy ha ha. He doesn't like to wait to get off last, so he just gets up and follows the flow off the plane.

Get the app SeeingAI ... it's new and free from Microsoft. It can read hotel rooms, describe scenes, handwriting, boarding passes etc.

His travel doesn't usually take him abroad but we took a river cruise for the first time (we are still figuring out best/accessible vacations) in Europe last year.  It was fun and the people were great. No, he wasn't expected to stay in his room. We requested a room kind of close to the main desk so he wouldn't have far to go if I wasn't with him. 
There were lectures, music, cocktail hours etc. We enjoyed sitting on the top of the boat too. I'm not sure if this is the type of ship you are taking. Definitely go! We met people from all over the world. 

The only issue we had were the lack of ... or narrow sidewalks and uneven cobblestones in a few towns but overall Europe is much more pedestrian friendly. Some employees wanted to assist him getting on and off the boat, but he doesn't like people grabbing him.  Hope this helps :)",,,,brass444,,,1519863916,t5_2qpec,t3_80djky,t3_80djky,1,1524684655,0,0,duznpes,Blind,,,,"My husband is blind and travels all the time by himself -- two to three weeks/month. He knows his way around our airport and requests ""transfer assistance"" to change gates as needed. He just goes to the front desk at the airport and asks for someone to walk with him to the gate, room, etc. Ditto the other comments below. He pre- boards and just asks the flight attendant to lead him to his seat ... If they are behind him for some reason they want to put their hands on him, which make him crazy ha ha. He doesn't like to wait to get off last, so he just gets up and follows the flow off the plane.

Get the app SeeingAI ... it's new and free from Microsoft. It can read hotel rooms, describe scenes, handwriting, boarding passes etc.

His travel doesn't usually take him abroad but we took a river cruise for the first time (we are still figuring out best/accessible vacations) in <LOCATION> last year.  It was fun and the people were great. No, he wasn't expected to stay in his room. We requested a room kind of close to the main desk so he wouldn't have far to go if I wasn't with him. 
There were lectures, music, cocktail hours etc. We enjoyed sitting on the top of the boat too. I'm not sure if this is the type of ship you are taking. Definitely go! We met people from all over the world. 

The only issue we had were the lack of ... or narrow sidewalks and uneven cobblestones in a few towns but overall <LOCATION> is much more pedestrian friendly. Some employees wanted to assist him getting on and off the boat, but he doesn't like people grabbing him.  Hope this helps :)","[{'start': 1415, 'end': 1425, 'entity_type': 'LOCATION', 'text': '<LOCATION>', 'operator': 'replace'}, {'start': 884, 'end': 894, 'entity_type': 'LOCATION', 'text': '<LOCATION>', 'operator': 'replace'}]"
417,"Ok,pretty standard. Sometimes when I'm going over a lot a rough terrain my hand cramps up, but in your case I'm sure it's just you getting used to it. I wish you the best of luck!",,,,lHawkeye16l,,,1520816622,t5_2qpec,t3_83r1y8,t1_dvjxbh9,1,1525063928,0,0,dvjxitl,Blind,,,,,
418,"The majority of blind people have had vision or still have some vision, and even those born totally blind typically know that certain colors represent certain things.

I like the idea of doing it as prose, but I'm a reader/writer. Others might prefer a shorter description.",,,,AllHarlowsEve,Low Partial since 2013 from brain farts,,1520472777,t5_2qpec,t3_82stbg,t3_82stbg,3,1524930783,0,0,dvcq9gx,Blind,,,blue1,,
419,"I say you just need to stay on top of it. Anyone can be disorganized or organized. My aunt was sighted fully, and she had a riddiculously disorganized room. I am blind and I organize better than that, maybe excessively organized. If you have something, put it away. I tend to use a organization where I put a purpose to a shelf or a drawer. This one is for headphones. these two shelves in the cabinet is devoted to computer accessory and wiring. This one to software. That drawer is for accessibility tools. That other drawer is for microphones and studio equipment. ETC... I think you get the idea. Be consistent with it. Be disciplined about it. I say these are generally good ideas for sighted people as well.",,,,estj136,blind conservative go-getter,,1521507415,t5_2qpec,t3_85o3ik,t3_85o3ik,2,1525351435,0,0,dvyz1uh,Blind,,,blue1,,
420,"Hi there!
I am a Teacher for the Visually Impaired (in California) but might be able to help with some first steps if you need! I provide services to students just like yourself and it would be very important to get started with stuff asap...at least before you graduate. Feel free to message me anytime. I know it must be scary but there are definitely some things that can be done to make the whole process and school a little easier. 

Edit: You can ABSOLUTELY go to culinary school still. You just might need additional support but totally doable!",,,,mallorypallory,,,1521945344,t5_2qpec,t3_86razr,t3_86razr,3,1525563520,0,0,dw8ou4d,Blind,,,,"Hi there!
I am a Teacher for the Visually Impaired (in <LOCATION>) but might be able to help with some first steps if you need! I provide services to students just like yourself and it would be very important to get started with stuff <URL> least before you graduate. Feel free to message me anytime. I know it must be scary but there are definitely some things that can be done to make the whole process and school a little easier. 

Edit: You can ABSOLUTELY go to culinary school still. You just might need additional support but totally doable!","[{'start': 235, 'end': 240, 'entity_type': 'URL', 'text': '<URL>', 'operator': 'replace'}, {'start': 55, 'end': 65, 'entity_type': 'LOCATION', 'text': '<LOCATION>', 'operator': 'replace'}]"
