,body,score_hidden,archived,name,author,author_flair_text,downs,created_utc,subreddit_id,link_id,parent_id,score,retrieved_on,controversiality,gilded,id,subreddit,ups,distinguished,author_flair_css_class,anonymized_body,anonymized_masks
94,"I have learned that the phrase “legally blind” will get doors slammed in my face; I have had interviewers turn away from me and start looking out windows while tapping their pens on their knees and notebooks; I have had interviewers slouch in their seats, resting their heads on the backs of their chairs like they were going to take a nap on me; I have had interviewers tell me they could put me to work right away, go as far as show me the workstation I would be using then a day or two later inform me that the company is going to continue looking.  I have had interviewers start talking to me as if I were six years old again or start talking to others in the interview as if I wasn’t there.  I had one company tell me the job had been filled that very morning, pull the job off their website and re-post it a week later with a “REQUIREMENT” of a valid drivers license even though the description stated zero percent travel.  

I truly believe that the average person doesn’t understand the difference between “legally blind” and “totally blind”.  My empirical evidence indicates that most people sub-consciously make a connection that if your eyes don’t work and since your eyes are in your head then there must be something wrong with the rest of your head.  

I no longer use the phrase “legally blind” when my vision comes up in an interview, instead I use the phrase “very near sighted” which seems to be more acceptable to people, it is something they can relate to I guess.  Using “very near sighted” is a way to open the topic for conversation and allow me the opportunity to quantify my vision, offer examples of how my vision is an asset to me in my job as well as, hopefully, an opportunity for me to dispel some false assumptions the average person may have about people with visual impairments.  

A potential employer needs to know and not making them aware of my vision during the interview would, I think, come across as being deceptive.  One of the best opening I get is when I am asked what my strengths are to which I reply that being very near sighted from birth has given me a lifetime of experience in problem solving and that I have honed that skill to a razors edge.  More often than not I am asked to elaborate on the “skill” of problem solving before I am asked about the “tool” of being very near sighted    

Sorry about the novelette folks.
",False,False,t1_cqq76ba,clark3141,,0,1430141318,t5_2qpec,t3_337qc0,t3_337qc0,2,1432629893,0,0,cqq76ba,Blind,2,,,,
95,Thanks :) Just living life like it should be lived.,False,False,t1_cqkz4km,johnnytai,,0,1429721731,t5_2qpec,t3_33a8wz,t1_cqk0ufp,2,1432539686,0,0,cqkz4km,Blind,2,,,,
96,"I'm not blind but my boyfriend has RP and is very limited visually (pinhole vision that's only useful in VERY well lit rooms).

He had an interview today, actually. I encouraged him to bring up his restrictions prior to the interview so they're not shocked. He knew there was going to be a written test on paper so beforehand he emailed the recruiter and explained that he had limited vision so the test would need to be on either a computer with high contrast or someone would need to read it to him. The guy emailed back and was very nice, and at the interview today my boyfriend didn't end up having to take the test because they couldn't have it reprinted or get authorization from the company they buy it from to have someone read it to him.

So I'd just recommend letting the recruiter know when you're calling/emailing to talk about details, and they will inform anyone else who needs to know.",False,False,t1_cqiwfmc,homeschooled,sighted significant other,0,1429563468,t5_2qpec,t3_337qc0,t3_337qc0,3,1432503905,0,0,cqiwfmc,Blind,3,,,,
97,"Actually, there are several developers who sell through steam, like Choice Of Games, who's games are otherwise perfectly accessible.  Also, the developers of Skullgirls (and Shank apparently) have added accessibility features to their games.  Unfortunately, it doesn't really do any good, as it's almost impossible to purchase or update the games without sighted help.  I think that's what prompted the petition in the first place; there are lots of game developers who are quite willing to help us out.  But requiring that they abandon steam to become accessible on PC seems unreasonable.  ",False,False,t1_cqahjf8,fastfinge,,0,1428896730,t5_2qpec,t3_32bryx,t1_cqahdan,1,1432358436,0,0,cqahjf8,Blind,1,,,,
98,"What  OS are you on? On Windows, NVDA (http://www.nvda-project.org) does what you want, and is free. On OS X and IOS, Voiceover is built-in to the OS and does these things.",False,False,t1_cqed14b,fastfinge,,0,1429196070,t5_2qpec,t3_32rel0,t3_32rel0,2,1432425504,0,0,cqed14b,Blind,2,,,"What  OS are you on? On Windows, NVDA (<URL>) does what you want, and is free. On OS X and IOS, Voiceover is built-in to the OS and does these things.","[{'start': 39, 'end': 44, 'entity_type': 'URL', 'text': '<URL>', 'operator': 'replace'}]"
99,"Thanks for the tip on NVDA! I'm really very concerned with how expensive JAWS is, I'll give your recommendation a go.",False,False,t1_cqjxnj4,Felinomancy,,0,1429642985,t5_2qpec,t3_33cpfo,t1_cqjwa0q,1,1432521736,0,0,cqjxnj4,Blind,1,,,,
100,"Edit: The average human speaks at 150 words per minute, not 50 words per minute. I knew this, but my finger just didn't wanna hit that ""1"" key, apparently.

Personally, no.  I have my TTS set to well over 300 words per minute, and the average human speaks at 150 words per minute.  Sure, for fiction books and stories, I love audio readings by a real human, because they can dramatize the fiction in a way a computer never will.  But for the vast majority of the blog posts I read, a human reading would add no value.  I can honestly think of only 2 of the 20 or 30 blogs I read regularly that I'd enjoy having read to me. For the rest of them, I'd use my TTS even if I had the option of a human reader.  TTS is faster, and if the article has been well-organized (headings, etc), I can skip the uninteresting bits.  

Also, every single blog I read includes multiple images in the articles with no alt-text, or where the only thing in the alt-text is photo credits (stockphoto/Wavecraft Media is not valid alt-text, no matter that it passes all the tests, and fulfills your obligations to give photo credits).  I'm absolutely serious about this, without any exaggeration at all:, every single blog I read has photos with no alt-text or invalid alt-text.  So trying to get bloggers to read their articles out loud is just a tragic waste of resources, that could be better spent advocating about alt-text.  If you use an image, for anything, it needs a description.  Who cares if you take the 25 minutes required to record a reading of your article, if you flatly refuse to take the 45 seconds needed to describe an image you included.  ",False,False,t1_cqf1vvh,fastfinge,,0,1429237005,t5_2qpec,t3_32ohq2,t1_cqevhcl,2,1432437428,0,0,cqf1vvh,Blind,2,,,,
101,"From a development perspective, access on the mac would probably be the easiest to implement, seeing as OS X has a well-documented set of accessibility guidelines and APIs, and they make the screen reader, so it implements all of the APIs in the documented way.  On Windows, of course, there are multiple screen reading packages, and they all do things slightly differently.  While there are APIs on Windows like IAccessible2, support and implementations differ.  

As for your games, if you want to access them right now, and have access to Windows, a guide on how to do that is at:
http://forum.audiogames.net/viewtopic.php?id=13431

It requires that you use the NVDA screen reader, and have installed the OCR Extension for NVDA.  Basically, using steam involves trying to run OCR on the text in the steam Window, and clicking on likely looking bits of text.  In my experience, this breaks frequently, and I would, in the strongest possible terms, not recommend anyone who is blind purchase any Steam games; any update could, at any time, break this solution, and you will lose all of the money you've invested in games.  Also, it won't work on Mac, or with anything but NVDA, Firefox, and Windows.  But if you already have some steam games, maybe because you got them for free in a promotion, or because you purchased them before you lost your vision, you can still sort of access them for now, sometimes.  ",False,False,t1_cqdwld1,fastfinge,,0,1429151172,t5_2qpec,t3_32bryx,t1_cqdmt7p,1,1432417617,0,0,cqdwld1,Blind,1,,,"From a development perspective, access on the mac would probably be the easiest to implement, seeing as OS X has a well-documented set of accessibility guidelines and APIs, and they make the screen reader, so it implements all of the APIs in the documented way.  On Windows, of course, there are multiple screen reading packages, and they all do things slightly differently.  While there are APIs on Windows like IAccessible2, support and implementations differ.  

As for your games, if you want to access them right now, and have access to Windows, a guide on how to do that is at:
<URL>

It requires that you use the NVDA screen reader, and have installed the OCR Extension for NVDA.  Basically, using steam involves trying to run OCR on the text in the steam Window, and clicking on likely looking bits of text.  In my experience, this breaks frequently, and I would, in the strongest possible terms, not recommend anyone who is blind purchase any Steam games; any update could, at any time, break this solution, and you will lose all of the money you've invested in games.  Also, it won't work on <PERSON>, or with anything but NVDA, Firefox, and Windows.  But if you already have some steam games, maybe because you got them for free in a promotion, or because you purchased them before you lost your vision, you can still sort of access them for now, sometimes.  ","[{'start': 1102, 'end': 1110, 'entity_type': 'PERSON', 'text': '<PERSON>', 'operator': 'replace'}, {'start': 584, 'end': 589, 'entity_type': 'URL', 'text': '<URL>', 'operator': 'replace'}]"
102,You're welcome. Any suggestions in how I might make this particular service better than the others?,False,False,t1_cqu56yg,AlmostARockstar,,0,1430420265,t5_2qpec,t3_34eo7r,t1_cqu55dj,1,1432697787,0,0,cqu56yg,Blind,1,,,,
103,"Heh. I get a lot eyecare and rx lenses ads too, esp in twitter.
(Was about to ask if that was Tommy in the video but d'oh... Took a while to fugure what to try to see on the screen so figured it out)",False,False,t1_cqh12ap,Unuhi,,0,1429405588,t5_2qpec,t3_332zhs,t3_332zhs,1,1432471586,0,0,cqh12ap,Blind,1,,,"Heh. I get a lot eyecare and rx lenses ads too, esp in twitter.
(Was about to ask if that was <PERSON> in the video but d'oh... Took a while to fugure what to try to see on the screen so figured it out)","[{'start': 94, 'end': 102, 'entity_type': 'PERSON', 'text': '<PERSON>', 'operator': 'replace'}]"
104,"Well if he is going to get a smart phone, I would highly recommend an iPhone. Apple is leaps ahead of any other phone when it comes to accessibility. As for as the tutorials, I'm not sure to be honest. Facebook, I don't use it anymore, but I'm pretty sure it's usable. Though I know for a fact it's usable on an iPhone. Hope this helped.",False,False,t1_cqjrx7g,Nighthawk321,,0,1429634247,t5_2qpec,t3_33cpfo,t3_33cpfo,3,1432518965,0,0,cqjrx7g,Blind,3,,,,
105,"Sigh... The joys of accessibility.
I did an audioboom trying to watch Daredevil earlier, 
https://audioboom.com/boos/3079661-watching-daredevil-on-netflix 
But I haven't watched the show further - it could be interesting but kind of made my point by getting past the beginning. ""I can't see!"" ... (Well... Go on...)
",False,False,t1_cqdw5zi,Unuhi,,0,1429150511,t5_2qpec,t3_32l5ds,t1_cqd7lvs,1,1432417416,0,0,cqdw5zi,Blind,1,,,"Sigh... The joys of accessibility.
I did an audioboom trying to watch <PERSON> earlier, 
<URL> 
But I haven't watched the show further - it could be interesting but kind of made my point by getting past the beginning. ""I can't see!"" ... (Well... Go on...)
","[{'start': 89, 'end': 94, 'entity_type': 'URL', 'text': '<URL>', 'operator': 'replace'}, {'start': 70, 'end': 78, 'entity_type': 'PERSON', 'text': '<PERSON>', 'operator': 'replace'}]"
106,it's interesting and a bit comforting to hear others say the same thing happened to them at about the same age. I guess I just thought I had more time (wishful thinking) but it's definitely encouraging to hear that your central vision is holding steady.,False,False,t1_cqmwzo6,nomorechocolatebars,,0,1429855367,t5_2qpec,t3_334irp,t1_cqmgkow,2,1432573196,0,0,cqmwzo6,Blind,2,,,,
107,"I use Firefox on my Windows 7 laptop, and Safari on mac.  

Most blind people don't use command line anymore, so I don't really know of anyone who still uses Lynx or any other text based browser.  These days, with sites like YouTube and SoundCloud, audio is a large enough part of the browsing experience that it wouldn't make sense.  ",False,False,t1_cqeccwp,fastfinge,,0,1429194899,t5_2qpec,t3_32ohq2,t1_cqe9mzj,2,1432425187,0,0,cqeccwp,Blind,2,,,,
108,"Are your friends supportive and understanding of it? 
Yeah I had been doing the same thing until this year when I realized I just can't afford to ignore anything anymore.",False,False,t1_cqmz3e5,WhimsicalCat,,0,1429862806,t5_2qpec,t3_334irp,t1_cqmyo50,1,1432574187,0,0,cqmz3e5,Blind,1,,,,
109,"oh wow you're the guy in the video, I didn't look at the posters name before commenting. lol you're so cool!",False,False,t1_cqk0ufp,Zensune,Sighted Son,0,1429647757,t5_2qpec,t3_33a8wz,t1_cqjg1ld,1,1432523241,0,0,cqk0ufp,Blind,1,,,,
110,"Well, some of it is actually just software. On Windows, I use NVDA. Some prefer JAWS or Windows Eyes. On OSX, Voiceover is built in. The majority of blind people use iPhones, because Voiceover works really well compared to other competitors. As far as text to brail, yes it's called a braille display. I really don't use them, but I believe the simple ones you just plug in and the text will pop up on the device. ",False,False,t1_cqfg21m,Nighthawk321,,0,1429278467,t5_2qpec,t3_32rel0,t3_32rel0,1,1432444246,0,0,cqfg21m,Blind,1,,,,
111,"Yep, tremendously. The amount of blind or people with bad eyes that don't know braille has been increasing a lot over the years. 

This is also in no small part due to the merging of braille classrooms with regular ones, where it's much harder to find teachers who know braille to teach it. This was due to budget problems. ",False,False,t1_cqsu3s3,Corm,,0,1430328139,t5_2qpec,t3_2u64ht,t1_co5gwqn,2,1432675295,0,0,cqsu3s3,Blind,2,,,,
112,"As you mentioned, the biggest barrier to more people getting braille displays is price. There are several groups working on this in various areas, but to this point, we haven't seen anything tangible. National Braille Press comes to mind as one organization that has been doing research on more affordable braille displays.
Some people have tried models where it displays a single character at a time, but I don't find these to offer the same level of flexibility. At minimum, a full line (40 cells or more) seems ideal, especially for programmers as one can feel the characters in relationship to each other and spot errors such as missing braces, etc. A good braille reader will use multiple fingers on both hands and can read at 200-300 words a minute or more. If you do a search on braille display research, you could probably track down some of what has been tried or that is currently being worked on. Current braille display tech is largely 20-30 years old and is very cost-prohibitive as you have likely noticed.",False,False,t1_cqpwf2v,jage9,,0,1430105703,t5_2qpec,t3_33m1w4,t3_33m1w4,2,1432624683,0,0,cqpwf2v,Blind,2,,,,
113,"Argh, okay. Still figuring out the ropes. Thank you!",False,False,t1_cqlwz1w,YanskaNY,,0,1429792580,t5_2qpec,t3_2ysici,t1_cpw0884,1,1432555872,0,0,cqlwz1w,Blind,1,,,,
114,"At least you have them hey. Yeah I know what you mean, it gets really tiring explaining it, especially with what you can and cannot see. such a complicated illness. Are you able to work or anything and be okay? I went and had a visual field test, officially qualified as legally blind now which was pretty hard to hear. ",False,False,t1_cqrczol,WhimsicalCat,,0,1430224108,t5_2qpec,t3_334irp,t1_cqn0onr,1,1432649889,0,0,cqrczol,Blind,1,,,,
115,"Facebook is pretty easy to navigate blind - some practice and it works on iOS.
I use VoiceOver &amp; other vision accessibility settings.
Iʻve never used a Samsung, but Iʻd imagine they would also have some good accessibility settings",False,False,t1_cqldb9g,Unuhi,,0,1429743490,t5_2qpec,t3_33cpfo,t3_33cpfo,1,1432546467,0,0,cqldb9g,Blind,1,,,"Facebook is pretty easy to navigate blind - some practice and it works on iOS.
I use VoiceOver &amp; other vision accessibility settings.
Iʻve never used a Samsung, but <PERSON> imagine they would also have some good accessibility settings","[{'start': 169, 'end': 177, 'entity_type': 'PERSON', 'text': '<PERSON>', 'operator': 'replace'}]"
116,"It's actually much easier on mobile than on computer, facebook at least.",False,False,t1_cqjs41p,Nighthawk321,,0,1429634546,t5_2qpec,t3_33cpfo,t1_cqjs2hd,2,1432519055,0,0,cqjs41p,Blind,2,,,,
117,"This is good, the materials are free on the site. https://nfb.org/braille-transcribing",False,False,t1_cqmau3l,NahumGardner,,0,1429815759,t5_2qpec,t3_33k5if,t3_33k5if,2,1432562544,0,0,cqmau3l,Blind,2,,,"This is good, the materials are free on the site. <URL>","[{'start': 50, 'end': 55, 'entity_type': 'URL', 'text': '<URL>', 'operator': 'replace'}]"
118,"Some meme sites include the caption as alt text. This can be weird though if you don't know what the image under the text is.

Thanks for exploring more accessible ways to implement meme images.",False,False,t1_cqu55dj,bondolo,Sighted Spouse,0,1430420198,t5_2qpec,t3_34eo7r,t3_34eo7r,2,1432697767,0,0,cqu55dj,Blind,2,,,,
119,"Depends on a hospital.
And the person.

I have so bad memories from hospitals of a litime and especially last year that I rather die than go in any hospital, at least in USA.

Let's put it this way:
Hospitals and EMS fail in recognizing people who are blind or visually impaired.

ER doctors have talked to my husband to ask about my symptoms while I am lying on a hospital bed, and fully conscious. WTF?! Jusf because my eyes don't have the same type of funtional vision as yours, why do I need an interprete? Oh yea beacuse I don't see, right... 
So I don't know what hospitals I've been in because they don't always actually inform the patient. 

I also wish every medical staff would quit ever trying to do stroke diagnostics on me.
I have a non-24h circadian rhythm, what a surprise. I try to regulate my sleep/awake schedule. English being my third language I may form a bit odd sentences to a native speakersʻ shall we say, eyes?

I don't even know how I can find out in this country if I have been diagnozed with a seizure. Guess how fun that is...

Medical records belong to the corporation, not the patient. That depends on the state you live in. US is definitely the most stressful place for any medical needs of all the countries I've lived in on three different continents. 

It would probably be less stressful if I had been always completely blind.",False,False,t1_cqrevt4,Unuhi,,0,1430228417,t5_2qpec,t3_344x3k,t3_344x3k,4,1432650781,0,0,cqrevt4,Blind,4,,,"Depends on a hospital.
And the person.

I have so bad memories from hospitals of a litime and especially last year that I rather die than go in any hospital, at least in <LOCATION>.

Let's put it this way:
Hospitals and EMS fail in recognizing people who are blind or visually impaired.

ER doctors have talked to my husband to ask about my symptoms while I am lying on a hospital bed, and fully conscious. WTF?! <PERSON> because my eyes don't have the same type of funtional vision as yours, why do I need an interprete? Oh yea beacuse I don't see, right... 
So I don't know what hospitals I've been in because they don't always actually inform the patient. 

I also wish every medical staff would quit ever trying to do stroke diagnostics on me.
I have a non-24h circadian rhythm, what a surprise. I try to regulate my sleep/awake schedule. English being my third language I may form a bit odd sentences to a native speakersʻ shall we say, eyes?

I don't even know how I can find out in this country if I have been diagnozed with a seizure. Guess how fun that is...

Medical records belong to the corporation, not the patient. That depends on the state you live in. <LOCATION> is definitely the most stressful place for any medical needs of all the countries I've lived in on three different continents. 

It would probably be less stressful if I had been always completely blind.","[{'start': 1168, 'end': 1178, 'entity_type': 'LOCATION', 'text': '<LOCATION>', 'operator': 'replace'}, {'start': 413, 'end': 421, 'entity_type': 'PERSON', 'text': '<PERSON>', 'operator': 'replace'}, {'start': 170, 'end': 180, 'entity_type': 'LOCATION', 'text': '<LOCATION>', 'operator': 'replace'}]"
120,"Facebook on the computer has improved a lot, over the last year or so.  But it uses all the fancy new accessibility APIs, so if your version of JAWS is even 1 version out-of-date, Facebook is going to be a lot easier on Mobile.  Think of it like this: on a computer, you have a large screen, with lots of memory and CPU, so apps are designed to have multiple things happening, all at once: a scrolling activity feed on the side, chat messages and notifications popping up, an endlessly scrolling newsfeed, and all that just on the one page, not counting all of the other apps the computer is running.  On a phone, the screen, CPU, battery, data, and memory are limited enough, that most apps are designed to only do 1 or 2 things at once.  As a 27-year-old blind person who has been an extremely active computer user since age 9, even I find doing a lot of things on my phone much easier and less frustrating.  

If you do want to keep your grandfather on the desktop, I strongly recommend getting him using Firefox with NVDA (http://www.nvda-project.org).  NVDA is a free and open source screen reader, so he can have the latest and best, without having to pay several thousand dollars every 2 years.  Also, currently NVDA's support for web apps, when using Firefox, is the best by miles.  The key commands are similar enough to JAWS that he won't be totally lost, either.  Also, once you've gotten him on Firefox, you can give him AAdBlock.  For a blind person, this is the best thing.  First off, it blocks all of those animated ads and pop-up windows and spammy links with no relation to what we're trying to do.  This will make the screen reader faster, and his experience much better; as a blind person, it's sometimes not obvious where the ads end and the real website begins.  And if you know a little about web development yourself, if your grandfather finds something on a website difficult or confusing, you can use AdBlock to get rid of it for him, or GreaseMonkey and Stylish to modify it.  This is something only Firefox seems to allow, and in my opinion, is another reason why Firefox and NVDA leads the pack in accessibility.  ",False,False,t1_cqjwa0q,fastfinge,,0,1429640877,t5_2qpec,t3_33cpfo,t3_33cpfo,1,1432521090,0,0,cqjwa0q,Blind,1,,,"Facebook on the computer has improved a lot, over the last year or so.  But it uses all the fancy new accessibility APIs, so if your version of JAWS is even 1 version out-of-date, Facebook is going to be a lot easier on Mobile.  Think of it like this: on a computer, you have a large screen, with lots of memory and CPU, so apps are designed to have multiple things happening, all at once: a scrolling activity feed on the side, chat messages and notifications popping up, an endlessly scrolling newsfeed, and all that just on the one page, not counting all of the other apps the computer is running.  On a phone, the screen, CPU, battery, data, and memory are limited enough, that most apps are designed to only do 1 or 2 things at once.  As a 27-year-old blind person who has been an extremely active computer user since age 9, even I find doing a lot of things on my phone much easier and less frustrating.  

If you do want to keep your grandfather on the desktop, I strongly recommend getting him using Firefox with <PERSON> (<URL>).  NVDA is a free and open source screen reader, so he can have the latest and best, without having to pay several thousand dollars every 2 years.  Also, currently NVDA's support for web apps, when using Firefox, is the best by miles.  The key commands are similar enough to JAWS that he won't be totally lost, either.  Also, once you've gotten him on Firefox, you can give him AAdBlock.  For a blind person, this is the best thing.  First off, it blocks all of those animated ads and pop-up windows and spammy links with no relation to what we're trying to do.  This will make the screen reader faster, and his experience much better; as a blind person, it's sometimes not obvious where the ads end and the real website begins.  And if you know a little about web development yourself, if your grandfather finds something on a website difficult or confusing, you can use AdBlock to get rid of it for him, or GreaseMonkey and Stylish to modify it.  This is something only Firefox seems to allow, and in my opinion, is another reason why Firefox and NVDA leads the pack in accessibility.  ","[{'start': 1031, 'end': 1036, 'entity_type': 'URL', 'text': '<URL>', 'operator': 'replace'}, {'start': 1021, 'end': 1029, 'entity_type': 'PERSON', 'text': '<PERSON>', 'operator': 'replace'}]"
