,body,score_hidden,archived,name,author,author_flair_text,downs,created_utc,subreddit_id,link_id,parent_id,score,retrieved_on,controversiality,gilded,id,subreddit,ups,distinguished,author_flair_css_class,anonymized_body,anonymized_masks
0,I'm definitely interested in getting a guide dog. I'll be looking into the Leader Dogs program for sure.,,,,georgeQwashington,,,1447351303,t5_2qpec,t3_3sfnhl,t1_cwxll32,1,1449760767,0,0,cwxwqpu,Blind,1,,,,
1,"Students who are between the ages of 14-22. Some states have different age ranges, but most of them are 14-22. 

",,,,aam22,,,1448409435,t5_2qpec,t3_3twbgh,t1_cxbmjl3,1,1450004283,0,0,cxc0lha,Blind,1,,,,
2,It sounds like the readers only read for the library of congress.,,,,DietOysterCrackers,,,1448259805,t5_2qpec,t3_3sm8ct,t3_3sm8ct,1,1449967941,0,0,cx9wlbb,Blind,1,,,,
3,Thank you for adding voiceover accessibility. Too many devs don't do this.,,,,Nighthawk321,Gunshot.,,1447052962,t5_2qpec,t3_3rnwb8,t3_3rnwb8,1,1449690823,0,0,cwtut8j,Blind,1,,blue1,,
4,"He really likes politics and world affairs, hence why I can only think of braille/audio books for a gift.",,,,StrongBoston,,,1447076897,t5_2qpec,t3_3s2zy8,t1_cwtr3ar,1,1449694005,0,0,cwu1kbq,Blind,1,,,,
5,"No problem :)  I got my intensive training over this past summer through a local organization, the program was for people about to enter (like myself) or just starting college, and it was just for people in my local area.  

&amp;nbsp;

My instructors have spoken very highly of the Leader Dog Accelerated O&amp;M program though which doesn't have an age/ stage in life/ location requirement.  I think I also mentioned that I'm pretty sure you get a free Trekker, I know you do in the guide dog program.

&amp;nbsp;

When I started cane training I had absolutely zero intention of pursuing a guide dog.  I had this idea that it was just for people with total blindness, or absolutely no functional vision whatsoever.  I had an O&amp;M ask me if I was thinking about it and encourage me to do it because of my fast pace and public transit commuting.  After working with him and having a chance to do both a Juno walk and a trial run on a guide dog in training, I decided that it was what I wanted to do.  At this time I don't have a guide dog, however I was accepted into a couple of programs and have decided with my O&amp;Ms to go with Leader Dogs for the Blind.  So basically I'm flying out in June to get my first guide dog at Leader.  I can't really speak for the experience other than the hour or so I had to actually walk with one, but it was an incredible experience for me and I'm way too excited for June right now.  So yeah, that's where I stand with the guide dog.  Are you interested in getting one?",,,,geoffisblind,LCA (Low Vision),,1447330519,t5_2qpec,t3_3sfnhl,t1_cwxfqdz,1,1449755442,0,0,cwxll32,Blind,1,,blue1,,
6,"If you have apple devices - voice over will read the page. You will have to leran assorted various commands to manipulate the program. If you have a licensed version of Microsoft Office, you can get window eyes free - again, a learning curve to learn the commands. Of course, on the PC, the narrator within accessibility (start menu) is inherent to windows. There are a few more found when googling free screen readers. ",,,,sheasadorable,,,1447446334,t5_2qpec,t3_3sotv8,t3_3sotv8,1,1449784113,0,0,cwz9con,Blind,1,,,,
7,"That is very unfortunate, has it always been this way?  Are there any efforts to amend this?",,,,geoffisblind,LCA (Low Vision),,1447293851,t5_2qpec,t3_3sc8qp,t1_cww7tm7,1,1449749134,0,0,cwx8h5s,Blind,1,,blue1,,
8,"Done :)
I'll share it in twitter too",,,,Unuhi,,,1447872503,t5_2qpec,t3_3t7iip,t1_cx4nkm2,1,1449879597,0,0,cx4sb3k,Blind,1,,,,
9,"You wouldn't be able to separate out  the audio tracks, but, you could do something similar.

Have a volunteer watching the movie do their own audio description as it is playing, which could then be fed to headphones.  Could be an interesting activity for any students in a theatre/drama program.

Obviously they'd need to sit at the back, and talk quietly into the microphone so as not to disturb anyone else.  It might be a workable compromise though.  If your school/college has a music production dept. they might be able to help you out with equipment.  It might be an interesting little project for them to get involved in that could tie into their studies.

Recording studios will quite often have a dedicated headphone amp with multiple outputs, if you can get your hands on a few cordless headphones it would work quite well.

If you use a small mixer, you could mix the movie &amp; AD audio together.

I used to be a musician with a lot of studio experience before I lost most of my sight (I still have my home studio), this is how I would do it....

https://i.imgur.com/cyJBfJM.jpg

If you can't get cordless headphones then trailing cables might become a trip hazard, so I would suggest the visually impaired moviegoers sit together nearest the mixer and you give them the headphones after they are seated, and take back the headphones before they leave the seat.

I hope you can pull this off as it does sound like a great idea.",,,,impablomations,Homonymous Hemianopsia,,1448035498,t5_2qpec,t3_3tj2vr,t1_cx6nigp,1,1449917471,0,0,cx6zevh,Blind,1,,blue1,"You wouldn't be able to separate out  the audio tracks, but, you could do something similar.

Have a volunteer watching the movie do their own audio description as it is playing, which could then be fed to headphones.  Could be an interesting activity for any students in a theatre/drama program.

Obviously they'd need to sit at the back, and talk quietly into the microphone so as not to disturb anyone else.  It might be a workable compromise though.  If your school/college has a music production dept. they might be able to help you out with equipment.  It might be an interesting little project for them to get involved in that could tie into their studies.

Recording studios will quite often have a dedicated headphone amp with multiple outputs, if you can get your hands on a few cordless headphones it would work quite well.

If you use a small mixer, you could mix the movie &amp; AD audio together.

I used to be a musician with a lot of studio experience before I lost most of my sight (I still have my home studio), this is how I would do it....

<URL>

If you can't get cordless headphones then trailing cables might become a trip hazard, so I would suggest the visually impaired moviegoers sit together nearest the mixer and you give them the headphones after they are seated, and take back the headphones before they leave the seat.

I hope you can pull this off as it does sound like a great idea.","[{'start': 1061, 'end': 1066, 'entity_type': 'URL', 'text': '<URL>', 'operator': 'replace'}]"
10,"Yes, I think the Kodi screen-reader should work on a pi.  However, it's much more complicated to set-up.  On Windows, all I have to do is run the KODI screen-reader installer, and it will download Kodi, download the screen-reader addon, and configure everything for me.  On the pi, you need to get Kodi up and running without the screen-reader, and then add the repository, and then install the add-on through the add-on manager, and then...I think you need to have the python speech server or something? I'm not totally clear on how that works.  I don't have any sighted people around who could do those first steps for me, and I'm completely blind so can't do it myself, so I don't know much about what's involved.  It's worth a try though!  If you do get it all working on the pi, perhaps consider creating an SD Card image for the rest of us? :-)",,,,fastfinge,born blind,,1448821645,t5_2qpec,t3_3upmkw,t1_cxgu3vk,1,1450103092,0,0,cxgy5fc,Blind,1,,blue1,"Yes, I think the <PERSON> screen-reader should work on a pi.  However, it's much more complicated to set-up.  On Windows, all I have to do is run the <PERSON> screen-reader installer, and it will download <PERSON>, download the screen-reader addon, and configure everything for me.  On the pi, you need to get <PERSON> up and running without the screen-reader, and then add the repository, and then install the add-on through the add-on manager, and then...I think you need to have the python speech server or something? I'm not totally clear on how that works.  I don't have any sighted people around who could do those first steps for me, and I'm completely blind so can't do it myself, so I don't know much about what's involved.  It's worth a try though!  If you do get it all working on the pi, perhaps consider creating an SD Card image for the rest of us? :-)","[{'start': 310, 'end': 318, 'entity_type': 'PERSON', 'text': '<PERSON>', 'operator': 'replace'}, {'start': 205, 'end': 213, 'entity_type': 'PERSON', 'text': '<PERSON>', 'operator': 'replace'}, {'start': 150, 'end': 158, 'entity_type': 'PERSON', 'text': '<PERSON>', 'operator': 'replace'}, {'start': 17, 'end': 25, 'entity_type': 'PERSON', 'text': '<PERSON>', 'operator': 'replace'}]"
11,"If you want to learn to train others, there are a few colleges with the program. I'm doing it as a master's degree at Texas Tech. It's mostly online but with a few on-campus experiences, and then the month ish of cane training. I believe UMASS Boston has a program as well. Where do you live?",,,,snazzychica2812,training TVI/COMS,,1447294700,t5_2qpec,t3_3sc8qp,t1_cww5pow,1,1449749362,0,0,cwx8yh5,Blind,1,,blue2,,
12,"Thank you for the terrific information. Out of curiosity, where did you get your accelerated O&amp;M? Do you have a guide dog?",,,,georgeQwashington,,,1447308548,t5_2qpec,t3_3sfnhl,t1_cwxcbmf,1,1449752620,0,0,cwxfqdz,Blind,1,,,,
13,"(781)922-8511 is the hotline number, let us know what you think!",,,,bhmode,The Blind Hour Podcast,,1446624997,t5_2qpec,t3_3rgwrm,t3_3rgwrm,1,1449588825,0,0,cwny4hp,Blind,1,,blue2,"<PHONE_NUMBER> is the hotline number, let us know what you think!","[{'start': 0, 'end': 14, 'entity_type': 'PHONE_NUMBER', 'text': '<PHONE_NUMBER>', 'operator': 'replace'}]"
14,"Austin Tx.
Lots of blind training stuff over here. :)",,,,Unuhi,,,1447297550,t5_2qpec,t3_3sc8qp,t1_cwx8yh5,1,1449750075,0,0,cwxah07,Blind,1,,,"<PERSON>.
Lots of blind training stuff over here. :)","[{'start': 0, 'end': 8, 'entity_type': 'PERSON', 'text': '<PERSON>', 'operator': 'replace'}]"
15,Wonderful.  Ask for Danielle Capreau and tell her Rum sent you.,,,,rumster,Works with the Blind,,1447246239,t5_2qpec,t3_3sc0z5,t1_cwwemby,1,1449735500,0,0,cwwg3iw,Blind,1,,mod,Wonderful.  Ask for <PERSON> and tell her Rum sent you.,"[{'start': 20, 'end': 28, 'entity_type': 'PERSON', 'text': '<PERSON>', 'operator': 'replace'}]"
16,"It totally depends on that individuals interests. The blind or low vision thing is less of a factor than the choosing something that individual person may like. Find out what they are into. If they like tea, maybe a cool mug and some fancy tea.  If they like audiobooks maybe an audible subscription or iTunes gift card. If they are into movies blu-rays with descriptive audio tracks may be a good idea. If they are into comedy, take them to see a favorite comedian perform, or see a favorite band perform. It really depends on that person. If there isn't a budget, maybe an iPad or some other tablet. 

Innapropeiate gift ideas... Books, picture books!, magazines, whatever. ",,,,0mgitsrachel,,,1448433452,t5_2qpec,t3_3u3oyc,t3_3u3oyc,1,1450010074,0,0,cxcclxg,Blind,1,,,,
17,"Because of his cognitive deficits, he's not quite ready to look at accessible technology and his memory is very poor, which is why I also don't think he's ready to learn Braille. I'm trying to focus on the basics like walking so that he can get to/from the bathroom.

Thank you for your feedback!",,,,aishel,,,1447198349,t5_2qpec,t3_3sc0z5,t1_cwvwayy,1,1449726089,0,0,cwvwiz4,Blind,1,,,,
18,"Thanks! I did that, and actually might've found someone to talk to. 

Out of curiosity, whereabout do you ride? Do you find it to be an okay experience, overall? ",,,,literallyARockStar,,,1446847644,t5_2qpec,t3_3rrx2n,t1_cwr5qcy,1,1449644350,0,0,cwr5zta,Blind,1,,,,
19,"Do you want your sub in the sidebar? Also, I assume you know about the accessible gameboy emulator thing Tyler released a while ago?  ",,,,fastfinge,born blind,,1447174391,t5_2qpec,t3_3s62gm,t3_3s62gm,1,1449718464,0,0,cwvghuk,Blind,1,,blue1,"Do you want your sub in the sidebar? Also, I assume you know about the accessible gameboy emulator thing <PERSON> released a while ago?  ","[{'start': 105, 'end': 113, 'entity_type': 'PERSON', 'text': '<PERSON>', 'operator': 'replace'}]"
20,"Yep I feel ya. We as a society are in a rush these days with close to no downtime. I completely agree with you and understand when you say music has become a commodity over an experience. Hopefully a generation can shift that thought and bring music back to the forefront of experience rather than something that is kinda just there in the background. It doesn't help that artists these days are pushing for quantity over a quality haha. One single track  was actually something I was considering but i decided to split it up just in the case someone enjoyed one part of the story over the rest, I guess it was more for convenience. But definitely in the future if my stories are foolproof with no gaps or holes and flows nicely as one single track I will release it as a single track. Thanks heaps for taking your time to reply, and giving me your honest opinion, its great to see people that actually take time on the internet and treat everyone as a person over a username or block of text :) 

edit: spelling grammar",,,,sj1220,,,1447307454,t5_2qpec,t3_3sdypp,t1_cwx3qdy,1,1449752418,0,0,cwxfayp,Blind,1,,,,
21,"The first thing to do is contact the Division of Blind Services. This is the state agency that is in charge of locating or providing services to people who are visually impaired. The name differs from state to state, but it's basically the same office. DBS (or what it's called in your state) will pay for all services and they even have a fund to buy adaptive devices s/he will need. ",,,,aam22,,,1448249525,t5_2qpec,t3_3sc0z5,t3_3sc0z5,1,1449965520,0,0,cx9rlci,Blind,1,,,,
22,"Twitters getting bad with screenshorts. Facebook is people screenshotting others pics and screenshorts then their reactions and posting that.

I'm starting to wonder if some sites can go do away with text out of an image file all together.",,,,SideshowKaz,,,1446672450,t5_2qpec,t3_3ri44o,t3_3ri44o,1,1449600583,0,0,cwomnq2,Blind,1,,,,
23,"Yeah don't get him braille books. Just get him whatever his hobby is; isn't that what everyone does when they give a person a gift? But yeah, no braille books haha.",,,,Nighthawk321,Gunshot.,,1447052529,t5_2qpec,t3_3s2zy8,t3_3s2zy8,1,1449690690,0,0,cwtuo00,Blind,1,,blue1,,
24,"Thank you! If questions come up, I'll PM you!

Shall I send you my presentation when I'm done? although it will be pretty basic stuff, maybe you have some use for it?

Also, would you mind if I use some the graphics from your presentation? With proper attribution, of course.",,,,ThrowawayWebU,,,1447901060,t5_2qpec,t3_3t5w41,t1_cx4lx8a,1,1449888288,0,0,cx5agxs,Blind,1,,,,
25,"What does the person like?
Everything depends on what they like. So just like there is no universal gift for a sighted person or someone to pick by just knowing their age or their gender, there aren't ideas that work universally.

Low vision just like blindness has so many varieties.
So some may still read even regular print. Generally: don't get a book as a gift.
A giftcard for a bookstore or audiobooks might be better.
And then knowing more about the person will help. 
If you don't know anything about their hobbies or likes, some wine and some edibles might be a relatively safe bet.",,,,Unuhi,,,1448411306,t5_2qpec,t3_3u3oyc,t3_3u3oyc,1,1450004848,0,0,cxc1nl5,Blind,1,,,,
26,"Oh I know that feeling all too well.  The suspense is absolutely killer.  I don't have a guide dog yet, I got my acceptance call in October informing me that I had been assigned to the June 2016 class and it was one of the happiest moments of the year for me.  I had a chance to trial run a dog for about an hour with a guide dog mobility instructor and two of my O&amp;Ms over the summer and that experience was enough that we decided to shoot the O&amp;M demonstration video for the school that I'm going to.  The difference in speed and fluidity over a cane is amazing, also I really like dogs which certainly helped with making that decision.  I fly out in early June for my class and I am beyond excited.

&amp;nbsp;

Again, best of luck!  Hoping everything works out for you.",,,,geoffisblind,LCA (Low Vision),,1448258653,t5_2qpec,t3_3tpjuv,t1_cx9v17c,1,1449967672,0,0,cx9w5s1,Blind,1,,blue1,,
27,I'm tempted to try this just to see what happens; although I must admit I'm a bit concerned about what is done with the pictures afterward.,,,,Nandflash,,,1448711586,t5_2qpec,t3_3ty6e1,t3_3ty6e1,1,1450079905,0,0,cxfnbdg,Blind,1,,,,
28,"No, it isn't.  The AD would need to be on for everyone.",,,,fastfinge,born blind,,1448034230,t5_2qpec,t3_3tj2vr,t1_cx6nigp,1,1449917106,0,0,cx6ymz2,Blind,1,,blue1,,
29,"Do you already know braille? Or at least, the braille alphabet? Writing with a slate and stylus is tricky, because you need to write  in mirror image, moving from right to left and pushing the bumps through to the other side of the paper. I'm not aware of any way to handwrite without a slate/stylus, because it would be near impossible to get bumps to the right depth and spacing. Even a tiny fraction of an inch in irregularity can completely change a character.

[Here](https://www.youtube.com/watch?v=K15zmbl4IrQ) is a good resource for writing with a slate and stylus. Watch it, see if you think it's plausible for your skill level, and if you're interested, PM me your address and as a slightly-less-broke grad student, I'll fund a slate and stylus for you.",,,,snazzychica2812,training TVI/COMS,,1447978931,t5_2qpec,t3_3tgeya,t3_3tgeya,2,1449906469,0,0,cx6chgj,Blind,2,,blue2,"Do you already know braille? Or at least, the braille alphabet? Writing with a slate and stylus is tricky, because you need to write  in mirror image, moving from right to left and pushing the bumps through to the other side of the paper. I'm not aware of any way to handwrite without a slate/stylus, because it would be near impossible to get bumps to the right depth and spacing. Even a tiny fraction of an inch in irregularity can completely change a character.

[Here](<URL>) is a good resource for writing with a slate and stylus. Watch it, see if you think it's plausible for your skill level, and if you're interested, PM me your address and as a slightly-less-broke grad student, I'll fund a slate and stylus for you.","[{'start': 473, 'end': 478, 'entity_type': 'URL', 'text': '<URL>', 'operator': 'replace'}]"
30,The workaround might work for a few sites I use a bunch. But most VIP will never be able to do that data entry by themselves. Also most sites are rarely visited and not worth the effort to add as a bookmark. ,,,,matt_may,,,1448250080,t5_2qpec,t3_3t5w41,t1_cx972nc,2,1449965683,0,0,cx9rxul,Blind,2,,,,
31,"Great thank you! I don't mind a bit of ""artistic licence"" here and there, but I know it's annoying when an author includes something that is just blatantly wrong, and I didn't want to do that.",,,,istara,,,1448186524,t5_2qpec,t3_3tiw6c,t1_cx8vt2z,1,1449950526,0,0,cx8wbwl,Blind,1,,,,
32,Thank you so much. The more detail the better. ,,,,datthepirate,,,1448037381,t5_2qpec,t3_3t7iip,t1_cx70lra,1,1449918045,0,0,cx70mq0,Blind,1,,,,
33,Not to mention Daredevil! Big fan of Netflix &amp; what they're doing. BBC does audio description apparently. Not sure about BBCAmerica though.,,,,GoingInBlindPodcast,,,1447075491,t5_2qpec,t3_3rlxw7,t1_cwpboy2,1,1449693734,0,0,cwu0zlt,Blind,1,,,,
34,"&gt;  Cane training is six hours a day for a month, and honestly that's not that much compared to how much training we give to actual blind people.

Wow, I wish I had got even that!

My guide cane 'training' consisted of ""hold it diagonally in front of you"".  Support for people who lose sight in later life is woefully dire in the UK.",,,,impablomations,Homonymous Hemianopsia,,1447217799,t5_2qpec,t3_3sc8qp,t1_cww51pd,1,1449731543,0,0,cww7tm7,Blind,1,,blue1,"&gt;  <PERSON> training is six hours a day for a month, and honestly that's not that much compared to how much training we give to actual blind people.

Wow, I wish I had got even that!

My guide cane 'training' consisted of ""hold it diagonally in front of you"".  Support for people who lose sight in later life is woefully dire in the <LOCATION>.","[{'start': 336, 'end': 346, 'entity_type': 'LOCATION', 'text': '<LOCATION>', 'operator': 'replace'}, {'start': 6, 'end': 14, 'entity_type': 'PERSON', 'text': '<PERSON>', 'operator': 'replace'}]"
35,Their college might have a disability services office that would do it because it's a nice idea.  ,,,,thatsnotgneiss,Chronic Bilateral Iridiocyclitis/low vision,,1448000876,t5_2qpec,t3_3tgeya,t1_cx5zjbv,1,1449911785,0,0,cx6nmkk,Blind,1,,blue1,,
36,I know exactly how you feel. we are getting screwed big time!,,,,crypto786,,,1447792130,t5_2qpec,t3_3t2m1n,t1_cx3iked,1,1449860586,0,0,cx3or7a,Blind,1,,,,
37,"I'm not completely blind, but I don't think most people who are would consider thought to be a ""sense"", especially that cognitive voice in your head. Senses are a way to gain information, and thought is the way we interpret and process that information. ",,,,blind_devotion08,,,1448389120,t5_2qpec,t3_3tvuf1,t3_3tvuf1,1,1449997665,0,0,cxbmow1,Blind,1,,,,
38,"Hey, thanks for the answer!

I have a few more questions going off of what you told me:

1. Would you say you are overall trusting of the individual strangers around you as you go about your day, or distrusting? Why?

2. Do you ever find yourself using strangers’ voices as a way of making initial judgments as to whether or not you should trust them? (Assuming it's necessary that you make this judgment)

3.Do you think there’s a difference between how you trust people in person vs less personal mediums of communication?  Do you feel different levels of confidence in judging a stranger's trustworthiness in an in-person setting, a phone call setting, or a text-based setting (like email), or are they all similar? 

Thanks for your time",,,,OzCello,,,1448058808,t5_2qpec,t3_3tiofx,t1_cx7aveg,1,1449924681,0,0,cx7efnf,Blind,1,,,"Hey, thanks for the answer!

I have a few more questions going off of what you told me:

1. Would you say you are overall trusting of the individual strangers around you as you go about your day, or distrusting? Why?

2. Do you ever find yourself using strangers’ voices as a way of making initial judgments as to whether or not you should trust them? (Assuming it's necessary that you make this judgment)

<URL> you think there’s a difference between how you trust people in person vs less personal mediums of communication?  Do you feel different levels of confidence in judging a stranger's trustworthiness in an in-person setting, a phone call setting, or a text-based setting (like email), or are they all similar? 

Thanks for your time","[{'start': 407, 'end': 412, 'entity_type': 'URL', 'text': '<URL>', 'operator': 'replace'}]"
39,"I think we are in a similar situation.  My only vision is central.  I started using a cane a little over a year ago and have probably gotten something around 30 to 35 combined hours of training since.  I received about 24 over the course of three weeks in an intensive program and probably about ten more spread over the time between September 2014 and June 2015.  

&amp;nbsp;

I am not pursuing anymore cane training at this point as I feel confident in traveling independently.  I don't think you necessarily need that amount if you are feeling good but it was definitely helpful to me.  I'd say if you don't feel confident yet, get more, insist to local organizations and your local Rehab Services for the Blind (If you are in the US) that you feel that you need more training.  If you are happy with it then there is no need to continue training.  It all comes down to how you feel.",,,,geoffisblind,LCA (Low Vision),,1447293498,t5_2qpec,t3_3sfnhl,t3_3sfnhl,1,1449749039,0,0,cwx89v1,Blind,1,,blue1,"I think we are in a similar situation.  My only vision is central.  I started using a cane a little over a year ago and have probably gotten something around 30 to 35 combined hours of training since.  I received about 24 over the course of three weeks in an intensive program and probably about ten more spread over the time between September 2014 and June 2015.  

&amp;nbsp;

I am not pursuing anymore cane training at this point as I feel confident in traveling independently.  I don't think you necessarily need that amount if you are feeling good but it was definitely helpful to me.  I'd say if you don't feel confident yet, get more, insist to local organizations and your local Rehab Services for the Blind (If you are in the <LOCATION>) that you feel that you need more training.  If you are happy with it then there is no need to continue training.  It all comes down to how you feel.","[{'start': 735, 'end': 745, 'entity_type': 'LOCATION', 'text': '<LOCATION>', 'operator': 'replace'}]"
