,body,score_hidden,archived,name,author,author_flair_text,downs,created_utc,subreddit_id,link_id,parent_id,score,retrieved_on,controversiality,gilded,id,subreddit,ups,distinguished,author_flair_css_class,anonymized_body,anonymized_masks
0,"Depends what country you live in, and how much you want to spend.  If you get something like a Victor Reader Stream or a BookSense, they take SD Cards. So you could load a card up with files, stick it in the mail, and he can pop it into his player when he gets it.  But those devices do not come cheap.  ",False,False,t1_cqghtjs,fastfinge,,0,1429366577,t5_2qpec,t3_32xohp,t3_32xohp,1,1432462437,0,0,cqghtjs,Blind,1,,,,
1,"I was diagnosed when I was 14 and am now 23. At first it seemed really slow, but since I was about 19 it seems to have progressed faster, but I think as it gets worse I just notice it more. I have had a lot of trouble adjusting and have found people around me have a lot of trouble understanding it because i look 'normal' and can still do things without a cane. Became a little isolated as a result of no longer going out to bars etc. I'm going to check out support groups soon, maybe do that? I'm sure they'd have them in most countries",False,False,t1_cqmydjp,WhimsicalCat,,0,1429859999,t5_2qpec,t3_334irp,t3_334irp,1,1432573848,0,0,cqmydjp,Blind,1,,,,
2,Workman makes some nice custom adaptable bikes and trikes ,False,False,t1_cqmqivo,thatsnotgneiss,Chronic Bilateral Iridiocyclitis/low vision,0,1429841898,t5_2qpec,t3_33mm6a,t3_33mm6a,1,1432570077,0,0,cqmqivo,Blind,1,,,<PERSON> makes some nice custom adaptable bikes and trikes ,"[{'start': 0, 'end': 8, 'entity_type': 'PERSON', 'text': '<PERSON>', 'operator': 'replace'}]"
3,"Sorry, the question ""Please rank the following tasks by difficulty"" was completely inaccessible with every screen reader I tried (NVDA, IOS, Mac).  I'm not finding anywhere to type or select a number.  If you want to survey the blind community, you need to put in the effort of testing your surveys for accessibility on, at minimum, one platform.  ",False,False,t1_cqasols,fastfinge,,0,1428933124,t5_2qpec,t3_32clsw,t3_32clsw,1,1432363829,0,0,cqasols,Blind,1,,,,
4,"As am I.  I get massive, massive lags in the Netflix app with VoiceOver on, and frequent crashes of Netflix and Voiceover, both.  When it does work, there are frequent places where swiping just...says nothing. Not ""button"", or anything, just makes the click swipe sound, and says nothing at all.  There are also multiple unlabelled buttons throughout the app.  You can get it to work, in the same way you can get the website to work, if you're willing to fight with it, and put up with missing functionality.  But it's definitely a semi-usable app, not an accessible app.  Especially on IOS, there is no excuse for that.  ",False,False,t1_cqd1jta,fastfinge,,0,1429100279,t5_2qpec,t3_32l5ds,t1_cqcpj9f,1,1432402637,0,0,cqd1jta,Blind,1,,,"As am <PERSON>  I get massive, massive lags in the Netflix app with VoiceOver on, and frequent crashes of Netflix and Voiceover, both.  When it does work, there are frequent places where swiping <URL>ys nothing. Not ""button"", or anything, just makes the click swipe sound, and says nothing at all.  There are also multiple unlabelled buttons throughout the app.  You can get it to work, in the same way you can get the website to work, if you're willing to fight with it, and put up with missing functionality.  But it's definitely a semi-usable app, not an accessible app.  Especially on IOS, there is no excuse for that.  ","[{'start': 195, 'end': 200, 'entity_type': 'URL', 'text': '<URL>', 'operator': 'replace'}, {'start': 6, 'end': 14, 'entity_type': 'PERSON', 'text': '<PERSON>', 'operator': 'replace'}]"
5,"TuneIn Radio works for the show.
(I use it on iphone)",False,False,t1_cqi42si,Unuhi,,0,1429498332,t5_2qpec,t3_332zhs,t1_cqhvcxw,1,1432490263,0,0,cqi42si,Blind,1,,,,
6,"O wow, what country do you live in, because I live in the US and I have had none of these bugs. I'm not able to check my version number at the moment because I'm in school, but I will let you know before the end of the day.",False,False,t1_cqd6yki,Nighthawk321,,0,1429110991,t5_2qpec,t3_32l5ds,t1_cqd5mdc,1,1432405256,0,0,cqd6yki,Blind,1,,,"O wow, what country do you live in, because I live in the <LOCATION> and I have had none of these bugs. I'm not able to check my version number at the moment because I'm in school, but I will let you know before the end of the day.","[{'start': 58, 'end': 68, 'entity_type': 'LOCATION', 'text': '<LOCATION>', 'operator': 'replace'}]"
7,If I remember right the cochlear implant advanced leaps and bounds since the first generation. Here is to hoping the same happens with this technology as well.,False,False,t1_cqhpoku,Faldorn,,0,1429471549,t5_2qpec,t3_2mssya,t1_cm7wbsd,1,1432483337,0,0,cqhpoku,Blind,1,,,,
8,"Oh no, he will be using FB on his computer... I don't think I'm ready to introduce my dad to the ""joys"" of mobile computing yet. ",False,False,t1_cqjs2hd,Felinomancy,,0,1429634479,t5_2qpec,t3_33cpfo,t1_cqjrx7g,1,1432519035,0,0,cqjs2hd,Blind,1,,,,
9,"Argh i feel you! Mine was very similar, the optometrist told the woman to do this test on me, and i told her before we started that I have no peripheral vision - but she kept pausing it and telling me to do the test properly. It made me teary and snappy. Then going back to the optometrist he was just like ""well are you happy? got what you wanted?"" I felt like i was being attacked and that people were all cynical of my really bad results despite almost 10 years of RP being recorded on my files, and the people doing the tests were completely naive, why would you be administering a field vision test if you have no knowledge of conditions that could mean the results are shit? I wanted to slap everyone.
the optometrist didn't understand it either? that is so ridiculous and stupid. I'm sorry you had such a shit experience. did you even get the field vision test results? It makes the whole situation which is already so difficult so much worse when you have to keep explaining and justifying yourself. 

",False,False,t1_cqtdlth,WhimsicalCat,,0,1430358489,t5_2qpec,t3_334irp,t1_cqrggm4,1,1432684635,0,0,cqtdlth,Blind,1,,,,
10,"Good questions.
I answered.
I'm comfortable askign strangers in twitter or reddit to explain to me what's in a picture.
But i'm extremely uncomfortable when i go out to see a movie when i really shluld ask for audio description headset. :( (and the cinema i go even alone to does not have them).
I'm very uncomfortable asking anyone help with reading papers or documents. 
I'm extremely uncomfortable when I see any doctors or medical staff. 
I can't do grocery shopping alone, but I'm glad my other half is a good driver and has patience with me when we shop with a list.",False,False,t1_cqad5r8,Unuhi,,0,1428888191,t5_2qpec,t3_32clsw,t3_32clsw,1,1432356372,0,0,cqad5r8,Blind,1,,,"Good questions.
I answered.
I'm comfortable askign strangers in twitter or <PERSON> to explain to me what's in a picture.
But i'm extremely uncomfortable when i go out to see a movie when i really shluld ask for audio description headset. :( (and the cinema i go even alone to does not have them).
I'm very uncomfortable asking anyone help with reading papers or documents. 
I'm extremely uncomfortable when I see any doctors or medical staff. 
I can't do grocery shopping alone, but I'm glad my other half is a good driver and has patience with me when we shop with a list.","[{'start': 75, 'end': 83, 'entity_type': 'PERSON', 'text': '<PERSON>', 'operator': 'replace'}]"
11,"Even if this petition were to go through, I don't really see how making the Steam client accessible would help - the games themselves would still be inaccessible, and you'd have to petition every individual developer for updates.

To that end, I think it would be better to focus on a blind specific gaming service instead.  I've actually been working with some blind developers to set up something similar to steam, hopefully to drive more audiogame development and get more titles out there.  We should have the first titles out in the next few months.",False,False,t1_cqahdan,indent,,0,1428896363,t5_2qpec,t3_32bryx,t3_32bryx,1,1432358356,0,0,cqahdan,Blind,1,,,,
12,"Look for a local NFB or vision rehab place.
Get some cane training - or train yourself from the internet or just try different things...

It'll be awkward.
Some days and some light situations you'll benefit from the cane - other times it's fine without it.
Learn to laugh at yourself, and find local blinky friends.

This week in my boring life:
- I spilled freshly ground coffee on kitchen floor - oops but floor smelled good after
- a few days a sharpie and my dyson were smarter than I 
- I was looking for my jacket for a week... It was in living room, in a pretty central spot
- I nearly fell on the firelane painted lane (it was brown! I didn't see it) like 20 feet from my front door, while returning from a run. That paint had nearly 1/2 inch (1cm) height difference from the street 
Oh, I did get some green fishing reflective tape so I could cover the terrible red part of the ""selfie stick"".

Oh, look at /r/colorblind too.
It's different challenges with them, but you can always use the ""what color is this?"" to your sdvantage. It's a bit less frightening for the others, so ""oh, you're just colorblind"" can be a refreshing reaction.",False,False,t1_cqi41n8,Unuhi,,0,1429498277,t5_2qpec,t3_334irp,t1_cqhygci,1,1432490247,0,0,cqi41n8,Blind,1,,,"Look for a local NFB or vision rehab place.
Get some cane training - or train yourself from the internet or just try different things...

It'll be awkward.
Some days and some light situations you'll benefit from the cane - other times it's fine without it.
Learn to laugh at yourself, and find local blinky friends.

This week in my boring life:
- I spilled freshly ground coffee on kitchen floor - oops but floor smelled good after
- a few days a sharpie and my dyson were smarter than I 
- I was looking for my jacket for a week... It was in living room, in a pretty central spot
- I nearly fell on the firelane painted <PERSON> (it was brown! I didn't see it) like 20 feet from my front door, while returning from a run. That paint had nearly 1/2 inch (1cm) height difference from the street 
Oh, I did get some green fishing reflective tape so I could cover the terrible red part of the ""selfie stick"".

Oh, look at /r/colorblind too.
It's different challenges with them, but you can always use the ""what color is this?"" to your sdvantage. It's a bit less frightening for the others, so ""oh, you're just colorblind"" can be a refreshing reaction.","[{'start': 622, 'end': 630, 'entity_type': 'PERSON', 'text': '<PERSON>', 'operator': 'replace'}]"
13,"My thoughts, exactly.  I'm waiting for the gushing mainstream media coverage of this, where they talk about how wonderful Netflix is, and never mention that it took over 3 years of constant lobbying, with multiple refusals by Netflix themselves, even though they've supported alternate audio for other languages for years.  Also, they make no mention of even attempting to make the website accessible; the only place Netflix even works is on the Apple TV.  Even the IPhone app has serious issues.  

On the other hand, constant negativity won't help, either.  Let's support the victories!",False,False,t1_cqc7ny4,fastfinge,,0,1429034866,t5_2qpec,t3_32l5ds,t1_cqc6vzo,2,1432388345,0,0,cqc7ny4,Blind,2,,,,
14,"The cards are dealt face up and the dealer announces the cards, both yours and theirs, as they are revealed. Not all dealers are good about remembering to do this, but it is something they have all been trained to do. If you have a crummy dealer, move to another table. 

The dealer is under no obligation to tell you your total unless you've busted though some will read the hand rather than the specific cards, ie. They will say ""16"" rather than ""9 and 7"" or ""7 or 17"" rather than ""ace and 6"". This can be good and bad. We have had dealers who read a pair of 8's as ""16"" and failed to mention it was a very desirable pair against a low dealer card. Others at the table spoke up and urged us to split rather than stand.",False,False,t1_cpz5jac,bondolo,Sighted Spouse,0,1428001357,t5_2qpec,t3_317kj0,t1_cpz4d6s,1,1432159179,0,0,cpz5jac,Blind,1,,,,
15,"The valve corporation works in a cabal type system where ideas are floated around the company and as they build up supporters they work to unanimously movie idea forward. I don't know if a petition will do anything about this, but I do have friends who work at valve and at other gaming companies around the same area that may help get the idea started within the company. I miss all of my games purchased through my steam account, but gaining access to them again and to more accessible games would be fantastic.

Steam is on the Mac, so there may be voiceover potential there for future updates…",False,False,t1_cqdmt7p,Marconius,,0,1429135047,t5_2qpec,t3_32bryx,t3_32bryx,1,1432412867,0,0,cqdmt7p,Blind,1,,,"The valve corporation works in a cabal type system where ideas are floated around the company and as they build up supporters they work to unanimously movie idea forward. I don't know if a petition will do anything about this, but I do have friends who work at valve and at other gaming companies around the same area that may help get the idea started within the company. I miss all of my games purchased through my steam account, but gaining access to them again and to more accessible games would be fantastic.

Steam is on the <PERSON>, so there may be voiceover potential there for future updates…","[{'start': 531, 'end': 539, 'entity_type': 'PERSON', 'text': '<PERSON>', 'operator': 'replace'}]"
16,Look into braille displays and depending on your needs into braille notetakers which can be described as braille PDAs.,False,False,t1_cqekwpq,NationalBraillePress,,0,1429208462,t5_2qpec,t3_32rel0,t3_32rel0,1,1432429287,0,0,cqekwpq,Blind,1,,,,
17,"I'm blind and I actually play Alteraeon. I believe there is a subreddit called /r/alteraeon, but it's pretty much abandon. But you could definatly promote it here I assume. Youcould also go to other gaming sus and try to get sighted people interested.",False,False,t1_cqas1h0,Nighthawk321,,0,1428931750,t5_2qpec,t3_312ast,t3_312ast,1,1432363526,0,0,cqas1h0,Blind,1,,,"I'm blind and I actually play Alteraeon. I believe there is a subreddit called /r/alteraeon, but it's pretty much abandon. But you could definatly promote it here I assume. <PERSON> also go to other gaming sus and try to get sighted people interested.","[{'start': 173, 'end': 181, 'entity_type': 'PERSON', 'text': '<PERSON>', 'operator': 'replace'}]"
18,"Sorry about that! We are using Qualtric's survey software since it was required for our class. But you're right. We should have checked how accessible it was via mobile and screen readers before we launched it.  If you know of any other survey platforms that perform better let me know, and we'll try launching a second iteration. And of course we'll keep looking for a better solution as well",False,False,t1_cqbo3kc,Nick_w_c,,0,1428985915,t5_2qpec,t3_32clsw,t1_cqasols,1,1432378916,0,0,cqbo3kc,Blind,1,,,,
19,"I got the results but only after I specifically asked.  I couldn't see anything at the time so I snapped pictures on my phone to look at while the guy was off checking that the girl didn't make a mistake then went back yesterday and made them give me a copy.
Best part of the whole visit was when I was explaining (defending myself) about why I had not been in sooner because it is a super emotional experiance for me (it's not like I ever get good results) and the optometrist goes ""get over it ""  congrats I will find myself a new ""retinal specialist""  maybe one who has a clue this time.",False,False,t1_cqtfnan,nomorechocolatebars,,0,1430361935,t5_2qpec,t3_334irp,t1_cqtdlth,1,1432685597,0,0,cqtfnan,Blind,1,,,,
20,Not true at all. Netflix has worked on Android for a good two years now.,False,False,t1_cqcu6yz,jage9,,0,1429073244,t5_2qpec,t3_32l5ds,t1_cqc7ny4,1,1432399171,0,0,cqcu6yz,Blind,1,,,,
21,I can't wait ro get a chance to meet him in person one day :),False,False,t1_cqh1ghf,Unuhi,,0,1429406344,t5_2qpec,t3_332zhs,t1_cqh14i8,1,1432471771,0,0,cqh1ghf,Blind,1,,,,
22,"Casinos will always deal multi-deck blackjack face up if you ask. If the dealer at table you sit down at doesn't know or refuses just ask for the pit boss. We've never had a problem. There has been increasing reluctance to deal single deck face up in recent years. Some places still will, others will not.

Poker is harder. I haven't heard, outside of specific tournaments for blind players, of any solution for reading players their hole cards.",False,False,t1_cpz1yke,bondolo,Sighted Spouse,0,1427994923,t5_2qpec,t3_317kj0,t3_317kj0,1,1432157423,0,0,cpz1yke,Blind,1,,,,
23,"The app works currently, though it still has minor issues from time to time.",False,False,t1_cqpwi9t,jage9,,0,1430105876,t5_2qpec,t3_33dc94,t1_cqkskdu,1,1432624725,0,0,cqpwi9t,Blind,1,,,,
24,"I've taken surveys built in Survey Monkey and Google Docs that have been accessible.  But I've never created a survey myself, so from the perspective of the creators, I don't know if they did anything special on those platforms to make sure they were accessible.  ",False,False,t1_cqbxjfh,fastfinge,,0,1429018037,t5_2qpec,t3_32clsw,t1_cqbo3kc,1,1432383433,0,0,cqbxjfh,Blind,1,,,,
25,"I'm on 8.3 right now.  But when I last tested Netflix, I was on the last version of IOS 7, and had the same or similar bugs.",False,False,t1_cqdfy2q,fastfinge,,0,1429124659,t5_2qpec,t3_32l5ds,t1_cqd9bbn,1,1432409562,0,0,cqdfy2q,Blind,1,,,,
26,"He's usually on Monday nights:

http://vaughnlive.tv/hankandjim",False,False,t1_cqhs1yc,BeyondKen,,0,1429475942,t5_2qpec,t3_332zhs,t1_cqhfmeg,2,1432484527,0,0,cqhs1yc,Blind,2,,,"He's usually on Monday nights:

<URL>","[{'start': 32, 'end': 37, 'entity_type': 'URL', 'text': '<URL>', 'operator': 'replace'}]"
27,"I'm thinking maybe it has to do with the audio ducking feature in voiceover?  Next step is to turn that off, and see if that makes it work with my headset, or makes it worse, or something.  I know some other apps I run freak out voiceover, and it can't duck the volume of audio from those apps, frequently.  I don't really care, as I have an Apple TV, so never use Netflix on my phone anyway.  But now I'm curious.  ",False,False,t1_cqdx0i0,fastfinge,,0,1429151799,t5_2qpec,t3_32l5ds,t1_cqdjmyd,1,1432417816,0,0,cqdx0i0,Blind,1,,,,
28,"I was part of a trail group for the trekker breeze about four years ago, we basically got to take it around town for a couple of hours and then gave our thoughts on it. Honestly, I would say that if you are comfortable with Google Maps then there is no point in changing - from memory I can not remember any significant difference between the two apart from the obvious lack of a screen on the trekker breeze. ",False,False,t1_cqmecff,kroro7,,0,1429821002,t5_2qpec,t3_33jmfg,t3_33jmfg,1,1432564268,0,0,cqmecff,Blind,1,,,,
29,"Personally I just bought a good book (mice and men) from http://www.braillebookstore.com/Books-for-Adults

Then I used http://en.wikipedia.org/wiki/English_Braille to translate. It's slow going at first, but not too bad. http://en.wikipedia.org/wiki/English_Braille#Abbreviations this part was the most useful. ",False,False,t1_cqsv4p2,Corm,,0,1430329631,t5_2qpec,t3_33k5if,t3_33k5if,1,1432675777,0,0,cqsv4p2,Blind,1,,,"Personally I just bought a good book (mice and men) from <URL>

Then I used <URL> to translate. It's slow going at first, but not too bad. <URL> this part was the most useful. ","[{'start': 139, 'end': 144, 'entity_type': 'URL', 'text': '<URL>', 'operator': 'replace'}, {'start': 76, 'end': 81, 'entity_type': 'URL', 'text': '<URL>', 'operator': 'replace'}, {'start': 57, 'end': 62, 'entity_type': 'URL', 'text': '<URL>', 'operator': 'replace'}]"
30,"I hope there is.
Because plain text will suffice...
There are plenty of NFB and other vision activists in Boston area... Lucky y'alls.",False,False,t1_cq1isok,Unuhi,,0,1428197903,t5_2qpec,t3_3137gv,t3_3137gv,1,1432201280,0,0,cq1isok,Blind,1,,,"I hope there is.
Because plain text will suffice...
There are plenty of NFB and other vision activists in <LOCATION> area... <PERSON>.","[{'start': 125, 'end': 133, 'entity_type': 'PERSON', 'text': '<PERSON>', 'operator': 'replace'}, {'start': 106, 'end': 116, 'entity_type': 'LOCATION', 'text': '<LOCATION>', 'operator': 'replace'}]"
31,Who locks a guide dog in the trunk of a car?,False,False,t1_cqjw5mx,alwaysoz,,0,1429640696,t5_2qpec,t3_33dc94,t3_33dc94,2,1432521031,0,0,cqjw5mx,Blind,2,,,,
32,"At a new place, it can be overwhelming for me. My father has been hospitalized so many times at one hospital I can find my way very easily. 

That being said, I have had multiple doctors give me printouts of information. That has certainly been a WTF moment. ",False,False,t1_cqrmt51,thatsnotgneiss,Chronic Bilateral Iridiocyclitis/low vision,0,1430241501,t5_2qpec,t3_344x3k,t3_344x3k,2,1432654586,0,0,cqrmt51,Blind,2,,,,
33,"Iʻd love a puppy like that. :)
(Although a sighted dog would probably be a bit more practical for my needs)",False,False,t1_cqldi0c,Unuhi,,0,1429743819,t5_2qpec,t3_33gyr9,t3_33gyr9,1,1432546555,0,0,cqldi0c,Blind,1,,,"<PERSON> love a puppy like that. :)
(Although a sighted dog would probably be a bit more practical for my needs)","[{'start': 0, 'end': 8, 'entity_type': 'PERSON', 'text': '<PERSON>', 'operator': 'replace'}]"
34,"Smartphone: Unfortunately I don't personally know any blind Galaxy users but everyone who I know who uses a touch screen phone is successful in navigating their phones. There are books available in various formats including braille and Daisy that give you instructions on how to navigate your iPhone and what Apps you might find useful.

You can also find information on using Android while blind [here](http://eyes-free.googlecode.com/svn@325/trunk/documentation/android_access/index.html)

The Internet: Again there are books on how to navigate iOS and Windows computers in various formats. There are books on how to use google, and how to tweet, and emails. 

[Here](http://www.nbp.org/ic/nbp/process.html?subcat_id=4&amp;heading=Adult%20Books--Computers%20%26%20Technology&amp;mv_nextpage=publications%2fbrowse_results&amp;mv_todo=return) are some of the publications that we carry.",False,False,t1_cqsz02m,NationalBraillePress,,0,1430335276,t5_2qpec,t3_33cpfo,t3_33cpfo,1,1432677671,0,0,cqsz02m,Blind,1,,,"Smartphone: Unfortunately I don't personally know any blind Galaxy users but everyone who I know who uses a touch screen phone is successful in navigating their phones. There are books available in various formats including braille and <PERSON> that give you instructions on how to navigate your iPhone and what Apps you might find useful.

You can also find information on using Android while blind [here](<URL>)

The Internet: Again there are books on how to navigate iOS and Windows computers in various formats. There are books on how to use google, and how to tweet, and emails. 

[Here](<URL>) are some of the publications that we carry.","[{'start': 593, 'end': 598, 'entity_type': 'URL', 'text': '<URL>', 'operator': 'replace'}, {'start': 407, 'end': 412, 'entity_type': 'URL', 'text': '<URL>', 'operator': 'replace'}, {'start': 236, 'end': 244, 'entity_type': 'PERSON', 'text': '<PERSON>', 'operator': 'replace'}]"
35,"I've heard of cane defense classes, but a real life Dare Devil!(sort of?) Awesome.

I need to show these videos to my mom, maybe it'll give her some motivation and inspiration to branch out her interests.",False,False,t1_cqj53mb,Zensune,Sighted Son,0,1429578218,t5_2qpec,t3_33a8wz,t3_33a8wz,1,1432508059,0,0,cqj53mb,Blind,1,,,,
36,"I wonder if they ever fixed the app?  It had some serious problems on IOS for a while, so I stopped using it, and then I moved to a city where it isn't available.  I haven't heard Twitter complaining with every update, so they must have.  ",False,False,t1_cqkskdu,fastfinge,,0,1429710954,t5_2qpec,t3_33dc94,t3_33dc94,1,1432536584,0,0,cqkskdu,Blind,1,,,,
37,Awesome feedback - thanks again for your time :-),False,False,t1_cqf4xty,rendesr,,0,1429242937,t5_2qpec,t3_32ohq2,t1_cqf1vvh,1,1432438867,0,0,cqf4xty,Blind,1,,,,
38,Would you mind having a phone call with me in the near future?,False,False,t1_cq3mtfm,pros599,,0,1428369720,t5_2qpec,t3_31cd8i,t1_cq0emwe,1,1432237805,0,0,cq3mtfm,Blind,1,,,,
