,body,score_hidden,archived,name,author,author_flair_text,downs,created_utc,subreddit_id,link_id,parent_id,score,retrieved_on,controversiality,gilded,id,subreddit,ups,distinguished,author_flair_css_class,anonymized_body,anonymized_masks
97,"/u/geoffisblind put it perfectly, I couldn't have said it better myself.

It's amazing how much you adapt &amp; adjust.

When I lost most of my sight last year (stroke during heart procedure) I thought my gaming days were over - I only have tunnel vision on my right side &amp; I'm totally blind at night/low light.

1yr later, after changing monitor to one with a square screen, relearning how to 'look' around with the mouse since I only see the middle of the screen - I can now play shooters again.  Completed FarCry 4, All the Borderlands games.

I also have mobility problems and can only walk about 20yds or so - again after relearning how to look around and scan my environment, I'm now able to get out on a mobility scooter and not stay trapped in the house.

It's only natural to be worried - I came close to a complete breakdown.  In the space of one week I lost most of my sight, my cat died just short of his 26th birthday and we found out my father had a massive brain tumour that took up the entire left side of his skull.  Also support for people with sudden sight loss is abysmal in the UK so I was basically dumped at home with no support or knowing how to cook/function on a day to day basis.

But I coped and now enjoy 99% of the things I used to.  Made my own latex prosthetics for a Halloween outfit and have taken up making latex masks as a hobby - something I never though about even when I had full sight.

If you're struggling with your phone - I've heard good things about the Iphone and blind users.  If it's out of your price range (like me), I bought a Windows phone - Nokia 635.  Only cost me £60 in the UK although I think it's almost 1/2 that price if you're in the US.   Cortana (voice activated assistant) works pretty well, you can dictate &amp; listen to text messages, search the internet by voice, etc.    You can also have buttons fill the width of the screen, so they are easy to see.  My home screen has just 4 buttons that fill the height/width of the screen - Make call, phonebook, Text message, Cortana",,,,impablomations,Homonymous Hemianopsia,,1448730871,t5_2qpec,t3_3uknad,t3_3uknad,1,1450083219,0,0,cxfu7n9,Blind,1,,blue1,"<USER> put it perfectly, I couldn't have said it better myself.

It's amazing how much you adapt &amp; adjust.

When I lost most of my sight last year (stroke during heart procedure) I thought my gaming days were over - I only have tunnel vision on my right side &amp; I'm totally blind at night/low light.

1yr later, after changing monitor to one with a square screen, relearning how to 'look' around with the mouse since I only see the middle of the screen - I can now play shooters again.  Completed FarCry 4, All the <LOCATION> games.

I also have mobility problems and can only walk about 20yds or so - again after relearning how to look around and scan my environment, I'm now able to get out on a mobility scooter and not stay trapped in the house.

It's only natural to be worried - I came close to a complete breakdown.  In the space of one week I lost most of my sight, my cat died just short of his 26th birthday and we found out my father had a massive brain tumour that took up the entire left side of his skull.  Also support for people with sudden sight loss is abysmal in the <LOCATION> so I was basically dumped at home with no support or knowing how to cook/function on a day to day basis.

But I coped and now enjoy 99% of the things I used to.  Made my own latex prosthetics for a Halloween outfit and have taken up making latex masks as a hobby - something I never though about even when I had full sight.

If you're struggling with your phone - I've heard good things about the Iphone and blind users.  If it's out of your price range (like me), I bought a Windows phone - Nokia 635.  Only cost me £60 in the <LOCATION> although I think it's almost 1/2 that price if you're in the <LOCATION>.   <PERSON> (voice activated assistant) works pretty well, you can dictate &amp; listen to text messages, search the internet by voice, etc.    You can also have buttons fill the width of the screen, so they are easy to see.  My home screen has just 4 buttons that fill the height/width of the screen - Make call, phonebook, Text message, <PERSON>","[{'start': 2054, 'end': 2062, 'entity_type': 'PERSON', 'text': '<PERSON>', 'operator': 'replace'}, {'start': 1718, 'end': 1726, 'entity_type': 'PERSON', 'text': '<PERSON>', 'operator': 'replace'}, {'start': 1704, 'end': 1714, 'entity_type': 'LOCATION', 'text': '<LOCATION>', 'operator': 'replace'}, {'start': 1632, 'end': 1642, 'entity_type': 'LOCATION', 'text': '<LOCATION>', 'operator': 'replace'}, {'start': 1093, 'end': 1103, 'entity_type': 'LOCATION', 'text': '<LOCATION>', 'operator': 'replace'}, {'start': 522, 'end': 532, 'entity_type': 'LOCATION', 'text': '<LOCATION>', 'operator': 'replace'}, {'start': 0, 'end': 6, 'entity_type': 'USER', 'text': '<USER>', 'operator': 'replace'}]"
98,"I really have no clue what the timeline is on getting certain kinds of help after an event like this with regards to safety.  Orientation and mobility training on a white cane will be really important when he is safe to walk, you will want an orientation and mobility specialist to help with this.  I would also start looking into accessible technology, learning how to use a screen reader will be important for making sure he can still function on a computer.  Maybe start looking into learning to read Braille?  You can also get in touch with some local non-profits/ the Department of Social Services Rehabilitation Services for the Blind as they will probably be able to direct you to, or provide you with more resources.  I am not an expert on any of these things but those are the things that jump out at me in terms of getting back on his feet.

&amp;nbsp;

I hope everything works out, these kinds of situations are horrible but I'm glad there are people like you who can help others get back on their feet after these kinds of traumatic events.  Best of luck to you and your patient :)",,,,geoffisblind,LCA (Low Vision),,1447197976,t5_2qpec,t3_3sc0z5,t3_3sc0z5,2,1449725984,0,0,cwvwayy,Blind,2,,blue1,,
99,I honestly hope her parents didn't allow that to happen! There has to be some consumer agency that will help them out with the process. This is just unacceptable. ,,,,aam22,,,1448249637,t5_2qpec,t3_3ts71u,t1_cx9rkvv,2,1449965552,0,0,cx9rnpw,Blind,2,,,,
100,"This is very unfortunate. I was under the impression that under the rules of the ADA, cities with public transportation are required to have a separate service (paratransit) for disabled passengers who can not use their traditional public transportation system. My city has one that is not separately funded, it's funded through the normal transportation budget.

This seems very wrong to me. Sad!",,,,homeschooled,sighted significant other,,1447950801,t5_2qpec,t3_3tend6,t3_3tend6,2,1449897566,0,0,cx5tvdd,Blind,2,,blue2,,
101,I'm an O&amp;M instructor and I don't think I have spent only 5 hours with any of my clients. I mostly teach adults who have lost their vision and go through the whole training (depending on their needs and goals). I would definitely request more hours. Street crossings alone can take up to 5-6 classes (depending on abilities and learning styles). I hope you get the time you need. By the end of your program you should feel confident in your abilities and comfortable traveling in your community. ,,,,aam22,,,1448248982,t5_2qpec,t3_3sfnhl,t3_3sfnhl,1,1449965369,0,0,cx9r9sk,Blind,1,,,,
102,I'm pretty sure I had 20-40 hours with my instructor. We practiced a bunch of routes in my neighborhood. Finding places I go frequently. Crossing streets. A lot of practicing street crossing. If after your next session he says ta time to cut you loose talk to the organization you are working with and request more hours and a different instructor.,,,,0mgitsrachel,,,1447270627,t5_2qpec,t3_3sfnhl,t3_3sfnhl,1,1449742258,0,0,cwwu5t0,Blind,1,,,,
103,"Loud noises in a place where i'm at: uncomfortable, makes it harder to hear what the others say. And i can't hear what happens from the other sounds.
Also if it's quiet but i don't know who else are around when  i'm talking with someone it makes me feel uncomfortable. I don't like people eavesdropping so that's a bit of an issue in silent environments.

Email feels nicer than on phone because people can finish their thoughts and compose their full thoughts and stories. And you don't get interrupted like on phone.

Perhaps one more reason for disliking phone is i used to need to talk with a lot pf people on the phone and fix their problems.
Some customers used to yell (because of whatever problem unrelated to me: i wasn't even in their country).
Then there were the ones who demanded princess treatment just because their (entitlement syndrome).
And those deep sights that I dreaded.
Or those UK polite voices that ... have the UK politeness that really isn't and that's complicated.
And all those Bangalore voices and Chinese and South African accents...

Now most voices on the phone are from here in US, from native speakers of English, and I'm not in the mood to usually figure out who they are or whether i need to tell them anything personal. 

How i judge the voices... Subconscious mostly, i think?
Sometimes you must know someone sounds sincere. 
While often people who try to give the very polite and turstworthy sounding voice (in their job especially) fail. 
If in doubt, drop in a few self-depracating jokes and see if they have a good reaction. 
Or ask them something, ... Catching lies is a lot more complicated without being able to see the body language. Especially when there isn't the benefit of first language either, so odd expressions pass my sieve.",,,,Unuhi,,,1448068251,t5_2qpec,t3_3tiofx,t1_cx7h1o8,1,1449927070,0,0,cx7jdaq,Blind,1,,,"Loud noises in a place where i'm at: uncomfortable, makes it harder to hear what the others say. And i can't hear what happens from the other sounds.
Also if it's quiet but i don't know who else are around when  i'm talking with someone it makes me feel uncomfortable. I don't like people eavesdropping so that's a bit of an issue in silent environments.

Email feels nicer than on phone because people can finish their thoughts and compose their full thoughts and stories. And you don't get interrupted like on phone.

Perhaps one more reason for disliking phone is i used to need to talk with a lot pf people on the phone and fix their problems.
Some customers used to yell (because of whatever problem unrelated to me: i wasn't even in their country).
Then there were the ones who demanded princess treatment just because their (entitlement syndrome).
And those deep sights that I dreaded.
Or those <LOCATION> polite voices that ... have the <LOCATION> politeness that really isn't and that's complicated.
And all those <LOCATION> voices and Chinese and South African accents...

Now most voices on the phone are from here in <LOCATION>, from native speakers of English, and I'm not in the mood to usually figure out who they are or whether i need to tell them anything personal. 

How i judge the voices... Subconscious mostly, i think?
Sometimes you must know someone sounds sincere. 
While often people who try to give the very polite and turstworthy sounding voice (in their job especially) fail. 
If in doubt, drop in a few self-depracating jokes and see if they have a good reaction. 
Or ask them something, ... Catching lies is a lot more complicated without being able to see the body language. Especially when there isn't the benefit of first language either, so odd expressions pass my sieve.","[{'start': 1129, 'end': 1139, 'entity_type': 'LOCATION', 'text': '<LOCATION>', 'operator': 'replace'}, {'start': 1023, 'end': 1033, 'entity_type': 'LOCATION', 'text': '<LOCATION>', 'operator': 'replace'}, {'start': 945, 'end': 955, 'entity_type': 'LOCATION', 'text': '<LOCATION>', 'operator': 'replace'}, {'start': 902, 'end': 912, 'entity_type': 'LOCATION', 'text': '<LOCATION>', 'operator': 'replace'}]"
104,"Just to clarify, when you talk about comfort in an in-person situation with respect to the noise level, does a higher noise level correspond with less comfort, and vice versa?

Also, what do you mean when you say that email makes it easier for you because you can ""be more precise and have a better conversation?"" Can you be a bit more specific?

And lastly, can you elaborate more on how you use peoples' voices to make judgments? Or is it kind of a subconscious thing?",,,,OzCello,,,1448063632,t5_2qpec,t3_3tiofx,t1_cx7fbfv,1,1449925911,0,0,cx7h1o8,Blind,1,,,,
105,"Thank you for your reply. 

I like the idea of turning the coloring pages into a puzzle for her.  Unfortunately, I'm working on what is pretty much non-existent budget, so have to find what I have available.  

I really need to take a couple minutes to talk to her mom and identify what her current abilities are - There really wasn't any kind of introduction to her or her abilities - the first day I was in the classroom, her mom brought her in, set her at the table with her headset and left (noise is a trigger with her autism as well), and that's been pretty par for the course, so I've really been learning on my own.  
  ",,,,justme753,Educator,,1448482048,t5_2qpec,t3_3u92wg,t1_cxcxh7b,1,1450020339,0,0,cxcy3lv,Blind,1,,blue2,,
106,"It must be quite a while ago since he tried Reaper, it is one of the most feature rich DAWs around.  It's certainly the most customisable, as it uses it's own custom scripting engine.

Take a peek at these to see what I mean

http://www.houseofwhitetie.com/reaper/walter_themers_guide.pdf

http://www.reaper.fm/sdk/walter/walter.php

If he is unable to raise the necessary funds, REAPER might be a viable option as customising it for his use would be a hell of a lot easier than Cubase.

Another one I've heard good things about is Samplitude, a DAW developed with the help of the Frankfurter Stiftung für Blinde und Sehbehinderte (Frankfurter foundation for the blind and visually impaired).

I used to use Cubase myself, I used it from its precursor (Pro24) and Cubase itself on the Atari ST, up until Version 6.  I've since jumped ship to one called Studio One - written by ex Steinberg devs as I was sick of Cubase stability issues and it being a general unstable memory hog.

Thankfully I still have some limited sight so I don't need to use a screen reader, just remapped controls and a small control surface.  I'd hate to navigate a DAW without any sight at all, editing must be a nightmare - he certainly has my utmost admiration for that!",,,,impablomations,Homonymous Hemianopsia,,1447795664,t5_2qpec,t3_3t4rdv,t1_cx3m38j,2,1449861860,0,0,cx3rbid,Blind,2,,blue1,"It must be quite a while ago since he tried <PERSON>, it is one of the most feature rich DAWs around.  It's certainly the most customisable, as it uses it's own custom scripting engine.

Take a peek at these to see what I mean

<URL>

<URL>

If he is unable to raise the necessary funds, REAPER might be a viable option as customising it for his use would be a hell of a lot easier than Cubase.

Another one I've heard good things about is Samplitude, a DAW developed with the help of the Frankfurter Stiftung für Blinde und Sehbehinderte (Frankfurter foundation for the blind and visually impaired).

I used to use Cubase myself, I used it from its precursor (Pro24) and Cubase itself on the Atari ST, up until Version 6.  I've since jumped ship to one called Studio One - written by ex <PERSON> devs as I was sick of Cubase stability issues and it being a general unstable memory hog.

Thankfully I still have some limited sight so I don't need to use a screen reader, just remapped controls and a small control surface.  I'd hate to navigate a DAW without any sight at all, editing must be a nightmare - he certainly has my utmost admiration for that!","[{'start': 788, 'end': 796, 'entity_type': 'PERSON', 'text': '<PERSON>', 'operator': 'replace'}, {'start': 235, 'end': 240, 'entity_type': 'URL', 'text': '<URL>', 'operator': 'replace'}, {'start': 228, 'end': 233, 'entity_type': 'URL', 'text': '<URL>', 'operator': 'replace'}, {'start': 44, 'end': 52, 'entity_type': 'PERSON', 'text': '<PERSON>', 'operator': 'replace'}]"
107,"Has he considered switching DAWs?

Reaper has 2 or 3 plugins that make it compatible with most screenreaders.

Sonar is accessible through use of a couple of plugins.

If he's on a Mac then ProTools is compatible with Voice Over and almost fully accessible.",,,,impablomations,Homonymous Hemianopsia,,1447768465,t5_2qpec,t3_3t4rdv,t3_3t4rdv,2,1449853012,0,0,cx396zw,Blind,2,,blue1,,
108,"I'm not sure of what happened after this. But maybe it can help your friend. 

http://www.mid-day.com/articles/iit-delhi-creates-affordable-smart-cane-for-the-blind/15506173
",,,,aam22,,,1448248539,t5_2qpec,t3_3sgq00,t3_3sgq00,1,1449965247,0,0,cx9r0je,Blind,1,,,"I'm not sure of what happened after this. But maybe it can help your friend. 

<URL>
","[{'start': 79, 'end': 84, 'entity_type': 'URL', 'text': '<URL>', 'operator': 'replace'}]"
109,Definitely talking to them about more instruction. I've crossed the street with my instructor present probably a dozen times. I still feel very leery of doing it by myself and I shouldn't feel like that.,,,,georgeQwashington,,,1447300382,t5_2qpec,t3_3sfnhl,t1_cwwu5t0,1,1449750873,0,0,cwxc0zy,Blind,1,,,,
110,"I decided to run a search through the sub to see if this had been mentioned and it seems as if it hasn't.  The National Federation of the Blind has a program where they offer fixed white canes free of charge to blind and visually impaired individuals.  Of course you should always seek professional training on how to properly navigate using a white cane, but if you have been interested in finding out if one can benefit you this could be a good first step.  Also, just as a matter of preference, many people (myself included) find that folding canes are much more convenient than fixed canes.  These are free though so it could be a good first step.",,,,geoffisblind,LCA (Low Vision),,1448927361,t5_2qpec,t3_3ux9a7,t3_3ux9a7,2,1450434981,0,0,cxii2kw,Blind,2,,blue1,,
111,"As a driver, let me go through some of these one at a time:

1) Speeding really isn't a problem.  IMHO the penalties are high enough, and raising them further doesn't really fix anything.

2) The driving tests have nothing at all to do with driving skill.  Having to take the test more regularly won't improve how people drive.

4) More incentives for carpooling aren't going to help, because there's no way to give people enough incentive to make it worth their time.  Even here in california, where the roads are terrible, I still don't bother to carpool - it's just not worth the effort.

5) This one is an infrastructure issue.  I don't know that law enforcement would ever be able to do that effectively.

6) Heck yeah, self driving cars are the way to go.  Self driving cars basically fix all the problems, all at once.

7) I don't think a non-qualified license is the correct way to handle self driving cars.  I'm pretty sure that set of problems will be solved a different way.

8) This is another area I don't think is necessary, but that's more because I think liability will be handled differently when we have these kinds of vehicles.  I wouldn't worry about this just yet.

9) Again, driving test reform is likely to do nothing but waste people's time.  It's not going to magically make people into better drivers.

10) Anti-cell phone laws already exist.  The problem isn't that it's illegal, the problem is that there's no way to catch enough people doing it for it to matter.  Again, a problem that goes away with self driving cars.

Based on this, if you have the ability to change something or sell people on an idea, I'd try to push self driving cars the hardest.  If you get that, almost all your other solutions aren't needed.  Plus, self driving cars would be awesome.",,,,indent,,,1446862453,t5_2qpec,t3_3rt6qq,t3_3rt6qq,2,1449648348,0,0,cwrec9f,Blind,2,,,"As a driver, let me go through some of these one at a time:

1) Speeding really isn't a problem.  IMHO the penalties are high enough, and raising them further doesn't really fix anything.

2) The driving tests have nothing at all to do with driving skill.  Having to take the test more regularly won't improve how people drive.

4) More incentives for carpooling aren't going to help, because there's no way to give people enough incentive to make it worth their time.  Even here in <LOCATION>, where the roads are terrible, I still don't bother to carpool - it's just not worth the effort.

5) This one is an infrastructure issue.  I don't know that law enforcement would ever be able to do that effectively.

6) Heck yeah, self driving cars are the way to go.  Self driving cars basically fix all the problems, all at once.

7) I don't think a non-qualified license is the correct way to handle self driving cars.  I'm pretty sure that set of problems will be solved a different way.

8) This is another area I don't think is necessary, but that's more because I think liability will be handled differently when we have these kinds of vehicles.  I wouldn't worry about this just yet.

9) Again, driving test reform is likely to do nothing but waste people's time.  It's not going to magically make people into better drivers.

10) Anti-cell phone laws already exist.  The problem isn't that it's illegal, the problem is that there's no way to catch enough people doing it for it to matter.  Again, a problem that goes away with self driving cars.

Based on this, if you have the ability to change something or sell people on an idea, I'd try to push self driving cars the hardest.  If you get that, almost all your other solutions aren't needed.  Plus, self driving cars would be awesome.","[{'start': 483, 'end': 493, 'entity_type': 'LOCATION', 'text': '<LOCATION>', 'operator': 'replace'}]"
112,"First, you apply for an NLS account. A doctor will fill a part of the application. You mail it in, they'll evaluate it, if you get appproved they'll call you amd you start from it.
I'm sure it'll depemd by state, but there are some basic players you can get on loan. 
You'll get a catalog every few months, in large print, and can request the audiobooks you want. They will mail the cartridges to your address, and you'll just drop them in a usps mailbox to return within 45 days.
You'll also get a URL for online bard account. The mobile app exists for iOS and android, and it's awesome. Download what you want, listen to whenever, keep if you like and have space.
And you can use also third party players like Victor.
On both NLS pkayers and BARD app you can set the speed up to 300%.
That is the major difference to other formats.

Bookshare is what a lot of people use too.

RNIB and many regular libraries use Overdrive. Audiobooks in that will work up to 2x speed, and the books will have an expiry date.

No harm in using multiple formats.

NLS books have a copy protections. (So much for Marrakesh treaty)",,,,Unuhi,,,1447387183,t5_2qpec,t3_3sm8ct,t3_3sm8ct,1,1449771807,0,0,cwyjnmd,Blind,1,,,"First, you apply for an NLS account. A doctor will fill a part of the application. You mail it in, they'll evaluate it, if you get appproved they'll call you amd you start from it.
I'm sure it'll depemd by state, but there are some basic players you can get on loan. 
You'll get a catalog every few months, in large print, and can request the audiobooks you want. They will mail the cartridges to your address, and you'll just drop them in a usps mailbox to return within 45 days.
You'll also get a URL for online bard account. The mobile app exists for iOS and android, and it's awesome. Download what you want, listen to whenever, keep if you like and have space.
And you can use also third party players like Victor.
On both NLS pkayers and BARD app you can set the speed up to 300%.
That is the major difference to other formats.

Bookshare is what a lot of people use too.

RNIB and many regular libraries use Overdrive. Audiobooks in that will work up to 2x speed, and the books will have an expiry date.

No harm in using multiple formats.

NLS books have a copy protections. (So much for <LOCATION> treaty)","[{'start': 1096, 'end': 1106, 'entity_type': 'LOCATION', 'text': '<LOCATION>', 'operator': 'replace'}]"
113,"The camera glasses are described in more detail at http://www.seeingwithsound.com/camera_glasses.htm, while The vOICe for Windows software for use with these glasses is available from http://www.seeingwithsound.com/winvoice.htm

There is also The vOICe for Android, available from Google Play at https://play.google.com/store/apps/details?id=vOICe.vOICe and described in more detail at http://www.seeingwithsound.com/android.htm
",,,,seeingwithsound,,,1447830235,t5_2qpec,t3_3t3b5e,t3_3t3b5e,2,1449871090,0,0,cx4akvf,Blind,2,,,"The camera glasses are described in more detail at <URL> while The vOICe for Windows software for use with these glasses is available from <URL>

There is also The vOICe for Android, available from Google Play at <URL> and described in more detail at <URL>
","[{'start': 251, 'end': 256, 'entity_type': 'URL', 'text': '<URL>', 'operator': 'replace'}, {'start': 213, 'end': 218, 'entity_type': 'URL', 'text': '<URL>', 'operator': 'replace'}, {'start': 139, 'end': 144, 'entity_type': 'URL', 'text': '<URL>', 'operator': 'replace'}, {'start': 51, 'end': 56, 'entity_type': 'URL', 'text': '<URL>', 'operator': 'replace'}]"
