,body,score_hidden,archived,name,author,author_flair_text,downs,created_utc,subreddit_id,link_id,parent_id,score,retrieved_on,controversiality,gilded,id,subreddit,ups,distinguished,author_flair_css_class,anonymized_body,anonymized_masks
194,"Blind people tend to be more expressionless and won't have as wide a range as expression as sighted peers unless taught from a young age to practice certain facial expressions. When you have sight, you learn a lot of these unspoken rules as you grow up simply by watching and copying, those of us who are blind miss a lot of those visual hints and thus won't know about them unless told. This is also why a lot of blind people can seem distant or unfriendly at first sight because we're not smiling a lot unless we know there's something to smile at- otherwise if you just sit around smiling at nothing you look like a retard on top of being blind lol.",,,,johnnytai,,,1448829229,t5_2qpec,t3_3umajf,t3_3umajf,1,1450105422,0,0,cxh33gb,Blind,1,,,,
195,I can't stand certain sites on my smartphone. The developers lock the text so it can't be enlarged. I just can't read them and have to leave. Not sure why they feel the need to lock the text size. ,,,,matt_may,,,1448007378,t5_2qpec,t3_3t5w41,t3_3t5w41,2,1449912798,0,0,cx6pn0b,Blind,2,,,,
196,"I would probably post to /r/Boston as well if you haven't already, you'd probably have an easier time finding someone there or someone who knows a visually impaired person who can help you.  I could give you information on riding public transit regularly as a bus commuter but not as a Boston/ MBTA specific commuter. ",,,,geoffisblind,LCA (Low Vision),,1446847230,t5_2qpec,t3_3rrx2n,t3_3rrx2n,2,1449644226,0,0,cwr5qcy,Blind,2,,blue1,,
197,"Fair enough! :P I think if novels get too creative with certain things, (unless they know the world is very different from our own like Harry Potter), then people won't take the book seriously. You have to be very careful and I think what you're going to do is going to work nicely. ",,,,God-Macabre,RP &amp; Short-Sightedness,,1448188568,t5_2qpec,t3_3tiw6c,t1_cx8wbwl,2,1449950724,0,0,cx8wr28,Blind,2,,blue1,"Fair enough! :P I think if novels get too creative with certain things, (unless they know the world is very different from our own like <PERSON>), then people won't take the book seriously. You have to be very careful and I think what you're going to do is going to work nicely. ","[{'start': 136, 'end': 144, 'entity_type': 'PERSON', 'text': '<PERSON>', 'operator': 'replace'}]"
198,"Absolutely!  Thanks for tagging, I'll add that to the list of things to do.",,,,geoffisblind,LCA (Low Vision),,1448314432,t5_2qpec,t3_3ty6e1,t1_cxa6nro,2,1449980035,0,0,cxalucg,Blind,2,,blue1,,
199,"As far as I know, my facial gestures and body language are exactly the same as everyone else, without any lessons or anything.  The only exceptions are that while I can smile naturally, I can't seem to smile for a camera; I just have to think of something happy, and then I smile, whereas if I try and smile on command, I have no idea what to do with my face.  Also, I can't catch someone's eye from across the room, for obvious reasons.  Lastly, I never ever wave, and rarely point.  But I don't think that has anything to do with nature vs nurture...waving just feels really strange to do, for me, and I'm never quite sure if I'm doing it properly and in the right direction at the right person and if they're even looking.  If that's a thing they teach children to do, I apparently missed that class, and as a 27 year old man I don't feel like asking at this late stage.  I can get buy perfectly without waving greetings and farewells at people.  And I rarely point because it's rare that I know exactly where something is with enough accuracy to point at it.  Plus, if someone else points at something, it doesn't help me, so when I'm trying to communicate with someone else, it doesn't often occur to me as a method of communication.  Describing the exact location of what I'm talking about just feels more natural to me.  ",,,,fastfinge,born blind,,1448743474,t5_2qpec,t3_3umajf,t3_3umajf,3,1450086608,0,0,cxg1dzb,Blind,3,,blue1,,
200,Kudos. I have two kids with RP. My wife's not impaired so she can drive. How do you get grocery or kids to school? ,,,,matt_may,,,1446963153,t5_2qpec,t3_3rpmja,t3_3rpmja,1,1449669802,0,0,cwsn1ew,Blind,1,,,,
201,"I think it would depend on what physical similarity it is. If it's just that their faces look similar, no, I don't think it would be possible through touch. However, if it's something pretty prominent like large nose, or long hair, tall with broad shoulders, or something like that that is allowing her to make that connection, then I think it could work. ",,,,colorshow,TVI/COMS grad student,,1447994851,t5_2qpec,t3_3tiw6c,t3_3tiw6c,2,1449910613,0,0,cx6l534,Blind,2,,blue1,,
202,"As a mobility instructor, I feel that this device, while interesting, gives too much information! I feel that the vibrations will be too distracting that that it will vibrate too much. 

Any BVI person here that has used this or something similar? I would love to hear feedback. ",,,,aam22,,,1448248245,t5_2qpec,t3_3t352g,t3_3t352g,1,1449965169,0,0,cx9quh8,Blind,1,,,,
203,"hears a few i didn't see in the comments:
* [Fedora Outlier](http://fedoraoutlier.com)  
Providing support for blind users on the OS X platform, IOS platform, Apple watch platform, and apple TV platform. More trainings to come soon.  
* [Wordpress from a Blind Guy Instruction](http://empoweringtheblind.com/beta/)  
Providing wordpress training from a blind person's point of view.",,,,payown,,,1447225895,t5_2qpec,t3_3dz14g,t3_3dz14g,1,1449733084,0,0,cwwaz0g,Blind,1,,,"hears a few i didn't see in the comments:
* [Fedora Outlier](<URL>)  
Providing support for blind users on the OS X platform, IOS platform, Apple watch platform, and apple TV platform. More trainings to come soon.  
* [Wordpress from a Blind Guy Instruction](<URL>)  
Providing wordpress training from a blind person's point of view.","[{'start': 259, 'end': 264, 'entity_type': 'URL', 'text': '<URL>', 'operator': 'replace'}, {'start': 61, 'end': 66, 'entity_type': 'URL', 'text': '<URL>', 'operator': 'replace'}]"
204,"I do have some limited vision on my right side, but in low light or at night time outside that dissapears too.

The 'training' also took place without a cane, as she forgot to bring it.  I ended up buying my own as she never came back, and the cane never arrived that was supposed to come.

I could be using it all wrong, I don't know, as I've pretty much had to teach myself how to use it.",,,,impablomations,Homonymous Hemianopsia,,1447294983,t5_2qpec,t3_3sc8qp,t1_cwx8wht,1,1449749437,0,0,cwx94as,Blind,1,,blue1,,
205,"It already exists.  Take a look at [Alter Aeon](http://www.alteraeon.com).  There's a blind specific client that mixes sounds, music, and text to describe the game world and help you navigate.",,,,indent,,,1446861779,t5_2qpec,t3_3rs84q,t3_3rs84q,1,1449648180,0,0,cwrdzdu,Blind,1,,,"It already exists.  Take a look at [Alter Aeon](<URL>).  There's a blind specific client that mixes sounds, music, and text to describe the game world and help you navigate.","[{'start': 48, 'end': 53, 'entity_type': 'URL', 'text': '<URL>', 'operator': 'replace'}]"
206,"Is this intended to be used in conjunction with a cane? Because I don't see how these bracelets would help with uneven sidewalks and curbs. Will they be able to sense signs or electrical boxes that are above ground so the cane doesn't hit them. But your face might? And lastly. Will they be cute? Cause. I would never wear anything that didn't match my personal style. 

I use my iPhone 6+ for most things. My biggest struggle is visiting places I've never been before or aren't familiar with. And I'm hoping that I will get a guide dog soon. Waiting for approval now. 
",,,,0mgitsrachel,,,1448137827,t5_2qpec,t3_3tpjuv,t3_3tpjuv,1,1449940154,0,0,cx8ahwt,Blind,1,,,,
207,Thanks for telling me! I changed it. It would help out out a lot if you could take it :),,,,datthepirate,,,1447865693,t5_2qpec,t3_3t7iip,t1_cx461el,1,1449877305,0,0,cx4nkm2,Blind,1,,,,
208,"Assistive Tech Project Officer here, could give you a few go-to's of mine if you want to message me.  Where are you based? Country/Region?",,,,LowVisionOnMission,,,1446565085,t5_2qpec,t3_3quglc,t1_cwjs6ls,1,1449571472,0,0,cwmxva4,Blind,1,,,,
209,"Familiar routes are nice then, because less frightening.
Then new fun routes.
And find some local blind friends :) if there's e.g. a local NFB or AFB chapter that has activity that could be a fun way to find friends and then just have fun together.",,,,Unuhi,,,1447392178,t5_2qpec,t3_3sfnhl,t1_cwylxtu,1,1449772956,0,0,cwym3fv,Blind,1,,,"Familiar routes are nice then, because less frightening.
Then new fun routes.
And find some local blind friends :) if there's e.g. a local NFB or <LOCATION> chapter that has activity that could be a fun way to find friends and then just have fun together.","[{'start': 146, 'end': 156, 'entity_type': 'LOCATION', 'text': '<LOCATION>', 'operator': 'replace'}]"
210,"Most natural emotions seem to be the same.
Happiness, joy, anger, disguest etc. That's at least wjat my therapist told me - fortunatelt I'm not her only VI client.

But there is a lot of place for variation as some faces are expressed only in some cultures. And in some cultures you are supposed to have a happy, smiling face all the time (US) whereas in some other cultures a blank face is the normal. 
I also think that ""rolleyes"" is a thing they only do in US (and where the same culture is strong) because I don't remember ever having seen that when I grew up (with what I could see, at least I'd have caught the eyes at short range)",,,,Unuhi,,,1448776872,t5_2qpec,t3_3umajf,t3_3umajf,1,1450095744,0,0,cxgiu1c,Blind,1,,,"Most natural emotions seem to be the same.
Happiness, joy, anger, disguest etc. That's at least wjat my therapist told me - fortunatelt I'm not her only VI client.

But there is a lot of place for variation as some faces are expressed only in some cultures. And in some cultures you are supposed to have a happy, smiling face all the time (<LOCATION>) whereas in some other cultures a blank face is the normal. 
I also think that ""rolleyes"" is a thing they only do in <LOCATION> (and where the same culture is strong) because I don't remember ever having seen that when I grew up (with what I could see, at least I'd have caught the eyes at short range)","[{'start': 468, 'end': 478, 'entity_type': 'LOCATION', 'text': '<LOCATION>', 'operator': 'replace'}, {'start': 340, 'end': 350, 'entity_type': 'LOCATION', 'text': '<LOCATION>', 'operator': 'replace'}]"
211,"We've gotten ourselves on iTunes (finally). You can check it out here: https://itunes.apple.com/us/podcast/the-blind-hour-podcast/id1060368525?mt=2

Or by searching in the iTunes store for ""The Blind Hour Podcast.""",,,,bhmode,The Blind Hour Podcast,,1448007391,t5_2qpec,t3_3tb5ls,t1_cx4pozm,1,1449912800,0,0,cx6pn51,Blind,1,,blue2,"We've gotten ourselves on iTunes (finally). You can check it out here: <URL>

Or by searching in the iTunes store for ""The Blind Hour Podcast.""","[{'start': 71, 'end': 76, 'entity_type': 'URL', 'text': '<URL>', 'operator': 'replace'}]"
212,"I have a Ruby XL. It's really great for me. However, I am not sure exactly the budget you guys have.",,,,thatsnotgneiss,Chronic Bilateral Iridiocyclitis/low vision,,1448312918,t5_2qpec,t3_3twt2f,t3_3twt2f,1,1449979523,0,0,cxakr7u,Blind,1,,blue1,,
213,"Hi:

It might be helpful if you said what country you're in. Things differ wildly from country to country; different organizations, different governments and laws, different funding methods, and so on.  ",,,,fastfinge,born blind,,1447197895,t5_2qpec,t3_3sc0z5,t3_3sc0z5,2,1449725962,0,0,cwvw98k,Blind,2,,blue1,,
214,"She has some functional vision.  She can see 60 font bold print.  The laptop is new to us this last couple of days, so I don't know yet about BookShare.  That would be an app already on the laptop?  I'm new to apple, so this is one of the reasons I'm looking for information.",,,,CallMeBoo,,,1446669291,t5_2qpec,t3_3rho1z,t1_cwo3rnf,1,1449599482,0,0,cwokblc,Blind,1,,,,
215,"Done.  I may have given a slightly too detailed answer in  the box at the end. :)

/r/servicedogs might be another good place to post your survey, as will as /r/disability",,,,impablomations,Homonymous Hemianopsia,,1448037340,t5_2qpec,t3_3t7iip,t1_cx6znzy,1,1449918031,0,0,cx70lra,Blind,1,,blue1,,
216,"/u/Unseen_Art,

&amp;nbsp;

I removed your post and wanted to provide an explanation.  You posted about the same thing twice in the same day.   I noticed that one link went to an official website and one went to an indiegogo (this one).  This one was removed because it had less upvotes and the other link stayed because it goes directly to the project's website.  If you would like to reference the indiegogo, feel free to leave a comment on your other post.  I understand that you probably didn't intend it to be spam, but it could be perceived this way.

&amp;nbsp;

I'm just going to pull two quotes directly from [Reddit's explanation of what constitutes spam](https://reddit.zendesk.com/hc/en-us/articles/204536499) that may be helpful for you to consider.
 
&gt;If your contribution to Reddit consists primarily of submitting links to a business that you run, own or otherwise benefit from, tread carefully.
 
&amp;nbsp;

&gt;Additionally, if you do not participate in other discussions or reply to comments and questions, you may be considered a spammer and banned from Reddit.

&amp;nbsp;

I don't think you are intentionally spamming, but please just be careful in the future.  No hard feelings, we just have to keep the sub clean :)  If you have any questions please feel free to reply or reach out to the rest of the moderation team and we would be happy to to help you out.

&amp;nbsp;

Have a great day!",,,,geoffisblind,LCA (Low Vision),,1447899963,t5_2qpec,t3_3t9vyl,t3_3t9vyl,1,1449887998,0,0,cx59ur4,Blind,1,moderator,blue1,"<USER>,

&amp;nbsp;

I removed your post and wanted to provide an explanation.  You posted about the same thing twice in the same day.   I noticed that one link went to an official website and one went to an indiegogo (this one).  This one was removed because it had less upvotes and the other link stayed because it goes directly to the project's website.  If you would like to reference the indiegogo, feel free to leave a comment on your other post.  I understand that you probably didn't intend it to be spam, but it could be perceived this way.

&amp;nbsp;

I'm just going to pull two quotes directly from [Reddit's explanation of what constitutes spam](<URL>) that may be helpful for you to consider.
 
&gt;If your contribution to Reddit consists primarily of submitting links to a business that you run, own or otherwise benefit from, tread carefully.
 
&amp;nbsp;

&gt;Additionally, if you do not participate in other discussions or reply to comments and questions, you may be considered a spammer and banned from Reddit.

&amp;nbsp;

I don't think you are intentionally spamming, but please just be careful in the future.  No hard feelings, we just have to keep the sub clean :)  If you have any questions please feel free to reply or reach out to the rest of the moderation team and we would be happy to to help you out.

&amp;nbsp;

Have a great day!","[{'start': 659, 'end': 664, 'entity_type': 'URL', 'text': '<URL>', 'operator': 'replace'}, {'start': 0, 'end': 6, 'entity_type': 'USER', 'text': '<USER>', 'operator': 'replace'}]"
217,"Book share is a website that some districts maintain a subscription with for their students. It's a good way to insure that kids have accessible leisure reading material. It's good for the kids because it allows them to check out the same books their peers have access to in the school library. It's pretty cheap for what you get too. 

Read2Go is the app that you have to use to access the books on bookshare on an Ipad, you can access the site through your browser  on a laptop but the app is much easier to use so I would suggest downloading it even if you aren't using a tablet. 

I would post this same question on the NOPBC facebook page. They have 1000's of members who are parents and teachers of the blind and and many blind adults and students who could point you in the right direction. It's really really active and the people in that group know their tech inside and out. I'll PM you a link.  ",,,,stupidpoopoohead,Mother of a Blind Child,,1446673826,t5_2qpec,t3_3rho1z,t1_cwokblc,1,1449601064,0,0,cwonogr,Blind,1,,blue2,"Book share is a website that some districts maintain a subscription with for their students. It's a good way to insure that kids have accessible leisure reading material. It's good for the kids because it allows them to check out the same books their peers have access to in the school library. It's pretty cheap for what you get too. 

Read2Go is the app that you have to use to access the books on bookshare on an Ipad, you can access the site through your browser  on a laptop but the app is much easier to use so I would suggest downloading it even if you aren't using a tablet. 

I would post this same question on the <PERSON> facebook page. They have 1000's of members who are parents and teachers of the blind and and many blind adults and students who could point you in the right direction. It's really really active and the people in that group know their tech inside and out. I'll PM you a link.  ","[{'start': 624, 'end': 632, 'entity_type': 'PERSON', 'text': '<PERSON>', 'operator': 'replace'}]"
218,"I live in St. Louis, Missouri.  Public transit has gotten much better but it is subject to bickering between municipal governments that has prevented further expansion of the rail system for years.  Buses average about 30 minutes per connection which means if one bus is off you are stuck for a while.  The operators seem pretty understanding of disability issues for the most part but on more than one occasion I've had a driver forget to let me off where I asked them to.  In addition I've had drivers make assumptions about my abilities and tell me they won't let me off at a certain place, even if it is a sanctioned stop.  This actually happened to me on Tuesday, I was riding in a part of the city I'm not normally in to go visit someone in the hospital, I asked the driver to let me off at an intersection to connect with the line that went to the hospital and he told me that he didn't feel comfortable letting me crossing that street with my visual impairment and that he would let me off further down where he was more comfortable doing so.  Which is great, but it's not what I asked him to do and it was kind of insulting.  This is aside from the fact that I missed my connection and had to wait for 30 minutes on the side of the road for the next bus.

&amp;nbsp;

The other issue I've had is a lack of modern integration, it seems like all of the decently sized cities in the US are getting some kind of smart card system to pay for transit easily, we haven't got that yet except for disposable, flimsy monthly passes that can be swiped.  The project is underway but behind schedule from what I understand.

&amp;nbsp;

My last problem is with fellow riders, people really like to try to help me without announcing that they are doing so.  Getting grabbed is an issue for me, but that's more of a social issue than a bus issue, I just notice it mostly when I'm riding.

&amp;nbsp;

So yeah, that's my experience.  I'd like to move to either Seattle or Chicago to continue my education within the next year so I'm excited about having a more robust public transit system available.",,,,geoffisblind,LCA (Low Vision),,1446867982,t5_2qpec,t3_3rrx2n,t1_cwr5zta,2,1449649675,0,0,cwrh5m2,Blind,2,,blue1,"I live in <LOCATION>, <LOCATION>.  Public transit has gotten much better but it is subject to bickering between municipal governments that has prevented further expansion of the rail system for years.  Buses average about 30 minutes per connection which means if one bus is off you are stuck for a while.  The operators seem pretty understanding of disability issues for the most part but on more than one occasion I've had a driver forget to let me off where I asked them to.  In addition I've had drivers make assumptions about my abilities and tell me they won't let me off at a certain place, even if it is a sanctioned stop.  This actually happened to me on Tuesday, I was riding in a part of the city I'm not normally in to go visit someone in the hospital, I asked the driver to let me off at an intersection to connect with the line that went to the hospital and he told me that he didn't feel comfortable letting me crossing that street with my visual impairment and that he would let me off further down where he was more comfortable doing so.  Which is great, but it's not what I asked him to do and it was kind of insulting.  This is aside from the fact that I missed my connection and had to wait for 30 minutes on the side of the road for the next bus.

&amp;nbsp;

The other issue I've had is a lack of modern integration, it seems like all of the decently sized cities in the <LOCATION> are getting some kind of smart card system to pay for transit easily, we haven't got that yet except for disposable, flimsy monthly passes that can be swiped.  The project is underway but behind schedule from what I understand.

&amp;nbsp;

My last problem is with fellow riders, people really like to try to help me without announcing that they are doing so.  Getting grabbed is an issue for me, but that's more of a social issue than a bus issue, I just notice it mostly when I'm riding.

&amp;nbsp;

So yeah, that's my experience.  I'd like to move to either <LOCATION> or <LOCATION> to continue my education within the next year so I'm excited about having a more robust public transit system available.","[{'start': 1979, 'end': 1989, 'entity_type': 'LOCATION', 'text': '<LOCATION>', 'operator': 'replace'}, {'start': 1965, 'end': 1975, 'entity_type': 'LOCATION', 'text': '<LOCATION>', 'operator': 'replace'}, {'start': 1392, 'end': 1402, 'entity_type': 'LOCATION', 'text': '<LOCATION>', 'operator': 'replace'}, {'start': 22, 'end': 32, 'entity_type': 'LOCATION', 'text': '<LOCATION>', 'operator': 'replace'}, {'start': 10, 'end': 20, 'entity_type': 'LOCATION', 'text': '<LOCATION>', 'operator': 'replace'}]"
219,Would be really cool to try one of these. Unfortunately I'm not in any of the listed countries.,,,,Nandflash,,,1448711426,t5_2qpec,t3_3ujagd,t3_3ujagd,2,1450079889,0,0,cxfna6g,Blind,2,,,,
