,body,score_hidden,archived,name,author,author_flair_text,downs,created_utc,subreddit_id,link_id,parent_id,score,retrieved_on,controversiality,gilded,id,subreddit,ups,distinguished,author_flair_css_class,anonymized_body,anonymized_masks
39,"As for Facebook on desktop, many people use the Mobile site at http://m.facebook.com. It doesn't have all of the features of the regular site, but is often more efficient for quick posting of status and doing other common FB tasks. Yes, if you haven't bought Jaws yet, NVDA is a better option for the web and free. You can buy better-sounding voices if the built-in one sounds a bit harsh, or if you're on Windows 8, switch to the decently-sounding Microsoft voices. Those Nokias were good phones for their day and until the iPhone, one of the only accessible smartphones available.",False,False,t1_cqpwnzc,jage9,,0,1430106201,t5_2qpec,t3_33cpfo,t3_33cpfo,2,1432624800,0,0,cqpwnzc,Blind,2,,,"As for Facebook on desktop, many people use the <LOCATION> site at <URL>. It doesn't have all of the features of the regular site, but is often more efficient for quick posting of status and doing other common FB tasks. Yes, if you haven't bought Jaws yet, NVDA is a better option for the web and free. You can buy better-sounding voices if the built-in one sounds a bit harsh, or if you're on Windows 8, switch to the decently-sounding Microsoft voices. Those Nokias were good phones for their day and until the iPhone, one of the only accessible smartphones available.","[{'start': 67, 'end': 72, 'entity_type': 'URL', 'text': '<URL>', 'operator': 'replace'}, {'start': 48, 'end': 58, 'entity_type': 'LOCATION', 'text': '<LOCATION>', 'operator': 'replace'}]"
40,:) Glad these vids are of some interest and help to people.,False,False,t1_cqjg1ld,johnnytai,,0,1429603734,t5_2qpec,t3_33a8wz,t1_cqj53mb,1,1432513298,0,0,cqjg1ld,Blind,1,,,,
41,"I tried to explore valve and steam a while back.
I'm completely clueless in Windows. Even after asking some friends who do audio gaming in Windows. :'(",False,False,t1_cqacvj2,Unuhi,,0,1428887640,t5_2qpec,t3_32bryx,t1_cq9rf6f,1,1432356238,0,0,cqacvj2,Blind,1,,,,
42,Interesting. Were can I find a mobility specialist? Do you mind asking how much you paid? I have been thinking of getting the cane at the very least to deflect some of the nasty looks I get when I trip over people but honestly not even sure where to get one.,False,False,t1_cqks97c,nomorechocolatebars,,0,1429710329,t5_2qpec,t3_334irp,t1_cqkqzsi,1,1432536437,0,0,cqks97c,Blind,1,,,,
43,"Your symptoms sound almost identical to mine.  I have never had night vision and my peripheral has always been bad, but I really started to notice it about 8 months ago.  My solution was to talk with an orientation and mobility specialist. She recommended that I at least try a white cane and see how it worked.  I was not sure at first but it has really changed the way I live my life. I don't run into things or trip as much anymore, the people I do run into are far more understanding, and I am more confident. Now I refuse to leave the house without it and I carry a spare cane in my bag. The worst it can do is not help at all, in which case you can just stop using it, if it does work it will give you more mobility, confidence and independence.",False,False,t1_cqkqzsi,geoffisblind,LCA,0,1429707612,t5_2qpec,t3_334irp,t3_334irp,1,1432535843,0,0,cqkqzsi,Blind,1,,,,
44,"The Trekker Breeze has a subpar GPS chip in its current form. The refreshed model, the Breeze Plus, which is coming out soon will supposedly remedy this. That being said, you won't get better results using a Breeze vs. apps on your phone. I use a GPS often, and it's great to let me know what street I'm on or the names of upcoming streets or businesses. It's no replacement for good cane/dog skills however, and you'll still need to do a bit of guessing to find what you're looking for, especially at the end. Use GPS as a tool, but trust your instincts and judgment over what any phone or computer is telling you.",False,False,t1_cqpw6gx,jage9,,0,1430105229,t5_2qpec,t3_33jmfg,t3_33jmfg,1,1432624570,0,0,cqpw6gx,Blind,1,,,,
45,"Last I heard, Netflix wasn't even available on Android for DRM reasons.  I don't own an Android though, so I wouldn't have heard if that changed.",False,False,t1_cqd1gwt,fastfinge,,0,1429100047,t5_2qpec,t3_32l5ds,t1_cqcu6yz,1,1432402599,0,0,cqd1gwt,Blind,1,,,,
46,"Yea. My m&amp;o guide first talked about him.
I've asked Tommy some stuff in twitter too.
And I'm really excited to have signed up for a conference where he'll be talking. Such a sunny attitude - better than pretty much any sighted people I know (uh... Kind of awkward. I was raised as sighted but now wish someone would had the brain to teach some basic o&amp;m etc skills as a kid. Not seeing something was the worst thing ever, and the thought of ever needing the cane would have mortified me. Oh well - at least now I have friends that have very different eye skills, so I donʻt have to feel awkward when I don't see).",False,False,t1_cqh3j9u,Unuhi,,0,1429410551,t5_2qpec,t3_332zhs,t1_cqh1qrh,1,1432472750,0,0,cqh3j9u,Blind,1,,,"Yea. My m&amp;o guide first talked about him.
I've asked <PERSON> some stuff in twitter too.
And I'm really excited to have signed up for a conference where he'll be talking. Such a sunny attitude - better than pretty much any sighted people I know (uh... Kind of awkward. I was raised as sighted but now wish someone would had the brain to teach some basic o&amp;m etc skills as a kid. Not seeing something was the worst thing ever, and the thought of ever needing the cane would have mortified me. Oh well - at least now I have friends that have very different eye skills, so I donʻt have to feel awkward when I don't see).","[{'start': 57, 'end': 65, 'entity_type': 'PERSON', 'text': '<PERSON>', 'operator': 'replace'}]"
47,"Thanks again, one thing I stumbled across was the Speak Your Word project, which basically promoted the use of dual format article/blog posts so there is an audio 'reading' for people to listen to.

From their twitter: ""Initiative to motivate bloggers for recording their articles into narration in order to offer the blind community the chance of information in a personal format""

Would something like that add value to your browsing experience?",False,False,t1_cqevhcl,rendesr,,0,1429225283,t5_2qpec,t3_32ohq2,t1_cqeccwp,1,1432434339,0,0,cqevhcl,Blind,1,,,,
48,You might want to ask /r/legaladvice. ,False,False,t1_cqnexqj,thatsnotgneiss,Chronic Bilateral Iridiocyclitis/low vision,0,1429898511,t5_2qpec,t3_33qfrd,t3_33qfrd,1,1432581863,0,0,cqnexqj,Blind,1,,,,
49,"I have an iPhone five too. I'm able to search for a show, select the show, click witch episode I want to watch, fast forward, rewind, etc. The onlyt hing I can think of is that, correct me if I'm totally wrong, but perhaps you don't know all the commands of voiceover?",False,False,t1_cqd2yp9,Nighthawk321,,0,1429103796,t5_2qpec,t3_32l5ds,t1_cqd1w88,1,1432403374,0,0,cqd2yp9,Blind,1,,,,
50,"I have noticed lately as my friends have started growing up (mostly 26 and getting real jobs) is that the whole party/bar thing is starting to die out. It's much easier to make plans to go out to (a usually well lit) restaurant then being super uncomfortable at a bar because you have no clue what's going on around you. 
I know I should find local support groups I have just avoided it because I guess that means it's really happening which I have pretty successfully ignored because it used to be only a nighttime thing.",False,False,t1_cqmyo50,nomorechocolatebars,,0,1429861093,t5_2qpec,t3_334irp,t1_cqmydjp,1,1432573987,0,0,cqmyo50,Blind,1,,,,
51,"Do you have some kind of mass-posting script or something?  I see AA updates on /r/MUD, mudconnect.com, mudbytes.net, audiogames.net, and a bunch of other places. It must take you forever! LOL.  Personally, I don't mind.  But I'm not a mod, so I dunno.  Maybe because this isn't a gaming community, you might want to just do more promotional posts here, with links to mush-z and other resources for blind folks who don't game, and didn't even know they could?  I run across people like that every time I meet new blind people.  ",False,False,t1_cpytu76,fastfinge,,0,1427981097,t5_2qpec,t3_312ast,t3_312ast,1,1432153525,0,0,cpytu76,Blind,1,,,"Do you have some kind of mass-posting script or something?  I see AA updates on /r/MUD, <URL>, <LOCATION>, <URL>, and a bunch of other places. It must take you forever! LOL.  Personally, I don't mind.  But I'm not a mod, so I dunno.  Maybe because this isn't a gaming community, you might want to just do more promotional posts here, with links to mush-z and other resources for blind folks who don't game, and didn't even know they could?  I run across people like that every time I meet new blind people.  ","[{'start': 107, 'end': 112, 'entity_type': 'URL', 'text': '<URL>', 'operator': 'replace'}, {'start': 95, 'end': 105, 'entity_type': 'LOCATION', 'text': '<LOCATION>', 'operator': 'replace'}, {'start': 88, 'end': 93, 'entity_type': 'URL', 'text': '<URL>', 'operator': 'replace'}]"
52,"Wow that's really weird. I wonder, what version of IOS are you on.",False,False,t1_cqd9bbn,Nighthawk321,,0,1429114635,t5_2qpec,t3_32l5ds,t1_cqd7lvs,1,1432406436,0,0,cqd9bbn,Blind,1,,,,
53,Fitting username if I've ever seen one...,False,False,t1_cq9ymnd,lbtm,,0,1428861429,t5_2qpec,t3_32bryx,t1_cq9r6ds,3,1432349384,0,0,cq9ymnd,Blind,3,,,<PERSON> username if I've ever seen one...,"[{'start': 0, 'end': 8, 'entity_type': 'PERSON', 'text': '<PERSON>', 'operator': 'replace'}]"
54,"I would recommend posting this on r/audiobooks, there is a lot more people that can probably help.  I have loaded audiobooks and podcasts for someone else before, but I dont know how often you would have to do it.",False,False,t1_cqfpiiz,DietOysterCrackers,,0,1429293857,t5_2qpec,t3_32xohp,t3_32xohp,1,1432448877,0,0,cqfpiiz,Blind,1,,,,
55,"I am also 25. I wasn't looking for any magic tricks just helpful advice that keeps you from walking into that pole you didn't see our dealing with the angry stranger who's feet you tripped over. I have an uncle with rpm but he lives in England and really only ever tells me how much easier it is to live there rather then the states, which is not exactly helpful. I two could use someone who knows what it's like and I can actually relate to.",False,False,t1_cqhygci,nomorechocolatebars,,0,1429487845,t5_2qpec,t3_334irp,t1_cqhpaqj,1,1432487612,0,0,cqhygci,Blind,1,,,"I am also 25. I wasn't looking for any magic tricks just helpful advice that keeps you from walking into that pole you didn't see our dealing with the angry stranger who's feet you tripped over. I have an uncle with rpm but he lives in <LOCATION> and really only ever tells me how much easier it is to live there rather then the states, which is not exactly helpful. I two could use someone who knows what it's like and I can actually relate to.","[{'start': 236, 'end': 246, 'entity_type': 'LOCATION', 'text': '<LOCATION>', 'operator': 'replace'}]"
56,"I'm a Canadian, so I don't know. But there should be.  ",False,False,t1_cpyww4t,fastfinge,,0,1427986985,t5_2qpec,t3_3137gv,t3_3137gv,1,1432155035,0,0,cpyww4t,Blind,1,,,,
57,"Recently some accessibility buddies demoed http://describler.com/samples/
I don't remember if it was chrome or firefox they used, but it was interesting to learn how the data can be shown, told, acted with. 
I played with the same sample pictures with my voiceover and ipad in the same meeting. The data it read was different, but more to the point. 

Any links for me about learning quick about microsoft accessibility? I hear there's Narrator, but it'll probably take a while to get the hang of it...",False,False,t1_cq1ipx4,Unuhi,,0,1428197749,t5_2qpec,t3_31cd8i,t3_31cd8i,1,1432201244,0,0,cq1ipx4,Blind,1,,,"Recently some accessibility buddies demoed <URL>
I don't remember if it was chrome or firefox they used, but it was interesting to learn how the data can be shown, told, acted with. 
I played with the same sample pictures with my voiceover and ipad in the same meeting. The data it read was different, but more to the point. 

Any links for me about learning quick about microsoft accessibility? I hear there's Narrator, but it'll probably take a while to get the hang of it...","[{'start': 43, 'end': 48, 'entity_type': 'URL', 'text': '<URL>', 'operator': 'replace'}]"
58,"The hospital I attend the most is an old victorian hospital that has had loads of modern extensions built on to it, as a result it is a huge confusing labyrinthine mess even for the fully sighted.

I normally have to ask for a hospital porter to take me in a wheelchair (I do have walking problems too) otherwise it would take me forever to reach whatever dept. I'm going too.

While I do have some limited sight, I have a white cane - 9/10 times when my name is called in the waiting room, even after seeing me with my white cane the staff member will disappear up some corridor without waiting to see if I'm behind them.

Most hospitals I've been too is pretty much the same experience - confusing, disorientating.",False,False,t1_cqrk7jz,impablomations,,0,1430237498,t5_2qpec,t3_344x3k,t3_344x3k,2,1432653361,0,0,cqrk7jz,Blind,2,,,,
59,"Do you mind me asking how old you are? I also have RP. I started noticing more gradual vision loss during the peak of puberty. Now 25, my peripheral vision seems worse than ever before. I strongly believe that there is a link between puberty and the gradual vision loss of RP. I haven't seen any studies between these two yet. To answer your question, you simply adapt. I know, you probably wanted to hear some magical advice but I don't have any. I personally avoid being around lots of people to avoid embarrassing myself. If you have any other questions or just want to relate with someone, please message me. I could use a friend that knows what I'm going through.",False,False,t1_cqhpaqj,[deleted],,0,1429470839,t5_2qpec,t3_334irp,t3_334irp,2,1432483156,0,0,cqhpaqj,Blind,2,,,,
60,"Thanks very much for your detailed reply - appreciated!

Do you use a regular browser (like Chrome, FireFox etc) or do you sometimes use a text only browser like Lynx?",False,False,t1_cqe9mzj,rendesr,,0,1429189514,t5_2qpec,t3_32ohq2,t1_cqd73ck,1,1432423836,0,0,cqe9mzj,Blind,1,,,,
61,"I took my visual my field test this weekend actually, the girl was new so she had no idea what I was talking about even after I explained what I have, what it does and that I had made the appointment specifically because I had noticed an increase in tunnel vision. She kept explaining how to do the test like I was slow and having me repeat it. I had gotten to the point were I was going to demand someone else when she gave up. She then asked if I wore glasses for night time driving, I laughed (it's been three years since I did any driving.) I know it's rude but I was frustrated and upset. As I'm paying the guy sees the results (also explained to him after I told him the special peripheral enhancing glasses he was trying to upsell would be wasted on me) doesn't believe I could possibly not have seen anything but right in front of me and had to check with the optometrist before I can get out of there.  I felt like the one place I wouldn't have to explain what I could vs couldn't see and more importantly why. was the optometrist but apparently not. Sorry for the vent I am just kind of upset (also got 20/100 best corrected central vision which I wasn't expecting I knew it was bad just not that bad) all in all not my best day.",False,False,t1_cqrggm4,nomorechocolatebars,,0,1430231349,t5_2qpec,t3_334irp,t1_cqrczol,1,1432651594,0,0,cqrggm4,Blind,1,,,,
62,"umm as much as they can be I guess. I am lucky to have a few very close friends that I have grown up with so they understand I can't see at night and that I don't drive anymore but if your not living it it's harder to understand just how much of your life it effects. I find it really difficult to make new friends because it's not something I like sharing right away so then your weird for not driving or tripping constantly, missing certain things... oh well.",False,False,t1_cqn0onr,nomorechocolatebars,,0,1429869910,t5_2qpec,t3_334irp,t1_cqmz3e5,1,1432575006,0,0,cqn0onr,Blind,1,,,,
63,"That makes sense, I wasn't intending to have it replace my cane, I was just looking for another way to orient especially when I can't tell what intersections I'm approaching.  People seem to really like BlindSquare but I am an Android user and the developer either appears to be uninterested or moving very slowly on developing for that platform.  I'll stick to google maps walking directions for now although I would love more information about my surroundings.",False,False,t1_cqpwl2u,geoffisblind,LCA,0,1430106034,t5_2qpec,t3_33jmfg,t1_cqpw6gx,1,1432624761,0,0,cqpwl2u,Blind,1,,,,
64,"Sorry, I am still on Windows 7, so I can't really help you, there.  

I had a Victor Stream for years, and once I memorized all the functions, it worked really well, for me. These days, I use an app on my IPhone called Voice Dream Reader.  If you have an IPhone, I recommend it!  It's easier to use, because it works the same way your IPhone does, and it has many more functions.  ",False,False,t1_cqafslt,fastfinge,,0,1428893204,t5_2qpec,t3_32bryx,t1_cqaf4it,1,1432357614,0,0,cqafslt,Blind,1,,,,
65,"Maybe you have an IPhone6? I'm on a 5, so that might at least explain the slowness and crashes?  I know it's nothing gone wrong in the app, because when I originally tested it and found it unusable, I uninstalled it.  I just re installed it fresh from the app store this morning to test and write this comment, and have all the same issues.  It can't be the phone, because it's been reset and restored pretty recently, because it went in for a battery replacement.  All I can say is, for me, the app is right on the edge of unusable.  ",False,False,t1_cqd1w88,fastfinge,,0,1429101243,t5_2qpec,t3_32l5ds,t1_cqd1m50,1,1432402870,0,0,cqd1w88,Blind,1,,,,
66,"Finally… Here's to hoping that they make the experience somewhat better on all of the iDevices. If only my PlayStation three were accessible… I primarily use that to watch Netflix, but will always need a sighted person to help pick and choose content. Have not really tried using the website on my Mac mini which is also hooked up to my sound system and TV.",False,False,t1_cqcawl4,Marconius,,0,1429039823,t5_2qpec,t3_32l5ds,t3_32l5ds,1,1432389871,0,0,cqcawl4,Blind,1,,,"Finally… Here's to hoping that they make the experience somewhat better on all of the iDevices. If only my PlayStation three were accessible… I primarily use that to watch Netflix, but will always need a sighted person to help pick and choose content. Have not really tried using the website on my <PERSON> mini which is also hooked up to my sound system and TV.","[{'start': 298, 'end': 306, 'entity_type': 'PERSON', 'text': '<PERSON>', 'operator': 'replace'}]"
67,Well I hope it does give you some comfort. I was told in 2000 I had ten years of vision left. I've beat that. But it hasn't been all fun. I've documented my visual timeline here if you're interested: http://rp-vip.blogspot.com/2015/04/visual-history.html,False,False,t1_cqmyuk4,matt_may,,0,1429861790,t5_2qpec,t3_334irp,t1_cqmwzo6,1,1432574071,0,0,cqmyuk4,Blind,1,,,Well I hope it does give you some comfort. I was told in 2000 I had ten years of vision left. I've beat that. But it hasn't been all fun. I've documented my visual timeline here if you're interested: <URL>,"[{'start': 200, 'end': 205, 'entity_type': 'URL', 'text': '<URL>', 'operator': 'replace'}]"
68,"Just letting you know that this survey website doesn't work with mobile voice over. I hear the questions just fine, however the answers paired to the radio buttons do not announce themselves so I don't know what the radio button select.  This is rather funny considering that your first question asks if I use an iPhone or not, yet I cannot answer it while using an iPhone…",False,False,t1_cqak6j3,Marconius,,0,1428903152,t5_2qpec,t3_32clsw,t3_32clsw,1,1432359752,0,0,cqak6j3,Blind,1,,,,
69,"You didn't really indicate where you are located, but I am in the United States.  The Department of Social Services for my state has a subdivision called Rehabilitative Services for the Blind.  This is state funded, they provided me with a caseworker for general things and an Orientation and Mobility specialist.  This is all free of charge.  I meet with my O&amp;M specialist once every few weeks and I am coming close to completing my training fully.  They do more than just cane work, they can help you with night time orientation, public transit techniques, and tons more.  If you don't have something like Rehabilitative Services for the Blind you can look for private organizations (I have two in my area).  All of these agencies can help you with training and equipment.

My caseworker at RSB made sure I got the training I need, she also pointed me to another organization which provided me with over 5,000 dollars in low vision technology including a desktop CCTV, iPad, and handheld video magnifier.  These are all things that I wouldn't have been able to afford by myself.  Luckily there are resources, you just have to seek them out.

Back to the cane, I really enjoy the confidence it gives me.  People make room for you and you don't get the frustration from people in public.  Part of the problem is that just because you are visually impaired and prone to running into things does not necessarily mean you look like you have that problem to the public.  The cane makes your disability visible which is good for a lot of reasons.  The one I like the most is the not getting in hassled part, however it is also very important for safety.  It is a very visible warning to drivers that you are visually impaired and may not see them and it has gotten me out of a few situations where I didn't hear a car coming due to the noise level of my surrounding.  If for no other reason than that I will not leave the house without a cane in my hand.  

Beyond the warning it gives, you just won't run into stuff as much and that is a fantastic perk :)  If you can find an organization that will train you for free they will probably also provide you with a cane for free.  If you can't find one, I don't think it would be impossible to train yourself on the basics.  It isn't exactly rocket science and if you needed guidance I could PM you some basic techniques.  Canes are cheap ($20-$30), I like Ambutech canes, they are very durable and offer customization for your comfort (different tips, lengths, materials, etc.)  Let me know if you have any other questions :)  Good luck!",False,False,t1_cqlackr,geoffisblind,LCA,0,1429738587,t5_2qpec,t3_334irp,t1_cqks97c,1,1432545000,0,0,cqlackr,Blind,1,,,"You didn't really indicate where you are located, but I am in <LOCATION>.  The Department of Social Services for my state has a subdivision called Rehabilitative Services for the Blind.  This is state funded, they provided me with a caseworker for general things and an Orientation and Mobility specialist.  This is all free of charge.  I meet with my O&amp;M specialist once every few weeks and I am coming close to completing my training fully.  They do more than just cane work, they can help you with night time orientation, public transit techniques, and tons more.  If you don't have something like Rehabilitative Services for the Blind you can look for private organizations (I have two in my area).  All of these agencies can help you with training and equipment.

My caseworker at RSB made sure I got the training I need, she also pointed me to another organization which provided me with over 5,000 dollars in low vision technology including a desktop CCTV, iPad, and handheld video magnifier.  These are all things that I wouldn't have been able to afford by myself.  Luckily there are resources, you just have to seek them out.

Back to the cane, I really enjoy the confidence it gives me.  People make room for you and you don't get the frustration from people in public.  Part of the problem is that just because you are visually impaired and prone to running into things does not necessarily mean you look like you have that problem to the public.  The cane makes your disability visible which is good for a lot of reasons.  The one I like the most is the not getting in hassled part, however it is also very important for safety.  It is a very visible warning to drivers that you are visually impaired and may not see them and it has gotten me out of a few situations where I didn't hear a car coming due to the noise level of my surrounding.  If for no other reason than that I will not leave the house without a cane in my hand.  

Beyond the warning it gives, you just won't run into stuff as much and that is a fantastic perk :)  If you can find an organization that will train you for free they will probably also provide you with a cane for free.  If you can't find one, I don't think it would be impossible to train yourself on the basics.  It isn't exactly rocket science and if you needed guidance I could PM you some basic techniques.  Canes are cheap ($20-$30), I like <PERSON> canes, they are very durable and offer customization for your comfort (different tips, lengths, materials, etc.)  Let me know if you have any other questions :)  Good luck!","[{'start': 2396, 'end': 2404, 'entity_type': 'PERSON', 'text': '<PERSON>', 'operator': 'replace'}, {'start': 62, 'end': 72, 'entity_type': 'LOCATION', 'text': '<LOCATION>', 'operator': 'replace'}]"
