,body,score_hidden,archived,name,author,author_flair_text,downs,created_utc,subreddit_id,link_id,parent_id,score,retrieved_on,controversiality,gilded,id,subreddit,ups,distinguished,author_flair_css_class,anonymized_body,anonymized_masks
70,"It depends, the hospital I visit to have my eyes checked out and where they are doing research on me is very difficult to get around because of all the poorly planned extensions that keep getting added on.  I have also had to visit people in different hospitals this past year, the one in particular is much smaller, more linear, and more easily navigable.  If I am struggling I just have someone lead me to the room, it's usually not a big deal.  I will be volunteering in a hospital coming up in about a week and they showed me around where I will be working.  That is going to take some getting used to.",False,False,t1_cqrxref,geoffisblind,LCA,0,1430258185,t5_2qpec,t3_344x3k,t3_344x3k,2,1432659833,0,0,cqrxref,Blind,2,,,,
71,"I was born blind.  And...I dunno?  I can roll my eyes in my head, because I can kind of...feel them moving, I guess.  And when I get something stuck in my eye, I blink, tear, and move my eye up and down to try and force it out just like anyone else would.  But I think that focusing on a visual object requires different muscles than moving your eyes from left to right and up and down does.  Doesn't focusing...do something to the lens of your eyeball? Contract or expand it or something?  Maybe I'm thinking of night vision, though. Anyway, how would I know if I can do that or not?  I don't think I could feel my eye lens doing that in the same way I can feel my eye moving back and forth.  

TL;DR: I'm born blind, so there is no way I can answer your question. Try a doctor.",False,False,t1_cpxs7q7,fastfinge,,0,1427895714,t5_2qpec,t3_30zxgy,t3_30zxgy,6,1432135443,0,0,cpxs7q7,Blind,6,,,"I was born blind.  And...I dunno?  I can roll my eyes in my head, because I can kind of...feel them moving, I guess.  And when I get something stuck in my eye, I blink, tear, and move my eye up and down to try and force it out just like anyone else would.  But I think that focusing on a visual object requires different muscles than moving your eyes from left to right and up and down does.  Doesn't <URL> something to the lens of your eyeball? Contract or expand it or something?  Maybe I'm thinking of night vision, though. Anyway, how would I know if I can do that or not?  I don't think I could feel my eye lens doing that in the same way I can feel my eye moving back and forth.  

TL;DR: I'm born blind, so there is no way I can answer your question. Try a doctor.","[{'start': 401, 'end': 406, 'entity_type': 'URL', 'text': '<URL>', 'operator': 'replace'}]"
72,"CNIB and march of Dimes in Canada

I can't vouch for it but one of the iPod touches using voice control might work as long as all of the books are clearly titled. I know CNIB has something better avail but I don't know the details. ",False,False,t1_cqgf725,angelcake,,0,1429357989,t5_2qpec,t3_32xohp,t1_cqg3yfr,1,1432461131,0,0,cqgf725,Blind,1,,,,
73,"Hmm.. yeah, a tablet sounds more reasonable. Plus, my dad has fat fingers, lol. 

Now the problem with that is how to keep the bratty grandkids from using it, but that's my problem now. Thanks for your suggestion!",False,False,t1_cql4xmv,Felinomancy,,0,1429730537,t5_2qpec,t3_33cpfo,t1_cql4uu5,1,1432542448,0,0,cql4xmv,Blind,1,,,,
74,"Your post reminded me of this recent post.
https://www.youtube.com/watch?v=W1VUr544i84

I'd be interested in knowing what you come up with. I'm facing possible blindness sometime between now and when I retire (mid 30s now) and work with data as my primary job function.

Edit: Reddit source: http://www.reddit.com/r/Blind/comments/2x956w/my_friend_has_been_working_on_a_tool_for/",False,False,t1_cq0emwe,Faldorn,,0,1428098989,t5_2qpec,t3_31cd8i,t3_31cd8i,1,1432180854,0,0,cq0emwe,Blind,1,,,"Your post reminded me of this recent post.
<URL>

I'd be interested in knowing what you come up with. I'm facing possible blindness sometime between now and when I retire (mid 30s now) and work with data as my primary job function.

Edit: Reddit source: <URL>","[{'start': 254, 'end': 259, 'entity_type': 'URL', 'text': '<URL>', 'operator': 'replace'}, {'start': 43, 'end': 48, 'entity_type': 'URL', 'text': '<URL>', 'operator': 'replace'}]"
75,"On the website, you can pick a show, but you can't seem to pick a particular episode; it just resumes where you left off.  You can also pick movies.  But when anything is playing, you can't use any of the controls (rewind, pause, fast forward, volume, etc).  Of course, that's how it was a month or so ago when I last tried it.  If you can come up with the money, I highly recommend getting yourself an Apple TV.  It's the best experience a blind person can have with Netflix, Youtube, and even the iTunes store, for that matter.  I use it daily, and it was worth every penny.  ",False,False,t1_cqcgs33,fastfinge,,0,1429048809,t5_2qpec,t3_32l5ds,t1_cqcawl4,1,1432392709,0,0,cqcgs33,Blind,1,,,,
76,"If in the US, check out the NLS and go over the guidelines. The devices are simple and books are sent by mail.",False,False,t1_cqg7obh,GringodelRio,Sighted Spouse,0,1429329132,t5_2qpec,t3_32xohp,t3_32xohp,2,1432457514,0,0,cqg7obh,Blind,2,,,"If in the <LOCATION>, check out the NLS and go over the guidelines. The devices are simple and books are sent by mail.","[{'start': 10, 'end': 20, 'entity_type': 'LOCATION', 'text': '<LOCATION>', 'operator': 'replace'}]"
77,I have RP. I was diagnosed when I was 14 and I have lost most of my night vision. My peripheral vision isn't that great either. I would say range of vision is about 60 degrees. It hasn't been that bad coping with the fact that I will be legally blind sometime in the future. Its inevitable. Just stay strong and you will get through it. I've realized that life is short and that we all have a purpose.,False,False,t1_cq8p8w4,[deleted],,0,1428746849,t5_2qpec,t3_2xs27u,t3_2xs27u,2,1432327637,0,0,cq8p8w4,Blind,2,,,,
78,"Actually, they can:
http://shoryuken.com/2014/01/31/mike-mike-z-zaimont-updates-skullgirls-encore-to-enhance-accessibility-for-blind-players/
",False,False,t1_cq9r2os,fastfinge,,0,1428845499,t5_2qpec,t3_32bryx,t1_cq9qzbk,1,1432345754,0,0,cq9r2os,Blind,1,,,"Actually, they can:
<URL>
","[{'start': 20, 'end': 25, 'entity_type': 'URL', 'text': '<URL>', 'operator': 'replace'}]"
79,"There are recumbent two, three and four wheel bikes with both foot and arm powered drives. They are quite expensive though and since he's likely to grow a lot in the next couple of years now may not be the best age to buy him one.

Depending on his abilities to ride independently you might also consider a tandem. Something like: [tandem handcycle](http://www.rivonline.org/Outdoor%20Equipment.html)",False,False,t1_cqmc9w2,bondolo,Sighted Spouse,0,1429817904,t5_2qpec,t3_33mm6a,t3_33mm6a,2,1432563221,0,0,cqmc9w2,Blind,2,,,"There are recumbent two, three and four wheel bikes with both foot and arm powered drives. They are quite expensive though and since he's likely to grow a lot in the next couple of years now may not be the best age to buy him one.

Depending on his abilities to ride independently you might also consider a tandem. Something like: [tandem handcycle](<URL>)","[{'start': 350, 'end': 355, 'entity_type': 'URL', 'text': '<URL>', 'operator': 'replace'}]"
80,Don't waste your money. It's basically a google maps. My GF uses trekker and it too ahs its good and bad days. It's not worth the money IMO considering any GPS you can get for the Iphone does the same thing.,False,False,t1_cqoc4b5,johnnytai,,0,1429979760,t5_2qpec,t3_33jmfg,t3_33jmfg,1,1432597781,0,0,cqoc4b5,Blind,1,,,,
81,"I don't find GPS accurate enough for turn by turn; I've used several platforms, and it's always accurate to about 15 to 30 feet in the real world.  I find the best solution is Blindsquare on IOS.  Don't bother with turn by turn, just track your destination. Blindsquare will tell you what direction you're going, how fast, what street is coming up, and nearby landmarks.  This works really well to keep you oriented, help know if you're walking the right way, got the right bus, etc.  ",False,False,t1_cqlyy0g,fastfinge,,0,1429797020,t5_2qpec,t3_33jmfg,t3_33jmfg,2,1432556870,0,0,cqlyy0g,Blind,2,,,"I don't find GPS accurate enough for turn by turn; I've used several platforms, and it's always accurate to about 15 to 30 feet in the real world.  I find the best solution is <PERSON> on IOS.  Don't bother with turn by turn, just track your destination. Blindsquare will tell you what direction you're going, how fast, what street is coming up, and nearby landmarks.  This works really well to keep you oriented, help know if you're walking the right way, got the right bus, etc.  ","[{'start': 176, 'end': 184, 'entity_type': 'PERSON', 'text': '<PERSON>', 'operator': 'replace'}]"
82,"This is strange to me, because I only use the IOS app; and perfectly fine. Sure the layout is a little odd, but I use it on IOS7 and IOS8, and I get around fine.",False,False,t1_cqd1m50,Nighthawk321,,0,1429100465,t5_2qpec,t3_32l5ds,t1_cqd1jta,1,1432402667,0,0,cqd1m50,Blind,1,,,,
83,"Hospitals are terrible.  Especially in Canada, where they're almost always overcrowded; good luck getting anywhere when there are masses of people sitting/standing in every waiting room, stretchers in the halls, hand-washing stations that you are required to use before entering particular areas (but of course the hand-washing station is nowhere near the actual entry to the area in question), almost no Braille signs, etc, etc, etc.  Also, whenever I am in a hospital, it's either because I'm feeling sick or in pain myself, or someone close to me is sick.  So the fact that I'm extremely stressed/upset doesn't make the already difficult task of navigating a hospital any easier at all.  If a family member is sick enough to be in the hospital, I'm probably just not even going to try; I'll ask for help to find them, so I can preserve what little cheer I have for the time I spend visiting them.  Being there for my friends and family is more important to me than the pride I take in my independence.  ",False,False,t1_cqrtciw,fastfinge,,0,1430251442,t5_2qpec,t3_344x3k,t3_344x3k,2,1432657740,0,0,cqrtciw,Blind,2,,,"Hospitals are terrible.  Especially in <LOCATION>, where they're almost always overcrowded; good luck getting anywhere when there are masses of people sitting/standing in every waiting room, stretchers in the halls, hand-washing stations that you are required to use before entering particular areas (but of course the hand-washing station is nowhere near the actual entry to the area in question), almost no Braille signs, etc, etc, etc.  Also, whenever I am in a hospital, it's either because I'm feeling sick or in pain myself, or someone close to me is sick.  So the fact that I'm extremely stressed/upset doesn't make the already difficult task of navigating a hospital any easier at all.  If a family member is sick enough to be in the hospital, I'm probably just not even going to try; I'll ask for help to find them, so I can preserve what little cheer I have for the time I spend visiting them.  Being there for my friends and family is more important to me than the pride I take in my independence.  ","[{'start': 39, 'end': 49, 'entity_type': 'LOCATION', 'text': '<LOCATION>', 'operator': 'replace'}]"
84,"It's a mainstream game with added features.  That'd be like saying it's not a TV show if you watch it on your COMPUTER.  Also, for that matter, many major video game sites review MUDs, browser based games, interactive fiction, and other things that are called video games even though they don't involve any video.  ",False,False,t1_cq9rf6f,fastfinge,,0,1428846495,t5_2qpec,t3_32bryx,t1_cq9r6ds,3,1432345918,0,0,cq9rf6f,Blind,3,,,,
85,Sounds like this is a question for a doctor or scientist. ,False,False,t1_cpxruyt,SupermarketSweep,,0,1427894933,t5_2qpec,t3_30zxgy,t3_30zxgy,1,1432135278,0,0,cpxruyt,Blind,1,,,,
86,"Where do you live?

In US there is NLS. Talking Books for the blind, www.loc.gov/nls
each state has their own library. You can call the,m, and thye are friendly. You judt need an opthamawhatchalallit ye doctor to fill in the application fro you.
Thye'll even send a device for reading.

In UK, check RNIB. 
They have some similar audiobook options.

And other countries do too.

UK's RNIB has even Radio Insight where on one channel they have audiobooks. Other channels have nice shows for blind and visually impaired. I mean points of view that are close to heart.

Then there's radio perkins. They have something about books too.

But NLS and RNIB are good places to start if you are in Us or UK.",False,False,t1_cqg3yfr,Unuhi,,0,1429321036,t5_2qpec,t3_32xohp,t3_32xohp,2,1432455762,0,0,cqg3yfr,Blind,2,,,"Where do you live?

In <LOCATION> there is NLS. Talking Books for the blind, <URL>
each state has their own library. You can call the,m, and thye are friendly. You judt need an opthamawhatchalallit ye doctor to fill in the application fro you.
<PERSON> even send a device for reading.

In <LOCATION>, check RNIB. 
They have some similar audiobook options.

And other countries do too.

<LOCATION>'s RNIB has even Radio Insight where on one channel they have audiobooks. Other channels have nice shows for blind and visually impaired. I mean points of view that are close to heart.

Then there's radio perkins. They have something about books too.

But NLS and RNIB are good places to start if you are in <LOCATION> or <LOCATION>.","[{'start': 718, 'end': 728, 'entity_type': 'LOCATION', 'text': '<LOCATION>', 'operator': 'replace'}, {'start': 704, 'end': 714, 'entity_type': 'LOCATION', 'text': '<LOCATION>', 'operator': 'replace'}, {'start': 386, 'end': 396, 'entity_type': 'LOCATION', 'text': '<LOCATION>', 'operator': 'replace'}, {'start': 289, 'end': 299, 'entity_type': 'LOCATION', 'text': '<LOCATION>', 'operator': 'replace'}, {'start': 244, 'end': 252, 'entity_type': 'PERSON', 'text': '<PERSON>', 'operator': 'replace'}, {'start': 77, 'end': 82, 'entity_type': 'URL', 'text': '<URL>', 'operator': 'replace'}, {'start': 23, 'end': 33, 'entity_type': 'LOCATION', 'text': '<LOCATION>', 'operator': 'replace'}]"
87,"Well, I don't know what kind of websites you build, so I don't know if this applies, but the biggest frustration I find regularly is a lack of consistency throughout a website.  As far as I know (and I could be wrong), standards documents don't really address this.  The problem is especially bad on sites that allow users to style things, like MySpace and Zanga used to, back in the day.  You can wind up with some parts of a website that are perfectly accessible, and some that aren't, depending on who's in charge.  Wordpress.com for example, is pretty bad for this.  They host all the wordpress installs everyone who blogs at domain.wordpress.com uses, so there is no reason they can't let me sign in with my Wordpress.com account, and then force every wordpress.com blog I view to use a theme of my choice.  That way, they'd all look the same, and be more-or-less accessible!  Tumblr is another website that's bad for this; I haven't tried tumblr in over a year, but last I checked, even when I signed in, I couldn't disable the customized styles for each different tumblr.  If that's changed and I'm wrong, I'd love to know!  In the positive category, Reddit does this perfectly; when I'm signed in, I can disable subreddit styles, if I don't want them.  DreamWidth and other LiveJournal based sites also do this well; I can force every other journal I visit to use the style I have for my journal.  

TL;DR: If you let users who post content to your website customize the look and theme of their section of the site, provide a way for blind users to disable these custom themes, and use your *hopefully* fully accessible global style.  ",False,False,t1_cqd73ck,fastfinge,,0,1429111202,t5_2qpec,t3_32ohq2,t3_32ohq2,3,1432405319,0,0,cqd73ck,Blind,3,,,"Well, I don't know what kind of websites you build, so I don't know if this applies, but the biggest frustration I find regularly is a lack of consistency throughout a website.  As far as I know (and I could be wrong), standards documents don't really address this.  The problem is especially bad on sites that allow users to style things, like MySpace and <PERSON> used to, back in the day.  You can wind up with some parts of a website that are perfectly accessible, and some that aren't, depending on who's in charge.  <URL> for example, is pretty bad for this.  They host all the wordpress installs everyone who blogs at <URL> uses, so there is no reason they can't let me sign in with my <URL> account, and then force every <URL> blog I view to use a theme of my choice.  That way, they'd all look the same, and be more-or-less accessible!  Tumblr is another website that's bad for this; I haven't tried tumblr in over a year, but last I checked, even when I signed in, I couldn't disable the customized styles for each different tumblr.  If that's changed and I'm wrong, I'd love to know!  In the positive category, Reddit does this perfectly; when I'm signed in, I can disable subreddit styles, if I don't want them.  DreamWidth and other LiveJournal based sites also do this well; I can force every other journal I visit to use the style I have for my journal.  

TL;DR: If you let users who post content to your website customize the look and theme of their section of the site, provide a way for blind users to disable these custom themes, and use your *hopefully* fully accessible global style.  ","[{'start': 729, 'end': 734, 'entity_type': 'URL', 'text': '<URL>', 'operator': 'replace'}, {'start': 693, 'end': 698, 'entity_type': 'URL', 'text': '<URL>', 'operator': 'replace'}, {'start': 625, 'end': 630, 'entity_type': 'URL', 'text': '<URL>', 'operator': 'replace'}, {'start': 522, 'end': 527, 'entity_type': 'URL', 'text': '<URL>', 'operator': 'replace'}, {'start': 357, 'end': 365, 'entity_type': 'PERSON', 'text': '<PERSON>', 'operator': 'replace'}]"
88,This seems to be what everyone recommends: http://www.hadley.edu/brailleCoursesFAQ.asp,False,False,t1_cqlwybz,fastfinge,,0,1429792527,t5_2qpec,t3_33k5if,t3_33k5if,1,1432555862,0,0,cqlwybz,Blind,1,,,This seems to be what everyone recommends: <URL>,"[{'start': 43, 'end': 48, 'entity_type': 'URL', 'text': '<URL>', 'operator': 'replace'}]"
89,http://en.wikipedia.org/wiki/English_Braille for the rules of the grade 2 language. Then just get a good grade 2 book and start translating it. ,False,False,t1_cqsvd1m,Corm,,0,1430329971,t5_2qpec,t3_2tku9w,t3_2tku9w,1,1432675886,0,0,cqsvd1m,Blind,1,,,<URL> for the rules of the grade 2 language. Then just get a good grade 2 book and start translating it. ,"[{'start': 0, 'end': 5, 'entity_type': 'URL', 'text': '<URL>', 'operator': 'replace'}]"
90,"Honestly, I agree with you.  I don't think it'll help, either.  But if someone wants to try, taking a minute to sign the petition and share it seems like the least I can do.  If we assume a petition won't work, it definitely won't.  If we try, it probably still won't work. But at least it was tried.",False,False,t1_cq9yu02,fastfinge,,0,1428861798,t5_2qpec,t3_32bryx,t1_cq9yl8e,1,1432349481,0,0,cq9yu02,Blind,1,,,,
91,"Thanks for the info!  I'll keep it around for when I go on my summer travels, in that case.",False,False,t1_cqqb857,fastfinge,,0,1430148972,t5_2qpec,t3_33dc94,t1_cqpwi9t,1,1432631801,0,0,cqqb857,Blind,1,,,,
92,"I'm pretty sure I do.  And even if I didn't, I'm not sure why that would cause the app to crash constantly, or cause voiceover to reload out of nowhere.  The most frequent crashes of the Netflix app seem to happen just after selecting an episode or movie: instead of playing anything, it just crashes to the home screen.  Also, if I'm going through multiple search results quickly, the app will reliably crash.  I had it crash twice when I was on the front page going through the stuff recommended by Netflix, but I can't seem to reproduce that one.  When I'm playing a video, often VO will randomly reload if I try and use the controls (pause/rewind, etc).  The other place Voiceover often crashes (4 out of 10 times I tried it) is on the initial screen, when I have to select who's watching Netflix (my account has 3 profiles under it).  When that happens, Voiceover won't read anything when I swipe in Netflix after it reloads, and I need to exit Netflix out of the app switcher to get it working again.  

So, to make a long story short, the app is hardly usable for me.  Maybe they have a different app version on the Canadian and US app stores? What version number is your app?",False,False,t1_cqd5mdc,fastfinge,,0,1429108812,t5_2qpec,t3_32l5ds,t1_cqd2yp9,1,1432404625,0,0,cqd5mdc,Blind,1,,,"I'm pretty sure I do.  And even if I didn't, I'm not sure why that would cause the app to crash constantly, or cause voiceover to reload out of nowhere.  The most frequent crashes of the Netflix app seem to happen just after selecting an episode or movie: instead of playing anything, it just crashes to the home screen.  Also, if I'm going through multiple search results quickly, the app will reliably crash.  I had it crash twice when I was on the front page going through the stuff recommended by Netflix, but I can't seem to reproduce that one.  When I'm playing a video, often VO will randomly reload if I try and use the controls (pause/rewind, etc).  The other place Voiceover often crashes (4 out of 10 times I tried it) is on the initial screen, when I have to select who's watching Netflix (my account has 3 profiles under it).  When that happens, Voiceover won't read anything when I swipe in Netflix after it reloads, and I need to exit Netflix out of the app switcher to get it working again.  

So, to make a long story short, the app is hardly usable for me.  Maybe they have a different app version on the Canadian and <LOCATION> app stores? What version number is your app?","[{'start': 1136, 'end': 1146, 'entity_type': 'LOCATION', 'text': '<LOCATION>', 'operator': 'replace'}]"
93,"They aren't all that surprising to me.  Most training blind people get about computers is done by sighted people who hardly know anything about anything access related.  Folks who went blind later in life, even if they were once gamers, probably don't know anything about MUDs, so just assume they can't game anymore.  Folks who were born blind will only find out about MUDs if they go and look for computer games to play, not from teachers/trainers, or sighted friends.  And they may not even look, having tried so-called text-based games that sighted friends have told them might be accessible (NetHack, Dwarf Fortress, Runescape, etc) and found them totally unplayable, thus giving up hope.  

Wow, all that posting by hand must take you hours.  And then checking back later to respond...that's dedication!  If other MUD owners were as dedicated to promotion as you obviously are, maybe the genre would be in better shape.  ",False,False,t1_cpyxyz8,fastfinge,,0,1427988744,t5_2qpec,t3_312ast,t1_cpyxbd6,1,1432155543,0,0,cpyxyz8,Blind,1,,,"They aren't all that surprising to me.  Most training blind people get about computers is done by sighted people who hardly know anything about anything access related.  Folks who went blind later in life, even if they were once gamers, probably don't know anything about MUDs, so just assume they can't game anymore.  Folks who were born blind will only find out about MUDs if they go and look for computer games to play, not from teachers/trainers, or sighted friends.  And they may not even look, having tried so-called text-based games that sighted friends have told them might be accessible (NetHack, Dwarf Fortress, Runescape, etc) and found them totally unplayable, thus giving up hope.  

Wow, all that posting by hand must take you hours.  And then checking back later to <URL>at's dedication!  If other MUD owners were as dedicated to promotion as you obviously are, maybe the genre would be in better shape.  ","[{'start': 781, 'end': 786, 'entity_type': 'URL', 'text': '<URL>', 'operator': 'replace'}]"
