commentator_id,created_utc,anonymized_body,ups,downs,score,controversiality,gilded,distinguished
f2baa086-a690-4a08-83ab-98f41d532653,1502917179,"Hi! For those who need it, it appears that this video already has transcripts provided by the uploader. If this is untrue, please use the ""Message the mods"" link below to let us know.

---

v2.7.1 | This message was posted by a bot. | [FAQ](https://www.reddit.com/r/TranscribersOfReddit/wiki/index) | [Source](https://github.com/itsthejoker/TranscribersOfReddit) | Questions? [Message the mods!](https://www.reddit.com/message/compose?to=%2Fr%2FTranscribersOfReddit&amp;subject=Bot%20Question&amp;message=)",,,1,0,0,
887bed4d-1d2c-465d-a5f2-10011720c4ef,1504065731,"Hi. I'm really glad this topic was of interest to other people besides me, and am so glad I've gotten so many thoughtful replies. 

Classes are good I'm currently not taking any, but looking into some both on corsera and the local community college is something I've been considering.",,,1,0,0,
ffb3fe92-2bdb-462c-afed-c5aef99b5d8d,1504062228,"This is my Youtube channel. Currently, I mainly do a lot of video game material, but have recently been branching out a bit.

https://www.youtube.com/channel/UCoZujToINVP7xax9BTc7s2g",,,2,0,0,
ffb3fe92-2bdb-462c-afed-c5aef99b5d8d,1502080118,"""Implementation of web accessibility benefits web browsing experience for the blinds.""

Lol, you may want to reword that.",,,3,0,0,
39e3d456-788e-46b0-8900-dc756fa85be6,1502546278,"I forgot to mention the other tip, when you decide on a bake time for cookies, stick to it and don't open the oven at any point. You are correct in that the stab method doesn't work with cookies. And each time the door of the oven is opened the temperature drops out of the range it needs for cooking. So 30 seconds of open oven may result in 3 or 4 more minutes they need to be cooked. This will lead to frustration because we don't actually know now if the original bake time you decided on is or is not sufficient. That situation is very frustrating. The anxiety will be reduced though by trusting in your recipe, and letting the recipe fail, and making only simple adjustments to the recipe after all the data is in from the cooled and tested cookie. ",,,2,0,0,
6f5cde6d-e1cb-4d27-89b1-d6123e70c1ef,1504056056,"Agreed. Started learning a few years ago, but I dropped it for quite a while. I'd just make one, but that sounds like a lot of work. Haha.",,,1,0,0,
f9f54438-f5c9-44db-bfb1-2937dd5d89a7,1502584906,"I worked for county government for almost 13 years, so I was reaching the mid-career point when I got sick.  Our pension plan actually offers a disability retirement benefit that is a better option than either withdrawing your funds (and pay penalties plus taxes) or leaving it until retirement age.  You go through a medical review process like for SSA disability, but it moves more quickly.  

Here in KY, I don't think teachers contribute to Social Security.  A lot of teachers work part-time jobs just to pay into SS.  My disability retirement benefits will be in addition to my SSDI, but the combined amount can't exceed 80% of last rate of pay or my county pension gets reduced.

Now would be a great time to get into programming for government.  Many states and large cities have in-house developers either designing proprietary software or working on interfacing various software platforms.  Most government is way behind the curve, so there is a definite need.",,,1,0,0,
3c0a5c2d-4532-404e-81c7-9fbd7a356ef0,1503882089,"Years ago I tried an early Vuzix product and had a similar complaint. It seemed that you actually needed pretty good vision to take advantage of this product for people with low vision. The screens felt very far away. It's too bad, since, for example, I can much better through my iPad camera than I can unaided, but tiny screens far away don't really help.",,,2,0,0,
7dfa93f1-b4ca-4f21-9908-d574d170abee,1504185669,"As the dissenting voice, I can understand being annoyed by this, depending on the situation. However, she should have explained why she was annoyed in that situation to you to make the interaction less negative.  Personally, I get annoyed when:

1.  The person opening the door for me is standing in the door themselves.  I can't see you to go around!  If you're standing in my way, this could mean bumping into you, or increased anxiety having to figure out how much of the door you're blocking while holding it open for me.  If you're holding the door open, make sure you're standing somewhere where I won't bump you trying to go through the door, or if you can't do that because of the layout, call out so I know where you are.  

2.  You didn't fully open the door.  Again, sometimes you can't, for various reasons. But if you're holding a half-open door, I'm likely to misjudge, and just walk into the door itself, rather than through it. Painful! Or just try an go through on the wrong side. If I open the door myself, that never happens, because I'm holding onto the door so I know where it is.  

3.  You didn't tell me you were opening the door for me!  This results in a situation where I know I'm approaching a door, so I slow down, and hold out my hand, looking for the door.  Then...know door! I move slower and slower...am I lost? Where'd the door go?  Awkward, and puts me off my feed.  Then five seconds later I realize someone is standing there holding the door. And they're probably judging me, wondering why on earth I slowed down in the middle of the door and held out my hand.  OK, you're probably not judging me; put that feeling down to personal anxiety.  

But any of those things are simple to explain. A simple ""Woe, dude! I didn't know you were blocking the door...almost bumped into you!"" or ""Oh, I didn't realize you were holding that for me!"" or similar would explain why I was annoyed without making the interaction negative.  So if any of those things is the case, failing to explain is on her.  ",,,4,0,0,
47da1bf7-15f1-4cf4-a7a5-922282223dfa,1502080942,"My bad, feels free to correct my English as well :P
My English isn't really that great",,,1,0,0,
7dfa93f1-b4ca-4f21-9908-d574d170abee,1504186993,"The reason I don't use it is because I never know what videos have it available. If they only had a chrome extension that would detect when I looked at a video that was on you describe, then just automatically redirected me there from youtube, it would be perfect. As it is, only like one tenth of one percent of things on youtube have descriptions on you describe, so I just never remember to bother looking.

Edit to ad: Woe! Is it just me, or did youtube rewrite the entire website this morning?  Now I'm confused and upset.  I'll probably like it better eventually. Maybe it'll be more accessible.  But right now I'm just starting the whiny ""WTF?"" stage.",,,2,0,0,
28bd916f-f773-4af6-b115-ec219e094f89,1502433031,I am legally blind and was always. Visual leaner. I gesture a lot with my hands still when I explaining something. I also still ask for a lot of details so I can visual places and people. ,,,2,0,0,
3c0a5c2d-4532-404e-81c7-9fbd7a356ef0,1503332360,"My understanding is that accommodation of blindness and low vision is less assured where your friend lives. In my (Western) experience, VI people tend to gravitate toward these professions, though they are by no means the only professions your friend could choose:

- Accountant
- Advocate
- Lawyer
- Programmer
- Musician
- Human Resources
- Counselor
- Radio
- Disability Service
- Researcher/Analyst
- Dispatcher
- Engineer
- Teacher/Professor
- Business Consultant
- Web Accessibility Specalist
- Government

These are compiled from my own experience and this (somewhat outdated) report: http://www.blindness.org/pdf/careerbook.pdf",,,1,0,0,
c4f82a04-745f-4b72-b4ac-42a7c56532cb,1501717420,"Word!

If you're using the Google Maps API there are themes available from places like Snazzy Maps that can help address the contrast issue. I've gone through a few of those though and even the best of them (in terms of contrast) still aren't perfect. 

Best of luck :)",,,1,0,0,
7dfa93f1-b4ca-4f21-9908-d574d170abee,1503403316,"Not surprising, really. It was the second or third week of a large university class with something like a hundred students. That's why I didn't want to miss it; missing early classes sets me slightly behind for the entire term.  So it wouldn't surprise me if anyone who saw me didn't recognize me. Plus, I don't know about you, but the first impression a lot of people seem to get of me from a distance is ""that blind guy with the cane"". So sleeping on a bench, with my cane folded and tucked away, would make it even less likely they'd recognize me.  Plus, it was an 8 AM class. I doubt anyone else was all that awake either.",,,2,0,0,
921e5395-df5d-454d-a32b-a858be44fe00,1502448856,I didn't code any kind of captcha. I don't have any idea where that is coming from. Thank you for input. Any additional details appreciated!,,,1,0,0,
f4c33857-c4e0-4d69-9dd6-aeade46e5c6d,1504166498,"The only time I get annoyed with help, is when people scare me by grabbing my arm or elbow without asking.
",,,3,0,0,
c4f82a04-745f-4b72-b4ac-42a7c56532cb,1501717472,"Word!

If you're using the Google Maps API there are themes available from places like Snazzy Maps that can help address the contrast issue. I've gone through a few of those though and even the best of them (in terms of contrast) still aren't perfect. 

Best of luck :)",,,1,0,0,
863382c6-db10-4d42-a2bc-a9544104e038,1501955370,Ah so if you use English as the default the braille display will still show accented letters? I was afraid it would just ignore that letter ,,,1,0,0,
d829e41e-0b4a-4608-a330-6822d193a49f,1502890458,"Thank you so much for the tip. So sorry about the menu issue, we will keep the thread updated so when we make updates hopefully you can play!

",,,2,0,0,
bd938754-7e97-4f4f-a7c2-5285808657fc,1502411047,"I think the individual's personality would still matter greatly. I'll give you three case studies to show you what I mean. 

Client A went in for routine heart surgery. During the surgery, there was a complication and his brain didn't get enough oxygen. It caused brain damage to his occipital lobe, which caused complete vision loss. 

Client B was diagnosed with retinitis pigmentosa at age 20. It is an aggresive version, and told that he will likely lose all of his vision before he is 40. 

Client C is an elderly client who has been diagnosed with macular degeneration, an eye condition that damages the central vision that causes loss of fine detail. While it doesn't cause total blindness, it will make it virtually impossible to read without adaptive aids, or to see her grandchildren clearly.

In all three of those examples, I've had that happen to more than one client. Sometimes the client gives up and doesn't want to do anything... another client, though, may refuse to give in and work hard at their rehabilitation. ",,,1,0,0,
df001a02-04aa-432f-a604-1c6d22442efb,1501988095,"1. 23 F. Visually impaired since the age of six with vision having grown consistently worse throughout much of my life.
2. I consider myself moderately kinky. I'm very into being submissive. To be more clear, I like my partner to call me a whore/sex toy, be rough, tie me up, etc. I have a general thing for bondage. I also have a kink for partners who are significantly bigger than me (I am quite small so this is easy to achieve).
3. I am pansexual. Gender is fairly irrelevant to me. I find lots of men, women, gender-queer, transgender, etc people attractive. Currently, I am with a cisgender, hetero male. That's just what fate led me to. 
4. As I said, i'm pansexual. I will say that personality has a huge part in whether or not i find someone attractive sexually, enough to make a move. I might look at a woman and be like ""Yeah, she's hot"" but that doesn't motivate me at all. I'd have to talk to her and see if I actually connect.",,,1,0,0,
3c0a5c2d-4532-404e-81c7-9fbd7a356ef0,1502076503,Remember that these devices have to fit into people's lives. Will people walk around with a Pi in their pocket? Probably not. But as a prototype it might be interesting.,,,1,0,0,
7dfa93f1-b4ca-4f21-9908-d574d170abee,1503522470,"The term ""blind stick"" is not correct; the word you want is cane.  Also, question 8 is unclear/inaccessible.  Does 1 star mean most challenging, or is 5 stars most challenging.  I suspect this is indicated visually, but not to screen readers.",,,1,0,0,
bfed6c15-5ed5-4aa8-a68b-c27f735c7087,1501683679,"Hi! 

I get that everyone is looking for different stuff, but since you are browsing listing sites, and do have Stargardt Disease, you might be facing problems that sighted people are not. Like finding essential information, or having difficulties going through a listing site with a screen reader or a magnifier program. ",,,2,0,0,
d982ccf3-44d0-4806-b2bb-053867724cef,1504175509,"Maybe she felt you were trying to take her independence, I'm visually impaired but I like it when people hold the door out of politeness but I can understand people having a problem with it ",,,3,0,0,
ed0776cb-0218-4be6-97b2-92c8de993c2e,1504211897,I was born legally blind.  I see a bit better than I did then thanks to corrective surgery and strengthening my bad eye with patches.  Still legally blind though.,,,1,0,0,
47601089-648b-456b-b886-bca153eb9f2a,1502071529,"This is just the free community gym. I found someone willing to run with a tether, so we're going to give it a shot tomorrow morning!",,,1,0,0,
2fe2ef52-35b0-4a1b-bfbb-8569f2c3c4f0,1503887143,Great work. You're very appreciated.,,,1,0,0,
7dfa93f1-b4ca-4f21-9908-d574d170abee,1504184916,"Born blind for me, as per my flair.  Never even had light perception.",,,2,0,0,
7dfa93f1-b4ca-4f21-9908-d574d170abee,1504190662,"They're still supporting Win 7, as long as service pack 1 has been installed. It's only win 7 without sp1 that isn't supported. And Microsoft no longer supports Vista.  Microsoft an NVDA continue to support Windows 8 and Windows 8.1.  ",,,3,0,0,
70563e3b-9834-4622-a4f4-7d0fd3d0c0f0,1502062380,"Remember your local Y, health club, etc should make all equipment etc accessible. That's the law. Just ask. My husband lifts weights and takes classes like spinning. There is also a group in Richmond VA called Sportable. They have adaptive sports of all types -- guides for running, rowing, etc. ",,,2,0,0,
cc94062a-466e-412f-8def-b096f7fa524f,1503544970,"Hi there, I'm an MA in poli-sci and even if you wanted to go full academia in our field you could definitely keep going with accessibility features and screen readers. There are blind coders so even something that's a pain like R won't be impossible to use.

Also since you're still in the ""what do I do"" stage I'd recommend contacting your University's disability services department (whatever they're called), and [Lighthouse](http://www.afb.org/directory/profile/lighthouse-for-the-visually-impaired-and-blind/12). Some of my friends are blind and they've had very positive things to say about the local branch of Lighthouse, hopefully yours is as good.",,,2,0,0,
0ce20fc4-3fd6-43af-97c7-4874225ec47e,1502436834,There is an audio alternative  captcha I was able to complete on my cell phone.,,,1,0,0,
3c0a5c2d-4532-404e-81c7-9fbd7a356ef0,1504209337,"Ah, that's not so bad then. I didn't even realize Vista had ended support, it was in April apparently.",,,2,0,0,
a31ded7a-b91d-4c92-85f6-b6c56d69a09e,1502324878,"Being blind feels like being sighted, with some extra Annoyances. There is nothing especially   unique or different about how our mindes work.",,,4,0,0,
7dfa93f1-b4ca-4f21-9908-d574d170abee,1503012835,[nvda](https://www.nvaccess.org) is what most of us use.  But [Balabolka](http://www.cross-plus-a.com/balabolka.htm) might be more like what you want.,,,2,0,0,
bd938754-7e97-4f4f-a7c2-5285808657fc,1502239021,"What you need a sighted guide for is rather important. If you only need a sighted guide for a short route (say, to cross a street or locate an unfamiliar room in a new building), you should be able to find someone nearby that can quickly assist you. 

If you need a sighted guide for a longer period of time (say, you need guiding between classes all day for a university), you should check with classmates to see if they can assist you.

If you need a sighted guide to help run a marathon, you should probably check into local running clubs. 

",,,1,0,0,
9f7fbd78-9ef2-422e-8e15-bfce552d43e4,1502081282,"If you happen to live in california (or if you want to donate to a CA based org), the Braille Institute is fantastic! I joined their youth programs shortly after losing my vision and they really have become a second home for me. I still come back to volunteer every now and then, and i just love watching the kidsos become more confident and independent through their experiences with the programs",,,1,0,0,
7dfa93f1-b4ca-4f21-9908-d574d170abee,1502284231,"Hmmm.  I guess my favourite books would be the Harry Potter series, followed by the works of Robert Heinlein and Piers Anthony.  The best Heinlein is _Time Enough For Love_, and the best Anthony is probably the adept series.  ",,,1,0,0,
f4c33857-c4e0-4d69-9dd6-aeade46e5c6d,1503761366,"Not one. Am good mates with a band on lineup, so had same pass as the band members.",,,2,0,0,
bd938754-7e97-4f4f-a7c2-5285808657fc,1503457101,"There are a few factors that could contribute to vision loss from looking at the sun. The biggest factor is the time spent looking directly at the sun, and the second bigggest is any sort of magnifying lens (like glasses). 

If you have no pain and no obvious vision issues, you likely wouldn't have to worry much (but you can always ask your doctor to check for damage for your next visit). If you did have pain or obvious vision issues, you should see your eye doctor sooner.

Not someone I know personally, but I heard about a case where someone had looked up at the sun during a partial eclipse and didn't experience and ill effects. But a few years later, they end up having an unrelated eye condition and it did reveal they had damage to their retina.",,,1,0,0,
c4f82a04-745f-4b72-b4ac-42a7c56532cb,1501717315,"Word.

If you're using the Google Maps API there are themes available from places like Snazzy Maps that can help address the contrast issue. I've gone through a few of those though and even the best of them (in terms of contrast) still aren't perfect. 

Best of luck :)",,,1,0,0,
887bed4d-1d2c-465d-a5f2-10011720c4ef,1504065477,"Yes, this is my preferred method as well. I just find it difficult to actually go to events where there are a lot of people who already know each other. That said it is actively one of the things I want to get better at doing more of. Thanks for the suggestion.",,,1,0,0,
92fd5e93-3121-49c5-bb57-5eb38365bf31,1503989050,"Awesome, thanks for the tips! I didn't realize there were so many options, so I will definitely research these now! :)",,,1,0,0,
3c0a5c2d-4532-404e-81c7-9fbd7a356ef0,1503459620,"Not sure how old your father is, but with a vision impairment learning how to use a smartphone with a screen reader can help with independence and feeling connected. Visual impairment shouldn't necessarily mean your father can't run, but you may need to put a little more thought into where and when. Some older people have reported that they like the Amazon Echo, since they can just talk to it (no real learning curve), but I'd buy him an iPhone, learn how to use the screen reader yourself, and try to teach him.

If you have some financial resources, I'd start with an Echo and some podcasts or audiobooks. Get some classic stuff like Orson Welles or something else related to his interests. Just make sure he isn't sitting alone stewing, if he's listening to something or talking to people he'll do a lot better. Also find a way for him to get exercise, whether it's swimming, walking, or running. ",,,2,0,0,
3c130157-57ac-4503-afde-a50cbd9cb4d6,1501943440,"I'm not a JAWS user but know many who do use outlook.

With NVDA (the screen reader I use) outlook works pretty well once you get used to the layout. Same goes with thunderbird although I've heard it doesn't play as well with JAWS.  
P.S. I should addd  that I'm relatively tech savvy compared to the layman.",,,1,0,0,
4d84bf48-e38f-42a4-b8ce-b5b1f8b5c60f,1502820213,Downloading the game right now. I am partially sighted and will check it out!,,,2,0,0,
7dfa93f1-b4ca-4f21-9908-d574d170abee,1502389288,"Whatever fits with the show. A deep male voice describing a magical girl anime would be strange.  Similarly, a young female voice describing the latest ultra-violent military flick would be distracting.  ",,,6,0,0,
bd938754-7e97-4f4f-a7c2-5285808657fc,1501561642,"I've never had a client use a jumbo tip before (although they are available), but looking at the design, it would catch on just as many things as the roller marshmallow tip. It would definitely last longer, I believe it is made of the same material as the high mileage tips (Although if lasting a long time is a factor, you should also consider the ceramic tips).

Yes, the roller ball is hollow, and when it's worn down enough, the ball comes apart. I don't see that happen very often, though, and when I do, it is usually because the client has been using the ball for a really long time. Where you live, is there a program that helps cover the cost of a cane? In Ontario, the health care system covers 75% of the cost of a cane every year. It doesn't cover the cost of a roller tip specifically, but your area might. 

If you aren't happy with either choice, there is a third option, although that may not be what you want either. It is called the Rover tip, and it is a wheel. The technique to use it is slightly different as well, because you need to twist your wrist at the end of each scan to line the wheel up for the scan back to the other side. Because it is a wheel, it rolls over a lot more obstacles and doesn't get damaged as easily. However, it is physically more difficult to use. Most of the people who use this sort of tip usually uses it for hiking or non-paved surfaces. Also, it sucks in heavy snow (sinks into the snow if it is too deep, too heavy and unwieldy to use for two point touch). 

https://ambutech.com/shop-online/rover-free-wheeling-hook-tip

",,,2,0,0,
8fd01324-2dfd-45de-9783-79bca3340315,1503842591,"DO you use mac or windows? If I buy this, it would be on a windows ten laptop.",,,1,0,0,
0ce20fc4-3fd6-43af-97c7-4874225ec47e,1503907815,"Thanks for sharing your review!

I didn't get to do a full demo of esight, but I did briefly try them at a conference. While I was impressed with how far away I could see objects with it, the view was very narrow and grainy to me (at the high level of magnification needed.) Nothing about it seemed like $10,000 worth. 

I've seen compliants online previously from people who claimed that they weren't able to make use of the devices and had trouble returning them, although I've obviously never bought the device so I can't personally say if this is the case.

Plus, I just don't like their advertising. For example, their site states: 

&gt; ""eSight is a comprehensive customized medical device that can replace all the many single-task assistive devices that are currently available but do not provide actual sight (e.g. white canes, magnifying devices, service animals, Braille machines, CCTV scanners, text-to-speech software).""

Now how in the hell is a pair of zooming glasses going to replace a white cane or guide dog? What are you going to do, carefully scan around with the glasses before taking every single step? And how do magnifiers and CCTVs not ""provide actual sight"" as opposed to what seems like basically a fancy glasses-mounted CCTV system? 

Also, the idea that low vision tools (like this) can fully replace non-visual tools (like text to speech or braille) in partially sighted people is wrong and harmful to partially sighted people, even those on the ""more sighted"" end of the spectrum. Imagine a child who might be made to read with exclusively magnification tools. How much faster (and with less eye strain and pain over long periods of time) might they read if they were given adequate access to audio or braille? 

They really seem to be trying to sell up how ""unique"" and ""revolutionary"" these systems are, probably to encourage family members, donors, and organizations to pay that much money!  For example, the site also has a section of ""moments"" which are videos of people using the glasses. They have titles such as ""Christian sees for the first time,"" ""10-year-old Sophie gets the gift of sight for Christmas,"" and ""John has been blind his whole life. But he can finally see!"" 

Yuck.",,,2,0,0,
47601089-648b-456b-b886-bca153eb9f2a,1501640818,"I have been applying to EVERY clinical trial for it in my area, but I never meet the age requirements. I have late onset Stargardt disease. ",,,3,0,0,
b73591d8-60c2-48e7-82f1-3403ae8fb8f3,1503761824,"Thanks, didn't know how any of that worked.",,,1,0,0,
ed77879d-aebc-446e-b289-a128ddfb9e03,1502449100,"
Male 21 US.

1. I have been blind sense I was born
2. I am only attracted to girls.
3. I would have to say I perfer my sex in a jacuzzi or big huge bath. I'm also a virgin. But I hope to find the right girl some day and share that with her. I'm not into open relationships at all. I hope this isn't as bland as most of the posts or comments. God Bless.",,,1,0,0,
3c0a5c2d-4532-404e-81c7-9fbd7a356ef0,1501946205,Yikes. That is kind of scary. I'd love to hear if there is any resolution on this...sounds like the Amazon right hand might not have known what the left hand was doing.,,,5,0,0,
d829e41e-0b4a-4608-a330-6822d193a49f,1502892212,Gave this to our lead programmer and he wanted me to pass on his personal thanks for sending this over...so TY:)! ,,,2,0,0,
