commentator_id,created_utc,anonymized_body,ups,downs,score,controversiality,gilded,distinguished
d3b78228-c040-4e3c-9541-e7c5bbab6368,1504053671,"Here is a link to my good friend Paul's YouTube page: https://www.youtube.com/user/BlindSkierDude/featured

Sadly Paul passed away two years ago. I am pretty sure he did all the work on the page himself.",,,2,0,0,
f2baa086-a690-4a08-83ab-98f41d532653,1504116284,"Hi! For those who need it, it appears that this video already has transcripts provided by the uploader. If this is untrue, please use the ""Message the mods"" link below to let us know.

---

v0.2.0 | This message was posted by a bot. | [FAQ](https://www.reddit.com/r/TranscribersOfReddit/wiki/index) | [Source](https://github.com/itsthejoker/TranscribersOfReddit) | Questions? [Message the mods!](https://www.reddit.com/message/compose?to=%2Fr%2FTranscribersOfReddit&amp;subject=Bot%20Question&amp;message=)",,,1,0,0,
3c0a5c2d-4532-404e-81c7-9fbd7a356ef0,1503609253,"NVDA is a good option. If you have an iPhone, you can try turning on Voiceover and testing your software with that. I recommend turning on the ""screen curtain"" feature that blacks out your screen so you get a better sense of how it would actually be to use your site or product.

There are many things frequently done wrong on the web, but the two most common are no or poor alt text on buttons and images and a lack of semantics.

The alt text issue is actually more common and annoying for buttons, search boxes, etc., than it is for images, since often it's not really important to know what a particular image is, but it's really annoying to hear the word ""button"" and not know what it does. Most screen readers have a labeling feature so you can experiment and name things yourself, but obviously that's annoying to have to do.

Semantics means using elements for what they mean, rather than what they look like. While for sighted people a list formatted with CSS might look like a table, a screen reader user might not be able to understand that it's a table or interact with it properly unless it actually uses table tags. Similarly, sighted designers often use heading tags indiscriminately because, say, they think the &lt;h3&gt; tag looks nicer and let's just go with that. But if you're laying out a page structure, it's really annoying to be a screen reader user and to have the heading tags have no semantic meaning. Similarly, it's better to use &lt;nav&gt; than to use a styled list (though I'm guilty of that one myself).

Good on you for taking it upon yourself to learn about this.",,,1,0,0,
d8f65f9d-e7b2-43fb-8940-7b73548546ac,1502534655,Cookies continue to bake when they're removed from the oven. I would follow the recipe times and put the pan of cookies on a wire rack for about 10 minutes before removing them. Maybe you can do a couple this way to try the time suggested in the recipe without wasting it all. You want your cookies to come out of the oven soft to the touch because they will harden some when cooling.,,,3,0,0,
bd938754-7e97-4f4f-a7c2-5285808657fc,1503545425,"The term sighted guide refers to a specific method of guiding someone (someone sighted guiding someone who is blind). For question 7, the question would be better phrased ""What method do you use to travel around?"". And as /u/6b71e46e-9c9c-43d9-bb9e-90dfc13ffcd9 said, the proper term is a cane (to be specific, a mobility cane). 

Overall, your survey uses the phrase ""sighted guide"" as a catchall term for travelling independently. 
",,,2,0,0,
ebf0bc5f-1096-49fd-b997-20e9cb61766a,1503302089,"I'll follow up with the team, thanks.",,,2,0,0,
1b221c6f-90d4-41c9-a562-0b068cad288b,1504133510,"Oh man I miss roleplaying! I've tried to join groups on Goodreads but I just get ignored. Not a huge fan of group roleplays. 

That's interesting! I once met a guy who was blind and loved classical music. I love bands like Twilight Force and Nightwish, the longer songs sound like a movie. 

Ooh, how could D&amp;D work with electronics? I was interested in playing that but I found everything just so overwhelming. ",,,1,0,0,
887bed4d-1d2c-465d-a5f2-10011720c4ef,1503451831,"My understanding from viewing warnings about it are that you'd know. You'd be experiencing color dimness and probably pain, at the least. ",,,1,0,0,
7dfa93f1-b4ca-4f21-9908-d574d170abee,1502566204,"Just for the tech side of things, [NVDA](https://www.nvaccess.org) is free, and cheap training material is available.  If you have the time and interest, you don't need the CNIB (or anyone else) to get you started.  ",,,3,0,0,
1b221c6f-90d4-41c9-a562-0b068cad288b,1504218340,"TF are like... uber-cheesy, almost-Disney kind of power metal. It's wonderful. And yes, Floor is amazing! I'm not a fan of EFMB as an album but Showtime, Storytime is amazing. 

I write and like to roleplay romance haha. It's lame, I know, but it's fun. 

That's awesome, I'll definitely check out tabletop rpgs some day!",,,1,0,0,
1586bb74-45d5-4d20-9c71-26a3e6e5c607,1502417191,I was thinking just that. I've used a USB turntable before for my father and it worked well. Any suggestion for apps that would allow him to do it himself?,,,1,0,0,
3bd4153b-1def-4abd-a81c-cfbe619819ae,1503639281,"Yep, puffitup or planet of the vapes will help you",,,2,0,0,
d26a138b-971e-40df-99f6-0bd4860670bf,1501960067,TBH I don't have hands on experience with refreshable Braille displays connected to iOS or android but if it translates correctly it should show the accents. ,,,2,0,0,
72c696fd-bc5d-439e-a107-56469cfefc1d,1502197941,"There is a very different attitude to firearms in the UK compared to the US and possibly Canada, though. Firearm ownership is pretty rare, and attitudes mean that owners are unlikely to take their firearm out of storage  (excepting hunting)",,,1,0,0,
bd938754-7e97-4f4f-a7c2-5285808657fc,1501721840,"Skin colour doesn't really have any textual difference. It would be moisturizers or whatever skin treatments that you feel (and age, UV exposure and other things would be a factor)",,,1,0,0,
bd938754-7e97-4f4f-a7c2-5285808657fc,1502079079,"Under educational status, some countries don't use Tertiary, so you have have to explain that a bit further. 

I assume screeen amplifier refers to a magnifier? Some people also move closer to the screen, or hold up an actual magnify glass to the screen (that doesn't work as well, but I've seen it before). 

In regards to asking how long someone has been blind, you may also want to include a question asking if they have been blind all their life. If someone answers their age as 19-30, but then lists being blind as over 20 years, you wouldn't be able to tell if someone was born completely blind, or lost their vision at 9 years old, which would have major differences. ",,,3,0,0,
bd938754-7e97-4f4f-a7c2-5285808657fc,1502411391,"That sounds like RP or some sort of rod-cone dystrophy. 

Have you seen a low vision specialist yet? They may be able to make some suggestions regarding tools that may help.

For night blindness, one thing that helps is carrying a flashlight. A decent, high powered one with a good LED light, not one of those ones that you get from the dollar store. It might cost $20 to $30, but can be quite effective. Another possible tool is yellow sunglasses. They are not always helpful, but they do help to bring out the contrast. 

Depending on how progressive your condition is, you may want to also consider speaking to your state agency regarding early rehabilitation training. While you may not need a full mobility cane, you may find an ID cane useful. ",,,2,0,0,
90acf455-4cd0-4185-8e7c-4b3d53fee01a,1504205178,People actually used Vista. Thought that was a funny joke,,,3,0,0,
df001a02-04aa-432f-a604-1c6d22442efb,1503362711,"I have a collage of various flowers (Sunflower, daffodils, ranunculus, and lavender) on my left upper thigh. I plan to get a similar tattoo in the future on my right thigh.",,,1,0,0,
887bed4d-1d2c-465d-a5f2-10011720c4ef,1504081957,"If I might ask, what interests do you have? Game of thrones is really popular, but it is good in spite of that. 

I'm not sure if it helps, but iOS 11 will have a way to access subtitles in streaming apps like netflix and amazon. Its not perfect, but I hope it helps. 

Good luck with the rest of your semester.",,,1,0,0,
b73591d8-60c2-48e7-82f1-3403ae8fb8f3,1503760763,"What kind of artist are you, if I can ask?",,,1,0,0,
ffb3fe92-2bdb-462c-afed-c5aef99b5d8d,1502118950,Haha no worries. I would suggest changing it from blinds to people who are blind or blind people.,,,1,0,0,
7dfa93f1-b4ca-4f21-9908-d574d170abee,1501863151,"Did you see [the one yesterday](https://arstechnica.com/tech-policy/2017/08/podcaster-can-you-admit-to-me-that-youre-a-scammer-please) about the podcaster who went to India to confront a ""department of Windows"" scammer who called him?  I was expecting to read about a dead reporter for a minute there.  LOL.  ",,,3,0,0,
65134dbb-cb2c-48e9-ae49-d82fe8da5a8c,1503680137,A reminder that [NVAccess depends on your donations](https://www.nvaccess.org/donate/) to keep working on NVDA,,,3,0,0,
ffb3fe92-2bdb-462c-afed-c5aef99b5d8d,1502807856,"I'm a huge gamer, but this doesn't really sound like my type of game. However, I would suggest asking over on audiogames.net. I'm sure you can find a ton of people who will be willing to help out :).",,,7,0,0,
58071da6-869f-4389-9a4f-0e1412d38c7c,1503946738,"Related to this, there is a battery type option under device settings which may also need to be set.",,,1,0,0,
c4f82a04-745f-4b72-b4ac-42a7c56532cb,1501718324,"That works too :P

If you're using the Google Maps API there are themes available from places like Snazzy Maps that can help address the contrast issue. I've gone through a few of those though and even the best of them (in terms of contrast) still aren't perfect. 

Best of luck :)",,,1,0,0,
80835783-62cf-4845-833c-6e1827b93448,1503619763,"In any case, while I would not recommend taking drugs, if you're going to take them anyway a vapouriser may make it less harmful.
",,,3,0,0,
b0ceb496-2ec9-4182-b7d4-4e9d6dee7034,1501550389,"Thanks for your feedback! As of now, I've decided to work on a combination of 1 and 3. You're completely right that an ultrasonic sensor would be better suited for distance measurement, but thankfully, as part of their push in augmented reality, Apple has embedded similar functionality inside their SDK. I'll make sure to come back in September or October to share the app.",,,2,0,0,
2e0665a4-8cc5-4fb5-a541-cab3c34f5269,1503765164,I listen to a lot of audiobooks on Android. My idea was to listen to a codebase on Android with the freedom to move around and so forth. I understand this is incredibly bizarre :-),,,1,0,0,
5b999348-0de6-4ad5-9d39-07f2807d5120,1501920568,"You gave me an honest and respectful answer to my question. I don't understand how you could possibly think that offensive.

It's difficult to decide between all these organizations, so I will likely do some sort of three-way split, and this organization will definitely be one of the recipients. They sound great. Thank you for your input.",,,1,0,0,
3c0a5c2d-4532-404e-81c7-9fbd7a356ef0,1502548281,"Learning styles have been repeatedly debunked, though it doesn't seem to stop people from beleiving in the idea: https://www.psychologicalscience.org/news/releases/learning-styles-debunked-there-is-no-evidence-supporting-auditory-and-visual-learning-psychologists-say.html

Math, though, is indeed harder to learn nonvisually, though certainly not impossible. ",,,1,0,0,
4d84bf48-e38f-42a4-b8ce-b5b1f8b5c60f,1502880443,Would it be possible for the app to automatically dictate a version of what you said at startup? Maybe some kind of option for the deaf and hard of hearing?,,,1,0,0,
7dfa93f1-b4ca-4f21-9908-d574d170abee,1504186620,"I hate 'em.  Mostly because if I'm upside down, I get sick.  Doesn't matter how long, or why, or when. If you turn me upside down, I will throw up. It's a fixed law of the universe.  I can spin, or go up and down, or side to side, or any other motion.  But upside down means it's instantly time to toss my cookies. So my inability to see the track means it's impossible for me to judge what I can ride safely, and what I can't.  And even if I tell friends about this, the first time I go on rides with them, they assume I'm not that serious. ""Ah, it's not that bad. I just won't mention it.""  Then they're sorry!  ",,,3,0,0,
28bd916f-f773-4af6-b115-ec219e094f89,1503438282,"My grandmother has the firefly. She presses a button and it calls a phone center that we have give her contacts to, so she says ""call my son please"" and then they dial his number. That way she doesn't have to try to remember everyone's number. ",,,1,0,0,
a0cd523b-23b9-4e39-a8cb-1f3d7aae6055,1501730717,oh my god I hate those dreams where you can't run it's so awful,,,1,0,0,
7dfa93f1-b4ca-4f21-9908-d574d170abee,1503765730,"I'm not sure you could get anything from listening to a codebase that way.  When I'm programming, I often move line by line, so I can stop an think about particularly complex sections. Or sometimes I move character by character, in the case of deeply nested if statements.  Plus, my windows screen reader has methods to tell me how deeply indented I am, so I can track scope etc.  I often skip from one level to the next, so I can skip over blocks of similar or uninteresting code, rather than have to listen to it repeated over and over. When I'm ""listening"" to code, I never just start it reading and sit back and listen.  It's a deeply interactive process, involving lots of skipping around, lots of changing granularity (from character to line to code block etc), and sometimes even adding explanatory comments to parts of the code I know I'm going to forget, and don't want to have to listen to entirely multiple times (""// Standard network initialization; next section does nothing interesting"").",,,1,0,0,
b73591d8-60c2-48e7-82f1-3403ae8fb8f3,1503402111,"Wait ... it's yellow? TIL.

Also, story number two is one of my greatest fears, and why I always go for the stall.",,,1,0,0,
bfed6c15-5ed5-4aa8-a68b-c27f735c7087,1501773274,I'm already using Snazzy Maps for some website projects of mine! I'll keep you posted! Thanks again! ,,,1,0,0,
a31ded7a-b91d-4c92-85f6-b6c56d69a09e,1503619837,"I'm blind and my job is to do accessibility testing for Temple University. Check out the Web Aim wave accessibility tool.
http://wave.webaim.org/
I use the firebox extension every day, and I think it's a good tool to have in your arsenal. Wave will flag a lot of accessibility issues and concerns and explain why they matter. FYI, tools like Wave are never as good as simply testing web pages with assistive technology. It's great that you’re testing with NVDA.
",,,1,0,0,
8fd01324-2dfd-45de-9783-79bca3340315,1504205740,"They're awesome! There's the moving and the falling and the rising and the flipping and the spinning. I went on the Saw roler coaster at thorp park and it was great! Apart from the scary speakers that you walk past and they make a noise, that part wasn't fun.",,,1,0,0,
c4f82a04-745f-4b72-b4ac-42a7c56532cb,1501641545,"Ah, excellent! Just the man I need! Roll20. It's gods awful for accessibility (I mean, its interface is clunky and unintuitive, but it's got woeful compatability with high contrast. Not sure how screen readers handle it, they likely don't). So if you want a project and a half, have a look at that :P

Yes, dimensions usually are off a bit. For the most part it's not a huge amount, but if they were tight to begin with then that can be problematic. It's nothing malicious, just building errors. I remember a bloke measuring up a room in a property we were viewing and it was not square :P 

1) Negative, I do not currently use a screen reader. I use high/inverted contrast however. 

2) When you say map, you mean map of where the property is located I take it? Maps aren't useually provided in Australia. I find maps nested in websites to be annoying to use (there's a few reasons, the big one being Google maps doesn't invert colour in Firefox, which is my primary browser, so I have to open up Chrome for using Google Maps. There was also a year or two there where Google Maps didn't work with the Chrome high contrast extension. Those were dark days, or blindingly bright days as the case was).

Edit: And I should add that I use the directions feature of Google Maps to see how far away things are by certain means of transportation. So I need that functionality, which nested maps don't have (afaik?) and is better using the whole window anyway. That's my personal feeling anyway.",,,2,0,0,
3c0a5c2d-4532-404e-81c7-9fbd7a356ef0,1501866787,"This is what an article in this space should be. No blindness puns (""a cure is in sight!""), no breathless tone, and some actual research with links to other similar projects. I went ahead and ordered one to try it out.",,,3,0,0,
ffb3fe92-2bdb-462c-afed-c5aef99b5d8d,1502388199,"I honestly don't mind either way, as long as either gender doesn't have an annoying voice. A+ if the female narrator sounds hot, haha.",,,5,0,0,
a0cd523b-23b9-4e39-a8cb-1f3d7aae6055,1501640275,Is that anything like sleep paralysis?,,,3,0,0,
7dfa93f1-b4ca-4f21-9908-d574d170abee,1502398819,"Ah, OK. In that case, a shuffle might be your best bet.  I was going to recommend a couple other devices, but they all give voice feedback in English.  If she speaks French, Google Home will work in French (and I think German and Spanish now?).  ",,,5,0,0,
3c0a5c2d-4532-404e-81c7-9fbd7a356ef0,1503433378,"I'd consider an Amazon Echo. You just talk to it with more or less natural language. The learning curve is essentially nil, you just say, ""Alexa, call Sandy.""

If he wants something portable, get an iPhone and show him how to use Siri. Some older people have trouble timing their speech with Siri, though.",,,1,0,0,
47601089-648b-456b-b886-bca153eb9f2a,1502251287,"A little scary! The sidewalks here aren't maintained, so he pulled me onto the grass a couple of times. There was some yanking on a few hills due to our varying fitness levels. It was great for a first run, though.  

It felt kind of like walking an energetic dog!",,,1,0,0,
3c0a5c2d-4532-404e-81c7-9fbd7a356ef0,1503537787,"Funny. I assumed that you were female in my response, but not sure why I did. Not that it matters for what I wrote.",,,1,0,0,
40e6f6da-b1f2-47f3-978b-4d8dc0674985,1502124418,"I saw a ""How the blind use Reddit"" thread, but thought it was a bit old.  Made me laugh.",,,5,0,0,
1a8aa46a-0519-4ead-b75a-9a3e5392ba8b,1502112267,"This does not sound like something I would use. I hear emotion in speech and don't necessarily need to know who is around me when navigating. When walking through the City the amount of feedback that would come from such a device would make it more annoying than useful, plus the use of multiple vibration motors results in oversaturation of tactile feedback after a short period of use. Just listening to a voice and understanding context is enough to determine emotion at a glance, so to speak. ",,,1,0,0,
7dfa93f1-b4ca-4f21-9908-d574d170abee,1504209538,"You got downvoted, apparently. We found the vista user!",,,2,0,0,
55904f1b-43b3-46ad-9568-f188a5b28e9c,1504139232,"The most important thing is to  ask a blind person if they need help/how that help can be best provided.


That being said, This kind of thing isn't usually the kind of thing that would annoy me personally, because holding a door is the kind of thing sighted people would also do for one another.",,,15,0,0,
863382c6-db10-4d42-a2bc-a9544104e038,1501956110,ah so what if the accented letter doesn't show up? Does the braille display ignore the entire letter?,,,1,0,0,
27fc7c3f-2109-4d04-9d7f-950f2d23e71c,1501743126,I just play more games than any normal person should be.  At least no one tells me that the glare is going to hurt my eyes any more.  I play with the screen off sometimes now.  I love how that confuses people.,,,2,0,0,
dc77956f-9356-4310-908c-01942105519d,1503693383,"Thank you for responding to my post. Yeah, that is really a good idea. But is there a way to differentiate between the job that require a contractor and the one which does not? almost every job listing in that site posts the Driver's license as a condition of employment. ",,,1,0,0,
7dfa93f1-b4ca-4f21-9908-d574d170abee,1503755406,"May I ask why you're trying to do this on Android? You'd be better using something like Windows, with a full keyboard, a decent IDE, etc.",,,1,0,0,
b8567de0-f7d0-4197-9ab8-55823a13f242,1502398327,"Thank you for the suggestion! The problem with voice control is that she doesn't speak English, and her ability to hear is also fairly weak. ",,,3,0,0,
803e0c4b-4b23-467b-80a2-4e1920f5377c,1501646488,"I am going through something similar and can relate.  In ways of support, depending on what type of person your SIL is she may need help navigating assistive technology, medical appointments, state services, and career planning, among others.  In addition, she will need emotional support most of all.  Understand this is a mental journey more than anything else.  Make sure you are the one offering support and taking initiative rather than waiting for her to ask.  If it looks like she's having trouble doing a task due to vision, ask her if you can help.  Vision loss is a broad term, and different diseases cause vision loss to  develop differently.  She may become light sensitive, have reduced vision in her periphery, reduced acuity, or a combination of these symptoms.  This is a big deal for her and it is sometimes easy to ignore or trivialize the problem since it is not easily visible to others.  Do your research on what is causing her vision loss, and, if the cause is believed to be genetic, get genetic testing done at her earliest convenience (since testing will strengthen the diagnosis, can take a few months to complete, and is required for any sort of gene therapy clinical trials).

You all have a long road ahead of you.  Take it one step at a time, and pm if I can help provide additional direction.

Edit: also know that by posting and taking steps to help her you have already done more than most others would",,,9,0,0,
47601089-648b-456b-b886-bca153eb9f2a,1502617276,Crochet or knitting! Very tactile and rewarding hobbies.,,,4,0,0,
48f11593-62a4-4422-a276-1f29a74bfe01,1504084947,"They'll never listen. Exactly what you say is correct, but they are a troll. I've just reported them, hopefully they'll be removed soon x",,,1,0,0,
47601089-648b-456b-b886-bca153eb9f2a,1503790723,Would [ORCA](https://wiki.gnome.org/Projects/Orca) work? ,,,1,0,0,
7dfa93f1-b4ca-4f21-9908-d574d170abee,1502566521,"This has been done dozens of times. Remember Umano?  I really don't see the business model here.  Either they're losing money, or they're seriously underpaying the voice talent.  Before I give them any money at all, I'd want to know that they're paying the union rate (currently $210 per finished hour).  And if they are, either they won't be around long, or the subscription must be like $30 a month.  

edit to add: What do the journalists who originally wrote the article get?  In the case of an audiobook, the author still gets a cut of audiobook sales.  I'm not sure why it should be any different in the case of long-form journalism.  ",,,1,0,0,
3c0a5c2d-4532-404e-81c7-9fbd7a356ef0,1503435638,"Agreed about the iPhone. But the old accessible phones are rapidly disappearing and it's not like they have no learning curve themselves. Still think an echo is your best bet if he'll be calling from home, and it can tell the time and read the news, do weather, etc.",,,1,0,0,
7dfa93f1-b4ca-4f21-9908-d574d170abee,1502133672,"With [nvda](https://www.nvaccess.org) on windows, pressing enter doesn't seem to remove the overlay.  Also, both NVDA and the extension read out the caption.  If it were me, what I would probably do is modify the alt-text of the original image that the user right clicked on, to make the alt text be equal to the returned caption. Then just play a small sound to signify that the work has been done.  That way, the user can review the caption with his regular screen reader commands, without losing his place in the web page, or having to listen to a third party voice reading it.  

Also, if the image contains text, your extension doesn't seem to indicate that at all.  It would be useful, even if it couldn't do OCR, if it returned something like ""Also contains text"".  Many screen readers (NVDA and JAWS at least) have a command to perform OCR on an image. However, that doesn't describe the image at all, just recognize text.  So, for example, the first image on [this page](https://thedailywtf.com/articles/a-test-imonial), when I OCR it with NVDA, returns:
&gt; Testimonial
&gt; 
&gt; This is a test of the testimonial section.
&gt; 
&gt; -- John Doe, US

When I ask your extension for a caption, it returns:
&gt; a close up of a person holding a wii remote

I have no idea where it's getting that; I'm totally blind myself.  Never-the-less, the point of the image is the text. So a hint that the user should try OCR would be useful.  ",,,1,0,0,
a93edde6-65f1-4519-95c1-f4971169d0b9,1503954032,"It did a passable but not great job.  I'm asking for a visually impaired student who currently has to get everything converted by the disability office into Word, so it will work with a copy of Zoomtext.",,,1,0,0,
adb92843-662a-412c-8dcc-b286a02b5828,1503602968,"Thanks for writing! Yep....those are the only files you need. That is so cool tha the library can print those for you....please send me pictures when they are printed. I'd love to share them! We also have a facebook group devoted to the DOTS outreach: https://www.facebook.com/groups/dotsrpg
",,,2,0,0,
