commentator_id,created_utc,anonymized_body,ups,downs,score,controversiality,gilded,distinguished
6119f3d3-fdaf-497a-8aa4-c2108f768f86,1503399430,"It is difficult for her to find the phone &amp; pick up from her little table. Her decline from heatlthy to blind has been pretty rapid and I don't think she has time to master any new skills.
The pure voice activated environment is giving her some easy access to others.
Thanks.",,,2,0,0,
8fd01324-2dfd-45de-9783-79bca3340315,1503844309,That's awesome! Now all I have to do is get my hands on a keyboard to try out.,,,1,0,0,
dfe02ece-4389-4f67-a432-86548b8013da,1504118610,"There are lots of roller coasters with blackout sections; at King's Island, the studio backlot coaster has roughly 10 seconds of blackout. As a sighted person, it's more intense because I can't anticipate where the train is going to go. Overall, I'm going to guess that the answer to your question is ""just like you, but without being able to brace for oncoming turns"".",,,4,0,0,
bd938754-7e97-4f4f-a7c2-5285808657fc,1503636145,"Requiring a driver's license may be necessary for the company if you are a contract cleaner and need to travel to many different locations, especially overnight. You may have better luck finding one where you work for a company directly, so you would be in the same building all day. It may also be posssible to make do with public transit if your city has good transit. ",,,3,0,0,
8fd01324-2dfd-45de-9783-79bca3340315,1503760224,"I agree with shacklebolt, if you are completely blind, then I'd recommend getting your hands on an IPhone and tap tap see and apps like that.",,,2,0,0,
71b56506-70aa-4557-b446-a04309ddca9d,1503627362,"I'm total and I also smoke at least once a week, sometimes more. Someone earlier in the thread laid out the medical benefits. It helps to use a vaporizer. Even if where you live doesn't allow cannabis you can still order a vaporizer from a lot of online retailers. I suggest r/PuffItUp.",,,2,0,0,
47da1bf7-15f1-4cf4-a7a5-922282223dfa,1502080149,"Thanks for the feedback
Yes, screen amplifier refers to a magnifier, I have corrected it to magnifier to avoid confusion
",,,1,0,0,
b73591d8-60c2-48e7-82f1-3403ae8fb8f3,1503423322,"Simple solution to high lighter issues for the color blind. Underline, or write in quotes or brackets. Real easy. 

As for troughs, I may have done that before. ",,,1,0,0,
cbc97d15-4329-44f1-acf0-5a2ce247d5c9,1504111003,"I have contacted Deafblind UK a week ago, but they haven't replied yet. Calling RNIB is a great idea too – thanks! I've also managed to get a more positive reply from SENSE by contacting the TouchBase South East office. They asked me what kind of question I wanted to ask, so we'll see where it goes.",,,1,0,0,
3c0a5c2d-4532-404e-81c7-9fbd7a356ef0,1502118100,"Generally if you can select and copy the text in the PDF, it's probably accessible. ",,,1,0,0,
90acf455-4cd0-4185-8e7c-4b3d53fee01a,1501862930,Agreed. Ars tends to have a good writing staff. Is an unusual topic for them still though. ,,,3,0,0,
0ce20fc4-3fd6-43af-97c7-4874225ec47e,1503908481,"Have you tried local events that pertain to your interests? If you live in a decently populated area, chances are there's loads of groups of people who share at least some of your interests. It's a lot easier to socialize when there's a planned event versus just trying to get out there and talk to people in my experience. Some ideas that many areas have: book clubs, fan clubs, board game or roleplay game groups, writing clubs, sports or athletic groups, industry or career groups, language learning, social groups for people in a given demographic, photography or art groups, religious groups, drinking or dinner groups, and so on. 

I've personally never made a friend in a ""complete stranger I bumped into in a random bar"" type scenario. It's a lot easier to meet people through common interests, and then through shared friends. ",,,1,0,0,
8f0eb11f-903f-4ebc-8933-c7d1088218fb,1502430979,"You should know that on completion of your survey, the website asks users to complete a captcha that involves clicking on photos thus making it inaccessible to a large portion of visually impaired users.",,,1,0,0,moderator
8fd01324-2dfd-45de-9783-79bca3340315,1503760015,"I'd recommend using ARIA for Live updates, at least that's what I think they're called. For example; let's say you have 100 characters left in a text box, and you're writing and writing and then,, oh no! you've gone over the limit. With ARIA as far as I understand it, screen reader users can get an alert telling them that this has happened. It's alot easier than having to go out of forms mode or focus mode and then checking the amount of characters remaining.",,,1,0,0,
f388fb53-d85c-48ae-a44c-b003a44b3761,1501640163,My wife and I are currently in the process of buying a new house. I'm sighted but she's blind. She mostly uses sites like realtor.com or Zillow on her iPhone. We've finally picked a house and it was one she found first and sent to me. She relies entirely on the description of the property. Just like with any home buyer we had a list of needs and wants and she looked for those items in the description. If she read something she liked she would send me a link and I'd take a look at the pictures. Then we'd go from there. Not sure if that helps at all.,,,1,0,0,
ffb3fe92-2bdb-462c-afed-c5aef99b5d8d,1503459479,"Imagine a normal day, and you looked at the sun for 2 seconds. That's literally all you did with the eclipse. You're fine.",,,2,0,0,
c4f82a04-745f-4b72-b4ac-42a7c56532cb,1501710007,"The ones where I'm dreaming that I'm laying in bed, no, those are darkness (because at night it is darkness, so that's what I'm dreaming about). There's another form where I'm trying to run as fast as I can, but my legs move slower than even the slowest walking speed as though they weigh tons. In those instances, yes, they're visual. The only dreams I have that don't include visual elements will be sleep paralysis ones where I'm laying in bed in the darkness.",,,1,0,0,
6007d79c-e89a-48be-b722-ab89b817257d,1503471908,"How bad is your social anxiety? Can you talk to a stranger without shaking and a racing heart? How often do you avoid social activities just because you're afraid of talking to people, even though you want to?",,,1,0,0,
28bd916f-f773-4af6-b115-ec219e094f89,1502434169,"I don't see why not. There are blocks, raised pens, braille, loads of ways to 'learn' the meaning of the words for shapes name. Geometry was actually my favorite part of math since it made the most sense to me. I can't think of anything off the top of my head that would make geometry unlearnable",,,1,0,0,
4d84bf48-e38f-42a4-b8ce-b5b1f8b5c60f,1502374214,"I'm slowly going legally blind. I'm not legally blind yet though! Until last year, I was under the impression that my eyesight was normal. As a kid I thought if you are blind then all you see is total darkness. Not true! I don't see complete and total darkness. I can still see the world around me, it's just become VERY blurry.

The first thing to go was night vision. When I'm in a dark room, I can't really see anything. I can't see any details on my SO's face in a dimly lit room but I CAN see his face during the day.

It's difficult to read, even with my glasses on during the day. I can strain my eyes a bit and temporarily get rid of the double vision. I'll last a couple hours before I have to rest my throbbing eyes.

Hmmmm. What else? My peripheral vision is gone. You can easily scare the shit out of me by sneaking up on me. Gets me every time.

So to recap- my internal thought process is the same. I'm just more jumpy, more clumsy, and easily fatigued.

Feel free to ask any questions ",,,1,0,0,
5b999348-0de6-4ad5-9d39-07f2807d5120,1501920740,"Thanks, everyone. I'll likely do a three-way split between three of the U.S. based suggestions:

National Federation of the Blind

Guide Dogs for the Blind

The Foundation Fighting Blindness",,,3,0,0,
d829e41e-0b4a-4608-a330-6822d193a49f,1502868972,"Hey man, I really like that idea - you are right the screen is really busy, I guess we didn't think about how everything might merge together. I'll have a chat to the team and see what we can come up with. By all means get the kids on it! The only reason we are targeting adults right now is because the game isn't yet finished and the levels we posted (especially the last 3 of 5) can be quite difficult, but kids these days are incredible gamers so sometimes I think we worry a little too much:)",,,2,0,0,
3461e965-d8ad-4647-b594-1c4b3fafd2f6,1503500360,If I were to print something out in braille and then use a pen or stylus to raise the dots would someone blind be able to use it? ,,,1,0,0,
36cc6068-7490-450d-a443-0955b91642ea,1502057657,"I'm not sure just how accessible it is as I haven't used it personally, but I've heard that sonocent audio notetaker is good for storing large amounts of data. ",,,1,0,0,
5a28ae88-1e35-40b1-b7f0-31ad324a3945,1503434838,"&gt; get an iPhone

Even if you can get Siri to dial the call for you, you still have to use the UI to end the call, and the standard iPhone UI is not usable of you have low vision. You have to see where to stab the screen to end the call.

Voiceover is great with the iPhone but there is a lot to learn and the amount of learning is very off putting. Should I three finger treble tap or two finger swipe down? 

The range of accessible phones (in the UK) seems to have really declined if you believe the  [RNIB's shop website](http://shop.rnib.org.uk/accessible-technology/telephones-and-mobiles.html). 

The [Doro 580](https://www.doro.co.uk/doro-secure-580.html) might be an option if it is not too dumbed down. 

Edit: treble table -&gt; treble tap",,,1,0,0,
73227c3d-b76b-4706-ba2e-228c83a1fb8e,1501852978,"The foundation fighting blindness puts a good percentage of their money into research for different cures. If that's what you're interested in helping with, they're a good organization. ",,,2,0,0,
7dfa93f1-b4ca-4f21-9908-d574d170abee,1502670032,"I'm sure you've already thought about audiobooks. That isn't really ""doing something"" though, in the way I think you mean it.  But headsets can be turned up enough that he might still be able to hear them.  I know a lot of blind folks who take up pottery and woodworking.  Though 95 years old might not be a good time to take up that hobby, if he has some previous experience with either of those things, they can be adapted for him to do while blind.  

At 95, he's probably experienced a lot of interesting history.  If he's well spoken, another activity he might enjoy is taking a voice-recorder and recording his memories, for his grandchildren, and later descendants, to listen and learn family history from.  Not only his memories, but the memories he has of his own grandparents, and your family history.  This resource could be priceless if someone in your family decides to take up making a family tree later on.  ",,,3,0,0,
90ac4778-eda9-451e-9c5c-010eeec4552b,1502115590,"If the PDF is tagged for accessibility,  yes a braille display can read a PDF document very well. If you just dump a gif, or jpg into a PDF, no. Google creating accessible PDFs for more information.",,,2,0,0,
7dfa93f1-b4ca-4f21-9908-d574d170abee,1503580380,"The Ottawa Public Library near me has a ProJet 1500 3D Printer, and a Makerbot 3D Printer.  Apparently I can submit 3d Print jobs to them to be printed overnight.  So are those STL files all they need?  Of the two printers they have, what printer would it be better for me to request?  ",,,1,0,0,
3c0a5c2d-4532-404e-81c7-9fbd7a356ef0,1503456974,"If you have no symptoms now, you're highly unlikely to develop any. Symptoms usually become noticeable after 12 hours. Even if you had damaged your retina (unlikely in this case), there's no treatment but waiting for it to improve. So forget about it...you'd know by now if you'd damaged your eyes.",,,3,0,0,
9f7fbd78-9ef2-422e-8e15-bfce552d43e4,1504137249,Molly burke!  Molly burke is one of my favorite youtubers period. She's blind (light perception and shaddows only) from retinitis pigmentosa. She vlogs about any thing from her cute guide dog to her love of makeup. She's so great,,,2,0,0,
fc4139cb-f235-4ab0-a30f-5a852be1638a,1502981225,"That is correct in that it spells vitalis , Braille is not a language like English or German, it's an alphabet.",,,4,0,0,
bd938754-7e97-4f4f-a7c2-5285808657fc,1501986608,All three are good organizations with solid track records. Thank you for being so generous!,,,1,0,0,
7dfa93f1-b4ca-4f21-9908-d574d170abee,1503096445,"I use IOS on iPhone myself.  What I mean by the small screen is, I doubt the screen would be large enough to contain the entire board.  If it was, say on something like the large iPad, I might be able to use two hands on the screen at once, to get a better idea of the relation between two pieces I'm thinking about moving.  That's what I do with the physical, carved wooden board on my desk.  However, no phone is that large.  So no matter what, I'm going to have to set-up my physical board.  I'm sure if I played more than a single game every two months or so, I could handle it all in my head. But I don't. :-)

&gt; a different format. 

Yeah, doing it that way would work just fine.  It'd probably be easier than typing in moves, too. Especially for chess beginners.  ",,,1,0,0,
7dfa93f1-b4ca-4f21-9908-d574d170abee,1502890650,"If you need beta testing for the menu update, send me a pm and I'll send you my email address for test flight.",,,1,0,0,
4d84bf48-e38f-42a4-b8ce-b5b1f8b5c60f,1502860006,I'm a little confused. Am I supposed to jump on objects or destroy them? And why are there a lot of red X marks showing up? It doesn't seem like a MARIO type game. �� I'm not clear on the objective.,,,1,0,0,
bd938754-7e97-4f4f-a7c2-5285808657fc,1502509736,"I think you mean your vision is 20/45, the other way around doesn't make sense. 

Also, I work for CNIB, and I have no idea why they said no one learns Braille anymore. Not as many people learn Braille, because adaptive technology is easier, but I have a few clients who are still learning Braille. 

Degenerative myopia is most commonly associated with people of Asian descent (often Chinese or Japanese, although some Middle Eastern countries), although it is a genetic condition that anyone can get. One of the dangers of this particular eye condition is due to higher myopia (I would guess that you have a fairly strong nearsighted prescription?), the retina at the back of your eye is stretched more than average eyes. As a result, the stretched retina sometimes ends up with abnormal blood vessels growing along cracks, which causes scarring. Additionally, because the retina is stretched, you also have a higher likelihood of retina detachment. You may also have a higher likelihood of acute angle glaucoma. If that happens, that is an ocular emergency and you should go to the hospital immediately. The symptoms include extreme eye pain (like someone shoving red hot pokers into your eyes) and headache so bad it makes you vomit.

I should also mention, I will likely get this condition myself in the future. 

You can still get training, even if your vision isn't too bad. I am currently working with someone who has better vision that I do. Even if your doctor suggests against it, you can still ask for a copy of your eye report and fax that in to your regional office. Here is the link for the refferal form if you want him to fill it out.

https://www.visionlossrehab.ca/Documents/REHAB_DrReferral_FORM-1_pager-Rev.pdf

Technically speaking, you can also make a self-referral. That gets a little more complicated, because they do want to get an updated eye report, but it is possible to get service without it. 

",,,2,0,0,
b73591d8-60c2-48e7-82f1-3403ae8fb8f3,1503402155,"Dang, none of your passing classmates thought to wake you up?",,,2,0,0,
d575bab1-38e5-4492-9e2d-0fce55a034fe,1501910758,"I'd personally recommend the [National Federation of the Blind](https://nfb.org/programs), or your local [Lion's Club](http://www.lionsclubs.org/EN/how-we-serve/index.php).  I would consider both of these more assistance-based than preventative.",,,2,0,0,
72c696fd-bc5d-439e-a107-56469cfefc1d,1502197335,"What's it like at the other end of the tether? I've not guided much, and my mate is super experienced anyway",,,2,0,0,
1b221c6f-90d4-41c9-a562-0b068cad288b,1504093080,"That's handy! Unfortunately GOT isn't on any streaming service and we don't have the cable company that it's on. I don't like sex scenes so I noped out on the first episode. I mainly like writing, music (rock and power/symphonic metal, but I haven't found anyone who likes that based off dress), etc. Slowly gaining interest in gaming again.  There's no drama clubs or anything creative at my uni. Mainly sports (can't do any), international or Christian clubs (I don't even go to a Christian uni but there's like 5)",,,1,0,0,
f9f54438-f5c9-44db-bfb1-2937dd5d89a7,1502578741,"I think you raise a lot of valid concerns regarding your teaching career.  It's never too early to begin planning for the loss of your eyesight, but I wouldn't necessarily rush my decision either.  

One thing I wonder about your career change is a loss of retirement and benefits.  I'm not sure where you live, how old you are, how many years you've been teaching, and if you've contributed to Social Security (if you are in the US).  You might want to check into whether your pension offers a disability retirement benefit.  

I know software developers make a good living, but if you get a job where you are classified as a contractor, you'll have a greater tax liability and probably no employer-provided benefits.  Think holistically about your situation when comparing job offers, because as you sight declines, you'll need good insurance benefits.

I think that you are making a good decision evaluating  your options.   Vision loss affects your life and it can affect your livelihood.  The more diverse your skill set is, the better chance you'll have finding a more accessible job should you decide to quit teaching.",,,2,0,0,
a57c7439-7c0f-46b0-94fc-0800b9c7559c,1501713548,"I don't know the exact name of the condition. Basically last year she was told she has multiple fluid buildups in the back of her eye the doctor said it was a condition that normally doesn't affect anyone younger than 55 and it generally causes total blindness within 25 years. She went back for her normal exam this year and the progression of the condition indicates that she will be completely blind in less than 2-3 years about 80% faster than the normal progression. Shes going to have a spot appear in her vision that will expand until it blocks her vision completely. Honestly the slow noticeable progression of it is what scares her the most shes told me multiple times that she'd rather wake up one morning completely blind and let that be the end of it. She doesn't have any noticeable symptoms of it yet but shes been referred to a few specialists and they have confirmed both the diagnosis and prognosis.

Edit: I'm pretty sure its either retinal vein occlusion or wet macular degeneration.",,,1,0,0,
48f11593-62a4-4422-a276-1f29a74bfe01,1504083121,"You're absolutely disgusting. 
Moderators, this is clearly a troll - can't we remove them?",,,1,0,0,
7dfa93f1-b4ca-4f21-9908-d574d170abee,1502669568,"Oh, this is really neat!  Most Binaural audio uploaded to youtube these days seems to be ASMR stuff.  Nothing against the ASMR folks, but something a bit more interesting and engaging is extremely welcome.  ",,,2,0,0,
0fa64def-8900-49aa-9848-ec63792243c2,1503458674,"I looked at The Sun directly for maybe 3-4 seconds but I had anti-UV swimming goggles on, like one of those goggles that has a dark purple tint. It’s just my anxiety that is kicking in.",,,1,0,0,
7dfa93f1-b4ca-4f21-9908-d574d170abee,1503430209,"I don't think it reads the contact list, but if you're in the US, perhaps the [Jitterbug](https://www.jitterbugdirect.com) would do the trick? It does offer voice dialing and a simple keypad.  ",,,1,0,0,
c4f82a04-745f-4b72-b4ac-42a7c56532cb,1504050305,"I'm not aware of one, but I've not been learning Braille for very long. I feel like such a thing would more likely be a paragraph than a short sentence. ",,,2,0,0,
3be9cbf1-b598-4428-aabd-985787d78d13,1503832201,"I've been using it for over a year now, and it has truly opened up some amazing doors for me.",,,2,0,0,
39e3d456-788e-46b0-8900-dc756fa85be6,1503010733,"I'm assuming this users response here but I think they mean that if a button isn't used in any of the the menus throughout the game, like clicking the left joystick button, and you change it to something like this

*click and hold left joystick

&gt;if the joystick button is depressed -  temporarily disable the normal function of some other keys in anticipation for a code input

*while holding left joystick button, hit a b a b, or an equivalent depending on the system. This is the key sequence, or code. 

&gt;this triggers all menus henceforth to be voiced out loud for the player. Another button sequence/code can be used to specifically voice only the current menu, and not all menus. Ex.  ' depress and hold left stick button - hit a a b b - release left stick button. Current menu is now read to the player '

Now if you really want to go an extra step and make an impressive impact, you can have the programmers set up a small memory for which menus the players profile wants to be voices. Lets say, a low vision player only needs a few of the specific menus read to them. A third key sequence or code can be used by the player to say ' Remember this menu and always read it'. Now the player doesn't need to hit a code every 2 minutes of game play, and they don't need to listen to voiced menus that they don't need to hear.  A fourth key sequence can be used to reset all menus set to voice activate. Print the key sequenced codes on a Braille sheet and insert that into the jewel cases of the game, or mail it to customers if they email a specific address. ",,,3,0,0,
8fd01324-2dfd-45de-9783-79bca3340315,1501712014,"As far as i can see, your test was a success.",,,1,0,0,
48f11593-62a4-4422-a276-1f29a74bfe01,1504083532,"I'm not even gunna reply again. You're foul. Think it's funny to say things to people who are severely disabled? You're an awful, awful person and I truly feel sorry for you. Hopefully you'll be removed from
This sub soon.",,,1,0,0,
1aaa6ea6-a4ea-4dff-b6ea-58493f4e76fd,1504193052,Why should we expect anything different from modern tech companies?,,,2,0,0,
bd938754-7e97-4f4f-a7c2-5285808657fc,1503636414,"I""ll definitely try to print these out! I'm a big D&amp;D fan ;) Don't currently have access to a 3D printer but I'll figure something out. ",,,1,0,0,
660c110a-c1a6-4115-b557-db36650bf966,1503100129,"As in English, if it is a *name* or *nickname*, it should be capitalized. ⟨Vitalis⟩ would be ⟨⠠⠧⠊⠞⠁⠇⠊⠎⟩, whereas ⟨⠧⠊⠞⠁⠇⠊⠎⟩ would be ⟨vitalis⟩.

In (grade two) English braille, my username would be written ⟨⠠⠞⠺⠊⠌⠫⠠⠎⠳⠏⟩, not ⟨⠞⠺⠊⠌⠫⠎⠳⠏⟩. 

It is **not** universal for all languages. If you take ⟨⠠⠧⠊⠞⠁⠇⠊⠎⟩ and assume that you're writing in Japanese braille (known as *tenji*), then you'd get ⟨わひおとあにおの⟩, or *wahiotoaniono*. This is gibberish. A similar nonsense word would occur if you interpreted it as being Russian or Greek. French and German braille are the most similar to English, but they are not without differences.",,,2,0,0,
f4c33857-c4e0-4d69-9dd6-aeade46e5c6d,1503547154,"I'm female, and no idea.
I had AAA artist pass, showed it and was told ""You can't get in here."" Said can't read the doors, am looking promoters room, they said not this one, asked whose it was, guard said ""Metallica"" and I'm like ""Oh, that isn't place I'm looking for..""
Artist passes let you into every room except theirs, so no other bands could go in their room, had to have special Metallica pass/only band door that had own guards.
But yeah no judgement to the band or guard cause I was in the wrong place/didn't have the right pass!
",,,2,0,0,
333266a3-7fca-4d94-9d8f-4f23caaa0218,1504041922,"Blind film critic and the Tommy Edison experience are the same guy, I enjoy his stuff. Lots of dad humour.",,,8,0,0,
bd938754-7e97-4f4f-a7c2-5285808657fc,1502073482,"They have a simliiar device, although the target is for children with autism.

http://www.nbcnews.com/health/kids-health/google-glass-app-helps-kids-autism-see-emotions-n597641

http://autismglass.stanford.edu/

That system could also be adapted with an accessible option. It is still being studied, so they aren't sure if it would be mass produced yet.

",,,2,0,0,
