commentator_id,created_utc,anonymized_body,ups,downs,score,controversiality,gilded,distinguished
bfed6c15-5ed5-4aa8-a68b-c27f735c7087,1501639537,"Thank you very much for your answer! 

I do think too that a plan of the property is really a must-have! But I think that most of the time, they are not representing the real dimensions and if someone is using a wheelchair and needs to have space for rotation, it will not be that useful. 

Let me explain: I'm a web developer from Montreal, Canada. For the past 2 years, I've been studying web accessibility. I'm doing it for myself, and because we will all face, at a point or at another in our life, some disabilities (sight, mobility, attention, or other). I really want to create a better web :) 

Anyhow, I'm now working for a company that is selling website templates to broker and real estate companies, and I want our websites to be accessible and top notch! So I'm doing that research on my free time, because that's what I do. 

So a big thank you for your feedback. I appreciate it, mate! And what I get from it is that: floor plan is a must, location-location-location, and after that, it's all the same. 

Quick questions: 

1) do you use a screen reader? if yes, which one,and on which browser? 

2) How was your navigation online? Were there some information hard to find? Would you like it more if a relevant map was the first thing you could see? (on most of the websites here, the maps are on the second tab)

Thanks!!! 
",,,2,0,0,
863382c6-db10-4d42-a2bc-a9544104e038,1502342508,"I read this, but what is public Jaws?",,,1,0,0,
d829e41e-0b4a-4608-a330-6822d193a49f,1502807964,"No worries! Thanks for the tip, I'll get our sound wizard to check out the forums. ",,,2,0,0,
c4f82a04-745f-4b72-b4ac-42a7c56532cb,1501631915,"Keep in mind I still have central vision in my left eye (as was the case when I bought my place):

When I started working, I started looking for a house to buy. I'd saved up a deposit through uni thanks to my pension, casual retail work, and then a PhD scholarship (not that I finished my PhD, I quit). So I had a price range (my deposit to be no less than 20% the value of the property). 

Next up: location. For a sighted person, easy access to all amenities (shops, public transport etc) is great. For blind/vision impaired, it's essential for independence. I wanted a place that was walking distance (5-15mins) to the supermarket and public transport, and that public transport would get me into the city (Adelaide has a central business district that's about 2km² surrounded by suburbs for days) within 30 minutes. That narrowed down my suburb selection.

Preoperty type was easy: Torrens title (detatched home) or Community title (usually semi-detatched home with common area needing strata to cover public liability insurance, possibly sinking fund etc, e.g. common driveway. You own the building and the land though, not just the building as is the case with a Strata title). I also wanted nothing much older than a decade (less maintenance cost, nicer in general).

Regarding interior, with such an age range things are quite standardized. I wanted bright interiors because my condition means my low light/night vision is shot - modern builds cover this well. Rooms, I was after at least two but preferably three bedrooms. That's just a personal preference. I live on my own, but I've plenty of hobbies, also it's an income source if you want it to be (which it was for three years, let them out to my brothers, and brother's mate). 

In terms of searching for options, online listings. I'd go through, open up everything that was in my price range in the suburbs I was interested in. I'd then briefly flick through the pictures to what I really wanted to see, which was the floor plan. It annoys me so much when property listings don't have floor plans. That is, in my opinion, the single most important thing to include with the listing. The write ups are always the same really, but they can be useful for those key phrases like ""up and coming suburb"" (it's a patchy area), ""great for investor or the first home buyer"" (an older property on the smaller side), ""renovators dream"" (do not buy, it's a dump) etc. I'd then use Google maps to see where the property was relative to shops, public transport etc.

When it came to viewing, my grandfather offered to drive me round and check them out (which was great because it meant cruising in his Mercedes CLK 240, which was a really nice car. We went for lunch after too, on him). It was more about the utility of his car than anything else, as I said, I still have central vision in my left eye (though it is worse now than it was then). 

Ultimately if you're buying newer properties (anything built after 2000 really), designs are very standardised (at least, they are in Australia), so all it really comes down to is location, whether you like the floor plan (i.e. space is used well, there aren't areas that are compromised because of the positioning of doors etc), and price. 

So with the exception of the increased importance on location, and the desire for mad brightness indoors, pretty much the same as a sighted person goes about purchasing property.

And, yes, I did purchase one of the properties I viewed with my grandfather. Been there over four years now and couldn't have picked a better spot. 2mins to train station (max 20 mins into city, major shopping centre 4mins back down the line, then 10min walk), 5mins to bus stop (25mins to city, or 20mins to beach with shopping, restaurants), 5-10 mins walk to supermarket (plus bank, post office, bakery, chemist, Cheesecake Shop, and a few other things besides), and the all important bottleo (liquor store if you're from North America, off licence if you're form the UK) round the corner.",,,2,0,0,
6119f3d3-fdaf-497a-8aa4-c2108f768f86,1503399263,Thanks-She has trouble even finding the phone to pick it up. We put a spot of sandpaper on the TV remote to help with that.,,,1,0,0,
5a28ae88-1e35-40b1-b7f0-31ad324a3945,1503446134,"A couple of questions about the Amazon Echo

Can you call someone who doesn't have an echo?

[How to use an Amazon Echo to call someone](https://www.cnet.com/uk/how-to/how-to-use-an-amazon-echo-to-call-someone/)      
This Cnet review suggest that's all you can do.

How do you end a call with the Amazon Echo?

Are your calls private?",,,1,0,0,
65134dbb-cb2c-48e9-ae49-d82fe8da5a8c,1503896626,"It depends on how loud and how much spatial differentiation is available. There is also a lot of personal tolerance and preference involved as well. I made the mistake of choosing a very loud Spanish tapas restaurant on a Friday night for a large group of blind people. Entering the space the sound was like a sonic waterfall. Almost immediately there were complaints about disorientation and feeling uncomfortable. The very loud white noise environment was intolerable and we had to leave. 

Since then I have been more conscious about sound environment with blind people. Sound is a large part of balance for most blind people and they can find loud environments disorienting and even dizzying. My wife found water falls like Takakkaw falls in Yoho park to be overwhelming. She has the same experience at some loud concerts and restaurants. Other blind people I have met are better able to hand loud environments or appreciate them. 

In general though blind people probably prefer environments where they can spatially orient and differentiate directionality of sounds. Next to a waterfall might be too much but a streamside with rapids upstream or a waterfall in the vicinity can be really enjoyable.",,,5,0,0,
bd938754-7e97-4f4f-a7c2-5285808657fc,1504156536,"Some people get annoyed at everything. She probably would have gotten annoyed if someone didn't hold open the door, either. ",,,3,0,0,
2e0665a4-8cc5-4fb5-a541-cab3c34f5269,1503779745,I'm not a Windows user (I only have Linux). Are you aware of a chrome extension or something similar that allows similar usage?,,,2,0,0,
28bd916f-f773-4af6-b115-ec219e094f89,1502415528,"If you can digitalize the collection then there are apps and computers/phones that are accessible. 

For the vinyl, maybe label the cases in braille?",,,3,0,0,
4d84bf48-e38f-42a4-b8ce-b5b1f8b5c60f,1502374468,"It feels scary. When will my sight completely leave? How long will this going blind process take? Why did I bother finishing my BA degree in 2015? All that hard work, only to lose my sight! Scary and frustrating 

It feel betrayed by my own body. I can't help but wonder what I did to deserve this. ",,,1,0,0,
d26a138b-971e-40df-99f6-0bd4860670bf,1501955783,"Yes an accented letter will show in most cases. It can depend on the transcriber sometimes. A transcriber may neglect to enter the accent. But we are taught to type everything just as it is in print. Accents, italics, bold, underlines etc. ",,,1,0,0,
0ce20fc4-3fd6-43af-97c7-4874225ec47e,1503905795,"If you haven't been receiving services recently, it may be worth looking into what low vision evaluation type services exist in your area. They may be able to help you select the best products and try stuff out in person. Your insurance might not cover blindness gadgets, vocational rehab might, but you should always personally check what is available to you.

If you ever go to any blindness-related conventions, it's also a great opportunity to try all the latest gadgets. 

I have tried orcam in a conference demo, and was unimpressed. They weren't super clear with me on how someone could be trained to ""point"" at items they cannot see, which is required for the device to read. The battery unit seemed bulky. The recognition was fine. I recommend going for a demo and personally trying the device before buying, but also compare it to other options that are on the market. 

Some other options to look into: 

If you want portable optical character recognition, KNFB reader (on your iphone or android phone) works well and costs $99 per license. I own and use this. It can be used to read text in large print, to listen to it, or with a connected braille display. 

Another app worth mentioning is the new ""seeing AI"" app. It can identify products, recognize saved faces, read text, and describe scenes or objects in very general terms. 

If you want magnification, the glasses do not provide this as far as I know. If you have an iphone it has a built in magnifier app (go to settings, general, accessibility, turn magnifier on.) There's also android apps that do this with your cell phone camera. If you need more power, there are dedicated low-vision portable video magnifiers that typically cost a few hundred dollars.  

It's not quite the same, but Aira has glasses with remote human agent minutes (who can read, describe, look up information, etc for you.) It's a paid monthly subscription. If I was going to spend a lot of money on ""smart"" glasses, this would probably be it. ",,,1,0,0,
28bd916f-f773-4af6-b115-ec219e094f89,1503973521,"Oh god, disability services. I turned in requests the first week of June and still don't have my books. Had to tell professors today that I probably won't be able to do the readings for two more weeks",,,3,0,0,
28bd916f-f773-4af6-b115-ec219e094f89,1501872252,"Guide Dogs for the Blind has a program where you can list them as your beneficiary and the taxes are less for them. They're fully donation based and provide guide dogs to legally blind and totally blind people. They pay for airfare to their campuses and provide housing and food for the duration of the program. They send you home with a guide dog, tons of stuff for the dog, and information about how to receive monetary assistance if you need it. They also have a support center graduate can call anytime to get help with their dogs and lawyers who can advise on legal matters. They also take international students and have a school in Canada. ",,,2,0,0,
d575bab1-38e5-4492-9e2d-0fce55a034fe,1502596652,"Totally agree.  Can also play with other accessibility options already included on computers, phones, etc.",,,2,0,0,
b73591d8-60c2-48e7-82f1-3403ae8fb8f3,1503761689,"Just a quick foot note about the bar scene.

I'm VI, and have been to a bar solo about a dozen times in the past 2 years or so.

First, a question, how do you go about finding a bar stool? This is one thing I still, to this day, have to ask for help with when going alone.

Now, on to the point about conversation.

The bar I mainly went to was the Village Pub in Palm Springs, CA. A few nights a week they have live music, but I normally dodge out before than because I'm an early bird. Either way, they'll have decently loud music going, and when I'm there the bar is probably at least to half capacity.

My method is just to listen in on conversations around me, see if anything interesting is being discussed, or if anything interesting is going on.

Interesting things I was able to jump in on.

1. Two people were talking about maybe traveling to Seattle, my home town.

2. An old man was flirting with two girls and used the line ""What do you think I am, blind?"" I jumped in with ""You may not be, but I am."" Ended up unintentionally distracting the guy while the girls walked away. They bought me a drink later.

3. The guys sitting behind me were talking about boating, a favorite past time of mine.

Interesting things I've noticed. With these, they're good ice breakers if there's someone / some people sitting near by not talking.

1. Drunken guy getting loud with security, before getting being turned away at the door.

2. Some drunk marines getting in a brawl with local college kids. Apparently this time around the bar itself actually cleared out, and I was the only one that stayed sitting. I knew everyone left, but didn't know a quick way to get out without getting involved, so I just kept eating, ignoring them.

3. Drunk guy spilling freshly ordered drink on off duty bar tender, then forgetting he ordered a drink. (This was actually the same guy as #1, he left and tried coming back.)

Now, for the actual chatting.

It's loud, we know it, but they know it too. There is no shame in asking someone to repeat themself. Or asking if they'd like to head outside for a breath of fresh air.

If the conversation hits a natural pause, there's nothing wrong with turning back to the bar and just focusing on your drink for a minute. if you think of something else you'd like to talk about, or they do, great. If not, not that big of a deal.

Is it a bit overwhelming to be in a bar / loud place being VI? Yes. But if you can establish yourself in a stool, and try to tune in to things going on around you, I think it's fairly easy to start chatting with people.",,,1,0,0,
8fd01324-2dfd-45de-9783-79bca3340315,1503842739,"For anyone who wants to listen to a demo, here is a link to one that was done in 2016. It is by andre louis. https://soundcloud.com/andre-louis/komplete-kontrol-with-speech You can also find demos of the accessibility on youtube.",,,2,0,0,
39e3d456-788e-46b0-8900-dc756fa85be6,1502467045,Hmm. Youtube is giving me an error for this video. ,,,1,0,0,
b03bb7be-f5fc-42d5-b99b-1f49402a5ced,1504058520,"Yes, I heard of James. He sure make some great contents, I actually got in touch with him about several stuff that might be interesting. ",,,3,0,0,
8cb9a862-14c2-40d4-b9b2-9b00f0330bf2,1504190797,"There was a big stink about this on the NVDA list. I was like, look, why should people or even companies support older OS's when even the OS manufacturer doesn't even support them anymore? That is just silly.",,,5,0,0,
3c0a5c2d-4532-404e-81c7-9fbd7a356ef0,1503447014,This guy is obviously brilliant. Thanks for advocating and getting the voiceover put in.,,,3,0,0,
887bed4d-1d2c-465d-a5f2-10011720c4ef,1503472471,"I don't know exactly how to measure it to answer that. I CAN talk to strangers if I have to but often avoid doing so in real life rather assiduously. I can do it if its like a driver or something with a fairly defined length of interaction, but have a harder time in large groups especially, or with strangers in an undefined interaction. I guess, the best way to really put it is that it keeps me from going to events I would like to attend, but isn't so bad that I literally can't leave the house. As with pretty much anything else, there are days when its easier and days when its not. I'm fortunate in that I don't tend to have extremely noticable physical discomfort, for which I'm crateful.  ",,,1,0,0,
28bd916f-f773-4af6-b115-ec219e094f89,1502427526,I don't know about the downloading. Apples voiceover should work though,,,2,0,0,
6119f3d3-fdaf-497a-8aa4-c2108f768f86,1503417024,She is pretty much bed ridden at this point,,,3,0,0,
835be7db-4c29-499d-bf31-820fa9804cf7,1503370467,"She may be able to learn to use her cell phone. My partner is blind, and uses an iPhone. She's had an Android phone before this one, and says the iPhone accessibility is much better. She is quite good at using it.",,,9,0,0,
4177a772-faa1-4a3e-ac72-6f69a1f71598,1502433416,do you imagine you coould be able to learn math all over again? more specifically geomotry? like if you forgot everything about it. As if you were learning it for the first time,,,1,0,0,
d575bab1-38e5-4492-9e2d-0fce55a034fe,1503451774,"I have one right now, [an hourglass](https://plus.google.com/+tymmezinni).

I have three others lined up and just need the guy to become available to do them.  First is the totem pole from [a camp for blind/deaf/other handicapped kids](http://www.wisconsinlionscamp.com/) that I went to in my youth, on my right leg.  Right arm will have two memorial ones- a more adult/""crass"" Tinkerbell in memory of my mom, and a copy of the perfect cribbage hand etched on my grandfather's gravestone.",,,1,0,0,
b73591d8-60c2-48e7-82f1-3403ae8fb8f3,1503540690,"I've heard those guys are extremely nice.

Please tell me they got the story, of the blind man trying to find the right door, and shared a laugh with you?",,,1,0,0,
6f5cde6d-e1cb-4d27-89b1-d6123e70c1ef,1504080964,"Aye, that's what I'm wondering about.

On the other hand, I'm only looking at the very basic one-character contractions and the maybe 100 main words tops. And broken into smaller chunks that may be more manageable.",,,1,0,0,
7dfa93f1-b4ca-4f21-9908-d574d170abee,1502566940,"For digitizing records, [Audacity](http://www.audacityteam.org) is probably all he needs, and it works perfectly with [NVDA](https://www.nvaccess.org).  He doesn't need any of the fancy features of something like Reaper, after all.  ",,,2,0,0,
ef2e7339-4bef-49eb-9d1e-e10181339b23,1503570308,Thanks for your reply and all points fixed now.,,,2,0,0,
7dfa93f1-b4ca-4f21-9908-d574d170abee,1502062726,"Well, it would certainly be unique!  We have vibration used to detect obstacles (using ultrasound etc), but...vibration to detect emotion?  I honestly don't know quite what to think.  ",,,1,0,0,
4d84bf48-e38f-42a4-b8ce-b5b1f8b5c60f,1503531856,Maybe a computer language?,,,5,0,0,
ffb3fe92-2bdb-462c-afed-c5aef99b5d8d,1503268600,"I no no, I knew that haha. Looking at your comment again, I now realize you were making fun of talkback. That completely went over my head.",,,2,0,0,
1a8aa46a-0519-4ead-b75a-9a3e5392ba8b,1502111617,My Baum Vario Ultra 40 reads PDF files in its notetaker mode. ,,,1,0,0,
27fc7c3f-2109-4d04-9d7f-950f2d23e71c,1501742761,"Good luck finding info on this.  I have a genetic condition, but the particular causal gene is not the one being targeted by all the gene therapies.  When my eyes started getting very bad I tried to find out how well the therapies worked.  All you ever find is newspapers talking about miracle cures and medical articles professing uncertainty.  I heard about pushes being made towards FDA approval, but I can't tell you more than that.  I have not actually tried to find something about it in a while though.

I agree that it is not being discussed much.  Especially not in public forums.",,,2,0,0,
0ce20fc4-3fd6-43af-97c7-4874225ec47e,1503610374,"Is this for you, personally? What is your level of vision loss? What are you hoping to get out of the device? 

For most people, Orcam seems like a waste of money. There are much cheaper ways to do the things included. ",,,2,0,0,
ea4fc196-d231-4d6d-a859-41863eb7d823,1503541479,"Yes, there is tactile sign language, which works a lot better than one would imagine.",,,5,0,0,
7e87525c-d09f-4310-a2a2-3214e50dde2e,1504143548,"Please don't judge all blind people by this experience.

Just remember to ask first. Don't push or pull, offer your elbow and let someone walk beside you, one step behind.
",,,8,0,0,
13ff2ddd-a7cd-42ec-a7a7-07a7eff76eb5,1504201818,"Born with a glaucoma in both eyes and only 10% of sight, lost it 3 years ago.",,,1,0,0,
7dfa93f1-b4ca-4f21-9908-d574d170abee,1502286149,"No problem!  Heinlein is science fiction (spaceships, aliens, etc) mixed with politics and sex. Piers Anthony is light fantasy.  ",,,2,0,0,
fc459083-bc70-495a-9576-c6984e7c2a03,1502439150,"Oops! Made  a mistake on my last post and can't see where or how to  edit. 
The decision to block Alexa while VoiceOver is running is ridiculous.   I too think it came from a place of ignorance as to what VO does and they should rectify it ASAP. I was thinking of trying this app out before I heard about this nasty buh.  ",,,2,0,0,
3461e965-d8ad-4647-b594-1c4b3fafd2f6,1503498555,Eclipse light isn't any worse than any other day. The natural spectacle just makes it easier for people to override their natural inStint to look away from Bright Light. You are fine.,,,1,0,0,
47601089-648b-456b-b886-bca153eb9f2a,1503753090,TalkBack is the default for Android devices,,,1,0,0,
887bed4d-1d2c-465d-a5f2-10011720c4ef,1503468152,"I'm actually not male, but still, useful advice. Just degender all of what you said in your 3 points about finding available and interesting people, and yeah. That's fairly close to my own experience.",,,1,0,0,
f4c33857-c4e0-4d69-9dd6-aeade46e5c6d,1503764320,"No problems! Artist passes are the AAA lanyards the bands, and their crew get. ",,,2,0,0,
ebf0bc5f-1096-49fd-b997-20e9cb61766a,1503000535,Can you explain what you mean by activated by a key sequence?,,,1,0,0,
a31ded7a-b91d-4c92-85f6-b6c56d69a09e,1504202857,"My thoughts on this kind of thing have evolved and changed a lot over the seven years that I have been blind. First of all, let me just say there is no black and white, one size fits all ideal approach for either offering assistance or receiving assistance, because every blind person will have a different preference, and every sighted person will try to help in different ways. As several people have already pointed out, I do think the most important thing for sighted people to do is ask first. On the flip side, I believe the most important thing for blind people is to try and not react with frustration or resentment when sighted people offer to help them in a reasonable manner. To open a door for someone, as you did, is reasonable and I do not think it was right for the blind person in question to express frustration towards you. However, you could not imagine some of the insane, unreasonable things that sighted people do which we blind people have to deal with. It is a pretty regular thing for people to touch us and grab us without our consent. People will follow us, even when we have explained that we don’t want their help; to be touched or followed like this takes away all of our agency and is the kind of experience that is normally reserved for children, although who thinks it’s ok for a stranger to grab or follow a child? When facing such treatment, I believe it is understandable and even advisable to make it clear that the “assistance” is not appreciated.

When I first lost my sight and learned mobility skills, I was very resentful when sighted people offered help. I had worked hard to regain my independence, and it felt like these sighted people were questioning this independence. I eventually mellowed out, because sighted people normally have good intentions and making them feel bad does not accomplish anything. Occasionally, I would make an effort to help sighted people understand the proper way to offer and provide assistance. For example, if I was dealing with a friend or coworker who I knew I would be interacting on a regular basis. However, for most polite sighted people who I would encounter it would simply not be worth my time to try and explain the intricacies of interacting with blind people, so I would just politely refuse or accept their help, depending on the situation.

A year ago, I lost a great deal of hearing in one of my ears, so it is much harder for me to get around now. As a result, I find myself needing more assistance from sighted people then I required in the past. On the other hand, however, I will say that with my decreased hearing I do find it more difficult to deal with doors that people are holding open for me. I’ve always found it easier as a blind person to simply find the door myself, but now this is even more the case because I have decreased directional hearing. In other words, it is harder for me to tell exactly where someone’s voice is coming from, so it is much easier to walk into them; this combined with the fact that it is often difficult for people to correctly offer left/right directions can result in some annoying situations. For me this is a great example of how you can never know what assistance a blind person might need, so it is always best to ask; likewise, as a blind person, you can never know what a sighted person’s intentions are, or what their previous interactions have been like with blind people, so it’s best to try and default to a polite understanding approach. Honestly, with most human interactions it is best for our default to be polite understanding with limits on preconceptions, weather or not our eyeballs work. 
",,,3,0,0,
