commentator_id,created_utc,anonymized_body,ups,downs,score,controversiality,gilded,distinguished
adf46e8d-fcdc-45f9-af4d-0a70170b8dd4,1516419367,"I recently got my 1st wheelchair so I’m looking at this more from an educator’s side as I taught 1st grade for 7 yrs. one yr I had a student with an aide. She has C.P. no wheelchair, but needed some help. The aide was just a part of our classroom and the kids all knew her and were allowed to ask her for help if she wasn’t needed by the student. She was there to make sure the student didn’t fall and also for bathroom time. 

During lunch our tables get full as well. The aide would sometimes sit at the table, but as the student had friends who could help her open things the aide started standing by the lunchroom monitor and just kept an eye on the student. As long as she kept an eye on the student she was ok to help other kids open things and excuse them from the table. This was something she asked the mom, the principal and our district 504 person about because those are the people directly involved with that. 

So, if the person who pointed it out is over you, I’d ask the parent what their thoughts were (in writing). This doesn’t sound like the case, and as with almost every school there are most people trying to tell others how to do their job better or looking for a reason to complain. So...I’d ask your supervisor their thoughts. Tell them the situation and ask them what they would like you to do. One thing that was so helpful for the aide &amp; my student was they had a notebook that went back and forth between home and school every day. It stayed in the backpack and it was a way for mom to communicate with the aide. Most of the time there were just a sentence or 2 w/any questions, something the aide saw (good/bad), and also how the child was socially fitting in. Not naming names if other kids, but saying if she had others playing w/her, etc. 

",,,2,0,0,
e8117b8b-2125-4688-a26a-e99161f4c6af,1516420886,no she was getting it from the state of NJ. ,,,1,0,0,
2581662f-fc04-455f-9b7a-b7314fcd746e,1516436642,I'm really sorry you're stuck in that position. I hope you can find something soon. ♥️,,,1,0,0,
7f51e6d0-3fde-419b-9ef7-9f2e39c4e36c,1516468018,Unless you can get disability DO NOT QUIT. Having no income along with being disabled is a recipe for disaster. Keep looking. Try the non profits who assist people with disabilities find work. Just please don’t make the problem worse by quitting. At worst make them fire you so you can get unemployment. ,,,6,0,0,
b18ba244-d1c0-4e50-97a8-6189347b4228,1516468079,"I do remember decisions being delayed during the 2013 shutdown. Though it looks like SSA changed their plan in 2015. [Per this contingency plan](https://www.ssa.gov/agency/shutdown/materials/2015-contingency-plan.pdf), ""decision writing"" is supposed to continue during a shutdown. ",,,2,0,0,
7f51e6d0-3fde-419b-9ef7-9f2e39c4e36c,1516468538,"Can you get your doc to give you stress leave? Go talk to yours and explain everything, including how much this is stressing and wearing you out. If they have half of a heart they should at least put in the effort to try ",,,2,0,0,
c4b5bc36-a215-461f-907c-5d5e84ffcfda,1516475607,"Yes. SS is partly shut down during a government shutdown. Some Application work is put on hold, but not all of it. Depends on where your application is in the process. For example, final quality reviews that happen before issuing the decision is on hold. Also, SS checks will continue to go out.",,,3,0,0,
9598abc7-033c-45b2-820f-5129e1a9cc12,1516487579,"I relate. Not to the physical pain, but emotional stress. I could only get a job working as a case manager for MHMR, and to say that it was emotionally draining is an understatement.

That job has seriously sent and left me in a dark, dark depression. 

I’m still struggling to recover, still struggling to get back on my feet. 

Have you considered getting help from DARS if you have something like that in your area? They might help you find something else that can work for you. 

That’s what I’m doing.",,,3,0,0,
1ff4d3fe-c09e-45d6-b07b-4761503f596e,1517012821,"i get that, but my issue is my capability to see a doctor for any kind of formal diagnosis in the first place.",,,1,0,0,
ab79de79-0229-458c-a4d5-5c0a08df738a,1517314417,"""Disabled-coded"" seems like an odd choice, but you probably don't have to worry what words you select as long as you don't use traditionally negative words like cripple, invalid, etc. ",,,2,0,0,
6df91383-2180-4e5c-9df2-37ea3a8398f8,1514992415,What if I've been through the spectrum of meds and the doctor doesn't have any more recommendations for me to try?,,,5,0,0,
ac60aab4-d67f-4ff4-85f9-465bc31c576a,1514984586,Wow... that sounds like a very serious situation. I'm sorry to hear you haven't gotten the support you deserve.,,,2,0,0,
108324f5-ae26-46ff-9c68-b4f273c7a98c,1517418052,"I think the fact that this is understandably something I’m sensitive about after being told “you’re too young to be in this much pain so I’m taking your pills away” among other things by actual trained professionals. I don’t usually have too much trouble putting to one side the fact that other people have different opinions or even where they’re just trolling. 

(Side note: I did eventually start using meditation and get rid of most of my pills, but that’s not the point) ",,,4,0,0,
2e98a32b-1620-46a4-80cb-3355f4f260c7,1516319087,"They should anyways, if medically necessary.
These do not qualify as mobility devices.
Might they work for you? Eh. I wouldn't ever want to depend on something 2 wheeled. Balance is too often an issue.

https://www.medicare.gov/coverage/durable-medical-equipment-coverage.html

Medicaid has the same guidelines, but pays the coinsurance.

https://www.medicare.gov/coverage/manual-wheelchairs-and-power-mobility-devices.html",,,1,0,0,
dceb64d2-5c4b-4083-acea-083cb49463b7,1515870621,Marlee Matlin - Reasonable Doubts,,,3,0,0,
257dbded-d8af-4dfa-9170-5a6c9c5c6755,1517113194,"Well, you know...your taxes pay for it. ",,,3,0,0,
499bfd37-54a0-4159-9314-c7e0d020cc8b,1515239262,"At some hospitals I've been at they have a chair that they wheel around to weigh everyone. The numbers are on the back and you have to lift your legs off the floor so you would need some help unless you can find a different one.

Search ""weighing chair"" ",,,2,0,0,
de6dcd15-0280-4763-85ac-07d6d6c73060,1517170982,The hearing went well I think. It was demonstrated that I fall below all of the common standards for employment in my field. Now waiting for the decision. I'm guessing I'll hear something about early feb. Not holding my breath...,,,1,0,0,
b353aeb5-7cea-49b3-8473-b4346795c053,1515479479,"Personally, I would bring the dog to class if it helps. I try never to sit out and miss things completely because of my disability, but try to find strategies to participate even a little bit. I would encourage you to do the same.

As for the personal insult side of things, honestly, shit happens. Non-disabled people rarely understand disability without some assistance (or in this case challenge), for most people, it comes from a lack of real world experience with disabled people. Given the taboo around mental health, I hate to say it, but you're likely to encounter quite a few people who just don't get it.  Your instructor has apologised and offered to try to do better, neither of you will learn anything if you just avoid one another.

It will awkward (and I imagine for a person with severe anxiety issues, all the more difficult) but I suggest you try to repair the relationship. Perhaps schedule a time to meet in a casual private setting so you can explain a little bit more about what being you is like. Take the doggo. Everyone loves doggos, it'll break the ice. ",,,9,0,0,
5b3317f6-1372-4ef7-9c98-98010eb6dc19,1517013440,"The last time I applied involved a doctor who refused to assess me (very long story) and used 5 year old notes to complete the form. I think that was rock bottom in terms of applying, so I have faith that things will be better this time, even if it's because things can't possibly go worse.",,,1,0,0,
df6b513c-6d92-4e57-a964-3c67b769934f,1515025359,"How about, ""I'm having a party and I'd really like you to come. The problem is that my apartment has a few steps, the bathroom is upstairs, and blah blah blah. Is there any way we can make it happen?""

Basically, exactly how you just asked strangers on the internet. ",,,20,0,0,
df531f97-06a3-4961-9947-05bcbcb828ae,1515557937,"I have it, it's hell. Plus having a vestibular tumor.  I fall.... A lot.  My balance and hearing just complicated things much more. Props to her, I'm too afraid to travel to the store anymore.  She's doing great! ",,,2,0,0,
85d78199-6a32-4e80-aa98-2b4135b65903,1517368672,Its illegal to do that unless the driving links to the essential function of the work. Not that knowing that helps you get a job for those asshats.,,,6,0,0,
f1e5eab4-f220-4392-b8a3-dd5163fb070b,1515131620,"Hi OP-

I can try to give you some direction if you want to PM me. I’ll help however I can! :-)",,,2,0,0,
30eeb657-90d9-4776-9c58-192e16f2b321,1515918959,I have spina bifida. I think I honestly stopped growing when I was 14. I'm 4'7'' so i'm okay with the height.,,,1,0,0,
87e6a634-43f4-42cb-b982-195120faf70a,1517216855,I could expand the cartoon from 4 to 6 panels to make room for more examples. Thanks!,,,1,0,0,
14f46960-cc30-4e96-b3c3-e2afd8315714,1515151567,I posted it there as well but I was hoping that maybe someone on this subreddit has gone through something similar before,,,2,0,0,
027a1edc-29da-4b66-aaf2-22f18a400f4e,1515344686,"I sort of have one of those. Not sure if it counts.... Before my leg came off, it was incredibly, amazingly painful at all times, and the knee was frozen straight out with no weightbearing -- basically just plain awful, TLDR. Years and years of that.

Then the leg came off, and it all that went away. GRANTED -- it's a whole different kind of disability now, so calling it a ""cure"" is kinda odd, but that's sure what it felt like. Does that count?",,,2,0,0,
cf345023-1504-4662-9658-c7ae58d18bdd,1515955362,"I was making an observation, not worrying.",,,1,0,0,
335682bb-f6ee-4c38-942d-4611152db80f,1515705566,Forced apologies are fake apologies. ,,,2,0,0,
c89d8b55-ee70-4e80-81b2-f2bfc4ccb3b9,1515855841,"While the idea seems great...I do have concerns. This *is* Texas, after all, where they put caps on special education referrals and have done a shitty job in general of taking care of their disabled students. My concern is that this gives people power to abuse folks with invisible disabilities, whom they feel don't ""deserve"" their placard. Hopefully that would be part of the training, but you never know. I see people taking up these spaces (and the lines next to them) all the time, and I would love to be able to knock some sense into these people, so hopefully this practice will work well! ",,,7,0,0,
7a8adfe0-b3bb-42b1-8e1d-493cd5ecfe68,1515479886,"Good that you've started a dialog. People make comments in ignorance of differences and disabilities not knowing the effects that they can have on people, and it's my personal belief that it is just as much their responsibility to be mindful of these comments as it is our responsibility to educate them. There is no better place to do this than in a classroom setting. If at all possible, I recommend staying in the course and requesting time in class to tell the class about the incident and some other elements of your experience that you feel are important for them to understand. if you are uncomfortable doing this in front of class, write in something to be read, or take a video. You can help to make sure that no one feels like you did in her classes again. ",,,2,0,0,
9ae79ad4-9ca7-4ad9-8ab1-65f21906bfd4,1517171477,I see so it's lost gain on the attorney's   end.  Makes sense.,,,1,0,0,
56f29fd4-a277-4cd2-8648-fae70ede86b9,1515632172,"I have a lovely carbon fiber one from fashionable canes. I actually prefer it to my solid one, since I can just fold it up and tuck it away at restaurants etc.",,,3,0,0,
fee77648-82f7-486b-8fbb-2bb004c4ce06,1517019034,"Sorry if I missed this in your post- what part of the world are you in?

If there is any kind of free legal clinic in your area, I would suggest talking to them first.",,,2,0,0,
eeecf595-5e8d-4cae-b625-467a9d093e70,1517027845,"Ok I am not trying to be rude here but I too live in WA state and you have to be confused about something. With your work history there is no way you qualified for ssdi. Then you have to be on ssdi for 2 years before you get Medicare (or have it take 2+ years for your reviews and  hearings). 

If you google ""having ssdi transition to ssi NOTHING comes up. So I don't know what happened but whatever it was isn't what you're saying. ",,,1,0,0,
9ec0d415-16db-4619-bab1-860659a04385,1514903537,I really want to post a pic . But I don't know how to do it on this app ,,,1,0,0,
5ea08a66-c757-4cf4-b562-6e83d54b8f30,1517239495,"Thank you, this was really helpful. ",,,1,0,0,
c5e64409-7272-4539-8c7a-692a90f16dbc,1515074971,Ask is the only way. I am in a chair but I use walking sticks and crutches and sometimes nothing so it will depend on people's individual disability,,,3,0,0,
675542cd-7a0c-4dc0-8f65-8611c3671af6,1515183036,"Contact the SSA and see if she can apply for SSDI on your Social Security.  I want to say she can be put on yours until age 21, and she'll get Medicare.  I'm not 100%, though, so check.",,,1,0,0,
2621950a-f51e-4bb9-a542-09ef5708bfea,1515359538,This is the funniest thing I've read today. Thanks.,,,3,0,0,
3d0b7e4e-d934-4f04-af27-a8bf17e4d94e,1515365873,Never trust people who don't like your dog.,,,8,0,0,
1dda2c56-97ba-4322-9cf7-462d289ee1a4,1515807046,I'm pretty sure you're right about that.,,,6,0,0,
322615a8-192e-4fe4-a282-c8578c9b5ae5,1515816677,^^^ This. I was denied. Got a Lawyer and won.,,,1,0,0,
c4700850-875b-465c-b50e-e8b77c12c8f6,1515850341,"With inspiration porn *in general*, regardless of who makes it, there's an implication that you're at fault for your own suffering because you're not working hard enough to get better. It's like how people in poverty are being told they aren't working hard enough, even though upwards mobility in the USA is extremely limited.

Your friend is a statistical outlier. His situation has a lot more to do with luck than with hard work, but that's probably hard for him to come to terms with. It's empowering to believe that you have control over your circumstances, and certainly much more comfortable to think about than that all your hard work might have been for nought. That's all well and good for him, but when he applies those feelings to you as well, that's a problem.

You can try talk to him about it, and if you can't make him understand where you're coming from through reason, you might have to enforce a ""conversation topic ban"". I've disallowed my mom from ever mentioning my weight, because even if she's giving me a compliment, it comes across the wrong way - just like how your friend, in his own mind, is only trying to help. If that's the way you go with it, you can choose to say something like ""I know you're trying to help, but it's upsetting to me when you say these things. I'm happy you recovered, but I'm going to recover in my own way, at my own pace.""",,,11,0,0,
7b755d24-6e0d-4d25-9b76-4ffa9ea1f166,1515253804,Where do I start with this? I'm not on SSDI and everything says that I need to be on that? ,,,1,0,0,
d06ad108-abc0-4cb9-adc8-467d15cfd080,1515435182,"I tend to kind of float around at the same level I sit in my chair, or I'm crawling... Only when there is some reason to pay attention to my wheelchair do I have one.",,,1,0,0,
6f535f25-8e33-4de9-9afa-31f3fed9cd2f,1515475031,"Most dreams I’m not in a wheelchair. Although some I have had some type of impairment walking where I’m limping, dragging a leg or I need a cane. ",,,3,0,0,
7e2eab6c-0501-424e-9ed5-d355701b1267,1515300563,"I am not 100% certain, but I seem to recall that you can only have one set for one vehicle. They issue a rear view mirror placard for the other vehicle he owns, or in case he drives with someone else. At least that is the info the CA DMV  have to me when applying. ",,,1,0,0,
076fb0f4-b654-4c31-8898-56a6411933ee,1515302197,"No, you apply for a license plate not a placard.

You only qualify for the license plate if you have a Permanent disability. they will issue a plate if you have the proper documentation. It's not hard 


From the DMV website


Permanent Placards &amp; Plates
Permanent handicap parking permits are available ONLY if you have a permanent disability that is certified by a medical professional.
The California DMV issues:
Permanent placards, if you are a permanently disabled driver.
Disabled person (DP) license plates, if you have a vehicle registered in your name.
Disabled veteran (DV) license plates, if you meet the DV plate requirements.*
*Veterans who are 100% disabled may be eligible for Disabled Veterans License Plates and be exempt from vehicle registration fees.
Temporary Parking Placards
If you are temporarily disabled, you can apply for a handicap placard that is valid for no more than 6 months.
A medical professional will need to:
Certify your disability.
AND
Indicate how long the placard should be valid.
",,,1,0,0,
92f0dd46-cdb3-439b-82c6-ae2762dc04fd,1516168773,"The following is going to be abrasive but it needs to be said:

The reason we keep seeing this is because we don't get our shit together and vote for disability-friendly candidates. If we made disability issues our #1 priority on election day, you bet your ass things would change.

But every election it's the same thing. Half of us vote for the disability-friendly guy, the other half go the other way, often for stupid reasons. And some of us don't vote at all. Not because they are legally banned but because they don't wanna.

I know at least two people who won't vote for pro-disability candidates because they don't want to be accused of letting disability influence their vote by their abled ""friends.""

And I'm beyond done with the special needs parents or whatever they call themselves who claim they're sooooo concerned about their kids' Medicaid yet keep voting for the people cutting it thinking that if they just ask reeeeeeeeaaaaal politely, they'll decide not to cut Medicaid.

Sorry if I sound abrasive but it's been 27 years since the ADA. And since then, we've stagnated in terms of progress because we've bent over backwards to be bi-partisan even as one party has made it clear that they don't like us. Justin Dart would be run out of today's GOP.

Here's the deal, all my fellow disabled people who want better SSI, Medicaid, job training, etc. you have to vote for it. You have to vote for the politicians that want it.

Yes, even though the special ed. teacher hurt your feelings (been there done that).
Yes even if the college kids complaining about ""cultural appropriation"" are insufferable.
Yes even if your friends/family accuse you of ""identity politics"" or whatever.
Yes even if your pastor/priest says to vote for the other guy.

Because as long as disabled people keep not voting, keep trying to reason with the Paul Ryans of the world, keep letting our fears of what our abled ""friends"" think influence us to vote for people who have their claws pointed at us, we'll keep seeing this.",,,10,0,0,
ca2d5ddf-11bc-4597-abb5-d3f7ae707019,1515303856,"Thank you, I found one he likes on North Face.    He likes the bright cobalt blue Youth Recon Squash.    He is vision impaired so the brighter something is the more he loves it.    ",,,1,0,0,
cef2c1e8-fd07-45d7-ac5e-1f05ec78c419,1514963042,I have an institutional rep payee. I pay them 40 dollars a month to manage my finances. If you call social security they should be able to refer you to an organization that does this.,,,2,0,0,
c14f29b9-a9d5-4c6e-93d0-5e3d1bb07340,1514966598,"It all depends where you are and what local services are available.

Find out everything you can about all of them and use this knowledge to hook up your clients with services that can help them.

Some ideas of things to look for:

Subsidized disability housing

Or other form of rent assistance service (pretty damn rare AFAIK) 

Home caregiver services from cleaning and shopping to in home health care

Local food banks and how to sign up

Local homeless shelters

Local free meal options for the homeless/poor

Home delivery services like meals on wheels, food rescue (leftover redistribution groups, some places have them)

And of course how they can sign up for Medicaid, Medicare if they're not on it already, food stamps/wic/chip/etc

Other local disability assistance services that can provide things like power of attorney to handle their paperwork and healthcare choices when they are unable.


I'll come back and add more stuff if I think of anything :) good luck and thank you for doing this! ",,,2,0,0,
9ec0d415-16db-4619-bab1-860659a04385,1514904250,im from China . 29 years old . I got divorce about 2 years ago . And my ex left me for another woman last month . I'm so depressed. I can't any any joke in my life . Is there any one can accept a girl who has scars on her body ?,,,1,0,0,
c48eb133-c65f-4218-a7a8-20867cdd6cfb,1515572062,Youtube channel with some additional description ot the tool - https://www.youtube.com/user/4webTV/videos,,,1,0,0,
71a837b3-8158-43af-9de4-ff21c75ec02d,1517257717,"There are enough people with broken or sprained ankles who otherwise look (and are) physically fit but use a cane. So you shouldn't worry about people thinking that you don't really need it. As far as the stigma attached to a cane, there is more stigma attached to being drunk, so it is better that people see you walking with a cane than stumbling without one.

I don't have any problem with my hip, but a cane may help yours by keeping some of the stress off of it.",,,1,0,0,
335682bb-f6ee-4c38-942d-4611152db80f,1515705464,"I'm concerned that this is a professor who is TEACHING about students with disabilities today while making this statement. 

I would be highly interested in what the student disability office and HR's disability management office has to say about the professor's course, because they seem a little behind on the laws of service animals. I would also be interested in what the ADA coordinator and the chair of the instructor's division would say. 

Are you sure this isn't a focus group brought together to discuss the issues? Cause there would be SO much to talk about...

LMS's such as Canvas and usability of the technology, as well as the lack of training for all involved. 

apps included into Canvas which aren't accessible to all students. 

course materials which are basically images and don't interact with technologies. 

and transcripts of all posted videos...

the list goes on and on.",,,1,0,0,
803f36c6-e447-4fab-bc36-5c2b9b60f424,1516001059,"Oh, neither did I. I got my retro check before my approval letter. I was shocked that I was approved. I just figured it was due to what I had as proof.",,,1,0,0,
83d13a38-9cf4-464a-af66-5774eee3950d,1515366461,This is the right answer. Communication should always be the first step.,,,5,0,0,
a553ad6a-2955-4a66-8c7c-65f98f7a6933,1515393790,"Oh my gosh. Same. Don't be too hard on yourself, it is really hard to change our diets to be safe because our tastebuds say one thing and our logic says another. Your eventual goal is to make it automatic so you just eat like you should out of habit and easy-access foods, or to reward yourself when you eat safe by noticing how good it is or punishing yourself by eating badly by noticing how bad it is. 

There are lots of options. What's worked for me is just making eating the safe foods a habit, and making sure everyone around me knows I'm not supposed to eat any foods besides my few safe foods. I make sure I always have a safe snack in my purse and bring my own food to people's places when there's a dinner thing. I make sure restaurants have a safe food by checking menus beforehand. It's like you said, when I get down to it eating this way isn't so bad and it's doable. 

Basically, I made a list of things I could eat at restaurants, quick prep things I had in my freezer (frozen food or prepared by me and frozen) to make it easy to eat safe, and then just ate the same things on rotation until it was eventually habit. The important thing is to make it really, really easy to eat safe or semi-safe. Try to avoid ""oh and I'll also cook elaborate meals constantly"" style planning. I still slip up a lot but I am usually eating within the framework of safe food with only occasional slip ups so I'm okay with it. 

Have a semi-safe treat food, too. Chocolate isn't great for me, but it's not as bad as if I caved and had cornbread, for instance. So having some chocolate on hand to satisfy cravings helps me. It's all about harm reduction and training the people around you so they don't make it harder on you too with their comments. And it's easier to replace a bad habit of caving with a different habit instead of trying to just do nothing and not eat it while you think about it still. 

Edit:
Oh and oddly enough adding in vitamin gummies helped me because it reduced my cravings. Often when we crave something it's because we need some nutrient, so I'll take a gummy when I have a craving too. Or if I'm craving something salty, I will (this is gross but it works) literally pour some salt into my mouth and wash it down. I need a lot of salt because I have POTS. ",,,3,0,0,
982f0caa-e46f-49e7-a332-f29a66fe18ed,1516898919,"I've had a very positive experience with Ally. They're an online bank, but they have a no-minimum-balance, no-fee checking account and their savings accounts have no minimum balance + 1.35% interest rate.

Simple is another (also online) no-fee banking option.",,,1,0,0,
