commentator_id,created_utc,anonymized_body,ups,downs,score,controversiality,gilded,distinguished
ae4d9426-ef76-4989-94e3-27b17dcd7599,1516343754,"It’s definitely not offensive, he gave you permission so that’s fine. The person who made that comment, I’m assuming they didn’t know he asked you to sit there. I can understand why they might have thought it was rude, but context matters. If anything you were doing the best thing you could for him by helping him socialise! ",,,8,0,0,
e768af5e-ec19-4ca9-9bbe-36b43c792143,1516343893,"I've been a chair pilot for over 50 years.  I know what I'm talking about.  As he asked you to sit in his chair, he's obviously okay with that, and you.  The aide who had the tantrum was way, way out of line.  This Aide has no right to speak to you like that, or to presume to speak for the community.  This person is not the kind of person I would even consider as an aide.   This person is a disgrace, not you.",,,11,0,0,
aae7c254-aa01-4ce4-83ba-64398c3b7be8,1516344343,"I think the problem isn't that you sat in his wheelchair, but rather that you sat in it and you are his aide/paraeducator - if that makes any sense. You weren't being disrespectful to him (he asked you to!), but you weren't respecting your job position as basically an employee for this kid.

I mean, I got out of my chair all the time in high school just to give my butt a bit of a change and my friends would steal my wheelchair and go for joyrides. I was fine with it. It was funny. But it would have been super weird if one of my teachers or aides did the same thing, just because of the power imbalance. 

I applaud you for letting this kid feel normal, but couldn't you have just grabbed another chair from somewhere else? ",,,4,0,0,
aae7c254-aa01-4ce4-83ba-64398c3b7be8,1516346462,"Okay. I understand. Yeah, that is a bit of a awkward situation for you (at my school, the noon aides wore specific vests so that the normal aids wouldn't be bothered with such requests). I think you can just look ahead to future situations and make sure you grab a normal chair for both him and yourself.  ",,,3,0,0,
5905a3d8-ca1d-4986-a81a-308adf2c6eca,1516351433,Have been in a wheelchair for 30 years and can categorically say that IMO you did nothing wrong. Whatsoever. The aid may be sincere in her desire to stand up for the 'rights of the disabled' [or whatever she thinks she is doing] but I think she needs to chill... a lot.,,,15,0,0,
0cc2367e-d66b-4f9b-85ff-aff199112a28,1516354794,"I worry this may happen to me, my disability is not as visible as others, I have severe scoliosis(although it corrects itself and I stand pretty upright) but it is extremely painful and very limiting to do much walking. I had several muscle groups surgically removed from my back, and I suffer from spinal stenosis (pinched spinal cord). If I know I won’t be in a store long, I don’t always bring my cane, and I’m sure people look at me with their judgmental little faces. My brace is usually under a jacket or shirt and not noticeable. Anyways, I hate ppl sometimes. ",,,2,0,0,
dd5ba938-8e66-497b-aa3a-5b82d384ce26,1516370533,You're in the good. She was just being a cunt. ,,,13,0,0,
b972c2bc-f7fa-4bc3-a009-93ef7653bc3d,1516372066,"Just curious, what does your job mean? Just from your description he seems handling things fine by him self.

You live in the US I guess?

I see no problem in you sitting in his chair if he asked you to do. Did you tell the women that and what was her response to that?",,,5,0,0,
c2228151-c10d-4d91-b659-6355f1124daf,1516669468,"Thank you, I sure hope so. 

The group is a legal advocate and will send someone to represent me, they're going to reach out and review my case soon for the next step.",,,1,0,0,
7cf6d277-ec4b-4607-8516-2ba5feb9f31b,1516669732,"My limitations havent stopped me from doing my job right now and shouldnt stop me in the promotion. Essentially, I am already doing the  work of the promotion. The promotion is me being officially paid for it and getting a fancy title even and a couple of perks. My physical limitations slow me down in comparison to my all male coworkers. I'm shorter and cant reach the high spots, I'm not as strong as they are and by default with being shorter I'm not as fast.  When they do a casual stroll, I'm doing a fast walk to try and keep up. I'm average height for a female at 5'5'' my coworkers start at 6ft. My actual disability has nothing to do with my abilityto the job and thats why I never asked for accommodations at work. I didnt need them. ",,,1,0,0,
ddd89bca-461d-4fb7-8e88-3685610f9f05,1516671813,I found the same problem when I first started using mobility aids.  But I would make a joke about it such as introducing my walking stick by a silly name like Kyle.  After that people loosened up,,,1,0,0,
dcb60d0d-0b04-4005-91c3-e4a2cd8554c6,1516676523,"In the interim check local sales sites for another used one. My bf was in a different situation, but the medical supply store in our town contacted the doc and insurer.",,,2,0,0,
dcb60d0d-0b04-4005-91c3-e4a2cd8554c6,1516676932,"Your video editing ""smooch!"" Perfection! From your painting in the video, I assume the arts are your forte. Subcribed and sending to a girlfriend, who may be old enough to be your mom but is feeling very shy about being in wheelchair, I think she will dig this. ",,,1,0,0,
a9467d56-6d20-44d4-b4f5-bb5d47a5f3b3,1516680671,"Hello fellow ""near Denverite""! There is a great Facebook group called
Virtual Workers of America that you can request to be a part of. They list all kinds of Work From Home jobs. There's some really nice people there.

Good Luck!",,,2,0,0,
22f6148d-5dfb-4ea5-8663-e7efc596858b,1516700294,Thank you for sharing your concerns and for being so validating. People do not always understand how hard all of this is. There are a lot more people not getting what they they need than there are people who supposedly abuse the system to get free money.,,,1,0,0,
c886b214-67b1-4390-b5d3-20204bd45aca,1516707298,"That doesn't seem right. The judge must base their decision on the listing. That's the law. My lawyer world give me no indication of his thoughts saying he doesn't make predictions
. ",,,1,0,0,
1a47580d-606f-4f02-98d8-058c40e3edfa,1516713893,"Get documentation of your problems.  Every time you need medication or a procedure to aid your work  (muscle relaxants,  pain killers, nerve blocks, anything) and maintain income,  get a printout.  Keep a journal of how your daily work routine affects your pain levels,  mobility,  and health.   Get copies of scans and other assessments,  and get new ones if it's been a while.   Highlight deterioration if your radiologist or ortho sees any. 

You'll need all that for the first and second appeal. Get started on the application now because it can take 3 years to get it.   Use a lawyer, the SSD ones usually only get paid if you win and will just take a small percentage of back pay.  

I'm 36 with spina bifida and still not disabled enough so I wish you better luck than I've had.  I got lucky and found a job independently contracting from home so I don't need it now anyway! ",,,2,0,0,
60933438-bb12-4b31-a1f6-4cce0d57da5f,1516714295,"Thanks! You can tell her that my next video is going to be very much about this whole wheelchair thing with a touch of fun, currently editing. She might like that video and appreciate being in the chair :) ",,,2,0,0,
c2228151-c10d-4d91-b659-6355f1124daf,1516726535,"I've tried numerous meds in the past to which none have worked. I'm just starting up with a new therapist who agreed that taking medicine for my stomach wouldn't help until my head is better. My GI doc will only prescribe antibiotics since all he can tell me is ibs. Insurance won't cover expensive medicine. So I've been trying yoga, dietary restrictions and eating better, things I can control.  I've tried tons of anxiety meds to which none have helped, which is also explained by my GI problems. Anxiety and depression meds don't take full effect unless released in lower intestines and my stomachs bad acid isn't letting the pills get there, so they aren't being absorbed correctly. So I've been wasting my time with meds. I have a lot of trial and error and this chapter is all about dietary efforts and learning ways to destress and cope.",,,1,0,0,
a9090660-b2d1-4f4a-b00d-32880c994553,1516729170,"If you are going the non-insurance/non-doctor route:

If you have a local chapter of Easter Seals, they might be able to help.  I know before we were married, my wife was able to get a hospital bed from our local chapter.  

Also, I have seen them on govdeals.com locally many times (especially when local VA facilities and care/treatment facilities upgrade to newer equipment)...Last year they were so plentiful on the site locally that they were being sold for $50 for working units.",,,2,0,0,
7946bccb-5377-4069-a5fd-ec0342912784,1516738501,"Just hired Timothy White.    
Good lookin out, much appreciated ♡",,,2,0,0,
226dbb47-9192-4a4e-ab13-5697ae8b56f6,1515914871,"/u/58a4bd60-76c6-4e22-9fd2-a299a5390317 , were you able to find out anything else?",,,1,0,0,
226dbb47-9192-4a4e-ab13-5697ae8b56f6,1515173943,"You very well may be right. I suspected that things are not as bad as he says, but I have no experience in this so can't say anything. I'll pass on the info and post back here what he says. What about recertification?  He says he'll need a signature again when it comes time to recertify.",,,1,0,0,
226dbb47-9192-4a4e-ab13-5697ae8b56f6,1515190228,"I can speculate why they don't want to sign anything, but don't want to here.
Does it make a difference? It would be good to know if it is in fact illegal, but if it is illegal playing that card would be the last resort I'd think. The ""landlord"" lives in the room down the hallway. Threating to sew or calling the authorities would make for a very tense living situation I'd think.",,,1,0,0,
226dbb47-9192-4a4e-ab13-5697ae8b56f6,1515108585,"AFAIK he is.
He's currently receiving the full SSI and if the new landlord doesn't sign something my friend is in deep doo-doo.",,,1,0,0,
226dbb47-9192-4a4e-ab13-5697ae8b56f6,1515185015,"Thanks!
Just spoke to my friend. He says ""ok, but  what about SNAP? That's only half the problem"". Is it the same process? Just update the address and call it a day? 
I assume most people on SSI also have SNAP (food stamps)? 

Edit: he insists that the issue is that once he moves he must notify the SNAP office. Once he notifies the SNAP office that the address changed, he must show proof of rent for the new address which he can't get so he looses food stamps.",,,1,0,0,
226dbb47-9192-4a4e-ab13-5697ae8b56f6,1515041339,"Yeah I guess sublet is the right term. The issue is that the person on the lease (maybe landlord wasn't the right word to use) doesn't want to sign anything. 

It's a typical NY arrangement - he's subleasing one bedroom from a person who's renting a two bedroom apartment in an apartment building. The person renting the apartment is on the lease.",,,2,0,0,
226dbb47-9192-4a4e-ab13-5697ae8b56f6,1515171609,"Because he cannot receive mail at the old address anymore. So he said new address, new forms.",,,1,0,0,
226dbb47-9192-4a4e-ab13-5697ae8b56f6,1515101252,"Thanks /u/58a4bd60-76c6-4e22-9fd2-a299a5390317 .

That's a fair point, but I have a feeling if his ""landlord"" was insisting on cash in the first place, the landlord wouldn't agree to change now.
What's his option if the landlord says ""No, I take only cash and no receipts. Cash or GTFO""?

We've been brainstorming on this for over a month already and can't think of any good options.
Posting here is the last resort.
Moving out is always an option, but isn't a good one. It's hard enough to find a decent affordable room, never-mind one where the ""landlord"" will be willing to bother with receipts or checks.

Can the person on the lease (aka ""landlord"") get a tax write-off for renting a room to a disabled person?
Unless we can incentivise the ""landlord"" we have no leverage.",,,1,0,0,
e038a184-d3ea-496f-9f65-20567dafebfe,1516552086,"Agreed. As a kid, I'd have been more upset if they didn't sit in my chair. My chair is badass, its always been decorated and other kids asked to sit in it. Having an adult refuse my offer to sit in my cool chair (unless accompanied by an explanation) would have upset kid me.

",,,2,0,0,
e038a184-d3ea-496f-9f65-20567dafebfe,1515402274,Suggestions [here](https://www.np.reddit.com/r/disability/comments/7eik8n/since_winter_is_coming_up_can_you_recommend_me/).,,,1,0,0,
e038a184-d3ea-496f-9f65-20567dafebfe,1515849495,"I empathise, I've had the same issue that people with the same illnesses and/or level of injury seem to have made more progress even though many of them admit themselves they skip their PT and don't look after themselves. 

What's helpful for me personally is to look at it...personally. Is my life better than it would have been without the effort? Undoubtedly. My docs have consistently emphasised that. It might not be as much progress as someone else but it's progress for me and that's important. It's good to measure against yourself.

I'm not trying to fix myself either but I am trying to keep my body in the best shape it can be, like anyone able bodied or otherwise. My baseline for healthy is just different than it used to be and when I keep that in mind, I find it does a lot for my motivation and overall mental health. Like you said it's about looking after your new body and how it works now rather than focusing on the old one that doesn't exist any more.",,,2,0,0,
e038a184-d3ea-496f-9f65-20567dafebfe,1515853185,"Exactly. Don't write yourself off just because you haven't made as much progress as others - the progress you *have* made is down to grit and determination and hard work and you should absolutely congratulate yourself for that. Look back and remind yourself, regularly, and that helps with moving forward.

I hate when random strangers tell me I'm inspirational because they know nothing about me and it feels like pity. I have had a couple friends tell me that they admire and are inspired by the effort I put into things and I'll take that, because they know me and they know how much it takes. If a mate says to me 'I love how you got out to Tesco even when it was black ice out there' that's not a shite pity comment to me, because they know that takes a whole lot of effort and actually, that is something worth admiring and being inspired by. It's not inspirational for me to get to the shops under normal conditions just because I use a wheelchair, I do it every day. But for someone with less function that might be a monumental moment for them because of the increased effort it takes, and that is inspirational. 

It's not an empty compliment if someone sees the work you put in. People are inspired by Olympians who dedicate time and energy to being the best they can be. I can be inspired by someone with a disability who puts their time and energy into being the best they can be, *whatever that is*. The problem for me is when people claim to be 'inspired' by everyday acts, with no idea how difficult that act is for the individual. To me, it's all about context. ",,,4,0,0,
e038a184-d3ea-496f-9f65-20567dafebfe,1515846670,"In your case specifically I'm with /u/8a3f3dbd-7461-4ac9-9c88-1751e523be6c, because this is a friend problem rather than an inspiration porn problem. There are of course plenty of people out there who *could* put more effort into their health/recovery, but your friend has no idea if you're one of them. 

Speaking of inspiration porn generally I think it is down to the individual case, a lot of recovery *is* down to hard work and when everything is hard I can find it motivational to do my PT knowing it can make a difference. I don't expect it to make the same difference as anyone else and I would be pissed as fuck if anyone other than my doctor suggested 'if you just do x you'll get y result'. It also depends on the tone of the writer in general, someone like your friend I'm not going to listen to, someone who acknowledges that luck is as important as hard work I'll find a kindred spirit in.

Everyone is different and as you've said a large portion of it is luck. Some people who do all the right things, have a positive attitude and put in a lot of work get minimal improvement while others who are grumpy twats and sit around all day eating chips get great improvement. Life is unfair that way. 

If you want to be more diplomatic than fuck off I would sit him down and say that while you're happy for his progress, it is difficult for you when your own illness is so very different. Remind him that although his hard work was essential to his recovery, a lot of it is luck and rubbing that in the face of someone not so lucky is not going to inspire anyone. If he responds with anything other than 'sorry mate, I didn't realise how it came across' I'd rethink how much contact you have with him.  ",,,3,0,0,
bd2cb114-3cef-4fdd-9b98-a68fa931ee78,1516468260,Yeah that’s what terrifies me. I’ve been looking for jobs for a year and I can’t find one even being employed. I just don’t know how much longer I can deal with constant pain..,,,2,0,0,
bd2cb114-3cef-4fdd-9b98-a68fa931ee78,1516506216,"Not really. It is a sales job and I actually have tried this before. People don’t buy things from disabled people. As soon as I dumped the wheelchair and the cane my sales skyrocketed, it is crazy. If my paychecks weren’t dependent on my sales I wouldn’t care what people think and I’d use my wheelchair.",,,3,0,0,
bd2cb114-3cef-4fdd-9b98-a68fa931ee78,1516579770,"Sure, but if I’m going to sacrifice my pay to the point where I can’t pay any of my expenses, I’d rather just not go to work to be honest.",,,1,0,0,
bd2cb114-3cef-4fdd-9b98-a68fa931ee78,1516579829,"I figured I would not qualify, that’s why I’ve never tried. It sucks because no one wants to hire a cripple regardless of whether it’s for a desk job or not..",,,2,0,0,
bd2cb114-3cef-4fdd-9b98-a68fa931ee78,1516506641,"Thanks for the advice. I am blessed to at least have my family and they have been a huge help to me. I have other expenses that I need to pay for on my own and I am trying not to be such a burden on my family but they are there if I need it. A huge part of me just wants to quit my job so that I don’t have to constantly suffer, and I’d probably be okay-ish for a while, but I don’t want to be a burden on my family if I don’t have to be.

I’m glad things are looking up for you.",,,1,0,0,
bd2cb114-3cef-4fdd-9b98-a68fa931ee78,1516506297,"Thank you for the advice, I hope that you recover well. I will have to see if I have anything like DARS available to me.",,,1,0,0,
bd2cb114-3cef-4fdd-9b98-a68fa931ee78,1516506441,"I am looking into this and what my job offers. I think I exhausted my paid leave already; I could take non-paid leave but that wouldn’t help me for long. Still, good suggestion, thank you. ",,,1,0,0,
96c8124a-1cf8-450c-a506-184472cdd472,1514952168,"I don’t want my family involved. I have two friends, but one isn’t willing to do it, and the other is applying for disability as well.",,,1,0,0,
96c8124a-1cf8-450c-a506-184472cdd472,1514948770,"I guess what I’m asking about is a little different — a case where someone is determined not to be able to manage their own finances.

Tbh I am hoping NOT to need a rep payee. But apparel a lot of people with psych conditions are required to have one, so I want to be prepared in case that comes up.",,,1,0,0,
96c8124a-1cf8-450c-a506-184472cdd472,1514948264,What’s the point of having your name on the account if you don’t do anything with the money though?,,,1,0,0,
96c8124a-1cf8-450c-a506-184472cdd472,1515029895,Update: I found out I was medically approved for SSI :),,,2,0,0,
d0d4be64-a550-443e-ac4b-255d418ab00c,1516993603,"There are things called keyguards, that may help, though I don't know how well they work with modern keyboards. There's [intellikeys](https://www.enablemart.com/intellikeys-usb-keyboard), and [big keys](https://www.bigkeys.com/). [Amazon also sells a few](https://www.amazon.com/big-key-keyboard/s?ie=UTF8&amp;page=1&amp;rh=i%3Aaps%2Ck%3Abig%20key%20keyboard). If you want to try a mouse still, I'd go with [this guy](http://www.traxsys.com/AssistiveTechnology/Joysticks/RollerPlusJoystick/tabid/1408/Default.aspx).

Welcome to AT, where prices take your soul",,,2,0,0,
d0d4be64-a550-443e-ac4b-255d418ab00c,1517434504,I think it would be more helpful to mention what countries you might be interested in. Each country has varying levels of accessibility and laws to enter,,,1,0,0,
d0d4be64-a550-443e-ac4b-255d418ab00c,1517156442,"I am sorry to hear about what is going on. You have a good way with words. If you haven't, I recommend writing to your congressman/woman and tell them how important it these programs are to you. ",,,3,0,0,
d0d4be64-a550-443e-ac4b-255d418ab00c,1515454626,"This. Depending on the quality pf your caseworker, DVR may help pay for school, and set up for success.",,,2,0,0,
d0d4be64-a550-443e-ac4b-255d418ab00c,1515512080,"Division of Vocational Rehabilitation, though some states may call it slightly different",,,1,0,0,
d0d4be64-a550-443e-ac4b-255d418ab00c,1516371505,"While you were fine sitting in his chair, I wouldn't recommend doing it moving forward. Maybe you can ask for a chair to sit in from the school staff, and talk to the other aides to make sure it isn't taken until you get there. also maybe you can get a nametag or something that says you're not a normal lunch aide?",,,2,0,0,
f9f54438-f5c9-44db-bfb1-2937dd5d89a7,1517150135,"I think the reason your lawyer put that $850 clause in there is that SSI has  income and asset limits.  For every dollar of income you make, there is a complex formula that reduces your SSI benefit.  It actually treats unearned income like unemployment worse than wages earned by working.  After you are approved, SS will look at your financial eligibility for each month you are due back pay.  Your back pay will be reduced by the amount of any income, including unemployment, you had each month.  Since your lawyer gets paid based on a percentage of your back, he or she loses money each month you draw unemployment and receive a reduced back pay benefit.",,,1,0,0,
f9f54438-f5c9-44db-bfb1-2937dd5d89a7,1517020007,"Your situation sucks and I'm sorry you are dealing with that kind of situation.  When you say that you applied and were denied 3 times, does that mean you appealed and ended up before an administrative law  judge?  If you are denied, be sure to appeal.  A judge has more flexibility in applying the Social Security law and regulations.  Find an attorney who specializes in SS law.",,,4,0,0,
f9f54438-f5c9-44db-bfb1-2937dd5d89a7,1515498378,"Either way you are monitored for three years and you can earn (by working) no more than your state's poverty level for a household of 2.  They hold your loan for 3 years and if you meet the criteria during that period, then your loan is discharged.  I used my SSDI award letter when I applied.  One good thing from the Tax Cuts and Jobs Act that was recently passed is that the discharged debt is no longer treated as taxable income (until 2025).  Many people who previously used the program got rid of their student loan debt but found themselves with a substantial state and federal tax bill.",,,1,0,0,
f9f54438-f5c9-44db-bfb1-2937dd5d89a7,1515123438,"I totally forgot abut CHIP eligibility if you have private insurance.  I think if you have private insurance, they have to wait 180 days to be covered. ",,,2,0,0,
f9f54438-f5c9-44db-bfb1-2937dd5d89a7,1515366523,"One of the criteria for SSDI benefits is that your disability must be expected to last at least a year, so they are considered to be long-term.  However, nothing would prevent you from returning to work if your condition improves and the SSA provides assistance to help disabled individuals to retrain for different fields through the Ticket to Work Program.  Seizures are listed in the [SSA Bluebook] (https://www.ssa.gov/disability/professionals/bluebook/11.00-Neurological-Adult.htm) under section 11.02.  There are listings for each condition and if you meet the criteria, you will be approved.  If you don’t exactly meet a listing nut are close, the disability examiner may determine you equal a listing.  Some of fellow redditors are disability examiners or SSA employees, so they can speak more authoritatively than me

You can start filling out your application online and you can sign a release so the SSA can obtain your records.  I’d suggest getting copies of your records for yourself so you know what they are using and as you receive more treatment, forward the new records to your disability examiner.",,,1,0,0,
f9f54438-f5c9-44db-bfb1-2937dd5d89a7,1516911507,"It depends on what type of benefits you are applying for.  Social Security Disability, which you qualify for by earning credits through work, has no income or asset limits.  SSI, which is a program for those who have never worked or have not earned the required number of credits, does have income and asset restrictions.  The same is true for Medicaid.",,,1,0,0,
f9f54438-f5c9-44db-bfb1-2937dd5d89a7,1515782744,"Man I feel you.  My first job out of college was for $27000 a year.  My wife, who was drawing SSI for bipolar disorder, was pregnant.  Called SS and reported my income and they said they’d make a determination.  We didn’t cash any more of her checks and 6 months later, SS wanted the money back.  I returned the uncashed  checks.  It’s almost harder to be right above the poverty line than right below.  You have bills and no help with medical or housing costs.",,,7,0,0,
