commentator_id,created_utc,anonymized_body,ups,downs,score,controversiality,gilded,distinguished
3e2013ba-335a-42bb-bacc-4a6e31c5ed95,1516234042,"So, looking at this from an examiner's perspective, I encourage you to prove the following:

Enlarged heart, congestive heart failure and A-fib: explain how his signs and symptoms preclude him from even sedentary work on a full time basis. Swelling, palpitations, shortness of breath, dizziness, actual fainting.

Scaitic nerve: this is really tough on which to get disability, unless the doctor reports show decreased strength, sensation and reflexes.

Diabetic type 2: unless his kidneys, vision, or sensation are affected, this won't really be considered. 

Seizures that only occur when he's sleeping: this doesn't affect work.

Weakness in legs that's caused from all the meds to treat issues: how much weakness, does he need a cane or crutches? If not, then he can do sedentary work. 

So, just consider these issues when you fill out the forms they send you.
",,,1,0,0,
3e2013ba-335a-42bb-bacc-4a6e31c5ed95,1514991358,"Your checks should not stop because your case is up for review, so something is wrong there, make sure SSA has your correct address and/or bank account information ASAP.

ALL cases come up for review, even autism cases. If you recently turned 18, and you were approved as a teenager, then this is an Age 18 Redetermination case. All cases are reviewed at age 18, since now they have to see if you fit the adult criteria rather than the child criteria, and they can be different.

We do not expect people to see doctors for autism, so don't worry about that part. If you have any sort of case management services or an agency which helps you with work, financial management, daily living skills or appointments, list those. If you don't, that is ok too, but be sure to list a family member who knows your limitations well. Return every form and questionnaire sent to you, and go to an exam if they set one up for you, otherwise you can lose your benefits for failure to comply.

Hope this helps, feel free to ask more questions if you need to! But call the field office right away and find out why you didn't get your check- unless your benefits were ceased, they shouldn't stop unless the review is complete and they decide you are no longer disabled.",,,7,0,0,
3e2013ba-335a-42bb-bacc-4a6e31c5ed95,1515945565,"The three years starts from when they decided you are disabled, not from when they decided you BECAME disabled. So, 3 years from December 2017, not August 2016. However, they can do a review whenever the heck they want, the disability determination office recommends anywhere between 1 and 7 years, but the SSA can review early if you are working a lot, or ignore your review for years past the recommended date. As far as your son getting benefits, it depends on his conditions, his age, his past work, whether he lived with you and what your resources are, etc.",,,2,0,0,
3e2013ba-335a-42bb-bacc-4a6e31c5ed95,1514994265,"I'm glad you got to the bottom of it! I have people tell me all the time ""I told SSA my new address"" and yet, I got nothing. Good luck with your review!",,,2,0,0,
3e2013ba-335a-42bb-bacc-4a6e31c5ed95,1514991757,"If we are talking social security benefits, you will not lose your benefits because you are afraid to try something like ECT. As long as we see you are still going to appointments, getting med adjustments or trying different meds, etc., that is enough. A red flag for me is when every single treatment the doctors (multiple doctors) recommend gets refused due to some reason or other, like the person read about weight gain and wouldn't try this med, or said a friend had a reaction so they wouldn't try that med, the doctor suggests therapy over and over and the person refuses, etc.",,,5,0,0,
3e2013ba-335a-42bb-bacc-4a6e31c5ed95,1516761562,"Attorneys can and do argue that an individual meets a listing. A judge can decide whether they do or don't, and many listings are subjective (what are mild, moderate, marked, or extreme limitations?), they can also decide that even though they don't meet a listing, they can't perform past work or adjust to other work, based on MANY factors. It's not just about meeting listings. ",,,1,0,0,
3e2013ba-335a-42bb-bacc-4a6e31c5ed95,1517103853,"Denial letters never say ""you are absolutely disabled but you're too young"". They simply do not. The letter may have said, ""While you do have severe symptoms and some limitations due to your conditions, based on your age and education level, we have determined that you are not disabled"". This is not age discrimination, it's the medical vocational rules. Someone age 25 is expected to be able to learn new job skills, where someone over 55 will have a tougher time. It's not discrimination, it's the law.",,,2,0,0,
3e2013ba-335a-42bb-bacc-4a6e31c5ed95,1517116559,"And you told them each visit that the treatment wasn't working? If so, what did they say? I'm married to and related to many health care providers, who would never let that go without either advice or a treatment change. ",,,3,0,0,
3e2013ba-335a-42bb-bacc-4a6e31c5ed95,1516233347,"List it, especially if it's legal in your state. Your claim is evaluated by someone in your state, not the feds, so you're fine. Honestly, medical marijuana hasn't even been set up in my state yet (although it is legal), and I don't even consider it a red flag in any way. Just be honest, they're going to find it in the records anyway. ",,,7,0,0,
3e2013ba-335a-42bb-bacc-4a6e31c5ed95,1516548777,"Can't wait for the Monday morning meeting to find out what we can and can't work on, or if I'll even be able to hold my hearings until it's resolved. Last time, federal quality review shut down.",,,2,0,0,
3e2013ba-335a-42bb-bacc-4a6e31c5ed95,1517103423,"We never look for reasons to deny. They are likely trying to get more vision records and depression treatment because they don't have enough on those conditions, and they say  PT records because PTs tend to have great range of motion and strength exams, so you might avoid going to a physical exam if you have gone to PT. The correct way to answer is the truth. I will say that it looks much better for your case if you're actively seeking treatment for depression by getting med changes and therapy, rather than just trying a handful of meds then giving up. Also, PT often takes months to work, not just a few sessions. If you have worse pain with PT, you tell your provider and they, first, write it in your chart, and second, either explain that it's normal and you have to work through it, or, give you different treatment. Either way, don't try something once and then give up if you don't get immediate relief.",,,3,0,0,
3e2013ba-335a-42bb-bacc-4a6e31c5ed95,1516671375,The only think we cannot do at DDS level is anything related to CDRs.,,,1,0,0,
ccb3fb93-e321-4429-91b8-3bd113b37f9c,1515430730,"This is belated (I was camping), but I just re-read your comments and noticed your specific goal is London from Atlanta. My approach with cross-Atlantic (honed at a time when the onboard restrooms were less available, so perhaps less necessary now...) is to avoid a direct flight and instead scan many flights to find one with the farthest north east layover. New York and Iceland are common layovers. Iceland in particular is one of the best at dividing the length of the flight legs. This approach generally creates a much, much longer total flight time. Instead of, say, a 13 hour direct flight, I’ll pick two 7 hour flights with a 4 hour layover. Unlike most travelers, I try to get a *long* layover time—3-4 hours is my time preferred. This length of time is enough for me to hydrate a bit at the end of my first flight, pee that all out, then restart my dehydration. Tools like Kayak.com have extensive search filters that allow one to search for specific layover locations and layover lengths. Huge help! I guess this might sound onerous, but I find it more relaxed actually than worrying how I’ll fare on a 13 hour flight.",,,1,0,0,
ccb3fb93-e321-4429-91b8-3bd113b37f9c,1516556267,"Also (commenting in addition to my previous comment), is moving to a more convenient location possible? For instance, is there a school you could attend closer to a good city? You could relocate using school funds, and then you’ll be in a much better location to seek jobs that don’t need a car ",,,3,0,0,
ccb3fb93-e321-4429-91b8-3bd113b37f9c,1515034556,"I agree with everyone else in this thread—just be direct, upfront. It’s not a big deal. This is the case with a sadly high percentage of apartments. Dude has probably encountered this tons. It’s just how things are. It’s only a big deal in your head (I mean, for obvious friendly reasons that you wish he could come over), and the best thing for your friendship is probably to not let it grow too much bigger in your head. That’s awkward, ya know?? And it’s not like it’s going to fix that staircase.

Just chat about it. Maybe he can climb those stairs, maybe he has some buff friends, maybe you have buff friends, or maybe he can’t come but you guys could hang elsewhere. C’est la vie. ",,,12,0,0,
ccb3fb93-e321-4429-91b8-3bd113b37f9c,1516556095,"Coding sure sounds like a good option for you...perhaps web development could stoke your art interests while also utilizing your computer skills?

In general, it sounds like you’re in a situation where you need to develop more advanced skills in *something*. Where I’m from, a high school degree will qualify you only for the most basic of jobs, and it’s the lowest jobs that are ironically harder IMO for physically disabled people to work at. More advanced jobs require less physical minutiae. Has the college angle really been ruled out? Is there perhaps another college that might work?? Pursuing that more aggressively would be my suggestion.

Coding may not be your ideal, but it is practical since it is a skill in high demand. Art...not so much.",,,1,0,0,
ccb3fb93-e321-4429-91b8-3bd113b37f9c,1515631188,"Yeah...like I said. The strategy lengthens travel time, but reduces flight leg time. Works for me, but hey if you can make it through the longer flight leg time go for it!",,,1,0,0,
65eb3d01-3c5f-4f46-bbd9-7f98ef92e763,1515422639,"You say there are no other openings in your department, but what about other departments?

Zebrastampede is correct that the on-call rotation is considered an integral part of the job (which explains HR's language/statements) and removing you causes an undue burden on them. Not to mention the impact is has on the other workers who have to work extra on-call to cover your portion. 

FMLA is always an option, but I'm not sure how much that will help if the issue is the long hours and some interpersonal issues with management. Even if you took a few months off the issues would be there when you returned.

 If the issue was getting acclimated to the new position/hours - has that gotten any better in the 4-5 months that you'd had the modified schedule? In the grand scheme of schedule related accommodations, they have been pretty generous with giving you this much time to adjust. 

If I were you I would start looking for other employment, something with better hours. You mention that your job history is spotty, but you'd be better off being proactive and finding something now rather than you ultimately being fired. Your employer has a wide latitude to determine what is a 'reasonable' accommodation and what constitutes an 'undue burden'. ",,,3,0,0,
65eb3d01-3c5f-4f46-bbd9-7f98ef92e763,1516904776,Most banks don't charge checking account fees if you have direct deposit. Even the BOA ones that everyone has been complaining about the last few days waive the fee as long as you have a DD of $250/mo. ,,,2,0,0,
65eb3d01-3c5f-4f46-bbd9-7f98ef92e763,1515089966,"Honestly, after about 10 years, the chances of your benefits being ceased (barring a significant improvement or you go back to work) is very small. 

You working a job for a month won't matter, if anything it just shows that you weren't successful at working. ",,,4,0,0,
65eb3d01-3c5f-4f46-bbd9-7f98ef92e763,1516711722,"So aside from currently working for SSA, I also used to be an organizational rep payee (my company offered payee services).

The big issue with being a rep payee is being able to provide documentation to SSA where your money is going. Now, will SSA do a complete audit? Not unless there is a question/complaint about your mom. She is going to have to fill out an annual Rep Payee Form that just asks how much money was spent in specific categories (food, housing, medical, etc). 

Your mom is responsible for making sure that you are fed, clothed, housed, and medicated (well access to medical care). As long as she is taking care of those things, the money she gives you for spending doesn't need to be accounted for. If you wanted to spend all your spending money on lotto tickets and candy - that is your decision to make.  

When I was a payee I had my clients keep all their receipts for their spending money - but that was for cash and so wasn't auditable. If you are using your debit card for your spending money, the statements would be sufficient. 

Your mom being an accountant explains a lot. Frankly, the way you guys have it set up (payee accounts and your account) is a really smart system. And you already keep track of your expenses; probably more than you need to. 

Is her being your payee a new thing? It can be stressful for payees at first, because it is a legal responsibility for which they don't give you much direction. Conflicts between beneficiary and family rep-payees are very common. At its core it is a bit of a power struggle.

That your mom is willing to go to family therapy is a good thing, its showing she is willing to work through the issues. From your post, it sounds like she doesn't have an issue with *how* you're spending your money, just on *documenting* the spending. That is an easier conflict to resolve. Some family payees will take a person's entire check and not give them any money. 

",,,3,0,0,
65eb3d01-3c5f-4f46-bbd9-7f98ef92e763,1516712229,"You actually have a decent chance of getting benefits if the CP affects both legs. That you were on benefits when you were younger suggests to me that your condition is more severe than you are presenting. 

There are 2 ways that you can be granted benefits - your condition is severe enough to meet a blue book listing (conditions so severe that no age, education, work is taken into consideration) or be assessed to not be able to work even a sedentary job. 

The medical listing for CP is [here](https://www.ssa.gov/disability/professionals/bluebook/11.00-Neurological-Adult.htm#11_07) which you'd be evaluated under 11.07. Even if they don't determine your mobility issues to be severe, working even a sedentary job with those kinds of issues (especially with your back starting to go out) would be difficult. 

What it may come down to is what your currently do for work. What kind of job do you have? Do you have any reasonable accommodations? If you're doing a job where you're on your feet all day without RAs, then likely they will assess you could do work that is easier, but that you can still work. If you're working a desk job and failing at that, it is a stronger argument for disability.  ",,,3,0,0,
65eb3d01-3c5f-4f46-bbd9-7f98ef92e763,1516718050,"are you on SSI or SSDI? 

Since SSI has the asset restrictions, it does lend itself to needing more documentation and tracking. Because the combination of your 3 accounts would need to be under the asset limit at the end of the month. SSI also has the higher propensity for fraud - hiding assets, misrepresenting living situations, not reporting income, etc. 

SSDI is so much more lax. Since your assets don't matter, they will really only investigate if there is a complaint or work involved (a work investigation would actually involve both of you). 

If your goal is to eventually be your own payee, one thing you need to do is prove your fiscal responsibility with the money that you are given. If, down the road, you apply to be your own payee they will ask your mom for her opinion. Now, I'm not saying do whatever your mom says, but some compromise now might help in the long term. If I were you I might try to offer a sliding scale of documentation compromise. Like if you do what she asks for 2 months and don't mess it up, that she will slowly require less and less. Again, I think what you guys are doing is overkill - but working in government I can tell you that overkill of documentation is never a bad thing. ",,,2,0,0,
da0b8b33-b644-4000-9af4-39aa8c3a79b2,1516420061,This sounds like a short term disability benefit provided by her employer/insurance company. She'd need to reach out to those places for further info. ,,,3,0,0,
da0b8b33-b644-4000-9af4-39aa8c3a79b2,1516443478,"Right? And I know they don't shut the payment part of SS down, but I have no idea if they shut the other parts down. ",,,2,0,0,
da0b8b33-b644-4000-9af4-39aa8c3a79b2,1516445152,Thanks. If I am I hope my lawyer is on board and we can just move right into it. I have every indication that my hearing went well so I'm afraid the longer this takes the higher my hopes will get. I just wish I could put it out of my head but that's kinda asking a lot with anxiety and obsessive tendencies.,,,1,0,0,
da0b8b33-b644-4000-9af4-39aa8c3a79b2,1516877783,Dude is straight up delusional.,,,8,0,0,
da0b8b33-b644-4000-9af4-39aa8c3a79b2,1517048914,"You can fill out the application and gather her records yourself at fisrt. Then if she is denied you can do her first appeal. If she's denied again now it's time to get the lawyer. You 100% do not want to go to a hearing without representation, that would be stupid. Lawyers are only paid if she wins with a percentage of her backpay.",,,3,0,0,
da0b8b33-b644-4000-9af4-39aa8c3a79b2,1516581714,"Yeah, people shouldn't discriminate but it happens. I'm really sorry you're in this situation and I hope you can find an easier job soon. ",,,2,0,0,
da0b8b33-b644-4000-9af4-39aa8c3a79b2,1517181007,"If you're not accepted right away (only about 35% of people are) it will be months into years. The first application takes some time, let's say 90 days. The appeal does as well, let's say another 90. Then it's a 12-14 month wait for the next appeal which is a hearing with an Administrative Law Judge. This is where most people get approved (47%) but then you need to wait 90 days for the answer to that.

This is where I'm at now, wating for the answer from my hearing. I originally applied October 2015.",,,1,0,0,
da0b8b33-b644-4000-9af4-39aa8c3a79b2,1517137576,"I've never heard of a situation like yours before. If I were you I'd take the unemployment and resign with your lawyer when it expires. You won't need a lawyer for the first application and appeal, only for the hearing.

Now, here's the tricky part. When you file for unemployment you are stating that you are able and willing to work. When you file disability you are doing the opposite. I personally did take unemployment myself at the advice of someone at my attorney's office. I don't know if it will bite me in the butt because I just had my hearing this month and don't have my decision, but my lawyer tells me that it's not a big deal, I just won't be paid disability for that timeframe.

So in the end you have to do what you need to do to get by. Unless you're approved right away because you meet a listing this is going to be a long process for you.
",,,2,0,0,
da0b8b33-b644-4000-9af4-39aa8c3a79b2,1515390948,"Hey OP, a lot of what you said resonates with me. I also have BPD (as well as PTSD, MDD, BED, GAD). I'm about to go to my hearing in a few days. I'm really struggling with the idea that my conditions will be called into question and I won't be validated. They'll have a vocational expert there explicitly to tell the judge how many jobs I can work. I don't know how I'm going to remember the important points I want to convey or how I'm actually going to be able to control myself when I'm very literally being judged. A couple months ago I couldn't wait for my hearing and now I'm just so scared that I don't know what to do.",,,1,0,0,
da0b8b33-b644-4000-9af4-39aa8c3a79b2,1517181157,They should look great under a pantsuit! ,,,1,0,0,
da0b8b33-b644-4000-9af4-39aa8c3a79b2,1516536218,"I'm not actually on disability, I'm in the process so I may be wrong about some info but there are no caseworkers or any special things directly from the SS department. Some people have caseworkers and people who are designated payees if the disabled can't manage their money but I think those are from outside agencies.

Basically it's up to family to make sure the disabled is taken care of. Is your mom paying a standard rent? You could have her get on section 8 housing which won't take more than 30% of her income. Is she on food stamps? Can her doctors perscribe her a brand of medication that is covered by her medicare? If she has a perscription not covered she can go through GoodRX and see if it's cheaper.

Calling 211 in her area might help her find some other resources to help.",,,2,0,0,
da0b8b33-b644-4000-9af4-39aa8c3a79b2,1515724477,For disability benefits. I was rejected when I applied so now I have to go in front of a judge to state my case.,,,1,0,0,
da0b8b33-b644-4000-9af4-39aa8c3a79b2,1516941255,Please wait for the decision to come. I just had my hearing as well so I'm in a similar position to you. The sad fact is though that the nationwide approval rate at hearing level is only 47%. I have never heard of another lawyer being so sure that they've won before.,,,3,0,0,
da0b8b33-b644-4000-9af4-39aa8c3a79b2,1516535140,"OP, I'm concerned that a couple of these posters have implied that you can get disability based on your conditions. Disability is awarded if you can't perform *any* job so the idea that you could work a desk job (even though you can't find one to hire you) would prevent you from qualifying. I'm not sure if you were going to apply, but I did want to caution you.",,,3,0,0,
da0b8b33-b644-4000-9af4-39aa8c3a79b2,1515367611,"I'm glad you got approved, thanks for the response.",,,1,0,0,
da0b8b33-b644-4000-9af4-39aa8c3a79b2,1516494693,"I'm not sure then. I was on a state based disability, but it was meant to be more like SSI (permanent disability) and was only available to me because I had an open case for federal disability. My state disability was only for a period of 12 months and I cannot reapply for 5 years.",,,1,0,0,
da0b8b33-b644-4000-9af4-39aa8c3a79b2,1517137980,Make the switch to wearing women's pants suits. You'll get to wear a far wider range of shoes with them. Some mens dress shoes could even look nice.,,,2,0,0,
da0b8b33-b644-4000-9af4-39aa8c3a79b2,1516347171,"Omg, it's killing me already. I'm like 54 or so days left...",,,1,0,0,
da0b8b33-b644-4000-9af4-39aa8c3a79b2,1516347316,"Oh, and that's if it is closer to 60 days too. If you read r/disability most decisions are taking 90 days now and my lawyer told me not to stress too much if I haven't gotten a response on day 60. So if I cut the difference then maybe I'll hear back in April. FML.",,,1,0,0,
da0b8b33-b644-4000-9af4-39aa8c3a79b2,1516348388,So that might be your states version of disability. My state had a version which was something like $350/month for 12 months and will be paid back if I win my claim. Maybe just clarify what your program is.,,,2,0,0,
da0b8b33-b644-4000-9af4-39aa8c3a79b2,1516687605,"Thought I'd post back here if anyone else had the same question, my lawyer contacted me letting know the hearing and decision process of SS will continue in event of a shutdown.",,,2,0,0,
da0b8b33-b644-4000-9af4-39aa8c3a79b2,1516687810,Congrats OP! I just had my hearing this month so I'm thinking April for my decision. My lawyer argued that I met a listing but warned me that she's never seen my judge decide based on a listing so I really have no idea if I'll get it or not.,,,2,0,0,
da0b8b33-b644-4000-9af4-39aa8c3a79b2,1516688636,"I'm sure there are some people on disability who don't belong, but it's really not an easy thing to get. I try and tell myself I can never know what someone else is truly struggling with.",,,3,0,0,
da0b8b33-b644-4000-9af4-39aa8c3a79b2,1516690185,"I just read your first post. Have you found a new mental health clinic? I've read here and been told by my lawyer that continuing treatment was *very* important to my case. I just had my hearing this month and the judge asked about my therapy, my medications, how I handled panic attacks, what progress I've made and what accommodations my last employer gave me among other questions.

Please don't take this wrong, but I don't think any judge, no matter how progressive, wants to hear that you're only medicating with weed. If you're already in therapy and on meds, great! If not I STRONGLY encourage you to get right on that so you can show the judge you're attempting to find solutions to your issues. 

Without a clear diagnosis for your stomach condition my guess is the judge will need to decide a lot of your case on your mental conditions.",,,2,0,0,
da0b8b33-b644-4000-9af4-39aa8c3a79b2,1516691552,"Btw, your new symptoms of rage and loss of patience are both common sympotoms in depression and PTSD for which you have been diagnosed. Paranoia is also a symptom of PTSD.  

Edit to add: you *are* medicating with weed and that also causes paranoia :/",,,2,0,0,
