commentator_id,created_utc,anonymized_body,ups,downs,score,controversiality,gilded,distinguished
836e24a8-f1c6-4972-a527-a4b8465abd41,1516178513,"Where are you? You may qualify for a home visit (yes, there are still doctors who do this, &amp; OHIP covers it. My Mom was refusing to go to a doctor so I found one to come to her, which ironically was enough to get her to go to see her own doctor) ",,,2,0,0,
c14f29b9-a9d5-4c6e-93d0-5e3d1bb07340,1516527562,"I mean, even disregarding the article content and relying on pretty much any accurate source, it's clear that the Republicans in power want to do everything they can to reduce, or ideally for them, eliminate, programs that literally keep disabled people alive, myself included.

I'm not sure how you can conclude that threatening programs that keep people alive is not a threat to those people's lives. And as such I cannot comprehend an informed, well intentioned disabled person supporting the goals of the current GOP. ",,,11,0,0,
db77a2c7-8dce-47b8-995a-fa3ee9dd3c60,1517301614,"I’m not annoyed about the handout itself. I know people who could really do with reading this. The fact that she should know me and said that it was a gift, unaware that I would take it seriously for a minute",,,2,0,0,
4d279958-f0d6-46e1-855c-c3523c583540,1516975078,"I live near one of those ""ministries"" that does fucked up shit like that.",,,1,0,0,
8845fd1c-b461-42d9-b492-b91e83ab171a,1515177718,"
It's going to be an elevator one way or the other.  
I pretty much figured the cost would run me in the 10-15k range and that's ok with me and I suppose I would have to put a cap on it at $20k.  I obviously want to get the lowest price but I don't want to get low quality so I have to find the balance there.

I can't move, this the house my folks built and it's FULL of their things and so many memories, I can't and won't leave here.  The way the house was designed it's not possible to live downstairs.  

For now I struggle to get up and down the stairs and if I have to I'll go up the stairs on my butt.  Getting down is far less a problem, for now.  

If I can only find a reputable company that will come put one in.",,,1,0,0,
7406ba91-3814-4ec3-9c04-50426c814aef,1515262274,"Seal skinz were recommended in a video on here, I love mine! They’re waterproof and thick but have little rubber bits for grip. They’re also really thick but you maintain decent dexterity. Think kinda like a truly waterproof wetsuit material. ",,,1,0,0,
c163c16f-6936-4fa2-8673-795dc016837b,1515461534,"It depends. If you can go to school full time, why can’t you work full time. You need to talk to SSA and get anything they say in writing before you attempt to go back to school. ",,,3,0,0,
905dccfd-447a-46d8-bf52-ab94f5e26a6d,1515464275,"Going to school is not seen the same as working by the SSA.

I got SSI the entire time I was a full time student, all through undergrad and law school. I have known many people in my same position and none of us have had problems receiving benefits while in school full time.

However, I'm not an SSI attorney, so I can't tell you definitively one way or the other. Checking with the SSA can't hurt and will give you peace of mind. ",,,3,0,0,
c6ec9547-7140-47ac-b73f-573c07b81b58,1515461313,My Pell Grants pay for my schooling I just want to make sure they won’t cut me off because I decide to go back to school. ,,,2,0,0,
6d1bd434-439e-4115-a3d2-b7431fffd7b5,1517177386,"The first one is great! The second might work better, in my opinion, if we saw more examples of people saying this person is “brave” or “inspiring” before they snap. That’s probably break your format, so maybe changing the disabled person’s reaction to one of annoyance or confusion would work?",,,1,0,0,
b345f385-c462-4693-a61b-5cc382484176,1517186421,With the amount of pain I don't think I can continue to work full time. I'm wondering what my options are before I quit because my quality of life is suffering. ,,,1,0,0,
161fdcbc-7d95-4c10-a63b-a3eba3896a2f,1515720555,$600 a month and your paralyzed!!? That's it!!!!!? This world is messed up someone obvious paralyzed should be receiving $1500-$3000 a month ,,,1,0,0,
ee62f3e4-00cb-449c-a287-56b33015ec48,1515553577,"A warning when you do this.  You will have to pay taxes on the amount discharged for that calendar year.

This can mean a pretty large amount must be paid when you file your 2018 taxes.  If you do not file they will begin garnishing your disability check.

One way to get around this is to claim insolvency if you qualify.  Calculate your debt including student loans then minus your assets to determine if you are insolvent for some or all the amount.

An example:
Person A discharged 50k in student loans in 2018.  He then received a tax form for the 50k discharged loans in January 2019.  He must then file his taxes with the 50k counting as income for 2018.  If that was his only income then he would have to pay $9,057 to the IRS.  If he fails to pay or file his taxes the IRS will begin to garnish his disability payments until it is paid plus interest and fees.

Person A decides to claim insolvency.  They add all there debt including the $50k student loans as well as $5k in credit cards for a total of $55k in total debt.  They then add there assets.  Lets assume this is $10k in the bank and car worth $5k.

55k - 15k means Person A is insolvent by 40k.  This means instead of paying taxes on 50k they only pay taxes on 15k.

I am not a tax expert though so if you are uncomfortable doing your own research into it than consider hiring a tax expert.",,,1,0,0,
b7b5eca3-6987-48b7-a131-1c239745e4b8,1515032180,"Honestly, just have an upfront and honest conversation with him about it. Let him know what your intentions are and then you two can work together to figure out a solution to the problem. I am in a wheelchair myself, and I've come across this exact situation on several occasions. It probably isn't the first time he's had to deal with accessibility issues and it won't be the last, and so he would know better how to adapt to his challenges than someone else.",,,4,0,0,
4e105c4a-44ca-4b2a-9722-3b92145849b2,1517037018,No. I was destitute and at the time was eating less than a meal a day to try and stretch resources.  I was severely depressed and under enough mental stress at that point that even applying (and them being denied) was nearly too much for me to deal with. ,,,1,0,0,
815e1c0b-cfd8-40cc-a943-ba187fec8ee7,1517088011,"Surveys are required to be in a self-post which must include information about the survey, the surveyor, the data being collected, and how the data will used.",,,1,0,0,moderator
8741039a-2dab-49ab-8987-b989a020f5d8,1516996513,"You told him yesterday about your niece, and between yesterday and today, he's stopped talking to you as frequently as he did?

It seems to be a little early to come to a decision about your boyfriend's motivations. ",,,2,0,0,
ad2c738b-ebad-4496-be48-00d9eeffcf1b,1515625601,"Sounds great and I am happy for you. Are you impressed with education in Denmark as a whole?  

I am not familiar with your speech program, I looked it up quickly and it seems like it is icon based, so you assemble sentences word by word.  Do you find this easier and faster than typing words on a keyboard?  When you wrote this posting did you use icons to assemble it or type letters.  Just curious.

Thanks for posting the apps that help you be successful. I want to learn more about using Apple Notes. I was looking for an app that scans worksheets so they can be filled in by typing instead of writing with a pencil.  I was looking at SnapType but if Apple Notes can do it that is easier.  ",,,1,0,0,
03753759-df87-4430-a526-7efff4f07b1c,1515361578,Anyone with a challenge that they face in life,,,1,0,0,
42d76d95-4e40-432e-9cf8-e926303054c0,1515700056,"And other thing, create your personal account on SSA.gov - there is information on payment dates, payment amounts and all kinds of information that is helpful for people who get SSDI.",,,1,0,0,
7b755d24-6e0d-4d25-9b76-4ffa9ea1f166,1515104233,"Would chip be my secondary insurance then? Whatever my primary insurance doesn't cover send to the secondary? 
",,,3,0,0,
027a1edc-29da-4b66-aaf2-22f18a400f4e,1515382466,"*Disclaimer: results not typical; your experience with amputation may vary*

Because of what I was going through beforehand, losing the leg was easy. There was a reflex-nerve component to the pain (according to one doc anyway), which meant that there was a chance amputating the leg wouldn't have stopped the pain, and that woulda been pretty catastrophically horrible, so it was a very difficult call. When I woke up *without* pain, it's hard to describe how great that feeling was. Then, I mean, then the morphine wore off and there was some generic ""they just chopped your leg off"" ouchiness, but whatever, I was over the moon. 

Support was great. I live by myself on the opposite end of the country, and my folks took turns flying out to help. There was some uneasiness about the decision (because let's face it, there ought to be), but when for instance my mother saw the ""before"" and ""after,"" that pretty much settled any doubts. Also helped everyone appreciate what the ""before"" really was, which was I guess some level of validation for me, and that was probably nice.

If I had to summarize the emotional impact.... I mean I really haven't stopped feeling great ever since. Shit happens and all, I've had rough days/weeks/months, but it's hard to think of anything as a particularly big deal. Probably part of that is being surrounded by great people, but also, I think there's some perspective that comes from going through big challenges.... At the same time I definitely *didn't* have that perspective when I was actually hurting, so I dunno. Sample size of one, going through a big challenge and coming out the other side makes you feel awesome. ",,,4,0,0,
20597516-88bf-4e6d-acf2-ec6fe693da48,1515626646,"Hey there. :) I'm also short in stature, about 4'9"" and I'm 28. I have spinal muscular atrophy and I use a wheelchair full time. ",,,1,0,0,
52f3ad06-2427-4553-9030-a1986b25bf41,1515223941,"Yeah we need to figure out a comeback to the pity faces/comments. I want to say some thing about how being disabled is not being less than, but yeah the coming up with it in the moment doesn't happen for me. ",,,3,0,0,
59a23ded-70d5-40ae-84fe-7097ebf6df8a,1516849606,If you are able to work in the first you will likely be denied. ,,,2,0,0,
c5e64409-7272-4539-8c7a-692a90f16dbc,1514844381,"Yes, but where I come from it's a term loaded with stigma and rarely used so I was surprised to see it. Was hoping to get some info on how/why people might feel comfortable with it or see it as an empowering term.

different terms for disability largely rely on cultural choice so  I just wanted some insight into that",,,10,0,0,
6d03a6f3-ca94-4bf2-b850-a92e3f5a8d1e,1517104523,I'm sorry to hear you've been going through those things. Thanks for sharing your story and gratitude with us.,,,7,0,0,
37e36f6a-2b8c-40aa-b5bf-4a49e274ad5b,1515866800,Katie LeClerc? She’s hard of hearing.,,,1,0,0,
2581662f-fc04-455f-9b7a-b7314fcd746e,1517140302,"I was actually thinking to say this. I work with a wide range of disabilities, and have noticed that those for whom it is obvious (because of a mobility aid or such) do tend to get more accommodation than those whose disabilities are more invisible. Making it more apparent may seem counterintuitive, but may help?

Hope you find a route that helps. ",,,3,0,0,
49e3a8d9-ec71-460a-86fd-9b04a0b5e065,1517187099,"When mine started affecting my work, I was lucky to have a toilet right by my classroom, and a boss and lab assistant willing to step in for a few when I needed a break. I now wear adult diapers, because of my issues with movement and getting to the bathroom ontime. Just like any other disability, the employer should be required to make legal accommodations. If its an office job, ask for a spot near the restrooms, and keep an extra set of clothes and underwear. My best friend keeps extra diapers in her car for me when we go out. My fecal incontinence can usually be contained by them until I get to a restroom to change. Just because our bowels don't work doesn't mean our minds can't! Best of luck!",,,9,0,0,
845f2887-1f47-4546-9ea9-0161d0e94488,1517283674,"Ugh, that's still pretty irksome, were I in your place.  Now I wonder if she does this to every class at that term.  Regardless of that, if she's known you for that long, she should've had the foresight to re-think her gag gift.",,,3,0,0,
b6a13fef-aaa1-46ab-929f-f298a524c120,1516511291,"Amen.

Look, I'm no trump fan, but as a disabled person I'm also not just another voting block for one party or the other. Disabled as I may be, I'm still a thinking, rational adult who tries to look at the issues independently. 

Articles like this don't help.",,,6,0,0,
fa34223a-edca-433a-a46e-d1209e79d75a,1516968410,"Hey guys! I thought I'd give you the update: I invited him over last week, and let him know beforehand that there were stairs and how many to anticipate etc., turns out he can do stairs they're just difficult for him, so he was able to come visit and I just gave him a hand with the chair. I'm glad he was able to come see me, but I think next time I'll go visit him because the stairs were tiring for him. But now if I ever have an event I certainly wont hesitate to invite him! Thank you all for the advice, it really helped me feel more confident about having this conversation, and I'm glad I did :)",,,3,0,0,
6be7e826-bf78-44c3-9011-d80b6993cca7,1517382463,"Yeah but that’s not what you said, is it?",,,5,0,0,
cf345023-1504-4662-9658-c7ae58d18bdd,1515939709,"Yes.

But can you share a type of invisible disease which negatively affects ambulation but only requires a temporary handicapped placard? And perhaps why the wealthy in my area are the ones predominantly suffering from it?",,,2,0,0,
7236ea78-0e18-4b5d-8855-059eb7401d4f,1515769599,"I have a disability chair, footrest, wrist supports at my desk. I am not expected to do the same level of Ealing of lifting as everyone else, and while I work in events and lead on some, I am not disabikity to be involved in packing down as other leads are. In some cases where I need to travel, I may be able to put a case forward to get a taxi rather than being the train etc that the company would pay for. This is usually reserved for managers. 

I am also able to work from home 2 days a week. The days of my treatment (IV med that takes all day) I don't have to book, I have those off no questions asked. When I dislocated my knees, there was no problem for me to work from home for a week and a half to avoid walking on it. After any event I run I have the next day working from home /off, to recover. I tend to overwork and then regret, but my manager is happy with my work level that means he is flexible to how I need to cope.",,,3,0,0,
1d0da643-80d7-4f66-aa5b-2298ff0c0fe9,1516547480,"The bill that you threw the summary up for has some interesting text that you may not have read. Basically, it allows companies to just say ""yeah we are working on providing accommodations"" without any standard that requires them to make progress. It removes your ability to take it to court to force them to actually begin the work of making those accommodations though. I would recommend you read the actual text of the bill, there is good reason it has no support. ",,,10,0,0,
eb55c37b-3720-406c-b163-af6904eb9659,1517335253,"I always disclose on that paperwork, as it is used by the federal government (EEOC) to ensure that persons with disabilities are at least included in the hiring process. Even if you have recovered from your disability you are still entitled to check yes.

I may or may not disclose in an interview, particularly on the telephone, If I am seeking an in-person interview.

Most employers do not discuss disabilities openly for anything other than direct job-related activities (technically any other sort of questions are illegal, just like questions about race, ethnicity, religion, gender expression preference, sexual preferences, and so on)

If you feel that it is necessary to talk about your specific issues in the interest of full disclosure, then by all means, do so.

Remember that an employer is not obligated to hire you for any reason, and they may always find other reasons to choose another candidate over you. The best way to avoid this is to be overqualified by your job by a good margin.",,,1,0,0,
8845fd1c-b461-42d9-b492-b91e83ab171a,1515177085,"That's not going to happen.  I'm staying here, period.  
",,,1,0,0,
108324f5-ae26-46ff-9c68-b4f273c7a98c,1517416505,"Thanks, knowing that I’m not the only one helps. I think it was the fact that the post in question was my first ever post in a place where I thought I would be believed was what made it sting",,,3,0,0,
9ebbc38d-31df-41b5-b2e7-69a3a1a9227a,1515812707,"If I had a dollar for every article about this issue, I'd be able to bankroll the production of a blockbuster film about it. 

How much longer do we have to wait for anything to actually change? 'Awareness' isn't helping. They know we exist! That's why they tell (and profit from) stories about us! 

What's the next step? What can we actually do to fix this? It's not like they suffer any consequences for doing this, so why would they change?",,,13,0,0,
ab79de79-0229-458c-a4d5-5c0a08df738a,1517266096,"Specifically the dept of vocational rehabilitation. If he has employment goals, then they may cover your out of pocket. 

Another alternative is to look to craigslist or eBay for a similar chair that is not new, but will do the trick.",,,1,0,0,
fef14778-5548-4115-ae5f-6f393dacdc46,1517253973,"What state are you in? Not making any promises but I will get you a list of places that may be able to help with funding. 

Is your BF currently enrolled in schooling of any kind or is he currently in the market for a job? Some state agencies offer more help to folks who are in school or working or actively job searching. ",,,2,0,0,
7a8adfe0-b3bb-42b1-8e1d-493cd5ecfe68,1517089019,"It's counterintuitive because unfortunately our typical understanding of biology and nutrition gives us the assumption that people gain weight by eating more and exercising less, and that these two factors are the only things that impact body health. We, as a society in general, are ignorant of the complex factors that go into body health, and unfortunately people make judgements from that ignorance. It's infuriating, to be sure. The best we can do is try to educate, I suppose. I for one have learned from your account of yet another exception to the two-factor body weight narrative, and I thank you for that. I hope this person also comes to understand, and that you are able to find some peace from your anger as more people come to understand as well. ",,,2,0,0,
9467eb37-981d-4ca7-8d4b-0d1f920f1dca,1515821707,"/rant below 

Wow. FFS, Guillermo del Toro. I'm genuinely pissed off. I loved the vast majority of his films I'd seen so far. I don't care, I'm probably not going to see this one. As a deaf person, my mind's made up -- I've seen this shit way too many times before so I have no expectation that it'll be any different this time -- sooo, likely nothing anyone will say will sway me.

There are already so many good D/deaf actors and actresses, locally and beyond, and he had to pick some girl *and pay her an actual paycheck, unlike us who get nothing*. The chick who's never struggled like a deaf, paralyzed (?), or ""mute"" person, got paid to pretend to not be able to speak and use what was probably garbage pantomime instead of actual sign language. This is like the 29584th time it's happened in mainstream filming. 

I hope he chokes on one of his daily churro binges. Fuck's sake, this is such a disappointment, seriously hits me like the time George Takei basically admitted to be a sex assaulter. I thought del Toro was one of the cool ones, wtf.

/end (perhaps overly heated) rant",,,10,0,0,
ed8ba6bc-882d-499a-852e-bd8584f2b729,1515023943,???????? then kindly input your experience instead of writing something so vague. ,,,1,0,0,
d7e61ae2-ab65-47a6-9837-317575faf28b,1517350843,"That's the point, they do it as a quick and easy screen to keep undesirable applicants out and avoiding claims of discrimination, pretty much the norm in most job applications now.

Whether disabled, a drunk convicted of DUIs, or just lazy and never got/needed a license, all of those are things they don't want in an employee.

Because its illegal to write ""disabled need not apply"".",,,3,0,0,
30c5b634-d237-4b27-a37f-e32a3fd44a4f,1516859034,"Tbh, the manager has a legitimate point if you are unwilling to work with people.  Feeling like an idiot shouldn't be an issue when working in fast food, it's probably hard work and not everyone can do it, whether they are disabled or not.  If you don't want to have face time with customers, I'm not sure you will want this job.  

A little back ground on me: I'm schizophrenic too and used to get tons of panic attacks.  Truth is, the only easy jobs that don't require customer face time are those that require a college degree.

I work at a gas station behind the register, so I deal with customers almost all day, and it can kind of suck if I'm in the wrong mood.

To me, it seems like you're only asking for 4 to 8 hours a week.  The problem with that is there really aren't any jobs that only want people to work four hours a week.  Most jobs want minimum of twenty, which is part time.  If they don't have the labor hours for a stocking position, than there really isn't much you can do to prove discrimination.  Customer service is hard.",,,2,0,0,
1e5139d8-da37-4700-8609-6b74d57637bd,1514817753,"Right, I hear you but as I said above food delivery is not an option for me. The food is picked up at the gate which is farther than walking to the dining hall. They won’t take it to me because it’s farther than the dining hall food which they also won’t take.",,,1,0,0,
c89d8b55-ee70-4e80-81b2-f2bfc4ccb3b9,1515859641,That's a good point. I really do hope that whoever is in charge of all that will hold people accountable. ,,,2,0,0,
1170f023-b09a-44c6-8498-ff16d1d9e8f3,1515561512,I have never worked due to my health so I never file any taxes.,,,1,0,0,
fa34223a-edca-433a-a46e-d1209e79d75a,1515128727,"Thank you guys for the feedback, honestly I really appreciate it! I’ll just tell him about my apartment, let him know the layout and he can decide if he thinks he can handle it or not. I just overthink things sometimes and worry I’ll make people uncomfortable, I was worried it would be rude just to say “my apartment isn’t accessible”, and I didn’t want to seem pushy by offering way too many solutions (being my occasionally over enthusiastic self, lol) that he may not be comfortable with (i.e. my guy friend broke his foot last month and couldn’t get up my stairs, so I gave him a piggy back ride).

All good insight, only he knows his abilities and rather than me asking what they are, I’ll just tell him what the layout is and I’m sure he has enough experience that he’ll know the right call too make. 

Just one follow up Q, if I do find out my apartment isn’t an option for him, would it be kind of rude to keep inviting him to events there? I want to include him (of course!), but it seems like it could be hurtful and make him just feel left out? What’s a good way to deal with that? Thanks in advance for the feedback guys, I just don’t have much experience with this and want to try my best to be a considerate friend! :) ",,,2,0,0,
9a6239bc-065e-4ab4-85f3-c2f1375f96f2,1517044580,"Do you have any family members or friends you can fall back on? At this point, you're going to have to rely on someone. There's really no two ways around this, unless you're going to accept being homeless. A lot of people get declined for SSI multiple times before being accepted, so as others said.. try to find a pro bono lawyer. 

Another idea, there may be a non-profit related to your disability that can assist you.",,,3,0,0,
