commentator_id,created_utc,anonymized_body,ups,downs,score,controversiality,gilded,distinguished
5ddbf681-9c1c-471c-8471-18d0d18ce6be,1430231349,"I took my visual my field test this weekend actually, the girl was new so she had no idea what I was talking about even after I explained what I have, what it does and that I had made the appointment specifically because I had noticed an increase in tunnel vision. She kept explaining how to do the test like I was slow and having me repeat it. I had gotten to the point were I was going to demand someone else when she gave up. She then asked if I wore glasses for night time driving, I laughed (it's been three years since I did any driving.) I know it's rude but I was frustrated and upset. As I'm paying the guy sees the results (also explained to him after I told him the special peripheral enhancing glasses he was trying to upsell would be wasted on me) doesn't believe I could possibly not have seen anything but right in front of me and had to check with the optometrist before I can get out of there.  I felt like the one place I wouldn't have to explain what I could vs couldn't see and more importantly why. was the optometrist but apparently not. Sorry for the vent I am just kind of upset (also got 20/100 best corrected central vision which I wasn't expecting I knew it was bad just not that bad) all in all not my best day.",1,0,1,0,0,
5ddbf681-9c1c-471c-8471-18d0d18ce6be,1429869910,"umm as much as they can be I guess. I am lucky to have a few very close friends that I have grown up with so they understand I can't see at night and that I don't drive anymore but if your not living it it's harder to understand just how much of your life it effects. I find it really difficult to make new friends because it's not something I like sharing right away so then your weird for not driving or tripping constantly, missing certain things... oh well.",1,0,1,0,0,
c9691d3e-23af-43e5-8704-67ac14abc496,1430106034,"That makes sense, I wasn't intending to have it replace my cane, I was just looking for another way to orient especially when I can't tell what intersections I'm approaching.  People seem to really like BlindSquare but I am an Android user and the developer either appears to be uninterested or moving very slowly on developing for that platform.  I'll stick to google maps walking directions for now although I would love more information about my surroundings.",1,0,1,0,0,
7dfa93f1-b4ca-4f21-9908-d574d170abee,1428893204,"Sorry, I am still on Windows 7, so I can't really help you, there.  

I had a Victor Stream for years, and once I memorized all the functions, it worked really well, for me. These days, I use an app on my IPhone called Voice Dream Reader.  If you have an IPhone, I recommend it!  It's easier to use, because it works the same way your IPhone does, and it has many more functions.  ",1,0,1,0,0,
7dfa93f1-b4ca-4f21-9908-d574d170abee,1429101243,"Maybe you have an IPhone6? I'm on a 5, so that might at least explain the slowness and crashes?  I know it's nothing gone wrong in the app, because when I originally tested it and found it unusable, I uninstalled it.  I just re installed it fresh from the app store this morning to test and write this comment, and have all the same issues.  It can't be the phone, because it's been reset and restored pretty recently, because it went in for a battery replacement.  All I can say is, for me, the app is right on the edge of unusable.  ",1,0,1,0,0,
1a8aa46a-0519-4ead-b75a-9a3e5392ba8b,1429039823,"Finally… Here's to hoping that they make the experience somewhat better on all of the iDevices. If only my PlayStation three were accessible… I primarily use that to watch Netflix, but will always need a sighted person to help pick and choose content. Have not really tried using the website on my Mac mini which is also hooked up to my sound system and TV.",1,0,1,0,0,
2fc8cf80-fed0-4d14-83a5-4d2d85d679d3,1429861790,Well I hope it does give you some comfort. I was told in 2000 I had ten years of vision left. I've beat that. But it hasn't been all fun. I've documented my visual timeline here if you're interested: http://rp-vip.blogspot.com/2015/04/visual-history.html,1,0,1,0,0,
1a8aa46a-0519-4ead-b75a-9a3e5392ba8b,1428903152,"Just letting you know that this survey website doesn't work with mobile voice over. I hear the questions just fine, however the answers paired to the radio buttons do not announce themselves so I don't know what the radio button select.  This is rather funny considering that your first question asks if I use an iPhone or not, yet I cannot answer it while using an iPhone…",1,0,1,0,0,
c9691d3e-23af-43e5-8704-67ac14abc496,1429738587,"You didn't really indicate where you are located, but I am in the United States.  The Department of Social Services for my state has a subdivision called Rehabilitative Services for the Blind.  This is state funded, they provided me with a caseworker for general things and an Orientation and Mobility specialist.  This is all free of charge.  I meet with my O&amp;M specialist once every few weeks and I am coming close to completing my training fully.  They do more than just cane work, they can help you with night time orientation, public transit techniques, and tons more.  If you don't have something like Rehabilitative Services for the Blind you can look for private organizations (I have two in my area).  All of these agencies can help you with training and equipment.

My caseworker at RSB made sure I got the training I need, she also pointed me to another organization which provided me with over 5,000 dollars in low vision technology including a desktop CCTV, iPad, and handheld video magnifier.  These are all things that I wouldn't have been able to afford by myself.  Luckily there are resources, you just have to seek them out.

Back to the cane, I really enjoy the confidence it gives me.  People make room for you and you don't get the frustration from people in public.  Part of the problem is that just because you are visually impaired and prone to running into things does not necessarily mean you look like you have that problem to the public.  The cane makes your disability visible which is good for a lot of reasons.  The one I like the most is the not getting in hassled part, however it is also very important for safety.  It is a very visible warning to drivers that you are visually impaired and may not see them and it has gotten me out of a few situations where I didn't hear a car coming due to the noise level of my surrounding.  If for no other reason than that I will not leave the house without a cane in my hand.  

Beyond the warning it gives, you just won't run into stuff as much and that is a fantastic perk :)  If you can find an organization that will train you for free they will probably also provide you with a cane for free.  If you can't find one, I don't think it would be impossible to train yourself on the basics.  It isn't exactly rocket science and if you needed guidance I could PM you some basic techniques.  Canes are cheap ($20-$30), I like Ambutech canes, they are very durable and offer customization for your comfort (different tips, lengths, materials, etc.)  Let me know if you have any other questions :)  Good luck!",1,0,1,0,0,
c9691d3e-23af-43e5-8704-67ac14abc496,1430258185,"It depends, the hospital I visit to have my eyes checked out and where they are doing research on me is very difficult to get around because of all the poorly planned extensions that keep getting added on.  I have also had to visit people in different hospitals this past year, the one in particular is much smaller, more linear, and more easily navigable.  If I am struggling I just have someone lead me to the room, it's usually not a big deal.  I will be volunteering in a hospital coming up in about a week and they showed me around where I will be working.  That is going to take some getting used to.",2,0,2,0,0,
7dfa93f1-b4ca-4f21-9908-d574d170abee,1427895714,"I was born blind.  And...I dunno?  I can roll my eyes in my head, because I can kind of...feel them moving, I guess.  And when I get something stuck in my eye, I blink, tear, and move my eye up and down to try and force it out just like anyone else would.  But I think that focusing on a visual object requires different muscles than moving your eyes from left to right and up and down does.  Doesn't focusing...do something to the lens of your eyeball? Contract or expand it or something?  Maybe I'm thinking of night vision, though. Anyway, how would I know if I can do that or not?  I don't think I could feel my eye lens doing that in the same way I can feel my eye moving back and forth.  

TL;DR: I'm born blind, so there is no way I can answer your question. Try a doctor.",6,0,6,0,0,
05b93126-6b2a-436a-817b-ee3ea856610e,1429357989,"CNIB and march of Dimes in Canada

I can't vouch for it but one of the iPod touches using voice control might work as long as all of the books are clearly titled. I know CNIB has something better avail but I don't know the details. ",1,0,1,0,0,
8986e1d3-fd85-4f15-920f-e112b5edf86e,1429730537,"Hmm.. yeah, a tablet sounds more reasonable. Plus, my dad has fat fingers, lol. 

Now the problem with that is how to keep the bratty grandkids from using it, but that's my problem now. Thanks for your suggestion!",1,0,1,0,0,
1580d3e3-85b7-4b99-a447-8791199580f0,1428098989,"Your post reminded me of this recent post.
https://www.youtube.com/watch?v=W1VUr544i84

I'd be interested in knowing what you come up with. I'm facing possible blindness sometime between now and when I retire (mid 30s now) and work with data as my primary job function.

Edit: Reddit source: http://www.reddit.com/r/Blind/comments/2x956w/my_friend_has_been_working_on_a_tool_for/",1,0,1,0,0,
7dfa93f1-b4ca-4f21-9908-d574d170abee,1429048809,"On the website, you can pick a show, but you can't seem to pick a particular episode; it just resumes where you left off.  You can also pick movies.  But when anything is playing, you can't use any of the controls (rewind, pause, fast forward, volume, etc).  Of course, that's how it was a month or so ago when I last tried it.  If you can come up with the money, I highly recommend getting yourself an Apple TV.  It's the best experience a blind person can have with Netflix, Youtube, and even the iTunes store, for that matter.  I use it daily, and it was worth every penny.  ",1,0,1,0,0,
10dbdb36-59e1-4336-b55e-5f845b9e336b,1429329132,"If in the US, check out the NLS and go over the guidelines. The devices are simple and books are sent by mail.",2,0,2,0,0,
d42770b1-9f84-462c-9536-090461a2ff56,1428746849,I have RP. I was diagnosed when I was 14 and I have lost most of my night vision. My peripheral vision isn't that great either. I would say range of vision is about 60 degrees. It hasn't been that bad coping with the fact that I will be legally blind sometime in the future. Its inevitable. Just stay strong and you will get through it. I've realized that life is short and that we all have a purpose.,2,0,2,0,0,
7dfa93f1-b4ca-4f21-9908-d574d170abee,1428845499,"Actually, they can:
http://shoryuken.com/2014/01/31/mike-mike-z-zaimont-updates-skullgirls-encore-to-enhance-accessibility-for-blind-players/
",1,0,1,0,0,
65134dbb-cb2c-48e9-ae49-d82fe8da5a8c,1429817904,"There are recumbent two, three and four wheel bikes with both foot and arm powered drives. They are quite expensive though and since he's likely to grow a lot in the next couple of years now may not be the best age to buy him one.

Depending on his abilities to ride independently you might also consider a tandem. Something like: [tandem handcycle](http://www.rivonline.org/Outdoor%20Equipment.html)",2,0,2,0,0,
02ffe1fd-fcde-4414-87f8-5d9f34131c54,1429979760,Don't waste your money. It's basically a google maps. My GF uses trekker and it too ahs its good and bad days. It's not worth the money IMO considering any GPS you can get for the Iphone does the same thing.,1,0,1,0,0,
7dfa93f1-b4ca-4f21-9908-d574d170abee,1429797020,"I don't find GPS accurate enough for turn by turn; I've used several platforms, and it's always accurate to about 15 to 30 feet in the real world.  I find the best solution is Blindsquare on IOS.  Don't bother with turn by turn, just track your destination. Blindsquare will tell you what direction you're going, how fast, what street is coming up, and nearby landmarks.  This works really well to keep you oriented, help know if you're walking the right way, got the right bus, etc.  ",2,0,2,0,0,
ffb3fe92-2bdb-462c-afed-c5aef99b5d8d,1429100465,"This is strange to me, because I only use the IOS app; and perfectly fine. Sure the layout is a little odd, but I use it on IOS7 and IOS8, and I get around fine.",1,0,1,0,0,
7dfa93f1-b4ca-4f21-9908-d574d170abee,1430251442,"Hospitals are terrible.  Especially in Canada, where they're almost always overcrowded; good luck getting anywhere when there are masses of people sitting/standing in every waiting room, stretchers in the halls, hand-washing stations that you are required to use before entering particular areas (but of course the hand-washing station is nowhere near the actual entry to the area in question), almost no Braille signs, etc, etc, etc.  Also, whenever I am in a hospital, it's either because I'm feeling sick or in pain myself, or someone close to me is sick.  So the fact that I'm extremely stressed/upset doesn't make the already difficult task of navigating a hospital any easier at all.  If a family member is sick enough to be in the hospital, I'm probably just not even going to try; I'll ask for help to find them, so I can preserve what little cheer I have for the time I spend visiting them.  Being there for my friends and family is more important to me than the pride I take in my independence.  ",2,0,2,0,0,
7dfa93f1-b4ca-4f21-9908-d574d170abee,1428846495,"It's a mainstream game with added features.  That'd be like saying it's not a TV show if you watch it on your COMPUTER.  Also, for that matter, many major video game sites review MUDs, browser based games, interactive fiction, and other things that are called video games even though they don't involve any video.  ",3,0,3,0,0,
d4813c8e-eb4c-4160-9f37-ef67f465e1e8,1427894933,Sounds like this is a question for a doctor or scientist. ,1,0,1,0,0,
785715d2-5557-43ec-a873-47078f038f24,1429321036,"Where do you live?

In US there is NLS. Talking Books for the blind, www.loc.gov/nls
each state has their own library. You can call the,m, and thye are friendly. You judt need an opthamawhatchalallit ye doctor to fill in the application fro you.
Thye'll even send a device for reading.

In UK, check RNIB. 
They have some similar audiobook options.

And other countries do too.

UK's RNIB has even Radio Insight where on one channel they have audiobooks. Other channels have nice shows for blind and visually impaired. I mean points of view that are close to heart.

Then there's radio perkins. They have something about books too.

But NLS and RNIB are good places to start if you are in Us or UK.",2,0,2,0,0,
7dfa93f1-b4ca-4f21-9908-d574d170abee,1429111202,"Well, I don't know what kind of websites you build, so I don't know if this applies, but the biggest frustration I find regularly is a lack of consistency throughout a website.  As far as I know (and I could be wrong), standards documents don't really address this.  The problem is especially bad on sites that allow users to style things, like MySpace and Zanga used to, back in the day.  You can wind up with some parts of a website that are perfectly accessible, and some that aren't, depending on who's in charge.  Wordpress.com for example, is pretty bad for this.  They host all the wordpress installs everyone who blogs at domain.wordpress.com uses, so there is no reason they can't let me sign in with my Wordpress.com account, and then force every wordpress.com blog I view to use a theme of my choice.  That way, they'd all look the same, and be more-or-less accessible!  Tumblr is another website that's bad for this; I haven't tried tumblr in over a year, but last I checked, even when I signed in, I couldn't disable the customized styles for each different tumblr.  If that's changed and I'm wrong, I'd love to know!  In the positive category, Reddit does this perfectly; when I'm signed in, I can disable subreddit styles, if I don't want them.  DreamWidth and other LiveJournal based sites also do this well; I can force every other journal I visit to use the style I have for my journal.  

TL;DR: If you let users who post content to your website customize the look and theme of their section of the site, provide a way for blind users to disable these custom themes, and use your *hopefully* fully accessible global style.  ",3,0,3,0,0,
7dfa93f1-b4ca-4f21-9908-d574d170abee,1429792527,This seems to be what everyone recommends: http://www.hadley.edu/brailleCoursesFAQ.asp,1,0,1,0,0,
ab622f92-b1d9-407b-98be-e5ec8823e247,1430329971,http://en.wikipedia.org/wiki/English_Braille for the rules of the grade 2 language. Then just get a good grade 2 book and start translating it. ,1,0,1,0,0,
7dfa93f1-b4ca-4f21-9908-d574d170abee,1428861798,"Honestly, I agree with you.  I don't think it'll help, either.  But if someone wants to try, taking a minute to sign the petition and share it seems like the least I can do.  If we assume a petition won't work, it definitely won't.  If we try, it probably still won't work. But at least it was tried.",1,0,1,0,0,
7dfa93f1-b4ca-4f21-9908-d574d170abee,1430148972,"Thanks for the info!  I'll keep it around for when I go on my summer travels, in that case.",1,0,1,0,0,
7dfa93f1-b4ca-4f21-9908-d574d170abee,1429108812,"I'm pretty sure I do.  And even if I didn't, I'm not sure why that would cause the app to crash constantly, or cause voiceover to reload out of nowhere.  The most frequent crashes of the Netflix app seem to happen just after selecting an episode or movie: instead of playing anything, it just crashes to the home screen.  Also, if I'm going through multiple search results quickly, the app will reliably crash.  I had it crash twice when I was on the front page going through the stuff recommended by Netflix, but I can't seem to reproduce that one.  When I'm playing a video, often VO will randomly reload if I try and use the controls (pause/rewind, etc).  The other place Voiceover often crashes (4 out of 10 times I tried it) is on the initial screen, when I have to select who's watching Netflix (my account has 3 profiles under it).  When that happens, Voiceover won't read anything when I swipe in Netflix after it reloads, and I need to exit Netflix out of the app switcher to get it working again.  

So, to make a long story short, the app is hardly usable for me.  Maybe they have a different app version on the Canadian and US app stores? What version number is your app?",1,0,1,0,0,
7dfa93f1-b4ca-4f21-9908-d574d170abee,1427988744,"They aren't all that surprising to me.  Most training blind people get about computers is done by sighted people who hardly know anything about anything access related.  Folks who went blind later in life, even if they were once gamers, probably don't know anything about MUDs, so just assume they can't game anymore.  Folks who were born blind will only find out about MUDs if they go and look for computer games to play, not from teachers/trainers, or sighted friends.  And they may not even look, having tried so-called text-based games that sighted friends have told them might be accessible (NetHack, Dwarf Fortress, Runescape, etc) and found them totally unplayable, thus giving up hope.  

Wow, all that posting by hand must take you hours.  And then checking back later to respond...that's dedication!  If other MUD owners were as dedicated to promotion as you obviously are, maybe the genre would be in better shape.  ",1,0,1,0,0,
f4c30932-ac6f-45fb-bc1a-a0162a57a60d,1430141318,"I have learned that the phrase “legally blind” will get doors slammed in my face; I have had interviewers turn away from me and start looking out windows while tapping their pens on their knees and notebooks; I have had interviewers slouch in their seats, resting their heads on the backs of their chairs like they were going to take a nap on me; I have had interviewers tell me they could put me to work right away, go as far as show me the workstation I would be using then a day or two later inform me that the company is going to continue looking.  I have had interviewers start talking to me as if I were six years old again or start talking to others in the interview as if I wasn’t there.  I had one company tell me the job had been filled that very morning, pull the job off their website and re-post it a week later with a “REQUIREMENT” of a valid drivers license even though the description stated zero percent travel.  

I truly believe that the average person doesn’t understand the difference between “legally blind” and “totally blind”.  My empirical evidence indicates that most people sub-consciously make a connection that if your eyes don’t work and since your eyes are in your head then there must be something wrong with the rest of your head.  

I no longer use the phrase “legally blind” when my vision comes up in an interview, instead I use the phrase “very near sighted” which seems to be more acceptable to people, it is something they can relate to I guess.  Using “very near sighted” is a way to open the topic for conversation and allow me the opportunity to quantify my vision, offer examples of how my vision is an asset to me in my job as well as, hopefully, an opportunity for me to dispel some false assumptions the average person may have about people with visual impairments.  

A potential employer needs to know and not making them aware of my vision during the interview would, I think, come across as being deceptive.  One of the best opening I get is when I am asked what my strengths are to which I reply that being very near sighted from birth has given me a lifetime of experience in problem solving and that I have honed that skill to a razors edge.  More often than not I am asked to elaborate on the “skill” of problem solving before I am asked about the “tool” of being very near sighted    

Sorry about the novelette folks.
",2,0,2,0,0,
02ffe1fd-fcde-4414-87f8-5d9f34131c54,1429721731,Thanks :) Just living life like it should be lived.,2,0,2,0,0,
c8952630-193a-4571-8cfa-5be54ba95163,1429563468,"I'm not blind but my boyfriend has RP and is very limited visually (pinhole vision that's only useful in VERY well lit rooms).

He had an interview today, actually. I encouraged him to bring up his restrictions prior to the interview so they're not shocked. He knew there was going to be a written test on paper so beforehand he emailed the recruiter and explained that he had limited vision so the test would need to be on either a computer with high contrast or someone would need to read it to him. The guy emailed back and was very nice, and at the interview today my boyfriend didn't end up having to take the test because they couldn't have it reprinted or get authorization from the company they buy it from to have someone read it to him.

So I'd just recommend letting the recruiter know when you're calling/emailing to talk about details, and they will inform anyone else who needs to know.",3,0,3,0,0,
7dfa93f1-b4ca-4f21-9908-d574d170abee,1428896730,"Actually, there are several developers who sell through steam, like Choice Of Games, who's games are otherwise perfectly accessible.  Also, the developers of Skullgirls (and Shank apparently) have added accessibility features to their games.  Unfortunately, it doesn't really do any good, as it's almost impossible to purchase or update the games without sighted help.  I think that's what prompted the petition in the first place; there are lots of game developers who are quite willing to help us out.  But requiring that they abandon steam to become accessible on PC seems unreasonable.  ",1,0,1,0,0,
7dfa93f1-b4ca-4f21-9908-d574d170abee,1429196070,"What  OS are you on? On Windows, NVDA (http://www.nvda-project.org) does what you want, and is free. On OS X and IOS, Voiceover is built-in to the OS and does these things.",2,0,2,0,0,
8986e1d3-fd85-4f15-920f-e112b5edf86e,1429642985,"Thanks for the tip on NVDA! I'm really very concerned with how expensive JAWS is, I'll give your recommendation a go.",1,0,1,0,0,
