commentator_id,created_utc,anonymized_body,ups,downs,score,controversiality,gilded,distinguished
7dfa93f1-b4ca-4f21-9908-d574d170abee,1429366577,"Depends what country you live in, and how much you want to spend.  If you get something like a Victor Reader Stream or a BookSense, they take SD Cards. So you could load a card up with files, stick it in the mail, and he can pop it into his player when he gets it.  But those devices do not come cheap.  ",1,0,1,0,0,
dd26bcea-5ac4-4228-acca-9ddf00bd2448,1429859999,"I was diagnosed when I was 14 and am now 23. At first it seemed really slow, but since I was about 19 it seems to have progressed faster, but I think as it gets worse I just notice it more. I have had a lot of trouble adjusting and have found people around me have a lot of trouble understanding it because i look 'normal' and can still do things without a cane. Became a little isolated as a result of no longer going out to bars etc. I'm going to check out support groups soon, maybe do that? I'm sure they'd have them in most countries",1,0,1,0,0,
13c1bda3-c843-4de9-989d-6f9c02295ac1,1429841898,Workman makes some nice custom adaptable bikes and trikes ,1,0,1,0,0,
7dfa93f1-b4ca-4f21-9908-d574d170abee,1428933124,"Sorry, the question ""Please rank the following tasks by difficulty"" was completely inaccessible with every screen reader I tried (NVDA, IOS, Mac).  I'm not finding anywhere to type or select a number.  If you want to survey the blind community, you need to put in the effort of testing your surveys for accessibility on, at minimum, one platform.  ",1,0,1,0,0,
7dfa93f1-b4ca-4f21-9908-d574d170abee,1429100279,"As am I.  I get massive, massive lags in the Netflix app with VoiceOver on, and frequent crashes of Netflix and Voiceover, both.  When it does work, there are frequent places where swiping just...says nothing. Not ""button"", or anything, just makes the click swipe sound, and says nothing at all.  There are also multiple unlabelled buttons throughout the app.  You can get it to work, in the same way you can get the website to work, if you're willing to fight with it, and put up with missing functionality.  But it's definitely a semi-usable app, not an accessible app.  Especially on IOS, there is no excuse for that.  ",1,0,1,0,0,
785715d2-5557-43ec-a873-47078f038f24,1429498332,"TuneIn Radio works for the show.
(I use it on iphone)",1,0,1,0,0,
ffb3fe92-2bdb-462c-afed-c5aef99b5d8d,1429110991,"O wow, what country do you live in, because I live in the US and I have had none of these bugs. I'm not able to check my version number at the moment because I'm in school, but I will let you know before the end of the day.",1,0,1,0,0,
1580d3e3-85b7-4b99-a447-8791199580f0,1429471549,If I remember right the cochlear implant advanced leaps and bounds since the first generation. Here is to hoping the same happens with this technology as well.,1,0,1,0,0,
8986e1d3-fd85-4f15-920f-e112b5edf86e,1429634479,"Oh no, he will be using FB on his computer... I don't think I'm ready to introduce my dad to the ""joys"" of mobile computing yet. ",1,0,1,0,0,
dd26bcea-5ac4-4228-acca-9ddf00bd2448,1430358489,"Argh i feel you! Mine was very similar, the optometrist told the woman to do this test on me, and i told her before we started that I have no peripheral vision - but she kept pausing it and telling me to do the test properly. It made me teary and snappy. Then going back to the optometrist he was just like ""well are you happy? got what you wanted?"" I felt like i was being attacked and that people were all cynical of my really bad results despite almost 10 years of RP being recorded on my files, and the people doing the tests were completely naive, why would you be administering a field vision test if you have no knowledge of conditions that could mean the results are shit? I wanted to slap everyone.
the optometrist didn't understand it either? that is so ridiculous and stupid. I'm sorry you had such a shit experience. did you even get the field vision test results? It makes the whole situation which is already so difficult so much worse when you have to keep explaining and justifying yourself. 

",1,0,1,0,0,
785715d2-5557-43ec-a873-47078f038f24,1428888191,"Good questions.
I answered.
I'm comfortable askign strangers in twitter or reddit to explain to me what's in a picture.
But i'm extremely uncomfortable when i go out to see a movie when i really shluld ask for audio description headset. :( (and the cinema i go even alone to does not have them).
I'm very uncomfortable asking anyone help with reading papers or documents. 
I'm extremely uncomfortable when I see any doctors or medical staff. 
I can't do grocery shopping alone, but I'm glad my other half is a good driver and has patience with me when we shop with a list.",1,0,1,0,0,
d85c1f05-6904-4488-9843-90a63d24c75f,1428896363,"Even if this petition were to go through, I don't really see how making the Steam client accessible would help - the games themselves would still be inaccessible, and you'd have to petition every individual developer for updates.

To that end, I think it would be better to focus on a blind specific gaming service instead.  I've actually been working with some blind developers to set up something similar to steam, hopefully to drive more audiogame development and get more titles out there.  We should have the first titles out in the next few months.",1,0,1,0,0,
785715d2-5557-43ec-a873-47078f038f24,1429498277,"Look for a local NFB or vision rehab place.
Get some cane training - or train yourself from the internet or just try different things...

It'll be awkward.
Some days and some light situations you'll benefit from the cane - other times it's fine without it.
Learn to laugh at yourself, and find local blinky friends.

This week in my boring life:
- I spilled freshly ground coffee on kitchen floor - oops but floor smelled good after
- a few days a sharpie and my dyson were smarter than I 
- I was looking for my jacket for a week... It was in living room, in a pretty central spot
- I nearly fell on the firelane painted lane (it was brown! I didn't see it) like 20 feet from my front door, while returning from a run. That paint had nearly 1/2 inch (1cm) height difference from the street 
Oh, I did get some green fishing reflective tape so I could cover the terrible red part of the ""selfie stick"".

Oh, look at /r/colorblind too.
It's different challenges with them, but you can always use the ""what color is this?"" to your sdvantage. It's a bit less frightening for the others, so ""oh, you're just colorblind"" can be a refreshing reaction.",1,0,1,0,0,
7dfa93f1-b4ca-4f21-9908-d574d170abee,1429034866,"My thoughts, exactly.  I'm waiting for the gushing mainstream media coverage of this, where they talk about how wonderful Netflix is, and never mention that it took over 3 years of constant lobbying, with multiple refusals by Netflix themselves, even though they've supported alternate audio for other languages for years.  Also, they make no mention of even attempting to make the website accessible; the only place Netflix even works is on the Apple TV.  Even the IPhone app has serious issues.  

On the other hand, constant negativity won't help, either.  Let's support the victories!",2,0,2,0,0,
65134dbb-cb2c-48e9-ae49-d82fe8da5a8c,1428001357,"The cards are dealt face up and the dealer announces the cards, both yours and theirs, as they are revealed. Not all dealers are good about remembering to do this, but it is something they have all been trained to do. If you have a crummy dealer, move to another table. 

The dealer is under no obligation to tell you your total unless you've busted though some will read the hand rather than the specific cards, ie. They will say ""16"" rather than ""9 and 7"" or ""7 or 17"" rather than ""ace and 6"". This can be good and bad. We have had dealers who read a pair of 8's as ""16"" and failed to mention it was a very desirable pair against a low dealer card. Others at the table spoke up and urged us to split rather than stand.",1,0,1,0,0,
1a8aa46a-0519-4ead-b75a-9a3e5392ba8b,1429135047,"The valve corporation works in a cabal type system where ideas are floated around the company and as they build up supporters they work to unanimously movie idea forward. I don't know if a petition will do anything about this, but I do have friends who work at valve and at other gaming companies around the same area that may help get the idea started within the company. I miss all of my games purchased through my steam account, but gaining access to them again and to more accessible games would be fantastic.

Steam is on the Mac, so there may be voiceover potential there for future updates…",1,0,1,0,0,
74d4a5cf-0b48-4c7a-a22a-de2a8b1c7c01,1429208462,Look into braille displays and depending on your needs into braille notetakers which can be described as braille PDAs.,1,0,1,0,0,
ffb3fe92-2bdb-462c-afed-c5aef99b5d8d,1428931750,"I'm blind and I actually play Alteraeon. I believe there is a subreddit called /r/alteraeon, but it's pretty much abandon. But you could definatly promote it here I assume. Youcould also go to other gaming sus and try to get sighted people interested.",1,0,1,0,0,
5bc908fe-499c-4126-a514-d7e3b190fa90,1428985915,"Sorry about that! We are using Qualtric's survey software since it was required for our class. But you're right. We should have checked how accessible it was via mobile and screen readers before we launched it.  If you know of any other survey platforms that perform better let me know, and we'll try launching a second iteration. And of course we'll keep looking for a better solution as well",1,0,1,0,0,
5ddbf681-9c1c-471c-8471-18d0d18ce6be,1430361935,"I got the results but only after I specifically asked.  I couldn't see anything at the time so I snapped pictures on my phone to look at while the guy was off checking that the girl didn't make a mistake then went back yesterday and made them give me a copy.
Best part of the whole visit was when I was explaining (defending myself) about why I had not been in sooner because it is a super emotional experiance for me (it's not like I ever get good results) and the optometrist goes ""get over it ""  congrats I will find myself a new ""retinal specialist""  maybe one who has a clue this time.",1,0,1,0,0,
58071da6-869f-4389-9a4f-0e1412d38c7c,1429073244,Not true at all. Netflix has worked on Android for a good two years now.,1,0,1,0,0,
785715d2-5557-43ec-a873-47078f038f24,1429406344,I can't wait ro get a chance to meet him in person one day :),1,0,1,0,0,
65134dbb-cb2c-48e9-ae49-d82fe8da5a8c,1427994923,"Casinos will always deal multi-deck blackjack face up if you ask. If the dealer at table you sit down at doesn't know or refuses just ask for the pit boss. We've never had a problem. There has been increasing reluctance to deal single deck face up in recent years. Some places still will, others will not.

Poker is harder. I haven't heard, outside of specific tournaments for blind players, of any solution for reading players their hole cards.",1,0,1,0,0,
58071da6-869f-4389-9a4f-0e1412d38c7c,1430105876,"The app works currently, though it still has minor issues from time to time.",1,0,1,0,0,
7dfa93f1-b4ca-4f21-9908-d574d170abee,1429018037,"I've taken surveys built in Survey Monkey and Google Docs that have been accessible.  But I've never created a survey myself, so from the perspective of the creators, I don't know if they did anything special on those platforms to make sure they were accessible.  ",1,0,1,0,0,
7dfa93f1-b4ca-4f21-9908-d574d170abee,1429124659,"I'm on 8.3 right now.  But when I last tested Netflix, I was on the last version of IOS 7, and had the same or similar bugs.",1,0,1,0,0,
7dd3530c-7733-4a84-a4fc-81eb0ed272ad,1429475942,"He's usually on Monday nights:

http://vaughnlive.tv/hankandjim",2,0,2,0,0,
7dfa93f1-b4ca-4f21-9908-d574d170abee,1429151799,"I'm thinking maybe it has to do with the audio ducking feature in voiceover?  Next step is to turn that off, and see if that makes it work with my headset, or makes it worse, or something.  I know some other apps I run freak out voiceover, and it can't duck the volume of audio from those apps, frequently.  I don't really care, as I have an Apple TV, so never use Netflix on my phone anyway.  But now I'm curious.  ",1,0,1,0,0,
cd021b05-9244-41fb-922f-ebbbcf95e082,1429821002,"I was part of a trail group for the trekker breeze about four years ago, we basically got to take it around town for a couple of hours and then gave our thoughts on it. Honestly, I would say that if you are comfortable with Google Maps then there is no point in changing - from memory I can not remember any significant difference between the two apart from the obvious lack of a screen on the trekker breeze. ",1,0,1,0,0,
ab622f92-b1d9-407b-98be-e5ec8823e247,1430329631,"Personally I just bought a good book (mice and men) from http://www.braillebookstore.com/Books-for-Adults

Then I used http://en.wikipedia.org/wiki/English_Braille to translate. It's slow going at first, but not too bad. http://en.wikipedia.org/wiki/English_Braille#Abbreviations this part was the most useful. ",1,0,1,0,0,
785715d2-5557-43ec-a873-47078f038f24,1428197903,"I hope there is.
Because plain text will suffice...
There are plenty of NFB and other vision activists in Boston area... Lucky y'alls.",1,0,1,0,0,
821a6ac7-d4e9-4137-90cd-750939f3da06,1429640696,Who locks a guide dog in the trunk of a car?,2,0,2,0,0,
13c1bda3-c843-4de9-989d-6f9c02295ac1,1430241501,"At a new place, it can be overwhelming for me. My father has been hospitalized so many times at one hospital I can find my way very easily. 

That being said, I have had multiple doctors give me printouts of information. That has certainly been a WTF moment. ",2,0,2,0,0,
785715d2-5557-43ec-a873-47078f038f24,1429743819,"Iʻd love a puppy like that. :)
(Although a sighted dog would probably be a bit more practical for my needs)",1,0,1,0,0,
74d4a5cf-0b48-4c7a-a22a-de2a8b1c7c01,1430335276,"Smartphone: Unfortunately I don't personally know any blind Galaxy users but everyone who I know who uses a touch screen phone is successful in navigating their phones. There are books available in various formats including braille and Daisy that give you instructions on how to navigate your iPhone and what Apps you might find useful.

You can also find information on using Android while blind [here](http://eyes-free.googlecode.com/svn@325/trunk/documentation/android_access/index.html)

The Internet: Again there are books on how to navigate iOS and Windows computers in various formats. There are books on how to use google, and how to tweet, and emails. 

[Here](http://www.nbp.org/ic/nbp/process.html?subcat_id=4&amp;heading=Adult%20Books--Computers%20%26%20Technology&amp;mv_nextpage=publications%2fbrowse_results&amp;mv_todo=return) are some of the publications that we carry.",1,0,1,0,0,
c5af9d01-d60d-4f41-b7d8-a72770031874,1429578218,"I've heard of cane defense classes, but a real life Dare Devil!(sort of?) Awesome.

I need to show these videos to my mom, maybe it'll give her some motivation and inspiration to branch out her interests.",1,0,1,0,0,
7dfa93f1-b4ca-4f21-9908-d574d170abee,1429710954,"I wonder if they ever fixed the app?  It had some serious problems on IOS for a while, so I stopped using it, and then I moved to a city where it isn't available.  I haven't heard Twitter complaining with every update, so they must have.  ",1,0,1,0,0,
8752c851-3f7f-47ba-9232-ad821fe685c2,1429242937,Awesome feedback - thanks again for your time :-),1,0,1,0,0,
85485b69-c9ab-4f31-a8c1-4a14b6d62ce7,1428369720,Would you mind having a phone call with me in the near future?,1,0,1,0,0,
58071da6-869f-4389-9a4f-0e1412d38c7c,1430106201,"As for Facebook on desktop, many people use the Mobile site at http://m.facebook.com. It doesn't have all of the features of the regular site, but is often more efficient for quick posting of status and doing other common FB tasks. Yes, if you haven't bought Jaws yet, NVDA is a better option for the web and free. You can buy better-sounding voices if the built-in one sounds a bit harsh, or if you're on Windows 8, switch to the decently-sounding Microsoft voices. Those Nokias were good phones for their day and until the iPhone, one of the only accessible smartphones available.",2,0,2,0,0,
02ffe1fd-fcde-4414-87f8-5d9f34131c54,1429603734,:) Glad these vids are of some interest and help to people.,1,0,1,0,0,
785715d2-5557-43ec-a873-47078f038f24,1428887640,"I tried to explore valve and steam a while back.
I'm completely clueless in Windows. Even after asking some friends who do audio gaming in Windows. :'(",1,0,1,0,0,
5ddbf681-9c1c-471c-8471-18d0d18ce6be,1429710329,Interesting. Were can I find a mobility specialist? Do you mind asking how much you paid? I have been thinking of getting the cane at the very least to deflect some of the nasty looks I get when I trip over people but honestly not even sure where to get one.,1,0,1,0,0,
c9691d3e-23af-43e5-8704-67ac14abc496,1429707612,"Your symptoms sound almost identical to mine.  I have never had night vision and my peripheral has always been bad, but I really started to notice it about 8 months ago.  My solution was to talk with an orientation and mobility specialist. She recommended that I at least try a white cane and see how it worked.  I was not sure at first but it has really changed the way I live my life. I don't run into things or trip as much anymore, the people I do run into are far more understanding, and I am more confident. Now I refuse to leave the house without it and I carry a spare cane in my bag. The worst it can do is not help at all, in which case you can just stop using it, if it does work it will give you more mobility, confidence and independence.",1,0,1,0,0,
58071da6-869f-4389-9a4f-0e1412d38c7c,1430105229,"The Trekker Breeze has a subpar GPS chip in its current form. The refreshed model, the Breeze Plus, which is coming out soon will supposedly remedy this. That being said, you won't get better results using a Breeze vs. apps on your phone. I use a GPS often, and it's great to let me know what street I'm on or the names of upcoming streets or businesses. It's no replacement for good cane/dog skills however, and you'll still need to do a bit of guessing to find what you're looking for, especially at the end. Use GPS as a tool, but trust your instincts and judgment over what any phone or computer is telling you.",1,0,1,0,0,
7dfa93f1-b4ca-4f21-9908-d574d170abee,1429100047,"Last I heard, Netflix wasn't even available on Android for DRM reasons.  I don't own an Android though, so I wouldn't have heard if that changed.",1,0,1,0,0,
785715d2-5557-43ec-a873-47078f038f24,1429410551,"Yea. My m&amp;o guide first talked about him.
I've asked Tommy some stuff in twitter too.
And I'm really excited to have signed up for a conference where he'll be talking. Such a sunny attitude - better than pretty much any sighted people I know (uh... Kind of awkward. I was raised as sighted but now wish someone would had the brain to teach some basic o&amp;m etc skills as a kid. Not seeing something was the worst thing ever, and the thought of ever needing the cane would have mortified me. Oh well - at least now I have friends that have very different eye skills, so I donʻt have to feel awkward when I don't see).",1,0,1,0,0,
8752c851-3f7f-47ba-9232-ad821fe685c2,1429225283,"Thanks again, one thing I stumbled across was the Speak Your Word project, which basically promoted the use of dual format article/blog posts so there is an audio 'reading' for people to listen to.

From their twitter: ""Initiative to motivate bloggers for recording their articles into narration in order to offer the blind community the chance of information in a personal format""

Would something like that add value to your browsing experience?",1,0,1,0,0,
13c1bda3-c843-4de9-989d-6f9c02295ac1,1429898511,You might want to ask /r/legaladvice. ,1,0,1,0,0,
ffb3fe92-2bdb-462c-afed-c5aef99b5d8d,1429103796,"I have an iPhone five too. I'm able to search for a show, select the show, click witch episode I want to watch, fast forward, rewind, etc. The onlyt hing I can think of is that, correct me if I'm totally wrong, but perhaps you don't know all the commands of voiceover?",1,0,1,0,0,
5ddbf681-9c1c-471c-8471-18d0d18ce6be,1429861093,"I have noticed lately as my friends have started growing up (mostly 26 and getting real jobs) is that the whole party/bar thing is starting to die out. It's much easier to make plans to go out to (a usually well lit) restaurant then being super uncomfortable at a bar because you have no clue what's going on around you. 
I know I should find local support groups I have just avoided it because I guess that means it's really happening which I have pretty successfully ignored because it used to be only a nighttime thing.",1,0,1,0,0,
7dfa93f1-b4ca-4f21-9908-d574d170abee,1427981097,"Do you have some kind of mass-posting script or something?  I see AA updates on /r/MUD, mudconnect.com, mudbytes.net, audiogames.net, and a bunch of other places. It must take you forever! LOL.  Personally, I don't mind.  But I'm not a mod, so I dunno.  Maybe because this isn't a gaming community, you might want to just do more promotional posts here, with links to mush-z and other resources for blind folks who don't game, and didn't even know they could?  I run across people like that every time I meet new blind people.  ",1,0,1,0,0,
ffb3fe92-2bdb-462c-afed-c5aef99b5d8d,1429114635,"Wow that's really weird. I wonder, what version of IOS are you on.",1,0,1,0,0,
78299b14-9eb5-4375-93d1-632f4a017a87,1428861429,Fitting username if I've ever seen one...,3,0,3,0,0,
4d005ee4-b359-45a1-9ecf-9fd347430b85,1429293857,"I would recommend posting this on r/audiobooks, there is a lot more people that can probably help.  I have loaded audiobooks and podcasts for someone else before, but I dont know how often you would have to do it.",1,0,1,0,0,
5ddbf681-9c1c-471c-8471-18d0d18ce6be,1429487845,"I am also 25. I wasn't looking for any magic tricks just helpful advice that keeps you from walking into that pole you didn't see our dealing with the angry stranger who's feet you tripped over. I have an uncle with rpm but he lives in England and really only ever tells me how much easier it is to live there rather then the states, which is not exactly helpful. I two could use someone who knows what it's like and I can actually relate to.",1,0,1,0,0,
7dfa93f1-b4ca-4f21-9908-d574d170abee,1427986985,"I'm a Canadian, so I don't know. But there should be.  ",1,0,1,0,0,
785715d2-5557-43ec-a873-47078f038f24,1428197749,"Recently some accessibility buddies demoed http://describler.com/samples/
I don't remember if it was chrome or firefox they used, but it was interesting to learn how the data can be shown, told, acted with. 
I played with the same sample pictures with my voiceover and ipad in the same meeting. The data it read was different, but more to the point. 

Any links for me about learning quick about microsoft accessibility? I hear there's Narrator, but it'll probably take a while to get the hang of it...",1,0,1,0,0,
8f0eb11f-903f-4ebc-8933-c7d1088218fb,1430237498,"The hospital I attend the most is an old victorian hospital that has had loads of modern extensions built on to it, as a result it is a huge confusing labyrinthine mess even for the fully sighted.

I normally have to ask for a hospital porter to take me in a wheelchair (I do have walking problems too) otherwise it would take me forever to reach whatever dept. I'm going too.

While I do have some limited sight, I have a white cane - 9/10 times when my name is called in the waiting room, even after seeing me with my white cane the staff member will disappear up some corridor without waiting to see if I'm behind them.

Most hospitals I've been too is pretty much the same experience - confusing, disorientating.",2,0,2,0,0,
d42770b1-9f84-462c-9536-090461a2ff56,1429470839,"Do you mind me asking how old you are? I also have RP. I started noticing more gradual vision loss during the peak of puberty. Now 25, my peripheral vision seems worse than ever before. I strongly believe that there is a link between puberty and the gradual vision loss of RP. I haven't seen any studies between these two yet. To answer your question, you simply adapt. I know, you probably wanted to hear some magical advice but I don't have any. I personally avoid being around lots of people to avoid embarrassing myself. If you have any other questions or just want to relate with someone, please message me. I could use a friend that knows what I'm going through.",2,0,2,0,0,
8752c851-3f7f-47ba-9232-ad821fe685c2,1429189514,"Thanks very much for your detailed reply - appreciated!

Do you use a regular browser (like Chrome, FireFox etc) or do you sometimes use a text only browser like Lynx?",1,0,1,0,0,
