commentator_id,created_utc,anonymized_body,ups,downs,score,controversiality,gilded,distinguished
7dfa93f1-b4ca-4f21-9908-d574d170abee,1429237005,"Edit: The average human speaks at 150 words per minute, not 50 words per minute. I knew this, but my finger just didn't wanna hit that ""1"" key, apparently.

Personally, no.  I have my TTS set to well over 300 words per minute, and the average human speaks at 150 words per minute.  Sure, for fiction books and stories, I love audio readings by a real human, because they can dramatize the fiction in a way a computer never will.  But for the vast majority of the blog posts I read, a human reading would add no value.  I can honestly think of only 2 of the 20 or 30 blogs I read regularly that I'd enjoy having read to me. For the rest of them, I'd use my TTS even if I had the option of a human reader.  TTS is faster, and if the article has been well-organized (headings, etc), I can skip the uninteresting bits.  

Also, every single blog I read includes multiple images in the articles with no alt-text, or where the only thing in the alt-text is photo credits (stockphoto/Wavecraft Media is not valid alt-text, no matter that it passes all the tests, and fulfills your obligations to give photo credits).  I'm absolutely serious about this, without any exaggeration at all:, every single blog I read has photos with no alt-text or invalid alt-text.  So trying to get bloggers to read their articles out loud is just a tragic waste of resources, that could be better spent advocating about alt-text.  If you use an image, for anything, it needs a description.  Who cares if you take the 25 minutes required to record a reading of your article, if you flatly refuse to take the 45 seconds needed to describe an image you included.  ",2,0,2,0,0,
7dfa93f1-b4ca-4f21-9908-d574d170abee,1429151172,"From a development perspective, access on the mac would probably be the easiest to implement, seeing as OS X has a well-documented set of accessibility guidelines and APIs, and they make the screen reader, so it implements all of the APIs in the documented way.  On Windows, of course, there are multiple screen reading packages, and they all do things slightly differently.  While there are APIs on Windows like IAccessible2, support and implementations differ.  

As for your games, if you want to access them right now, and have access to Windows, a guide on how to do that is at:
http://forum.audiogames.net/viewtopic.php?id=13431

It requires that you use the NVDA screen reader, and have installed the OCR Extension for NVDA.  Basically, using steam involves trying to run OCR on the text in the steam Window, and clicking on likely looking bits of text.  In my experience, this breaks frequently, and I would, in the strongest possible terms, not recommend anyone who is blind purchase any Steam games; any update could, at any time, break this solution, and you will lose all of the money you've invested in games.  Also, it won't work on Mac, or with anything but NVDA, Firefox, and Windows.  But if you already have some steam games, maybe because you got them for free in a promotion, or because you purchased them before you lost your vision, you can still sort of access them for now, sometimes.  ",1,0,1,0,0,
43e90db6-c565-4e06-a206-88c66e20344c,1430420265,You're welcome. Any suggestions in how I might make this particular service better than the others?,1,0,1,0,0,
785715d2-5557-43ec-a873-47078f038f24,1429405588,"Heh. I get a lot eyecare and rx lenses ads too, esp in twitter.
(Was about to ask if that was Tommy in the video but d'oh... Took a while to fugure what to try to see on the screen so figured it out)",1,0,1,0,0,
ffb3fe92-2bdb-462c-afed-c5aef99b5d8d,1429634247,"Well if he is going to get a smart phone, I would highly recommend an iPhone. Apple is leaps ahead of any other phone when it comes to accessibility. As for as the tutorials, I'm not sure to be honest. Facebook, I don't use it anymore, but I'm pretty sure it's usable. Though I know for a fact it's usable on an iPhone. Hope this helped.",3,0,3,0,0,
785715d2-5557-43ec-a873-47078f038f24,1429150511,"Sigh... The joys of accessibility.
I did an audioboom trying to watch Daredevil earlier, 
https://audioboom.com/boos/3079661-watching-daredevil-on-netflix 
But I haven't watched the show further - it could be interesting but kind of made my point by getting past the beginning. ""I can't see!"" ... (Well... Go on...)
",1,0,1,0,0,
5ddbf681-9c1c-471c-8471-18d0d18ce6be,1429855367,it's interesting and a bit comforting to hear others say the same thing happened to them at about the same age. I guess I just thought I had more time (wishful thinking) but it's definitely encouraging to hear that your central vision is holding steady.,2,0,2,0,0,
7dfa93f1-b4ca-4f21-9908-d574d170abee,1429194899,"I use Firefox on my Windows 7 laptop, and Safari on mac.  

Most blind people don't use command line anymore, so I don't really know of anyone who still uses Lynx or any other text based browser.  These days, with sites like YouTube and SoundCloud, audio is a large enough part of the browsing experience that it wouldn't make sense.  ",2,0,2,0,0,
dd26bcea-5ac4-4228-acca-9ddf00bd2448,1429862806,"Are your friends supportive and understanding of it? 
Yeah I had been doing the same thing until this year when I realized I just can't afford to ignore anything anymore.",1,0,1,0,0,
c5af9d01-d60d-4f41-b7d8-a72770031874,1429647757,"oh wow you're the guy in the video, I didn't look at the posters name before commenting. lol you're so cool!",1,0,1,0,0,
ffb3fe92-2bdb-462c-afed-c5aef99b5d8d,1429278467,"Well, some of it is actually just software. On Windows, I use NVDA. Some prefer JAWS or Windows Eyes. On OSX, Voiceover is built in. The majority of blind people use iPhones, because Voiceover works really well compared to other competitors. As far as text to brail, yes it's called a braille display. I really don't use them, but I believe the simple ones you just plug in and the text will pop up on the device. ",1,0,1,0,0,
ab622f92-b1d9-407b-98be-e5ec8823e247,1430328139,"Yep, tremendously. The amount of blind or people with bad eyes that don't know braille has been increasing a lot over the years. 

This is also in no small part due to the merging of braille classrooms with regular ones, where it's much harder to find teachers who know braille to teach it. This was due to budget problems. ",2,0,2,0,0,
58071da6-869f-4389-9a4f-0e1412d38c7c,1430105703,"As you mentioned, the biggest barrier to more people getting braille displays is price. There are several groups working on this in various areas, but to this point, we haven't seen anything tangible. National Braille Press comes to mind as one organization that has been doing research on more affordable braille displays.
Some people have tried models where it displays a single character at a time, but I don't find these to offer the same level of flexibility. At minimum, a full line (40 cells or more) seems ideal, especially for programmers as one can feel the characters in relationship to each other and spot errors such as missing braces, etc. A good braille reader will use multiple fingers on both hands and can read at 200-300 words a minute or more. If you do a search on braille display research, you could probably track down some of what has been tried or that is currently being worked on. Current braille display tech is largely 20-30 years old and is very cost-prohibitive as you have likely noticed.",2,0,2,0,0,
f622c14c-3629-4064-bb7d-f5fc52e0ee2d,1429792580,"Argh, okay. Still figuring out the ropes. Thank you!",1,0,1,0,0,
dd26bcea-5ac4-4228-acca-9ddf00bd2448,1430224108,"At least you have them hey. Yeah I know what you mean, it gets really tiring explaining it, especially with what you can and cannot see. such a complicated illness. Are you able to work or anything and be okay? I went and had a visual field test, officially qualified as legally blind now which was pretty hard to hear. ",1,0,1,0,0,
785715d2-5557-43ec-a873-47078f038f24,1429743490,"Facebook is pretty easy to navigate blind - some practice and it works on iOS.
I use VoiceOver &amp; other vision accessibility settings.
Iʻve never used a Samsung, but Iʻd imagine they would also have some good accessibility settings",1,0,1,0,0,
ffb3fe92-2bdb-462c-afed-c5aef99b5d8d,1429634546,"It's actually much easier on mobile than on computer, facebook at least.",2,0,2,0,0,
c902455d-fb3d-4588-aead-790182a3c85d,1429815759,"This is good, the materials are free on the site. https://nfb.org/braille-transcribing",2,0,2,0,0,
65134dbb-cb2c-48e9-ae49-d82fe8da5a8c,1430420198,"Some meme sites include the caption as alt text. This can be weird though if you don't know what the image under the text is.

Thanks for exploring more accessible ways to implement meme images.",2,0,2,0,0,
785715d2-5557-43ec-a873-47078f038f24,1430228417,"Depends on a hospital.
And the person.

I have so bad memories from hospitals of a litime and especially last year that I rather die than go in any hospital, at least in USA.

Let's put it this way:
Hospitals and EMS fail in recognizing people who are blind or visually impaired.

ER doctors have talked to my husband to ask about my symptoms while I am lying on a hospital bed, and fully conscious. WTF?! Jusf because my eyes don't have the same type of funtional vision as yours, why do I need an interprete? Oh yea beacuse I don't see, right... 
So I don't know what hospitals I've been in because they don't always actually inform the patient. 

I also wish every medical staff would quit ever trying to do stroke diagnostics on me.
I have a non-24h circadian rhythm, what a surprise. I try to regulate my sleep/awake schedule. English being my third language I may form a bit odd sentences to a native speakersʻ shall we say, eyes?

I don't even know how I can find out in this country if I have been diagnozed with a seizure. Guess how fun that is...

Medical records belong to the corporation, not the patient. That depends on the state you live in. US is definitely the most stressful place for any medical needs of all the countries I've lived in on three different continents. 

It would probably be less stressful if I had been always completely blind.",4,0,4,0,0,
7dfa93f1-b4ca-4f21-9908-d574d170abee,1429640877,"Facebook on the computer has improved a lot, over the last year or so.  But it uses all the fancy new accessibility APIs, so if your version of JAWS is even 1 version out-of-date, Facebook is going to be a lot easier on Mobile.  Think of it like this: on a computer, you have a large screen, with lots of memory and CPU, so apps are designed to have multiple things happening, all at once: a scrolling activity feed on the side, chat messages and notifications popping up, an endlessly scrolling newsfeed, and all that just on the one page, not counting all of the other apps the computer is running.  On a phone, the screen, CPU, battery, data, and memory are limited enough, that most apps are designed to only do 1 or 2 things at once.  As a 27-year-old blind person who has been an extremely active computer user since age 9, even I find doing a lot of things on my phone much easier and less frustrating.  

If you do want to keep your grandfather on the desktop, I strongly recommend getting him using Firefox with NVDA (http://www.nvda-project.org).  NVDA is a free and open source screen reader, so he can have the latest and best, without having to pay several thousand dollars every 2 years.  Also, currently NVDA's support for web apps, when using Firefox, is the best by miles.  The key commands are similar enough to JAWS that he won't be totally lost, either.  Also, once you've gotten him on Firefox, you can give him AAdBlock.  For a blind person, this is the best thing.  First off, it blocks all of those animated ads and pop-up windows and spammy links with no relation to what we're trying to do.  This will make the screen reader faster, and his experience much better; as a blind person, it's sometimes not obvious where the ads end and the real website begins.  And if you know a little about web development yourself, if your grandfather finds something on a website difficult or confusing, you can use AdBlock to get rid of it for him, or GreaseMonkey and Stylish to modify it.  This is something only Firefox seems to allow, and in my opinion, is another reason why Firefox and NVDA leads the pack in accessibility.  ",1,0,1,0,0,
13c1bda3-c843-4de9-989d-6f9c02295ac1,1428674588,The Hadley School for the Blind's [Braille by Mail](http://www.hadley.edu/braillecourses.asp) courses seem to be widely praised as a good method for both professionals and people with vision disabilities. ,2,0,2,0,0,
52504393-6937-4413-94a9-c8a6498ce376,1430232822,"For my boyfriend, who is completely blind, it is pretty much impossible without assistance from a staff member. There may be Braille on the wayfinding signs, but most blind people don't know or use Braille.",3,0,3,0,0,
7dfa93f1-b4ca-4f21-9908-d574d170abee,1429112006,"I live in Canada.  However, with the help of a few other people who are slightly more clever than I am, I've narrowed the bugs down just a tad.  See, whenever I use my iPhone, I'm always, always using my stereo bluetooth headset.  But, here's the surprising part: If I turn off the headset, and just use my iPhone speaker, the crashes are vastly reduced.  I can use the video controls without crashing at all, and the Netflix app never crashes when I start video playback.  I did have it crash at launch once, but I just don't have the time to give it another 10 or 20 tries and see if it keeps happening.  I also still have huge lag when swiping through things like search results and recommendations, and if I swipe too quickly, the app will still crash.  But the lag and that one crash are the only bugs left after turning off my bluetooth headset.  So it seems like the bugs I'm experiencing have something to do with using Voiceover in Netflix while using a Bluetooth headset.  That...is oddly specific.  I haven't yet figured out if It's my model of headset, or all Bluetooth headsets, yet.  And I'm not sure I care enough to test.  

The moral of the story: if one person says an app is totally inaccessible, and another person says it's totally accessible, they can apparently both be right, at the same time.  ",1,0,1,0,0,
d85c1f05-6904-4488-9843-90a63d24c75f,1427987686,"Actually no, I don't have a mass posting script - I've got a list of places I normally post, and I go through them by hand to post at all of them when we have a major update.  I'm an actual person.  Thanks for the idea of promotional posts - I don't want to spam the board and run afoul of the mods either.

The blind people who don't know there are blind games are always surprising to me, and I thought this forum might be a way to find some of them.",1,0,1,0,0,
78299b14-9eb5-4375-93d1-632f4a017a87,1428861358,"I'm all for more accessible gaming, but I don't think a change.org petition is going to do much to influence a company like Valve.

To bring about a change in priorities at modern tech companies, you need motivated internal stakeholders to drive these kinds of efforts.  Either that or you can try to have an advocacy organization threaten them with lawsuits, but that causes more harm than good.",3,0,3,0,0,
1b75ffd0-3921-4d41-8fb5-25e58925a150,1430357576,"Thanks! I am try to read 3 and 4 letters from a, b, c and d. It is slow going. I want to use a stylus to convert the poems of Khalil Gibran to  Braille format. ",1,0,1,0,0,
785715d2-5557-43ec-a873-47078f038f24,1428889080,"I only have Macs, and iOS stuff.
I need to figure how to get a pc or use my husband's (also to use my book reader. So embarassing when I can't get it to work by myself and with the mac. :(
I've only used some windows screenreader once, to help a friend who used it, over 10 years ago, to type some phone numbers while on phone.",1,0,1,0,0,
785715d2-5557-43ec-a873-47078f038f24,1428891967,"Victor stream reader.
BARD mobile is really nice to use too. But I wanted something that makes a bolder statement. vut learni to concentrate and have long memory in pure audio with just numeric buttons is kind of frustrating and difficult right now. So sudden ""i'm too stupid to even properly blind"" frustrations in life. All lights hurt my eyes and screw  adly with my circadian rhythms. Sigh. 

I'll want to try NVDA. But firstI'll need to ask where my husband's old MS Surface is, and see if I can get it to work.
I won't mind going MS store to ask for sccessibility help. Because Win 8 is like visiting China - no clue where I'll be or how to click or what to swipe or how. Sigh...",1,0,1,0,0,
19fab5b7-e391-446a-8324-ba9474a41d38,1430332104,Thank you for getting back to me on this!!!,1,0,1,0,0,
ffb3fe92-2bdb-462c-afed-c5aef99b5d8d,1429634487,"I would just let them know in advance, and appear very independent and confident when you show up. They will probably forget about the fact that your blind if you look like you know what your doing.",2,0,2,0,0,
7dfa93f1-b4ca-4f21-9908-d574d170abee,1428888845,"If you are using the NVDA screen reader, with the Firefox browser, there is a multi-step process you can run, to get it sort of working.  Basically, it involves modifying how Steam prints text to the screen, turning off some security features, and then using an OCR program to scan the screen and try and recognize the letters.  And then it only works some of the time, for some of the people, on some of the computers.  And if Steam ever updates anything, ever, it'll all break.  ",2,0,2,0,0,
e6589cf3-620a-426a-ba12-f06313d35495,1429730423,"I would not recommend giving him the old Note phone. A note 3 or 4 would benefit him much, much more. The much older forms of Google's talk-back, kick-back, and sound-back are going to work yeah, but it's going to frustrate the hell out of him.
I'm using a Galaxy S 6 and no disrespect to apple users but being fully blind Google and Samsung aren't so 'light years' away any longer. I''m fully blind and I can vouch for the mobile facebook being tons better than screen reading on pc. It's simplier to use, which is the goal for accessability.
As for the jaws tutorials, well, weather it's an i-device, which by the way even the old ones are much more expensive, or some mid-range android device, the youtube app works for almost all platforms. I played with the search and there were tons on youtube, how to turn on, use, etc etc. 
If nothing else, you could always get a tablet to introduce him to mobility. A nexus 4 are relitively inexpensive, and still somewhat modern enough for learning and teaching.
I hope this helps.",1,0,1,0,0,
7dfa93f1-b4ca-4f21-9908-d574d170abee,1428889744,"NVDA is pretty easy to use, and the manual is complete and understandable.  It's also completely free, and you can get it at: http://www.nvda-project.org

Out of curiosity, what kind of book reader do you have?",2,0,2,0,0,
2fc8cf80-fed0-4d14-83a5-4d2d85d679d3,1429824526,I went through a similar progression. My field felt pretty normal until early 20's then dropped off quickly.  I'm in my 40's now and I've kept that core central vision of 8/9 degrees. At least so far. ,2,0,2,0,0,
