commentator_id,created_utc,anonymized_body,ups,downs,score,controversiality,gilded,distinguished
15a5c45f-9339-4bec-840d-0d3197a60fc9,1571098175,"Thank you. It feels very soothing to read your angry lines haha :). And believe me, I would love to sue them after this comment. The problem is I'm from Switzerland where disabled individuals have almost no legal protections. So it's frustrating in a two ways. When someone discriminates you it's already super frustrating but then you can't even do much about it. However, I have written an email to the management now. I told them I want a different stove/oven and I also told them the sexist/ableist remark was totally inappropriate. I haven't yet heard back from them but I hope that they will eventually give in if I get on their nerves for long enough. I'd even go as far as paying for the new devices myself because the current situation is really not working.

What depresses me the most, however, is the fact that the architect couldn't think of this. I mean, he's not some random office worker. He's a freaking architect who designs living spaces for people as a job. How can it not cross his mind that such a stove/oven would be a problem for a blind person? It's like designing a building without a ramp and without an elevator, not even thinking about the possibility that wheelchair-bound people might want to live there. Thinking about the different needs of your customers seems like such a basic thing. So, yes, I totally agree with you that it's very annoying how sighted people assume everyone's just like them and everything's a piece of cake.",,,1,0,0,
eb8f4705-112e-46d0-9387-858d2d936957,1572484197,"True, it can just about serve as a minimalistic screen reader, but the lack of decent speech synthesisers, features present in NVDA addons as well as lots of features already in voiceover in mac OS mean it really can’t be compared to any other screen reader on the market. I mean, it doesn’t even have a decent developer API, this is a multi billion company we’re talking about guys...",,,3,0,0,
3b7279ae-9e59-4303-9d83-084df137f2ec,1571797633,I live in California I was wondering who can I talk to about getting The bioptic product from,,,1,0,0,
051cd2b2-4917-4b00-8ea0-166635f2c263,1572316289,If you can find an organizations such as the national Federation of the blind in your local area and get her around other blind people I think that would help as well. I am an accessibility testing specialist for the United States Forest Service. What that basically means in English is I make sure that any electronic documents websites etc. are accessible using my screen reader. I agree with the other comments above that she needs to definitely get the technology training and other things that can help her be successful. And if her job is willing to pay for the technology than that is a definite plus.,,,1,0,0,
02b32c0b-23c4-4035-b73d-78ba34e79173,1570597538,"Thank you.

Thanks a lot for your Inputs. But we  are talking about 3rd world countries here.

The solution don't need to be part of Tech. any Basic thing which may help them is fine.",,,1,0,0,
ebb8b287-4953-44ac-89a5-fe95727793aa,1570701231,The color of the mug is actually something I overlooked somehow. I'll definitely remember to add that to my design specs. I might even go as far as to make it transparent. Thanks so much for the response!,,,1,0,0,
acebb3ce-5f28-4f21-9dfa-b89060a3ff7a,1570278634,"similarly, our cats go crazy for these little catnip-filled mice that we keep by the door. i just toss one up the stairs whenever im worried theyll try to head out with me.",,,1,0,0,
f00d5a5c-9ed8-4a04-945f-ca736b2405b7,1572437648,"Thank you for this post! Thank you for clarifying and helping. I have been struggling with this for a few months now, but decided to just behave like I would with any other person and so far me and my new friend who happens to be blind, is getting on like a house in fire. 

One thing that really put me at ease was him saying the word see in a sentence. He said 'I saw something this one time' and immediately that made me feel ok to say 'see' too. Silly I know... 

The only thing that is still a struggle is to know if I am bombarding him because, of course I initiate the conversations, as he doesn't know I'm around, but does he really feel like talking to me? I don't know, other than to start the conversation and taking it from there, which sometimes meant having conversations dying out awkwardly (he wasn't in the mood for one but was too nice to say but it became clear eventually) anyway will keep working on it!

Thank you again!",,,1,0,0,
e6efca1c-2804-4fd4-9960-97d80eda684e,1570984432,"I am sighted. I encountered one of these stoves recently and this was my first thought. 

Which country are you in KingWithoutClothes?",,,1,0,0,
5e44f979-3bdf-4599-b3bf-854222b01278,1572538471,"Thank you for the suggestions! I have tried the Austin Lighthouse, but I haven't been able to get any response to my calls or emails yet. I have not yet tried TSBVI, so I will reach out to them today.",,,1,0,0,
c7ec269e-2f4e-4993-95b4-585261b6b0b2,1572463437,"I don’t like when ppl ask if I listened to a film, I’m not offended if u say did u see it",,,1,0,0,
baab8422-7b2b-446e-9214-9437e3a2d2f3,1571684254,I am a mechanical engineering major with with a group of bio engineers on a creative design engineering course. Areas of expertise? School doesn't really give a concentration for us but I have experience from thermal system design in a solar field to engineering a beer brewery. Kind of have done everything,,,1,0,0,
9dd5807e-9153-4701-8a20-4c1602ebe180,1570929907,"I'm not blind my father is. I would think case's like this would be bittersweet. Yes they should accomodate for their disability.

But from what my dad has experienced businesses just won't hire him in the first place so they don't have to do any accomodations or any extra help training needed. Which is a shame because my dad is very smart and would really like to work.",,,1,0,0,
2efe43b8-00d8-435d-90fc-777f2fa15b86,1570496394,"That's awesome. If there's one thing I hear regularly about BeMyEyes, it's that the connection often sucks.

I wonder why they haven't manage to improve that yet.",,,3,0,0,
c577711c-dae4-49d8-82e5-9771bd511f4c,1571275107,"Yes. Its pre defined that way. Sorry, I corrected it now.",,,2,0,0,
36794900-0684-426b-af81-21a1ba279ec6,1571625867,"Last trip, she was mostly in the hotel room if we weren't at a appointment.  I thought it would be nice if I could find some things for her to do.",,,1,0,0,
dfe02ece-4389-4f67-a432-86548b8013da,1570510028,Oh yeah. The version of this thread over in r/programming is a shitshow.,,,4,0,0,
dae24872-49d0-47e0-8354-3c5674c5b623,1570859544,"Thank you. I will download and use it    I still encounter the situation that the camera of my mobile phone is not accurate, or I cannot obtain the information comprehensively, so I can only try little by little.",,,1,0,0,
2007f495-b5e7-448a-97d0-5254b7369ea6,1571806709,"Yes! You can even have an accomodation that states that all typed homework assignments will be turned in to the professor in a different font size and font family than the one the professor is requiring. 

Make them give you all material including textbook in PDF format as well. Then request Jaws from them as you will need it for Microsoft Office products, if they refuse to pay for it then ask them to point you in the direction of a state agency that can provide it to you free of charge, because you cannot afford it.

If you can, get the Voice Dream Reader app (I have a calculus book on mine), and the Voice Scanner app (I use my app to read handouts).

You can also request a note taker and/or a classroom scribe, and even record lectures. 

Ask them if they have a swell machine, if they do not, then there is a portable device that a scribe can use to draw graphs that allow you to feel them in 3D (I forget the name of it), see if they can order this device for you.

There is also talking graphing calculators that they should be able to order for you. 

Then request that all test be given on some type of CCTV such as the DaVinci. You can also request 2.5x on all exams or quizzes due to your visual impairment.

For online homework from Pearsons, you need to tell the professor that he can only assign the assignments that are accessible for screen readers. Here is the link that will explain how to do this, https://www.pearsonmylabandmastering.com/northamerica/mymathlab/accessibility/index.html

NVDA works best with google drive (such as google docs). Unlike Jaws, NVDA is free, however it is somewhat limited.

You state should have some type of blind organization that can advocate on your behalf with your school in case you run into issues with your disability office.

I have had really bad experiences at my main university in getting what I needed to succeed, so I started taking what classes I can at a community college that had a better disability office.",,,4,0,0,
c614e68c-7cd3-4217-b6fe-5ca96a4508cc,1570351879,"Do you/could you have some magnifiers handy? Maybe a lighted handheld? Or one of those sheet magnifiers that could be placed over the cash register? How about voc rehab/services for the blind in your state- oftentimes they will come out to the workplace and help with accommodations. If you need help tracking anything down, or want more suggestions, let me know!",,,6,0,0,
2a0b067b-0db8-4254-9f8b-809af8648f95,1571835584,"What is wrong with these people.  I am a blind woman, though I don't use a guide dog personally, I have friends that do.  Their dogs are treated like a life companion and are loved.  They have a symbiotic relationship that sighted people and this stupid activist clearly can't understand.",,,8,0,0,
c9d373fa-7974-4684-9364-d5ab97798465,1571835589,"Good suggestion, might just do that. Cheers",,,1,0,0,
b7006c23-de78-4703-8918-15b26a78db60,1571242187,"Thanks for your feedback, I've fixed that now!",,,2,0,0,
b79d2edf-64cd-45d4-baa3-4539a04a9195,1571074676,Hey this is a great news! I couldn't find anything online. I'll PM you right now! Thanksss,,,1,0,0,
b79d2edf-64cd-45d4-baa3-4539a04a9195,1571081205,"Yup! They do exactly this with fine art photos. I think that is the technique we might need to learn to accomplish, but we do not know if that's really the best way to transfer the information we have to the visually impaired community, as the photos we have are far from being fine art (meaning it's not about the photo, but about the **contents** of the photo). Hope this makes sense haha Thank you for your suggestion!",,,2,0,0,
76f00014-25da-4a90-b494-27256a15b412,1571343043,Training programs that use sleep shares cam be very helpful. I recently graduated from Colorado Center for the Blind and still use what I learned with the vision I have left.,,,2,0,0,
ec4b445d-4ed9-4b09-860f-a992f97f4d6a,1572294781,"Have you considered carbon fiber, it's more stiff but still lightweight and has no balance like fiber glass, at least the NFB styles.
￼ambutech makes a fiberglass model that is rigid like the graphite.￼￼￼￼￼￼￼",,,2,0,0,
487db26c-9681-4c54-bd7b-deba69c57cf4,1570574639,"Get the amazon alexa app. It has a bunch of skills, there version of apps. Many are fun games that are all through voice commands. Most sre free and will work on IOS",,,1,0,0,
815701da-4ebc-490a-a804-d701f864417c,1571694867,"Correct pronunciation and an accent that isn't too obnoxious (which is entirely subjective, I know). That's about it, really.",,,3,0,0,
8724f5ad-032e-4a92-9b11-f5f47ab2272a,1570835231,Will definitely keep that in mind. Doesn't it also only wor if screen curtain is off though?,,,1,0,0,
ed7e64de-ff0b-4ebd-8ba8-313d938e76ff,1570321964,"Audiowizards.
Lords and knights.
Dice world.
Godville. 
Iassociate 2. 
Lost cities.",,,1,0,0,
66c5cdeb-dd76-4bd2-bc38-5a4d7ab1c068,1570411521,"The more I work towards this, the more I’m falling in love with the private speciality schools. I’ve done three years now in the public schools as a sub, both “normal” children and SPED children. To put it bluntly, they’ll have to drag me out of my private school practicum placement kicking and screaming. 

Ultimately, I have plans to go for my EdD in SPED and/or PhD in psychology and teach full-time at the college level. I currently teach psychology online as an adjunct and the students are amazed that their professor is blind. I think that having a blind person teach future SPED teachers how to teach would be a wonderful thing for the profession.",,,2,0,0,
e19e2631-49f7-40d3-a39d-4caf5ba46cf1,1571447175,"I'm throwing this account away because I'm a reddit addict. Here's my channel, [https://www.youtube.com/channel/UClQ4MjSh2d9d2nCACkL3LWQ?view\_as=subscriber](https://www.youtube.com/channel/UClQ4MjSh2d9d2nCACkL3LWQ?view_as=subscriber)

if I don't upload an Audio Descriptive video within a week then I want to be banned from this subreddit. But if I do upload an Audio Descriptive video in time, please post it here.",,,1,0,0,
fce0b3cb-93f2-4e22-a789-68f0a23c1d5b,1571191792,"I once witnessed a woman in a wheelchair get hip-bounced/rolled out the way becaude she was looking at an item that another lady sans wheelchair wanted to look at. 

Idk but that lady would've real upset if I then came over and pushed her ass to the ground so I could look at that brand of cheese.",,,3,0,0,
fe508f81-8e4a-43d6-979b-cfe908dedff1,1572058986,"It’s very rare, but we have helped people with building against these criteria before. AAA should definitely be strived for, but it is rarely fully achieved. That’s not a good thing, but it is an accurate statement about the current make up of the web. If you have some specific questions, I would be happy to answer them. I think it’s absolutely amazing that you want to achieve this goal and the web needs way more people like you, as far as I’m concerned.",,,2,0,0,
0354a55d-2496-445c-8738-ea0d8cbe5b4a,1571637777,是的，我虽然能看到光，但这一点光明基本给不了我什么帮助。曾经的我过于依赖眼睛去看事物。但愿我能尽快适应这种改变的过程。,,,2,0,0,
4298aadd-ec8d-4b14-b0bf-c64c61061313,1571125113,"He uses metal utensils that have a foam grip. Honestly, the difficult part seems to be since its 'out of sight' he forgets to take more bites, so some of the issue is concentration but I feel like if it was easier  for him to see, maybe he would not 'forget' so much. When we lift the loaded spoon to his 'good' eye he will take the bite. He also seems to struggle with loading the spoon. He has gotten a little more independent since school started, so he is making progress. We would like to see him make some more, because independent eating has to make a person feel better and more empowered! We don't mind helping him, but we want him to be able to do more for himself- independence is so freeing for our students!",,,1,0,0,
d370c416-ccde-4564-90d3-0da5d22a9c66,1570697837,"Yeah, I'm gonna get some podcasts downloaded for both of us. Someone else recommended adventure zone so I'll definitely check it out, thanks!",,,1,0,0,
ebb8b287-4953-44ac-89a5-fe95727793aa,1570701991,"I really like the way you think! Tbh, it kinda sounds like I'm putting a car backup sensor on the top of the cup, lol. But I like that approach, I was just considering a single beep to indicate that the level has reached the top, but I like your idea a lot better. 

One approach I was thinking of was to put buttons on the handle of the mug, each corresponding with a different level of liquid (e.g. one-third, half, three-quarters, etc). You'd push whichever button you desire, pour the liquid into the mug, and the device would beep once it reached that level. Let me know what you think of this idea.

Thanks for the feedback, I got some really great ideas to consider!",,,1,0,0,
aac1a26f-1f46-4675-ab67-721683aec71e,1570793848,"My new obsession is Final Fantasy XIV. I struggle a bit, but it's still very enjoyable. Maxed out machinist, now working on summoner.  


Fallout 4 remains one of my main games. I still find new things every playthrough, and my settlement building improves with each iteration. VATS and a stealth sniper build helps a lot, and I have a mod that allows for a multi-spectrum eyepiece (regular, night vision, thermal, and targeting) to help me sort out what I am looking at.  


Diablo 3 can be a bit of  a struggle as well, but I tend to play the same build every season so I can rely on muscle memory a bit more.",,,2,0,0,
c9d373fa-7974-4684-9364-d5ab97798465,1569934624,"My three favourite games are, crafting kingdom, black box and a dark room ￼",,,2,0,0,
7ceaf0b3-06e3-4259-ad29-61062f3f25a1,1572015893,"No problem :) 

A few other things I remember, salads are his favorite thing at the moment so I make different ones, chinese chicken, grilled chicken, steak, he will even add rice to it to kind clump things together, hot dogs, steak sandwhiches, he also does alot of sandwhiches andnthe cool part is you can change things up and he wont get tired of it. 

He will almost always use a bowl because he can scrape the bottom and scoop up the last bites. He does spill drinks or drop things from time to time. We don't make a big deal because we get it but he worries everyone saw it to which I reply does it matter if you can't see them? Haha 

Just keep things light, he is still the same person just with different abilities sometimes we even joke about it. I remind my husband that everyone has different abilities and disabilities and we are there to help or direct him in the right direction. 

Please remind everyone to introduce themselves  and tell him if they are leaving the room or get up and let him know if they are leaving for good or whatnot. Thats my husbands biggest gripe. It gets lonely even around loved ones. Just listen and give support which looks like you are doing well there. 
Good job. :)",,,1,0,0,
bf5caaf8-41bd-41a5-9f5e-dd738c577b1c,1570369264,"Don't tell them you can't use your webcam for accessibility reasons? What else can't she do and so on may be the response.
Just do the interview and own it. You've come this far and proven your skills. Be confident and assertive and you'll do great.
Good luck and please let us know how it goes.",,,10,0,0,
8e7e76e0-3bf5-46c5-94dc-188b03bc4ec1,1570462860,"Yes, great point. Our website may be a nice place to start, and please feel free to reach out with any additional questions.

 [https://www.blind.msstate.edu/](https://www.blind.msstate.edu/)",,,1,0,0,
4f549d0a-5578-4ada-822c-c9a1fbb00df2,1572023298,"Hi. Maybe try some finger foods like sandwiches, pizza, and quesadillas. Be sure that they are not overloaded with filling or toppings that will easily fall off. What types of food does he like? Other commenters can provide finger food ideas based off of his preferences. Also, have you considered using separate dishes for different food items during a meal? This would allow him to have tactile boundaries of his food without it getting mixed around a plate. Another commenter suggested using bowls instead of plates to prevent food from falling onto the table.",,,1,0,0,
bd6c4d05-7da6-49b1-a0cf-6e3eb5a668ef,1570552279,very glad to see this.  This will have far reaching implications through the web.,,,2,0,0,
5bb87753-ae03-424b-a444-3d3cd6d2a884,1571246322,"Try this:
1. Press insert + j to open JAWS menu.
2. Open Utilities.
3. Open ""Sound Cards"".
4. Here probably ""Speakers"" is checked. If so, check ""Windows Default Sound Card"" instead.
Not sure if it will solve your problem. Just a suggestion.",,,5,0,0,
9e7a8c1e-92a1-4c52-bd36-1c8edd3b0eb1,1571416951,Get a guide dog. Those things are panty droppers.,,,10,0,0,
d618460b-cd40-4cd1-8f6b-4d7f926c724d,1571003482,"Hey girl, I totally get it. I was also born premature, blind in my left eye and my vision is 6/35 (distance) and at a minimum I can read 18 point font. I struggle with contrast . I have retinopathy and glaucoma. And it’s a struggle but I try not to give up. Technology is wonderful. I can read menus using my phones camera, I can navigate around uni by using the maps app on my phone. I’m confident I can work with the help of magnifiers. I use a cane and people are more nice than they are mean. 

But I totally get the anxiety. I can’t see at night so socialising is hard. I joined an anime club but stopped going because I couldn’t read the subtitles. As confident as I am, I’m scared I won’t be able to work. Or be able to raise my future kids properly because I won’t be able to drive them to school, or read to them. I get it. But I think we need to find solutions. Are there any pre-employment programs for people who are blind, visually impaired, or disabled near you? Is there orientation and mobility to help you get around? 

And you should totally begin blogging or writing a book! It would be awesome :)

Best of luck to you, Hailee! And if you need a friend, I’m always here :)",,,2,0,0,
fbbf1d41-f5bc-4597-ac50-65b9c3d7b071,1569976934,"Reach out to your state's Vocational Rehabilitation Services (all states should have some version, it is Federally mandated). They usually have specialty units for those who are blind or visually impaired (also Deaf, Hard of Hearing, Traumatic Brain Injury, and a few other focused sections). They should be able to assist you with identifying alternative resources. You can also reach out to the National Federation for the Blind which holds annual conventions.",,,1,0,0,
6f334990-8905-49ef-94f0-2b3b934bf8b6,1570761947,This sounds similar to Lazarillo. An app available now in the Apple Store. I’m an orientation and mobility specialist and I recommend it for many of my students. Worth checking out to see if it’s available in your country.,,,1,0,0,
16832c29-6bec-4d4b-b69b-5a14637fa12a,1570953901,Messaged u the link looking forward to see u there,,,2,0,0,
7ceaf0b3-06e3-4259-ad29-61062f3f25a1,1572008227,"Finger foods lile pizza, sandwhiches, soup with a spoon of course, tacos ect. 

My husband hates it as well so I have learned a few things. He likes salads in a bowl. I usually give him a bowl when I serve him food. I will toss the salad or cut up meats and he is ok to fork around and the food wont fall off the plate. I also male alot of stir fry and things that can be mixed and or smaller pieces. 

The clock method works for the most part. Once things get mixed around it can get confusing so I just make things that can be mixed together. 

I will ask more when he wakes up. :) 

I hope any of this helps!",,,1,0,0,
d5a7c0ae-5be9-4884-8f5d-f3a844f2096d,1571319832,"hello! it’s really great that you’re reaching out besides the language barriers. 

having to adjust to a new setting while blind is pretty intimidating— i moved to a big city when i started college and i initally stayed only on campus or in my dorm— i knew the city offered plenty to experience, but i was too scared. 

And that’s just moving to different cities! I can’t imagine what it must be like to move to a different country. 

For getting out more, I think it really is vital to experience public transportation with a trusted loved one. after using the bus/subway system here was my sister a couple times, and I felt confident enough to try it myself. but of course, if that’s too big if a step, simply go for a walk around the block— familiarize yourself with what restaurants/cafes are close by, find your favorite, go sit there often— it’s all up to you. 

Please, feel free to direct message me at any time. i would love to talk advice more specific to your case.",,,1,0,0,
bd6c4d05-7da6-49b1-a0cf-6e3eb5a668ef,1570553683,"It will be hard to get SCOTUS to keep hearing arguments.  They tend to just kick it down to lower courts once they make a decision.  

Anyways, i hope it sticks.

I just had a coworker try and argue with me it was bad to force companies to provide accessible options on their site.  People simply don't get it.

I can't even argue anymore I just want to smash idiots with a hammer.",,,2,0,0,
55dc9c22-3857-40ea-88b9-7bd5c9c1d5f8,1571000677,"Are you associated with any vocational rehab programs? Ours allows my husband to pick what he needs from a couple suppliers, maybe peruse their sites to see if there's anything? 

Maybe this would be handy?
https://www.maxiaids.com/dual-sound-liquid-level-indicator",,,1,0,0,
9f89afb9-646a-4f5d-a529-95e4947144fe,1572202924,I cite multiple studies that show that the majority in these three communities prefer this while many outside the community insist on calling us otherwise.,,,2,0,0,
e91c6966-e5f5-4437-92a2-ec51629dd35c,1571418856,"It ain't easy, but keep at it. Gotta weed through a lot of really ignorant folks and whatnot. I don't blame them, personally. I know I'm judgmental in my own ways. There are women out there who will be cool with it.",,,1,0,0,
4e5cd858-5ad4-4ea0-a85f-f1311eb3754d,1571163623,"As far as I could understand, I think it's just that it's a 'negative term'. It's not considered 'good' to have a blind spot, and so the argument, I think, is that the word ""blind"" is used...negatively? I could be wrong though. Like I said, I was a bit confused by it. But I've seen it a lot lately. There's been an effort to introduce the phrase ""dead angle"" instead of ""blind spot"" as well.",,,3,0,0,
a5034056-7ec9-4c86-91fd-96c53b23940d,1571522757,I FUCKING LOVE YOU THANK YOU SO MUCH HAVE A GREAT DAYY!!!!,,,27,0,0,
988a4610-1ad1-4716-9bd6-9aff07762504,1571954755,"I'm an editor, but yeah, I second everyone's recommendations to talk to a rehab specialist or someone from your local commission from the blind. The one hour I spent with a specialist (who taught me how to optimize my phone and laptop and showed me all the accessibility options) was incredibly helpful.",,,1,0,0,
51975ff6-993a-4c3a-96ba-72de75e81bf6,1569977898,"Hi there. Are you looking for Braille cards, or printed cards?",,,2,0,0,
