commentator_id,created_utc,anonymized_body,ups,downs,score,controversiality,gilded,distinguished
deebcb14-07c9-433d-b098-4199a087aa42,1571418212,"This is a good thread, please do upload your work.
P.S. I was moderating a conversation with a group of blind people, and we reviewed quite a few selections from Netflix. It got interesting when we played the explicit part of a movie; everyone started talking about the things that are not described. Everyone in the room agreed that descriptions of the characters are important; they wanted more descriptions on how they looked physically and what they were wearing.",,,1,0,0,
e931e18c-dc86-42e5-9c4e-c4646eba93d9,1571069688,Thank you. I really do think people need to be educated. Because there are 1.3 billion people that have eye confusions. I know a lot can be fixed with glasses and stuff. But it’s not an uncommon thing to be blind or VI,,,2,0,0,
e931e18c-dc86-42e5-9c4e-c4646eba93d9,1570914594,"Thank you. 

Well I still have really great friends that help me a lot. So I am very grateful for them. But they still can’t understand that I don’t want to order anything for myself. They will order for me, but each time I know they can’t understand why. And other things like that, that just make me feel worse about feeling the way I do.",,,1,0,0,
e931e18c-dc86-42e5-9c4e-c4646eba93d9,1570910966,That’s always a good thing to have :) But on Discord there are also text chat rooms if you don’t have a mic,,,2,0,0,
e931e18c-dc86-42e5-9c4e-c4646eba93d9,1570986057,True. I know that there are people out there who have it a lot worse. I try to think of that whenever I feel down. Thanks for the advice,,,2,0,0,
e931e18c-dc86-42e5-9c4e-c4646eba93d9,1570972498,Lol. That’s amazing. When I make blind jokes people look at me like I’m crazy. Little do they know I am :),,,2,0,0,
e931e18c-dc86-42e5-9c4e-c4646eba93d9,1570973098,"I try, but I don’t take my cane when I go. I find it is to difficult to work out and keep track of my cane",,,1,0,0,
e931e18c-dc86-42e5-9c4e-c4646eba93d9,1570973033,True. I’m just tired of always telling people. I have been doing it for over a decade,,,2,0,0,
e931e18c-dc86-42e5-9c4e-c4646eba93d9,1570907990,Lol maybe blind people have more nightmares because they are generally more stressed. Living life as a blind person is stressful :),,,1,0,0,
e931e18c-dc86-42e5-9c4e-c4646eba93d9,1570911427,"I myself can’t read brail and prefer to use an online menu. But when I go into a restraint they don’t know that. I have my ID cane with me, so I  am not given any kind of a menu  �� I am just left to help myself. 

I did get a Braille menu once. And sat there for 15 minutes pretending to read it because it was so sweet that someone brought me one :)",,,1,0,0,
e931e18c-dc86-42e5-9c4e-c4646eba93d9,1570906985,"I joined one today lol. Here is a link to join 

https://discord.gg/uF33ZrX",,,2,0,0,
e931e18c-dc86-42e5-9c4e-c4646eba93d9,1570972646,"True. It’s sad for me, because I explain, sounds like your wife does as well. But people don’t listen",,,1,0,0,
e931e18c-dc86-42e5-9c4e-c4646eba93d9,1570972801,"Ooooo free food. I haven’t gotten free food yet. 

But I can’t have a guide dog, because I currently have a dog that hates other dogs. Plus I don’t want to have people always coming and petting  my dog.",,,2,0,0,
e931e18c-dc86-42e5-9c4e-c4646eba93d9,1570976068,"Hi Hailee. This is a part of my story :)

I am a blind teen. I started losing vision when I was 9. My school at the time basically kicked me out. Then I home schooled for a few years. Went to an awful primary school. And found an amazing high school. 

But still I feel like I am always depending on other people to drive me around. I am worried about finding work.  

And I feel like to other people all I talk about is being blind. But it’s such a fundamental part of who I am, that I can’t not talk about it. Like when everyone talks about moving out of home and finding apartments while they study. I talk about finding a university near home so that my mom can help take me around.  

And I know the feeling of hiding how sad you are from others. I always felt that even though people try to understand, they just can’t. I needed to talk to other blind people. My people. Because it is a great thing to have someone to talk to that has gone through or is going through what you are. That’s why I love using Readit. 

As for wanting to see. I kinda don’t want to anymore. I know I would be a totally different person without being blind. And I think I have grown so much. I have learnt to always ask why someone does something, not just to judge them. And to think of others, because it is so rare that someone out of no where will think of helping me, or how something will affect me. With small things like going to the movies with friends, they don’t think that I need to sit in front and they will book seats right at the back. 

I too have wanted to write a book about being blind. And if you don’t feel like your life is worth anything, maybe you should start writing and maybe that’s where you are meant to be. And you can feel like you have a purpose",,,6,0,0,
e931e18c-dc86-42e5-9c4e-c4646eba93d9,1570972934,"That’s so sweet. I’m glad he was able to help you. He sounds like an amazing person.
 I think it might help me too, thank you :)",,,2,0,0,
3d05759c-e721-49af-a06a-2581f4d3c067,1570923722,"The main keyboard is slower, but Apple, not Google, have built in an onscreen braille keyboard, where one can type in braille on the phone's screen. For the blind people that do not know braille, there is handwriting mode. So, for those who are willing to learn to use it, input on an iPhone does not have to be slow.

For those Android users for some of whom, Google can do no wrong and typing is a labor of slow love to Google for them, /sarcasm, they won't want your product anyway because Android is perfect and is the fourth member of the Holy Trinity. /sarcasm lol.

For some, though, on either platform, it may be more quick to simply double tap on an edit field, and begin typing, with braille aiding tactilly finding the right key.

No, our phones most certainly should *not* get simpler!!! I have students who only can use their iPhones or iPads, because keyboard commands are hard for them to remember, and they need as *much* functionality out of the device as they can get. There are others who are simply used to using an iPad, and moving from that ... tactile, ironically, experience of feeling the screen to one of going through the more vague interface of the keyboard disorientates them and they spend more time tabbing for things than they could do simply with feeling around the screen.",,,1,0,0,
3d05759c-e721-49af-a06a-2581f4d3c067,1570922916,"How is Lazzorillo better than Blindsquare, or ... well, Soundscape relies on headphones, so maybe not...",,,1,0,0,
3d05759c-e721-49af-a06a-2581f4d3c067,1570924200,"Totally blind,, beat Dissidia Final Fantasy, original, using an emulator and OCR functions built into NVDA. Well, beat almost everything except inward chaos because dealing with equipment and accessories is hard even with OCR. Everyone should try it so I can have some online play going lol.",,,1,0,0,
3d05759c-e721-49af-a06a-2581f4d3c067,1570924460,Oof! I know a person that does that and typing is so slow for him that he just gives up on punctuation and just writes very long sentences with no punctuation just like this and I feel awful for him reading his Facebook posts about his feelings for his gf because it looks so unintelligent,,,2,0,0,
3d05759c-e721-49af-a06a-2581f4d3c067,1571193064,"I've not heard of the control usageassistant for NVDA. Besides that, this is one of the best comparisons.",,,1,0,0,
3d05759c-e721-49af-a06a-2581f4d3c067,1571193186,You'd get... swallowed up by JAWS... lol,,,2,0,0,
3d05759c-e721-49af-a06a-2581f4d3c067,1571192754,"seeingwithsound.com. Just about the only thing that may work, for those few willing to learn how it works.",,,2,0,0,
3d05759c-e721-49af-a06a-2581f4d3c067,1570923831,"You don't need to swipe to each letter, just memorize where the keys are and tap them. Also see the ""typing styles"" rotor item.",,,2,0,0,
b035ef99-7732-4e3e-bc1e-e944a8fa8ca5,1571414086,"Speaking from the other side as someone who married a blind woman. Dating was just like anyone else. The vision wasn't really an issue. We had known each for years. Her vision didn't start going until age 30. I knew her when she had perfect vision but didnt' date her until years later when her vision was getting really bad. The courtship process was exactly the same. There were a few changes. I had to pick her up since she's not driving anywhere. A standard movie date sucks for the blind partner so that's out. But beyond that, smooth sailing. As a bonus I get to tell her how handsome I am getting as time goes on. She can't verify that I'm lying.",,,6,0,0,
b035ef99-7732-4e3e-bc1e-e944a8fa8ca5,1571683721,"They usually announce at our local bus station which bus is approaching. Also, my wife just asks people around her. They tend to pretty helpful. She hasn't had any problems navigating our city's bus system.",,,1,0,0,
b035ef99-7732-4e3e-bc1e-e944a8fa8ca5,1570327387,Hey. I'm just calling it like it is for most people. Most of the general public doesn't have an experience with blind people. It's ok if you don't like my answer but I was trying to give sincere feedback.,,,3,0,0,
b035ef99-7732-4e3e-bc1e-e944a8fa8ca5,1571414147,"If that's your biggest fear, make sure that's the thing you throw out first. You'll weed out anyone to whom that might be an issue.",,,1,0,0,
b035ef99-7732-4e3e-bc1e-e944a8fa8ca5,1570749917,"It is sort of the stereotype. Oddly enough, all of the blind people in my circle wear glasses lots of the time and always have a cane.",,,2,0,0,
b035ef99-7732-4e3e-bc1e-e944a8fa8ca5,1570749833,"I think people can be too sensitive. They are children's story's characters or song characters.   It would probably be pretty cute. It's certainly less ""abelist"" than the classic blind referee/umpire, which I think is hilarious.",,,4,0,0,
b035ef99-7732-4e3e-bc1e-e944a8fa8ca5,1569895781,"It's a bumpy process.

My wife had a tutor who helped her. Her vision didn't go until her 30s. She spent some time learning the ABC's. We also would go to the library and check out braille books from the children's section. That's a basic start. I don't know about braille displays. I know this isn't that helpful, but it's what I can offer.",,,4,0,0,
b035ef99-7732-4e3e-bc1e-e944a8fa8ca5,1570317234,"Of course the questions are about your disability.  It's the first thing they see and are curious. You shouldn't think of it as judgemental but more of curiosity.  Answer the questions and let your personality shine through.  And although relationships are the same with blind people, it can be different to. Your blind partner is never driving to meet you somewhere, movies are less interesting for the visually impaired partner, etc. It's little things in the big scheme if your with the one you love, but these little things do matter and questions are the first part. Source: married a blind woman.",,,3,0,0,
7f930e74-ef8c-41b7-be57-b1ddae8cb8d0,1571229011,"I don't use it, and if I were you, I would wait to update. Thirteen is super buggy.",,,2,0,0,
7f930e74-ef8c-41b7-be57-b1ddae8cb8d0,1571266077,I use my phone too much to put up with that.,,,1,0,0,
7f930e74-ef8c-41b7-be57-b1ddae8cb8d0,1571179366,"I must be the only person who doesn't get touched all that offten. Maybe it is because I live in a small town, but I have been grabbed once in the last 8 years. I didn't even know people got touched and pushed around all that offten.",,,6,0,0,
7f930e74-ef8c-41b7-be57-b1ddae8cb8d0,1571179692,"I had a problem knowing when it was time to sleep when I was 2 or 3. This was right after I lost my light perception. My parents just put me on a sleep schedule, and sometimes if I stay up too late, I have to start back at square one. I don't know if this will work for you, but if I can keep myself on a normal sleep schedule, I never have any problems.",,,2,0,0,
7f930e74-ef8c-41b7-be57-b1ddae8cb8d0,1571262101,Just watch out because sometimes VoiceOver freezes when hanging up from a call. I haven't upgraded my Iphone because of that. My Ipad runs 13 though.,,,1,0,0,
7f930e74-ef8c-41b7-be57-b1ddae8cb8d0,1571180944,"I have a friend who uses crutches to walk, and he once got picked up and carried up some steps  without being asked first.",,,3,0,0,
7f930e74-ef8c-41b7-be57-b1ddae8cb8d0,1571191563,"The main thing I do is go to bed at a normal time and stay there until morning. Even if I can't sleep, I still stay there. After a day or two, I start sleeping all night. The hardest part is staying awake during the day.",,,2,0,0,
7f930e74-ef8c-41b7-be57-b1ddae8cb8d0,1570966145,"You're exactly right. My mom did this to her stove, and I thought it was a touch screen, but I looked at it after I posted last night, and her stove has bottons that are flat. I just use the labels to know where to push. A I don't know what I would do if her stove was an acctual touch screen.",,,3,0,0,
7f930e74-ef8c-41b7-be57-b1ddae8cb8d0,1571099048,"Find a different school. If the school is charging you $25000 for a dog, you should run away as fast as you can. Most schools are free, or they charge you like $150.",,,20,0,0,
7f930e74-ef8c-41b7-be57-b1ddae8cb8d0,1570937836,You could try having someone put braille labels on the parts of the screen that don't change. The only problem is that the label tape melts from the heat.,,,2,0,0,
0d45c2bd-c8d2-41fd-bbe9-97297fb7fa44,1572312130,You definitely wouldn't get that impression from this sub,,,2,0,0,
0d45c2bd-c8d2-41fd-bbe9-97297fb7fa44,1572136748,Graphite is significantly lighter. I didn't know anyone was still using aluminium canes,,,1,0,0,
0d45c2bd-c8d2-41fd-bbe9-97297fb7fa44,1571806519,Not very many of us around but we do exist :),,,3,0,0,
0d45c2bd-c8d2-41fd-bbe9-97297fb7fa44,1571807036,"I wouldn't bother with any of that smart cane stuff if I were you. It's a lot of expensive tech, including the battery, which will limit the lifespan of your cane. Besides, you're going to be banging that thing against walls and dragging it on sidewalks. It's not something worth spending hundreds of dollars on. Also the extra weight will put more strain on your wrists.",,,2,0,0,
0d45c2bd-c8d2-41fd-bbe9-97297fb7fa44,1570509167,Good. I'm glad they realized that Dominos' arguments were bullshit,,,2,0,0,
0d45c2bd-c8d2-41fd-bbe9-97297fb7fa44,1572532033,"I wouldn't go on anything less powerful than the pixel 3 a. That's rolling with the Snapdragon 670 which is an upper mid-range chip. TalkBack will run fine on weaker stuff but you won't have the best of times.

if you get a Samsung phone, use voice assistant to get to the play store so that you can install the Android accessibility suite. Samsung is a special snowflake that doesn't install it by default and uses their own crap screen reader instead. Android also doesn't have as smooth a setup experience as iOS. supposedly you can start TalkBack from setup with holding down both volume keys for 3 seconds but I've never gotten it to work. Maybe it only works on Pixel devices, not sure. There's an on-screen toggle for the screen reader under the vision settings menu on the very first screen. You can get a sighted person to turn it on if the hardware key combos don't work. if you need Braille then be sure to install Brailleback as well. I have no idea how well it works since I've never used it. Also I recommend gboard, if your phone doesn't ship with it by default. It's the Google keyboard and it supports rapid key input and has halfway decent speech recognition.

If you need help on using Android or some other app suggestions to make the experience a little better, like launchers, then let me know. I'm happy to help.",,,1,0,0,
0d45c2bd-c8d2-41fd-bbe9-97297fb7fa44,1570510131,"I mean, I guess you could make a bright white mug to contrast with tea and coffee. Maybe you could bundle it with one of those little buzzer things that goes off when it gets full.

Not a whole lot of innovation that can be packed into a ceramic cylinder tbh",,,1,0,0,
0d45c2bd-c8d2-41fd-bbe9-97297fb7fa44,1571808356,"Hey there. I'm the owner and former user of a NuEyes headset and I've also tried eSight. Both of them have their annoyances. eSight has a non-detachable remote that resembles something attached to a hospital bed but it has an HDMI input and a battery that will last a few hours. NuEyes is a lot more portable and comes with a nifty little bluetooth remote that you slip onto your thumb. Unfortunately headset battery life is about an hour at high brightness and maybe 2 if you keep it lower. eSight has larger, more color-accurate displays while NuEyes' are smaller, a bit greenish, and are in the topleft corner. This may be helpful if your peripheral vision is bettter than your foveal vision. The cameras on both are mediocre at best and suffer from the typical lag so you won't be doing anything that requires a quick response time on either of these. eSight claims they have a low-latency system but it was about the same as any other camera when I tried it.

Both get pretty hot during use and the weight will get uncomfortable. Since eSight offloads the battery and processing to the attached remote it's a little better than NuEyes but that non-detachable remote is a really hard sell. I found it not too difficult to just carry a small bag with me and hook up a battery bank to my NuEyes. It was kind of buggy though and eSight had a lot more features that made it feel a lot closer to ""wearable CCTV"" than NuEyes.

For me, the compactness and portability of NuEyes trumped the more robust feature set of eSight... also NuEyes was an authorized DOR vendor here in the states. Like hell I'm paying 6 grand for a camera I strap to my face. Oh yeah, the trackpad on the NuEyes broke twice on mine. I think it was sweat leaking in and messing it up. Very annoying.

Do keep in mind that I no longer use these since my vision's gotten too bad. They may have improved since then. I haven't touched my NuEyes in about 2 years. I should probably return them to the DOR before they fall off my table lol",,,1,0,0,
0d45c2bd-c8d2-41fd-bbe9-97297fb7fa44,1572476308,"I mean, I've written some stories with a txt editor I downloaded and a bluetooth keyboard. Android's not exactly great for productivity. I use it the same as anyone else: watching youtube, browsing Twitter, Reddit, email, maps, etc. Lots of cursing when an app isn't accessible. Nothing out of the ordinary.",,,2,0,0,
0d45c2bd-c8d2-41fd-bbe9-97297fb7fa44,1572451951,"We, or most of us I hope, aren't made of glass. I went to the mall with a cousin a few days ago and she did something similar. I corrected her about it and thankfully that was enough to set things straight but a lot of other people seem to constantly go on eggshells when talking about blindness  or disability in general.  Then there's the people that get offended for us. That's a whole different can of worms though.",,,1,0,0,
0d45c2bd-c8d2-41fd-bbe9-97297fb7fa44,1572488308,"Outlook for Android has a pretty good dark mode. If you're using a Samsung phone with Android pie or higher then the Samsung email app should have a dark mode as well which can be set through the system-wide dark mode. If you've got a phone running Android 10, like the pixel 4, then Gmail will default to dark mode if you set the system-wide dark mode


Alternatively you can try enabling the color inversion setting under accessibility in the settings app. This is system-wide. It's not as nice as what you would find on something like zoom text but if you can't find anything good then this should at least work. if you don't want the colors inverted all the time you can enable the accessibility shortcut and set it to toggle color inversion",,,3,0,0,
0d45c2bd-c8d2-41fd-bbe9-97297fb7fa44,1572532180,Give us more details or get the fuck out.,,,3,0,0,
0d45c2bd-c8d2-41fd-bbe9-97297fb7fa44,1572367691,In the US a cane needs to be mostly White. Beyond that the choice is up to you. Keep in mind that most people will recognize the red tape more easily than other colors though,,,1,0,0,
0d45c2bd-c8d2-41fd-bbe9-97297fb7fa44,1572367196,Mostly by coming up with more and more creative ways to tell them to fuck off,,,1,0,0,
0d45c2bd-c8d2-41fd-bbe9-97297fb7fa44,1572485093,"I get it. Really I do. As someone who's been in that rut of frustration I understand how aggravating it is to be denied access by unfair barriers to entry. Screen readers are expensive. Braille is either expensive or huge and expensive. Every major OS and even many Linux distros, all include their own screen readers but it's never the same as being able to look at a program with your eyes. Not even close. Not to mention the plethora of developers that make your screen reader useless by ignoring accessibility guidelines and conventions.

I understand that frustration. That anger how anyone else can pop into their local bigg box retailer and walk out with a $200 Chromebook and be up and running within minutes but you had to take weeks or possibly months memorizing keystroke after keystroke so you could use the screen reader. I get it doubly so because I used to be in the sighted camp. I know intimately how far the conventional interfaces and tech are ahead of their adaptive counterparts.

My first instinct was to rail against companies that profit off of this. Yes, it's unfair. Is it disgusting? That depends on your views. It's a product of capitalism, scarcity, and Human nature. We want to be compensated for the things we create because resources are finite and our effort and energy are also finite. As long as all of that continues to be true, which it will unless we start mining asteroids with automated robots or something, then we'll continue to expect compensation for the things we make.

We all have to pay for stuff, regardless if it's Mx. Consumer buying that $200 Chromebook or a blind user purchasing a screen reader. It's not wrong for people, or companies to charge money for what they make. I think that the high prices are wrong but that's a story for another time. I agree that a lot of this stuff is way too expensive, but here's the thing. Nobody's going to listen to you if you're just ranting. There's probably a myriad of things that could be done to help bring down the cost of adaptive tech, a lot of them involving subsidies in place of major institutions shouldering the high cost and making it available to its members. It's an uphill battle that no one person could ever hope to accomplish. Trouble is, ranting is even less productive than accepting the status quo. We know. We know this stuff is expensive. We know only schools and governments can afford it. Posting up a rant about it might make some people feel good or whatever but it's probably just going to piss the rest of us off and it won't help you or anyone else.

Am I happy with the status quo? No. Absolutely not. It's bullshit. I can buy a 4K gaming monitor for less money than the cheapest Braille display. I bought a laptop, flagship smartphone, two bluetooth keyboards, and 3 pairs of bluetooth headphones and even a custom core i7 desktop for less than what some Braille notetakers cost. Sadly this is the way things are.

What you do about is up to you. Personally I've gone down the road of adapting and making do with what's available. A high-end Android phone with a bluetooth keyboard and some headphones along with a Laptop with NVDA suits my portable computing and content creation and consumption needs well enough. When I need the expensive stuff I turn to government agencies to sponsor it for me. Perhaps you would rather try another way like campaigning to reduce the cost for the end user somehow. Does that sound corny? Probably, but not as bad as posting an angry rant about it on a tiny part of a website that gets sporadic mainstream attention at most. People here and in other online VI communities are often happy to help and provide solutions to problems where you can't have the expensive stuff. Again, posting an angry rant isn't the way to do it.

TL;DR Almost anything you do is better than sitting around and being mad about it..",,,9,0,0,
e9982704-f343-4dd5-bf68-96ead90abc38,1571175261,I love Logic Puzzles. I can’t do anything more than the basic ones in my head though. I know the grid you are talking about. Can you have someone convert the grid to Braille?  Can you make the grid itself embossed so it can be felt?,,,1,0,0,
e9982704-f343-4dd5-bf68-96ead90abc38,1571940262,"Does she already have accommodations at work?  If she does and still can’t keep up, then she might have to find another position in the company or change careers. Some times things like this open doors to other opportunities.",,,1,0,0,
e9982704-f343-4dd5-bf68-96ead90abc38,1571462777,That’s how I used to do it. But it doesn’t work anymore since my phone updated.,,,3,0,0,
e9982704-f343-4dd5-bf68-96ead90abc38,1571464117,Yes!  She was able to fix it for me. Thank you so very much for your help.,,,3,0,0,
e9982704-f343-4dd5-bf68-96ead90abc38,1571549701,The triple click wasn’t working. That is why I asked for help.,,,1,0,0,
e9982704-f343-4dd5-bf68-96ead90abc38,1571946276,I have things like a magnified computer screen and large print forms at my job. She needs to tell them what she needs. Most employers are happy to help if it won’t cost them too much money.,,,2,0,0,
e9982704-f343-4dd5-bf68-96ead90abc38,1571705191,I got mine from Amazon. $19. Very dark and if I break them I don’t feel bad about it.,,,1,0,0,
e9982704-f343-4dd5-bf68-96ead90abc38,1571463277,My daughter looked at it. She says it gives you the choice of “classic invert” and “magnifier”. The voice over option is no longer there.,,,1,0,0,
