commentator_id,created_utc,anonymized_body,ups,downs,score,controversiality,gilded,distinguished
4a07a13d-9b94-49eb-ac29-8ae7857d0a5f,1571241444,"Yes, the site will have the option to turn the voice commands off! It will be an internal website (only for students of an organization of my university, since it's a project for one of my teachers, so I guess nobody will have a screen reader when navigating the website, but that was a good thing to take note of, thanks! 

Could you provide me with the name of the screen reader you use? And maybe what feature do you like more about form filling and what are some they are missing?",,,1,0,0,
1d9dd1c8-62f6-40b2-b741-4ea90444b808,1570379104,"All I can say as someone who's on the other side of the interview often enough is that finding someone half decent who is also happens to be disabled would make HR very happy and get me extra brownie points. No-one like surprises so if you're getting a positive vibe off the company, I'd discuss it with them in advance. Either way, if you're relaxed, positive and get on well with the higher-ups they'll just go with whatever their underlings recommend.",,,3,0,0,
58071da6-869f-4389-9a4f-0e1412d38c7c,1571681318,It seems that more blind people prefer that term while educators try to shove person first down our throats.,,,3,0,0,
96facf60-c102-417c-82ed-a3a672db2f47,1570567540,"Looking at a screen myself, I often touch it inaccurately I guess that's what I was getting at. Basically if using a slab of glass do your fingers get disoriented I guess. Would I be right in saying that using that mode is impractical to use while standing/walking , or have you developed some ninja skills? Haha

Yeah I don't know how people can tolerate voice over, even the voice gives me a headache. I guess what I'll be working on with my buddies in the group will be an extremely cheap way of bridging both the braille screen mode and voiceover (without the voice)",,,1,0,0,
a779d46b-f05e-4441-83a8-2da6ae9bd8ef,1571352019,"If you have netflix, play any episode of a Netflix original and put the audio description track on. You should get a good idea how it should sound like and how much needs to be described.",,,3,0,0,
15a5c45f-9339-4bec-840d-0d3197a60fc9,1571099024,"Unfortunately there is zero audio output. No beeps, nothing. As you can imagine, this makes the situation much more difficult. Also, the red blinking numbers are really small... like maybe 8 millimeters (a third of an inch). For my amount of vision, this is impossible. And since my medical prognosis is bad, I also need to plan for a future where I won't see anything.

I have written an email to the management though, telling them I won't accept these devices. I hope they will eventually give in if I get on their nerves for long enough. For now, I haven't yet heard back from them.

If we're gonna go with a touchscreen stove and oven, I would need devices with AI that work like Siri or Alexa but better. Basically devices that understand you when you talk to them and then do it for you. I don't know if this even exists though. Anyway, thank you for your post.",,,1,0,0,
02b32c0b-23c4-4035-b73d-78ba34e79173,1570597298,"I'm closely working with a State government. 

Such laws required Federal / Central government to make changes. :)",,,1,0,0,
798c7bdd-0649-4102-b0c4-d05893026d0c,1571217806,"I'm in Ireland so only really have NCBI and this doctor doesn't seem willing to give up letters because of the whole 'you're not that bad'. He even said I could drive, which I thought was a terrible idea, and when NCBI did some vision tests with me they said I shouldn't drive and I was pretty responsible using my own judgement on that one rather than the doctor's.",,,4,0,0,
7c1b0070-faa7-40da-a73d-c04cf8a0a04b,1570187514,"You are in an interesting situation Sir. My best advice is to have your instructor spend a little one-on-one time with you before or after class do to a blind mirror mold. Mirror molding is usually done by looking in the mirror to make sure you are in the right position, and then repeating the move until you have muscle memory. Since you can't do this, I recommend the instructor put you into the ideal position for a technique, such as knife hand guarding block for example. You will need to hold it still for a long time, either from an L-stand or Junbi, and then attempt to execute the exact same block again without moving anywhere including intermediate hand positions. The instructor could then reposition you back into the correct position. After a number of times, you will start to build the muscle memory by feeling rather than by sight. Just an idea. Best of luck, I hope you keep going!! Taekwon!",,,2,0,0,
1dfb61e0-cede-40fa-972a-cb0fd92c7f4c,1571056694,"That is an amazing analogy, and a huge relief to boot.


Thank you greatly!",,,2,0,0,
5363cfb7-5f5c-4237-8010-445a149ec10e,1572438731,"I went blind due to bad luck, at least that’s what my doctor told me.
I lost lost my left eye to a detached retina, normally a quick fix but the only medical coverage I had at the time was the VA, they put me on a 6month wait list and by the time I got scene it was so far gone they refused to operate.
That was almost 9 years ago.

About 4 years ago I started having issues with my right eye, they found that I had glaucoma in that eye and the pressure was extremely high. By the time they got it under control I had lost roughly 80% field of vision. 

Back in May of this year, They found cataracts in both eyes, but due to some complications from previous surgery’s they have been hesitant to operate.

The bad luck of it all is the first two types of vision loss were neither genetic or from any sort of trauma. They just randomly happened and each one is exclusively in its respected eye. They don’t know why,.

If I had my vision back for a day I would probably just drive around. I miss the freedom of being able  to drive, maybe to watch a movie in theaters so I can see the whole picture again.",,,3,0,0,
86f8bdcb-7a43-455d-a544-36c755f4cd10,1570018291,"Thanks! Right now, I'm relying on other people to guide me in the dark, but it can be frustrating.  I like to be independent and I am a bit paranoid about falling.  Similarly to your partner, I've missed steps and sprained my ankle, etc.",,,1,0,0,
8b1173a2-8b67-405c-bcc2-08d744f781c2,1570459197,Just because they don’t do stem call research does not mean that the research they are doing is not legitimate or valid. This group is made up of some awesome advocates for Mississippi residents with low vision and blindness. Please keep in mind that not all research need be medically related either.,,,3,0,0,
4a07a13d-9b94-49eb-ac29-8ae7857d0a5f,1571322327,"I'll keep that in mind, didn't consider to go up to 700 words per minute but now I will!

I'm using NVDA now to see what is needed and I've learned that it makes a different sound when you focus on an input and so on, which I found really helpful. Also, would you say that typing is better than saying the word you want to put in the input field? I'm implementing it but sometimes the software recognized the wrong words, I dont't know how frustating it will be... Maybe I'll just leave voice controls for navigation",,,1,0,0,
b7006c23-de78-4703-8918-15b26a78db60,1571325003,Thanks a lot for the feedback! Really appreciate it. Will have a look at the survey again to see how I can make it clearer using your suggestions.,,,1,0,0,
9f89afb9-646a-4f5d-a529-95e4947144fe,1571413476,"Among the deaf and autistic, it's like 80-20, so pretty clear majority preference.",,,2,0,0,
99ef56d6-d06b-4065-a267-a06e972cdd4c,1571752074,Thanks for the clarity. I appreciate the response. Is there any literature on the conference itself and what people think or why it’s important? Or is there no such research data?,,,1,0,0,
66e0ff63-7fa8-4b64-9b42-bd0668002ed7,1570819815,"Legally blind and ~5% visual field left. Can play the good old CS 1.6 (familiar maps) and I do okay. Footsteps! I can locate enemies quite accurately in familiar maps by sound. Also, I have the Vive Pro VR headset and I can play Beat Saber quite well, although I need to partly memorize the songs. Then there's the VR equivalent of CS that is Pavlov VR. Again, familiar maps and sounds (and practice), and I'm usually in the top three. Skyrim, Diablo 2 LoD, 8 and 16 bit nintendo games.
So yeah, I play, but every now and then I feel bad knowing I'd be so much better if I wasn't almost blind.",,,2,0,0,
1de3349f-2645-4913-8833-1ce273f3895d,1572384609,I think [Dancing Dots](https://www.dancingdots.com/main/index.htm) is a good option. Can't speak from experience - only from what I've heard.,,,3,0,0,
4a07a13d-9b94-49eb-ac29-8ae7857d0a5f,1571264884,"thanks! would you say that this is enough? I can do this now, otherwise I would have to see another way of implementing 

* 1.0 is normal speed
* 0.5 is half speed (slower)
* 2.0 is double speed (faster)",,,1,0,0,
9e7a8c1e-92a1-4c52-bd36-1c8edd3b0eb1,1570489519,"The name of the game with coffee is contrast. Try to put black coffee in a white cup, not a black one.",,,2,0,0,
2ec20cf3-7dcf-4476-947d-2e1f18312c16,1570495723,I just want to say that I find people in that profession to be some of the most wonderful people I’ve ever met in my life! Keep doing what you do and providing support to those who need it. You rock!,,,2,0,0,
16832c29-6bec-4d4b-b69b-5a14637fa12a,1570953738,"Hi welcome to premature club lol 
I am almost same as you 
If u want more people like u to talk to or even talk to me I'll message u link to our discord channel where there are many like us it's great fun trust me",,,6,0,0,
68ad6cb0-5626-4540-b877-8c64e755f7fc,1572166094,Any reccomendations for most accessible with a screen reader? I know I did fine 20 years ago with C++ as long as I stayed clear of graphical stuff but that seems like lifetimes ago.,,,3,0,0,
9ad96c70-c7c4-45d7-9889-a42053d09f9b,1569936126,"I'm having a blast playing Bitlife when I have some time to waste.

It's very accessible imo, appart from some of the minigames you can encounter. It was pretty hard to get out of prison, and committing burglary when I tried them last time, and the new iq test didn't work well, but otherwise voice over read the buttons and labels.",,,2,0,0,
f2f00988-b8ae-41a9-acb8-f950399e504d,1569942022,"I learned Braille as a kid, and for the longest time afterwards decided I wasn’t really likely to use it, because speech was so much nicer and so forth. I am changing that view now, though, because I had an organization pay for a display for me,￼ no questions asked. I definitely want to see more of it in general, because I have come to appreciate the aesthetics of being able to actually feel the text, particularly as I am trying to learn foreign languages, which is a bit of a bumpy road with just speech. ￼￼
As for where, restaurant menus are obvious, but I also do want to see more braille books, because it would be nice to have the same kind of experience as sighted people, basically. I know there is no particular reason I can’t use electronic versions, and I do, but it just isn’t the same. :-)￼￼
Also, as a final note, you can’t read to friends and loved ones using audiobooks, or electronica ones. :-) I’ve come to appreciate Braille for that reason alone lately.￼￼",,,1,0,0,
b7006c23-de78-4703-8918-15b26a78db60,1571242282,"Haha yeah, I put that in because one of my lecturers suggested it. It's a pretty dim idea too in my opinion. Also survey monkey was suggested by an organisation I was sending my survey to.

Also, many thanks for your participation and feedback. Really appreciate it",,,1,0,0,
36794900-0684-426b-af81-21a1ba279ec6,1571604917,"We live in Alaska.  The next trip down will be first week of December, dunno dates yet.

I believe she can read braille, but reading anything written requires a LOT of light.  We will be working on getting her setup with VoiceOver soon.

I wanted to ask the community that would have a better idea than I would, as my vision is quite functional.",,,1,0,0,
8b1173a2-8b67-405c-bcc2-08d744f781c2,1570485756,I would double check with your school or proctor. But at our school we allow students to utilize accommodations as needed. So some switch back and forth between using the accommodations and not using them.,,,1,0,0,
2efe43b8-00d8-435d-90fc-777f2fa15b86,1570497133,"I don't use braille menus at all. When I go to a restaurant, I just look at the menu on my phone.
I've never seen a braille menu that was actually up to date, and looking at it on their website is so much easier anyway.

There have been a few instances where the menu isn't accessible. If that's the case, I just get something super basic. I don't like having people read me the menus.",,,1,0,0,
0fb3b6b7-6bcf-4436-8e13-eb3de7b98756,1572052014,"Mine is aluminum.  I’Ve never tried a graphite one, is it much heavier? Thanks!",,,3,0,0,
40e6f6da-b1f2-47f3-978b-4d8dc0674985,1570237418,Ukulele Grandmas would make a hot band name.,,,1,0,0,
8cb9a862-14c2-40d4-b9b2-9b00f0330bf2,1572486128,"I don't have the time nor the energy to comment on this post, but the only thing I have to say is, start doing some advocacy rather than posting on reddit. Make it so these companies don't have to milk us dry. Hint Hint. Aira has a business model I wish all would adopt. Make the big companies and businesses pay for our free minutes and usage.",,,2,0,0,
4df35708-80b2-4ce2-91a5-950980c9d0bc,1570934264,"I know what you mean. Both my central and peripheral are pretty shot but central is much worse, so I get especially nervous when it comes to eye contact. I think for me what helped was addressing the elephant in the room and moving on--making some kind of blind joke and then redirecting the conversation to something we have in common. I think sighted people are most self-consciosu about the blindness in the first few seconds of conversation, and after that it's somewhat easier to get them to calm down and see past it.",,,2,0,0,
ce2b18e5-89e9-4b67-bc8e-076f3e0707f8,1570935513,"Oh, how offensive! I am surprised that the manager and the architect actually showed you what little respect they did. Just reading this post makes me shake my head and wonder how sighted people think blind people live. The half joke regarding your wife is so incredibly sexist, I’m surprise you’re not filing a lawsuit against the both of them for their behavior. So inappropriate, it’s not funny. As for the touchscreen stove, the closest I have come to that experience is at a former friends house. The landlord renovated all the apartments and installed new stoves with glass cooking services and touch controls. I pointed out to my former friend that this would be an issue if I was staying over at their place, and they were not available to assist me. Well, since they are now a former friend, this is no longer an issue. I hate when sighted people automatically assume that blind people have an easy time of picking up new information as quickly as a sighted person does. We know this is not the case, at least not always. One lesson I have learned from imperfect interactions with sighted people is this, record everything! A simple audio recording goes a long way to straighten out a misunderstanding, especially when it involves crude sexist remarks like the one directed toward you regarding your wife.",,,3,0,0,
223afb33-7b9e-4774-8553-4c3e8fffe6be,1570859220,Those are pretty cool too. I played a link between worlds for the 3DS and it's my favorite 2d Zelda,,,2,0,0,
ca1901de-f2fb-40d3-a4aa-2cf6ffc781a5,1571716957,"Good audio production. People who can read clearly and maintain consistency with their characters. My favorites are Simon Vance, John Lee, Victor Bevine and Scott Brick.",,,1,0,0,
fba9d004-b11d-4d83-9e5a-8878afd66b44,1571217202,"I'm blind in one eye but have normal vision in the other. In dreams, I somehow never have problems I encounter in daily life. In my dreams there's never someone out of my field of vision who's assuming I can see them and my depth perception is always perfect.",,,4,0,0,
66c5cdeb-dd76-4bd2-bc38-5a4d7ab1c068,1571003516,"I’m currently an online assistant professor of psychology and I’m about to start a second online teaching position teaching the more philosophical/fringe areas of psychology (near death experiences, parapsychology, etc.). I’m also finishing up my M.Ed. in special education and will be teaching English at a private school for kids with psychiatric disabilities. With that being said, I have plans to get my PsyD and/or EdD and LPC and work online 100% of the time in academia.",,,2,0,0,
d5c6fa13-7d72-41f4-b3d2-86b594232391,1572292073,"Tbh, it's tricky enough when you can see what you're doing.",,,7,0,0,
d370c416-ccde-4564-90d3-0da5d22a9c66,1570648676,"That's brilliant, I was talking about podcasts for my mum to listen to as well so I'll get ahold of adventure zone for both of us. 
I'm gonna keep it a little loose because I'm more concerned with keeping things flowing in her imagination, so that's good advice about the spacing, I'll definitely use that. Thank you!",,,2,0,0,
cb03aadb-604e-48ac-9fd6-637204136ff1,1571175583,"I havent heard about this, ill look into it, thanks",,,2,0,0,
f9f54438-f5c9-44db-bfb1-2937dd5d89a7,1571955540,"Vocational rehab can help with accommodations and retraining.  Legal blindness meets a disability listing for Social Security benefits.  I say that because if she is approved for benefits, she can use the a Ticket to Work program to help with retraining.",,,1,0,0,
ee9a9dc1-87c7-4ef6-9534-5e24edcd2927,1571101670,Most schools charge little to no money.  Are you being scammed?,,,5,0,0,
864e5252-8012-4e15-9bfd-43f432d36270,1570669287,"You might also check out some D&amp;D podcasts like the adventure zone. They typically don't use visuals, since its am audio-only medium",,,2,0,0,
dccf23a0-3757-4007-80bd-814c59205640,1570768414,I am blind and have blind friends I've always wanted to go as the 3 blind mice because I think it would be hilarious,,,3,0,0,
d618460b-cd40-4cd1-8f6b-4d7f926c724d,1571902179,I hope this doesn’t become a thing here in Australia.,,,3,0,0,
b7006c23-de78-4703-8918-15b26a78db60,1571325195,Good point! Thanks Bradley. I'll make sure I add it to the survey,,,1,0,0,
9ad96c70-c7c4-45d7-9889-a42053d09f9b,1569954720,"It's better than nothing I guess. I will have to get my hands on a Bluetooth keyboard at some point.

Thanks for the info.",,,1,0,0,
b4383321-0712-4297-b536-73c48f445f63,1571159836,"I am no blind not work as a social worker with blind and vision impaired people in a long term care setting. One of my clients can’t access her email because the navigation tools intended for her use don’t translate deeply enough into the email program (a third party site purchased for accreditation for the school that seems to have wrap around service for sighted users). My client can “see” that she has an email, but cannot navigate into the content itself and thus can’t read it. 

This issue pervades many of the schools sites. So when testing, make sure you can navigate everywhere! No table or headings make things difficult!",,,1,0,0,
d5a7c0ae-5be9-4884-8f5d-f3a844f2096d,1570818975,thanks! tried this in my walks to classes and it helped a bit. i'm sure with more practice it will come more naturally. greatly appreciated!,,,1,0,0,
4b6c3a08-e067-44c9-8db4-f29168aed75a,1570489270,"A summary from Jack McElaney at Accessibility in the News

**KEY POINTS**

 The Supreme Court denied a petition from pizza giant Domino’s on Monday to hear whether its website is required to be accessible to the disabled, leaving in place a lower court decision against the company.

The case was originally brought by a blind man named Guillermo Robles, who sued the pizza chain after he was unable to order food on Domino’s website and mobile app despite using screen-reading software.

The decision not to grant the case is a loss for the company and a win for disability advocates, who have argued that, if businesses do not have to maintain accessible sites, disabled people could be effectively shut out of substantial portions of the economy. 

* The Supreme Court denied a petition from pizza giant Domino’s on Monday to hear whether its website is required to be accessible to the disabled,      leaving in place a lower court decision against the company.
* The decision not to grant the case is a loss for the company and a win for disability advocates, who have argued that, if businesses do not have to maintain accessible sites, disabled people could be effectively shut out of substantial portions of the economy.
* The case was originally brought by a blind man named Guillermo Robles, who sued the pizza chain after he was unable to order food on Domino’s website and mobile app despite using screen-reading software.
* The decision from the justices was announced in an [order](https://www.supremecourt.gov/orders/courtorders/100719zor_m648.pdf).
* **Read more:** [A blind man couldn’t order pizza from Domino’s. The company wants the Supreme Court to say websites don’t have to be  accessible](https://www.cnbc.com/2019/07/25/dominos-asks-supreme-court-to-say-disability-protections-dont-apply-online.html)
* Attorneys for Robles argued in court papers that the Americans with Disabilities Act requires businesses with physical locations to make their websites and other online platforms accessible to those with disabilities.
* A      panel of the 9th U.S. Circuit Court of Appeals sided with Robles, writing      that the “alleged inaccessibility of Domino’s website and app impedes      access to the goods and services of its physical pizza franchises—which      are places of public accommodation.”
* Domino’s urged the Supreme Court to review the decision. By declining to do so, the court’s decision on Monday will leave the ruling in place, meaning      Domino’s will have to fight Robles’s accessibility claims in court.
* Attorneys for Domino’s, backed by a range of business groups, had argued that the      ADA does not apply to online platforms that were not envisioned when the law was passed in 1990. And, they said, no clear rules exist for how to make their platforms properly accessible.
* The lawsuit is one of an increasing number filed over website accessibility in recent years. Last year, more than 2,200 such suits were filed in federal courts, according to the accessible technology firm [UsableNet](https://blog.usablenet.com/2018-ada-web-accessibility-lawsuit-recap-report), nearly tripling the number a      year before.
* The case is known as Domino’s Pizza v. Guillermo Robles, No. 18-1539.",,,4,0,0,
f072d1d7-45bf-4ea1-a382-a4cb5e335054,1571779910,Blind people want the same thing from an audiobook experience that everyone wants from an audiobook experience. audiobooks are one of those places where the experience between the blind and the cited is identical.,,,1,0,0,
ce2b18e5-89e9-4b67-bc8e-076f3e0707f8,1570925653,"Hello, my name is Greg... I'm in my early 40's and from the Pacific Northwest in the United States. Recently, I was browsing through the posts here on R/Blind and ran across this post about Minecraft. I know you mentioned the Java edition, but I actually have the Bedrock edition. I'm so new to Minecraft, I have no clue what to do, and being able to play with other visually impaired people would be nice. I know I'm restricted to playing with others with the Bedrock edition, but I do have a realm able to host up to 10 others besides myself if anyone with the Bedrock edition is interested. I also have a Discord server so I can chat with others who join me on my realm. I'm also open to joining other Bedrock servers/Discord servers to play with others in the visually impaired community. If interested, please get in touch. I'm Enigmus#7612 on Discord and Sasquatch98168 on XBox Live.",,,1,0,0,
519e297a-29ef-4e63-a5ed-732730272c71,1571186949,"This is really helpful to me actually. I am always looking down and trying to remember to scan my surroundings constantly. I have never used a cane but have recently (after getting injured tripping over something in the street) thought maybe I should start. I'm always bumping into people if I'm not careful, especially at busy places like airport terminals. It bites if I walk into someone and they say ""watch where you're going"" like...would if I could...",,,3,0,0,
4df35708-80b2-4ce2-91a5-950980c9d0bc,1571013132,Yeah I know what you mean. I'm at seven years of this and it just feels never-ending sometimes.,,,1,0,0,
0354a55d-2496-445c-8738-ea0d8cbe5b4a,1571120288,"Thank you very much for your comments. I know that getting out of the house is difficult for me, but I am still willing to try it. I think this may take a long process.",,,1,0,0,
139cdec7-9567-4e46-807d-0229bcc1cf08,1571837605,"Our quizzes at my school are typically done online before or after class. The entire school uses the same system. The teacher gets the document and gives it to their respective IT assistant to implement (it is possible that it’s not her fault and it’s IT and she’s also a new part time professor so yeah).

The only reason I’m not making a big deal about it is because it’s just a 1 credit human sexuality course. 20 mins to 30 mins isn’t that big of deal, but I’ve had courses where we were give 180 minutes per exam (and the majority of the class didn’t finish) I had an extra 50% of that time but even then it was a struggle.

Without going into too much detail on my eye condition and stuff lol I just think it should be honored. As it has been for all my other courses. 

It’s a relatively easy course, but I just feel like if it happened to me then it might happen to someone else too.",,,1,0,0,
