commentator_id,created_utc,anonymized_body,ups,downs,score,controversiality,gilded,distinguished
02477c80-dfed-445a-9f34-c2fc72b24c25,1571906826,"As a college professor who is blind and has many blind students please do not drop out, unless you can transfer to a college that will make the accommodations.

Firstly, in the US, you should expect that the college to do an assessment of you to agree with you what is required to make to allow you to study.  The process can be tortuous and at my college I lead a process where we interview all the new intake before they start if they have said they are disabled, but that wont help right now. 

Before you have any meeting please write a list of the adjustments you need and show that you have considered everything you think puts you at a disadvantage.  Then show how the adjustments can be made in each of your classes.

Simple things like providing everything in a printed or text only format before the class is reasonable.  It depends on your area of study.  I teach English and on the whole its easy, the only problem area is when we use video clips which I have to source as audio described. 

Maths is much harder to provide for as the software needed to interpret very complex formulas is much harder to accommodate especially if you are working things out on a whiteboard in front of the class.  It’s is possible be requires an assistant to code the formulas contemporaneously for the student to read.  In general the humanities are easier, anything medical is almost impossible, and sciences are ok if you have accommodating tutors. 

The main issue for my students is professors not preparing early enough.  

So to wrap up.  Be specific in the adjustments your want, show how they can be done, and work with the college to make your study easy.  Go with an open mind to get what you can but mostly open a dialogue.",,,1,0,0,
02477c80-dfed-445a-9f34-c2fc72b24c25,1571487108,"
1. How has the world changed for you? Obviously sight, one of the 5 senses is now impaired or removed. How has this changed the way you act or think?

Main change for me was sport , at 12 when I was blinded, I was a soccer nerd and this stopped for a few years until I got into blind soccer.  I was a very outward gregarious child and was heading for class president type roles.  Since then I’m much more in my own head and a very deep thinker. I recovered some of my gregariousness in late teens and now I’m a lecturer so spend a lot of time on my feet talking. 

2. If you had an S/O when you went blind how did they react? How about your parents, siblings or any other family?

I was 12 but had gf who didn’t dump me for ages even though she wanted too.  Mom died in accident on same day so family rallied round in grief.  My sibs are amazing and all adapted quickly to being my eyes.

3. If you were employed at work what happened? Was their a shift in the type of work you did? Did you get fired?

N/a 

4. Was it hard to learn Braille?

Nope really easy 

5. This is sort of a weird question and is personal, not school related, but what do you see? This always interested me. Is it black? Is there nothing? 

I experience the sensation of light in summer but mostly it’s an absence of anything.",,,3,0,0,
02477c80-dfed-445a-9f34-c2fc72b24c25,1570829860,I Use an eyepal reader for books and have an ocr reader/Braille translator,,,1,0,0,
02477c80-dfed-445a-9f34-c2fc72b24c25,1571751748,Most of the adoptees have yet to put the necessary legislation in place so it’s very slow going. The eu are facing a lot of internal descent for adopting it and the us has yet to assess the laws required to be changed let alone passed them to the floor for debate.,,,1,0,0,
02477c80-dfed-445a-9f34-c2fc72b24c25,1570902907,Hardware and software.  Use an iPad some times but Mac most of time.,,,1,0,0,
02477c80-dfed-445a-9f34-c2fc72b24c25,1571754166,You may find the treaty online but it’s unlikely there is much else. The conference was in ‘13 so it’s quite a while ago.,,,1,0,0,
02477c80-dfed-445a-9f34-c2fc72b24c25,1571487335,"I’m	 blind cos I have no eyes (they were massively damaged in car accident) so Christians who ask get me taking off my sunglasses , taking out the fake one and told hey go ahead let’s see god give me new eyes. Never had anyone offer to pray then...though I am a pretty solid Christian and for me blindness is not a problem. Sure I’d like to be sighted but then I’d have to see my own ugly face every morning.",,,2,0,0,
02477c80-dfed-445a-9f34-c2fc72b24c25,1570393116,I did a year in UK and another 5 months in Paris.  Biggest barrier was getting everything sorted at the start to replicate my organised life in US/Canada.  I was proficient in French which was a bonus and cos i was at University had a lot of support from an welfare officer in each case to ensure it was settled.  Took a bit of time to learn new routes and shopping was harder as nothing was the same brand but mostly it was like moving cities in the US.,,,3,0,0,
02477c80-dfed-445a-9f34-c2fc72b24c25,1571486674,Setting / accessibility / voiceover on / check volume / magnification / high,,,1,0,0,
02477c80-dfed-445a-9f34-c2fc72b24c25,1569930902,That’s OK Canadian French and English are my first languages.  So I always think of French in terms of how it’s used in Canada which is a mix of English and French but using the same Braille set.,,,2,0,0,
1654647e-1984-4443-9e01-bdf436c856a5,1572003761,"I only went blind 5 years ago, and I have synesthesia, so for me color is for sight what taste is for touch or timbre is for hearing, and higher pitched sounds have a higher color temperature than lower pitched sounds.",,,1,0,0,
1654647e-1984-4443-9e01-bdf436c856a5,1571329341,"I went through that phase in denial, and after going through rehab I realized that I had grossly overestimated my ability to deal with blindness.  Whenever I hear about extremely independent blind people I always wonder whether they have any kind of residual vision, because it does indeed make a world of difference as far as orientation and mobility is concerned.  For example I hate navigating open spaces since I can't see the landmarks in the distance.

Regarding Braille, I never found much use for it as even coding is perfectly doable with just a speech synthesizer., Braille displays are prohibitively expensive, and I struggle a lot with it anyway..

My life is stable thanks to the disability benefits.  I'm currently living with my retired mother who does some of the chores, and we employ a maid to do the rest of the housework, but while I'm afloat I don't really enjoy life anymore..",,,2,0,0,
1654647e-1984-4443-9e01-bdf436c856a5,1570768233,I'm a former professional programmer who went totally blind and still code for entertainment.  I wouldn't mind answering your questions if you posted them here on reddit either publicly or in a private message.,,,1,0,0,
1654647e-1984-4443-9e01-bdf436c856a5,1572192325,"I have absolutely no idea why Direct Touch-Typing exists at all since it's not even the way it works for the sighted, at least it wasn't on iOS 7, the last version of iOS that I used without a screen-reader.  In any case the swipe keyboard on iOS 13 allows you to type quickly without being precise, but it takes some time to get used to.",,,3,0,0,
1654647e-1984-4443-9e01-bdf436c856a5,1571574566,"Works for me, at least in the [old layout](https://old.reddit.com/).  For reference I'm running Safari 13.0.2 on MacOS Catalina 10.15.",,,1,0,0,
1654647e-1984-4443-9e01-bdf436c856a5,1570595147,"I use the touch-typing mode and am accurate 90% of the time because I developed muscle memory, but since I'm a perfectionist I tend to wait for VoiceOver to announce the key I'm touching which makes me slower.  The swipe keyboard on iOS 13 seems to solve my typing speed problem because it allows me to be inaccurate, but I have to test it properly before judging it.",,,1,0,0,
1654647e-1984-4443-9e01-bdf436c856a5,1571209693,"If you are on Windows 10 you can simply press NVDA+R to use the built-in OCR, no add-ons required.",,,3,0,0,
1654647e-1984-4443-9e01-bdf436c856a5,1572340629,"&gt; How did you go blind?

I lost my sight after almost 32 years fighting a congenital glaucoma.

&gt; If you could see for one day what would you do?

Probably nothing, one day is not enough to accomplish what I want, and I don't really miss vision, only the functionality that comes with it.

Before going blind I was a software developer with experience in network services and operating system kernels, two things that regular users don't see.  When I started losing my sight I quit my job in order to investigate what was wrong, but because I couldn't stop learning I decided to focus into desktop and mobile development, particularly for game development, however despite gaining the knowledge I never had the opportunity to do anything with it since I ended up going fully blind, and because of that I feel rather unaccomplished.  I did develop a very small 3D iOS game back in August just to prove a point, but hated depending on the sighted for testing.",,,2,0,0,
1654647e-1984-4443-9e01-bdf436c856a5,1571181111,"I don't use Voice Control, and my impression is that it's designed for sighted people with motor disabilities since it requires you to know what's on the screen.",,,6,0,0,
1654647e-1984-4443-9e01-bdf436c856a5,1572194101,"It's true that they can type with Direct Touch-Typing, I did not deny that, but the way it works for them is more akin of the regular Touch-Typing option, where you can move your finger to a different key without lifting it and it will not type the key that you first touched.  At least that was the case in iOS 7 and earlier.",,,2,0,0,
1654647e-1984-4443-9e01-bdf436c856a5,1571469552,"I'm late to the thread, but you can always ask Siri to enable VoiceOver for you when all else fails, and if Siri is disabled too you can also connect your iPhone to a computer and enable VoiceOver in iTunes, or in Finder if you are on MacOS Catalina..",,,4,0,0,
1654647e-1984-4443-9e01-bdf436c856a5,1571221921,Voice Control is a new feature in iOS 13 and MacOS Catalina that lets you interface with regular applications using your voice rather than a keyboard and mouse or trackpad.,,,2,0,0,
1654647e-1984-4443-9e01-bdf436c856a5,1571038904,"I was a very versatile programmer with 10% of visual acuity before losing my sight completely 5 years ago.  What I loved about it, and what I sold to the companies that hired me as well as to their clients, was my potential to create great things out of nothing and realize their ideas.  Nowadays blindness gets in the way of my versatility and independence so while I can still code I no longer do it professionally.",,,1,0,0,
1654647e-1984-4443-9e01-bdf436c856a5,1571475959,"&gt; How has the world changed for you? Obviously sight, one of the 5 senses is now impaired or removed.

It's certainly a lot more challenging, requiring lots of energy-draining strategies and planning for even the most mundane of tasks without exception since blindness affects everything across the board.  As a result of this I choose to do nothing, and because of that my life has become extremely boring and dull, a limbo where nothing of interesting ever happens.

&gt; If you had an S/O when you went blind how did they react? How about your parents, siblings or any other family?

I didn't have a significant other, so that part of the question doesn't apply to me.  Regarding my family they were and still are extremely supporting, too much in my opinion, to the point that they don't even let me do anything alone because they fear that I may get hurt, robbed, scammed, or somehow taken advantage of.

&gt; If you were employed at work what happened? Was their a shift in the type of work you did? Did you get fired?

I quit my job as an IT consultant at the first sign something was wrong with my vision.  At the time I intended to have whatever was wrong fixed and then return to work, but things didn't progress the way I wanted and I ended up going completely blind.

&gt; Was it hard to learn Braille?

I struggle a lot with Braille, not because I have trouble decoding it but rather because I have trouble sensing it.

&gt; This is sort of a weird question and is personal, not school related, but what do you see?

My left field of view sees whatever my brain thinks the world looks like from my perspective, giving me the impression that I'm actually seeing things when I'm in a familiar place, but I know I'm not because it's completely inaccurate when I'm in unfamiliar places.  My right field of view only sees white clouds on a black background which sometimes come from light sources, but I'm not actually seeing any lights since I can't see my phone's flash which I remember to be blindingly bright.",,,6,0,0,
bdf259a4-907a-4e5a-a6bb-6d35ef9a7ce1,1570156246,"That’s interesting. I’ve never been able to read a road sign, but that makes sense",,,1,0,0,
bdf259a4-907a-4e5a-a6bb-6d35ef9a7ce1,1570155256,"That’s especially true for foreign languages. I find it a lot harder to read in Spanish than I do in English, mainly because the words are unfamiliar",,,1,0,0,
bdf259a4-907a-4e5a-a6bb-6d35ef9a7ce1,1571693725,"Well, when I was younger, no one listened to me. Everyone thought THEY knew how my vision was, and I didn’t. So listening to them, and allowing them to have a say is very important. Not punishing them is also a very good idea. I didn’t want to wear glasses, so instead of consoling me, my parents took my toys, and my teachers yelled at me until I did. To this day, I have a very hard time communicating with people about my disability, because I’m terrified they’ll punish me for it. I would also suggest introducing them to role models who are visually impaired as well. I’m sure there are children’s books out there on this subject, and I think I would have benefitted a lot from this. It took me a long time to figure out that it wasn’t just me. Being honest is another tip. This is more for parents, but I think teachers/employers/mentors could do this as well. Evolve them in planning and accommodating for their disability. Work with them, not above the,. Of course, this would probably by more appropriate for older children, but it is still important. 

You might think this has a lot to do with the learning process, but school is pretty much the entire life of a child. School is where everything happens for them, and it’s a very important place. Enfolding them with their opinions and their wants, gives them the knowledge that they actually DO have a choice. This will give those kids so much confidence, and will teach them how to advocate for themselves when they need it. Confidence is a very important part of being independent. They can have the skills, but they need to know they can USE the skills. 

Being independent isn’t just about tools and technology. Building the motivation, and the belief that they CAN be independent is just as important. 

This is a very good question to be asking, because I really do believe a lot of teachers and parents have no idea what they’re doing. How you treat a child with a disability impacts them for the rest of their life, so it’s great that someone is trying to make a difference for the better.",,,2,0,0,
bdf259a4-907a-4e5a-a6bb-6d35ef9a7ce1,1571183977,"I’m legally blind, and I’ve experienced both extremes of this situation. Doctors think that my vision is much worse than it actulay is, and they alienate me from everyone else around me, and force me to use tools and such that I don’t need. It’s rather humiliating. But on the other side of the spectrum, people I meet in daily life don’t get it at all. I’ll tell I’m legally blind, and they’ll be like, “Oh it’s okay. I wear glasses too” which is so incredibly wrong on so many levels",,,4,0,0,
bdf259a4-907a-4e5a-a6bb-6d35ef9a7ce1,1571694024,"I’m legally blind, so reading is really hard for me. I’m not very picky about what I get. I just want someone to read it. I don’t even care if it’s a robot, so long as it’s bearable to listen to.",,,1,0,0,
bdf259a4-907a-4e5a-a6bb-6d35ef9a7ce1,1571739654,"I’m legally blind, and I’m also a writer. I have a character who is blind, and he is a famous warrior as well. I like the idea of your character speaking a new “sight”. I don’t think I’ve heard of anyone else doing that before. However, I would stay away from your character wanting “typical ““sight” if you don’t want drama. A lot of blind people, or just disabled people in general, will not take the cure if offered to them, including myself. Of course, this doesn’t mean your characters can’t have dreams, or be sad sometimes, but regaining “typical” sight, in my opinion, should not be the main quest. We don’t need to be fixed, and the world needs to stop thinking that our lives are miserable, and that all we do is try to be like everyone else. Writing is a great way to break this, and I encourage you to go through with your idea!",,,1,0,0,
db592ed5-0320-4312-8e81-25005fdcd7d3,1570967616,Unfortunately I’m not quite sure what my visual acuity is.  My eye condition is cornea sclera. Nasicly means my eyeballs are totally fine my corneas just can’t focus light properly,,,3,0,0,
db592ed5-0320-4312-8e81-25005fdcd7d3,1572265970,I relate color to the flavors of  fruit or candy. Red is normally strawberry or some sort of related fruit. Blue is blueberry and light and sweet. Green well you get it,,,1,0,0,
db592ed5-0320-4312-8e81-25005fdcd7d3,1570457979,Nice. I’m a blind mine craft player on YouTube. I gave him a subscribe. Looks cool,,,2,0,0,
db592ed5-0320-4312-8e81-25005fdcd7d3,1570965874,I really need to get a windows pc so I can play with you. I got the java version of the game because installing mods is easier for it and I game on the Mac right now. I’ll keep this in mind when I get it up and running though,,,1,0,0,
db592ed5-0320-4312-8e81-25005fdcd7d3,1572265901,Use plane unflavored chap stick or vaseline to oil up your joints. Only a little. Worked for me,,,1,0,0,
db592ed5-0320-4312-8e81-25005fdcd7d3,1570457919,"Just push on. If they ask you, I would briefly touch on it. Show them it won’t be a major issue or anything they need consider if you don’t need accommodations. Maybe sun glasses to hide the eye your self conscious about? Turn your head slightly toward that side of your face? Just all things I would think of doing. Hope it helps. Good luck with the job",,,2,0,0,
db592ed5-0320-4312-8e81-25005fdcd7d3,1569934967,"To be honest I’m kind of lazy. So I just take a razor to my entire face, sideburns included. But that’s just me LOL. It’s a lot easier to get rid of it, rather than  style it. Same with my hair. Save a buck and just buzz your head with a 0 guard on the clippers all the way around. Really easy to feel if you miss stuff if your hair isn’t super soft",,,1,0,0,
db592ed5-0320-4312-8e81-25005fdcd7d3,1569935263,"People have good luck with call centers, office jobs, mainly things focused on computer work. But just personal experience.",,,1,0,0,
db592ed5-0320-4312-8e81-25005fdcd7d3,1572265786,I love direct touch and am using it right now. The drawback of direct touch typing is that as a blind person you can’t see what letters your typing as you type them without screen reader input. So I rely on a combination of auto correct and muscle memory. I know apples auto correct isn’t the best but if you work on the muscle memory it’s like 95 percent helpful for me. Doesn’t work in password fields and can make entering unlock passcodes odd so keep that in mind.,,,1,0,0,
db592ed5-0320-4312-8e81-25005fdcd7d3,1570463117,Odd. Won’t let me post links. It’s called Logic Pro x gaming,,,2,0,0,
db592ed5-0320-4312-8e81-25005fdcd7d3,1572265556,I pretty much ignore it. I am an online media creator and people accuse me of faking all the time. Just becomes part of the background noise after a time,,,3,0,0,
db592ed5-0320-4312-8e81-25005fdcd7d3,1570536444,"Look at a unit called the crafty. Gives vibration feedback, has extremely bright high contrast lighting on it, and has a semiaccessible app and it connects to the unit via Bluetooth.",,,1,0,0,
db592ed5-0320-4312-8e81-25005fdcd7d3,1569935081,"It depends on how confident you are with a broom. For me, before I had someone to show me how to do it properly I used a hand brush and just crawled around on my hands and knees. Sounds tedious, but if you move in a grid pattern it’s pretty easy to tell if you miss things. Just sweep all of the dirt you can find into a pile, and have a dust pan ready to collect it when you’re done. Cut your room into quadrants and clean one quadrant at a time.  This next tip is a bit more expensive but works really well. Again it involves being on your hands and knees if you’re not confident with a broom, but putting a dry swiffer pad on your hand is a very good way of cleaning the floor.",,,1,0,0,
db592ed5-0320-4312-8e81-25005fdcd7d3,1570965729,"I feel this. But trust me when I say resources are out here that can help you. Try maybe looking into some independent living training. I went to a training center  for 9 months and it really helped. I had the chance to work with some amazing instructors and it helped to be able to talk to and socialize with other blind people who were going through the same. We all went in with different levels of confidence and independence and as all of our backgrounds were also different a lot was learned. Not only did they help me with my traveling skills, cooking, Braille, cleaning and computer usage, they put me in a lot of situations that really helped build my confidence. That being said I can totally relate on a lot of what you’ve said here. I even though I’ve learned how to use screen readers I still find myself making out with my phone to see something or blocking part of the tv from my friends by mistake when playing video games because I’m just trying to see what’s going on. Hope this helps and let me know if you have questions",,,6,0,0,
db592ed5-0320-4312-8e81-25005fdcd7d3,1570966871,Well I’m working now. Doing some music production and stuff on the side and about to go back to college.,,,2,0,0,
db592ed5-0320-4312-8e81-25005fdcd7d3,1570967306,I’m a contractor with the government right now. Gets  the bills payed lol,,,1,0,0,
db592ed5-0320-4312-8e81-25005fdcd7d3,1570966499,Is it an educational school! I know schools for the blind can teach some skills like that,,,1,0,0,
db592ed5-0320-4312-8e81-25005fdcd7d3,1572265641,Personally I’ve tried online dating and I never mentioned it. I let them find out later. It helps because I can use the first contact on the dating sight itself to let them get to know me and they can find out in person or if it comes up in normal conversation.,,,1,0,0,
db592ed5-0320-4312-8e81-25005fdcd7d3,1570458114,I actually do this sometimes. I have some vission that I use a lot but if I’m in a dark room or it’s too bright outside and I’m not sure how far away from an object I am I use it. Only if I have my dog and not my cane though,,,1,0,0,
db592ed5-0320-4312-8e81-25005fdcd7d3,1571680573,"I think that not one choice is better than the other, it just depends on what you need as a traveler. Ive been a dog handler for a few years now and am on dog 2, and I will say that I miss some things about not having a cane. The lift and Uber issues first and for most. I can’t tell you how many times I’ve been late for work because of dog rejections and I do mor than most handlers when it comes to preventing leaving hair behind. Be ready for people to not like your dog. The good thing is you can take it pretty much anywhere you want. The bad news is that some people you run into will not like your dog and you will never know why. Vet care, food, toys, grooming, it can all get very expensive. Some vet hospitals will not charge for care of a service dog but only a very small number of them. Of course with a cane you don’t need to worry about any of these things. I will say though I had to make sure I went out without my dog every once in a while. Still need to make sure you keep up on your cane skills and doing things like finding doorways and things to keep those skills sharp.",,,4,0,0,
3c0a5c2d-4532-404e-81c7-9fbd7a356ef0,1570899736,"Sounds like you might be holding everyone at a remove if you're thinking of people as humans as a go-to. :) The communities I see doing this are scientific communities, rationalists (their term), and some programmer groups, and I think stepping back from humanity is a common thought pattern there. It only becomes a failure mode when you come back to interact with people and retain that mindset, though...",,,1,0,0,
3c0a5c2d-4532-404e-81c7-9fbd7a356ef0,1570808604,"Love xcom  2, turn based helps a lot and I use Zoom and hold up Seeing AI to the screen to read text. Also been enjoying Dicey Dungeon, it tends to have large everything on screen which is nice.",,,2,0,0,
3c0a5c2d-4532-404e-81c7-9fbd7a356ef0,1570921862,"I've made a lot of progress by really embracing looking like an idiot. It's not that big a deal, really. Just keep putting yourself in new situations and tackling your problems head on and the more you look a fool, the easier the next time will be. I've pretty much burned out my embarrassment circuits. If you're not getting seriously embarrassed once a week or so (maybe more like once a day), you're too ensconced in your comfort zone.",,,8,0,0,
