commentator_id,created_utc,anonymized_body,ups,downs,score,controversiality,gilded,distinguished
3aa92a47-c0e5-4ef2-a991-f517acd65784,1422678857,I feel safe doing that. I'm in a power chair though I can move very quickly. ,1,0,1,0,0,
92607a36-ab21-411d-a4b2-aca1c753f479,1422321570,"Using the elevator during a fire is dangerous to people of all levels of ability. It's not offensive to try and keep *everybody* safe with statements like ""In case of fire, do not use elevator, use stairs"".

What would be useful is clearly displayed evacuation protocol for wheelchair users next to evacuation protocol for able patrons. Every establishment is different, some have fireproof doors and people who can not use stairs are expected to wait behind those doors for Emergency Workers to assist them. Other facilities expect other patrons to assist with evacuation as they lack appropriate firedoors.

The Nature of the evacuation also comes into play. There is a big difference between a fire that is going to cause threat via smoke inhalation vs a fire that is a threat due to structural damage to the building.

Evacuation protocol works on eugenic ethics, The best outcome is to get the most people evacuated safety. This is most easily achieve by making sure able bodied people get out first so that chairs and mobility aids are not blocking walk ways for extended periods of time.

Even in hospitals this method is used. if there is a need to evacuate patients the policy is order of evacuation is ""ambulant, semi-ambulent, totally dependant"".

Is this prejudice or offensive? No, it's the most logical and it's common sense if your aim is to preserve as many lives as possible. Is it fair? no, But that's life. Is it right or ethical? it totally depends on your morals.",1,0,1,0,0,
aae7c254-aa01-4ce4-83ba-64398c3b7be8,1421382245,I've seen this around for a few years now. It's a fantastic idea if you don't carry a lot of stuff with you or you live in somewhere with a warm climate. I live in northern canada and I have enough problems driving my kia soul around with the snow and ice. ,1,0,1,0,0,
027a1edc-29da-4b66-aaf2-22f18a400f4e,1422128182,"This isn't something I'm expert on, but I was visiting NYC recently and the subways are pretty bad. Getting on/off is manageable enough, but a lot of stations put you at the bottom of a flight of stairs. We called the support line or whatever and said 'so how do we get out?' and the person on the other end *helpfully* replied 'Well just go upstairs and there's an elevator.' Yeah, thanks, big help. That's....... probably not in your area I think, but I'm just saying. Maybe some alternative to the subways? Or else just brow-beat the DOT until they modernize more stations.",2,0,2,0,0,
9b087923-5808-446e-8bc0-3e344884ac0b,1421655442,"I guess people do question others' sexual identity, I mean that's the entire issue with bi-erasure, so maybe that wasn't the best example. But we give that a name at least. Totally didn't think you were saying she was in the right at all.",3,0,3,0,0,
804282ab-83ad-4cb6-84b9-cce1f563499b,1421766573,"So silver is an awesome metal and your name is a play on ""silver lining."" Still doesn't make any sense to me. Sorry that this comment isn't really on the merits of your organization, just the first thing that came to mind considering you had to explain the naming. Ag is often used as shorthand for agriculture. Maybe if it was Ag^+1 . Your logo and byline don't help with the confusion.
    
As for the merits ... there is almost nothing under ""programs."" So you want to do something and you've started a website, that's nice. I'm not sure how much general input anyone can give you when there really isn't anything of substance to comment on. ",3,0,3,0,0,
6635df6f-b979-4ffb-8987-53cd12549293,1421642889,"Wow, I've never heard handicapable. That is something else.",1,0,1,0,0,
027a1edc-29da-4b66-aaf2-22f18a400f4e,1422665722,"I'm using In-Motion forearm crutches ([these](http://www.amazon.com/dp/B004M1036E/?tag=googhydr-20&amp;hvadid=47133069888&amp;hvpos=1t1&amp;hvexid=&amp;hvnetw=g&amp;hvrand=10756559530720005185&amp;hvpone=&amp;hvptwo=&amp;hvqmt=e&amp;hvdev=c&amp;ref=pd_sl_2y2g01ti25_e)). Before using these, I'd only tried under-arm crutches before -- they bothered my shoulder and took up lots of space, thus the switch. Anyway I don't know *much* about forearm crutches in general -- just lots of experience with this one single model. Which is great! But not without its problems, and I imagine some of them are present in other models too. Let's go by bullets.

&gt; What can you tell us about the current forearm crutch?

It's more compact, lighter, and a little less stable than under-arm counterparts. It takes an extra second to pick up and use, or to put down -- sometimes that's great, like if you want to knock on a door or something, the crutch stays right there with you; sometimes it's a little annoying, like if you only have to move a small distance, you'll spend more time slipping the cuffs on and off than actually walking. Forearm crutches aren't as stable as under-arm, in my experience, but despite that, they're *much* easier on my shoulders (though that could be partly due to the shock-absorber tips on mine -- you could get under-arm crutches with those). Overall I definitely prefer forearm.

&gt; Likes and dislikes?

I like the size, weight, look, and feel. Also, transitioning to a single crutch feels a lot more natural with forearm models, I think -- it's somewhere between a crutch and a cane. 

I don't like the elaborate dexterity process required to put them on. Especially with mine -- the handgrips are specific to one side or the other, but not marked very well, so I usually wind up fumbling with them for a few seconds. More importantly though, I don't like the way the handgrips are designed -- I suspect this varies between different models, but on mine, the grip is rubber, wrapped around a metal post and secured in place with a bolt and washer. But as the rubber heats up, whether from use or from ambient temperature, it gets malleable enough that it slides right over the washer and starts to slip off. They can come totally free in mid-use, and if that happens you're just kind of boned. It's kind of a lot unsafe.

&gt; Is it stable enough?

Most of the time. Wet tips can sort of ruin that -- I guess if they were wider (or maybe just less worn-out than the ones I'm using), that might help. 

&gt; What would your ideal crutch have that current crutches lack?

I'm pretty sure that not all models have the spring-tip shock absorby things that mine have. They totally should. Those are awesome. I think it would be neat if it was easy to collapse -- think, like, switchblade crutches that just retract up into a tiny size when they're not in use, and then shoot out like lightsabers and play heavy metal music when you need them. Or, okay, maybe not that -- but that's always gonna be a good direction to explore. When you get into a car, it would be nice if you could quickly, easily, and comfortably stow your crutches. ",2,0,2,0,0,
f3a2291a-726a-42a0-8c02-527ae44b41e5,1421716710,So true.  I work for half of what I could had I looked normal.,3,0,3,0,0,
7e348e81-c25b-41eb-a98f-c8a2c52c2384,1421247233,Please folks there have been 11 tries at this before - it will never pass and would completely DOOM any presidental R candidate in '16. That's what I keep telling myself...,1,0,1,0,0,
48720b87-66d6-4b16-883d-e3c7f0bbe6c1,1420982938,"A ticket doesn't simply give you a ticket to go take to employers so they hire you. It's a funding source... and there are no paper tickets

Also you can't have a unrestricted letter A. They must be for a federal job only for a specific amount of time from an VR counselor.",1,0,1,0,0,
758dba79-f58b-465c-9bed-560456ae0d25,1421446731,But are non-medical entities allowed to ask you about that information?,1,0,1,0,0,
41641475-47a8-495c-a33c-24f9446b9644,1420973806,"Thanks guys! I'm not highly concerned about her learning skills. She is pretty sharp for a deaf baby. She can play the tablet on her own and even watch youtube by simply clicking on familiar videos. She loves to play and is very observant. She also shows social cues like shyness when meeting new people, smiling, laughing, and showing her cute face. She was also diagnosed with failure to thrive (FTT) that's why she's asked to undergo a muscle biopsy, renal tests, and metabolic tests to see what the cause is for her lack of growth. We've already been given an MRI request but we haven't done it yet because we plan to get her cochlear implants and that also needs an MRI, so we're going to hit two birds with one stone hopefully. You guys are an inspiration! Thank you :)",1,0,1,0,0,
b82056e1-38b6-4aaf-b241-1d54fe75a2f8,1420416279,"When my husband and I go out, we hit up a nice restaurant, or go to a movie, or to a park with wheelchair-friendly paths.  I don't know what else is available in your city, as there isn't a lot around here, but maybe go play darts, or maybe a meeting if you have a shared hobby, or an open game night at a local game store...",1,0,1,0,0,
cecbfcd0-5ae6-4716-98d6-932ad9aebbce,1420360540,"You say this and my asshole brain goes ""Welp, time to read the comments.""",1,0,1,0,0,
d42b72a0-f3b8-47b4-8199-fe3b27dfa74b,1422244117,"A lot less painful and uncomfortable than before I had it put in. For the moment it is temporary, and we're looking at reversing it in a few months, but there's a lot of doctor work to figure out if we should. I don't do well after surgeries --they've come pretty close to killing me twice. The stoma itself has no nerve endings and feels no pain, so that's cool... I can eat the spiciest of foods and not worry about the day after. :P 

Biggest difficulty with it is the practical things. Placing it under clothing, having to empty it in public restrooms, and just the weight of it at times. If I had a sex life I'm sure that would be a bit awkward as well, but nothing some sort of wrap shouldn't fix. The nice part about the ileostomy(small intestines) instead of a colostomy(large intestines) is that it's not 'fully digested' food so it comes out as a paste and doesn't smell anything like normal feces. More like... your chemically enriched meal from before... or something closer to vomit. Still pretty gross, but not that bad. ",1,0,1,0,0,
65134dbb-cb2c-48e9-ae49-d82fe8da5a8c,1421879099,At what point should you disclose that you will have a service animal living with you? I understand that it might not be *necessary* to disclose before occupying a residence but to avoid problems upfront disclosure does seem advisable. What is the lowest stress approach to disclosing?,1,0,1,0,0,
58101f45-4da5-4552-b809-7f4166f6530a,1421207646,"Check out the [International Paralympic Committee](http://www.paralympic.org/classification/) website. It has a list of Paralympic sports and which types of disabilities are eligible to compete. Within those sports, they have classification systems so that people of like abilities compete together.",1,0,1,0,0,
be8e6b44-ea50-4734-bf04-1a81cc30f559,1421190581,"Your submission was automatically removed because you linked to reddit without using the ""no-participation"" np. domain. Reddit links should be of the form ""np.reddit.com"" or ""np.redd.it""

*[I am a bot](/r/AutoModerator/comments/q11pu/what_is_automoderator/), and this action was performed automatically. Please [contact the moderators of this subreddit](/message/compose?to=%2Fr%2Fdisability) if you have any questions or concerns.*",1,0,1,0,0,moderator
7bc33e90-fbfd-4354-b445-d083937c145c,1421776021,"Ahh I didn't really realize how much numbers was packed in there until you mentioned it! Ill work on it and try to make the numbers now clear to understand. Most of the percentages and numbers are coming from the 19million non instiutionized disables persons ages 21 to 64. Thanks for the input, would you mind if i sent you the infographic after I play around with it more?",2,0,2,0,0,
4d8f5eb0-bf81-48df-a2c4-4d63e10c6b94,1422719067,"Absolutely, employers want diversity (for tax reasons).",2,0,2,0,0,
fa267a45-cb57-455c-a075-a5de69e68efd,1421940523,"Thanks for the question! 

I'll start with a definition. A reasonable modification is a structural change made in order to afford a person with a disability full enjoyment of the premises. These modifications can include structural changes to interiors and exteriors of dwellings and to common and to public use areas. These modifications are generally done at the expense of the requester, but in rental properties that receive federal funding, the modification is generally done at the expense of the housing provider. Probably the most obvious example of a reasonable modification is a ramp over a threshold or stairs. 

By definition, the request must be ""reasonable."" Whether or not something is reasonable is determined on a case-by-case basis and is very fact-specific. As such, there is no predetermined list of what is and is not reasonable. However, anything that could affect others' safety or the structural integrity of the unit might be deemed unreasonable. For example, widening a doorway to allow wheelchair access is generally considered reasonable, but if that doorway happens to be a on a load-bearing wall, it could be considered unreasonable. Or if a ramp could be a trip hazard for others, that particular ramp (or placement) could be considered unreasonable.

A lot of people assume that modifications like widening doorways or removing cabinets under the kitchen sink (or removing or changing other built-in features) are unreasonable, but those have been deemed reasonable by courts.

HUD and the DOJ released two memos concerning reasonable accommodations and reasonable modifications that are quite easy to read and provide wonderful information for everyone. We have provided these to landlords on numerous occasions. You can find them here:

[JOINT STATEMENT OF THE DEPARTMENT OF HOUSING AND URBAN DEVELOPMENT AND THE DEPARTMENT OF JUSTICE:  REASONABLE MODIFICATIONS UNDER THE FAIR HOUSING ACT](http://www.hud.gov/offices/fheo/disabilities/reasonable_modifications_mar08.pdf)

[JOINT STATEMENT OF THE DEPARTMENT OF HOUSING AND URBAN DEVELOPMENT AND THE DEPARTMENT OF JUSTICE:  REASONABLE ACCOMMODATIONS UNDER THE FAIR HOUSING ACT](http://www.hud.gov/offices/fheo/library/huddojstatement.pdf)",1,0,1,0,0,
ae5708f7-eab8-436d-b8cd-8a8edd4de91c,1421728435,Not at all because people will realize that disabled animals are easier to love and care for than disabled people because animals can't talk and complain.,2,0,2,0,0,
e05d9213-a423-44d9-9b1f-3769ae59bc07,1420276886,A couple of years ago I noticed some of the rest stops on the highways up and down the coast in California have notices on the walls out side and some inside ( also some state parks ) saying it's legal for a care giver of the  oppisent sex to go in the rest room with the person they are helping and I think it stated the State code no. for the law also . ,1,0,1,0,0,
0ddb56dc-e1a9-4313-a035-963ae97406e0,1421515408,"That was actually the first thing I thought of when she was done with the range of motion, that I haven't been working and have basically been doing NOTHING in order to keep from pissing off my joints, so how accurate are they expecting this to be? ",2,0,2,0,0,
3aa92a47-c0e5-4ef2-a991-f517acd65784,1422147208,"Heya I have SB too! I was wondering, do you get sick more often than the average person?",3,0,3,0,0,
e038a184-d3ea-496f-9f65-20567dafebfe,1422741857,"&gt; Well, look at it this way: They cannot punish you if you don't. 

They can't punish you, but I believe in some places if you fail to declare your boss has no obligation to provide adjustments for you. ",1,0,1,0,0,
54d15906-4ce0-4f12-bc2d-83ee5366fb8f,1422286668,"I agree with the other commenter, if this is causing you so much stress you need an attorney. I'm not sure what type of attorney you had at first but you should find one that will help you through all the steps of the process, not one who bows out when the going gets tough.  It can be helpful to have a local disability lawyer and you want to look for one who does not get paid until you win your case.  I found this great article on the advantages of having a good local disability lawyer: http://www.nashdisabilitylaw.com/index.php/blogs/the_advantages_of_a_local_disability_lawyer/",1,0,1,0,0,
a17492ed-91bc-400e-8830-698a1b0f04c2,1421647686,"Maybe the problem is that society uses mostly euphemisms or insults, instead of using straightforward language, or nothing at all when the disability is irrelevant. And yet my husband and I talk about parking in ""the crip spot,"" so I'm no better. ",2,0,2,0,0,
d43ea476-9a65-4aa9-8133-c4b9e5b6ea8e,1421466738,"Yes. SSA doctors are often half-assed, barely competent, bottom of the class failures. They get paid per head and my guess is that if they start approving too many claims, SSA gives them the boot.  If you want any chance of wining your case, you will need an independent Doctors opinion. Preferably one who is specialized/knowledgeable in back injury and what SSA defines as a disabling condition. Also it is very important include all your limitations.  Check out SSA.GOV. On the front page, in the search bar, type BLUE BOOK. this will open a list of pages, click on the list of conditions for ""adults"". This will show the many body systems. Each system has a list of what tests and diagnosis a doctor must report to prove your disabled. Use this information to instruct your Dr. what to tell SSA. Sorry if this is confusing, I'm trying to condense two hours of conversation into a few words. Good luck, its not easy to win most cases on the first go, but if you know what there looking for your one step ahead.",5,0,5,0,0,
758dba79-f58b-465c-9bed-560456ae0d25,1421438556,That's what I am thinking.  Evaluation centers aren't medical offices.,1,0,1,0,0,
7e36148b-2b74-4bba-b469-eb50434fa64b,1422379449,"Hey!!!
I had just gotten sucked in and then your story abruptly ended :( 
What's the plan, my friend? 
I'm eager to hear the remainder ofyour well-written story and as a fellow writer, I would recommend submitting a multi-part story in clear-cut and completed segments. Or just make it a single story. One way I determine if I have the quantity of content to bother with making a multi-post story is to write all of the related pieces at once. 
You have an engaging voice and a unique perspective so keep it up -- but also keep it coming!
All the best. ",1,0,1,0,0,
d6658c7c-7d7e-4243-a5f2-65dee93ff3ab,1421417892,"So it's not really too much hassle - that's good thanks. Have you ever had to carry something like a suitcase, my friend is gonna be travelling far with her chair and we don't really know the best way..?",1,0,1,0,0,
0b850139-2f7f-41b6-aa85-6a60d1680594,1422219298,"i had attempted suicide, and  my motor control was mostly gone but i still had to pee. i was essentially coming down from the pills so i was yelling and shouting and the nurse did not want to deal with me so she shoved the catheter pretty hard inside of me. now i'm scared of them.",1,0,1,0,0,
9e297079-3f8c-4a5b-aadb-ded91d542e4a,1421945589,"I'm a sib and grew up in the 90's.  We had Monosomy 9p- and United Cerebral Palsy events where my sister June and I could meet other sibs and people with disabilities. They were few and far between, though.  

Social media outlets like Twitter and Instagram have blown up in the past few years with self-advocates, parent advocates, disability organizations, etc. sharing pictures and stories with each other. What's struck me so far is the affect social media has in efforts to *normalize* the experiences of people with impairments and their everyday life.  If I had that growing up, I wouldn't have been nearly as negatively affected by ableist ideas.
Blogging is also a big influence in the disability community, especially self-advocates and parents.
There are also some interesting trends in ""inspiration porn"" through memes, primarily shared on Facebook and Pinterest.  

I would love to help you, even though this was posted 4 months ago. Let me know if you're still interested---",1,0,1,0,0,
3aa92a47-c0e5-4ef2-a991-f517acd65784,1422151179,"Thank you! Congrats on your engagement!! :D

",2,0,2,0,0,
37f84417-f829-4671-99d3-7ee8393787ad,1422452374,"I don't know if disability binarism is an accepted term or if you just came up with it but either way, thank you for saying it because I've not known how to sum up this particular disability issue in a simple term and it's sometimes quite frustrating when I'm trying to explain things. Thanks.",2,0,2,0,0,
d42770b1-9f84-462c-9536-090461a2ff56,1421034812,I am on disability for bipolar 2. I don't know in that case... I need to go to doctors regularly. They do ask for doctor info when you fill out the paperwork for review. You might want to call social security and ask.,2,0,2,0,0,
15186324-4c93-4518-b6cb-1b752acc9706,1421199482,Because the thought of having your whole life turned upside down by removing some part of you that you think defines you as human is terrifying.,4,0,4,0,0,
ba01e4df-67b4-4802-9aa6-e9086b5f9d81,1421649093,"I met someone at a seminar on accessibility in the classroom who corrected me when I used the term disabled to refer to *myself*. She actually said to me ""actually, they prefer diffabled."" I said ""I don't."" Very frustrating when people tell you how to refer to yourself. ",8,0,8,0,0,
22f56ab0-cf84-427e-9f9e-5545ce935928,1421203842,"Your contribution would be most welcome. Could you share what your experience was to approach common tasks you would engage in, without thought before the accident, with the new challenges of your disability?",1,0,1,0,0,
66d69e2c-fdaf-4e8c-ad43-27ab856d13e2,1421175709,"I am currently receiving enough in SSDI to pay my rent for less than half a year with 0 food. I am lucky to be alive now. If something isn't done about the GOP's plan to kill millions of elderly and disabled, that is exactly what will happen",1,0,1,0,0,
99e475d7-f0aa-4f04-97a0-39cd60e15f4e,1422730361,"I carry everywhere. Going to a bar =/= drinking.

Responsibility prevails.",1,0,1,0,0,
eaae6e69-2f9f-43d1-9773-a3611987c5a5,1420406304,"I couldn't read the writing on the middle concept, so I had to just judge based on the pictures, but I think the top one is the best concept. I don't have children, but I've thought about how difficult this problem would be if I did. Similarly, when I'm in a store, pushing a cart around is always a challenge.


I like the idea of the extra storage, and that the top one is collapsible. The fact that it clips to the front of the chair is convenient, but it could cause for steering difficulty. 

You could probably rent a wheelchair for a week and try it out for a while to get the feeling for what it's like and what the difficulties are for us who use them everyday. Just a suggestion!",3,0,3,0,0,
65134dbb-cb2c-48e9-ae49-d82fe8da5a8c,1420140243,"Everyone should learn to be bilingual and in an ideal world it would be nice to know sign language but it's been pointed out that there are more people who speak Samoan in the United States than currently use ASL. Why won't anyone think of the Samoans? More realistically, in the US Spanish fluency would be much more useful on an individual or societal basis than ASL. In the UK knowledge of *ANY* additional European language besides English would be a big step forward. Bilingual education is standard nearly everywhere except the UK.",5,0,5,0,0,
1367f57b-7c53-45f2-8e20-c0082dd78690,1422307676,"I am commenting for later because I'm on my phone, I know of some books that might help you with your nephew, but I need to be at home to look them up properly.",1,0,1,0,0,
46699cef-90bf-4cda-9936-790c1575cda4,1420803084,"This just popped up on my FB. Could be useful.

http://www.christopherreeve.org/site/c.mtKZKgMWKwG/b.6543277/k.FE28/The_Top_23_Winter_Survival_Tips_for_People_Living_with_Paralysis.htm",1,0,1,0,0,
589f63c3-bad5-4542-ac39-e0e5a5dc6591,1420100263,"I once saw one of those boxy vehicles (a Scion, maybe?) modified for a driver using a wheelchair. The driver's seat was removed and there was a modified seat belt to help strap in the driver &amp; chair.  A little ramp came out so the chair could get in and out.  I asked how much it cost to do that and they said $20k!  Ow...",1,0,1,0,0,
41641475-47a8-495c-a33c-24f9446b9644,1420974312,"My daughter has just recently been diagnosed with failure to thrive so they requested for muscle biopsy, renal tests, etc. to see what causes the nutritional impairment. The neonatologist told me that whether it's CP or not, it doesn't really matter and it's just a wasteful diagnosis. What we really need is to supply her disability with an alternative to make her life as normal as possible. We're going to get her cochlear implants and that's a step forward to her better life. I hope your son is doing well!",2,0,2,0,0,
be8e6b44-ea50-4734-bf04-1a81cc30f559,1422210708,"Your comment was automatically removed because you linked to reddit without using the ""no-participation"" np. domain. Reddit links should be of the form ""np.reddit.com"" or ""np.redd.it""

*[I am a bot](/r/AutoModerator/comments/q11pu/what_is_automoderator/), and this action was performed automatically. Please [contact the moderators of this subreddit](/message/compose?to=%2Fr%2Fdisability) if you have any questions or concerns.*",1,0,1,0,0,moderator
