commentator_id,created_utc,anonymized_body,ups,downs,score,controversiality,gilded,distinguished
ca2d5ddf-11bc-4597-abb5-d3f7ae707019,1420958804,"Isn't a muscle biopsy used in testing for mitochondrial disorders?   Usually hypotonia in and of itself doesn't indicate a primary diagnosis of cp so much as a disorder.   Hypotonia is common in a bunch of syndromes.   My son is hypotonic all over due to his syndromes and microcephaly but he really doesn't have diagnosed cerebral palsy.  Is there some other reason they suspect CP poor reflexes, history of birth trauma, mixed tone, spasticity  etc.....?  ",2,0,2,0,0,
37f84417-f829-4671-99d3-7ee8393787ad,1420640290,"I understand how this works if you own the house. However, what about if you're renting the house? How long before you move in can you make adaptations or do you have to already be in the house?",2,0,2,0,0,
1367f57b-7c53-45f2-8e20-c0082dd78690,1422511175,"This makes me so conflicted.

Because the ""it may sound a bit airy-fairy"" is. IT IS. To me. It plays into the notion that people see disability as inherently bad, and it's why the Deaf Community had pushed away the label. And that's not to say they are wrong, or anything. But they understand that the way their body works isn't an inherently bad thing and so they've separated themselves from the term, even if it frustrates me that they ended up doing that instead of fighting to change the tone behind the term.

Yes, labels can be used against people with negative consequences. But labels are also a big part of being able to discuss things, identify areas that are thematic (positive &amp; problematic ones). Similar to the fact that ""just because a decision has some negative outcomes, doesn't mean it is the wrong thing to do,"" just because something can be used negatively doesn't mean it shouldn't be used.

It also has roots in the ""I am colourblind"" movement - which people are railing against now. It erases problems, by denying differences. Those differences can be positive or problematic. However, when they are the problematic ones it can make it more difficult for the person experiencing them to have them addressed or acknowledged. For example, studies have shown that if you take two identical resumes and submit them with a ""white name"" and an ""non-white"" name, the person with the ""white"" sounding name is a lot more likely to get the job.

It's the things like ""I don't see you as disabled"" that deny part of your experience of the world, because while the person saying it might not 
hold the opinion that all people who have disabilities are to be pitied, or are helpless, or are weak, or incapable, or any of the other negative stereotypes that people place upon us, that is not how the world works. It's naive. It implies that the wrong definition of disability is not going to change, and also that they don't want to address the problematic side to disability. People who use wheelchairs have a markedly different time getting around than people who walk unaided. That doesn't neccesarily mean they are aware of it at all times, or that they are overwhelmed whenever they have an issue with it. But that it is part of the fabric of their lives.

A lot of it boils down to: don't pity me, but don't deny my differences/problems and not everything you define as a problem is a problem to me.

On the positive side, the website services he provides sound pretty damn cool. So, therein lies my conflicted feelings. We also have a young man who is visibly disabled standing up for being full members of society, with confidence, getting coverage for it, and having success at it. He has a great point about not having enough good role models for people with disabilities to look to. Yes, you can spout the ""be your own"" - but not everybody is the same and some people need a hand up.

He also DOES have the mindset that disability is not inherently bad, it's just that he's going about addressing it differently than other people.


It's now quarter to 1. I need to go to bed.",3,0,3,0,0,
d127c69a-fb85-4e45-a0dc-beaec5c71d5e,1421948275,What about Lauren Potter or Demi Lovato?,1,0,1,0,0,
89e3983b-cbb1-4d91-b868-5af461d89983,1422661079,"Regardless of disability, don't put your education on hold if you can afford to keep going. It's so hard to pick it up again once you take time off. ",1,0,1,0,0,
77f66097-69f1-4099-941b-d816c0e42bf4,1420219814,"I obtained disability on a second appeal and so I thought I might mention a few things. It's already been said that an SSDI lawyer can only take up to 25% of your backpay. That will be in the contract. It will also indicate a flat sum, stating that the attorney will take (once you've won your case) whichever of the two amounts is less. Whether or not you win your case you will be liable for office costs incurred while working your case, such as printing, copying, and mailing. You can request an itemized list for that when the time comes to pony up, but the chances are that it will be accurate if somewhat pricey. 

A free consultation with the attorney is expected, so don't go to one who would charge you for sitting down in his office. And just about any attorney out there will want to know what medical records you have at your disposal. The ambulance chasers will take on any case, but attorneys with busy schedules who will only take on cases they know they can win will want to see what evidence you have on hand that they can present in court. So when you go to your consult, have the names and contact info of all pertinent medical personnel available, and a summary of what each of them would be willing to say in written testimony. 

In court you will face two major hurdles: the court's pet doctor and their pet vocational expert. The administrative law judge will have the prerogative to call on either/both of them without informing your attorney prior, so you must be prepared. That means having doctors' statements indicating that your medical condition precludes the possibility of working (the judge gets pissed if the doctor uses the word ""disabled"" because that's the judge's call and not the doctor's) as well as a residual capacity questionnaire filled out which will defeat any alternative vocations the vocational expert would suggest. There is no uniform residual capacity questionnaire out there, so it's a good idea to find several and then cobble them together in a fashion which is tailored to your particular disability. That way your doctor doesn't have to puzzle vaguely worded questions out when he/she's busy and trying to fill it out quickly. ",1,0,1,0,0,
8b5b2d99-9c31-4822-99fa-9949e3120e32,1422563384,I'd rather get something purpose built then have to have something modified.,1,0,1,0,0,
ca2d5ddf-11bc-4597-abb5-d3f7ae707019,1422488214,"I suspect a table like this will get the most use in group settings.   So yes adjustable legs is a must.  My concern for mixed classes because all with severe multiple type disabilities are not in wheelchairs.   As a matter of fact 2/3rds of my son's class are ambulatory and yes, they all are considered severe and require hand over hand when working with manipulatives.   It has been a problem for ds's teacher because she has to have two tables one for those who are ambulatory and one for those in wheelchairs. ",2,0,2,0,0,
ceb73558-e339-40a4-8a6f-e74634d196a9,1420462056,"Thanks you very much for taking the time to reply to us, its really appreciated! 

The comment you've made about height is something we hadn't actually given much thought to but it does make absolute sense, so thank you for that! 
",2,0,2,0,0,
3aa92a47-c0e5-4ef2-a991-f517acd65784,1422058644,Getting out in the winter :( ,5,0,5,0,0,
53970c9b-7f2c-4fbc-a2f5-687d42d89d49,1422132862,"Contact your local WIPA office: http://www.socialsecurity.gov/work/WIPA.html

This is exactly what they do and if you need assistance with something they can't help with, they're usually great about finding someone who can.",5,0,5,0,0,
0ddb56dc-e1a9-4313-a035-963ae97406e0,1421526267,"I understand what you're saying, but my gait was *not* observed. Neither the doctor nor her assistant saw me walking. They were running over an hour behind so the receptionist put me in the room and took my vitals, and she clearly was not trained to do so because she took my BP and my pulse and 02 sat at the same time, which you if you're trained you know not to do (my sat dropped to 94% and my pulse shot up to 104 because I have allodynia so the pressure from the Bp cuff is excruciating) and then proceeded to tell my Bp of 103/94 was ""good."" It's not. 103 is a only a little low, but 94 is borderline hypertensive. Someone who isn't trained to take vitals isn't going to know enough about ambulation difficulties to make any sort of useful observation on the subject.",1,0,1,0,0,
7e36148b-2b74-4bba-b469-eb50434fa64b,1421241886,"I had a student who is one of the most talented equestrians I have ever trained-- she has one eye, as she lost her other eye due to sepsis in terrible living conditions as a baby. 
She even jumped some fences (although she mostly rode on the flat), and learned to feel her horse and read the course in a different way. 
I know everyone experiences their disabilities in different ways, but my student's story in contrast to your own are great examples of why OP can't just use some sort of test to determine what a person with a disability is capable of in sports. ",1,0,1,0,0,
261172ca-54be-4aee-bea2-804c359afedd,1420607841,"I got to a selective small liberal arts college where disability services is very small (literally one full-time staff). Though I am in regard contact with disability services, I work out accommodations with each individual professor, which is a perk of attending a small college.

Since you have been recently diagnosed, I would highly encourage you to speak to disability services at your university. You may choose whether or not to request accommodations at your own discretion, I encourage you to speak to someone at your university and make sure they have your most current documentation on file. This allows the office to support your requests for accommodations.

Finally, when you speak to those at your university, do ask them any questions you may have about your rights, responsibilities, and other information that may concern you. Also, ask them in there are on campus or off campus resources that may be helpful. As someone has already mentioned, a support group may be of some help to you in the process.",2,0,2,0,0,
e5b56ac9-c5b3-4936-bd6a-1561eaa38f16,1420307161,"This is awful, and happens to me a bunch!

Background: I have avascular necrosis, with a fused knee. It literally doesnt bend. However, with pants on and if Im not walking, I look like a normal, fit late 20s young woman. And people can be down right rude! Ive had people insult me, stare me down...I even had one lady yell at me on a subway for being ""selfish for sitting and not keeping the seat open for someone who may actually need it"". But high school...was the worst

In high school, my knee was still bendable, but I used cruches to prevent further damage to my joints while I waited for surgery. KIDS ARE MEAN. I had people accuse me of faking, of asking for attention. It was hard...but worth it in the long run (as I got to graduate with my friends and WALK across the stage instead of rushing into surgery and having a wheelchair.)

All in all, people can be cruel, but try and smile anyways",2,0,2,0,0,
f0d68960-0b55-4b63-b2ef-f2cfe7108c08,1420152096,/r/deaf,3,0,3,0,0,
049fecbd-5d9a-4727-aa92-ea113ee3b54c,1422163121,"To sum it up, got into a car accident and have extensive nerve damage to the point where I can't walk. ",1,0,1,0,0,
af670ebc-c0ea-45b8-b314-4b45408cb7c1,1422152610,             6. I'm pretty flexible. If I didn't have SB then I could be a gymnast lol. ,2,0,2,0,0,
ae5708f7-eab8-436d-b8cd-8a8edd4de91c,1422119784,"I've dealt with subtle forms of discrimination at my last job which gave me the hint that I needed to learn that staying home and out of everyone's way forever until the day I die is the wisest choice of action.  I myself wonder daily why I haven't killed myself yet.  Oh well, too stupid to help myself.",1,0,1,0,0,
99e475d7-f0aa-4f04-97a0-39cd60e15f4e,1420576608,"The best thing would be to look at some state parks around you online, and see if they mention accessibility. If they don't, then just give them a call and see if they can tell you how it'll be. It can definitely be a bitch trying to find a place that feels outdoorsy without feeling impossible to get around. A Freewheel would be fuckin sweet, but I just don't want to throw $600 at it every time I think of getting one.

As for camping, I still love it, but it sucks having to work around the bathroom situation. Outside of that, it's tons of fun.",1,0,1,0,0,
049fecbd-5d9a-4727-aa92-ea113ee3b54c,1422148238,"yeah, im in a wheelchair full time and will be for the foreseeable future so i plan on it, i just dont know which way to go or how to",1,0,1,0,0,
0ddb56dc-e1a9-4313-a035-963ae97406e0,1422316284,"It's commendable to attempt to see things from someone else's point of view, but honestly the question ""do you find 'in case of fire, use stairs' offensive?"" has to be one of the most ridiculous questions I've heard in years. If a disabled person attempted to make a stink about that, I would be first in line to crack them over the head with my cane. There's nothing segregating about following logical safety protocols. If the building is on fire, *everyone* goes down the stairs, even if that means abandoning a wheelchair and being dragged down the stairs. You'll be bruised and sore, sure, but it beats burning to death in a metal box. I actually find the question borderline insulting, though I'm trying to be nice because I think your intentions are good. But what your question implies is that disabled people are so *Other* that you could not possibly share similar enough experiences to come to a similar conclusion about something as basic and inarguable as ""when the building's on fire, take the stairs."" Basically what you're saying is that the disabled are as a whole so unknowable that you need one of them to talk you through every minute aspect of something so extraordinarily inane. I do think you mean well, but the expectations you seem to have of us as a whole are rather insulting.",5,0,5,0,0,
7e348e81-c25b-41eb-a98f-c8a2c52c2384,1421247427,"Have CP. Did get a letter saying no review at this time recently., was rather surprised and very relieved.",1,0,1,0,0,
73866e75-10f8-484a-9a53-5e546de1ac5d,1422467305,I do not have a disability myself but work with adults with cognitive/intellectual disabilities. Are you guys thinking of expanding to that population? ,1,0,1,0,0,
0ddb56dc-e1a9-4313-a035-963ae97406e0,1422120213,"So far I haven't run into much of this. I'm relatively new to being disabled (started using a cane and had to stop working just last June) but I assume I will react to it by being a smart-ass, as is my way. I tend to get the opposite reaction, in that people go out of their way to be nice to me. I appreciate it, but sometimes it makes me feel more self-conscious than I think I would if they just ignored me entirely. If I'm in a situation like a packed waiting room and someone offers their seat to me it can get very uncomfortable because they're often insistent that I take it, and then I have to explain that sitting normally in a chair actually causes more pain than simply standing (I have to keep the left leg elevated, otherwise my hip and knee get pissed off). ",2,0,2,0,0,
4e474cdd-3f71-4e94-8b7e-cfdfad11be3b,1420255584,"my mistake, it was /r/interestingasfuck, not /r/gifs, link is below: 

np.reddit.com/r/interestingasfuck/comments/2r2vql/motorized_attachment_for_a_wheelchair/

the wheelchair-motor is called a ""firefly"" made by Rio mobility: http://riomobility.com/en/powerhandcycle/firefly-benefits.html",2,0,2,0,0,
f0d68960-0b55-4b63-b2ef-f2cfe7108c08,1420152354,"Deaf are not the only users of sign.  I teach multiple nonverbal children who sign.  I have a friend who from fire injury has burned vocal cords and can't speak.  I have friends who have had ""the cure for deafness""  and it failed.  The repair was ineffective. 
Really, the medical/cultural deafness argument is annoying to me...  However I continue to respect both with an understanding that both views are correct and wrong in different lights. ",5,0,5,0,0,
46699cef-90bf-4cda-9936-790c1575cda4,1420422639,"A warm hat and layers of clothes. Also I have a ridiculously good coat. Put on an extra layer at least 10 minutes before you go out so you have time to warm it up a bit beforeally adding final layers and going out.

Biggest problem I have is cold hands. I'm Para, and have a manual chair. When my wheels get cold my hands suffer for it and I haven't found a pair of fingered gloves that allow me to control my chair. I have fingerless mittens that help loads though.

How much can you move? If i am really cold inside then 5 minutes of waving my arms around madly helps. Makes me look a touch demented though :)

Else if I am inside eating or drinking something warm helps lots. ",1,0,1,0,0,
d42b72a0-f3b8-47b4-8199-fe3b27dfa74b,1422244553,"Yeah, a big campus was brutal on my body. I would either try to give myself a gap between courses so I'm not having to rush anywhere, or keep them in the same building. Luckily I studied Literature, and about a third of my humanities degree allowed me to take just about anything, and so I did to get those back to back classes in the same room. It also helped that my school didn't have the biggest humanities program, and everything was confined to about 5 buildings unfortunately spread around the edge of campus in a sort of star shape.
",1,0,1,0,0,
85d78199-6a32-4e80-aa98-2b4135b65903,1420973081,What do you mean? You are the one that assigns the ticket if you are a SSA beneficiary. That's the whole point. Read up! http://www.chooseworkttw.net/about/how-it-works/index.html,1,0,1,0,0,
8374f308-8ba5-4f41-9ae2-783b45ae226a,1420462901,"No problem. 

If it the high of the buggy could be easily adjusted to suit the needs of the parent/child. That would be awesome. ",2,0,2,0,0,
ab79de79-0229-458c-a4d5-5c0a08df738a,1420270503,This is an interesting case because the [Florida permit application](http://www.flhsmv.gov/dmv/forms/btr/83039.pdf) doesn't actually specify a condition that's consistent with this woman's disability and doesn't really allow for exceptions either. They should probably change the law/form.,3,0,3,0,0,
1367f57b-7c53-45f2-8e20-c0082dd78690,1420415778,"Why can't he try wheelchair rugby? Is it a competitive team? If it's a recreational thing they might not be adverse to him trying it out.

Even if he can't join in the team, you could do some wheelchair-y sports stuff which I think would be fun :D

I'm in Canada though, where we let AB people play on a national scale for wheelchair basketball because there's already a lot of people who like an AB in a chair anyways (amputees for one) and it opens up the playing field (and the points system for who is on the floor means they can't overtake it, which would be a concern otherwise).

edit: Also, in the summer, what about canoeing? Sounds like you've possibly got the arm strength/ability for it.",1,0,1,0,0,
99e475d7-f0aa-4f04-97a0-39cd60e15f4e,1420448691,"My SO and I (she's AB) go hiking pretty often. Easy trails, obviously, but it's time outside and it's always nice. Good cardio, too. If you guys have some places around you, I'd recommend it!

We also shoot fairly often, that's always fun too. ",2,0,2,0,0,
d999ea9b-a56a-4e83-860a-be1e47f4db39,1422393842,Wish it could be a little cheaper for the people who are usually on a social security income.,3,0,3,0,0,
246ef8d2-58a0-445b-a390-ebfa078d858c,1420216873,"You know, I just realized.  The picture in the article isn't even a sign.  It's gibberish.",1,0,1,0,0,
d42b72a0-f3b8-47b4-8199-fe3b27dfa74b,1422157300,"Good to hear. Do you partake in some form of sport or exercise?

Actually I could extend that question a little further... have you any experiences with physiotherapy? If so do you feel they helped you at all?",1,0,1,0,0,
4e474cdd-3f71-4e94-8b7e-cfdfad11be3b,1420605500,"your uni should have a ""disability services"" office.  Check with them.  http://sas.mcmaster.ca  Most uni syllabi have a short blurb about access/accommodations for people with disabilities.  You should be prepared to have formal documentation though, since most schools will not lift a finger if you have not gone through the medical system.  Bullshit, but thats the way the system operates.  ",1,0,1,0,0,
ee283915-14f7-48e3-97c6-f5f7dfcb6dc9,1421938124,"The point of the poems is using the women and their stories as vehicles for universal themes. Emily Dickinson is the dichotomy between death and beauty, Pocahontas explores loss of innocence. Scheherazade explores endurance. Lilith speaks of pride. So the women and their stories have to be known enough to understand references to their lives without detracting from the meaning of the poem.

I do write about my own story, but it would not suit this purpose.  My story is too personal to me for me to explore a universal meaning to it. If I were to write my story it would be autobiographical with no purposeful subtext.

When I complete the poems about women with disabilities I'll share them, but my goal is to write 100 poems this year. 2 people with disabilities seems a bit under doing it. Ideally I'd like 3 or 4 more. 

I don't write inspiration porn for others. I write it on my bathroom mirror exclusively for myself.

Thank you for all the ideas though. Maybe my next set will have the theme of different disabilities as vehicles for broader meaning. Or perhaps use the disability as something akin to magical realism. I'll have to think on it more after my current project.

If you think of any famous women, fictional or real, please let me know. ^-^
",1,0,1,0,0,
65eb3d01-3c5f-4f46-bbd9-7f98ef92e763,1420560701,"While I think you are giving some good advice. I think I need to point out a few things. First, SSA is not going to be able to communicate by email. Those rules are in place due to the fact we can't ensure privacy and be sure who ware talking sure. Sure, the email could be comeing from johnsmith.yahoo.com but we can't know for sure that John is the one corresponding to us. 

Second, I strongly advice against using ""human rights"" and ""discrimination"" when dealing with SSA. Nothing will irritate someone from SSA more than using those words or making it seem like we don't know what we are doing. Using that kind of language makes you seem argumentative. Trust me, you're only  hurting yourself. ",2,0,2,0,0,
b82056e1-38b6-4aaf-b241-1d54fe75a2f8,1420338267,"I should have listened to you.  Holy crap, it's a perfect storm of politics, hatred, and ignorance.",2,0,2,0,0,
82db3290-4dbe-49c0-9b24-bf901f2aaa76,1420152255,"The difference is that people who speak other languages can learn English, while many deaf people will never be able to speak or understand spoken language. I know that learning English is a challenge and isn't accessible to everyone and it's great for Americans to learn Spanish, but at least the option exists.",3,0,3,0,0,
37f84417-f829-4671-99d3-7ee8393787ad,1422096145,"When someone tells me I can't do something, it just spurs me on to make it happen. I'm a big believer in flipping negative shit around to make it motivating. Nothing makes me work harder than anger.

Within reason though, like if someone tells me I can't run up a flight of stairs I'm like well yeah, ok, what else you got?
",3,0,3,0,0,
1f7b75e8-9ad2-4847-b1db-98a614f98445,1422584479,This is just about exactly the kind of example I needed.  Thanks!,1,0,1,0,0,
ceb73558-e339-40a4-8a6f-e74634d196a9,1420461974,"First of all, thank you very much for getting back to us, it really means a lot!

our Univeristy has a prosthetics department who allowed us to use their wheelchairs which really did make us realise how things like difficult just pushing up hills can be. ",2,0,2,0,0,
c0214792-62d0-4b84-8f45-4bcd7d7402e8,1421395918,"This article is wonderful, &amp; articulates much of what i have often tried to say. Thanks for sharing.",3,0,3,0,0,
d42770b1-9f84-462c-9536-090461a2ff56,1421032020,"What if the person, who is on disability due to mental illness, doesn't see a doctor after they're approved for disability? How much doctor/hospital records does there have to be in between reviews?",4,0,4,0,0,
3f2921a3-1424-4bca-822c-2915a73a519f,1422161833,"depends if your disability is long term or not, but it doesn't hurt to apply for it.   What is your disability? ",1,0,1,0,0,
1367f57b-7c53-45f2-8e20-c0082dd78690,1420496959,"I so recommend it. I haven't been in forever, but I so want to. I gotta get my blades sharpened first, and then LOOK OUT.

Plus, when you use a sledge. You get to have sticks with ice picks. You get to be legally armed. Mwahahahahaha.",1,0,1,0,0,
58101f45-4da5-4552-b809-7f4166f6530a,1420473895,"Do you have any resources you use for finding friendly trails? Whenever I've done it, it frankly feels like a slog in a manual chair, more muscling wheelies over mulch than real cardio. I'd like to get one of those FreeWheels for hiking, but for now I have tiny-ass little casters that get caught in EVERYTHING. I really like camping/hiking, and it's made me sad that I haven't had a great experience with it since I started using wheels.",1,0,1,0,0,
7866a899-033c-405d-a215-db082d9500d9,1421224177,"I'll PM you some answers to these questions later.
",1,0,1,0,0,
a24c9519-3557-4466-875a-5915ddd0bdfd,1421631420,How about students with special needs?,1,0,1,0,0,
