commentator_id,created_utc,anonymized_body,ups,downs,score,controversiality,gilded,distinguished
7e36148b-2b74-4bba-b469-eb50434fa64b,1421935889,"How cool that you are doing this! 
Hey, check out scrivener software if you haven't already- I find it super motivating for my writing. I also got into making rubber stamps, drawing/painting, and taking classes online at coursera, if you want any other ""stuck at home""solutions (share yours if you think of more; I'm always looking for new ideas!)..
Okay,back to your question! 
How about doing a piece with a non-famous person with a disability? Like yourself and your own experience, or someone you know? 
Sure, there are people with a disability who changed the world, but there we also people with a disability who change their small corner of the world. 
I think it depends on the kind of piece you are writing. 
Are you trying to write about an amazing thing that happened that is associated with someone with a disability, or are you wanting to write about an aspect of the experience of disability? I think it would be neat to have writing that features disability but isn't inspiration porn. I try to work this idea into my own writing (prose fiction, only sometimes poetry) by having characters with a disability who have a story that is unrelated to the disability. How they tackle problems or relate to the world is influenced by the presence of their disability, but the story isn't about that. 
Of course, poetry is a tighter venue with less space to flesh out a character and their story, so I think any suggestions we think of would need to be informed by what kind of piece you are writing and what your purpose for it is. 
Sorry, I don't think I have been helpful. . But I would love to read your work and I think it's awesome that you are thinking up ways to recreate your life within the parameters that are not in your control. That on its own would be a good subject for a poem....

All the best &amp; write me anytime!",2,0,2,0,0,
4e474cdd-3f71-4e94-8b7e-cfdfad11be3b,1421191704,"Lynchian versus Kafkaesque, why is it that the majority of metaphors used to depict disability are macabre and terrifying??

edit: a word",4,0,4,0,0,
be0a4a5e-9696-49f1-8c11-bc56e9011076,1421195934,"Not a problem, I hope this all works out for you, good luck!",1,0,1,0,0,
0ddb56dc-e1a9-4313-a035-963ae97406e0,1422317570,"Awesome. Well, feel free to pass my message along verbatim if needed.",2,0,2,0,0,
8678158d-3ddc-4920-ac29-98f574855a46,1420783087,"What's the price?

Any financial help available?

How is this different from a modified minivan? 

Is it easier than usual to install adaptive equipment?

As you might tell, I don't know car things... I'm not sure if these are stupid questions or not.",1,0,1,0,0,
74e3d7ec-b2da-4588-8de0-cf177a600dd4,1420603828,I go to mcmaster university in hamilton for biology :) ,1,0,1,0,0,
c29436b1-7881-4dde-8af1-b06a7f7ce1ae,1422562712,Uh... because you can easily modify an argo to be accessible... and uh... they have been around for decades so they're tried tested and uh... true...,1,0,1,0,0,
85895094-19d1-448c-9131-b23c0e563eea,1422740617,Is it safe to go out at night alone if you're *not* in a wheelchair? Then go.,1,0,1,0,0,
4284471f-0b33-4e27-ad5b-fa2a602af16a,1422326635,What resources do you suggest to find accessible housing? ,1,0,1,0,0,
d42770b1-9f84-462c-9536-090461a2ff56,1421030585,Most people who get disability have it for the rest of their lives. I am in a review right now. I'm not sweating it. No doctor has produced a miracle cure as much as I wish they could...,3,0,3,0,0,
a17492ed-91bc-400e-8830-698a1b0f04c2,1421628308,"How about ""students with psychiatric disorders"" and ""students with learning disabilities""? Either way, the primary focus is that they are students. ",2,0,2,0,0,
b353aeb5-7cea-49b3-8473-b4346795c053,1422701296,"I do but most online applications in the UK have it as a very separate section. You can see when you print it off that it's on a separate page and would not be forwarded to selectors, only used for equality monitoring.",2,0,2,0,0,
19ff30be-c676-47df-a64d-e67cfeeec093,1422567159,"I'd also like to see accessibility facts on how open the area is and whether the staff is Deaf friendly. As in, will they show us respect if we request writing notes or showing them what we want on phones without them sighing and rolling their eyes like I get most of the time at food chains.

So I guess what I'm asking is:

1. Open space, lights are comfortable and not too dark or too bright, tables where people can face eachother easily.

2. receptive staff that puts the effort to communicate, tries to clarify things if they're confused or we're confused.",3,0,3,0,0,
084f1e68-8501-48b1-bcc4-f7c09b843667,1421352440,Stretching and trying to reduce stress.  Exercise and a good diet can also help.,2,0,2,0,0,
d42770b1-9f84-462c-9536-090461a2ff56,1420934953,"It hurts to be in normal position. They usually bend into half fists (claws) without me noticing and at work I will randomly twist my hands backwards so my palm is facing up but backward and lean. I'm definitely going to ask, though. Thanks!",1,0,1,0,0,
d0d4be64-a550-443e-ac4b-255d418ab00c,1421849907,"I am a little confused, in the footer of there is a link to the ""Muffin Group."" Unless this is another venture of yours or a family member, as one of the leaders of this organization, why did you go with this firm to make your website? You basically just said ""the firm doesn't know what they're doing."" That is a bad business decision in my opinion.

&gt; Can you tell me what you mean that you cant use the site?

Yes. Some examples:

* people with mobile impairments typically don't use the mouse when using a computer, rather they use the keyboard, this also goes for blind individuals. The nav menu cannot be reached via keyboard, so they wouldn't be able to move past your homepage (if found via Google/etc), or the *Cause* page (if they used your link above)
* on your *Cause* page it is literally one big image. using images of text is a **huge** no-no for accessibility. Not to mention Search Engines won't see anything on this page.
* furthermore they give the image a null alt (`alt=""""`), which tells screen readers to ignore it. So this page is effectively blank for people with visual disabilities.
* there is poor contrast in parts of the page
* You have a video on the page that doesn't have captions. The automatic captions are a complete joke, just watch for about 10 sec.

See: http://webaim.org/ for starters",1,0,1,0,0,
ba01e4df-67b4-4802-9aa6-e9086b5f9d81,1422495918,Shocking. That's a shocking revelation right there. ,2,0,2,0,0,
b58a4be3-5104-4d86-aac9-7b24a42061db,1422485052,It looks like you're onto something. I can't think of any way to improve except that fewer legs are always a good thing. ,3,0,3,0,0,
fee77648-82f7-486b-8fbb-2bb004c4ce06,1420818552,(Cheers) I'm glad you've found a more positive outlook. Thank you for sharing!,1,0,1,0,0,
ef412993-27c5-48a5-9801-18ab9d1204e0,1421044028,"How often does your doctor want you to come in? SSA wants some kind of record of ongoing treatment. If you haven't been in a long time, it wouldn't hurt to go and get it on record.",2,0,2,0,0,
af670ebc-c0ea-45b8-b314-4b45408cb7c1,1422153040,"           9. I take Vesicare for my bladder (it calms it down so I don't have to go too much) as well as my Botox injections (which I've mentioned before). Other than that I take citalopram for depression, and BC for you know.... lol. I have to watch how much sugar I intake and the amount of fast food that I eat or it's going to be a hell of a morning the next day. :P Sorry for the TMI. Are you doing this for a research project? :) Thanks for the questions!!",3,0,3,0,0,
ba01e4df-67b4-4802-9aa6-e9086b5f9d81,1421650988,"I think people should be able to refer to themselves as they wish, but it irks me when people pull that kind of thing. ",3,0,3,0,0,
b3d791b3-a09e-435d-b7b3-5e701c9c6118,1420829816,"ADA guidelines are a good reference point.  They are required for commercial use, but not normally, for home use.  ADA requires one foot of ramp for each inch of rise (1:12), so a 10 inch rise would require a 10 foot ramp.  You typically, do not want to go shorter than half of what ADA would recommend (2:12), so a 5 foot ramp in the example.  You can also buy [portable ramps](http://www.portable-wheelchair-ramps.com/portable-ramps/trifold-ramps.aspx) fairly inexpensively.  Saves you some time and you know they are up to the job.  ",1,0,1,0,0,
3aa92a47-c0e5-4ef2-a991-f517acd65784,1422148461,well I know here there is a disability benefits office you can go to to talk to someone and get the papers you fill out. It's in the phone book and online too. Maybe try googling it for your area? ,1,0,1,0,0,
ab79de79-0229-458c-a4d5-5c0a08df738a,1421368738,"Needs to be cheaper. Much cheaper. I'd buy one tomorrow if it was $5k, think about it for $10k, forget about it for anything more than that. ",1,0,1,0,0,
74e3d7ec-b2da-4588-8de0-cf177a600dd4,1420844905,"As well I found out that you can get remembrised for your evaluation by the  , well in canada. I am since My parents do not have insurance. maybe they do that in the states.",1,0,1,0,0,
fa267a45-cb57-455c-a075-a5de69e68efd,1422372722,"Thanks for the question! 

Depending on where you live, there may be a [Center for Independent Living](http://www.ilru.org/projects/cil-net/cil-center-and-association-directory) that could help. 

Also, the Fair Housing Act requires that certain units in multifamily housing that has 4 or more units per building and that was built for first occupancy after March 1991 has to have certain minimum accessibility features, such as studs in bathroom walls for grab bar installation, accessible building entrances, light switches at certain heights, etc. [This booklet](http://www.huduser.org/publications/PDF/FAIRHOUSING/fairfull.pdf) gives some guidelines on the accessibility requirements. 

Good luck!",1,0,1,0,0,
ca2d5ddf-11bc-4597-abb5-d3f7ae707019,1422411046,"My experience with wheelchairs scales is that all of them are far too inaccurate.   I won't even let the nurses attempt a wheelchair scale weight anymore because it is a waste of time.  We just use a scale that will let my 10 year old sit directly on it and do transfers in and out of his chair.   Accuracy is important for him due to failure to thrive, severe GI issues and growth insufficiency that requires yearly body measurements, weight checks and blood draws.   ",2,0,2,0,0,
48aa8e29-c585-4b0b-8c48-7f063b9c4b8b,1420077830,"I believe that in order to apply for disability, your condition must ""be expected to last 12 months or more"".  

I've applied for disability four times.  The first time, I was living in a different state and they didn't even bother to contact me when they denied me.

The second and third times, I was in my current state.  They denied me, and did notify me of it, but I wasn't able to appeal the decisions in time.

Fourth time, I applied right before moving.  After I moved, I went to the Social Security office to update them on my contact information.

The man there told me that they have NO RECORD of me EVER having applied for disability!  Not in the other state, or in the other county before I moved to this county.  He even ran my social security number and it brought up zero results!  

I'm gonna be applying for the fifth time soon.  Is it worth it to me?  Yes, because I'm unable to work at all.  I NEED it, so I'm willing to keep trying.  YMMV.",2,0,2,0,0,
3aa92a47-c0e5-4ef2-a991-f517acd65784,1422149794,"Yeah I'm sick all the time- especially since my daughter started school. Mostly bladder infections, also sensitive stomach, headaches. 

What are your experiences with relationships?",3,0,3,0,0,
e05d9213-a423-44d9-9b1f-3769ae59bc07,1420412209,"I just read the Florida disability placard application and the only allowable disabilities are all mobility or visual problems . So how did she get a placard with a neurology disability when even with the special exception on the application you have to have a mobility or sight issue as well ? Is she like several people I've know who's Dr lied on the application because they felt the person should get a placard  even though by the law was not eligible ? If that is the case I hope she and her Dr are ready to tell a judge why she doesn't have to follow the law like every one else . I also don't understand why she can't just draw a map of where she parked her car or park under or near one of the number or letter signs that almost all large parking lots have to help people remember where they parked their car . I use to do this when my legs use to work OK . It would piss me off if I could not find a open handicap spot to use because some one who did not met my states law for having a placard had a placard and was using a spot I needed and was legally entitled to. Some one who could just write a map on a piece of paper or even a letter on her hand to find her car but it was easer for her to use a handicap parking spot , that I see by the permit app she does not qualify to use . If I don't have the extra room to get in and out of my car with my crutches ( on a good day ) or my wheelchair ( on a bad day ) , and the ramp , that doesn't make it easier,  it makes it possible to get to the sidewalk  I don't risk using a regular spot that the car next to it left enough space that I can get out OK because I have done that in the past only to come back and find a new car next to me and not enough space left between the cars for me  to get in my car . ",3,0,3,0,0,
d6d36ecf-a6c0-4fd8-9fa0-13def72aa38d,1420121228,"I'm never heard of temporary either but I think that applies more to my case because there is a chance some of the conditions can will go away once my  pituitary gland adjusts to the surgery. Fingers crossed!
",1,0,1,0,0,
dd19c642-f242-477f-a6f8-b376d9b6fde3,1422657141,Don't put your education on hold. ,3,0,3,0,0,
74e3d7ec-b2da-4588-8de0-cf177a600dd4,1420681966,thanks everyone for the responses. I went today and gave explained the situation to them and with my documents. All went pretty well and we were going to discuss accommodations next week  and funding possibilities for equipment I will need :) ,1,0,1,0,0,
65eb3d01-3c5f-4f46-bbd9-7f98ef92e763,1420569685,I believe you if you say that is your problem. I wast just making more of a general statement as to the language that you receive. I think that one thing you have going for you is that you were previously allowed benefits (even if just a closed period). Presumably you have the documentation showing your condition worsening probably close to the point you were when you were granted disability. I think that applying is defintly worth a shot. ,1,0,1,0,0,
9b087923-5808-446e-8bc0-3e344884ac0b,1421653772,"I get that, but being told that my identity/label is wrong is just another microaggression. It's ableism, mild yes, but still... no one feels justified to question someone else's sexual or racial identity. ",4,0,4,0,0,
c37550a2-7733-4a67-9fbe-82e928a249dc,1422049417,"Thanks for your input.  Yeah, and there are so many legal loopholes (as I'm sure you know) around building codes and regulations--which are vague at best.  At one of the major universities in my state, most of the buildings aren't even accessible from the outside because they are considered ""historical landmarks"" and are therefore exempt from bringing buildings up to code.  It's sickening.",1,0,1,0,0,
b0a0f9e3-aa59-48f1-a420-089b6550f0d3,1422736020,"I realize the subject is a double edged sword (no pun intended) it was my understanding that OP's original intention was more to pick up female companions, than to drink. But I agree, if you're going to be drinking too, carrying a deadly weapon is not advisable.",1,0,1,0,0,
b3d791b3-a09e-435d-b7b3-5e701c9c6118,1420828279,"Its a nice idea.  You do want to make sure that you look at the [ADA Ramp Guidelines](http://www.modular-wheelchair-ramps.com/modular-ramps/ada-guidelines.aspx).  You may be able to get some funding through local churches and/or organizations/charities.  Building out of wood may be a little cheaper, but if you get some funding, aluminum ramps are better.  You can move them from one location to another if no longer needed.",1,0,1,0,0,
99e475d7-f0aa-4f04-97a0-39cd60e15f4e,1422667256,I do. Pay attention to your surroundings and you'll be fine.,3,0,3,0,0,
ee283915-14f7-48e3-97c6-f5f7dfcb6dc9,1422050058,"My house was built in the 20s. I love it. It was owned till the man died, now it's owned by his son. There are a LOT of handicap adjustments to the house. The bathroom is a dream. Big enough for a wheelchair and handrails! The hallways are just super narrow. 

I haven't run into going out and not having handicap access ability yet, but then again, I only leave my house to visit friends and the grocery store. ",1,0,1,0,0,
ba506967-9587-497a-8fde-fefa59d05c18,1421879306,"Yes, it's a horrible situation.  Even with protections against discrimination it still happens all the time.  ",1,0,1,0,0,
65eb3d01-3c5f-4f46-bbd9-7f98ef92e763,1421503852,"Just so you know, the doctors that we send people to don't actually make the decision. All we are needing from them is to give us a basic exam because we don't have enough in file. And be wary of the ""independent"" exam; you are paying them to give you an opinion that is favorable to you. We never take those very seriously. We will use the objective evidence (ie range of motion) but not the opinion. ",1,0,1,0,0,
65eb3d01-3c5f-4f46-bbd9-7f98ef92e763,1420560893,"I want to address the reasoning that you were denied the first time. That you can adjust to other work. Once of the big misconceptions with disability is that you can qualify if you can't do the work you used to. The rules state that you have be unable to do all work based on your age, education, and work experience. So just because you won't be able to do the work you used to (due to disability or the sales agreement) doesn't mean you can't 'adjust' to other work.  As someone else recommended seek out a local Voc Rehab. they can help you find a job based on your needs and provide additional training. ",1,0,1,0,0,
48aa8e29-c585-4b0b-8c48-7f063b9c4b8b,1420078882,"No, each time I applied in person.  (Someone told me it's more effective to do it in person.  Plus, I had several written forms to attach to my application.)

I would go pick up the paper form, fill it out at home, and bring it back.  Since then I've found out that they should have been giving me a paper receipt each time; they never did.  ",1,0,1,0,0,
d42b72a0-f3b8-47b4-8199-fe3b27dfa74b,1422157047,"That's awesome stuff about the work and school. Is it a large campus, and do you have to move about a lot? When I was at University I did my absolute best to keep classes as close to one another as possible else risk being dead tired at the end of the day from moving about. Every semester I would manage to have two classes back to back in the same room. Had to pick a lot of courses I'd never have looked at otherwise, but that just made it a little fun. No place like University to get out of your comfort zone. ",1,0,1,0,0,
4d8f5eb0-bf81-48df-a2c4-4d63e10c6b94,1422327864,"Go get them, get loans. A lot of states will give you better benefits for going to school. ",1,0,1,0,0,
4603dfc1-a6c6-441d-8f71-719f862c601d,1421982283,"I'm in the same boat. How about:    
    
* **Laura Hillenbrand**- author of Seabiscuit and Unbroken, suffers from ME-CFS, homebound, often bed-bound, wrote two bestselling novels while disabled, which have been made into feature films.  
    
* **Marlee Matlin**- actress, deaf.   
    
* **Sarah Bernhardt**- French actress, Disabled by a knee injury, her leg amputated in 1914, she continued starring on stage until just before her death.    
    
* **Dorothea Lange** - Photographer, walked with a limp due to contracting polio at the age of seven. She said of her disability - ""I think it was perhaps the most important thing that happened to me. If formed me, guided me, instructed me, helped me, humiliated me, all those things at once. I've never gotten over it, and I am aware of the force and power of it."" Lange spent her life traveling the world photographing mostly the disenfranchised.     
    
* **Audre Lorde** - Poet, Activist, she underwent a mastectomy for breast cancer she refused to wear a prothesis stating, ""Either I love my body one-breasted now, or remain forever alien to myself."" Lorde won several awards for her writing.   
    
* **Judi Chamberlin** - Mental Patients' Liberation Activist, In her early 20s Judi Chamberlin was hospitalized in a state institution due to depression. She was horrified by the prison-like atomosphere of the hospital and soon discovered that, as a psychiatric patient, she had no legal rights. Later, in the 1970s, Judi cofounded a group of psychiatric survivors called the Mental Patients Liberation Front. In 1978 she published a book, On Our Own: Patient-Controlled Alternatives to the Mental Health System.    
    
* **Wilma Mankiller** - Principal Chief of the Cherokee Nation, Muscular Dystrophy.     
    
* **Harilyn Rousso** - Disability Rights Activist/Psychotherapist, Cerebral Palsy,  In the early 1980s she helped design the Networking Project for Disabled Women and Girls, and in 1988 Harilyn edited the book, Disabled, Female, and Proud.     
    
* **Judy Heumann** - Assistant Secretary of Education, Polio, fought all her life to be included in the educational system. When the New York City Board of Education refused to let her teach, even the ACLU would not help, but after a long struggle she eventually won her case. In 1970 Judy and several disabled friends founded Disabled in Action, an organization that set out to secure the protection of people with disabilities under civil rights laws.     
    
[Here's a huge list of famous men and women with various disabilities.](http://www.disabled-world.com/artman/publish/article_0060.shtml)",2,0,2,0,0,
d0d4be64-a550-443e-ac4b-255d418ab00c,1421781534,You may want to tell the web development firm to redo the site. As it stands there are a number of places were people with disabilities cannot use the site.,2,0,2,0,0,
a24c9519-3557-4466-875a-5915ddd0bdfd,1421649054,"I feel it sounds better and it describes me well. I think that words mean what people make of them. If some one calls me a cripple in the correct way with respect then I have no issue with it but if someone calls me disabled in a derogatory way then I will feel offense. Take the way nigga has been changed by the black rappers of America, dis empower the the negative and empower the positive.",1,0,1,0,0,
0ddb56dc-e1a9-4313-a035-963ae97406e0,1421519131,"Direct quote from the SSI letter, this was supposed to be a ""physical exam"" to gather evidence about my claim for ""Fibromyalgia, back injury and vertigo."" And according to the doctor, she was only assessing the back injury, nothing else (that discrepancy is still bugging me). How does a ""physical exam for a back injury"" equate to ROM for the legs and arms and testing the knee reflex, and nothing else? And I would have *loved* if she had taken my gait into account. I have to use a cane because my life side is not as coordinated as it should be. She didn't even ask me to stand, just tested my reflexes. Also, while she was doing ROM she spouted her holistic anti-medication bias when her assistant told her my current medications and she decided that my seizure-like episodes of Dystonia are pseudo-seizures or caused by the medication, because apparently she knows better than a *neurologist* who has actually seen videos of my episodes, and she flat-out dismissed me when I told her I've had incidents of these motor disturbances prior to taking any medication. I also *loved* that she decided that the rash on my face was caused by my sunglasses and not Lupus, as my *rheumatologist* believes, and then she left before I could explain that a) it's been raining for four days, so I haven't been wearing my sunglasses and b) I get rashes elsewhere, too. As for your other suggestions of why this has happened. . . 


1. I have a current doctor, two actually.
2. My doctor's notes are fine. I know someone who works at the clinic and I asked her to look them over to make sure they were in order.
3. Obviously yes, I have been treated.
4. My doctor's notes were sent. I made calls to follow-up.


This doctor apparently sees all of her SSI people in one day, because everyone in the waiting room was there for this reason. I overheard part of her examination of the guy before me (paper-thin walls) and she asked him about his daily habits, had him walk around the office, etc. She didn't ask me shit. She walked in, saw that I'm young (29) and made her mind up then and there before she even opened her mouth. The more I describe it, the more I realize just how screwed up it was. I'm going to go ahead and make a complaint on Monday, though apparently that won't change anything. Maybe it will make me feel better.",1,0,1,0,0,
1837e361-dfc4-4968-8780-6d62d0eaf23d,1421557397,"I'm 'colorblind'.  I have other disabilities, but I'll just focus on that.  Driving and commuting is something of a terror, but maybe that is related to an anxiety disorder too, IDK.  A 'light curtain' at work has lights on it to tell if it is blocked or not.  They change from red to green.  I can tell by looking at the intensity.  Some colors are academic abstractions to me, like 'infrared' or 'ultraviolet'.  I don't know if some things are 'green' or 'gray'.  More on 'color vision deficiency' at /r/colorblind, and there are also other sub's for other specific disabilities.  ",2,0,2,0,0,
dd19c642-f242-477f-a6f8-b376d9b6fde3,1422315043,Medicaid should cover an aide for him. Just find a reliable one. It shouldn't all be on your shoulders. ,2,0,2,0,0,
