commentator_id,created_utc,anonymized_body,ups,downs,score,controversiality,gilded,distinguished
89604901-25a2-4f01-8f05-b617633f97b0,1422668280,"I'd say it depends on where you live etc.

I've been followed home [when I used to live in a dodgier neighbourhood] significantly more when I've been on crutches than when I'm not. I guess because I'm an easier target?",3,0,3,0,0,
8b5b2d99-9c31-4822-99fa-9949e3120e32,1422103078,This will come eventually. They are still on the ground floor of this technology wise and once it advances to where it is safe enough they can make accessible vehicles. The Google car can't even drive in wet weather yet so give it some time. ,1,0,1,0,0,
35f8a781-fbd3-4889-9216-18213050a832,1420303544,"For the last 20 years I've feared someone harassing me just like this lady. I've had the stares but no one has confronted me yet. I already have a plan though. If someone starts harassing me, I'll tell them to call the cops and I'll wait. Then, when the cops arrive, I'll explain these people have been harassing me and then show the police my braces, with the hope that the people get a ticket. 

It's my fantasy, but luckily, hasn't happened yet. :-D ",1,0,1,0,0,
650a3277-0857-45ef-b421-41fb926ad9cc,1420595739,"There are jobs out there for people who cannot meet a regular schedule.  They're hard to find at times, but the Dept. of Vocational Rehab is definitely your best bet for working something out and getting employed.  I would continue applying for disability, get a benefits advocate (generally they do not get paid unless you get the benefits) and get a case manager with DVR.  That should cover your bases (not to mention keep you as busy as a job would).  ",2,0,2,0,0,
ae5708f7-eab8-436d-b8cd-8a8edd4de91c,1421006852,"Good luck.  My Vocational Rehab sent me to a Junior Blind of America school where my caseworker was SUPPOSED to help me apply for college and have tutorial help with my courses, but instead she placed me into a dead-end job where my co-workers resented the presence of a short one-eyed man with hearing aids and made the environment subtly hostile.  Good thing I took the hint and got a clue and am now staying home forever on disability.  Hopefully things work out better for you.  Good luck!",2,0,2,0,0,
65eb3d01-3c5f-4f46-bbd9-7f98ef92e763,1420209858,"By law an attorney representing you for SSDI cannot charge you anything to take your case. If you win they get 25% of your backpay (up to $6000). If they try to get you to pay them extra don't. I have seen some attorneys do some shady things to get more money out of people including making the person pay them to get medical records (which ssa does anyway) or having them pay out of pocket to get a whole bunch of evaluations done (which, if i'm being honest doesn't help your case). 

I think there are pros and cons to getting a smaller firm vs one of the bigger disability firms. If all they do is disability they already know what they are doing but i find those big firms sometimes aren't as cooperative with SSA. 

And, please people, this comes up in EVERY thread. SSA does not deny people once just for fun. 30% of people are allowed the first time around. Which is a high number when you consider that about 50% of all SSDI/SSI filings are bogus (like straight making stuff up). ",7,0,7,0,0,
084f1e68-8501-48b1-bcc4-f7c09b843667,1420478418,People are always so quick to judge.,1,0,1,0,0,
af670ebc-c0ea-45b8-b314-4b45408cb7c1,1422152927,"          8. I honestly wouldn't change anything that I have right other than my incontinence issues. I do get Botox injections every year though, so that helps a lot, and I've moved up from diapers to incontinence pads that are barely notice (sorry for the TMI). If they have something to help with my incontinence within the next 20 years that would be fantabulous!",2,0,2,0,0,
af670ebc-c0ea-45b8-b314-4b45408cb7c1,1422219179,"WHAT? That's crazy, and lol, no it's not normal to be incontinent. I hope you find out soon, I would hate to have that hanging over my head. And not really, just expensive sometimes, and you're more prone to getting bladder infections because of it. I don't think they're that bad honestly, and beats trying to pee and hold your breath at the same time haha. When I had my first Botox injection done, they took a scope to check out my bladder on the inside (which I honestly didn't know they were doing that until I looked at my records 3 months later-ha!) and there was some scarring from the catheter. It hurts sometimes when you do hit the inside of the bladder with it, but honestly, I've been pretty good with them. Just have to make sure to wash them, and keep everything clean down there to avoid bladder/kidney infections. I would reccomend them though, if you don't use them. Can I ask what happened at the ER?",1,0,1,0,0,
f0d68960-0b55-4b63-b2ef-f2cfe7108c08,1420207325,"Deaf can learn other languages and spoken languages.  I have a prof who is profoundly deaf,  no amplification and fluent in 5 languages.  It took the right support and modification to instruction. 

Deaf people often are not given the opportunity to learn a second language because 1st language typically develops too late and instruction takes major changes for most. ",1,0,1,0,0,
f1251df5-9a11-443d-9884-8ac29def5007,1422742817,"I use a manual wheelchair myself. 

While technically speaking, you MAY be an easier target, I haven't had problems so far. Also, I think a mugger is getting caught more easily / gets punished harder for robbing a wheelchair user, but that's just my gut feeling. ",2,0,2,0,0,
8b5b2d99-9c31-4822-99fa-9949e3120e32,1421449070,"HIPAA isn't about them being able to ask or not either. HIPAA governs what they do with that information and what information they are allowed to give out, not what information they can ask.",2,0,2,0,0,
af670ebc-c0ea-45b8-b314-4b45408cb7c1,1422216866,"I try to go to the gym as much as I can in between school... my program is pretty heavy, so I barely have anytime for myself. Like right now, I'm actually procrastinating on an assignment haha. In the summer I use my wheelchair and go for 4 km rolls down the road, and around the downtown. I use an exercise bike at the gym, and do a lot of arm work outs :)",2,0,2,0,0,
ab79de79-0229-458c-a4d5-5c0a08df738a,1420423835,"There are 4 settings. The hottest setting usually lasts up to 2 hours but that's fine if you are going from house to car to building to car to house...if you remember to turn it off. It takes a nice 20 minutes to get toasty warm too, so I usually put on the jacket a bit before I leave. The lower settings last longer. I think the lowest is supposed to last 6-8 hours. The coat itself is warm even without the battery running. I usually keep the spare battery on me if they're both charged so there's always a backup. I forgot to mention earlier that I also got a remote starter for my car and these two things combined have made winter weather so much more bearable. I have been doing a lot more stuff, even just boring errands, as a result.",2,0,2,0,0,
ca2d5ddf-11bc-4597-abb5-d3f7ae707019,1420245705,"I love it!   I do wonder how much power and how far it would take you before running out of juice.   Cool concept but curious on how practical it would be.  

Depending on practicality, I could see possibly buying one for ds for zoo outings or the like where his arms get too tired to propel but he still wants his independence. ",3,0,3,0,0,
f98011f2-b5f0-4de6-bb28-b0e64a652ad9,1420826934,I'd be curious to know a little more about what makes it more expensive to maintain. I have a modified van and it costs at least 2x as much to maintain because I have to keep up with the car itself and the modification equipment. How does the MV-1 differ on maintenance costs?,1,0,1,0,0,
8b5b2d99-9c31-4822-99fa-9949e3120e32,1422632539,"This for sure, though in this case that is something that I always check. Any event or party I get invited to, I call the place and make sure I can get where I need to before accepting the invite.",2,0,2,0,0,
37f84417-f829-4671-99d3-7ee8393787ad,1420561571,"I'm going on what has worked for me, I have no idea what exactly the SSA does and how it operates because I'm living in a different country to OP. Fair enough on the email thing, where I come from they are happy to communicate by email if you ask and they themselves prefer it for legal reasons. If there is valid reason to believe you are being discriminated against, I believe it doesn't hurt to let the other person know. That is *IF* there is a valid reason and I can't speak for whether that is the case for OP. I have faced discrimination from social workers and by letting them know, they quickly changed their tune. If I hadn't fought so hard on the human rights aspect, I wouldn't be living independently right now. I'm going based on what has worked for me in my situation but clearly there are cultural and organizational differences here which is why I called on someone else to give advice on that aspect.",2,0,2,0,0,
044e4ec4-5b9b-43bd-87af-a654a045a895,1422085143,"I used to get bummed out when people gave me dirty looks or talked shit about me because of the special stuff I have to wear to protect myself and minimize my disability, but then I was like fuck em. This is a good way to weed out terrible people anyway.",4,0,4,0,0,
af670ebc-c0ea-45b8-b314-4b45408cb7c1,1422217724,"I don't have any that I know of haha. I've been back and forth with the doctors this week because of severe pain in my knee, and my knee cap popping out of place- they're thinking that I may have premature arthritis. In the future there is a probability of tethered cord, but I don't at the time. What is fibromyalgia if you don't mind me asking?",1,0,1,0,0,
af670ebc-c0ea-45b8-b314-4b45408cb7c1,1422149148,"I think so lol. I have to watch what I eat a lot of the time to be honest, I have a sensitive tummy sometimes. Just got over a Kidney infection though, it was awful! What about you? :)",2,0,2,0,0,
65eb3d01-3c5f-4f46-bbd9-7f98ef92e763,1420209947,I'm going to be real blunt with you since you came here for information. Just based on the information above there is an almost zero chance you'd get approved for SSDI/SSI. The only possible way I would see is your HS but that would have to be so severe that you would already be on benefits. ,5,0,5,0,0,
ae5708f7-eab8-436d-b8cd-8a8edd4de91c,1422226170,Time to get ready to kill myself.,6,0,6,0,0,
d42770b1-9f84-462c-9536-090461a2ff56,1420936342,"I wasnt sure if it was normal. Thank you for the info though. At least we know for sure *something*. Fighting to believed was hell. I just convinced myself that whatever it is will become obvious. Fairly sure they'd have caught cp at birth in 1987,  right? Either way,  clear physical signs can hopefully speak to the doctor for me.",1,0,1,0,0,
99e475d7-f0aa-4f04-97a0-39cd60e15f4e,1421232919,"Awesome. So I was paralyzed when I was 14, I have a T1 complete injury so I'm paralyzed from the chest down.

&gt;-- How did your disability impact your ability to participate in play, school or other social events?

In school, since I went into high school with my injury, ""play"" wasn't really affected. I obviously couldn't do a ton during the down time when we were outside throwing the football or anything like that, but otherwise, very little changed. I also wasn't in PE, so the only adjustments made for me were longer-than-normal bathroom breaks. On the social side of things, I maintained the same friends pre and post injury, and that was actually not too affected.

&gt;-- Have have your values or beliefs influenced, or have been influenced, by your disability?

As in religious beliefs? I'm not religious, and I wasn't before the accident, so I wouldn't say it affected me. My values were changed, in the sense that I have a deeper appreciation for conveniences than I did before.

&gt;--What skills (motor, cognitive, communication) did you find most difficult due to your disability?

Motor.

&gt;--What routines or habits did you form to help you maintain a fuller life?

So my injury affects bowel/bladder control, which can be a massive problem if not managed properly. Getting on a consistent diet and bathroom schedule allowed me to actually live life without a considerable risk of an ""accident"".

&gt;--What impact has your disability had on your family? (relationships, financial, logistical, etc)

Financially, we were okay. My dad's job offered us excellent health insurance and we lucked out with the house being reasonably accessible already. It took some time to figure out how to balance independence and convenience, but we got back to a reasonable normalcy rather fast. 

&gt;Could you share what your experience was to approach common tasks you would engage in, without thought before the accident, with the new challenges of your disability?

The biggest challenges were physical, so considerations of accessibility, bathroom needs, my own ability to manage a wheelchair, etc. were the primary concern. If we wanted to go to dinner, we needed to know if it was actually accessible, if I would be able to use the bathroom if I needed it, if I could get in a booth and keep my chair next to the table, stuff like that. And then early on, I didn't have a ton of stamina and wasn't very good at transfers, so I also had to think of things like going to the mall, would I actually be able to push myself the whole time, or if I fell out of my chair, would I be able to get back in. But by and large, since the initial challenges *were* largely physical, they were things I could work on and see real improvements. So now, I really don't give much thought to what I'm doing. I know now that I can get around independently, even in places that aren't wheelchair-friendly.

Hope this helps, and if you need me to explain anything, just let me know!",1,0,1,0,0,
fa267a45-cb57-455c-a075-a5de69e68efd,1421941244,"Thanks for the question!

I'll also start this answer with a definition, but this time it will be of a reasonable accommodation, which is a change to rules, policies, practices, or services, when such accommodations may be necessary to afford a person with a disability equal opportunity to use and enjoy a dwelling.

If you are moving into a place that generally doesn't allow pets or has some other restrictions or deposits for pets, you should discuss your assistance animal with the housing provider up front. The reason we suggest this is because a housing provider is not required to allow a reasonable accommodation unless and until it is requested. Having an assistance animal, with no deposit and no pet rent, in a no-pets building is exactly the type of reasonable accommodation contemplated by the FHA.

If your housing provider generally allows pets with no deposit, no pet rent, and no size/breed restrictions, there is no need to disclose the nature of your assistance animal.

The lowest stress approach would be to discuss it up front. If the housing provider discovers the animal after the fact when pets aren't allowed, the landlord may start eviction proceedings. In that case, it will be a race with the clock to get the reasonable accommodation granted. 

We always recommend putting the request in writing, even though that is not technically required. The request should state that the animal is an assistance animal and that it provides x, y, z functions that ameliorate the effects of your disability. You do NOT need to state the nature or severity of your disability, but you do need to state what the animal does. Having a letter from your doctor, therapist, social worker, case worker, or other reliable third party definitely helps and, in fact, can be requested by the housing provider. That letter also does not need to state the nature or severity of your disability.

HUD has a memo about assistance animals that is quite helpful:
[Service Animals and Assistance Animals for People with Disabilities in Housing and HUD-Funded Programs](https://portal.hud.gov/hudportal/documents/huddoc?id=servanimals_ntcfheo2013-01.pdf)",1,0,1,0,0,
ab79de79-0229-458c-a4d5-5c0a08df738a,1420496420,Nice...great idea. I haven't done that yet but did take my chair on the ice and it was fun drifting and towing people around. :),1,0,1,0,0,
17955c94-f0bf-4aa9-a03d-571f8687250d,1422642646,"I'm a disabled graphic designer as well. How far are you into your degree? Are your skills sufficient to maybe do jobs online?

When I was going to school I did not work, except for work study. I couldn't balance school, and working enough hours to make up for any disability support I'd lose with a job.Do you have many bills/expenses that you need a job for? 

I would be happy to help out, just need to know a bit more about where you are with your skills &amp; what kind of situation you have going. Feel free to PM me if that's better.",2,0,2,0,0,
89e3983b-cbb1-4d91-b868-5af461d89983,1421486736,"yes that's normal. sometimes the doctors don't even do that.

i applied for disability because of a spinal cord injury and fibromyalgia, and they sent me to a chiropractor who checked range of motion of my shoulders and elbows, a half assed leg strength test, and that was it. i was out on the street heading home 5 minutes after they brought me in to the appointment.

the worst part was that the whole process ended up causing a terrible flare that lasted a week, and the jackass's report said i had zero problems whatsoever. (SSA accidentally sent me my entire file before my hearing, so i got to read all of their stupid BS.)

according to my lawyer, the SSA analysts &amp; judges are required to take the advice of the highest ranking professional who knows you the best. so if you've got an MD you've seen several times and vouches for your issues, and they send you to a chiropractor, or PT, or even a MD for one 3 minute evaluation, the eval won't hold water. that doesn't mean you wont get denied the first time, but it can be appealed. and if you get denied, you should think about getting a lawyer to walk you through the appeals process. they don't take any money unless/until you win your case, and these lawyers know how the system works. they'll do all the grunt work and make it less stressful for you.

good luck! don't sweat it. SSA hires the lowest bidder for these things, and it doesn't accurately measure your disability at all.",3,0,3,0,0,
92607a36-ab21-411d-a4b2-aca1c753f479,1422328803,"Disability Binarism is such a huge issue, I'm so glad to see more people talking about it in such a blunt and open way.

I've had my fair share of dirty looks as someone with an invisible illness who uses crutches and wheelchairs when necessary. It kept me from using aids for a long time because I was fearful of what others would say.

I was most fearful of what would happen if I went to the welfare office on crutches one day, and went back with nothing the next, would they assume I am getting better or faking and reduce my benefits, or are they smart enough to know that my illness has wavering symptoms?

My partner convinced me that I have a duty of care to myself to take advantage of aids that will give me a better quality of life, Being able to leave the house and buy my own groceries is more important than protecting myself from stares and judgement because I need crutches to do the shopping, but I don't need crutches to walk from my bed to my bathroom.

",3,0,3,0,0,
7dcc0e7c-05fd-4429-8859-f194bb9f5089,1421262011,"I just want to add to the others to have your doctor do a CBC with Chem panel.   I have been surprised to see how many cramps are caused, and spasticity is worsened, by having low magnesium levels. ",4,0,4,0,0,
b7eae1d7-289d-444b-bd7a-0920289fc182,1422498465,"You might be gone now, but I wanted to ask: What, if anything, does the Tennessee Fair Housing Council do to help people with mental/cognitive disabilities?",1,0,1,0,0,
6be7e826-bf78-44c3-9011-d80b6993cca7,1421663718,How exactly should cripple be used in the correct way?,1,0,1,0,0,
48aa8e29-c585-4b0b-8c48-7f063b9c4b8b,1420095923,"Thanks!  I'm going to reapply again soon.  I have family members supporting me financially, but they are sorta holding it over my head. (""You don't feel safe with your current roommates?  No, you can't move!"")  ",1,0,1,0,0,
89e3983b-cbb1-4d91-b868-5af461d89983,1421821630,"I'm a part time wheeler and I see how people treat me different too. It makes me so angry that I like to make fun of it and draw attention to it, too. 

My husband is really funny about some things. We've noticed that a LOT of shoppers will just park their carts in their aisles and block the whole thing,  while they wander off to drool in front of a display, so I can't get around. Even when I'm just a few feet behind them! So when we get past them (or have to choose another aisle), he'll spin the cart sideways, stop short and walk away. So I'll crash into the cart on purpose and we make a whole scene. It usually embarrasses people. I've made a few nearby crips laugh tho. :)",1,0,1,0,0,
e05d9213-a423-44d9-9b1f-3769ae59bc07,1420274563,"Many years ago my mom started having problems buttoning her clothes do to starting to lose fine motor skills related to progressing of  ALS . I ended up taking off the buttons on her clothes , sewing the button holes shut and resewing the button on top of that so it looked like the button was buttoned through the hole . Then I sewed Velcro on the spot where the button had originally been and on the inside of where the button hole was so when the Velcro was put together it looked like a normal buttoned shirt . I wonder if something like that would fix your problem fairly easily and wouldn't take very much time or sewing skills to a decent job. If you have enough mobility and dextrality in your left hand you might be able to just grasp the edge of the sleeve between your finger tips and you wrist to hold it in place and roll your arm to close the Velcro .  ",1,0,1,0,0,
3aad4825-0844-46e7-a9f3-3caa79ba5732,1422040732,"Ironically, I found it difficult to find information on that site pertaining to what Moebius Syndrome actually is. [Wikipedia link](http://en.wikipedia.org/wiki/M%C3%B6bius_syndrome).",5,0,5,0,0,
4830eda3-e46d-4e14-b8dd-6c432a6de4b1,1420677882,"That list has far more than ten things listed but they're pretty spot on, so no complaints! I'm learning a few new things too.

Could you x-post this to /r/deaf too? I'm sure they'd dig it a bunch. ",1,0,1,0,0,
1138da53-3270-4826-8d69-045064f4253b,1421262045,"The Bitcoin tip for 100 bits has been collected by *rada_rada_lag*.

Bonus: [an image from /r/bitcoin](http://i.imgur.com/8S5KlGj.png)


[ChangeTip info](https://www.changetip.com/tip-online/reddit) | [ChangeTip video](https://www.youtube.com/watch?v=_AnfKpypMNw) | /r/Bitcoin",1,0,1,0,0,
804282ab-83ad-4cb6-84b9-cce1f563499b,1422553562,"Also, whether every level is accessible. Mom threw a party for my dad's 50th at a local restaurant that we've been to hundreds of times. For the party, they put us on the second floor, which we had never been on before (I think it is reserved for events). Ends up that they do not have an elevator. ",3,0,3,0,0,
589f63c3-bad5-4542-ac39-e0e5a5dc6591,1422231371,"I read recently that one in five men and one in six women dies within 5 years of being accepted into the social security disability program.  I also think people who claim that there are people on social security disability that are no longer qualified don't understand that they can and do ask for re-confirmation of qualification.

That article quotes a nebulous ""studies show that"" in their claim that many people on disability improve and no longer need federal disability. I am trying to find these mythical studies.  So far I've found *one* article that referenced a study that they claim shows this, and the study was a) done on veterans and b) doesn't show that at all.    I know there have been studies done about people on private disability insurance getting better, but that's a different ball of wax.

However, I wonder if this is referring just to SSI and not also to SSDI, the latter of which is supposed to come out of the same money as the retirement fund.  (SSDI is the one you pay into, like your social security retirement.)",3,0,3,0,0,
82034b7e-36b6-456b-b7dc-54e5adbf2c03,1420186383,"Assuming you live in the U.S.: My lawyer didn't work on retainer. He took a cut of my backpay, which I only got once he won. I think there was a relatively small (a few hundred dollars) fee to get started. 

Working in a field where, by definition, your clients are not financially stable, I think you're not likely to find many incompetent lawyers. The margins are pretty low, I think, so it would be hard to make a living if you were unsuccessful all the time. As for where to find one, maybe ask at city hall? ",3,0,3,0,0,
ef412993-27c5-48a5-9801-18ab9d1204e0,1421044199,"I have a progressive and debilitating condition that has absolutely no cure aside from a stem cell transplant. That is extremely experimental and extremely expensive, and only a handful of people have gone through it. The ALJ set my review for 18 months. Um...okay. Because I was in my late twenties I was to experience said miracle cure? That's nuts. It is a CAL condition, so SSA itself has recognized that there is no cure and that it will not improve. I haven't seen a review yet, but I do visit my doctors on a regular basis. That's the nature of my condition, though. ",1,0,1,0,0,
